review,link,status_code,id,movie_key,critic
Were sorry we cant find the page that youre looking for Go to the content Go to the footer Time Out New York New York Popular cities London New York Paris Chicago Los Angeles Browse all cities Time Out New York Close New York Change city New York Popular cities London New York Paris Chicago Los Angeles Browse all cities Tickets Events Things to Do Restaurants Bars Movies Theater Music Shopping Attractions Blog Art Travel Nightlife Events amp; Festivals Museums Kids Hotels Comedy Dance LGBT Sex amp; Dating Books City Guide Neighborhoods Promotions Close My Time Out Things I love My lists My Profile My Account Sign out Sign in Create account Sign in With your social account Or with your email Email Password Remember me Forgotten your password? Sign in You can create a Time Out account in two ways... With a few clicks using your favourite social network Or by entering your details below Email First Name Last Name Create password Repeat new password I accept Time Outs terms of use including opt-in to newsletters. Create account Welcome  You have successfully connected your account to Time Out. You may sign in with this account in future. Please confirm your account details Email First Name Last Name I accept Time Outs terms of use including opt-in to newsletters. Sign up My Account Sign in or Create account Search Tickets Events Things to Do Restaurants Bars Movies Theater Music Shopping Attractions Blog Art Travel Nightlife Events amp; Festivals Museums Kids Hotels Comedy Dance LGBT Sex amp; Dating Books City Guide Neighborhoods Promotions More Search Were sorry we cant find the page that youre looking for We have either moved the page or it no longer exists. To help you find your way here are some search results we think may be of interest. Movies Agent Cody Banks 2 Destination London The formula remains the same the second time round. A highbrow music academy in London is the suspected cover for dastardly dealings involving a device for brainwashing world leaders. Posing as a talented clarinettist 16-year-old agent Banks (Muniz... Read more Top About us Work for Time Out Privacy policy Website terms of use Contact us Get listed Advertising Time Out products Mobile apps Time Out Shop Time Out Guides Time Out Travel Time Out Worldwide Time Out magazine Follow us Facebook Twitter Youtube Instagram Pinterest Spotify Foursquare Time Out New York Site map,http://www.timeout.com/film/reviews/77596/agent_cody_banks_2_destination_london.html,404,agentcodybanks2destinationlondon0,agentcodybanks2destinationlondon,timeout
Error - Houston Chronicle SUBSCRIBE As low as 1.00/week Sign In Home Contact Chron About Houston Chronicle Advertise with Us Place a Classified Ad Niche Publication Ads Careers Store Privacy Policy Terms of Use Newsletters Subscribe HC Archives Mormon phrase on condom packs? Theres the rub Places every Texas kid should see before growing up 12 ways Joanna Gaines of HGTVs Fixer Upper is your spirit Things Texans secretly do but would never admit Local Neighborhoods Neighborhoods All Neighborhoods Bay Area Bellaire Cy-Fair Fort Bend Heights Katy Kingwood Memorial Pearland Spring The Woodlands Houston amp; Texas News Houston amp; Texas News Houston Texas Traffic Weather Weather Radar amp; Forecasts Houston Weather Severe Weather News Hurricane Guide Education Education K-12 Zone Blog School Report Card 2014 Politics amp; Policy Politics amp; Policy Texas Politics Chronicle Investigates Obituaries Staff amp; Reader Blogs Classifieds Columnists Opinions amp; Editorials Opinions amp; Editorials Opinion Editorials Letters to the Editor Outlook Nick Anderson Cartoons La Voz (Espanol) Texas Energy Guide Mass die-off reported at Flower Garden Banks National Marine Mormon phrase on condom packs? Theres the rub Lawyer seeks gag order in Sandra Bland lawsuit Little boy who shot himself is on life support US amp; World US News World News Crime The Americas Politics Science amp; Environment Strange amp; Weird News Videos Video captures deputys dramatic rescue of gunshot victim kids Texas Senator Brian Birdwell finally got to meet the man who Study confirms what gun rights advocates have said for a long Warren Sapp bitten by shark during Florida Keys lobster trip Sports Texans Rockets Astros Dynamo High School Colleges UH Rice UT Aamp;M Outdoors More Sports More Sports Golf Buy Tickets Super Bowl LI Revisiting the Astros best and worst deadline deals Texans extend Rick Smiths contract Two coaches suspended after Texas Aamp;Ms chalk talk Astros place Luis Valbuena on disabled list Business Energy (Fuel Fix) Technology Real Estate Money Tips Business Insider Press Releases Small Business Mgmt Chron 100 Top Workplaces Sponsored Content Legal Notices Business Directory US GDP grows a weak 1.2 percent in second quarter Amazons already large distribution empire keeps expanding Ford surprises with lower 2Q profit on trouble in US China Chipotle branching out plans to open burger restaurant Aamp;E Preview Preview Alison Cook Restaurant Reviews Whine amp; Dine Top 100 Restaurants Guides to Houston Restaurants amp; Bars Music Movies Arts amp; Theater Rolling Stone Us Weekly Radar Online Horoscopes Comics amp; Games Events amp; Things To Do NEW Puzzles 20 tearjerker movies Hollywood should leave alone Chip and Joanna Gaines are just the latest celebrities to visit Chef Randy Ruckers Bramble restaurant has closed New Gonzo mural goes up at Rice Village Life Health Health The Doctors Mens Journal Live Healthy Escapes Escapes Home amp; Design Travel Style Mom Houston Luxe Life Houston Belief Food amp; Cooking Food amp; Cooking Food amp; Cooking Alison Cook Restaurant Reviews Whine amp; Dine Top 100 Restaurants Society Travel Travel Flight Tracker Texas Road Trips Travel Pets Houston Gives Weddings amp; Celebrations Sponsored Content Local backyard design inspirations thatll make you want to DIY The 50 smoothest pick-up lines in movie history 18 foods you should never feed your pet Why is everyone freaking out about this photo of two bikini-clad Jobs Advanced search Browse job categories Salary Wizard Career Rescue Careers in Engineering Salute to Nurses Work amp; Career Advice Post a Job Is that dream opportunity really a nightmare? These 25 hot jobs pay at least 100K Set a career goal for every month of 2016 The highest-paying entry-level jobs Cars Cars amp; Auto News Heidis Cars Blog New Car Search Used Car Search Certified Car Search Houston Auto Dealers The new Lincoln Navigator concept is too legit to quit Hennessey pushes a Camaro to over 200 MPH Riding the 2016 Indian Chieftain BMW turns 100 years old A look back Real Estate New Homes Second Homes Rentals Home Price Survey Mortgages Commercial Real Estate Farms amp; Ranches Senior Living Chron Homes App Private Party Ads Summer Showcase My Perfect Hous(e)ton Suburban homebuilder develops new Greater Heights neighborhood Glamorous Texas ranch with Hollywood history hits market Shipping container complex to be developed in Houston 115 Years Findamp;Save Roost MenuSections Item Not Found << Return to the Previous Page The item youve requested http//www.chron.com/cs/CDA/moviestory.mpl/ae/movies/reviews/2444936 was not found. Possible causes The address was entered incorrectly The item no longer exists or There has been an error on the site. If you feel the address you entered is correct you can contact us mentioning the error message received and the item you were trying to reach. We apologize for any inconvenience. From here you can Return to the previous page Use the menu bar above Select an item from our site index below Logo Return to Top About Our Company Careers Advertise with Us Ad Choices Terms amp; Conditions Privacy Policy Your California Privacy Rights Contact Customer Service Newsroom Contacts Connect Email Newsletter Facebook Twitter Pinterest Google Instagram Subscribe iPad app HoustonChronicle.com Houston Chronicle Archives eEdition Demo Todays eEdition Hearst Newspapers (c) Copyright Hearst Newspapers LLC,http://www.chron.com/cs/CDA/moviestory.mpl/ae/movies/reviews/2444936,404,agentcodybanks2destinationlondon1,agentcodybanks2destinationlondon,chron
Movie | stltoday.com Sign Up Log In Dashboard Logout My Account Dashboard Profile Saved items Logout Subscriber services Contact us E-edition Contests Apps Newsletters Obits News Education Election 2016 Databases Columnists Illinois Law and order Metro Nation Obits Political Fix St. Charles Weather Opinion Letters to the editor Columnists Business Top Workplaces Press releases Columnists Sports Cardinals Blues Mizzou Olympics SLU NFL Golf Forums Columnists Chats High schools Schedules Schools Sports Stats Go Entertainment Books Calendar Comics amp; games Dining Music Movies Television Theater amp; arts Columnists Lifestyles Advice Automotive Fashion Food and cooking Health Home and Garden Parenting Religion Travel Columnists Feast Magazine St. Louis Best Bridal Ladue News Multimedia Photos Videos Chats Forums Buy/sell Classifieds Real estate Business Directory Print Ads Newspaper ads Page reprints Autos Jobs Homes Archives Toggle navigation Menu Search Search Log In Using Your Account Log In Dont have an account? Sign Up Today My Account Dashboard Profile Saved items Logout 80deg Saint Louis MO (63101) Today Skies clearing overnight. Tonight Mostly cloudy early then clearing overnight. Low near 70F. Winds light and variable. Updated July 29 2016  753 pm Full Forecast News Sports Business Go Life Buy/Sell Sorry the page youre looking for cannot be found. 404 The page may have moved you may have mistyped the address or followed a bad link. Visit our homepage or search for whatever you were looking for... Feast Magazine Ladue News St. Louis Best Bridal STL High School Sports Products and features Apps Archives Calendar Chats Comics amp; games Contests E-edition Forums Newsletters Our events Press releases Tools and services Advertise with us Autos Classifieds Contact us Homes Jobs Newspapers in Education Page reprints Post-Dispatch store Site help Subscriber services (c) Copyright 2016 STLtoday.com 900 N. Tucker Blvd. St. Louis MO | Terms of Use | Privacy Policy Powered by BLOX Content Management System from TownNews.com.,http://www.stltoday.com/stltoday/entertainment/reviews.nsf/movie/story/C27BD9A4F4945FB286256E540054C205?OpenDocument,404,agentcodybanks2destinationlondon2,agentcodybanks2destinationlondon,stltoday
"thestar.com | Toronto Star | Canadas largest daily SectionsSearch the print archivesSectionsTop Stories608 PMShould kits to test if drugs are pure be handed out at Veld Music Festival?Report recommends testing drugs for impure substances at music festivals 718 PMConst. James Forcillo granted bail as he appeals Sammy Yatim shooting convictionToronto police officer spent last night in jail after being sentenced to six years in prison for conviction of attempted murder in shooting of Sammy Yatim.710 PMTurkey coup details are foggy but one fact is clear the military is about to lose political power Though details and reasons behind Turkeys failed coup remain foggy one fact is clear the countrys once-mighty military is about to lose its political power.July 28 2016Mayor Tory wants at least 1M fine for removal of trees on BayviewThe mayor says hes pushing for a ""seven-figure"" penalty for the removal of trees without a permit.506 PMAlleged purse thieves goof off in front of Longos security camera The men stole a purse from a cart and laughed as they exited the store on November 22 2015 712 PMZika has arrived in continental United States CDC saysZika is now here the director of the CDC announced Friday after four people likely contracted the virus from mosquitoes in neighbourhood of Miami.757 PMMcCain heiress asks for removal of estranged husbands lawyerAs Eleanor McCain and Jeff Melanson continue their divorce battle McCain seeks to remove Melansons lawyer.713 PMRussia hacks Democratic campaign committee computers reportsThe breach appears to have been carried out by the same Russian intelligence service that hacked the DNC.1138 AMWho is stealing the mannequins from Bellevilles clothing stores?Frustrated shop owners are worried by a string of ""creepy"" break-ins.817 AMFather of fallen Muslim American soldier blasts Trump You have sacrificed nothing and no oneIn a speech at the Democratic Convention Khizr Khan pulls a copy of the Constitution out of his suit pocket and offers to lend it to the Republican presidential nominee.548 PM70 million tab for Ontario pension plan a pricey bargaining chip business group saysCanadian Federation of Independent Business which opposed Kathleen Wynnes plan as a payroll tax accused her of rushing to start the ORPP.July 28 2016Wonderful family identified in Hwy. 407 crashThe family killed on Hwy. 407 in a crash involving a classic 1948 Chevrolet Fleetmaster Coupe has been identified.July 28 2016You never know what money will do to people says member of Niagara Falls group that won 7 million lotto""He was a friend . . . I got to like him very much"" said Sebastien Hoch one of 11 winners of a Lotto 6/49 ticket from three years ago. ""I guess first appearances are deceiving"" he added. "".""PopularBikini-clad Swedish cop arrests suspected thiefSunbathing police officer Mikaela Kellner was off duty and wearing a bikini but that didnt stop her from catching a man suspected of stealing a phoneWhy a Newfoundland village is afraid for this friendly beluga whale The 2.4-metre-long whale showed up at the wharf in Admirals Beach about four months ago and experts are now worried it could be hit by boat traffic.Sesame Street tells veteran cast to hit the roadBob McGrath a veteran cast member of Sesame Street says he and two other long-time actors have been fired.Cirque du Soleil Luzia an outrageous veritable festival of cultural appropriationShow is full of wow feats and gorgeous stage pictures but indulges in cultural appropriation.Melania Trumps website taken down after university degree debunked In a Twitter post Melania Trump said her website had been removed because ""it does not accurately reflect my current business and professional interests."" Bar hasnt been set high for Rio Olympics ArthurAt this point if the Games dont skid all the way into the ditch they will be deemed a success. Life is about setting reasonable expectations. So here are your best-and-worst-case scenarios for how the Games will unfold.Jason Bourne is on the run again older but still explosive ReviewMatt Damon returning to the screen as the amnesiac ex-CIA assassin is a kinetic and sympathetic presence.Watch White Lungs scorching mini-set at Mill Street Brew PubWatch the Vancouver punks scorching mini-set at Mill Street Brew Pub.Toronto native Samantha Bee has a message for unhappy Americans Canada is full The comedy star says Americans will need to deal with whatever happens in November. Her advice Stay where you are. Live in your mess. NewsThe Morning Headlines NewsletterDelivered daily to your inbox.Sign upGTAJims Restaurant about to serve its last best western in LeslievilleLeslieville diner closing to make way for condos.GTAOntario has a serious problem with bad bossesStudy commissioned by the Ministry of Labour says poor enforcement leaving vulnerable workers exposed.BUFFALO N.Y.U.S. Coast Guard ends search for missing Ontario fishermanGiusseppe Joe Reinhart on parole after serving time for manslaughter but Niagara Regional Police call report he may have faked death unsubstantiatedMIAMICaretaker shot by Miami officer gets hug from autistic man he tried to protectThe two met again for the first time since the July 18 confrontation that was captured on cellphone video.SYDNEY AUSTRALIASimulator owned by missing Malaysian planes captain had Indian Ocean route Someone on the captains home flight simulator had a course plotted to the southern Indian Ocean where the missing Flight 370 is believed to have crashed. Todays VideosNewsTrump Clinton should have congratulated me for making historyRepublican presidential nominee Donald Trump said Hillary Clinton should have congratulated me for having done something that nobody has ever done in history.NewsFuneral for Ottawa man who died after police altercationOttawas main mosque was packed to overflowing Friday for the funeral service of Abdirahman Abdi who died after a confrontation with police last Sunday.NewsClinton Kaine kick off post-convention bus tourHillary Clinton and running mate Tim Kaine are starting their bus tour of a pair of battleground states. The Democratic presidential nominee said the tour through critical Pennsylvania and Ohio will stop at places that make things.NewsB.C. couple walk free after entrapment ruling in terror caseA couple that had been found guilty of plotting a terrorist attack in B.C. walked free on Friday after a judge ruled that the RCMP had entrapped them.NewsDozens we killed in Taiwan bus crash on July 19A tour bus carrying Chinese tourists in Taiwan burst into flames on July 19 killing all 26 passengers aboard. The accident is the deadliest involving Chinese tourism to the island.NewsBritish PM seeks to reassure Poles in post-Brexit UKBritish Prime Minister Theresa May travelled to Warsaw to reassure the Polish government that the hundreds of thousands of Poles living in Britain still had a post-Brexit future there.NewsParachutists show their skills at international tournamentParachutists from over 30 countries compete in aerial acrobatics and precise landings at the 2016 World Military Parachuting Championships in Russia.NewsGlow-in-the-dark green Colour of DNC protest on final night of DNCSome Bernie Sanders supporters wore glow-in-the-dark shirts on the final night of Democrats convention in Philadelphia.NewsHinckley release worries agent shot with ReaganFormer Secret Service agent Tim McCarthy says I hope theyre right when asked about the decision to release John Hinckley Jr. the man who shot Ronald Reagan in 1981.Opinion and AnalysisEditorialsInvestigation into common strip searches most welcome Editorial The Office of the Independent Police Review Directorate is conducting a systemic province wide review of strip search policies and practices. It cant come soon enough. CommentaryCanadas main environmental law isnt workingEmissions of some of the most harmful chemicals are on the rise in Canada. We need to update the federal law thats supposed to curb them.EditorialsCanada needs further rail safety reforms Editorial Federal officials have succeeded in stopping the shipping of crude oil in vulnerable DOT-111 rail cars but more needs to be done. CommentaryClinton finds joy in being persecuted SalutinIf Hillary didnt persist and remind people of why they hate her it might fade awayCommentaryTDSBs plan to tackle racial disparityThe director of education acknowledges more work has to be done to help racialized groups succeedCommentaryHillary Clinton and Americas thirst for change WalkomBeing competent may not be enough. For better or worse Hillary Clinton represents the status quo.GTAOnce Upon a City The local eateries serving Torontonians for generations A menu of olde tyme favourites in photos.GTAWhy does Torontos east end hate everything?Residents in Leslieville and the Beach have complained about everything from breweries to music festivals.City HallToronto to test mobile ticketing app for island ferryNew way to buy tickets online aimed at cutting down lineups for island ferry.GTARefugee offers to pay hydro bills for pensioner left in the darkPeggy Mills 74 lost her hydro and her hope until Star readers came to the rescue with offers of financial help.CrimeBoy charged with criminal negligence after girl dies in Caledon crashCar was travelling north on Hwy. 10 when it crossed into the southbound lanes and struck an object in the ditch.GTARoad closures this Civic Holiday weekendLake Shore Blvd. will be closed all day Saturday for the annual Caribbean Carnival parade.OTTAWAU of T to get 98 million for lab upgradesOttawa Queens Park pledge funds to boost university researchSportsTennisDjokovic hits Rogers Cup semifinalsTop-ranked Novak Djokovic needed more than two hours to knock off Tomas Berdych at Aviva Centre.SPRINGFIELD N.J.Robert Streb flirts with history at PGA ChampionshipStreb became the latest player to shoot 63 in a major and hardly anyone noticed in a PGA Championship with endless action across Baltusrol on Friday.TennisNishikori Wawrinka advance to Rogers Cup semifinalsFan of Nishikori? Theres an app for that. He is one of a handful of stars with a personal mobile app which connects him to fans and customers.Blue JaysMinor-league deal for Erik Kratz gives Blue Jays catching depthFriday marks first anniversary of Troy Tulowitzkis late-night trade to Toronto.OlympicsBar hasnt been set high for Rio Olympics ArthurAt this point if the Games dont skid all the way into the ditch they will be deemed a success. Life is about setting reasonable expectations. So here are your best-and-worst-case scenarios for how the Games will unfold.WOBURN ENGLANDMirim Lee clings onto Womens British Open lead South Korean follows record-equalling 62 with 1-under second round at Woburn as pack closes inBusinessBusinessIn a park behind a Toronto rehab centre joy for kidsIn Spiral Park the outdoors is for everyone.BusinessTSX and loonie creep higher oil shows slight recoveryThe Canadian dollar closed at 76.59 cents US up 0.61 of a cent from Thursdays close.BusinessAir Canada profits decline with Brexit and attacksThe second-quarter drop comes in spite of slight lift in revenue.WASHINGTONU.S. economy posts sluggish growth in springThe Commerce Department said Friday that the gross domestic product -- the broadest measure of the economy -- grew at a 1.2 per cent annual rate in the April-June quarter.OTTAWAAlberta wildfires knocked GDP into reverse in MayThe huge Alberta wildfires helped force the Canadian economy to contract by 0.6 per cent in MayVICTORIAB.C.s foreign buyer tax set to help fund Metro Vancouver housing projectsThe government is already banking on the returns of the new 15 per cent property tax on foreign buyers.Life and EntertainmentDownload the Toronto Star ePaper Edition.LOS ANGELESMatt Damon joins Hollywood diversity battleActors production company joins forces with USC social change initiative to make Hollywood more equitable. MoviesReel Brief Cafe Society Vaxxed Phantom Boy Keanu and High-RiseQuick takes on some of this weeks new releases including Woody Allens latest.NEW YORKUnreleased Springsteen songs will accompany his autobiography Born to RunThe 18-track compilation album ""Chapter and Verse"" will include unreleased tracks ""Baby I"" and ""You Cant Judge a Book by the Cover"" which were recorded when Springsteen was a teenager. LifeHow to brave the basement battle after summer storm floodsIn the wake of a dramatic downpour act fast to remove the water to avoid mould experts say.EntertainmentHarry Potter and the Cursed Child its almost hereWith a new addition to the Potter series in play and book form here are things fans need to know.ParentParenting after divorce easier with flexible schedulingLocking into a set custody schedule that doesnt adapt to a childs needs can create challenges for parents and kids.EntertainmentBad Moms delivers lots of laughs loads of f-bombsDespite the profanity Bad Moms is actually a solid comedy with something to say about motherhood.25degCloseHomeLatest NewsVideoGTABlogsJims Restaurant about to serve its last best western in LeslievilleLeslieville diner closing to make way for condos.NewsGTACity HallQueens ParkCanadaWorldInvestigationsCrimeBusinessEconomyPersonal FinanceReal EstateYour TorontoSchoolsThe FixerLifeFashion amp; StyleFood amp; WineHealth amp; WellnessHomesParentTechnologyTravelSportsAmateurBaseballBasketballBlue JaysCurlingFootballGolfHockeyLacrosseLeafsOlympicsRaptorsSoccerTennisOpinionCommentaryCorrectionsEditorialsEditorial CartoonPublic EditorReaders LettersEntertainmentBooksMoviesMusicStageTelevisionVisual ArtsDiversionsHoroscopesCrosswordsSudokuComicsWheels.caSpecial FeaturesObituariesClassifiedsTV ListingsHot TopicsDem. ConventionRio OlympicsPokemon GoBlue JaysGeneration 9/11Panama PapersFresh Air FundWeather BlogFollow usFacebookTwitterGoogle+InstagramRSSManage NewslettersSite MapAboutContact UsFeedbackthestar.comFeedbackSite MapNewslettersInsurance HotlineNew in HomesStar StoreCorrectionsBehavioural TargetingTodays NewsFlyersCanadaStaysContestsToronto Star Newspaper Ltd.AboutAtkinson PrinciplesStatement of PrinciplesGet Home DeliveryMy SubscriptionContact UsContact WebmasterFAQNews ReleasesStar InternshipsCareers  the StarStar AdvisersStar ePaperStar TouchAdvertise with UsAdvertising TermsMedia KitSpecial FeaturesInitiativesSanta Claus FundFresh Air FundSpeakers BureauClassroom ConnectionToronto Star ArchivesReport on Community Giving(c) Copyright Toronto Star Newspapers Ltd. 1996 - 2016Privacy PolicyTerms and Conditions",http://www.thestar.com/NASApp/cs/ContentServer?pagename=thestar/Layout/Article_Type1&c=Article&cid=1079090045841&call_pageid=1022183557980&col=1022183560753,200,agentcodybanks2destinationlondon3,agentcodybanks2destinationlondon,thestar
