review,link,status_code,id,movie_key,critic
"washingtonpost.com Entertainment Guide Main Page Movies Music Restaurants Nightlife Museums/Galleries Theater/Dance Love Life In Store Outdoors/Fitness  Style  Comics  Crosswords  Horoscopes  Books  Travel  Weather  Traffic  TV Listings Atlantis That Sinking Feeling By Rita Kempley Washington Post Staff Writer Friday June 15 2001 Milo finds the lost city and meets Atlantean Kida in ""Atlantis The Lost Empire."" (Walt Disney) If Disneyland were 20000 leagues under the sea it would look a whole lot like ""Atlantis The Lost Empire"" the studios quaintly animated summer feature. With its magic mountains pastel colors and genial Bambi-eyed populace the sunken Shangri-la could easily be mistaken for the remains of ""The Lost Theme Park.""Ironically Disney had hoped to update its image with this mildly diverting adventure yet the picture hasnt really broken away from the tried-and-true format spoofed in the far superior ""Shrek."" But apparently shaking the companys warm and fuzzy tradition isnt so easy.Directors Gary Trousdale and Kirk Wise (""Beauty and the Beast"" ""The Hunchback of Notre Dame"" etc.) have axed what Disney does best calypso crustaceans wisecracking warthogs singing teapots. They even hired a hip comic-book artist (Mike Mignola of ""Hellboy"") to work with studio veterans in a futile even misguided attempt to appeal to preadolescents and teens instead of Mom Pop and the small fry. The result is cutesy but harsh a hybrid of saucer-eyed anime and square-jawed angularity that brings to mind an edgier ""Pokemon."" On top of everything else the filmmakers decided that the picture should also recall the studios live-action films from the 50s and 60s such as ""Swiss Family Robinson."" This means the computer graphics must look as if they were hand-drawn and the film shot in CinemaScope. Put it all together and youve got what the company calls ""Disnola"" a new-fashioned but old-fangled hash.The same goes for the plot which draws on Platos version of the story as well as Edgar Cayces alleged memories from a past life in Atlantis. Plato says the people got uppity and angered Neptune; Cayce suggests they produced unfathomable energy from powerful ""fire-crystals"" which they misused causing the continent to go plop-plop fizz-fizz.Anyway the story centers on Milo Thatch (voiced by Michael J. Fox) an insufferably eager nincompoop who joins an expedition in search of the submerged utopia. Oddly although its 1914 the crew is as inclusive as the Rainbow Coalition a Latina mechanic (Jacqueline Obradors) an African American doctor (Phil Morris) a crusty Euro-American commander (James Garner) a German dominatrix (Claudia Christian) a French geologist (Corey Burton) an Italian explosives expert (Don Novello) plus a chuck wagon-era cook (the late Jim Varney) and a cynical switchboard operator (Florence Stanley).When it comes to stereotypes Disney tries its darnedest but still fails. These characters are an improvement over the hook-nosed evil Arabs of ""Aladdin."" Yes stereotypes exist for a reason but must all Frenchmen stink all Germans wear jackboots and all Latinas recall Rosie Perez?If the screenwriter Tab Murphy in this case is too lazy or unimaginative to provide his characters with distinguishing traits the answer is invariably yes. Alas strong supporting players are even more crucial when the story is less than compelling and the hero this bland. Cree Summer gives voice to Princess Kida the Pocahontas of Atlantis and Milos love interest. The citys crystals are dimming and the civilization is dying. And while they speak all languages its people can no longer read Atlantean. Luckily Milo can and with his help Kida manages to provide a happily-ever-after ending. Hows that for cutting-edge?""Atlantis The Lost Empire"" (95 minutes) is rated PG for action and violence. Search Entertainment Venues/events Community Family Galleries Monuments Movies Museums Music Nightlife Outdoors Restaurants Theater Anywhere Washington NW Adams-Morgan Clev./Woodley Downtown Dupont Circle Foggy Bottom Georgetown Shaw NE SW SE Maryland A. Arundel Co. Bethesda Gaithersburg Howard Co. Montgomery P.G. Co. Silver Spring Rockville Virginia Alexandria Arlington Co. Ballston Fairfax Co. Falls Church Loudon Co. P. William Co. Reston Tysons Corner Optional Keyword powered by citysearch.comMore Search Options ""Atlantis The Lost Empire""showtimes and details Michael J. Fox filmography James Garner filmography John Mahoney filmography (c) Copyright 2001 The Washington Post Company",http://www.washingtonpost.com/wp-srv/entertainment/movies/reviews/atlantiskempley.htm,200,atlantisthelostempire4,atlantisthelostempire,washingtonpost
Page not found | The Seattle Times Skip to content Menu Local News Transportation Crime Local Politics Education Eastside Health Data Northwest Times Watchdog Business amp; Tech Boeing amp; Aerospace Amazon Microsoft Technology Economy Nation amp; World Nation amp; World Politics Oddities Photos of the Day Sports Seahawks Huskies Cougars Mariners Sounders Storm High School Sports Forums On TV/Radio Entertainment Movies Books Music Theater Classical Music Television Comics amp; Games Horoscopes Life Food amp; Drink Travel amp; Outdoors Wellness Pets Rant amp; Rave Pacific NW Magazine Homes amp; Real Estate Opinion Editorials Letters to the Editor Video Photography Obituaries Jobs Shop Autos Log In Subscribe 404 Error Local Biz/Tech Sports Entertainment Life Travel Homes Opinion | Jobs Autos Shop All SectionsLocal Transportation Crime Local Politics Education Eastside Northwest Data Health Times Watchdog Obituaries Photo amp; Video Nation amp; World Politics Oddities Photos of the Day Business Boeing Amazon Microsoft Technology Economy Real Estate Sports Seahawks Huskies Cougars High Schools Mariners Sounders Snow Sports Geoff Baker Matt Calkins Larry Stone Bob Condotta Forums On TV/Radio Entertainment Movies Books Music Theater Classical Music Television Comics amp; Games Horoscopes Life Pacific NW Magazine Food amp; Drink Happy Hour Wellness Home amp; Decor Pets Rant amp; Rave Bethany Jean Clement Travel Outdoors Northwest Hikes Washington Oregon B.C. Hawaii Opinion Editorials Letters Op-Eds Kate Riley Mark Higgins Brier Dudley Jonathan Martin Thanh Tan Blanca Torres Columnists Nicole Brodeur FYI Guy Mary Ann Gwinn Ron Judd Jerry Large Seattle Sketcher Jon Talton Danny Westneat Jobs Autos Homes Listings Classifieds NWshowcase ShopNW Seattle Times Store Contact FAQs Subscriber Services Print Replica iOS App Android App All SectionsLocal Transportation Crime Local Politics Education Eastside Northwest Data Health Times Watchdog Obituaries Photo amp; Video Nation amp; World Politics Oddities Photos of the Day Business Boeing Amazon Microsoft Technology Economy Real Estate Sports Seahawks Huskies Cougars High Schools Mariners Sounders Snow Sports Geoff Baker Matt Calkins Larry Stone Bob Condotta Forums On TV/Radio Entertainment Movies Books Music Theater Classical Music Television Comics amp; Games Horoscopes Life Pacific NW Magazine Food amp; Drink Happy Hour Wellness Home amp; Decor Pets Rant amp; Rave Bethany Jean Clement Travel Outdoors Northwest Hikes Washington Oregon B.C. Hawaii Opinion Editorials Letters Op-Eds Kate Riley Mark Higgins Brier Dudley Jonathan Martin Thanh Tan Blanca Torres Columnists Nicole Brodeur FYI Guy Mary Ann Gwinn Ron Judd Jerry Large Seattle Sketcher Jon Talton Danny Westneat Jobs Autos Homes Listings Classifieds NWshowcase ShopNW Seattle Times Store Contact FAQs Subscriber Services Print Replica iOS App Android App 404 Error Login Subscribe Uff da Youve come to a dead end. Fremont Troll by Seattle Sketcher Gabriel Campanario. The page you were looking for couldnt be found or may have been moved. Be sure to check your spelling in the address field in your browser. Here are some things you can do now Report a broken link Visit the homepage Search for Follow seattletimes on Twitter or visit our Facebook page. Contact Newsroom staff list FAQ Contact form About the company Seattle Restaurant Week Newspapers in Education Fund for the Needy Employment Historical Archives Pulitzers Company information Permissions Seattle Times Store Advertise Classifieds Autos Homes Obituary Jobs Media Kit Advertise with Us Subscriber Services Subscribe Activate Account Manage Subscription Place Temporary Hold Report Delivery Issue Make a Payment Print Replica Todays Front Page Facebook Twitter RSS Feeds Newsletters Mobile Apps Subscribe Copyright (c) 2016 The Seattle Times Company | Privacy statement | Terms of service,http://seattletimes.nwsource.com/html/artsentertainment/134306758_atla15.html,404,atlantisthelostempire5,atlantisthelostempire,nwsource
"Atlantis is a find / Disney emphasizes adventure over cuteness romance and song - SFGate Subscribe Sign In Home Contact SFGate Contact SFGate Customer Support Submissions amp; Tips Classifieds About SFGate About SFGate FAQ Register on SFGate SFGate Newsletters SFGate Staff Careers Site Index Hearst About The Chronicle About The Chronicle The Chronicle Staff Become a Subscriber Manage Your Subscription Customer Service Careers e-edition Back Copies Chronicle in Education Corrections Advertise with Us More on Advertising More on Advertising Place a Classified Ad About Our Ads Public Notices Local Business Directory Place an Obituary Gate List Store Privacy policy Privacy policy Ad Choices Chronicle Archives Terms of Use Newsletters Get news alerts SFGate Customer support Get VIP access with SF Chronicle Membership Get SFGate newsletters for the latest from the Bay Check out the Top 100 Bay Area restaurants News Bay Area amp; State Traffic Nation World Politics Crime Election Results Obituaries Tech Health Education Video News Blogs Court reject GOP efforts to restrict voting in 3 states Suspect held after 2 San Diego officers shot 1 fatally State questions its share of proposed deal between Uber drivers Police Vallejo woman run over by man who stole her car Sports 49ers Raiders Giants As Olympics Warriors Sports Blogs Sports Calendar MLB NBA College Preps Golf Outdoors One bad inning sinks As at Cleveland Names amp; Faces Steve Spurrier Cam Newton Mirim Lee clinging to lead at Womens British Open Slumbering Giants to get Pence back Saturday plus outfielder Business Technology Mortgage Rates Home Guides Public Notices Sponsored Content Office Space The Tech Chronicles Net Worth Plus Fossils amp; Photons Mind Your Business VisionSF Jobs ICYMI Can Chipotle be a burger king? Redstones potential Victorian duplex in SOMA open Sunday Three bedroom apartment in San Franciscos Financial District Newly built farmhouse brings Wine Country style to north Oakland Entertainment The Daily Dish Movies Music amp; Nightlife Performance Art Blogs Videos Events Puzzles TV Horoscope Comics Crosswords amp; Puzzles Things To Do Jason Bourne is a shaky smeary mess The latest from Dear Abby ""Bad Moms"" mixes sentiment with raunch and ends up vulgar Phantom Boy is fast-paced but slight animated fun Food Restaurants Wine Top 100 Restaurants Chronicle Wine Competition Reservations Beer News Inside Scoop SF Healthy Eating Angele Chef shuffle at Napa French restaurant Napa blockbuster Ninebark is closing (temporarily) Check out the food (and menu) at Black Cat now open in the Lights go out at La Rondalla longtime Mission dining spot Living Home amp; Garden Style Parties Lust LGBT Mommy Files amp; Parenting Houzz Outdoors Blogs Sponsored Schools Camps amp; Activities Couple from different cultures find love is a common ground Heres the most popular video game from the year you were born More Crystal Basin campsites are available with start of Olympics Law to fight global warming gets strong support in California Travel Destination BC Exotic Destinations Monterey-Carmel Weekend Getaways Wine Country Napa Reno-Tahoe Hawaii Caves offer older view of the Continent Traveling to Big Sur? What you need to know Suite Spot Ritz-Carlton Philadelphia Rick Steves Europe Drink in a city through cafe culture Real Estate New Homes Open Homes Luxury Rentals Mortgage Rates Commercial Place an ad Home Guides Home Sales On the Block Blog Hot Property Sebastopol Italianate estate enjoys ocean views How much space do you get for 1500 a month? Hillcrest Estate possibly owned by baseball Hall of Famer Joe Cars Dealers Click and Clack Car Blog My Ride Sell Your Car First Buick ragtop since the 91 Reatta A cherished Nash-Healey Roadster Past Phantom still turning heads Teslas Model S can be used as a boat in a pinch Jobs Job Events Advertise Salary Wizard Get To Work Consider the red flags when staying in a job you dislike Declutter your job search The job gap explanation How to impress an interviewer with non-verbal language Findamp;Save Chronicle Latest columns Michael Bauer Leah Garchik Bruce Jenkins Esther Mobley Ann Killion Thomas Lee Matier amp; Ross C.W Nevius Kathleen Pender Scott Ostler Special Report Forgotten Survivors of AIDS The ultimate NorCal brewery map Top 100 Restaurants Warriors show their style off the court MenuSections http//www.sfgate.com/movies/article/Atlantis-is-a-find-Disney-emphasizes-2909019.php Atlantis is a find / Disney emphasizes adventure over cuteness romance and song Wesley Morris Chronicle Movie Critic Published 400 am Friday June 15 2001 Image 1of/1 CaptionClose Image 1 of 1 Milo Thatch (left voice of Michael J. Fox) explains his theories about Atlantis to Commander Rourke and his shadowy lieutenant Helga Sinclair. Milo Thatch (left voice of Michael J. Fox) explains his theories about Atlantis to Commander Rourke and his shadowy lieutenant Helga Sinclair. Atlantis is a find / Disney emphasizes adventure over cuteness romance and song 1 / 1 Back to Gallery ATLANTIS THE LOST EMPIRE Animated. Voices by Michael J. Fox Cree Summer James Garner. Directed by Gary Trousdale and Kirk Wise. (PG. 88 minutes. At Bay Area theaters.) The villain in the new animated Disney movie ""Atlantis The Lost Empire"" is Commander Rourke a thrill-seeking plunderer who resents his mercenary label. ""Im an adventure capitalist"" he snivels to Milo the plucky young linguist (voiced by Michael J. Fox) who has brought him and his crew many leagues under the sea looking to unearth the title civilization. The rippling authoritative cadences of Rourkes voice belong to James Garner. The kids might not be aware but their parents will know As a hulking cunning bully Garner is playing against type. So is the studio that hired him. At sea level ""Atlantis"" is a Disney ride-or-die cartoon frolic featuring anachronistic speaker-bruising action sequences; cross-cultural boy-girl woo pitch; and a shelfload of cuddly supporting types not the least of whom is the anti-hygienic Peter Lorre-like critter called Mole (Corey Burton). But just beneath the surface ""Atlantis"" brims with adult possibility. The studio appears to be weaning its elementary-school set off the freewheeling irony-swilling potlucks of ""Hercules"" ""The Emperors New Groove"" and the Robin Williams areas of ""Aladdin"" with sheer force of visual panache and keen storytelling. Related Stories Atlantis action packed / Disney film good but not a classic ""Atlantis"" was directed by Gary Trousdale and Kirk Wise the tag team behind ""Beauty and the Beast"" and ""The Hunchback of Notre Dame."" And in a change of pace theyve left the singing and dancing for an inevitable Broadway version. The emphasis here is less on cuteness and romance and more on the ""Raiders of the Lost Ark""-style adventure. The film opens with an invasion sequence depicting Atlantis ruin that reminds you that Disney does ""Phantom Menace"" better than George Lucas. Later the gorgeous Atlantan princess Kida (Cree Summer) shares a childhood flashback in which the sky goes dark people flee cataclysm approaches and suddenly her memories look as if theyve been produced by Jerry Bruckheimer. Kidas city of course was devoured by a tidal wave and hidden from view until Milo et al. find it. For years the good forgotten people of Atlantis -- a population of crypto-Mayan/Afro-Caribbean silver-haired gym-toned polyglots -- have been thriving off a supply of crystals that are the lost empires source of power and medicine. The crystals are also the key to Atlantis legacy the bridge between its day-glo-colored future and its doomed past. Naturally Commander Rourke sees their market potential. Kida brings Milo and the shipwrecked crew to her father and king (Leonard Nimoy). He smells the imperialist tomb-raiding possibilities and asks them to leave. Rourke convinces the king to grant his posse a stay and soon hes got the crystals and is headed up to the surface. The average 6-and-under Disneyphile might have to work overtime what with the subtitles (for a language that sounds like coffeehouse Klingon) the endearingly drab oceanic-safari color palette and lack of gratuitous flourishes. The typical elements are here the distaff heroism of ""Mulan"" the passive- aggressive sexual overtures of ""Tarzan"" the parent-kid melodrama of ""The Lion King"" the songlessness of well thats basically unprecedented. But the tempo doesnt get cranked up to ""theme park"" until the big climax leaving time for disappointed kids to lean over and inquire about why they arent laughing. The temporary answer is that lifes answers arent solved in acutely ironic asides overproduced show tunes and Happy Meal tie-ins. But in the meantime whats a cynical 10-year-old cruising for light carnivalesque winking to do? The ""Atlantis"" reply appears to be ""let them eat Shrek. "" Most Popular 1 Dear Abby I want to contact mistress from 45 years ago 2 Iceland man says Donald Trumps son left white powder at... 3 7-year-old girl dies after elephant at zoo throws a rock at her 4 Bikini-clad Swedish cop makes arrest while sunbathing 5 Clinton speech draws mixed reaction on cable news 6 Police Girl 14 slits teens throat in hope of first kill 7 Trump Jr. accuses Obama of plagiarizing a line from his speech 8 The Latest Trump slams Clinton over radical Islam 9 Oakland-bound medical plane crashes -- 4 killed 10 Man beaten unconscious in SF confrontation over urination Find Showtimes Search Theaters amp; Showtimes -- County -- Alameda Contra Costa Lake Marin Napa San Francisco San Mateo Santa Clara Solano Sonoma Show Movies Now Playing | Recent Releases | Critics Favorites Rated G | PG | PG-13 | R Latest News Police Vallejo woman run over by man who stole her car Oakland-bound medical plane crashes -- 4 killed Apple CEO Tim Cook hosting fundraiser for Hillary Clinton E. Bay sheriffs deputy fired in connection with beating New BART station may be in works for 30th/Mission Man Trumps son left white powder at rental paid women Police Girl 14 slits teens throat in hope of first kill Woman at scene of minor crash killed when car hits her Parilia Amusement Ball in San Francisco early days View Comments (c) 2016 Hearst Communications Inc. Logo Return to Top About Our Company Careers Advertising Ad Choices Terms amp; Conditions Privacy Policy Your California Privacy Rights Contact Customer Service Newsroom Contacts Connect Facebook Twitter Pinterest Google Instagram Subscribe SFChronicle.com App e-edition The Chronicle Archives Subscription Offers Member Services Hearst Newspapers (c) Copyright Hearst Communications Inc.",http://www.sfgate.com/cgi-bin/article.cgi?f=/c/a/2001/06/15/DD217251.DTL,200,atlantisthelostempire6,atlantisthelostempire,sfgate
Page not found - The Denver Post News News Latest News Colorado News Nation / World Obituaries Marijuana Education Environment Crime amp; Courts Weather Your Hub Sports Sports Olympics Denver Broncos College Sports Colorado Rockies Preps Colorado Avalanche Outdoors Denver Nuggets Boxing / MMA Colorado Rapids Scores and Standings Sports Columnists Sports on TV/Radio Business Business Aerospace Airlines Economy Energy Real Estate Retail Technology Telecom Tourism Entertainment Entertainment Arcade Games Arts Books Calendar Comics Movies Music Reverb Music Theater Television Television Listings Travel Lifestyle Lifestyle Ask Amy Fashion Food amp; Drink Restaurants amp; Dining Fitness Home amp; Garden Horoscopes Opinion Opinion Editorials Columnists Letters Perspective Cartoons Opinion Polls Politics Politics Election Colorado Legislature Denver Politics Local Politics National Politics Cannabist Classifieds Classifieds Cars Homes Jobs Today Subscribe Newsletter News News Latest News Colorado News Nation / World Obituaries Marijuana Education Environment Crime amp; Courts Weather Your Hub Sports Sports Olympics Denver Broncos College Sports Colorado Rockies Preps Colorado Avalanche Outdoors Denver Nuggets Boxing / MMA Colorado Rapids Scores and Standings Sports Columnists Sports on TV/Radio Business Business Aerospace Airlines Economy Energy Real Estate Retail Technology Telecom Tourism Entertainment Entertainment Arcade Games Arts Books Calendar Comics Movies Music Reverb Music Theater Television Television Listings Travel Lifestyle Lifestyle Ask Amy Fashion Food amp; Drink Restaurants amp; Dining Fitness Home amp; Garden Horoscopes Opinion Opinion Editorials Columnists Letters Perspective Cartoons Opinion Polls Politics Politics Election Colorado Legislature Denver Politics Local Politics National Politics Cannabist Classifieds Classifieds Cars Homes Jobs Trending Mile High Roundup Hickenlooper Trump speech Broncos camp fan guide GABF tickets Meteor showers lion cubs at zoo Oops That page cant be found. Member Services News Alerts Facebook Twitter Instagram RSS Subscribe Become a Member / Subscribe Place a Hold Denver Post Store Digital Replica Edition Classifieds Autos Real Estate Jobs Todays Ads Weekly Ads Daily Ads Special Sections Contact Us Submit a News Tip Member Services Advertise With Us Careers Place an Obituary Todays Front Page Back Issues Archives Mobile Apps Copyright (c) 2016 Digital First Media Privacy Policy Site Map Ethics Policy Powered by WordPress VIP Arbitration Send to Email Address Your Name Your Email Address Cancel Post was not sent - check your email addresses Email check failed please try again Sorry your blog cannot share posts by email.,"http://www.denverpost.com/Stories/0,1002,78%257E46231,00.html",404,atlantisthelostempire7,atlantisthelostempire,denverpost
Atlantis The Lost Empire Movie Review (2001) | Roger Ebert,http://www.rogerebert.com/reviews/atlantis-the-lost-empire-2001,200,atlantisthelostempire8,atlantisthelostempire,rogerebert
