review,link,status_code,id,movie_key,critic
Atlantis The Lost Empire | Chicago Reader Switch to the mobile version of this page. Newsletters Follow us Twitter Facebook RSS Mobile Username View Profile Edit Profile Log Out Log in Create Account The Chicago Reader News amp; Politics Music Arts amp; Culture Film Food amp; Drink Classifieds Browse News amp; Politics News amp; Politics home page Steve Bogira | Criminal Justice John Greenfield | Transportation Deanna Isaacs | Culture Ben Joravsky | Politics Michael Miner | Media Browse Music Music home page Gossip Wolf In Rotation Record roundups Leor Galil | Music Criticism Peter Margasak | Music Criticism Soundboard Concerts this week Early Warnings Concerts on horizon Browse Film Film home page J.R. Jones | Movie Reviews Index of Long Reviews Film Archive Short Reviews Now Playing Todays Showtimes Browse Arts amp; Culture Arts amp; Culture home page Tony Adler | Theater Justin Hayford | Theater Aimee Levitt | Features Brianna Wellen | Comedy Arts amp; Culture event search Browse Food amp; Drink Food amp; Drink home page Mike Sula | Restaurant Reviews Key Ingredient A chef-to-chef challenge Cocktail Challenge Bar Guide Restaurant search Browse The Bleader The Bleader blog home page Browse Classifieds Classifieds home page Real Estate Rentals Announcements Services Jobs (Monster) Place ad ad Best of Chicago Summer Guide Savage Love Straight Dope Agenda Events Locations Issues Article Archives Fun amp; Free You searched for [X]Atlantis The Lost Empire Start over Search for... Browse movie times Narrow Search Author Select an author Andrea Gronvall Michael Atkinson Pat Aufderheide Zbigniew Banas Barbara Scharres Angelica Jade Bastien Bill Stamets Bob Mehr Brian Thomas Peter Brunette Dave Canfield Cara Jepsen Carol Burbank Cheryl Ross Pat Chesnut Luca Cimarusti Patrick Dahl Tyler Daswick Dave Kehr Cliff Doerksen Dominick Suzanne-Mayer Don Druker Mick Dumke Marilyn Ferdinand Fred Camper Patrick Friel Chris Fujiwara Leor Galil Hank Sartin Justin Hayford Jack Helbig Henry Sheehan Tanner Howard Drew Hunt J. R. Jones J.R. Jones Jennifer Vanasco Jessica Hopper Jim Healy Jonathan Rosenbaum Joshua Katzman Josh Katzman Anthony Kaufman Kelly Kleiman Asher Klein Shelley Kraicer Shelly Kraicer Nathalie Lagerfeld Adam Langer Lawrence Bommer Lisa Alspector Eric Lutz Peter Margasak Mark Jenkins Martha Bayne Adrian Martin Tom McCormack Meredith Brody Sergio Mims Michael Miner Laura Molzahn Monica Kendrick Adam Morgan Noel Murray Noah Berlatsky Pat Graham Patrick McGavin Patrick Z. McGavin Gerald Peary Richard Pena Mark Peranson Peter Keough Leah Pickett Richard M. Porton Laura Power Quintin Miles Raymer Reece Pendleton Berenice Reynaud Ronnie Scheib Tal Rosenberg Joshua Rothkopf Joshua H. Rothkopf Martin Rubin Ryan Wenzel Ben Sachs Dan Sallitt Dmitry Samarov Ronnie Schieb David Schwartz David P. Schwartz Scott Pfeiffer Ian Simmons Alissa Simon Michael Glover Smith Patrick Somerville Laura Stempel Steve Erickson David Stewart Gwynedd Stuart Mike Sula Ted Shen Julia Thiel Ignatiy Vishnevetsky Kevin Warwick Jessica Weisberg Brianna Wellen Joel Wicklund Albert Williams Michael Wilmington Sam Worley Rating G PG PG-13 R NC-17 X NR Show only Staff Pick Staff Pick Critics Choice Critics Choice Recommended Recommended New New Agenda Agenda Free Free Slideshow Slideshow Video Video Watch on Amazon Watch on Amazon Watch on Netflix Watch on Netflix Watch on Hulu Watch on Hulu Watch on YouTube Watch on YouTube Member Picks Member Picks Other Searches Events Location Guide Member Search Movie Showtimes Movie Reviews Article Archives Issue Archives Slideshows Comments Videos Images Sorting by Name Release Date Film Search Tweet Tools Email Print Share Digg Newsvine del.icio.us Facebook Reddit Twitter Windy Citizen Add to Custom List Loading... Comments (1) Atlantis The Lost Empire The grandson of an Atlantis scholar joins an expedition to locate the remains of the legendary civilization and discovers what he hadnt dared hope--that it still exists. Visually imaginative and even persuasively spiritual this animated adventure has some unusually complex villains and heroes and some of the plot and dialogue transcends whats typical in movies intended for a broad or youthful audience. Instead of joking dismissively about the idea that one cultures study of another can be hard to distinguish from occupation and plunder the characters actually discuss--and their actions acknowledge--the unresolved irony. Gary Trousdale and Kirk Wise directed a screenplay by Tab Murphy; with the voices of Michael J. Fox Cree Summer and James Garner. 95 min. By Lisa Alspector User Rating Now Playing Sorry there are no upcoming showtimes for Atlantis The Lost Empire Reviews/comments 4.1 out of 5 Showing 1-1 of 1 Add a review Subscribe to this thread By Email Subscribing... With RSS Showing 1-1 of 1 Comment Add a review Rating Roll over stars and click to rate. Subscribe to this thread Terms of UsePrivacy PolicySubmission GuidelinesAbout The ReaderStaffReader CareersContact UsFreelancing InfoAdvertisingBack IssuesReprints Copyright (c) 2016 Sun-Times Media LLC. Powered by Foundation,http://www.chicagoreader.com/chicago/atlantis-the-lost-empire/Film?oid=1054055,200,atlantisthelostempire0,atlantisthelostempire,chicagoreader
"Atlantis The Lost Empire | Variety Variety Continue to Variety () Variety Editions U.S Latino Global Asia Subscribe Today Navigation Menu Film TV Digital Contenders Video Dirt Jobs More Biz Music Legit Scene Conferences Insight Archives Directory Choose Edition U.S Latino Global Asia Russia | My Account Sign In Subscribe HomeFilmReviews Review Atlantis The Lost Empire Todd McCarthy 0 Share This Article Email LinkedIn Pin It Tumblr June 7 2001 | 0252PM PT ""Atlantis The Lost Empire"" is a blandly conceived and executed attempt at a juve-style ""Indiana Jones"" with Jules Verne trappings. It recycles familiar adventure and cartoon devices with minimal wit and flair and the lack of imagination will seem all the more dramatic to audiences in comparison to the winningly sophisticated ""Shrek."" Disney pushes into all-talking no-singing no-dancing and in the end no-fun animated territory with ""Atlantis The Lost Empire."" This blandly conceived and executed attempt at a juve-style ""Indiana Jones"" with Jules Verne trappings recycles familiar adventure and cartoon devices with minimal wit and flair and the lack of imagination will seem all the more dramatic to audiences in comparison to the winningly sophisticated ""Shrek"" against which ""Atlantis"" doesnt stand a chance at the box office. Rated PG but likely to be avoided by kids over 12 or so and without many elements that will register as cool to younger kids pic stands among the very least of Disneys major non-TV-derived animated features. Disney has long been moving closer to making a full-length cartoon without songs or anthropomorphized animal characters and one can hope that they and others will continue to try. But the approach and style will have to be more striking and creative than they are in this picture which departs from traditional Disney fare mostly through its pallid New Agey concepts and visual motifs that remind by turns of Japanese anime and horror of horrors ""Pokemon."" The enormously successful team of producer Don Hahn and directors Gary Trousdale and Kirk Wise (""Beauty and the Beast"" ""The Hunchback of Notre Dame"") and screenwriter Tab Murphy (""Hunchback"" ""Tarzan"") revives the myth of Atlantis in a way that makes it smack of ""Pocahontas"" as a threatened paradise whose fate hinges upon the outcome of a romance between a native girl and a sensitive explorer with mercenary companions. It seems to take far longer than necessary to cover the expository basics that set up the journey of the learned but green Milo Thatch (voiced by Michael J. Fox) from his academic womb in Washington D.C. to the under-oceanic world of Atlantis in 1914. The grandson of a legendary adventurer Milo can read the ancient Atlantean language and is given the presumed sole copy of a text and guide to the lost continent by a nutty tycoon willing to finance a trip into the unknown. Better yet he has already built and staffed a lavish submarine (reminiscent of those from ""20000 Leagues Under the Sea"" and ""Voyage to the Bottom of the Sea"") thats ready to go. The seriously multiethnic crew is led by the macho Commander Rourke (James Garner) and includes tough babe Helga (Claudia Christian) French Foreign Legion-type explosives expert Vinny Santorini (Don Novello) black medic Dr. Sweet (Phil Morris) Hispanic engineer Audrey Ramirez (Jacqueline Obradors) extendible lens-eyed geologist Mole (Corey Burton) the chain-smoking Thelma Ritter-ish wisecracker Mrs. Packard (Florence Stanley) and cook Cookie (the late Jim Varney). As the sub approaches the underwater passageway to Atlantis team sets off in lifeboats to escape the clutches of a giant lobster monster that destroys the mother ship and the survivors eventually make their way to their destination a beautiful but somewhat forlorn paradise that resembles a run-down Shangri-La. The ancient king (Leonard Nimoy) would seem to be on his last legs while his daughter and successor the spirited Princess Kida (Cree Summer) worries for her future subjects. ""Our people live but our culture is dying"" she laments to Milo a rangy bespectacled physical bumbler who takes more than an academic interest in the scantily clad maiden from down under. The New Age element comes to the fore when Milo exploring the island with Kida learns the exciting news that Crystal Power provides the energy source for the continent. But it turns out that Rourke knows this too and plans to export the stuff which also has exceptional healing properties back to the mainland for maximum commercial gain. This of course will mean the death of Atlantis all over again leading to a protracted struggle between Rourke and his hired guns on one side and Milo Kida (who gets kidnapped) and their assorted loyalists on the other. End result is an action sequence of some mild excitement as ancient flying-fish craft are resurrected to chase down Rourke but similar scenes in live-action features with the latest CGI work so eclipse this animated variation in terms of visceral impact and thrills that you have to wonder if it was really worth the trouble. Much the same could be said of the film as a whole. Decision to use CinemaScope as Disney previously did in animation on ""Lady and the Tramp"" ""Sleeping Beauty"" and ""A Bugs Life"" gives ""Atlantis"" a nice big canvas upon which to play out if only there were some arresting compositions to enliven it. Vocal perfs are fine with Novello getting the edge among the supporting thesps for his marvelously sardonic world-weary delivery. James Newton Howards score is a bit overblown. Atlantis The Lost EmpireAnimated ProductionA Buena Vista release of a Walt Disney Pictures presentation. Produced by Don Hahn. Directed by Gary Trousdale Kirk Wise. Screenplay Tab Murphy story by Wise Trousdale Joss Whedon Bryce Zabel Jackie Zabel Murphy (Technicolor CinemaScope). CrewEditor Ellen Keneshea; music James Newton Howard; art director David Goetz; artistic coordinator Christopher Jenkins; artistic supervisor for story John Sanford; layout Ed Ghertner; background Lisa Keene; cleanup Marshall Toomey; visual effects Marlon West; computer graphics imagery Kiran Bhakta Joshi; sound designer-supervisor (Dolby Digital/DTS/SDDS) Gary Rydstrom; supervising sound editors Michael Silvers John K. Carr; associate producer Kendra Haaland; casting Ruth Lambert Mary Hidalgo Matthew Jon Beck. Reviewed at the Avco Cinema L.A. June 2 2001. MPAA Rating PG. Running time 95 MIN. With Voices Milo Thatch - Michael J. Fox Commander Rourke - James Garner Princess Kida - Cree Summer The King of Atlantis - Leonard Nimoy Vinny Santorini - Don Novello Helga Sinclair - Claudia Christian Audrey Ramirez - Jacqueline Obradors Preston B. Whitmore - John Mahoney Mole - Corey Burton Fenton Q. Harcourt - David Ogden Stiers Cookie - Jim Varney Mrs. Packard - Florence Stanley Dr. Sweet - Phil Morris Filed Under Jim VarneyJohn CarrPhil Morris Want to read more articles like this one? SUBSCRIBE TO VARIETY TODAY. Post A Comment 0 Variety Jobs Creative Development Coordinator Triptyk Studios New York New York Account/Project Coordinator (Ad Agency) Petrol Advertising Burbank California Media Specialist Bridgewater Associates Westport Connecticut Executive Director Aspen Film Company Confidential Aspen Colorado Associate Director YouTuber amp; Gamer Partnerships Save the Children Fairfield Connecticut See More Jobs Marketplace Leave a Reply No Comments Cancel reply Comments are moderated. They may be edited for clarity and reprinting in whole or in part in Variety publications. Enter your comment here... Fill in your details below or click an icon to log in Email (required) (Address never made public) Name (required) Website You are commenting using your WordPress.com account. ( Log Out / Change ) You are commenting using your Twitter account. ( Log Out / Change ) You are commenting using your Facebook account. ( Log Out / Change ) You are commenting using your Google+ account. ( Log Out / Change ) Cancel Connecting to %s Notify me of new comments via email. Notify me of new posts via email. More Film News from Variety The Power of Content ABC Discovers Digital Talent Competition Announces Winner Liam Payne amp; Cheryl Fernandez-Versini Collaborating On Love Song... High Beam Shoes Launches Synching Sneakers That Help Find... General Hospitals Tyler Christopher Announces Return as... This is the reason next years Galaxy S8 will be so powerful Subscribe to Variety Today All The Ways to Get Variety Online Subscription Print Subscription Mobile Apps Newsletters News Alerts Archives Slanguage Dictionary Help Other Variety Products MediaVariety 411 Research amp; DataVariety Insight Archives Premium Email Alerts Real Estate Jobs Access the best entertainment industry data available View the Variety archives dating back to 1905 Get News Delivered To Your Inbox Privacy Policy Your Privacy Rights Terms of Use About Us Advertise Contact Us Google+ The Power of Content Deadline india.com Hollywoodlife hollywood TV Line BGR WWD Footwearnews (c) Copyright 2016 Variety Media LLC a subsidiary of Penske Business Media LLC. Variety and the Flying V logos are trademarks of Variety Media LLC. Powered by WordPress.com VIP Variety411 Your production services resource",http://www.variety.com/review/VE1117798244.html?categoryid=31&cs=1,200,atlantisthelostempire1,atlantisthelostempire,variety
Were sorry we cant find the page that youre looking for Go to the content Go to the footer Time Out New York New York Popular cities London New York Paris Chicago Los Angeles Browse all cities Time Out New York Close New York Change city New York Popular cities London New York Paris Chicago Los Angeles Browse all cities Tickets Events Things to Do Restaurants Bars Movies Theater Music Shopping Attractions Blog Art Travel Nightlife Events amp; Festivals Museums Kids Hotels Comedy Dance LGBT Sex amp; Dating Books City Guide Neighborhoods Promotions Close My Time Out Things I love My lists My Profile My Account Sign out Sign in Create account Sign in With your social account Or with your email Email Password Remember me Forgotten your password? Sign in You can create a Time Out account in two ways... With a few clicks using your favourite social network Or by entering your details below Email First Name Last Name Create password Repeat new password I accept Time Outs terms of use including opt-in to newsletters. Create account Welcome  You have successfully connected your account to Time Out. You may sign in with this account in future. Please confirm your account details Email First Name Last Name I accept Time Outs terms of use including opt-in to newsletters. Sign up My Account Sign in or Create account Search Tickets Events Things to Do Restaurants Bars Movies Theater Music Shopping Attractions Blog Art Travel Nightlife Events amp; Festivals Museums Kids Hotels Comedy Dance LGBT Sex amp; Dating Books City Guide Neighborhoods Promotions More Search Were sorry we cant find the page that youre looking for We have either moved the page or it no longer exists. To help you find your way here are some search results we think may be of interest. Movies Atlantis The Lost Empire An inexperienced young adventurer becomes the key to unraveling an ancient mystery when he joins up with a group of daredevil explorers to find the legendary lost empire of Atlantis. A naive-but-determined museum cartographer Milo Thatch (Michael J. Fox)... Read more Movies Atlantis - The Lost Empire This Disney animated spectacular is cast as an adventure story in the Jules Verne mould and played commendably straight. It ditches musical numbers and flip contemporary references in favour of a strong storyline genuine moral dilemmas and luxuriant... Read more Top About us Work for Time Out Privacy policy Website terms of use Contact us Get listed Advertising Time Out products Mobile apps Time Out Shop Time Out Guides Time Out Travel Time Out Worldwide Time Out magazine Follow us Facebook Twitter Youtube Instagram Pinterest Spotify Foursquare Time Out New York Site map,http://www.timeout.com/film/reviews/78273/atlantis_the_lost_empire.html,404,atlantisthelostempire2,atlantisthelostempire,timeout
"CNN.com - Review Atlantis a place thats nothing special - June 15 2001 MAIN PAGE WORLD U.S. WEATHER BUSINESS SPORTS POLITICS LAW SCI-TECH SPACE HEALTH ENTERTAINMENT TRAVEL EDUCATION IN-DEPTH QUICK NEWS LOCAL COMMUNITY MULTIMEDIA E-MAIL SERVICES CNNtoGO ABOUT US CNN TV whats on show transcripts CNN Headline News CNN International askCNN EDITIONS CNN.com Asia CNN.com Europe set your edition Languages --------- Time Inc. --------- Time.com People Fortune EW Design wonderful script pedestrian Review Atlantis a place thats nothing special By Paul ClintonCNN Reviewer (CNN) -- Blending digital with traditional hand-drawn effects ""Atlantis The Lost Empire"" is an action-filled adventure flick that will undoubtedly appeal to younger audiences. However it doesnt ascend to the lofty heights achieved by other Disney classics where the film enchants adults as much as it does children. ""Atlantis"" certainly has a pedigree. It was created by the team of producer Don Hahn and directors Gary Trousdale and Kirk Wise who made ""Beauty and the Beast"" (1991) and ""The Hunchback of Notre Dame"" (1996). The cast of voices is also terrific including those of Michael J. Fox James Garner Leonard Nimoy David Ogden Stiers John Mahoney the late actor and comedian Jim Varney and veteran voice-over actress Cree Summer. But even with all that ""Atlantis"" never soars. Angry lobsters and healing crystals MORE REVIEWS Van Wilder High Crimes Big Trouble Panic Room Blade II Ice Age Showtime Time Machine We Were Soldiers Queen of the Damned Dragonfly Iris John Q Big Fat Liar Collateral Damage Monsters Ball Slackers Birthday Girl Monte Cristo Mothman Orange County Charlotte Gray I Am Sam Gosford Park Black Hawk Down Ali Kate amp; Leopold Shipping News Jimmy Neutron Joe Somebody Beautiful Mind The Majestic The Lord of the Rings Lantana The Royal Tenenbaums Vanilla Sky No Mans Land Affair of the Necklace Enemy Lines In the Bedroom Spy Game Sidewalks Harry Potter Shallow Hal Man Who Wasnt There Heist Amelie Focus Domestic Disturbance Tape Monsters Inc. Life As A House My First Mister K-Pax From Hell Riding in Cars Last Castle Mulholland Drive Bandits Serendipity Joy Ride Training Day Dont Say a Word Zoolander Hearts in Atlantis Glitter Liam The Glass House Hardball The Musketeer Rock Star O Bubble Boy Jade Scorpion Corellis Mandolin Apocalypse Redux Now American Pie 2 The Others Osmosis Jones Ghost World Rush Hour 2 Jackpot Planet of the Apes Americas Sweethearts Jurassic Park III Legally Blonde The Score SongCatcher Cats and Dogs Scary Movie 2 crazy/beautiful A.I. The Fast and the Furious Dr. Dolittle 2 Atlantis Tomb Raider Swordfish Evolution Worst That Could Happen? Pearl Harbor Angel Eyes Shrek Calle 54 A Knights Tale Mummy Returns About Adam One Night at McCools Town and Country The Claim Freddy Got Fingered Bridget Joness Diary Joe Dirt Along Came a Spider Blow Tailor of Panama Someone Like You Heartbreakers Say It Isnt So Enemy at the Gates The Dish Blow Dry 15 Minutes The Cavemans Valentine The Mexican 3000 Miles to Graceland Monkeybone Sweet November Hannibal Shadow of the Vampire The Gift Snatch Chunhyang Finding Forrester O Brother Where Art Thou Thirteen Days Before Night Falls Vatel The House of Mirth Traffic Malena An Everlasting Piece All the Pretty Horses Miss Congeniality The Family Man Cast Away Chocolat What Women Want Emperors New Groove Crouching Tiger Hidden Dragon Proof of Life Vertical Limit Dungeons amp; Dragons Unbreakable Quills 102 Dalmatians Just Looking Whats Cooking The 6th Day The Grinch Bounce Boesman and Lena A Room for Romeo Brass You Can Count on Me Men of Honor Red Planet Little Nicky Wonder Boys Legend of Bagger Vance Charlies Angels George Washington Lucky Numbers Blair Witch 2 The Yards Pay It Forward Bedazzled Lost Souls The Contender Billy Elliot Dr. T and the Women Requiem for a Dream Meet the Parents CyberWorld 3D The Broken Hearts Club Girlfight Best in Show Beautiful Remember the Titans Into the Arms of Strangers Under Suspicion Woman on Top Dancer in the Dark Crime and Punishment in Suburbia Duets The Ballad of Ramblin Jack Bait Almost Famous Went to Coney Island on a Mission from God ...Be Back by Five The Watcher Nurse Betty Whipped Love and Sex Bring It On The Crew Art of War The Cell Original Kings Of Comedy Autumn in New York Tao of Steve Cecil B. Demented The Replacements Wonderland New Waterford Girl Hollow Man Space Cowboys Coyote Ugly Criminal Lovers Saving Grace Nutty Professor II What Lies Beneath Loser The Wisdom of Crocodiles Chuck amp; Buck X-Men But Im a Cheerleader Blood Simple Scary Movie Disneys The Kid Trixie Rocky and Bullwinkle Sunshine The Perfect Storm The Patriot Me Myself amp; Irene Chicken Run Boys and Girls Shaft Titan A.E. American Pimp Gone in 60 Seconds Passion of Mind Big Mommas House Mission Impossible 2 Small Time Crooks East Is East Dinosaur Center Stage Battlefield Earth The Big Kahuna Virgin Suicides Gladiator Me Myself I Time Code Where the Heart Is Frequency 28 Days U-571 Joe Goulds Secret American Psycho Keeping the Faith Here on Earth Rules of Engagement Return to Me Romeo Must Die The Road to El Dorado The Ninth Gate Mifune Waking the Dead Beyond the Mat Erin Brockovich",http://www.cnn.com/2001/SHOWBIZ/Movies/06/15/review.atlantis/index.html,200,atlantisthelostempire3,atlantisthelostempire,cnn
