review,link,status_code,id,movie_key,critic
"Lonesome Doves | L.A. Weekly NewsVPoliticsCommunityCrimeLongformBest of L.A.Daily NewsletterWeekly NewsletterMusicVConcert CalendarHenry RollinsBars amp; LoungesBest of L.A.Music NewsletterFood amp; DrinkVRestaurant ReviewsL.A. Restaurant GuideBars amp; LoungesBest of L.A.99 Essential RestaurantsFarmers MarketsFood amp; Drink NewsletterArts amp; CultureVFilm and TVTheaterComedyBest of L.A.Arts amp; Culture NewsletterCalendarVSubmit an EventConcertsThings To Do NewsletterFilm amp; TVVNews amp; InterviewsFilm ReviewsShowtimesTrailersFilm amp; TV NewsletterLongformMarijuanaVMarijuana NewsDispensariesStrainsMarijuana NewsletterVideosSlideshowsBest Of L.A.VBest of L.A. 2015Readers Choice PollBest Of NewsletterNewslettersPromotionsVPromotional EventsStreet TeamFree StuffPromotions NewsletterCrafty Bastards Beer ClubClassifiedsVAfter DarkAd Index Apps About Us Contact Us Staff Advertise E-Edition Privacy Terms menu Lonesome Doves Old Irrelevant Comedians Whine About Censorship in Can We Take a Joke? Remember Me SIGN IN > Forgot Password? Or sign in with a social account FACEBOOK GOOGLE + TWITTER YAHOO Dont have an account yet? Sign Up > Connect. Discover. Share. Get the most out of your experience with a personalized all-access pass to everything local on events music restaurants news and more. Enter your email or sign up with a social account to get started FACEBOOK TWITTER GOOGLE+ YAHOO Privacy Policy SIGN UP > Already registered? Login > Email Username Password Name Zipcode DONE MVN Sign In > Dont have an account yet? Sign Up > Facebook Twitter Follow laweekly Other Ella Taylor Lonesome Doves Thursday December 8 2005 at 12 a.m. By Ella Taylor Photo by Kimberly French A A Facebook- Twitter - More shares recommend reddit email - - At 55 vivid pages Annie Proulxs wonderful New Yorker short story Brokeback Mountain about a doomed love affair between two Wyoming cowboys is practically a screenplay off the bat. Still I couldnt see this minimally told tale as a feature-length movie let alone an Ang Lee movie that moseys along for 134 leisurely minutes. In fact husband and wife screenwriters Larry McMurtry and Diana Ossana labored seven years to get the project off the ground and given the storys frankly carnal homosexual theme its remarkable they got it made at all in an industry that prefers its gay movies gussied up in lifestyle and no sex please. Youd think Lee would steer clear of all things Western after his disastrous dabble with the form in his very odd 1999 bomb Ride With the Devil. But notwithstanding its setting home on the Texas-Wyoming range Brokeback Mountain is no ordinary Western. If anything the movie is a refutation of the forms macho posturing -- an old-fashioned romantic weepie whose protagonists happen to be two men boldly played by two of Hollywoods hottest young hetero studs. Over the course of a long Wyoming summer in 1963 Ennis Del Mar (Heath Ledger) a freelance ranch hand and Jack Twist (Jake Gyllenhaal) a rodeo rider are thrown together on a gig herding sheep. Behind them is space -- the airy lonely infinity of a Wyoming mountain snowcapped and freezing even in August -- and time long hours measured out by a lonely guitar when nothing or anything can happen. After a night of spontaneous rough sex in a pup tent the two grow so close in body and spirit that when the job ends and they have to part the inexpressive Ennis slugs his lover without warning drives off then stops his truck for a dry heave in an alleyway. Upcoming Events Paleyfest Previews Fall TV On Abc Tickets Sat. Sep. 10 1200pm Paleyfest Previews Fall TV On the CW Tickets Sat. Sep. 10 600pm Paleyfest Previews Fall TV On CBS Tickets Mon. Sep. 12 600pm Paleyfest Previews Fall TV On NBC Tickets Tue. Sep. 13 600pm Behind them too and cementing their mutual attraction is the shared experience of a dying world -- not the movie-cowboy landscape of lone rangers riding stoically into sunsets but the hand-to-mouth life of itinerant ranch hands their livelihood squeezed as farms are sold off to real estate sharks -- forcing them to abandon the outdoor work they love for cramped lives in small-town city apartments or trailers. It will be four years before Ennis and Jack meet again and by then they have both married and fathered children -- Ennis with his longtime sweetheart Alma (Michelle Williams) and Jack with rodeo queen Lureen portrayed as best she can by a woefully miscast Anne Hathaway who looks as if she just breezed in from tea with Julie Andrews. Lee whos a far more feminine director than the ballsy Proulx is a writer is instinctively drawn to domesticity and to women. Ensemble pieces come naturally to him and if broadening the focus of Proulxs tautly written two-hander gives Williams whos Ledgers partner in real life the chance to show what an intelligent young actress she is -- when Alma stumbles on a sensational clinch between Jack and Ennis Williams makes her silent anguish palpable -- it also drains energy from the implacable male passion that courses through Ennis and Jacks infrequent ""fishing trips"" in the wild. Still Lees delicacy remains true to Proulxs intent. He doesnt force the gay issue or reduce the two men to desperate closet cases. Instead he shows us the uncorking of a deep inchoate affinity between two very different personalities headlong impulsive puppyish Jack a romantic who wants his lover to come away with him; and quick-tempered Ennis whose fear of being outed is shaped by a childhood experience that showed him what happens to homosexuals in a hypermasculine society. Brokeback Mountain is at once the gayest and the least gay Hollywood film Ive seen which is another way of saying that Lee has a knack for culling universality from the most specific identities. Since Jack is an open book Gyllenhaal has the easy role but I suspect its posters of Ledger that will be going up on walls all over West Hollywood and far beyond. Rather than play down his instinctive animal masculinity Ledger gathers it into a tight tense ball of desire jockeying for space with rage and self-control and in the process so individuates the hapless Ennis that we forget until events crowd in to remind us that were witnessing a homosexual love affair imperiled by a cruelly inhospitable culture. What deepens the tragedy of Jack and Ennis is that the obstacles to their love are only partly cultural. The romantic lesson of Brokeback Mountain as in Walk the Line and countless Woody Allen movies is that the heart wants what it wants and should have it regardless. You can argue with that and I suspect that Ang Lee whose subject has often been the saving pragmatism of family and friends has his qualms. But theres no arguing with the ashen collapsed features of the man left behind with only a bloody shirt a picture post card of his beloved Brokeback Mountain and the terrible knowledge that he never wanted what he wanted enough to pay the price of getting it. BROKEBACK MOUNTAIN | Directed by ANG LEE | Written by LARRY McMURTRY and DIANA OSSANA based on the short story by ANNIE PROULX | Produced by OSSANA and JAMES SCHAMUS | Released by Focus Features | At the Grove Old Irrelevant Comedians Whine About Censorship in Can We Take a Joke? NEXT Contact Ella Taylor Follow L.A. Weekly Film amp; TV L.A. Weekly Film amp; TV Film Film and TV Get the Film amp; TV Newsletter Stay up to date on the best new movies with our critics latest reviews interviews and trailers for the films coming to a theater near you each week. GO Cancel Submit Comments In Case You Missed It The State of the Comedy Game Show Notes on Match Game and... The Low-Key Petes Dragon Dares to Mostly Let Its Beast Chill All-Too-Normal Activity Dominates the Ghostbusters Remake In The Night Before Seth Rogen and Co. Grow Up -- Again Upcoming Events Movie The Seeds Pushin Too Hard Tickets Thu. Aug. 25 900pm Paleyfest Previews Fall TV Fan Pass Tickets Thu. Sep. 8 600pm Paleyfest Previews Fall TV On Fox Tickets Thu. Sep. 8 600pm Paleyfest Previews Fall TV On El Rey Tickets Fri. Sep. 9 600pm Popular Stories The State of the Comedy Game Show Notes on Match Game... Paris and Limousin Are Burning in This Great Lesbian Love Story Ab Fab at Last Patsy and Edina Return Just When We... Ali Wongs Baby Cobra Have We Entered Televisions... Sponsor Content (c)2016 LA Weekly LP. All rights reserved. Newsletters All-access pass to the top stories events and offers around town. Top Stories Send Sign Up gt; Remind Me Later gt; No Thanks gt; Privacy Policy Newsletters All-access pass to top stories events and offers around town. Sign Up gt; No Thanks Remind Me Later gt;",http://www.laweekly.com/ink/06/03/film-taylor.php,200,brokebackmountain21,brokebackmountain,laweekly
"Rex Reed | Observer Politics| Arts amp; Entertainment| Style amp; Design| Business amp; Technology| Search for Submit Observer Archives Politics National New York International Editorials Arts amp; Entertainment Art Movies Music Performing Arts TV Style amp; Design Fashion Food amp; Drink Health amp; Wellness Home Design Real Estate Travel Business amp; Technology Deals Innovators Internet Culture Media Startups About Advertise Subscribe Careers Masthead Contact Privacy Terms Follow Us Sign Up for Newsletters Rex Reed Rex Reed one of the most renowned film critics in American history has been reviewing movies for the Observer for nearly the entirety of the papers existence. Before coming to the Observer Reed wrote for Vogue GQ The New York Times the Daily News and the New York Post. He is the author of eight books including the best seller Do You Sleep in the Nude? and his profile of the aging Ava Gardner was included in Tom Wolfes classic anthology The New Journalism. He is also an actor and the former co-host of the syndicated television show ""At the Movies."" Culture Quitters Sensitively Details the Vicissitudes of Teenage Angst Lights Out Is a Sad Excuse for a Horror Flick Culture By Rex Reed The Childhood of a Leader Details the Formation of a Fascist Culture By Rex Reed With Old Chums Life Is a Cabaret Culture By Rex Reed Outlaws and Angels Is an Exercise in Cosmic Cynicism Culture By Rex Reed Equals Is a Sci-Fi Hat Tip to Romeo and Juliet Culture By Rex Reed Dont Listen to Simon Culture By Rex Reed Cafe Society Is a Blast From an Imagined Past Culture By Rex Reed Super-Dad Captain Fantastic Enthralls the Senses and Engages the Mind Culture By Rex Reed Father and Daughters Is Too Boring to Make a Ripple in the Summer Movie Landscape Culture By Rex Reed The Rose Tattoo Opens Williamstown Theatre Festival Culture By Rex Reed Trending Now Wikileaks Proves Primary Was Rigged DNC Undermined Democracy Politics Bill Maher Im With Her or Im With Stupid Politics Space Radiation Devastated the Lives of Apollo Astronauts Business amp; Tech Why ISIS Sees an Elderly Priest as a Threat to the Caliphate Politics Wikileaks Dismantling of DNC Is Clear Attack by Putin on Clinton Politics Observer About Advertise Careers Contact Privacy Terms Powered by WordPress.com VIP",http://nyobserver.com/culture_rexreed.asp,200,brokebackmountain22,brokebackmountain,com/culture_rexreed
"Brokeback Mountain - Rolling Stone Follow RollingStone Brokeback Mountain 31 News Video Music Politics TV Movies Sports Long Reads RS Country More RS Country Long Reads Sports Movies TV Politics Music Lists Culture Galleries Glixel Interviews Artists Album Reviews Ram Report Movie Reviews Country Sessions Live Reviews Momentum Coverwall Trending Jane Sanders Why Bernie Voters Shouldnt Get Over It Slender Man Trial Why Trying These Girls as Adults Is... Inside Halseys Troubled Past Chaotic Present How Son of Sam Changed America Brokeback Mountain By Peter Travers December 2 2009 More News Sundance 2015 Stars Answer Peter Travers Burning Question 10 Best Movies of 2014 All Stories >> Ang Lees unmissable and unforgettable Brokeback Mountain hits you like a shot in the heart. Its a landmark film and a triumph for Heath Ledger and Jake Gyllenhaal who bring deep reserves of feeling to this defiantly erotic love story about two Wyoming ranch hands and the external and internal forces that drive them from desire to denial. Directed with piercing intelligence and delicacy by Lee the film of Annie Proulxs 1997 short story -- the unerring script by Larry McMurtry and Diana Ossana is a model of literary adaptation -- wears its emotions on its sleeve. More News Sundance 2015 Stars Answer Peter Travers Burning Question 10 Best Movies of 2014 All Stories >> That leaves the film vulnerable. The media keep tagging it as the gay cowboy movie the queer Gone With the Wind the Western that puts the poke in cowpoke. Coupled with the rise of homophobia as church and state shout down gay marriage the film is up against it. Do me a favor See the movie first and make your judgments later. Its an eye-opener. The story begins in 1963 when ranch boss Joe Aguirre (Randy Quaid) hires Jack Twist (Gyllenhaal) and Ennis Del Mar (Ledger) to herd sheep up on Wyomings Brokeback Mountain. Ennis is quiet but whiskey and Jacks talk about his rodeo riding loosens Ennis tongue and his inhibitions. One cold night they share a bedroll. Jack gives the impression of experience. For Ennis this is nothing hed done before but no instructional manual is needed. Proulx writes it this way ""They never talked about sex let it happen at first only in the tent at night then in full daylight with the hot sun striking down and at evening in the fire glow quick rough laughing and snorting no lack of noises but saying not a goddamn word except once Ennis said Im not no queer and Jack jumped in with Me neither. "" Lee and the gifted cinematographer Rodrigo Prieto (Amores Perros) transform Proulxs terse prose into expansive visual poetry. Shooting in Alberta Canada Lee avoids trite postcard prettiness to find the beauty and terror in nature that mirror the vivid and sometimes violent relationship between the two men. ""Its nobodys business but ours"" Jack tells Ennis. Hes wrong of course. Joe spots them with his binoculars and never hires them again. Ennis marries Alma (Michelle Williams) and has two daughters. Jack moves to Texas marries Lureen (Anne Hathaway) and has a son. Living a lie is easier than dealing with the truth at least it is for Ennis until Jack pays a visit -- his first in four years. Lees filmmaking mastery has never been more evident. Watch the skill with which the Taiwanese director of Crouching Tiger Hidden Dragon and Sense and Sensibility walks the volatile ground of this reunion scene. Ennis cant contain his excitement. Running down the steps to greet his friend he collides with Jacks body kissing him fiercely and Jack returning the heat. Alma sees it too from the window finding reinforcement for something shes always felt. Without dialogue Lee creates a whole world that can be read eloquently and movingly on the faces of the actors. And what actors. Though the characters must age twenty years Lee has cast the film young a risk that pays major dividends. Hathaway (The Princess Diaries) excels at showing Lureens journey from cutie-pie to hard case. And Williams (Dawsons Creek) is a revelation using what Proulx calls Almas ""misery voice"" when her husband goes fishing several times a year with Jack. Who can blame her? They never bring home any fish. When Alma remarries and lets Ennis feel the knife of her resentment Williams lets it rip. Of course the movie would not work at all if the two lead actors didnt deliver the goods. Gyllenhaal finds the reckless core in Jack who cruises alleys and bars in Mexico when Ennis rejects his offer to settle down and run his fathers ranch. Ennis lives in fear of coming out -- he relates a harrowing childhood incident in which he saw a man tortured and killed for the crime of living with another man. And so he forbids himself happiness with the one person he has ever truly loved. Ledgers magnificent performance is an acting miracle. He seems to tear it from his insides. Ledger doesnt just know how Ennis moves speaks and listens; he knows how he breathes. To see him inhale the scent of a shirt hanging in Jacks closet is to take measure of the pain of love lost. As Jack told him once ""That ol Brokeback got us good."" Thats the key reason -- besides its daring its bravery its dead-on relevance to right now -- that this classic in the making ranks high on the list of the years best movies. It gets you good. Dont Miss a Story Sign up for our newsletter to receive breaking news directly in your inbox. We may use your e-mail address to send you the newsletter and offers that may interest you on behalf of Rolling Stone and its partners. For more information please read our Privacy Policy How we use your email address Around the Web 6 Hit Songs That Destroyed the Bands They Made Famous Cracked Debunking 6 Rock n Roll Urban Legends Mental Floss 5 Real People Screwed By True-Story Movies Based On Them Cracked Trending This shows whats trending on RollingStone.com right now. What is this? Jane Sanders Why Bernie Voters Shouldnt Get Over It 9.0 Slender Man Trial Why Trying These Girls as Adults Is Absurd 7.8 Inside Halseys Troubled Past Chaotic Present 7.5 How Son of Sam Changed America 7.2 When John Lennons Jesus Controversy Turned Ugly 7.0 (c) Rolling Stone 2016 Digital Edition Subscribe Give a Gift Coverwall Contact Privacy Policy Your Privacy Rights Your Ad Choices Terms of Use Customer Service Advertise Sitemap",http://www.rollingstone.com/movies/reviews/brokeback-mountain-20091202,200,brokebackmountain23,brokebackmountain,rollingstone
Brokeback Mountain | EW.com Skip to main content Sign In Log Out TV TV Recaps Movies Music Books Gaming Video Big Brother Queen of the South Mr. Robot Wayward Pines Suits Tyrant Shop Newsletter Subscribe Get 1 year for 25 Save 86% off the cover price SUBSCRIBE More Great Stuff Comic-Con Hulu Hot List 50Scoops EW Popfest For Your Consideration Jess Cagle Interview Stage Follow EW EW on Facebook EW on Twitter EW on Tumblr EW on Instagram About EW Contact UsCustomer ServiceAbout UsJobs at Time Inc.AdvertisePrivacy PolicyYour California Privacy RightsAd ChoicesNewslettersSubscribeTerms of ServiceSite Map Copyright 2015 Entertainment Weekly Inc. All rights reserved. Login Log out TV TV Recaps Movies Music Books Gaming Video More... TV This Weeks Cover The Walking... TV Exclusive Photos of The Walking... EW POPFEST Get the details 50Scoops50Days Exclusive... Movies Crazy Stupid Love Before Th... Movies The Most 2000s Fashion From Joh... Movies 27 Great Revenge Movies Movies Alice in Wonderland Witticism... Movies John Tucker Must Die Where Ar... Books 15 Captivating International Cri... Movies Planet of the Apes See the Fa... Movies Toronto Film Festival 2016 See... TV One Tree Hill Where Are They... Movies Little Miss Sunshine Where Ar... Books Harry Potter and the Cursed Chi... Movies Comic-Con 2016 See Portraits of... TV Friends See the Casts Evolut... TV Comic-Con 2016 Get Batty With... Movies The Dark Tower Storybook Steph... News Comic-Con 2016 Star Portraits... TV 10 of the Best Moments From The... Movies The Dark Tower Storybook Steph... Movies Thelma and Louise See Rare Behi... Movies 9 of Garry Marshalls Best Movies Movies Every Star Trek Movie Ranked Movies Big Trouble in Little China... Movies The Dark Tower Exclusive Firs... Movies Suicide Squad Before They Wer... Movies The 10 Best Movies of 2016 (So Far) TV Fear the Walking Dead introduc... Movies by Owen Gleiberman Share Tweet Share on Google+ Share on Pinterest Share on Tumblr Brokeback Mountain A big Hollywood weeper with a beautiful ache at its center. In 1963 Ennis (Heath Ledger) and Jack (Jake Gyllenhaal) a couple of dirt-poor ranch...Brokeback MountainWesternDiana Ossana E. Annie Proulx Larry McMurtryPT134MR A big Hollywood weeper with a beautiful ache at its center. In 1963 Ennis (Heath Ledger) and Jack (Jake Gyllenhaal) a couple of dirt-poor ranch...2005-12-09Anne HathawayRandy QuaidMichelle WilliamsAnne Hathaway Randy Quaid Michelle WilliamsFocus Features Universal A Brokeback Mountain Genre Western; Starring Jake Gyllenhaal Heath Ledger Anne Hathaway Randy Quaid Michelle Williams; Director Ang Lee; Author Diana Ossana E. Annie Proulx Larry McMurtry; Release Date Limited 12/09/2005; Runtime (in minutes) 134; MPAA Rating R; Distributor Focus Features Universal Posted December 9 2005 -- 1200 AM EST A big Hollywood weeper with a beautiful ache at its center. In 1963 Ennis (Heath Ledger) and Jack (Jake Gyllenhaal) a couple of dirt-poor ranch hands take a herding job on Brokeback Mountain and wind up sleeping together. They reunite in secret over the years and the movie treating their passion as something unprecedented makes love seem as ineffable as it really is. Ledger gives a performance of extraordinary gnarled tenderness. Share Tweet Share on Google+ Share on Pinterest Share on Tumblr Top Stories Watch Kelly Clarkson adorably forget the lyrics to her songs Katy Perry reveals which line of her DNC speech Orlando Bloom wrote Chandra Levy miniseries in works at TNT Nick Jonas Demi Lovato send fans on scavenger hunt for concert tickets Pokemon Go nests are reportedly spawning different Pokemon Disney changes Avengers Infinity War Part 1 title Constance Wu says Matt Damons Great Wall perpetuates racist myth Photo Galleries 50Scoops50Days The Latest in Fall TV News The Biggest Moments From the 2016 Conventions Crazy Stupid Love Before They Were Stars The Most 2000s Fashion From John Tucker Must Die Exclusive Photos of The Walking Dead Season 7 27 Great Revenge Movies Alice in Wonderland Witticisms and Wisdom From the Disney Classic From Our Partners From Our Partners Contact UsCustomer ServiceAbout UsJobs at Time Inc.AdvertisePrivacy PolicyYour California Privacy RightsAd ChoicesNewslettersSubscribeTerms of ServiceSite Map Copyright (c) 2016 Entertainment Weekly Inc. All rights reserved. img[data-src] { display none important; },"http://www.ew.com/ew/article/0,,1138905,00.html",200,brokebackmountain24,brokebackmountain,ew
"Movies A Tender Cowpoke Love Story - TIME Time.com MY ACCOUNT SIGN IN SIGN OUT SUBSCRIBE SUBSCRIBE Home U.S. Politics World Business Tech Health Motto Entertainment Science Newsfeed Living Sports History The TIME Vault Magazine Ideas Parents TIME Labs Money LIFE The Daily Cut Photography Videos TIME Shop American Voices Next Generation Leaders The 100 Most Influential People Global Trade Person of the Year 2015 Top of the World A Year In Space Subscribe Newsletters Feedback Privacy Policy Your California Privacy Rights Terms of Use Ad Choices RSS TIME Apps TIME for Kids Advertising Reprints and Permissions Site Map Help Customer Service (c) 2016 Time Inc. All rights reserved. Subscribe Sign InSubscribe Movies A Tender Cowpoke Love Story By Richard Schickel Sunday Nov. 20 2005 Subscriber content preview. or Log-In Share Facebook Twitter Tumblr LinkedIn StumbleUpon Reddit Digg Mixx Del.i.cious Google+ Talk about revisionist westerns Brokeback Mountain is as far as one can tell the first movie to trace the course of a homosexual relationship between a pair of saddle tramps doing so in considerable--if discreetly visualized--detail from first idyllic rapture to angry rupture some 20 years later. Ennis Del Mar (Heath Ledger) and Jack Twist (Jake Gyllenhaal) meet in the summer of 1963 when they sign on to tend a herd of sheep on the eponymous peak which director Ang Lee locates high in ravishing Marlboro Country. Ennis is a slow-drawling mans man a simple soul content to live out a... To continue reading or Log-In Want the full story? Subscribe Now Get TIME the way you want it One Week Digital Pass -- 4.99 Monthly Pay-As-You-Go DIGITAL ACCESS -- 2.99 One Year ALL ACCESS -- Just 30   Best DealPrint Magazine + Digital Edition + Subscriber-only Content on TIME.com Learn more about the benefits of being a TIME subscriberIf you are already a subscriber sign up -- registration is free Sign In Already have an account? Sign in here Email address Password Remember me If you check the ""Remember me"" box you will be automatically signed in for 30 days to TIME.com when you visit in the future. If you are accessing TIME.com on a public computer you are advised not to click on the ""Remember me"" option. For more information please visit TIMEs Privacy Policy Home U.S. Politics World Business Tech Health Science Entertainment Newsfeed Living Ideas Parents Sports History The TIME Vault Magazine Subscribe Give a Gift TIME Shop Newsletters Customer Service Site Map Privacy Policy Your California Privacy Rights Terms of Use Advertising Ad Choices (c) 2016 Time Inc. All rights reserved.","http://www.time.com/time/magazine/article/0,9171,1132840,00.html",200,brokebackmountain25,brokebackmountain,time
