review,link,status_code,id,movie_key,critic
"Brokeback Mountain (2006) directed by Ang Lee | Film review Go to the content Go to the footer Time Out London London Popular cities London New York Paris Chicago Los Angeles Browse all cities Time Out London Close London Change city London Popular cities London New York Paris Chicago Los Angeles Browse all cities Tickets Offers Things to Do Restaurants Bars amp; Pubs Film Theatre Art Music Attractions Blog Theatre Tickets Shopping Offer of the Day Time Out Card Time Out Escapes Time Out Live Hotels Nightlife Music festivals Events amp; Festivals Kids Museums Clubs Comedy Food amp; Drink Classical Music amp; Opera Dance LGBT City Guide Area Guides Property Competitions Dating Close My Time Out Things I love My lists My Profile My Account Sign out Sign in Create account Sign in With your social account Or with your email Email Password Remember me Forgotten your password? Sign in You can create a Time Out account in two ways... With a few clicks using your favourite social network Or by entering your details below Email First Name Last Name Create password Repeat new password I accept Time Outs terms of use including opt-in to newsletters. Create account Welcome  You have successfully connected your account to Time Out. You may sign in with this account in future. Please confirm your account details Email First Name Last Name I accept Time Outs terms of use including opt-in to newsletters. Sign up My Account Sign in or Create account Search Tickets Offers Things to Do Restaurants Bars amp; Pubs Film Theatre Art Music Attractions Blog Theatre Tickets Shopping Offer of the Day Time Out Card Time Out Escapes Time Out Live Hotels Nightlife Music festivals Events amp; Festivals Kids Museums Clubs Comedy Food amp; Drink Classical Music amp; Opera Dance LGBT City Guide Area Guides Property Competitions Dating More Search Brokeback Mountain Film  Drama 4 out of 5 stars (15 user reviews) 0 Love It Save it 15 Add review 0 Love It Save it Time Out says Details Users say (15) 4 out of 5 stars Time Out says Ang Lees adaptation of an Annie Proulx short story arrives amid much chatter from awards-season soothsayers and pundits who have slapped the easy tag of gay cowboy movie on this sensitive intelligent and pleasingly traditional film. Certainly its two male protagonists Jack Twist (Jake Gyllenhaal) and Ennis Del Mar (Heath Ledger) two free-and-easy 19-year-olds tend sheep together in rural Wyoming. They favour denim live close to the land and enjoy - briefly - a loving sexual relationship. But theres little in this film to excite either John Wayne fans or devotees of Warhols Lonesome Cowboys. Instead the films themes of forbidden love lost opportunity marital deception and romantic honesty are quite accessible mainstream even. The revolution is all off-screen what ultimately makes Brokeback Mountain a radical project is that its set to become the first bona fide well-made and commercially successful gay weepie to emerge from Hollywood. Jack and Ennis meet on a Wyoming mountainside one summer when both are employed to watch over the flock of a local farm baron (Randy Quaid). Lee indulges wide shots of flowing rivers travelling sheep wispy clouds and mountain vistas to canonise the pairs experience on Brokeback Mountain. He threatens to over-sweeten us with the shallow beauty of a Marlboro commercial or Wrangler advert until one night on the mountain a drunken Ennis spits on his hand turns Jack over and lights the fuse on an on-off love affair that will stretch painfully over two decades but never escape the macho strictures of the rural worlds to which they belong. Both marry; both have kids; both meet occasionally over 20 years for the odd tryst disguised as a fishing trip. For Jack and Ennis Brokeback Mountain is more than a place; its a symbol of what could have been a state of mind an unattainable nirvana. Brokeback got us good sighs Jack to Ennis as their strained friendship floats through the years forever secret barely defined hardly spoken. Always taking his cue from Proulxs original story (a marvel of epic economy) Lee and his screenwriters Larry McMurty (The Last Picture Show) and Diana Ossana present just enough of the pairs married post-Brokeback lives to remind us of the conservative and traditional nature of their domestic lives. But what makes Brokeback Mountain more interesting than a well-meaning time capsule of period values are the subtle differences in character that Lee carves between Jack and Ennis. Jack is more exuberant more romantic a dreamer who rides the rodeo and hatches impossible plans for him and Ennis to live together. Ennis is a puritan unadventurous and afraid of himself; he takes solace in violence holds back emotionally and creates excuses for the stagnation that defines his life. The film is Enniss tragedy; it becomes painfully obvious that he left his soul on Brokeback Mountain. Its a tough act to witness and one that Heath Ledger handles superbly delivering an increasingly sad mumbling and desperate performance that smacks of loneliness and alienation. And all because the boy loves the boy but barely knows what such love means let alone possesses the tools with which to act on it.What we have here is acutely calibrated storytelling. Nothing is wasted. The pacing is calm the mood sombre and the adaptation is both respectful and imaginative. Lee retains the taut ease of Proulxs prose allowing him to cover a long period of time (about 20 years) without lessening the tragedy at the heart of the tale or offering episodic biographies. Very little is added to Proulxs story; the films screenwriters take smart inspiration from a line here or a comment there spinning them into well-placed new scenes. Brokeback Mountain deserves all the awards and acclaim that its bound to gather in the next couple of months. Its painful stuff moving and intelligent. Lee has taken a story of gay love and placed it where it should be - in the mainstream. Hes delivered a beautifully crafted film to boot. By Dave Calhoun Posted Tuesday December 20 2005 Details Release details Rated 15 Release date Friday January 6 2006 Duration 134 mins Cast and crew Director Ang Lee Screenwriter Larry McMurtry Diana Ossana Cast Anne HathawayRandy QuaidJake GyllenhaalMichelle WilliamsAnna FarisLinda CardelliniKate MaraHeath Ledger Users say (15) 4 out of 5 stars LiveReviews|151 person listeningSign inWrite reviewMost helpfulMost helpfulHighest ratingLowest ratingNewestOldestLoadingundefinedNew CommentsRefreshApr 27 2013DanielFeaturedAn unforgettable MasterpieceFlagShareHelpful?Yes|NoReplyApr 27 2013DanielFeaturedAn unforgettable MasterpieceFlagShareHelpful?Yes|NoReplyJan 18 2010MarcusFeaturedThe theme of Brokeback Mountain as expressed by Annie Proulx is one of rural homophobia in America and its effects. As such whether or not Jack died (and his death is ambiguous--was it a beating or was it a tire rim to the jaw?) Ennis tragedy stems from the effect of rural homophobia on his psyche. Why the film is so affecting is directly related to the specific tragedy of Ennis and his refusal to acknowledge his feelings for another man. I read ydurics review and respect his right to his own opinion which I feel reflects his own feelings towards hetero society in general rather than the reality of Brokeback. The film is multi-faceted its themese multi-layered and so the varying opinions on its intent and effect speak to its ultimate success as a film of enduring quality and scope. Each time I have watched it I grasp something new. Beautiful horrifying tragic relentless human realistic. It will endure.FlagShareHelpful?Yes|NoReplyJan 18 2010MarcusFeaturedThe theme of Brokeback Mountain as expressed by Annie Proulx is one of rural homophobia in America and its effects. As such whether or not Jack died (and his death is ambiguous--was it a beating or was it a tire rim to the jaw?) Ennis tragedy stems from the effect of rural homophobia on his psyche. Why the film is so affecting is directly related to the specific tragedy of Ennis and his refusal to acknowledge his feelings for another man. I read ydurics review and respect his right to his own opinion which I feel reflects his own feelings towards hetero society in general rather than the reality of Brokeback. The film is multi-faceted its themese multi-layered and so the varying opinions on its intent and effect speak to its ultimate success as a film of enduring quality and scope. Each time I have watched it I grasp something new. Beautiful horrifying tragic relentless human realistic. It will endure.FlagShareHelpful?Yes|NoReplyOct 8 2009CattyFeaturedReally fabulous film I take ydurics point but dont really agree with it the film was amazing and heartbreaking. Aside from the great acting and storyline the cinematography (of the wild especially) was beautiful.FlagShareHelpful?Yes|NoReplyOct 8 2009CattyFeaturedReally fabulous film I take ydurics point but dont really agree with it the film was amazing and heartbreaking. Aside from the great acting and storyline the cinematography (of the wild especially) was beautiful.FlagShareHelpful?Yes|NoReplySep 24 2008denise lewisFeaturedi have just seen the film on tele for the first time 2008 omg why did i never buy this it is beautiful and im so moved buy it .its by far the best film i have ever seen the power of the love between them is portraied brilliantly and so sad that society of what should be gets in the way of there true happiness together. its a tribute to heaths talent they were so the best actors for the parts.i now have the film the soundtrack and the memorey of the impact this has had on me.FlagShareHelpful?Yes|NoReplySep 24 2008denise lewisFeaturedi have just seen the film on tele for the first time 2008 omg why did i never buy this it is beautiful and im so moved buy it .its by far the best film i have ever seen the power of the love between them is portraied brilliantly and so sad that society of what should be gets in the way of there true happiness together. its a tribute to heaths talent they were so the best actors for the parts.i now have the film the soundtrack and the memorey of the impact this has had on me.FlagShareHelpful?Yes|NoReplyJul 2 2008admasamihFeaturedwow oh may gad good filmFlagShareHelpful?Yes|NoReplyJul 2 2008admasamihFeaturedwow ther is goodFlagShareHelpful?Yes|NoReplySep 23 2007FilioFeaturedI really liked that movie for two reasons... 1.It isnt another boring love story about a boy and a girl but a story of the true love of two men 2. It idicates that true love can be found anywhere...Thats really touchingFlagShareHelpful?Yes|NoReplySep 23 2007FilioFeaturedI really liked that movie for two reasons... 1.It isnt another boring love story about a boy and a girl but a story of the true love of two men 2. It idicates that true love can be found anywhere...Thats really touchingFlagShareHelpful?Yes|NoReplySep 1 2007yduricFeaturedBrokeback Mountain is a film that left me with a very sour taste in my mouth.I have to admit that I was at first moved by it probably influenced by the hype surrounding it. However... I would like to add a discordant voice here and point out something (at least it seems to me) few people paid attention to I am convinced after having thought about it a long time that its great success and high rating is due to its tragic ending an ending that adds a virtuous note to the film. The question is if Ang Lee had slightly deviated from Anne Proulxs short story and put a less tragic ending would the film have been so highly praised? The answer is I am sure NO because the sacrifice of one of the gay characters is what a great part of the audience unconsciously demanded in order to make the subject matter more acceptable.And this is what fills me with some kind of nausea and makes me think that this film is not as gay-friendly as it seems. Moreover if we compare Brokeback Mountain to the (in my opinion) far superior Mysterious Skin (whose director was  by the way nominated for best director alongside Ang Lee at the Independent Spirit Awards) things become very clear despite its much harder subject the latter does NOT end tragically which would be considered a major sin by many viewers and this is why some courageous films do not stand a single chance against the disguised homophobic weepie I just reviewed.FlagShareHelpful?Yes|NoReplyAug 29 2007Sarah JaneFeaturedOMG this movie is brilliant Even my mother said so and she can be VERY critical when it comes to movies. A friend of mine described it as ""just another love story"" but I think it is sooooo much more than that. It is also about how both Jack (Jake Gyllenhaal) and Ennis (Heath Ledger) have to keep their love a secret not just from their wives and children but also from society. A must-see movie.FlagShareHelpful?Yes|NoReplyAug 29 2007Sarah JaneFeaturedOMG this movie is brilliant Even my mother said so and she can be VERY critical when it comes to movies. A friend of mine described it as ""just another love story"" but I think it is sooooo much more than that. It is also about how both Jack (Jake Gyllenhaal) and Ennis (Heath Ledger) have to keep their love a secret not just from their wives and children but also from society. A must-see movie.FlagShareHelpful?Yes|NoReplyShow More Share Tweet 0 Shares Top About us Work for Time Out Privacy policy Cookie Policy Website terms of use Contact us Time Out for business Get listed Claim your listing Premium Profiles Advertising Time Out products Time Out Card Mobile apps Time Out Shop Time Out Guides Time Out Travel Time Out Offers Time Out Worldwide Time Out magazine Where to get Time Out magazine Subscribe to Time Out magazine Manage my subscription Follow us Facebook Twitter Youtube Instagram Pinterest Spotify Time Out London Site map }",http://www.timeout.com/film/83318.html,200,brokebackmountain0,brokebackmountain,timeout
"Lost in Loves Rocky Terrain washingtonpost.com gt; Arts amp; Living gt; Movies >> Follow Movies On Lost in Loves Rocky Terrain Jake Gyllenhaal left and Heath Ledger as lovers in ""Brokeback Mountain."" (By Kimberly French -- Focus Features Via Associated Press) Network News X Profile View More Activity TOOLBOX Resize Print E-mail Reprints By Ann Hornaday Washington Post Staff Writer Friday December 16 2005 Its hard to know what to make of ""Brokeback Mountain"" one of this seasons most buzzed-about -- and this week at least award-nominated -- movies. On the one hand its high-toned and refined an impeccably pedigreed literary adaptation of a short story by Annie Proulx that was first published in the New Yorker. On the other hand its a potential camp classic larded with unintended humor and ""Saturday Night Live""-ready fodder for instant pop culture parody. The story of two cowboys who fall in love in the 1960s its a genre-subverting exercise similar to Todd Hayness 2002 ""Far From Heaven"" although some theorists might argue that its redundant the idea being that all Westerns have a whiff of lavender about them at least subliminally. A sweeping solemn self-serious chronicle of the mens relationship over several decades ""Brokeback Mountain"" possesses handsome and sympathetic lead players magnificent scenery heartbreaking melodrama righteousness and cultural import. But as a testament to the importance of following ones passion its devoid of one crucial thing passion. This isnt to say that things dont get physical. Because ""Brokeback Mountain"" has been marketed as a breakthrough movie in its portrayal of homosexual relationships from the moment Ennis Del Mar (Heath Ledger) and Jack Twist (Jake Gyllenhaal) first meet while applying for jobs herding sheep in Wyoming its just a matter of when not if. The consummation of their relationship is a brief violent loveless episode that over their first summer together becomes an idyll of half-naked wrestling nuzzling by the campfire and fistfights that inevitably end in an embrace. They wont meet again until four years later -- by which time Ennis has married Alma (Michelle Williams) and had two daughters. But when Jack shows up on his doorstep the attraction clearly hasnt waned. Jack and Enniss highly charged reunion inspires Jack to suggest that the two run away and start a ranching operation together a suggestion Ennis dismisses out of hand. Over the next several years the two men will have to be satisfied with fishing trips on Brokeback Mountain during which no fish will be caught. (Their subterfuge is often what sparks ""Brokeback Mountains"" unintentional humor such as when Alma finally confronts Ennis by pointedly asking him why he never brought home any trout.) Meanwhile Jack gets married to a rodeo queen (Anne Hathaway) down in Texas sublimating his desire for Ennis in furtive dangerous assignations across the Mexico border. As a tragic evocation of the costs of homophobia -- not just to closeted gay people but also to their families and loved ones -- ""Brokeback Mountain"" is indeed a watershed movie an airing of taboos and secrets that can only be seen as welcome and deeply humanist. (And in its depiction of the violence that threatens Jack and Ennis should their relationship come to light its a sensitive empathic homage to those who have died of hatred including Matthew Shepard who seems to haunt the production from his Wyoming grave.) But director Ang Lee -- who knows his way around gay love (""The Wedding Banquet"") confining social strictures and rituals (""Eat Drink Man Woman"" ""Sense and Sensibility"") and the wages of repression (""The Hulk"") -- treats the source material with such deference that its as if the entire movie were made in New Yorker typescript. Lee and cinematographer Rodrigo Prieto frame and shoot everything for maximum grandeur The Wyoming vistas are flawlessly manicured Ledger and Gyllenhaal perfectly costumed and coiffed; even Ennis and Almas sad little apartment over a laundromat seems to have been designed to death. Even more oddly the two men are never portrayed within the welter of a larger life whether its Enniss Wyoming town or an America undergoing seismic social and political changes. Instead Jack and Ennis remain hermetic chiseled paragons atop their Bighorn Olympus. Given such a limited range to play in both Gyllenhaal and Ledger deliver fine performances and they make ""Brokeback Mountain"" memorable not as a stunt or political touchstone but as a good old-fashioned love story. Both are more complicated men than their terse personas would first lead you to believe; indeed its never clear just how surprised either man is by that first encounter in the tent. Ledger is especially impressive as the withdrawn emotionally stunted Ennis who if homosexuality is the love that cannot speak its name cannot speak at all. (Ledger seems to have looked to Billy Bob Thorntons dialect in ""Sling Blade"" as inspiration for Enniss rock-jawed diffidence and he pulls it off with impressive authenticity.) Its Ledgers Ennis who ultimately overcomes the pall of self-importance and sanctimony that hangs over so much of ""Brokeback Mountain."" In the films wrenching final scenes he provides what has been needed all along an immediate shattering sense of sadness and longing and loss. Its as if the movie has finally shifted its focus from the mountain to the man. Brokeback Mountain (134 minutes at Loews Dupont Circle and Landmarks Bethesda Row) is rated R for sex scenes nudity profanity and some violence. (c) 2005 The Washington Post Company Network News X My Profile Friends Activity View More Activity",http://www.washingtonpost.com/wp-dyn/content/article/2005/12/15/AR2005121502059.html,200,brokebackmountain1,brokebackmountain,washingtonpost
