review,link,status_code,id,movie_key,critic
"Charlie St. Cloud A so-so showcase for a solid Zac Efron - USATODAY.com Cars  Auto Financing  Event Tickets  Jobs  Real Estate  Online Degrees Shopping SearchHow do I find it?Subscribe to paper Home News Travel Money Sports Life Tech Weather Life >> Movies Box Office Report Movie Listings Awards Central Shop for Movies/DVDs Charlie St. Cloud A so-so showcase for a solid Zac Efron Updated  | Comment  | Recommend E-mail | Print | Enlarge By Diyah Pera Universal Pictures Ahoy there Zac Efron tries to bounce back from a tragedy involving his younger brother (Charlie Tahan left) in Charlie St. Cloud. ABOUT THE MOVIECharlie St. Cloud   (out of four) Stars Zac Efron Charlie Tahan Amanda Crew Donal Logue Ray Liotta Kim BasingerDirector Burr SteersDistributor Universal PicturesRating PG-13 for language including some sexual references an intense accident scene and some sensualityRunning time 1 hour 37 minutesOpens Friday nationwide In Charlie St. Cloud Zac Efron sees dead people -- with a few caveats. As the eponymous Charlie Efron spends large swaths of this sentimental movie brooding and mired in grief. But his legions of swooning fans neednt worry. Despite his dark turn he remains adorable and well-groomed even as a gloomy loner. And there are still plenty of shots of Efron shirtless (or in a wet T-shirt) and windswept sailing off into the sunset. TRAILER Check out a preview of Charlie St. Cloud PHOTOS Wade into our Zac Efron gallery Director Burr Steers (Igby Goes Down) throws in the occasional picturesque Northwestern coastal shot but Efron is lovingly photographed throughout from a tight shot on his piercing blue eyes gazing into the heavens to a lingering focus on his toned abs and broad shoulders. His tousled seafaring scenes are meant to highlight his carefree status as a talented high school senior with a love for sailing bound for Stanford and likely success. But Charlies life is derailed after he nearly dies in a terrible car accident that kills his 11-year-old brother Sam (Charlie Tahan). (This is no spoiler; the trailers and commercials have already given it away.) Like many actors before him Efron is in some ways hamstrung by his good looks and easy charisma. Meaty complex parts arent generally offered to young handsome actors especially if they got their start as Disney stars. But based on his performance in last years Me and Orson Welles his breezy comic timing in 17 Again and his heartfelt efforts here Efron seems poised to mature into a substantive actor. Five years after the accident Charlie is like the walking wounded mucking around in a dead-end job as a cemetery caretaker. At the graveyard he has an annoyingly wacky British gravedigging pal Alistair (Augustus Prew) whose presence is contrived and tonally wrong as if he wandered in from the comedy at the arthouse down the street. Charlie survived the car accident for a reason he is told by the religious paramedic who saved him (Ray Liotta). He shrugs it off. But soon he is compelled to choose between clinging to the past and loosening his bond with his beloved brother and embarking on a relationship with fellow sailor Tess (Amanda Crew). Some of Efrons best scenes are with Tahan. Theres an appealing gentle chemistry between the two. Efron is in almost every frame and has a natural physical ease on camera. Hes convincing enough but the sentimental story suffers from ladling on lightweight spirituality and piling on supernatural twists that dont follow their own internal logic. The movie tries to capture the crushing weight of loss but between the insipid pop tunes and the repetitive shots cutting away to a lighthouse on a scenic outcropping it feels more like a film version of a condolence card. Posted Updated E-mail | Print | To report corrections and clarifications contact Standards Editor Brent Jones. For publication consideration in the newspaper send comments to lettersusatoday.com. Include name phone number city and state for verification. To view our corrections go to corrections.usatoday.com. Guidelines You share in the USA TODAY community so please keep your comments smart and civil. Dont attack other readers personally and keep your language decent. Use the ""Report Abuse"" button to make a difference. Read more. Newspaper Home Delivery - Subscribe Today Home  News  Travel  Money  Sports  Life  Tech  Weather About USATODAY.com Site Map | FAQ | Contact Us | Jobs with Us | Terms of Service Privacy Policy/Your California Privacy Right | Advertise | Press Room | Developer | Media Lounge | Reprints and Permissions News Your Way Mobile News | Email News | Add USATODAY.com RSS feeds | Twitter | Podcasts | Widgets Partners USA WEEKEND | Sports Weekly | Education | Space.com | Travel Tips Copyright 2011 USA TODAY a division of Gannett Co. Inc.",http://www.usatoday.com/life/movies/reviews/2010-07-30-stcloud30_ST_N.htm,200,charliest.cloud8,charliest.cloud,usatoday
"Showtimes reviews trailers news and more - MSN Movies Home News Weather Entertainment Sports Money More gt; Lifestyle Health amp; Fitness Food amp; Drink Travel Autos Video entertainment You are using an older browser version. Please use a supported version for the best MSN experience. Kristen Stewart Finally Confirms Alicia Cargile is Her Girlfriend Im Just Really in Love 16 things to know about the Bad Moms star John Tucker Must Die Where Are They Now? Depps legal team sets date to depose Heard in court Matt Damon recalls losing Dead Poets Society role In Theaters Jason Bourne Bad Moms Nerve Star Trek Beyond Ice Age Collision Course AdChoices Movie News Lindsay Lohan not pregnant despite her dads claims friend says Constance Wu slams casting for The Great Wall"" Sony Deletes Ghostbusters Tweet Over Clinton Endorsement Criticism Will Technology Kill the Teen Movie? This Twilight child star is all grown up See her now From the Microsoft Store Sponsored | Microsoft Pre-order The Angry Birds Movie today Sponsored | Microsoft Get Katy Perrys new single Rise Sponsored | Microsoft Watch Season 5 of Homeland Sponsored | Microsoft Save 75 on the Microsoft Band 2 Featured Slideshows 15 ways Bad Moms is basically The Hangover but with moms Crazy Stupid Love Before they were stars 27 Great Revenge Movies 20 modern classic movies everyone needs to watch in their lifetime 17 Mistakes You Never Noticed in Big Thrillers Home News Weather Entertainment Sports Money Lifestyle Health amp; Fitness Food amp; Drink Travel Autos Video (c) 2016 Microsoft Privacy Legal About our Ads Feedback Help MSN Worldwide Newsletter MSN Movies",http://movies.msn.com/movies/movie-critic-reviews/charlie-st-cloud/,200,charliest.cloud9,charliest.cloud,msn
"Charlie St. Cloud movie review Zac Efron strips and sobs but never musters emotion |       NJ.com comments Charlie St. Cloud movie review Zac Efron strips and sobs but never musters emotion Print Stephen Whitty | ArtiSyndicate By Stephen Whitty | ArtiSyndicate The Star-Ledger Email the author | Follow on Twitter on July 30 2010 at 808 AM View/Post Comments Diyah Pera/Courtesy Universal Pictures/MCTZac Efron left and Charlie Tahan portray brothers in the tween melodrama ""Charlie St. Cloud."" Generally in a weepie its not a good sign if the people on screen are crying more than the audience is. So things do not seem to bode well for ""Charlie St. Cloud"" a new tween melodrama starring Zac Efron. In the course of little more than an hour-and-a-half the perpetually damp thespian weeps from his left eye then his right. He tears up manfully. He blubbers uncontrollably. He bathes his pretty face in a sheen of lachrymose moisturizer. While I sat there with cheeks so arid Omar Sharif could have led a caravan across them. Its not that I dont enjoy a good cry; its that the operative word is ""good."" And ""Charlie St. Cloud"" -- from its awful title to its annoyingly perfect photography -- is a schmaltzy sniffle at best. The story is based on a novel by Ben Sherwood a former television producer who seems to have read an awful lot of Nicholas Sparks novels. Like those popular books his contains a seaside setting young lovers a tragic loss and a heavy dose of everything-always-works-out-for-the-best philosophizing. Unlike Sparks though you never get the feeling that this author believes in any of it. Instead the story as adapted by several other hands (who made the characters younger) and directed by Burr Steers (who last made Efrons ""17 Again"") just feels like a clumsy bit of juvenile manipulation. Movie Review Charlie St. Cloud (PG-13) Universal (100 min.) Directed by Burr Steers. With Zac Efron Amanda Crew Ray Liotta Kim Basinger. Now playing in New Jersey. Ratings note The film contains brief violence and mild sensuality. Stephen Whittys review ONE AND A HALF STARS Sunlight slants through trees. A couple shares gentle kisses. Zac Efron takes his shirt off. Plaintive pop plays on the soundtrack. Adult characters hastily provide exposition. Zac Efron takes his shirt off. Falling stars streak across the sky. A dark storm brews. And yeah here come Zacs pecs again. The heart of the story is a deliberately unscary ghost story with Efron unable -- literally -- to let go of his dead kid brother. (He meets the spirit every day at sunset to play catch in the graveyard.) Theres also a rich girl and some mild town-and-gown class conflict. But none of it really develops into anything no matter how much Efron turns on the waterworks or pares down his wardrobe. Amanda Crew is stubbornly unappealing as his love interest and Augustus Prew -- isnt that a Lemony Snicket villain? -- is miserably unfunny as the supposed comic relief. Better is Charlie Tahan as the departed Sam. Hes an easy unaffected young actor and a steady presence throughout the film -- unlike Kim Basinger who after two quick scenes is suddenly reduced to a voice on a long-distance phone call or Ray Liotta who is given the thankless job of stating (and re-stating) the films theme. Which is what exactly? Life is for the living? Death is for the dead? Tears are for peeling onions? I was never sure. (Particularly since the one fact the movie manages to firmly establish about Charlie -- he sees dead people -- it ends up sort of throwing out the window.) But hey if you want to see Zac Efron cry ""Charlie St. Cloud"" awaits. And if you want to see me cry just make me watch it again. Stephen Whitty (212) 790-4435 or swhittystarledger.com. View/Post Comments Related Stories Listen to the latest episode of our TV podcast Subscribe on iTunes Subscribe on Stitcher Most Read Find Local Real Estate Jobs Autos Businesses Find a job Buy or sell a car Find a place to live See whats for sale Find a business View obituaries Get Your Weekly Entertainment Guide TV recaps movie and music reviews local dining guides and the latest in Atlantic City entertainment news delivered to your inbox Leave this field blank optional Check here if you do not want to receive additional email offers and information. See our privacy policy Thank you for your subscription To view and subscribe to any of our other newsletters please click here. Entertainment Essentials Search music dining more event listings Inside Jersey N.J.s lifestyle magazine OMJ.com N.J. celebrity and style Entertainment Listings Events Music Food Active Discussions nj.com About Us About NJ.com Advertise with us Contact Us Jobs at NJ Advance Media Newsletters RSS feeds More on NJ.com Interact Weather Blogs Premium Blogs Site map Claim your freebusiness listing Search Place an ad Sell your car Sell/rent your home Post a job Post a free classified ad Apartments amp; rentals NJ.com Sections N.J. News Local News N.J. Politics Sports High School Sports Entertainment Food amp; Recipes Living Business Opinion Inside Jersey Shore Obituaries Jobs Autos Real Estate Rentals Classifieds Shopping Good Deals Local Businesses Special Sections Contribute to NJ.com Submit your photos Submit your videos Forums Register for free with NJ.com Submit an event Follow Us Twitter | Facebook Google+ | foursquare Newspaper stories and photos The Star-Ledger | Subscribe The Times of Trenton | Subscribe The Jersey Journal | Subscribe South Jersey Times | Subscribe Hunterdon County Democrat | Subscribe Star Gazette | Subscribe The Messenger-Gazette The Warren Reporter Independent Press Suburban News Learn more about our newspapers Mobile iPhone Android apps | Tablet apps Registration on or use of this site constitutes acceptance of our User Agreement and Privacy Policy (c) 2015 New Jersey On-Line LLC. All rights reserved (About Us).The material on this site may not be reproduced distributed transmitted cached or otherwise used except with the prior written permission of New Jersey On-Line LLC. Community Rules apply to all content you upload or otherwise submit to this site. Contact interactivity management. Ad Choices",http://www.nj.com/entertainment/movies/index.ssf/2010/07/charlie_st_cloud_movie_review_zac_efron_strips_and_sobs_but_never_musters_emotion.html,200,charliest.cloud10,charliest.cloud,nj
"Charlie St. Cloud | Reelviews Movie Reviews Out now Vicki Lewis Vicki Lewis Birdman Leo Brower Home Video Views ReelThoughts Currently in Cinema ReelViews Library Login Specials My Books Array ( [page] =gt; reelviews [view] =gt; charlie-st-cloud ) Charlie St. Cloud (United States 2010) July 29 2010 A movie review by James Berardinelli Im not a Zac Efron hater; I thought he did a solid job in Me and Orson Welles a film that showcased his ability to act when given the opportunity. However in Charlie St. Cloud (as in his previous outing for director Burr Steers 17 Again) Zefron is used exclusively as a chick magnet. Or to put it another way his name on the marquee is designed to fill theater seats with young girls. He does his part looking soulful as he gazes into the distance before removing his shirt and doing something manly. One wonders whether Efron has been studying at the Taylor Lautner School of Acting. Its not much of a spoiler to reveal that Charlie St. Cloud involves the supernatural. Whether the Dead People represent ghosts figments of Charlies imagination or psychic projections is never made clear but I dont think were supposed to think deeply about such things. A central problem with the premise is the lack of ""rules."" Ghost stories and other tales of the supernatural need to show consistency otherwise anything goes. Even though Charlie St. Cloud is based on a novel by Ben Sherwood it provides the impression that the filmmakers are making things up as they go along and a lot of those things dont make sense. But Steers and his screenwriters arent aiming for logic; theyre leading up to the next opportunity for Efron to remove his shirt. The narrative which clumsily incorporates elements of Ghost The Sixth Sense and Field of Dreams into a total mess takes place in the Pacific Northwest (it was actually filmed in British Columbia but I believe the intended setting is the United States). Charlie (Efron) having graduated from high school is looking forward to his final summer at home before heading off to college on a sailing scholarship. He and his younger brother Sam (Charlie Tahan) have a good relationship although Charlie sometimes chafes at having to babysit for the 11-year old. Then the unthinkable happens. Charlie and Sam are involved in a brutal car accident that kills them both. A paramedic (Ray Liotta) is able to revive Charlie but Sam is D.O.A. Charlie however having been to the other side is able to see dead people including his brother with whom he plays catch in the woods every day for five years. Charlie becomes something of a recluse. His mother (Kim Basinger) moves away and Charlie begins working as the caretaker at the cemetery where his brother is buried. His daily highlight remains the hour every evening that he spends in Sams company at least until he starts flirting with Tess (Amanda Crew) a local girl who is making plans to sail her boat around the world. The screenplay for Charlie St. Cloud is so full of cheats and inconsistencies that they pour from the screen. One doesnt need 3-D for this sort of in-your-face exercise. I recently praised Chris Nolans Inception for demanding viewer concentration. Charlie St. Cloud requires the opposite. The less attentive one is the more likely the movie will pay dividends. The ""twist"" is transparent unless you spend half the movie in the lavatory. In that case it may be surprising (although it still doesnt make sense and no attempt is made to explain things). However although the idea of spending a portion of Charlie St. Clouds running time reading the graffiti in a rest room has its appeal I wouldnt recommend it. You might miss one of those occasions when Zac Efron doffs his shirt. Despite spending more of the movie posing than acting Efron generates a little chemistry with his female co-star Amanda Crew. Crews character Tess is infinitely more interesting than Charlie but since she lacks box office drawing power she ends up doing the sorts of things that female co-starts do in sappy romantic movies. She does not however spend time staring soulfully into space and she most definitely does not take off her shirt and strut around topless. Charlie Tahan the young actor playing Sam is nails-on-the-blackboard awful. The worst part is even when his character is dead he continues to annoy. Kim Basinger and Ray Liotta have small parts. The most interesting thing about Liotta is that even though hes not playing a lunatic bad guy you keep waiting for him to start frothing at the mouth. Basinger looks bedraggled and bored. Charlie St. Cloud will almost certainly appeal to its core demographic and absolutely no one else. Its a little like Sex and the City 2 in that regard. The Efron fans in the audience cooed appreciatively every time he stared soulfully into the distance and shrieked orgasmically every time he removed his shirt. That I suppose is how it should be. I just wish I hadnt wasted 105 minutes of my time to confirm it. Charlie St. Cloud (United States 2010) Director Burr Steers Cast Zac Efron Charlie Tahan Amanda Crew Donal Logue Kim Basinger Ray Liotta Screenplay Craig Pearce and Lewis Colick based on The Death and Life of Charlie St. Cloud by Ben Sherwood Cinematography Enrique Chediak Music Rolfe Kent U.S. Distributor Universal Pictures Run Time 145 U.S. Release Date 2010-07-30 MPAA Rating ""PG-13"" (Profanity Sexual Content) Genre DRAMA Subtitles none Theatrical Aspect Ratio 2.351 Comments Add Comment Three...better movies of this genre Cider House Rules The (1999) Maria Full of Grace (2004) Lilya 4-Ever (2003) worse movies of this genre Hole in My Heart A (2005) Neon Demon The (2016) Showgirls (1995) Three...better movies of Zac Efron Hairspray (2007) Me and Orson Welles (2009) Lorax The (2012) worse movies of Zac Efron Neighbors 2 Sorority Rising (2016) 17 Again (2009) Mike and Dave Need Wedding Dates (2016) Three...better movies of Charlie Tahan (There are no more better movies of Charlie Tahan) worse movies of Charlie Tahan Nights in Rodanthe (2008) Other Woman The (2011) (There are no more worst movies of Charlie Tahan) Three...better movies of Amanda Crew Sex Drive (2008) (There are no more better movies of Amanda Crew) worse movies of Amanda Crew Haunting in Connecticut The (2009) Final Destination 3 (2006) (There are no more worst movies of Amanda Crew) ReelViews Library Currently in Cinema Writings Fictional Writings ReelThoughts Specials About Privacy Policy Terms and Conditions Contact Website credits",http://www.reelviews.net/php_review_template.php?identifier=2135,200,charliest.cloud11,charliest.cloud,reelviews
"Gentle ghost story about living again Next up in Carrie Rickey A maestro and subtle slapstick News Sports EAGLES CAMP Business Health Entertainment Food Opinion Obituaries Search icon | SectionsClose Search Search Search Search icon News Breaking DNC Pennsylvania New Jersey Politics Education Sports Eagles Phillies Flyers Sixers Union College High School Entertainment Celebs amp; Gossip The Arts Things to Do Business Cars Jobs Pharma Philly Deals Real Estate Small Business The Street Health Kids Health Running Nutrition Sports Medicine Food Clean Plates Craig LaBan The Insider Opinion Blogs Columnists Think Tank Lifestyle Home amp; Design Sex amp; Dating Style Travel Marketplace Find a Home Job Listings Print Offers Online All Classifieds People Births Celebrations Engagements Obituaries Death Notices Your Day Event Calendar Horoscope Lottery Weather Newsletters Advertise Contact Us Permissions Reprints Powered By Inquirer logo Subscribe Daily News logo Subscribe entertainment -- Carrie Rickey Gentle ghost story about living again Updated July 29 2010 -- 241 PM EDT Facebook icon Share Twitter icon Tweet Tumblr icon Tumblr Mail icon Email Reprints amp; Permissions REPRINTS Popular Stories Bradley Cooper attends DNC upsets some conservative American Sniper fans Jul 29 - 641 AM Pennsylvanias new car seat law goes into effect in August Jul 28 - 911 PM Zac Efron plays a subdued and earnest Charlie St. Cloud haunted by tragedy. by Carrie Rickey Film Critic Twitter icon carrierickey Close icon Carrie Rickey Film Critic Mail icon carriedrickeygmail.com Twitter icon carrierickey Charlie St. Cloud an enjoyably moist ghost story follows a high school hotshot haunted by an error of judgment that casts a long gloomy shadow on a once-bright future. More about Charlie St. Cloud >> Charlie (Zac Efron) a townie in a New England hamlet (in Ben Sherwoods novel on which the film is based it was the seaside village of Marblehead Mass.) is a championship sailor. His kid brother Sam (Charlie Tahan) serves as his first mate. Despite the brothers skills the rich boys look down on the St. Clouds. Their dad has disappeared; their mom (Kim Basinger) is a nurse who works double shifts to support them. The girls however look at them with starry eyes. So too does cinematographer Enrique Chediak who for reasons pertaining to the plot shoots them in the glowing magic-time of dusk. After tragedy strikes Charlie is adrift in his own private Bermuda Triangle. In this gentle fable Charlie moves from living among the dead to living with the living. Director Burr Steers who helmed (no pun intended) Efron in the charming body-switch comedy 17 Again shrouds the film with a guilt-edged melancholy that evokes the atmosphere of Ghost and The Sixth Sense. How without dishonoring the departed does Charlie move past grief to acceptance? Initially putting the high-wattage Efron on a dimmer seems like a tragic waste of natural resources comparable to brown contact lenses on Paul Newmans baby blues. But Steers takes his time and it pays off in Efrons subdued performance earnest and yearning. (The same cannot be said of the low-angle shots of the backlit Efron heroically framed against the horizon more like a generic GQ model than a specific character.) Steers film which advocates grieving and growing rather than remaining stuck in mourning limbo is an unapologetically schmaltzy affair enormously effective on heartstrings and tear ducts. The byplay between Efron and newcomer Tahan as his brother has a warmth and intimacy that establish the films tone. The performances carry the film. As boozy Alistair Charlies outspoken coworker at a cemetery Augustus Prew supplies the comic relief. In the equivalent of Whoopi Goldbergs role in Ghost - or Thomas Lennons in 17 Again - Prew nails every punchline. Similarly Amanda Crew as Tess a competitive sailor preparing an around-the-world voyage is touching as Charlies female counterpart. While the vealcake shots of the shirtless Efron do not advance the story for the most part the filmmakers explore the faces of the young actors searching as they are for answers to the question of why they were put on this earth. Contact movie critic Carrie Rickey at 215-854-5402 or crickeyphillynews.com. Read her blog ""Flickgrrl"" at http//www.philly.com/philly/blogs/flickgrrl/. Published July 29 2010 -- 403 PM EDT The Philadelphia Inquirer Continue Reading More in entertainment Celebrities amp; Gossip > Clintons party at Kimmel Center post-acceptance speech Entertainment > Longwood Gardens beloved trippy Nightscape returns Things to Do Philly > East Passyunk Car Show and 11 other ways to recover from the DNC Philly walked away with a win says ex-DNC head Howard Dean Amy Schumer is coming to Philly for book signing Qamp;A with Jay McInerney New novel Bright future Upper Darby Summer Stage returns to the 20s in ""Nice Work If You Can Get It"" An era ends Last Center City store with classical recordings to close Yes Allen Iverson has a sock line 5 must-do events in Philly for August DNC on TV Clintons big moment and what networks couldve done better. Philly.com logo is powered by Inquirer logo Digital Edition Subscribe Subscriber Services Daily News logo Digital Edition Subscribe Subscriber Services Twitter icon phillydotcom Facebook icon /phillydotcom News amp; Info News Sports Entertainment Business Health Food Lifestyle Opinion Event Calendar Marketplace Deals Find a Home Job Listings Print Offers All Classifieds About us About Philly.com Advertise Contact Us Licensing amp; Permissions Photo Reprints Newspapers In Education Career Opportunities Internships   Mobile Apps Email Notifications Morning headlines Sports Weekend planner Dining In and Out Business Health Lifestyle PMN Events Show all V Show some V (c) Copyright 2016 Philadelphia Media Network (Digital) LLC Terms of Use amp; Privacy Policy",http://www.philly.com/inquirer/columnists/carrie_rickey/20100730_Gentle_ghost_story_about_living_again.html,200,charliest.cloud12,charliest.cloud,philly
