review,link,status_code,id,movie_key,critic
Charlie St. Cloud (PG-13) | miami.com Home Nightlife Restaurants Hotels See amp; Do Movies Shopping Events Visual Arts Guides Espanol Movies Charlie St. Cloud (PG-13) Its more of a demo reel for Zac Efron than a movie. Charlie Tahan and Zac Efron in the romantic drama Charlie St. Cloud. Diyah Pera/Universal Pictures Share Print Save to your profile By Rene Rodriguez The Miami Herald7/28/2010 Editor rating 2 Like the child protagonist of an earlier highly acclaimed movie the eponymous hero of Charlie St. Cloud sees dead people -- or at least in his case dead people he once knew. For example he has a long conversation with the ghost of a high-school buddy who enrolled in the military after graduation and was killed in action overseas. More important every day at sunset Charlie (Zac Efron) meets up with his dead little brother Sam (Charlie Tahan) in the woods near the cemetery to chat and throw a baseball around. Charlie has been doing this for five years. An expert sailor he passed up a scholarship to Stanford in order to keep his promise to Sam who was killed in a car accident. Charlie was driving. Based on a novel by Ben Sherwood and constructed as a showcase for Efrons dramatic talents the movie is a young mans journey to overcome the guilt that has paralyzed his life. Charlie is so obsessed with making sure he shows up to meet with Sam that he organizes every day around the designated time letting the rest of the world go on without him. Hes reluctant to pursue a relationship with the beautiful Tess (Amanda Crew) who is also an avid boater. His single mother (Kim Basinger in a cameo) has moved away apparently unable to shake her son out of his self-torturing state. Even the paramedic (Ray Liotta) who resuscitated Charlie after the accident and bumps into him years later encourages him to shake off the doldrums because theres probably a good reason why he survived the crash. After many scenes of crying and emoting by Efron who is shot by director Burr Steers (Igby Goes Down) the way Hitchcock shot Grace Kelly -- glamorously and adoringly -- a major (although illogical) plot twist arrives that gives the film a much-needed jolt. But by then the picture is beyond rescue. Efron is clearly talented and he can shed a single tear on cue in the same uncanny manner Demi Moore did in Ghost. But Charlie St. Cloud is primarily a vehicle to prove the actor can do more than dance and sing. Its more of a demo reel for Efron than a movie. His predominant fan base though wont mind a bit. Cast Zac Efron Charlie Tahan Amanda Crew Augustus Prew Donal Logue Ray Liotta Kim Basinger. Director Burr Steers. Screenwriters Craig Pearce Lewis Colick. Based on the novel ``The Death and Life of Charlie St. Cloud by Ben Sherwood. Producers Michael Fottrell Marc Platt. A Universal Pictures release. Running time 97 minutes. Mild vulgar language brief sexual situations adult themes. Related Links Trailer and movie times Speak Up Movies Review Jason Bourne revitalizes the aging franchise (PG-13) 3 Review Cafe Society is a sumptuous exploration of love and regret (PG-13) 3 Review Captain Fantastic rewrites the book on raising a family (R) 3 Movies5 Movies Worth Seeing and 3 to Avoid During Memorial Day Weekend Letting the good times roll in Everybody Wants Some (R) Hank Williams biopic I Saw The Light (R) falls flat What if the 2016 Oscar-nominated movies took place in Miami? Father doesnt always know best in The Clan (R) Rock the Kasbah (R) Pan (PG) He Named Me Malala (PG-13) Freeheld (PG-13) 99 Homes (R) See more in Movies Advanced Search Find everything youll need for your trip Hotels | Attractions | Getting Around FlightHotelCarPackagesCruiseActivities What type of Package do you want? Flight and hotelFlight hotel and carHotel and carFlight and car Departing from Depart Morn.Noon.Eve. Going to Return Morn.Noon.Eve. Adults 01234 Seniors 01234 Children 01234 Search for packages More Package search options Going to Arrive 12 AM1 AM2 AM3 AM4 AM5 AM6 AM7 AM8 AM9 AM10 AM11 AM12 noon1 PM2 PM3 PM4 PM5 PM6 PM7 PM8 PM9 PM10 PM11 PM Return 12 AM1 AM2 AM3 AM4 AM5 AM6 AM7 AM8 AM9 AM10 AM11 AM12 noon1 PM2 PM3 PM4 PM5 PM6 PM7 PM8 PM9 PM10 PM11 PM Adults 01234 Seniors 01234 Children 01234 Search for packages More Package search options Departing from Depart Morn.Noon.Eve. Going to Return Morn.Noon.Eve. Adults 01234 Seniors 01234 Children 01234 Search for packages More Package search options Search for hotels in Check-in date Check-out date Rooms 123 Room 1 Adults 1234 Children 01234 Room 2 Adults 1234 Children 01234 Room 3 Adults 1234 Children 01234 Search for hotels More Hotel search options Departing from Depart 12 AM1 AM2 AM3 AM4 AM5 AM6 AM7 AM8 AM9 AM10 AM11 AM12 noon1 PM2 PM3 PM4 PM5 PM6 PM7 PM8 PM9 PM10 PM11 PM Going to Return 12 AM1 AM2 AM3 AM4 AM5 AM6 AM7 AM8 AM9 AM10 AM11 AM12 noon1 PM2 PM3 PM4 PM5 PM6 PM7 PM8 PM9 PM10 PM11 PM Adults 1234 Seniors 01234 Children 01234 More Flight search options Search for flights Pick-up location Pick-up 12 AM1 AM2 AM3 AM4 AM5 AM6 AM7 AM8 AM9 AM10 AM11 AM12 noon1 PM2 PM3 PM4 PM5 PM6 PM7 PM8 PM9 PM10 PM11 PM Drop-off 12 AM1 AM2 AM3 AM4 AM5 AM6 AM7 AM8 AM9 AM10 AM11 AM12 noon1 PM2 PM3 PM4 PM5 PM6 PM7 PM8 PM9 PM10 PM11 PM Car class No PreferenceEconomyCompactMidsizeStandardFull SizePremiumLuxuryConvertibleMini-vanSport Utility Vehicle Search for cars More Car search options Select a top destination ----------------------------AfricaAlaskaAsiaBahamasBermudaCanada - New EnglandCaribbeanCaribbean - EasternCaribbean - SouthernCaribbean - WesternEuropeHawaiiMediterraneanMediterranean - EasternMediterranean - WesternMexicoNorthern Europenowhere (no port stops)Panama CanalSouth AmericaSouth PacificTransatlanticTranspacificUnited States amp; CanadaUS Pacific CoastWorld Departing in Cruise length Show All1-2 nights3-5 nights6-9 nights10-14 nights15+ nights Search for cruises More Cruise search options Destination Start date End date Search for activities More Activities search options Sign up for our weekend guide Make your plans with our Weekend Concierge email sent to your inbox every Wednesday. Follow us Follow Miamicom Nightlife Band of the Hour Clink Club Scout Latin Nightclubs Velvet Underground Weekend Ticket Nightclub Photo Galleries Restaurants Miami Waterfront Restaurants First Look The Big Review Dining Adviser Hotels Cheap Hotel Deals Hip Miami Hotels Miami Hotel Lounges Hotel Hopping The Suite Life See amp; Do Miami Golf Courses Miami Culture Events Miami Museums Miami Animal Attractions Miami Theatre Center Stage Miami Outdoor Events Movies Reviews Theaters Showtimes Gay Gay clubs Gay photo galleries Shopping Spa Fancy Boutique of the Week Sawgrass Mills Guide Kendall Shopping Guide Lincoln Road Shopping Guide Aventura Mall Shopping Guide Adults Miami Strip Club Guide Broward Strip Club Guide Adult Toy Store Guide Featured Dancer Risque Business Toy Joy Espanol Compras Que Hacer Restaurantes Vida Nocturna Hoteles Connect with us Contact us | Like us on facebook | Follow us on twitter | Sign up for our newsletter | RSS Correct us Get listed | Report an error About us | Privacy Policy | Terms of service | About our ads | Sitemap (c) 2016 Miami.com. All rights reserved. Miami.com logos graphics designs page headers icons and buttons are the property of the Miami Herald Media Co.,http://www.miami.com/charlie-st-cloud-pg-13-article,200,charliest.cloud0,charliest.cloud,miami
The Death and Life of Charlie St Cloud (2010) directed by Burr Steers | Film review Go to the content Go to the footer Time Out London London Popular cities London New York Paris Chicago Los Angeles Browse all cities Time Out London Close London Change city London Popular cities London New York Paris Chicago Los Angeles Browse all cities Tickets Offers Things to Do Restaurants Bars amp; Pubs Film Theatre Art Music Attractions Blog Theatre Tickets Shopping Offer of the Day Time Out Card Time Out Escapes Time Out Live Hotels Nightlife Music festivals Events amp; Festivals Kids Museums Clubs Comedy Food amp; Drink Classical Music amp; Opera Dance LGBT City Guide Area Guides Property Competitions Dating Close My Time Out Things I love My lists My Profile My Account Sign out Sign in Create account Sign in With your social account Or with your email Email Password Remember me Forgotten your password? Sign in You can create a Time Out account in two ways... With a few clicks using your favourite social network Or by entering your details below Email First Name Last Name Create password Repeat new password I accept Time Outs terms of use including opt-in to newsletters. Create account Welcome  You have successfully connected your account to Time Out. You may sign in with this account in future. Please confirm your account details Email First Name Last Name I accept Time Outs terms of use including opt-in to newsletters. Sign up My Account Sign in or Create account Search Tickets Offers Things to Do Restaurants Bars amp; Pubs Film Theatre Art Music Attractions Blog Theatre Tickets Shopping Offer of the Day Time Out Card Time Out Escapes Time Out Live Hotels Nightlife Music festivals Events amp; Festivals Kids Museums Clubs Comedy Food amp; Drink Classical Music amp; Opera Dance LGBT City Guide Area Guides Property Competitions Dating More Search The Death and Life of Charlie St Cloud Film  Drama 2 out of 5 stars 3 out of 5 stars (5 user reviews) 0 Love It Save it 5 Add review 0 Love It Save it Time Out says 2 out of 5 stars Details Users say (5) 3 out of 5 stars Time Out says 2 out of 5 stars Tear-jerkers based on novels are standard fare for rising heartthrobs so this Ben Sherwood adaptation is a logical move for High School Musical alumnus Zac Efron - and a logical marketing decision considering the millions of young women who follow his every move.But theres something a little too clean cut about Efron for the role of Charlie St Cloud an ambitious sailor and scholar who turns into a recluse after the death of his younger brother Sam (Charlie Tahan). The local fishing-village community think Charlies gone mad for five years he works in a graveyard and plays baseball with his dead brother in the woods every night. But we know hes still heartthrob Zac Efron - hes still shaving every day for starters.That said this is a fantasy and the suspension of disbelief is key as the film moves further into supernatural territory (lets just say itll please fans of Ghost). But as the drama increases so do the clumsy flashbacks and corny lines this relies on cheap tricks to force tears even if those tricks work. As for the supporting cast Tahan is suitably adorable while Amanda Crew will divide audiences as love interest Tess. At least her character has her own mind and career shes about to sail around the world solo. Theres also an amusing turn from young Brit Augustus Prew who brings a welcome streak of irreverence as Charlies party-boy colleague. Cynics need not apply. By Anna Smith Posted Tuesday October 5 2010 Details Release details Rated 12A Release date Friday October 8 2010 Duration 99 mins Cast and crew Director Burr Steers Cast Zac EfronRay LiottaKim Basinger Users say (5) 3 out of 5 stars Average User Rating2.8 / 5Rating Breakdown5 star04 star23 star12 star11 star0LiveReviews|51 person listeningSign inWrite reviewMost helpfulMost helpfulHighest ratingLowest ratingNewestOldestLoadingundefinedNew CommentsRefreshMay 7 2013bethan wilson Featuredi think this is a good and emotional film that you can laugh and cry during its one of those films that you think you have all figured out you know...... the hot guy the girl hell fall in love with and the all of the bumps along the way but it actually surprised me with a twist near the end that afterwards you sort of feel like you should have known was coming. it makes the film a lot more interesting and less predictable. zac efron gives a intense emotional performance that is very believable as does charlie tahan who plays sam this is definately a film worth watching. if you dont get even a little tear in your eye there is something wrong with you i love this filmFlagShareHelpful?Yes|NoReplyJan 6 2011sky316Featuredi will admit that this isnt the worst review of this film but its still completely untrue Zac Efron plays the part down to a tee taking us with him on his emotional journey. i agree with what Evie said if you don;t cry there is something wrong with youFlagShareHelpful?Yes|NoReplyOct 16 2010scrumpyjackFeaturedI dont know about all that paul.....I just enjoyed it 6/10FlagShareHelpful?Yes|NoReplyOct 9 2010PaulFeaturedA competent enough film that goes through the motions adequately for the Zac market. What irritates me is that American continues to feed this quasi-religious life after death everything happens for a reason pulp to young people. Why we cant have secular drama without resorting to follow the light cliches I dont know.FlagShareHelpful?Yes|NoReplyOct 9 2010EvieFeaturedYou dont have to be a teenage girl to enjoy this. Like 17 Again this has a broader family appeal. I doubt if anyone who disapproves of Zac Efron has ever seen one of his films. His oddly old school yet modern screen charisma is undeniable and he handles the emotionally dramatic storyline as ably as the fancy sailing scenes. True he looks way to clean cut for his character and Amanda Crew is about as bland as you get but its better than the mushy TV-movie I was expecting from the trailer. If you dont cry theres something possibly wrong with you.FlagShareHelpful?Yes|NoReplyShow More Share Tweet 0 Shares Top About us Work for Time Out Privacy policy Cookie Policy Website terms of use Contact us Time Out for business Get listed Claim your listing Premium Profiles Advertising Time Out products Time Out Card Mobile apps Time Out Shop Time Out Guides Time Out Travel Time Out Offers Time Out Worldwide Time Out magazine Where to get Time Out magazine Subscribe to Time Out magazine Manage my subscription Follow us Facebook Twitter Youtube Instagram Pinterest Spotify Time Out London Site map },http://www.timeout.com/film/reviews/88784/the-death-and-life-of-charlie-st-cloud.html,200,charliest.cloud1,charliest.cloud,timeout
"Charlie St. Cloud When Zac climbs to the serious rung tears are sure to follow - The Globe and Mail Jump to main navigationJump to main content News Search News by eluta.ca Search Jobs at eluta.ca Jobs Login Register 18 Toronto Subscribe Help AdChoices Home News Opinion Business Investing Sports Life Arts Tech Drive Real Estate Film TV amp; Media Books Music Theatre Visual Arts Awards Video Film Reviews Home>> Arts>> Film Charlie Tahan left and Zac Efron in Charlie St. Cloud. (Diyah Pera) Charlie Tahan left and Zac Efron in Charlie St. Cloud.(Diyah Pera) Movie Review Charlie St. Cloud When Zac climbs to the serious rung tears are sure to follow Add to ... Liam Lacey The Globe and Mail Published Friday Jul. 30 2010 1200AM EDT Last updated Wednesday Jan. 29 2014 356PM EST Comments Print /License AA Country USA Language English Charlie St. CloudDirected by Burr SteersWritten by Craig Pearce and Lewis ColickStarring Zac Efron Amanda Crew and Charlie TahanClassification PGThe new Zac Efron movie Charlie St. Cloud is a packaged teen weepie that often feels stranger than it intends to be. Efron the Disney heartthrob with the cerulean irises and artfully messy hair has been candid in characterizing the film as a ladder rung in his career between High School Musical stardom and more grown-up serious roles. What ""serious"" means for young actors as we know from Miley Cyruss The Last Song is maudlin and Charlie St. Cloud is no exception. In early scenes Efrons Charlie is a cocky high-school sailing prodigy who has a hard-working mom (Kim Basinger) and pesky 11-year-old brother Sam (Charlie Tahan). On his graduation night Charlie gets into a car crash that kills Sam sending Charlie into a prolonged funk.He puts off his Stanford scholarship and takes a job as a caretaker at the cemetery where Sam is buried. Every day after listening to his sardonic English buddy (Augustus Prew) and wiping bird droppings off the gravestones he heads out at sunset to practise baseball with his dead sibling.Charlie St. Cloud was adapted from a 2005 novel by former Good Morning America executive producer Ben Sherwood. The New Age fable about grief and letting go has been transferred from its original Massachusetts setting to the Pacific Northwest (played by British Columbia) a realm of forest and mountains and teen angst already well-known to Twilight fans.The director is Burr Steers who directed Efron before in last years age-switch comedy 17 Again as well as the superior 2002 black comedy Igby Goes Down. With Charlie St. Cloud its as if Steers has put a muzzle on his sardonic impulses. Efron meanwhile poses and wisecracks competently but is unpersuasive as a brooder. At best he stares blankly off in the distance and you forget about the story and wonder what kind of shade those eyes are. When Charlie starts hitting the Jack Daniels you cant help feeling the bottle should have a rubber nipple on it.On the subject of nipples we see Efrons torso as often as his tears. Theres nothing subtle in the way the emotional strings are yanked here Romantic kisses appear to be set against sunsets of oil painted on velvet; the piano tinkles and orchestra swells to augment every emotional peak. At its most mawkish moment Ray Liotta pops up as the emergency medic who brought Charlie back to life. Now dying of cancer he meets the young man again to tell him that God brought him back to life for a reason.God (who occasionally seems to stare down on the forest glades from high aerial shots) decides to reveal his purpose by introducing the comely Tess (Canadian actress Amanda Crew) Charlies former sailing rival and grown-up hottie. First though their schedules conflict. Shes about to embark on a six-month around-the-world sailing trip and hes got his nightly baseball practice with his dead brother to attend to.All this sets us up for a ""twist"" ending but if you dont predict it a half-hour before its revelation you surely must have nodded off during baseball practice. Report Typo/Error Follow Liam Lacey on Twitter liamlacey Comments Print /License AA In the know Report on Business In tough job market highly educated feel the squeeze Obituary Robert-Ralph Carmichael created the art on Canadas loonie CARRICK TALKS MONEY Whats the case for Americans living in Canada to renounce their U.S. citizenship? Report on Pokemon Canadians love it a Pokemaster is crowned Werner Herzog is puzzled Life How do I keep peace in the family when money comes up? The Globe Recommends {{title}} .preloader{displaynone;} Most popular videos >> News Bad boy Justin beaver terrorizes B.C. town News Trump Clinton should have congratulated me for making history Life Make this juicy and delicious tomato salad tonight News No Donald you dont Watch the highlights from Hillary Clintons convention speech News I will gladly lend you my copy Father of fallen Muslim soldier offers Trump his Constitution News Warning graphic content Toronto officers trial sees video of Sammy Yatim shooting Report on Business What age is a good retirement age? News He-said-she-said Contrasting Trump and Clintons convention speeches Report on Business Whats the case for Americans living in Canada to renounce their U.S. citizenship? Report on Business Analyst If Air Canada delivers the results the stock will look after itself News How a Dudes Club in Vancouver is helping homeless men feel human again News I know a con when I see one Bloomberg calls on DNC to unite in opposition to Trump <    > Highlights Report on Business B.C. credit union banks on a fun workplace Report on Business How academic research is subject to racism sexism More from The Globe and Mail Globe Investor This millennial wants to get his MBA but can he afford it? Life How to carb-load the smart way Most popular Forget Brexit This could be Europes biggest crisis yet Provincial free-trade deal clears the way for major changes to liquor laws Judge says RCMP manufactured B.C. terror plot overturns guilty verdict The mysterious case of Hunter Tootoos ban from the Liberal caucus July 30 Your daily horoscope More Top Stories British Columbia Liberal authorizations for Site C dam draw criticism Editorials The mysterious case of Hunter Tootoos ban from the Liberal caucus Football Glenn throws two TD passes Alouettes crush Riders Horoscopes July 30 Your daily horoscope Investment Ideas Tesla gets vote of confidence from a top investor Investment Ideas Alphabet and Amazon wind up stellar quarter for U.S. tech big five Video Trump Clinton should have congratulated me for making history Eye-candy experience at NY ice cream museum See inside Teslas new giant factory Canadian GDP reliant on real estate Photos Pope Francis visits Auschwitz death camp in silence Images from closing day at the Democratic National Convention X connect with us Products The Globe and Mail Newspaper Newspaper delivered to your doorstep. Subscribe to the newspaper Globe Unlimited Digital all access pass across devices. Subscribe to Globe Unlimited Globe2Go The digital replica of our newspaper. Subscribe to Globe2Go Globe Email Newsletters Get top Globe stories sent to your inbox. Subscribe to email newsletters Globe eBooks A collection of articles by the Globe. View the library Advertise with us GlobeLink.ca Your number one partner for reaching Canadas Influential Achievers. Or go directly to Newspaper Magazine Digital Globe Alliance extend your reach Globe Edge custom content Classifieds The Globe at your Workplace Globe Corporate Sales Globe Unlimited digital edition and Globe2Go e-paper group discounts available. Learn more Corporate financial data and content licensing for your organization. Learn more Or go directly to Report On Business Top 1000 DataStore essential business intelligence Our Company About us Work at The Globe Staff Secure Services Secure Drop Staff PGP Directory Customer Service Contact Us Customer Preference Center FAQs Customer Care website Digital subscription services Print subscription services Change your delivery address Vacation Stops Globe Recognition Special Globe events and offers for subscribers Mobile Apps News NEWS APP Available for download on the following devices iPhone iPad Android Blackberry Other Sections Appointments Art Store Births amp; Announcements Corrections Classifieds Classroom Edition Deaths Newspaper Ads Real Estate Special Reports Site Map Terms amp; Conditions Privacy Policy Disclaimer Accessibility Policy Community Guidelines Globe sustainability Editorial Code of Conduct Globe Arts is part of The Globe and Mails Globe Life Network Copyright 2016 The Globe and Mail Inc. All Rights Reserved. 444 Front St. W. Toronto ON Canada M5V 2S9 Phillip Crawley Publisher Add to Watchlist Add to Watchlist Weve run into a glitch. Please try again later. Weve run into a glitch. Please try again later. x Customize your reading font XS S M L XL The quick brown fox jumps over the lazy dog The quick brown fox jumps over the lazy dog The quick brown fox jumps over the lazy dog The quick brown fox jumps over the lazy dog The quick brown fox jumps over the lazy dog",http://www.theglobeandmail.com/news/arts/movies/charlie-st-cloud-when-zach-climbs-to-the-serious-rung-tears-are-sure-to-follow/article1656036/,200,charliest.cloud2,charliest.cloud,theglobeandmail
Detroit NewsSUBSCRIBE NOWFOR HOME DELIVERYHomeNewsSportsBusinessAutosLife + HomeEntertainmentOpinionPhoto + VideoMoreHomeNewsSportsBusinessAutosLife + HomeEntertainmentOpinionPhoto + VideoFireflyHi Already a subscriber?Log inSubscribe today for full access on your desktop tablet and mobile device.Subscribe NowAlready a print edition subscriber but dont have a login?Activate your digital access.Manage your account settings.My AccountView the E-NewspaperManage your NewslettersView your Insider deals and moreMember ID CardLog OutFollowSearchGet the newsLog In or Subscribe to skipAlready a subscriber?Log inSubscribe today for full access on your desktop tablet and mobile device.Subscribe NowAlready a subscriber but dont have a login?Activate your digital access.TOP TRENDINGxShareOOPSThis page exists to tell you that this page doesnt exist.RETURN TO HOMENewslettersAlerts amp; RSSContact UsNewsroomSubscribeHelpAppsHomeNewsDetroitWayneOaklandMacombFlint Water CrisisMichiganMore...Nation + WorldElectionsPoliticsSportsLionsTigersRed WingsPistonsBig TenMichiganMore...Michigan StateCollegeHigh SchoolBusinessTechnologyYour MoneyAutosAuto ShowFiat ChryslerFordForeignGeneral MotorsWoodward Dream CruiseLife + HomeHomestyleFood + DrinkHealthTravelAdviceEntertainmentTV + RadioMusicStageDining + BarsArts + FestivalsCelebritiesMore...BooksMoviesOpinionColumnistsBlogsEditorialsPhoto + VideoPhoto Store (c) 2016 The Detroit News a Digital First Media Newspaper. All rights reserved. ServicesAd ChoicesAdvertise With UsAdvertising Terms and ConditionseBookseEditionSign up for Home DeliveryManage AccountMember GuidePlace an Ad in ClassifiedsPlace a Death NoticeReport a Delivery IssuePhotoStorePrivacy Notice/Your California Privacy RightsTerms of ServiceOur PartnersCareerbuilder.comCars.comHomefinder.comFindNSave.comDetroit Newspapers in EducationRenvy.comMichigan.com,http://www.detnews.com/article/20100730/ENT02/7300323/1034/ENT02/Review--Zac-Efron-s--St.-Cloud--doesn-t-fly-sky-high,404,charliest.cloud3,charliest.cloud,detnews
