review,link,status_code,id,movie_key,critic
"Were sorry we cant find the page that youre looking for Go to the content Go to the footer Time Out New York New York Popular cities London New York Paris Chicago Los Angeles Browse all cities Time Out New York Close New York Change city New York Popular cities London New York Paris Chicago Los Angeles Browse all cities Tickets Events Things to Do Restaurants Bars Movies Theater Music Shopping Attractions Blog Art Travel Nightlife Events amp; Festivals Museums Kids Hotels Comedy Dance LGBT Sex amp; Dating Books City Guide Neighborhoods Promotions Close My Time Out Things I love My lists My Profile My Account Sign out Sign in Create account Sign in With your social account Or with your email Email Password Remember me Forgotten your password? Sign in You can create a Time Out account in two ways... With a few clicks using your favourite social network Or by entering your details below Email First Name Last Name Create password Repeat new password I accept Time Outs terms of use including opt-in to newsletters. Create account Welcome  You have successfully connected your account to Time Out. You may sign in with this account in future. Please confirm your account details Email First Name Last Name I accept Time Outs terms of use including opt-in to newsletters. Sign up My Account Sign in or Create account Search Tickets Events Things to Do Restaurants Bars Movies Theater Music Shopping Attractions Blog Art Travel Nightlife Events amp; Festivals Museums Kids Hotels Comedy Dance LGBT Sex amp; Dating Books City Guide Neighborhoods Promotions More Search Were sorry we cant find the page that youre looking for We have either moved the page or it no longer exists. To help you find your way here are some search results we think may be of interest. Movies Daddy Day Care While his wife Kim (Regina King) brings home the bacon unemployed Charlie (Eddie Murphy) spends his days caring for the couples young son. With help from a friend Phil (Jeff Garlin) Charlie decides to start a day care center. Enrollment quickly... Read more Movies Daddy Day Camp With Eddie Murphy apparently having finally found a role hes willing to turn down its up to Cuba Gooding Jr. to provide the star power for this sequel to Daddy Day Care. The two superdads (Gooding and Rae taking over for the originals Jeff Garlin)... 1 out of 5 stars Read more Movies Nativity Here is a list of things that sprang to mind while watching Debbie Isitts festive putting-on-a-show ordeal in which Martin Freeman (below) stars as a cantankerous primary school teacher battling to stage a nativity play with the help of an infantilised... 1 out of 5 stars Read more Blog Celebrate this Fathers Day at gay party ""Daddy"" You got mom an edible arrangement for Mothers Day why not try an Oedipal arrangement for Fathers Day? ""Living magazine"" and art collective The Culture Whore is taking over divey East Village gay bar Eastern Bloc this Sunday for a disco-heavy Fathers... Read more Top About us Work for Time Out Privacy policy Website terms of use Contact us Get listed Advertising Time Out products Mobile apps Time Out Shop Time Out Guides Time Out Travel Time Out Worldwide Time Out magazine Follow us Facebook Twitter Youtube Instagram Pinterest Spotify Foursquare Time Out New York Site map",http://www.timeout.com/film/reviews/64857/daddy_day_care.html,404,daddydaycare0,daddydaycare,timeout
New York | Not Found | Village Voice NewsVLongformThe MTAMediaNYPDPoliticsMake It StopCultureLGBTTop Stories NewsletterMusicVAsk Andrew W.K.New YorkersMusic ListsBars amp; LoungesConcert CalendarMusic NewsletterFood amp; DrinkVNYC Restaurant GuideRestaurant Reviews100 Favorite Dishes99 Essential Restaurants in BKPizzaFood amp; Drink ListsFood amp; Drink NewsletterArts amp; CultureVVisual ArtsTheaterBooksComedyObiesThe Seen A NYC Style GuideTheater NewsletterCalendarVSubmit an EventConcert CalendarThings To Do NewsletterFilm amp; TVVNews amp; InterviewsFilm ReviewsShowtimesTrailersVillage Voice Film PollFilm PodcastFilm amp; TV NewsletterLongformVideosSlideshowsBest Of NYC(r)VArts amp; EntertainmentFood amp; DrinkShopping amp; ServicesSports amp; RecreationReaders ChoiceBest Of NewsletterPromotionsVPromotional EventsStreet TeamFree StuffPromotions NewsletterClassifiedsVMedical Studies Apps About Us Contact Us Staff Careers Advertise E-Edition Privacy Terms menu Remember Me SIGN IN > Forgot Password? Or sign in with a social account FACEBOOK GOOGLE + TWITTER YAHOO Dont have an account yet? Sign Up > Connect. Discover. Share. Get the most out of your experience with a personalized all-access pass to everything local on events music restaurants news and more. Enter your email or sign up with a social account to get started FACEBOOK TWITTER GOOGLE+ YAHOO Privacy Policy SIGN UP > Already registered? Login > Email Username Password Name Zipcode DONE MVN Sign In > Dont have an account yet? Sign Up > Facebook Twitter Follow villagevoice Other MORE That page could not be found. Whoops we cant seem to find what youre looking for. Based upon what we do know here are some search results that you might find useful.  Article Stadium Issue? What Issue? 12 years ago by Paul Moses Dear International Olympic Committee inspectors I hope you dont mind but I somehow picture your team of International Olympic Committee inspectors as a bumbling crew of Inspector Clouseau types. Thats unfair of course. Youve no doubt already dissected New York Citys 562-page bid book to host the 2012 Olympics. But...  Article Right-track/Wrong-track 12 years ago by Rick Perlstein Right-track wrong-track polls another vaunted predictor of political behavior that has to be reevaluated. A conservative would no doubt tell a pollster the nation is headed on the wrong track after seeing Britney Spears and Madonna kissing on TV. Her protest will consist of voting to lower Britney and Madonnas...  Article Tracks of Your Tears 12 years ago by Brendan I. Koerner Q. Last month my friend loaned me this top-notch house CD which I promptly ripped to my hard drive. Problem now is that when I try to play it on my iPod there are always breaks between the tracks. This could scarcely be more annoying. A Pas de probleme as...  Article Bringing the Nation Back on Track 12 years ago by Chisun Lee They had to grab the wheel. In its blockbuster enemy-combatant decisions last week the Supreme Court steered a swerving nation back on its original course. No shortcuts in America the justices admonished the president--here the right way is sometimes the rockiest. In cases that posed the greatest test to national...  Article Tracking Down The Citys Moonshiners 5 years ago by By Lauren Shockey Photographs by Liz Barclay On a quiet Tuesday afternoon in early July a yeasty sour aroma fills Lances kitchen in the ground-floor apartment of a Carroll Gardens brownstone. Its improv time in Brooklyn. A large aluminum pot lidded with a Crock-Pot top and sealed shut with a sticky paste made from flour and water... All 2115 results or Back to home (c)2016 Village Voice LLC. All rights reserved. Newsletters All-access pass to the top stories events and offers around town. Top Stories Send Sign Up gt; Remind Me Later gt; No Thanks gt; Privacy Policy Newsletters All-access pass to top stories events and offers around town. Sign Up gt; No Thanks Remind Me Later gt;,http://www.villagevoice.com/issues/0320/tracking.php,404,daddydaycare1,daddydaycare,villagevoice
USATODAY.com - Daddy Its a Murphy mistake Classifieds | | | Home News Travel Money Sports Life Tech Weather Movies Movies home Box office report DVD releases Music Music home Top albums Top singles Listen Up Music reviews TV TV home TV listings Nielsen ratings Reality Check Critics Corner Idol Chatter Books Books home Top 150 books Columnists Columnists home Robert Bianco Peter Johnson Whitney Matheson Alison Maxwell Craig Wilson Gaming Gaming home Arcade Crosswords Sudoku More Life People Media Mix Pop Candy Photo archive Talk Today Marketplace Real estate Arcade Music Tickets Shopping International Business Index Newspaper Classifieds Posted 5/8/2003 1114 PM     Updated 5/9/2003 1056 AM BEYOND WORDS Video View trailer for Daddy Day Care RELATED STORIES Take Care Review Daddy Day Care is a Murphy mistake Father often knows best at the box office Eddie Murphy trades raw style for kid-friendly fare Summer movies USA TODAYs complete guide to summer movies Daddy Its a Murphy mistakeBy Claudia Puig USA TODAY Daddy Day Care does not end Eddie Murphys recent run of bad vehicles. This plodding would-be comedy follows in the tradition of last years trio of missteps The Adventures of Pluto Nash Showtime and I Spy. But audiences love Murphy in the lovable dad mode (Dr. Dolittle and its sequel were big hits) so Day Care is likely to offer at least opening-weekend success. Eddie Murphy stars in Daddy Day Care. The story is so formulaic and the proceedings so humorless that one cant help but ask what happened to the talented comic actor who made Beverly Hills Cop and more recently charmed audiences as the donkey in Shrek. Murphy is so oddly bland in Daddy Day Care that it seems like he sleepwalked through the making of the film. His edgy humor has been watered down making it palatable for family audiences but anyone over 10 is not likely to find this movie entertaining or clever. Review of the movie Daddy Day Care ( out of four) Stars Eddie Murphy Anjelica Huston Jeff Garlin Steve Zahn Director Steve Carr Distributor Revolution Studios Rating PG for language. Opens Friday nationwide Murphy plays a workaholic advertising executive who rarely sees his young son. Though Murphy and his wife (Regina King) live in a prosperous suburb for some reason their only choices for child care are a scary trailer park or the ridiculously exclusive Chapman Academy which requires preschoolers to learn five foreign languages. When Murphy loses his job he flounders until he comes up with the idea of running a day care center out of his house. He recruits male former colleagues and draws a dozen kids giving the hoity-toity Chapman Academy overseen by a harridan headmistress (Anjelica Huston) a run for its money. Hollywood executives seem fascinated by movies about the foibles of men taking care of children (Big Daddy Mr. Mom Three Men and a Baby) but laughs usually are part of the equation. This movies 93 minutes are pretty much laugh-free despite the presence of several ordinarily funny co-stars including Steve Zahn so hilarious in Out of Sight and Happy Texas and Jeff Garlin whos a hoot on the HBO series Curb Your Enthusiasm. Murphy plays straight man to a dozen kids who though cute dont have the chops to pull off real gags. Khamani Griffin the adorable 4-year-old who plays Murphys son inspired the only chuckle I could muster and that was in an outtake shown after the movie itself. You know something is wrong when a preschoolers unwitting ad-libs are funnier than anything seasoned comedy writers can come up with. Kids say the darnedest things. Too bad the grown-ups dont. Newspaper Home Delivery - Subscribe Today USATODAY.com partners USA WEEKEND Sports Weekly Education Space.com Home Travel News Money Sports Life Tech Weather Resources Mobile news Site map FAQ Contact us E-mail news Jobs with us Internships Terms of service Privacy policy/Your California Privacy Right Advertise Press Room Media Lounge Electronic print edition Reprints and Permissions Add USATODAY.com RSS feeds The Nations Homepage Copyright 2008 USA TODAY a division of Gannett Co. Inc.,http://www.usatoday.com/life/movies/reviews/2003-05-08-daddy-review_x.htm,200,daddydaycare2,daddydaycare,usatoday
