review,link,status_code,id,movie_key,critic
"Easy A (PG-13) | miami.com Home Nightlife Restaurants Hotels See amp; Do Movies Shopping Events Visual Arts Guides Espanol Review Easy A (PG-13) Emma Stone earns an A-plus in first lead role. Emma Stone as Olive Penderghast in Screen Gems Easy A. Share Print Save to your profile By Connie Ogle The Miami Herald9/15/2010 Editor rating 2.5 Not every moment of Easy A earns a passing grade but what works in this edgy teen comedy works spectacularly well. Borrowing ideas from Mean Girls and Saved with somewhat clumsy allusions to The Scarlet Letter the movie tackles always-relevant issues - that pesky sexual double standard the way even the sharpest teenage girls devalue themselves the dangers of gossip the difficulty of taking responsibility for your mistakes - while being smart irreverant and funny as hell. A lot of the credit for the films success lands squarely on the slim shoulders of the terrific Emma Stone last seen taking up arms against the undead in Zombieland. Here as high-school student Olive her weapons are different and somewhat less effective at least in the short run. Olive wields a savage wit a formidable vocabulary and keen intelligence none of which can save her from poor judgment and bad luck. Exasperated by a friends needling she confesses to losing her virginity to a college boy. The story is a lie; like all extraordinarily attractive young women in teen movies Olive doesnt even seem to date. But the lie is overheard by Christian do-gooder Marianne (Amanda Bynes) and the story spreads across campus faster than you can say ""Text me. Worse generous Olive agrees to help out a gay friend who wants to save himself grief by pretending he slept with her. Pretty soon all the outcasts are lining up to pay for pretending to use her services. The real twist the one that elevates Easy A beyond its teen-comedy roots is that as Olive becomes notorious she begins in a perverse way to enjoy the attention. Shes always felt invisible. Now shes in the spotlight and even if the starring role doesnt seem to capture the attention of her crush Todd (the handsome but bland Penn Badgley who is no John Cusack with a boom box) at least everybody else is looking. Easy A is unnecessarily hard on the religious kids. Unlike Saved it uses broad caricatures of gospel-singing fanatics to get laughs and the bug-eyed over-the-top performance by Bynes (who apparently really should have retired after making this film) doesnt help matters. Other broad comic bits - Olive and her gay friends faking orgasm for example - go on far longer than even the most juvenile viewer will think is funny. But director Will Gluck understands how a strong supporting cast can transform a comedy. Stanley Tucci and Patricia Clarkson are perfectly cast as Olives bright liberal-minded parents; you can see where she gets her quick wit and confidence. And Thomas Haden Church is hilarious as the English teacher puzzled and disturbed by Olives conversion from good student to vamp. A teenage girl sewing an A on her slutty new clothes - for ""awesome she announces - is more than a little ridiculous but Stone makes the act seem possible. If nothing else Easy A should be a breakout role for her. Shes an A-plus. Cast Emma Stone Penn Badgley Amanda Bynes Thomas Haden Church Dan Byrd Patricia Clarkson Stanley Tucci Malcolm McDowell. Director Will Gluck. Screenwriter Bert V. Royal. Producers Zanne Devine Will Gluck. A Screen Gems release. Running time 92 minutes. Mature thematic elements involving teen sexuality language some drug material. Playing at area theaters. Related Links Movie times Speak Up Movies Review Jason Bourne revitalizes the aging franchise (PG-13) 3 Review Cafe Society is a sumptuous exploration of love and regret (PG-13) 3 Review Captain Fantastic rewrites the book on raising a family (R) 3 Review3 movies to see 2 to skip this weekend July 29-31 The cyber-thriller Nerve doesnt compute (PG-13) These Bad Moms deserved better (R) 3 movies to see 2 to skip this weekend July 22-24 Star Trek Beyond flies at warp speed (PG-13) Absolutely Fabulous The Movie could have used more bite (R) Love is in the air in Isla Bonita (unrated) Lights Out will make afraid of the dark again (PG-13) Ice Age Collision Course is a disaster (PG) 3 movies to see 1 to skip this weekend July 15-17 See more in Review Advanced Search Find everything youll need for your trip Hotels | Attractions | Getting Around FlightHotelCarPackagesCruiseActivities What type of Package do you want? Flight and hotelFlight hotel and carHotel and carFlight and car Departing from Depart Morn.Noon.Eve. Going to Return Morn.Noon.Eve. Adults 01234 Seniors 01234 Children 01234 Search for packages More Package search options Going to Arrive 12 AM1 AM2 AM3 AM4 AM5 AM6 AM7 AM8 AM9 AM10 AM11 AM12 noon1 PM2 PM3 PM4 PM5 PM6 PM7 PM8 PM9 PM10 PM11 PM Return 12 AM1 AM2 AM3 AM4 AM5 AM6 AM7 AM8 AM9 AM10 AM11 AM12 noon1 PM2 PM3 PM4 PM5 PM6 PM7 PM8 PM9 PM10 PM11 PM Adults 01234 Seniors 01234 Children 01234 Search for packages More Package search options Departing from Depart Morn.Noon.Eve. Going to Return Morn.Noon.Eve. Adults 01234 Seniors 01234 Children 01234 Search for packages More Package search options Search for hotels in Check-in date Check-out date Rooms 123 Room 1 Adults 1234 Children 01234 Room 2 Adults 1234 Children 01234 Room 3 Adults 1234 Children 01234 Search for hotels More Hotel search options Departing from Depart 12 AM1 AM2 AM3 AM4 AM5 AM6 AM7 AM8 AM9 AM10 AM11 AM12 noon1 PM2 PM3 PM4 PM5 PM6 PM7 PM8 PM9 PM10 PM11 PM Going to Return 12 AM1 AM2 AM3 AM4 AM5 AM6 AM7 AM8 AM9 AM10 AM11 AM12 noon1 PM2 PM3 PM4 PM5 PM6 PM7 PM8 PM9 PM10 PM11 PM Adults 1234 Seniors 01234 Children 01234 More Flight search options Search for flights Pick-up location Pick-up 12 AM1 AM2 AM3 AM4 AM5 AM6 AM7 AM8 AM9 AM10 AM11 AM12 noon1 PM2 PM3 PM4 PM5 PM6 PM7 PM8 PM9 PM10 PM11 PM Drop-off 12 AM1 AM2 AM3 AM4 AM5 AM6 AM7 AM8 AM9 AM10 AM11 AM12 noon1 PM2 PM3 PM4 PM5 PM6 PM7 PM8 PM9 PM10 PM11 PM Car class No PreferenceEconomyCompactMidsizeStandardFull SizePremiumLuxuryConvertibleMini-vanSport Utility Vehicle Search for cars More Car search options Select a top destination ----------------------------AfricaAlaskaAsiaBahamasBermudaCanada - New EnglandCaribbeanCaribbean - EasternCaribbean - SouthernCaribbean - WesternEuropeHawaiiMediterraneanMediterranean - EasternMediterranean - WesternMexicoNorthern Europenowhere (no port stops)Panama CanalSouth AmericaSouth PacificTransatlanticTranspacificUnited States amp; CanadaUS Pacific CoastWorld Departing in Cruise length Show All1-2 nights3-5 nights6-9 nights10-14 nights15+ nights Search for cruises More Cruise search options Destination Start date End date Search for activities More Activities search options Sign up for our weekend guide Make your plans with our Weekend Concierge email sent to your inbox every Wednesday. Follow us Follow Miamicom Nightlife Band of the Hour Clink Club Scout Latin Nightclubs Velvet Underground Weekend Ticket Nightclub Photo Galleries Restaurants Miami Waterfront Restaurants First Look The Big Review Dining Adviser Hotels Cheap Hotel Deals Hip Miami Hotels Miami Hotel Lounges Hotel Hopping The Suite Life See amp; Do Miami Golf Courses Miami Culture Events Miami Museums Miami Animal Attractions Miami Theatre Center Stage Miami Outdoor Events Movies Reviews Theaters Showtimes Gay Gay clubs Gay photo galleries Shopping Spa Fancy Boutique of the Week Sawgrass Mills Guide Kendall Shopping Guide Lincoln Road Shopping Guide Aventura Mall Shopping Guide Adults Miami Strip Club Guide Broward Strip Club Guide Adult Toy Store Guide Featured Dancer Risque Business Toy Joy Espanol Compras Que Hacer Restaurantes Vida Nocturna Hoteles Connect with us Contact us | Like us on facebook | Follow us on twitter | Sign up for our newsletter | RSS Correct us Get listed | Report an error About us | Privacy Policy | Terms of service | About our ads | Sitemap (c) 2016 Miami.com. All rights reserved. Miami.com logos graphics designs page headers icons and buttons are the property of the Miami Herald Media Co.",http://www.miami.com/039easy-a039-pg-13-article,200,easya22,easya,miami
Easy A Movie Review amp; Film Summary (2010) | Roger Ebert,http://www.rogerebert.com/reviews/easy-a-2010,200,easya23,easya,rogerebert
"Easy A AZ City or ZIP  Movies  Dining  Coupons  Archives Log in Subscribe Activate Help Hi My account Newsletters Help Log out e-Newspaper Hi My account Newsletters Help Log out Subscribe Activate User Name / E-mail Password Forgot password? News Sports Money Things To Do Politics Travel Weather Pets Food amp; Home Todays Deal Shopping Jobs Cars Homes Rentals Classified Dining Events Kids Music Movies Nightlife Arts Best Travel Comics Celebs Tickets Horoscopes Dating TV Metromix Submit Event Browse Current Circulars Search for Deals Valley Values Todays Hot Deals Travel Deals Phoenix jobs Post Resume Find an Employee Job Fairs amp; Events Find a New or Used Car Sell a Car Research amp; Blue Book Value Used Specials | New Specials Cycles Boats RVs amp; More Find a Home Find Other Real Estate Sell Your Home Agents Advertise Your Listings Find a Rental Search by City ZIP Request Apts.com Magazine Rent Your Home Managers Advertise Vacancies Find an Ad | Place an Ad Pets Merchandise amp; Stuff | Services Announcements amp; Celebrations Public Notices phoenix tempe scottsdale arizona things to do 952 am 84deg Dining Events Kids Music Movies Bars Arts Best Travel Comics Celebrities More Submit an event Tickets Horoscopes Dating TV news and schedule events dining kids bars What(ex pizza or concert) Search Tips Where(ex 85004 or Phoenix) What(ex pizza or concert) Search Tips Where(ex 85004 or Phoenix) When From To OK Cancel Type Size A A A Print Email Most Popular Easy A 4.5 stars by Randy Cordova - Sept. 15 2010 1150 AM The Arizona Republic In the high-school comedy ""Easy A"" heroine Olive dreams of a romantic ending that comes straight out of a John Hughes movie. Easy A Good to Great Director Will Gluck. Cast Emma Stone Dan Byrd Amanda Bynes Penn Badgley Stanley Tucci Lisa Kudrow. Rating PG-13 for mature thematic elements involving teen sexuality language and some drug material. Qamp;A Emma Stone takes turn as leading lady Memorable chick flicks But there is one big thing that Olive doesnt realize. She is smarter and funnier than any of Hughes female characters from the 80s. In fact with her snappy pop culture references quick wit and exasperated empathy Olive is more Juno MacGuff than a fey Molly Ringwald creation. And with Scottsdale native Emma Stone playing Olive the character pretty much bursts off the screen. Stone has been good in supporting roles (""Zombieland"" ""Superbad"") but shes thoroughly captivating here. Shes feisty and vivacious and projects a completely natural charm. This role breaks her out from the pack of young starlets. Olive leads a fairly anonymous life at her high school in Ojai Calif. That all changes when she invents an off-the-cuff story for her best pal about spending the weekend with a non-existent college student named George. The tall tale quickly spreads throughout the school and Olive finds herself branded with a reputation. The twist? Olive loves the notoriety. Shes no longer invisible people are paying attention and guys are looking closer at her. Its everything she wanted and shes still able to hang onto her virginity. Things take another turn when a closeted gay student (hilarious Dan Byrd currently underused on TVs ""Cougar Town"") asks her to fake a quickie with him at a party. Soon all the school outcasts are begging her to claim fake deeds with them to bolster their reputations. In one of the films wittiest devices Olive trades her fake favors for cash gift cards (she likes OfficeMax and Amazon) and even coupons for Bath amp; Body Works. Things spiral even further. Olive is branded the school tramp by wicked campus puritan Marianne Bryant (a sharp Amanda Bynes). Marianne is the kind of girl who spends her free period singing ""Go Down Moses"" in the school quad. There is a lot going on in Bert V. Royals screenplay which at times borders on the chaotic. Besides the enjoyably fast dialogue which pretty much zips back and forth at a breakneck pace there are also Olives supportive parents (a solid Stanley Tucci and Patricia Clarkson). When Olive tells them she got sent to the principals office her mom asks ""Did you win a medal?"" Everything ties into Nathaniel Hawthornes ""The Scarlet Letter"" which Olive happens to be studying in school. This is actually one part of the film that feels slightly forced. Soon Olive decides to tart up her wardrobe and put a handmade ""A"" on her clothing. You understand why the character is doing it but it also seems like an excuse to get Stone into some cleavage-baring outfits. Still the movie is so brightly whimsical and bounces along so merrily little sins like that can be forgiven. This is the kind of movie about teenagers that an adult audience should embrace. Its simply that good and Stone is nothing short of wonderful. Reach the reporter at randy.cordovaarizonarepublic.com or 602-444-8849. Type Size A A A Print Email Most Popular search local businesses Popular Searches Phoenix Accountants Phoenix Attorneys Phoenix Churches Phoenix Dry Cleaners Phoenix Florists Phoenix Landscapers Phoenix Dentists Phoenix Doctors Phoenix Schools Phoenix Furniture More Popular Searches Phoenix Apartments Phoenix Attorneys Phoenix Auto Dealers Phoenix Auto Parts Phoenix Auto Repair Phoenix Beauty Salons Phoenix Car Rental Phoenix Dentists Phoenix Doctors Phoenix Hotels Phoenix Insurance Phoenix Loans Phoenix Mortgages Phoenix Movers Phoenix Pizza Phoenix Realtors Phoenix Restaurants Phoenix Storage Phoenix Tax Prep Phoenix Travel Phoenix Featured More... Powered by Local.com Screen Gems Emma Stone stars as Olive Penderghast in a scene from ""Easy A."" Most Read Celebrities who wear Boots 12 best movies about older people Daily celebrity fashion picks Hot or not? Top 10 sexiest movies ever made The 10 best movies based on mythology Top 10 films about switching identities 10 best films about troubled teens Sean Connerys wife recalls their first sexual encounter Top 10 movies set in or around water 10 best films based on young-adult novels Movie reviews Argo 5 stars | Showtimes Sinister 4 stars | Showtimes Seven Psychopaths 4 stars | Showtimes Here Comes the Boom 2.5 stars | Showtimes Taken 2 3.5 stars | Showtimes azcentrals BEST 2012 Nominate Vote Readers Picks Critics Picks The Latest Entertainment Deals more entertainment deals >> subscribe to entertainment deals Top 10 movie tattoos Heres a look at some of cinemas most unforgettable tattoos. Portlandia season two TV to look forward to in 2012 Scenes from Burning Man 2011 Video Game Awards 2011 photos Visit Deal Chicken every day to find big savings from local businesses. Todays deal There are no deals . Sign up to get the deal e-mailed to you each day >> Business owners We pay you to promote your deal >> email alerts Enter your email address to get movie newsletters. Find RSS feeds ranging from dining and movie reviews to celebrity news and much more >> Go to full RSS page Use your mobile phone to search azcentral.com for restaurants bars amp; clubs and movie listings. >> Find out how easy it is to connect Follow our latest Twitter activity on topics ranging from great deals to whats happening around the Valley. Become a fan of azcentral.com on Facebook and youll get the days most popular and talked-about Valley news sports entertainment and more - right in your newsfeed. >> Become a fan SITE MAP azcentral.com main arizona vacations lavozarizona.com phoenix news food amp; home phoenix weather arizona sports style classified phoenix business photos phoenix jobs things to do video phoenix cars arizona cardinals phoenix homes phoenix calendar rss feeds newsletters public notices CUSTOMER SERVICE terms of service advertise with Republic Media privacy policy contact The Republic about The Republic subscribe to The Republic jobs at The Republic Republic subscriber services Media in Education jobs at KPNX-TV about KPNX-TV PARTNERS USA Today Gannett Co. Inc. Apartments apartments.com Cars cars.com Dating eHarmony.com Homes Homefinder.com HomeGain Jobs CareerBuilder.com Local Businesses Shopping ShopLocal.com Copyright (c) 2012 azcentral.com. All rights reserved. Users of this site agree to the Terms of Service Privacy Policy/Your California Privacy Rights and Ad Choices x Log in Are you currently a subscriber? Set up your digital access now > Email address Password Reset your password? Log in Need help? Call (800) 332-6733 Or Chat Now Users of this site agree to the Privacy Policy and Terms and Conditions x Would you like to share your digital subscription? You can share your full access digital subscription with a friend by simply entering in their email address. Click below to proceed. Share now Remind me No thanks Enjoy a limited number of free articles over the next 30 days. 20 free articles remaining this month. Subscribe today for full access >> Already a subscriber? Activate your account now We hope you have enjoyed your complimentary access. Become a subscriber today to enjoy these benefits Unlimited access to our Web site Tablet-Optimized edition Mobile site amp; iPhone app View subscription options Log in Are you currently a subscriber? Set up your digital access now. Cookies must be enabled on your browser to view this site. Javascript must be enabled on your browser to view this site.",http://www.azcentral.com/thingstodo/movies/articles/2010/09/15/20100915easy-a-review-emma-stone.html,200,easya24,easya,azcentral
Easy A | EW.com Skip to main content Sign In Log Out TV TV Recaps Movies Music Books Gaming Video Big Brother Queen of the South Mr. Robot Wayward Pines Suits Tyrant Shop Newsletter Subscribe Get 1 year for 25 Save 86% off the cover price SUBSCRIBE More Great Stuff Comic-Con Hulu Hot List 50Scoops EW Popfest For Your Consideration Jess Cagle Interview Stage Follow EW EW on Facebook EW on Twitter EW on Tumblr EW on Instagram About EW Contact UsCustomer ServiceAbout UsJobs at Time Inc.AdvertisePrivacy PolicyYour California Privacy RightsAd ChoicesNewslettersSubscribeTerms of ServiceSite Map Copyright 2015 Entertainment Weekly Inc. All rights reserved. Login Log out TV TV Recaps Movies Music Books Gaming Video More... TV This Weeks Cover The Walking... TV Exclusive Photos of The Walking... EW POPFEST Get the details 50Scoops50Days Exclusive... Movies Crazy Stupid Love Before Th... Movies The Most 2000s Fashion From Joh... Movies 27 Great Revenge Movies Movies Alice in Wonderland Witticism... Movies John Tucker Must Die Where Ar... Books 15 Captivating International Cri... Movies Planet of the Apes See the Fa... Movies Toronto Film Festival 2016 See... TV One Tree Hill Where Are They... Movies Little Miss Sunshine Where Ar... Books Harry Potter and the Cursed Chi... Movies Comic-Con 2016 See Portraits of... TV Friends See the Casts Evolut... TV Comic-Con 2016 Get Batty With... Movies The Dark Tower Storybook Steph... News Comic-Con 2016 Star Portraits... TV 10 of the Best Moments From The... Movies The Dark Tower Storybook Steph... Movies Thelma and Louise See Rare Behi... Movies 9 of Garry Marshalls Best Movies Movies Every Star Trek Movie Ranked Movies Big Trouble in Little China... Movies The Dark Tower Exclusive Firs... Movies Suicide Squad Before They Wer... Movies The 10 Best Movies of 2016 (So Far) TV Fear the Walking Dead introduc... Movies Easy A by Owen Gleiberman Share Tweet Share on Google+ Share on Pinterest Share on Tumblr Easy A If Lindsay Lohan never makes it back to leading-lady status then we can all comfort ourselves with the knowledge that we have Emma Stone. In Easy AComedyPT94MPG-13 If Lindsay Lohan never makes it back to leading-lady status then we can all comfort ourselves with the knowledge that we have Emma Stone. In 2010-09-21Sony Pictures Entertainment Share Tweet Share on Google+ Share on Pinterest Share on Tumblr YOUTH IN REVOLT Emma Stone and Penn Badgley take a ride in Easy A (Adam Taylor) B- Easy A Genre Comedy; Starring Emma Stone; Director Will Gluck; Release Date Wide 09/17/2010; Runtime (in minutes) 94; MPAA Rating PG-13; Distributor Sony Pictures Entertainment Posted September 21 2010 -- 1200 AM EDT If Lindsay Lohan never makes it back to leading-lady status then we can all comfort ourselves with the knowledge that we have Emma Stone. In Easy A a remorselessly cheeky sociological teen-raunch comedy that attempts to do for The Scarlet Letter what Clueless did for Emma Stone has a speed and sparkle that may remind you of Lohan in her Mean Girls prime. She plays Olive who tells a tall tale about her sexual exploits only to learn that on the digital gossip grapevine of the texting era shes instantly been branded the school trollop. When all attempts to deny it prove futile she fights back by playing up the image dressing in bad-girl corsets accessorized with a scarlet A. But her acting-out routine has a secret saintly side. Shes really helping assorted guys -- like her closeted best friend or a pudgy dork -- by pretending to sleep with them so they can add a little I-shagged-the-school-slut luster to their public images. Easy A has some agreeable fast banter but its so self-consciously stylized that it wears you out. The movie has too many familiar elements like Amanda Bynes as a puritanical/bitchy/Christian BFF. Yet Stone who made her debut in Superbad never loses her flashing-eyed sunny vivacity. Patricia Clarkson and Stanley Tucci as Olives goofily empathic parents are a tasty comedy team and Lisa Kudrow as a guidance counselor who is a trollop is funny enough to make you wish that shed land a movie role that does her skewed whimsicality full justice. B- See all of this weeks reviews Share Tweet Share on Google+ Share on Pinterest Share on Tumblr Top Stories True Detective not dead yet HBO insists Jimmy Fallon Snapchats Martha Stewarts cooking on The Tonight Show Game of Thrones HBO confirms season 8 will be last Margot Robbie says shes given 50 tattoos to her friends HBO sets premiere dates for Westworld and more Suicide Squad Margot Robbie held her breath underwater for five minutes Real Time with Bill Maher renewed through 2018 Photo Galleries 50Scoops50Days The Latest in Fall TV News The Biggest Moments From the 2016 Conventions Crazy Stupid Love Before They Were Stars The Most 2000s Fashion From John Tucker Must Die Exclusive Photos of The Walking Dead Season 7 27 Great Revenge Movies Alice in Wonderland Witticisms and Wisdom From the Disney Classic From Our Partners From Our Partners Contact UsCustomer ServiceAbout UsJobs at Time Inc.AdvertisePrivacy PolicyYour California Privacy RightsAd ChoicesNewslettersSubscribeTerms of ServiceSite Map Copyright (c) 2016 Entertainment Weekly Inc. All rights reserved. img[data-src] { display none important; },"http://www.ew.com/ew/article/0,,20426225,00.html",200,easya25,easya,ew
