review,link,status_code,id,movie_key,critic
Easy A (2010) directed by Will Gluck | Film review Go to the content Go to the footer Time Out London London Popular cities London New York Paris Chicago Los Angeles Browse all cities Time Out London Close London Change city London Popular cities London New York Paris Chicago Los Angeles Browse all cities Tickets Offers Things to Do Restaurants Bars amp; Pubs Film Theatre Art Music Attractions Blog Theatre Tickets Shopping Offer of the Day Time Out Card Time Out Escapes Time Out Live Hotels Nightlife Music festivals Events amp; Festivals Kids Museums Clubs Comedy Food amp; Drink Classical Music amp; Opera Dance LGBT City Guide Area Guides Property Competitions Dating Close My Time Out Things I love My lists My Profile My Account Sign out Sign in Create account Sign in With your social account Or with your email Email Password Remember me Forgotten your password? Sign in You can create a Time Out account in two ways... With a few clicks using your favourite social network Or by entering your details below Email First Name Last Name Create password Repeat new password I accept Time Outs terms of use including opt-in to newsletters. Create account Welcome  You have successfully connected your account to Time Out. You may sign in with this account in future. Please confirm your account details Email First Name Last Name I accept Time Outs terms of use including opt-in to newsletters. Sign up My Account Sign in or Create account Search Tickets Offers Things to Do Restaurants Bars amp; Pubs Film Theatre Art Music Attractions Blog Theatre Tickets Shopping Offer of the Day Time Out Card Time Out Escapes Time Out Live Hotels Nightlife Music festivals Events amp; Festivals Kids Museums Clubs Comedy Food amp; Drink Classical Music amp; Opera Dance LGBT City Guide Area Guides Property Competitions Dating More Search Easy A Film  Comedy 4 out of 5 stars 5 out of 5 stars (3 user reviews) 0 Love It Save it 3 Add review 0 Love It Save it Time Out says 4 out of 5 stars Details Users say (3) 5 out of 5 stars Time Out says 4 out of 5 stars Every once in a while a smart female-focused teen movie comes along. The 90s had Clueless; the noughties had Mean Girls; each of them concerned with that age-old problem popularity. Similarly Easy A features a girl caught somewhere between loser and in-crowd. Instead of trying to get a leg up virgin Olive (Emma Stone) pretends shes got her leg over - mainly to shut up her inquisitive friend. Soon the details of Olives fictional cherry-popping have spread all over the school... and then it escalates.Unlike most teens Olive has an altruistic streak and this gets her into trouble. Soon shes agreeing to have imaginary sex with every geek and gay boy in the school to save them from a beating. Branded a hussy Olive decides to dress the part sewing an A on to her clothing in a nod to The Scarlet Letter.And so an amusing exploration of high-school life ensues but this is broader Olive has a maturity that makes her relatable to older women too. Stone gives a terrific performance her knowing drawl implying intellect and indifference with underlying warmth. Props also to a hilarious Stanley Tucci and Patricia Clarkson as laid-back parents. Easy A isnt perfect the love story feels like an add-on a storyline with teachers Lisa Kudrow and Thomas Haden Church is scrappy. But - like the John Hughes films it references - its hard not to love flaws and all. By Anna Smith Posted Tuesday October 19 2010 Details Release details Rated 15 Release date Friday October 22 2010 Duration 92 mins Cast and crew Director Will Gluck Screenwriter Bert V. Royal Cast Emma StoneAmanda BynesCam Gigandet Users say (3) 5 out of 5 stars Average User Rating4.4 / 5Rating Breakdown5 star14 star13 star02 star01 star0LiveReviews|31 person listeningSign inWrite reviewMost helpfulMost helpfulHighest ratingLowest ratingNewestOldestLoadingundefinedNew CommentsRefreshNov 8 2010PaulFeaturedI only saw this following a glowing Kermode review and I did find myself and others in the cinema laughing out loud. A real shame it got a 15cert but this will become a favourite dvd with teenagers and a natural follow-on to Mean Girls. Great to see the Jesus squad become a source of humour rare in Hollywood films. It is a delightful film and no doubt I will see it on dvd again to catch-up on all of the smart one-liners I missed because I was laughing too much.FlagShareHelpful?Yes|NoReplyOct 22 2010IanFeaturedEvery bit as good as the review and possibly better. The homage to the John Hughes movies at the end is excellent. A flm all teenage girls must see and one for anyone who likes a good story well told and acted by a series of excellent young actors ably assisted by a number of older actors who know a good thing when they see it.. One question is Emma Stone the new Molly Ringwald or the new Ally Sheedy?FlagShareHelpful?Yes|NoReplyOct 22 2010IanFeaturedEvery bit as good as the review and possibly better. The homage to the John Hughes movies at the end is excellent. A flm all teenage girls must see and one for anyone who likes a good story well told and acted by a series of excellent young actors ably assisted by a number of older actors who know a good thing when they see it.. One question is Emma Stone the new Molly Ringwald or the new Ally Sheedy?FlagShareHelpful?Yes|NoReplyShow More Share Tweet 0 Shares Top About us Work for Time Out Privacy policy Cookie Policy Website terms of use Contact us Time Out for business Get listed Claim your listing Premium Profiles Advertising Time Out products Time Out Card Mobile apps Time Out Shop Time Out Guides Time Out Travel Time Out Offers Time Out Worldwide Time Out magazine Where to get Time Out magazine Subscribe to Time Out magazine Manage my subscription Follow us Facebook Twitter Youtube Instagram Pinterest Spotify Time Out London Site map },http://www.timeout.com/film/reviews/88855/easy-a.html,200,easya0,easya,timeout
"Easy A We Heart Emma Stone - TIME Time.com MY ACCOUNT SIGN IN SIGN OUT SUBSCRIBE SUBSCRIBE Home U.S. Politics World Business Tech Health Motto Entertainment Science Newsfeed Living Sports History The TIME Vault Magazine Ideas Parents TIME Labs Money LIFE The Daily Cut Photography Videos TIME Shop American Voices Next Generation Leaders The 100 Most Influential People Global Trade Person of the Year 2015 Top of the World A Year In Space Subscribe Newsletters Feedback Privacy Policy Your California Privacy Rights Terms of Use Ad Choices RSS TIME Apps TIME for Kids Advertising Reprints and Permissions Site Map Help Customer Service (c) 2016 Time Inc. All rights reserved. Subscribe Sign InSubscribe Easy A We  Emma Stone By Richard Corliss Friday Sept. 17 2010 Share Tweet Read Later Send to Kindle Adam Taylor / Screen GemsEmma Stone as Olive Penderghast in Easy A Email Print Share Facebook Twitter Tumblr LinkedIn StumbleUpon Reddit Digg Mixx Del.i.cious Google+ Reprints Follow TIME The biggest joke in Easy A -- the new comedy about a high-school girl who goes from a nottie to a hottie when her classmates think shes had sex with a college guy -- is that Emma Stone could ever be a nonentity. Thats how Stones character Olive is sketched at the beginning of the movie people brush past her and knock her down; another student whos shared homerooms for nine years just cant place her face. Hey kids of Ojai High this is Emma bloomin Stone she of the green eyes sultry voice and fetching overbite (there are no fetching underbites) the smiling beguiling Circe who in movies of the past few years has been pursued by zombies (Zombieland) Jonah Hill (Superbad) and Marmaduke (she voiced the Australian collie Mazie opposite Owen Wilsons Great Dane). Nobody who saw these films could not see her as the most watchable huggable presence in them. Its an ocular impossibility. (See pictures of pinup queen Bettie Page.) Stones days as the smart self-aware darling in the corners of other peoples movies ought to be over. Easy A which had its world premiere last weekend at the Toronto Film Festival and opens today in real theaters does more than give Stone her first leading role; it establishes the 21-year-old as an actress/personality -- a star -- around whom Hollywood could build some pretty good movies. Is Easy A one of them? Well the film has a saucy 120-IQ wit that it works way too hard to put over. Like last years semi-hit (500) Days of Summer it sweats bullets to approximate that super-cool no-sweat vibe. Director Will Gluck whose only previous feature was the much grosser teen comedy Fired Up is like a salesman who insists on planting his foot in your door even when youve invited him in. But the screenwriter Bert V. Royal does possess a charming voice and an inside knowledge of the trials besetting bright young people. In his 2005 off-Broadway play Dog Sees God Confessions of a Teenage Blockhead Royal reimagined the characters from Peanuts as high-school kids with identity crises. Here he adolescentizes The Scarlet Letter; the title refers to the stigmatic A for Adultery worn by Nathaniel Hawthornes Hester Prynne. Remember Clueless which updated Jane Austens Emma and made Alicia Silverstone the girl of the month? Were in the same class here with Easy A and Stone. (See portraits of Seth Rogen.) Easy A -- which also carries the modern echo of ""easy lay"" -- poses Olive as that favorite figure of movie fantasy the fabulous babe whose sterling qualities only we the audience instantly recognize. (Audrey Hepburn played the role in half her movies.) Precocious every way but sexually Olive has an unblemished school record a fond unforced relationship with her goofy hippie parents (Stanley Tucci and Patricia Clarkson) and a discriminating taste in old films; she knows that the 1926 Lillian Gish adaptation of the Hawthorne novel has it all over the 1995 Demi Moore version. Shes also a little lonely. (See movies inspired by J.D. Salinger.) One Friday she tells her busty BF Rhiannon (Aly Michalka) that she has a date with a community-college stud; in fact she spends the weekend alone with her dog and a gift card that keeps playing Natasha Bedingfields ""Pocketful of Sunshine"" which Olive begins by thinking is the ""worst song ever"" but by Sunday has giddily and exhaustively karaoked. Next day she white-lies to Rhiannon that yes she did It. The rumor spreads school-wide and in no time Olive is notorious. Girls whisper their disapproval (read envy) while a half-dozen or so untouchable boys whether gay or just plain repugnant pay her to pretend shes had sex with them. One boy whos not a party to these transaction claims Olive gave him Chlamydia. Someone else is guilty but Olive gets the rap because she looks the part shes been cast in shes taken to wearing a spangled bra and mesh stockings. Why shouldnt she be thought of as the scarlet harlot? In a framing device thats both very today and already overly familiar Olive narrates the film as a webcam apologia for her bad behavior or lack of it. (Note to Emmamaniacs when she was 14 Stone created a PowerPoint presentation titled ""Project Hollywood 2004"" to convince her Scottsdale Ariz. parents that she should move to Los Angeles and try an acting career.) But like Nick and Norahs Infinite Playlist (500) Days of Summer and other recent smarty-pants teen pictures Easy A is indebted to the John Hughes comedies of the mid-80s -- just with a little more attitude and a little less angst. Its cultural cues are mostly from old movies and pop music that speak less to the teens for whom Easy A is marketed than to the 30-something people who made it. (See ""2010 The Year of the 80s Remakes."") You could say the movie like Olive is older than its years. But thats okay since this is one teen comedy that acknowledges the existence of adults not just Olives parents but her favorite teacher (Thomas Haden Church) his restless wife (Lisa Kudrow) and the frazzled principal (Malcolm McDowell who in his early career starred in the Brit school-revolt movie If...). More than her classmates these oldsters are Olives true peers because they realize that life is ever a battle between appearance and reality. I have to say I waged my own battle against Easy A; its assurance rankled me. But I finally surrendered to the scripts breezy intelligence and the movies relatively mature sensibility. As for Emma Stone she didnt have to win me over. She conquered me from the first A. See TIMEs Pictures of the Week. See the Cartoons of the Week. Home U.S. Politics World Business Tech Health Science Entertainment Newsfeed Living Ideas Parents Sports History The TIME Vault Magazine Subscribe Give a Gift TIME Shop Newsletters Customer Service Site Map Privacy Policy Your California Privacy Rights Terms of Use Advertising Ad Choices (c) 2016 Time Inc. All rights reserved.","http://www.time.com/time/arts/article/0,8599,2020024,00.html",200,easya1,easya,time
"Easy A | Reelviews Movie Reviews Out now Cher Harold Rosson Eva Green Benjamin ... Home Video Views ReelThoughts Currently in Cinema ReelViews Library Login Specials My Books Array ( [page] =gt; reelviews [view] =gt; easy-a ) Easy A (United States 2010) September 18 2010 A movie review by James Berardinelli Most movies about teenagers come in one of two flavors romantic comedies or sex comedies. Then there are films like Easy A - smart satirical jabs at aspects of popular culture that defy simplistic classification. These may be set in schools but what they have to say goes beyond those hotbeds of hormones peer pressure and academic cramming. Easy A belongs in the company of Election Heathers and Mean Girls - all motion pictures that have outlived their theatrical lives because they have unique voices and use them to say something. The message embraced by Easy A relates to the incestuous relationship between popularity and sleaze - not exactly a surprise when one considers how well tabloids sell and that a cesspool of crassness like Jersey Shore can claim big ratings. People love train wrecks. They love savoring the taste of another persons misery. Thats the reason why bottom-feeding ""celebrities"" attract such attention. The hypocrisy surrounding this cultural phenomenon is not lost on the makers of Easy A who use high school as a microcosm of the world at large as they dissect what popularity has become and what it really represents. Easy A doesnt stop with its central theme but many of its tertiary targets are pummeled less soundly and with mixed results. For example its jabs at religion feel stale and familiar - weve seen these same holier-than-thou caricatures in dozens of films and Easy A doesnt do enough with them thats new or interesting to make this aspect of the film worthwhile. In general however when director Will Gluck and screenwriter Bert V. Royal decide to launch a fusillade at something enough of the barbs stick for the point to be made. Olive (Emma Stone) is as ordinary as a smart pretty high school student can be. In her words if she was a ten-story building Google Earth wouldnt notice her. That all changes however with an innocent lie to her best friend Rhiannon (Aly Michalka). Tired of being thought of as virginal and boring she tells the other girl that she had a one-night stand with a college guy. Unfortunately for Olive this ""confession"" is overheard by the schools resident religious zealot Marianne (Amanda Bynes) who also happens to be a gossip. It takes less than a period for the news of Olives sexual exploit fueled by text-messages word-of-mouth and paper notes passed in classes to make its way through the corridors of academia. After that when she helps a gay friend (Dan Byrd) establish his ""straightness"" via a fake (but very public) sexcapade the snowball effect takes over. Reputation outstrips reality. Olive enjoys the notoriety for a time but soon learns that the negatives associated with popularity are greater than the benefits. Easy A represents a coming-out party of sorts for Emma Stone who is being given her first opportunity to carry a movie. She is unequivocally up to the task bringing charm confidence and self-deprecating wit to the part. The way she plays Olive reminds me of Lindsay Lohan in Mean Girls although considering how Lohan has become a bigger-than-live example of what Easy A is lampooning perhaps that isnt the kindest comparison. At any rate Stone never loses the cameras attention even when shes sharing the screen with older better-known veteran actors. The supporting cast is littered with familiar names. Patricia Clarkson and Stanley Tucci play Olives loving Mom and Dad. We havent seen parents this supportive since Juno. Indeed with nearly every motion picture family displaying the deepest seediest forms of dysfunction its a breath of fresh air to find a daughter who has a great relationship with both parents. Thomas Hayden Church is Olives favorite teacher Mr. Griffith and Lisa Kudrow is his wife the guidance counselor. Malcolm McDowell with his frown and glare fixed in place is Principal Gibbons. A lot of what transpires during the course of Easy A will resonate with teenagers (who are living through this) and adults (whose memories of high school will take them back). A throw-away romantic comedy has been shoehorned into the story. Its inclusion like some of the broader humor (such as the ""sex scene"" between Olive and her gay buddy) seems more tacked-on than organic. Its not awkward enough to detract but it is not seamlessly interwoven. Without it Easy A would have been a darker experience so perhaps it needs to be there to keep things from becoming too gloomy. Easy A provides plenty of nods and connections to 80s movies and music. Say Anything and Cant Buy Me Love are explicitly referenced but theyre not the only examples. Easy As version of ""In Your Eyes"" is Simple Minds ""Dont You (Forget About Me)."" The song ""Knock on Wood"" also gets a prime position. (Technically Amii Stewarts cover which is the best-known version was a 70s song since it reached the U.S. charts in 1979.) Easy A also references in a rather obvious way Nathaniel Hawthornes The Scarlet Letter with Olives voiceover providing a scathing review of the Demi Moore film version. Its often the case that movies like this which dont follow a cookie-cutter philosophy fail to find a large audience during a theatrical run. Its too early to say whether thats the case with Easy A but despite occasional missteps the film is smart and incisive enough to deserve success at the box office. The marketing campaign is doing the production a disservice by selling Easy A exclusively to teenagers. It is made for and deserves a wider audience. The things it has to say may resound loudest for those in high school but viewers of all ages will recognize those echoes in countless nooks and crannies of pop culture and life in general. Easy A may not be a great movie but it is a knowing and enjoyable one. Easy A (United States 2010) Director Will Gluck Cast Emma Stone Aly Michalka Malcolm McDowell Lisa Kudrow Patricia Clarkson Thomas Haden Church Dan Byrd Amanda Bynes Penn Badgley Stanley Tucci Screenplay Bert V. Royal Cinematography Michael Grady Music Brad Segal U.S. Distributor Screen Gems Run Time 133 U.S. Release Date 2010-09-17 MPAA Rating ""PG-13"" (Profanity Sexual Content) Genre COMEDY Subtitles none Theatrical Aspect Ratio 2.351 Comments Add Comment Three...better movies of this genre Princess Bride The (1987) City Lights (1931) This Is Spinal Tap (1984) worse movies of this genre Feast (2006) Dumb and Dumberer (2003) Freddy Got Fingered (2001) Three...better movies of Emma Stone Superbad (2007) Zombieland (2009) Crazy Stupid Love. (2011) worse movies of Emma Stone House Bunny The (2008) Rocker The (2008) Amazing Spider-Man The (2012) Three...better movies of Aly Michalka (There are no more better movies of Aly Michalka) worse movies of Aly Michalka (There are no more worst movies of Aly Michalka) Three...better movies of Malcolm McDowell Clockwork Orange A (1969) Hugo Pool (1969) In Good Company (2005) worse movies of Malcolm McDowell Halloween II (2009) Doomsday (2008) Halloween (2007) ReelViews Library Currently in Cinema Writings Fictional Writings ReelThoughts Specials About Privacy Policy Terms and Conditions Contact Website credits",http://www.reelviews.net/php_review_template.php?identifier=2177,200,easya2,easya,reelviews
