review,link,status_code,id,movie_key,critic
"Easy A (C) | Dallas Morning News Dallas Morning News Home ePaper Subscribe Sign Out Sign In Home News Communities Crime Education Investigations State Nation/World Politics Videos Photos Business Wall Street Airlines Technology Economy amp; You Top 100 Real Estate Autos Sports Cowboys Mavericks Stars Rangers Colleges High Schools Other Sports Entertainment Food and Drink Movies Music Things To Do Find Restaurants Find Concerts Arts amp; Life Arts Books Food amp; Wine Home amp; Garden Style Weddings Travel Health Opinion Editorials Blog Columns Sunday Points Letters Dallas North-South Gap Obits Burial Plots In Memoriams Marketplace Autos Jobs Real Estate Shopping Classifieds DMNstore Submit Twitter Instagram Facebook YouTube Entertainment Movies Reviews Reviews September 16 2010 0309 AM CDT January 21 2011 0159 PM CST Easy A (C) Easy A (C) By TOM MAURSTAD / The Dallas Morning News tmaurstaddallasnews.com Published 16 September 2010 0309 AM Updated 21 January 2011 0159 PM Easy As title is a clever reference to the Nathaniel Hawthorne- Scarlet Letter theme running through this teen comedy.Olive (Emma Stone) agrees to help some guys raise their status in high school by pretending to have sex with them and then finds herself the target of mean-girls gossip and puritanical furor.Judging from the self-congratulatory smarminess that builds through the movie you get the feeling that director Will Gluck and screenwriter Bert V. Royal are also grading themselves. While Easy A has its razor-sharp rewards and gives its target teen-young adult audience plenty of reason to celebrate its still a long way from a good movie.Almost by design (I say almost because I dont want to seem too cynical) Easy A seems constructed to break down along generational lines. Its bursting with all kinds of youth-friend hip signifiers mostly in the form of the pop-culture- reference-a-go-go dialogue where everyone speaks in a beat-poet patter of impossibly clever slogans. Does Royal have Diablo Cody-encoding speechwriting software or did he just have Juno running on a loop while he was crafting such lines as ""a gossip girl in a sweet valley of traveling pants?""But amid all this glib and relentlessly hip fun there is a movie that never establishes a story or characters that make much sense. As Olive Stone is great - smart and funny with unerring timing. In an early montage she becomes obsessed with a silly trifle of a pop song (Natasha Bedingfelds ""Pocket Full of Sunshine"") where she goes from sneering in disdain to singing it every second of the day in her room in the shower - that is perfect pop entertainment. Put that on YouTube and Id watch it over and over.If only the movies sum were as good as its best parts but too much of it just falls apart the moment you think about it. In what worlds high school would Olive be an obscure loser? Since when is losing your virginity the cause of witch-trial-like ostracizing? Why cast great actors like Stanley Tucci and Patricia Clarkson as Olives parents only to make them sock-puppet characters who are on hand to offer cool-parents one-liners? And really what in the world is Malcolm McDowell doing in this movie playing a small-town public-school principal?Easy A is one of those half-full or half-empty movies. It makes with the clever dialogue and it does present a world where a young woman takes charge and triumphs over peer pressure but the filmmakers were either too lazy or inept to find a way to be hip and competent at the same time.Director Will GluckStarring Emma Stone Penn Badgley Amanda Bynes Dan Byrd and Thomas Haden ChurchRun time 93 minutesMPAA rating PG-13 (mature thematic elements involving teen sexuality language and some drug use) editor picks Nailing down the Horseshoe Assembling Dallas latest Calatrava arches Get out Hit the ground running (or cycling) on these D-FW trails Music Find out concerts places with great music and more Alex from Target Internet sensation from Frisco to act in movie featuring Plano teens with cystic fibrosis Comments To post a comment log into your chosen social network and then add your comment below. Your comments are subject to our Terms of Service and the privacy policy and terms of service of your social network. If you do not want to comment with a social network please consider writing a letter to the editor. Copyright 2011 The Dallas Morning News. All rights reserve. This material may not be published broadcast rewritten or redistributed. featured products <a href=""http//ws-na.amazon-adsystem.com/widgets/q?rt=tf_sswamp;ServiceVersion=20070822amp;MarketPlace=USamp;ID=V20070822%2FUS%2Fthedalmornew-20%2F8003%2F8390f335-bc74-4000-b786-a78b33862cabamp;Operation=NoScript"">Amazon.com Widgets</a> Follow Twitter stay connected listings movie stories Criterion Blu-ray pick The gentle precision of Ozus final film An Autumn Afternoon Update Watch exclusive clips from ESPNs Von Erich documentary New 4D Lego Movie spin-off heading to Legoland Discovery Center in Grapevine photos Food photos Coal-fired goodness at Smoke in Plano Food photos Three cheers (and four stars) for Gemma video Dallasnews.com Full Site Map Close Home News Business Sports Entertainment Life Opinion Obituaries Weather Investigations Photos Video Blogs Crime Traffic Autos Real Estate Jobs Shopping Marketplace Celebrations Legal Notices Pets Place an Ad ePaper Newspaper Archives Local Business Listings Media Kit Mobile Apps eBooks Special Sections My Account Pay Bill Suspend Delivery Back Copies Contact Us 2015 Intern Program News Tips Feedback/questions Newsstand Feedback Related Sites AlDiaTX FD GuideLive SportsDayDFW neighborsgo Parade DentonRC.com Findamp;Save Local Shopping The Texas Wedding Guide Design Guide Texas Top Doctors Site Map About Us Careers Advertise Subscribe Contact Us Privacy Policy Terms of Service My Account FAQ (c)2016 The Dallas Morning News Inc. All Rights Reserved. Powered by the Parse.ly Publisher Platform (P3).",http://www.dallasnews.com/sharedcontent/dws/ent/movies/reviews/stories/091610dngdeasya.b1e9f7.html,200,easya8,easya,dallasnews
Movies News - MTV mtv Menu mtv mtv Home Shows Full Episodes Shows A-Z TV Schedule App MTV2 2016 vmas Shows News Music from the Shows Casting Calls Music Music Artists A-Z Music Videos Artist to Watch News Latest News Music Celebrity TV Movies Style Politics Life TV Provider Signout facebook twitter tumblr news Shows Full Episodes Shows A-Z TV Schedule App MTV2 2016 vmas Shows News Music from the Shows Casting Calls Music Music Artists A-Z Music Videos Artist to Watch News Latest News Music Celebrity TV Movies Style Politics Life facebook twitter tumblr VMA Nominations Live From The DNC Music Movies The latest movie news casting updates and rumors trailer sneak peeks and expert reviews on MTV. Movies Tallulah Takes A Disturbing Yet Compassionate Look At Motherhood Allison Janney and Ellen Page are key to making the outlandish plot feel grounded Inkoo Kang 1d ago Movies Beaches Please Imagine the remake of the 80s classic hinging on read receipts instead of letters Teo Bugbee 1d ago Amy On Film Bad Moms The Good The Bad And The Hammered In the struggle between Good Moms and Bad Moms (and Drunk Moms too) the common enemy is the PTA Amy Nicholson 07/29/2016 TheAmyNicholson Amy On Film Jason Bourne You Know His Name But You Will Probably Forget It Jason Bourne is at its best when Jason Bourne isnt in it Amy Nicholson 07/28/2016 TheAmyNicholson Movies 12 Things We Need To See Happen In Harry Potter And The Cursed Child Ginnys infamous Bat-Bogey Hex Snapes portrait the Marauders Map and more Crystal Bell 07/28/2016 crystalbell Movies Grab Your Muggle Money More Harry Potter And The Cursed Child Tickets Are Going On Sale Accio tickets Crystal Bell 07/28/2016 crystalbell Movies Jared Leto Discusses Filling Heath Ledgers Shoes As The Joker Its one of the best performances ever in cinema Madeline Roth 07/27/2016 madfitzroth Movies 9 Things I Realized After Finally Reading Harry Potter Late to the party but I still made it Stacey Grant 07/27/2016 Stacey_Grant91 Amy On Film Nerve Internet Fame Is Everything The adaptation of the YA novel is an online-obsessed action-adventure glamour shot about the dangers of the internet Amy Nicholson 07/27/2016 TheAmyNicholson Movies Marnie Piper Is Returning To Halloweentown And Bringing Magical Surprises Plus actress Kimberly J. Brown reveals what became of Benny the cab driver Stacey Grant 07/27/2016 Stacey_Grant91 Movies Suicide Squad Director Debunks Major Joker Fan Theory You might want to rethink that Joker is Robin idea Crystal Bell 07/26/2016 crystalbell Movies Meet The Magical Creatures Of Fantastic Beasts And Where To Find Them Reminder Though extremely cute a Niffler will chew your finger off if he has to Crystal Bell 07/26/2016 crystalbell Movies Its Official Harry Potter And The Cursed Child Is Every Bit As Magical As You Dreamed It Would Be The reviews are in -- and Cursed Child is a magical triumph Crystal Bell 07/26/2016 crystalbell Movies Baby Snape From Harry Potter And The Deathly Hallows Part 2 Is A Full-Grown Wizard Now Actor Benedict Clarke is old enough to have graduated from Hogwarts Stacey Grant 07/25/2016 Stacey_Grant91 Movies Every Disney Prince And Princess Turns Up In This Madeon Mash-Up Video  A whole new world  Deepa Lakshmin 07/25/2016 deepa San Diego Comic-Con Heres What Charlie Hunnam Has To Say About Pacific Rim 2 Hunnam tells MTV News that his busy filming schedule is keeping him out of his Jaeger Crystal Bell 07/25/2016 crystalbell San Diego Comic-Con Chris Pratt Explains Why He Was Moved To Tears By Guardians Of The Galaxy Vol. 2 Pratt and director James Gunn open up about Star-Lords major daddy issues in the Guardians sequel Crystal Bell 07/25/2016 crystalbell San Diego Comic-Con There Was A Mini Hoot Reunion 10 Years After The Film Premiered San Diego Comic-Con is where dreams are made Stacey Grant 07/25/2016 Stacey_Grant91 San Diego Comic-Con Tom Holland Hints That Spider-Man Could Go Down A Darker Path In Homecoming Plus Holland previews Spideys intense showdown with Vulture Crystal Bell 07/25/2016 crystalbell San Diego Comic-Con Michael B. Jordan Is On A Smile Strike For Marvels Black Panther MBJ tells MTV News why the dimples are gone in Black Panther Crystal Bell 07/25/2016 crystalbell San Diego Comic-Con Zendaya Says Her Spider-Man Homecoming Character Is Super Dry And Awkward -- Just Like Her Zendaya tells MTV News why Spider-Man has always been her favorite superhero. (Hint It might have something to do with her first date.) Crystal Bell 07/24/2016 crystalbell San Diego Comic-Con Wait Does Carrie Fishers Dog Gary Have A Cameo In Star Wars Episode VIII? MTV News caught up with Fishers daughter Billie Lourd at Comic-Con and heres what she had to say about Garys big Hollywood break Crystal Bell 07/23/2016 crystalbell San Diego Comic-Con New Fantastic Beasts And Where To Find Them Trailer Finally Unveils Some Magical Creatures Watch Newts fantastic beasts wreak havoc on New York City Crystal Bell 07/23/2016 crystalbell San Diego Comic-Con The Justice League Assembles In First Trailer -- But The Flash Steals The Show Please dont sit in Barry Allens second favorite chair Crystal Bell 07/23/2016 crystalbell News about FAQ/Help Jobs Terms of Use Privacy Policy/Privacy Rights Copyright Closed Captioning Eventful Partners Ad Choices (c)2016 Viacom International Inc. All Rights Reserved. MTV and all related titles and logos are trademarks of Viacom International Inc.,http://www.film.com/features/story/review-easy-marks-beginning-stone/40895280,200,easya9,easya,film
"Showtimes reviews trailers news and more - MSN Movies Home News Weather Entertainment Sports Money More gt; Lifestyle Health amp; Fitness Food amp; Drink Travel Autos Video entertainment You are using an older browser version. Please use a supported version for the best MSN experience. Kristen Stewart Finally Confirms Alicia Cargile is Her Girlfriend Im Just Really in Love 16 things to know about the Bad Moms star John Tucker Must Die Where Are They Now? Depps legal team sets date to depose Heard in court Matt Damon recalls losing Dead Poets Society role In Theaters Jason Bourne Bad Moms Nerve Star Trek Beyond Ice Age Collision Course AdChoices Movie News Lindsay Lohan not pregnant despite her dads claims friend says Constance Wu slams casting for The Great Wall"" Sony Deletes Ghostbusters Tweet Over Clinton Endorsement Criticism Will Technology Kill the Teen Movie? This Twilight child star is all grown up See her now From the Microsoft Store Sponsored | Microsoft Pre-order The Angry Birds Movie today Sponsored | Microsoft Get Katy Perrys new single Rise Sponsored | Microsoft Watch Season 5 of Homeland Sponsored | Microsoft Save 75 on the Microsoft Band 2 Featured Slideshows 15 ways Bad Moms is basically The Hangover but with moms Crazy Stupid Love Before they were stars 27 Great Revenge Movies 20 modern classic movies everyone needs to watch in their lifetime 17 Mistakes You Never Noticed in Big Thrillers Home News Weather Entertainment Sports Money Lifestyle Health amp; Fitness Food amp; Drink Travel Autos Video (c) 2016 Microsoft Privacy Legal About our Ads Feedback Help MSN Worldwide Newsletter MSN Movies",http://movies.msn.com/movies/movie-critic-reviews/easy-a/,200,easya10,easya,msn
"Easy A -- Film Review - Hollywood Reporter The Hollywood Reporter movies Subscribe reviews box office heat vision coming soon trailers movies tv music tech the business style culture awards video Subscribe Blogs heat vision bastard machine live feed behind the screen esq earshot the race Newsletter THR Social Confessions of Colbert Subscribe Now Never Miss A Story. Sign up for our Newsletters. Daily Edition Login to download Easy A -- Film Review 1014 PM PDT 10/14/2010 by Kirk Honeycutt FACEBOOK TWITTER EMAIL ME PRINT COMMENTS ""Easy A"" is a high school comedy that turns a stale genre upside down with sly wit and sharp satire. TWITTER TORONTO -- If as the old comic apocryphally said on his deathbed dying is easy but comedy hard then how is it every so often a film comes along that makes comedy look so easy? Such is the case with ""Easy A"" a high school romp that turns a stale genre upside down with sly wit and sharp satire. Certainly much of the credit goes to Bert V. Royal a playwright and sometime TV writer who has crafted a smart screenplay that introduces a classical theme into contemporary youth culture. And director Will Gluck keeps the screen busy and vibrant without the current fad of attention-deficit run-and-gun editing. Most of all a young actress was needed to carry the movie. Emma Stone who has been waiting in the wings for such a starring opportunity seizes the moment with such self-assurance and old-fashioned brio that she elevates the game of every actor who comes within her orbit. Consequently the film is loaded with sparkling supporting performances that make the comedy oh-so-much richer. ""Easy A"" has the potential to be that rara avis that connects with audiences below and above the 25-year age demarcation. But to reach that wider demographic Screen Gems will need to market this as a ""Juno""-like offering centering on a teenage girl with whip-smart dialogue and observant humor. The story takes place in Southern Californias Ojai Valley the films first stroke of brilliance as this lovely oasis of natural beauty with a spirited arts colony has scarcely appeared in movies since it was used to represent Shangri-La in Frank Capras 1939 ""The Lost Horizon."" The conflicting interplay of liberal sensibilities and small-town small-mindedness underscores the themes in Royals playful script. You might not quite buy the notion that such a pretty and intelligent student as Stones Olive Penderghast ever flew under everyones radar at Ojai High School. But nevermind -- once a vicious rumor races through the campus Olive certainly takes center stage. Trouble is she is the source of the rumor. To cover up for a dull weekend of doing absolutely nothing Olive tells best gal pal Rhiannon (Aly Michalka) a lurid tale about having a hot romance with a college dude; she more than hints that she lost her virginity. Gossip-hungry Rhiannon is as pleased as she is shocked but the tale is overheard by Marianne (Amanda Bynes) leader of the schools Jesus-freak celibates who is merely shocked. The scandalized teen cant wait to tweet so the social network of Ojai High is soon abuzz over Olives promiscuity. Discovering to her surprise that her new notoriety is more appealing than alarming Olive decides not to deny the rumor which leads to surprising consequences. Another school pal Brandon (Dan Byrd) bullied because he is gay persuades Olive to use her bad-girl reputation to help him fake his heterosexuality. Soon other losers in the popularity games of youth come to her with propositions. It just so happens that while this is going on Olives English class taught by the charismatic Mr. Griffith (Thomas Haden Church) is studying Nathaniel Hawthornes ""The Scarlet Letter."" Realizing her newfound identity with its heroine Hester Prynne -- a public pariah because of an act of adultery -- Olive starts to wear homemade trashy clothes festooned with a bright letter ""A."" Her liberal-minded and most trusting parents (Stanley Tucci Patricia Clarkson) latter-day hippies one can only wish to have for parents notice this change in their daughter and do question her about her choice of attire. But they never question her judgment or behavior. So the film makes all sorts of comic attacks on hypocrisy social networking peer pressure false values and double standards. Meanwhile parents will no doubt thrill to any teen movie that treats the loss of virginity in a negative light. If theres any drawback its that the comedy peaks too early in Olive and Brandons hilarious make-out behind closed doors at a raucous party. The film never finds anything nearly that funny in the subsequent ""sales"" of fraudulent sexual favors by Olive to other males eager to establish their reputations as studs. And the film struggles to find anything humorous in the sad demise of Mr. Griffiths marriage to a guidance counselor (Lisa Kudrow) which indirectly involves Olive. The entire movie is framed as a live webcast by Olive to the entire community to confess her false career as a school slut. This allows Stones character to offer wisecracks and wisdom while commenting on this career and everyone elses character-defining response to utter nonsense. The entire screenplay is shot through with zippy one-liners and puns that might possibly make the film funnier on second viewing. The acting is terrific throughout with gems by Tucci Clarkson Byrd and Church as well as Malcolm McDowell as the choleric school principal and Penn Badgley as Olives true love who like her parents pays no attention to rumors. Venue Toronto International Film Festival (Screen Gems) Production An Olive Bridge Entertainment production Cast Emma Stone Penn Badgley Amanda Bynes Dan Byrd Thomas Haden Church Patricia Clarkson Cam Gigandet Lisa Kudrow Malcolm McDowell Aly Michalka Stanley Tucci Director Will Gluck Screenwriter Bert V. Royal Producers Zanne Devine Will Gluck Director of photography Michael Grady Production designer Marcia Hinds Costume designer Mynka Daper Editor Susan Littenberg Rated PG-13 93 minutes FACEBOOK TWITTER EMAIL ME PRINT COMMENTS Kirk Honeycutt THRnewsthr.com thr Comments Please enable JavaScript to view the <a href=""http//disqus.com/?ref_noscript"">comments powered by Disqus.</a> comments powered by Disqus The Hollywood Reporter (c) 2016 The Hollywood Reporter All rights reserved. Terms of Use | Privacy | Sitemap | About Our Ads About Us Login Daily Edition Subscribe Subscriber Services Back Issues Advertising Contact Us Careers Industry Jobs Follow Us On Twitter Find Us On Facebook Watch Us On Youtube Our affiliate publications Billboard Ad Week Backstage Casting",http://www.hollywoodreporter.com/hr/film-reviews/easy-a-film-review-1004113726.story,200,easya11,easya,hollywoodreporter
"Emma Stone makes it Easy to love her - NY Daily News Trending DEMOCRATIC NATIONAL CONVENTION HILLARY CLINTON KESHIA KNIGHT PULLIAM MICHAEL JORDAN DONALD TRUMP Sections Sections Home New York NYC Crime Bronx Brooklyn Manhattan Queens Education Weather Obituaries Sports Yankees Mets Giants Jets Knicks Nets Rangers Islanders Football Basketball Baseball Hockey Soccer College High School The Score More Sports News Crime U.S. World Politics Entertainment Gossip Games Entertainment Pics TV Movies Music Theater amp; Arts Horoscopes Daily Weekly Monthly Pet Horoscopes Lifestyle Health Homes Food Opinion Autos Buyers Guide Ratings amp; Reviews News amp; Views Photos amp; Galleries Covers Classifieds Trending DEMOCRATIC NATIONAL CONVENTION HILLARY CLINTON KESHIA KNIGHT PULLIAM MICHAEL JORDAN DONALD TRUMP entertainment Follow Us Facebook Twitter Instagram Pinterest YouTube Subscribe Follow UsNewsletter App Subscriptions Subscribe Get Our Newsletter A daily blend of the most need-to-know Daily News stories delivered right to your inbox. Sign Up Get the latest breaking news entertainment sports and more.Download Our App Subscribe to the newspaper our e-edition or both.Subscribe Select Sport Football Basketball Baseball Hockey Soccer College High School More Sports Gossip Games Entertainment Pics TV Movies Music Theater amp; Arts Share This facebook Tweet email Easy A review Emma Stones teen comedy is a John Hughes remix for Generation Text Emma Stone makes it Easy to love her Elizabeth Weitzman Thursday September 16 2010 110 PM facebook Tweet email Easy A star Emma Stone flashes her philosophy on life in a scene from the movie. (Adam Taylor) Elizabeth Weitzman Thursday September 16 2010 110 PM Title Easy A If every age gets the teen movie it deserves Generation Text could ask for nothing better than ""Easy A."" Will Glucks high school comedy combines the soul of John Hughes with the arch sass of Diablo Cody and delivers something delightfully new in the process. Expect to hear much more about Emma Stone whos thoroughly charming as misguided heroine Olive Penderghast. When we first meet Olive shes sharing her woes on a much-watched webcast. It seems Olive has become the school pariah in a tale that mirrors the book her English teacher (Thomas Haden Church) has assigned. Just like ""The Scarlet Letters"" Hester Prynne Olive has been humiliated and shunned primarily for having sex with the wrong person. Or not as it happens. What she really does is lie about having sex to the wrong people. Though still a virgin Olive caves to pressure from her sophisticated best friend (Aly Michalka) and invents a wild night with a nonexistent boy. Her false confession is overheard by the campus moralizer (Amanda Bynes) and spreads instantly through school. Once she finds herself saddled with a reputation Olive decides to mess with her tormentors by embracing the false rumors. Alas what seems like a good plan one day can when twisted by gossip and judgment become a disaster the next. And neither her crush (Penn Badgley) nor her parents (the delightful Stanley Tucci and Patricia Clarkson) nor even Nathaniel Hawthorne can rescue her Shes got to figure a way out on her own. Youd be hard-pressed to find a misfit loner as confident as Olive who bears her considerable tortures with remarkable grace. But Stone is so funny smart and sweet that we relate to her anyway. While Gluck and writer Bert V. Royal are too self-aware to hit the highs of the 80s classics they repeatedly reference their clever remix feels both of-the-moment and eternal. In fact they shouldnt be surprised if one of the kids who sees it is inspired to make her own teen comedy someday -- complete with nostalgic allusions to this one. eweitzmannydailynews.com Send a Letter to the Editor Join the Conversation facebook Tweet PC Richard and Son Get Daily News stories delivered to your inbox. Sign Up Follow Us Facebook Twitter Instagram Pinterest YouTube Keep in Touch Newsletter Apps Subscribe Feeds Support amp; Contact Contact Us Careers Media Kit Site Map Terms of Use Ad Choices Terms of Service Privacy Policy Daily News Covers (c) Copyright 2016 NYDailyNews.com. All rights reserved.",http://www.nydailynews.com/entertainment/movies/2010/09/16/2010-09-16_easy_a_review_emma_stones_teen_comedy_is_a_john_hughes_remix_for_generation_text.html,200,easya12,easya,nydailynews
