review,link,status_code,id,movie_key,critic
"Fast Five drives 90 mph in a 35 zone - StarTribune.com Home All Sections Search StarTribune Manage Account Log out Log In Subscriptions New Manage Existing Recently Visited Home Local Sports Business Opinion Variety Health Highlights Politics Nation World Science Weather Traffic Video Photography Obituaries Classifieds Autos Housing Jobs Minneapolis St. Paul East Metro North Metro South Metro West Metro Projects Local Columnists Jon Tevlin James Lileks Local Blogs Campus Confidential Class Act Dateline Minnesota Full Disclosure Lileks at Lunch MPLS. STP The Drive Yesterdays News State Fair 10000 Takes Data Drop Twins Vikings Wild Wolves Gophers Colleges Golf Lynx Motorsports Outdoors High Schools Soccer Sports Columnists Dennis Anderson Sid Hartman Patrick Reusse Chip Scoggins Jim Souhan Sports Blogs Access Vikings A Fans View Bloggin Scoggins Dennis Anderson Doug Smith Gold in the Barn Gridiron Gold Ice Gold On the Lynx On the Wolves Patrick+ Randball Russos Rants Sids Scoops Souhan on Sports StribSports Upload The Roman Empire Twins Insider Sports Podcasts Access Vikings Twins Insider Top Workplaces Business Columnists Lee Schafer Neal St. Anthony Business Blogs 3D Economics Food Market Just Listed Lee Schafer Point of Sale The Mill Commentary Editorial Steve Sack Letters Podcasts Playing Politics Books Celebs Comics amp; Games Horoscopes Eat amp; Drink Movies Music Stage amp; Arts TV amp; Media Best of MN Health Home amp; Garden Kids Health Style Taste The Good Life Travel Variety Columnists Gail Rosenblum C. J Variety Blogs Artcetera Escape Artists Greengirls Health Check Lileks  Lunch On Books Table Talk Wingnut World Class View all Obituaries Place an Obituary Notice Place an Ad Garage Sales Estate Sales Merchandise Pets Recreational Vehicles amp; Marina Newspaper Ads Auctions Search Used Vehicles Sell your Vehicle Advertise Rentals Commercial Foreclosures Find an Agent Find a Job Your Resume Your Account Employer A-Z Top Workplaces Post a Job Star Tribune All content Business listings Close Home Local Sports Business Opinion Variety Obituaries Classifieds Autos Housing Jobs More from the Homepage prev Twin Cities area braces for sex trafficking tied to Super Bowl No survivors in crash of Texas balloon carrying at least 16 people Pokemon Go poses problem for peace at Eden Prairie park memorial Russia tied to hack of program used by Clintons campaign St. Croix County girl charged in savage attack on brothers girlfriend 1958 St. Louis Park rambler gets Finnish lake home makeover Fans give Morneau loud return to Target Field Cottage Grove couple wrap 250K honeymoon treehouse around old bur oak Chad Greenway again ready to fend off youngsters in his final(?) NFL season Midwest Traveler Exploring the revived Eau Claire Wis. 6 reasons to like new Downtown East Commons park near stadium next Movies 120881284 Fast Five drives 90 mph in a 35 zone The plot to ""Fast Five"" swerves to Brazil where chases crashes and explosions seem to tear up half of Rio de Janeiro. By Colin Covert April 30 2011 -- 548pm Jaimie Trueblood Mct Paul Walker and Vin Diesel in ""Fast Five"" Text size comment share tweet email Print more Share on Share on LinkedIn Share on Google+ Share on Pinterest Copy shortlink Purchase Order Reprint As adolescent male power fantasies go ""Fast Five"" has an undeniable trashy charm. Things blow up right and left muscle cars are pulverized sexpots vamp and brawny men wallop the tar out of each other. Yet there are pauses between adrenaline-packed driving sequences shootouts and explosions for three romance subplots and two involving babies. Heres a popcorn flick strong enough for a man and gentle enough for a woman. The story such as it is begins with an exhilarating escape from a prison-bound police bus that rivals the spectacular train wreck that opens ""The Fugitive."" Cut to Rio de Janeiro where road-racing bandits Vin Diesel Paul Walker and Jordana Brewster join in a train robbery that ends with them wrongly accused of killing several DEA agents. With vengeful FBI agent Dwayne Johnson now on their tail they plan a 100 million caper that will allow their team to move to countries with no extradition and no speed limits. Like a grease-monkey ""Oceans Thirteen"" the film reassembles the cast of earlier installments with Chris ""Ludacris"" Bridges Tyrese Gibson and Sung Kang back on board. The film is handsomely and atmospherically shot in gritty hillside slums and backstreet garages. This is not the tour-guide Rio of bikinis and palm trees. The story makes only one excursion to the citys beaches and its a treat. A leggy member of Diesels crew does a Girl From Ipanema act in order to obtain a crooks handprint needed to open a high-tech safe. Her hands-on approach is more fun than lifting his fingerprints off a doorknob so you give the pandering scene a pass. Its a bigger stretch to ignore the fact that the crooks level half of Rio while street racing with the policia in the finale. The staggeringly destructive sequence stops just short of toppling the statue of Christ the Redeemer from his mountainous perch. FAST FIVE  OUT OF FOUR STARS  Rating PG-13 for intense sequences of violence and action sexual content and language. With performances that are adequate at best and stunts that defy the laws of physics ""Fast Five"" flouts every rule of good filmmaking but one -- its never dull. Thankfully director Justin Lin who filmed the previous two installments of the ""Fast"" quintet makes the proceedings noisy chaotic shameless fun. His extravagantly budgeted stunt scenes are so crisp and thrilling that youre willing to forfeit sharp storytelling and interesting characters. You cant have everything. View Comments Read our comment standards StarTribune.com welcomes and encourages readers to comment and engage in substantive mutually respectful exchanges over news topics. Commenters must follow our Terms of Use. Keep it civil and stay on topic. No profanity vulgarity racial slurs or personal attacks. Comments with web links are not permitted. Comments that violate the above will be removed. Repeat violators may lose their commenting privileges on StarTribune.com. Comments will be reviewed before being published. Powered by Livefyre } More from Star Tribune Federal judge strikes down Wisconsin election laws Why Democrats abortion stance is a deal-breaker Rash Report 2016 campaign narrative defies expectations Twins win on Mauers pinch-hit walk-off walk Courts strike blows to GOP voter restrictions in 3 states Pokemon Go poses problem for peace at Eden Prairie park memorial More from Entertainment Polls July 27 Poll If Hillary becomes president what title will Bill have? Should Hillary Clinton become the president Bill Clinton would become the first male White House spouse. This poses a pressing question for Americans what would we call him? Variety July 6 Adele fans show that her music reaches all ages Adele kicked off the first of her two-night Adele Live 2016 North American tour stop at Xcel Energy Center on Tuesday night. Polls June 23 Poll Which new State Fair food do you most want to try? Movies June 19 Finding Dory blows animation record out of the water The forgetful blue fish of ""Finding Dory"" is box office gold. Polls June 14 Poll Which celeb would you most like to chat with over coffee? Top Stories Twin Cities area braces for sex trafficking tied to Super Bowl 814am No survivors in crash of Texas balloon carrying at least 16 people 5 minutes ago Pokemon Go poses problem for peace at Eden Prairie park memorial 1020am Most Read Movie reviews The Names of Love and The Man Who Fell to Earth  Movies Reviewed in brief Road Hard Human Capital Unfinished Business  Movies No strings in Friends With Benefits  Movies Lovely Bones a murder mystery about life  Movies Spy movie Safe House has bone-rattling action  Movies Local Grants help put a fresh face on Minneapolis businesses Twin Cities area braces for sex trafficking tied to Super Bowl Variety 6 reasons to like new Downtown East Commons park near stadium Twenty One Pilots land smoothly in St. Paul Sports Offense gets a hard look during Vikings first practice Fans give Morneau loud return to Target Field Featured Gallery Photos This mid-century home for sale in Golden Valley is like walk... 13 photos Wallpaper wallpaper wallpaper. Listed for 674900. Business Obama signs bill requiring labeling of GMO foods Edinas Galleria adding space for as many as 12 new stores Politics Russia tied to hack of program used by Clintons campaign Gov. Mark Dayton looks back on 40 years of Democratic National Conventions 10000 Takes The art of parting We used to spend so much time there How I came to see bipolar disorder as my greatest strength Nation Reagan shooter Hinckleys return to normalcy has been years in making Powerball 478 million jackpot is nations 8th largest World Philippine president calls off truce after rebel attack Security suddenly boosted at Amsterdams Schipol Airport Celebrities Latest late-night battle Stephen Colbert vs. corporate lawyers Fox 9s Jonathan Choe takes his talent and sartorial style home to Boston StarTribune Follow Us On Facebook Twitter Google+ Pinterest Instagram Tumblr Company About the Star Tribune Contact us Jobs News in Education City Pages High school sports hubs Mobile and tablet apps Advertise with us Talk with a business consultant Media kit Classifieds Buy Star Tribune Store Photo Reprints Archived articles Back Copies Commercial reprints Licensing Customer support Feedback Manage your account Newspaper subscription Digital access eEdition Vacation hold/billing Website Terms of use Privacy policy Site index RSS (c) 2016 StarTribune. All rights reserved.",http://www.startribune.com/entertainment/movies/120881284.html,200,fastfive24,fastfive,startribune
"Fast Five Muscle cars shootouts and lots of fun Next up in Movies In Double Hour the timing is good News Sports EAGLES CAMP Business Health Entertainment Food Opinion Obituaries Search icon | SectionsClose Search Search Search Search icon News Breaking DNC Pennsylvania New Jersey Politics Education Sports Eagles Phillies Flyers Sixers Union College High School Entertainment Celebs amp; Gossip The Arts Things to Do Business Cars Jobs Pharma Philly Deals Real Estate Small Business The Street Health Kids Health Running Nutrition Sports Medicine Food Clean Plates Craig LaBan The Insider Opinion Blogs Columnists Think Tank Lifestyle Home amp; Design Sex amp; Dating Style Travel Marketplace Find a Home Job Listings Print Offers Online All Classifieds People Births Celebrations Engagements Obituaries Death Notices Your Day Event Calendar Horoscope Lottery Weather Newsletters Advertise Contact Us Permissions Reprints Powered By Inquirer logo Subscribe Daily News logo Subscribe entertainment -- Movies Fast Five Muscle cars shootouts and lots of fun Updated April 28 2011 -- 241 PM EDT Facebook icon Share Twitter icon Tweet Tumblr icon Tumblr Mail icon Email Reprints amp; Permissions REPRINTS Popular Stories Pennsylvanias new car seat law goes into effect in August Jul 28 - 911 PM Kenney said luxury boxes would raise 1M for schools; so far just 23K 108 AM Paul Walker left and Vin Diesel in ""Fast Five."" by Steven Rea Movie Critic Twitter icon Steven_Rea Close icon Mail icon Email Twitter icon Steven_Rea Steven Rea Movie Critic Steven Rea is the movie critic.  He is a member of the National Society of Film Critics author of the books Hollywood Cafe Coffee With the Stars and Hollywood Rides a Bike Cycling With the Stars and producer at ridesabike.com. More by Steven Rea Introducing Phillys Maris Curran director of Five Nights in Maine Jul 29 Weekend Movie Selections Jul 30 Bad Moms Mila Kunis and writers from The Hangover skewer the mommy wars raunchily Jul 29 Defying laws of physics laws of acting and the law of diminishing returns Fast Five delivers a ridiculously fun mix of motorized macho mayhem and multicultural bonding. With vintage muscle cars and special-purpose monster trucks over-the-top-stunts and a heist that makes Danny Oceans meticulously timed takedowns look like the stuff of a preschool party game this fourth sequel in the Fast and Furious franchise is blissfully brainlessly satisfying. More about Fast Five >> Its also about a half-hour too long but director Justin Lin who has now presided over three of these testosteronic affairs (starting with Tokyo Drift) can be forgiven. Let a kid loose in Toys R Us and its hard not to fill the shopping cart sky high. Fast Five opens with an audacious highway bust-out Dominic (Vin Diesel) is en route to prison where hes looking at 25 years when his pals Brian (Paul Walker) and Mia (Jordana Brewster) roar up alongside the bus carrying the jailbirds and topple the thing. If this was the real world the movie would end right here Theres no way anyone could survive that high-speed bus crash let alone walk away and fly off to Rio. And Rio de Janeiro is where they go. The filmmakers must have binged on repeated viewings of City of God and the first quarter of Edward Nortons The Incredible Hulk and realized there wasnt a better place on Earth to stage shantytown shootouts and rooftop chases splashed in vibrant graffiti colors. Throw in swooping aerial shots of Sugarloaf and the statue of Christ arms outstretched gazing down at the bay the beaches and the beautiful Brazilians - its downright cinematic. Plot? Fast Five has about five of them a train heist; a rescue mission; a kabillionaire drug lord (Joaquim de Almeida) with a vengeful streak; a MacGuffin of a computer chip and a bank job that involves removing a house-sized steel vault and towing it away with a couple of turbocharged automobiles. This is a reunion movie too as various sidekicks and supporting players from earlier installments - the grinning garrulous Roman (Tyrese Gibson) the master safecracker Tej (Ludacris) ace wheelman Han (Sung Kang) the Dominican duo Leo (Tego Calderon) and Santos (Don Omar) and the glammy whats-she-do-exactly? Gisele (Gal Godot) - assemble to plan and preen. And in the Battle of the Biceps Dwayne Johnson joins the fray as the square-jawed FBI guy determined to bring Dominic and his buddies back to the States. When Diesel and The Rock trade dialogue - and fists and automatic weapons fire - before partnering up to fight the evil drug king its like a thespian grand master class. Olivier and Burton fuggedaboutit. In the end Fast Five for all its propulsive police pursuits and its bad boys in pursuit of money is wholesome we-are-the-world stuff. Its not much of a spoiler to note that in one of the movies quiet moments (there are two) Mia announces shes pregnant. Boyfriend Brian takes a nanosecond to consider this news strokes his two-day beard and beams with joy. And Dom and the gang huddle around to express their joy and approval too. Fast and Furious Six We Are Family? Contact movie critic Steven Rea at 215-854-5629 or sreaphillynews.com. Read his blog ""On Movies Online"" at http//www.philly.com/philly/blogs/onmovies/. Published April 28 2011 -- 336 PM EDT The Philadelphia Inquirer Continue Reading More in entertainment Steven Rea > Philly director from NoLibs making waves in Hollywood Television > Game of Thrones Emmy chances next year? Zilch Celebrities amp; Gossip > Clintons party at Kimmel Center post-acceptance speech Austin folkie Sarah Jarosz goes to the head of her class with album tour Folk music is a rich fine palate for Sarah Jarosz the classically trained but rustic singer/songwriter coming to Ardmore Music Hall Sunday... Weekend Movie Selections TV picks Sharknado The 4th Awakens MTV gets Classic Koko - The Gorilla Who Talks and more Howard Dean had lots of great things to say about Philly Amy Schumer is coming to Philly for book signing East Passyunk Car Show and 11 other ways to recover from the DNC Longwood Gardens beloved trippy Nightscape returns 5 must-do events in Philly for August Philly.com logo is powered by Inquirer logo Digital Edition Subscribe Subscriber Services Daily News logo Digital Edition Subscribe Subscriber Services Twitter icon phillydotcom Facebook icon /phillydotcom News amp; Info News Sports Entertainment Business Health Food Lifestyle Opinion Event Calendar Marketplace Deals Find a Home Job Listings Print Offers All Classifieds About us About Philly.com Advertise Contact Us Licensing amp; Permissions Photo Reprints Newspapers In Education Career Opportunities Internships   Mobile Apps Email Notifications Morning headlines Sports Weekend planner Dining In and Out Business Health Lifestyle PMN Events Show all V Show some V (c) Copyright 2016 Philadelphia Media Network (Digital) LLC Terms of Use amp; Privacy Policy",http://www.philly.com/philly/entertainment/movies/20110429__Fast_Five___Muscle_cars__shootouts__and_lots_of_fun.html,200,fastfive25,fastfive,philly
"Fast Five is stuck between The Rock and a stupid place | Movie reviews | stltoday.com You are the owner of this article. Edit Article Add New Article Sign Up Log In Dashboard Logout My Account Dashboard Profile Saved items Logout Subscriber services Contact us E-edition Contests Apps Newsletters Obits News Education Election 2016 Databases Columnists Illinois Law and order Metro Nation Obits Political Fix St. Charles Weather Opinion Letters to the editor Columnists Business Top Workplaces Press releases Columnists Sports Cardinals Blues Mizzou Olympics SLU NFL Golf Forums Columnists Chats High schools Schedules Schools Sports Stats Go Entertainment Books Calendar Comics amp; games Dining Music Movies Television Theater amp; arts Columnists Lifestyles Advice Automotive Fashion Food and cooking Health Home and Garden Parenting Religion Travel Columnists Feast Magazine St. Louis Best Bridal Ladue News Multimedia Photos Videos Chats Forums Buy/sell Classifieds Real estate Business Directory Print Ads Newspaper ads Page reprints Autos Jobs Homes Archives Toggle navigation Menu Search Search Log In Using Your Account Log In Dont have an account? Sign Up Today My Account Dashboard Profile Saved items Logout 84deg Saint Louis MO (63101) Today Sunshine and clouds mixed. High 86F. Winds WNW at 5 to 10 mph.. Tonight Partly cloudy skies. Low 69F. Winds NNE at 5 to 10 mph. Updated July 30 2016  1153 am Full Forecast News Sports Business Go Life Buy/Sell Entertainment Close 1 of 7 Jaimie Trueblood Paul Walker (left) and Vin Diesel ""Fast Five."" (AP Photo/Universal Pictures Jaimie Trueblood) Jaimie Trueblood In this film publicity image released by Universal Pictures Vin Diesel left and Paul Walker are shown in a scene from ""Fast Five."" (AP Photo/Universal Pictures Jaimie Trueblood) Jaimie Trueblood In this film publicity image released by Universal Pictures Vin Diesel left and Paul Walker are shown in a scene from ""Fast Five."" (AP Photo/Universal Pictures Jaimie Trueblood) Jaimie Trueblood In this film publicity image released by Universal Pictures Dwayne Johnson left and Elsa Pataky are shown in a scene from ""Fast Five."" (AP Photo/Universal Pictures Jaimie Trueblood) HOEP In this film publicity image released by Universal Pictures Vin Diesel left and Dwayne Johnson are shown in a scene from ""Fast Five."" (AP Photo/Universal Pictures) HOEP In this film publicity image released by Universal Pictures Elsa Pataky left and Vin Diesel are shown in a scene from ""Fast Five."" (AP Photo/Universal Pictures) Jaimie Trueblood In this film publicity image released by Universal Pictures Dwayne Johnson is shown in a scene from ""Fast Five."" (AP Photo/Universal Pictures Jaimie Trueblood) Fast Five Fast Five is stuck between The Rock and a stupid place BY JOE WILLIAMS  Post-Dispatch Film Critic  joewilliamspost-dispatch.com  314-340-8344 Apr 28 2011 (...) Jaimie Trueblood Paul Walker (left) and Vin Diesel ""Fast Five."" (AP Photo/Universal Pictures Jaimie Trueblood) Jaimie Trueblood In this film publicity image released by Universal Pictures Vin Diesel left and Paul Walker are shown in a scene from ""Fast Five."" (AP Photo/Universal Pictures Jaimie Trueblood) Jaimie Trueblood In this film publicity image released by Universal Pictures Vin Diesel left and Paul Walker are shown in a scene from ""Fast Five."" (AP Photo/Universal Pictures Jaimie Trueblood) Jaimie Trueblood In this film publicity image released by Universal Pictures Dwayne Johnson left and Elsa Pataky are shown in a scene from ""Fast Five."" (AP Photo/Universal Pictures Jaimie Trueblood) HOEP In this film publicity image released by Universal Pictures Vin Diesel left and Dwayne Johnson are shown in a scene from ""Fast Five."" (AP Photo/Universal Pictures) HOEP In this film publicity image released by Universal Pictures Elsa Pataky left and Vin Diesel are shown in a scene from ""Fast Five."" (AP Photo/Universal Pictures) Jaimie Trueblood In this film publicity image released by Universal Pictures Dwayne Johnson is shown in a scene from ""Fast Five."" (AP Photo/Universal Pictures Jaimie Trueblood) Picture yourself in a cafe in Rio enjoying tangerine tea and a marshmallow pie. Suddenly somebody drives down the sidewalk -- a cop with maniacal eyes. You do a samba sidestep to avoid the car but it plows into a mother and son at a nearby ice-cream stand. The vehicle squeals to a stop and the hulking driver leans over the weeping boy who cradles his dying mother in his lap. ""Dont do drugs"" the driver says. Then he flashes a dazzling smile and you realize hes Dwayne ""The Rock"" Johnson. And hes gone.That trippy scene must have been deleted from ""Fast Five."" Any intrusion of true emotion or collateral consequences would spoil the fun of this beefsteak bacchanal. Like the other fantasies in the ""Fast and Furious"" series this ridiculous flick is all about cool cars confiscated cash and compliant cuties. The trendy new setting is Brazil where diehard car thief Dominic Toretto (Vin Diesel) and ex-cop Brian OConner (Paul Walker) are going to pull ""one last job"" before retiring.They assemble a dream team including Doms sister Mia (Jordana Brewster) safecracker Tej (Ludacris) mechanic Roman (Tyrese Gibson) and honeytrap Gisele (Gal Gadot). Because their target is Reyes (Joaquim de Almeida) a corrupt industrialist who controls the drug trade in Rios favela slums everything they do is excusable in the eyes of previously principled filmmaker Justin Lin (""Better Luck Tomorrow""). Even when American agent Hobbs (Johnson) arrives on the scene and starts slaughtering local henchmen hes impressed by Toretto who spares his life in a man-to-man meatdown -- er beatdown -- that is one of the highlights of the movie.Another highlight is the death-defying scene in which the thieves speed down the streets dragging what is essentially a 10-ton mace that levels buildings and whips corrupt cops into submission -- without harming a single civilian. ""Fast Five"" represents Yankee ingenuity of the brutally stupid kind. ""Fast Five""Two stars (out of four)  Rating PG-13  Run time 210  Content Violence and strong language Entertainment Watch a trailer for Fast Five Apr 28 2011 (...) Find movie showtimes Nov 11 2010 (...) Related Links Find showtimes for Fast Five Tags Fast Five Vin Diesel Paul Walker Dwayne Johnson Jordana Brewster Movie Review Justin Lin Joe Williams View (...) comments Most popular Old Standard Fried Chicken will close this weekend Smash-and-grab burglars hit original Sweetie Pies location in Dellwood Mellow Mushroom pizzeria opens in Sunset Hills Half-century-old Webster Groves Bookshop is closing Today in Pokemon Go Shootout in Vegas security risk in Israel finding Yuri in Russia Latest Disney movies help autistic boy find his voice in Life Animated Woody Allens Cafe Society is a bittersweet treat A trio of misfit mothers lose control in Bad Moms Jason Bourne is back doing what he does best Eat That Question taps into Frank Zappa Quick links Comics/games Contests Horoscopes Movie times Pop off forum Reel Time movie forum TV listings The Blender Tube Talk Sign up For Go Sneak Peek Pick up this Sundays paper for the Craft Beer Special Section Get your tickets for the St. Louis Post-Dispatch Arts + Craft Brewfest See ads from todays newspaper Manage your services Feast Magazine Ladue News St. Louis Best Bridal STL High School Sports Products and features Apps Archives Calendar Chats Comics amp; games Contests E-edition Forums Newsletters Our events Press releases Tools and services Advertise with us Autos Classifieds Contact us Homes Jobs Newspapers in Education Page reprints Post-Dispatch store Site help Subscriber services (c) Copyright 2016 STLtoday.com 900 N. Tucker Blvd. St. Louis MO | Terms of Use | Privacy Policy Powered by BLOX Content Management System from TownNews.com.",http://www.stltoday.com/entertainment/movies/article_3c3ae5ac-dc60-527e-96e0-2ad113c1f349.html,200,fastfive26,fastfive,stltoday
