review,link,status_code,id,movie_key,critic
"Fast Five (PG-13) | miami.com Home Nightlife Restaurants Hotels See amp; Do Movies Shopping Events Visual Arts Guides Espanol Review Fast Five (PG-13) The fifth installment is big loud long stupid... and fun Share Print Save to your profile By Connie Ogle | cogleMiamiHerald.com4/27/2011 Editor rating 2.5 The fifth installment of the Fast and Furious franchise is big loud long and stupid. Its leading man is a charisma-free block of muscle and its plot features holes big enough to drive a semi through (which these characters could and would do without hesitation). Its also embarrassingly fun the sort of speedy senseless violence-crammed action flick that virtually defines the summer season with superheroes who arent gods or crusaders in tights but guys in T-shirts and jeans who can drive cars really fast. Theyre criminals who break the law and yet are deeply morally sound so rooting for them is interesting without presenting any sticky ethical questions.The creators of the series changed things up a bit in Fast Five which was directed by Justin Lin who helmed Fast amp; Furious (No. 4) and Tokyo Drift (No. 3). Its morphed from a race to a heist movie -- think Oceans 11 without the glam of the Bellagio -- with a couple of excellent car chases and vicious fights and the new dimension makes the film accessible to viewers who dont know a 1970 Dodge Charger from a 2010 Toyota Prius while still providing pedal-to-the-metal thrills for original fans. When last we saw our heroes Dom (Vin Diesel) and former FBI agent Brian (Paul Walker) the latter was breaking the former out of state custody by crashing the prison-bound bus in which Dom was riding. (No one is killed though the bus flips about 40 times; innocent bystanders fare well in this movie to keep the heroes pure.) Fast Five opens with that rescue following Dom Brian and Doms sister/Brians girlfriend Mia (Jordana Brewster) on the lam into the shantytowns of Rio de Janeiro. Prudence suggests they should lay low. And yet theyre still tempted by the lure of Hollywoods bright and shiny cliche the ""one last job"" so that they can take the money and disappear off the radar for good.Trouble is the job goes awry (after the robbery of a moving train with a jaw-dropping ending). The trio discovers a secret hidden in one of the cars they steal and soon theyre at odds not only with a Rio crime lord (Joaquim de Almeida) but also a pumped-up federal agent (Dwayne Johnson in full raging badass mode) determined to bring them home to face justice. What else can they do but get the old gang back together and try to steal the bad guys cash while evading the law?The film is as silly as this sounds and yet somehow it works so long as you dont dwell on such questions as If these guys are so broke how can they afford an endless supply of equipment to set up the heist? Why would a pretty female agent be so easily swayed by Dom who possesses all the charm of an engine block? Why is Johnson glistening like hes just greased up for a wrestling match? Fortunately the action is well choreographed and intense enough to take your mind off such musings. Bringing back familiar characters from the earlier movies also proves inspired. A mostly funny supporting cast which includes Tyrese as the groups dynamic sweet talker and rapper Ludacris as a guy who just wants enough money to open a garage distracts you from the hilarity of scenes that require Diesel to exhibit emotion.This franchise has primarily been aimed at young male viewers but the screenwriters have also apparently wised up to the fact that this audience brings girlfriends to the movies and so a family-oriented theme runs throughout. The fact that that bit of manipulation works too -- along with a teaser ending setting up a Fast Six -- indicates this franchise has no plans ever to slow down. Movie Info Cast Vin Diesel Paul Walker Jordana Brewster Tyrese Gibson Dwayne Johnson. Director Justin Lin. Screenwriters Chris Morgan Gary Scott Thompson. Producers Vin Diesel Michael Fottrell Neal H. Moritz. A Universal Pictures release. Running time 130 minutes. Intense scenes of violence and action sexual material language. Playing at area theaters. Speak Up Movies Review Jason Bourne revitalizes the aging franchise (PG-13) 3 Review Cafe Society is a sumptuous exploration of love and regret (PG-13) 3 Review Captain Fantastic rewrites the book on raising a family (R) 3 Review3 movies to see 2 to skip this weekend July 29-31 The cyber-thriller Nerve doesnt compute (PG-13) These Bad Moms deserved better (R) 3 movies to see 2 to skip this weekend July 22-24 Star Trek Beyond flies at warp speed (PG-13) Absolutely Fabulous The Movie could have used more bite (R) Love is in the air in Isla Bonita (unrated) Lights Out will make afraid of the dark again (PG-13) Ice Age Collision Course is a disaster (PG) 3 movies to see 1 to skip this weekend July 15-17 See more in Review Advanced Search Find everything youll need for your trip Hotels | Attractions | Getting Around FlightHotelCarPackagesCruiseActivities What type of Package do you want? Flight and hotelFlight hotel and carHotel and carFlight and car Departing from Depart Morn.Noon.Eve. Going to Return Morn.Noon.Eve. Adults 01234 Seniors 01234 Children 01234 Search for packages More Package search options Going to Arrive 12 AM1 AM2 AM3 AM4 AM5 AM6 AM7 AM8 AM9 AM10 AM11 AM12 noon1 PM2 PM3 PM4 PM5 PM6 PM7 PM8 PM9 PM10 PM11 PM Return 12 AM1 AM2 AM3 AM4 AM5 AM6 AM7 AM8 AM9 AM10 AM11 AM12 noon1 PM2 PM3 PM4 PM5 PM6 PM7 PM8 PM9 PM10 PM11 PM Adults 01234 Seniors 01234 Children 01234 Search for packages More Package search options Departing from Depart Morn.Noon.Eve. Going to Return Morn.Noon.Eve. Adults 01234 Seniors 01234 Children 01234 Search for packages More Package search options Search for hotels in Check-in date Check-out date Rooms 123 Room 1 Adults 1234 Children 01234 Room 2 Adults 1234 Children 01234 Room 3 Adults 1234 Children 01234 Search for hotels More Hotel search options Departing from Depart 12 AM1 AM2 AM3 AM4 AM5 AM6 AM7 AM8 AM9 AM10 AM11 AM12 noon1 PM2 PM3 PM4 PM5 PM6 PM7 PM8 PM9 PM10 PM11 PM Going to Return 12 AM1 AM2 AM3 AM4 AM5 AM6 AM7 AM8 AM9 AM10 AM11 AM12 noon1 PM2 PM3 PM4 PM5 PM6 PM7 PM8 PM9 PM10 PM11 PM Adults 1234 Seniors 01234 Children 01234 More Flight search options Search for flights Pick-up location Pick-up 12 AM1 AM2 AM3 AM4 AM5 AM6 AM7 AM8 AM9 AM10 AM11 AM12 noon1 PM2 PM3 PM4 PM5 PM6 PM7 PM8 PM9 PM10 PM11 PM Drop-off 12 AM1 AM2 AM3 AM4 AM5 AM6 AM7 AM8 AM9 AM10 AM11 AM12 noon1 PM2 PM3 PM4 PM5 PM6 PM7 PM8 PM9 PM10 PM11 PM Car class No PreferenceEconomyCompactMidsizeStandardFull SizePremiumLuxuryConvertibleMini-vanSport Utility Vehicle Search for cars More Car search options Select a top destination ----------------------------AfricaAlaskaAsiaBahamasBermudaCanada - New EnglandCaribbeanCaribbean - EasternCaribbean - SouthernCaribbean - WesternEuropeHawaiiMediterraneanMediterranean - EasternMediterranean - WesternMexicoNorthern Europenowhere (no port stops)Panama CanalSouth AmericaSouth PacificTransatlanticTranspacificUnited States amp; CanadaUS Pacific CoastWorld Departing in Cruise length Show All1-2 nights3-5 nights6-9 nights10-14 nights15+ nights Search for cruises More Cruise search options Destination Start date End date Search for activities More Activities search options Sign up for our weekend guide Make your plans with our Weekend Concierge email sent to your inbox every Wednesday. Follow us Follow Miamicom Nightlife Band of the Hour Clink Club Scout Latin Nightclubs Velvet Underground Weekend Ticket Nightclub Photo Galleries Restaurants Miami Waterfront Restaurants First Look The Big Review Dining Adviser Hotels Cheap Hotel Deals Hip Miami Hotels Miami Hotel Lounges Hotel Hopping The Suite Life See amp; Do Miami Golf Courses Miami Culture Events Miami Museums Miami Animal Attractions Miami Theatre Center Stage Miami Outdoor Events Movies Reviews Theaters Showtimes Gay Gay clubs Gay photo galleries Shopping Spa Fancy Boutique of the Week Sawgrass Mills Guide Kendall Shopping Guide Lincoln Road Shopping Guide Aventura Mall Shopping Guide Adults Miami Strip Club Guide Broward Strip Club Guide Adult Toy Store Guide Featured Dancer Risque Business Toy Joy Espanol Compras Que Hacer Restaurantes Vida Nocturna Hoteles Connect with us Contact us | Like us on facebook | Follow us on twitter | Sign up for our newsletter | RSS Correct us Get listed | Report an error About us | Privacy Policy | Terms of service | About our ads | Sitemap (c) 2016 Miami.com. All rights reserved. Miami.com logos graphics designs page headers icons and buttons are the property of the Miami Herald Media Co.",http://www.miami.com/action-flick-franchise-stays-high-speed-article,200,fastfive8,fastfive,miami
"Fast Five preview Vin Diesel and friends are back in fifth film in the Fast and Furious series |       NJ.com comments Fast Five preview Vin Diesel and friends are back in fifth film in the Fast and Furious series Print Stephen Whitty | ArtiSyndicate By Stephen Whitty | ArtiSyndicate The Star-Ledger Email the author | Follow on Twitter on April 29 2011 at 835 AM View/Post Comments Jaimie Trueblood Vin Diesel right reprises his role as a car thief in ""Fast Five"" the latest movie in the Fast and Furious series. Brian OConner (right) plays Paul Walker Fast Five"" not only stars Vin Diesel and Dwayne Johnson it puts them in a massive fistfight. It fills its Imax screen with big guns male bonding muscle cars stuff getting broken things blowing up cold beer and sweat. If there were any more testosterone here Jose Canseco could have boiled down the screen and injected it. If thats all youre looking for -- two hours of slugfests and squealing tires -- well ""Fast Five"" reliably delivers. You may feel a little stupider -- and slightly deafened -- after watching it but you wont feel as if you had your pocket picked. This is as the title is awkwardly meant to inform us the fifth film in the franchise. If youre keeping a timeline though its actually the fourth story chronologically coming right before ""Tokyo Drift."" And if you are keeping a timeline of the ""Fast and Furious"" series -- well you need to get out more. Seriously. Anyway the setup here has master car thief Diesel cop-gone-crook Paul Walker and Walkers love (and Diesels sis) Jordana Brewster on the run in Rio. Where Diesel says its time for ""one last job -- then we disappear forever."" Movie Review FAST FIVE (PG-13) Universal (122 min.) Directed by Justin Lin. With Vin Diesel Paul Walker Jordana Brewster. Now playing in New Jersey. Rating note The film contains constant violence and some barely there bikinis. Stephen Whittys Review TWO AND A HALF STARS Yeah right. We know how easily that little plan always works out in the movies. Of course these characters are criminals which means the script has to get awfully cute pretending not to endorse their behavior. So they only steal from other worse criminals -- and all the cops chasing them are corrupt and therefore no better than they are. The one exception being Johnson a federal agent determined to bring them down. Johnson is even more of a cartoon than usual made up with so much bronzer and manly moisture he looks like a side of barbecued ribs. (Still hes Sir Ian McKellen next to the low-grade Diesel who isnt so much phoning in his performance as sending it by carrier pigeon.) But if you buy a ticket to one of these movies its not to admire the performances (although supporting players Tyrese Gibson and Ludacris contribute some nice low-key humor). Its to see the cars and marvel at the car chases. Director Justin Lin who made two of the other films in the series puts both on display. Lins not good with physical action (when Diesel and Johnson finally square off its such a blur of closeups you cant tell the bald heads from the biceps). But the cars are lit with far more love than the actresses and the chases are done with care. Whats here beyond that? Not much. But the chase scenes are great. The four-wheeled stars are all shown off to advantage. And while you dont want to wish criminals a happy retirement if Diesel and company really do disappear after this one last job -- well that would be just fine. View/Post Comments Related Stories Listen to the latest episode of our TV podcast Subscribe on iTunes Subscribe on Stitcher Most Read Find Local Real Estate Jobs Autos Businesses Find a job Buy or sell a car Find a place to live See whats for sale Find a business View obituaries Get Your Weekly Entertainment Guide TV recaps movie and music reviews local dining guides and the latest in Atlantic City entertainment news delivered to your inbox Leave this field blank optional Check here if you do not want to receive additional email offers and information. See our privacy policy Thank you for your subscription To view and subscribe to any of our other newsletters please click here. Entertainment Essentials Search music dining more event listings Inside Jersey N.J.s lifestyle magazine OMJ.com N.J. celebrity and style Entertainment Listings Events Music Food Active Discussions nj.com About Us About NJ.com Advertise with us Contact Us Jobs at NJ Advance Media Newsletters RSS feeds More on NJ.com Interact Weather Blogs Premium Blogs Site map Claim your freebusiness listing Search Place an ad Sell your car Sell/rent your home Post a job Post a free classified ad Apartments amp; rentals NJ.com Sections N.J. News Local News N.J. Politics Sports High School Sports Entertainment Food amp; Recipes Living Business Opinion Inside Jersey Shore Obituaries Jobs Autos Real Estate Rentals Classifieds Shopping Good Deals Local Businesses Special Sections Contribute to NJ.com Submit your photos Submit your videos Forums Register for free with NJ.com Submit an event Follow Us Twitter | Facebook Google+ | foursquare Newspaper stories and photos The Star-Ledger | Subscribe The Times of Trenton | Subscribe The Jersey Journal | Subscribe South Jersey Times | Subscribe Hunterdon County Democrat | Subscribe Star Gazette | Subscribe The Messenger-Gazette The Warren Reporter Independent Press Suburban News Learn more about our newspapers Mobile iPhone Android apps | Tablet apps Registration on or use of this site constitutes acceptance of our User Agreement and Privacy Policy (c) 2015 New Jersey On-Line LLC. All rights reserved (About Us).The material on this site may not be reproduced distributed transmitted cached or otherwise used except with the prior written permission of New Jersey On-Line LLC. Community Rules apply to all content you upload or otherwise submit to this site. Contact interactivity management. Ad Choices",http://www.nj.com/entertainment/movies/index.ssf/2011/04/fast_five_preview_vin_diesel_and_friends_are_back_in_fifth_film_in_the_fast_and_furious_series.html,200,fastfive9,fastfive,nj
"Fast Five Review and Showtimes Vin Diesel in Fast Five Homepage Todays Paper Homepage Post TV Politics Opinions Local Sports National World Business Tech Lifestyle Entertainment Classifieds Jobs Real Estate Events GoingOutGuide Movies Username Sign in Subscribe Home Delivery | Digital Fast Five Find x Showtimes x Current Location Share Share on Facebook Share on Twitter Share by Email Share on Pinterest Share on Google Plus Share on Tumblr Add to Go Out List Print 0 0 Editors pick Fast Five 0 0 Trailer Critic rating | MPAA rating PG-13 Genre Action/Adventure The newest ""Fast and Furious"" installment gets 2011s summer movie season off on the right lead foot. Starring Vin Diesel Paul Walker Jordana Brewster Chris ""Ludacris"" Bridges Tyrese Gibson Sung Kang Gal Gadot Matt Schulze Tego Calderon Don Omar Director Justin Lin Running time 210 Release Opened Apr 29 2011  Editorial Review Race down memory lane again By Sean OConnell Wednesday April 27 2011 Quick Name a Hollywood franchise that has produced its finest installment on the fifth try. Its tough to do right? Everything from ""Harry Potter"" to ""Police Academy"" tends to peter out after two or three films. But the burly brawny ""Fast Five"" bucks the trend. By shifting into a previously untapped gear it delivers the most entertaining ""Fast and Furious"" adventure while also getting 2011s summer movie season off on the right lead foot. Lets not get too carried away though. This remains a ""Fast"" film and likely wont win over new converts to the 10-year-old franchise. But the reason this series has survived for a decade is because it respects its target audience caters to their adrenalized needs and rarely tries to be something it isnt. This is a souped-up soap opera. Its ""Guiding Light"" for guys. Chris Morgans script trots out melodramatic plot twists that are the norm on daytime television unplanned pregnancies; betrayals orchestrated by close teammates; a presumed-dead character returning from the grave. But as long as cars are racing metal is crunching and bikinis are hugging female curves die-hard ""Fast"" fans either wont notice or simply wont let it spoil their fun. Aside from its wayward third installment the ""Fast"" series has followed the dangerous exploits of monotone street racer Dom Toretto (Vin Diesel) and Brian OConner (Paul Walker) the ex-cop who gradually became Doms high-flying partner in crime. The duos latest impossible mission takes place in and around Rio de Janeiros congested favelas where Torettos crew uses vital information stored on a stolen microchip to rob a sadistic drug kingpin (oily Joaquim de Almeida) all while avoiding Hobbs (Dwayne Johnson) the road-raging federal bounty hunter ordered to bring these fugitives to justice. That may sound like too much plot but director Justin Lin helming his third consecutive ""Fast"" film has become adept at steering this continuing story around major plot holes as we race toward the next muscular action sequence. Morgan may have constructed a durable heist at the heart of ""Fast Five"" but its Lins elaborately planned and eye-popping automobile stunts -- which avoid artificial-looking CGI whenever possible -- that butter this movies bread. Characters dangle from the hoods of trucks as they are driven into rapidly moving trains. A footrace across Brazils rooftops looks like a large-scale game of Tetris. And the films final chase scene which demolishes most of downtown Rio as two cars drag a multiton safe will make Michael Bay drool with envy. Just about every actor previously involved with a ""Fast"" film returns so Lin finds a place for cocky Roman (Tyrese Gibson) tech-savvy Tej (Chris ""Ludacris"" Bridges) and mainstay Mia (Jordana Brewster) who has provided eye candy since the first ""Fast"" in 2001. Johnson -- who Ill always consider to be The Rock despite his name change -- is the films notable newcomer yet he plugs so effortlessly into the franchises brash vibe you have to wonder why it took so long for him to be included. His relentless agent is an ideal foil to Diesels arrogant crook and when they clash in a no-holds-barred fistfight the audience will understand how teenage girls felt when they finally saw Bella kiss Edward in ""Twilight."" To borrow a culinary analogy Rock is chocolate to the ""Five"" series peanut butter. Now that Ive tasted the two flavors together I cant ever imagine them being apart and am excited that Rock appears to be sticking around for future installments. Oh there will be more ""Fast"" films. Stick around through the ""Fast Five"" credits to learn where the storys heading next. Producers have suggested in recent interviews that the sixth ""Fast"" is likely to be the last but I dont believe them for a second. Once that aforementioned baby is born he or she will be groomed to assume the lead role in ""Fast"" parts nine through 12. By then I can only assume Walker and Diesel will be infiltrating NASA so they can hijack rockets in outer space. Contains intense sequences of violence and action sexual content and language. Want to go? 0 Been there? 0 Rate it 0 Share Recently Reviewed Creative Control Eye in the Sky Hello My Name Is Doris KTown Cowboys Miracles from Heaven Remember The Bronze The Confirmation The Divergent Series Allegiant The Divergent Series Allegiant The IMAX Experience Embrace of The Serpent (El abrazo de la serpiente) Knight of Cups Top Fast Five Find x Showtimes x Current Location Share Share on Facebook Share on Twitter Share by Email Share on Pinterest Share on Google Plus Share on Tumblr Add to Go Out List Print 0 0 Going Out Guide Home Restaurants Bars amp; Clubs Movies Trailers In Theaters Coming Soon Critics Picks Top Box Office Events Music Museums Theater amp; Dance Visitors Guide Follow Us Homepage | Sign in | Talk to Us | Newsletters Copyright (c) 2016 The Washington Post x Share on Facebook Share your Want to go and Been there lists with Facebook friends. See where your friends want to go or where theyve been and make plans together Connect with facebook No thanks - maybe later. Close x You must be logged in to use that feature. Login x Submit your review Alert The following underlined text is not permitted Title your review Choose a star rating Alert The following underlined text is not permitted Leave a review 0 of 750 Characters. HTML and URLs are prohibited Post to Facebook Thank you for submitting the review. Cancel Submit x Request Removal of a User Review You have chosen to submit a user review for possible removal by our editorial staff due to its offensive or inappropriate nature. Please confirm that you would like the review submitted for evaluation. If our editors find that the review does not fall within our user review guidelines then it will be removed promptly. The user review that you selected has been submitted for evaluation by our editors. It usually takes us about 5-7 days to evaluate a review.Thanks for the notification Submit For Evaluation Close x E-mail This Going Out Guide Profile to a Friend Fast Five Send This Profile to Enter the e-mail address of the recipient(s) separated by commas. Please limit to 10 recipients. Your E-mail Address Add a Personal Message (Optional) - max 150 chars HTML tags will be stripped Your email has been sent. Close Submit x Sign me up for these weekly newsletters Please choose at least one newsletter. Eats amp; Drinks Movies Going Out Guide events With the Kids Subscribe x Subscribe newsletters Cancel x Share Twitter Email Facebook Pinterest Google plus Tumblr Add to Go Out List Print Close x Alert Please enter a keyword in the search box OK","http://www.washingtonpost.com/gog/movies/fast-five,1161742/critic-review.html",200,fastfive10,fastfive,washingtonpost
