review,link,status_code,id,movie_key,critic
"Fast Five Grindingly Mechanical But With Car Porn Who Cares? Home Movies Waxword Alonso Duralde Steve Pond Deal Central Box Office Movie Reviews Film Festivals TV Ratings TV Reviews Media Media Alley Hollywood D.C. Awards Oscars Emmys Golden Globes SAG Awards Tech Culture Music Theater Party Report Reviews Movie Reviews TV Reviews Videos Photos Events Power Women Breakfast ShortList TheGrill Features EmmyWrap Emilia Clarke EmmyWrap Sarah Paulson EmmyWrap Hello and Goodbye CANNES CHLOE SEVIGNY Cannes Wrap Directors Portfolio OscarWrap Voting OscarWrap Alicia Vikander OscarWrap Saoirse Ronan OscarWrap The Hateful Eight OscarWrap Spotlight OscarWrap Actors Dark Horses We Love Jake Gyllenhaal The Walk Fall TV Kingdom Cannes Podcast Power Women Breakfast TheGrill Oscar Screening Series ShortList Powergrid Jobs Facebook Twitter Instagram Google+ Youtube Pinterest LinkedIn Search Entertainment News Covering Hollywood Home Movies Waxword Alonso Duralde Steve Pond Deal Central Box Office Movie Reviews Film Festivals TV Ratings TV Reviews Media Media Alley Hollywood D.C. Awards Oscars Emmys Golden Globes SAG Awards Tech Culture Music Theater Party Report Reviews Movie Reviews TV Reviews Videos Photos Events Power Women Breakfast ShortList TheGrill Features EmmyWrap Emilia Clarke EmmyWrap Sarah Paulson EmmyWrap Hello and Goodbye CANNES CHLOE SEVIGNY Cannes Wrap Directors Portfolio OscarWrap Voting OscarWrap Alicia Vikander OscarWrap Saoirse Ronan OscarWrap The Hateful Eight OscarWrap Spotlight OscarWrap Actors Dark Horses We Love Jake Gyllenhaal The Walk Fall TV Kingdom Cannes Return to Content Fast Five Grindingly Mechanical But With Car Porn Who Cares? Movies | By    Leah Rozen on April 28 2011  410 pm Email Print The fifth in the series moves from just pedal-to-the-metal into ""Oceans Eleven"" territory Car porn judging from the blissful grins on the many men in the audience at the screening I saw of ""Fast Five"" in Manhattan is as beloved by a certain half of the population as real porn. To qualify as car porn a movie must treat the vehicles shown -- mostly muscle cars -- with the same reverence and adoration if not more that it shows its human stars. The camera must caress every metallic line on the vehicles the lighting and cinematography bring out their shiny gleam and the soundtrack enhance the purr and roar of their accelerating engines. Its not enough that the cars in car-porn movies look good -- they also must perform with va-va-vroom. These babies must go fast bash into other cars into trucks into trains and into inanimate objects ... and then blow up. The noisier the better. An emphasis on and appreciation for cars has taken the ""Fast and Furious"" franchise a long way. The first ""The Fast and the Furious"" which starred Vin Diesel and Paul Walker came out 10 years ago and focused on the subculture of street racing and car theft in Los Angeles. Two years later ""2 Fast 2 Furious"" was set in Miami and had Walker driving fast and bringing down a drug dealer. The third 2006s ""The Fast and the Furious Tokyo Drift"" relocated to Japan and tried putting in a no-name cast and making the cars the stars. The last film 2009s ""Fast amp; Furious"" re-teamed Walker and Diesel (as well as bringing back Jordana Brewster and Michelle Rodriguez the female leads from ""The Famp;F"") and had them zipping between L.A. and Mexico to bring down a drug dealer. Three out of the four of the original stars (Diesel Walker and Brewster) are back for ""Fast Five"" -- and the movie delivers all the fast cars action and tough guy talk fans could want. Two hours and three minutes worth. Director Justin Lin who handled the third and fourth films returns for another lap adroitly putting it through its paces Open with a well-executed high-speed stunt sequence in which Walker and Brewster help Diesel escape from a prison bus? Check. Send everyone down to Rio and mix up atmospheric shots contrasting beaches and favelas? Check. Stage a robbery in which fancy sports cars are downloaded from a moving train and then driven off at top speed through the desert? Check. As for plot we get our boys are on the run from the law. To finance a permanent escape to an extradition-free paradise they plan an elaborate 11 million heist of funds belonging to a powerful Brazilian drug lord. By cleverly putting more emphasis on the mechanics of assembling the crew for a heist and carrying off a complicated robbery ""Fast Five"" sets up for a focal switch in the franchise away from just pedal-to-the-metal to more of an ""Oceans Eleven"" and ""Italian Job"" kind of mode. It also introduces Dwayne ""The Rock"" Johnson into the mix as a steely law enforcement officer who likely -- per a scene at the end credits -- has a future with the franchise or in a spin-off series. All of that said ""Fast Five"" is grindingly   mechanical -- and not just because of all the emphasis on car repairs and retooling. Its full of expository howlers (""You realize were gonna go up against the most powerful guy in Rio and take all of his money?"" asks Walker recapitulating the basic plot for those who may have gone out for popcorn). And it doesnt help that Diesel Walker and Johnson collectively have an expressive range as wide as a stick of gum. But silly me no one goes to these movies for the acting or lyrical dialogue. They want tough. And really does it get any tougher than having Johnson when instructing an underling to shadow a suspect say ""If he goes to the john I want to know how many times he shakes it."" If Shakespeare had lived in an age when he could have climbed into a Corvette Pantera or Ford GT40 -- all autos that streak through ""Five"" -- Im sure he would have written exactly that same line. Breaking News To Your Inbox. Sign up >> http//twitter.com/share?text=Fast Five Grindingly Mechanical But With Car Porn Who Cares?amp;via=TheWrapamp;url=http%3A%2F%2Fwww.thewrap.com%2Ffast-five-grindingly-mechanical-car-porn-who-cares-26889%2Famp;t=Fast Five Grindingly Mechanical But With Car Porn Who Cares? http//www.facebook.com/sharer.php?u=http%3A%2F%2Fwww.thewrap.com%2Ffast-five-grindingly-mechanical-car-porn-who-cares-26889%2Famp;t=Fast Five Grindingly Mechanical But With Car Porn Who Cares? Email Print You may like... Dwayne Johnson Fast and Furious Fast Five Leah Rozen Paul Walker The Rock Vin Diesel TheWrap Featured Video - Sponsored Most PopularMost SharedMost CommentedStephen Colbert Cant Use Colbert Report Character on CBS Lawyers Say (Video)46367 ViewsHillary Clinton Has to Raise Voice to Be Heard Over Protesters During Nomination Acceptance Speech12780 ViewsMarvel Surprise Avengers Infinity War Wont Be Split Into 2 Movies10871 ViewsJerry Doyle Babylon 5 Star and EpicTimes Founder Dies at 608255 ViewsDoes Star Trek Beyond Have a Post-Credits Scene?6892 ViewsAnn Coulter Hammered by Conservatives for Smearing US War Heros Dad as Angry Muslim5984 Views7 Stranger Things Fan Theories About Season 25302 ViewsMTV Star Tyler Posey Slammed For Fake Coming Out on Social MediaHBO Programming Boss Pelted With Sexual Violence Questions Over GoT Night OfGame of Thrones Season 8 Will Be the Last HBO ConfirmsJon Stewarts HBO Project Is an Animated Parody of a Cable News NetworkGame of Thrones Star Sophie Turner Reveals Her No. 1 Hope for Sansa Stark (Video)Bill Mahers Real Time Renewed by HBO Through 2018Jason Bourne Jacks Up Weekend Prediction With 23 Million FridayStephen Colbert Cant Use Colbert Report Character on CBS Lawyers Say (Video)739 CommentsAnn Coulter Hammered by Conservatives for Smearing US War Heros Dad as Angry Muslim45 CommentsJustin Bieber Lookalike Botched Star Tobias Strebel Died of Multiple Drugs Coroner Says36 CommentsMichael Jacksons Family Sues Radar Online for 100 Million Over Sexual Abuse Reports24 CommentsJerry Doyle Babylon 5 Star and EpicTimes Founder Dies at 6021 CommentsPaul Simon Moves the Democratic Convention With Classic Ballad (Video)20 CommentsBrie Larson Confirmed to Play Captain Marvel17 Comments (c) The Wrap News Inc. 2016Privacy Policy Partners Featured (c) The Wrap News Inc. 2016Privacy Policy ConnectFacebook Twitter YouTube Featured BlogsWaxword Steve Pond Alonso Duralde Media Alley Party Report Hollywood D.C. TheGrill Conference Obits Hello Hollywood InformationMasthead Newsletter Subscription About Us OscarWrap 2016 OscarWrap 2015 EmmyWrap 2016 EmmyWrap 2015 CannesWrap 2016 CannesWrap 2015 Fall TV Preview Press Releases Contact Advertise With Us Jobs",http://www.thewrap.com/awards/column-post/fast-five-grindingly-mechanical-car-porn-who-cares-26889,200,fastfive0,fastfive,thewrap
"Page not found - The New Yorker The New Yorker Sign in Link your subscription Shop F T G+ Home Election 2016 News Culture Books Science amp; Tech Business Humor Cartoons Magazine Video Archive Subscribe Subscribe Search Our apologies this is almost certainly not the page you were looking for. Please try the search tool above or visit our home page. Back to the Homepage About Us FAQ Strongbox Customer Care Cartoon Bank On The Town RSS Contact Us The New Yorker Store Careers Reprints/Permissions Press The New Yorker Media Kit Conde Nast Digital Subscribe to a magazine View All Titles - - - - - - - - - - - - - - Allure Architectural Digest Bon Appetit Brides Conde Nast Traveler Details Glamour Golf Digest Golf World GQ Lucky Self Teen Vogue The New Yorker Vanity Fair Vogue W Wired Other Conde Nast sites - - - - - - - - - - - - - - Allure Architectural Digest Ars Technica Bon Appetit Brides.com Conde Nast Traveler Concierge Details Epicurious Glamour Golf Digest Golf World GQ Hotel Chatter Jaunted Lucky NutritionData Reddit The Scene Self Style Teen Vogue Vanity Fair Vegas Chatter Vogue W Wired Use of this site constitutes acceptance of our User Agreement (effective January 1 2014) and Privacy Policy (effective January 1 2014). Your California Privacy Rights The material on this site may not be reproduced distributed transmitted cached or otherwise used except with the prior written permission of Conde Nast. Ad Choices <a href=""http//www.omniture.com"" title=""Web Analytics""></a>",http://www.newyorker.com/arts/reviews/film/fast_five_lin,404,fastfive1,fastfive,newyorker
"Movie review Lawless ""Fast Five"" roars back into action in Rio - The Denver Post News News Latest News Colorado News Nation / World Obituaries Marijuana Education Environment Crime amp; Courts Weather Your Hub Sports Sports Olympics Denver Broncos College Sports Colorado Rockies Preps Colorado Avalanche Outdoors Denver Nuggets Boxing / MMA Colorado Rapids Scores and Standings Sports Columnists Sports on TV/Radio Business Business Aerospace Airlines Economy Energy Real Estate Retail Technology Telecom Tourism Entertainment Entertainment Arcade Games Arts Books Calendar Comics Movies Music Reverb Music Theater Television Television Listings Travel Lifestyle Lifestyle Ask Amy Fashion Food amp; Drink Restaurants amp; Dining Fitness Home amp; Garden Horoscopes Opinion Opinion Editorials Columnists Letters Perspective Cartoons Opinion Polls Politics Politics Election Colorado Legislature Denver Politics Local Politics National Politics Cannabist Classifieds Classifieds Cars Homes Jobs Today Subscribe Newsletter News News Latest News Colorado News Nation / World Obituaries Marijuana Education Environment Crime amp; Courts Weather Your Hub Sports Sports Olympics Denver Broncos College Sports Colorado Rockies Preps Colorado Avalanche Outdoors Denver Nuggets Boxing / MMA Colorado Rapids Scores and Standings Sports Columnists Sports on TV/Radio Business Business Aerospace Airlines Economy Energy Real Estate Retail Technology Telecom Tourism Entertainment Entertainment Arcade Games Arts Books Calendar Comics Movies Music Reverb Music Theater Television Television Listings Travel Lifestyle Lifestyle Ask Amy Fashion Food amp; Drink Restaurants amp; Dining Fitness Home amp; Garden Horoscopes Opinion Opinion Editorials Columnists Letters Perspective Cartoons Opinion Polls Politics Politics Election Colorado Legislature Denver Politics Local Politics National Politics Cannabist Classifieds Classifieds Cars Homes Jobs Movie review Lawless ""Fast Five"" roars back... Share thisClick to share on Facebook (Opens in new window)Click to share on Reddit (Opens in new window)Click to share on Twitter (Opens in new window)Click to print (Opens in new window)Click to email this to a friend (Opens in new window)MoreClick to share on LinkedIn (Opens in new window)Click to share on Pinterest (Opens in new window)Click to share on Tumblr (Opens in new window)Submit to Stumbleupon (Opens in new window) Trending Broncos camp fan guide Texas balloon crash Woody Paige retiring Sports Authority bonuses GABF tickets Mile High Roundup Entertainment Movie review Lawless ""Fast Five"" roars back into action in Rio Share thisClick to share on Facebook (Opens in new window)Click to share on Reddit (Opens in new window)Click to share on Twitter (Opens in new window)Click to print (Opens in new window)Click to email this to a friend (Opens in new window)MoreClick to share on LinkedIn (Opens in new window)Click to share on Pinterest (Opens in new window)Click to share on Tumblr (Opens in new window)Submit to Stumbleupon (Opens in new window) Vin Diesel as Dominic Toretto in ""Fast Five."" By  Lisa Kennedy PUBLISHED April 27 2011 at 1240 pm | UPDATED May 4 2016 at 323 pm Sign up for newsletters and alerts Submit your news tips or photos Most Popular Donald Trump stumps in Colorado promises ""No more Mr. Nice Guy"" Chris Harris INT injuries and 8 other observations from Day 2 of Broncos training camp Broncos offensive linemen can live with the blame game. Theyre built for it. LoDo shooting leaves one dead another injured Peyton Manning stars in 3 new hilarious DIRECTV ads with Lionel Richie Woody Paige retiring from The Denver Post ""Ill take gas pedals girls and guns for 200 Alex."" ""What pop-culture phenomenon runs on Diesel fuel?"" ""What is The Fast and the Furious film franchise?"" Yes the once-loud but oddly modest street-racing franchise has re-revved the engines on a fifth model. A decade after Dominic Toretto and undercover fed Brian OConner first squared off in the underground racing world of Los Angeles -- becoming family thanks to Doms sister Mia -- comes ""Fast Five."" This time the action is set in Brazils Rio de Janeiro and reunites the trio and their cohort in ""one last job."" You know the kind a payoff too big to resist a violent nemesis begging for a shellacking a heist that allows the tarnished heroes a graceful very comfortable exit. The chemistry of the core cast -- steered by Vin Diesel and Paul Walker -- keeps this outing from running on fumes. And things shift into a smoother gear when Chris ""Ludacris"" Bridges and Tyrese Gibson arrive in Rio reprising their roles as gear-genius Tej and OConners childhood friend Roman. The two do an easy jig of competition and camaraderie. Shun Kang and Gal Gadot do a flirty sexy-nerd minuet as Han and Gisele. ""Fast Five"" offers fewer high-octane pleasures than earlier films although its not for lack of trying. Director Justin Lin has never been one to cheat on action set-pieces. Theres an almost-great train robbery at the start and a better if overlong chase-on-a-causeway finale. But the writing (by Chris Morgan) is often thuddingly leaden. ""Youre the only cop in Rio who cant be bought"" U.S. federal agent Luke Hobbs (Dwayne Johnson) tells Elena a Brazilian rookie played by Elsa Pataky. ""Am I right? Of course I am."" Hobbs tracks our fugitive heroes. A well-heeled baddie named Reyes is after them for different reasons. Reyes stores his ill-gotten drug gains -- 100 million anybody? -- in Rios hillside shanties or favelas. Portrayed by Portuguese-born actor Joaquim de Almeida he waxes smug on Brazils poorest the way a newfangled colonialist might. He sees Doms vulnerable spot in sister Mia. Dark-haired lean Jordana Brewster could be the young mans Demi Moore. (Except that Moore has turned out to be well a young mans Demi Moore.) Mia is pregnant and early action sequences of her and Brian escaping through a favela had us wondering just how much rigorous activity is good for an expectant mom. But thats not the point. Family values Dom-style is. Though central to the chase Hobbs presence feels incidental to this storyline. And one suspects that the heavily armed agents role provides the future video-game version with more single-player shooting action. ""Fast Five"" skids most when trying to engage deeper themes. (If you cant handle the heat of Brazils daunting inequities stay out of the favelas.) So its still an illegal race between friends in the wee hours that has the movie pur- ring and reminds us that ""The Fast and the Furious"" has often delivered stupid joys. An early Newtonian-physics-defying stunt features Dom Brian and a sleek silver Corvette roadster. Its an obvious wink to Butch and Sundances leap off a cliff meant to remind audiences -- especially those of us long in the tooth and starting to feel less comfy with so much blow-stuff-up action -- that we love on-screen lawlessness. We like our outlaws but dont take kindly to corruption. We root for the naughty guys over the nasty guys or the arrogant lawmen. We cheer for the multiracial Robin Hoods to vanquish a hood in a custom-tailored suit. We like our popcorn fantasies. Ladies and gentlemen start your engines. Film critic Lisa Kennedy 303-954-1567 or lkennedydenverpost.com; also on blogs.denverpost.com/ madmoviegoer Lisa Kennedy Digital amp; Driveway Delivery - 50% Off More in Music Polica Synth-pop in the age of racial strife July 29 2016 Indie synth-pop band Polica (pronounced poh-LEE-sah) knew that their newest album ""United Crushers"" wasnt going to get as much attention as their debut album ""Give You the Ghost"" did. Blake Shelton plays free intimate show at Denvers Grizzly Rose July 28 2016 Only 2000 people made it inside Grizzly Rose Thursday for an intimate show by a country superstar. Tickets on sale for Denver shows this week July 29 July 28 2016 How to get tickets for the best upcoming Colorado shows. Dont Miss This Chicano Music Festival this weekend July 28 2016 In the Art District on Santa Fe folks at Su Teatro Cultural and Performing Arts Center have already begun celebrating the 20th annual Chicano Music Festival this week. Member Services News Alerts Facebook Twitter Instagram RSS Subscribe Become a Member / Subscribe Place a Hold Denver Post Store Digital Replica Edition Classifieds Autos Real Estate Jobs Todays Ads Weekly Ads Daily Ads Special Sections Contact Us Submit a News Tip Member Services Advertise With Us Careers Place an Obituary Todays Front Page Back Issues Archives Mobile Apps Copyright (c) 2016 Digital First Media Privacy Policy Site Map Ethics Policy Powered by WordPress VIP Arbitration Send to Email Address Your Name Your Email Address Cancel Post was not sent - check your email addresses Email check failed please try again Sorry your blog cannot share posts by email.",http://www.denverpost.com/movies/ci_17943291,200,fastfive2,fastfive,denverpost
"Fast Five | Chicago Reader Switch to the mobile version of this page. Newsletters Follow us Twitter Facebook RSS Mobile Username View Profile Edit Profile Log Out Log in Create Account The Chicago Reader News amp; Politics Music Arts amp; Culture Film Food amp; Drink Classifieds Browse News amp; Politics News amp; Politics home page Steve Bogira | Criminal Justice John Greenfield | Transportation Deanna Isaacs | Culture Ben Joravsky | Politics Michael Miner | Media Browse Music Music home page Gossip Wolf In Rotation Record roundups Leor Galil | Music Criticism Peter Margasak | Music Criticism Soundboard Concerts this week Early Warnings Concerts on horizon Browse Film Film home page J.R. Jones | Movie Reviews Index of Long Reviews Film Archive Short Reviews Now Playing Todays Showtimes Browse Arts amp; Culture Arts amp; Culture home page Tony Adler | Theater Justin Hayford | Theater Aimee Levitt | Features Brianna Wellen | Comedy Arts amp; Culture event search Browse Food amp; Drink Food amp; Drink home page Mike Sula | Restaurant Reviews Key Ingredient A chef-to-chef challenge Cocktail Challenge Bar Guide Restaurant search Browse The Bleader The Bleader blog home page Browse Classifieds Classifieds home page Real Estate Rentals Announcements Services Jobs (Monster) Place ad ad Best of Chicago Summer Guide Savage Love Straight Dope Agenda Events Locations Issues Article Archives Fun amp; Free You searched for [X]Fast Five Start over Search for... Browse movie times Narrow Search Author Select an author Andrea Gronvall Michael Atkinson Pat Aufderheide Zbigniew Banas Barbara Scharres Angelica Jade Bastien Bill Stamets Bob Mehr Brian Thomas Peter Brunette Dave Canfield Cara Jepsen Carol Burbank Cheryl Ross Pat Chesnut Luca Cimarusti Patrick Dahl Tyler Daswick Dave Kehr Cliff Doerksen Dominick Suzanne-Mayer Don Druker Mick Dumke Marilyn Ferdinand Fred Camper Patrick Friel Chris Fujiwara Leor Galil Hank Sartin Justin Hayford Jack Helbig Henry Sheehan Tanner Howard Drew Hunt J. R. Jones J.R. Jones Jennifer Vanasco Jessica Hopper Jim Healy Jonathan Rosenbaum Joshua Katzman Josh Katzman Anthony Kaufman Kelly Kleiman Asher Klein Shelley Kraicer Shelly Kraicer Nathalie Lagerfeld Adam Langer Lawrence Bommer Lisa Alspector Eric Lutz Peter Margasak Mark Jenkins Martha Bayne Adrian Martin Tom McCormack Meredith Brody Sergio Mims Michael Miner Laura Molzahn Monica Kendrick Adam Morgan Noel Murray Noah Berlatsky Pat Graham Patrick McGavin Patrick Z. McGavin Gerald Peary Richard Pena Mark Peranson Peter Keough Leah Pickett Richard M. Porton Laura Power Quintin Miles Raymer Reece Pendleton Berenice Reynaud Ronnie Scheib Tal Rosenberg Joshua Rothkopf Joshua H. Rothkopf Martin Rubin Ryan Wenzel Ben Sachs Dan Sallitt Dmitry Samarov Ronnie Schieb David Schwartz David P. Schwartz Scott Pfeiffer Ian Simmons Alissa Simon Michael Glover Smith Patrick Somerville Laura Stempel Steve Erickson David Stewart Gwynedd Stuart Mike Sula Ted Shen Julia Thiel Ignatiy Vishnevetsky Kevin Warwick Jessica Weisberg Brianna Wellen Joel Wicklund Albert Williams Michael Wilmington Sam Worley Rating G PG PG-13 R NC-17 X NR Show only Staff Pick Staff Pick Critics Choice Critics Choice Recommended Recommended New New Agenda Agenda Free Free Slideshow Slideshow Video Video Watch on Amazon Watch on Amazon Watch on Netflix Watch on Netflix Watch on Hulu Watch on Hulu Watch on YouTube Watch on YouTube Member Picks Member Picks Other Searches Events Location Guide Member Search Movie Showtimes Movie Reviews Article Archives Issue Archives Slideshows Comments Videos Images Sorting by Name Release Date Film Search Tweet Tools Email Print Share Digg Newsvine del.icio.us Facebook Reddit Twitter Windy Citizen Add to Custom List Loading... Comments click to enlarge Fast Five Video Rated PG-13  130 minutes  2011 The fifth installment in the franchise that began with The Fast and the Furious (2001) pulls together veterans from the first four headed by Vin Diesel as the car-crazy thief and Paul Walker as the lawman turned outlaw. It also notably increases the number of chase sequences and resets the action to a fantasy Rio de Janeiro whose streets have rarely seemed less safe and whose police seem incapable of enforcing even the simplest traffic laws. Dwayne Johnson hops aboard as a stern U.S. agent hot on Diesels trail and the whole thing progresses to one of the looniest heists of all time. The result is the most exciting visually jazzy and absurd entry in the series. Justin Lin directed a script by Chris Morgan. By Michael Wilmington Official Site www.fastfivemovie.comDirector Justin LinProducer Neal H. Moritz Vin Diesel Michael Fottrell Amanda Lewis Samantha Vincent and Justin LinCast Vin Diesel Paul Walker Jordana Brewster Tyrese Gibson Chris ""Ludacris"" Bridges Matt Schulze Sung Kang Dwayne Johnson Gal Gadot Tego Calderon Don Omar Joaquim de Almeida Elsa Pataky Michael Irby Fernando Chien Alimi Ballard and Yorgo Constantine Trailer Fast Five Now Playing Sorry there are no upcoming showtimes for Fast Five Reviews/comments Subscribe to this thread By Email Subscribing... With RSS Comment Add a review Rating Roll over stars and click to rate. Subscribe to this thread Terms of UsePrivacy PolicySubmission GuidelinesAbout The ReaderStaffReader CareersContact UsFreelancing InfoAdvertisingBack IssuesReprints Copyright (c) 2016 Sun-Times Media LLC. Powered by Foundation",http://www.chicagoreader.com/chicago/MovieTimes?oid=3555501,200,fastfive3,fastfive,chicagoreader
