review,link,status_code,id,movie_key,critic
"Furry Vengeance A slapstick comedy with a wily raccoon and a war motif - The Globe and Mail Jump to main navigationJump to main content News Search News by eluta.ca Search Jobs at eluta.ca Jobs Login Register 18 Toronto Subscribe Help AdChoices Home News Opinion Business Investing Sports Life Arts Tech Drive Real Estate Film TV amp; Media Books Music Theatre Visual Arts Awards Video Film Reviews Home>> Arts>> Film Brendan Fraser deals with one of natures little annoyances in Furry Vengeance. Brendan Fraser deals with one of natures little annoyances in Furry Vengeance. Furry Vengeance A slapstick comedy with a wily raccoon and a war motif Add to ... Liam Lacey The Globe and Mail Published Friday Apr. 30 2010 1200AM EDT Last updated Thursday Apr. 29 2010 315PM EDT Comments AA Country USA Language English Furry Vengeance Directed by Roger Kumble Written by Michael Carnes and Josh Gilbert Starring Brendan Fraser Brooke Shields Classification G For some reason movies involving CGI-enhanced animals slapstick humour and excretion jokes often fail to win over film reviewers so its a reasonable bet that the critical reception to Furry Vengeance a live-action comedy about insurgent forest animals will fall between Another Mediocre Family Comedy and Worst Brendan Fraser Comedy Ever. Still the appeal of this kind of film to audiences between 4 and 8 shouldnt be underestimated. As we have learned in innumerable movies - from Home Alone to Alvin and the Chipmunks the Squeakquel - children deeply enjoy watching grown-ups getting smacked tripped and splattered with various kinds of slop. When the humiliation is carried out by small furry animals the effect is only enhanced. More importantly even if youre not looking forward to seeing Brendan Fraser have a raccoon urinate on his face get trapped in a car filled with skunks or run about in a womens exercise suit with his belly hanging out Furry Vengeance is a movie with a worthy message. This is the first childrens film that involves Participant Media a production company founded by Canadian-born billionaire and former eBay president Jeff Skoll that contributes to films aimed at social change. Its roster includes An Inconvenient Truth Goodnight and Good Luck The Cove and The Soloist. In this case the message is to avoid building subdivisions in forest areas (any children who were thinking of doing so should reconsider). Fraser plays real-estate developer Dan Sanders a dad who thinks he knows best even as his wife (Brooke Shields) a high-school science teacher and his teen-aged son (Matt Prokop) roll their eyes make sardonic cracks and wait for him to come to his senses. The Sanders are the first residents of a new subdivision carved out of the Oregon forest. Dans company hides behind the green developer label while using sleazy lobbying tactics to despoil the forest. His boss is played by The Hangovers Ken Jeong in his latest mentally unstable Asian guy role and his bosss boss is an East Indian so the movie cant be accused of being too politically correct. As we learn in the pre-credits sequence Dan and his company are up against a wily and ruthless opponent a raccoon that inhabits the Oregon forest. The animal - a sort of woodsy Osama Bin Varmint - gets a lot of screen time walks upright squeaks and twitters plans improvised roadside attacks and organizes the forest birds and animals with a stump speech that uses picture bubbles formed from his head to inspire them. Fraser either through devotion to his craft or his executive producing credit proves willing to endure any kind of humiliation for a laugh. On the other hand Brooke Shields as his wife seems ill at ease (those famous caterpillar eyebrows suggest she may be allied with the enemy camp). As with Avatar and The Fantastic Mr. Fox theres a sense that the script (by Michael Carnes and Josh Gilbert) taps into motifs drawn from current American military conflicts. Theres the obvious contrast between the high-tech human invaders and the ruthlessly resourceful insurgency but more specifically wait for the scene when all the forest animals are imprisoned in a forest-glade version of Guantanamo Bay at which point even Dan realizes things may have gone too far. The paradox here is that the message of respect for animal life is outweighed by the lack of respect for human beings. Along with the save-the-animals message wouldnt it be feasible to include some socially constructive messages such as ""It makes Daddy cry when he gets hit in the crotch"" or ""Use your words not urine."" Report Typo/Error Follow Liam Lacey on Twitter liamlacey More Related to this Story Furry Vengeance Everyone has a raccoon story Comments AA In the know Report on Business In tough job market highly educated feel the squeeze Obituary Robert-Ralph Carmichael created the art on Canadas loonie CARRICK TALKS MONEY Whats the case for Americans living in Canada to renounce their U.S. citizenship? Report on Pokemon Canadians love it a Pokemaster is crowned Werner Herzog is puzzled Life How do I keep peace in the family when money comes up? The Globe Recommends {{title}} .preloader{displaynone;} Most popular videos >> News Bad boy Justin beaver terrorizes B.C. town News Trump Clinton should have congratulated me for making history Life Make this juicy and delicious tomato salad tonight News No Donald you dont Watch the highlights from Hillary Clintons convention speech News I will gladly lend you my copy Father of fallen Muslim soldier offers Trump his Constitution News Warning graphic content Toronto officers trial sees video of Sammy Yatim shooting Report on Business What age is a good retirement age? Report on Business Whats the case for Americans living in Canada to renounce their U.S. citizenship? News I know a con when I see one Bloomberg calls on DNC to unite in opposition to Trump News He-said-she-said Contrasting Trump and Clintons convention speeches Report on Business Analyst If Air Canada delivers the results the stock will look after itself Sports Video Meet some of the athletes on the Refugee Olympic Team <    > Highlights Report on Business B.C. credit union banks on a fun workplace Report on Business How academic research is subject to racism sexism More from The Globe and Mail Globe Investor This millennial wants to get his MBA but can he afford it? Life How to carb-load the smart way Most popular July 30 Your daily horoscope Forget Brexit This could be Europes biggest crisis yet Provincial free-trade deal clears the way for major changes to liquor laws Judge says RCMP manufactured B.C. terror plot overturns guilty verdict The mysterious case of Hunter Tootoos ban from the Liberal caucus More Top Stories British Columbia Liberal authorizations for Site C dam draw criticism Editorials The mysterious case of Hunter Tootoos ban from the Liberal caucus Football Glenn throws two TD passes Alouettes crush Riders Horoscopes July 30 Your daily horoscope Investment Ideas Tesla gets vote of confidence from a top investor Investment Ideas Alphabet and Amazon wind up stellar quarter for U.S. tech big five Video Trump Clinton should have congratulated me for making history Eye-candy experience at NY ice cream museum See inside Teslas new giant factory Canadian GDP reliant on real estate Photos Pope Francis visits Auschwitz death camp in silence Images from closing day at the Democratic National Convention X connect with us Products The Globe and Mail Newspaper Newspaper delivered to your doorstep. Subscribe to the newspaper Globe Unlimited Digital all access pass across devices. Subscribe to Globe Unlimited Globe2Go The digital replica of our newspaper. Subscribe to Globe2Go Globe Email Newsletters Get top Globe stories sent to your inbox. Subscribe to email newsletters Globe eBooks A collection of articles by the Globe. View the library Advertise with us GlobeLink.ca Your number one partner for reaching Canadas Influential Achievers. Or go directly to Newspaper Magazine Digital Globe Alliance extend your reach Globe Edge custom content Classifieds The Globe at your Workplace Globe Corporate Sales Globe Unlimited digital edition and Globe2Go e-paper group discounts available. Learn more Corporate financial data and content licensing for your organization. Learn more Or go directly to Report On Business Top 1000 DataStore essential business intelligence Our Company About us Work at The Globe Staff Secure Services Secure Drop Staff PGP Directory Customer Service Contact Us Customer Preference Center FAQs Customer Care website Digital subscription services Print subscription services Change your delivery address Vacation Stops Globe Recognition Special Globe events and offers for subscribers Mobile Apps News NEWS APP Available for download on the following devices iPhone iPad Android Blackberry Other Sections Appointments Art Store Births amp; Announcements Corrections Classifieds Classroom Edition Deaths Newspaper Ads Real Estate Special Reports Site Map Terms amp; Conditions Privacy Policy Disclaimer Accessibility Policy Community Guidelines Globe sustainability Editorial Code of Conduct Globe Arts is part of The Globe and Mails Globe Life Network Copyright 2016 The Globe and Mail Inc. All Rights Reserved. 444 Front St. W. Toronto ON Canada M5V 2S9 Phillip Crawley Publisher Add to Watchlist Add to Watchlist Weve run into a glitch. Please try again later. Weve run into a glitch. Please try again later. x Customize your reading font XS S M L XL The quick brown fox jumps over the lazy dog The quick brown fox jumps over the lazy dog The quick brown fox jumps over the lazy dog The quick brown fox jumps over the lazy dog The quick brown fox jumps over the lazy dog",http://www.theglobeandmail.com/news/arts/movies/furry-vengeance-a-slapstick-comedy-with-a-wily-raccoon-and-a-war-motif/article1551323/,200,furryvengeance4,furryvengeance,theglobeandmail
"Movie Review Furry Vengeance is harsh punishment just for destroying a planet washingtonpost.com gt; Print Edition gt; Weekend >> Follow The Post On >> This StoryRead +|Watch +| Comments D.C.-area nightlife events and dining Home Restaurants Bars Movies Events Music Museums Theater Kids Furry Vengeance Movie Review Furry Vengeance is harsh punishment just for destroying a planet Network News X Profile View More Activity TOOLBOX Resize Print E-mail Reprints By Jen Chaney Washington Post Staff Writer Friday April 30 2010 Brendan Fraser has done serious drama (""Gods and Monsters""). He has done epic blockbusters (""The Mummy"" ""Journey to the Center of the Earth""). And yes he has done his share of juvenile comedies. (Surely somewhere at this moment a cable network is airing ""Bedazzled"" or ""Encino Man."") This StoryFurry Vengeance Um not the kick in the pants he needsFind Furry Vengeance showtimesWatch the trailer But with the eco-conscious family comedy ""Furry Vengeance"" the oafishly handsome star has finally found the movie that really allows him to showcase his acting range. Example In one ""Vengeance"" scene Fraser gets blasted in the crotch with a gushing garden hose. Then in another vastly different scene an angry raccoon bites him in the crotch. And in a third scene Fraser straddles the peaked roof of his exurban home while chasing a pesky crow then slips and falls totally nailing himself in the . . . Sigh. Yes ""Furry Vengeance"" is that kind of kid-friendly comedy one that finds its delights in the varying degrees of slapsticky torture inflicted on Dan Sanders (Fraser) a well-intentioned real estate developer who at the behest of his maniacal boss (Ken Jeong) is razing acres of forestland to make room for an allegedly environmentally friendly single-family subdivision called Rocky Springs. Its the same old story Pave paradise put up a bunch of green houses that allow Americans to park their hybrid SUVs in two-car garages. Of course the cuddly woodland creatures that live in that forest arent exactly in favor of the proposal. So they form their own preservation posse and pool their resources -- acorns boulders a surprising deftness for hot-wiring cars -- to unleash all manner of Animal Planet fury on Dan. He gets blasted with skunk juice. He gets carjacked by a wily raccoon. He even winds up with his pants down in a portable toilet that gets thrown into a tree by a really ticked-off bear. (Did I mention that Fraser starred in the excellent ""Gods and Monsters""? Thats a fact that may slip your mind while you watch him jostle around unpantsed inside a flying potty.) To be fair Fraser -- who energetically mugs his way through the nonstop nature show from hell -- isnt really the problem here. The problem or problems stem from the lazy unfunny script; the weak computer-generated animals (never have Gods creatures looked less lifelike while dancing to Chics ""Le Freak""); and the squandering of so much talent. Brooke Shields who plays Dans wife is stuck in a thankless role that allows her to adopt facial expressions ranging all the way from exasperation to polite befuddlement. And usually spot-on supporting players like Jeong and Angela Kinsey from TVs ""The Office"" dont get a solid shot at generating hilarity either. Even the obligatory blooper reel that runs during the closing credits is painful in its desperation to generate laughs. ""Furry Vengeance"" may teach young viewers that being kind to the Earth involves action not just self-serving lip service. Thats a good thing. But that theme has already been covered more effectively in other family-oriented fare such as ""Over the Hedge"" and ""Hoot."" Honestly the mental image most likely to stay put after ""Vengeance"" ends is one of Fraser taking yet another hit to his private parts. And honestly who needs that in their consciousness eco- or otherwise?  PG. At area theaters. Contains some rude humor mild language and brief smoking. 91 minutes. >> This StoryRead +|Watch +| Comments (c) 2010 The Washington Post Company Network News X My Profile Friends Activity View More Activity  Um not the kick in the pants he needs Find Furry Vengeance showtimes Watch the trailer",http://www.washingtonpost.com/wp-dyn/content/article/2010/04/29/AR2010042901453.html,200,furryvengeance5,furryvengeance,washingtonpost
"Furry unfunny | New York Post Thanks for contacting us. Weve received your submission. Back to Reading News Metro Page Six Sports Business Opinion Entertainment Fashion Living Media Tech Real Estate Sub Menu 1 Photos Video Covers Columnists Horoscopes Sub Menu 2 Classifieds Subscribe Sign in In The News hillary clinton iran lamar odom 2016 presidential election new york mets Sections Search Tips Sign in New York Post Most Popular 18454 How Hillary blew her big moment 11197 Malia Obama skipped the DNC for Lollapalooza 7496 Cop in bikini tackles bad guy 7428 NYC tourist duped into buying 1M worth of fake jewelry 6364 Bloombergs DNC speech blindsided Trump campaign 6332 Judge blasts Nick Denton for lying about Gawker stock value Share thisFacebookTwitterGoogleWhatsAppEmailCopy Entertainment Share thisFacebookTwitterGoogleWhatsAppEmailCopy Furry unfunny By Lou Lumenick View author archive email the author follow on twitter Get author RSS feed Name(required) Email(required) Comment(required) April 30 2010 | 400am Modal Trigger A woodland-clearing developer (Brendan Fraser) meets resistance in ""Furry Vengeance."" Imagine Alfred Hitchcocks ""The Birds"" as a childrens comedy and you have a rough idea of the excruciatingly unfunny ""Furry Vengeance"" which keeps slamming the audience over the head with a single joke. Thats birds and animals -- an army led by a beaver (who communicates in thought balloons) and includes crows squirrels and turkeys -- attacking a developer who plans to raze their nature preserve and turn it into a gated community. I wont deny some children may enjoy the sight of the developer (Brendan Fraser) being repeatedly doused in the critters bodily fluids and receiving blows to the crotch. But any adult unlikely enough to stick around for this will also be treated to the sight of the pudgy actor running around in a way-too-small pair of pink sweat pants before he is sent to a psychiatrist (Wallace Shawn). Those pants belong to Frasers unhappy wife -- a rare big-screen outing for Brooke Shields who gets less screen time than Frasers SUV. The vehicle oddly gets the most product placement (including an invasion by a squad of skunks) in this allegedly eco-friendly production. Although the ubiquitous Ken Jeong turns up in a vaguely racist role as Frasers ""comically"" accented boss Angela Kinsey (""The Office"") plays Jeongs assistant and Matt Prokop (""High School Musical 3"") is cast as Frasers son Fraser appears with just the animals in most of the movie. Sort of. They were in most cases photographed separately with computer-assisted expressions -- with CGI taking overly entirely (and unconvincingly) in the spectacularly witless climax. Fraser who has star-red in two part-animated films in the past is up for any sort of slapstick humiliation here but defeated by a script by the writers of ""Mr. Woodcock"" that almost managed to make me nostalgic for ""Over the Hedge"" and ""Dr. Doolittle."" Incoherently directed by Roger Kumble (""College Road Trip"") ""Furry Vengeance"" is co-sponsored by Participant Media which would be well advised to stick to socially conscious documentaries like the Oscar-winning ""The Cove."" lou.lumenicknypost.com Share thisFacebookTwitterGoogleWhatsAppEmailCopy Share this article Share thisFacebookTwitterGoogleWhatsAppEmailCopy Read Next Live Its Saturday White Read Next Live Its Saturday White Share Selection Trending Nowon NYPost.com 17854 How Hillary blew her big moment 10583 Malia Obama skipped the DNC for Lollapalooza 7306 NYC tourist duped into buying 1M worth of fake jewelry Now On Eric Claptons girlfriends ex-beau busted on pot rap Orlando Bloom joins Andy Sambergs HBO mockumentary Jill and Joe Biden stop traffic on Fifth Avenue SEE ALL Page Six TV Lindsay Lohans dad says booze pics arent what they seem Lindsays sober claims Michael Lohan These celebs hang out where? Now On Pure Nude Yoga Actual Workout Or Masturbation Material? (Answer Sorta Both) SEE ALL More Stories pagesix Harry Brant busted for drugs and bailing on taxi fare Now On Decider This Woman Giving Birth In A Stream Has Been Watched Over 54 Million Times (NSFW) nypost How Hillary blew her big moment New York Post Twitter Facebook Instagram Email Newsletters Mobile Apps Contact Us Tips Twitter Facebook Instagram Sections amp; Features News Real Estate Page Six Tech Sports Media Metro Photos Entertainment Video Business Alexa Opinion Covers Fashion Horoscopes Living Classifieds Newsletters amp; Feeds Email Newsletters RSS Feeds NYPost Store Home Delivery Subscribe Manage Subscription Preferences Help/Support Customer Service App FAQ amp; Help Contact Us Tips Newsroom Letters to the Editor Reprints Careers Apps iPhone App iPad App Android Phone Android Tablet Advertise Media Kit Contact Post Digital Network (c) 2016 NYP Holdings Inc. All Rights Reserved | Terms of Use | Privacy | Your Ad Choices News Corp. is a network of leading companies in the world of diversified media news and information services. News Corp HarperCollins Marketwatch realtor.com Dow Jones The Sun Storyful Wall Street Journal The Times Mansion Global New York Post The Australian Checkout51 News America Marketing News.com.au Unruly Send to Email Address Your Name Your Email Address Cancel Post was not sent - check your email addresses Email check failed please try again Sorry your blog cannot share posts by email. Copy Share URL Copy Link Sign Up / Sign In Sign In // Sign Up With your existing account from... With your existing account { loginWidget } Use an account with your email address Or with a NYPost.com account { userInformationForm } { traditionalSignIn_emailAddress } { traditionalSignIn_password } { traditionalSignIn_signInButton }{ traditionalSignIn_createButton } { /userInformationForm } Sign Up / Sign In Sign In // Sign Up Welcome back { welcomeName } { loginWidget } Or use NYPost.com account Sign Up / Sign In Sign In // Sign Up Welcome back Welcome back { welcomeName } { userInformationForm } { traditionalSignIn_emailAddress } { traditionalSignIn_password } { traditionalSignIn_signInButton } { /userInformationForm } Use an account with your email address Or use another account Almost Done Please confirm the information below before signing in. Please confirm the information below. { socialRegistrationForm } { socialRegistration_emailAddress } { socialRegistration_displayName } { socialRegistration_ageVerification } By clicking ""Sign In"" you confirm that you accept our terms of service and have read and understand privacy policy. { backButton } { socialRegistration_signInButton } { /socialRegistrationForm } Almost Done { registrationForm } { traditionalRegistration_emailAddress } { traditionalRegistration_password } { traditionalRegistration_passwordConfirm } { traditionalRegistration_displayName } { traditionalRegistration_captcha } { traditionalRegistration_ageVerification } By clicking ""Create account"" you confirm that you accept our terms of service and have read and understand our privacy policy. { backButton } { createAccountButton } { /registrationForm } Create a new password ForgotPassword? Dont worry it happens. Well send you a link to create a new password. { forgotPasswordForm } { traditionalSignIn_emailAddress } { backButton } { forgotPassword_sendButton } { /forgotPasswordForm } Create a new password Sent Weve sent an email with instructions to create a new password. Your existing password has not been changed. Weve sent an email with instructions to create a new password. Close Account Already Exists { mergeAccounts } { backButton } Sign in to complete account merge { tradAuthenticateMergeForm } { traditionalSignIn_emailAddress } { mergePassword } { traditionalSignIn_signInButton } { /tradAuthenticateMergeForm }",http://www.nypost.com/p/entertainment/movies/fur_against_one_T9iW4FKDvzvbwBWqPje5gI,200,furryvengeance6,furryvengeance,nypost
