review,link,status_code,id,movie_key,critic
"Furry Vengeance May the furs be with you | Toronto Star SectionsSearch the print archivesSectionsEntertainmentMoviesFurry Vengeance May the furs be with youFamily comedy Furry Vengeance pits man against nature and guess who wins?Brendan Fraser gets smacked around by a raccoon in Furry Vengeance.  (AP)  By Linda BarnardStaff ReporterThu. April 29 2010Furry Vengeance (out of 4)Starring Brendan Fraser Brooke Shields Ken Jeong Matt Prokop and Angela Kinsey. 91 minutes. At major theatres. GHeres how the pitch meeting may have gone for Furry Vengeance ""Its Poltergeist. But with raccoons.""Its cool to go green so Hollywood is happy to jump on the (low-emission electric-powered) bandwagon making evil developers the new villains and vigilante critters our superheroes. Article Continued BelowDan Sanders (Brendan Fraser The Mummy Inkheart) thinks hes building an environmentally conscious subdivision in the middle of the Oregon forest at the behest of his bipolar boss (The Hangovers Ken Jeong). Dans wife Tammy (Brooke Shields) and teen son Tyler (heartthrob Matt Prokop of High School Musical 3) are none too pleased about leaving bustling Chicago behind for what they see as rube-ringed wilderness. But Dan reminds them theyll be saving the planet one backsplit at a time -- and its only for a year.After all Dans a tree-hugger at heart. He starts each day with a deep inhale and a peaceful ""ahhh nature"" as he surveys the woodland view from his front lawn. Hes unaware the sprawling new phase of the development is to be built on habitat thats home to all manner of critters and soon he finds himself the target of uncaged rage when nature turns on him.Blessedly the animals do not talk in Furry Vengeance. But theres not much natural about them thanks to computer-aided facial expressions and a rich soundtrack of bleats and ""uh-ohs"" that sound like they were voiced by Frank Oz. The ringleader of the hole-in-the-log gang a tubby raccoon conveys his instructions to his fur and feathered army via thought balloons. My mother who has long suspected animals are looking at her ""funny"" while plotting their attacks would be very distressed to know they are also telepathic.Fraser gamely allows himself to be subjected to all manner of humiliations from having his pants wetted for him by the crafty raccoon (and being gleefully dubbed ""Mr. Pee-Pee Pants"" by his wife) to being trapped in his eco-friendly SUV with a troupe of skunks and being sent on a thrill ride in a port-o-potty by a furious bear. A skilled physical comic seemingly without shame Fraser grew a sizeable gut by gorging on a pre-shoot pizza and beer diet and lets it all hang out in various stages of undress. Kids will lose their minds at the sight of Fraser in a skin-tight pink tracksuit with the words ""Yum Yum"" on his sizeable backside. Parents will sigh and eat popcorn.Shields is an ideal foil for Frasers antics taking her share of tumbles and stumbles along the way. They actually seem like a pair of marrieds and have considerable onscreen chemistry. Cant say the same for Jeong and his assistant (The Offices Angela Kinsey) who take up the role of dueling hams including a tiresome ""no not that kind of Indian"" joke that is both racist and ridiculous. A dream sequence involving robotic-looking CGI creatures getting down to a funky porcupine DJ spinning ""Le Freak"" in the kitchen looks more like a taxidermists nightmare. If you stay in your seat for the credits rather than making the patented T.O. bolt for the exit prepare yourself for a lengthy outtakes-style video as Shields and Fraser mug dressed as a variety of pop culture icons to ""Insane in the Brain"" -- not the Cyprus Hill version either.Directed by Roger Kumble who should still be forced to sit in the corner for College Road Trip Furry Vengeance is the sort of hyper free-for-all that will keep kids sufficiently entertained for 90 minutes even if they leave the theatre thinking that otters can drive cars and ermines can form the intent to exact revenge.     The Morning Headlines NewsletterDelivered daily to your inbox.Sign upMore from the Toronto Star amp; PartnersLOADING                                             LOADING                    22degCloseHomeLatest NewsVideoGTABlogsToronto to test mobile ticketing app for island ferryNew way to buy tickets online aimed at cutting down lineups for island ferry.NewsGTACity HallQueens ParkCanadaWorldInvestigationsCrimeBusinessEconomyPersonal FinanceReal EstateYour TorontoSchoolsThe FixerLifeFashion amp; StyleFood amp; WineHealth amp; WellnessHomesParentTechnologyTravelSportsAmateurBaseballBasketballBlue JaysCurlingFootballGolfHockeyLacrosseLeafsOlympicsRaptorsSoccerTennisOpinionCommentaryCorrectionsEditorialsEditorial CartoonPublic EditorReaders LettersEntertainmentBooksMoviesMusicStageTelevisionVisual ArtsDiversionsHoroscopesCrosswordsSudokuComicsWheels.caSpecial FeaturesObituariesClassifiedsTV ListingsHot TopicsDem. ConventionRio OlympicsPokemon GoBlue JaysGeneration 9/11Panama PapersFresh Air FundWeather BlogFollow usFacebookTwitterGoogle+InstagramRSSManage NewslettersSite MapAboutContact UsFeedbackthestar.comFeedbackSite MapNewslettersInsurance HotlineNew in HomesStar StoreCorrectionsBehavioural TargetingTodays NewsFlyersCanadaStaysContestsToronto Star Newspaper Ltd.AboutAtkinson PrinciplesStatement of PrinciplesGet Home DeliveryMy SubscriptionContact UsContact WebmasterFAQNews ReleasesStar InternshipsCareers  the StarStar AdvisersStar ePaperStar TouchAdvertise with UsAdvertising TermsMedia KitSpecial FeaturesInitiativesSanta Claus FundFresh Air FundSpeakers BureauClassroom ConnectionToronto Star ArchivesReport on Community Giving(c) Copyright Toronto Star Newspapers Ltd. 1996 - 2016Privacy PolicyTerms and Conditions",http://www.thestar.com/entertainment/movies/article/802653--furry-vengeance-may-the-furs-be-with-you,200,furryvengeance7,furryvengeance,thestar
"Animals take Vengeance on family fare - NY Daily News Trending DEMOCRATIC NATIONAL CONVENTION HILLARY CLINTON KESHIA KNIGHT PULLIAM MICHAEL JORDAN DONALD TRUMP Sections Sections Home New York NYC Crime Bronx Brooklyn Manhattan Queens Education Weather Obituaries Sports Yankees Mets Giants Jets Knicks Nets Rangers Islanders Football Basketball Baseball Hockey Soccer College High School The Score More Sports News Crime U.S. World Politics Entertainment Gossip Games Entertainment Pics TV Movies Music Theater amp; Arts Horoscopes Daily Weekly Monthly Pet Horoscopes Lifestyle Health Homes Food Opinion Autos Buyers Guide Ratings amp; Reviews News amp; Views Photos amp; Galleries Covers Classifieds Trending DEMOCRATIC NATIONAL CONVENTION HILLARY CLINTON KESHIA KNIGHT PULLIAM MICHAEL JORDAN DONALD TRUMP entertainment Follow Us Facebook Twitter Instagram Pinterest YouTube Subscribe Follow UsNewsletter App Subscriptions Subscribe Get Our Newsletter A daily blend of the most need-to-know Daily News stories delivered right to your inbox. Sign Up Get the latest breaking news entertainment sports and more.Download Our App Subscribe to the newspaper our e-edition or both.Subscribe Select Sport Football Basketball Baseball Hockey Soccer College High School More Sports Gossip Games Entertainment Pics TV Movies Music Theater amp; Arts Share This facebook Tweet email Furry Vengeance is painfully unfunny family flick full of pandemonium Animals take Vengeance on family fare Joe Neumaier Thursday April 29 2010 440 PM facebook Tweet email Brendan Fraser is shown in a scene from ""Furry Vengeance."" Unfortunately the creature caper is a painfully unfunny family flick. (Summit) Joe Neumaier Thursday April 29 2010 440 PM Title Furry Vengeance If only ""Furry Vengeance"" were a foreign film that had been dubbed incorrectly or an experimental movie whose backers got a load of cash and decided to add rampaging bears and angry squirrels. Then the insanity onscreen might make a little more sense. But the truth is this is just one nutso painfully unfunny family flick.Even calling it a family flick is to run the risk of guiding families toward it by mistake. Sure kids under 4 may be briefly amused by forest creatures that dance and pop their eyes yet even they will likely view the antics as unacceptable even by the standards of ""Alvin and the Chipmunks The Squeakquel"" or the animated ""Over the Hedge"" which this story recalls.Brendan Fraser plays Dan an executive for a housing development firm thats tearing up Oregon timberland for a future subdivision. Dans updates to his nasty boss (Ken Jeong) are overheard by a raccoon who somehow understands English so the raccoon gets his winged clawed and pawed pals to make Dans life very hairy Skunks spray him. Birds drop dung on him. An otter rolls a boulder at him. (At least the animals dont talk - they communicate in chirps and pantomimes and sometimes we see what theyre thinking via thought bubbles.)Well-meaning Dan soon learns his companys green image is just a slogan and that the animals are endangered. Meanwhile his wife (an unrecognizable Brooke Shields) and son (Matt Prokop) are never around when the varmints attack and so think Dan is losing his mind.You may lose yours as the long 90 minutes pass. Fraser does what he can to keep things fun including hamming it up in various moments of humiliation. Since hes become a family-films guy Fraser works best when he uses his once-buff good-naturedness for self-deprecating heroism as in ""Journey to the Center of the Earth"" and ""Inkheart."" In that realm his dopey smile reassures kids that a good time is possible. Here he looks apologetic.To its credit there are things so strange in ""Furry Vengeance"" that they have a kooky appeal and there is minimal CGI; the critters were trained for their shenanigans. The silliest bits show the tricky traps they set including a model of the humans forest festival complete with roller coasters made of sticks. The conclusion at that festival though goes for pandemonium over invention. Guess the filmmakers were a few otters short of a romp.jneumaiernydailynews.com Send a Letter to the Editor Join the Conversation facebook Tweet PC Richard and Son Get Daily News stories delivered to your inbox. Sign Up Follow Us Facebook Twitter Instagram Pinterest YouTube Keep in Touch Newsletter Apps Subscribe Feeds Support amp; Contact Contact Us Careers Media Kit Site Map Terms of Use Ad Choices Terms of Service Privacy Policy Daily News Covers (c) Copyright 2016 NYDailyNews.com. All rights reserved.",http://www.nydailynews.com/entertainment/movies/2010/04/30/2010-04-30_furry_vengeance_is_painfully_unfunny_family_flick_full_of_pandemonium.html,200,furryvengeance8,furryvengeance,nydailynews
"Furry Vengeance Coarse family film is a slapstick stinker - USATODAY.com Cars  Auto Financing  Event Tickets  Jobs  Real Estate  Online Degrees Shopping SearchHow do I find it?Subscribe to paper Home News Travel Money Sports Life Tech Weather Life >> Movies Box Office Report Movie Listings Awards Central Shop for Movies/DVDs Furry Vengeance Coarse family film is a slapstick stinker Updated  | Review  | Recommend E-mail | Print | Enlarge Summit Entertainment via AP This radical raccoon and other creatures fight back when a ""green""-company executive (Brendan Fraser) bulldozes their land. ABOUT THE MOVIEFurry Vengeance out of four Stars Brendan Fraser Brooke Shields Ken Jeong Matt ProkopDirector Roger KumbleDistributor Summit EntertainmentRating PG for some rude humor mild language and brief smokingRunning time 1 hour 31 minutesOpens Friday nationwide By Claudia Puig USA TODAY ""I just dont think this can get any worse"" Brooke Shields says in Furry Vengeance playing a woman married to a man beset by woodland creatures. She couldnt be more right. Furry Vengeance is a slapstick stinker easily the worst movie of the year. And its from the same company responsible for last years The Hurt Locker which won the best-picture Oscar. Go figure. This coarse family film is an insult to sentient families. Purporting to encourage conservation and the love of animals its a slight to true environmentalists and heck even an affront to animals. TRAILER See a preview of Furry Vengeance Whats lacking amid the over-acting shoddy special effects and pratfalls is imagination. Everything feels slapdash and repetitive. Do we need to see three incidents of skunkings a parade of urinations and body excretions as well as several attacks to the groin? Theres simply nothing to recommend this mirthless mess. It might have been sick fun to listen in on the pitch meeting when the filmmakers touted the moronic high concept ""A company is raping the land plowing down a scenic wilderness. All the animals become radical protesters and fight back. Think Home Alone in the forest. We can feature hilarious armies of skunks sneaking into an SUV and birds that dive-bomb and defecate everywhere. A cute raccoon is in charge of all the torment."" When informed this movie was already made and it was called Over the Hedge no doubt some savvy producer pointed out this would be wildly different live action not animated. If anyone piped up to enumerate the similarities toDoctor Dolittle he was probably shushed. Brendan Fraser stars as Dan an exec at an allegedly green company thats paving paradise and putting up a subdivision. He uprooted his family -- wife Tammy (Shields) and teenage son Tyler (Matt Prokop) -- from Chicago to the Oregon woods to oversee the project. Since he is destroying their habitat the critters have a hit out on him. His boss Neal Lyman -- get it? Lie Man -- constantly touts the companys eco-friendliness but even a toddler can see hes a ridiculous hypocrite. Somehow though Dan cant. Ken Jeong is cringe-worthy as Lyman lapsing into high-pitched gibberish when English language humor fails. There are other racist undertones including slurs confusing Native Americans and Indians. Shields is humorless wearing one expression throughout the movie -- annoyance -- no doubt informed by her decision to be a part of this inane film. Though hes given only terrible dialogue to spout the usually likable Fraser seems to be channeling Jackie Gleason. His bug-eyed expressions and yowls of exasperation dont give us a jot of insight into his obtuse character. Its nearly impossible to believe this foolish guy skittering around in his tighty whities is the same Fraser who a dozen years ago gave such a moving performance in Gods and Monsters. Seeing him as this doughy unfunny doofus makes you want to run screaming and pop in a George of the Jungle DVD for old times sake. Posted Updated E-mail | Print | To report corrections and clarifications contact Standards Editor Brent Jones. For publication consideration in the newspaper send comments to lettersusatoday.com. Include name phone number city and state for verification. To view our corrections go to corrections.usatoday.com. Guidelines You share in the USA TODAY community so please keep your comments smart and civil. Dont attack other readers personally and keep your language decent. Use the ""Report Abuse"" button to make a difference. Read more. Newspaper Home Delivery - Subscribe Today Home  News  Travel  Money  Sports  Life  Tech  Weather About USATODAY.com Site Map | FAQ | Contact Us | Jobs with Us | Terms of Service Privacy Policy/Your California Privacy Right | Advertise | Press Room | Developer | Media Lounge | Reprints and Permissions News Your Way Mobile News | Email News | Add USATODAY.com RSS feeds | Twitter | Podcasts | Widgets Partners USA WEEKEND | Sports Weekly | Education | Space.com | Travel Tips Copyright 2011 USA TODAY a division of Gannett Co. Inc.",http://www.usatoday.com/life/movies/reviews/2010-04-30-furry30_ST_N.htm,200,furryvengeance9,furryvengeance,usatoday
"Furry Vengeance movie review - Furry Vengeance showtimes - The Boston Globe Local Search Site Search Home Delivery HomeTodays GlobeNewsYour TownBusinessSportsLifestyleAamp;EThings to doTravelCarsJobsReal Estate MoviesRestaurantsMusicTheater/ArtTelevisionBooksCelebrity newsEventsGamesComics THIS STORY HAS BEEN FORMATTED FOR EASY PRINTING Home / Aamp;E / Movies Movie Review Furry Vengeance A Furry woodland revolt By Ty Burr Globe Staff / April 30 2010 E-mail this article To Invalid E-mail address Add a personal message(80 character limit) Your E-mail Invalid E-mail address Sending your article Your article has been sent. E-mail| Print| Reprints| | Text size - + In its cretinous fashion ""Furry Vengeance is almost impressive. Heres a pro-nature anti-development family comedy that appears to be made by and for people who never leave the mall.For a heartwarming eco-fable about woodland critters rebelling against mankind ""Vengeance has the odor of court-ordered community service. The jokes never rise above the groin. The trees look plastic the characters more so. The animals -- oh dear god the animals. Modified into ""adorable anthropomorphic behavior by bargain-basement computer animation the various raccoons skunks possums and squirrels come across as hideous midget cyborgs furry corpses brought back to twitching life through the miracle of modern special effects.But hey take the kids.Actually the most abused mammal in ""Furry Vengeance may be star Brendan Fraser who plays Dan Sanders a good-guy builder trying to carve a ""green housing development out of a pristine forest preserve. Thats right hes the hero. At the behest of his sleazy boss (comic actor Ken Jeong going over the top into full-on racial self-parody; Gedde Watanabe you can finally let your guard down) Dan has moved into one of his show houses with skeptical wife Tammy (yes that Brooke Shields) and rebellious teen son Tyler (Matt Prokop).He doesnt know that the animals in this neck of the woods have been fighting off humans for centuries taking the time-honored ""Home Alone approach of throwing heavy things at our testicles. The ringleader is a raccoon; his secret weapon is a bear. ""Furry Vengeance was shot locally (in Topsfield) and is set in the Pacific Northwest but its sense of wilderness is as generic as freshly laid blacktop. One of Dans tormentors is a lovely pied crow which last time I checked (just now on Google) is native to Africa. But who expects a movie about the outdoors to get the species right? What are you a nature geek?Directed by Roger Kumble who started with teen movies (""Cruel Intentions) and is working his way down the evolutionary ladder ""Furry Vengeance will tickle very young children and others who persist in thinking of animals as little people in fur suits. It will appall everyone else not because of the gaping disconnect between its message and its methods but because the movies simply thunderingly unfunny. The hero gets gassed by skunks stung by bees assaulted by a South African condor () and even when the plot works up to a pitch of Tom-and-Jerry lunacy -- when Dan appears before his construction crew wearing a bra the animals have somehow engineered him into -- the frenzied editing and prefab music suck the laughs away.Theres a much better comedy in this idea and probably a decent horror movie too (""Furry Vengeance Survival of the Fittest) but neither of them would star Fraser who has ballooned alarmingly in recent years and who spends much of the film with his shirt off and his gut protruding. The mans starting to resemble a human pork rind; any bigger and Macys will be calling. Yes yes its unfair to mock an actors body but here Frasers flab seems symbolic of the movie as a whole. ""Furry Vengeance is a double quarter-pounder in a proudly recycled paper box Chow down if you must but with what it costs to take a family to the movies today you might as well go camping.Ty Burr can be reached at tburrglobe.com. For more on movies go to www.boston.com/movienation. (c) Copyright 2010 Globe Newspaper Company. Related Shields marries calm to Frasers comic urges Hollywood Beauty Brooke Shields plays tamer to Brendan Frasers Beast in interviews and on screen in ""Furry Vengeance."" Find showtimes and theaters for Furry Vengeance Video Watch the trailer FURRY VENGEANCE Directed by Roger Kumble Written by Michael Carnes and Josh Gilbert Starring Brendan Fraser Brooke Shields Matt Prokop Ken Jeong At Boston Common Fenway suburbs Running time 92 minutes Rated PG (some rude humor mild language brief smoking) LOG IN TO COMMENT Sorry we could not find your e-mail or password.Please try again or click here to retrieve your password. Existing users E-mail Password Screen name ( fields are required) Login Forgot your password? New users Please take a minute to register. After you register and pick a screen name you can publish your comments everywhere on the site. Posting Policy. Register Your comment is subject to the rules of our Posting Policy This comment may appear on your public profile. Public Profile FAQ Movie listings search Movie times  Globe review archive Find theaters by town | Search all movie listings Advertisement Boston.com Most EmailedSubscribe to SliceBookmark Boston.com Most Emailed120 MOST E-MAILED >> Report Warrant Issued for Roggies Bar OwnerMap of Greater Boston Farmers MarketsBoston Pops Concert Move Keeps the Beach Boys Ditches Joey McIntyreWe Tried Out Those New Solar BenchesNew Englands top outdoor water parksDrink of the Week Mojito ItalianoLawmakers pass compounding pharmacy oversight bill Follow this list on Twitter BostonPopular Home| Todays Globe| News| Business| Sports| Lifestyle| Aamp;E| Things to Do| Travel| Cars| Jobs| Real Estate| Local Search Contact Boston.com | Help| Advertise| Work here| Privacy Policy| Your Ad Choices| Terms of Service| Newsletters| Mobile| RSS feeds| Sitemap Contact The Boston Globe| Subscribe| Manage your subscription| Advertise| Boston Globe Insiders| The Boston Globe Gallery| (c) Boston Globe Media Partners LLC <a href=""http//www.omniture.com"" title=""Web Analytics""></a>",http://www.boston.com/ae/movies/articles/2010/04/30/a_furry_woodland_revolt/,200,furryvengeance10,furryvengeance,boston
