review,link,status_code,id,movie_key,critic
"Furry Vengeance movie review Brendan Fraser stars in uninspired man-vs.-animal tale |       NJ.com NJ.com Menu Home News Politics Sports High School Sports Entertainment Photos/Videos Obituaries Autos Jobs Real Estate Rentals Health Classifieds Local Businesses Place An Ad Opinion Follow Us Subscribe Back to Main Menu News News by County All Newspapers Business Crime Education Health Lottery Obituaries Politics Back to Main Menu Atlantic Bergen Burlington Camden Cape May Cumberland Essex Gloucester Hudson Hunterdon Mercer Middlesex Monmouth Morris Ocean Passaic Salem Somerset Sussex Union Warren Back to Main Menu The Star-Ledger The Times of Trenton The Jersey Journal South Jersey Times Hunterdon County Democrat Independent Press Horse News Back to Main Menu Politics Home Chris Christie Opinion The Auditor Back to Main Menu Sports Home Devils Eagles Flyers Giants Jets Knicks Mets Nets Phillies Rangers Red Bulls Rutgers Basketball Rutgers Football Rutgers Sports Seton Hall Sixers Yankees Back to Main Menu Football Baseball Softball Boys Lacrosse Girls Lacrosse Boys Track and Field Girls Track and Field Boys Volleyball Boys Tennis Boys Golf Girls Golf Wrestling Boys Basketball Off Season Sports Back to Main Menu Football Wrestling Boys Basketball Girls Basketball Boys Bowling Girls Bowling Boys Cross Country Girls Cross Country Boys Fencing Girls Fencing Field Hockey Boys Ice Hockey Girls Ice Hockey Gymnastics Boys Skiing Girls Skiing Boys Soccer Girls Soccer Boys Swimming Girls Swimming Girls Tennis Girls Volleyball Boys Winter Track Girls Winter Track Back to Main Menu Entertainment Home Atlantic City Entertainment Celebrities Comics Events Food amp; Dining Indulge Inside Jersey Movies Music Online Gambling Guide Puzzles Shore TV Back to Main Menu Hunterdon County Democrat Photos Jersey Journal Photos NJ.com Photos South Jersey Times Photos Star-Ledger Photos Times of Trenton Photos Videos Back to Main Menu Homes for Sale New Homes For Rent Foreclosures Commercial Real Estate News Resources Place An Ad Back to Main Menu Home Buying Sell My Home Rental Living Home Ideas Mortgages and Loans Im Moving Back to Main Menu Obituaries Rentals Pets For Sale Garage Sales Find n Save Fraud Prevention Manage Your Ad Place An Ad Back to Main Menu Find A Business Food amp; Dining Retail Shopping Health amp; Medicine Personal Care Entertainment Real Estate Automotive Claim Your Business Sponsored Blogs Back to Main Menu Visit our Facebook Page Follow us on Twitter View our Instagram photos See our Tumblr feed See our Pinterest page Visit us on Google Plus Visit OMJ for NJ celebrity amp; style Back to Main Menu Email newsletters The Star-Ledger The Times of Trenton The Jersey Journal South Jersey Times Hunterdon County Democrat Star Gazette Back to Main Menu Close Customize Your Weather Set Your Location (Enter City and State or Zip Code) Congratulations Your weather is set to . You can change the location at any time. AccuWeather.com Quick Look Change your current location >> View Full Weather Report Search Search Search NJ.com Account Sign In Close Sign in toNJ.com You are signed in as Edit Public Profile Sign Out Subscribe Email newsletters The Star-Ledger The Times of Trenton The Jersey Journal South Jersey Times Hunterdon County Democrat Star Gazette comments Furry Vengeance movie review Brendan Fraser stars in uninspired man-vs.-animal tale Print Email Martin Tsai/The Star-Ledger By Martin Tsai/The Star-Ledger The Star-Ledger Follow on Twitter on April 30 2010 at 439 AM updated April 30 2010 at 637 PM comments Brooke Shields and Brandon Fraser take on the residents of a forest in ""Furry Vengeance."" ""Furry Vengeance"" tries to pass itself off as a fun family movie with a message. While the movies fun quotient for preschoolers is subject to debate there is indeed a message -- albeit not one of the tree-hugging and animal-advocating variety. Brendan Fraser plays careerist real estate developer Dan Sanders who thanklessly uproots his family from Chicago for the unwelcome greener pastures of Oregon to help his company turn reserved forestland into subdivisions. Easy peasy right? Wrong. Furry Vengeance (PG) Summit Entertainment (91 min.) Directed by Roger Kumble. With Brendan Fraser Brooke Shields Ken Jeong and Matt Prokop. Now playing in New Jersey. Martin Tsais rating One and a half stars Rating note The film contains some rude humor mild language and brief smoking. Local animals have put their heads together to conspire against his every move organizing vicious attacks ranging from staging car accidents to filling his SUV with skunks to turning a portable toilet upside down while he is inside. Meanwhile everyone else thinks he is paranoid about the animals and needs psychiatric help. Anthropomorphized animals can be a riot. Think of the English-subtitled point-of-view flashback of a chimpanzee in ""Being John Malkovich."" But ""Furry Vengeance"" brings to mind something like a live-action version of ""Looney Tunes."" Sooner or later you might be inclined to root for hapless predators like Sylvester the Cat or Wile E. Coyote because they are the underdogs and their prey are far more obnoxious than they are. That sentiment holds especially true for ""Furry Vengeance"" given that Frasers character is so agreeable and defenseless. Worse the young children who are the films target audience could easily get the impression from these creatures that wild animals dont need our protection. And the thought balloons here are just not nearly as amusing as subtitles when it comes to conveying animal communications. Latent xenophobia is evident in the head developer being an Asian man who busts Bruce Lee moves and the investor being an Indian national. This racially tinged inversion of power dynamics is absurd. The only inspired element of the film is the casts cover of hip-hop group Cypress Hills ""Insane in the Brain"" over the end credits complete with a music video featuring various pop-culture quotations such as one from ""The Blue Lagoon"" -- which is hilarious given that Haworth resident Brooke Shields is in the supporting role of Dans wife. Since the clip will probably go viral at some point you might want to skip this movie -- and go rent ""George of the Jungle"" to get your Brendan Fraser fix if you must. Listen to the latest episode of our TV podcast Subscribe on iTunes Subscribe on Stitcher Most Read Find Local Real Estate Jobs Autos Businesses Find a job Buy or sell a car Find a place to live See whats for sale Find a business View obituaries Get Your Weekly Entertainment Guide TV recaps movie and music reviews local dining guides and the latest in Atlantic City entertainment news delivered to your inbox Leave this field blank optional Check here if you do not want to receive additional email offers and information. See our privacy policy Thank you for your subscription To view and subscribe to any of our other newsletters please click here. Entertainment Essentials Search music dining more event listings Inside Jersey N.J.s lifestyle magazine OMJ.com N.J. celebrity and style Entertainment Listings Events Music Food Active Discussions nj.com About Us About NJ.com Advertise with us Contact Us Visit OMJ.com Jobs at NJ Advance Media Newsletters RSS feeds More on NJ.com Interact Weather Site map Claim your free business listing Sponsor Content Search Place an ad Sell your car Sell/rent your home Post a job Post a free classified ad Apartments amp; rentals NJ.com Sections N.J. News Local News N.J. Politics Sports High School Sports Entertainment Food amp; Recipes Living Business Opinion Inside Jersey Shore Obituaries Jobs Autos Real Estate Rentals Classifieds Shopping Good Deals Local Businesses Special Sections Contribute to NJ.com Register for free with NJ.com Submit an event Follow Us Twitter Google+ Facebook foursquare Newspaper stories and photos The Star-Ledger | Subscribe The Times of Trenton | Subscribe The Jersey Journal | Subscribe South Jersey Times | Subscribe Hunterdon County Democrat | Subscribe Star Gazette | Subscribe The Warren Reporter Suburban News Horse News Learn more about our newspapers Mobile iPhone Android apps | Tablet apps Registration on or use of this site constitutes acceptance of our User Agreement and Privacy Policy (c) 2016 New Jersey On-Line LLC. All rights reserved (About Us). The material on this site may not be reproduced distributed transmitted cached or otherwise used except with the prior written permission of New Jersey On-Line LLC. Community Rules apply to all content you upload or otherwise submit to this site. Ad Choices",http://www.nj.com/entertainment/index.ssf/2010/04/furry_vengeance_movie_review_b.html,200,furryvengeance0,furryvengeance,nj
Were sorry we cant find the page that youre looking for Go to the content Go to the footer Time Out New York New York Popular cities London New York Paris Chicago Los Angeles Browse all cities Time Out New York Close New York Change city New York Popular cities London New York Paris Chicago Los Angeles Browse all cities Tickets Events Things to Do Restaurants Bars Movies Theater Music Shopping Attractions Blog Art Travel Nightlife Events amp; Festivals Museums Kids Hotels Comedy Dance LGBT Sex amp; Dating Books City Guide Neighborhoods Promotions Close My Time Out Things I love My lists My Profile My Account Sign out Sign in Create account Sign in With your social account Or with your email Email Password Remember me Forgotten your password? Sign in You can create a Time Out account in two ways... With a few clicks using your favourite social network Or by entering your details below Email First Name Last Name Create password Repeat new password I accept Time Outs terms of use including opt-in to newsletters. Create account Welcome  You have successfully connected your account to Time Out. You may sign in with this account in future. Please confirm your account details Email First Name Last Name I accept Time Outs terms of use including opt-in to newsletters. Sign up My Account Sign in or Create account Search Tickets Events Things to Do Restaurants Bars Movies Theater Music Shopping Attractions Blog Art Travel Nightlife Events amp; Festivals Museums Kids Hotels Comedy Dance LGBT Sex amp; Dating Books City Guide Neighborhoods Promotions More Search Were sorry we cant find the page that youre looking for We have either moved the page or it no longer exists. To help you find your way here are some search results we think may be of interest. Movies Furry Vengeance We were really hoping that such an ecologically friendly anti-big business movie wouldnt feel so plastic. But as Dan a corporate dolt terrorized by the animals of the forest hes seeking to develop an especially puffy Brendan Fraser brings his standard... 1 out of 5 stars Read more Movies Furry Vengeance Initiatives to preserve wilderness areas from human encroachment would be much harder to defend politically if it were revealed that the wildlife they sustain consists of smaller furrier versions of that crotch-wounding fist-pumping little bastard... 1 out of 5 stars Read more Top About us Work for Time Out Privacy policy Website terms of use Contact us Get listed Advertising Time Out products Mobile apps Time Out Shop Time Out Guides Time Out Travel Time Out Worldwide Time Out magazine Follow us Facebook Twitter Youtube Instagram Pinterest Spotify Foursquare Time Out New York Site map,http://www.timeout.com/film/chicago/reviews/88550/furry_vengeance.html,404,furryvengeance1,furryvengeance,timeout
Were sorry we cant find the page that youre looking for Go to the content Go to the footer Time Out New York New York Popular cities London New York Paris Chicago Los Angeles Browse all cities Time Out New York Close New York Change city New York Popular cities London New York Paris Chicago Los Angeles Browse all cities Tickets Events Things to Do Restaurants Bars Movies Theater Music Shopping Attractions Blog Art Travel Nightlife Events amp; Festivals Museums Kids Hotels Comedy Dance LGBT Sex amp; Dating Books City Guide Neighborhoods Promotions Close My Time Out Things I love My lists My Profile My Account Sign out Sign in Create account Sign in With your social account Or with your email Email Password Remember me Forgotten your password? Sign in You can create a Time Out account in two ways... With a few clicks using your favourite social network Or by entering your details below Email First Name Last Name Create password Repeat new password I accept Time Outs terms of use including opt-in to newsletters. Create account Welcome  You have successfully connected your account to Time Out. You may sign in with this account in future. Please confirm your account details Email First Name Last Name I accept Time Outs terms of use including opt-in to newsletters. Sign up My Account Sign in or Create account Search Tickets Events Things to Do Restaurants Bars Movies Theater Music Shopping Attractions Blog Art Travel Nightlife Events amp; Festivals Museums Kids Hotels Comedy Dance LGBT Sex amp; Dating Books City Guide Neighborhoods Promotions More Search Were sorry we cant find the page that youre looking for We have either moved the page or it no longer exists. To help you find your way here are some search results we think may be of interest. Movies Furry Vengeance We were really hoping that such an ecologically friendly anti-big business movie wouldnt feel so plastic. But as Dan a corporate dolt terrorized by the animals of the forest hes seeking to develop an especially puffy Brendan Fraser brings his standard... 1 out of 5 stars Read more Movies Furry Vengeance Initiatives to preserve wilderness areas from human encroachment would be much harder to defend politically if it were revealed that the wildlife they sustain consists of smaller furrier versions of that crotch-wounding fist-pumping little bastard... 1 out of 5 stars Read more Top About us Work for Time Out Privacy policy Website terms of use Contact us Get listed Advertising Time Out products Mobile apps Time Out Shop Time Out Guides Time Out Travel Time Out Worldwide Time Out magazine Follow us Facebook Twitter Youtube Instagram Pinterest Spotify Foursquare Time Out New York Site map,http://www.timeout.com/film/reviews/88550/furry_vengeance.html,404,furryvengeance2,furryvengeance,timeout
"Review Furry Vengeance - SFGate Subscribe Sign In Home Contact SFGate Contact SFGate Customer Support Submissions amp; Tips Classifieds About SFGate About SFGate FAQ Register on SFGate SFGate Newsletters SFGate Staff Careers Site Index Hearst About The Chronicle About The Chronicle The Chronicle Staff Become a Subscriber Manage Your Subscription Customer Service Careers e-edition Back Copies Chronicle in Education Corrections Advertise with Us More on Advertising More on Advertising Place a Classified Ad About Our Ads Public Notices Local Business Directory Place an Obituary Gate List Store Privacy policy Privacy policy Ad Choices Chronicle Archives Terms of Use Newsletters Get news alerts SFGate Customer support Get VIP access with SF Chronicle Membership Get SFGate newsletters for the latest from the Bay Check out the Top 100 Bay Area restaurants News Bay Area amp; State Traffic Nation World Politics Crime Election Results Obituaries Tech Health Education Video News Blogs 2 men held after 2 San Diego officers shot 1 fatally 4 Sierra plane crash victims were from Tuolumne County Big Sur fire grows to nearly 33000 acres Alameda County sheriffs deputy fired in connection with Sports 49ers Raiders Giants As Olympics Warriors Sports Blogs Sports Calendar MLB NBA College Preps Golf Outdoors How low can Giants go? Latest loss comes with a triple play Rich Hills blister problem As success muddle trade outlook One bad inning sinks As at Cleveland Names amp; Faces Steve Spurrier Cam Newton Business Technology Mortgage Rates Home Guides Public Notices Sponsored Content Office Space The Tech Chronicles Net Worth Plus Fossils amp; Photons Mind Your Business VisionSF Jobs Price Point 649000 in San Bruno ICYMI Can Chipotle be a burger king? Redstones potential Victorian duplex in SOMA open Sunday Three bedroom apartment in San Franciscos Financial District Entertainment The Daily Dish Movies Music amp; Nightlife Performance Art Blogs Videos Events Puzzles TV Horoscope Comics Crosswords amp; Puzzles Things To Do Jason Bourne is a shaky smeary mess The latest from Dear Abby ""Bad Moms"" mixes sentiment with raunch and ends up vulgar Phantom Boy is fast-paced but slight animated fun Food Restaurants Wine Top 100 Restaurants Chronicle Wine Competition Reservations Beer News Inside Scoop SF Healthy Eating Angele Chef shuffle at Napa French restaurant Napa blockbuster Ninebark is closing (temporarily) Check out the food (and menu) at Black Cat now open in the Lights go out at La Rondalla longtime Mission dining spot Living Home amp; Garden Style Parties Lust LGBT Mommy Files amp; Parenting Houzz Outdoors Blogs Sponsored Schools Camps amp; Activities Couple from different cultures find love is a common ground Heres the most popular video game from the year you were born More Crystal Basin campsites are available with start of Olympics Law to fight global warming gets strong support in California Travel Destination BC Exotic Destinations Monterey-Carmel Weekend Getaways Wine Country Napa Reno-Tahoe Hawaii Caves offer older view of the Continent Traveling to Big Sur? What you need to know Suite Spot Ritz-Carlton Philadelphia Rick Steves Europe Drink in a city through cafe culture Real Estate New Homes Open Homes Luxury Rentals Mortgage Rates Commercial Place an ad Home Guides Home Sales On the Block Blog Hot Property Sebastopol Italianate estate enjoys ocean views How much space do you get for 1500 a month? Hillcrest Estate possibly owned by baseball Hall of Famer Joe Cars Dealers Click and Clack Car Blog My Ride Sell Your Car First Buick ragtop since the 91 Reatta A cherished Nash-Healey Roadster Past Phantom still turning heads Teslas Model S can be used as a boat in a pinch Jobs Job Events Advertise Salary Wizard Get To Work Consider the red flags when staying in a job you dislike Declutter your job search The job gap explanation How to impress an interviewer with non-verbal language Findamp;Save Chronicle Latest columns Michael Bauer Leah Garchik Bruce Jenkins Esther Mobley Ann Killion Thomas Lee Matier amp; Ross C.W Nevius Kathleen Pender Scott Ostler Special Report Forgotten Survivors of AIDS The ultimate NorCal brewery map Top 100 Restaurants Warriors show their style off the court MenuSections http//www.sfgate.com/movies/article/Review-Furry-Vengeance-3190406.php Review Furry Vengeance Amy Biancolli Hearst Movie Writer Published 400 am Friday April 30 2010 Photo Summit Entertainment Image 1of/1 CaptionClose Image 1 of 1 BRENDAN FRASER stars in FURRY VENGEANCE. BRENDAN FRASER stars in FURRY VENGEANCE. Photo Summit Entertainment Review Furry Vengeance 1 / 1 Back to Gallery Furry Vengeance J Comedy. Starring Brendan Fraser. Directed by Roger Kumble. (PG. 91 minutes. At Bay Area theaters.) ""Furry Vengeance"" is billed as a comedy but I doubt itll make you laugh. It might however cause you to weep for Brendan Fraser whose locus of manhood - not to mention his career - takes a beating from vengeful creatures. Water. Coffee. Fangs. Power window. Peaked roof. Leech. You name it If its hot wet pointy or painful it lands in Frasers no-no zone putting this minor miserable film in a special category of PG movies that routinely mistakes crotch hits for humor. Which all-powerful arbiter of filmmaking taste decided this was funny? Perhaps we can blame a screenwriting program that inserts scenes of comic emasculation as a default mode. Or perhaps its a sadistic hazing ritual for large mild-mannered action stars. The rationale behind all the flagrant Fraser humiliation is an uprising of small but vindictive woodland fauna in an undisclosed patch of Oregon. There a nefarious real estate developer (Ken Jeong putting on that high-pitched screech of his) schemes to replace acres upon acres of untouched forest with a sprawling mall and McMansions. Off to the rescue run Mother Natures four-legged eco-crusaders a band of disparate species led by a resourceful diurnal raccoon who makes life heck for on-site Lyman flunky Dan Sanders (Fraser). The story progresses from bird attacks and stinky skunk shenanigans to a chase scene with bear and undies that concludes after a fashion with Fraser dangling from a tree in an upended portable toilet (and all that it implies). The forest denizens a mix of live-action and slipshod CGI display neither personality nor expressive flair communicating solely through Scooby-Doo-ish grunts and pictographic thought balloons. No animals were harmed in the making of this film; they were just made to look like badly rendered clip art. -- Advisory Rude humor mild language and brief smoking. Furry Vengeance J Comedy. Starring Brendan Fraser. Directed by Roger Kumble. (PG. 91 minutes. At Bay Area theaters.) Most Popular 1 Dear Abby I want to contact mistress from 45 years ago 2 Cops Son of billionaire former supermodel arrested after... 3 Iceland man says Donald Trumps son left white powder at... 4 Ann Coulter Hammered by Conservatives for Smearing US War... 5 Bikini-clad Swedish cop makes arrest while sunbathing 6 7-year-old girl dies after elephant at zoo throws a rock at her 7 Police Girl 14 slits teens throat in hope of first kill 8 Oakland-bound medical plane crashes -- 4 killed 9 Clinton speech draws mixed reaction on cable news 10 Inmate charged in 2015 quadruple slaying in S.F. Find Showtimes Search Theaters amp; Showtimes -- County -- Alameda Contra Costa Lake Marin Napa San Francisco San Mateo Santa Clara Solano Sonoma Show Movies Now Playing | Recent Releases | Critics Favorites Rated G | PG | PG-13 | R Latest News Ann Coulter slammed for calling war heros dad angry Muslim 4 Sierra plane crash victims were from Tuolumne County Family to sue Oakland over mans fatal shooting by police Police Vallejo woman run over by man who stole her car Oakland-bound medical plane crashes -- 4 killed Apple CEO to host fundraiser for Hillary Clinton E. Bay sheriffs deputy fired in connection with beating Man Trumps son left white powder at rental paid women Parilia Amusement Ball in San Francisco early days View Comments (c) 2016 Hearst Communications Inc. Logo Return to Top About Our Company Careers Advertising Ad Choices Terms amp; Conditions Privacy Policy Your California Privacy Rights Contact Customer Service Newsroom Contacts Connect Facebook Twitter Pinterest Google Instagram Subscribe SFChronicle.com App e-edition The Chronicle Archives Subscription Offers Member Services Hearst Newspapers (c) Copyright Hearst Communications Inc.",http://www.sfgate.com/cgi-bin/article.cgi?f=/c/a/2010/04/30/MVPJ1D6UML.DTL,200,furryvengeance3,furryvengeance,sfgate
