review,link,status_code,id,movie_key,critic
Gridiron Gang (2007) directed by Phil Joanou | Film review Go to the content Go to the footer Time Out London London Popular cities London New York Paris Chicago Los Angeles Browse all cities Time Out London Close London Change city London Popular cities London New York Paris Chicago Los Angeles Browse all cities Tickets Offers Things to Do Restaurants Bars amp; Pubs Film Theatre Art Music Attractions Blog Theatre Tickets Shopping Offer of the Day Time Out Card Time Out Escapes Time Out Live Hotels Nightlife Music festivals Events amp; Festivals Kids Museums Clubs Comedy Food amp; Drink Classical Music amp; Opera Dance LGBT City Guide Area Guides Property Competitions Dating Close My Time Out Things I love My lists My Profile My Account Sign out Sign in Create account Sign in With your social account Or with your email Email Password Remember me Forgotten your password? Sign in You can create a Time Out account in two ways... With a few clicks using your favourite social network Or by entering your details below Email First Name Last Name Create password Repeat new password I accept Time Outs terms of use including opt-in to newsletters. Create account Welcome  You have successfully connected your account to Time Out. You may sign in with this account in future. Please confirm your account details Email First Name Last Name I accept Time Outs terms of use including opt-in to newsletters. Sign up My Account Sign in or Create account Search Tickets Offers Things to Do Restaurants Bars amp; Pubs Film Theatre Art Music Attractions Blog Theatre Tickets Shopping Offer of the Day Time Out Card Time Out Escapes Time Out Live Hotels Nightlife Music festivals Events amp; Festivals Kids Museums Clubs Comedy Food amp; Drink Classical Music amp; Opera Dance LGBT City Guide Area Guides Property Competitions Dating More Search Gridiron Gang Film  Drama Add review 0 Love It Save it 0 Add review 0 Love It Save it Time Out says Details Users say Time Out says Theres an old rumour that Ronald Reagan used to study newsreel footage of Adolf Hitler in order to inject his own speeches with the Fuhrers aggressive and hypnotic style. Whether true or not its a method Dwayne The Rock Johnson looks also to have adopted in order to flesh out his role as the firm-but-fair American football coach whose everyday banter sounds like hes block-quoting from Triumph of the Will. This familiar sports-prison hybrid sees a surly band of teenage reprobates taken under the wing of their bleeding-heart trainer who firmly believes that the best way to rehabilitate these boys is with plenty of full-contact team sports. While the nub of the story focuses on the Rocks volatile relationship with irksome star quarterback Willie Weathers (Jade Yorker) the film also draws naive parallels between the kids violent on-field antics and the tit-for-tat LA gang slayings that are getting them locked up in the first place. The point-and-click direction from Phil Joanou (best known for his U2 concert doc Rattle and Hum) does little to supply any substance to a yarn that was probably on its last legs to begin with and while it remains thoroughly inoffensive and well-meaning stuff its so jam-packed with genre cliches and recycled ideas (think Coach Carter Bad News Bears Wildcats) that theres nothing you wont have seen thought or heard before. By David Jenkins Posted Tuesday January 30 2007 Details Release details Rated 12A Release date Friday February 2 2007 Duration 125 mins Cast and crew Director Phil Joanou Screenwriter Jeff Maguire Cast The Rock XzibitKevin DunnLeon RippyJade YorkerTrevor OBrienBrandon Mychal Smith MODavid ThomasSetu TaaseJames Earl IIIJarnal Mixon Users say LiveReviews|01 person listeningSign inWrite reviewMost helpfulMost helpfulHighest ratingLowest ratingNewestOldestLoadingundefinedNew CommentsRefreshShow More Share Tweet 0 Shares Top About us Work for Time Out Privacy policy Cookie Policy Website terms of use Contact us Time Out for business Get listed Claim your listing Premium Profiles Advertising Time Out products Time Out Card Mobile apps Time Out Shop Time Out Guides Time Out Travel Time Out Offers Time Out Worldwide Time Out magazine Where to get Time Out magazine Subscribe to Time Out magazine Manage my subscription Follow us Facebook Twitter Youtube Instagram Pinterest Spotify Time Out London Site map },http://www.timeout.com/film/83514.html,200,gridirongang0,gridirongang,timeout
"Page not found | www.accessatlanta.com Our ProductsAJC JobsContact UsNewsSportsNeighborhoodLifeThings to DoMoreBlogsAJC ClassifiedsGa LotteryHoroscopesTrafficDoctors amp; Sex Abuse All News 2016 Election Atlanta News Nation amp; World Business Technology Politics Crime Education Offbeat News News Video Atlanta Weather News BlogsAJC InvestigationsPolitical InsiderGet SchooledAll News BlogsIn the NewsAtlanta Watering RestrictionsTraffic Construction AlertGa. Public School RatingsAtlanta Gas Prices All Sports Atlanta Braves Atlanta Falcons Hawks High Schools Georgia Tech Georgia State Kennesaw State UGA / DawgNation SEC / SECCountry Sports Video Sports BlogsRecruiting BlogAtlanta FalconsAtlanta HawksAll Sports BlogsIn the NewsSports ScoresGolfNASCARAJC Peachtree Road Race All Neighborhood Newcomer Guide Buckhead Buford Decatur Gwinnett County Intown Atlanta Marietta Roswell Sandy Springs Smyrna Peachtree City County NewsClayton CountyCobb CountyDeKalb CountyGwinnett CountyIn the NewsAtlanta Summer CampsLiving NorthsideLiving IntownEvents Near Me All Life Celebrities Home amp; Garden Weddings amp;... Health Travel Parenting Music Home Design Ideas Food amp; Drink Movies amp; TV Arts amp; Culture Life BlogsBest of AtlantaAtlanta RestaurantsAtlanta ShoppingAll Entertainment BlogsIn the NewsBest of AtlantaGamesAJC Peachtree Road Race All Things to Do Events in Atlanta Best of Atlanta Summer Camps Movie Showtimes Radio amp; TV Arts amp; Culture Music Food amp; Drink Shopping Latest Video Games BlogsAtlanta RestaurantsMusic SceneArts amp; CultureAll Entertainment BlogsIn the NewsUpcoming MoviesLiving Intown BeltLineHoroscopes All More Newsletters AJC Customer Care Contact the AJC Games AJC Cars AJC Jobs Shop Obituaries Homefinder Kudzu Todays BuzzBuzz BlogRadio amp; TV TalkNews to MeInside AJCMovie TheatersAtlantas Top WorkplacesFind a Garage Sale All Blogs The Biz Beat Georgia Tech High School Jeff Schultz Mark Bradley Political Insider Radio amp; TV Talk The Buzz Get Schooled Take a BreakPlay a GameHoroscopesWeekend CalendarEvents near youIn the newsHow Atlanta Loses WeightKudzuGa Lottery All AJC Classifieds AJC Pets AJC Cars Homes for Sale AJC Jobs All Ga Lottery All Horoscopes All Traffic All Doctors amp; Sex Abuse State-by-State For Patients Explore the Project About the Project Doctors Investigation ArticlesBroken SystemWhich Doctors AbuseHow Many Cases?One Repeat OffenderVulnerable PatientsDoctors ExcusesUndercover Agent Nabs DocPediatrician AccusedSubscribe nowAs low as 99C/SubscribeLog InYour AccountNewslettersLog Out COMMENTS0 SHORTCUTS Homefinder Atlanta Jobs Find Your Car Classifieds Obituaries Family-placed Notices Contact Us/Subscribe Customer Care Advertise With Us Digital Products Shortcuts Homefinder Atlanta Jobs Find Your Car Full Site IndexVisitor AgreementPrivacy PolicyContact UsFollow usTopCLOSESECTIONSnewssportslifeneighborhoodsshopthings to doSHORTCUTSajc obituariesfamily-placed noticesclassifiedshomefinderatlanta jobsfind your carmanage your profilecontact uscustomer careadvertise with usdigital productsPARTNERSfind amp; save couponskudzusavings.comvalpakmyajcFUNgame centerMEMBER CENTERsign inmanage your profileUTILITIESarchivesweathertrafficsitemapLEARN ABOUT AJC.COMtake a tourFOLLOW USfacebooktwitterinstagramyoutubepinterestPRODUCTS SUBSCRIBEFOLLOW US (c) 2016 Cox Media Group. By using this website you accept the terms of our Visitor Agreement and Privacy Policy and understand your options regarding Ad Choices. Learn about careers at Cox Media Group. <a href=""http//www.omniture.com"" title=""Web Analytics""></a><a href=""http//www.qualtrics.com/enterprise-feedback-management"">Enterprise Feedback Management</a><a href=""http//www.qualtrics.com/survey-software"">Survey Software</a>x Indianapolis police officer arrested accused of shooting fellow... Newborn found abandoned on apartment porch deputies search for... Woman reunites with man who found her abandoned in phone booth 22... Did Hillary Clinton plagiarize a line in her DNC speech? Maybe Risks Businesses Take With Credit Cards Six Cheap Ways to Entertain the Kids This Summer The page could not be foundWere sorry the page you requested could not be found. It is possible that the address is incorrect or that the page no longer exists.To look further you can enter a search term in the box belowSearch More from ajc.com Topics AllNewsSportsNeighborhoodLifeThings to DoMoreBlogsAJC ClassifiedsGa LotteryHoroscopesTrafficDoctors amp; Sex AbuseCrime Indianapolis police officer arrested accused of shooting fellow... Crime Newborn found abandoned on apartment porch deputies search for... Nation Woman reunites with man who found her abandoned in phone booth 22... Politics Did Hillary Clinton plagiarize a line in her DNC speech? Maybe Business Those Who Never Graduated Have More Student Loan Debt Business 3 Signs You Are Too Reliant On Credit Cards Sign InORSign in using your accessAtlanta profileNeed a Profile? Register Now. { userInformationForm } EMAIL { traditionalSignIn_emailAddress } PASSWORDForgot your password? { traditionalSignIn_password } { traditionalSignIn_signInButton } { /userInformationForm } Sign in using your existing account { loginWidget } Sign InORSign in using your accessAtlanta profileNeed a Profile? Register Now. { userInformationForm } EMAIL { traditionalSignIn_emailAddress } PASSWORDForgot your password? { traditionalSignIn_password } { traditionalSignIn_signInButton } { /userInformationForm } Sign in using your existing account { loginWidget } Sign InORSign in using your accessAtlanta profileNeed a Profile? Register Now. { userInformationForm } EMAIL { traditionalSignIn_emailAddress } PASSWORDForgot your password? { traditionalSignIn_password } { traditionalSignIn_signInButton } { /userInformationForm } Sign in using your existing account { loginWidget } Youre Almost DonePlease confirm the information below before signing in.Required { socialRegistrationForm } { socialRegistration_displayName } { socialRegistration_emailAddress } By submitting your registration information you agree to our Visitor Agreement and Privacy Policy. { socialRegistration_signInButton } { /socialRegistrationForm } RegisterRequired { registrationForm } { traditionalRegistration_emailAddress } { traditionalRegistration_password } { traditionalRegistration_passwordConfirm } { traditionalRegistration_displayName } By submitting your registration information you agree to our Visitor Agreement and Privacy Policy. { createAccountButton } { /registrationForm } Create a New AccountRequired { registrationFormBlank } { traditionalRegistration_emailAddressBlank } { traditionalRegistration_passwordBlank } { traditionalRegistration_passwordConfirmBlank } { traditionalRegistration_displayName } By submitting your registration information you agree to our Visitor Agreement and Privacy Policy. { createAccountButton } { /registrationForm } Just One More Thing...We have sent you a verification email. Please check your email and click on the link to activate your profile.If you do not receive the verification message within a few minutes of signing up please check your Spam or Junk folder.CloseThank you for registeringWe look forward to seeing you on [website] frequently. Visit us and sign in to update your profile receive the latest news and keep up to date with mobile alerts. Click here to return to the page you were visiting. Create a new passwordDont worry it happens. Well send you a link to create a new password. { forgotPasswordForm } { forgotPassword_emailAddress } { forgotPassword_sendButton } { /forgotPasswordForm } Email sentWe have sent you an email with a link to change your password.Close { mergeAccounts } Sign in to complete account merge { tradAuthenticateMergeForm } { traditionalSignIn_emailAddress } { mergePassword } { backButton } { traditionalSignIn_signInButton } { /tradAuthenticateMergeForm } Resend Email VerificationClick submit to receive another verification email { resendVerificationForm } { traditionalSignIn_emailAddress } { /resendVerificationForm } Your Verification Email Has Been SentCheck your email for a verification linkClose",http://www.accessatlanta.com/movies/movies/etc/viewMovie.jspd?movieId=183,404,gridirongang1,gridirongang,accessatlanta
Movie | stltoday.com Sign Up Log In Dashboard Logout My Account Dashboard Profile Saved items Logout Subscriber services Contact us E-edition Contests Apps Newsletters Obits News Education Election 2016 Databases Columnists Illinois Law and order Metro Nation Obits Political Fix St. Charles Weather Opinion Letters to the editor Columnists Business Top Workplaces Press releases Columnists Sports Cardinals Blues Mizzou Olympics SLU NFL Golf Forums Columnists Chats High schools Schedules Schools Sports Stats Go Entertainment Books Calendar Comics amp; games Dining Music Movies Television Theater amp; arts Columnists Lifestyles Advice Automotive Fashion Food and cooking Health Home and Garden Parenting Religion Travel Columnists Feast Magazine St. Louis Best Bridal Ladue News Multimedia Photos Videos Chats Forums Buy/sell Classifieds Real estate Business Directory Print Ads Newspaper ads Page reprints Autos Jobs Homes Archives Toggle navigation Menu Search Search Log In Using Your Account Log In Dont have an account? Sign Up Today My Account Dashboard Profile Saved items Logout 71deg Saint Louis MO (63101) Today Sun and clouds mixed. High 88F. Winds NW at 5 to 10 mph.. Tonight Mainly clear skies. Low 69F. Winds NNE at 5 to 10 mph. Updated July 30 2016  253 am Full Forecast News Sports Business Go Life Buy/Sell Sorry the page youre looking for cannot be found. 404 The page may have moved you may have mistyped the address or followed a bad link. Visit our homepage or search for whatever you were looking for... Feast Magazine Ladue News St. Louis Best Bridal STL High School Sports Products and features Apps Archives Calendar Chats Comics amp; games Contests E-edition Forums Newsletters Our events Press releases Tools and services Advertise with us Autos Classifieds Contact us Homes Jobs Newspapers in Education Page reprints Post-Dispatch store Site help Subscriber services (c) Copyright 2016 STLtoday.com 900 N. Tucker Blvd. St. Louis MO | Terms of Use | Privacy Policy Powered by BLOX Content Management System from TownNews.com.,http://www.stltoday.com/stltoday/entertainment/reviews.nsf/movie/story/436E2A897C3210E2862571E90072E5B9?OpenDocument,404,gridirongang2,gridirongang,stltoday
"Gridiron Gang | Chicago Reader Switch to the mobile version of this page. Newsletters Follow us Twitter Facebook RSS Mobile Username View Profile Edit Profile Log Out Log in Create Account The Chicago Reader News amp; Politics Music Arts amp; Culture Film Food amp; Drink Classifieds Browse News amp; Politics News amp; Politics home page Steve Bogira | Criminal Justice John Greenfield | Transportation Deanna Isaacs | Culture Ben Joravsky | Politics Michael Miner | Media Browse Music Music home page Gossip Wolf In Rotation Record roundups Leor Galil | Music Criticism Peter Margasak | Music Criticism Soundboard Concerts this week Early Warnings Concerts on horizon Browse Film Film home page J.R. Jones | Movie Reviews Index of Long Reviews Film Archive Short Reviews Now Playing Todays Showtimes Browse Arts amp; Culture Arts amp; Culture home page Tony Adler | Theater Justin Hayford | Theater Aimee Levitt | Features Brianna Wellen | Comedy Arts amp; Culture event search Browse Food amp; Drink Food amp; Drink home page Mike Sula | Restaurant Reviews Key Ingredient A chef-to-chef challenge Cocktail Challenge Bar Guide Restaurant search Browse The Bleader The Bleader blog home page Browse Classifieds Classifieds home page Real Estate Rentals Announcements Services Jobs (Monster) Place ad ad Best of Chicago Summer Guide Savage Love Straight Dope Agenda Events Locations Issues Article Archives Fun amp; Free You searched for [X]Gridiron Gang Start over Search for... Browse movie times Narrow Search Author Select an author Andrea Gronvall Michael Atkinson Pat Aufderheide Zbigniew Banas Barbara Scharres Angelica Jade Bastien Bill Stamets Bob Mehr Brian Thomas Peter Brunette Dave Canfield Cara Jepsen Carol Burbank Cheryl Ross Pat Chesnut Luca Cimarusti Patrick Dahl Tyler Daswick Dave Kehr Cliff Doerksen Dominick Suzanne-Mayer Don Druker Mick Dumke Marilyn Ferdinand Fred Camper Patrick Friel Chris Fujiwara Leor Galil Hank Sartin Justin Hayford Jack Helbig Henry Sheehan Tanner Howard Drew Hunt J. R. Jones J.R. Jones Jennifer Vanasco Jessica Hopper Jim Healy Jonathan Rosenbaum Joshua Katzman Josh Katzman Anthony Kaufman Kelly Kleiman Asher Klein Shelley Kraicer Shelly Kraicer Nathalie Lagerfeld Adam Langer Lawrence Bommer Lisa Alspector Eric Lutz Peter Margasak Mark Jenkins Martha Bayne Adrian Martin Tom McCormack Meredith Brody Sergio Mims Michael Miner Laura Molzahn Monica Kendrick Adam Morgan Noel Murray Noah Berlatsky Pat Graham Patrick McGavin Patrick Z. McGavin Gerald Peary Richard Pena Mark Peranson Peter Keough Leah Pickett Richard M. Porton Laura Power Quintin Miles Raymer Reece Pendleton Berenice Reynaud Ronnie Scheib Tal Rosenberg Joshua Rothkopf Joshua H. Rothkopf Martin Rubin Ryan Wenzel Ben Sachs Dan Sallitt Dmitry Samarov Ronnie Schieb David Schwartz David P. Schwartz Scott Pfeiffer Ian Simmons Alissa Simon Michael Glover Smith Patrick Somerville Laura Stempel Steve Erickson David Stewart Gwynedd Stuart Mike Sula Ted Shen Julia Thiel Ignatiy Vishnevetsky Kevin Warwick Jessica Weisberg Brianna Wellen Joel Wicklund Albert Williams Michael Wilmington Sam Worley Rating G PG PG-13 R NC-17 X NR Show only Staff Pick Staff Pick Critics Choice Critics Choice Recommended Recommended New New Agenda Agenda Free Free Slideshow Slideshow Video Video Watch on Amazon Watch on Amazon Watch on Netflix Watch on Netflix Watch on Hulu Watch on Hulu Watch on YouTube Watch on YouTube Member Picks Member Picks Other Searches Events Location Guide Member Search Movie Showtimes Movie Reviews Article Archives Issue Archives Slideshows Comments Videos Images Sorting by Name Release Date Film Search Tweet Tools Email Print Share Digg Newsvine del.icio.us Facebook Reddit Twitter Windy Citizen Add to Custom List Loading... Comments Gridiron Gang Dwayne ""the Rock"" Johnson weeps gentle tears in this sappy sports drama about Sean Porter a probation officer at a Los Angeles juvenile detention facility who turned a collection of teenage felons into a competitive high school football squad. The coachs mother is dying of cancer the kids are all emotionally wounded and the score swells at every opportunity; you have to admire such bleeding-heart tenderness in a conservative genre but as Robert Aldrich proved in The Longest Yard a football movie should be able to hit harder. The end credits are accompanied by clips of Porter from the Emmy-winning documentary Gridiron Gang (1993) which prove that key scenes from this movie were lifted straight from life and that life needs better writers. PG-13 120 min. By J.R. Jones Now Playing Sorry there are no upcoming showtimes for Gridiron Gang Reviews/comments Subscribe to this thread By Email Subscribing... With RSS Comment Add a review Rating Roll over stars and click to rate. Subscribe to this thread Terms of UsePrivacy PolicySubmission GuidelinesAbout The ReaderStaffReader CareersContact UsFreelancing InfoAdvertisingBack IssuesReprints Copyright (c) 2016 Sun-Times Media LLC. Powered by Foundation",http://onfilm.chicagoreader.com/movies/briefs/30310_GRIDIRON_GANG.html,200,gridirongang3,gridirongang,chicagoreader
