review,link,status_code,id,movie_key,critic
"Page not found | www.accessatlanta.com Our ProductsAJC JobsContact UsNewsSportsNeighborhoodLifeThings to DoMoreBlogsAJC ClassifiedsGa LotteryHoroscopesTrafficDoctors amp; Sex Abuse All News 2016 Election Atlanta News Nation amp; World Business Technology Politics Crime Education Offbeat News News Video Atlanta Weather News BlogsAJC InvestigationsPolitical InsiderGet SchooledAll News BlogsIn the NewsAtlanta Watering RestrictionsTraffic Construction AlertGa. Public School RatingsAtlanta Gas Prices All Sports Atlanta Braves Atlanta Falcons Hawks High Schools Georgia Tech Georgia State Kennesaw State UGA / DawgNation SEC / SECCountry Sports Video Sports BlogsRecruiting BlogAtlanta FalconsAtlanta HawksAll Sports BlogsIn the NewsSports ScoresGolfNASCARAJC Peachtree Road Race All Neighborhood Newcomer Guide Buckhead Buford Decatur Gwinnett County Intown Atlanta Marietta Roswell Sandy Springs Smyrna Peachtree City County NewsClayton CountyCobb CountyDeKalb CountyGwinnett CountyIn the NewsAtlanta Summer CampsLiving NorthsideLiving IntownEvents Near Me All Life Celebrities Home amp; Garden Weddings amp;... Health Travel Parenting Music Home Design Ideas Food amp; Drink Movies amp; TV Arts amp; Culture Life BlogsBest of AtlantaAtlanta RestaurantsAtlanta ShoppingAll Entertainment BlogsIn the NewsBest of AtlantaGamesAJC Peachtree Road Race All Things to Do Events in Atlanta Best of Atlanta Summer Camps Movie Showtimes Radio amp; TV Arts amp; Culture Music Food amp; Drink Shopping Latest Video Games BlogsAtlanta RestaurantsMusic SceneArts amp; CultureAll Entertainment BlogsIn the NewsUpcoming MoviesLiving Intown BeltLineHoroscopes All More Newsletters AJC Customer Care Contact the AJC Games AJC Cars AJC Jobs Shop Obituaries Homefinder Kudzu Todays BuzzBuzz BlogRadio amp; TV TalkNews to MeInside AJCMovie TheatersAtlantas Top WorkplacesFind a Garage Sale All Blogs The Biz Beat Georgia Tech High School Jeff Schultz Mark Bradley Political Insider Radio amp; TV Talk The Buzz Get Schooled Take a BreakPlay a GameHoroscopesWeekend CalendarEvents near youIn the newsHow Atlanta Loses WeightKudzuGa Lottery All AJC Classifieds AJC Pets AJC Cars Homes for Sale AJC Jobs All Ga Lottery All Horoscopes All Traffic All Doctors amp; Sex Abuse State-by-State For Patients Explore the Project About the Project Doctors Investigation ArticlesBroken SystemWhich Doctors AbuseHow Many Cases?One Repeat OffenderVulnerable PatientsDoctors ExcusesUndercover Agent Nabs DocPediatrician AccusedSubscribe nowAs low as 99C/SubscribeLog InYour AccountNewslettersLog Out COMMENTS0 SHORTCUTS Homefinder Atlanta Jobs Find Your Car Classifieds Obituaries Family-placed Notices Contact Us/Subscribe Customer Care Advertise With Us Digital Products Shortcuts Homefinder Atlanta Jobs Find Your Car Full Site IndexVisitor AgreementPrivacy PolicyContact UsFollow usTopCLOSESECTIONSnewssportslifeneighborhoodsshopthings to doSHORTCUTSajc obituariesfamily-placed noticesclassifiedshomefinderatlanta jobsfind your carmanage your profilecontact uscustomer careadvertise with usdigital productsPARTNERSfind amp; save couponskudzusavings.comvalpakmyajcFUNgame centerMEMBER CENTERsign inmanage your profileUTILITIESarchivesweathertrafficsitemapLEARN ABOUT AJC.COMtake a tourFOLLOW USfacebooktwitterinstagramyoutubepinterestPRODUCTS SUBSCRIBEFOLLOW US (c) 2016 Cox Media Group. By using this website you accept the terms of our Visitor Agreement and Privacy Policy and understand your options regarding Ad Choices. Learn about careers at Cox Media Group. <a href=""http//www.omniture.com"" title=""Web Analytics""></a><a href=""http//www.qualtrics.com/enterprise-feedback-management"">Enterprise Feedback Management</a><a href=""http//www.qualtrics.com/survey-software"">Survey Software</a>x Indianapolis police officer arrested accused of shooting fellow... Newborn found abandoned on apartment porch deputies search for... Woman reunites with man who found her abandoned in phone booth 22... Did Hillary Clinton plagiarize a line in her DNC speech? Maybe Risks Businesses Take With Credit Cards Six Cheap Ways to Entertain the Kids This Summer The page could not be foundWere sorry the page you requested could not be found. It is possible that the address is incorrect or that the page no longer exists.To look further you can enter a search term in the box belowSearch More from ajc.com Topics AllNewsSportsNeighborhoodLifeThings to DoMoreBlogsAJC ClassifiedsGa LotteryHoroscopesTrafficDoctors amp; Sex AbuseCrime Indianapolis police officer arrested accused of shooting fellow... Crime Newborn found abandoned on apartment porch deputies search for... Nation Woman reunites with man who found her abandoned in phone booth 22... Politics Did Hillary Clinton plagiarize a line in her DNC speech? Maybe Business Those Who Never Graduated Have More Student Loan Debt Business 3 Signs You Are Too Reliant On Credit Cards Sign InORSign in using your accessAtlanta profileNeed a Profile? Register Now. { userInformationForm } EMAIL { traditionalSignIn_emailAddress } PASSWORDForgot your password? { traditionalSignIn_password } { traditionalSignIn_signInButton } { /userInformationForm } Sign in using your existing account { loginWidget } Sign InORSign in using your accessAtlanta profileNeed a Profile? Register Now. { userInformationForm } EMAIL { traditionalSignIn_emailAddress } PASSWORDForgot your password? { traditionalSignIn_password } { traditionalSignIn_signInButton } { /userInformationForm } Sign in using your existing account { loginWidget } Sign InORSign in using your accessAtlanta profileNeed a Profile? Register Now. { userInformationForm } EMAIL { traditionalSignIn_emailAddress } PASSWORDForgot your password? { traditionalSignIn_password } { traditionalSignIn_signInButton } { /userInformationForm } Sign in using your existing account { loginWidget } Youre Almost DonePlease confirm the information below before signing in.Required { socialRegistrationForm } { socialRegistration_displayName } { socialRegistration_emailAddress } By submitting your registration information you agree to our Visitor Agreement and Privacy Policy. { socialRegistration_signInButton } { /socialRegistrationForm } RegisterRequired { registrationForm } { traditionalRegistration_emailAddress } { traditionalRegistration_password } { traditionalRegistration_passwordConfirm } { traditionalRegistration_displayName } By submitting your registration information you agree to our Visitor Agreement and Privacy Policy. { createAccountButton } { /registrationForm } Create a New AccountRequired { registrationFormBlank } { traditionalRegistration_emailAddressBlank } { traditionalRegistration_passwordBlank } { traditionalRegistration_passwordConfirmBlank } { traditionalRegistration_displayName } By submitting your registration information you agree to our Visitor Agreement and Privacy Policy. { createAccountButton } { /registrationForm } Just One More Thing...We have sent you a verification email. Please check your email and click on the link to activate your profile.If you do not receive the verification message within a few minutes of signing up please check your Spam or Junk folder.CloseThank you for registeringWe look forward to seeing you on [website] frequently. Visit us and sign in to update your profile receive the latest news and keep up to date with mobile alerts. Click here to return to the page you were visiting. Create a new passwordDont worry it happens. Well send you a link to create a new password. { forgotPasswordForm } { forgotPassword_emailAddress } { forgotPassword_sendButton } { /forgotPasswordForm } Email sentWe have sent you an email with a link to change your password.Close { mergeAccounts } Sign in to complete account merge { tradAuthenticateMergeForm } { traditionalSignIn_emailAddress } { mergePassword } { backButton } { traditionalSignIn_signInButton } { /tradAuthenticateMergeForm } Resend Email VerificationClick submit to receive another verification email { resendVerificationForm } { traditionalSignIn_emailAddress } { /resendVerificationForm } Your Verification Email Has Been SentCheck your email for a verification linkClose",http://www.accessatlanta.com/movies/content/shared/movies/reviews/H/halloweenresurrection.html,404,halloweenresurrection0,halloweenresurrection,accessatlanta
"Biz up; Mamma 931g | Variety Variety Editions U.S Latino Global Asia Subscribe Today Navigation Menu Film TV Digital Contenders Video Dirt Jobs More Biz Music Legit Scene Conferences Insight Archives Directory Choose Edition U.S Latino Global Asia Russia | My Account Sign In Subscribe HomeLegitNews Biz up; Mamma 931g Variety Staff Follow Us on Twitter Variety 0 Share This Article Email LinkedIn Pin It Tumblr February 20 2005 | 0500AM PT Road grosses NEW YORK -- Road grosses rose 6.5% to 13327489 during Week 37 (Feb. 7-13). ""Mamma Mia"" climbed 242303 to 931813 in moving from Lincoln Neb. to Kansas City Mo. while ""Chicago"" jumped 229208 to 958394 at the Pantages in Los Angeles. Estimates for last week ROAD GROSSES WEEK 37 FEB. 7-13 2005 AKRON OHIOThoroughly Modern Millie (M) EJ Thomas Hall (52; 2271; 632110) (2/11/05-2/13/05).PW 403042 in Myrtle Beach S.C.Last (1st) wk 253890 (5perf). AUSTIN Little Shop of Horrors (M) Bass Hall (59; 2924; 822522) (2/8/05-2/13/05).PW 690610 in Atlanta.Last (1st) wk 446917. BALTIMOREThe King and I (M) France Merrick PAC (62; 2270; 855720) (2/1/05-2/13/05).PW 618691.Last (2nd) wk 689770. BOSTONThe Lion King (M-2nd Co.) Opera House (85; 2542; 1187132) (7/16/04-2/20/05).PW 922244.Last (31st) wk 1035019. CHICAGOPeter Pan (M) Palace (72; 2344; 1100866) (2/1/05-2/13/05).PW 568561.Last (2nd) wk 664724.The Producers (M-2nd Co.) Auditorium (80; 2558; 1314697) (2/2/05-2/20/05).PW 721147.Last (2nd) wk 888754. CLEARWATER FLA.Riverdance (M) Ruth Eckerd Hall (72; 1714; 590704) (2/11/05-2/13/05).PW 620169 in Chattanooga Tenn. (3perf) and Gainesville Fla. (5perf).Last (1st) wk 838270 in Sarasota Fla. (3perf) and Clearwater Fla. (5perf) CLEVELANDMovin Out (M) Palace (75; 2716; 1256500) (2/7/05-2/20/05).PW 1037080 in Lansing Mich.Last (1st) wk 1030931. COLUMBUS OHIOBig River (M) Palace (45; 2809; 437310) (2/11/05-2/13/05).PW 610360 in Sacramento.Last (1st) wk 151479 (5 perf). DETROITOn the Record (M) Fisher (69; 2089; 863866) (2/7/05-2/27/05).PW 206109 in Richmond Va.Last (1st) wk 280851. FORT MYERS FLA.The Phantom of the Opera (M) Barbara B. Mann PAC (84; 1713; 824893) (2/2/05-2/27/05).PW 590383.Last (2nd) wk 700072. KANSAS CITY MO.Mamma Mia (M-2nd Co.) Music Hall (65; 2389; 1081665) (2/8/05-2/13/05).PW 689510 in Lincoln Neb.Last (1st) wk 931813. LOS ANGELESChicago (M) Pantages (100; 2753; 1362500) (2/1/05-2/20/05).PW 729186.Last (2nd) wk 958394. SAN FRANCISCOCaroline or Change (M) Curran (90; 1576; 989852) (1/11/05-2/20/05).PW 553688.Last (5th) wk 554600. ST. LOUISLes Miserables (M) Fox (60; 4074; 1210554) (2/1/05-2/13/05).PW 729627.Last (2nd) wk 875641. TAMPA FLA.Hairspray (M) Tampa Bay PAC (77; 2399; 1298382) (2/1/05-2/13/05).PW 1002651.Last (2nd) wk 1018429. TEMPE ARIZ.The Lion King (M-2nd Co.) Gammage Auditorium (125; 2686; 1237204) (1/17/05-3/6/05).PW 1105743.Last (4th) wk 1128882. TORONTOMamma Mia (M) Royal Alexandra (C94/76; 1446; C690000/558969) (5/10/00-OE).PW C626000/501488.Last (213th) wk C650000/526565. WILMINGTON DEL.The Graduate (P) DuPont (60; 1238; 564864) (2/4/05-2/13/05).PW 217836 in Easton Penn. (1perf) and Wilmington Del. (4perf).Last (2nd) wk 352488. Want to read more articles like this one? SUBSCRIBE TO VARIETY TODAY. Post A Comment 0 Most Popular 1 Film 836PM PT Frank Zappa in Eat That Question A Blast of Sanity From the Rock Past 2 TV 626PM PT Chandra Levy Limited Series in Development at TNT 3 TV 551PM PT Howard Dean Explains Donald Trumps Rise People Dont Care 4 TV 551PM PT HBO Orders Alan Ball Family Drama to Series 5 Film 530PM PT Marvels Avengers Infinity War Will be One Movie Not Two Variety Jobs Creative Development Coordinator Triptyk Studios New York New York Account/Project Coordinator (Ad Agency) Petrol Advertising Burbank California Media Specialist Bridgewater Associates Westport Connecticut Executive Director Aspen Film Company Confidential Aspen Colorado Associate Director YouTuber amp; Gamer Partnerships Save the Children Fairfield Connecticut See More Jobs Marketplace Leave a Reply No Comments Cancel reply Comments are moderated. They may be edited for clarity and reprinting in whole or in part in Variety publications. Enter your comment here... Fill in your details below or click an icon to log in Email (required) (Address never made public) Name (required) Website You are commenting using your WordPress.com account. ( Log Out / Change ) You are commenting using your Twitter account. ( Log Out / Change ) You are commenting using your Facebook account. ( Log Out / Change ) You are commenting using your Google+ account. ( Log Out / Change ) Cancel Connecting to %s Notify me of new comments via email. Notify me of new posts via email. More Legit News from Variety The Power of Content Jason Bourne Targets 60M+; Bad Moms Gets Sassy With 26.5M... Amber Rose Wiz Khalifa Recently Put His Sperm On My Face... High Beam Shoes Launches Synching Sneakers That Help Find... General Hospitals Tyler Christopher Announces Return as... This is the reason next years Galaxy S8 will be so powerful Subscribe to Variety Today All The Ways to Get Variety Online Subscription Print Subscription Mobile Apps Newsletters News Alerts Archives Slanguage Dictionary Help Other Variety Products MediaVariety 411 Research amp; DataVariety Insight Archives Premium Email Alerts Real Estate Jobs Access the best entertainment industry data available View the Variety archives dating back to 1905 Get News Delivered To Your Inbox Privacy Policy Your Privacy Rights Terms of Use About Us Advertise Contact Us Google+ The Power of Content Deadline india.com Hollywoodlife hollywood TV Line BGR WWD Footwearnews (c) Copyright 2016 Variety Media LLC a subsidiary of Penske Business Media LLC. Variety and the Flying V logos are trademarks of Variety Media LLC. Powered by WordPress.com VIP Variety411 Your production services resource",http://www.variety.com/index.asp?layout=review&reviewid=VE1117918201&categoryid=31,200,halloweenresurrection1,halloweenresurrection,variety
