review,link,status_code,id,movie_key,critic
Harry Potter and the Goblet of Fire - Houston Chronicle SUBSCRIBE As low as 1.00/week Sign In Home Contact Chron About Houston Chronicle Advertise with Us Place a Classified Ad Niche Publication Ads Careers Store Privacy Policy Terms of Use Newsletters Subscribe HC Archives Mormon phrase on condom packs? Theres the rub Places every Texas kid should see before growing up 12 ways Joanna Gaines of HGTVs Fixer Upper is your spirit Things Texans secretly do but would never admit Local Neighborhoods Neighborhoods All Neighborhoods Bay Area Bellaire Cy-Fair Fort Bend Heights Katy Kingwood Memorial Pearland Spring The Woodlands Houston amp; Texas News Houston amp; Texas News Houston Texas Traffic Weather Weather Radar amp; Forecasts Houston Weather Severe Weather News Hurricane Guide Education Education K-12 Zone Blog School Report Card 2014 Politics amp; Policy Politics amp; Policy Texas Politics Chronicle Investigates Obituaries Staff amp; Reader Blogs Classifieds Columnists Opinions amp; Editorials Opinions amp; Editorials Opinion Editorials Letters to the Editor Outlook Nick Anderson Cartoons La Voz (Espanol) Texas Energy Guide Reports Man shoots child then turns gun on himself Report Man charged after road rage video goes viral Mormon phrase on condom packs? Theres the rub Lawyer seeks gag order in Sandra Bland lawsuit US amp; World US News World News Crime The Americas Politics Science amp; Environment Strange amp; Weird News Videos Video captures deputys dramatic rescue of gunshot victim kids Texas Senator Brian Birdwell finally got to meet the man who Study confirms what gun rights advocates have said for a long Warren Sapp bitten by shark during Florida Keys lobster trip Sports Texans Rockets Astros Dynamo High School Colleges UH Rice UT Aamp;M Outdoors More Sports More Sports Golf Buy Tickets Super Bowl LI DeAndre Hopkins doesnt report for training camp over contract 10 questions facing Texans at training camp Revisiting the Astros best and worst deadline deals Texans extend Rick Smiths contract Business Energy (Fuel Fix) Technology Real Estate Money Tips Business Insider Press Releases Small Business Mgmt Chron 100 Top Workplaces Sponsored Content Legal Notices Business Directory US GDP grows a weak 1.2 percent in second quarter Amazons already large distribution empire keeps expanding Ford surprises with lower 2Q profit on trouble in US China Chipotle branching out plans to open burger restaurant Aamp;E Preview Preview Alison Cook Restaurant Reviews Whine amp; Dine Top 100 Restaurants Guides to Houston Restaurants amp; Bars Music Movies Arts amp; Theater Rolling Stone Us Weekly Radar Online Horoscopes Comics amp; Games Events amp; Things To Do NEW Puzzles 20 tearjerker movies Hollywood should leave alone Meghan Trainor rocks girls night out in Woodlands Chip and Joanna Gaines are just the latest celebrities to visit Chef Randy Ruckers Bramble restaurant has closed Life Health Health The Doctors Mens Journal Live Healthy Escapes Escapes Home amp; Design Travel Style Mom Houston Luxe Life Houston Belief Food amp; Cooking Food amp; Cooking Food amp; Cooking Alison Cook Restaurant Reviews Whine amp; Dine Top 100 Restaurants Society Travel Travel Flight Tracker Texas Road Trips Travel Pets Houston Gives Weddings amp; Celebrations Sponsored Content Local backyard design inspirations thatll make you want to DIY The 50 smoothest pick-up lines in movie history 18 foods you should never feed your pet Why is everyone freaking out about this photo of two bikini-clad Jobs Advanced search Browse job categories Salary Wizard Career Rescue Careers in Engineering Salute to Nurses Work amp; Career Advice Post a Job Is that dream opportunity really a nightmare? These 25 hot jobs pay at least 100K Set a career goal for every month of 2016 The highest-paying entry-level jobs Cars Cars amp; Auto News Heidis Cars Blog New Car Search Used Car Search Certified Car Search Houston Auto Dealers The new Lincoln Navigator concept is too legit to quit Hennessey pushes a Camaro to over 200 MPH Riding the 2016 Indian Chieftain BMW turns 100 years old A look back Real Estate New Homes Second Homes Rentals Home Price Survey Mortgages Commercial Real Estate Farms amp; Ranches Senior Living Chron Homes App Private Party Ads Summer Showcase My Perfect Hous(e)ton Suburban homebuilder develops new Greater Heights neighborhood Glamorous Texas ranch with Hollywood history hits market Shipping container complex to be developed in Houston 115 Years Findamp;Save Roost MenuSections http//www.chron.com/entertainment/movies/article/Harry-Potter-and-the-Goblet-of-Fire-1954287.php Harry Potter and the Goblet of Fire Things get hairy in the fourth installment  3starsGo to showtimes AMY BIANCOLLI Copyright 2005 Houston Chronicle Published 630 am Thursday November 17 2005 Among Potterphiles J.K. Rowlings fourth book is considered a critical turning point. Its the first novel in which Harry fails to vanquish foes the first to kill off a significant character the first to chronicle the initial blush of Harrys interest in girls and the first to note Rons metamorphosis into (as Harry might say) a right foul git. But most of all Harry Potter and the Gobletof Fire begins that black descent into a terrifying world order -- not simply for Harry and his pals at Hogwarts but for everyone wizards and Muggles all. It is a big sloppy slab of fiction a meandering tonally spastic beast of 734 pages that should have been cut by 200. But by its end when evil has risen from the dust and Harry is facing unimagined horrors it is irresistible fantastically tragic storytelling. And so by its end is the movie. This newest film -- from Donnie Brasco director Mike Newell the series first bona-fide Brit at the helm -- is neither the best nor worst in the canon and its neither the most nor least faithful to its source. Steven Kloves screenplay toys with new elements and fanatics should know that whole subplots are absent (dont go looking for the Society for the Protection of Elvish Welfare) along with 99.9 percent of the Quidditch World Cup. No sexpot Veelas either. The spine of the tale remains the Triwizard Tournament a harrowing magical competition that chucks Harry and three fellow students into the fray with dragons mermaids and other necromantic obstacles designed to challenge their wizardly knowledge and wandly skills. We know that the satanic Lord Voldemort is still after Harry and we know that somebody -- nobody nice probably one of You-Know-Whos slimy minions -- entered an unwitting Harry in the competition perhaps to get him killed. Life turns stormy for the poor kid forcing Radcliffe to follow suit After years of relying on his undeniable dewy cuteness he rolls up his sleeves and acts. Beyond that the film preserves much of what made the book both problematic and absorbing. It still rambles. It still feels like a tussle between multiple personalities -- between adolescent primping and apocalyptic combat between hormones and war. (Then again hormones are war.) Muddling things further are its overcooked under-imagined action set pieces. Yet in its last third The Goblet of Fire builds to a climax of such overpowering dread that you might just forget the rest. Harry grows up in an instant and the film does too. Before the final credits roll the Potter saga has transformed into a fully matured allegory of elemental struggle a knock-down drag-out between opposing forces. Harry good Voldemort evil. Any questions? One more thing This is nightmare material. I wouldnt bring my 5-year-old and neither should you. The Harry Potter epic may have started out as childrens fare but it certainly isnt kids stuff any longer. Todays Deals Wide-Ruled 70-Sheet Spiral-Bound Notebook for 17 cents +... Mini Portable Washer and Spin Dryer for 90 + free shipping 6 Pairs of Alpine Swiss Mens Dress Socks for 7 + free shipping NFL Caps at Lids for 10 + free shipping w/ 50 Powered by Contests Enter to win concert tickets airfare and hotel More Entertainment News Rolling Stones Lash Out at Donald Trump (Again) Over Song Use Daveed Diggs Renee Elise Goldsberry to Leave Hamilton Broken Social Scene Working on New Album Steve Young of M/A/R/R/S Pump Up the Volume Fame Dead Calvin Harris Taylor Swift Song Co-Write Questions We Still... Andrew W.K. Celebrates Power of Partying on 50-State... In Police Violence Cases Time Works Against Justice New Marvin Gaye Doc Features Unseen Footage Garth Brooks Previews Unprecedented New Video Series Craig Morgans Son Jerry Greer Dead at 19 in Boating Accident Most Read 1 These are unsettling times that require a steady hand Thats... 2 Teen son accused of killing ex-Aamp;M football star and wife 3 Two coaches suspended after Texas Aamp;Ms chalk talk for women 4 Texas meteorologist removed from staff page after racially... 5 Why is everyone freaking out about this photo of two... 6 Reports Man shoots child then turns gun on himself 7 Thunderstorms high winds likely to batter Houston region 8 Galveston officials Officer says she set out to seduce ex-... 9 Ex-Katy High teacher charged with improper relationship with... 10 Hearst purchases community newspapers across Houstons suburbs View Comments (c) 2016 Hearst Communications Inc. Logo Return to Top About Our Company Careers Advertise with Us Ad Choices Terms amp; Conditions Privacy Policy Your California Privacy Rights Contact Customer Service Newsroom Contacts Connect Email Newsletter Facebook Twitter Pinterest Google Instagram Subscribe iPad app HoustonChronicle.com Houston Chronicle Archives eEdition Demo Todays eEdition Hearst Newspapers (c) Copyright Hearst Newspapers LLC,http://www.chron.com/default/article/Harry-Potter-and-the-Goblet-of-Fire-1954287.php,200,harrypotterandthegobletoffire0,harrypotterandthegobletoffire,chron
"The Pitter Potter of Magical Feats Search Newsweek U.S.WorldBusinessTech amp; ScienceCultureSportsOpinion Subscribe To Newsweek This Week EditionSign InAccount Subscribe To Newsweek Subscribe To Newsweek 14.99Print amp; Digital3 Month Trial--Save 85% off cover Try4.99Digital Only3 Month Trial--Save 45% off cover Try See All Subscription Options Subscribe To The Newsletter Please enter a valid email This Week Edition This Weeks Edition July 29The Chilcot Reports War on ErrorWhy Cancer Clusters Are Impossible to ProveCats Star Turn Deep Inside the Weird World of CatCon View All FeaturesChange Your EditionUSEuropeMiddle EastEspanolRi Ben hangugPakistanPolskaSrbijaCeska RepublikaSign InAccountYour SubscriptionYou have days remaining on your subscription Renew Account Settings Sign Out NewsThe Pitter Potter of Magical Feats By David Ansen On 11/20/05 at 700 PM NewsSexual attraction has entered the Harry Potter universe. Harry (Daniel Radcliffe) is now 14 and hes one of four contestants competing in the dangerous Tri-Wizard Tournament. The first event requires him to capture a golden egg thats guarded by a ferocious Hungarian flying dragon. Terrifying as this is it pales in comparison with having to ask the beguiling Cho Chang (Katie Leung) to Hogwartss Yule Ball. Now that takes courage.The hormonal confusions of adolescence threaten the camaraderie of Harry Ron (Rupert Grint) and Hermione (Emma Watson). But if the teenagers are experiencing growing pains the movie series has come into its own. ""Harry Potter and the Goblet of Fire"" may not reach the lyrical heights of Alfonso Cuarons stylish ""Prisoner of Azkaban"" but this fourth installment directed by Mike Newell has a stronger tale to tell. And the storytelling is so assured that its 144-minute running time feels half that--unlike the first two movies which felt twice as long as they actually were.Newell (""Donnie Brasco"" ""Four Weddings and a Funeral"") and screenwriter Steve Kloves have made the funniest the scariest and possibly the most human of the series. It also offers our first up-close-and-personal glimpse of Harrys great antagonist Lord Voldemort (Ralph Fiennes). There will be debate among Potter fans whether Fienness archvillain matches their direst expectations. At worst his scene is a near miss. Try Newsweek for only 1.25 per week The uncontestable triumph of ""Goblet of Fire"" however is Brendan Gleesons Alastor (Mad-Eye) Moody the grizzled new Defense Against the Dark Arts professor. With a face like cracked pottery and a manner both menacing and mentoring he becomes Harrys protector as he faces life-threatening tests. Gleeson one of the screens greatest character actors steals every scene hes in--no small feat when youre up against Maggie Smith and Alan Rickman.Kloves has streamlined J. K. Rowlings 700-plus-page opus into cinematic fighting form. And the special effects which threatened to overwhelm the first two movies are seamlessly integrated. The question now becomes can the next two episodes be finished before Radcliffe Grint and Watson literally outgrow their roles?Request Reprint or Submit Correction Join the Discussion Most Read (c) 2016 Newsweek LLC Please enter a valid emailAbout UsCorrectionsContact UsIBT MediaCareersAdvertiseCopyrightPrivacy PolicyTerms of ServiceTerms of SaleArchiveRecent Issues SubscribeJuly 22 Issue Cop Killers Fatal Shootings of Police Are Rising Jeff Bezos Wants to Rule the World Can Mark Carney Save Britain From Itself? July 15 Issue The Last Nazi Hunter The Weird World of Extreme Racing Solar Power Brightens Prospects in East Africa July 08 Issue Beyond Brexit Europes Populist Backlash Intensifies Mapping Any Location on Earth With Just Three Words Its Time to Stop the Madness Over Starting Pitchers July 01 Issue Jeff Sessions the Trump Whisperer How D.C. Is Preparing for the Next Terrorist Attack Serena Williams and Coach Mouratoglou Perfect Match?Browse Archives",http://www.newsweek.com/pitter-potter-magical-feats-115179,200,harrypotterandthegobletoffire1,harrypotterandthegobletoffire,newsweek
"At the Movies Harry Potter and the Goblet of Fire - The Daily Universe .wpb_animate_when_almost_visible { opacity 1; } x News Breaking News Campus Local State Nation World Religion Eleven News Campus Campus News Campus Events Coverage Devotionals and Forums Sports Baseball Basketball Cheer Cougarettes Football Golf Gymnastics Outdoor Recreation Soccer Softball Swim and Dive Tennis Track and Field Volleyball Club Sports Intramurals Olympic Sports Life Art Books Food Fashion Healthy Living Movies / Television Museums amp; Exhibitions Music Technology Theater Opinion Editorials Readers Forum Tweet Beat Viewpoints Police Beat Events Campus Events Calendar Publications Bridal Guide Eleven News Housing Guide Two Magazine Universe Archives (PDF) Special Projects A Day in the Life of BYU A Week in Photos Capital West News Comics Cougar Questions Parliament of the Worlds Religions Sudoku Answers Uros Islands Project Ygram Marketplace At the Movies Harry Potter and... News Breaking News Campus Local State Nation World Religion Eleven News Campus Campus News Campus Events Coverage Devotionals and Forums Sports Baseball Basketball Mens Basketball Womens Basketball Cheer Cougarettes Football Golf Gymnastics Outdoor Recreation Soccer Softball Swim and Dive Tennis Track and Field Volleyball Mens Volleyball Womens Volleyball Club Sports Hockey Lacrosse Rugby Other Club Sports Intramurals Olympic Sports Life Art Books Food Fashion Healthy Living Movies / Television Museums amp; Exhibitions Music Technology Theater Opinion Editorials Readers Forum Tweet Beat Viewpoints Police Beat Events Campus Events Calendar Publications Bridal Guide Eleven News Housing Guide Two Magazine Universe Archives (PDF) Special Projects A Day in the Life of BYU A Week in Photos Capital West News Comics Cougar Questions Parliament of the Worlds Religions Sudoku Answers Uros Islands Project Ygram Marketplace At the Movies Harry Potter and the Goblet of Fire November 14 2005 by NewsNet Staff Writer 0 0 0 0 0 By CHRISTY LEMIRE AP Movie Critic (AP) - If the third film in the Harry Potter series last years ""Prisoner of Azkaban"" seemed frightening with its soul-sucking Dementors and its German expressionist aesthetic then the fourth installment ""Harry Potter and the Goblet of Fire"" will have kids quaking in their seats _ and perhaps wishing they had an invisibility cloak to hide beneath. This ""Potter"" earns its PG-13 rating _ a first for the previously PG series about the boy wizard _ as Harry grows into adolescence and learns more about his powers and his past. Of course young fans have already devoured the J.K. Rowling books that provide the basis for the films so they know whats coming. (The author is up to No. 6 out of seven planned.) But reading it on the page and seeing it on the screen can be two entirely different experiences and several scenes will be disturbing to viewers regardless of age. ""Goblet of Fire"" features the return of the dreaded Lord Voldemort _ He-Who-Must-Not-Be-Named _ the dark warlock who killed Harrys parents and tried to kill him too when he was just an infant. (Having survived the attack is what gives Harry a certain mystique among his professors and classmates at the Hogwarts School of Witchcraft and Wizardry; it also gave him his trademark lightning-bolt scar on his forehead.) As played by an unrecognizable Ralph Fiennes Voldemort appears hairless and noseless hissing and threatening in the moonlight _ a smooth almost effeminate incarnation of the Devil surrounded by cloaked minions. Even scarier though is the maze Harry must navigate as a competitor in the dangerous Triwizard Tournament. The giant hedges that serve as the maze walls arent just tall and the pathways arent just narrow _ theyre also predatory collapsing violently on their inhabitants sensing and feeding on their fears trying to swallow them whole. (Bet Stanley Kubrick wishes hed thought of that when he made ""The Shining."") While these are the most extreme examples of the movies intensity theyre also the ones that are the most emotionally powerful. Director Mike Newell has crafted a film full of images that are vast and wondrous but strangely detached and obviously artificial similar to the look of the ""Lord of the Rings"" movies. You can appreciate the enormity of the visuals but they seem so distant its difficult to feel engaged by them. But with Newell at the helm _ the first English director following American Chris Columbus who did the first two parts and Mexican Alfonso Cuaron who did the third and best thus far _ ""Goblet of Fire"" seems more in touch with the innate Britishness of Rowlings books both in its sense of humor and in its boarding-school setting. Newell (working from a script by Steve Kloves who has adapted all of Rowlings books and had his work cut out for him with the 734-page ""Goblet of Fire"") seems less interested in the whimsical magicality of Hogwarts halls _ thankfully since were all over the moving staircases and talking portraits by now _ and focuses more on Harry and his friends as they come of age. ""Goblet of Fire"" is more effective in these smaller more intimate moments than in the bloated bombast of its larger set pieces. One of Newells best-known and loved films is ""Four Weddings and a Funeral"" and he applies that same keen sense of romantic comedy timing here. Harry (Daniel Radcliffe more confident than ever) Hermione (Emma Watson more vibrant than ever) and Ron (Rupert Grint whos well still a little goofy) are beginning to figure out who they are and struggling to understand the opposite sex something theyre forced to do upon the unexpected arrival of students from two other schools. The sophisticated young women of the Beauxbatons Academy and the virile vaguely Eastern European young men from the Durmstrang Institute are visiting Hogwarts for the year to compete in the Triwizard Tournament. As headmaster Dumbledore (Michael Gambon) explains it this is an opportunity to foster relations in the wizarding community; its also the first time for us to see that there is indeed a world outside Hogwarts and England. The Goblet of Fire spits out the name of one student from each school to participate in this grueling challenge Hogwarts BMOC Cedric Diggory (Robert Pattinson); Beauxbatons glamour girl Fleur Delacour (Clemence Poesy); and Durmstrangs Quidditch star Viktor Krum (Staniskav Ianevski). Then it offers a fourth name _ you guessed it _ Harry Potter even though the rules state that hes too young to compete at age 14. Surely darker forces are behind his selection which hell have to confront in the films overlong climax. But first hell have to dance at the Yule Ball _ awkwardly of course since he and his classmates have received only cursory uncomfortable lessons from Maggie Smiths Professor McGonagall. (Brendan Gleeson a fantastic new addition to the cast as the schools bad-boy Defense Against the Dark Arts teacher just stands in the corner with his flask and his one fake eye which has a mind of its own.) The whole scene is like something out of a John Hughes movie _ funny relatable and loaded with misunderstandings with everyone in attendance wishing they were there with someone else or not at all. In its realism its one of the most magical moments of all. ""Harry Potter and the Goblet of Fire"" a Warner Bros. Pictures release is rated PG-13 for sequences of fantasy violence and frightening images. Running time 157 minutes. Two and a half stars out of four. Motion Picture Association of America rating definitions G _ General audiences. All ages admitted. PG _ Parental guidance suggested. Some material may not be suitable for children. PG-13 _ Special parental guidance strongly suggested for children under 13. Some material may be inappropriate for young children. R _ Restricted. Under 17 requires accompanying parent or adult guardian. NC-17 _ No one under 17 admitted. NewsNet Staff Writer ""NewsNet Staff Writer"" is an archive project developed by Robert Swingler. The archive contains over 52000 articles ranging from March 2009 to October 1994. Most articles contain the name of the original author. 0 0 0 0 0 Related News Marriage takes adjustment as joint schedules cha Stingers win 13-5 Mayor Rocky Visits UVSC Archives  Archives Select Month July 2016 June 2016 May 2016 April 2016 March 2016 February 2016 January 2016 December 2015 November 2015 October 2015 September 2015 August 2015 July 2015 June 2015 May 2015 April 2015 March 2015 February 2015 January 2015 December 2014 November 2014 October 2014 September 2014 August 2014 July 2014 June 2014 May 2014 April 2014 March 2014 February 2014 January 2014 December 2013 November 2013 October 2013 September 2013 August 2013 July 2013 June 2013 May 2013 April 2013 March 2013 February 2013 January 2013 December 2012 November 2012 October 2012 September 2012 August 2012 July 2012 June 2012 May 2012 April 2012 March 2012 February 2012 January 2012 December 2011 November 2011 October 2011 September 2011 August 2011 July 2011 June 2011 May 2011 April 2011 February 2011 January 2011 September 2010 June 2010 March 2009 February 2009 January 2009 December 2008 November 2008 October 2008 April 2008 March 2008 February 2008 January 2008 December 2007 October 2007 September 2007 August 2007 July 2007 June 2007 May 2007 April 2007 March 2007 February 2007 January 2007 December 2006 November 2006 October 2006 September 2006 August 2006 July 2006 June 2006 May 2006 April 2006 March 2006 February 2006 January 2006 December 2005 November 2005 October 2005 September 2005 August 2005 July 2005 June 2005 May 2005 April 2005 March 2005 February 2005 January 2005 December 2004 November 2004 October 2004 September 2004 August 2004 July 2004 June 2004 May 2004 April 2004 March 2004 February 2004 January 2004 December 2003 November 2003 October 2003 September 2003 August 2003 July 2003 June 2003 May 2003 April 2003 March 2003 February 2003 January 2003 December 2002 November 2002 October 2002 September 2002 August 2002 July 2002 June 2002 May 2002 April 2002 March 2002 February 2002 January 2002 December 2001 November 2001 October 2001 September 2001 August 2001 July 2001 June 2001 May 2001 April 2001 March 2001 February 2001 January 2001 December 2000 November 2000 October 2000 September 2000 August 2000 July 2000 June 2000 May 2000 April 2000 March 2000 February 2000 January 2000 December 1999 November 1999 October 1999 September 1999 August 1999 July 1999 June 1999 May 1999 April 1999 March 1999 February 1999 January 1999 December 1998 November 1998 October 1998 September 1998 August 1998 July 1998 June 1998 May 1998 April 1998 March 1998 February 1998 January 1998 December 1997 November 1997 October 1997 September 1997 August 1997 July 1997 June 1997 May 1997 April 1997 March 1997 February 1997 January 1997 December 1996 November 1996 October 1996 September 1996 August 1996 July 1996 June 1996 May 1996 April 1996 March 1996 February 1996 January 1996 October 1994 ABOUT US ADVERTISING BRIMHALL WEBCAM CONTACT US COPYRIGHT / PRIVACY SUBMIT NEWS TIPS UNIVERSE ARCHIVES (PDF) UNIVERSE JOBS Site Login (c) 2016 The Daily Universe - Brigham Young University",http://universe.byu.edu/2005/11/14/at-the-movies-harry-potter-and-the-goblet-of-fire/,200,harrypotterandthegobletoffire2,harrypotterandthegobletoffire,byu
