review,link,status_code,id,movie_key,critic
"washingtonpost.com Entertainment Guide Home | Register               Web Search <a href=""http//ad.doubleclick.net/jump/wpni.entertain/;kw=;sz=468x60;tile=1;ord=""></a> Main Page Movies Music Restaurants Nightlife Museums/Galleries Theater/Dance Love Life In Store Outdoors/Fitness "" Style "" Comics "" Crosswords "" Horoscopes "" Books "" Travel "" Weather "" Traffic "" TV Listings Head Over Heels Not a Pretty Picture By Rita Kempley Washington Post Staff Writer Friday February 2 2001 Tomiko Fraser Shalom Harlow Ivana Milicevic China Chow Sarah OHare and Monica Potter in ""Head Over Heels."" (Universal) Meeting cute takes on a whole new meaning in ""Head Over Heels"" a moronic romantic comedy that gets underway when the heros Great Dane topples the heroine Amanda (appealing Monica Potter) and thereupon demonstrates his mounting interest in her. ""Ive got the runs"" says the gaga Monica who meant to say ""Ive gotta run."" Oopsy. One look at Jim Wilson (fatuous Freddie Prinze Jr.) and shes weak in the knees and mangling her sentences. Though its love at first sight Amanda has been unlucky in love - she caught her previous beau in the act of cheating - and is reluctant to risk another affair. But since Jim lives in the high-rise next door the two - three if you count the dog and we really should - are thrown together again and again. Amanda who restores Renaissance paintings at the Metropolitan Museum of Art has just moved in with four fabulous supermodels (Shalom Harlow Sarah OHare Ivana Milicevic and Tomiko Fraser) whose palatial pad comes with a view of Jims apartment. Amanda is crushed when she glances out the window and thinks she sees Jim commit murder. Now she and her friends must find out the truth. It took four writers to come up with the story which was no doubt pitched as ""Rear Window"" with clothes hangers. With each rewrite it seems things grew fouler duller and more idiotic. The moviemakers go out of their way to parody the leggy ladies but the models stand tall no matter what these brutes throw at them . . . including sewage. (Theyre hiding out in a mens room when a toilet explodes hardy-har-har.) The models good sports to say the least spend a lot of time in toilets. In another instance theyre cowering behind Jims shower curtain gagging and holding their noses as the leading man ascends the throne and breaks the wind barrier. Amanda not privy to the aforementioned scene therefore remains subject to Jims charms. At present she is working on a Titian that is missing a face in the background. She fills the space with a portrait of Jim which the curator deems just perfect. Just when you think this movie couldnt get more ridiculous . . . ""Head Over Heels"" (a blessedly short 87 minutes) is rated PG-13 for bad language horny hounds and off-color humor. (c) Copyright 2001 The Washington Post Company <a href=""http//ad.doubleclick.net/jump/wpni.entertain/;kw=;sz=468x60;tile=2;ord=""></a> Search Entertainment Venues/events Movies Music Nightlife Exhibits Theater Around Town Restaurants Museums Theaters Galleries Bookstores Monuments Anywhere Washington NW Adams-Morgan Clev./Woodley Downtown Dupont Circle Foggy Bottom Georgetown Shaw NE SW SE Maryland A. Arundel Co. Bethesda Gaithersburg Howard Co. Montgomery P.G. Co. Silver Spring Rockville Virginia Alexandria Arlington Co. Ballston Fairfax Co. Falls Church Loudon Co. P. William Co. Reston Tysons Corner Optional Keyword powered by citysearch.comMore Search Options ""Head Over Heels""showtimes and details Freddie Prinze Jr. filmography Monica Potter filmography Home | Register               Web Search",http://www.washingtonpost.com/wp-srv/entertainment/movies/reviews/headoverheelskempley.htm,200,headoverheels6,headoverheels,washingtonpost
"USATODAY.com - Romance slapped silly Home News Money Sports Life Inside Movies Movies home Now playing Home theater Tech Weather Site Web Click here to get the Daily Briefing in your inbox 02/01/2001 - Updated 0701 PM ET Romance slapped silly By Mike Clark USA TODAY Head Over Heels out of four Stars Monica Potter Freddie Prinze Jr. Sarah OHare Shalom Harlow Ivana Milicevic Director Mark Waters Distributor Universal Rating PG-13 for sexual content crude humor and language With an epic number of knockdowns pratfalls and amorous knee swoons throughout its 87 minutes Head Over Heels is as good a title as any for this Monica Potter comedy. But it feels like a movie some other actress rejected -- you can almost see Sandra Bullock using the screenplay manuscript as a coffee coaster and not caring if she left a brown ring on the title page. The story actually operates on two comic levels and the subsidiary one involving four fashion-model roommates has its moments. Unfortunately the head that flips most of the time belongs to Potter who looks mighty uncomfortable in slapstick situations. Then again if you or I had been the co-star of Patch Adams we probably would have lost our sense of humor too. Potter plays an Iowa transplant who restores museum art in New York City where (as weve been told in so many other movies) there are no available men. She finally thinks she has found one in a fashion-exec neighbor (Freddie Prinze Jr.) whose Great Dane repeatedly attacks her as if hes interested in more than just kissing. But as Potter and her glitzy/ditzy roomies spy on him from their across-the-way apartment they become convinced theyve seen Prinze commit a murder. Whats then attempted according to the films press release is North by Northwest as if Preston Sturges had directed it. (In other words mixing edge-of-your-seat suspense with breathless knockabout farce.) Its an iffy proposition not remotely realized though probably no iffier than having four screenwriters on a movie in the first place (including Ed Decter and John Strauss of Theres Something About Mary). The story sprays in some strange directions and some dark comic stuff about one of the models having been sexually abused by an Australian ""Uncle Pete"" really does sound like the Mary guys. And speaking of spraying one dreadful bathroom scene offers proof that scatological screen humor wont be any less crude in 2001 than it was in 2000 -- though in truth Heels was bumped from last Augusts release schedule. At least the models avarice and teasing provide a chuckle or two as their dates line up panting at the door. Purely by default their contribution makes this a slightly better working-woman romance than The Wedding Planner. USATODAY.com partners USA WEEKEND Sports Weekly Education Space.com Home Travel News Money Sports Life Tech Weather Resources Mobile news Site map FAQ Contact us E-mail news Jobs with us Internships Terms of service Privacy policy/Your California Privacy Right Advertise Press Room Media Lounge Electronic print edition Reprints and Permissions Add USATODAY.com RSS feeds The Nations Homepage Copyright 2008 USA TODAY a division of Gannett Co. Inc.",http://www.usatoday.com/life/enter/movies/2001-02-02-head-over-heels-review.htm,200,headoverheels7,headoverheels,usatoday
"Air Head / Freddie Prinze Jr. charms but lightweight Heels is empty calories - SFGate Subscribe Sign In Home Contact SFGate Contact SFGate Customer Support Submissions amp; Tips Classifieds About SFGate About SFGate FAQ Register on SFGate SFGate Newsletters SFGate Staff Careers Site Index Hearst About The Chronicle About The Chronicle The Chronicle Staff Become a Subscriber Manage Your Subscription Customer Service Careers e-edition Back Copies Chronicle in Education Corrections Advertise with Us More on Advertising More on Advertising Place a Classified Ad About Our Ads Public Notices Local Business Directory Place an Obituary Gate List Store Privacy policy Privacy policy Ad Choices Chronicle Archives Terms of Use Newsletters Get news alerts SFGate Customer support Get VIP access with SF Chronicle Membership Get SFGate newsletters for the latest from the Bay Check out the Top 100 Bay Area restaurants News Bay Area amp; State Traffic Nation World Politics Crime Election Results Obituaries Tech Health Education Video News Blogs Fire in Big Sur area grows 15 percent contained Little shaker 2.7-magnitude earthquake rattles Bay Area 2 men held after 2 San Diego officers shot 1 fatally 4 Sierra plane crash victims were from Tuolumne County Sports 49ers Raiders Giants As Olympics Warriors Sports Blogs Sports Calendar MLB NBA College Preps Golf Outdoors Cal football position preview Linebacker How low can Giants go? Latest loss comes with a triple play Rich Hills blister problem As success muddle trade outlook One bad inning sinks As at Cleveland Business Technology Mortgage Rates Home Guides Public Notices Sponsored Content Office Space The Tech Chronicles Net Worth Plus Fossils amp; Photons Mind Your Business VisionSF Jobs Price Point 649000 in San Bruno ICYMI Can Chipotle be a burger king? Redstones potential Victorian duplex in SOMA open Sunday Three bedroom apartment in San Franciscos Financial District Entertainment The Daily Dish Movies Music amp; Nightlife Performance Art Blogs Videos Events Puzzles TV Horoscope Comics Crosswords amp; Puzzles Things To Do Jason Bourne is a shaky smeary mess The latest from Dear Abby ""Bad Moms"" mixes sentiment with raunch and ends up vulgar Phantom Boy is fast-paced but slight animated fun Food Restaurants Wine Top 100 Restaurants Chronicle Wine Competition Reservations Beer News Inside Scoop SF Healthy Eating Angele Chef shuffle at Napa French restaurant Napa blockbuster Ninebark is closing (temporarily) Check out the food (and menu) at Black Cat now open in the Lights go out at La Rondalla longtime Mission dining spot Living Home amp; Garden Style Parties Lust LGBT Mommy Files amp; Parenting Houzz Outdoors Blogs Sponsored Schools Camps amp; Activities Exploring night photography locations in the Bay Area Couple from different cultures find love is a common ground Heres the most popular video game from the year you were born More Crystal Basin campsites are available with start of Olympics Travel Destination BC Exotic Destinations Monterey-Carmel Weekend Getaways Wine Country Napa Reno-Tahoe Hawaii Caves offer older view of the Continent Traveling to Big Sur? What you need to know Suite Spot Ritz-Carlton Philadelphia Rick Steves Europe Drink in a city through cafe culture Real Estate New Homes Open Homes Luxury Rentals Mortgage Rates Commercial Place an ad Home Guides Home Sales On the Block Blog Hot Property Sebastopol Italianate estate enjoys ocean views How much space do you get for 1500 a month? Hillcrest Estate possibly owned by baseball Hall of Famer Joe Cars Dealers Click and Clack Car Blog My Ride Sell Your Car First Buick ragtop since the 91 Reatta A cherished Nash-Healey Roadster Past Phantom still turning heads Teslas Model S can be used as a boat in a pinch Jobs Job Events Advertise Salary Wizard Get To Work Consider the red flags when staying in a job you dislike Declutter your job search The job gap explanation How to impress an interviewer with non-verbal language Findamp;Save Chronicle Latest columns Michael Bauer Leah Garchik Bruce Jenkins Esther Mobley Ann Killion Thomas Lee Matier amp; Ross C.W Nevius Kathleen Pender Scott Ostler Special Report Forgotten Survivors of AIDS The ultimate NorCal brewery map Top 100 Restaurants Warriors show their style off the court MenuSections http//www.sfgate.com/movies/article/Air-Head-Freddie-Prinze-Jr-charms-but-2956725.php Air Head / Freddie Prinze Jr. charms but lightweight Heels is empty calories By Mick LaSalle Published 400 am Friday February 2 2001 Image 1of/1 CaptionClose Image 1 of 1 Monica Potter and Freddie Prinze Jr. fall for each other in the action comedy ""Head Over Heels."" Monica Potter and Freddie Prinze Jr. fall for each other in the action comedy ""Head Over Heels."" Air Head / Freddie Prinze Jr. charms but lightweight Heels is empty calories 1 / 1 Back to Gallery HEAD OVER HEELS Action comedy. Starring Monica Potter and Freddie Prinze Jr. Directed by Mark Waters. (PG- 13. 88 minutes. At Bay Area theaters.) Lets start with the good news In ""Head Over Heels"" Freddie Prinze Jr. grows up. Sure most of us werent losing sleep over whether Prinze would make the transition from pleasing juvenile to grown-up lead. But to see it happen ... to see an actor in his 20s plausibly play a man ... is such a rare occurrence these days that its gratifying. Prinze has charm. He has ease. Women like his looks and men dont find him irritating. Its a pleasure almost to watch him in ""Head Over Heels"" and a pleasure almost to watch Monica Potter play Amanda an insecure art restorer who goes for him in a big way. Its also a pleasure to hear the Go-Gos song ""Head Over Heels"" play over the theater sound system. But now were scraping the bottom of the pleasure barrel. ""Head Over Heels"" is light stuff the cinematic equivalent of the airy wax paper that separates cold cuts on a delicatessen scale. Its as close to nothing as anything could be while still being something. Poor Amanda just cant get lucky with men. She comes home and finds her boyfriend in bed with another woman. ""This is not what it looks like"" he says. So she moves out and moves into an apartment with four models -- ""the last four nonsmoking models in New York"" -- who are all very tall very thin and very self-involved. From its opening moments there is something off about ""Head Over Heels"" something tin-eared in its humor and disjointed in its structure. In the movies first moments we find out that Amandas sexy co-worker (China Chow) is a lesbian. Theres no reason for her to be a lesbian except that all movies are supposed to have one these days. She appears in two scenes and then disappears for about an hour. The models are played by real-life models Sarah OHare Shalom Harlow Ivana Milicevic and Tomiko Fraser and the picture seems in part to be a satire of the modeling world. Certainly the models are there and so are the modeling jokes. Yet the real concerns of the picture lie in another direction entirely. The most disconcerting thing about ""Head Over Heels"" is no fault of the filmmakers and yet its such an unavoidable part of the experience that it has to be noted. A running joke throughout the film involves Amandas getting repeatedly pounced on and knocked flat by a huge dog. With the tragedy of the Pacific Heights dog attack fresh in the minds of Bay Area audiences these moments dont produce a laugh but a collective shudder. Thats how Amanda meets Jim (Prinze) -- the dog he is walking gets loose and knocks her down. Its love at first sight. Its also love at second and third sight when Amanda realizes that she can see right into Jims apartment from her living-room window. Like everyone else in the history of motion pictures Jim doesnt own curtains and almost never pulls down the shades. The one time he does it looks from the shadows as if he is committing a murder. So Amanda is kind of iffy about whether she should keep their date. Director Mark Waters walked a fine line in his directorial debut the superb but largely ignored ""House of Yes."" He found the right balance between naturalism and surrealism comedy and drama seriousness and absurdity and he made a movie that will last (if anyone ever bothers to see it). In ""Head Over Heels"" the challenge was to make a thriller that was also a farce that was also a romantic comedy. Perhaps Preston Sturges could have managed it -- but only with a Preston Sturges script. In ""Head Over Heels"" Waters is working with nothing with air with an all- over-the-place screenplay by Ron Burch and David Kidd. Amanda is presented as a klutz banging into things and falling down. The model played by OHare is also a klutz banging into things and falling down. These screenwriters have only so many personality types to go around. This isnt to say ""Head Over Heels"" is without its moments; its just that moments are all it has. When a flustered Amanda says ""I got the runs"" when she means to say ""I gotta run"" thats funny. Or at least Potter makes it funny. Sort of. Advisory This film contains violence. Most Popular 1 Dear Abby I want to contact mistress from 45 years ago 2 Cops Son of billionaire former supermodel arrested after... 3 Ann Coulter Hammered by Conservatives for Smearing US War... 4 Iceland man says Donald Trumps son left white powder at... 5 Dear Abby I dont want anyone to know that Ive retired 6 Oakland-bound medical plane crashes -- 4 killed 7 Police Girl 14 slits teens throat in hope of first kill 8 Inmate charged in 2015 quadruple slaying in S.F. 9 Bikini-clad Swedish cop makes arrest while sunbathing 10 Woman at scene of minor crash killed when car hits her Find Showtimes Search Theaters amp; Showtimes -- County -- Alameda Contra Costa Lake Marin Napa San Francisco San Mateo Santa Clara Solano Sonoma Show Movies Now Playing | Recent Releases | Critics Favorites Rated G | PG | PG-13 | R Latest News Officials believe no survivors in Texas hot air balloon crash Little shake 2.7-magnitude earthquake rattles Bay Area Philippine president calls off truce after rebel attack Ann Coulter slammed for calling war heros dad angry Muslim 4 Sierra plane crash victims were from Tuolumne County Inmate charged in 2015 quadruple slaying in S.F. Police Vallejo woman run over by man who stole her car Man Trumps son left white powder at rental paid women Parilia Amusement Ball in San Francisco early days View Comments (c) 2016 Hearst Communications Inc. Logo Return to Top About Our Company Careers Advertising Ad Choices Terms amp; Conditions Privacy Policy Your California Privacy Rights Contact Customer Service Newsroom Contacts Connect Facebook Twitter Pinterest Google Instagram Subscribe SFChronicle.com App e-edition The Chronicle Archives Subscription Offers Member Services Hearst Newspapers (c) Copyright Hearst Communications Inc.",http://www.sfgate.com/cgi-bin/article.cgi?f=/c/a/2001/02/02/DD180389.DTL,200,headoverheels8,headoverheels,sfgate
Apache Tomcat/7.0.56 - Error report HTTP Status 403 - No file path found /movies/nd8776.htmtype Status reportmessage No file path found /movies/nd8776.htmdescription Access to the specified resource has been forbidden.Apache Tomcat/7.0.56,http://www.newsday.com/content/movies/nd8776.htm,403,headoverheels9,headoverheels,newsday
Head Over Heels Movie Review amp; Film Summary (2001) | Roger Ebert,http://www.rogerebert.com/reviews/head-over-heels-2001,200,headoverheels10,headoverheels,rogerebert
