review,link,status_code,id,movie_key,critic
Head Over Heels | Chicago Reader Switch to the mobile version of this page. Newsletters Follow us Twitter Facebook RSS Mobile Username View Profile Edit Profile Log Out Log in Create Account The Chicago Reader News amp; Politics Music Arts amp; Culture Film Food amp; Drink Classifieds Browse News amp; Politics News amp; Politics home page Steve Bogira | Criminal Justice John Greenfield | Transportation Deanna Isaacs | Culture Ben Joravsky | Politics Michael Miner | Media Browse Music Music home page Gossip Wolf In Rotation Record roundups Leor Galil | Music Criticism Peter Margasak | Music Criticism Soundboard Concerts this week Early Warnings Concerts on horizon Browse Film Film home page J.R. Jones | Movie Reviews Index of Long Reviews Film Archive Short Reviews Now Playing Todays Showtimes Browse Arts amp; Culture Arts amp; Culture home page Tony Adler | Theater Justin Hayford | Theater Aimee Levitt | Features Brianna Wellen | Comedy Arts amp; Culture event search Browse Food amp; Drink Food amp; Drink home page Mike Sula | Restaurant Reviews Key Ingredient A chef-to-chef challenge Cocktail Challenge Bar Guide Restaurant search Browse The Bleader The Bleader blog home page Browse Classifieds Classifieds home page Real Estate Rentals Announcements Services Jobs (Monster) Place ad ad Best of Chicago Summer Guide Savage Love Straight Dope Agenda Events Locations Issues Article Archives Fun amp; Free You searched for [X]Head Over Heels Start over Search for... Browse movie times Narrow Search Author Select an author Andrea Gronvall Michael Atkinson Pat Aufderheide Zbigniew Banas Barbara Scharres Angelica Jade Bastien Bill Stamets Bob Mehr Brian Thomas Peter Brunette Dave Canfield Cara Jepsen Carol Burbank Cheryl Ross Pat Chesnut Luca Cimarusti Patrick Dahl Tyler Daswick Dave Kehr Cliff Doerksen Dominick Suzanne-Mayer Don Druker Mick Dumke Marilyn Ferdinand Fred Camper Patrick Friel Chris Fujiwara Leor Galil Hank Sartin Justin Hayford Jack Helbig Henry Sheehan Tanner Howard Drew Hunt J. R. Jones J.R. Jones Jennifer Vanasco Jessica Hopper Jim Healy Jonathan Rosenbaum Joshua Katzman Josh Katzman Anthony Kaufman Kelly Kleiman Asher Klein Shelley Kraicer Shelly Kraicer Nathalie Lagerfeld Adam Langer Lawrence Bommer Lisa Alspector Eric Lutz Peter Margasak Mark Jenkins Martha Bayne Adrian Martin Tom McCormack Meredith Brody Sergio Mims Michael Miner Laura Molzahn Monica Kendrick Adam Morgan Noel Murray Noah Berlatsky Pat Graham Patrick McGavin Patrick Z. McGavin Gerald Peary Richard Pena Mark Peranson Peter Keough Leah Pickett Richard M. Porton Laura Power Quintin Miles Raymer Reece Pendleton Berenice Reynaud Ronnie Scheib Tal Rosenberg Joshua Rothkopf Joshua H. Rothkopf Martin Rubin Ryan Wenzel Ben Sachs Dan Sallitt Dmitry Samarov Ronnie Schieb David Schwartz David P. Schwartz Scott Pfeiffer Ian Simmons Alissa Simon Michael Glover Smith Patrick Somerville Laura Stempel Steve Erickson David Stewart Gwynedd Stuart Mike Sula Ted Shen Julia Thiel Ignatiy Vishnevetsky Kevin Warwick Jessica Weisberg Brianna Wellen Joel Wicklund Albert Williams Michael Wilmington Sam Worley Rating G PG PG-13 R NC-17 X NR Show only Staff Pick Staff Pick Critics Choice Critics Choice Recommended Recommended New New Agenda Agenda Free Free Slideshow Slideshow Video Video Watch on Amazon Watch on Amazon Watch on Netflix Watch on Netflix Watch on Hulu Watch on Hulu Watch on YouTube Watch on YouTube Member Picks Member Picks Other Searches Events Location Guide Member Search Movie Showtimes Movie Reviews Article Archives Issue Archives Slideshows Comments Videos Images Sorting by Name Release Date Film Search Tweet Tools Email Print Share Digg Newsvine del.icio.us Facebook Reddit Twitter Windy Citizen Add to Custom List Loading... Comments Head Over Heels Through a rear window in her Manhattan apartment art restorer Monica Potter spies on neighbor Freddie Prinze Jr. who literally makes her weak in the knees--pratfalls are a big part of this comedy. With the help of her roommates four fashion models Potter keeps an eye on Prinze hoping to learn everything shell need to know about him before an upcoming date. Shes worried about being two-timed or dumped again but this time it seems she may have fallen for a man whose crimes are punishable by law. Though more of the abundant sight gags and slips of the tongue originate in bathrooms and bedrooms than are actually set there the best jokes are on the models and the men who pursue them and Shalom Harlow Ivana Milicevic Sarah OHare and Tomiko Fraser--the real models who play Potters roommates--are very good sports. Mark Waters (The House of Yes) directed a screenplay by Ron Burch and David Kidd; with China Chow. 91 min. By Lisa Alspector Now Playing Sorry there are no upcoming showtimes for Head Over Heels Reviews/comments Subscribe to this thread By Email Subscribing... With RSS Comment Add a review Rating Roll over stars and click to rate. Subscribe to this thread Terms of UsePrivacy PolicySubmission GuidelinesAbout The ReaderStaffReader CareersContact UsFreelancing InfoAdvertisingBack IssuesReprints Copyright (c) 2016 Sun-Times Media LLC. Powered by Foundation,http://onfilm.chicagoreader.com/movies/capsules/20035_HEAD_OVER_HEELS,200,headoverheels0,headoverheels,chicagoreader
404 - Page Not Found The Globe and Mail Jump to main navigationJump to main content Home News Commentary Business Investing Sports Life Arts Technology Drive Video AdChoices Oops That page isnt here. We couldnt find the page you were looking for one of the following reasons It has moved it never existed or an agreement with an outside provider has expired. Can we help you findwhat youre looking for? Query Want to help? and let us know about the page error. Please include a link to the page that brought you here as well as any other relevant information. Thanks in advance for the heads-up Or try one of these links editorial cartoons celebrity photos popular videos connect with us Products The Globe and Mail Newspaper Newspaper delivered to your doorstep. Suscribe to the newspaper Globe Unlimited Digital all access pass across devices. Suscribe to Globe Unlimited Globe2Go The digital replica of our newspaper. Suscribe to Globe2Go Globe Email Newsletters Get top Globe stories sent to your inbox. Subscribe to email newsletters Globe eBooks A collection of articles by the Globe. View the library Advertise with us GlobeLink.ca Your number one partner for reaching Canadas Influential Achievers. Or go directly to Newspaper Magazine Digital Globe Alliance extend your reach Globe Edge custom content Classifieds The Globe at your Workplace Globe Corporate Sales Globe Unlimited digital edition and Globe2Go e-paper group discounts available. Learn more Corporate financial data and content licensing for your organization. Learn more Or go directly to Report On Business Top 1000 DataStore essential business intelligence Our Company About us Work at The Globe Staff Secure Service Secure Drop Customer Service Contact Us FAQs Customer Care website Digital subscription services Print subscription services Change your delivery address Vacation Stops Globe Recognition Special Globe events and offers for subscribers Mobile Apps News NEWS APP Available for download on the following devices iPhone iPad Android Blackberry Other Sections Appointments Art Store Births amp; Announcements Corrections Classifieds Classroom Edition Deaths Newspaper Ads Real Estate Special Reports Site Map Terms amp; Conditions Privacy Policy Disclaimer Accessibility Policy Community Guidelines Globe sustainability Editorial Code of Conduct Copyright 2016 The Globe and Mail Inc. All Rights Reserved. 444 Front St. W. Toronto ON Canada M5V 2S9 Phillip Crawley Publisher,http://www.globeandmail.com/servlet/ArticleNews/movie/MOVIEREVIEWS/20010202/RVHEAD,404,headoverheels1,headoverheels,globeandmail
"New York | Not Found | Village Voice NewsVLongformThe MTAMediaNYPDPoliticsMake It StopCultureLGBTTop Stories NewsletterMusicVAsk Andrew W.K.New YorkersMusic ListsBars amp; LoungesConcert CalendarMusic NewsletterFood amp; DrinkVNYC Restaurant GuideRestaurant Reviews100 Favorite Dishes99 Essential Restaurants in BKPizzaFood amp; Drink ListsFood amp; Drink NewsletterArts amp; CultureVVisual ArtsTheaterBooksComedyObiesThe Seen A NYC Style GuideTheater NewsletterCalendarVSubmit an EventConcert CalendarThings To Do NewsletterFilm amp; TVVNews amp; InterviewsFilm ReviewsShowtimesTrailersVillage Voice Film PollFilm PodcastFilm amp; TV NewsletterLongformVideosSlideshowsBest Of NYC(r)VArts amp; EntertainmentFood amp; DrinkShopping amp; ServicesSports amp; RecreationReaders ChoiceBest Of NewsletterPromotionsVPromotional EventsStreet TeamFree StuffPromotions NewsletterClassifiedsVMedical Studies Apps About Us Contact Us Staff Careers Advertise E-Edition Privacy Terms menu Remember Me SIGN IN > Forgot Password? Or sign in with a social account FACEBOOK GOOGLE + TWITTER YAHOO Dont have an account yet? Sign Up > Connect. Discover. Share. Get the most out of your experience with a personalized all-access pass to everything local on events music restaurants news and more. Enter your email or sign up with a social account to get started FACEBOOK TWITTER GOOGLE+ YAHOO Privacy Policy SIGN UP > Already registered? Login > Email Username Password Name Zipcode DONE MVN Sign In > Dont have an account yet? Sign Up > Facebook Twitter Follow villagevoice Other MORE That page could not be found. Whoops we cant seem to find what youre looking for. Based upon what we do know here are some search results that you might find useful.  Article The Queer Issue Beefcakes Golden Age 7 years ago by Steve Weinstein Scott Herman is hanging out at the Belvedere the campy turreted guesthouse in Cherry Grove that is so over-the-top its been called the Capitol of Gay America. The hunky breakout star of MTVs The Real World Brooklyn looks right at home lounging poolside with four other models. Theyre on Fire...  Article Jay-Z Fleeing Subpoenas and David Paterson Bows Out of Aqueduct Gambling Venture 6 years ago by Zach Baron It all seemed so glamorous back in the fall when Jay-Z signed on for a single-digits stake in the development conglomerate AEG just weeks before the company successfully pitched his buddy David Paterson and was awarded a billion dollar-plus contract to run slot machines out at the Aqueduct Racetrack. Then...  Music News Politics  Article Joe Sitt Weeps for Coney; Land Use Committee Considers Plan Tomorrow 7 years ago by Roy Edroso We are grateful to Brownstoner for tipping us to the Crains New York Business article on Coney Island developer Joe Sitt his habit of buying up city properties and flipping them for profits and his attempts to do the same with his Coney holdings though he tells Crains (with tears...  Article Lehman Brothers Still Spending Cash It Doesnt Have 8 years ago by Graham Rayman From the department of the kind of appalling the bankrupt Wall Street giant Lehman Brothers is still trying to lease office space Crains New York Business tells us. Apparently the remnants of the crippled firm need office space for the employees who are still trying to figure out remaining issues...  Article Cocktails That Drink Like a Meal; Restos and Food Shops Survey Irenes Damage 5 years ago by Chantal Martineau Weather-related disruptions to the food supply could ""ratchet up prices"" according to experts. [Bloomberg] Astronauts traveling to Mars will likely have to grow and cook their own food. Maintaining food supplies remains a main issue in planning Mars missions. [Discovery] Restaurants are offering hearty cocktails that drink like a meal...  Food News All 63 results or Back to home (c)2016 Village Voice LLC. All rights reserved. Newsletters All-access pass to the top stories events and offers around town. Top Stories Send Sign Up gt; Remind Me Later gt; No Thanks gt; Privacy Policy Newsletters All-access pass to top stories events and offers around town. Sign Up gt; No Thanks Remind Me Later gt;",http://www.villagevoice.com/issues/0106/crain.shtml,404,headoverheels2,headoverheels,villagevoice
0,http://asp.tvplex.go.com/ebertandthemovies/ebert.asp?mode=display&page=movie&id=3822&ref=index,0,headoverheels3,headoverheels,tvplex
"Head Over Heels | Variety Variety Editions U.S Latino Global Asia Subscribe Today Navigation Menu Film TV Digital Contenders Video Dirt Jobs More Biz Music Legit Scene Conferences Insight Archives Directory Choose Edition U.S Latino Global Asia Russia | My Account Sign In Subscribe HomeFilmReviews Review Head Over Heels Lael Loewenstein 0 Share This Article Email LinkedIn Pin It Tumblr February 1 2001 | 1100PM PT Romantic comedy madcap farce and suspense thriller collide in ""Head Over Heels"" a mildly amusing trifle set in Gothams high fashion world. Though the films strenuous play for laughs tends to overshadow its assets it does offer a pair of appealing leads in Monica Potter and Freddie Prinze Jr. Romantic comedy madcap farce and suspense thriller collide in ""Head Over Heels"" a mildly amusing trifle set in Gothams high fashion world. Though the films strenuous play for laughs tends to overshadow its assets it does offer a pair of appealing leads in Monica Potter and Freddie Prinze Jr. attractive eye candy in a quartet of models and a pleasant romantic diversion that should make it easy for Universal to recoup its relatively modest budget. Pic reps the sophomore effort of helmer Mark Waters whose ""House of Yes"" was a Sundance favorite in 1997. But those who appreciated the darkly funny sensibility of his tyro feature will be disappointed by the unabashedly commercial nature of Waters second ""Head Over Heels"" has all the edge and density of a Nerf ball. New pic reteams him with Prinze who in the interim has built a resume as a teen heartthrob in films including ""Shes All That"" and ""Down to You."" Often better than his material Prinze graduates here to an adult role playing Jim Winston the suave and charming fashion consultant who catches the eye of an improbably unlucky-in-love art restorer Amanda Pierce winningly played by Monica Potter. Having taken up residence with four out-of-work models and sworn off men after discovering her boyfriends cheating ways Amanda is duly shocked at her instant attraction to Jim a fellow so fetching that shes weak at the knees whenever they meet; their first encounter is a standard screwball riff in which she stammers and equivocates incessantly. Hes equally smitten with her though a good deal more articulate. So its mighty convenient that Jims apartment is in full view of the one occupied by Amanda and the models who begin to track his rituals document his social life and count his chin-ups. But when Amanda thinks shes seen Jim commit a murder she reports him to the police who find her claim groundless. Drawn to Jim but emotionally conflicted Amanda enlists her model chums to help investigate Jims apartment. That makes for a funny if mostly predictable scene in which Jim returns unexpectedly and the fashion divas hide in his shower after being alerted (from across the courtyard) to his presence. Hitchcock might not be amused at the unapologetic homage to ""Rear Window"" but contempo audiences most certainly will particularly by an off-color ""Dumb and Dumber""-like sequence that finds Jim defecating noisily while the hidden models cringe in horror. Theres even more Farrelly brothers-style scatological humor where that came from as in a superfluous gross-out bit that finds the glamorous gals hiding in a filthy restaurant bathroom stall after spying on Amanda and Jim. The final act resolves -- oh so neatly -- the questions of Jims identity Amandas feelings the alleged murder and the fate of the models careers. The statuesque quartet of Shalom Harlow Ivana Milicevic Sarah OHare and Tomiko Fraser -- supermodels all -- are great sports throughout particularly given that ""Head Over Heels"" paints them as bubbleheaded Amazons. Harlow who revealed a surprising comic sensibility in ""In and Out"" and developed her acting chops in ""Cherry"" is ready for bigger things. As the couple who fall -- yes -- head over heels for each other Potter and Prinze anchor the picture credibly and exchange banter effectively but their courtship suffers from an inordinate number of distracting and redundant pratfalls. Tech values are generally fine throughout though locations are minimal and coverage sometimes feels compromised. The wardrobe which fittingly evokes Seventh Avenue chic couldnt be more flatteringly displayed. Music by Randy Edelman and Steve Porcaro plays a key role in evoking the pics mood shifts; it helps guides the viewer along the precarious transitions from comedy to thriller and back. Head Over HeelsProductionA Universal Pictures release of a Robert Simonds production. Produced by Simonds. Executive producers Tracey Trench Julia Dray Ed Decter John J. Strauss. Co-producer Ira Shuman. Directed by Mark Waters. Screenplay Ron Burch David Kidd story by John J. Strauss Ed Decter Kidd Burch. CrewCamera (color) Mark Plummer; editor Cara Silverman; music Randy Edelman Steve Porcaro; music supervisors Gary Jones Happy Walters; production designer Perry Andelin Blake; art director Lance King; set designer Catherine Ircha; set decorator Dominique Fauquet-Lemaitre; costume supervisor Valerie Halverson; costume consultant Tracey Ross; sound (Dolby digital DTS/SDDS) Michael McGee; supervising sound editor Richard LeGrand Jr.; assistant director Morgan James Beggs; second unit director Ira Shuman; casting Joanna Colbert Amy Tasken Somers. Reviewed at the Avco Cinema L.A. Jan. 31 2001. MPAA Rating PG-13. Running time 86 MIN. With Amanda Pierce - Monica Potter Jim Winston - Freddie Prinze Jr. Jade - Shalom Harlow Roxana - Ivana Milicevic Candi - Sarah OHare Holly - Tomiko Fraser Lisa - China Chow Halloran/Strukov - Jay Brazeau Alfredo - Stanley DeSantis Filed Under HeelMark WatersTracey Trench Want to read more articles like this one? SUBSCRIBE TO VARIETY TODAY. Post A Comment 0 Variety Jobs Creative Development Coordinator Triptyk Studios New York New York Account/Project Coordinator (Ad Agency) Petrol Advertising Burbank California Media Specialist Bridgewater Associates Westport Connecticut Executive Director Aspen Film Company Confidential Aspen Colorado Associate Director YouTuber amp; Gamer Partnerships Save the Children Fairfield Connecticut See More Jobs Marketplace Leave a Reply No Comments Cancel reply Comments are moderated. They may be edited for clarity and reprinting in whole or in part in Variety publications. Enter your comment here... Fill in your details below or click an icon to log in Email (required) (Address never made public) Name (required) Website You are commenting using your WordPress.com account. ( Log Out / Change ) You are commenting using your Twitter account. ( Log Out / Change ) You are commenting using your Facebook account. ( Log Out / Change ) You are commenting using your Google+ account. ( Log Out / Change ) Cancel Connecting to %s Notify me of new comments via email. Notify me of new posts via email. More Film News from Variety The Power of Content Westworld Divorce amp; Insecure Get Premiere Date On HBO Lindsay Lohan Without Engagement Ring Egor Tarabasov Wedding... High Beam Shoes Launches Synching Sneakers That Help Find... Performer of the Week John Turturro All the best new iOS and Android apps you need to download Subscribe to Variety Today All The Ways to Get Variety Online Subscription Print Subscription Mobile Apps Newsletters News Alerts Archives Slanguage Dictionary Help Other Variety Products MediaVariety 411 Research amp; DataVariety Insight Archives Premium Email Alerts Real Estate Jobs Access the best entertainment industry data available View the Variety archives dating back to 1905 Get News Delivered To Your Inbox Privacy Policy Your Privacy Rights Terms of Use About Us Advertise Contact Us Google+ The Power of Content Deadline india.com Hollywoodlife hollywood TV Line BGR WWD Footwearnews (c) Copyright 2016 Variety Media LLC a subsidiary of Penske Business Media LLC. Variety and the Flying V logos are trademarks of Variety Media LLC. Powered by WordPress.com VIP Variety411 Your production services resource",http://www.variety.com/review/VE1117797212.html?categoryid=31&cs=1,200,headoverheels4,headoverheels,variety
"washingtonpost.com Entertainment Guide Home | Register               Web Search <a href=""http//ad.doubleclick.net/jump/wpni.entertain/;kw=;sz=468x60;tile=1;ord=""></a> Main Page Movies Music Restaurants Nightlife Museums/Galleries Theater/Dance Love Life In Store Outdoors/Fitness "" Style "" Comics "" Crosswords "" Horoscopes "" Books "" Travel "" Weather "" Traffic "" TV Listings Underwhelming Head Over Heels By Desson Howe Washington Post Staff Writer Friday February 2 2001 Tomiko Fraser Shalom Harlow Ivana Milicevic China Chow Sarah OHare and Monica Potter in ""Head Over Heels."" (Universal) Occasionally a humorous line or funny sight gag surfaces in ""Head Over Heels"" a romantic comedy starring Freddie Prinze Jr. and Monica Potter. The jokes usually have something to do with anorexia narcissism or obsessive-compulsive desire for cleanliness among the four models who figure as comic relief in the story. There are some other positive things to identify Prinze and Potter are likable and good-natured performers for instance. And heres my favorite part Its only 87 minutes long. But for the most part this movie is just another bland fair-to-middling vehicle for two emerging fledgling stars. Potter plays Amanda a single girl whos shy a little goofy and who just got betrayed by her boyfriend. She moves into an East Side apartment in New York City with four fabulous willowy models (Shalom Harlow Ivana Milicevic Sarah OHare and Tomiko Fraser) who seem to be umbilically connected to one another switching skimpy T-shirts avoiding food and dirty rooms listening to the slavering admiration of male admirers and exchanging airhead pitter-patter. Amanda falls in love with a handsome kinda cross-eyed fella named Jim Winston (Prinze) whos always walking a Great Dane that always knocks her over. The filmmakers find this idea so adorable poor Amanda gets knocked over a good three or four times during the movie. They also make Amanda collapse - literally go weak in the knees - whenever she sets eyes on Jim (usually after picking herself up from the dog attack). Another adorable touch. Amanda who enlists the help of her vacuous roommates becomes convinced that Jims a killer when she apparently witnesses Jim (in silhouette) killing a woman with a baseball bat. The rest of the movie is consumed with her half-believing hes a killer but being unable to resist his charm while those models pursue their own investigation. For cheap measure the movie throws in some pretty gross stuff involving the models crowded into the stall of a mens room two plumbers and a disgusting explosion. Im going to stop now in order to anticipate this conversation at Blockbuster Video in the not-too-distant future as two teenage renters come upon . . . ""Hey Head over Heels. Whats this?"" ""Thats the one with Freddie Prinze Jr."" ""Whos he?"" ""Remember? He was in I Know What You Did Last Summer and Shes All That and Boys and Girls. And remember People magazine voted him . . ."" ""Oh yeah one of the Most Beautiful Whatever. Yeah hes cute. Wait isnt he dating Sarah Michelle Gellar?"" ""That was like a year ago or something. No way would they be dating still."" ""And what about Monica Potter?"" ""Well she was in Patch Adams and she puts like castor oil on her eyelashes and eyebrows to make them thicker."" ""Gross."" ""And Freddie Prinze like plucks his eyebrows every day he says."" ""No way."" ""For sure. I read it on the Internet."" ""Okay lets get it. I want to see if thats really true about her eyebrows."" That would be as good a reason as any. ""Head Over Heels"" (PG-13 87 minutes) - Contains gross-out humor sexual scenes and nudity. (c) Copyright 2001 The Washington Post Company <a href=""http//ad.doubleclick.net/jump/wpni.entertain/;kw=;sz=468x60;tile=2;ord=""></a> Search Entertainment Venues/events Movies Music Nightlife Exhibits Theater Around Town Restaurants Museums Theaters Galleries Bookstores Monuments Anywhere Washington NW Adams-Morgan Clev./Woodley Downtown Dupont Circle Foggy Bottom Georgetown Shaw NE SW SE Maryland A. Arundel Co. Bethesda Gaithersburg Howard Co. Montgomery P.G. Co. Silver Spring Rockville Virginia Alexandria Arlington Co. Ballston Fairfax Co. Falls Church Loudon Co. P. William Co. Reston Tysons Corner Optional Keyword powered by citysearch.comMore Search Options ""Head Over Heels""showtimes and details Freddie Prinze Jr. filmography Monica Potter filmography Home | Register               Web Search",http://www.washingtonpost.com/wp-srv/entertainment/movies/reviews/headoverheelshowe.htm,200,headoverheels5,headoverheels,washingtonpost
