review,link,status_code,id,movie_key,critic
"Review I Spit on Your Grave - SFGate Subscribe Sign In Home Contact SFGate Contact SFGate Customer Support Submissions amp; Tips Classifieds About SFGate About SFGate FAQ Register on SFGate SFGate Newsletters SFGate Staff Careers Site Index Hearst About The Chronicle About The Chronicle The Chronicle Staff Become a Subscriber Manage Your Subscription Customer Service Careers e-edition Back Copies Chronicle in Education Corrections Advertise with Us More on Advertising More on Advertising Place a Classified Ad About Our Ads Public Notices Local Business Directory Place an Obituary Gate List Store Privacy policy Privacy policy Ad Choices Chronicle Archives Terms of Use Newsletters Get news alerts SFGate Customer support Get VIP access with SF Chronicle Membership Get SFGate newsletters for the latest from the Bay Check out the Top 100 Bay Area restaurants News Bay Area amp; State Traffic Nation World Politics Crime Election Results Obituaries Tech Health Education Video News Blogs Fire in Big Sur area grows 15 percent contained Little shaker 2.7-magnitude earthquake rattles Bay Area 2 men held after 2 San Diego officers shot 1 fatally 4 Sierra plane crash victims were from Tuolumne County Sports 49ers Raiders Giants As Olympics Warriors Sports Blogs Sports Calendar MLB NBA College Preps Golf Outdoors Raiders GM McKenzie gets 4-year extension Cal football position preview Linebacker How low can Giants go? Latest loss comes with a triple play Rich Hills blister problem As success muddle trade outlook Business Technology Mortgage Rates Home Guides Public Notices Sponsored Content Office Space The Tech Chronicles Net Worth Plus Fossils amp; Photons Mind Your Business VisionSF Jobs Price Point 649000 in San Bruno ICYMI Can Chipotle be a burger king? Redstones potential Victorian duplex in SOMA open Sunday Three bedroom apartment in San Franciscos Financial District Entertainment The Daily Dish Movies Music amp; Nightlife Performance Art Blogs Videos Events Puzzles TV Horoscope Comics Crosswords amp; Puzzles Things To Do Jason Bourne is a shaky smeary mess The latest from Dear Abby ""Bad Moms"" mixes sentiment with raunch and ends up vulgar Phantom Boy is fast-paced but slight animated fun Food Restaurants Wine Top 100 Restaurants Chronicle Wine Competition Reservations Beer News Inside Scoop SF Healthy Eating Angele Chef shuffle at Napa French restaurant Napa blockbuster Ninebark is closing (temporarily) Check out the food (and menu) at Black Cat now open in the Lights go out at La Rondalla longtime Mission dining spot Living Home amp; Garden Style Parties Lust LGBT Mommy Files amp; Parenting Houzz Outdoors Blogs Sponsored Schools Camps amp; Activities Exploring night photography locations in the Bay Area Couple from different cultures find love is a common ground Heres the most popular video game from the year you were born More Crystal Basin campsites are available with start of Olympics Travel Destination BC Exotic Destinations Monterey-Carmel Weekend Getaways Wine Country Napa Reno-Tahoe Hawaii Caves offer older view of the Continent Traveling to Big Sur? What you need to know Suite Spot Ritz-Carlton Philadelphia Rick Steves Europe Drink in a city through cafe culture Real Estate New Homes Open Homes Luxury Rentals Mortgage Rates Commercial Place an ad Home Guides Home Sales On the Block Blog Hot Property Sebastopol Italianate estate enjoys ocean views How much space do you get for 1500 a month? Hillcrest Estate possibly owned by baseball Hall of Famer Joe Cars Dealers Click and Clack Car Blog My Ride Sell Your Car First Buick ragtop since the 91 Reatta A cherished Nash-Healey Roadster Past Phantom still turning heads Teslas Model S can be used as a boat in a pinch Jobs Job Events Advertise Salary Wizard Get To Work Consider the red flags when staying in a job you dislike Declutter your job search The job gap explanation How to impress an interviewer with non-verbal language Findamp;Save Chronicle Latest columns Michael Bauer Leah Garchik Bruce Jenkins Esther Mobley Ann Killion Thomas Lee Matier amp; Ross C.W Nevius Kathleen Pender Scott Ostler Special Report Forgotten Survivors of AIDS The ultimate NorCal brewery map Top 100 Restaurants Warriors show their style off the court MenuSections http//www.sfgate.com/movies/article/Review-I-Spit-on-Your-Grave-3250717.php Review I Spit on Your Grave By Mick LaSalle Published 400 am Friday October 8 2010 Photo Steve Dietl (c) 2010 Family Of The Year Produc Image 1of/1 CaptionClose Image 1 of 1 I Spit On Your Grave 1 Sarah Butler Jeff Branson and Rodney Eastman star in Anchor Bay FilmsO I SPIT ON YOUR GRAVE I Spit On Your Grave 1 Sarah Butler Jeff Branson and Rodney Eastman star in Anchor Bay FilmsO I SPIT ON YOUR GRAVE Photo Steve Dietl (c) 2010 Family Of The Year Produc Review I Spit on Your Grave 1 / 1 Back to Gallery I Spit on Your Grave Horror thriller. Starring Sarah Butler Jeff Branson and Andrew Howard. Directed by Steven R. Monroe. (Not rated. 103 minutes. At Bay Area theaters.) As vile unredeeming and thoroughly unpleasant experiences go ""I Spit on Your Grave"" at least has one thing interesting about it. Its a document of the most paranoid fantasies that urban Northern people have about a rural Southern people. A young writer goes to a cabin in the woods to work on her second novel and shes not there a week when five guys start plotting against the ""city bitch"" who is ""stuck up"" and thinks she is ""too good"" for honest country folk. They barge in torture her and gang-rape her. The scenes of torment and rape go on for at least a half hour of screen time and its hard to see by what stretch of the term this constitutes entertainment. Yet I suspect that many urban Northern coastal people will see these despicable hulking rednecks tormenting a refined accomplished young woman and feel their buttons getting pressed. They will see it as a tableau depicting the relative moral worth of blue state and red state America. They will receive this as though witnessing an Obama voter surrounded by a bunch of clowns who look as if they could be Joe the Plumbers cousins. And thus they will have a rooting interest of sorts when she escapes half dead and comes back in the second half to torture and slaughter each of those five rednecks. But just hold on there one minute cowboy. ""I Spit on Your Grave"" doesnt have a single Southerner or Southwesterner in the cast. Everybody is either from the Northwest or Brooklyn or Jersey City or Canada and the director Steven R. Monroe is from New York. You know that commercial about picante sauce made in New York City? This is the movie equivalent. In 1978 the original ""I Spit on Your Grave"" had the woman renting a cabin in upstate New York. Here the location isnt clear but even if it were specified the accents and attitudes tell their own story - this is ""Deliverance"" country. All we need is the kid with the banjo. In addition to all the obvious things that are disgusting about this movie ""I Spit on Your Grave"" is trying to get us to hate each other. Hate it instead. It makes more sense and the hatred is much more deserved. -- Advisory Rape torture mutilation simulated sex nudity bad language and a general air of stupidity throughout. Most Popular 1 Dear Abby I want to contact mistress from 45 years ago 2 Cops Son of billionaire former supermodel arrested after... 3 Ann Coulter Hammered by Conservatives for Smearing US War... 4 Iceland man says Donald Trumps son left white powder at... 5 Dear Abby I dont want anyone to know that Ive retired 6 Oakland-bound medical plane crashes -- 4 killed 7 Police Girl 14 slits teens throat in hope of first kill 8 Inmate charged in 2015 quadruple slaying in S.F. 9 Bikini-clad Swedish cop makes arrest while sunbathing 10 San Francisco ranks surprisingly low on the list of 20 Most... Find Showtimes Search Theaters amp; Showtimes -- County -- Alameda Contra Costa Lake Marin Napa San Francisco San Mateo Santa Clara Solano Sonoma Show Movies Now Playing | Recent Releases | Critics Favorites Rated G | PG | PG-13 | R Latest News Coast Guard searching delta region for three missing people Officials believe no survivors in Texas hot air balloon crash Outrage caution from Latino stars in critical election year Little shake 2.7-magnitude earthquake rattles Bay Area Philippine president calls off truce after rebel attack Ann Coulter slammed for calling war heros dad angry Muslim Inmate charged in 2015 quadruple slaying in S.F. Man Trumps son left white powder at rental paid women Parilia Amusement Ball in San Francisco early days View Comments (c) 2016 Hearst Communications Inc. Logo Return to Top About Our Company Careers Advertising Ad Choices Terms amp; Conditions Privacy Policy Your California Privacy Rights Contact Customer Service Newsroom Contacts Connect Facebook Twitter Pinterest Google Instagram Subscribe SFChronicle.com App e-edition The Chronicle Archives Subscription Offers Member Services Hearst Newspapers (c) Copyright Hearst Communications Inc.",http://www.sfgate.com/cgi-bin/article.cgi?f=/c/a/2010/10/07/MV4E1FP5P6.DTL,200,ispitonyourgrave4,ispitonyourgrave,sfgate
"Movie review I Spit On Your Grave - latimes Advertisement YOU ARE HERE LAT Home-Collections-EntertainmentMovie review I Spit On Your GraveOctober 07 2010|By Michael OrdoA+-a The most shocking thing about ""I Spit on Your Grave"" is that someone thought the 1978 original deserved a remake. That was an artless poorly made leering phenomenally unintelligent chronicle of gang rape and intricate revenge. It set so low a bar that even this ill-conceived but slick venture can be called ""better."" Congratulations. But why take the return trip? Theres no suspense during the many long stalking sequences because we know whats going to happen when either beautiful soon-to-be-rape-victim or horrible soon-to-be-revenge-victims are being pursued. Thats the problem (one anyway) of making a film with nothing more than a premise. Thats it thats the whole movie. Oops spoiler alert. Heres another one The apparent motivation to revisit this exploitation ""classic"" was to drastically increase the violence. Certainly the rape and killings are more intricate graphic excruciating and nauseating. Hooray. At least the infuriating idiocy of the original sequences has been reduced. But dont worry this one is still mighty dumb. The original somehow generated debate over whether it was misogynist or feminist; clearly the pointless remakes only ""ist"" is ""sadistic."" Sure some folks get their jollies from seeing a woman extensively brutalized presumably justifying their voyeurism by then enjoying watching men suffer tortures that are to say the least unlikely. But for most there will be no adrenaline rush from fear or thrill or vicarious release from seeing tormentors tormented; one leaves feeling sad. Sad that this is what ""entertainment"" has come to. Come on filmmakers. Cant you do better? ""I Spit on Your Grave."" MPAA rating Unrated. Running time 1 hour 46 minutes. Playing at the Mann Chinese 6 Hollywood. MORESeizure Led to FloJos DeathHis 104 scores make his caseRestaurant review South Beverly GrillBrutal Murder by Teen-Age Girls Adds to Britons ShockComaneci Confirms Suicide Attempt Magazine SaysAdvertisement FROM THE ARCHIVESMovie review Rise of the Planet of the ApesAugust 5 2011Movie review Exporting RaymondApril 29 2011Movie Review  Legal Eagles Loses Its Entertainment CaseJune 18 1986MORE STORIES ABOUTEntertainmentCopyright 2016 Los Angeles TimesTerms of Service|Privacy Policy|Index by Date|Index by Keyword","http://www.latimes.com/entertainment/news/la-et-spit-grave-review-story,0,5127300.story",200,ispitonyourgrave5,ispitonyourgrave,latimes
"I Spit On Your Grave  Film Review I Spit On Your Grave  Movie Review  The A.V. Club Film TV Club Music Comedy Books Games Aux More I Spit On Your Grave Most Read A.V. Club Most Read 1 (Graphic Nick Wanserski) Posted Jul 30 The best books of 2016 so far The A.V. Clubs catch-up guide 2 Westworld (1973) Posted Jul 30 HBO sets a date for the robot cowboy uprising to begin 3 Photo Warner Bros. Posted Jul 30 Lights Out director David Sandberg defends the ending of his horror hit 4 (Screenshot YouTube) Posted Jul 29 Audition tapes reveal a bare-bones Game Of Thrones Film TV Club Music Comedy Books Games Aux Newswire Reviews Video Great Job Internet Film TV Club Music Comedy Books Games Aux Newswire Features Reviews Videos Great Job Internet The Latest From Newswire Guardians Of The Galaxy Marvel might only be making one Infinity War movie now Westworld (1973) HBO sets a date for the robot cowboy uprising to begin The Latest From Features (Graphic Nick Wanserski) The best books of 2016 so far The A.V. Clubs catch-up guide American jazz vocalist Michael Franks at SIR studios in NYC. (Photo Oliver Morris/Getty Images) Jazz-inflected yacht rock word lists and pop-culture nerdery The Latest From Reviews B- Photo Cinema Asia Releasing League Of Gods offers the deadly farts of a six-armed baby in dazzling 3-D B+ Mike Kinsella (Photo Shervin Lainez) On The King Of Whys Owens the best its ever been The Latest From Videos Chasing Jason Bourne and catching up with Woody Allen Comedian Damien Lemon likes his weed to have a heroic backstory The Latest From Great Job Internet (Screenshot YouTube) Watch David Cross wound himself with increasingly brutal hot wings Democratic nominee President Hillary Clinton waves to the crowd following her acceptance speech at the Democratic National Convention in Philadelphia on Thursday July 28 2016. (Photo Bill Clark/CQ Roll Call) Read This Hillary Clinton knows her Hamilton so chill All Recent Browse Our Features Coming Distractions Savage Love Facebook Twitter Tumblr Film Movie Review I Spit On Your Grave By Scott Tobias Oct 7 2010 242 PM D Share Tweet D I Spit On Your Grave Director Steven R. Monroe Runtime 107 minutes Rating Not Rated Cast Sarah Butler Jeff Branson Daniel Franzeze Community Grade (11 Users) A A- B+ B B- C+ C C- D+ D D- F Your Grade A A- B+ B B- C+ C C- D+ D D- F ? Our Community Grading Tool is in beta. Send Feedback. Share Tweet The impulse to remake any even moderately successful horror movie of the 70s and 80s hits rock bottom with I Spit On Your Grave which has the odd effect of cheapening one of the eras rankest most notorious pieces of exploitation trash. Shot with the plain day-lit marginally competent horror-realism of Last House On The Left the 1980 original is a rape-revenge story stripped down to its raw essence Woman travels alone to a backwoods cabin to do some writing; woman gets assaulted physically and sexually by five men (one mentally retarded) who leave her for dead; woman survives then gets her revenge by luring them into traps and killing them off one by one. (A hook from the trailer ""This woman will soon cut chop and burn five men beyond recognition and there isnt a jury in this country that would convict her."") Its not clever or multi-layered or stylized in an interesting way and it doesnt have a point other than to appeal artlessly to the audiences worst instincts. Not surprisingly the remake gussies up the grindhouse roughness of the first film which makes it relatively more palatable--yet still vapid and repulsive--while also in a perverse way selling it out. The first half more or less follows the outline Sarah Butler plays a big-city writer who heads to the boonies to work on her latest novel. She inadvertently insults a quartet of violent young rednecks who respond by invading her cabin and terrorizing and assaulting her in horrific fashion. The revenge part of the rape-revenge equation is where writer Stuart Morse and director Steven R. Monroe try to get creative by turning I Spit On Your Grave into Saw VIII losing much of the homemade crudeness that made the 1980 version so nauseatingly effective. In other words I Spit On Your Grave is now a grisly entertainment polished and full of rah-rah righteous kills calibrated to satisfy its bloodthirsty audience. That it succeeds speaks poorly of success. Share Tweet Filed Under Film More Movie Review Previous Movie Review Case 39 Next Movie Review Marwencol Dont miss a story--follow The A.V. Club on Cant see comments? Please enable JavaScript to view the <a href=""http//disqus.com/?ref_noscript""> comments powered by Disqus. </a> More Movie Review League Of Gods offers the deadly farts of a six-armed baby in dazzling 3-D Jul 30 2016 1022 AM Philip Roths Indignation becomes a character study worth examining Jul 28 2016 900 AM A former football pro documents his struggle with ALS in Gleason Jul 28 2016 1200 AM A woman fights to hold on to her career on Wall Street in Equity Jul 28 2016 1200 AM A.V. Club Most Read 1 (Graphic Nick Wanserski) Posted Jul 30 The best books of 2016 so far The A.V. Clubs catch-up guide 2 Westworld (1973) Posted Jul 30 HBO sets a date for the robot cowboy uprising to begin 3 Photo Warner Bros. Posted Jul 30 Lights Out director David Sandberg defends the ending of his horror hit 4 (Screenshot YouTube) Posted Jul 29 Audition tapes reveal a bare-bones Game Of Thrones Sign up for news Daily Newsletter Highlights from The A.V. Club Whats On Tonight A daily update on the world of TV Submit Links and such All Recent Browse Our Features Coming Distractions Savage Love Contests RSS About Us Contact Advertise Jobs Privacy Policy Our Partners Hitfix Mental Floss Oh My Rockness Uproxx Upworthy Vice (c) Copyright 2016 Onion Inc. All Rights Reserved.","http://www.avclub.com/articles/i-spit-on-your-grave,46100/",200,ispitonyourgrave6,ispitonyourgrave,avclub
I Spit on Your Grave Movie Review (2010) | Roger Ebert,http://www.rogerebert.com/reviews/i-spit-on-your-grave-2010,200,ispitonyourgrave7,ispitonyourgrave,rogerebert
I Spit on Your Grave | EW.com Skip to main content Sign In Log Out TV TV Recaps Movies Music Books Gaming Video Big Brother Queen of the South Mr. Robot Wayward Pines Suits Tyrant Shop Newsletter Subscribe Get 1 year for 25 Save 86% off the cover price SUBSCRIBE More Great Stuff Comic-Con Hulu Hot List 50Scoops EW Popfest For Your Consideration Jess Cagle Interview Stage Follow EW EW on Facebook EW on Twitter EW on Tumblr EW on Instagram About EW Contact UsCustomer ServiceAbout UsJobs at Time Inc.AdvertisePrivacy PolicyYour California Privacy RightsAd ChoicesNewslettersSubscribeTerms of ServiceSite Map Copyright 2015 Entertainment Weekly Inc. All rights reserved. Login Log out TV TV Recaps Movies Music Books Gaming Video More... TV This Weeks Cover The Walking... TV Exclusive Photos of The Walking... EW POPFEST Get the details 50Scoops50Days Exclusive... Movies Crazy Stupid Love Before Th... Movies The Most 2000s Fashion From Joh... Movies 27 Great Revenge Movies Movies Alice in Wonderland Witticism... Movies John Tucker Must Die Where Ar... Books 15 Captivating International Cri... Movies Planet of the Apes See the Fa... Movies Toronto Film Festival 2016 See... TV One Tree Hill Where Are They... Movies Little Miss Sunshine Where Ar... Books Harry Potter and the Cursed Chi... Movies Comic-Con 2016 See Portraits of... TV Friends See the Casts Evolut... TV Comic-Con 2016 Get Batty With... Movies The Dark Tower Storybook Steph... News Comic-Con 2016 Star Portraits... TV 10 of the Best Moments From The... Movies The Dark Tower Storybook Steph... Movies Thelma and Louise See Rare Behi... Movies 9 of Garry Marshalls Best Movies Movies Every Star Trek Movie Ranked Movies Big Trouble in Little China... Movies The Dark Tower Exclusive Firs... Movies Suicide Squad Before They Wer... Movies The 10 Best Movies of 2016 (So Far) TV Fear the Walking Dead introduc... Movies I Spit on Your Grave by Lisa Schwarzbaum Share Tweet Share on Google+ Share on Pinterest Share on Tumblr I Spit on Your Grave There are two insurmountable problems for an exploitation flick in which a woman is gang-raped and exacts revenge by creatively torturing and killing...I Spit on Your GravePT107MUnrated There are two insurmountable problems for an exploitation flick in which a woman is gang-raped and exacts revenge by creatively torturing and killing...2010-10-08Anchor Bay Entertainment Share Tweet Share on Google+ Share on Pinterest Share on Tumblr REVENGE IS A DISH BEST SERVED COLD Sarah Butler and Jeff Branson in the new version of I Spit on Your Grave (Anchor Bay Films) C- I Spit on Your Grave Release Date Wide 10/08/2010; Runtime (in minutes) 107; MPAA Rating Unrated; Distributor Anchor Bay Entertainment Posted October 8 2010 -- 1200 AM EDT There are two insurmountable problems for an exploitation flick in which a woman is gang-raped and exacts revenge by creatively torturing and killing each rapist. One This is a remake of Meir Zarchis infamous 1978 exercise I Spit on Your Grave made back when torture porn was readily identified as disgusting and worthy of outrage. Now its just one more movie in which genitals are sliced. Two Zarchi cannily exploited the eras interest in/fear of feminism (he preferred his title Day of the Woman). Now its just some thin chick in her underwear kicking butt. C- See all of this weeks reviews Share Tweet Share on Google+ Share on Pinterest Share on Tumblr Top Stories Stranger Things cast and fans scared with even Stranger prank HBO defends violent content as critics complain Nick Cannon says he was hit with Mariah Carey diss on Wild N Out True Detective not dead yet HBO insists Jimmy Fallon Snapchats Martha Stewarts cooking on The Tonight Show Game of Thrones HBO confirms season 8 will be last Margot Robbie says shes given 50 tattoos to her friends Photo Galleries 50Scoops50Days The Latest in Fall TV News The Biggest Moments From the 2016 Conventions Crazy Stupid Love Before They Were Stars The Most 2000s Fashion From John Tucker Must Die Exclusive Photos of The Walking Dead Season 7 27 Great Revenge Movies Alice in Wonderland Witticisms and Wisdom From the Disney Classic From Our Partners From Our Partners Contact UsCustomer ServiceAbout UsJobs at Time Inc.AdvertisePrivacy PolicyYour California Privacy RightsAd ChoicesNewslettersSubscribeTerms of ServiceSite Map Copyright (c) 2016 Entertainment Weekly Inc. All rights reserved. img[data-src] { display none important; },"http://www.ew.com/ew/article/0,,20432160,00.html",200,ispitonyourgrave8,ispitonyourgrave,ew
