review,link,status_code,id,movie_key,critic
I Spit On Your Grave (2011) directed by Steven R. Monroe | Film review Go to the content Go to the footer Time Out London London Popular cities London New York Paris Chicago Los Angeles Browse all cities Time Out London Close London Change city London Popular cities London New York Paris Chicago Los Angeles Browse all cities Tickets Offers Things to Do Restaurants Bars amp; Pubs Film Theatre Art Music Attractions Blog Theatre Tickets Shopping Offer of the Day Time Out Card Time Out Escapes Time Out Live Hotels Nightlife Music festivals Events amp; Festivals Kids Museums Clubs Comedy Food amp; Drink Classical Music amp; Opera Dance LGBT City Guide Area Guides Property Competitions Dating Close My Time Out Things I love My lists My Profile My Account Sign out Sign in Create account Sign in With your social account Or with your email Email Password Remember me Forgotten your password? Sign in You can create a Time Out account in two ways... With a few clicks using your favourite social network Or by entering your details below Email First Name Last Name Create password Repeat new password I accept Time Outs terms of use including opt-in to newsletters. Create account Welcome  You have successfully connected your account to Time Out. You may sign in with this account in future. Please confirm your account details Email First Name Last Name I accept Time Outs terms of use including opt-in to newsletters. Sign up My Account Sign in or Create account Search Tickets Offers Things to Do Restaurants Bars amp; Pubs Film Theatre Art Music Attractions Blog Theatre Tickets Shopping Offer of the Day Time Out Card Time Out Escapes Time Out Live Hotels Nightlife Music festivals Events amp; Festivals Kids Museums Clubs Comedy Food amp; Drink Classical Music amp; Opera Dance LGBT City Guide Area Guides Property Competitions Dating More Search I Spit On Your Grave Film  Horror 2 out of 5 stars 3 out of 5 stars (4 user reviews) 0 Love It Save it 4 Add review 0 Love It Save it Time Out says 2 out of 5 stars Details Users say (4) 3 out of 5 stars Time Out says 2 out of 5 stars By honing the jagged edges of Meir Zarchis cheap and nasty rape-revenge shocker into slick entertainment this unwelcome remake improves technically on the 1978 original while retaining all that was sleazy and repellent about his allegedly feminist movie. Jennifer a cock-teasing big-city writer rents a remote lakeside house where she is humiliated gang-raped and left for dead by the kind of slavering good ol boys familiar from Deliverance. A few weeks later the traumatised Jennifer emerges from the woods to take her revenge using fish hooks garden shears a flesh-peeling acid bath and a rifle barrel thrust where the sun dont shine. Monroes reworking introduces two new elements an ambiguously motivated local sheriff and the attackers use of a video camera to record their actions. Unfortunately for the filmmakers the BBFC felt that these voyeuristic video images invited the viewer to enjoy the eroticised sadistic sexual violence so less titillating footage has been substituted. Jennifers cruel calculated vengeance which ironically mirrors her own abuse is also excessive - but it has the spurious defence of being justified. By Nigel Floyd Posted Tuesday January 18 2011 Details Release details Rated 18 Release date Friday January 21 2011 Duration 0 mins Cast and crew Director Steven R. Monroe Screenwriter Meir Zarchi Stuart Morse Cast Sarah ButlerDaniel FranzeseChad Lindberg Users say (4) 3 out of 5 stars Average User Rating5 / 5Rating Breakdown5 star14 star03 star02 star01 star0LiveReviews|41 person listeningSign inWrite reviewMost helpfulMost helpfulHighest ratingLowest ratingNewestOldestLoadingundefinedNew CommentsRefreshJun 12 2011kellyFeaturedhas to be the worst film i have watched in quite a while the very brutal rape scenes dominate the film which i felt was not necessary and very disturbing and uncomfortable to watchFlagShareHelpful?Yes|NoReplyMay 29 2011AidanFeaturedRubbish - dont waste two hours of your time. Can only think that people watching this do so for reasons i would not like to mention. Happy ending though.FlagShareHelpful?Yes|NoReplyFeb 19 2011CharmaineFeaturedThis film i thought was brilliant. Even though the first hour is brutal rape you cannot take your eyes off for a second. One of the best films i have seen in a while.FlagShareHelpful?Yes|NoReplyFeb 19 2011CharmaineFeaturedThis film i thought was brilliant. Even though the first hour is brutal rape you cannot take your eyes off for a second. One of the best films i have seen in a while.FlagShareHelpful?Yes|NoReplyShow More Share Tweet 0 Shares Top About us Work for Time Out Privacy policy Cookie Policy Website terms of use Contact us Time Out for business Get listed Claim your listing Premium Profiles Advertising Time Out products Time Out Card Mobile apps Time Out Shop Time Out Guides Time Out Travel Time Out Offers Time Out Worldwide Time Out magazine Where to get Time Out magazine Subscribe to Time Out magazine Manage my subscription Follow us Facebook Twitter Youtube Instagram Pinterest Spotify Time Out London Site map },http://www.timeout.com/film/reviews/88970/i-spit-on-your-grave.html,200,ispitonyourgrave0,ispitonyourgrave,timeout
"I Spit on Your Grave A bad idea then a bad idea now - The Globe and Mail Jump to main navigationJump to main content News Search News by eluta.ca Search Jobs at eluta.ca Jobs Login Register 18 Toronto Subscribe Help AdChoices Home News Opinion Business Investing Sports Life Arts Tech Drive Real Estate Film TV amp; Media Books Music Theatre Visual Arts Awards Video Film Reviews Home>> Arts>> Film Sarah Butler in a scene from ""I Spit on Your Grave"" The biblical vigilantism unfolds as it must. (Steve Dietl) Sarah Butler in a scene from ""I Spit on Your Grave"" The biblical vigilantism unfolds as it must.(Steve Dietl) Movie review I Spit on Your Grave A bad idea then a bad idea now Add to ... Rick Groen The Globe and Mail Published Friday Oct. 15 2010 1200AM EDT Last updated Monday Sep. 10 2012 312PM EDT Comments AA Country USA Language English WHAT IS IT? More to the point what was it? Specifically this is a remake of a flick that many think shouldnt have been made in the first place. Back in 1978 Day of the Woman pushed the then-popular vigilante theme to graphic and exploitative extremes. Extremely graphic because as the theme ran its predictable course from victimhood to vengeance the sex-violence meter got cranked up to awfully brutal crude and explicit levels. Extremely exploitative because a lone woman assaulted and raped by a gang of men doubled as both the initial victim and the subsequent avenger. Multimedia I Spit on Your Grave Official trailer So its not hard to spot the tactics in the original. In its chauvinistic attack phase that movie salaciously stripped and humiliated an attractive female; then in the feminist counterattack segment it ostensibly empowered the same woman although only by having her embrace the very violence she endured. Yep as strategies go thats transparent stuff but it obviously worked on a disgusted Roger Ebert who in high dudgeon pronounced it the worst movie ever made. Despite that superlative the picture quickly disappeared later to be semi-resurrected by the usual small cult of admirers/apologists offering the usual arguments The explicitness is disgusting because rape is disgusting and (aint it ingenious) the audience is meant to feel complicit in the offence. And thus the film languished awaiting its inevitable rebirth in this post-Abu Ghraib era of torture porn. All hail the second coming. HOW DOES IT WORK? Exactly like the first with a few narrative details altered but with the logical holes in the plot as massively absurd as ever. Jennifer the city gal (Sarah Butler) ventures to a cabin in the woods where the red-neck country guys lie in wait four of them simply vicious and the other just simple-minded. Of course since even hicks pack a camera these days the assault is videotaped in this version an attempt to intensify our peeping-Tom complicity. From there the biblical vigilantism unfolds as it must. The woman will suffer and then inflict suffering in kind - voyeurs will have their eyes plucked out violators will be violated the sodomizers sodomized. And everyone will look and feel soiled not least of all us. DOES IT MATTER? Nope. Sure we in the media may try to make it matter as many will condemn righteously and a few will praise faintly and others will compare the levels of explicitness then and now in a vain wish to read the barometer of social change. But no all thats as silly and wasteful as the picture itself which is neither boring enough to qualify as pornography nor vital enough to generate a controversy. Damn I cant even subject I Spit on Your Grave to the great expectorations it so badly desires. I Spit on Your Grave Directed by Steven R. Monroe Written by Stuart Morse Starring Sarah Butler Classification 18A I Spit on Your Grave opens in Toronto on Friday Montreal on Oct. 22 and Ottawa on Oct. 29; Vancouver and Calgary dates to be determined. Report Typo/Error Follow us on Twitter GlobeArts More Related to this Story Nowhere Boy All the Lennons rolled into one Stone meets hard place and nothing much ensues Conviction Not a convincing case Comments AA In the know Life This woman became a middle-age man magnet. Heres how Life What to watch read cook and drink this weekend GLOBE DRIVE Three essential knots for attaching gear to your car Style The best party photos from the Power Ball Report on Pokemon Canadians love it a Pokemaster is crowned Werner Herzog is puzzled The Globe Recommends {{title}} .preloader{displaynone;} Most popular videos >> News Trump Clinton should have congratulated me for making history News Bad boy Justin beaver terrorizes B.C. town News I know a con when I see one Bloomberg calls on DNC to unite in opposition to Trump Life Make this juicy and delicious tomato salad tonight Report on Business What age is a good retirement age? Report on Business How do I stop living month to month? News He-said-she-said Contrasting Trump and Clintons convention speeches Report on Business Whats the case for Americans living in Canada to renounce their U.S. citizenship? Life Why beets are a great summer staple Sports Video Meet some of the athletes on the Refugee Olympic Team News No Donald you dont Watch the highlights from Hillary Clintons convention speech Report on Business Analyst If Air Canada delivers the results the stock will look after itself <    > Highlights Report on Business Ersatz products leave scent makers nose out of joint Report on Business B.C. credit union banks on a fun workplace More from The Globe and Mail Report on Business July 30 Dubious tax objective - letters to the ROB editor Life How to carb-load the smart way Most popular Meet the wealthy immigrants at the centre of Vancouvers housing debate How to stop Calgary from becoming the next Detroit Forget Brexit This could be Europes biggest crisis yet July 30 Your daily horoscope Liquor laws to undergo most significant changes since prohibition More Top Stories National At least 16 feared dead in fiery Texas hot air balloon crash Opinion Entrapment verdict Canadas anti-terror strategy found guilty Football Glenn throws two TD passes Alouettes crush Riders National Montreals Just for Laughs festival fundraising for comedians legal fees Startups How two brothers revived their familys Tennessee whiskey distillery Gen Y Money This millennial wants to get his MBA but can he afford it? Video Trump Clinton should have congratulated me for making history Eye-candy experience at NY ice cream museum See inside Teslas new giant factory Canadian GDP reliant on real estate Photos Pope Francis visits Auschwitz death camp in silence X connect with us Products The Globe and Mail Newspaper Newspaper delivered to your doorstep. Subscribe to the newspaper Globe Unlimited Digital all access pass across devices. Subscribe to Globe Unlimited Globe2Go The digital replica of our newspaper. Subscribe to Globe2Go Globe Email Newsletters Get top Globe stories sent to your inbox. Subscribe to email newsletters Globe eBooks A collection of articles by the Globe. View the library Advertise with us GlobeLink.ca Your number one partner for reaching Canadas Influential Achievers. Or go directly to Newspaper Magazine Digital Globe Alliance extend your reach Globe Edge custom content Classifieds The Globe at your Workplace Globe Corporate Sales Globe Unlimited digital edition and Globe2Go e-paper group discounts available. Learn more Corporate financial data and content licensing for your organization. Learn more Or go directly to Report On Business Top 1000 DataStore essential business intelligence Our Company About us Work at The Globe Staff Secure Services Secure Drop Staff PGP Directory Customer Service Contact Us Customer Preference Center FAQs Customer Care website Digital subscription services Print subscription services Change your delivery address Vacation Stops Globe Recognition Special Globe events and offers for subscribers Mobile Apps News NEWS APP Available for download on the following devices iPhone iPad Android Blackberry Other Sections Appointments Art Store Births amp; Announcements Corrections Classifieds Classroom Edition Deaths Newspaper Ads Real Estate Special Reports Site Map Terms amp; Conditions Privacy Policy Disclaimer Accessibility Policy Community Guidelines Globe sustainability Editorial Code of Conduct Globe Arts is part of The Globe and Mails Globe Life Network Copyright 2016 The Globe and Mail Inc. All Rights Reserved. 444 Front St. W. Toronto ON Canada M5V 2S9 Phillip Crawley Publisher Add to Watchlist Add to Watchlist Weve run into a glitch. Please try again later. Weve run into a glitch. Please try again later. x Customize your reading font XS S M L XL The quick brown fox jumps over the lazy dog The quick brown fox jumps over the lazy dog The quick brown fox jumps over the lazy dog The quick brown fox jumps over the lazy dog The quick brown fox jumps over the lazy dog",http://www.theglobeandmail.com/news/arts/movies/i-spit-on-your-grave-a-bad-idea-then-a-bad-idea-now/article1757401/,200,ispitonyourgrave1,ispitonyourgrave,theglobeandmail
A shallow Grave | Toronto Star SectionsSearch the print archivesSectionsEntertainmentMoviesA shallow GraveRemake of the 1978 revenge-horror grindhouse gorefest is just as troubling as its predecessor.I Spit on Your Grave opens Friday.  (HANDOUT)  By Jason AndersonSpecial to the StarThu. Oct. 14 2010 I Spit on Your Grave (out of 4) Starring Sarah Butler Chad Lindberg and Andrew Howard. Directed by Steven R. Monroe. 107 minutes. At major theatres. 18A Such is the markets appetite for remakes and updates of horror movies of the 70s and 80s that even one of the eras most notorious and repugnant shockers has been recycled by ever-enterprising producers. The matter of whether this particular property was better left in the crypt has already generated much debate among horror fans. Thats partially because any new version of I Spit on Your Grave inevitably inherits many of the same issues that have dogged the original since it first surfaced on the grindhouse circuit in 1978. A low-budget revenge thriller Zeir Marchis film was infamous for its depiction of sexual violence which was explicit even by the standards of exploitation cinema. Though some elements have been changed to better suit the tastes of todays Saw fanbase Steven R. Monroes version is just as likely to upset and infuriate. Again whats essentially on offer is an inordinately lengthy and graphic depiction of a womans brutalization and rape by a group of redneck thugs after she comes to a remote cabin for a writing retreat. In this case the victim is Jennifer (Sarah Butler) who first attracts the ire of the men when she stops at a local gas station and rebuffs a sexual advance. Seeing as her cellphone has been conveniently rendered unusable she is unable to get help when the men arrive at the cabin with the worst of intentions. Then again she wouldnt have received much assistance from the local sheriff (Andrew Howard) who turns out to be just as monstrous as her other attackers. The most significant difference here concerns the second half of the movie in which Jennifer gets her revenge. Whereas Marchis heroine lured her victimizers to their doom with the promise of consensual sex Monroe prefers to make his a more straightforward yet increasingly implausible figure. This time shes a coolly rational killer who shares the Jigsaw Killers ingenuity for creating diabolical contraptions. To his credit Monroe hasnt slicked up the material -- in fact his film may look even grubbier than the original which was hardly the case for new versions of Texas Chainsaw Massacre or Last House on the Left. Alas none of his modifications or decisions makes the still-abundant trove of sadistic and sexually violent imagery any easier to excuse or endure. Likewise the intended cathartic value of Jennifers acts of vengeance does not compensate for the sheer nastiness of whats come before. More troubling is how the movie wants viewers to regard the violence of the first part as upsetting and realistic before rewarding them with the requisite quota of gory kills. Some critics defended Marchis original on the basis that it stripped away the pretensions of Deliverance and Straw Dogs two more prestigious revenge flicks that were equally problematic when it came to matters of class and gender politics. An attempt to trade on its predecessors reputation without really grappling with the questions it raises Monroes version merely seems shallow cynical and extremely ugly. The Morning Headlines NewsletterDelivered daily to your inbox.Sign upMore from the Toronto Star amp; PartnersLOADING                                             LOADING                    21degCloseHomeLatest NewsVideoGTABlogsToronto to test mobile ticketing app for island ferryNew way to buy tickets online aimed at cutting down lineups for island ferry.NewsGTACity HallQueens ParkCanadaWorldInvestigationsCrimeBusinessEconomyPersonal FinanceReal EstateYour TorontoSchoolsThe FixerLifeFashion amp; StyleFood amp; WineHealth amp; WellnessHomesParentTechnologyTravelSportsAmateurBaseballBasketballBlue JaysCurlingFootballGolfHockeyLacrosseLeafsOlympicsRaptorsSoccerTennisOpinionCommentaryCorrectionsEditorialsEditorial CartoonPublic EditorReaders LettersEntertainmentBooksMoviesMusicStageTelevisionVisual ArtsDiversionsHoroscopesCrosswordsSudokuComicsWheels.caSpecial FeaturesObituariesClassifiedsTV ListingsHot TopicsDem. ConventionRio OlympicsPokemon GoBlue JaysGeneration 9/11Panama PapersFresh Air FundWeather BlogFollow usFacebookTwitterGoogle+InstagramRSSManage NewslettersSite MapAboutContact UsFeedbackthestar.comFeedbackSite MapNewslettersInsurance HotlineNew in HomesStar StoreCorrectionsBehavioural TargetingTodays NewsFlyersCanadaStaysContestsToronto Star Newspaper Ltd.AboutAtkinson PrinciplesStatement of PrinciplesGet Home DeliveryMy SubscriptionContact UsContact WebmasterFAQNews ReleasesStar InternshipsCareers  the StarStar AdvisersStar ePaperStar TouchAdvertise with UsAdvertising TermsMedia KitSpecial FeaturesInitiativesSanta Claus FundFresh Air FundSpeakers BureauClassroom ConnectionToronto Star ArchivesReport on Community Giving(c) Copyright Toronto Star Newspapers Ltd. 1996 - 2016Privacy PolicyTerms and Conditions,http://www.thestar.com/entertainment/movies/article/875577--a-shallow-grave,200,ispitonyourgrave2,ispitonyourgrave,thestar
"Page not found | New York Post Thanks for contacting us. Weve received your submission. Back to Reading News Metro Page Six Sports Business Opinion Entertainment Fashion Living Media Tech Real Estate Sub Menu 1 Photos Video Covers Columnists Horoscopes Sub Menu 2 Classifieds Subscribe Sign in In The News hillary clinton iran lamar odom 2016 presidential election new york mets Sections Search Tips Sign in New York Post Close Breaking News 16 feared dead in Texas hot air balloon crash Did You Get Lost? It seems we cant find what youre looking for. Perhaps searching can help. Most popular today 1 How Hillary blew her big moment 2 Malia Obama skipped the DNC for Lollapalooza 3 Ex-NFLer wife fatally shot by teen in their home 4 Bloombergs DNC speech blindsided Trump campaign 5 The Bachelorette is screwed no matter which man she picks More Stories pagesix Harry Brant busted for drugs and bailing on taxi fare Now On Decider This Woman Giving Birth In A Stream Has Been Watched Over 54 Million Times (NSFW) nypost Ex-NFLer wife fatally shot by teen in their home New York Post Twitter Facebook Instagram Email Newsletters Mobile Apps Contact Us Tips Twitter Facebook Instagram Sections amp; Features News Real Estate Page Six Tech Sports Media Metro Photos Entertainment Video Business Alexa Opinion Covers Fashion Horoscopes Living Classifieds Newsletters amp; Feeds Email Newsletters RSS Feeds NYPost Store Home Delivery Subscribe Manage Subscription Preferences Help/Support Customer Service App FAQ amp; Help Contact Us Tips Newsroom Letters to the Editor Reprints Careers Apps iPhone App iPad App Android Phone Android Tablet Advertise Media Kit Contact Post Digital Network (c) 2016 NYP Holdings Inc. All Rights Reserved | Terms of Use | Privacy | Your Ad Choices News Corp. is a network of leading companies in the world of diversified media news and information services. News Corp HarperCollins Marketwatch realtor.com Dow Jones The Sun Storyful Wall Street Journal The Times Mansion Global New York Post The Australian Checkout51 News America Marketing News.com.au Unruly Sign Up / Sign In Sign In // Sign Up With your existing account from... With your existing account { loginWidget } Use an account with your email address Or with a NYPost.com account { userInformationForm } { traditionalSignIn_emailAddress } { traditionalSignIn_password } { traditionalSignIn_signInButton }{ traditionalSignIn_createButton } { /userInformationForm } Sign Up / Sign In Sign In // Sign Up Welcome back { welcomeName } { loginWidget } Or use NYPost.com account Sign Up / Sign In Sign In // Sign Up Welcome back Welcome back { welcomeName } { userInformationForm } { traditionalSignIn_emailAddress } { traditionalSignIn_password } { traditionalSignIn_signInButton } { /userInformationForm } Use an account with your email address Or use another account Almost Done Please confirm the information below before signing in. Please confirm the information below. { socialRegistrationForm } { socialRegistration_emailAddress } { socialRegistration_displayName } { socialRegistration_ageVerification } By clicking ""Sign In"" you confirm that you accept our terms of service and have read and understand privacy policy. { backButton } { socialRegistration_signInButton } { /socialRegistrationForm } Almost Done { registrationForm } { traditionalRegistration_emailAddress } { traditionalRegistration_password } { traditionalRegistration_passwordConfirm } { traditionalRegistration_displayName } { traditionalRegistration_captcha } { traditionalRegistration_ageVerification } By clicking ""Create account"" you confirm that you accept our terms of service and have read and understand our privacy policy. { backButton } { createAccountButton } { /registrationForm } Create a new password ForgotPassword? Dont worry it happens. Well send you a link to create a new password. { forgotPasswordForm } { traditionalSignIn_emailAddress } { backButton } { forgotPassword_sendButton } { /forgotPasswordForm } Create a new password Sent Weve sent an email with instructions to create a new password. Your existing password has not been changed. Weve sent an email with instructions to create a new password. Close Account Already Exists { mergeAccounts } { backButton } Sign in to complete account merge { tradAuthenticateMergeForm } { traditionalSignIn_emailAddress } { mergePassword } { traditionalSignIn_signInButton } { /tradAuthenticateMergeForm }",http://www.nypost.com/p/entertainment/movies/grave_expectations_in_redneck_country_zOdjIyUNQfOdOLyttnhpOI,404,ispitonyourgrave3,ispitonyourgrave,nypost
