review,link,status_code,id,movie_key,critic
"Were sorry we cant find the page that youre looking for Go to the content Go to the footer Time Out New York New York Popular cities London New York Paris Chicago Los Angeles Browse all cities Time Out New York Close New York Change city New York Popular cities London New York Paris Chicago Los Angeles Browse all cities Tickets Events Things to Do Restaurants Bars Movies Theater Music Shopping Attractions Blog Art Travel Nightlife Events amp; Festivals Museums Kids Hotels Comedy Dance LGBT Sex amp; Dating Books City Guide Neighborhoods Promotions Close My Time Out Things I love My lists My Profile My Account Sign out Sign in Create account Sign in With your social account Or with your email Email Password Remember me Forgotten your password? Sign in You can create a Time Out account in two ways... With a few clicks using your favourite social network Or by entering your details below Email First Name Last Name Create password Repeat new password I accept Time Outs terms of use including opt-in to newsletters. Create account Welcome  You have successfully connected your account to Time Out. You may sign in with this account in future. Please confirm your account details Email First Name Last Name I accept Time Outs terms of use including opt-in to newsletters. Sign up My Account Sign in or Create account Search Tickets Events Things to Do Restaurants Bars Movies Theater Music Shopping Attractions Blog Art Travel Nightlife Events amp; Festivals Museums Kids Hotels Comedy Dance LGBT Sex amp; Dating Books City Guide Neighborhoods Promotions More Search Were sorry we cant find the page that youre looking for We have either moved the page or it no longer exists. To help you find your way here are some search results we think may be of interest. Movies Jackass The Movie In this comedic documentary Johnny Knoxville heads a crew of stuntmen skateboarders and all-around lunatics as they prank embarrass and torture each other in the name of fun. The antics range from childlike -- the boys don panda suits for a romp through... Read more Movies Jackass Number Two Call it distasteful crude the lowest form of culture-coarsening trash. Or in the thoughtful words of a critic sitting beside me at the screening ""Oh no no no no bad idea BAD IDEA thats no no no no please no stop no what a stupid thing youre doing... Read more Movies Kon-Tiki movie review Driven by crazy currents and the blue-eyed ferocity of its lead actor Pal Sverre Hagen this Norwegian retelling of Thor Heyerdahls 1947 Pacific-crossing adventure ought to come with a Jackass-style warning Dont try this at home kids even though... 4 out of 5 stars Read more Movies Kick-Ass For those of us who find somber superhero movies faintly ridiculous Kick-Ass is a one-film justice league. It might be the best recruiting tool the geek squad ever had puncturing fanboyish obsessions and reinvesting them with passion. Slyly the movie... 4 out of 5 stars Read more Movies Daltry Calhoun A bighearted Miramax curiosity brimming with Southern comfort and genteel humor this post-Weinstein dump of a release--about a Tennessee lawn specialist (Knoxville) experiencing horticultural and marital woes--surprisingly has charm to spare. Moreover... Read more Movies Daltry Calhoun HOW GREEN WAS MY VALLEY? Lawn specialist Knoxville rules with a green thumb. In grass-crazy Tennessee Daltry Calhoun (Knoxville) is king. His special seed recipe has made golf courses verdant nationwide and filled his once-empty pockets with unimagined... Read more Movies The falls 30 must-see films Devil (September 17)Several big-city business types are stuck in an elevator with Satan. This clever B-flick concept comes ""from the mind of M. Night Shyamalan"" (the onscreen producers credit thats been getting boos wherever the trailer plays). It still... Read more Top About us Work for Time Out Privacy policy Website terms of use Contact us Get listed Advertising Time Out products Mobile apps Time Out Shop Time Out Guides Time Out Travel Time Out Worldwide Time Out magazine Follow us Facebook Twitter Youtube Instagram Pinterest Spotify Foursquare Time Out New York Site map",http://www.timeout.com/film/reviews/77062/jackass_the_movie.html,404,jackassthemovie0,jackassthemovie,timeout
"Page not found | www.accessatlanta.com Our ProductsAJC JobsContact UsNewsSportsNeighborhoodLifeThings to DoMoreBlogsAJC ClassifiedsGa LotteryHoroscopesTrafficDoctors amp; Sex Abuse All News 2016 Election Atlanta News Nation amp; World Business Technology Politics Crime Education Offbeat News News Video Atlanta Weather News BlogsAJC InvestigationsPolitical InsiderGet SchooledAll News BlogsIn the NewsAtlanta Watering RestrictionsTraffic Construction AlertGa. Public School RatingsAtlanta Gas Prices All Sports Atlanta Braves Atlanta Falcons Hawks High Schools Georgia Tech Georgia State Kennesaw State UGA / DawgNation SEC / SECCountry Sports Video Sports BlogsRecruiting BlogAtlanta FalconsAtlanta HawksAll Sports BlogsIn the NewsSports ScoresGolfNASCARAJC Peachtree Road Race All Neighborhood Newcomer Guide Buckhead Buford Decatur Gwinnett County Intown Atlanta Marietta Roswell Sandy Springs Smyrna Peachtree City County NewsClayton CountyCobb CountyDeKalb CountyGwinnett CountyIn the NewsAtlanta Summer CampsLiving NorthsideLiving IntownEvents Near Me All Life Celebrities Home amp; Garden Weddings amp;... Health Travel Parenting Music Home Design Ideas Food amp; Drink Movies amp; TV Arts amp; Culture Life BlogsBest of AtlantaAtlanta RestaurantsAtlanta ShoppingAll Entertainment BlogsIn the NewsBest of AtlantaGamesAJC Peachtree Road Race All Things to Do Events in Atlanta Best of Atlanta Summer Camps Movie Showtimes Radio amp; TV Arts amp; Culture Music Food amp; Drink Shopping Latest Video Games BlogsAtlanta RestaurantsMusic SceneArts amp; CultureAll Entertainment BlogsIn the NewsUpcoming MoviesLiving Intown BeltLineHoroscopes All More Newsletters AJC Customer Care Contact the AJC Games AJC Cars AJC Jobs Shop Obituaries Homefinder Kudzu Todays BuzzBuzz BlogRadio amp; TV TalkNews to MeInside AJCMovie TheatersAtlantas Top WorkplacesFind a Garage Sale All Blogs The Biz Beat Georgia Tech High School Jeff Schultz Mark Bradley Political Insider Radio amp; TV Talk The Buzz Get Schooled Take a BreakPlay a GameHoroscopesWeekend CalendarEvents near youIn the newsHow Atlanta Loses WeightKudzuGa Lottery All AJC Classifieds AJC Pets AJC Cars Homes for Sale AJC Jobs All Ga Lottery All Horoscopes All Traffic All Doctors amp; Sex Abuse State-by-State For Patients Explore the Project About the Project Doctors Investigation ArticlesBroken SystemWhich Doctors AbuseHow Many Cases?One Repeat OffenderVulnerable PatientsDoctors ExcusesUndercover Agent Nabs DocPediatrician AccusedSubscribe nowAs low as 99C/SubscribeLog InYour AccountNewslettersLog Out COMMENTS0 SHORTCUTS Homefinder Atlanta Jobs Find Your Car Classifieds Obituaries Family-placed Notices Contact Us/Subscribe Customer Care Advertise With Us Digital Products Shortcuts Homefinder Atlanta Jobs Find Your Car Full Site IndexVisitor AgreementPrivacy PolicyContact UsFollow usTopCLOSESECTIONSnewssportslifeneighborhoodsshopthings to doSHORTCUTSajc obituariesfamily-placed noticesclassifiedshomefinderatlanta jobsfind your carmanage your profilecontact uscustomer careadvertise with usdigital productsPARTNERSfind amp; save couponskudzusavings.comvalpakmyajcFUNgame centerMEMBER CENTERsign inmanage your profileUTILITIESarchivesweathertrafficsitemapLEARN ABOUT AJC.COMtake a tourFOLLOW USfacebooktwitterinstagramyoutubepinterestPRODUCTS SUBSCRIBEFOLLOW US (c) 2016 Cox Media Group. By using this website you accept the terms of our Visitor Agreement and Privacy Policy and understand your options regarding Ad Choices. Learn about careers at Cox Media Group. <a href=""http//www.omniture.com"" title=""Web Analytics""></a><a href=""http//www.qualtrics.com/enterprise-feedback-management"">Enterprise Feedback Management</a><a href=""http//www.qualtrics.com/survey-software"">Survey Software</a>x Deadly hot air balloon crash in Texas What we know now Mystery mower carves Trumps name into Texas lawn Walmart store in Oklahoma keeping cops busy Former college football star wife killed by son police say Small Loans Make Up Greatest Share Of Student Debt Staycations 101 The page could not be foundWere sorry the page you requested could not be found. It is possible that the address is incorrect or that the page no longer exists.To look further you can enter a search term in the box belowSearch More from ajc.com Topics AllNewsSportsNeighborhoodLifeThings to DoMoreBlogsAJC ClassifiedsGa LotteryHoroscopesTrafficDoctors amp; Sex AbuseNation Deadly hot air balloon crash in Texas What we know now Politics Mystery mower carves Trumps name into Texas lawn Crime Walmart store in Oklahoma keeping cops busy Nation Former college football star wife killed by son police say Business Small Loans Make Up Greatest Share Of Student Debt Business Staycations 101 Sign InORSign in using your accessAtlanta profileNeed a Profile? Register Now. { userInformationForm } EMAIL { traditionalSignIn_emailAddress } PASSWORDForgot your password? { traditionalSignIn_password } { traditionalSignIn_signInButton } { /userInformationForm } Sign in using your existing account { loginWidget } Sign InORSign in using your accessAtlanta profileNeed a Profile? Register Now. { userInformationForm } EMAIL { traditionalSignIn_emailAddress } PASSWORDForgot your password? { traditionalSignIn_password } { traditionalSignIn_signInButton } { /userInformationForm } Sign in using your existing account { loginWidget } Sign InORSign in using your accessAtlanta profileNeed a Profile? Register Now. { userInformationForm } EMAIL { traditionalSignIn_emailAddress } PASSWORDForgot your password? { traditionalSignIn_password } { traditionalSignIn_signInButton } { /userInformationForm } Sign in using your existing account { loginWidget } Youre Almost DonePlease confirm the information below before signing in.Required { socialRegistrationForm } { socialRegistration_displayName } { socialRegistration_emailAddress } By submitting your registration information you agree to our Visitor Agreement and Privacy Policy. { socialRegistration_signInButton } { /socialRegistrationForm } RegisterRequired { registrationForm } { traditionalRegistration_emailAddress } { traditionalRegistration_password } { traditionalRegistration_passwordConfirm } { traditionalRegistration_displayName } By submitting your registration information you agree to our Visitor Agreement and Privacy Policy. { createAccountButton } { /registrationForm } Create a New AccountRequired { registrationFormBlank } { traditionalRegistration_emailAddressBlank } { traditionalRegistration_passwordBlank } { traditionalRegistration_passwordConfirmBlank } { traditionalRegistration_displayName } By submitting your registration information you agree to our Visitor Agreement and Privacy Policy. { createAccountButton } { /registrationForm } Just One More Thing...We have sent you a verification email. Please check your email and click on the link to activate your profile.If you do not receive the verification message within a few minutes of signing up please check your Spam or Junk folder.CloseThank you for registeringWe look forward to seeing you on [website] frequently. Visit us and sign in to update your profile receive the latest news and keep up to date with mobile alerts. Click here to return to the page you were visiting. Create a new passwordDont worry it happens. Well send you a link to create a new password. { forgotPasswordForm } { forgotPassword_emailAddress } { forgotPassword_sendButton } { /forgotPasswordForm } Email sentWe have sent you an email with a link to change your password.Close { mergeAccounts } Sign in to complete account merge { tradAuthenticateMergeForm } { traditionalSignIn_emailAddress } { mergePassword } { backButton } { traditionalSignIn_signInButton } { /tradAuthenticateMergeForm } Resend Email VerificationClick submit to receive another verification email { resendVerificationForm } { traditionalSignIn_emailAddress } { /resendVerificationForm } Your Verification Email Has Been SentCheck your email for a verification linkClose",http://www.accessatlanta.com/movies/content/shared/movies/reviews/J/jackassthemovie.html,404,jackassthemovie1,jackassthemovie,accessatlanta
410 Gone Gone The requested resource/film/film_results.php is no longer available on this server and there is no forwarding address. Please remove all references to this resource.,http://www.laweekly.com/film/film_results.php?showid=2179,410,jackassthemovie2,jackassthemovie,laweekly
"Jackass The Movie | Variety Variety Editions U.S Latino Global Asia Subscribe Today Navigation Menu Film TV Digital Contenders Video Dirt Jobs More Biz Music Legit Scene Conferences Insight Archives Directory Choose Edition U.S Latino Global Asia Russia | My Account Sign In Subscribe HomeFilmReviews Review Jackass The Movie Joe Leydon Film Critic joeleydon 0 Share This Article Email LinkedIn Pin It Tumblr October 25 2002 | 0435PM PT If you can see only one film this year about guys who barf on camera attach electrodes to their private parts relieve themselves in public places and demolish a putt-putt course -- and very nearly each other --while riding golf carts then it might as well be ""jackass the movie."" If you can see only one film this year about guys who barf on camera attach electrodes to their private parts relieve themselves in public places and demolish a putt-putt course -- and very nearly each other -while riding golf carts then it might as well be ""jackass the movie"" an aggressively and egregiously gross spin-off from the notorious MTV series that famously outraged Sen. Joseph Leiberman (among others) and delighted a thrill-crazed cult aud. Quite possibly the most exuberantly distasteful hodgepodge of beery anarchy and death-wishing irresponsibility ever unleashed by a major Hollywood distrib pic likely wont remain in megaplexes long enough to generate organized protests. But its guaranteed to have a long vid shelf life in frat houses and slacker domiciles everywhere. Cobbled together with breathtakingly brazen haphazardness -- the filmmakers dont even bother to provide capital letters or a colon for the title -- pic is little more than a feature-length version of the TV series showcasing semi-celebrity Johnny Knoxville and his party-hearty associates (Bam Margera Chris Pontius Steve-O Dave England Ryan Dunn Jason ""Wee Man"" Acuna Preston Lacy Ehren McGhehey) in various modes of exhibitionism and judging from the amount of alcohol freely consumed possibly variegated levels of inebriation. Its plotless shapeless -- and yet it must be admitted not entirely humorless. Indeed the more outrageous bits achieve a shock-you-into-laughter intensity of almost Dadaist proportions. As Steve Martin has sagely noted comedy is not pretty.Except for intro and epilogue most of ""jackass"" is filmed in muddy messy digital video. The overall grunginess of tech values is altogether appropriate for a pic in which one plucky fellow consumes a snow cone soaked with his own urine -- and then of course throws up -- and another guy blithely defecates in a toilet on display in a home supply store. Bits range in length from a few seconds to several minutes and in dementia from sadomasochism to arrested development. Many gags are nasty tricks on relatively innocent bystanders but to their credit the ""jackass"" boys are crueler to themselves than they are to any outsider. They pole-vault into walls give themselves paper cuts drive rental cars in demolition derbies skateboard down banisters use their heads as bowling balls attempt to roller-disco while tossed about the back of a speeding truck -- and periodically visit hospital emergency rooms. Occasionally the ""jackass"" crew springs ""Candid Camera""-like stunts with hidden camcorders. A few too many of these involve Steve-O prancing about in a silver-lame jockstrap while identifying himself as ""Party Boy"" to unsettling passersby. (Hidden-camera bits shot in Japan indicate that Japanese passersby are less susceptible to unsettlement than their American counterparts.) But theres something undeniably (albeit perversely) hilarious about an extended sequence in which a ""jackass"" stalwart lubricates a small toy car shoves it up his own anus-and is then x-rayed by a doctor whos not in on the gag.Certain analytical critics doubtless will discern a homoerotic subtext in the many many stunts that revolves around the use and abuse of male rectums and genitalia. Those same analysts may also detect a strain of misogyny in a segment titled ""Ass Kicked by Girl."" Sure enough Ryan Dunn steps into the ring with a female Japanese martial artist looks at the camera and grimly predicts ""Im about to get the shit kicked out of me by a girl."" Which of course he does. Much like the TV show ""jackass the movie"" comes with a disclaimer Dont try this at home kids. Jackass The MovieProductionA Paramount release presented with MTV Films of a Dickhouse production in association with Lynch Siderow Prods. Produced by Jeff Tremaine Spike Jonze Johnny Knoxville. Executive producers Trip Taylor John Miller David Gale. Co-executive producers Michelle Klepper Jessica Swirnoff. Co-producers Sean Cliver Dimitry Elyashkevich. Directed by Jeff Tremaine. CrewCamera (Deluxe color) Dimitry Elyashkevich; editors Liz Ewart Mark Hansen Kristine Young; costume designer Melissa Lacombe; music supervisor Karen Glauber; sound (Dolby Digital) Cordell Mansfield. Reviewed at Cinemark Westchase Tinseltown Cinema Houston Oct. 24 2002. MPAA Rating R. Running time 84 MIN. With Johnny Knoxville Bam Margera Chris Pontius Steve-O Dave England Ryan Dunn Jason ""Wee Man"" Acuna Preston Lacy Ehren McGhehey. Want to read more articles like this one? SUBSCRIBE TO VARIETY TODAY. Post A Comment 0 Variety Jobs Creative Development Coordinator Triptyk Studios New York New York Account/Project Coordinator (Ad Agency) Petrol Advertising Burbank California Media Specialist Bridgewater Associates Westport Connecticut Executive Director Aspen Film Company Confidential Aspen Colorado Associate Director YouTuber amp; Gamer Partnerships Save the Children Fairfield Connecticut See More Jobs Marketplace Leave a Reply No Comments Cancel reply Comments are moderated. They may be edited for clarity and reprinting in whole or in part in Variety publications. Enter your comment here... Fill in your details below or click an icon to log in Email (required) (Address never made public) Name (required) Website You are commenting using your WordPress.com account. ( Log Out / Change ) You are commenting using your Twitter account. ( Log Out / Change ) You are commenting using your Facebook account. ( Log Out / Change ) You are commenting using your Google+ account. ( Log Out / Change ) Cancel Connecting to %s Notify me of new comments via email. Notify me of new posts via email. More Film News from Variety The Power of Content HBO Boss Talks True Detective Season 3 Deadwood Movie... Texas Hot Air Balloon Horror 16 People Die After Fiery Crash High Beam Shoes Launches Synching Sneakers That Help Find... HBO Boss on Game of Thrones End Date and Possible Spinoff... Video reveals what Apples iPhone 7 headphones may look like Subscribe to Variety Today All The Ways to Get Variety Online Subscription Print Subscription Mobile Apps Newsletters News Alerts Archives Slanguage Dictionary Help Other Variety Products MediaVariety 411 Research amp; DataVariety Insight Archives Premium Email Alerts Real Estate Jobs Access the best entertainment industry data available View the Variety archives dating back to 1905 Get News Delivered To Your Inbox Privacy Policy Your Privacy Rights Terms of Use About Us Advertise Contact Us Google+ The Power of Content Deadline india.com Hollywoodlife hollywood TV Line BGR WWD Footwearnews (c) Copyright 2016 Variety Media LLC a subsidiary of Penske Business Media LLC. Variety and the Flying V logos are trademarks of Variety Media LLC. Powered by WordPress.com VIP Variety411 Your production services resource",http://www.variety.com/review/VE1117919168.html?categoryid=31&cs=1,200,jackassthemovie3,jackassthemovie,variety
"New York | Not Found | Village Voice NewsVLongformThe MTAMediaNYPDPoliticsMake It StopCultureLGBTTop Stories NewsletterMusicVAsk Andrew W.K.New YorkersMusic ListsBars amp; LoungesConcert CalendarMusic NewsletterFood amp; DrinkVNYC Restaurant GuideRestaurant Reviews100 Favorite Dishes99 Essential Restaurants in BKPizzaFood amp; Drink ListsFood amp; Drink NewsletterArts amp; CultureVVisual ArtsTheaterBooksComedyObiesThe Seen A NYC Style GuideTheater NewsletterCalendarVSubmit an EventConcert CalendarThings To Do NewsletterFilm amp; TVVNews amp; InterviewsFilm ReviewsShowtimesTrailersVillage Voice Film PollFilm PodcastFilm amp; TV NewsletterLongformVideosSlideshowsBest Of NYC(r)VArts amp; EntertainmentFood amp; DrinkShopping amp; ServicesSports amp; RecreationReaders ChoiceBest Of NewsletterPromotionsVPromotional EventsStreet TeamFree StuffPromotions NewsletterClassifiedsVMedical Studies Apps About Us Contact Us Staff Careers Advertise E-Edition Privacy Terms menu Remember Me SIGN IN > Forgot Password? Or sign in with a social account FACEBOOK GOOGLE + TWITTER YAHOO Dont have an account yet? Sign Up > Connect. Discover. Share. Get the most out of your experience with a personalized all-access pass to everything local on events music restaurants news and more. Enter your email or sign up with a social account to get started FACEBOOK TWITTER GOOGLE+ YAHOO Privacy Policy SIGN UP > Already registered? Login > Email Username Password Name Zipcode DONE MVN Sign In > Dont have an account yet? Sign Up > Facebook Twitter Follow villagevoice Other MORE That page could not be found. Whoops we cant seem to find what youre looking for. Based upon what we do know here are some search results that you might find useful.  Article Left to Their Own Devices 10 years ago by George Smith The first question that comes to mind on reading Ed Halters From Sun Tzu to Xbox War and Video Games is How did a military thats so handily made a mess of its real war make one of the best computer war games for kids ever? The title of the...  Article Letters Letter Of The Week Overserved underfed Re ""Not a Pretty Picture"" [Press Clips May 18-24] Sydney H. Schanbergs point has been running through my head from the beginning of this whole fiasco. Every day we see the numbers and reports of deaths. Yet in this day of information and image...  Article To Toes Action-Film Line With a Publicity-Savvy Police Story 11 years ago by Ed Halter Well executed but ultimately unsatisfying Breaking News centers its cops-and-robbers plot around a clever meta-media twist that nevertheless fails to transcend gimmickry. After photos surface of two Hong Kong policemen getting gunned down during their bungled melee with an armed gang Inspector Rebecca Hong (Cantopop dance diva Kelly Chen) decides...  Article Music 12 years ago by Chuck Eddy A bad iPod ad helps Swedes who swing harder than the Hives finally move mass asses with a track that first hit big on Village Voice radio three years ago. A Voice teen-pop critics band burns the flag. And his onetime Samoan replacement Jeff Dahl covers Badfinger gets epic like...  Article Secret Angel Still Wants to Save St. Brigids 10 years ago by Sarah Ferguson In other East Village demolition news though the wrecking ball has been stayed--for now--at St. Brigids fans and former parishioners are still fuming that the Archdiocese turned down offers by an anonymous ""angel"" to either repair or buy the Avenue B church in order to save it. An attorney for... All 189 results or Back to home (c)2016 Village Voice LLC. All rights reserved. Newsletters All-access pass to the top stories events and offers around town. Top Stories Send Sign Up gt; Remind Me Later gt; No Thanks gt; Privacy Policy Newsletters All-access pass to top stories events and offers around town. Sign Up gt; No Thanks Remind Me Later gt;",http://www.villagevoice.com/issues/0244/halter.php,404,jackassthemovie4,jackassthemovie,villagevoice
