review,link,status_code,id,movie_key,critic
"Mo Po - StarTribune.com Home All Sections Search StarTribune Manage Account Log out Log In Subscriptions New Manage Existing Recently Visited Home Local Sports Business Opinion Variety Health Highlights Politics Nation World Science Weather Traffic Video Photography Obituaries Classifieds Autos Housing Jobs Minneapolis St. Paul East Metro North Metro South Metro West Metro Projects Local Columnists Jon Tevlin James Lileks Local Blogs Campus Confidential Class Act Dateline Minnesota Full Disclosure Lileks at Lunch MPLS. STP The Drive Yesterdays News State Fair 10000 Takes Data Drop Twins Vikings Wild Wolves Gophers Colleges Golf Lynx Motorsports Outdoors High Schools Soccer Sports Columnists Dennis Anderson Sid Hartman Patrick Reusse Chip Scoggins Jim Souhan Sports Blogs Access Vikings A Fans View Bloggin Scoggins Dennis Anderson Doug Smith Gold in the Barn Gridiron Gold Ice Gold On the Lynx On the Wolves Patrick+ Randball Russos Rants Sids Scoops Souhan on Sports StribSports Upload The Roman Empire Twins Insider Sports Podcasts Access Vikings Twins Insider Top Workplaces Business Columnists Lee Schafer Neal St. Anthony Business Blogs 3D Economics Food Market Just Listed Lee Schafer Point of Sale The Mill Commentary Editorial Steve Sack Letters Podcasts Playing Politics Books Celebs Comics amp; Games Horoscopes Eat amp; Drink Movies Music Stage amp; Arts TV amp; Media Best of MN Health Home amp; Garden Kids Health Style Taste The Good Life Travel Variety Columnists Gail Rosenblum C. J Variety Blogs Artcetera Escape Artists Greengirls Health Check Lileks  Lunch On Books Table Talk Wingnut World Class View all Obituaries Place an Obituary Notice Place an Ad Garage Sales Estate Sales Merchandise Pets Recreational Vehicles amp; Marina Newspaper Ads Auctions Search Used Vehicles Sell your Vehicle Advertise Rentals Commercial Foreclosures Find an Agent Find a Job Your Resume Your Account Employer A-Z Top Workplaces Post a Job Star Tribune All content Business listings Close Home Local Sports Business Opinion Variety Obituaries Classifieds Autos Housing Jobs More from the Homepage prev No survivors in crash of Texas balloon carrying at least 16 people Twin Cities area braces for sex trafficking tied to Super Bowl Pokemon Go poses problem for peace at Eden Prairie park memorial Russia tied to hack of program used by Clintons campaign St. Croix County girl charged in savage attack on brothers girlfriend 1958 St. Louis Park rambler gets Finnish lake home makeover Fans give Morneau loud return to Target Field Cottage Grove couple wrap 250K honeymoon treehouse around old bur oak Chad Greenway again ready to fend off youngsters in his final(?) NFL season Midwest Traveler Exploring the revived Eau Claire Wis. 6 reasons to like new Downtown East Commons park near stadium next Movies 122609249 Mo Po Creators of ""Kung Fu Panda 2"" added 3-D a new villain and even for Po a touch of neurosis.  |  1/2 out of 4 stars By COLIN COVERT Star Tribune May 27 2011 -- 945am DreamWorks Animation MCT Po the voice of Jack Black is joined by a group of bunnies during a wild rickshaw chase in ""Kung Fu Panda 2"" Text size comment share tweet email Print more Share on Share on LinkedIn Share on Google+ Share on Pinterest Copy shortlink Purchase Order Reprint Huggable Po gets all touchy-feely in ""Kung Fu Panda 2"" a sturdy sequel to the 2009 blockbuster. This entry aims to expand the series both in storytelling terms and visually. It introduces emotionally complex issues and literally adds new scope via 3-D. In each case the payoff is impressive. The movie opens with a ravishing replica of traditional Chinese shadow puppet plays. The prologue introduces the movies new villain a militarist peacock named Lord Shen who aims to conquer China by exterminating kung fu. Po a giant panda who transformed himself from a dumpling-shaped layabout to a mighty martial arts master leads his Furious Five posse against Lord Shens ""unstoppable"" new weapon. But pride may be his undoing unless he can find spiritual harmony as his mentor Master Shifu instructs. Haunted by memories of infancy and always a bit at odds with his fussbudget dad -- how can a goose sire a panda? -- Po lacks inner peace. He will have to subdue his own demons before he can vanquish his foe. The vocal cast is fine with Jack Black alternately laconic and lunatic as Po and Gary Oldman all silken menace as Lord Shen whose claws and tail feathers double as rapiers. Angelina Jolies strong protective Master Tigress moves to the forefront of Pos team as Pos surrogate Tiger Mother embodying the strict Chinese parenting that the immature hero still needs. Her colleagues Jackie Chan Seth Rogen David Cross and Lucy Liu get about two lines apiece. But thats fine because it gives more room to Michelle Yeoh as a soothsaying mountain goat who nervously nibbles at her clients robes when not dispensing wisdom and James Hong as Mr. Ping Pos proud papa. The films richly textured visuals will leave you breathless. The screen is almost radioactive with beauty. The backgrounds are photorealistic landscapes of National Geographic magnificence the interiors are fever dreams of Ming Dynasty splendor and the character animation with complex but extremely smooth kung fu choreography simply flows. Fireworks are a key element of the story and the sheer surfeit of visual delights -- more than the eye can absorb in any one moment -- mirrors the climax of a fireworks display. Theres dizzy slapstick wit to the fighting. In one scene Po and friends hide in a street-dance dragon that seemingly gobbles up Lord Shens wolf henchmen and expels them out the other end. A climactic naval battle puts ""Pirates of the Caribbean"" to shame as it whittles an armada of long ships into chopsticks. Magical as the slick 3-D scenes are the antique shadow play that opens the movie is even cooler. KUNG FU PANDA 2  1/2 out of 4 stars Rating PG for sequences of martial arts action and mild violence. Screenwriter Charlie Kaufman (""Being John Malkovich"" ""Adaptation"") did a script polish no doubt adding the notes of soul-searching and doubt that peck at Po. That master of fairy-tale menace Guillermo del Toro (""Pans Labyrinth"" ""Hellboy"") is credited as a creative consultant sharpening the talons of Lord Shen Id wager. And the gag writers are ever-inventive In one absurd exchange Po atop a towering roof shouts a challenge to Lord Shen who cant make out a word hes saying. Theres an intimidating number of moving parts in a project such as this and director Jennifer Yuh keeps it all running smoothly. The effort must have been considerable. The result is worth it. View Comments Read our comment standards StarTribune.com welcomes and encourages readers to comment and engage in substantive mutually respectful exchanges over news topics. Commenters must follow our Terms of Use. Keep it civil and stay on topic. No profanity vulgarity racial slurs or personal attacks. Comments with web links are not permitted. Comments that violate the above will be removed. Repeat violators may lose their commenting privileges on StarTribune.com. Comments will be reviewed before being published. Powered by Livefyre } More from Star Tribune Twins win on Mauers pinch-hit walk-off walk Federal judge strikes down Wisconsin election laws Why Democrats abortion stance is a deal-breaker Rash Report 2016 campaign narrative defies expectations Postgame Nolasco finished his extra-long start with a flourish Twin Cities transit projects reach a perilous pass More from Entertainment Polls July 27 Poll If Hillary becomes president what title will Bill have? Should Hillary Clinton become the president Bill Clinton would become the first male White House spouse. This poses a pressing question for Americans what would we call him? Variety July 6 Adele fans show that her music reaches all ages Adele kicked off the first of her two-night Adele Live 2016 North American tour stop at Xcel Energy Center on Tuesday night. Polls June 23 Poll Which new State Fair food do you most want to try? Movies June 19 Finding Dory blows animation record out of the water The forgetful blue fish of ""Finding Dory"" is box office gold. Polls June 14 Poll Which celeb would you most like to chat with over coffee? Top Stories No survivors in crash of Texas balloon carrying at least 16 people 3 minutes ago Twin Cities area braces for sex trafficking tied to Super Bowl 814am Pokemon Go poses problem for peace at Eden Prairie park memorial 1020am Most Read Movie reviews The Names of Love and The Man Who Fell to Earth  Movies Step Up to Miami heat  Movies To combat Netflix and 60"" screens now playing at cinema Luxury  Movies Reviewed in brief  Movies Truly a trial  Movies Local Grants help put a fresh face on Minneapolis businesses Twin Cities area braces for sex trafficking tied to Super Bowl Variety 6 reasons to like new Downtown East Commons park near stadium Twenty One Pilots land smoothly in St. Paul Sports Offense gets a hard look during Vikings first practice Fans give Morneau loud return to Target Field Featured Gallery Photos This mid-century home for sale in Golden Valley is like walk... 13 photos Wallpaper wallpaper wallpaper. Listed for 674900. Business Obama signs bill requiring labeling of GMO foods Edinas Galleria adding space for as many as 12 new stores Politics Russia tied to hack of program used by Clintons campaign Gov. Mark Dayton looks back on 40 years of Democratic National Conventions 10000 Takes The art of parting We used to spend so much time there How I came to see bipolar disorder as my greatest strength Nation Reagan shooter Hinckleys return to normalcy has been years in making Powerball 478 million jackpot is nations 8th largest World Philippine president calls off truce after rebel attack Security suddenly boosted at Amsterdams Schipol Airport Celebrities Latest late-night battle Stephen Colbert vs. corporate lawyers Fox 9s Jonathan Choe takes his talent and sartorial style home to Boston StarTribune Follow Us On Facebook Twitter Google+ Pinterest Instagram Tumblr Company About the Star Tribune Contact us Jobs News in Education City Pages High school sports hubs Mobile and tablet apps Advertise with us Talk with a business consultant Media kit Classifieds Buy Star Tribune Store Photo Reprints Archived articles Back Copies Commercial reprints Licensing Customer support Feedback Manage your account Newspaper subscription Digital access eEdition Vacation hold/billing Website Terms of use Privacy policy Site index RSS (c) 2016 StarTribune. All rights reserved.",http://www.startribune.com/entertainment/movies/122609249.html,200,kungfupanda223,kungfupanda2,startribune
"Kung Fu Panda 2 Review Jack Black Angelina Jolie | EW.com Skip to main content Sign In Log Out TV TV Recaps Movies Music Books Gaming Video Big Brother Queen of the South Mr. Robot Wayward Pines Suits Tyrant Shop Newsletter Subscribe Get 1 year for 25 Save 86% off the cover price SUBSCRIBE More Great Stuff Comic-Con Hulu Hot List 50Scoops EW Popfest For Your Consideration Jess Cagle Interview Stage Follow EW EW on Facebook EW on Twitter EW on Tumblr EW on Instagram About EW Contact UsCustomer ServiceAbout UsJobs at Time Inc.AdvertisePrivacy PolicyYour California Privacy RightsAd ChoicesNewslettersSubscribeTerms of ServiceSite Map Copyright 2015 Entertainment Weekly Inc. All rights reserved. Login Log out TV TV Recaps Movies Music Books Gaming Video More... TV This Weeks Cover The Walking... TV Exclusive Photos of The Walking... EW POPFEST Get the details 50Scoops50Days Exclusive... Movies Crazy Stupid Love Before Th... Movies The Most 2000s Fashion From Joh... Movies 27 Great Revenge Movies Movies Alice in Wonderland Witticism... Movies John Tucker Must Die Where Ar... Books 15 Captivating International Cri... Movies Planet of the Apes See the Fa... Movies Toronto Film Festival 2016 See... TV One Tree Hill Where Are They... Movies Little Miss Sunshine Where Ar... Books Harry Potter and the Cursed Chi... Movies Comic-Con 2016 See Portraits of... TV Friends See the Casts Evolut... TV Comic-Con 2016 Get Batty With... Movies The Dark Tower Storybook Steph... News Comic-Con 2016 Star Portraits... TV 10 of the Best Moments From The... Movies The Dark Tower Storybook Steph... Movies Thelma and Louise See Rare Behi... Movies 9 of Garry Marshalls Best Movies Movies Every Star Trek Movie Ranked Movies Big Trouble in Little China... Movies The Dark Tower Exclusive Firs... Movies Suicide Squad Before They Wer... Movies The 10 Best Movies of 2016 (So Far) TV Fear the Walking Dead introduc... Movies Kung Fu Panda 2 by Owen Gleiberman Share Tweet Share on Google+ Share on Pinterest Share on Tumblr Kung Fu Panda 2When Po the clown-eyed roly-poly kick-ass panda bear hero of Kung Fu Panda 2 goes into his twirly lightning-limbed fighting mode he...Kung Fu Panda 2Animation Action/AdventureJonathan Aibel Glenn BergerPT91MPGWhen Po the clown-eyed roly-poly kick-ass panda bear hero of Kung Fu Panda 2 goes into his twirly lightning-limbed fighting mode he...2011-06-06Jackie ChanParamount Pictures Share Tweet Share on Google+ Share on Pinterest Share on Tumblr SKADOOSH Po and co. are back. (Sweet moves Tigress.) (2010 DreamWorks Animation LLC) B+ Kung Fu Panda 2 Genre Animation Action/Adventure; Starring Jack Black Angelina Jolie Jackie Chan; Author Jonathan Aibel Glenn Berger; Release Date Wide 05/26/2011; Runtime (in minutes) 91; MPAA Rating PG; Distributor Paramount Pictures Posted June 6 2011 -- 1200 AM EDT When Po the clown-eyed roly-poly kick-ass panda bear hero of Kung Fu Panda 2 goes into his twirly lightning-limbed fighting mode he doesnt leave his slightly abashed suburban sweetness behind. ""Yes"" he says dispatching a foe ""Taste the defeat"" and you can hear the joyous disbelief (did I really just whip that guys butt?) in the gee-whiz sound of Jack Black who voices him. Its not hard to see why children love Po the rare animated hero whos awesome and ridiculous at the same moment. Hes like the coolest stuffed animal in the world. But since he became a triumphant member of the Furious Five -- Tigress (Angelina Jolie) Monkey (Jackie Chan) Viper (Lucy Liu) Mantis (Seth Rogen) and Crane (David Cross) -- in 2008s Kung Fu Panda whats left for him to conquer beyond the next bowl of dumplings? In Kung Fu Panda 2 Po must now defeat a seething white peacock Lord Shen (voiced with silvery menace by Gary Oldman) who owns a gigantic cannon he plans to use to put the Furious Five -- and indeed all of kung fu -- out of business. More than that Po must come to grips with his own repressed memories of the moment that left him an abandoned infant. At times Kung Fu Panda 2 suggests Bambi redone as an episode of Oprah. Yet its a more-than-worthy sequel. Youll taste and savor the victory through an irresistible gush of ""healing"" tears. B+ Movie Links Official Site Kung Fu Panda 2 on Facebook Movies Like This Zookeeper Cars 2 The Smurfs Share Tweet Share on Google+ Share on Pinterest Share on Tumblr Top Stories HBO announces re-run premiere date for The Larry Sanders Show Stranger Things cast and fans scared with even Stranger prank HBO defends violent content as critics complain Nick Cannon says he was hit with Mariah Carey diss on Wild N Out True Detective not dead yet HBO insists Jimmy Fallon Snapchats Martha Stewarts cooking on The Tonight Show Game of Thrones HBO confirms season 8 will be last Photo Galleries 50Scoops50Days The Latest in Fall TV News The Biggest Moments From the 2016 Conventions Crazy Stupid Love Before They Were Stars The Most 2000s Fashion From John Tucker Must Die Exclusive Photos of The Walking Dead Season 7 27 Great Revenge Movies Alice in Wonderland Witticisms and Wisdom From the Disney Classic From Our Partners From Our Partners Contact UsCustomer ServiceAbout UsJobs at Time Inc.AdvertisePrivacy PolicyYour California Privacy RightsAd ChoicesNewslettersSubscribeTerms of ServiceSite Map Copyright (c) 2016 Entertainment Weekly Inc. All rights reserved. img[data-src] { display none important; }","http://feeds.ew.com/~r/entertainmentweekly/movies/reviews/~3/ytbYfXrR73o/0,,20483438,00.html",200,kungfupanda224,kungfupanda2,ew
"Time Out New York | New York Events Activities amp; Things To Do Go to the content Go to the footer Time Out New York New York Popular cities London New York Paris Chicago Los Angeles Browse all cities Time Out New York Close New York Change city New York Popular cities London New York Paris Chicago Los Angeles Browse all cities Tickets Events Things to Do Restaurants Bars Movies Theater Music Shopping Attractions Blog Art Travel Nightlife Events amp; Festivals Museums Kids Hotels Comedy Dance LGBT Sex amp; Dating Books City Guide Neighborhoods Promotions Close My Time Out Things I love My lists My Profile My Account Sign out Sign in Create account Sign in With your social account Or with your email Email Password Remember me Forgotten your password? Sign in You can create a Time Out account in two ways... With a few clicks using your favourite social network Or by entering your details below Email First Name Last Name Create password Repeat new password I accept Time Outs terms of use including opt-in to newsletters. Create account Welcome  You have successfully connected your account to Time Out. You may sign in with this account in future. Please confirm your account details Email First Name Last Name I accept Time Outs terms of use including opt-in to newsletters. Sign up My Account Sign in or Create account Search Tickets Events Things to Do Restaurants Bars Movies Theater Music Shopping Attractions Blog Art Travel Nightlife Events amp; Festivals Museums Kids Hotels Comedy Dance LGBT Sex amp; Dating Books City Guide Neighborhoods Promotions More Search Your ultimate guide to New York Discover the best NYC events things to do restaurants theater and nightlife Movies The best movies out right now Find the latest reviews for movies playing in New York this week Read more Bars The best Williamsburg bars in NYC These are the best Wiliamsburg bars from bustling beer gardens to elegant speakeasies Read more Blog Five emo bands worth taking a look at Theyll make you wish it was the 90s again Read more Things to do The best helicopter tours in NYC Soak up exhilarating views of the citys stunning skyline by choosing the best helicopter tour NYC has to offer Read more Shopping The best cheap clothing stores in NYC The best cheap clothing stores in NYC have everything from vintage duds to one-of-a-kind outfits Read more Things to do in New York Today This week This weekend This month Find more things to do in New York Tickets and offers Hamilton Get your tickets to one of the most critically-acclaimed shows ever--winner of 11 TONY Awards Read more Beautiful The Carole King Musical Take good care of your baby and take them to see this award-winning show Read more The Book of Mormon Nine TONYs. Five Stars. Thank God you can get tickets to this hilarious musical right here. Read more Wicked Touted as the ""Best Musical of the Decade"" Wicked is truly Broadway at its best. Read more Find more tickets Latest news Blog Five emo bands thatll make you wish it was still the 90s What the hell is emo music? The only certainty that question offers is No one will agree. Theres the proto-emo puritans (see 80s acts Rites of Spring and... Read more Blog 15 things youll miss about having a roommate in NYC Roommates. Every New Yorker either has or had one at some point in their lives (unless of course youre a bazillionaire). As tricky as living with your... Read more Blog Awesome free party Glow will illuminate Brooklyns Grove Alley with cosmic light displays tonight Who needs to see the nights stars when trippy light displays are brought to the citys streets or more specifically Brooklyns Grove Alley? Tonight... Read more Blog Whales are blowing up (air from the top of their heads) all over New York Here in New York we like things as a certain infamous city resident is known for saying huge Our skyscrapers are the countrys tallest our Macys is the... Read more More from the blog Upcoming NYC events and festivals Blog Waterfight NYC 2016 2 Read more Things to do New York City Poetry Festival Read more Music Lincoln Center Out of Doors Read more Things to do Jazz Age Lawn Party Read more More New York events and festivals New York events calendar July events August events September events October events See our full events calendar for 2016 The best of New York Things to do The best of 2016 See our essential guide to the best of 2016 including upcoming concerts movies museum exhibits restaurants and more 1 Read more Bars Cocktails in NYC Use our guide to find the best cocktails in the city drink recipes bar reviews and more Read more Attractions The 50 best sights and attractions in NYC From historical landmarks to newer destinations here are the best sights to visit in NYC for tourists and locals alike 5 Read more Theater The best Broadway shows in NYC The most exciting plays musicals and revivals on Broadway. Read more Restaurants The 100 best restaurants in NYC Where are you eating tonight? Read more Art The best art museums in NYC In New York theres a museum for every aesthetic and intellectual taste. 1 Read more Find the best of NYC Most popular stories Blog New dine-in Brooklyn movie theater only charges 3 per ticket Its like a fancier version of Nitehawk Cinema but cheaper? Damn Cancel your plans because tonight January 15 is the grand opening of Syndicated (a new... 7 Read more Blog Watch HD footage of New York in 1993 You wont spot any Citi Bikes smartphones or illegal hoverboards in this footage of New York. The impressively clear HD footage was actually shot around the... 1 Read more Music The 50 best love songs of all time Are you ready to fall head over heels with the best love songs of all time? Cupid has you in his sights people. Read more Things to do NYC events calendar for 2016 Find the best things to do all year with our NYC events calendar of 2016s coolest events including parades concerts films and art exhibits Read more Music 50 sexiest songs ever made Our playlist of sex songs will take you by the hand whisper sweet nothings in your ear and lead you straight to the bedroom Read more See more popular stories New York neighborhoods Things to do Williamsburg neighborhood guide Read more Things to do Chelsea neighborhood guide Read more Things to do Bushwick neighborhood guide Read more Things to do Soho neighborhood guide Read more Things to do Chinatown neighborhood guide Read more Things to do Bronx neighborhood guide Read more More New York neighborhood guides Top About us Work for Time Out Privacy policy Website terms of use Contact us Get listed Advertising Time Out products Mobile apps Time Out Shop Time Out Guides Time Out Travel Time Out Worldwide Time Out magazine Follow us Facebook Twitter Youtube Instagram Pinterest Spotify Foursquare Time Out New York Site map }",http://newyork.timeout.com/arts-culture/film/1456977/kung-fu-panda-2,200,kungfupanda225,kungfupanda2,timeout
