review,link,status_code,id,movie_key,critic
"Deftly pandas to its audience | New York Post Thanks for contacting us. Weve received your submission. Back to Reading News Metro Page Six Sports Business Opinion Entertainment Fashion Living Media Tech Real Estate Sub Menu 1 Photos Video Covers Columnists Horoscopes Sub Menu 2 Classifieds Subscribe Sign in In The News hillary clinton iran lamar odom 2016 presidential election new york mets Sections Search Tips Sign in New York Post Most Popular 33476 Ex-NFLer wife fatally shot by teen in their home 25774 Why Hollywood babes are trying to bag a tech titan not a rock star 17454 14-year-old girl slit teens throat in hopes of getting 1st kill cops 15483 16 feared dead in Texas hot air balloon crash 13108 Malia Obama skipped the DNC for Lollapalooza 11372 Why didnt the Democrats even mention the Clinton Foundation? Share thisFacebookTwitterGoogleWhatsAppEmailCopy Entertainment Share thisFacebookTwitterGoogleWhatsAppEmailCopy Deftly pandas to its audience By Kyle Smith View author archive email the author follow on twitter Get author RSS feed Name(required) Email(required) Comment(required) May 27 2011 | 400am Modal Trigger The titular bear (voiced by goofy Jack Black) reunites with old friends for a beautifully animated adventure. It wouldnt be right to say that half an hour after ""Kung Fu Panda 2"" ended I was starving for laughs again. In truth I was starving pretty much all the way through. A lot of this movie is like an oxygen dumpling. But Po and friends redeem themselves with a terrific third act the animation (in three distinct styles) is superb and theres enough hiii-YA-ing to keep the kids yipping throughout. As you exit the theater be prepared to protect vital organs from low-altitude karate chops that slice the air at about waist height. The many pleasures of the first film included Jack Blacks buzzing nonstop jive as Po and the way his blubbery loser gradually became a Dragon Warrior. Now the character is as fuzzy as Pos belly Half the time hes kicking butt the other half hes falling on it. Moreover now that every ""SportsCenter"" host celebrity gossip and hepcat blogger rattles his vocal cords in fluent Blacktalk (""Thats severely cool"" ""Taste the defeat"" ""My fist hungers for justice"") its all starting to take on the air of a Tuesday night lounge act. In Reno. Predictable comedy is dead comedy -- and no you dont get a pass because half your audience is still mastering long division. Rug-rat chaperones are being asked to pay up to 17 for this in Manhattan. Them is grown-up prices. Still the quality of the animation is worth it. In a prologue presented beautifully to look like paper cutouts we meet the villainous peacock Lord Shen (Gary Oldman) who as a youngster was banished by his parents because of his obsession with finding the dark side of fireworks. This element together with a sequence in which Po learns about finding inner peace from his Yoda-like master Shifu (Dustin Hoffman) by mastering the ability to catch a single raindrop is essential to setting up the not unrousing big finish. Po wants to learn a little more about where he came from. Just as a for-instance -- why is Dad a goose? Father explains that Po is indeed adopted having been discovered in a crate of radishes but thats all he knows. Po is as hungry for more answers as he is for noodles. Meanwhile Lord Shen and his army of wolves are ransacking a town. Po and his five pals (including Angelina Jolies Tigress and Seth Rogens Mantis) come to the rescue although every few minutes its Po who needs to be saved usually by Crane picking him up as he plummets into a gorge. Kung Fu Panda was an advanced warrior at the end of the first film but now hes bumbling again because well making fatty fall down is this movies primary sense of comedy. Its a bit hard to be terrified of a peacock (the snow leopard in the first movie was way more sinister). But the animators are in charge and they succeed in dazzling with Lord Shens look -- just as they create a sly hand-drawn style for flashbacks of Pos youth. Action scenes such as a battle in a towering pagoda look splendid. Shen lacks size but does have heavy artillery. Hes been stealing all of the metal from the villages to produce a cannon with which he proposes to rule all of China. (Silly bird If he just made cheap junk he could rule the world not just China.) The pattern on Shens tail feathers breaks loose a memory Po has about how he was parted from his parents as a cub. He comes to suspect that he was abandoned. If so Shen and Po have much in common. The script could have done more with this idea Shen might have tricked Po into joining forces if for no other reason than to split the cost of a therapist to sort out their daddy issues. At the end of that nifty third act there is a warm emotional payoff that comes with a slightly alarming quantity of hugging. (Young cubs listen well Bugs Bunny never hugged anyone unless he had a lit stick of dynamite in one hand.) One worthy thing about Po though He is not faux. In his bounce and jiggle he contains the toddlers absence of self-consciousness the puppys anticipation of infinite joy Chris Farleys denial of limits. And unlike Farley KFP can go on forever. As long as he doesnt overdose on bamboo. kyle.smithnypost.com Share thisFacebookTwitterGoogleWhatsAppEmailCopy Share this article Share thisFacebookTwitterGoogleWhatsAppEmailCopy Read Next Oprah finale scores biggest audience in 17 years Read Next Oprah finale scores biggest audience in 17 years Share Selection Trending Nowon NYPost.com 31723 Ex-NFLer wife fatally shot by teen in their home 27400 Why Hollywood babes are trying to bag a tech titan not a rock star 16608 14-year-old girl slit teens throat in hopes of getting 1st kill cops Now On Celebrate Arnolds 69th birthday with his beefiest vintage pics Eric Claptons girlfriends ex-beau busted on pot rap Orlando Bloom joins Andy Sambergs HBO mockumentary SEE ALL Page Six TV Lindsay Lohans dad says booze pics arent what they seem Lindsays sober claims Michael Lohan These celebs hang out where? Now On Pure Nude Yoga Actual Workout Or Masturbation Material? (Answer Sorta Both) SEE ALL More Stories pagesix Harry Brant busted for drugs and bailing on taxi fare Now On Decider This Woman Giving Birth In A Stream Has Been Watched Over 54 Million Times (NSFW) nypost Ex-NFLer wife fatally shot by teen in their home New York Post Twitter Facebook Instagram Email Newsletters Mobile Apps Contact Us Tips Twitter Facebook Instagram Sections amp; Features News Real Estate Page Six Tech Sports Media Metro Photos Entertainment Video Business Alexa Opinion Covers Fashion Horoscopes Living Classifieds Newsletters amp; Feeds Email Newsletters RSS Feeds NYPost Store Home Delivery Subscribe Manage Subscription Preferences Help/Support Customer Service App FAQ amp; Help Contact Us Tips Newsroom Letters to the Editor Reprints Careers Apps iPhone App iPad App Android Phone Android Tablet Advertise Media Kit Contact Post Digital Network (c) 2016 NYP Holdings Inc. All Rights Reserved | Terms of Use | Privacy | Your Ad Choices News Corp. is a network of leading companies in the world of diversified media news and information services. News Corp HarperCollins Marketwatch realtor.com Dow Jones The Sun Storyful Wall Street Journal The Times Mansion Global New York Post The Australian Checkout51 News America Marketing News.com.au Unruly Send to Email Address Your Name Your Email Address Cancel Post was not sent - check your email addresses Email check failed please try again Sorry your blog cannot share posts by email. Copy Share URL Copy Link Sign Up / Sign In Sign In // Sign Up With your existing account from... With your existing account { loginWidget } Use an account with your email address Or with a NYPost.com account { userInformationForm } { traditionalSignIn_emailAddress } { traditionalSignIn_password } { traditionalSignIn_signInButton }{ traditionalSignIn_createButton } { /userInformationForm } Sign Up / Sign In Sign In // Sign Up Welcome back { welcomeName } { loginWidget } Or use NYPost.com account Sign Up / Sign In Sign In // Sign Up Welcome back Welcome back { welcomeName } { userInformationForm } { traditionalSignIn_emailAddress } { traditionalSignIn_password } { traditionalSignIn_signInButton } { /userInformationForm } Use an account with your email address Or use another account Almost Done Please confirm the information below before signing in. Please confirm the information below. { socialRegistrationForm } { socialRegistration_emailAddress } { socialRegistration_displayName } { socialRegistration_ageVerification } By clicking ""Sign In"" you confirm that you accept our terms of service and have read and understand privacy policy. { backButton } { socialRegistration_signInButton } { /socialRegistrationForm } Almost Done { registrationForm } { traditionalRegistration_emailAddress } { traditionalRegistration_password } { traditionalRegistration_passwordConfirm } { traditionalRegistration_displayName } { traditionalRegistration_captcha } { traditionalRegistration_ageVerification } By clicking ""Create account"" you confirm that you accept our terms of service and have read and understand our privacy policy. { backButton } { createAccountButton } { /registrationForm } Create a new password ForgotPassword? Dont worry it happens. Well send you a link to create a new password. { forgotPasswordForm } { traditionalSignIn_emailAddress } { backButton } { forgotPassword_sendButton } { /forgotPasswordForm } Create a new password Sent Weve sent an email with instructions to create a new password. Your existing password has not been changed. Weve sent an email with instructions to create a new password. Close Account Already Exists { mergeAccounts } { backButton } Sign in to complete account merge { tradAuthenticateMergeForm } { traditionalSignIn_emailAddress } { mergePassword } { traditionalSignIn_signInButton } { /tradAuthenticateMergeForm }",http://www.nypost.com/p/entertainment/movies/deftly_pandas_to_its_audience_nLp0CHGD346SwZriJFi30N?CMP=OTC-rss&FEEDNAME=,200,kungfupanda24,kungfupanda2,nypost
"Movie review ""Kung Fu Panda 2"" offers eye candy wisdom for kids - The Denver Post News News Latest News Colorado News Nation / World Obituaries Marijuana Education Environment Crime amp; Courts Weather Your Hub Sports Sports Olympics Denver Broncos College Sports Colorado Rockies Preps Colorado Avalanche Outdoors Denver Nuggets Boxing / MMA Colorado Rapids Scores and Standings Sports Columnists Sports on TV/Radio Business Business Aerospace Airlines Economy Energy Real Estate Retail Technology Telecom Tourism Entertainment Entertainment Arcade Games Arts Books Calendar Comics Movies Music Reverb Music Theater Television Television Listings Travel Lifestyle Lifestyle Ask Amy Fashion Food amp; Drink Restaurants amp; Dining Fitness Home amp; Garden Horoscopes Opinion Opinion Editorials Columnists Letters Perspective Cartoons Opinion Polls Politics Politics Election Colorado Legislature Denver Politics Local Politics National Politics Cannabist Classifieds Classifieds Cars Homes Jobs Today Subscribe Newsletter News News Latest News Colorado News Nation / World Obituaries Marijuana Education Environment Crime amp; Courts Weather Your Hub Sports Sports Olympics Denver Broncos College Sports Colorado Rockies Preps Colorado Avalanche Outdoors Denver Nuggets Boxing / MMA Colorado Rapids Scores and Standings Sports Columnists Sports on TV/Radio Business Business Aerospace Airlines Economy Energy Real Estate Retail Technology Telecom Tourism Entertainment Entertainment Arcade Games Arts Books Calendar Comics Movies Music Reverb Music Theater Television Television Listings Travel Lifestyle Lifestyle Ask Amy Fashion Food amp; Drink Restaurants amp; Dining Fitness Home amp; Garden Horoscopes Opinion Opinion Editorials Columnists Letters Perspective Cartoons Opinion Polls Politics Politics Election Colorado Legislature Denver Politics Local Politics National Politics Cannabist Classifieds Classifieds Cars Homes Jobs Movie review ""Kung Fu Panda 2"" offers eye... Share thisClick to share on Facebook (Opens in new window)Click to share on Reddit (Opens in new window)Click to share on Twitter (Opens in new window)Click to print (Opens in new window)Click to email this to a friend (Opens in new window)MoreClick to share on LinkedIn (Opens in new window)Click to share on Pinterest (Opens in new window)Click to share on Tumblr (Opens in new window)Submit to Stumbleupon (Opens in new window) Trending Broncos camp fan guide Texas balloon crash Woody Paige retiring Sports Authority bonuses Rockies down Mets Mile High Roundup Entertainment Movie review ""Kung Fu Panda 2"" offers eye candy wisdom for kids Share thisClick to share on Facebook (Opens in new window)Click to share on Reddit (Opens in new window)Click to share on Twitter (Opens in new window)Click to print (Opens in new window)Click to email this to a friend (Opens in new window)MoreClick to share on LinkedIn (Opens in new window)Click to share on Pinterest (Opens in new window)Click to share on Tumblr (Opens in new window)Submit to Stumbleupon (Opens in new window) Po (Jack Black) and Shifu (Dustin Hoffman) receive troubling news about Lord Shens plan to take over China in ""Kung Fu 2."" By  Lisa Kennedy PUBLISHED May 25 2011 at 1220 pm | UPDATED May 3 2016 at 141 am Sign up for newsletters and alerts Submit your news tips or photos Most Popular Donald Trump stumps in Colorado promises ""No more Mr. Nice Guy"" Chris Harris INT injuries and 8 other observations from Day 2 of Broncos training camp Broncos offensive linemen can live with the blame game. Theyre built for it. LoDo shooting leaves one dead another injured Peyton Manning stars in 3 new hilarious DIRECTV ads with Lionel Richie Woody Paige retiring from The Denver Post ""Kung Fu Panda 2"" makes one thing clear from the get-go Lord Shen hes one angry bird. Gary Oldman voices the peacock whose pride may goeth but not before he causes a storm of destruction in the lovely sequel to the 2008 surprise that introduced us to Po. Jack Black returns as the voice of the pudgy panda who dreamed of becoming a martial-arts hero. Angelina Jolie returns as Tigress. Dustin Hoffman reprises Master Shifu Pos wise wry teacher. Along with the Furious Five Shifu keeps the peace in the optimistically named Valley of Peace. And his father Mr. Pings noodle restaurant has the memorabilia to prove it. Directed with verve and nerve by Jennifer Yuh Nelson ""Kung Fu Panda 2"" offers plenty of lessons about misreading destiny as the right to rule unfettered about parental love and disappointment about parental love and compassion. If you are looking for age-old parables recast against a vividly rendered world this kids flick bests ""Thor."" Without ever becoming too film-cultish the original paid homage to Chinese martial-arts films. Written by Jonathan Aibel and Glenn Berger the sequel goes further introducing younguns to the notion of ""inner peace"" and disclosing the heartache of Pos origins. In ""Kung Fu Panda 2"" the student has become the teacher as they say. Or perhaps the better adage would be ""the fan has become the celebrity."" Because gobsmacked Po has grown into his role as Dragon Warrior. Plying a yin-yang mix of humor and solemnity the movie teases us with melancholy then laughter. In so many ways an adoptees saga in the vein of Moses journey ""Kung Fu Panda 2"" touches on destiny upended and embraced. The evolving relationship between Po and his dad the silly (loving) goose Mr. Ping (James Hong) becomes as moving as it is funny. A disturbing flashback sends Po home with questions that link him to Lord Shen more than he imagines. While the movies insights wont necessarily strike chaperones as new they may serve as cozy nudges. Among them that a sad start may shape ones destiny but one can chose to steer it toward good or ill. And usually heroes have friends; villains have minions they shove around. The kung-fu quintet of Crane (David Cross) Monkey (Jackie Chan) Mantis (Seth Rogen) Viper (Lucy Liu) and in particular Tigress are no longer furious about the rise of the at-times-still-clumsy Po. These critters make a formidable loving posse. Lord Shen having disappointed his parents surrounds himself with yes men and one honorable soothsaying bighorn sheep (Michelle Yeoh) whose warnings he consistently humbugs. The films visuals are thrilling beguiling vivid the greens of a glade or a terraced hillside; the molten reds of Shens smelting works or yellow-orange arcs of fireworks. The action mixes the kinetic with the calm adding one more pleasure to the endearing Tao of ""Kung Fu Panda."" Film critic Lisa Kennedy 303-954-1567 or lkennedy denverpost.com; also on blogs.denverpost.com/ madmoviegoer ""Kung Fu Panda 2"" PG for sequences of martial-arts action and mild violence. 1 hour 30 minutes. Directed by Jennifer Yuh Nelson; written by Jonathan Aibel and Glenn Berger; voiced by Jack Black Angelina Jolie Dustin Hoffman Gary Oldman James Hong Jackie Chan Lucy Liu Seth Rogen David Cross Michelle Yeoh and Danny McBride. Opens today at area theaters in 3-D and 2-D. Lisa Kennedy Digital amp; Driveway Delivery - 50% Off More in Music Polica Synth-pop in the age of racial strife July 29 2016 Indie synth-pop band Polica (pronounced poh-LEE-sah) knew that their newest album ""United Crushers"" wasnt going to get as much attention as their debut album ""Give You the Ghost"" did. Blake Shelton plays free intimate show at Denvers Grizzly Rose July 28 2016 Only 2000 people made it inside Grizzly Rose Thursday for an intimate show by a country superstar. Tickets on sale for Denver shows this week July 29 July 28 2016 How to get tickets for the best upcoming Colorado shows. Dont Miss This Chicano Music Festival this weekend July 28 2016 In the Art District on Santa Fe folks at Su Teatro Cultural and Performing Arts Center have already begun celebrating the 20th annual Chicano Music Festival this week. Member Services News Alerts Facebook Twitter Instagram RSS Subscribe Become a Member / Subscribe Place a Hold Denver Post Store Digital Replica Edition Classifieds Autos Real Estate Jobs Todays Ads Weekly Ads Daily Ads Special Sections Contact Us Submit a News Tip Member Services Advertise With Us Careers Place an Obituary Todays Front Page Back Issues Archives Mobile Apps Copyright (c) 2016 Digital First Media Privacy Policy Site Map Ethics Policy Powered by WordPress VIP Arbitration Send to Email Address Your Name Your Email Address Cancel Post was not sent - check your email addresses Email check failed please try again Sorry your blog cannot share posts by email.",http://www.denverpost.com/movies/ci_18139946,200,kungfupanda25,kungfupanda2,denverpost
"Kung Fu Panda 2 (B+) | Dallas Morning News Dallas Morning News Home ePaper Subscribe Sign Out Sign In Home News Communities Crime Education Investigations State Nation/World Politics Videos Photos Business Wall Street Airlines Technology Economy amp; You Top 100 Real Estate Autos Sports Cowboys Mavericks Stars Rangers Colleges High Schools Other Sports Entertainment Food and Drink Movies Music Things To Do Find Restaurants Find Concerts Arts amp; Life Arts Books Food amp; Wine Home amp; Garden Style Weddings Travel Health Opinion Editorials Blog Columns Sunday Points Letters Dallas North-South Gap Obits Burial Plots In Memoriams Marketplace Autos Jobs Real Estate Shopping Classifieds DMNstore Submit Twitter Instagram Facebook YouTube Entertainment Movies Reviews Reviews May 25 2011 0314 PM CDT May 25 2011 0315 PM CDT Kung Fu Panda 2 (B+) Kung Fu Panda 2 (B+) By NANCY CHURNIN nchurnindallasnews.com Staff Writer Published 25 May 2011 0314 PM Updated 25 May 2011 0315 PM Related Kung Fu Panda 2 showtimes A heartless creature hearing a prophecy that foretells his doom sets out to destroy the one who might someday stand in his way thus possibly fulfilling the very prediction hes trying to avoid.No were not talking about Lord Voldemort and Harry Potter although it does feel that way early on in the animated Kung Fu Panda 2. Lord Shen the evil white peacock voiced by Gary Oldman (Sirius Black in the Potter films) sets out to change his destiny by killing Po (Jack Black) who eludes him as a baby and now faces him as the kung-fu dragon warrior.Po does not remember what happened to him as a baby. We get a series of flashbacks done in contrasting flat cartoon style as compared to the lush CGI fullness of the rest of the story.Fortunately just as it starts to look like a retread the film shifts focus to an origin story that ultimately becomes like Disneys Tarzan an affecting adoption story. (Harry Potter and the Deathly Hallows Part 2 is coming fast on Pos furry heels with a scheduled release date of July 15.)Once Po learns the truth about how his loving mother gave him up to save him he sees what a great father he has in Mr. Ping (voiced by James Hong) the goose who rescued raised and fed him lots of noodles.Despite the potpourri of serious themes the film is frequently funny. A witty script by Jonathan Aibel and Glenn Berger is matched by director Jennifer Yuhs visual agility with sight gags which is splashily displayed in 3-D.Its hard not to laugh at round-bellied slacker warrior Jack Black as a Pooh Bear of a Po making all his jokes count. He happily remains an Everybear with a goof for each triumph. Thats whether he is making an impassioned declaration from a great height (only to find out that no one can hear him) or finding a unique way to slip into Shens castle by hiding in a dragon costume looking to observers as if the dragon is ""eating"" bad guys and ejecting them out the back end.Fans of the Furious Five warriors may be a little disappointed as their parts along with that of their teacher Shifu (Dustin Hoffman) are muted in a tale that belongs to Po Shen and Mr. Ping. Still Angelina Jolie lends action-hero impact to the tough and serious Tigress one of the warriors who fights alongside Po in a common quest to save China and kung fu.For those who like the way this story focuses on Po they should really like the surprise ending because surprise -- not -- it sets up yet another potentially Po-centric sequel. If this takes off look for Kung Fu Panda Legends of Awesomeness a television series currently listed as being in development.Kung Fu Panda 2B+ Starring the voice talents of Jack Black Angelina Jolie Dustin Hoffman Gary Oldman Lucy Liu Seth Rogen and Jackie Chan. Directed by Jennifer Yuh. PG (sequences of martial arts action and mild violence). 91 mins. In wide release. editor picks Nailing down the Horseshoe Assembling Dallas latest Calatrava arches Get out Hit the ground running (or cycling) on these D-FW trails Music Find out concerts places with great music and more Alex from Target Internet sensation from Frisco to act in movie featuring Plano teens with cystic fibrosis Comments To post a comment log into your chosen social network and then add your comment below. Your comments are subject to our Terms of Service and the privacy policy and terms of service of your social network. If you do not want to comment with a social network please consider writing a letter to the editor. Copyright 2011 The Dallas Morning News. All rights reserve. This material may not be published broadcast rewritten or redistributed. featured products <a href=""http//ws-na.amazon-adsystem.com/widgets/q?rt=tf_sswamp;ServiceVersion=20070822amp;MarketPlace=USamp;ID=V20070822%2FUS%2Fthedalmornew-20%2F8003%2F8390f335-bc74-4000-b786-a78b33862cabamp;Operation=NoScript"">Amazon.com Widgets</a> Follow Twitter stay connected listings movie stories Criterion Blu-ray pick The gentle precision of Ozus final film An Autumn Afternoon Update Watch exclusive clips from ESPNs Von Erich documentary New 4D Lego Movie spin-off heading to Legoland Discovery Center in Grapevine photos Food photos Coal-fired goodness at Smoke in Plano Food photos Three cheers (and four stars) for Gemma video Dallasnews.com Full Site Map Close Home News Business Sports Entertainment Life Opinion Obituaries Weather Investigations Photos Video Blogs Crime Traffic Autos Real Estate Jobs Shopping Marketplace Celebrations Legal Notices Pets Place an Ad ePaper Newspaper Archives Local Business Listings Media Kit Mobile Apps eBooks Special Sections My Account Pay Bill Suspend Delivery Back Copies Contact Us 2015 Intern Program News Tips Feedback/questions Newsstand Feedback Related Sites AlDiaTX FD GuideLive SportsDayDFW neighborsgo Parade DentonRC.com Findamp;Save Local Shopping The Texas Wedding Guide Design Guide Texas Top Doctors Site Map About Us Careers Advertise Subscribe Contact Us Privacy Policy Terms of Service My Account FAQ (c)2016 The Dallas Morning News Inc. All Rights Reserved. Powered by the Parse.ly Publisher Platform (P3).",http://www.dallasnews.com/entertainment/movies/reviews/20110525-kung-fu-panda-2-b-.ece,200,kungfupanda26,kungfupanda2,dallasnews
