review,link,status_code,id,movie_key,critic
"Kung Fu Panda 2 Review and Showtimes Jack Black in Kung Fu Panda 2 Homepage Todays Paper Homepage Post TV Politics Opinions Local Sports National World Business Tech Lifestyle Entertainment Classifieds Jobs Real Estate Events GoingOutGuide Movies Username Sign in Subscribe Home Delivery | Digital Kung Fu Panda 2 Find x Showtimes x Current Location Share Share on Facebook Share on Twitter Share by Email Share on Pinterest Share on Google Plus Share on Tumblr Add to Go Out List Print 0 0 Kung Fu Panda 2 0 0 Trailer Critic rating | MPAA rating PG A satisfying if less than sensational sequel. Starring Jack Black Dustin Hoffman Angelina Jolie Director Jennifer Yuh Nelson Running time 131 Release Opened May 26 2011  Editorial Review Kung Fu Panda 2By Michael OSullivanThursday May 26 2011Its finally here. At long last comes the second installment of the summer film weve all been waiting for -- the story of a dark prophesy an orphaned boy-hero and his showdown with an evil nemesis.No not ""Harry Potter and the Deathly Hallows Part 2."" Its ""Kung Fu Panda 2.""In the satisfying if less than sensational sequel to the funny charming and action-packed animated feature from 2008 Po the panda (voice of Jack Black) returns in pursuit of inner peace the defeat of a murderous peacock (Gary Oldman) and the truth about what happened to his real parents. What? You didnt actually think that Mr. Ping (James Hong) the noodle-making Chinese goose from the first movie who raised Po as his son was actually our heros biological father did you? We need to talk.There always was that nagging -- and much commented on -- genetic impossibility at the heart of the original ""Kung Fu Panda"" How on Earth could a waterfowl have spawned a giant 250-pound bear cub? Daddys a bird for crying out loud. The new movie puts that question to rest. Its both a story about Pos search for his origins and a reckoning with the bad guy responsible for Pos identity crisis (Oldmans Voldemort-like Lord Shen). All this is set up in a beautifully drawn but harrowing prologue that shows Lord Shen -- in response to a prophesy that he will one day be defeated by an unnamed black-and-white hero -- attempting to slaughter all the pandas in the world in an effort to clear the way for world domination. Apparently he missed one.Call Po ""The Panda Who Lived."" And yes ""Kung Fu Panda 2"" is a little darker and a little more intense than the first film especially for very young viewers.Not that there arent some laughs too though Po is a little less physically inept and emotionally insecure this go-round having spent the last film mastering the art of kung fu. And its nice to see his menagerie of martial-artist animal friends reunited including Tigress (Angelina Jolie) Mantis (Seth Rogen) Monkey (Jackie Chan) Crane (David Cross) and Viper (Lucy Liu) known as the Furious Five. Dennis Haysbert also makes a welcome addition as a bovine kung fu master as do Jean-Claude Van Damme as a crocodile and Michelle Yeoh as a bearded soothsaying goat.Pos personal history notwithstanding the story offers little in the way of bombshells except for a surprise ending that holds out the promise of a ""Kung Fu Panda 3."" Visually however theres more TNT. Made in 3-D unlike the first film the sequel boasts eye-popping scenes of battle and the fiery furnace of Lord Shens workshop where he has built a powerful weapon against which kung fu is no match.Gorgeously animated the movie is a consistent pleasure to watch even if the outcome of Pos adventures feels like a prophesy that any one of us could have foretold. Contains martial arts action and some violence. Want to go? 0 Been there? 0 Rate it 0 Share Recently Reviewed Creative Control Eye in the Sky Hello My Name Is Doris KTown Cowboys Miracles from Heaven Remember The Bronze The Confirmation The Divergent Series Allegiant The Divergent Series Allegiant The IMAX Experience Embrace of The Serpent (El abrazo de la serpiente) Knight of Cups Top Kung Fu Panda 2 Find x Showtimes x Current Location Share Share on Facebook Share on Twitter Share by Email Share on Pinterest Share on Google Plus Share on Tumblr Add to Go Out List Print 0 0 Going Out Guide Home Restaurants Bars amp; Clubs Movies Trailers In Theaters Coming Soon Critics Picks Top Box Office Events Music Museums Theater amp; Dance Visitors Guide Follow Us Homepage | Sign in | Talk to Us | Newsletters Copyright (c) 2016 The Washington Post x Share on Facebook Share your Want to go and Been there lists with Facebook friends. See where your friends want to go or where theyve been and make plans together Connect with facebook No thanks - maybe later. Close x You must be logged in to use that feature. Login x Submit your review Alert The following underlined text is not permitted Title your review Choose a star rating Alert The following underlined text is not permitted Leave a review 0 of 750 Characters. HTML and URLs are prohibited Post to Facebook Thank you for submitting the review. Cancel Submit x Request Removal of a User Review You have chosen to submit a user review for possible removal by our editorial staff due to its offensive or inappropriate nature. Please confirm that you would like the review submitted for evaluation. If our editors find that the review does not fall within our user review guidelines then it will be removed promptly. The user review that you selected has been submitted for evaluation by our editors. It usually takes us about 5-7 days to evaluate a review.Thanks for the notification Submit For Evaluation Close x E-mail This Going Out Guide Profile to a Friend Kung Fu Panda 2 Send This Profile to Enter the e-mail address of the recipient(s) separated by commas. Please limit to 10 recipients. Your E-mail Address Add a Personal Message (Optional) - max 150 chars HTML tags will be stripped Your email has been sent. Close Submit x Sign me up for these weekly newsletters Please choose at least one newsletter. Eats amp; Drinks Movies Going Out Guide events With the Kids Subscribe x Subscribe newsletters Cancel x Share Twitter Email Facebook Pinterest Google plus Tumblr Add to Go Out List Print Close x Alert Please enter a keyword in the search box OK","http://www.washingtonpost.com/gog/movies/kung-fu-panda-2,1158871.html",200,kungfupanda20,kungfupanda2,washingtonpost
Kung Fu Panda 2 (2011) directed by Jennifer Yuh | Film review Go to the content Go to the footer Time Out London London Popular cities London New York Paris Chicago Los Angeles Browse all cities Time Out London Close London Change city London Popular cities London New York Paris Chicago Los Angeles Browse all cities Tickets Offers Things to Do Restaurants Bars amp; Pubs Film Theatre Art Music Attractions Blog Theatre Tickets Shopping Offer of the Day Time Out Card Time Out Escapes Time Out Live Hotels Nightlife Music festivals Events amp; Festivals Kids Museums Clubs Comedy Food amp; Drink Classical Music amp; Opera Dance LGBT City Guide Area Guides Property Competitions Dating Close My Time Out Things I love My lists My Profile My Account Sign out Sign in Create account Sign in With your social account Or with your email Email Password Remember me Forgotten your password? Sign in You can create a Time Out account in two ways... With a few clicks using your favourite social network Or by entering your details below Email First Name Last Name Create password Repeat new password I accept Time Outs terms of use including opt-in to newsletters. Create account Welcome  You have successfully connected your account to Time Out. You may sign in with this account in future. Please confirm your account details Email First Name Last Name I accept Time Outs terms of use including opt-in to newsletters. Sign up My Account Sign in or Create account Search Tickets Offers Things to Do Restaurants Bars amp; Pubs Film Theatre Art Music Attractions Blog Theatre Tickets Shopping Offer of the Day Time Out Card Time Out Escapes Time Out Live Hotels Nightlife Music festivals Events amp; Festivals Kids Museums Clubs Comedy Food amp; Drink Classical Music amp; Opera Dance LGBT City Guide Area Guides Property Competitions Dating More Search Kung Fu Panda 2 Film  Action and adventure 3 out of 5 stars 4 out of 5 stars (2 user reviews) 0 Love It Save it 1/22/2 2 Add review 0 Love It Save it Time Out says 3 out of 5 stars Details Find a cinema Users say (2) 4 out of 5 stars Time Out says 3 out of 5 stars Back in 2008 when the first Kung Fu Panda hit cinemas Jack Black was the loveable hero of School of Rock and Nacho Libre the cuddly comic superstar whose cosy off-the-cuff charm seemed a perfect fit for an animated family-friendly blockbuster about a portly panda with martial-arts ambitions. Three years later Black is the tiresome unfunny bore of Year One and Gullivers Travels his schlubby semi-improvised shtick grown stale. Could overfamiliarity take the sweet edge off our once-loveable hero Po?Luckily for Black most of his target audience is too young to care unlike many modern animations Kung Fu Panda 2 is aimed squarely at pre-teens with few of the ironic asides which have become fashionable in the post-Shrek marketplace. There are some dark touches - the biblically inspired backstory of peacock villain Shen (Gary Oldman) is really rather nasty - but overall this is a kid-friendly romp with mercifully few pretensions.The setting once again is a lost kingdom of medieval China mysteriously colonised by a global menagerie of random animals (gorillas antelope wolves even a rhino) with Californian accents. We find Po still honing his martial arts skills under the direction of diminutive Yoda wannabe Master Shifu (Dustin Hoffman) but his quest to find inner peace is interrupted by the evil ambitions of once-proud peacock princeling Shen on a mission to reclaim the throne by any means necessary. But our hero wont be able to defeat Shen or achieve true kung-fu focus until he learns the truth of what happened to his parents.Its this emotionally resonant subplot which is the films most memorable aspect Pos troubled but loving relationship with his adoptive dad Ping voiced wonderfully by James Hong is warm and wholly believable.And while Pos quest for his roots occasionally slows the action it pays off in a rewardingly melodramatic finale. Elsewhere the story is a mite haphazard Shens motives and methods are never entirely clear while our heroes plans to thwart him remain equally obscure. The smaller characters are often underdeveloped particularly Pos karate compadres the Furious Five. And while Po is a sympathetic hero Blacks freewheeling vocal mannerisms do begin to grate.But any such concerns go out the window once the action kicks off while the 3D rendering may make things a little fuzzy around the edges first-time director Jennifer Yuh handles the big set-pieces - notably a breathlessly paced cart chase through the streets of the capital city - with confidence. The result is a solid slice of summer entertainment forgettable perhaps but plenty of fun while it lasts. By Tom Huddleston Posted Tuesday June 7 2011 Details Release details Rated PG Release date Friday June 24 2011 Duration 90 mins Cast and crew Director Jennifer Yuh Find a cinema Search 1 cinema showing Kung Fu Panda 2 View as map View as list Westfield VueWestfield Vue Westfield Shopping Centre London W12 7GF SunJul 311000amTueAug 21000amThuAug 41000amSatAug 61000amMonAug 81000amWedAug 101000amFriAug 121000amSunAug 141000amTueAug 161000amThuAug 181000am1 Users say (2) 4 out of 5 stars Average User Rating3.1 / 5Rating Breakdown5 star04 star13 star12 star01 star0LiveReviews|21 person listeningSign inWrite reviewMost helpfulMost helpfulHighest ratingLowest ratingNewestOldestLoadingundefinedNew CommentsRefreshJul 7 2011JoeFeaturedGood and funny cartooonFlagShareHelpful?Yes|NoReplyJun 13 2011scrumpyjackFeaturedToo dark and not funny. About 30 sec of good 3D means 2D will do fine. Frantic wall to wall action (must have been 50 kids in cinema - not a peep) and beautiful animation (when light) earns it a skin of teeth 6/10 it aint one that will be remembered.FlagShareHelpful?Yes|NoReplyShow More Share Tweet 0 Shares Top About us Work for Time Out Privacy policy Cookie Policy Website terms of use Contact us Time Out for business Get listed Claim your listing Premium Profiles Advertising Time Out products Time Out Card Mobile apps Time Out Shop Time Out Guides Time Out Travel Time Out Offers Time Out Worldwide Time Out magazine Where to get Time Out magazine Subscribe to Time Out magazine Manage my subscription Follow us Facebook Twitter Youtube Instagram Pinterest Spotify Time Out London Site map },http://www.timeout.com/film/reviews/89558/kung-fu-panda-2.html,200,kungfupanda21,kungfupanda2,timeout
"Kung Fu Panda 2 | Reelviews Movie Reviews Out now Cher Harold Rosson Eva Green Benjamin ... Home Video Views ReelThoughts Currently in Cinema ReelViews Library Login Specials My Books Array ( [page] =gt; reelviews [view] =gt; kung-fu-panda-2 ) Kung Fu Panda 2 (United States 2011) May 28 2011 A movie review by James Berardinelli The average animated sequel is content to apprehend the successful elements from its predecessor and regurgitate them. The result no matter how enjoyable often drips with an overly familiar precipitation. Dreamworks biggest animated franchise Shrek suffered mightily from this problem. Thankfully the creative team behind the Kung Fu Panda movies has elected to move the series in a different direction. Kung Fu Panda 2 brings back nearly the entire cast of characters from the first movie but instead of recycling the original storyline screenwriters Jonathan Aibel amp; Glenn Burger and first-time director Jennifer Yuh use this opportunity to expand the main characters back story and explore some dark corners and crevices of the world in which these talking animals exist. The production is still family-friendly and includes the kind of easily accessible humor many kids (and more than a few adults) love about animated fare but theres no getting away from some of the adult themes that crop up. This is the most mature animated feature since Rango. At the end of Kung Fu Panda panda bear Po (voice of Jack Black) came into his birthright as the Dragon Warrior. As Kung Fu Panda 2 begins he is continuing his training under the tutelage of Master Shifu (Dustin Hoffman) whose latest lesson about finding ""inner peace"" is eluding Po. Accompanied by the Furious Five - Tigress (Angelina Jolie) Mantis (Seth Rogen) Monkey (Jackie Chan) Viper (Lucy Liu) and Crane (David Cross) - Po sets out on a mission to foil a group of bandits terrorizing a nearby village. The bad guys are after the metal needed by their diabolical master Lord Shen the peacock (Gary Oldman) whose Weapon of Mass Destruction requires it. In addition to having an unquenchable thirst for world domination Shen is deathly afraid of pandas; his soothsayer (Michelle Yeoh) has prophesied he will be killed by one. So many years ago in an act possibly inspired by King Herod he attempted genocide of the entire panda population. When he learns that the Furious Five is led by one who got away he makes it his number one goal to capture and eliminate Po. The biggest narrative exploration of Kung Fu Panda 2 is to explain how Po ended up as the son of a noodle restaurateur goose. This story which is told via snatches of flashbacks is laced with tragedy. It also emphasizes the movies central theme of accepting oneself. Kung Fu Panda 2 also notes that the concepts of ""parents"" and ""family"" have less to do with genetics than with love and nurturing. These ideas may lack the sophistication one finds in Pixar films but they will resonate with many younger members of the audience. Jack Black once again shows his excellence as a voice actor. His rendering of Po is more likeable and less cartoonish than many of his live-action characters (including Gulliver in last years misfire Gullivers Travels). This may have something to do with the respect shown to Po by the screenplay which identifies with him rather than attempting to make him the butt of every joke. Black is complemented by a cast of mostly well-known faces. Theres some platonic (with possible future romantic implications) chemistry between Po and Angelina Jolies Tigress who like Po enjoys the introduction of a back story. Gary Oldmans voice alone makes Shen a malevolent entity. Dustin Hoffmans Master Shifu barely sounds like the actor; the same cannot be said of Seth Rogens Mantis. (Shouldnt he be playing a hornet?) Visually the movie is as good as any animated endeavor out there. Having seen Kung Fu Panda 2 in 2-D I cant comment about the 3-D effects but I can state the way I saw it offered a bright colorful palette that would have lost some of its luster when seen through a lens darkly. In additional to the usual manner of digital animation Yuh employs hand-drawn imagery (or an excellent facsimile) for many of the flashback scenes and a ""stick puppet"" style to present narrative background. Its a fun movie to look at especially without the encumbrance of the 3-D glasses. (In fairness to Dreamworks it should be noted that they have been at the forefront of making animated 3-D movies watchable surpassing even Pixar. Their How to Train Your Dragon remains the Avatar of animated 3-D.) Kung Fu Panda 2 ends with what assumes is a direct lead-in to Kung Fu Panda 3. Normally this sort of thing makes me cringe but if the same care to expand the canvas is lavished upon the next installment of this franchise the second sequel might be worth awaiting with anticipation rather than trepidation. Kung Fu Panda 2 (United States 2011) Director Jennifer Yuh Cast (voices) Jack Black Jean-Claude Van Damme Michelle Yeoh Dustin Hoffman David Cross Lucy Liu Jackie Chan Seth Rogen Gary Oldman Angelina Jolie Dennis Haysbert Screenplay Jonathan Aibel amp; Glenn Berger Cinematography Music John Powell Hans Zimmer U.S. Distributor Dreamworks Run Time 130 U.S. Release Date 2011-05-26 MPAA Rating ""PG"" Genre ANIMATED Subtitles none Theatrical Aspect Ratio 2.351 Comments Add Comment Three...better movies of this genre Beauty and the Beast (1991) Shrek (2001) Lion King The (1994) worse movies of this genre Quest for Camelot The (1998) Happily NEver After (2007) Ant Bully The (2006) Three...better movies of (voices) Jack Black Kung-Fu Panda (2008) (There are no more better movies of (voices) Jack Black) worse movies of (voices) Jack Black (There are no more worst movies of (voices) Jack Black) Three...better movies of Jean-Claude Van Damme (There are no more better movies of Jean-Claude Van Damme) worse movies of Jean-Claude Van Damme Hard Target (1993) Expendables 2 The (2012) (There are no more worst movies of Jean-Claude Van Damme) Three...better movies of Michelle Yeoh Crouching Tiger Hidden Dragon (2000) Tomorrow Never Dies (1997) Sunshine (2007) worse movies of Michelle Yeoh Mummy The Tomb of the Dragon Emperor (2008) Babylon A.D. (2008) (There are no more worst movies of Michelle Yeoh) ReelViews Library Currently in Cinema Writings Fictional Writings ReelThoughts Specials About Privacy Policy Terms and Conditions Contact Website credits",http://www.reelviews.net/php_review_template.php?identifier=2314,200,kungfupanda22,kungfupanda2,reelviews
