review,link,status_code,id,movie_key,critic
"Legends Of Oz Dorothys Return  Film Review Legends Of Oz saddles Dorothy with a team of unworthy replacements  Movie Review  The A.V. Club Film TV Club Music Comedy Books Games Aux More Legends Of Oz saddles Dorothy with a team of unworthy replacements Most Read A.V. Club Most Read 1 Guardians Of The Galaxy Posted Jul 30 Marvel might only be making one Infinity War movie now 2 Westworld (1973) Posted Jul 30 HBO sets a date for the robot cowboy uprising to begin 3 (Graphic Nick Wanserski) Posted Jul 30 The best books of 2016 so far The A.V. Clubs catch-up guide 4 Photo Warner Bros. Posted Jul 30 Lights Out director David Sandberg defends the ending of his horror hit Film TV Club Music Comedy Books Games Aux Newswire Reviews Video Great Job Internet Film TV Club Music Comedy Books Games Aux Newswire Features Reviews Videos Great Job Internet The Latest From Newswire HBO programming president Casey Bloys at the 2016 Television Critics Association Summer Tour at The Beverly Hilton (Photo by Jeff Kravitz/FilmMagic/Getty Images) HBO exec Casey Bloys on the future of Curb Deadwood and Jon Stewart Guardians Of The Galaxy Marvel might only be making one Infinity War movie now The Latest From Features (Graphic Nick Wanserski) The best books of 2016 so far The A.V. Clubs catch-up guide American jazz vocalist Michael Franks at SIR studios in NYC. (Photo Oliver Morris/Getty Images) Jazz-inflected yacht rock word lists and pop-culture nerdery The Latest From Reviews B- Photo Cinema Asia Releasing League Of Gods offers the deadly farts of a six-armed baby in dazzling 3-D B+ Mike Kinsella (Photo Shervin Lainez) On The King Of Whys Owens the best its ever been The Latest From Videos Chasing Jason Bourne and catching up with Woody Allen Comedian Damien Lemon likes his weed to have a heroic backstory The Latest From Great Job Internet (Screenshot YouTube) Watch David Cross wound himself with increasingly brutal hot wings Democratic nominee President Hillary Clinton waves to the crowd following her acceptance speech at the Democratic National Convention in Philadelphia on Thursday July 28 2016. (Photo Bill Clark/CQ Roll Call) Read This Hillary Clinton knows her Hamilton so chill All Recent Browse Our Features Coming Distractions Savage Love Facebook Twitter Tumblr Film Movie Review Legends Of Oz saddles Dorothy with a team of unworthy replacements By Kevin McFarland May 9 2014 1130 AM D Share Tweet D Legends Of Oz Dorothys Return Director Will Finn Dan St. Pierre Runtime 88 minutes Rating PG Cast Lea Michele Dan Aykroyd Jim Belushi Kelsey Grammer Community Grade (2 Users) A A- B+ B B- C+ C C- D+ D D- F Your Grade A A- B+ B B- C+ C C- D+ D D- F ? Our Community Grading Tool is in beta. Send Feedback. Share Tweet Since all of L. Frank Baums Oz novels are in the public domain there have been countless continuations and adaptations of the series with varying degrees of separation from canon to apocrypha. Legends Of Oz Dorothys Return--based on Dorothy Of Oz a 1989 novel by L. Frank Baums grandson Roger S. Baum and the first in a series intended for younger readers--makes for an odd choice as a computer-animated feature film adaptation. Sure it features the characters everyone cares about Dorothy Gale (Lea Michele) Scarecrow (Dan Aykroyd) Tin Man (Kelsey Grammer) and Lion (Jim Belushi). But theyre altered for the worse and stranded apart from one another for a story that has precious little message other than ""beware of obvious hucksters."" In Oz the now-genius Scarecrow works with Lion (hes dropped the ""cowardly"" and gained a crown) and an over-emoting Tin Man to send an emergency message from Emerald City to Dorothy. An evil Jester (Martin Short) threatens to take over Oz and hes turning beloved (yet unfamiliar) characters into puppets with a magic wand a ret-conned possession leftover from the Wicked Witch Of The West.Dorothy awakens in Kansas after another twister--one that destroys the Gales house and the surrounding town yet somehow didnt merit a retreat to the storm cellar. After a slimy and questionably credentialed insurance appraiser (Short again because there must be a real-world villain parallel in Oz stories) shows up to condemn all the houses in town and coerce their owners to quickly sign them away and vacate the Gales resign themselves to selling and moving. As Dorothy rues her inability to fix everything she and Toto are whisked back to Oz via a moving rainbow (why not?) though not to Emerald City. Instead of her familiar companions a new group joins Dorothy on her journey of rediscovery Wiser (Oliver Platt) a flightless chatterbox owl; Marshal Mallow (Hannibals Hugh Dancy) a marshmallow soldier from Candy County; and Dainty China Princess (Megan Hilty) the... princess of Dainty China Country. Casting a legitimately prodigious Broadway talent like Michele in an iconic role like Dorothy is a no-brainer but problems abound from the rushed beginning all the way through the impossibly resolved ending. Instead of traveling through an Oz that even somewhat resembles one familiar to anyone versed in the MGM classic Dorothy and her new cadre wander through what is essentially a mash-up of Candyland and the Mad Hatters tea party. The Jester like his human counterpart has only a tenuous foundation as a villain. Hes the Wicked Witch Of The Wests brother who was forced to serve as her downtrodden fool and now... hes inexplicably evil. The new characters are as weakly drawn as the old guard--who are locked up by the jester for most of the movie and sorely missed. Formidable as the cast list looks on paper the voice acting reeks of cash grabs and the performances are way off (Grammers Tin Man in particular). Not a single one of the grating songs is likely to be remembered after the credits roll. At one point as Dorothy and Wiser stuff their faces full of candy due to some nefarious sign-changing from the Jester Short sings a seemingly never-ending list of candy names that does absolutely nothing but stretch out the tune to an acceptable length.The land Dorothy visits in Legends is not the merry old land of Oz--its a retread as flimsy as cotton candy. NBCs gamble on broadcasting a live staging of The Sound Of Music paid off so well that Fox is already giving Grease the same treatment. But the only good thing to come from Legends Of Oz is the idea that perhaps once Glee concludes its final season and that long-rumored Funny Girl revival is complete someone will cast Lea Michele as Dorothy in a worthier musical adaptation of Baums material. Share Tweet Filed Under Film The Wizard Of Oz Lea Michele More Movie Review Previous Movie Review May director Lucky McKee takes another misstep with All Cheerleaders Die Next Movie Review Horses Of God sharply dramatizes a real-life terrorist attack Dont miss a story--follow The A.V. Club on Cant see comments? Please enable JavaScript to view the <a href=""http//disqus.com/?ref_noscript""> comments powered by Disqus. </a> More Movie Review League Of Gods offers the deadly farts of a six-armed baby in dazzling 3-D Jul 30 2016 1022 AM Philip Roths Indignation becomes a character study worth examining Jul 28 2016 900 AM A former football pro documents his struggle with ALS in Gleason Jul 28 2016 1200 AM A woman fights to hold on to her career on Wall Street in Equity Jul 28 2016 1200 AM A.V. Club Most Read 1 Guardians Of The Galaxy Posted Jul 30 Marvel might only be making one Infinity War movie now 2 Westworld (1973) Posted Jul 30 HBO sets a date for the robot cowboy uprising to begin 3 (Graphic Nick Wanserski) Posted Jul 30 The best books of 2016 so far The A.V. Clubs catch-up guide 4 Photo Warner Bros. Posted Jul 30 Lights Out director David Sandberg defends the ending of his horror hit Sign up for news Daily Newsletter Highlights from The A.V. Club Whats On Tonight A daily update on the world of TV Submit Links and such All Recent Browse Our Features Coming Distractions Savage Love Contests RSS About Us Contact Advertise Jobs Privacy Policy Our Partners Hitfix Mental Floss Oh My Rockness Uproxx Upworthy Vice (c) Copyright 2016 Onion Inc. All Rights Reserved.",http://www.avclub.com/review/legends-oz-saddles-dorothy-team-unworthy-replaceme-204457,200,legendsofozdorothy'sreturn0,legendsofozdorothy'sreturn,avclub
Legends of Oz Dorothys Return | EW.com Skip to main content Sign In Log Out TV TV Recaps Movies Music Books Gaming Video Big Brother Queen of the South Mr. Robot Wayward Pines Suits Tyrant Shop Newsletter Subscribe Get 1 year for 25 Save 86% off the cover price SUBSCRIBE More Great Stuff Comic-Con Hulu Hot List 50Scoops EW Popfest For Your Consideration Jess Cagle Interview Stage Follow EW EW on Facebook EW on Twitter EW on Tumblr EW on Instagram About EW Contact UsCustomer ServiceAbout UsJobs at Time Inc.AdvertisePrivacy PolicyYour California Privacy RightsAd ChoicesNewslettersSubscribeTerms of ServiceSite Map Copyright 2015 Entertainment Weekly Inc. All rights reserved. Login Log out TV TV Recaps Movies Music Books Gaming Video More... TV This Weeks Cover The Walking... TV Exclusive Photos of The Walking... EW POPFEST Get the details 50Scoops50Days Exclusive... Movies Crazy Stupid Love Before Th... Movies The Most 2000s Fashion From Joh... Movies 27 Great Revenge Movies Movies Alice in Wonderland Witticism... Movies John Tucker Must Die Where Ar... Books 15 Captivating International Cri... Movies Planet of the Apes See the Fa... Movies Toronto Film Festival 2016 See... TV One Tree Hill Where Are They... Movies Little Miss Sunshine Where Ar... Books Harry Potter and the Cursed Chi... Movies Comic-Con 2016 See Portraits of... TV Friends See the Casts Evolut... TV Comic-Con 2016 Get Batty With... Movies The Dark Tower Storybook Steph... News Comic-Con 2016 Star Portraits... TV 10 of the Best Moments From The... Movies The Dark Tower Storybook Steph... Movies Thelma and Louise See Rare Behi... Movies 9 of Garry Marshalls Best Movies Movies Every Star Trek Movie Ranked Movies Big Trouble in Little China... Movies The Dark Tower Exclusive Firs... Movies Suicide Squad Before They Wer... Movies The 10 Best Movies of 2016 (So Far) TV Fear the Walking Dead introduc... Movies Legends of Oz Dorothys Return by Adam Markovitz  amrkvtz Share Tweet Share on Google+ Share on Pinterest Share on Tumblr Legends of Oz Dorothys ReturnAs unnecessary uninspired Wizard of Oz revivals go (see also Oz The Great and Powerful Return to Oz the Wicked Witch parts...Legends of Oz Dorothys ReturnPT88MAs unnecessary uninspired Wizard of Oz revivals go (see also Oz The Great and Powerful Return to Oz the Wicked Witch parts...2014-06-03Clarius Entertainment Share Tweet Share on Google+ Share on Pinterest Share on Tumblr UNMAGICAL Can the wizard give us those 88 minutes of our life back? (Weinstein) C Legends of Oz Dorothys Return Starring Dan Aykroyd Kelsey Grammer Lea Michele; Director Will Finn; Release Date Wide 05/09/2014; Runtime (in minutes) 88; Distributor Clarius Entertainment Posted June 3 2014 -- 1200 AM EDT As unnecessary uninspired Wizard of Oz revivals go (see also Oz The Great and Powerful Return to Oz the Wicked Witch parts of Once Upon a Time) this 3-D animated off-brand tale isnt exactly wicked -- its just a little short on brains. Dorothy (voiced by Lea Michele) is now a cowboy-booted country girl fighting to keep her familys home in Kansas and shes teleported back to Oz by the Scarecrow (Dan Aykroyd) Lion (Jim Belushi) and Tin Man (Kelsey Grammer) to rescue Glinda (Bernadette Peters) from the grips of the evil Jester (Martin Short). On her way to the Emerald City Dorothy runs into a slew of new Ozzies including an oversize owl named Wiser (Oliver Platt) the brave and squishy Marshal Mallow (Hugh Dancy) and a snooty China Princess (Megan Hilty) whose royal fortification -- a literal great wall of China -- is one of the movies best throwaway gags. Based on the book Dorothy of Oz by Roger Stanton Baum (great-grandson of Oz creator L. Frank Baum) and featuring so-so original music by Bryan Adams and co-writer Jim Vallance Legends should serve its presumed purpose of hypnotizing kids. Its rainbow-hued animation is like a CG Candy Land board come to computerized life. But theres barely a trace of the magic of 1939s The Wizard of Oz; the bricks are still yellow but the road doesnt lead anywhere special. C Share Tweet Share on Google+ Share on Pinterest Share on Tumblr Top Stories Sarah Jessica Parker New HBO show isnt Sex and the City HBO announces re-run premiere date for The Larry Sanders Show Stranger Things cast and fans scared with even Stranger prank HBO defends violent content as critics complain Nick Cannon says he was hit with Mariah Carey diss on Wild N Out True Detective not dead yet HBO insists Jimmy Fallon Snapchats Martha Stewarts cooking on The Tonight Show Photo Galleries 50Scoops50Days The Latest in Fall TV News The Biggest Moments From the 2016 Conventions Crazy Stupid Love Before They Were Stars The Most 2000s Fashion From John Tucker Must Die Exclusive Photos of The Walking Dead Season 7 27 Great Revenge Movies Alice in Wonderland Witticisms and Wisdom From the Disney Classic From Our Partners From Our Partners Contact UsCustomer ServiceAbout UsJobs at Time Inc.AdvertisePrivacy PolicyYour California Privacy RightsAd ChoicesNewslettersSubscribeTerms of ServiceSite Map Copyright (c) 2016 Entertainment Weekly Inc. All rights reserved. img[data-src] { display none important; },"http://www.ew.com/ew/article/0,,20815286,00.html",200,legendsofozdorothy'sreturn1,legendsofozdorothy'sreturn,ew
Legends of Oz Sincere to the point of boredom - The Globe and Mail Jump to main navigationJump to main content News Search News by eluta.ca Search Jobs at eluta.ca Jobs Login Register 18 Toronto Subscribe Help AdChoices Home News Opinion Business Investing Sports Life Arts Tech Drive Real Estate Film TV amp; Media Books Music Theatre Visual Arts Awards Video Film Reviews Home>> Arts>> Film>> Film Reviews LEGENDS OF OZ DOROTHYS RETURN (2013). (Clarius Entertainment) LEGENDS OF OZ DOROTHYS RETURN (2013).(Clarius Entertainment) Legends of Oz Sincere to the point of boredom Add to ... JOHN SEMLEY Special to The Globe and Mail Published Friday May 09 2014 1200AM EDT Last updated Friday May 09 2014 1200AM EDT Comments AA Classification G Country USA Language English To its credit the 3-D computer-animated musical Legends Of Oz Dorothys Return sidesteps the smirking Shrek-y snark that mars so much kiddie cinema. The Tin Man (Kelsey Grammer) doesnt wear sunglasses or breakdance or anything. Theres no nagging desperate hipness. In its place is an old-timey earnestness sincere to the point of boredom as G-rated Legends charts the quest of Dorothy (Glees Lea Michele) to thwart an evil jester (Martin Short) who wields the powers of the late Wicked Witch. But its short on jokes and hampered by unmemorable musical numbers (including one about building a boat) and the films niceness cant overcome the dopey tedium. AP Photo Video Video Weekend movie pick Even adults will love the Lego Movies humour Report Typo/Error Follow us on Twitter GlobeArts More Related to this Story Hunting for skeletons in black and white Lots of heart in I Used to Be Darker Stage Fright comes up flat as a horror-musical spoof Comments AA In the know Life This woman became a middle-age man magnet. Heres how Life How do I keep peace in the family when money comes up? GLOBE DRIVE Three essential knots for attaching gear to your car Style The best party photos from the Power Ball Report on Pokemon Canadians love it a Pokemaster is crowned Werner Herzog is puzzled The Globe Recommends {{title}} .preloader{displaynone;} Most popular videos >> News Trump Clinton should have congratulated me for making history News Bad boy Justin beaver terrorizes B.C. town News I know a con when I see one Bloomberg calls on DNC to unite in opposition to Trump Life Make this juicy and delicious tomato salad tonight Report on Business What age is a good retirement age? Report on Business How do I stop living month to month? News He-said-she-said Contrasting Trump and Clintons convention speeches Report on Business Canadian GDP reliant on real estate Globe Drive Three essential knots for attaching gear to your car Sports Video Meet some of the athletes on the Refugee Olympic Team Report on Business Whats the case for Americans living in Canada to renounce their U.S. citizenship? Report on Business Analyst If Air Canada delivers the results the stock will look after itself <    > Highlights Report on Business Ersatz products leave scent makers nose out of joint Report on Business B.C. credit union banks on a fun workplace More from The Globe and Mail Report on Business Doing business abroad in a volatile world Life How to carb-load the smart way Most popular Meet the wealthy immigrants at the centre of Vancouvers housing debate How to stop Calgary from becoming the next Detroit Forget Brexit This could be Europes biggest crisis yet This woman became a middle-age man magnet. Heres how July 30 Your daily horoscope More Top Stories Toronto Two men shot during morning fitness class at Toronto park Opinion Entrapment verdict Canadas anti-terror strategy found guilty Football Glenn throws two TD passes Alouettes crush Riders Horoscopes July 30 Your daily horoscope Accessories Bungee cables help keep the load off the road Investment Ideas Alphabet and Amazon wind up stellar quarter for U.S. tech big five Video Trump Clinton should have congratulated me for making history Eye-candy experience at NY ice cream museum See inside Teslas new giant factory Canadian GDP reliant on real estate Photos Pope Francis visits Auschwitz death camp in silence X connect with us Products The Globe and Mail Newspaper Newspaper delivered to your doorstep. Subscribe to the newspaper Globe Unlimited Digital all access pass across devices. Subscribe to Globe Unlimited Globe2Go The digital replica of our newspaper. Subscribe to Globe2Go Globe Email Newsletters Get top Globe stories sent to your inbox. Subscribe to email newsletters Globe eBooks A collection of articles by the Globe. View the library Advertise with us GlobeLink.ca Your number one partner for reaching Canadas Influential Achievers. Or go directly to Newspaper Magazine Digital Globe Alliance extend your reach Globe Edge custom content Classifieds The Globe at your Workplace Globe Corporate Sales Globe Unlimited digital edition and Globe2Go e-paper group discounts available. Learn more Corporate financial data and content licensing for your organization. Learn more Or go directly to Report On Business Top 1000 DataStore essential business intelligence Our Company About us Work at The Globe Staff Secure Services Secure Drop Staff PGP Directory Customer Service Contact Us Customer Preference Center FAQs Customer Care website Digital subscription services Print subscription services Change your delivery address Vacation Stops Globe Recognition Special Globe events and offers for subscribers Mobile Apps News NEWS APP Available for download on the following devices iPhone iPad Android Blackberry Other Sections Appointments Art Store Births amp; Announcements Corrections Classifieds Classroom Edition Deaths Newspaper Ads Real Estate Special Reports Site Map Terms amp; Conditions Privacy Policy Disclaimer Accessibility Policy Community Guidelines Globe sustainability Editorial Code of Conduct Globe Arts is part of The Globe and Mails Globe Life Network Copyright 2016 The Globe and Mail Inc. All Rights Reserved. 444 Front St. W. Toronto ON Canada M5V 2S9 Phillip Crawley Publisher Add to Watchlist Add to Watchlist Weve run into a glitch. Please try again later. Weve run into a glitch. Please try again later. x Customize your reading font XS S M L XL The quick brown fox jumps over the lazy dog The quick brown fox jumps over the lazy dog The quick brown fox jumps over the lazy dog The quick brown fox jumps over the lazy dog The quick brown fox jumps over the lazy dog,http://www.theglobeandmail.com/arts/film/film-reviews/legends-of-oz-sincere-to-the-point-of-boredom/article18568901/,200,legendsofozdorothy'sreturn2,legendsofozdorothy'sreturn,theglobeandmail
Legends of Oz Dorothys Return Movie Review (2014) | Roger Ebert,http://www.rogerebert.com/reviews/legends-of-oz-dorothys-return-2014,200,legendsofozdorothy'sreturn3,legendsofozdorothy'sreturn,rogerebert
"Page not found - Chicago Sun-Times Menu Chicago News News Home Crime Education Opinion Transportation Business Chicago Sneed The Watchdogs Homicide Watch Koschman Sports Sports Home Rick Morrissey Rick Telander White Sox Bears Blackhawks Bulls Cubs Outdoors Colleges Fire High School Steve Greenberg Ladd Biro Dale Bowman Jeff Agrest Politics Politics Home Chicago Springfield Washington Lynn Sweet 2016 Candidates Entertainment Entertainment Home Architecture amp; Design Art Games Bill Zwecker Hedy Weiss Rich Roeper Books Things to do Comedy Dance Movies Music Reviews Stage Television Columnists Dale Bowman Rick Morrissey Rick Telander Steve Greenberg Dan Mihalopoulos Jeff Agrest Lynn Sweet Rich Roeper Bill Zwecker Hedy Weiss Neil Steinberg Mark Brown Mary Mitchell Sneed Shia Kapos Opinion Opinion Home Editorials Letters to the Editor 2016 Candidates S. E. Cupp Madeleine Doubek John Fountain Marlen Garcia Jesse Jackson Gene Lyons Sue Ontiveros Andy Shaw Roger Simon Laura Washington Other Views Lifestyles Lifestyles Home 80 Destinations Mid West Travel Horoscopes Relationship Advice Dear Abby Obits Local Obits Obits Local Obits Classifieds Classifieds Real Estate Autos Jobs Monster Subscribe Manage Account Subscriptions Newsletters Todays E-Paper Paper Finder TV Weekly Order Back Issues NIE More Advertise with Us Licensing Order Photos About Us Contact Us About Native Ads Terms of Use Privacy Policy About Our Ads Page Not Found Were sorry but we seem to have lost this page. Back to the Chicago Sun-Times home page. Follow Follow ""Chicago Sun-Times"" Get every new post delivered to your Inbox. Join 411 other followers Build a website with WordPress.com",http://www.suntimes.com/entertainment/movies/27273755-421/legends-of-oz-if-this-animated-knockoff-only-had-a-brain-.html#.U2wvZSjzeSo,404,legendsofozdorothy'sreturn4,legendsofozdorothy'sreturn,suntimes
