review,link,status_code,id,movie_key,critic
"Legends of Oz Dorothys Return Reunites Crew for a Caper - The New York Times NYTimes.com no longer supports Internet Explorer 9 or earlier. Please upgrade your browser. LEARN MORE >> Sections Home Search Skip to content Skip to navigation View mobile version The New York Times Movies|Wicked Witch Is Dead but Here Comes a Jester Advertisement Search Subscribe Now Log In 0 Settings Close search search sponsored by Site Search Navigation Search NYTimes.com Clear this text input Go http//nyti.ms/1ovleRg Loading... See next articles See previous articles Site Navigation Site Mobile Navigation Advertisement Supported by Movies | Movie Review Wicked Witch Is Dead but Here Comes a Jester Legends of Oz Dorothys Return Reunites Crew for a Caper Legends of Oz Dorothys Return Directed by Will Finn Daniel St. Pierre Animation Family Fantasy Musical PG 1h 28m By NICOLAS RAPOLDMAY 8 2014 Continue reading the main story Share This Page Continue reading the main story Photo An animated Dorothy voiced by Lea Michele is summoned to the Land of Oz for a rescue mission with her dog Toto. Credit Clarius Entertainment The maps included with many Oz books promised bookish completists that there was always another little corner of this flip-side world to explore. That sense of imagination is largely absent from ""Legends of Oz Dorothys Return"" a second-rate animated adaptation of a spinoff by Roger Stanton Baum L. Frank Baums great-grandson. Still the films set-piece journey through China Country ruled over by a tiny haughty porcelain princess (a delightful Megan Hilty) is a highlight the picture of a self-absorbed royal hamlet with its own rules and wigs.China Country is one stop on a rescue mission undertaken by Dorothy (Lea Michele of ""Glee"") here a blandly courageous kid whos summoned to save Oz from an evil jester (Martin Short). In addition to her usual trio of pals there are a helpful tubby owl (Oliver Platt) and later a talking tree (Patrick Stewart) that turns into a boat.The owls argyle-pattern chest is a nice touch as is the trees textured grain. But fine details like these must be picked out from among more slipshod visuals much as the one-liners are lost in the wash of generic back-and-forth and weak characterizations. (The bookend Kansas sequences are generally an embarrassment.)The films songs imperfectly staged feel pitched to younger tots uneasily bridging Broadway and a childrens television show. All in all the beloved kingdom of Oz is not well served though theres just enough detectable affection to keep it from feeling like a pure cashing-in.""Legends of Oz"" is rated PG (Parental guidance suggested) for all the perils of a commute from Kansas. Legends of Oz Dorothys Return Directors Will Finn Daniel St. Pierre Writers Randi Barnes Adam Balsam Daniel St. Pierre Stars Lea Michele Kelsey Grammer Dan Aykroyd James Belushi Bernadette Peters Rating PG Running Time 1h 28m Genres Animation Family Fantasy Musical Movie data powered by IMDb.com Last updated Mar 30 2016 Opens on Friday. Directed by Will Finn and Daniel St. Pierre 1 hour 28 minutes A version of this review appears in print on May 9 2014 on page C15 of the New York edition with the headline Legends of Oz Dorothys Return. Order Reprints| Todays Paper|Subscribe Continue reading the main story Were interested in your feedback on this page. Tell us what you think. Whats Next Loading... Go to Home Page >> Site Index The New York Times Site Index Navigation News World U.S. Politics N.Y. Business Tech Science Health Sports Education Obituaries Todays Paper Corrections Opinion Todays Opinion Op-Ed Columnists Editorials Contributing Writers Op-Ed Contributors Opinionator Letters Sunday Review Taking Note Room for Debate Public Editor Video Opinion Arts Todays Arts Art amp; Design Books Dance Movies Music N.Y.C. Events Guide Television Theater Video Arts Living Automobiles Crossword Food Education Fashion amp; Style Health Jobs Magazine N.Y.C. Events Guide Real Estate T Magazine Travel Weddings amp; Celebrations Listings amp; More Classifieds Tools amp; Services Times Topics Public Editor N.Y.C. Events Guide Blogs Multimedia Photography Video NYT Store Times Journeys Subscribe Manage My Account Subscribe Subscribe Times Insider Home Delivery Digital Subscriptions Crossword Email Newsletters Alerts Gift Subscriptions Corporate Subscriptions Education Rate Mobile Applications Replica Edition International New York Times Site Information Navigation (c) 2016 The New York Times Company Home Search Accessibility concerns? Email us at accessibilitynytimes.com. We would love to hear from you. Contact Us Work With Us Advertise Your Ad Choices Privacy Terms of Service Terms of Sale Site Information Navigation Site Map Help Site Feedback Subscriptions",http://www.nytimes.com/2014/05/09/movies/legends-of-oz-dorothys-return-reunites-crew-for-a-caper.html?partner=rss&emc=rss,200,legendsofozdorothy'sreturn5,legendsofozdorothy'sreturn,nytimes
"Legends of Oz Dorothys Return a creepy charmless reboot review | Toronto Star SectionsSearch the print archivesSectionsEntertainmentMoviesLegends of Oz Dorothys Return a creepy charmless reboot reviewA big-name cast singing songs co-written by rocker Bryan Adams cant help creepy-looking animated clunker Legends of Oz Dorothys Return.By Linda BarnardStaff ReporterThu. May 8 2014Legends of Oz Dorothys ReturnAnimated musical comedy featuring the voices of Dan Aykroyd James Belushi Kelsey Grammer Lea Michele Martin Short Hugh Dancy and Patrick Stewart. Directed by Will Finn and Dan St. Pierre. 95 minutes. Opens Friday at GTA theatres. GA big-name cast singing songs co-written by rocker Bryan Adams still cant save animated clunker Legends of Oz Dorothys Return a flat-footed attempt to cash in on the story first told in L. Frank Baums beloved books and 1939 film with a rebooted 3D version.This Emerald City adventure is based on More Adventures of Oz penned in 1989 by Baums great-grandson banker-turned-writer Roger Stanton Baum.Article Continued BelowAlthough the initial action is set in modern-day Kansas there is enough from the original tale of Dorothy including a tornado yellow brick road and her little dog too to make the story familiar. Theres another contemporary update a healthy dose of girl power is injected into Dorothy often called by her full name Dorothy Gale and voiced by Glees Lea Michele.Legends of Oz Dorothys Return is based on a story written by L. Frank baums great-grandson.Co-directed by DreamWorks and Disney animation veterans Will Finn and Dan St. Pierre screenwriters Adam Balsam and Randi Barnes send Dorothy newly returned from Oz right back to the Emerald City on a ""rainbow mover"" dispatched by the Scarecrow (Dan Aykroyd).Scarecrow Tin Man (Kelsey Grammer) and no-longer cowardly lion (James Belushi) need Dorothys help to go up against the power-mad brother of the now melted Wicked Witch Jester (Martin Short bellowing both songs and lines).Creepy computer animation gives the characters both human and fantasy the bizarrely cold sheen of those direct-to-DVD animated works about Barbie and Tinkerbelle. Glinda mechanically voiced by Bernadette Peters looks like a victim of bad plastic surgery.New adventures await for crusading Dorothy as she sets out to save the day but the pace feels off and new sidekicks Wiser (Oliver Platt) an obese over-sharing owl imperious China Princess (Megan Hilty who played Glinda in Broadways Wicked) and helpful tree Tugg (Patrick Stewart) arent going to stick in anyones memory.Hugh Dancy is the exception as the sweet-natured Candy Country officer Marshal Mallow. Not only does he engage with a fine singing voice his shyly big-hearted character nicely blends the heroic and vulnerable.Too bad the jokes arent funny and stirred little reaction in the kid-filled screening. And Jester isnt just mean in the broad sense of cartoon villains; his torment of the flying monkey leader is downright vicious.Devoid of the visual magic and heartfelt emotion of the original film this version of Oz and Dorothy 2.0 feel like the cheaply made knockoffs you find in a dollar store garishly shiny flimsy and not built to last. ""Toto this doesnt look like the Oz I remember"" Dorothy tells her furry sidekick upon her arrival which effectively sums up this charmless cash-grab. The Morning Headlines NewsletterDelivered daily to your inbox.Sign upMore from the Toronto Star amp; PartnersLOADING                                             LOADING                    22degCloseHomeLatest NewsVideoGTABlogsToronto to test mobile ticketing app for island ferryNew way to buy tickets online aimed at cutting down lineups for island ferry.NewsGTACity HallQueens ParkCanadaWorldInvestigationsCrimeBusinessEconomyPersonal FinanceReal EstateYour TorontoSchoolsThe FixerLifeFashion amp; StyleFood amp; WineHealth amp; WellnessHomesParentTechnologyTravelSportsAmateurBaseballBasketballBlue JaysCurlingFootballGolfHockeyLacrosseLeafsOlympicsRaptorsSoccerTennisOpinionCommentaryCorrectionsEditorialsEditorial CartoonPublic EditorReaders LettersEntertainmentBooksMoviesMusicStageTelevisionVisual ArtsDiversionsHoroscopesCrosswordsSudokuComicsWheels.caSpecial FeaturesObituariesClassifiedsTV ListingsHot TopicsDem. ConventionRio OlympicsPokemon GoBlue JaysGeneration 9/11Panama PapersFresh Air FundWeather BlogFollow usFacebookTwitterGoogle+InstagramRSSManage NewslettersSite MapAboutContact UsFeedbackthestar.comFeedbackSite MapNewslettersInsurance HotlineNew in HomesStar StoreCorrectionsBehavioural TargetingTodays NewsFlyersCanadaStaysContestsToronto Star Newspaper Ltd.AboutAtkinson PrinciplesStatement of PrinciplesGet Home DeliveryMy SubscriptionContact UsContact WebmasterFAQNews ReleasesStar InternshipsCareers  the StarStar AdvisersStar ePaperStar TouchAdvertise with UsAdvertising TermsMedia KitSpecial FeaturesInitiativesSanta Claus FundFresh Air FundSpeakers BureauClassroom ConnectionToronto Star ArchivesReport on Community Giving(c) Copyright Toronto Star Newspapers Ltd. 1996 - 2016Privacy PolicyTerms and Conditions",http://www.thestar.com/entertainment/movies/2014/05/08/legends_of_oz_dorothys_return_a_creepy_charmless_reboot_review.html,200,legendsofozdorothy'sreturn6,legendsofozdorothy'sreturn,thestar
"Legends of Oz Dorothys Return review Shoulda stayed in Kansas | Newsday 147686468041 Long Island Sports Entertainment Lifestyle News Business Health Opinion Obituaries Cars Homes Jobs Subscribe Manage Manage my account Preferences Newsletters Subscribe to TV Weekly Subscribe to Newsday Manage my account Subscribe to TV Weekly Todays Paper Todays paper / archives >> Newsday Fun Book >> Recent covers gallery >> Special sections >> Traffic 0 Weather 80deg Log in Log out Sections Home Long Island Top Stories Nassau Suffolk Education Crime Politics Towns Investigations Data and maps Commuting LI Life History Obituaries Sports Top Stories Yankees Mets Islanders Rangers Jets Giants Knicks Nets High school College Columns Videos Scores Baseball Basketball Boxing Football Golf Hockey Horse Racing Media MMA Motor Racing Olympics Soccer Opinion Top Stories Matt Davies Columnists Letters to the editor Submit your letter Business Top Stories Real Estate Technology Cars Columns Mutual funds Markets Stocks Nation and World Nation and World NYC State and Region Health Technology Weird news Lottery Entertainment Top Stories Movies TV Celebrities Music Books Theater Reality TV Crosswords Puzzles Comics Lifestyle Top Stories Restaurants Family Pets Travel Food and Drink Top 100 Restaurants Fashion and Shopping Home and Garden LI Getaways Recreation Retirement Advice Beaches Events Things to do Classifieds Classifieds Jobs Cars Real Estate Yellow Pages Legal Notices Obituaries Crosswords More Todays Paper Weather Traffic and Transit Data and maps Photos Videos Act 2 Horoscopes Advice Columns Lottery Long Island Sports Entertainment Lifestyle News Business Health Opinion Obituaries Cars Homes Jobs MoviesEntertainment Legends of Oz Dorothys Return review Shoulda stayed in Kansas Updated May 8 2014 342 PM By RAFER GUZMAN rafer.guzmannewsday.com + - Dorothy returns to Oz in the animated ""Legends of Oz Dorothys Return"" with the voices of Lea Michele Dan Aykroyd Jim Belushi Kelsey Grammer Bernadette Peters and Martin Short. Photo Credit Clarius Entertainment advertisement | advertise on newsday REVIEW PLOT Dorothy Gale must save Oz from a new villain The Jester. Rated PG (some scary images and mild peril) BOTTOM LINE An uninspired sequel with weird characters generic rock songs and none of the original storys heart. CAST Voices of Lea Michele Dan Aykroyd Martin Short Kelsey Grammer LENGTH 130 More than ruby slippers or poppies the most magical ingredient in the story of Oz was simplicity. Its the reason were all still familiar with a 75-year-old movie ""The Wizard of Oz"" adapted from whats now a 114-year-old novel by L. Frank Baum. The lost little girl and her companions all wishing for powers they already have -- these characters resonate in a way that needs no explanation. Simplicity has been missing from every ""Oz"" sequel since. After all the only way to continue a story is to complicate it. Subsequent screenwriters (and Baum himself) have come up with whimsical new characters like Jack Pumpkinhead from the 1985 flop ""Return to Oz"" and clever new story lines like the Wizards tale in last years ""Oz the Great and Powerful"" but none have had the original storys powerful mythical simplicity. Most popular Seth Meyers live Late Night funny effortless AGT star from LI set for shows quarterfinals Who will Fletcher choose on Bachelorette finale? 3 longtime Sesame Street stars leaving the show Late nights convention takes Who did it best? A new animated movie ""Legends of Oz Dorothys Return"" continues the tradition. Based on a 1989 novel by Baums great-grandson Roger Stanton Baum it begins just as Dorothy Gale (the voice of Lea Michele of Foxs ""Glee"") regains consciousness in her tornado-ravaged house. Within moments however a rainbow-shaped teleporter whisks her back to Oz where years have passed. Scarecrow (Dan Aykroyd) is now a math whiz the Tin Man (Kelsey Grammer) cant control his emotions and the Lion (Jim Belushi) is a blustery brawler. That beloved trio is quickly incapacitated by the evil Jester (a manic Martin Short) leaving Dorothy to find new companions. Ranging from ill-conceived to grotesque they include the mordibly obese owl Wiser (Oliver Platt) a candy soldier named Marshal Mallow (Hugh Dancy) and Dainty China Princess an insufferably privileged 18th century aristocrat (Megan Hilty) whose hollow porcelain body seems almost intended as a Marxist metaphor. Bernadette Peters is the voice of a spaced-out Glinda; Patrick Stewart plays a tree so old he begs to be whittled into a boat. Stiffly animated sluggishly directed (by Daniel St. Pierre and Will Finn) and padded out with generic Broadway-rock tunes co-written by Bryan Adams (yep the one who sang ""Cuts Like a Knife"" in 1983) ""Legends of Oz"" feels like the opposite of the original film. Underneath its aggressive distractions and dim ideas it has no heart. 221 MoviesLegends of Oz trailer PLOT Dorothy Gale must save Oz from a new villain The Jester. advertisement | advertise on newsday RATING PG (some scary images and mild peril) CAST Voices of Lea Michele Dan Aykroyd Martin Short Kelsey Grammer LENGTH 130 BOTTOM LINE An uninspired sequel with weird characters generic rock songs and none of the original storys heart. MoviesSummers must-see movies Sign up for Newsdays Entertainment newsletter Get the latest on celebs TV and more. submit Click here to read or post comments Comments Newsday.com now uses Facebook for our comment boards. Please read our guidelines and connect your Facebook account to comment. You also may be interested in More coverage Guardians of the Galaxy 2014s next big superhero flick 2014 film TV music and theater awards Oscars 2014 Complete coverage Like it? Share it Back to Top Services Subscribe Manage my Newsday Todays paper Join us on Facebook Join us on Twitter Sign up for newsletters Get our Apps Our Network News 12 am New York Newsday Cars The Hometown Shopper Newsday Homes CareerBuilder Optimum Newsday Connect MSG Varsity News Long Island Nassau Suffolk Education Crime Politics Towns NYC U.S. / World Business Technology Commuting History Data and Maps Traffic Obituaries Sports Giants Jets Knicks Nets Islanders Rangers Yankees Mets High school Colleges Columns Scores Videos Photo Entertainment Celebrities Movies TV Music Restaurants Theater Lifestyle Family Shopping Pets Events Travel Books Weekend Guide Beaches Classifieds Jobs Cars Real Estate Yellow Pages More Crossword Weather Photos Videos LI Life Act 2 Lottery RSS Archive Site Map Privacy Policy Your ad choices Terms of Service Subscription Terms Contact Newsday Careers Reprints amp; Permissions Media Kit Advertise with Newsday Help Copyright (c) Newsday. All rights reserved.",http://www.newsday.com/entertainment/movies/legends-of-oz-dorothy-s-return-review-shoulda-stayed-in-kansas-1.7949456,200,legendsofozdorothy'sreturn7,legendsofozdorothy'sreturn,newsday
"Legends of Oz cant find the Yellow Brick Road - The Boston Globe Legends of Oz cant find the Yellow Brick Road - The Boston Globe SubscribeStarting at 99 cents MembersSign In SUBSCRIBE NOW Get unlimited access to Globe.com today Menu SubscribeStarting at 99 cents MembersSign In Movies SubscribeStarting at 99 cents MembersSign In Metro Sports Business amp; Tech Opinion Politics Lifestyle Arts Most popular on bostonglobe.com Based on what youve read recently you might be interested in theses stories Doris Kearns Goodwin talks politics with Stephen Colbert Vote all you want. The secret government wont change. Donald Trump doesnt have a clue about my son A new low for Jill Stein Todays Paper Magazine Obituaries Weather Comics Crossword The Big Picture Digital Access 99 cents a week for the first 4 weeks Subscribe Subscribe Home Delivery Save 50% off the regular rate Subscribe Subscribe Already a subscriber? Members Sign In Digital Access 99 cents a week for the first 4 weeks Subscribe Subscribe Home Delivery Save 50% off the regular rate Subscribe Subscribe Already a subscriber? Members Sign In Movie Review Legends of Oz cant find the Yellow Brick Road E-Mail Share via e-mail To Add a message Your e-mail Facebook Twitter Google+ LinkedIn Comments Print The Boston Globe Tweet Share Clarius Entertainment ""Legends of Oz Dorothys Return."" By Tom Russo Globe Correspondent May 08 2014",http://www.bostonglobe.com/arts/movies/2014/05/08/legends-can-find-yellow-brick-road/KUogtDCcsDlSKEnYySmzON/story.html,200,legendsofozdorothy'sreturn8,legendsofozdorothy'sreturn,bostonglobe
"Dorothys Return is not quite Oz-some | Movie reviews | stltoday.com You are the owner of this article. Edit Article Add New Article Sign Up Log In Dashboard Logout My Account Dashboard Profile Saved items Logout Subscriber services Contact us E-edition Contests Apps Newsletters Obits News Education Election 2016 Databases Columnists Illinois Law and order Metro Nation Obits Political Fix St. Charles Weather Opinion Letters to the editor Columnists Business Top Workplaces Press releases Columnists Sports Cardinals Blues Mizzou Olympics SLU NFL Golf Forums Columnists Chats High schools Schedules Schools Sports Stats Go Entertainment Books Calendar Comics amp; games Dining Music Movies Television Theater amp; arts Columnists Lifestyles Advice Automotive Fashion Food and cooking Health Home and Garden Parenting Religion Travel Columnists Feast Magazine St. Louis Best Bridal Ladue News Multimedia Photos Videos Chats Forums Buy/sell Classifieds Real estate Business Directory Print Ads Newspaper ads Page reprints Autos Jobs Homes Archives Toggle navigation Menu Search Search Log In Using Your Account Log In Dont have an account? Sign Up Today My Account Dashboard Profile Saved items Logout 70deg Saint Louis MO (63101) Today Sun and clouds mixed. High 88F. Winds NW at 5 to 10 mph.. Tonight Mainly clear skies. Low 69F. Winds NNE at 5 to 10 mph. Updated July 30 2016  334 am Full Forecast News Sports Business Go Life Buy/Sell Movie reviews Close Jody Mitori China Princess Dorothy Gale and Marshal Mallow from ""Legends of Oz Dorothys Return."" Dorothys Return is not quite Oz-some By Joe Williams joewilliamspost-dispatch.com 314-340-8344 Joe Williams May 8 2014 (...) Jody Mitori China Princess Dorothy Gale and Marshal Mallow from ""Legends of Oz Dorothys Return."" When most of us watch a movie we pay no attention to the men and women behind the curtain. But especially in an animated film there are minions doing the dirty work one frame at a time. They may not be as important as the director the screenwriter and the actors but sometimes the crews handicraft is the most interesting thing in the film.Case in point ""Legends of Oz Dorothys Return."" This musical toon isnt made for anyone old enough to operate a remote control let alone remember the MGM classic but the dubious discount-bin eye candy could keep the chaperones awake.In the books by L. Frank Baum Dorothy returned to Oz several times but none of the stories was set in the 21st century like this one. Dorothy (voice of Lea Michelle) is still living in tornado-plagued Kansas where the good folks are losing their property to an evil bureaucrat (Martin Short). But before Dorothy can save the farm she gets sucked back over the rainbow by those needy nincompoops the Scarecrow (Dan Akyroyd) the Tin Man (Kelsey Grammer) and the Lion (James Belushi). They need her help to defeat the evil Joker (Short) who has imprisoned the good witch Glinda (Bernadette Peters). In Oz Dorothy and Toto acquire a new set of traveling companions to lead them to the Emerald City flightless bird-brain Wiser the Owl (Oliver Platt) gallant candy-man Marshal Mallow (Hugh Dancy) and tiny diva China Princess (Megan Hilty). When they discover that the Yellow Brick Road has been washed away by floods they float down river on Tugg (Patrick Stewart) the only oak tree in the Haunted Forest who isnt still mad at Dorothy about that apple incident from years ago.Of course there are songs by a motley crew of tunesmiths who include Bryan Adams but except for a showstopper tailor-made for Short they dont make much of an impact. Ditto for the script which is woefully lacking in the kind of wisecracks for grown-ups that make the Pixar and ""Shrek"" movies cross-generational hits. Yet if youre old enough to read this and you find yourself at a screening try thinking about the munchkins who worked so hard on the psychedelic scenery. And if counting Plasticine sugarplums doesnt help pass the 88 minutes click your heels and softly repeat ""Theres no place like home.""What ""Legends of Oz Dorothys Return""  Two stars out of four  Rating PG  Run time 128  Content Some mild peril Joe Williams is the film critic of the Post-Dispatch and the author of the book ""Hollywood Myths."" Follow him on Twitter joethecritic A new Oz puts a twist on Americas favorite story Andrew Lloyd Webber and Tim Rice reunite to update ""The Wizard of Oz"" coming to the Fox Theatre. Tags Wizard Of Oz Legends Of Oz Dorothys Return Lea Michelle Martin Short Joe Williams Joe Williams Joe Williams is the film critic for the St. Louis Post-Dispatch. Follow Joe Williams Close Get email notifications on Joe Williams daily Your notification has been saved. There was a problem saving your notification. Whenever Joe Williams posts new content youll get an email delivered to your inbox with a link. Email notifications are only sent once a day and only if there are new matching items. Save Manage followed notifications Follow Joe Williams Close Followed notifications Please log in to use this feature Log In Dont have an account? Sign Up Today View (...) comments Most popular Old Standard Fried Chicken will close this weekend Smash-and-grab burglars hit original Sweetie Pies location in Dellwood Mellow Mushroom pizzeria opens in Sunset Hills Half-century-old Webster Groves Bookshop is closing Today in Pokemon Go Shootout in Vegas security risk in Israel finding Yuri in Russia Latest Disney movies help autistic boy find his voice in Life Animated Woody Allens Cafe Society is a bittersweet treat A trio of misfit mothers lose control in Bad Moms Jason Bourne is back doing what he does best Eat That Question taps into Frank Zappa Quick links Comics/games Movie times Pop off forum Reel Time movie forum TV listings The Blender Tube Talk Sign up For Go Sneak Peek Pick up this Sundays paper for the Craft Beer Special Section Get your tickets for the St. Louis Post-Dispatch Arts + Craft Brewfest See ads from todays newspaper Manage your services Feast Magazine Ladue News St. Louis Best Bridal STL High School Sports Products and features Apps Archives Calendar Chats Comics amp; games Contests E-edition Forums Newsletters Our events Press releases Tools and services Advertise with us Autos Classifieds Contact us Homes Jobs Newspapers in Education Page reprints Post-Dispatch store Site help Subscriber services (c) Copyright 2016 STLtoday.com 900 N. Tucker Blvd. St. Louis MO | Terms of Use | Privacy Policy Powered by BLOX Content Management System from TownNews.com.",http://www.stltoday.com/entertainment/movies/reviews/dorothy-s-return-is-not-quite-oz-some/article_65346a64-d309-5969-b4fc-a1b0a1a9936c.html,200,legendsofozdorothy'sreturn9,legendsofozdorothy'sreturn,stltoday
