review,link,status_code,id,movie_key,critic
"Million Dollar Arm | Reelviews Movie Reviews Out now Cher Harold Rosson Eva Green Benjamin ... Home Video Views ReelThoughts Currently in Cinema ReelViews Library Login Specials My Books Array ( [page] =gt; reelviews [view] =gt; million-dollar-arm ) Million Dollar Arm (United States 2014) May 16 2014 A movie review by James Berardinelli Movies that arrive in theaters with the tagline ""based on a true story"" often stray far from the historical basis underlying the narrative. As its said ""Never let the facts get in the way of a good story."" Unfortunately in presenting the tale of sports agent J.B. Bernstein (Jon Hamm) and his quest to transform cricket-playing Indians into baseball prospects Disney has taken the skeleton of a potentially worthy motion picture and fleshed it out with an overabundance of feel-good clichA(c)s. The result is sappy saccharine and predictable to the point where its almost painful. Thomas McCarthys screenplay is an example of paint-by-numbers storytelling. When we first meet Bernstein hes down to his last few dollars. The sports agency he started with his partner Ash (Aasif Mandvi) is on its last legs. Their big name clients have all retired and their best chance for a new payday has signed with another agency. Thats when J.B. gets a brainstorm go to India and using a reality show called ""Million Dollar Arm"" to attract contestants find a few good men to bring back to the U.S. and whip into shape for Major League Baseball tryouts. In India with the help of a grumpy old scout (Alan Arkin) J.B. unearths his prospects in Dinesh Patel (Madhur Mittal) and Rinku Singh (Suraj Sharma) but harnessing their talent proves to be a difficult process even for coaching guru Tom House (Bill Paxton). In the end however because this is a Disney sports moviea| well you can guess what happens. Million Dollar Arm isnt completely devoid of value. Even though the overall story and various character arcs are soft-peddled the movie provides some interesting cultural contrasts in a way that evokes the 1986 film Crocodile Dundee. Its a reciprocal situation affecting J.B. in India during the movies first half and Dinesh and Rinku later in Los Angeles. Crocodile Dundee was smarter and funnier but at least give Million Dollar Arm credit for addressing the ""fish out of water"" aspect. That element works better than the awkward romance between J.B. and a female tenant on his property Brenda Fenwick (Lake Bell). I found it odd how little character the country of India displayed even though about 1/3 of the movies scenes transpire there. With the exception of a distant shot of the Taj Mahal the action might as well have transpired in Generic Foreign Country 1. Director Craig Gillespie does little to make India come alive. The film Outsourced about another American coming to India succeeded in part because of an immersive sense of place and culture - qualities mostly absent in Million Dollar Arm. For Jon Hamm this is an opportunity to step away from the character and TV show (Don Draper Mad Men) that have defined him as an actor over the last seven years. Hamm with his leading man looks has little trouble navigating the waters of J.B.s transition from self-absorption to all-around good guy. Disney is selling the movie as the true story of the first two Indians to sign American sports contracts but Million Dollar Arm is more about J.B.s redemption. The two young Indian actors Suraj Sharma (who was the title character in Life of Pi) and Madhur Mittal (who appeared in Slumdog Millionaire) do credible jobs. Alan Arkin and Bill Paxton steal scenes in supporting roles. At two hours in length Million Dollar Arm overstays its welcome. The story as related in this screenplay might have sustained a shorter feature but the one that reaches the screen is bloated and obvious. The movie is typical live action Disney family-friendly and simplistic with nothing controversial and an upbeat ending. Its a little old-fashioned. Unfortunately its also a little boring. Million Dollar Arm (United States 2014) Director Craig Gillespie Cast Jon Hamm Madhur Mittal Suraj Sharma Lake Bell Alan Arkin Bill Paxton Aasif Mandvi Screenplay Thomas McCarthy Cinematography Gyula Pados Music A.R. Rahman U.S. Distributor Walt Disney Pictures Run Time 200 U.S. Release Date 2014-05-16 MPAA Rating ""PG"" Genre DRAMA Subtitles none Theatrical Aspect Ratio 2.351 Comments Add Comment Three...better movies of this genre Cider House Rules The (1999) Maria Full of Grace (2004) Lilya 4-Ever (2003) worse movies of this genre Hole in My Heart A (2005) Neon Demon The (2016) Showgirls (1995) Three...better movies of Jon Hamm Shrek Forever After (2010) Town The (2010) (There are no more better movies of Jon Hamm) worse movies of Jon Hamm Sucker Punch (2011) Day the Earth Stood Still The (2008) Bridesmaids (2011) Three...better movies of Madhur Mittal Slumdog Millionaire (2008) (There are no more better movies of Madhur Mittal) worse movies of Madhur Mittal (There are no more worst movies of Madhur Mittal) Three...better movies of Suraj Sharma Life of Pi (2012) (There are no more better movies of Suraj Sharma) worse movies of Suraj Sharma (There are no more worst movies of Suraj Sharma) ReelViews Library Currently in Cinema Writings Fictional Writings ReelThoughts Specials About Privacy Policy Terms and Conditions Contact Website credits",http://www.reelviews.net/php_review_template.php?identifier=2764,200,milliondollararm0,milliondollararm,reelviews
Million Dollar Arm | Chicago Reader Switch to the mobile version of this page. Newsletters Follow us Twitter Facebook RSS Mobile Username View Profile Edit Profile Log Out Log in Create Account The Chicago Reader News amp; Politics Music Arts amp; Culture Film Food amp; Drink Classifieds Browse News amp; Politics News amp; Politics home page Steve Bogira | Criminal Justice John Greenfield | Transportation Deanna Isaacs | Culture Ben Joravsky | Politics Michael Miner | Media Browse Music Music home page Gossip Wolf In Rotation Record roundups Leor Galil | Music Criticism Peter Margasak | Music Criticism Soundboard Concerts this week Early Warnings Concerts on horizon Browse Film Film home page J.R. Jones | Movie Reviews Index of Long Reviews Film Archive Short Reviews Now Playing Todays Showtimes Browse Arts amp; Culture Arts amp; Culture home page Tony Adler | Theater Justin Hayford | Theater Aimee Levitt | Features Brianna Wellen | Comedy Arts amp; Culture event search Browse Food amp; Drink Food amp; Drink home page Mike Sula | Restaurant Reviews Key Ingredient A chef-to-chef challenge Cocktail Challenge Bar Guide Restaurant search Browse The Bleader The Bleader blog home page Browse Classifieds Classifieds home page Real Estate Rentals Announcements Services Jobs (Monster) Place ad ad Best of Chicago Summer Guide Savage Love Straight Dope Agenda Events Locations Issues Article Archives Fun amp; Free You searched for [X]Million Dollar Arm Start over Search for... Browse movie times Narrow Search Author Select an author Andrea Gronvall Michael Atkinson Pat Aufderheide Zbigniew Banas Barbara Scharres Angelica Jade Bastien Bill Stamets Bob Mehr Brian Thomas Peter Brunette Dave Canfield Cara Jepsen Carol Burbank Cheryl Ross Pat Chesnut Luca Cimarusti Patrick Dahl Tyler Daswick Dave Kehr Cliff Doerksen Dominick Suzanne-Mayer Don Druker Mick Dumke Marilyn Ferdinand Fred Camper Patrick Friel Chris Fujiwara Leor Galil Hank Sartin Justin Hayford Jack Helbig Henry Sheehan Tanner Howard Drew Hunt J. R. Jones J.R. Jones Jennifer Vanasco Jessica Hopper Jim Healy Jonathan Rosenbaum Joshua Katzman Josh Katzman Anthony Kaufman Kelly Kleiman Asher Klein Shelley Kraicer Shelly Kraicer Nathalie Lagerfeld Adam Langer Lawrence Bommer Lisa Alspector Eric Lutz Peter Margasak Mark Jenkins Martha Bayne Adrian Martin Tom McCormack Meredith Brody Sergio Mims Michael Miner Laura Molzahn Monica Kendrick Adam Morgan Noel Murray Noah Berlatsky Pat Graham Patrick McGavin Patrick Z. McGavin Gerald Peary Richard Pena Mark Peranson Peter Keough Leah Pickett Richard M. Porton Laura Power Quintin Miles Raymer Reece Pendleton Berenice Reynaud Ronnie Scheib Tal Rosenberg Joshua Rothkopf Joshua H. Rothkopf Martin Rubin Ryan Wenzel Ben Sachs Dan Sallitt Dmitry Samarov Ronnie Schieb David Schwartz David P. Schwartz Scott Pfeiffer Ian Simmons Alissa Simon Michael Glover Smith Patrick Somerville Laura Stempel Steve Erickson David Stewart Gwynedd Stuart Mike Sula Ted Shen Julia Thiel Ignatiy Vishnevetsky Kevin Warwick Jessica Weisberg Brianna Wellen Joel Wicklund Albert Williams Michael Wilmington Sam Worley Rating G PG PG-13 R NC-17 X NR Show only Staff Pick Staff Pick Critics Choice Critics Choice Recommended Recommended New New Agenda Agenda Free Free Slideshow Slideshow Video Video Watch on Amazon Watch on Amazon Watch on Netflix Watch on Netflix Watch on Hulu Watch on Hulu Watch on YouTube Watch on YouTube Member Picks Member Picks Other Searches Events Location Guide Member Search Movie Showtimes Movie Reviews Article Archives Issue Archives Slideshows Comments Videos Images Sorting by Name Release Date Film Search Tweet Million Dollar Arm Tools Email Print Share Digg Newsvine del.icio.us Facebook Reddit Twitter Windy Citizen Add to Custom List Loading... Comments (1) click to enlarge Million Dollar Arm Video Rated PG  124 minutes  2014 Youd never guess this Disney sports drama was scripted by Thomas McCarthy writer-director of such meaty independent releases as The Visitor (2007) and Win Win (2011); its a completely by-the-numbers affair about a sports-marketing agent (Jon Hamm) who sets out to recruit major-league baseball players from India but learns the sturdy lesson that sports should be fun instead of an exercise in moneygrubbing. The story is encrusted with formula the cute young doctor (Lake Bell) who rents the heros backyard apartment and appears on cue to offer one-liners and life advice the cranky old baseball scout (Alan Arkin) who comes along to India and rips on everyone in sight the wide-eyed teenagers with good arms (Suraj Sharma Madhur Mittal) who journey to America and get into trouble like naughty children. The movie was inspired by the real-life experiences of agent J.B. Bernstein but the story stretches all the way back to Disneys Jan-Michael Vincent comedy The Worlds Greatest Athlete (1973). Craig Gillespie directed; with Aasif Mandvi and Bill Paxton. By J.R. Jones Official Site movies.disney.com/million-dollar-armDirector Craig GillespieProducer Mark Ciardi Gordon Gray Joe Roth Palak Patel Kevin Halloran Bill Simmons and Connor SchellCast Jon Hamm Aasif Mandvi Bill Paxton Suraj Sharma Lake Bell Madhur Mittal Pitobash Alan Arkin Bar Paly Allyn Rachel Tzi Ma and Al Sapienza Trailer Million Dollar Arm Now Playing Sorry there are no upcoming showtimes for Million Dollar Arm Reviews/comments Showing 1-1 of 1 Add a review Subscribe to this thread By Email Subscribing... With RSS Showing 1-1 of 1 Comment Add a review Rating Roll over stars and click to rate. Subscribe to this thread Terms of UsePrivacy PolicySubmission GuidelinesAbout The ReaderStaffReader CareersContact UsFreelancing InfoAdvertisingBack IssuesReprints Copyright (c) 2016 Sun-Times Media LLC. Powered by Foundation,http://www.chicagoreader.com/chicago/million-dollar-arm/Film?oid=13302395,200,milliondollararm1,milliondollararm,chicagoreader
"Review ""MIllion Dollar Arm"" Jon Hamm brings a nice swing solid writing - The Denver Post News News Latest News Colorado News Nation / World Obituaries Marijuana Education Environment Crime amp; Courts Weather Your Hub Sports Sports Olympics Denver Broncos College Sports Colorado Rockies Preps Colorado Avalanche Outdoors Denver Nuggets Boxing / MMA Colorado Rapids Scores and Standings Sports Columnists Sports on TV/Radio Business Business Aerospace Airlines Economy Energy Real Estate Retail Technology Telecom Tourism Entertainment Entertainment Arcade Games Arts Books Calendar Comics Movies Music Reverb Music Theater Television Television Listings Travel Lifestyle Lifestyle Ask Amy Fashion Food amp; Drink Restaurants amp; Dining Fitness Home amp; Garden Horoscopes Opinion Opinion Editorials Columnists Letters Perspective Cartoons Opinion Polls Politics Politics Election Colorado Legislature Denver Politics Local Politics National Politics Cannabist Classifieds Classifieds Cars Homes Jobs Today Subscribe Newsletter News News Latest News Colorado News Nation / World Obituaries Marijuana Education Environment Crime amp; Courts Weather Your Hub Sports Sports Olympics Denver Broncos College Sports Colorado Rockies Preps Colorado Avalanche Outdoors Denver Nuggets Boxing / MMA Colorado Rapids Scores and Standings Sports Columnists Sports on TV/Radio Business Business Aerospace Airlines Economy Energy Real Estate Retail Technology Telecom Tourism Entertainment Entertainment Arcade Games Arts Books Calendar Comics Movies Music Reverb Music Theater Television Television Listings Travel Lifestyle Lifestyle Ask Amy Fashion Food amp; Drink Restaurants amp; Dining Fitness Home amp; Garden Horoscopes Opinion Opinion Editorials Columnists Letters Perspective Cartoons Opinion Polls Politics Politics Election Colorado Legislature Denver Politics Local Politics National Politics Cannabist Classifieds Classifieds Cars Homes Jobs Review ""MIllion Dollar Arm"" Jon Hamm brings a... Share thisClick to share on Facebook (Opens in new window)Click to share on Reddit (Opens in new window)Click to share on Twitter (Opens in new window)Click to print (Opens in new window)Click to email this to a friend (Opens in new window)MoreClick to share on LinkedIn (Opens in new window)Click to share on Pinterest (Opens in new window)Click to share on Tumblr (Opens in new window)Submit to Stumbleupon (Opens in new window) Trending Broncos camp fan guide Texas balloon crash Woody Paige retiring Sports Authority bonuses Rockies down Mets Mile High Roundup Entertainment Review ""MIllion Dollar Arm"" Jon Hamm brings a nice swing solid writing Share thisClick to share on Facebook (Opens in new window)Click to share on Reddit (Opens in new window)Click to share on Twitter (Opens in new window)Click to print (Opens in new window)Click to email this to a friend (Opens in new window)MoreClick to share on LinkedIn (Opens in new window)Click to share on Pinterest (Opens in new window)Click to share on Tumblr (Opens in new window)Submit to Stumbleupon (Opens in new window) From left Madhur Mittal Suraj Sharma and Jon Hamm in a scene from ""Million Dollar Arm.""In ""Million Dollar Man"" Madhur Mittal left travels from India to Los Angeles to compete in a pitching challenge in hopes of landing a major league contract even though hes never played baseball. Jon Hamm plays JB Bernstein a sports agent who cooks up the competition.Show Caption of Expand By  Lisa Kennedy PUBLISHED May 14 2014 at 1050 am | UPDATED April 27 2016 at 825 am Sign up for newsletters and alerts Submit your news tips or photos Most Popular Donald Trump stumps in Colorado promises ""No more Mr. Nice Guy"" Chris Harris INT injuries and 8 other observations from Day 2 of Broncos training camp Broncos offensive line can live with the blame game. Theyre built for it. LoDo shooting leaves one dead another injured Peyton Manning stars in 3 new hilarious DIRECTV ads with Lionel Richie Woody Paige retiring from The Denver Post This months Vanity Fair cover guy Jon Hamm is busy. The seventh season of ""Mad Men"" is underway and he can also be found in the family-inviting ""Million Dollar Arm."" While Don Drapers portrayer is the star here hes hardly the sole reason the winning baseball flick connects. And so a quick backstory. It was a few years back but memorable just the same. Writer-director Tom McCarthy was in Denver doing publicity for ""The Visitor."" Accompanying him was the incomparable Richard Jenkins who would later be nominated for a best-actor Oscar for his performance as a widower whose New York apartment is inhabited by a couple of undocumented immigrants. McCarthy and Jenkins sat at Dixons restaurant on 16th -- since shuttered. Their heads were tilted at the same slight angle; their eyes riveted to the TV screen. They were watching SportsCenters countdown of the week. Ah the love of the game. Any game it seemed. A few years later McCarthy came to town again for the touchingly funny high-school wrestling movie ""Win Win."" Now hes written the sports-savvy ""Million Dollar Arm"" based on actual events with broad even global appeal not least because it concerns two guys hoping to become major league pitchers who hail from a vast population of movie-lovers India. Hamm plays JB Bernstein a sports agent who in a dire moment in his companys biz cooks up a pitching challenge to take to one of the last untapped markets for baseball. Tzi Ma plays Chang JBs savvy and terse backer. Dinesh Patel (Madhur Mittal) and Rinku Singh (Suraj Sharma) are the two young men who compete in the televised event then travel from India to Los Angeles in hopes of landing a major league contract though neithers ever played baseball. An eager to-please-imp named Amit (Pitobash Tripathy) comes along as interpreter chaperone and hungry baseball acolyte. Aasif Mandvi plays Aash JBs business partner. Their companys woes began in earnest when JB wasnt able to reel in a big-money client footballer Popo (Cincinnati Bengal linebacker Rey Maualuga). Aash is smart loyal a parent. That last fact may be why even more than his Indian heritage that he takes JB to task when he plays a little fast and lose with his trio of strangers in LaLaLand. Lake Bell portrays Brenda a medical resident and JBs tenant. Shes bright relaxed an authentic beauty though not in some flashy way. In other words shes not like the models JBs known to hook up with. A good listener she knows the yearnings and burdens of JBs wards long before he does. Actually a number of characters step up to the plate as the conscience of baseball the caretakers of the boys or both. Alan Arkin brings his pleasing cant-be-bothered crankiness to his role as the baseball scout who accompanies JB in India. Bill Paxton portrays the pitching guru whose wisdom is as celebrated as it is contested. JB is not the wisest of men and ""Million Dollar Arm"" makes no bones about him being a character in need of an upward arc. Even so the movie never sacrifices the other characters as mere handmaidens to his growth. Did we mention the screenwriter? McCarthy didnt direct ""Million Dollar Arm"" (Craig Gillispie did the honors) but his grip on the emotion and humor in this saga is unmistakable. Feel-good drama? Absolutely. But an ace skillset helped Hamm and a deep bench ensemble send this one soaring. Lisa Kennedy 303-954-1567 lkennedydenverpost.com or twitter.com/bylisakennedy Lisa Kennedy Digital amp; Driveway Delivery - 50% Off More in Music Polica Synth-pop in the age of racial strife July 29 2016 Indie synth-pop band Polica (pronounced poh-LEE-sah) knew that their newest album ""United Crushers"" wasnt going to get as much attention as their debut album ""Give You the Ghost"" did. Blake Shelton plays free intimate show at Denvers Grizzly Rose July 28 2016 Only 2000 people made it inside Grizzly Rose Thursday for an intimate show by a country superstar. Tickets on sale for Denver shows this week July 29 July 28 2016 How to get tickets for the best upcoming Colorado shows. Dont Miss This Chicano Music Festival this weekend July 28 2016 In the Art District on Santa Fe folks at Su Teatro Cultural and Performing Arts Center have already begun celebrating the 20th annual Chicano Music Festival this week. Member Services News Alerts Facebook Twitter Instagram RSS Subscribe Become a Member / Subscribe Place a Hold Denver Post Store Digital Replica Edition Classifieds Autos Real Estate Jobs Todays Ads Weekly Ads Daily Ads Special Sections Contact Us Submit a News Tip Member Services Advertise With Us Careers Place an Obituary Todays Front Page Back Issues Archives Mobile Apps Copyright (c) 2016 Digital First Media Privacy Policy Site Map Ethics Policy Powered by WordPress VIP Arbitration Send to Email Address Your Name Your Email Address Cancel Post was not sent - check your email addresses Email check failed please try again Sorry your blog cannot share posts by email.",http://www.denverpost.com/movies/ci_25762696/jon-hamm-brings-nice-swing-but-its-writing,200,milliondollararm2,milliondollararm,denverpost
