review,link,status_code,id,movie_key,critic
"Were sorry we cant find the page that youre looking for Go to the content Go to the footer Time Out New York New York Popular cities London New York Paris Chicago Los Angeles Browse all cities Time Out New York Close New York Change city New York Popular cities London New York Paris Chicago Los Angeles Browse all cities Tickets Events Things to Do Restaurants Bars Movies Theater Music Shopping Attractions Blog Art Travel Nightlife Events amp; Festivals Museums Kids Hotels Comedy Dance LGBT Sex amp; Dating Books City Guide Neighborhoods Promotions Close My Time Out Things I love My lists My Profile My Account Sign out Sign in Create account Sign in With your social account Or with your email Email Password Remember me Forgotten your password? Sign in You can create a Time Out account in two ways... With a few clicks using your favourite social network Or by entering your details below Email First Name Last Name Create password Repeat new password I accept Time Outs terms of use including opt-in to newsletters. Create account Welcome  You have successfully connected your account to Time Out. You may sign in with this account in future. Please confirm your account details Email First Name Last Name I accept Time Outs terms of use including opt-in to newsletters. Sign up My Account Sign in or Create account Search Tickets Events Things to Do Restaurants Bars Movies Theater Music Shopping Attractions Blog Art Travel Nightlife Events amp; Festivals Museums Kids Hotels Comedy Dance LGBT Sex amp; Dating Books City Guide Neighborhoods Promotions More Search Were sorry we cant find the page that youre looking for We have either moved the page or it no longer exists. To help you find your way here are some search results we think may be of interest. Movies My Best Friends Girl Meet cute? More like fuck angry. Rom-coms dont get more toxic than this depressing stew of cock jokes pussy insults and cesspool declarations of love. Self-loathing lothario Tank (Cook) is hired by broken-hearted weenies to wreak emotional terrorism... 1 out of 5 stars Read more Movies My Best Friends Girl Bliers films are a continuing chronicle of the male psyche getting to the parts even Howard Hawks didnt often reach. Arriving at a ski resort in search of a new steady and the home that goes with him Huppert seizes on the local romantic (Lhermitte).... Read more Blog AAP Rocky discusses Black Lives Matter Time Out New York interview At the end of last week a quote from AAP Rockys September 2015 Time Out New York cover story in which the rapper talked about police violence and not wanting to get political in his music made the rounds on Twitter. The questions and responses--excerpted... Read more Music AAP Rocky talks dropping acid Ferguson and being intimidated by women AAP Rocky is late. Two hours late to be exact. Then out of nowhere he rolls up (literally) to our cover shoot on an electronic skateboard which he uses to travel from the door of his Escalade to the studio floor approximately 30 feet away. ""Im... Read more Blog Debra Levine focuses on George Chakiris and Theodore Kosloff at MoMA As part of ""To Save and Project The 12th MoMA International Festival of Film Preservation"" the museum hosts three events led by the Los Angeles dance writer and critic Debra Levine. On October 26 at 445pm Levine will sit down with George Chakiris... Read more Things to do Lena Dunham talks Taylor Swift feminism and the Cosby controversy Its hard to describe my relationship with Lena because shes my creative partner  my friend my mentor my (unlicensed but excellent) doctor and so much more. Instead I will share some numbers 5 The number of years weve been best friends and partners ... Read more Shopping My style guide to NYC Nicole Russo personal shopper image consultant and founder of NR Styles Nicole Russo the stylist personal shopper and image consultant behind NR Styles spills her favorite lesser-known Queens stores spas and salons. She reveals what makes places such as LIC Living Simple Skin Spa Soleil and Pin Up Queens worth... Read more Shopping Model friendships RECOMMENDED See all of this years fall fashion content Katarina Lindberg 18 model Newburgh NY Charlene Macielag 17 student Newburgh NYFriends for three years Is there any rivalry between you two? Charlene I think there has been. I cant... Read more Top About us Work for Time Out Privacy policy Website terms of use Contact us Get listed Advertising Time Out products Mobile apps Time Out Shop Time Out Guides Time Out Travel Time Out Worldwide Time Out magazine Follow us Facebook Twitter Youtube Instagram Pinterest Spotify Foursquare Time Out New York Site map",http://www.timeout.com/film/chicago/reviews/85814/my_best_friend-s_girl.html,404,mybestfriend'sgirl0,mybestfriend'sgirl,timeout
My Best Friends Girl | Chicago Reader Switch to the mobile version of this page. Newsletters Follow us Twitter Facebook RSS Mobile Username View Profile Edit Profile Log Out Log in Create Account The Chicago Reader News amp; Politics Music Arts amp; Culture Film Food amp; Drink Classifieds Browse News amp; Politics News amp; Politics home page Steve Bogira | Criminal Justice John Greenfield | Transportation Deanna Isaacs | Culture Ben Joravsky | Politics Michael Miner | Media Browse Music Music home page Gossip Wolf In Rotation Record roundups Leor Galil | Music Criticism Peter Margasak | Music Criticism Soundboard Concerts this week Early Warnings Concerts on horizon Browse Film Film home page J.R. Jones | Movie Reviews Index of Long Reviews Film Archive Short Reviews Now Playing Todays Showtimes Browse Arts amp; Culture Arts amp; Culture home page Tony Adler | Theater Justin Hayford | Theater Aimee Levitt | Features Brianna Wellen | Comedy Arts amp; Culture event search Browse Food amp; Drink Food amp; Drink home page Mike Sula | Restaurant Reviews Key Ingredient A chef-to-chef challenge Cocktail Challenge Bar Guide Restaurant search Browse The Bleader The Bleader blog home page Browse Classifieds Classifieds home page Real Estate Rentals Announcements Services Jobs (Monster) Place ad ad Best of Chicago Summer Guide Savage Love Straight Dope Agenda Events Locations Issues Article Archives Fun amp; Free You searched for [X]My Best Friends Girl Start over Search for... Browse movie times Narrow Search Author Select an author Andrea Gronvall Michael Atkinson Pat Aufderheide Zbigniew Banas Barbara Scharres Angelica Jade Bastien Bill Stamets Bob Mehr Brian Thomas Peter Brunette Dave Canfield Cara Jepsen Carol Burbank Cheryl Ross Pat Chesnut Luca Cimarusti Patrick Dahl Tyler Daswick Dave Kehr Cliff Doerksen Dominick Suzanne-Mayer Don Druker Mick Dumke Marilyn Ferdinand Fred Camper Patrick Friel Chris Fujiwara Leor Galil Hank Sartin Justin Hayford Jack Helbig Henry Sheehan Tanner Howard Drew Hunt J. R. Jones J.R. Jones Jennifer Vanasco Jessica Hopper Jim Healy Jonathan Rosenbaum Joshua Katzman Josh Katzman Anthony Kaufman Kelly Kleiman Asher Klein Shelley Kraicer Shelly Kraicer Nathalie Lagerfeld Adam Langer Lawrence Bommer Lisa Alspector Eric Lutz Peter Margasak Mark Jenkins Martha Bayne Adrian Martin Tom McCormack Meredith Brody Sergio Mims Michael Miner Laura Molzahn Monica Kendrick Adam Morgan Noel Murray Noah Berlatsky Pat Graham Patrick McGavin Patrick Z. McGavin Gerald Peary Richard Pena Mark Peranson Peter Keough Leah Pickett Richard M. Porton Laura Power Quintin Miles Raymer Reece Pendleton Berenice Reynaud Ronnie Scheib Tal Rosenberg Joshua Rothkopf Joshua H. Rothkopf Martin Rubin Ryan Wenzel Ben Sachs Dan Sallitt Dmitry Samarov Ronnie Schieb David Schwartz David P. Schwartz Scott Pfeiffer Ian Simmons Alissa Simon Michael Glover Smith Patrick Somerville Laura Stempel Steve Erickson David Stewart Gwynedd Stuart Mike Sula Ted Shen Julia Thiel Ignatiy Vishnevetsky Kevin Warwick Jessica Weisberg Brianna Wellen Joel Wicklund Albert Williams Michael Wilmington Sam Worley Rating G PG PG-13 R NC-17 X NR Show only Staff Pick Staff Pick Critics Choice Critics Choice Recommended Recommended New New Agenda Agenda Free Free Slideshow Slideshow Video Video Watch on Amazon Watch on Amazon Watch on Netflix Watch on Netflix Watch on Hulu Watch on Hulu Watch on YouTube Watch on YouTube Member Picks Member Picks Other Searches Events Location Guide Member Search Movie Showtimes Movie Reviews Article Archives Issue Archives Slideshows Comments Videos Images Sorting by Name Release Date Film Search Tweet Tools Email Print Share Digg Newsvine del.icio.us Facebook Reddit Twitter Windy Citizen Add to Custom List Loading... Comments My Best Friends Girl Dane Cook stars as a major-league asshole who specializes in mending other peoples relationships jilted boyfriends hire him to date their exes and repel the women back into their former lovers arms. His lucrative business is threatened however when he meets his roommates brassy self-centered ex (Kate Hudson) whose immunity to Cooks antics proves irresistible to him. Cook does some surprisingly good work bringing a darker and more malevolent undercurrent to his character than the script might have suggested. Theres something genuinely transgressive beneath the movies rom-com surface though director Howard Deutch keeps retreating to the safety of frat-boy humor. R 101 min. By Reece Pendleton Now Playing Sorry there are no upcoming showtimes for My Best Friends Girl Reviews/comments Subscribe to this thread By Email Subscribing... With RSS Comment Add a review Rating Roll over stars and click to rate. Subscribe to this thread Terms of UsePrivacy PolicySubmission GuidelinesAbout The ReaderStaffReader CareersContact UsFreelancing InfoAdvertisingBack IssuesReprints Copyright (c) 2016 Sun-Times Media LLC. Powered by Foundation,http://onfilm.chicagoreader.com/movies/capsules/33569_MY_BEST_FRIENDS_GIRL,200,mybestfriend'sgirl1,mybestfriend'sgirl,chicagoreader
403 Forbidden 403 Forbidden nginx,http://boxoffice.com/reviews/2008/09/my-best-friends-girl-1.php,403,mybestfriend'sgirl2,mybestfriend'sgirl,com/reviews/2008/09/my-best-friends-girl-1
"Girl wastes Hudson and local setting - The Boston Globe Local Search Site Search Home Delivery HomeTodays GlobeNewsBusinessSportsLifestyleAamp;EThings to doTravelCarsJobsHomesLocal Search MoviesRestaurantsMusicTheater/ArtsTelevisionBooksCelebrity newsEventsGamesComics THIS STORY HAS BEEN FORMATTED FOR EASY PRINTING Home / Aamp;E / Movies Movie Review Girl wastes Hudson and local setting Kate Hudson and Dane Cook in My Best Friends Girl which was filmed in Boston. (claire folger/lionsgate) By Wesley Morris Globe Staff / September 20 2008 Email| Print| Single Page| | Text size - + The inexplicable romantic comedy career of Dane Cook marches on. In Kate Hudson Cook appears to have found a woman who can both withstand his obnoxiousness and sometimes surpass it. The occasion is ""My Best Friends Girl"" another of Cooks gimmicky vehicles that probably couldnt score the free 200 points on the SAT. In ""Good Luck Chuck"" he was a charm that got women married. Now men hire him to be such a heathen on dates with the women theyve wronged that his crassness makes them seem princely. Cooks roommate (Jason Biggs) is obsessed with Hudson and hires him to work his magic. Naturally he falls in love and what took most episodes of ""Friends"" 22 minutes to resolve here requires about an hour and 40.Theres a cheap thrill in watching Hudson defuse Cooks pig antics with some foulness of her own. I dont know for instance how far it advances the cause of women at the movies to enjoy watching Hudson shout along to one of 2 Live Crews skank odes. But I laughed while she rapped dirty mostly out of surprise. I used to think Hudson was above such crummy faux-romantic eyesores but thats how shes paying her cable bill these days - ""You Me and Dupree"" ""Fools Gold"" now this another movie that looks like it was made by no one who cared.In fact Howard Deutch made it. A veteran of canceled shows and pitiful sequels whose originals he didnt direct (""The Odd Couple II"" say) Deutch is a master of seeming as though hes never made a movie before. His first film was ""Pretty in Pink"" so many semesters ago. And before ""My Best Friends Girl"" it was ""The Whole Ten Yards.""Its worth noting that Deutch shot this movie in Boston and what the film lacks in actual Bostonians aside from Cook it makes up with gratuitous helicopter shots above Back Bay and the South End - more Google Earth than cinema. But if the movie doesnt work as romantic comedy (Jordan Cahans script seems like it was written with some buddies to cope with the tedium of their Fantasy Football draft) it succeeds in making this city seem like the last place youd want to have sex.Wesley Morris can be reached at wmorrisglobe.com. For more on movies go to www.boston .com/movienation. (c) Copyright 2008 Globe Newspaper Company. My Best Friends Girl Directed by Howard Deutch Written by Jordan Cahan Starring Dane Cook Kate Hudson Jason Biggs and Alec Baldwin At Boston Common Fenway suburbs Running time 109 minutes Rated R (strong language and sexual content throughout including graphic dialogue and some nudity) Email Email Print Print Single page Single page Reprints Reprints Share Share Comment Comment Share on Digg Share on Facebook Save this article powered by Del.icio.us Your Name Your e-mail address (for return address purposes) E-mail address of recipients (separate multiple addresses with commas) Name and both e-mail fields are required. Message (optional) Disclaimer Boston.com does not share this information or keep it permanently as it is for the sole purpose of sending this one time e-mail. Advertisement Boston.com Most EmailedSubscribe to SliceBookmark Boston.com Most Emailed120 MOST E-MAILED >> Report Warrant Issued for Roggies Bar OwnerMap of Greater Boston Farmers MarketsBoston Pops Concert Move Keeps the Beach Boys Ditches Joey McIntyreWe Tried Out Those New Solar BenchesNew Englands top outdoor water parksDrink of the Week Mojito ItalianoLawmakers pass compounding pharmacy oversight bill Follow this list on Twitter BostonPopular Home| Todays Globe| News| Business| Sports| Lifestyle| Aamp;E| Things to Do| Travel| Cars| Jobs| Homes| Local Search Contact Boston.com | Help| Advertise| Work here| Privacy Policy| <a href=""http//members.boston.com/reg/login.do?dispatch=loginpageamp;p1=Foot_ContactBostonCom_Newsletters"">Newsletters</a>| Mobile| RSS feeds| Make Boston.com your homepage Contact The Boston Globe| Subscribe| Manage your subscription| Advertise| The Boston Globe Extras| The Boston Globe Store| (c) NY Times Co.",http://www.boston.com/ae/movies/articles/2008/09/20/girl_wastes_hudson_and_local_setting,200,mybestfriend'sgirl3,mybestfriend'sgirl,boston
