review,link,status_code,id,movie_key,critic
"Neighbors 2 Sorority Rising - The New Yorker Subscribe Subscribe Search Sign In Link your subscription The New Yorker Sign in Link your subscription Shop F T G+ Home Election 2016 News Culture Books Science amp; Tech Business Humor Cartoons Magazine Video Archive Subscribe Subscribe Search Movies Expand/Close The Theatre Night Life Art Dance Classical Music Movies Above amp; Beyond Food amp; Drink Close MoviesNeighbors 2 Sorority Rising A bit of self-awareness goes a long way in elevating this comedy sequel above the 2014 original. Seth Rogen and Rose Byrne again star as Mac and Kelly Radner youngish suburban parents whose domestic tranquillity is shattered by the revelry of college students renting the house next door. This time the trouble is caused by a new sorority founded by three young women (Chloe Grace Moretz Kiersey Clemons and Beanie Feldstein) at odds with the norms of Greek life. Teddy Sanders (Zac Efron) the first installments self-destructive prince of parties returns bringing a twist of pathos that grounds the comedic action. Teddys frat brothers (including Jerrod Carmichael Christopher Mintz-Plasse and Dave Franco) are back too along with the Radners best friends (Ike Barinholtz and Carla Gallo) and the dean of the college (Lisa Kudrow). The biggest change is political the themes of gay marriage female empowerment endemic sexism and racist harassment by the police crop up alongside the practicalities of real-estate transactions to make the narrative setup far more engaging than the antic--and often merely frantic--set pieces. Directed by Nicholas Stoller.      --Richard Brody Goings On A free New York City events app What to do tonight Follow goingson About Us FAQ Strongbox Customer Care Cartoon Bank On The Town RSS Contact Us The New Yorker Store Careers Reprints/Permissions Press The New Yorker Media Kit Conde Nast Digital Subscribe to a magazine View All Titles - - - - - - - - - - - - - - Allure Architectural Digest Bon Appetit Brides Conde Nast Traveler Details Glamour Golf Digest Golf World GQ Lucky Self Teen Vogue The New Yorker Vanity Fair Vogue W Wired Other Conde Nast sites - - - - - - - - - - - - - - Allure Architectural Digest Ars Technica Bon Appetit Brides.com Conde Nast Traveler Concierge Details Epicurious Glamour Golf Digest Golf World GQ Hotel Chatter Jaunted Lucky NutritionData Reddit The Scene Self Style Teen Vogue Vanity Fair Vegas Chatter Vogue W Wired Use of this site constitutes acceptance of our User Agreement (effective January 1 2014) and Privacy Policy (effective January 1 2014). Your California Privacy Rights The material on this site may not be reproduced distributed transmitted cached or otherwise used except with the prior written permission of Conde Nast. Ad Choices <a href=""http//www.omniture.com"" title=""Web Analytics""></a>",http://www.newyorker.com/goings-on-about-town/movies/neighbors-2-sorority-rising,200,neighbors0,neighbors,newyorker
Neighbors 2 Equal Opportunity Idiocy | New Republic,https://newrepublic.com/article/133659/neighbors-2-equal-opportunity-idiocy,200,neighbors1,neighbors,com/article/133659/neighbors-2-equal-opportunity-idiocy
"Neighbors 2 Sorority Rising | Reelviews Movie Reviews Out now Cher Harold Rosson Eva Green Benjamin ... Home Video Views ReelThoughts Currently in Cinema ReelViews Library Login Specials My Books Array ( [page] =gt; reelviews [view] =gt; neighbors-2-sorority-rising ) Neighbors 2 Sorority Rising (United States 2016) May 20 2016 A movie review by James Berardinelli Its the same sad story a small movie becomes an unexpected success and for purely financial reasons a sequel is commissioned. The follow-up proves not only to be creatively bankrupt but a disappointment on all levels and thereby tarnishes the perception of its predecessor. Neighbors 2 Sorority Rising isnt the first instance of this happening and it wont be the last. However its depressing to realize that the filmmaking team of director Nicholas Stoller and his four co-writers couldnt have come up with something - anything - better. Instead they have resurrected the awful comedy tropes of the 1980s and emerged with something shockingly lifeless. There are about six really good laughs during the films 92-minute running length. For those who believe this to represent an acceptable rate rush out to see Neighbors 2. Others may find this difficult to watch even as a home rental. For the most part the story is a retread. I suppose thats understandable when one considers the ""if it aint broke dont fix it"" rule. A better solution than enduring the sequel for those who (like me) enjoyed the first movie would be to re-watch that one rather than spending the price of a movie ticket. Even the best parts of Neighbors 2 feel a little stale. This time instead of a fraternity in the house next door to Mac (Seth Rogen) and Kelly (Rose Byrne) Radners abode its a sorority. The movie provides a needlessly in-depth backstory for why three girls - Shelby (Chloe Grace Moretz) Beth (Kiersey Clemons) and Nora (Beanie Feldstein) - go out of their way to reject the universitys existing Greek culture and start a new off-campus sorority. They are ""mentored"" by university alum Teddy Sanders (Zac Efron) the Raders nemesis from Neighbors. Of course things get out of hand a war ensues Teddy is rejected by the girls and joins Team Mac amp; Kelly and... well... you know the rest. The movie unconvincingly offers a message about sexual equality and female empowerment. (On campuses fraternities can have parties but sororities cant - Google it.) This might seem a little less like pandering if the approach wasnt so heavy-handed. The problem isnt the message its the clumsiness with which it is presented. The mealy writing evident in Neighbors 2 isnt going to advance any agenda. Better written female characters would have been a start. The three sorority leads arent exactly ""strong"" women. Theyre more like girls stuck in a state of arrested development. I fail to understand why would-be raunchy comedies feel the need to inject quasi-dramatic elements into the proceedings. It never works it always feels half-baked and it only serves to slow the proceedings. A lot of it feels like filler. Do we care whether Teddy ""finds himself?"" Do we care whether the girls grow as sisters? Do we care whether Mac and Kelly are good parents? No no and no. Yet the screenplay expends about half its running time pursuing these questions. Are six laughs good for 92 minutes? Not when the viewer is forced to endure ten times as much treacle as humor. Maybe the problem is that when I go to a raunchy comedy I expect to have a good time not to be inundated by inept drama. Any edge the first movie possessed has been dulled to insignificance here. The tit-for-tat tactics in the ""war"" between the ex-party animals and the current ones are nowhere near as vicious as they were in Neighbors. Theres some gross stuff to be sure but ""gross"" doesnt automatically equate to ""funny."" So we get moments of comedic gold like Rose Byrne vomiting on Seth Rogens face and used tampons being employed as weapons. Since the first movie made money and the second one is almost guaranteed to follow suit its hard to blame the actors for taking their checks and mailing in their performances or for the writers to do the laziest job imaginable in ""crafting"" the screenplay. This isnt about providing quality entertainment; its about fooling audiences into spending money by offering a familiar title with recognizable actors. Neighbors 2 is a direct-to-video level production. Welcome to how too many movies are made in 2016. Neighbors 2 Sorority Rising (United States 2016) Director Nicholas Stoller Cast Seth Rogen Rose Byrne Zac Efron ChloA<< Grace Moretz Kiersey Clemons Beanie Feldstein Ike Barinhnoltz Clara Mamet Screenplay Andrew J. Cohen amp; Brendan OaBrien amp; Nicholas Stoller amp; Seth Rogen amp; Evan Goldberg Cinematography Brandon Trost Music Michael Andrews U.S. Distributor Universal Pictures Run Time 132 U.S. Release Date 2016-05-20 MPAA Rating ""R"" (Profanity Sexual Content Drugs) Genre Comedy Subtitles none Theatrical Aspect Ratio 2.351 Comments Add Comment Three...better movies of this genre Princess Bride The (1987) City Lights (1931) This Is Spinal Tap (1984) worse movies of this genre Feast (2006) Dumb and Dumberer (2003) Freddy Got Fingered (2001) Three...better movies of Seth Rogen Knocked Up (2007) 40-Year-Old Virgin The (2005) Steve Jobs (2015) worse movies of Seth Rogen Green Hornet The (2011) Guilt Trip (2012) Kung Fu Panda 3 (2016) Three...better movies of Rose Byrne Sunshine (2007) Adam (2009) Get Him to the Greek (2010) worse movies of Rose Byrne Marie Antoinette (2006) Internship The (2013) Insidious Chapter 2 (2013) Three...better movies of Zac Efron Hairspray (2007) Me and Orson Welles (2009) Lorax The (2012) worse movies of Zac Efron Charlie St. Cloud (2010) 17 Again (2009) Mike and Dave Need Wedding Dates (2016) ReelViews Library Currently in Cinema Writings Fictional Writings ReelThoughts Specials About Privacy Policy Terms and Conditions Contact Website credits",http://www.reelviews.net/reelviews/neighbors-2-sorority-rising,200,neighbors2,neighbors,reelviews
"Female Students Flip The Script For Neighbors 2 Sorority Rising  NPR View Navigation NPR NPR NPR Music NPR Books NPR About NPRPodcast Directory Search Toggle search NPR Home News Arts amp; Life Music Topics Programs amp; Podcasts NPR Music Genres New Music Concerts amp; Videos Articles amp; Lists Tiny Desk NPR Books Author Interviews Find Books Reviews About NPR Overview Connect Support Press Careers Podcast Directory Categories Shop Back News U.S. World Politics Business Technology Science Health Race amp; Culture Education Arts amp; Life Books Movies Pop Culture Food Art amp; Design Performing Arts Photography Music First Listen Songs We Love Music Articles Tiny Desk Videos More Our Blogs Corrections All About NPR Back News amp; Conversations Morning Edition All Things Considered Fresh Air Here amp; Now Code Switch The Diane Rehm Show Embedded Latino USA NPR Politics Podcast On Point Weekend Edition Saturday Weekend Edition Sunday Youth Radio Storytelling amp; Humor Ask Me Another The Best Of Car Talk Bullseye Hidden Brain How To Do Everything Invisibilia Only A Game Planet Money Pop Culture Happy Hour StoryCorps TED Radio Hour Wait Wait...Dont Tell Me Music First Listen All Songs Considered Songs We Love Tiny Desk Alt.Latino From The Top Jazz Night In America Metropolis Microphone Check Mountain Stage Piano Jazz The Thistle amp; Shamrock World Cafe More All Programs Podcast Directory NPR Podcasts Back Rock Pop Jazz Classical Hip-Hop Ramp;B/Soul Folk Latin World Electronic/Dance Back First Listen Songs We Love All Songs Considered Reviews Music Videos Back Tiny Desk Live Concerts Field Recordings Studio Sessions Music Documentaries Music Videos Festival Recordings Back Articles Interviews Quizzes Music Lists Best Music of the Year Back Art amp; Design Arts amp; Entertainment Biography amp; Memoir Business amp; Economy Childrens Books Comedy Comics amp; Graphic Novels Digital Culture Faith amp; Spirituality Food amp; Wine History amp; Society Historical Fiction Horror amp; Supernatural Literary Fiction Mystery amp; Thrillers Parenting amp; Families Poetry Politics amp; Public Affairs Romance Science Fiction amp; Fantasy Science amp; Health Sports Travel Young Adult Nonfiction Fiction Back Book Reviews This Weeks Must Read My Guilty Pleasure Three Books... PG-13 Risky Reads You Must Read This Summer Books Best Books of the Year Back Overview Overview and History Mission and Vision Stations and Public Media NPR Finances People Ethics Awards Back Visit NPR NPR Presents Studio 1 Events Generation Listen Book a Speaker Request Permissions Ways to Listen NPR Extra Blog Email Newsletters Shop NPR Get Help Contact Us Back Support Public Radio Corporate Sponsorship Volunteer Back Releases and Statements Photos and Logos Fact Sheet (PDF) Media Relations Contacts Back Careers at NPR Search Jobs Culture Applying Interns Fellows Digital Back Arts Business Comedy Education Games amp; Hobbies Government amp; Organizations Health Kids amp; Family Music News amp; Politics Religion amp; Spirituality Science amp; Medicine Society amp; Culture Sports amp; Recreation Technology TV amp; Film Female Students Flip The Script For Neighbors 2 Sorority Rising Movie Reviews Female Students Flip The Script For Neighbors 2 Sorority Rising Facebook Twitter Google+ Email May 19 2016500 PM ET Andrew Lapin i Zac Efron and Seth Rogen reunite in Neighbors 2 Sorority Rising. Universal Pictures hide caption toggle caption Universal Pictures Zac Efron and Seth Rogen reunite in Neighbors 2 Sorority Rising. Universal Pictures Neighbors 2 Sorority Rising is likely the first college comedy to show a frat party from a womans perspective and it is scary. The young sorority pledges trudge reluctantly through a creepy house infected by unsupervised male id trying to avoid the grabby hands and drink offerings of their leering hosts. ""Im getting a really rape-y vibe"" one of the girls says as neon signs leading to the bedrooms read ""Stairway to Heaven"" and ""No Means Yes."" But three disgusted freshmen played by Chloe Grace Moretz Kiersey Clemons and Beanie Feldstein decide to build their own heaven instead by launching an off-campus house where they can throw their own parties. In the two short years since the original Neighbors pitted one of those old-school National Lampoon movie fraternities against new parents played by Seth Rogen and Rose Byrne theres been a sea change in popular cultures view of Greek life. Much of that may be due to increased exposure of the sexual assault epidemic on American campuses including how dangerous some frat parties have become for women. When one character instructs another to ""never drink the punch"" like its a well-known fact of life it could be a line from The Hunting Ground. This is a really grim way to set the table for a movie where a shirtless Rogen sprints through a tailgate with a garbage bag full of marijuana. But one of Neighbors 2s unexpected charms is that it touches on such issues without trivializing them. The films turning point is the (very real) fact that the National Panhellenic Conference bans U.S. sorority chapters from consuming alcohol in their own houses. The girls plan to rent the house formerly occupied by Zac Efrons frat crew for partying purposes is an approach that could help curb campus rape in real life. But its nevertheless bad news for the Radners next door (Rogen and Byrne) who have a little girl with another on the way and who have just sold their house in escrow and need to keep shenanigans at bay for 30 days until they can close the deal. And so another generation-gap rivalry begins. The girls refuse to rein in their parties and they are aided at first by Efrons Teddy former campus king turned purposeless mid-twenties sad sack. (Its heartening to find that Van Wilder-style perma-collegedom is no longer something to be emulated.) A running theme throughout the escalating neighbor wars is parenthood The Radners look at the undisciplined girls next door and see their daughters in the future when they no longer will want anything to do with the ""old people"" telling them how to have fun. But this half-hearted attempt to discuss maturation is second to the films true purpose gender-flipping all the first movies jokes about rowdy college kids. Lazy? Maybe but in a Hollywood starving for female-fronted movies of any stripe it still qualifies as revolutionary. The approach allows the women to be instruments of comedy rather than targets of it. Condom jokes become tampon jokes with the sisters verbally challenging the idea that what theyre doing is any more disgusting. When Moretzs character loses her virginity we never even see the partner or the act; we only see the celebration her sisters throw for her (the women have good onscreen chemistry even if they never distinguish themselves as individual characters). And there are long discussions over what does and does not constitute sexism which get more laughs than anything Rogen does with his dad bod for the upteenth time. As was true of the first Neighbors this films construction is rather sloppy. The running gags involving small children dont work characters blab tons of semi-improvised filler and the overall look is cheap. The script also lacks the sense of pushing a concept to the outer limits that Rogen and co-writer Evan Goldberg pulled off so well in Superbad and This Is The End. (They are two of five credited writers all male; the director is Nicholas Stoller who also helmed the first Neighbors and the under-appreciated The Five-Year Engagement.) But the deck is stacked with ace comic performers like Byrne who does a splendid morning-sickness puke and Efron making his hunky boyishness the butt of every joke. And at only 92 minutes the films hurry to rush through its plethora of characters becomes a strength because we dont have enough time to get bored by any one scene. The set pieces may be thin but they show flickers of genuine warmth. ""Lets do what parents do better than anything Stop young people from having fun"" Rogen yells as a rallying cry. But the women of Neighbors 2 for once dont have to stop. Facebook Twitter Google+ Email More Stories From NPR Movie Reviews In Tallulah An Aimless Young Woman Stumbles Across A Purpose Kidnapping Movie Reviews Indignation Based On Philp Roths Autobiographical Novel Marred By Miscasting Movie Reviews In Equity Wall Streets Glass Towers Have Glass Ceilings Movie Reviews This Time Out Matt Damons Not Feeling The Bourne More Stories Comments You must be signed in to leave a comment. Sign In / Register Please keep your community civil. All comments must follow the NPR.org Community rules and Terms of Use. NPR reserves the right to use the comments we receive in whole or in part and to use the commenters name and location in any medium. See also the Terms of Use Privacy Policy and Community FAQ. Please enable JavaScript to view the <a href=""http//disqus.com/?ref_noscript"">comments powered by Disqus.</a> NPR thanks our sponsorsBecome an NPR sponsor News U.S. World Politics Business Technology Science Health Race amp; Culture Education Arts amp; Life Books Movies Pop Culture Food Art amp; Design Performing Arts Photography Music First Listen Songs We Love Music Articles Tiny Desk Videos Programs About NPR Overview NPR Finances People at NPR Support NPR Visit NPR Press Room NPR Extra Blog Careers at NPR Corrections NPR Ombudsman Permissions Help Contact Terms of Use Privacy Sponsorship Choices Text-Only",http://www.npr.org/2016/05/19/478669370/female-students-flip-the-script-for-neighbors-2-sorority-rising,200,neighbors3,neighbors,npr
"Neighbors 2 Sorority Rising (2016) directed by Nicholas Stoller | Movie review Go to the content Go to the footer Time Out New York New York Popular cities London New York Paris Chicago Los Angeles Browse all cities Time Out New York Close New York Change city New York Popular cities London New York Paris Chicago Los Angeles Browse all cities Tickets Events Things to Do Restaurants Bars Movies Theater Music Shopping Attractions Blog Art Travel Nightlife Events amp; Festivals Museums Kids Hotels Comedy Dance LGBT Sex amp; Dating Books City Guide Neighborhoods Promotions Close My Time Out Things I love My lists My Profile My Account Sign out Sign in Create account Sign in With your social account Or with your email Email Password Remember me Forgotten your password? Sign in You can create a Time Out account in two ways... With a few clicks using your favourite social network Or by entering your details below Email First Name Last Name Create password Repeat new password I accept Time Outs terms of use including opt-in to newsletters. Create account Welcome  You have successfully connected your account to Time Out. You may sign in with this account in future. Please confirm your account details Email First Name Last Name I accept Time Outs terms of use including opt-in to newsletters. Sign up My Account Sign in or Create account Search Tickets Events Things to Do Restaurants Bars Movies Theater Music Shopping Attractions Blog Art Travel Nightlife Events amp; Festivals Museums Kids Hotels Comedy Dance LGBT Sex amp; Dating Books City Guide Neighborhoods Promotions More Search Neighbors 2 Sorority Rising Movies  Comedy Now Showing 3 out of 5 stars Add review 1 Love It Save it 0 Add review 1 Love It Save it Time Out says 3 out of 5 stars Details Users say Time Out says 3 out of 5 stars Zac Efron Seth Rogen and the gang are back for more beer pong and hilarity--this time with a feminist twist. If you live in a tiny apartment and you can hear everything when your neighbors are watching Game of Thrones (or worse) youll have zero sympathy for the noise problems suffered by Seth Rogen and Rose Byrne back in Neighbors 2 Sorority Rising as a married couple with a kid living in a relatively palatial house near a college campus. Last film around a gang of frat boys moved in next door. This time its female students (led by Chloe Grace Moretz) who are sick of sexist taunts and have started their own sorority. This sequel turns out to be a gross-out comedy with a pro-woman streak (instead of sexy selfies or bro-luring bacchanals the sorority throws a ""feminist icon"" party). And it just about works. Once again Zac Efron saves the day. In the original he played the president of the fraternity. Now he takes on a mentor role to the sorority instructing them on the art of debauchery. In return they teach him the ways of feminism ""Dont call them hos--thats not cool anymore"" he tells his buddies. Jokes like this keep Neighbors 2 Sorority Rising just funny enough to not feel like a retread. By Cath Clarke Posted Friday May 20 2016 Details Release details Rated R Release date Friday May 20 2016 Duration 92 mins Cast and crew Director Nicholas Stoller Screenwriter Andrew Jay Cohen Nicholas Stoller Seth Rogen Brendan OBrien Evan Goldberg Cast Zac EfronSeth RogenChloe Grace MoretzRose Byrne Users say LiveReviews|01 person listeningSign inWrite reviewMost helpfulMost helpfulHighest ratingLowest ratingNewestOldestLoadingundefinedNew ReviewsRefreshShow More Share Tweet 0 Shares Top About us Work for Time Out Privacy policy Website terms of use Contact us Get listed Advertising Time Out products Mobile apps Time Out Shop Time Out Guides Time Out Travel Time Out Worldwide Time Out magazine Follow us Facebook Twitter Youtube Instagram Pinterest Spotify Foursquare Time Out New York Site map }",http://www.timeout.com/us/film/neighbors-2-sorority-rising,200,neighbors4,neighbors,timeout
