review,link,status_code,id,movie_key,critic
"Movie review Neighbors 2 flips the script to great success | Entertainment News | ArcaMax Publishing ArcaMax News amp; Entertainment by Email Home News Columns Comics Search Login Log in to ArcaMax Username or Email  Password  Forgot Password? Click here. Register for your free account Subscribe to any feature and receive your newsletter directly in your inbox. Easy email subscription management. Post comments vote and upload gallery pictures. Click Here to Get Started Business Entertainment Health amp; Spirit Home amp; Leisure Knowledge Politics Sports Entertainment / ArcaMax Entertainment News Subscribe Subscribe Your email is safe with us. Privacy Policy or Movie review Neighbors 2 flips the script to great success Katie Walsh Tribune News Service on May 18 2016 Published in Entertainment News Subscribe Subscribe Your email is safe with us. Privacy Policy or Two years ago ""Neighbors"" writers Andrew Jay Cohen and Brendan OBrien along with director Nicholas Stoller reinvented the classic college party movie by pitting the frat guys against the young parents next door. It was a raunchy but sweet rumination on getting older and growing out of party mode a refreshing take on the college movie formula. With ""Neighbors 2 Sorority Rising"" theyve flipped the script creating a feminist party classic thats completely current and doesnt skimp on any of the wild humor. Its also even better than its predecessor.Starring Chloe Grace Moretz Kiersey Clemons and Beanie Feldstein as the freshman founding members of Kappa Nu the film takes on a real world issue thats a legitimate problem on college campuses. Greek sorority houses arent allowed to host parties with alcohol so the majority of college parties take place in the ""boys rule"" atmosphere of fraternities often predatory environments with themes that are usually sexist and designed to get girls into skimpy outfits.The picture-perfect sororities of flower crowns and sundresses also arent the right fit for Shelby (Moretz) Beth (Clemons) and Nora (Feldstein). This is a trio of girls who want to party on their own turf and by their own rules. So they find their own house formerly the Delta Psi house next door to 30-something parents Mac (Seth Rogen) and Kelly (Rose Bryne).The couple are currently attempting to sell the property and just need to get through 30 days of escrow before the new buyers (Abbi Jacobson and Sam Richardson stealing the show) move in and have to deal with the Greeks. How do they confront the wild new sorority next door? A prank war of course. If it worked against Zac Efron and the Delta Psis how bad can some teenage girls be?Take ""Animal House"" or ""Revenge of the Nerds"" and turn the gender roles inside out and youll have ""Neighbors 2."" In fact eliminate almost all of the guys. The girls have no real interest in these slovenly dudes. Efron as Teddy the former frat guy who cant let go of his college lifestyle is simply there to be objectified a role he embraces by performing a ""Magic Mike"" style dance number while oiled up in barbecue grease. They refer to him as ""Hot Guy.""The film derives a lot of humor from embracing and also complicating stereotypes. These girls are at once absorbed in their phones but also physically powerful. They wage war through texting and always refer to their neighbors as ""the old people."" Those ""old people"" Kelly and Mac question their own parenting skills but theyve embraced the role of parenthood vowing to do what parents do best stop young people from having fun. Their realization that their toddler daughter will one day grow up to be a petulant teen leads to a touching moment that gets at the bittersweet nature of parenthood.Isnt it time that the ladies got their own rollicking foul-mouthed THC-soaked party movie? The fact that it contains a profoundly progressive message about the difficulties of bucking an inherently sexist system helps its instant-classic status. With high school graduation season upon us ""Neighbors 2 Sorority Rising"" should be required viewing for anyone matriculating into college next year. Congrats grads Good luck have fun and remember -- never drink the punch.NEIGHBORS 2 SORORITY RISING4 out of 4 starsCast Seth Rogen Zac Efron Rose Byrne Chloe Grace Moretz Kiersey Clemons Beanie FeldsteinDirected by Nicholas StollerRunning time 1 hour 32 minutesRated R for crude sexual content including brief graphic nudity language throughout drug use and teen partying.(c)2016 Tribune Content Agency LLCDistributed by Tribune Content Agency LLC. Share Comment More Entertainment News Hillary Clintons acceptance speech ratings will fall below Donald Trumps Entertainment News / July 29 2016 NEW YORK -- Early ratings for Hillary Clintons acceptance speech Thursday at the Democratic National Convention show that it will fall short of Donald Trumps audience from July 22.The 10 p.m. ET slot that featured ...Read More New Sandy Hook School unveiled Entertainment News / July 29 2016 NEWTOWN Conn. -- The Sandy Hook Elementary School was opened to the media Friday nearly four years after the mass shooting at the school.The 86800-square-foot school will house students in pre-kindergarten to fourth ...Read More Dont Think Twice review Mike Birbiglias honest funny take on improv performers Entertainment News / July 28 2016 In the spirit of improvisational comedys ""yes and"" method of developing a scene Yes ""Dont Think Twice"" is one of the best films of the year. And its an unusually delicate movie about the brutal business of being ...Read More Whats opening in theaters next week Entertainment News / July 28 2016 MOVIESOpening Friday""Suicide Squad"" (PG-13) Will Smith Jared Leto Margot Robbie and Jai Courtney are among the DC Comics supervillains who are offered clemency if they carry out a secret mission. Because bad guys ...Read More Movie review Indignation offers stellar adaptation of Philip Roths bittersweet 2008 novel Entertainment News / July 28 2016 LOS ANGELES -- ""Indignation"" tells a very particular story one thats bittersweet heartbreaking and bleakly comic all at once and it gets it right.An impressive directing debut for James Schamus and a glowing showcase...Read More Movie review Dont Blink -- Robert Frank profiles iconic photographer Entertainment News / July 28 2016 LOS ANGELES -- Films focused on visual artists are a staple of the documentary world but ""Dont Blink -- Robert Frank"" does things a little differently. Rather than being a film about an artist its an attempt to show us...Read More Comments Please enable JavaScript to view the <a href=""http//disqus.com/?ref_noscript"">comments powered by Disqus.</a> blog comments powered by Disqus Popular Stories The return of Harry Potter Is it still magical? Jul 27 2016 Movie review Jason Bourne falls flat Jul 27 2016 Bill OReilly courts controversy with comments on slavery; Hollywood hits back Jul 28 2016 Dont Think Twice review Mike Birbiglias honest funny take on improv performers Jul 28 2016 Actor Bradley Cooper attends DNC upsets some conservative American Sniper fans Jul 28 2016 Social Connections facebook google+ Comics See more ArcaMax TOPICS Business Entertainment Health amp; Spirit Home amp; Leisure Knowledge Politics Sports CATEGORIES News Comics Columns Quizzes COMPANY Reader Services Write the Editor Why ArcaMax Media Center Newsletter Directory (c)2016 ArcaMax Publishing. All rights reserved Advertise | Privacy Policy | Terms of Use | Help/FAQs",http://www.arcamax.com/entertainment/entertainmenttoday/s-1831917,200,neighbors25,neighbors,arcamax
"A Sorority Spirit Seizes the Neighbors-verse | Village Voice NewsVLongformThe MTAMediaNYPDPoliticsMake It StopCultureLGBTTop Stories NewsletterMusicVAsk Andrew W.K.New YorkersMusic ListsBars amp; LoungesConcert CalendarMusic NewsletterFood amp; DrinkVNYC Restaurant GuideRestaurant Reviews100 Favorite Dishes99 Essential Restaurants in BKPizzaFood amp; Drink ListsFood amp; Drink NewsletterArts amp; CultureVVisual ArtsTheaterBooksComedyObiesThe Seen A NYC Style GuideTheater NewsletterCalendarVSubmit an EventConcert CalendarThings To Do NewsletterFilm amp; TVVNews amp; InterviewsFilm ReviewsShowtimesTrailersVillage Voice Film PollFilm PodcastFilm amp; TV NewsletterLongformVideosSlideshowsBest Of NYC(r)VArts amp; EntertainmentFood amp; DrinkShopping amp; ServicesSports amp; RecreationReaders ChoiceBest Of NewsletterPromotionsVPromotional EventsStreet TeamFree StuffPromotions NewsletterClassifiedsVMedical Studies Apps About Us Contact Us Staff Careers Advertise E-Edition Privacy Terms menu A Sorority Spirit Seizes the Neighbors-verse Soul Power Sharon Jones Wont Let Cancer Stop the Funk Remember Me SIGN IN > Forgot Password? Or sign in with a social account FACEBOOK GOOGLE + TWITTER YAHOO Dont have an account yet? Sign Up > Connect. Discover. Share. Get the most out of your experience with a personalized all-access pass to everything local on events music restaurants news and more. Enter your email or sign up with a social account to get started FACEBOOK TWITTER GOOGLE+ YAHOO Privacy Policy SIGN UP > Already registered? Login > Email Username Password Name Zipcode DONE MVN Sign In > Dont have an account yet? Sign Up > Facebook Twitter Follow villagevoice Other April Wolfe A Sorority Spirit Seizes the Neighbors-verse Wednesday May 18 2016 at 11 a.m. By April Wolfe EXPAND Courtesy of Universal Pictures A A Facebook- Twitter - More shares recommend reddit email - - In Neighbors 2 Sorority Rising the sequel to 2014s old-people-vs.-frat-brothers comedy Zac Efron takes off his shirt in nearly every scene hes in. Its a sight to behold -- again and again and again -- but a calculated effort like most of this film to appeal to the ladies. As surprising as it seems for an R-rated comedy made by many men it totally succeeds on that front and many others.When they endure a harrowing five minutes inside the carnival of macabre sexist pleasures that is a frat party college friends Shelby (Chloe Grace Moretz) and her new pals Beth (Kiersey Clemons) and Nora (Beanie Feldstein) take off to smoke weed in their dorm room and hatch a plan to start their own sorority Kappa Nu. Meanwhile the inept/typical parents/adults from Neighbors Kelly (Rose Byrne) and Mac (Seth Rogen) think theyre in the clear The frat next door along with Teddy (Efron) and his brothers is long gone and Kelly and Mac have bought a new house anyway and sold the old one. Unfortunately they dont know what ""escrow"" means and discover that they have to keep up appearances on their old house for thirty days just when Shelby and the gangs makeshift sorority opens up next door with one objective to party on their own terms.Film DetailsCritics Pick Neighbors 2 Sorority Rising RatingR GenreComedy Running Time92 min. More Info Trailer And party they do but not exactly in the ways you might expect after seeing the Spring Breakers-like trailers. A hilarious montage showcases the sorority sisters a cappella karaoke soirees Fault in Our Stars cryfests and a laugh-out-loud-funny ""Feminist Hero"" costume party where the power of Oprah is invoked and three people (including Efrons Teddy) dress as Hillary Clinton. Teddy has joined ranks with the sisters after his bro Pete (Dave Franco) gets engaged to his boyfriend and kicks Teddy out. Thats right Pete is gay and for once in a studio comedy queerness is incidental rather than a joke. Like real life.Shelbys crew proves wickedly endearing. Feldsteins performance as the adrenaline-powered ball of sunshine and pain pills invites comparisons to Aidy Bryant or a less complainy Jonah Hill who as it turns out is her real-life older brother. The girls get a stab at physical comedy too. Pledges dressed as Minions hanging from chandeliers and falling down stairs in the background account for the extra-long roster of female stunt actors in the credits and a frenetic action sequence thats more beautifully shot than comedies demand has Shelby chasing Mac through a hard-partying sea of tailgaters to retrieve a garbage bag of weed so she can sell it and make rent.With so many women in the cast the doors open for new avenues of gross-out humor. A mid-coitus barf from Kelly is followed by a recurring vibrator gag where Kelly and Macs daughter now age two keeps finding Mommys bright-pink dildo prompting the couple to just dress it up like a pretty princess and call it good. Byrne as always is on point but the best of these scenes by far is a sorority-sister bloody-tampon carpet bomb that delivers in laughs before delivering in lessons -- Teddy tells them bloody tampons are ""gross"" but the women convince him that theyre actually funny-gross. EXPAND Courtesy of Universal Pictures Teddy of course learns a lot of lessons in his time at Kappa Nu the most salient being that frat parties themes always make girls play hos. When he finally grasps this his face contorts into the pained acknowledgment that he may have been a terrible person and thus begins Teddys journey to maturity -- and later the realization that hes an ""old"" with no friends and no direction. Its almost impossible that a human could have Efrons abs and his comic timing and director Nicholas Stoller definitely makes use of both even working in a Magic Mike-worthy dance scene.As a writer and director Stoller (Forgetting Sarah Marshall The Five-Year Engagement) has long been a proponent of funny women and people of color. This films no different. Girl Codes Awkwafina plays a potato-chip-munching monotone stoner Veeps new breakout star Sam Richardson gives his stilted goody-goody best and Jerrod Carmichael reprises his role as Garf whos now joined Hannibal Buresss cop character on the local police force. Carmichael and Buress get one of the funniest scenes in a funny movie when they bust a bunch of white drug dealers drawing some comic inspiration from Denzel Washington in Training Day. They wreak havoc playing tough until they burst into a room of African-American weed entrepreneurs -- whom they proceed to treat with the utmost respect. Its a timely role reversal playing on the cordial way in which white mass-shooter Dylann Roof was treated by white cops. Stoller doesnt shy away from jokes with some edge even in a mostly innocuous comedy.Theres so much good to say about Neighbors 2 that its easy to overlook some flat punchlines like the lackluster ending to a drawn-out text-messaging prank. Even then Kelly and Macs relationship is hashtag marriagegoals. Meanwhile the complexity of feminism for young girls today is displayed with rare hilarity and insight. Nobody captures the spirit of it all better though than Shelbys father played by an always alarmingly perfect Kelsey Grammer ""So what you get to be just as dumb as the boys are now?"" Yes. And its all they ever wanted. Soul Power Sharon Jones Wont Let Cancer Stop the Funk NEXT Film Film and TV Film Reviews Get the Film amp; TV Newsletter Stay up to date on the best new movies with our critics latest reviews interviews and trailers for the films coming to a theater near you each week. GO Cancel Submit Comments In Case You Missed It One Mans Quest to Give the Gift of Star Wars to Our Troops... Quentin Tarantino Is About to Drop His Most Unconventional Film in... Heres the Village Voices 1979 Review of The Warriors Marlon Brando and David Foster Wallace Plus a Story About Jason... Popular Stories Lights Out Is Creepiest When It Stops Explaining Itself Yes Comedies Look Better Than They Used To. Brandon Trost Is Why. Busted Flat All-Too-Normal Activity Dominates the... Back on Trek Beyond Has Blockbuster Action -- But Also Some of... Zombie Thriller Train to Busan Comes Awfully Close to Greatness Pixar Dives Under the Sea Again -- And Into Memory Itself --... Ali Wongs Baby Cobra Have We Entered Televisions... Old Comedians Mistake Criticism for Censorship in Whiny Doc... Sponsor Content (c)2016 Village Voice LLC. All rights reserved. Newsletters All-access pass to the top stories events and offers around town. Top Stories Send Sign Up gt; Remind Me Later gt; No Thanks gt; Privacy Policy Newsletters All-access pass to top stories events and offers around town. Sign Up gt; No Thanks Remind Me Later gt;",http://www.villagevoice.com/film/a-sorority-spirit-seizes-the-neighbors-verse-8626367,200,neighbors26,neighbors,villagevoice
"Neighbors 2 Sorority Rising gives feminism old college try - NY Daily News Trending DEMOCRATIC NATIONAL CONVENTION HILLARY CLINTON KESHIA KNIGHT PULLIAM MICHAEL JORDAN DONALD TRUMP Sections Sections Home New York NYC Crime Bronx Brooklyn Manhattan Queens Education Weather Obituaries Sports Yankees Mets Giants Jets Knicks Nets Rangers Islanders Football Basketball Baseball Hockey Soccer College High School The Score More Sports News Crime U.S. World Politics Entertainment Gossip Games Entertainment Pics TV Movies Music Theater amp; Arts Horoscopes Daily Weekly Monthly Pet Horoscopes Lifestyle Health Homes Food Opinion Autos Buyers Guide Ratings amp; Reviews News amp; Views Photos amp; Galleries Covers Classifieds Trending DEMOCRATIC NATIONAL CONVENTION HILLARY CLINTON KESHIA KNIGHT PULLIAM MICHAEL JORDAN DONALD TRUMP entertainment Follow Us Facebook Twitter Instagram Pinterest YouTube Subscribe Follow UsNewsletter App Subscriptions Subscribe Get Our Newsletter A daily blend of the most need-to-know Daily News stories delivered right to your inbox. Sign Up Get the latest breaking news entertainment sports and more.Download Our App Subscribe to the newspaper our e-edition or both.Subscribe Select Sport Football Basketball Baseball Hockey Soccer College High School More Sports Gossip Games Entertainment Pics TV Movies Music Theater amp; Arts Share This facebook Tweet email Neighbors 2 Sorority Rising has Seth Rogen and Zac Efron giving feminism the old college try Neighbors 2 Sorority Rising gives feminism old college try BY Edward Douglas NEW YORK DAILY NEWS Tuesday May 17 2016 210 PM facebook Tweet email BY Edward Douglas NEW YORK DAILY NEWS Tuesday May 17 2016 210 PM Title Neighbors 2 Sorority Rising Film Info With Seth Rogen Rose Byrne Zac Efron Chloe Grace Moretz Ike Barinholz Dave Franco Selena Gomez. Rogen and Byrne face more noisy neighbors and unexpected enlightenment in this sequel. Director Nicholas Stoller.(Running Time 132) R Rude sexual content including brief graphic nudity language throughout drug use and teen partying. Area theaters. The gender may have changed but the stakes and laughs remain high in ""Neighbors 2 Sorority Rising."" The sequel to the 2014 R-rated comedy once again pits grown-ups against the noisy kids next door but its much more than a rehash of the same premise. Two years after the original ""Neighbors"" Mac and Kelly Radner (Seth Rogen Rose Byrne) have finally found a buyer for their house but this time a new sorority created by Chloe Moretzs Shelby and her friends are causing them just as much grief. The sorority is set up with the sole purpose to give the sisters the chance to party like their frat brothers do but loud bashes will likely scare away the couples buyer. Sisters Act (From l.) Carla Gallo Rose Byrne Seth Rogen Ike Barinholtz and Zac Efron observe the enemy in Neighbors 2 Sorority Rising. (Photo Credit Chuck Zlotnick) Meanwhile the Radners old frathouse rival Teddy Sanders (Zac Efron) feels like hes not living up to his potential so he offers his consulting services to Shelby so her sorority can make the money necessary to pay rent. Meet the women behind Neighbors 2 Sorority Rising ""Neighbors 2"" offers quite a few new tricks from the original comedy if only because it forces the Radners to face the fact that someday their adorable 2-year-old daughter might grow up to be one of those partying hellions keeping them up all night. At first they think that dealing with a sorority has to be handled slightly more tenderly than the rowdy fratboys from the first movie but they quickly learn that college girls have the potential to be even more formidable than their male counterparts. The Abs and the Abs-Nots Efron and Rogen have a lot to learn on campus in the sequel to 2014s Neighbors. (Photo Credit Universal Pictures) Most of the characters from the original ""Neighbors"" return some in larger roles than others but once again director Nicholas Stoller finds a way to create resonance with the audience whether its parents trying to raise young daughters or teen girls rooting for Selby and friends. Hes quite good at creating comedy that is gender-neutral making ""Neighbors 2"" perfectly fine as a date movie for couples. But ""Neighbors 2"" isnt just a battle of the sexes. Kelly -- pregnant with the couples second daughter -- doesnt want to squash Shelbys female empowerment so it becomes more about how the unimpressionable texting teens view their elders. Even Teddy is eventually thrown to the curb for being too old and boring which is when he switches sides and agrees to help Kelly and Mac with their problem. Chloe Moretz to star in The Little Mermaid The ladies of Kappa Nu are led by Chloe Grace Moretzs Shelby (c.) (Photo Credit Chuck Zlotnick) Any attempt at deeper themes aside ""Neighbors 2"" is hilariously funny as it continues to keep the jokes moving at a fast pace paying homage to some of the gags from the earlier movie but always giving them a different spin. Rogens well-established routine is clearly maturing with age helped by the likes of Byrne who continues to prove her worth as a comic actress. Efrons also quite funny -- and when all else fails he can remove his shirt. With the added layer of humor that comes with switching genders ""Neighbors 2"" ends up offering even more laughs than the original movie. Tags movie reviews neighbors 2 seth rogen rose byrne chloe grace moretz zac efron Send a Letter to the Editor Join the Conversation facebook Tweet PC Richard and Son Get Daily News stories delivered to your inbox. Sign Up Follow Us Facebook Twitter Instagram Pinterest YouTube Keep in Touch Newsletter Apps Subscribe Feeds Support amp; Contact Contact Us Careers Media Kit Site Map Terms of Use Ad Choices Terms of Service Privacy Policy Daily News Covers (c) Copyright 2016 NYDailyNews.com. All rights reserved.",http://www.nydailynews.com/entertainment/movies/neighbors-2-sorority-rising-feminism-old-college-article-1.2640011,200,neighbors27,neighbors,nydailynews
