review,link,status_code,id,movie_key,critic
"Next Friday | EW.com Skip to main content Sign In Log Out TV TV Recaps Movies Music Books Gaming Video Big Brother Queen of the South Mr. Robot Wayward Pines Suits Tyrant Shop Newsletter Subscribe Get 1 year for 25 Save 86% off the cover price SUBSCRIBE More Great Stuff Comic-Con Hulu Hot List 50Scoops EW Popfest For Your Consideration Jess Cagle Interview Stage Follow EW EW on Facebook EW on Twitter EW on Tumblr EW on Instagram About EW Contact UsCustomer ServiceAbout UsJobs at Time Inc.AdvertisePrivacy PolicyYour California Privacy RightsAd ChoicesNewslettersSubscribeTerms of ServiceSite Map Copyright 2015 Entertainment Weekly Inc. All rights reserved. Login Log out TV TV Recaps Movies Music Books Gaming Video More... TV This Weeks Cover The Walking... TV Exclusive Photos of The Walking... EW POPFEST Get the details 50Scoops50Days Exclusive... Movies Crazy Stupid Love Before Th... Movies The Most 2000s Fashion From Joh... Movies 27 Great Revenge Movies Movies Alice in Wonderland Witticism... Movies John Tucker Must Die Where Ar... Books 15 Captivating International Cri... Movies Planet of the Apes See the Fa... Movies Toronto Film Festival 2016 See... TV One Tree Hill Where Are They... Movies Little Miss Sunshine Where Ar... Books Harry Potter and the Cursed Chi... Movies Comic-Con 2016 See Portraits of... TV Friends See the Casts Evolut... TV Comic-Con 2016 Get Batty With... Movies The Dark Tower Storybook Steph... News Comic-Con 2016 Star Portraits... TV 10 of the Best Moments From The... Movies The Dark Tower Storybook Steph... Movies Thelma and Louise See Rare Behi... Movies 9 of Garry Marshalls Best Movies Movies Every Star Trek Movie Ranked Movies Big Trouble in Little China... Movies The Dark Tower Exclusive Firs... Movies Suicide Squad Before They Wer... Movies The 10 Best Movies of 2016 (So Far) TV Fear the Walking Dead introduc... Movies by Owen Gleiberman Share Tweet Share on Google+ Share on Pinterest Share on Tumblr Next Friday As a screenwriter Ice Cube has a gift for creating rowdy riotously self-absorbed flakes -- fools who think theyre players. For a while ...Next FridayComedyIce CubePT92MR As a screenwriter Ice Cube has a gift for creating rowdy riotously self-absorbed flakes -- fools who think theyre players. For a while ...2000-01-21Don D.C. CurryTamala JonesTiny ListerJohn WitherspoonDon D.C. Curry Tamala Jones Tiny Lister John WitherspoonNew Line Cinema C+ Next Friday Genre Comedy; Starring Mike Epps Ice Cube Don D.C. Curry Tamala Jones Tiny Lister John Witherspoon; Director Steve Carr; Author Ice Cube; Release Date Wide 01/12/2000; Runtime (in minutes) 92; MPAA Rating R; Distributor New Line Cinema Posted January 21 2000 -- 1200 AM EST As a screenwriter Ice Cube has a gift for creating rowdy riotously self-absorbed flakes -- fools who think theyre players. For a while Next Friday the sequel to the 1995 sleeper hit Friday dawdles with amiable shagginess as it follows Craig (played once again by Ice Cube who also produced) the chunky impassive hero out to the L.A. suburbs where he goes to live with his Uncle Elroy (Don ""DC"" Curry) and cousin Day-Day (Mike Epps) who have used their lottery winnings to escape South Central. The movie is a comic cavalcade of screwups and hucksters most of whom are so myopically focused on the pleasures and problems right in front of them that theyre completely cut off from the larger world. Asked if he has any of his lottery booty left Day-Day a vain petty scoundrel who has abandoned his pregnant girlfriend because he fantasizes that hes a righteous pimp replies with utter seriousness ""I dunno -- I done went and bought some shoes."" As long as Ice Cube is scripting moments like that or the one in which the motormouth hedonist Uncle Elroy says ""Im about to show yall who the real Puff Daddy is"" as he lights up a cigar stuffed with reefer Next Friday in its winning slovenly way evokes the early Cheech and Chong movies. The first Friday had a lackadaisical day-in-the-life-of-the-hood structure that felt true to the world it was portraying. It also had Chris Tucker who in his breakout role gave the movie a hotfoot. He isnt in this one but that might not have mattered so much had the gap been filled by another wild-card actor or two. Instead we get a dull revenge plot in which Craig attempts to escape the gargantuan local bully Debo (Tommy ""Tiny"" Lister Jr.) whom he beat up at the end of Friday. The movie starts high gradually bogs down then dies. Still theres no doubt that Ice Cube is a spry distinctive talent behind the camera. Ive always found his acting a bit too consciously stoic but The Players Club the 1998 movie he wrote and directed was vibrant and funny and dramatic and the best parts of Next Friday are like its predecessor the raw stuff of a comedy of urban manners. C+ Share Tweet Share on Google+ Share on Pinterest Share on Tumblr Top Stories Fast and Furious 8 Dwayne Johnson dives for cover in new set video Kanye West on Apples talks with Tidal Let the kids have the music A Chorus Line kicks up the classics at the Hollywood Bowl Sarah Jessica Parker New HBO show isnt Sex and the City The Larry Sanders Show reruns returning to HBO this fall Stranger Things cast and fans scared with even Stranger prank HBO chief spars with critics over rape scenes Photo Galleries 50Scoops50Days The Latest in Fall TV News The Biggest Moments From the 2016 Conventions Crazy Stupid Love Before They Were Stars The Most 2000s Fashion From John Tucker Must Die Exclusive Photos of The Walking Dead Season 7 27 Great Revenge Movies Alice in Wonderland Witticisms and Wisdom From the Disney Classic From Our Partners From Our Partners Contact UsCustomer ServiceAbout UsJobs at Time Inc.AdvertisePrivacy PolicyYour California Privacy RightsAd ChoicesNewslettersSubscribeTerms of ServiceSite Map Copyright (c) 2016 Entertainment Weekly Inc. All rights reserved. img[data-src] { display none important; }","http://www.ew.com/ew/article/0,,275210,00.html",200,nextfriday3,nextfriday,ew
"Ice Cube Warms Up In Delightful `Friday / Comedy sequel scores with nonstop gags - SFGate Subscribe Sign In Home Contact SFGate Contact SFGate Customer Support Submissions amp; Tips Classifieds About SFGate About SFGate FAQ Register on SFGate SFGate Newsletters SFGate Staff Careers Site Index Hearst About The Chronicle About The Chronicle The Chronicle Staff Become a Subscriber Manage Your Subscription Customer Service Careers e-edition Back Copies Chronicle in Education Corrections Advertise with Us More on Advertising More on Advertising Place a Classified Ad About Our Ads Public Notices Local Business Directory Place an Obituary Gate List Store Privacy policy Privacy policy Ad Choices Chronicle Archives Terms of Use Newsletters Get news alerts SFGate Customer support Get VIP access with SF Chronicle Membership Get SFGate newsletters for the latest from the Bay Check out the Top 100 Bay Area restaurants News Bay Area amp; State Traffic Nation World Politics Crime Election Results Obituaries Tech Health Education Video News Blogs Coast Guard searching delta region for three missing people Fire in Big Sur area grows 15 percent contained Little shaker 2.7-magnitude earthquake rattles Bay Area 2 men held after 2 San Diego officers shot 1 fatally Sports 49ers Raiders Giants As Olympics Warriors Sports Blogs Sports Calendar MLB NBA College Preps Golf Outdoors Raiders GM McKenzie gets 4-year extension Cal football position preview Linebacker How low can Giants go? Latest loss comes with a triple play Rich Hills blister problem As success muddle trade outlook Business Technology Mortgage Rates Home Guides Public Notices Sponsored Content Office Space The Tech Chronicles Net Worth Plus Fossils amp; Photons Mind Your Business VisionSF Jobs Price Point 649000 in San Bruno ICYMI Can Chipotle be a burger king? Redstones potential Victorian duplex in SOMA open Sunday Three bedroom apartment in San Franciscos Financial District Entertainment The Daily Dish Movies Music amp; Nightlife Performance Art Blogs Videos Events Puzzles TV Horoscope Comics Crosswords amp; Puzzles Things To Do Jason Bourne is a shaky smeary mess The latest from Dear Abby ""Bad Moms"" mixes sentiment with raunch and ends up vulgar Phantom Boy is fast-paced but slight animated fun Food Restaurants Wine Top 100 Restaurants Chronicle Wine Competition Reservations Beer News Inside Scoop SF Healthy Eating Angele Chef shuffle at Napa French restaurant Napa blockbuster Ninebark is closing (temporarily) Check out the food (and menu) at Black Cat now open in the Lights go out at La Rondalla longtime Mission dining spot Living Home amp; Garden Style Parties Lust LGBT Mommy Files amp; Parenting Houzz Outdoors Blogs Sponsored Schools Camps amp; Activities Exploring night photography locations in the Bay Area Couple from different cultures find love is a common ground Heres the most popular video game from the year you were born More Crystal Basin campsites are available with start of Olympics Travel Destination BC Exotic Destinations Monterey-Carmel Weekend Getaways Wine Country Napa Reno-Tahoe Hawaii Caves offer older view of the Continent Traveling to Big Sur? What you need to know Suite Spot Ritz-Carlton Philadelphia Rick Steves Europe Drink in a city through cafe culture Real Estate New Homes Open Homes Luxury Rentals Mortgage Rates Commercial Place an ad Home Guides Home Sales On the Block Blog Hot Property Sebastopol Italianate estate enjoys ocean views How much space do you get for 1500 a month? Hillcrest Estate possibly owned by baseball Hall of Famer Joe Cars Dealers Click and Clack Car Blog My Ride Sell Your Car First Buick ragtop since the 91 Reatta A cherished Nash-Healey Roadster Past Phantom still turning heads Teslas Model S can be used as a boat in a pinch Jobs Job Events Advertise Salary Wizard Get To Work Consider the red flags when staying in a job you dislike Declutter your job search The job gap explanation How to impress an interviewer with non-verbal language Findamp;Save Chronicle Latest columns Michael Bauer Leah Garchik Bruce Jenkins Esther Mobley Ann Killion Thomas Lee Matier amp; Ross C.W Nevius Kathleen Pender Scott Ostler Special Report Forgotten Survivors of AIDS The ultimate NorCal brewery map Top 100 Restaurants Warriors show their style off the court MenuSections http//www.sfgate.com/movies/article/Ice-Cube-Warms-Up-In-Delightful-Friday-Comedy-2812111.php Ice Cube Warms Up In Delightful `Friday / Comedy sequel scores with nonstop gags Mick LaSalle Chronicle Staff Critic Published 400 am Wednesday January 12 2000 NEXT FRIDAY Comedy. Starring Ice Cube Mike Epps John Witherspoon and Don ""DC"" Curry. Directed by Steve Carr. (R. 92 minutes. At Bay Area theaters.) . ""Next Friday"" is an extremely funny movie and this is coming from someone who barely cracked a smile during ""Friday"" the first installment of this franchise. It stars and was written by rap star and actor Ice Cube which means a lot of middle-aged white people will go no further than this sentence. They will assume that ""Next Friday"" is a niche picture pitched to an audience that doesnt include them. Wrong. This movie is a find a delight for adults of all ages -- as funny as ""Dumb and Dumber"" and ""Theres Something About Mary"" though without the latters cruelty. ""Next Friday"" has the inventive silliness of those two movies the comic spirit the vulgarity and the nonstop laughs. The picture which opens today is the best comedy of the decade -- for the time being. ""Friday"" ended with Craig (Cube) a young man from South Central beating up a huge guy named Debo (Tommy Lister Jr.) who was subsequently thrown into prison. Now Debo has broken out and to avoid another showdown Craig is sent to the suburbs to stay with his uncle Elroy (Don ""DC"" Curry) and cousin Day-Day (Mike Epps). Sound funny yet? ""Next Friday"" is not a comedy of situation. Its one of character. Everyone with the exception of straight man Craig is drawn in extreme terms and the actors most of them alumni of the stand-up comedy circuit give full- out performances. Craigs father (John Witherspoon) is a dogcatcher who talks a mile a minute usually about something disgusting. He tells Craig in detail that he looks forward to his absence so that he and Craigs mom can walk around the house naked and she can give him a lap dance. He eats spicy food and makes mad dashes to the nearest bathroom. Uncle Elroy is another exaggerated creation. He owns a big purple house in the suburbs thanks to winning the Lotto. He struts around in a gold robe calling himself ""the king"" and has a much younger wife who is immediately sex-crazed for Craig. When Craig walks into his uncles bedroom the ambience is like the inside of a sex shop. Who would ever have expected that Ice Cube whose screen demeanor is so serious had such a silly side? He has written a tightly constructed low farce with humor that borders on absurdist and Steve Carr in his feature directing debut doesnt miss an opportunity. He chooses camera angles for maximum comic impact and the performances are just right straddling the line between the real and the ridiculous. The story doesnt matter though there is one -- Cube and his cousin have to come up with 3900 in taxes or else Uncle Elroy will lose his house. The important thing is that the story serves as a clothesline for gags and the gags never stop coming. .. Most Popular 1 Dear Abby I want to contact mistress from 45 years ago 2 Cops Son of billionaire former supermodel arrested after... 3 Ann Coulter Hammered by Conservatives for Smearing US War... 4 Dear Abby I dont want anyone to know that Ive retired 5 Iceland man says Donald Trumps son left white powder at... 6 Oakland-bound medical plane crashes -- 4 killed 7 Inmate charged in 2015 quadruple slaying in S.F. 8 Police Girl 14 slits teens throat in hope of first kill 9 33 signs youre living in the San Francisco bubble 10 San Francisco ranks surprisingly low on the list of 20 Most... Find Showtimes Search Theaters amp; Showtimes -- County -- Alameda Contra Costa Lake Marin Napa San Francisco San Mateo Santa Clara Solano Sonoma Show Movies Now Playing | Recent Releases | Critics Favorites Rated G | PG | PG-13 | R Latest News Coast Guard searching delta region for three missing people Officials believe no survivors in Texas hot air balloon crash Outrage caution from Latino stars in critical election year Little shake 2.7-magnitude earthquake rattles Bay Area Philippine president calls off truce after rebel attack Ann Coulter slammed for calling war heros dad angry Muslim Inmate charged in 2015 quadruple slaying in S.F. Man Trumps son left white powder at rental paid women Parilia Amusement Ball in San Francisco early days View Comments (c) 2016 Hearst Communications Inc. Logo Return to Top About Our Company Careers Advertising Ad Choices Terms amp; Conditions Privacy Policy Your California Privacy Rights Contact Customer Service Newsroom Contacts Connect Facebook Twitter Pinterest Google Instagram Subscribe SFChronicle.com App e-edition The Chronicle Archives Subscription Offers Member Services Hearst Newspapers (c) Copyright Hearst Communications Inc.",http://www.sfgate.com/cgi-bin/article.cgi?f=/c/a/2000/01/12/DD83498.DTL,200,nextfriday4,nextfriday,sfgate
Movie Review - - FILM REVIEW; Sounds Are Loud and in Stereo(types) - NYTimes.com campaign nyt2016_bar1_digi_election_67WXR -- 284133 creative 4_nyt2016_bar1_digi_election_67WXR_lc -- 414592 page movies.nytimes.com/movie/review targetedPage movies.nytimes.com/movie/review position Bar1 1 of 10 articles read SUBSCRIBE NOW How will thiselection impactthe world? Save 40% for one year.Last Chance SUBSCRIBE NOW Subscribe Log In Register Now Help Home Page Todays Paper Video Most Popular Times Topics MoviesA All NYT Saturday July 30 2016 Movies World U.S. N.Y. / Region Business Technology Science Health Sports Opinion Arts Style Travel Jobs Real Estate Autos Search Movies or Showtimes by ZIP Code More in Movies A>> In Theaters Coming Soon Critics Picks On DVD Tickets amp; Showtimes Trailers ArtsBeat E-MAIL Print Movie Review January 12 2000 FILM REVIEW; Sounds Are Loud and in Stereo(types) By LAWRENCE VAN GELDER Published January 12 2000 In the most enjoyable moment of the cinematic lollipop that goes by the title Next Friday a father who has just ripped a tape gag off the mouth of his captive son slaps it right back on rather than listen to any more of his foolishness. Splendid idea. Next Friday is a loud low-level candy-colored sequel to the juvenile 1995 comedy Friday. Produced and written by Ice Cube who is also one of its stars it is notable chiefly for feeding a stereotype of blacks as shiftless layabouts interested mainly in recreational drugs and irresponsible sex. Most of the principal female characters are either sexually voracious sexually promiscuous pregnant out of wedlock or angrily bent on revenge. The principal villains of the film are members of a Hispanic family who are violent criminals and bullies; the secondary villain is a black man who has escaped from prison. From the standpoint of the films characters the butt of comedy is a foul-mouthed Korean woman Miss Ho-Kym (Amy Hill). Even on its own terms which include soundtrack credits for Ice Cube Wyclef Jean and Wu-Tang Clan among others Next Friday directed by Steve Carr can stake no claim to high achievement. The film picks up the life of Craig Jones (Ice Cube) at a time when Debo the hulking menace of Friday has just broken out of the Los Angeles County Mens Central Jail. Craigs father (John Witherspoon) still characterized mainly by his penchant for hot sauce and his bathroom habits decides it would be a good idea to dispatch Craig from South-Central Los Angeles to live in the suburbs with his Uncle Elroy (Don Curry known as D. C.) and his cousin Day-Day (Mike Epps). Uncle Elroy nearly broke though a lottery winner lives with the steamy Suga (Kym E. Whitley) across the way from the vicious and terrifying Joker brothers. Day-Day and his BMW are under siege from the angry pregnant DWana (Tamala Jones) and her henchwoman Baby D (Robin Allen). So on the very day that Uncle Elroy faces the seizure of his 230000 home for a 3900 tax delinquency Debo (Tommy Lister Jr. known as Tiny) has stowed away in Mr. Joness dogcatchers truck en route to Rancho Cucamonga so he can wreak vengeance on Craig. Craig meanwhile has run afoul of the Joker brothers (Jacob Vargas Lobo Sebastian and Rolando Molina) and their pit bull while falling for their beautiful and decent sister Karla (Lisa Rodriguez). Day-Day and his pal Roach (Justin Pierce) have lost their jobs in a record shop. Now its up to Craig to save the day which involves a burglary. But since it is a theft from the Joker brothers who are thieves and drug dealers themselves the film takes the position that its O.K. Naturally everyone converges on the Jokers home at the same time. The conclusion has energy without much originality. Next Friday is rated R (Under 17 requires accompanying parent or adult guardian). It involves coarse language violence drug use and sexual situations. NEXT FRIDAY Directed by Steve Carr; written by Ice Cube based on characters created by Ice Cube and D. J. Pooh; director of photography Christopher J. Baffa; edited by Elena Maganini; music by Terence Blanchard; production designer Dina Lipton; produced by Ice Cube; released by New Line Cinema. Running time 93 minutes. This film is rated R. WITH Ice Cube (Craig Jones) Mike Epps (Day-Day) Justin Pierce (Roach) John Witherspoon (Mr. Jones) Don Curry (Uncle Elroy) Jacob Vargas (Joker) Lobo Sebastian (Lil Joker) Rolando Molina (Baby Joker) Tamala Jones (DWana) Lisa Rodriguez (Karla) Clifton Powell (Pinky) and Tommy Lister Jr. (Debo) Amy Hill (Miss Ho-Kym) Kym E. Whitley (Suga) and Robin Allen (Baby D). More Theaters Near You A>> campaign nyt2014_edu_propensity_cookie_dropper -- 256873 creative nyt2015_edu_personalized_isEDU_cookie_dropper -- 401071 page movies.nytimes.com/movie/review targetedPage movies.nytimes.com/movie/review position Inv1 (c) 2016 The New York Times Company Site Map Privacy Your Ad Choices Advertise Terms of Sale Terms of Service Work With Us RSS Help Contact Us Site Feedback,http://movies.nytimes.com/movie/review?res=9A0CEFDF163AF931A25752C0A9669C8B63&partner=Rotten%20Tomatoes,200,nextfriday5,nextfriday,nytimes
New York | Not Found | Village Voice NewsVLongformThe MTAMediaNYPDPoliticsMake It StopCultureLGBTTop Stories NewsletterMusicVAsk Andrew W.K.New YorkersMusic ListsBars amp; LoungesConcert CalendarMusic NewsletterFood amp; DrinkVNYC Restaurant GuideRestaurant Reviews100 Favorite Dishes99 Essential Restaurants in BKPizzaFood amp; Drink ListsFood amp; Drink NewsletterArts amp; CultureVVisual ArtsTheaterBooksComedyObiesThe Seen A NYC Style GuideTheater NewsletterCalendarVSubmit an EventConcert CalendarThings To Do NewsletterFilm amp; TVVNews amp; InterviewsFilm ReviewsShowtimesTrailersVillage Voice Film PollFilm PodcastFilm amp; TV NewsletterLongformVideosSlideshowsBest Of NYC(r)VArts amp; EntertainmentFood amp; DrinkShopping amp; ServicesSports amp; RecreationReaders ChoiceBest Of NewsletterPromotionsVPromotional EventsStreet TeamFree StuffPromotions NewsletterClassifiedsVMedical Studies Apps About Us Contact Us Staff Careers Advertise E-Edition Privacy Terms menu Remember Me SIGN IN > Forgot Password? Or sign in with a social account FACEBOOK GOOGLE + TWITTER YAHOO Dont have an account yet? Sign Up > Connect. Discover. Share. Get the most out of your experience with a personalized all-access pass to everything local on events music restaurants news and more. Enter your email or sign up with a social account to get started FACEBOOK TWITTER GOOGLE+ YAHOO Privacy Policy SIGN UP > Already registered? Login > Email Username Password Name Zipcode DONE MVN Sign In > Dont have an account yet? Sign Up > Facebook Twitter Follow villagevoice Other MORE That page could not be found. Whoops we cant seem to find what youre looking for. Based upon what we do know here are some search results that you might find useful.  Article Naked Acts 18 years ago by Gary Dauphin Bridgett Daviss indie debut opens with a seriocomic setup an inexperienced African American actress finds her biggest professional challenge isnt remembering her lines but keeping her clothes on. The once chubby Cicely (Jake-ann Jones) has slimmed down enough to win her first role but shes still carrying a few pounds...  Article Jean Shepherd Shepherds Another Annual Rallye 7 years ago by Tony Ortega Clip Job an excerpt every day from the Voice archives. August 6 1964 Vol. IX No. 42 Hubcaps By Daniel List Last Sunday we held a sports car rallye on the outskirts of Washington Square Park and we should certainly be thankful for the high spirits of the contestants. This... Clip Job  Article Two on the Isle 18 years ago by Gary Dauphin Hollywood didnt really discover the black female audience with Waiting To Exhale at least not the way Columbus discovered America. Terry McMillans bestselling romance novel was already a recognized phenomenon before there was a movie version and so the dream industry was just along for the ride. Exhale was a...  Article Continental Drift 18 years ago by Gary Dauphin Decent images of black life are always hard to come by but you almost forget that there was once a time when educated film types questioned with a straight face the material existence of African or African American films. Today between glossy Hollywood-centric black film fests and events like Artmattans...  Article Under the Skin 18 years ago by Gary Dauphin American History X apparently had some paternity issues long before it headed to theaters. A leaden presumptively shocking expose about skinheads and surrogate fathers X was reportedly marred by budgetary squabbles a temporarily AWOL director and an editing-room battle for control of the final cut. Neat industry chatter to be... All 14 results or Back to home (c)2016 Village Voice LLC. All rights reserved. Newsletters All-access pass to the top stories events and offers around town. Top Stories Send Sign Up gt; Remind Me Later gt; No Thanks gt; Privacy Policy Newsletters All-access pass to top stories events and offers around town. Sign Up gt; No Thanks Remind Me Later gt;,http://www.villagevoice.com/issues/0002/dauphin.shtml,404,nextfriday6,nextfriday,villagevoice
