review,link,status_code,id,movie_key,critic
"Next Friday | EW.com Skip to main content Sign In Log Out TV TV Recaps Movies Music Books Gaming Video Big Brother Queen of the South Mr. Robot Wayward Pines Suits Tyrant Shop Newsletter Subscribe Get 1 year for 25 Save 86% off the cover price SUBSCRIBE More Great Stuff Comic-Con Hulu Hot List 50Scoops EW Popfest For Your Consideration Jess Cagle Interview Stage Follow EW EW on Facebook EW on Twitter EW on Tumblr EW on Instagram About EW Contact UsCustomer ServiceAbout UsJobs at Time Inc.AdvertisePrivacy PolicyYour California Privacy RightsAd ChoicesNewslettersSubscribeTerms of ServiceSite Map Copyright 2015 Entertainment Weekly Inc. All rights reserved. Login Log out TV TV Recaps Movies Music Books Gaming Video More... TV This Weeks Cover The Walking... TV Exclusive Photos of The Walking... EW POPFEST Get the details 50Scoops50Days Exclusive... Movies Crazy Stupid Love Before Th... Movies The Most 2000s Fashion From Joh... Movies 27 Great Revenge Movies Movies Alice in Wonderland Witticism... Movies John Tucker Must Die Where Ar... Books 15 Captivating International Cri... Movies Planet of the Apes See the Fa... Movies Toronto Film Festival 2016 See... TV One Tree Hill Where Are They... Movies Little Miss Sunshine Where Ar... Books Harry Potter and the Cursed Chi... Movies Comic-Con 2016 See Portraits of... TV Friends See the Casts Evolut... TV Comic-Con 2016 Get Batty With... Movies The Dark Tower Storybook Steph... News Comic-Con 2016 Star Portraits... TV 10 of the Best Moments From The... Movies The Dark Tower Storybook Steph... Movies Thelma and Louise See Rare Behi... Movies 9 of Garry Marshalls Best Movies Movies Every Star Trek Movie Ranked Movies Big Trouble in Little China... Movies The Dark Tower Exclusive Firs... Movies Suicide Squad Before They Wer... Movies The 10 Best Movies of 2016 (So Far) TV Fear the Walking Dead introduc... Movies by Owen Gleiberman Share Tweet Share on Google+ Share on Pinterest Share on Tumblr Next FridayAs a screenwriter Ice Cube has a gift for creating rowdy riotously self-absorbed flakes -- fools who think theyre players. For a while Next FridayNext FridayComedyIce CubePT92MRAs a screenwriter Ice Cube has a gift for creating rowdy riotously self-absorbed flakes -- fools who think theyre players. For a while Next Friday2000-01-14Don D.C. CurryTamala JonesTiny ListerJohn WitherspoonDon D.C. Curry Tamala Jones Tiny Lister John WitherspoonNew Line Cinema Share Tweet Share on Google+ Share on Pinterest Share on Tumblr GAWK DONT RUN As the star writer and producer of Next FridayIce Cube en C+ Next Friday Genre Comedy; Starring Mike Epps Ice Cube Don D.C. Curry Tamala Jones Tiny Lister John Witherspoon; Director Steve Carr; Author Ice Cube; Release Date Wide 01/12/2000; Runtime (in minutes) 92; MPAA Rating R; Distributor New Line Cinema Posted January 14 2000 -- 1200 AM EST As a screenwriter Ice Cube has a gift for creating rowdy riotously self-absorbed flakes - fools who think theyre players. For a while Next Friday the sequel to the 1995 sleeper hit ""Friday"" dawdles with amiable shagginess as it follows Craig (played once again by Ice Cube who also produced) the chunky impassive hero out to the L.A. suburbs where he goes to live with his Uncle Elroy (Don ""DC"" Curry) and cousin Day-Day (Mike Epps) who have used their lottery winnings to escape South Central. The movie is a comic cavalcade of screwups and hucksters most of whom are so myopically focused on the pleasures and problems right in front of them that theyre completely cut off from the larger world. Asked if he has any of his lottery booty left Day-Day a vain petty scoundrel who has abandoned his pregnant girlfriend because he fantasizes that hes a righteous pimp replies with utter seriousness ""I dunno - I done went and bought some shoes."" As long as Ice Cube is scripting moments like that or the one in which the motormouth hedonist Uncle Elroy says ""Im about to show yall who the real Puff Daddy is"" as he lights up a cigar stuffed with reefer ""Next Friday"" in its winning slovenly way evokes the early Cheech and Chong movies. The first ""Friday"" had a lackadaisical ""day in the life of the hood"" structure that felt true to the world it was portraying. It also had Chris Tucker who in his breakout role gave the movie a hotfoot. He isnt in this one but that might not have mattered so much had the gap been filled by another wild-card actor or two. Instead we get a dull revenge plot in which Craig attempts to escape the gargantuan local bully Debo (Tommy ""Tiny"" Lister Jr.) whom he beat up at the end of ""Friday."" The movie starts high gradually bogs down then dies. Still theres no doubt that Ice Cube is a spry distinctive talent behind the camera. Ive always found his acting a bit too consciously stoic but ""The Players Club"" the 1998 movie he wrote and directed was vibrant and funny and dramatic and the best parts of ""Next Friday"" are like its predecessor the raw stuff of a comedy of urban manners. Share Tweet Share on Google+ Share on Pinterest Share on Tumblr Top Stories Fast and Furious 8 Dwayne Johnson dives for cover in new set video Kanye West on Apples talks with Tidal Let the kids have the music A Chorus Line kicks up the classics at the Hollywood Bowl Sarah Jessica Parker New HBO show isnt Sex and the City The Larry Sanders Show reruns returning to HBO this fall Stranger Things cast and fans scared with even Stranger prank HBO chief spars with critics over rape scenes Photo Galleries 50Scoops50Days The Latest in Fall TV News The Biggest Moments From the 2016 Conventions Crazy Stupid Love Before They Were Stars The Most 2000s Fashion From John Tucker Must Die Exclusive Photos of The Walking Dead Season 7 27 Great Revenge Movies Alice in Wonderland Witticisms and Wisdom From the Disney Classic From Our Partners From Our Partners Contact UsCustomer ServiceAbout UsJobs at Time Inc.AdvertisePrivacy PolicyYour California Privacy RightsAd ChoicesNewslettersSubscribeTerms of ServiceSite Map Copyright (c) 2016 Entertainment Weekly Inc. All rights reserved. img[data-src] { display none important; }","http://www.ew.com/ew/article/0,,64469,00.html",200,nextfriday0,nextfriday,ew
Were sorry we cant find the page that youre looking for Go to the content Go to the footer Time Out New York New York Popular cities London New York Paris Chicago Los Angeles Browse all cities Time Out New York Close New York Change city New York Popular cities London New York Paris Chicago Los Angeles Browse all cities Tickets Events Things to Do Restaurants Bars Movies Theater Music Shopping Attractions Blog Art Travel Nightlife Events amp; Festivals Museums Kids Hotels Comedy Dance LGBT Sex amp; Dating Books City Guide Neighborhoods Promotions Close My Time Out Things I love My lists My Profile My Account Sign out Sign in Create account Sign in With your social account Or with your email Email Password Remember me Forgotten your password? Sign in You can create a Time Out account in two ways... With a few clicks using your favourite social network Or by entering your details below Email First Name Last Name Create password Repeat new password I accept Time Outs terms of use including opt-in to newsletters. Create account Welcome  You have successfully connected your account to Time Out. You may sign in with this account in future. Please confirm your account details Email First Name Last Name I accept Time Outs terms of use including opt-in to newsletters. Sign up My Account Sign in or Create account Search Tickets Events Things to Do Restaurants Bars Movies Theater Music Shopping Attractions Blog Art Travel Nightlife Events amp; Festivals Museums Kids Hotels Comedy Dance LGBT Sex amp; Dating Books City Guide Neighborhoods Promotions More Search Were sorry we cant find the page that youre looking for We have either moved the page or it no longer exists. To help you find your way here are some search results we think may be of interest. Movies Next Friday Less a sequel to Ice Cubes 1995 cult movie Friday more a joke for joke rehash. The scatological humour has not abated and the smoking of weed underlies most major plot points with Craig (Ice Cube) and his sidekick Day-Day (Epps) coming on like a latter-day... Read more Sex and dating Inside a new swingers club on the Lower East Side I imagine that there are many good reasons why you should never attend a swingers club. With the opening of Bowery Bliss--a 4000-square-foot multilevel sexploratorium at the nexus of the Lower East Side Chinatown and Nolita--an unfashionable location... Read more Shopping Mitchells Wine amp; Liquor Store If youre going to spend nearly 20 on a ticket and shell out about the same for snacks you might as well go all-out and grab something to spike your overpriced Coke with. Well-stocked with both wine and liquor this shop is just three blocks from the... Upper West Side Read more Blog A milkshake and sex toy party is coming to NYC And its free? Hell thats enough to turn anyone on. Out of the many sex shops in NYC Babeland throws weekly parties equipped with cool perks like free bubbly naughty gifts with purchase and all the sex advice you could ever need. But this is the first... Read more Music Worship at the altar of Genesis P-Orridge Capitalist ideology divine energy exchange black magic and the occult--conversations with Genesis Breyer P-Orridge chart as erratic a path as the musical trailblazers life trajectory. In 1976 P-Orridge (who uses alternating she and he third-person... Read more Restaurants Le Cirque The unlisted reservation number for Le Cirque 2000 was one of my more valuable possessions in the late 90s--seven digits that would bypass the busy signal and with any luck land me a table before 1045pm one night that month. When I called the listed... Midtown East Read more Bars Rocky Sullivans Insane rent sent this Gramercy-area Irish pub scuttling to Red Hooks former Liberty Heights Tap Room space a sprawling roof-decked haunt with a view of the waterfront. While Rockys still serves brick-oven pizzas also offered at Liberty and brewed-next-door... Red Hook Read more Blog Heres how to see Harry Potter and the Cursed Child in London for only 21 dollars If you literally cant even with the Hamilton lottery we would like to present an alternative the Cursed Child lottery. The two-part stage performance of Harry Potter and the Cursed Child debuted in London on June 7 and its already getting rave reviews.... Read more Blog That guy who dresses as Bane in Times Square needs to GTFO So theres a guy in Times Square who thinks its appropriate to dress as Bane. Yes that Bane the DC supervillain with the muscles and the mask and the silly everythings-a-question voice who spends the last three hours of The Dark Knight Rises (or... Read more Restaurants Sienas Trattoria Fresh ingredients casual and friendly cozy for the family or dinner for two.Sienas Trattoria  conveniently located on the northbound side of Central Park Avenue just before the Cross County Parkway and just down the road from Empire City is an affordable... Read more Top About us Work for Time Out Privacy policy Website terms of use Contact us Get listed Advertising Time Out products Mobile apps Time Out Shop Time Out Guides Time Out Travel Time Out Worldwide Time Out magazine Follow us Facebook Twitter Youtube Instagram Pinterest Spotify Foursquare Time Out New York Site map,http://www.timeout.com/film/reviews/63282/next_friday.html,404,nextfriday1,nextfriday,timeout
"StarTribune.com News weather sports from Minneapolis St. Paul and Minnesota All Sections Search Saturday July 30 2016 Manage Account Log out Log In Subscriptions New Manage Existing eEdition 78deg Forecast Traffic Star Tribune Local Sports Business Opinion Variety Obituaries Classifieds Autos Housing Jobs Home All Sections Search StarTribune Manage Account Log out Log In Subscriptions New Manage Existing Recently Visited Home Local Sports Business Opinion Variety Health Highlights Politics Nation World Science Weather Traffic Video Photography Obituaries Classifieds Autos Housing Jobs Minneapolis St. Paul East Metro North Metro South Metro West Metro Projects Local Columnists Jon Tevlin James Lileks Local Blogs Campus Confidential Class Act Dateline Minnesota Full Disclosure Lileks at Lunch MPLS. STP The Drive Yesterdays News State Fair 10000 Takes Data Drop Twins Vikings Wild Wolves Gophers Colleges Golf Lynx Motorsports Outdoors High Schools Soccer Sports Columnists Dennis Anderson Sid Hartman Patrick Reusse Chip Scoggins Jim Souhan Sports Blogs Access Vikings A Fans View Bloggin Scoggins Dennis Anderson Doug Smith Gold in the Barn Gridiron Gold Ice Gold On the Lynx On the Wolves Patrick+ Randball Russos Rants Sids Scoops Souhan on Sports StribSports Upload The Roman Empire Twins Insider Sports Podcasts Access Vikings Twins Insider Top Workplaces Business Columnists Lee Schafer Neal St. Anthony Business Blogs 3D Economics Food Market Just Listed Lee Schafer Point of Sale The Mill Commentary Editorial Steve Sack Letters Podcasts Playing Politics Books Celebs Comics amp; Games Horoscopes Eat amp; Drink Movies Music Stage amp; Arts TV amp; Media Best of MN Health Home amp; Garden Kids Health Style Taste The Good Life Travel Variety Columnists Gail Rosenblum C. J Variety Blogs Artcetera Escape Artists Greengirls Health Check Lileks  Lunch On Books Table Talk Wingnut World Class View all Obituaries Place an Obituary Notice Place an Ad Garage Sales Estate Sales Merchandise Pets Recreational Vehicles amp; Marina Newspaper Ads Auctions Search Used Vehicles Sell your Vehicle Advertise Rentals Commercial Foreclosures Find an Agent Find a Job Your Resume Your Account Employer A-Z Top Workplaces Post a Job Star Tribune All content Business listings Close Toll unclear in crash of Texas balloon carrying at least 16 2 minutes ago A hot air balloon carrying at least 16 people caught on fire and crashed in Central Texas on Saturday causing what authorities described as a ""significant loss of life."" The Latest Woman near Texas balloon crash saw fireball A look at the deadliest hot air balloon accidents FAA warned of potential for many hot air balloon deaths Local Twin Cities area braces for sex trafficking tied to Super Bowl Ryder Cup 33 minutes ago Local Pokemon Go poses problem for peace at Eden Prairie park memorial 1020am Pokemon Go trainers were out in full force Nation Russia tied to hack of program used by Clintons campaign 816am Trump Comments about Russia Clinton emails were sarcastic Local St. Croix County girl charged in savage attack on brothers girlfriend 737am More top headlines 2 people shot and wounded in Minneapolis 1117am Anoka adds resources to crack down on homeless panhandling 735am Man dies in overnight crash near Hastings 1120am Carver County judge narrows list of potential Prince heirs to at least 6 743am Homegazing Spacecrafting The design for the makeover was inspired by Finnish lake homes of the 1960s. Windows were enlarged to capture views of the backyard pond. Homegazing 1958 St. Louis Park rambler gets Finnish lake home makeover An Eisenhower-era rambler in St. Louis Park was crying out for a makeover telling its remodeling designer what it wanted to be -- clean-lined simple and quiet like a midcentury modern Scandinavian home. You can have it for 550000. A Finnish-inspired makeover New landscaping and overhang solve water problems at Minnetonka home How to grow a garden with natural beauty Sports Chad Greenway again ready to fend off youngsters in his final(?) NFL season 922am Offense gets a hard look during Vikings first practice Dont miss Cottage Grove couple wrap 250K honeymoon treehouse around old bur oak Michael and Paula Bushillas have spent the last few years making their 8-acre property into a shabby-chic romantic venue for new brides and grooms. Sports Fans give Morneau loud return to Target Field 945am Twins pitchers Abad Kintzler could be on the move Variety Midwest Traveler Exploring the revived Eau Claire Wis. Visiting revitalized Eau Claire Wis. Variety 6 reasons to like new Downtown East Commons park near stadium In nod to new stadium Vikings-themed lottery game is launched Opinion Rash Report 2016 campaign narrative defies expectations Like the primaries and the impact of media the DNC hack is just the latest story to morph in a different direction than anticipated. Twin Cities transit projects reach a perilous pass Why Democrats abortion stance is a deal-breaker Sports Offense gets a hard look during Vikings first practice Fans give Morneau loud return to Target Field Chad Greenway again ready to fend off youngsters in his final(?) NFL season Local Twin Cities area braces for sex trafficking tied to Super Bowl Ryder Cup New public square to liven up W. Broadway in Minneapolis Cottage Grove couple wrap 250K honeymoon treehouse around old bur oak Business After stumbling big Boston Scientific has regained its stride Mike McNamara is weaving a new web for Target IT operations Growing corn like its 2065 to study climate change effects Variety Is J.K. Rowling selling out? Some Harry Potter fans wonder 168 shows 850 performances 11 days Why Minnesotas Fringe Fest matters Husker Dus Grant Hart on full display in Walker exhibit Blogs Access Vikings Mike Harris calls illness mild setback no set timetable for return Paul Douglas on Weather Good-Looking Weekend; More Hot Encounters Scheduled for August Twins Insider Postgame Nolasco finished his extra-long start with a flourish The Drive Right turns across LRT tracks now legal at 5th and 5th but dont get used to it Todays Video http//www.startribune.com Raw video Patterson injured after spectacular catch 0021Cordarrelle Patterson left Vikings practice after a spectacular catch over cornerback Jabari Price Now Playing Raw video Patterson injured after spectacular ... Now Playing Special prosecutor added to help with Castile ... Now Playing C.J. Outrageous Davis strives to be Dave ... Now Playing Afternoon forecast Partly sunny with a high ... The StreamNews updates from around the Web most read most watched Toll unclear in crash of Texas balloon carrying at least 16  Nation Twin Cities area braces for sex trafficking tied to Super Bowl Ryder Cup  Minneapolis 1958 St. Louis Park rambler gets Finnish lake home makeover  Variety Offense gets a hard look during Vikings first practice  Vikings Fans give Morneau loud return to Target Field  Twins Raw video Patterson injured after spectacular catch  Vikings Nunez Its tough to leave Twins  Sports Clinton With no ceilings the skys the limit  Politics Special prosecutor added to help with Castile shooting case  Video Vikings Greenway hints this could be final year  Vikings Most Shared 1958 St. Louis Park rambler gets Finnish lake home makeover  Variety Right tool for the job? Master gardener shares her favorites  Variety Wisconsin doubles down on dairy distinction with goat farms  Local Choi adds special prosecutor to probe of Castile shooting  East Metro Have a flight at MSP? Exhibit shows history of Minnesota food (and drink)  Variety Follow Us On Facebook Twitter Google+ Pinterest Instagram Tumblr World Philippine president calls off truce after rebel attack Security suddenly boosted at Amsterdams Schipol Airport Nation Reagan shooter Hinckleys return to normalcy has been years in making Powerball 478 million jackpot is nations 8th largest Politics Russia tied to hack of program used by Clintons campaign Gov. Mark Dayton looks back on 40 years of Democratic National Conventions markets get quote symbol lookup 20 minute delay last updated new stadium a look inside Go inside U.S. Bank Stadium the new star of the north Top Workplaces Beer in the office? Top Workplaces offer unusual incentives to attract workers Transparency and straight talk are not just buzzwords at top large companies Celebrities Latest late-night battle Stephen Colbert vs. corporate lawyers Fox 9s Jonathan Choe takes his talent and sartorial style home to Boston Twins Fans give Morneau loud return to Target Field Twins win on Mauers pinch-hit walk-off walk Vikings Offense gets a hard look during Vikings first practice Day 1 injuries to Patterson Peterson dont worry Vikings coach Zimmer poll Poll If Hillary becomes president what title will Bill have? Should Hillary Clinton become the president Bill Clinton would become the first male White House ... 10000 Takes The art of parting We used to spend so much time there How I came to see bipolar disorder as my greatest strength Featured Gallery Photos This mid-century home for sale in Golden Valley is like walk... 13 photos Wallpaper wallpaper wallpaper. Listed for 674900. Featured Video A new generation of black leaders say Jamar Clark made the struggle... 0328 Hear from the new generation of black leaders about challenges they face addressing ... special feature Find the summer fun Whats your flavor? Summer in Minnesota offers something for everyone. StarTribune Follow Us On Facebook Twitter Google+ Pinterest Instagram Tumblr Company About the Star Tribune Contact us Jobs News in Education City Pages High school sports hubs Mobile and tablet apps Advertise with us Talk with a business consultant Media kit Classifieds Buy Star Tribune Store Photo Reprints Archived articles Back Copies Commercial reprints Licensing Customer support Feedback Manage your account Newspaper subscription Digital access eEdition Vacation hold/billing Website Terms of use Privacy policy Site index RSS (c) 2016 StarTribune. All rights reserved.",http://www.startribune.com/stories/389/37917.html,200,nextfriday2,nextfriday,startribune
