review,link,status_code,id,movie_key,critic
Old School directed by Todd Phillips | Film review Go to the content Go to the footer Time Out London London Popular cities London New York Paris Chicago Los Angeles Browse all cities Time Out London Close London Change city London Popular cities London New York Paris Chicago Los Angeles Browse all cities Tickets Offers Things to Do Restaurants Bars amp; Pubs Film Theatre Art Music Attractions Blog Theatre Tickets Shopping Offer of the Day Time Out Card Time Out Escapes Time Out Live Hotels Nightlife Music festivals Events amp; Festivals Kids Museums Clubs Comedy Food amp; Drink Classical Music amp; Opera Dance LGBT City Guide Area Guides Property Competitions Dating Close My Time Out Things I love My lists My Profile My Account Sign out Sign in Create account Sign in With your social account Or with your email Email Password Remember me Forgotten your password? Sign in You can create a Time Out account in two ways... With a few clicks using your favourite social network Or by entering your details below Email First Name Last Name Create password Repeat new password I accept Time Outs terms of use including opt-in to newsletters. Create account Welcome  You have successfully connected your account to Time Out. You may sign in with this account in future. Please confirm your account details Email First Name Last Name I accept Time Outs terms of use including opt-in to newsletters. Sign up My Account Sign in or Create account Search Tickets Offers Things to Do Restaurants Bars amp; Pubs Film Theatre Art Music Attractions Blog Theatre Tickets Shopping Offer of the Day Time Out Card Time Out Escapes Time Out Live Hotels Nightlife Music festivals Events amp; Festivals Kids Museums Clubs Comedy Food amp; Drink Classical Music amp; Opera Dance LGBT City Guide Area Guides Property Competitions Dating More Search Old School Film  Comedy 5 out of 5 stars (4 user reviews) 0 Love It Save it 4 Add review 0 Love It Save it Time Out says Details Users say (4) 5 out of 5 stars Time Out says Thirty-something Mitch (Wilson) comes home after a hard days executive graft to find his girl watching a skinflick and a couple of blindfolded swingers lining up to test the mattress. Sheesh His buddies arent exactly having a ball either. Freshly married Frank (Ferrell) is itching to misbehave and electronics store owner Beanie (Vaughn) thinks responsibility is what happens to the unlucky guys - and he should know. Wouldnt it be cool decide the trio if they formed a fraternity. You know with parties ritual initiation goonery and none of the seminars. But theres a catch the villainous dean of their new school is out to spoil their fun. Director Phillips (Road Trip) confesses to frat membership in his youth and even made a documentary on the subject. So why is this not funnier or more outrageous? Sure theres humiliating mischief and the girlfriends blowjob class is some kind of gory highlight. But no ones heart seems to be in the enterprise. By SCr Details Release details Duration 91 mins Cast and crew Director Todd Phillips Screenwriter Todd Phillips Scot Armstrong Cast Luke WilsonWill FerrellVince VaughnEllen PompeoJuliette LewisLeah ReminiPerrey ReevesCraig KilbornJeremy PivenElisha CuthbertPatrick CranshawSeann William Scott Users say (4) 5 out of 5 stars Average User Rating5 / 5Rating Breakdown5 star24 star03 star02 star01 star0LiveReviews|41 person listeningSign inWrite reviewMost helpfulMost helpfulHighest ratingLowest ratingNewestOldestLoadingundefinedNew CommentsRefreshJun 4 2013MadieFeaturedIt is genuinely funnyFlagShareHelpful?Yes|NoReplyJun 4 2013MadieFeaturedIt is genuinely funnyFlagShareHelpful?Yes|NoReplyJul 29 2008TomFeaturedyouve got a fricken dart in your neckFlagShareHelpful?Yes|NoReplyJul 29 2008TomFeaturedyouve got a fricken dart in your neckFlagShareHelpful?Yes|NoReplyShow More Share Tweet 0 Shares Top About us Work for Time Out Privacy policy Cookie Policy Website terms of use Contact us Time Out for business Get listed Claim your listing Premium Profiles Advertising Time Out products Time Out Card Mobile apps Time Out Shop Time Out Guides Time Out Travel Time Out Offers Time Out Worldwide Time Out magazine Where to get Time Out magazine Subscribe to Time Out magazine Manage my subscription Follow us Facebook Twitter Youtube Instagram Pinterest Spotify Time Out London Site map },http://www.timeout.com/film/65981.html,200,oldschool0,oldschool,timeout
"New York | Not Found | Village Voice NewsVLongformThe MTAMediaNYPDPoliticsMake It StopCultureLGBTTop Stories NewsletterMusicVAsk Andrew W.K.New YorkersMusic ListsBars amp; LoungesConcert CalendarMusic NewsletterFood amp; DrinkVNYC Restaurant GuideRestaurant Reviews100 Favorite Dishes99 Essential Restaurants in BKPizzaFood amp; Drink ListsFood amp; Drink NewsletterArts amp; CultureVVisual ArtsTheaterBooksComedyObiesThe Seen A NYC Style GuideTheater NewsletterCalendarVSubmit an EventConcert CalendarThings To Do NewsletterFilm amp; TVVNews amp; InterviewsFilm ReviewsShowtimesTrailersVillage Voice Film PollFilm PodcastFilm amp; TV NewsletterLongformVideosSlideshowsBest Of NYC(r)VArts amp; EntertainmentFood amp; DrinkShopping amp; ServicesSports amp; RecreationReaders ChoiceBest Of NewsletterPromotionsVPromotional EventsStreet TeamFree StuffPromotions NewsletterClassifiedsVMedical Studies Apps About Us Contact Us Staff Careers Advertise E-Edition Privacy Terms menu Remember Me SIGN IN > Forgot Password? Or sign in with a social account FACEBOOK GOOGLE + TWITTER YAHOO Dont have an account yet? Sign Up > Connect. Discover. Share. Get the most out of your experience with a personalized all-access pass to everything local on events music restaurants news and more. Enter your email or sign up with a social account to get started FACEBOOK TWITTER GOOGLE+ YAHOO Privacy Policy SIGN UP > Already registered? Login > Email Username Password Name Zipcode DONE MVN Sign In > Dont have an account yet? Sign Up > Facebook Twitter Follow villagevoice Other MORE That page could not be found. Whoops we cant seem to find what youre looking for. Based upon what we do know here are some search results that you might find useful.  Article The Queer Issue The New Gayborhoods of Fort Greene Sunset Park and Jackson Heights 7 years ago by Michael Lavers Hunky bartender Alejandro Torres literally puts on a show each night that he works at Friends Tavern on Roosevelt Avenue Jackson Heights main drag. Patrons rub his bare chest with baby oil before he ""swims"" up the bar as a fellow bartender sprays him with water to shouts of ""!Fuego...  Article The Queer Issue A Guide for Gays 7 years ago by John Russell This year Pride is laden with heavy political context--Stonewalls 40th anniversary Prop. 8 marriage victories in Iowa Vermont Maine and New Hampshire and the continuing ""Dont Ask Dont Tell"" fiasco. But good old-fashioned demonstrating wont keep thousands of gayboys from squeezing into their skinny jeans and muscle tanks and hitting...  Film Barefoot in the Park (1967) Rating NR Genre Classic Comedy Based on the hit Broadway play by Neil Simon who made his screenwriting debut with this adaptation Barefoot In The Park follows the lives of newlyweds Paul (Robert Redford) and Corie Bratter (Jane Fonda) as they adjust to married life in a tiny Greenwich Village apartment. Paul is a buttoned-down straight-arrow lawyer whos wound a little...  Article The Queer Issue A Nightlife Guide for Dykes 7 years ago by Sharyn Jackson Not that we didnt love The L Word but New York girls have reclaimed their rightful place as the center of the lesbian universe. You wont find West Hollywoods clueless starlets or faux futches on our dance floors. No girlfriend what you get here is full-on dyke realness. With girly...  Article Park Here? 18 years ago by J.A. Lobbia At the far western end of Canal Street near the Hudson River cars cabs and heavy trucks muscle their way to the Holland Tunnel and Manhattan Bridge whipping past a desolate scrap of land. Bordered by concrete slabs and littered with piles of rebar and stacks of lumber the wedge-shaped... All 2645 results or Back to home (c)2016 Village Voice LLC. All rights reserved. Newsletters All-access pass to the top stories events and offers around town. Top Stories Send Sign Up gt; Remind Me Later gt; No Thanks gt; Privacy Policy Newsletters All-access pass to top stories events and offers around town. Sign Up gt; No Thanks Remind Me Later gt;",http://www.villagevoice.com/issues/0309/park.php,404,oldschool1,oldschool,villagevoice
"Old School | Variety Variety Editions U.S Latino Global Asia Subscribe Today Navigation Menu Film TV Digital Contenders Video Dirt Jobs More Biz Music Legit Scene Conferences Insight Archives Directory Choose Edition U.S Latino Global Asia Russia | My Account Sign In Subscribe HomeFilmReviews Review Old School Dennis Harvey Film Critic 0 Share This Article Email LinkedIn Pin It Tumblr February 12 2003 | 0530PM PT ""Old School"" is this years kinder gentler ""Animal House."". Slickly made diverting albeit unmemorable effort from director Todd Phillips and his co-scenarist Scot Armstrong isnt half so fresh or funny as their prior feature ""Road Trip."" Still its lively and different enough from concurrent releases to score just as well with the same demographic. This article was corrected on Feb. 13 2003. A comedy about grown-ups pitched at auds young enough to think college is a nonstop party youd never want to end ""Old School"" is this years kinder gentler ""Animal House"" -- as if anyone needed ""Animal House"" to be kind or gentle. Slickly made diverting albeit unmemorable effort from director Todd Phillips and his co-scenarist Scot Armstrong isnt half so fresh or funny as their prior feature ""Road Trip."" Still its lively and different enough from concurrent releases to score just as well with the same demographic with some crossover to twenty- and thirtysomethings. Prologue has realtor Mitch (Luke Wilson) returning early from a miserable days business travel only to find live-in girlfriend Heidi (Juliette Lewis) engaged with two undressed blindfolded playmates. He moves out -- into a rental home just off-campus in the town where his college buds Frank (Will Farrell) and Beanie (Vince Vaughn) still live. Beanie whos got a wife and kids but suffers from a serious case of bachelor-days nostalgia decides the new house will be Party Central -- and since hes owner of an audio-equipment chain the massive kickoff fest manages to get Snoop Dogg and crew as its ""house band."" Frank meanwhile is newly wed to Marissa (Perrey Reeves). She graciously allows him a ""boys night out"" then is mortified when the notorious ""Frank the Tank"" of yore -- who emerges like a John Belushi Dr. Jekyll after a copious amount of brewskis- is spotted streaking down Main Street. This bacchanal attracts the attention of the male trios former teasing target Pritchard (Jeremy Piven) whos now the universitys Dean. Intending to get the juvenile grownups thrown out he has the house re-zoned as campus housing. However Beanie finds a loophole -- theyll start their own fraternity. Craving quiet rather than collective madness after his recent spousal trauma Mitch is a reluctant joiner. But hes already got Frank as a housemate -Marissa having given him the boot -- so why not. As pledges are put through hazing paces the ""frats"" anything-goes reputation (complete with KY-jelly topless wrestling contests) spreads like wildfire a fact that does not aid Mitchs earnest romantic pursuit of Nicole (Ellen Pompeo) a divorcee hed had a crush on years earlier. Meanwhile Pritchard uses increasingly underhanded means in trying to shut the house down. Pic lacks cumulative momentum or any especially hilarious setpieces to this point. But laugh quotient does jump a few notches with a climax that has the fraternity brothers forced to prove themselves worthy before an evaluation board -- including debating against surprise guest James Carville -- before a final confrontation with the vengeful Pritchard. Compared with the clever situations and sunny attitude of ""Road Trip"" ""Old School"" is less imaginative and more forced -- the attempts to feign depth via semi-serious narrative developments especially in Mitchs dealings with Nicole come off half-baked and unnecessary. Ample chances to lampoon aspects of college and civilian life are seldom taken. Script lacks verbal wit with rote substitution of cusswords (not to mention a few dismaying homophobic jokes). Nor are lead characters as idiosyncratically defined as one might like though all are well played Wilsons protag is pretty much your basic Nice Guy while the mix of misogyny and middle-class dad in Vaughns figure is pushed just far enough to be slightly creepy but not far enough to be a wellspring of outre humor. The reliably funny Farrells periodic party-monster outbursts amuse though hes had better material. Piven makes a dull villain (wheres ""Rock n Roll High Schools"" Mary Woronov when you need her?). In addition to Carville and Snoop there are middling cameos by ""Road Trip"" vets Andy Dick and Seann William Scott. Nonetheless ""Old School"" is better paced and more brightly mounted than most youth-skewed comedies of late. Phillips knows how to make an audience feel like its having a good time a knack missing from most such efforts since well ""Road Trip."" As in that pic soundtracked song choices are well above average in terms of variety and ironic kick with particular nods toward such chestnuts as Kansas ""Dust in the Wind"" and Simon amp; Garfunkels ""Sounds of Silence."" Tech contribs are all solid. Old SchoolProductionA DreamWorks release of a Montecito Picture Co. production. Produced by Daniel Goldberg Joe Medjuck Todd Phillips. Executive producers Ivan Reitman Tom Pollock. Co-producer Paul Deason. Directed by Todd Phillips. Screenplay Phillips Scot Armstrong story by Court Crandall Phillips Armstrong. CrewCamera (Technicolor) Mark Irwin; editor Michael Jablow; music Theodore Shapiro; music supervisor Randall Poster; production designer Clark Hunter; art director Max Biscoe; set designer Peter Davidson; set decorator Traci Kirschbaum; costume designer Nancy Fisher; sound (DTS/Dolby Digital/SDDS) Petur Hliddal; supervising sound editors David Hankins John Benson; sound designer Mike Babcock; assistant director Michael Neumann; casting Joseph Middleton. Reviewed at AMC Van Ness 1000 San Francisco Feb. 12 2003. MPAA Rating R. Running time 90 MIN. With Mitch - Luke Wilson Frank - Will Ferrell Beanie - Vince Vaughn Pritchard - Jeremy Piven Nicole - Ellen Pompeo Heidi - Juliette Lewis Lara - Leah Remini Marissa - Perrey Reeves Mark - Craig Kilborn Darcie - Elisha Cuthbert With Patrick Cranshaw Jerod Mixon Seann William Scott Harve Presnel James Carville Snoop Dogg Warren G. Filed Under Perrey Reeves Want to read more articles like this one? SUBSCRIBE TO VARIETY TODAY. Post A Comment 0 Variety Jobs Creative Development Coordinator Triptyk Studios New York New York Account/Project Coordinator (Ad Agency) Petrol Advertising Burbank California Media Specialist Bridgewater Associates Westport Connecticut Executive Director Aspen Film Company Confidential Aspen Colorado Associate Director YouTuber amp; Gamer Partnerships Save the Children Fairfield Connecticut See More Jobs Marketplace Leave a Reply No Comments Cancel reply Comments are moderated. They may be edited for clarity and reprinting in whole or in part in Variety publications. Enter your comment here... Fill in your details below or click an icon to log in Email (required) (Address never made public) Name (required) Website You are commenting using your WordPress.com account. ( Log Out / Change ) You are commenting using your Twitter account. ( Log Out / Change ) You are commenting using your Facebook account. ( Log Out / Change ) You are commenting using your Google+ account. ( Log Out / Change ) Cancel Connecting to %s Notify me of new comments via email. Notify me of new posts via email. More Film News from Variety The Power of Content HBO President On Vinyls Demise On-Screen Violence -TCA Tyler Posey Teen Wolf Star Regrets Im Gay Video -- I Am... Jamie Foxx Wears Puma High-Tops And Unveils New Arsenal Soccer... Sarah Jessica Parker Explains Biggest Difference Between Her... Pokemon Go update for Android has a very annoying feature... Subscribe to Variety Today All The Ways to Get Variety Online Subscription Print Subscription Mobile Apps Newsletters News Alerts Archives Slanguage Dictionary Help Other Variety Products MediaVariety 411 Research amp; DataVariety Insight Archives Premium Email Alerts Real Estate Jobs Access the best entertainment industry data available View the Variety archives dating back to 1905 Get News Delivered To Your Inbox Privacy Policy Your Privacy Rights Terms of Use About Us Advertise Contact Us Google+ The Power of Content Deadline india.com Hollywoodlife hollywood TV Line BGR WWD Footwearnews (c) Copyright 2016 Variety Media LLC a subsidiary of Penske Business Media LLC. Variety and the Flying V logos are trademarks of Variety Media LLC. Powered by WordPress.com VIP Variety411 Your production services resource",http://www.variety.com/review/VE1117919952.html?categoryid=31&cs=1,200,oldschool2,oldschool,variety
USATODAY.com - Old School A toga party upgrade Classifieds | | | Home News Travel Money Sports Life Tech Weather Movies Movies home Box office report DVD releases Music Music home Top albums Top singles Listen Up Music reviews TV TV home TV listings Nielsen ratings Reality Check Critics Corner Idol Chatter Books Books home Top 150 books Columnists Columnists home Robert Bianco Peter Johnson Whitney Matheson Alison Maxwell Craig Wilson Gaming Gaming home Arcade Crosswords Sudoku More Life People Media Mix Pop Candy Photo archive Talk Today Marketplace Real estate Arcade Music Tickets Shopping International Business Index Newspaper Classifieds Posted 2/20/2003 1108 PM     Updated 2/21/2003 336 PM BEYOND WORDS Multimedia View trailer for Old School Photos The many faces of Will Ferrell Old School A toga party upgrade By Mike Clark USA TODAY Old School is in the rambunctiously retro spirit of National Lampoons Animal House-- but with new-millennium twists. Will Ferrell with a little help from his friends reverts to the raucous behavior of his frat-house days in Old School. In lieu of a toga party one scene treats us to an octogenarian fraternity member wrestling two topless townie lookers slathered in KY Gel. Hey theres no stopping progress. Director Todd Phillips and co-writer Scot Armstrong have followed up Road Trip with a college-town farce thats on the slightly high side of boilerplate. Lead Luke Wilson is affably low-key while Vince Vaughn is funnier than he sometimes is. And Will Ferrell who rounds out their frat-house triumvirate takes to his drunken streaking scene down the communitys main drag with what looks like telltale zest. Review of the movie Old School ( out of four) Stars Luke Wilson Will Ferrell Vince Vaughn Jeremy Piven Ellen Pompeo Juliette Lewis Director Todd Phillips Distributor DreamWorks Rating R for some strong sexual content nudity and language Opens Friday nationwide If the leads sound a little ripe for a frat comedy this is the point. Married Vaughn newly married Ferrell and newly unattached Wilson turn Wilsons new digs into a fraternity house to escape a zoning clause that would otherwise enable the unctuous college dean (Jeremy Piven) to shut it down. They stock it with students and non (including the octogenarian) and steadfastly refuse to have anything to do with the school. Its all just an excuse to have parties and even Snoop Dogg himself shows up to entertain at the first one. The movie is so loosely structured that even James Carville shows up in one scene. As a result the throwaway bits (a wedding singer warbling obscenities a deliciously nasty gag during the end credits) tend to be good for guffaws in a way the overall movie is not. During the parts that fizzle maybe you can take the time to ponder what Phillips and Armstrong possibly will attempt in their upcoming movie of Starsky and Hutch. Like all DreamWorks releases Old School begins with the little kid dropping his fishing line off a crescent moon. If theres only paltry poundage on his catch this time out an energetic cast and moderate pacing skills are worth something. Unlike most of the lowbrow comedies in theaters these days this one isnt quite a carp. Newspaper Home Delivery - Subscribe Today USATODAY.com partners USA WEEKEND Sports Weekly Education Space.com Home Travel News Money Sports Life Tech Weather Resources Mobile news Site map FAQ Contact us E-mail news Jobs with us Internships Terms of service Privacy policy/Your California Privacy Right Advertise Press Room Media Lounge Electronic print edition Reprints and Permissions Add USATODAY.com RSS feeds The Nations Homepage Copyright 2008 USA TODAY a division of Gannett Co. Inc.,http://www.usatoday.com/life/movies/reviews/2003-02-20-school_x.htm,200,oldschool3,oldschool,usatoday
