review,link,status_code,id,movie_key,critic
"Planes movie review by Chicago Tribunes Michael Phillips - tribunedigital-chicagotribune Sections HomeNewsBusinessSportsAamp;ELifestylesOpinionReal EstateCarsJobs HomeNewsBusinessSportsAamp;ELifestylesOpinionReal EstateCarsJobs Imagine the pitch for Planes... August 08 2013|Michael PhillipsA scene from the Disney movie Planes. (Disney)Scene 1The pitch meeting. Disney executive on one side of the table ""Planes"" director Klay Hall and screenwriter Jeffrey M. Howard on the other.The executive So ... its ""Cars.""Hall Yes ...Howard Thats right ...The executive But with planes.Pause.Howard Yes. Right. ""Cars"" with planes. And some cars. And a truck or two.The executive Fine. Great. I have a 10 oclock but fine. Thanks. Lorraine can validate your parking on the way out.Scene 2The follow-up meeting.The executive We like it. We like what were seeing with the storyboards fellas. ""Planes"" may be going straight to video but we like to feel good about where things are going even if this isnt a Pixar project the way ""Cars"" and ""Cars 2"" were. Those were some toys right? How many billions? Too many for me to count. My son cant get enough of Lightning McQueen. Heres a photo.Lights instantly dim and the executive runs through an elegant slide show of his son in the bath playing with cars from ""Cars.""The executive This summer you know what I want? I want that kid to be doing the same with your crop duster Dusty the one who wants to compete in the around-the-world air race against the Mexican the Indian the French Canadian -- all the ethnic stereotypes you have in that script of yours Jeffrey.Howard We want that too Wed like that too.Hall Its ""Cars"" but with planes see?The executive Yes I see.Hall The towns called Propwash Junction sort of like Radiator Springs in ""Cars."" And the eyes The eyes of the planes are going to look exactly the same as the eyes of the cars in ""Cars."" And ""Cars 2."" I assure you we wont try anything new. Nothing.The executive Uh-huh.Pause.The executive But fresh I hope. I hope itll feel fresh.Hall Were thinking Dane Cook for the voice of Dusty; Brad Garrett as the crop dusters trusty fuel truck Mater -- sorry Chug thats it Chug his name is Chug. And in the Doc role the one Paul Newman voiced in the first ""Cars"" we have Stacy Keach as Skipper the crusty mentor with the dramatic World War II back story the one that seems to come from an entirely different picture.The executive I liked those storyboards. Real History Channel stuff.Howard Because John (Lasseter the Disney/Pixar giant who executive-produced ""Planes"" and helped cook up the story) is a nostalgic fellow were going for some of that stuff from his moviegoing youth. You know ""Those Magnificent Men in Their Flying Machines."" ""The Great Race."" That sort of thing.The executive losing interest checking his iPad Right.Hall But with heart.The executive Very important. What is it that Walt said? For every laugh a tear? Teach an animator to draw and hell draw for a lifetime? Something like that. OK we all have deadlines and stockholders to fear. Thomas will validate your parking.Scene 3The executive So were going to release ""Planes"" theatrically after all.Hall GreatThe executive And were going ahead with the sequel.Howard GreatThe executive Life is funny guys. A lot funnier than your movie. Just kidding. Well done. ""Planes"" has practically no visual distinction its a complete knockoff but I think itll get by with the kids. My son cant wait to see it. We saw ""Turbo"" the other night by the way and this is ""Ratatouille"" compared to ""Turbo.""Hall Great to hear.The executive And its great to be able to say. And Leslies got your parking validation. See you soon.Lights out.Planes - 2 starsMPAA rating PG (for some mild action and rude humor)Running time 131Opens Friday MORE`I Believe We Killed Jordans DadPain relievers What are the differences?Gutierrezs Tax Bill Proves That Miracles Still Do Happen Life Skill 201 Washing a baseball capLongtime nursing home operators must face trial judge rules10 reasons why you want the job Related LinksRelated ArticlesPixar hits the wall with humorless charmless Cars 2June 23 2011Disneys Planes gets Nintendo video gamesApril 18 2013RPT-ANALYSIS-In year of abundance Canadas farmers miss...January 16 2014Agribusiness Company Adds Automotive Sizzle To CanolaFebruary 9 1997At 70 Her Lifes Still In The AirFebruary 12 1993Find More Stories AboutTerms of ServicePrivacy PolicyIndex by DateIndex by Keywordwww.chicagotribune.comConnectLike us on FacebookFollow us on Twitter","http://www.chicagotribune.com/entertainment/movies/sc-mov-0807-planes-20130808,0,7594105.column",200,planes17,planes,chicagotribune
"Planes movie review - NY Daily News Trending DEMOCRATIC NATIONAL CONVENTION HILLARY CLINTON KESHIA KNIGHT PULLIAM MICHAEL JORDAN DONALD TRUMP Sections Sections Home New York NYC Crime Bronx Brooklyn Manhattan Queens Education Weather Obituaries Sports Yankees Mets Giants Jets Knicks Nets Rangers Islanders Football Basketball Baseball Hockey Soccer College High School The Score More Sports News Crime U.S. World Politics Entertainment Gossip Games Entertainment Pics TV Movies Music Theater amp; Arts Horoscopes Daily Weekly Monthly Pet Horoscopes Lifestyle Health Homes Food Opinion Autos Buyers Guide Ratings amp; Reviews News amp; Views Photos amp; Galleries Covers Classifieds Trending DEMOCRATIC NATIONAL CONVENTION HILLARY CLINTON KESHIA KNIGHT PULLIAM MICHAEL JORDAN DONALD TRUMP entertainment Follow Us Facebook Twitter Instagram Pinterest YouTube Subscribe Follow UsNewsletter App Subscriptions Subscribe Get Our Newsletter A daily blend of the most need-to-know Daily News stories delivered right to your inbox. Sign Up Get the latest breaking news entertainment sports and more.Download Our App Subscribe to the newspaper our e-edition or both.Subscribe Select Sport Football Basketball Baseball Hockey Soccer College High School More Sports Gossip Games Entertainment Pics TV Movies Music Theater amp; Arts Share This facebook Tweet email Planes movie review Planes movie review BY Jordan Hoffman NEW YORK DAILY NEWS Thursday August 8 2013 1200 PM facebook Tweet email Dusty aims high in Disneys Planes. BY Jordan Hoffman NEW YORK DAILY NEWS Thursday August 8 2013 1200 PM Title Planes Film Info PG Rude humor. Area theaters. In 3-D where available. If ""Cars"" was first class the semi-sequel ""Planes"" is definitely coach. A Disney release -- but not a Pixar production it should be noted -- ""Planes"" is set in the same sort of world as the 2006 ""Cars"" and its 2011 followup. Vehicles are sentient and no humans exist (but there are still buildings and houses for some reason). This movie was originally intended as a direct-to-video release but when you can airlift this much money duty-free why not book a theatrical reservation too? Dane Cook is the voice of Dusty a crop-duster with dreams of being a celebrated racing plane. With the coaching of World War II-era bomber-type Skipper (Stacy Keach) and his best bud a fuel truck named Chug (Brad Garrett) Dusty enters a round-the-world race to prove hes got the right stuff. Dustys big secret though is that hes a plane with a fear of heights. (As a crop-duster he can stay low.) But with a new international group of high-flyin friends like Bulldog (John Cleese) -- a Union Jack-decorated stiff-upper-propeller British plane -- and a potential love interest in the Indian jet-setter Ishani (Priyanka Chopra) no turbulence will get in the way. The jokes in ""Planes"" are runway flat and parents will likely reach for the air-sickness bag. Alas in this entry theres no character as remotely endearing as Mater Larry the Cable Guys ""Cars"" staple. Some sequences here have a bit of visual dazzle but plenty of them look like they were done on the cheap (theres a lot of time spent just hangin round the hangar.) Little ones will stay engaged but any kid old enough to fly unaccompanied will probably search for other in-flight entertainment. Send a Letter to the Editor Join the Conversation facebook Tweet PC Richard and Son Get Daily News stories delivered to your inbox. Sign Up Follow Us Facebook Twitter Instagram Pinterest YouTube Keep in Touch Newsletter Apps Subscribe Feeds Support amp; Contact Contact Us Careers Media Kit Site Map Terms of Use Ad Choices Terms of Service Privacy Policy Daily News Covers (c) Copyright 2016 NYDailyNews.com. All rights reserved.",http://www.nydailynews.com/entertainment/tv-movies/planes-movie-review-article-1.1420181,200,planes18,planes,nydailynews
"Planes  Film Review Planes  Movie Review  The A.V. Club Film TV Club Music Comedy Books Games Aux More Planes Most Read A.V. Club Most Read 1 (Graphic Nick Wanserski) Posted Jul 30 The best books of 2016 so far The A.V. Clubs catch-up guide 2 (Screenshot YouTube) Posted Jul 29 Audition tapes reveal a bare-bones Game Of Thrones 3 Photo Warner Bros. Posted Jul 30 Lights Out director David Sandberg defends the ending of his horror hit 4 (Photo Gabriel Olsen/Getty Images) Posted Jul 29 Constance Wu has no fucking time for Matt Damons China-saving antics Film TV Club Music Comedy Books Games Aux Newswire Reviews Video Great Job Internet Film TV Club Music Comedy Books Games Aux Newswire Features Reviews Videos Great Job Internet The Latest From Newswire Westworld (1973) HBO sets a date for the robot cowboy uprising to begin Six Feet Under HBO orders new family drama from True Blood and Six Feet Unders Alan Ball The Latest From Features (Graphic Nick Wanserski) The best books of 2016 so far The A.V. Clubs catch-up guide American jazz vocalist Michael Franks at SIR studios in NYC. (Photo Oliver Morris/Getty Images) Jazz-inflected yacht rock word lists and pop-culture nerdery The Latest From Reviews B- Photo Cinema Asia Releasing League Of Gods offers the deadly farts of a six-armed baby in dazzling 3-D B+ Mike Kinsella (Photo Shervin Lainez) On The King Of Whys Owens the best its ever been The Latest From Videos Chasing Jason Bourne and catching up with Woody Allen Comedian Damien Lemon likes his weed to have a heroic backstory The Latest From Great Job Internet (Screenshot YouTube) Watch David Cross wound himself with increasingly brutal hot wings Democratic nominee President Hillary Clinton waves to the crowd following her acceptance speech at the Democratic National Convention in Philadelphia on Thursday July 28 2016. (Photo Bill Clark/CQ Roll Call) Read This Hillary Clinton knows her Hamilton so chill All Recent Browse Our Features Coming Distractions Savage Love Facebook Twitter Tumblr Film Movie Review Planes By A.A. Dowdaadowd Aug 8 2013 1206 AM D+ Share Tweet D+ Planes Director Klay Hall Runtime 92 minutes Rating PG Cast Dane Cook Stacy Keach Brad Garrett Community Grade (14 Users) A A- B+ B B- C+ C C- D+ D D- F Your Grade A A- B+ B B- C+ C C- D+ D D- F ? Our Community Grading Tool is in beta. Send Feedback. Share Tweet Taking a flawed property and removing all redeeming facets like a chop-shop mechanic stripping an old vehicle of its working parts Planes demonstrates that even Pixars creative nadir is hard to match. For many the fact that this Mouse House spin-off exists within the ""world of Cars""--as an opening title card unnecessarily announces--is reason enough to steer clear. John Lasseters twin odes to the automobile take a lot of abuse; critics have held them up as proof not only that Pixar is fallible but that its artistic engines have become increasingly fueled by purely monetary concerns. Pandering as they are though Cars and its 007-flavored sequel are plainly labors of love--not just for professed car nut Lasseter but also for the actors and animators bringing those anthropomorphized machines to life. The same most certainly cannot be said for Planes in which Disney proper offers its soulless approximation of a Pixar movie. Its the cinematic equivalent of those Chinese knockoff luxury sedans. The hook here is that unlike its earthbound predecessors Planes occasionally soars into the vast open expanses of the sky. The best that can be said for the movie is that some of its airborne imagery is pretty though shouldnt visual delights be a given for a Disney-animated offering? Doing his best Owen Wilson impersonation Dane Cook voices Dusty a plucky crop duster who yearns--like the super-powered mollusk of last months Turbo--to go fast. Trouble is not only was he not built for speed he has a crippling fear of heights. Like most family films this one seems determined to tell its impressionable young audience that no dream is too impossible so soon enough Dusty is overcoming his limitations to compete in a globe-crossing race. In his corner are a Mater-like fuel truck (Brad Garrett) and a veteran fighter plane (Stacy Keach) clearly modeled on Paul Newmans rusty mentor figure in Cars. Theres also a whole fleet of supporting stereotypes er characters--most of whom are voiced by paycheck-cashing celebrities contributing little but an opportunity to sell a few more tie-in toys. Clearly set to autopilot Planes races through obligatory plot points rushing its zero-to-hero narrative. The pokiness of Cars which was a full half-hour longer than this speedy cash-grab looks in retrospective like a benefit There was time back in Radiator Springs for such niceties as character development. Planes cuts corners at every turn a strategy that leaves it feeling like the skeletal framework of an incomplete Pixar project. Then again when the films idea of charm is having one of its many comic-relief aircrafts perform a slow mariachi-band rendition of ""Love Machine"" maybe getting to the finish line as quickly as possible isnt such a bad thing. For captive parents the lone source of interest may be trying to make sense of the eternally confusing Cars universe--a place where Old Yeller apparently exists but dogs dont and vacationing automobiles pack suitcases full of clothing which they dont wear. Come to think of it why would this world even need crop dusters? Do the machines eat? What are their insides made of anyway? Perhaps one of the two already-in-the-works Planes sequels will crack one of these unholy machines open. Thatd be about the only reason to return to this nose-diving franchise. Share Tweet Filed Under Film More Movie Review Previous Movie Review Prince Avalanche Next Movie Review The Patience Stone Dont miss a story--follow The A.V. Club on Cant see comments? Please enable JavaScript to view the <a href=""http//disqus.com/?ref_noscript""> comments powered by Disqus. </a> More Movie Review League Of Gods offers the deadly farts of a six-armed baby in dazzling 3-D Jul 30 2016 1022 AM Philip Roths Indignation becomes a character study worth examining Jul 28 2016 900 AM A former football pro documents his struggle with ALS in Gleason Jul 28 2016 1200 AM A woman fights to hold on to her career on Wall Street in Equity Jul 28 2016 1200 AM A.V. Club Most Read 1 (Graphic Nick Wanserski) Posted Jul 30 The best books of 2016 so far The A.V. Clubs catch-up guide 2 (Screenshot YouTube) Posted Jul 29 Audition tapes reveal a bare-bones Game Of Thrones 3 Photo Warner Bros. Posted Jul 30 Lights Out director David Sandberg defends the ending of his horror hit 4 (Photo Gabriel Olsen/Getty Images) Posted Jul 29 Constance Wu has no fucking time for Matt Damons China-saving antics Sign up for news Daily Newsletter Highlights from The A.V. Club Whats On Tonight A daily update on the world of TV Submit Links and such All Recent Browse Our Features Coming Distractions Savage Love Contests RSS About Us Contact Advertise Jobs Privacy Policy Our Partners Hitfix Mental Floss Oh My Rockness Uproxx Upworthy Vice (c) Copyright 2016 Onion Inc. All Rights Reserved.","http://www.avclub.com/articles/planes,101329/?utm_medium=RSS&utm_campaign=feeds&utm_source=feedly",200,planes19,planes,avclub
"Disneys Planes Film Review - Hollywood Reporter The Hollywood Reporter movies Subscribe reviews box office heat vision coming soon trailers movies tv music tech the business style culture awards video Subscribe Blogs heat vision bastard machine live feed behind the screen esq earshot the race Newsletter THR Social Confessions of Colbert Subscribe Now Never Miss A Story. Sign up for our Newsletters. Daily Edition Login to download Planes Film Review 900 PM PDT 8/6/2013 by Michael Rechtshaffen FACEBOOK TWITTER EMAIL ME YOUTUBE PRINT COMMENTS Despite the more aerodynamic setting this ""Cars"" 3D offshoot emerges as an uninspired retread. TWITTER It may be an official Cars spinoff but you wont find the name Pixar anywhere in connection with Disneys Planes. While visually engaging this production of Disneytoon Studios -- it was originally slated to go direct-to-DVD -- lacks the sort of character depth and dramatic scope normally associated with the Pixar brand. Granted the Cars vehicles especially the 2011 sequel were never embraced by critics as prime Pixar but that lack of substance never seemed to matter in toy stores where they have been merchandising behemoths. Likewise the main thrust for Planes would appear to be a surefire way to supplement those Lightning McQueen sales. Theatrically given the crowded animated feature marketplace Planes should do solid if unspectacular business -- provided audiences dont mind some overlapping plot and character similarities also shared with the recent Turbo and Despicable Me. PHOTOS 26 of Summers Most Anticipated Movies Man of Steel Wolverine The Lone Ranger It should be noted that theres a happy precedent where Disneys Planes is concerned -- both Toy Story 2 and The Tigger Movie also started out life as direct-to-DVD propositions. Set in a patch of the American Midwest that looks remarkably like Radiator Springs from the first Cars movie Planes concerns the competitive high-flying ambitions of one Dusty Crophopper (affably voiced by Dane Cook) a crop duster who feels the need for speed. Taken under the wing of a reclusive mentor Skipper (Stacy Keach) a Navy Corsair who once commanded the celebrated Jolly Wrenches squadron until an incident removed him from combat Dusty also receives coaching by Dottie (Teri Hatcher) a spunky no-nonsense forklift. After a few minor adjustments Dusty finds himself going up against the unbeatable Ripslinger (Roger Craig Smith) in a globe-spanning air-racing event that takes him a long way from the heartland. Based on a concept by executive producer John Lasseter and directed by Klay Hall (""King of the Hill"") the well-researched film contains enough technical jargon to please aviation buffs but comes up short on freshness and originality where those characters are concerned. As written by Jeffrey M. Howard (Secret of the Wings) the screenplay settles for the slightest of variations on what has preceded it -- gruff Skipper is simply a winged take on gruff Doc Hudson; Dustys smug green nemesis Ripslinger is a knock-off of McQueens smug green nemesis Chick Hicks; dimwitted fuel truck Chug (voiced by Brad Garrett) recalls dimwitted tow-truck Mater and so on. That element of familiarity at least serves the voice cast well with Top Gun co-stars Anthony Edwards and Val Kilmer lending their voices to the characters of Echo and Bravo while Brent Musburger reprises his Cars 2 role as sportscaster Brent Mustangburger. Also on energetically on board are Julia Louis-Dreyfus as a French-Canadian competitor named Rochelle whos being doggedly courted by overly-confident El Chupacabra (Carlos Alazraqui) something of a luchador of the indoor racing world. Opens Friday August 9 Production companies Disneytoon Studios Voice cast Dane Cook Stacy Keach. Brad Garrett Teri Hatcher Julia Louis-Dreyfus Priyanka Chopra John Cleese Cedric the Entertainer Anthony Edwards Val Kilmer Director Klay Hall Screenwriter Jeffrey M. Howard Executive producer John Lasseter Producer Traci Balthazor-Flynn Production designer Ryan L. Carlson Music Mark Mancina Editor Jeremy Milton Rating PG 92 minutes. Comments Please enable JavaScript to view the <a href=""http//disqus.com/?ref_noscript"">comments powered by Disqus.</a> comments powered by Disqus The Hollywood Reporter (c) 2016 The Hollywood Reporter All rights reserved. Terms of Use | Privacy | Sitemap | About Our Ads About Us Login Daily Edition Subscribe Subscriber Services Back Issues Advertising Contact Us Careers Industry Jobs Follow Us On Twitter Find Us On Facebook Watch Us On Youtube Our affiliate publications Billboard Ad Week Backstage Casting",http://www.hollywoodreporter.com/movie/planes/review/600352,200,planes20,planes,hollywoodreporter
"Planes movie review (2013) directed by Klay Hall | Movie review Go to the content Go to the footer Time Out New York New York Popular cities London New York Paris Chicago Los Angeles Browse all cities Time Out New York Close New York Change city New York Popular cities London New York Paris Chicago Los Angeles Browse all cities Tickets Events Things to Do Restaurants Bars Movies Theater Music Shopping Attractions Blog Art Travel Nightlife Events amp; Festivals Museums Kids Hotels Comedy Dance LGBT Sex amp; Dating Books City Guide Neighborhoods Promotions Close My Time Out Things I love My lists My Profile My Account Sign out Sign in Create account Sign in With your social account Or with your email Email Password Remember me Forgotten your password? Sign in You can create a Time Out account in two ways... With a few clicks using your favourite social network Or by entering your details below Email First Name Last Name Create password Repeat new password I accept Time Outs terms of use including opt-in to newsletters. Create account Welcome  You have successfully connected your account to Time Out. You may sign in with this account in future. Please confirm your account details Email First Name Last Name I accept Time Outs terms of use including opt-in to newsletters. Sign up My Account Sign in or Create account Search Tickets Events Things to Do Restaurants Bars Movies Theater Music Shopping Attractions Blog Art Travel Nightlife Events amp; Festivals Museums Kids Hotels Comedy Dance LGBT Sex amp; Dating Books City Guide Neighborhoods Promotions More Search Planes movie review Movies  Animation 2 out of 5 stars Add review 0 Love It Save it 0 Add review 0 Love It Save it Time Out says 2 out of 5 stars Details Users say Time Out says 2 out of 5 stars Most Walt Disney protagonists dream of bigger and better things Pinocchio wished he were a real boy Cinderella longed to meet her Prince Charming the Little Mermaid hoped to shed her aquatic tail and be part of our world. The trend continues with the Mouse Houses latest dissatisfied hero Dusty Crophopper (Dane Cook) who fantasizes about doing ""more than I was built for."" Dustys a plane you see--a crop duster whod rather be racing around pylons than spraying rows of corn with fertilizer. He gets his chance after just barely placing in a local competition which guarantees him a spot in a globehopping aerial race. But first this green country boy (who is paradoxically afraid of heights) requires some Rocky-esque tutelage from Skipper (Stacy Keach) a seemingly tough-as-nails Navy Corsair whose gruff demeanor hides his tragic past. A typically colorful narratively inconsequential entry in the Disney canon Planes manages to be slightly more involving than the two installments of Cars (an opening card informs us that all of these sentient machines share the same world). Credit director Klay Hall and his team of animators for maximizing the gravity-defying visuals--an ethereal flight to a Himalayan monastery is especially awe-inspiring--which distract from much of the questionable comedy. Strangest is the films tendency toward racial stereotyping which comes off as breezily silly at best (John Cleeses Bulldog is a snooty British De Havilland Comet) and downright insensitive at worst (Cedric the Entertainer voices a Southern-accented laze-about biplane named Leadbottom). But what really undoes the movie is its seen-it-all-before familiarity Every crisis feels manufactured be it the egotistical machinations of the villainous Ripslinger (Roger Craig Smith) or Dustys own third-act doldrums which milk parent-figure pathos in all the ways youd expect a Disney film to. The characters may soar but viewers spirits stay grounded. Follow Keith Uhlich on Twitter keithuhlich By Keith Uhlich Posted Wednesday August 7 2013 Details Release details Rated PG Release date Friday August 9 2013 Duration 92 mins Cast and crew Director Klay Hall Screenwriter Jeffrey M Howard Users say LiveReviews|02 people listeningSign inWrite reviewMost helpfulMost helpfulHighest ratingLowest ratingNewestOldestLoadingundefinedNew CommentsRefreshShow More Share Tweet 0 Shares Top About us Work for Time Out Privacy policy Website terms of use Contact us Get listed Advertising Time Out products Mobile apps Time Out Shop Time Out Guides Time Out Travel Time Out Worldwide Time Out magazine Follow us Facebook Twitter Youtube Instagram Pinterest Spotify Foursquare Time Out New York Site map }",http://www.timeout.com/us/film/planes-movie-review,200,planes21,planes,timeout
