review,link,status_code,id,movie_key,critic
"Movie review Disney wings it with Planes - Movies - Boston.com Sites V ^ Boston.com BDCwire Love Letters Real Estate Menu Login Search Search Home News Weather Sports Entertainment Lifestyle Travel Cars Real Estate Search Sections Home News Weather Sports Entertainment Business Lifestyle Travel Cars Jobs Real Estate Classified Marketplace Shortcuts Circulars Traffic Video Lottery Markets Horoscopes Forums Comics Movie Listings Crosswords Site help Digital Jobs at Boston Globe Media BDCWire Id click that Radio BDC Streaming todays top alternative music amp; more Loveletters Your daily love advice Boston Globe Home of award-winning Boston Globe reporting Beta Boston Your one-stop source for local innovation news Crux Covering all things Catholic Twitter Facebook Google + ? Privacy Policy Terms of Service Contact (c)2016 Boston Globe Media Partners LLC Disney wings it with Planes By Mark Feeney August 8 2013 800 PM Share Comment This is a summary. To read the whole story subscribe to BostonGlobe.com PLANES Share Comment The relative decline of the quality of Pixars animated features has at least one benefit its presumed effect on corporate sibling rivalry. Disney animated features dont have as much catching up to do. ""Planes"" Disneys latest seems in fact like a lesser version of what may be Pixars two weakest efforts the ""Cars"" movies. That likeness may have something to do with the fact that Disney animation chief John Lasseter who directed and cowrite the Pixar titles is executive producer and cowriter of ""Planes."" Like ""Cars"" ""Planes"" features vehicles with faces and personalities -- mostly aircraft of course but also trucks and forklifts and yes cars. Propellers make for nice nose substitutes. Chief among the personalities is Dusty (voiced by Dane Cook) a single-engine crop-duster. Full story for BostonGlobe.com subscribers. MPAA Rating PG | MPAA rating reasons a crash landing at sea and World War II flashback might be too intense for small children | Running Time 92 minutes | Cast Dane Cook Stacy Keach Teri Hatcher Brad Garrett Carlos Alazraqui | Director Klay Hall | Writers Jeffrey M. Howard John Lasseter Klay Hall | Playing at Boston Common Fenway suburbs | Share Tweet Get the full story with unlimited access to BostonGlobe.com. Just 99 cents for four weeks. Get Access Now Share Comment Twitter Facebook Google + ? (c)2016 Boston Globe Media Partners LLC Privacy Policy | Terms of Service | Ad Choices Search Sections Home News Weather Sports Entertainment Business Lifestyle Travel Cars Jobs Real Estate Classified Marketplace Shortcuts Circulars Traffic Video Lottery Markets Horoscopes Forums Comics Movie Listings Crosswords Site help Digital Jobs at Boston Globe Media BDCWire Id click that Radio BDC Streaming todays top alternative music amp; more Loveletters Your daily love advice Boston Globe Home of award-winning Boston Globe reporting Beta Boston Your one-stop source for local innovation news Crux Covering all things Catholic Twitter Facebook Google + ? Privacy Policy Terms of Service Contact (c)2016 Boston Globe Media Partners LLC Sign in Register <a href=""http//www.omniture.com"" title=""Web Analytics""> </a>",http://www.boston.com/ae/movies/2013/08/08/movie-review-disney-wings-with-planes/rtMNNmR12RMw3wOBF9vYVI/story.html,200,planes13,planes,boston
"Movie Review Planes Has a Script Made for a VCR -- Vulture NYMag.com Daily Intelligencer Vulture The Cut Science of Us Select All Grub Street Bedford amp; Bowery FOLLOW Facebook Twitter Instagram UserName LOG IN REGISTER TV Movies Music What to Stream BoJack Horseman Vulture at the RNC Star Trek Beyond Mr. Robot Emmys 2016 Search Sections Home TV Movies Music What to Stream Hot Topics BoJack Horseman Vulture at the RNC Star Trek Beyond Mr. Robot Emmys 2016 Vultures Network NYMag.com Daily Intelligencer The Cut Grub Street Science of Us Bedford amp; Bowery Like UsFollow UsFollow Us Popular on Vulture When Did the Media Turn Against Taylor Swift? >> movie review August 8 2013 430 p.m. Movie Review Planes Has a Script Made for a VCR By Bilge Ebiri Follow BilgeEbiri A throwback to straight-to-video Disney quickies like <em>Bambi II</em>. 16 Shares Share 16 Tweet 0 Share 0 Share Email Print Share Disneys Planes Photo Walt Disney Studios People above a certain age dont seem to like the Cars franchise very much. Perhaps its because the first Cars was for many of us the first indication that the geniuses at Pixar for all their artistic accomplishments were also part of a money-making enterprise; they seemed perfectly content creating a movie that merely entertained millions of kids and sold merchandise by the metric ton. (That said the less said about Cars 2A -- which even my 4-year-old refuses to watchA -- the better.) Planes was produced not by Pixar but by the folks at DisneyToon Studios the folks who for years have been gamely churning out direct-to-video sequels of classic Disney films like Bambi II and Cinderella II Dreams Come True. So as soon as you see the ""World of Cars"" logo at the beginning you can practically smell the corporate synergy. Ironically enough the plot of Planes feels less like Cars and more like the recent Turbo. This time instead of a snail that participates in the Indy 500 weve got a crop-duster that participates in a renowned round-the-world circuit race. For help in this endeavor our hero Dusty Crophopper (Dane Cook) enlists a ragtag ground crew including a feisty forklift voiced by Teri Hatcher and a gently growly fuel truck voiced by Brad Garrett. Of course theres also a surly veteran who is initially resistant to helping our hero but gradually comes around WWII fighter jet Skipper Riley (Stacy Keach) who can no longer fly due to his traumatic wartime experiences as part of a squad named the Jolly Wrenches. Dusty is ambitious and hes a good flyer but hes alsoA -- get thisA -- afraid of heights. His hope is to win the race by staying relatively close to the ground. Can he do it? And will he be able to defeat the high-tech showboating longtime champion Ripslinger (Roger Craig Smith)? Take one wild guess. Kids will probably enjoy Planes because well its called Planes and its got lots of planes and it doesnt beat around the bush getting to the planes doing their plane thing flying and banking and swooping. And the international nature of the race allows for some decent variation in locales along the way. One appealing brief sequence in the Himalayas has Dusty flying through a tunnel in an attempt to stay close to the ground running into a train and winding up in a Buddhist monastery. Another scene involves a nod to the famous romantic plane ride from Out of Africa and this time the elegant flocks of flamingos taking flight are themselves tiny little baby planes. Anyway planes. Planes planes planes. Aesthetically the problem with Planes (and to some extent with the Cars films) is that vehicles being inorganic limit the visual range of the film in terms of both design and movement. Eventually a world full of planes just gets boring no matter how many times they soar and spin and swoosh. After a while it feels about as interesting as a movie called Phones in which everybodys a phone. Or Boxes. Or Light Bulbs. When later on Dusty gets stuck in a cyclone in the middle of the Pacific you can feel your eyes getting excited at the sight of wavesA -- gloriously un-angular and undulating and unpredictable. (Id happily watch a movie called Waves.) But on just about every other level other than visuals Planes is dry dry dry. Theres no verbal wit no standout vocal performances. (We dont expect much from Dane Cook but some of the other actors like Keach and John Cleese who voices a British contender in the race have potential.) The film was reportedly developed to be another straight-to-video toon until the honchos at Disney liked the footage so much that they decided to turn it into a theatrical feature. That doesnt always bode ill The remarkable Toy Story 2 also started out the same way. But in going from the small screen to the big Planes doesnt appear to have gotten the requisite injection of wit imagination or energy. Its not terrible but it still feels like a waste. Tagsmoviesmovie reviewplanes Share on Facebook Tweet this Story Top Stories Survivoras Remorseas Third Season Is Its Best Yet Which Game of Thrones Characters Would Be Republicans According to Delegates at the RNC On His First Album Producer Clams Casino Reinvents the Futurism of His Past Most Viewed Stories Constance Wu Slams Matt Damonas Great Wall Film for Perpetuating a aRacist Mytha 34.6k Shares Share Tweet LeBron James Reportedly Stopped Justin Bieber From Performing at the RNC 90 Shares Share Tweet John C. Reilly Is Giving One of the Best Performances in TV Comedy Today 8k Shares Share Tweet How a80s Are the Names on Stranger Things? 214 Shares Share Tweet Whatas New on Netflix August 2016 2 Shares Share Tweet What to Stream Now See whatas new and notable on Netflix Amazon Hulu and HBO Drakeas Current Nemesis Joe Budden Is More of a Match for Him Than He Looks 9 Shares Share Tweet Malia Obama Americaas Coolest Teen Spent Her DNC at Lollapalooza 1.3k Shares Share Tweet In Praise of the Stand-alone Episode of TV 152 Shares Share Tweet American Sniper Fans Are Upset Bradley Cooper Attended the DNC 917 Shares Share Tweet A Quick Refresher on the Jason Bourne Universe Backstory 17 Shares Share Tweet Latest News from Vulture 4 mins agoJon Stewartas New HBO Show Will Be Animated and Onion-LikeBill Maher is also staying until 2018. 17 mins agoDivorce Insecure and Westworld Get Fall Premiere Dates on HBOTheyll be here soon enough... 1231 p.m.The Larry Sanders Show Is Coming to HBO Streaming Outlets in SeptemberSeptember 23 to be precise. 1228 p.m.Avengers Infinity War Doesnt Want Infinite Films Is Now Just a Standalone Film2 Infinity 2 Handle. 1158 a.m.Somebody Alert the Television Academy A New Alan Ball Family Drama Is Coming to HBOItll focus on a ""contemporary multi-racial family."" 1104 a.m.The Handmaiden Trailer Its the Korean Gothic Lesbian Revenge Thriller We DeserveIn theaters October 19 1031 a.m.A Chandra Levy Miniseries Is Coming to TNTNetworks cant get enough of true crime. 936 a.m.You Can Now Watch Mr. Robots Disturbing Short Film The Careful Massacre of the BourgeoisieNSFW 837 a.m.Jimmy Fallon Found a Super Effortless Way to Hold Margot Robbies Hand For Four MinutesIf the glove doesnt fit... Yesterday at 1100 p.m. Outcast Recap Sympathy for the Devil""What Lurks Within"" is a deceptively slow episode. Yesterday at 1100 p.m. The Great British Baking Show Recap Rough PuffWho on earth is washing all of these dishes? Yesterday at 1000 p.m.The Great British Baking Show Recap Lady FingersThe greatest mystery of our time Why does the Male Judge hate pomegranate? Yesterday at 550 p.m.A Quick Refresher on the Jason Bourne Universe BackstoryUniversal was really planning on more Jeremy Renner movies. Yesterday at 547 p.m.Whatas New on Hulu August 2016Youre the Worst The Wine Show Yesterday at 510 p.m.How a80s Are the Names on Stranger Things?Barb. Nance. Joyce. Yesterday at 424 p.m.Behind the Making of Indignationas Thrilling 18-Minute Argument Scene""When youre a director watching an 18-minute scene unfold you can come up with a lot of notes let me tell you."" Yesterday at 417 p.m.Orlando Bloom Follows Up DNC Stardom by Joining Andy Sambergas Tour de PharmacyHes part of a packed cast that also includes John Cena and Mike Tyson. Yesterday at 406 p.m.In Praise of the Stand-alone Episode of TVThey jolt us out of complacency. Yesterday at 402 p.m.The Music Video for YGas aWord Is Bonda Comes With Japanese and English Subtitles Is AmusingAwkward uses of language please laugh. Yesterday at 355 p.m.Drakeas Current Nemesis Joe Budden Is More of a Match for Him Than He LooksIs Drake finally losing his temper? Load More Home TV Movies Music Books New On Netflix Newsletters Facebook Twitter RSS Feedly Privacy Terms Sitemap Media Kit Ad Choices About Us Contacts Feedback Were Hiring A(c) 2016 New York Media LLC. View all trademarks Close But we noticed youre visiting us with an ad blocker We understand the reasons for blocking but Vulture depends on ads to pay our writers and editors. Were working hard to improve the ad experience on our site but in the mean time wed really appreciate it if you added us to the approved list in your ad blocker. Thanks for the support Breaking Bad As Infographics J.J. Philbin Remembers The O.C. Writers Room Ad will collapse in seconds... CLOSE",http://www.vulture.com/2013/08/movie-review-planes-should-go-right-to-video.html,200,planes14,planes,vulture
"Planes 2 stars Article Comments () Things to do >> Movies >> Article Planes 2 stars SHARE URL EMAIL Tweet FONT A A A Photo URL To From Add a brief message (optional) Comments RELATED INFO Planes Bad 2 stars Director Klay Hall. Cast Dane Cook Stacy Keach Brad Garrett. Rating PG for some mild action and rude humor. By Bill Goodykoontz The Republic | azcentral.com Wed Aug 21 2013 1142 AM If youve watched the trailers you might go into ""Planes"" thinking its an awful lot like ""Cars"" and it is a sequel to one of Pixars least-regarded films.But dont worry. Its an awful lot like ""Turbo"" instead.Thats not a compliment.Rather than a snail trying to race in the Indy 500 ""Planes"" directed by Klay Hall is the story of a crop duster trying to compete in an international aviation race. Can the underdog overcome the odds his own fears and doubts and a crowd favorite who is a bad guy in disguise?If you saw ""Turbo"" you know the answer to that question. Actually if youve even seen any movie with underdogs in it you know the answer to that question. Which is fine. Predictability alone doesnt sink a movie.But combine it with a lazy script some oddly broad stereotypes and a competition not a whole lot of people know or care about and youve got... um ""Cars 2"" in the sky maybe?Thats not a compliment either.The small children at whom ""Planes"" is so obviously aimed probably wont mind that because all the toys and lunchboxes and whatnot will look just as nifty no matter how good or bad the movie is. The dispiriting thing is that you cant shake the feeling the folks at Disney the studio that made the movie were thinking the same thing.Dusty (voice of Dane Cook) is the crop duster who spends his days spraying fields but dreaming of racing. Hes supported in this by his pal Chug (Brad Garrett) a truck who is kind of like a slightly smarter Mater from the ""Cars"" movies and Dottie (Teri Hatcher) Dustys mechanic. (Not human; there are no people in the film. Shes like a little tractor or something.)In addition to not being the sleekest plane in the sky Dusty has one other problem Hes afraid of heights. (Its a problem more talked about than displayed.)With coaching from Skipper (Stacy Keach) a legendary World War II fighter Dusty manages to make it into the race. There he meets his competitors including El Chupacabra (Carlos Alazraqui) from Mexico; Bulldog (John Cleese) from England; and Ishani (Priyanka Chopra) from India. Imagine those nationalities depicted with all the subtlety and sensitivity of a 1950s comic book and youll have a good idea of how theyre presented.For Dusty however the big trouble is Ripslinger (Roger Craig Smith) the defending champion whose talent is matched only by his ego. Hes not buying into this underdog business. He wants to crush Dusty and everyone else in the race.The competition provides several opportunities for mayhem and mischief and for the planes to get to know each other better. There are not a lot of surprises with the exception of a segment involving Skipper that includes some remarkably grown-up elements which is odd in a movie made for tykes.""Planes"" was originally scheduled to be released straight to video. Although the smallest children might like bits and pieces of it theres nothing in the movie that suggests why Disney strayed from its original plan. > Join the DiscussionView/Add Comments  >> Posting a comment to our website allows you to join in on the conversation. Share your story and unique perspective with members of the azcentral.com community. Comments posted via facebook > Join the Discussion Join the conversation To comment on azcentral.com you must be logged into an active personal account on Facebook. You are responsible for your comments and abuse of this privilege will not be tolerated. We reserve the right without warning or notification to remove comments and block users judged to violate our Terms of Service and Rules of Engagement. Facebook comments FAQ Back to Article Comments posted via facebook Republic Photography - Purchase this image photo Exclusive selections for our subscribers Mauling of Phoenix boy keys debate over fate of pit bull Battle over Arizona education standards continues Petite Maison 4 stars Trevor Cahills knee injury ugly but evidently not serious Expert U.S. near crisis of secrecy Most Popular Top Videos Celebrities who wear Boots 12 best movies about older people Daily celebrity fashion picks Hot or not? Top 10 sexiest movies ever made The 10 best movies based on mythology Top 10 films about switching identities 10 best films about troubled teens Sean Connerys wife recalls their first sexual encounter Top 10 movies set in or around water 10 best films based on young-adult novels (Video) (Video) (Video) (Video) (Video) (Video) (Video) (Video) (Video) (Video) TOP JOBS GET AZCENTRAL ANYWHERE azcentral.com mobile editions Get azcentral.com on your phones and tablets for the latest news sports video photos and much more from azcentral The Arizona Republic and 12 News. >> Get azcentral.com mobile >> Android | iPad | iPhone | iPhone Sports | AZ From our sponsor Banner Childrens Total Kid for iPad Download your free copy of Total Kid an interactive digital parenting magazine filled with trending health topics videos tips and activities. Sponsored by Banner Health. Sign up for text alerts Get the latest updates sent to your phone. Sign up for breaking news weather traffic sports and celebrity alerts Sign up now GET NEWS amp; INFORMATION VIA OUR EMAIL NEWSLETTERS Azcentral.com offers a wide variety of newsletters that range from breaking news to sports to events to community news .. and much more Sign up now AZCENTRAL.COM ON TWITTER Follow our latest Twitter activity on topics ranging from breaking news to great shopping deals around the Valley. FOLLOW US ON FACEBOOK Join thousands of azcentral.com fans on Facebook and get the days most popular and talked-about Valley news sports entertainment and more - right in your newsfeed. Youll see what others are saying about the hot topics of the day. >> Become a fan today (c) 2016 azcentral.com. All rights reserved. | Users of this site agree to the Terms of Service Privacy Policy/Your California Privacy Rights and Ad Choices Enjoy a limited number of free articles over the next 30 days. 20 free articles remaining this month. Subscribe today for full access >> Already a subscriber? Activate your account now We hope you have enjoyed your complimentary access. Become a subscriber today to enjoy these benefits Unlimited access to our Web site Tablet-Optimized edition Mobile site amp; iPhone app View subscription options Log in Are you currently a subscriber? Set up your digital access now. Cookies must be enabled on your browser to view this site. Javascript must be enabled on your browser to view this site.",http://www.azcentral.com/thingstodo/movies/articles/20130808planes-movie-review.html#protected,200,planes15,planes,azcentral
"Planes review Familiar plot achieves lift-off - San Francisco Chronicle Autos Jobs Real Estate e-edition Account Edit Your Profile Manage Your Subscription e-edition Subscribe Sign In First time signing in to SFChronicle.com? Click here to confirm your subscription amp; sign in information. Stay signed in Forgot Your Password? By logging in you agree to the Terms and Conditions and Privacy Policy. Sign In Movies amp; TV Home SFGATE Local Columnists San Francisco Bay Area Crime Environment Election 2016 Health Obituaries California Drought US amp; World US World Politics amp; Policy Environment Science Divided America Sports 49ers Raiders Giants As Warriors Cal College Rio Olympics Stanford Sharks High School More Sports Biz amp; Tech Technology Real Estate Markets Opinion Editorials Letters to the editor Op-ed columns Insight Open Forum Submit your opinions Style Scene Fashion Shopping Weddings Food+Home Restaurants Wine amp; Beer Recipes Cook Your Week Top 100 Restaurants Home Design Aamp;E Movies amp; TV Arts amp; Theater Music Music Festivals Guide Books Bad Reporter Horoscopes Comics Games Movie Listings SFMOMA Leah Garchik Best of Jon Carroll Lifestyle Style Health Outdoors Travel Photos From the Archive Photos of the Week City Exposed Field of Vision The Regulars Travel In-Depth Beyond Homelessness Top 100 Restaurants AIDS Survivors Airbnb Project 2016 Rising sea levels National parks at 100 SFMOMAs New Era Teachers Priced Out NorCal Brewery Map Star Wars and S.F. Our SF Archive The Literary City Membership About Membership Exclusive offers Join Now Manage my account Archive Planes review Familiar plot achieves lift-off By Peter Hartlaub August 8 2013 Updated August 8 2013 423pm Photo Associated Press Dusty voiced by comedian Dane Cook is a plucky crop duster who dreams of competing in races. Dusty voiced by comedian Dane Cook is a plucky crop duster who... Planes Animated comedy. Starring the voices of Dane Cook Stacy Keach and Teri Hatcher. Directed by Klay Hall. (PG. 92 minutes.) ""I am more than just a crop duster"" Dusty Crop-hopper exclaims at the beginning of ""Planes"" and its hard not to sigh. In recent years weve seen a penguin who wants to dance a video game villain who wants to be a good guy and most recently a snail who wants to be a race car. The children of the world get it. You can be whatever you want if you work really hard and have a couple of charming sidekicks. But after a trying first act this DisneyToon Studios release finds a nice cruising altitude embarking on a world tour that yields some pleasant surprises. ""Planes"" was supposed to debut direct-to-video before Disney decided it was deserving of the big screen. (Story idea A video store cassette that dreams of being a theatrical release) ""Planes"" is no ""Toy Story 2"" but it was certainly worthy of the promotion. Dusty (voiced by Dane Cook) is a small-town crop duster who finds a mentor in a relic war plane named Skipper (Stacy Keach) and yearns to compete in a grand prix-style race around the world. If that sounds like ""Cars"" and ""Cars 2"" - the movie poster tagline also references the connection - know that this film efforts to distance itself from its Pixar distant cousins. Theres no Lightning McQueen. No Radiator Springs. Even John Ratzenberger gets to voice a completely new character. Looking at the history of spin-offs as related to their source material ""Planes"" feels less like ""The Penguins of Madagascar"" and more like ""Prometheus."" The sidekicks training sequences and mentor-trainee growing pains in ""Planes"" have a familiar feel. The first 30 minutes sometimes seem like more of a checklist than a movie. However once Dusty earns his wings screenwriter Jeffrey M. Howard and the story team seem to get more adventurous as well. Much fun is had with the destinations whether its a temple in India or an aircraft carrier. Dustys suave Latin friend El Chupacabra has an excellent serenading scene which starts with a ""Say Anything"" reference before turning into something original and sweet. The main story arc remains predictable with several themes - including Dustys fear of heights and Skippers mysterious military background - reaching inevitable conclusions. But the smaller details remain fresh. When Dusty gets to New York the JFK Airport air traffic controllers have Kennedy-esque accents and the Statue of Liberty appears to be a forklift. (Three films into this sort-of series its time to ask what has happened to all the humans in these movies. Was there some kind of ""Maximum Overdrive""-style takeover or does the fact that no enslaved humans remain mean that humankind never existed at all? In any case adults shouldnt do drugs and watch ""Cars"" or ""Planes."") Airplane buffs are going to have a particularly good time; each of the planes seems to have an obscure real-life counterpart. And pop-culture junkies will appreciate a few sly nods as well. Listen very carefully to the voices of Bravo and Echo the two F-18 Hornets that Dusty meets in the middle of the film. The biggest enemy of ""Planes"" may be misinformation. Many moviegoers are going to enter theaters thinking this is a Pixar film with the raised expectations that accompany that mistake. But even cynical animation fans will see theres quality here. After a little turbulence ""Planes"" comes in for a nice landing. Peter Hartlaub is The San Francisco Chronicles pop culture critic. E-mail phartlaubsfchronicle.com Twitter PeterHartlaub Peter Hartlaub Pop Culture Critic Editorial Naming a Navy ship for Harvey Milk is the right thing to do Local How the SF Marathon became exceptional Special Report Black Lives Black Voices Top 100 Restaurants Top 100 Restaurants 2016 Savor Bay Areas best Movies amp; TV Load more in Section Top About Our Company Ad Choices Careers Terms of Use Advertising Privacy Policy Your Privacy Rights Your California Privacy Rights Contact Customer Service Frequently Asked Questions Newsroom Contacts Connect Facebook Twitter LinkedIn Google+ Connect (c) Hearst Corporation",http://www.sfchronicle.com/movies/article/Planes-review-Familiar-plot-achieves-lift-off-4717566.php?t=4d0c53680647b02379,200,planes16,planes,sfchronicle
