review,link,status_code,id,movie_key,critic
Planes (2013) directed by Klay Hall | Film review Go to the content Go to the footer Time Out London London Popular cities London New York Paris Chicago Los Angeles Browse all cities Time Out London Close London Change city London Popular cities London New York Paris Chicago Los Angeles Browse all cities Tickets Offers Things to Do Restaurants Bars amp; Pubs Film Theatre Art Music Attractions Blog Theatre Tickets Shopping Offer of the Day Time Out Card Time Out Escapes Time Out Live Hotels Nightlife Music festivals Events amp; Festivals Kids Museums Clubs Comedy Food amp; Drink Classical Music amp; Opera Dance LGBT City Guide Area Guides Property Competitions Dating Close My Time Out Things I love My lists My Profile My Account Sign out Sign in Create account Sign in With your social account Or with your email Email Password Remember me Forgotten your password? Sign in You can create a Time Out account in two ways... With a few clicks using your favourite social network Or by entering your details below Email First Name Last Name Create password Repeat new password I accept Time Outs terms of use including opt-in to newsletters. Create account Welcome  You have successfully connected your account to Time Out. You may sign in with this account in future. Please confirm your account details Email First Name Last Name I accept Time Outs terms of use including opt-in to newsletters. Sign up My Account Sign in or Create account Search Tickets Offers Things to Do Restaurants Bars amp; Pubs Film Theatre Art Music Attractions Blog Theatre Tickets Shopping Offer of the Day Time Out Card Time Out Escapes Time Out Live Hotels Nightlife Music festivals Events amp; Festivals Kids Museums Clubs Comedy Food amp; Drink Classical Music amp; Opera Dance LGBT City Guide Area Guides Property Competitions Dating More Search Planes Film  Animation 3 out of 5 stars Add review 0 Love It Save it 0 Add review 0 Love It Save it Time Out says 3 out of 5 stars Details Users say Time Out says 3 out of 5 stars This simple amiable Disney animation is a spin-off from Pixars Cars films and like them features no humans at all - just talking planes with big eyes and grins as well as the odd truck and train. Its an endearing enough David-and-Goliath tale aimed squarely at younger kids as smalltown crop-dusting plane Dusty (Dane Cook) leaves behind the day job to enter a global aerial race that takes him from the US to Iceland from India to Mexico. Dusty is assisted by some longtime mechanical buddies and coached by a retired warplane. His fellow contestants include Bulldog (John Cleese) a Brit with a stiff upper nose cone and Ripslinger a sly American who cant bear the thought of being beaten by Dusty. Planes isnt a Pixar film even if its related to one (Disney bought Pixar in 2006) and theres nothing groundbreaking about the animation or script. That said the characters and story still offer low-key charms. By Dave Calhoun Posted Tuesday August 13 2013 Details Release details Rated U Release date Friday August 16 2013 Duration 92 mins Cast and crew Director Klay Hall Screenwriter Jeffrey M Howard Users say LiveReviews|02 people listeningSign inWrite reviewMost helpfulMost helpfulHighest ratingLowest ratingNewestOldestLoadingundefinedNew CommentsRefreshShow More Share Tweet 0 Shares Top About us Work for Time Out Privacy policy Cookie Policy Website terms of use Contact us Time Out for business Get listed Claim your listing Premium Profiles Advertising Time Out products Time Out Card Mobile apps Time Out Shop Time Out Guides Time Out Travel Time Out Offers Time Out Worldwide Time Out magazine Where to get Time Out magazine Subscribe to Time Out magazine Manage my subscription Follow us Facebook Twitter Youtube Instagram Pinterest Spotify Time Out London Site map },http://www.timeout.com/london/film/planes,200,planes0,planes,timeout
"Review Planes - MTV mtv Menu mtv mtv Home Shows Full Episodes Shows A-Z TV Schedule App MTV2 2016 vmas Shows News Music from the Shows Casting Calls Music Music Artists A-Z Music Videos Artist to Watch News Latest News Music Celebrity TV Movies Style Politics Life TV Provider Signout facebook twitter tumblr news Shows Full Episodes Shows A-Z TV Schedule App MTV2 2016 vmas Shows News Music from the Shows Casting Calls Music Music Artists A-Z Music Videos Artist to Watch News Latest News Music Celebrity TV Movies Style Politics Life facebook twitter tumblr VMA Nominations Live From The DNC Music Movies Review Planes Williams Goss 08/09/2013 A Disney-only spin-off to an established Pixar brand that technically doesnt bear the latter companys name and certainly doesnt attempt their degree of innovative storytelling or reliable wit ""Planes"" proudly announces its existence within the world of ""Cars"" before cramming the stories of those two earlier films together in a visually colorful but otherwise vanilla continuation of the series. Dusty Crophopper (voiced by Dane Cook) is a single-prop crop-duster in the tiny town of Radiator Springs Propwash Junction who daydreams of flying far and fast. ""Ive flown thousands of miles but Ive never been anywhere"" he cries to manure-hauling compatriot Leadbottom (Cedric the Entertainer) but heres the kicker Dustys afraid of heights That wont keep him from attempting to qualify for the Wings Around the Globe race with the help of dumb fat fuel truck friend Mater Chug (Brad Garrett) and crusty mentor Doc Skipper (Stacy Keach). Much like last months ""Turbo"" and countless other toons before that ""Planes"" incorporates any number of ethnic stereotypes for maximum international appeal -- a Latin lover wearing a lucha libre mask named El Chupacabra for example -- while teaching wee ones that they can surely achieve their dreams granted that they best their cocky idols and endure severe body transformations along the way. (Much is made of Dustys reluctance to have his sprayer surgically removed. Good luck explaining that one folks.) The fun doesnt stop there characters toss around pun-powered slang like ""Lugnut up"" and ""Why dont you go plow yourself?"" while a convertible flying car is greeted warily as a schizophrenic because if theres one thing that kids love with their ""Midnight Cowboy"" references (yes really) its shoutouts to mental illness. While the adults in the audience get to preoccupy themselves with the still-eerie logic of the ""Cars""/""Planes"" universe where planes fly within one another to get places and still somehow built a Statue of Liberty in their own image the kids should be placated by the close calls bright colors and wacky accents by the likes of Cook Keach Julia Louis-Dreyfus Teri Hatcher John Cleese Priyanka Chopra Carlos Alazraqui Roger Craig Smith and -- in an admittedly inspired touch -- Val Kilmer and Anthony Edwards as fighter jets. The intercontinental intrigue shouldnt stun them just as the valuable lessons about teamwork and self-worth (spoiler alert?) wont blow minds. Everything about Klay Halls direction and Jeffrey M. Howards screenplay aims to make a minimal impact and given the projects origins as a direct-to-video venture one is hardly surprised. Only the sight of Chug shamelessly hawking Dustys merchandise feels actively aware of ""Planes"" own thorough disposability as a money-making machine. When Chopras sleek Indian temptress makes a nod to Hindu culture by saying that ""many believe that we will be recycled as tractors"" one is tempted to remind her that technically this will all be recycled as ""Planes Fire amp; Rescue"" next summer then as ""Boats"" then as ""Trains"" and then maybe as ""Tractors."" SCORE 4.3 / 10 Movies Disneys Planes News about FAQ/Help Jobs Terms of Use Privacy Policy/Privacy Rights Copyright Closed Captioning Eventful Partners Ad Choices (c)2016 Viacom International Inc. All Rights Reserved. MTV and all related titles and logos are trademarks of Viacom International Inc.",http://www.film.com/movies/planes-review,200,planes1,planes,film
Planes Movie Review amp; Film Summary (2013) | Roger Ebert,http://www.rogerebert.com/reviews/planes-2013,200,planes2,planes,rogerebert
"Planes review New cartoon never takes off |       NJ.com NJ.com Menu Home News Politics Sports High School Sports Entertainment Photos/Videos Obituaries Autos Jobs Real Estate Rentals Health Classifieds Local Businesses Place An Ad Opinion Follow Us Subscribe Back to Main Menu News News by County All Newspapers Business Crime Education Health Lottery Obituaries Politics Back to Main Menu Atlantic Bergen Burlington Camden Cape May Cumberland Essex Gloucester Hudson Hunterdon Mercer Middlesex Monmouth Morris Ocean Passaic Salem Somerset Sussex Union Warren Back to Main Menu The Star-Ledger The Times of Trenton The Jersey Journal South Jersey Times Hunterdon County Democrat Independent Press Horse News Back to Main Menu Politics Home Chris Christie Opinion The Auditor Back to Main Menu Sports Home Devils Eagles Flyers Giants Jets Knicks Mets Nets Phillies Rangers Red Bulls Rutgers Basketball Rutgers Football Rutgers Sports Seton Hall Sixers Yankees Back to Main Menu Football Baseball Softball Boys Lacrosse Girls Lacrosse Boys Track and Field Girls Track and Field Boys Volleyball Boys Tennis Boys Golf Girls Golf Wrestling Boys Basketball Off Season Sports Back to Main Menu Football Wrestling Boys Basketball Girls Basketball Boys Bowling Girls Bowling Boys Cross Country Girls Cross Country Boys Fencing Girls Fencing Field Hockey Boys Ice Hockey Girls Ice Hockey Gymnastics Boys Skiing Girls Skiing Boys Soccer Girls Soccer Boys Swimming Girls Swimming Girls Tennis Girls Volleyball Boys Winter Track Girls Winter Track Back to Main Menu Entertainment Home Atlantic City Entertainment Celebrities Comics Events Food amp; Dining Indulge Inside Jersey Movies Music Online Gambling Guide Puzzles Shore TV Back to Main Menu Hunterdon County Democrat Photos Jersey Journal Photos NJ.com Photos South Jersey Times Photos Star-Ledger Photos Times of Trenton Photos Videos Back to Main Menu Homes for Sale New Homes For Rent Foreclosures Commercial Real Estate News Resources Place An Ad Back to Main Menu Home Buying Sell My Home Rental Living Home Ideas Mortgages and Loans Im Moving Back to Main Menu Obituaries Rentals Pets For Sale Garage Sales Find n Save Fraud Prevention Manage Your Ad Place An Ad Back to Main Menu Find A Business Food amp; Dining Retail Shopping Health amp; Medicine Personal Care Entertainment Real Estate Automotive Claim Your Business Sponsored Blogs Back to Main Menu Visit our Facebook Page Follow us on Twitter View our Instagram photos See our Tumblr feed See our Pinterest page Visit us on Google Plus Visit OMJ for NJ celebrity amp; style Back to Main Menu Email newsletters The Star-Ledger The Times of Trenton The Jersey Journal South Jersey Times Hunterdon County Democrat Star Gazette Back to Main Menu Close Customize Your Weather Set Your Location (Enter City and State or Zip Code) Congratulations Your weather is set to . You can change the location at any time. AccuWeather.com Quick Look Change your current location >> View Full Weather Report Search Search Search NJ.com Account Sign In Close Sign in toNJ.com You are signed in as Edit Public Profile Sign Out Subscribe Email newsletters The Star-Ledger The Times of Trenton The Jersey Journal South Jersey Times Hunterdon County Democrat Star Gazette comments Planes review New cartoon never takes off disneys planes.jpg Disneys Planes is a brand-new movie. So why does it feel so third-hand? (DISNEY) Print Email Stephen Whitty | ArtiSyndicate By Stephen Whitty | ArtiSyndicate The Star-Ledger Email the author | Follow on Twitter on August 09 2013 at 525 AM updated August 09 2013 at 526 AM comments Halfway through ""Planes"" a little car shows up towing wings behind him. Hes both an automobile and an airplane he explains -- a weird ungainly little hybrid of which only six were made. Well Disney just made another one. Its new movie a title tells us is part of the ""World of Cars"" -- an apparently broad new franchise based on the first ""Cars"" movie in which every mode of transport has big eyes and a huge dream. Boy I just cant wait for ""Ferries."" In the meantime though here comes this. And you can see the appeal for little kids who just love playing vroom-vroom around the living room. Also for merchandisers who love playing Just How Much More Junk Can We Cram Into Toystores? But in reality the new film is just a thin copy of ""Cars"" and ""Cars 2"" -- and frankly neither of them was that wonderful to begin with. Of course the character design -- which was unfortunately Pixars worst -- remains. The vehicles windshields double as eyes. There are no sharp edges or rich textures. Everything is as round and shiny as a pacifier. But the story is even slighter -- like a Mad Libs version of the first ""Cars"" scripts with merely some nouns changed. So is there a grumpy grandfatherly mentor as in ""Cars""? Yes. And an awkward untutored truck as a sidekick? Check. Do we have an international race as we did in ""Cars 2""? You bet. Complete with national stereotypes of the various foreign entries? But of course senor. Of course its not as if anybody besides a compulsive critic really remembers the plots of the ""Cars"" movies but the recycling is proof of the slightly slipshod nature of the whole project. Eh they liked it before theyll like it again. Just put wings on the things. At least the first ""Cars"" movie has some distinctive voices giving the story a slight advantage though. Here instead of Owen Wilson as the hero we get the bland Dane Cook. And instead of Paul Newman as a crusty advisor were handed -- Stacy Keach. These are dinner-theater substitutions at best. Brad Garrett at least gives a little life to his part as the sidekick. And its a cute idea to bring on Anthony Edwards and Val Kilmer as a couple of fighter planes although the joke is too fleeting to make an impression even on adults whod remember them from ""Top Gun."" But other than that its strictly by the numbers from the believe-in-yourself moral to the purely predictable ending. Small children probably wont mind. The ones I saw at my screening certainly didnt and although this Disneyfied cartoon adds bathroom jokes that Pixar would never have stooped to it also picks up the pace considerably. Once the race starts and the main characters take off the movie does too -- at least for little ones. But if youre one of their adult companions? Put your seat in a reclining position. And pray for in-flight beverage service. Ratings note The film contains some mildly vulgar humor. Planes (PG) Disney (92 min.) Directed by Klay Hall. With the voices of Dane Cook Brad Garrett Stacy Keach. Now playing in New Jersey.",http://www.nj.com/entertainment/index.ssf/2013/08/planes_review_new_cartoon_never_takes_off.html,200,planes3,planes,nj
"Disneys Planes Follows in the Footsteps of Cars - The New York Times NYTimes.com no longer supports Internet Explorer 9 or earlier. Please upgrade your browser. LEARN MORE >> Sections Home Search Skip to content Skip to navigation View mobile version The New York Times Movies|For a Crop-Duster Theres More to Life Than Spraying the Fields Advertisement Search Subscribe Now Log In 0 Settings Close search search sponsored by Site Search Navigation Search NYTimes.com Clear this text input Go http//nyti.ms/13K6gio Loading... See next articles See previous articles Site Navigation Site Mobile Navigation Advertisement Supported by Movies | Movie Review For a Crop-Duster Theres More to Life Than Spraying the Fields Disneys Planes Follows in the Footsteps of Cars Planes Directed by Klay Hall Animation Adventure Comedy Family PG 1h 31m By NEIL GENZLINGERAUG. 8 2013 Continue reading the main story Share This Page Continue reading the main story Photo A bored Dusty voiced by Dane Cook seeks adventure in an around-the-world race in the feature ""Disneys Planes."" Credit Walt Disney Pictures Not so long ago if you bought a ticket to an animated childrens movie you could expect to spend 90 minutes watching a princess slowly fall for a handsome young man or some variation on that theme. These days though the odds are good that you will instead find yourself watching a race. There was ""Cars"" in 2006 followed by ""Cars 2"" in 2011. Last years engaging hit ""Wreck-It Ralph"" built to a big race too. And just last month ""Turbo"" brought us a speedy snail.Now comes ""Disneys Planes"" in which a determined little airplane named Dusty Crophopper (the voice of Dane Cook) seeks to escape his workaday life of spraying fertilizer on farm fields and enter an around-the-world race intended for much sleeker and more powerful aircraft. Repeated exposure to racing plotlines rather than drippy romantic ones will almost certainly warp the current generation of toddlers although precisely how wont become clear for a few decades. Romance however has not been banished completely. ""Planes"" carries the clear suggestion that airplanes have sex.More on that later.""Planes"" is in the ""Cars"" lineage with John Lasseters DNA (he is executive producer) and an absence of human characters; the planes and other machines here do their own talking and thinking. What comes out of them isnt as amusing or surprising as what came out of those cars and no matter how fast they go these planes cannot escape the gravitational pull of the earlier movies. ""Planes"" is for the most part content to imitate rather than innovate presumably hoping to reap a respectable fraction of the box office numbers of ""Cars"" and ""Cars 2"" which together made hundreds of millions of dollars (not to mention the ubiquitous product tie-ins).It shamelessly adopts the international story approach of ""Cars 2"" which played well in overseas markets. The airplane racers come from an assortment of countries and stop all over the globe. (The best gag is a reincarnation joke delivered somewhere around India.) And it has the familiar assortment of friends and foes either helping or hindering the likable hero an old aircraft with wise advice a cutthroat one that doesnt play by the rules and so on.Skipper (Stacy Keach) is the old warplane who coaches Dusty and has his own story a nod to the heroics and traumas of the World War II generation. Chug the fuel truck (Brad Garrett) and Dottie the forklift (Teri Hatcher) provide crucial support as well Dottie serving as mechanic. Ripslinger (Roger Craig Smith) has won the race three times in a row and will stop at nothing to make it four. Advertisement Continue reading the main story To its credit just when it seems on its way to a predictable happy ending the movie directed by Klay Hall takes a jarringly dark turn as Dusty encounters a frightening storm at sea. Hes flying close to the water because hes afraid of heights not a good thing when the ocean is churning with ""Perfect Storm""-size waves.As for the racy element of this race most of it involves a Mexican plane named El Chupacabra (Carlos Alazraqui). The character is one of several in this movie that carry a whiff of ethnic stereotyping but more notable is this planes relentless wooing of a Canadian plane named Rochelle (Julia Louis-Dreyfus).She eventually succumbs to his charms but what precisely this means is left unclear as their plane-to-plane make-out session takes place off screen. With children being naturally curious parents should prepare themselves by studying the schematics for assorted aircraft. There are bound to be some awkward questions about the birds and the bees and the flying machines.""Disneys Planes"" is rated PG (Parental guidance suggested) for mildly suggestive moments and a scary encounter with the sea. Planes Director Klay Hall Writer Jeffrey M. Howard Stars Jon Cryer Carlos Alazraqui Rating PG Running Time 1h 31m Genres Animation Adventure Comedy Family Movie data powered by IMDb.com Last updated Mar 30 2016 A version of this review appears in print on August 9 2013 on page C12 of the New York edition with the headline For a Crop-Duster Theres More To Life Than Spraying the Fields. Order Reprints| Todays Paper|Subscribe Continue reading the main story Were interested in your feedback on this page. Tell us what you think. Whats Next Loading... Go to Home Page >> Site Index The New York Times Site Index Navigation News World U.S. Politics N.Y. Business Tech Science Health Sports Education Obituaries Todays Paper Corrections Opinion Todays Opinion Op-Ed Columnists Editorials Contributing Writers Op-Ed Contributors Opinionator Letters Sunday Review Taking Note Room for Debate Public Editor Video Opinion Arts Todays Arts Art amp; Design Books Dance Movies Music N.Y.C. Events Guide Television Theater Video Arts Living Automobiles Crossword Food Education Fashion amp; Style Health Jobs Magazine N.Y.C. Events Guide Real Estate T Magazine Travel Weddings amp; Celebrations Listings amp; More Classifieds Tools amp; Services Times Topics Public Editor N.Y.C. Events Guide Blogs Multimedia Photography Video NYT Store Times Journeys Subscribe Manage My Account Subscribe Subscribe Times Insider Home Delivery Digital Subscriptions Crossword Email Newsletters Alerts Gift Subscriptions Corporate Subscriptions Education Rate Mobile Applications Replica Edition International New York Times Site Information Navigation (c) 2016 The New York Times Company Home Search Accessibility concerns? Email us at accessibilitynytimes.com. We would love to hear from you. Contact Us Work With Us Advertise Your Ad Choices Privacy Terms of Service Terms of Sale Site Information Navigation Site Map Help Site Feedback Subscriptions",http://movies.nytimes.com/2013/08/09/movies/disneys-planes-follows-in-the-footsteps-of-cars.html?smid=tw-nytmovies&seid=auto,200,planes4,planes,nytimes
