review,link,status_code,id,movie_key,critic
"No great heights reached by Planes - The Orange County Register Subscribe Today Customer Service eRegister Todays Paper Knowledge Cafe Magazines Unidos Weather Home News Sports Business Entertainment Life Opinion Obits Register Rewards CARS JOBS DEALS HOMES CLASSIFIEDS Best of OC Celebrities Events Music Disney Knotts Movies Dining TV Arts OCVarsity Arts Columns Brett Simpson goes down other O.C. surfers slip through at U.S. Open Comic takes a long road from O.C. to Mad TV Want to help the homeless through surfing? Heres how you can Early Trump supporter changes her tune Tim Lincecums struggles continue in Angels 6-2 loss to Red Sox Joc Pederson and Chase Utley homer as Dodgers rally to reclaim 9-7 victory over Diamondbacks Rams relocation a breeze compared to Oilers move from Houston to Nashville in 1997 Brett Simpson goes down other O.C. surfers slip through at U.S. Open Erasing buyer turnoffs will help sell your home Anaheim program is packaging new opportunities for workers with disabilities Lynsi Snyder In-N-Out president honored as most trustworthy leader Grocery Outlet debut Free Bruxie lunch for shoppers next week in Orange Comic takes a long road from O.C. to Mad TV 10 free things to do this week (July 29-Aug. 4) Things to do in Orange County (July 29-Aug. 4) Photos Deadheads gather at Irvine Meadows one last time Top news Entertainment No great heights reached by Planes Aug. 8 2013 Updated Aug. 21 2013 1228 p.m. 1 of 5 Dusty (Dane Cook) is a little plane who aspires to big things in ""Planes."" DISNEY ENTERPRISES 1 of 5 Franz (Oliver Kalkofe) helps out the Mexican racing champ El Chupacabra (Carlos Alazraqui) in a scene from ""Planes."" DISNEY ENTERPRISES 1 of 5 From left Dottie (Teri Hatcher) Dusty (Dane Cook) and Chug (Brad Garrett) appear in a scene from ""Planes."" DISNEY ENTERPRISES 1 of 5 Dusty (Dane Cook) appears in a scene from ""Planes."" DISNEY ENTERPRISES 1 of 5 Dusty (Dane Cook) and Bulldog (John Cleese) appear in ""Planes."" DISNEY ENTERPRISES View slideshow Dusty (Dane Cook) is a little plane who aspires to big things in ""Planes.""DISNEY ENTERPRISES By MICHAEL SRAGOW / ORANGE COUNTY REGISTER Facebook Twitter Email Comments PRINT SEND PDF PlanesStarring The voices of Dane Cook Stacy Keach Brad Garrett Teri Hatcher Julia Louis-Dreyfus John Cleese Cedric the Entertainer Carlos Alazraqui and Priyanka ChopraBehind the scenes Directed by Klay HallRating PG for some mild action and rude humorRunning time 1 hour 32 minutesThe quick hitA modest peppy ""Cars"" spin-off about a crop duster who wants to become an aviation rally champ.Grade B- Have Disney cartoons just become the B line for Disney/Pixar? ""From the world of Cars comes Disneys Planes"" say the commercials and for once theres truth in advertising. ""Planes"" is just a zippy little programmer designed to exploit the same vehicles-as-people formula as the ""Cars"" franchise. The great old studios too used to spin low-budget variations on their own and each others hits. ""Planes"" has roughly the same relationship to ""Cars"" as ""Congo Maisie"" had to ""Red Dust.""The plot has been super-simplified. Instead of a racing hotshot who learns small-town values and how to drive for the right reasons our hero in ""Planes"" is already a rural crop-duster who values his down-to-earth friends. He dreams of (sound trumpets for the moral) ""doing more than just what I was built for."" He wants to compete in the ""Wings Around the Globe"" aviation rally. His name is Dusty Crophopper since inventive nomenclature popped to 5 a gallon during the writing of the screenplay.Dane Cook is surprisingly amiable in this go-getter role which begins with Dusty lost in ""Top Gun"" fantasies (Anthony Edwards and Val Kilmer give vocal cameos) then swiftly moves into gear as his clattery fuel-truck pal Chug (Brad Garrett) and can-do mechanic Dottie (Teri Hatcher) ready him for the rallys qualifying race. He performs well enough to snag the attention of a Second World War fighter plane named Skipper (Stacy Keach) who functions as a cross between a D.I. in a basic-training film and Paul Newmans wise ""Doc"" in ""Cars.""Before long Dusty is racing across the continents with an international crew of jolly cartoonish stereotypes like Bulldog (John Cleese) the stiff-upper-lip Englishman who blubbers when struck by emotion and El Chupacabra (Carlos Alazraqui) the flamboyant Mexican star of racing telenovelas and romance novels who wears his heart on his wing and becomes Dustys closest ""compadre.""The movie has its share of visual wit El Chupacabra dons a cape and mask and roughly has the same profile as Jack Black in ""Nacho Libre."" And writer Jeffrey M. Howard fills the script with racing lore that gives this sleek confection some welcome knotty verbal textures - lets hope they entice some kids to learn what ""a radial G pass"" really is.But apart from the fleeting charms of Dustys friendships and one dazzling lyric interlude - a flight over India with the alluring but ambiguous Ishani (Priyanka Chopra) - the movie fails to spark much emotion beyond a general ""go for it"" spirit. Even the moments of high merriment and high drama feel well mechanical. For the record I preferred El Chupacabra serenading his French-Canadian sweetie Rochelle (Julia-Louis Drefyus) to Skipper revealing the dark secret of why he stopped flying after World War II.Still the overall attitude is chipper and the flying scenes are exciting (if not exactly memorable) in the post-""Star Wars"" lets-steer-this-baby-between-two-walls kind of way. (And why not? John Lasseter who executive-produced the film and co-wrote the story really got his start at LucasFilm.)My biggest fear is that this films success will mean a string of uninspired entries. Whats next? ""From the world of Cars and Planes comes Trains"" - except given the state of American high-speed rail it would have to be set entirely in Europe and Japan.Contact the writer msragowocregister.com Most Popular Costa Mesa Police detail homeowners 2012 fatal shooting of burglar -- caper involved artDodgers Yasiel Puig remains in limbo as trade deadline nears; Jay Bruce a possible targeTim Lincecums struggles continue in Angels 6-2 loss to Red SoxGrocery Outlet debut Free Bruxie lunch for shoppers next week in OrangeEarly Trump supporter changes her tune User Agreement Comments are encouraged but you must follow our Privacy Policy Policy amp; Terms of Use Keep it civil and stay on topic. No profanity vulgarity racial slurs or personal attacks. People who harass others or joke about tragedies will be blocked. By posting your comment you agree to allow Orange County Register Communications Inc. the right to republish your name and comment in additional Register publications without any notification or payment. Brett Simpson goes down other O.C. surfers slip through at U.S. Open Comic takes a long road from O.C. to Mad TV Want to help the homeless through surfing? Heres how you can Early Trump supporter changes her tune Tim Lincecums struggles continue in Angels 6-2 loss to Red Sox Joc Pederson and Chase Utley homer as Dodgers rally to reclaim 9-7 victory over Diamondbacks Rams relocation a breeze compared to Oilers move from Houston to Nashville in 1997 Brett Simpson goes down other O.C. surfers slip through at U.S. Open Erasing buyer turnoffs will help sell your home Anaheim program is packaging new opportunities for workers with disabilities Lynsi Snyder In-N-Out president honored as most trustworthy leader Grocery Outlet debut Free Bruxie lunch for shoppers next week in Orange Comic takes a long road from O.C. to Mad TV 10 free things to do this week (July 29-Aug. 4) Things to do in Orange County (July 29-Aug. 4) Photos Deadheads gather at Irvine Meadows one last time Top news Education >> Explaining Californias new vaccine law 9 things you need to know as school begins Santa Ana Unified School District names one of its own as new superintendent Concordia celebrates 40th anniversary with big band concert BUSINESS >> Erasing buyer turnoffs will help sell your home Anaheim program is packaging new opportunities for workers with disabilities Lynsi Snyder In-N-Out president honored as most trustworthy leader O.C. Watchdog >> Obamacare tax credit turns into headache Does O.C. local government need more oversight? Very clear signs of trouble at Trinity Broadcasting Network as revenue shrinks attractions close Health Care >> Obamacare tax credit turns into headache What do Covered Californias big rate hikes mean for you? Obamacare rates in state to rise 13% in 2017 - 14% higher in O.C. ENTERTAINMENT >> Comic takes a long road from O.C. to Mad TV 10 free things to do this week (July 29-Aug. 4) Things to do in Orange County (July 29-Aug. 4) Food >> An OCFair question Who makes the best Spam dish ... and why? Dunkin Donuts opens redesigned store Monday in Yorba Linda Will Johnny Rockets new boss bring back singing waiters or push ahead with modern touch? TELEVISION >> Comic takes a long road from O.C. to Mad TV Richard Wagoner on radio If Sacramento can get its local counter-culture FM station back why not L.A.? This weeks TV highlights Special Sections >> OC Home 2016 OC HOME 2015 100 Top Workplaces 2015 Featured Multimedia CARTOONS >> Cartoons Running with baggage HARRY POTTER >> Why Harry Potter and the Cursed Child continues J.K. Rowlings magical success SLIDESHOW >> U.S. Open of Surfing Check out these tattoos on display SLIDESHOW >> All dressed up for the Barnyard Fashion show at the O.C. Fair SLIDESHOW >> OC Fairs Conjurer is a soothsayer with wit and wisdom SLIDESHOW >> FanFriday Angel fans in the stands Programs amp; Promotions Nominate an Everyday Hero Stay Connected with our E-Mail Newsletters Receive breaking news and newsletters Cars Jobs Homes Deals Classifieds Find a car Dealer Print Specials Find a Dealer News and Research Sell a Car Find a job Employer Tools Interview Online Post a Resume Top Workplaces Find a home Apartments amp; Rentals Find an Agent Mortgage Center New Homes Find a deal Garage Sales Grocery Coupons Search Coupons Search Ads Search Classifieds Announcements Obituaries Place an Ad Pets Business Directory More Orange County Businesses Ads by Google Return to Top home news sports business entertainment life travel opinion Real estate Jobs Cars Deals Classifieds Place an Ad ADVERTISE OPTIONS Self Service Place an Online Ad Place a Print Ad Place a Classified Ad Media Kit Advertising Contact Info CONTACT OCREGISTER About Us Careers Contact Us Corrections Customer Service Subscribe Today Upgrade to 7-days Subscriber Services Site Help Site Feedback OCR SERVICES Archives Buy Our Photos California Lottery Deals Register Rewards Register in Education Obituaries Facebook Comments FAQs NEWS YOUR WAY Blogs E-Mail Newsletters E-Register Mobile RSS Site Map Video ADVERTISING Classifieds Cars Deals Jobs Real Estate Place a Classified Ad View our Media Kit PARTNERS KDOC-TV Unidos Coast Magazine Freedom Printing OC Register Family Southland Golf Copyright (c) 2016 The Orange County Register amp; Digital First Media Privacy Policy amp; Terms of Use | Copyright | Arbitration | Site Help | Site Map | Digital First Media",http://www.ocregister.com/articles/planes-520077-cars-dusty.html,200,planes7,planes,ocregister
"Planes a sky-high crowd pleaser for kids review | Toronto Star SectionsSearch the print archivesSectionsEntertainmentMoviesPlanes a sky-high crowd pleaser for kids reviewPlanes the latest animated offering from Disney doesnt quite soar. But strong visuals and an engaging story will likely appeal to young audiences.Dusty the hero of Planes basks in the approval of adoring fans.By Bruce DeMaraEntertainmentThu. Aug. 8 2013PlanesStarring the voices of Dane Cook Stacey Keach. Directed by Klay Hall. 92 minutes. Opens Aug 9 at major theatres. GHe may be a lowly crop duster but he has a soaring ambition to win an around-the-world race. Now if only Dusty Crophopper could overcome his fear of heights.Article Continued BelowThats the premise behind Planes the latest feature out of DisneyToon Studios a film clearly inspired by the anthropomorphic success of another Disney product Pixar Studios Cars and Cars 2 which together grossed more than 1 billion at the box office. ""Ive flown 1000s of miles and Ive never been anywhere"" Dusty (voiced by comic Dane Cook) laments. But even after narrowly qualifying for the Wings Around the World event -- after another competitor cheats and is disqualified -- Dusty gets little respect from his fellow competitors who disdain him as a ""farm boy"" who reeks of um compost.Planes follows the standard Disney formula to the letter the mean-spirited alpha male villain named Ripslinger (voiced by Roger Craig Smith) who along with two nasty minions Ned and Zed will do anything to win against the underdog hero Dusty who manages to prevail through sheer pluck and with the help of friends old and new.While the film is clearly aimed at young audiences theres also an effort to bring along adults with a script that contains several humorous references that would be way over the heads of youngsters.To wit naming a colour commentator Brent Mustangburger a reference to sports personality Brent Musburger giving the control tower at New Yorks JFK Airport a Kennedy-esque accent and a conversation between two female planes about an eligible but undesirable male flyer -- ""Nice enough guy but way too much baggage.""Director Klay Hall has also corralled a slew of celebrity voices among them British comic John Cleese as Bulldog a de Havilland Comet; Stacey Keach as the gruff Skipper Riley an aged Corsair who trains Dusty and Julia Louis-Dreyfus doing a howlingly bad Quebecois accent as his love interest Rochelle. And while the plotting is rather pedestrian the humour mostly lame what makes Planes a stand-out experience -- not surprisingly based on Disneys vast and impressive history of animated classics -- is the visuals.With so much of the action taking place in the stratosphere the film is a visual treat throughout including scenes of simple homespun beauty such as Nebraska cornfields and others of breathtaking magnificence capturing the majesty of the Himalayas and the Pacific Ocean during a raging storm. If ever a film was designed to take advantage of 3-D it is this one and it does.With a sequel already in production and set for release in 2014 the people at Disney clearly have sky-high expectations of Planes. Their confidence will likely be rewarded.The Morning Headlines NewsletterDelivered daily to your inbox.Sign upMore from the Toronto Star amp; PartnersLOADING                                             LOADING                    21degCloseHomeLatest NewsVideoGTABlogsJims Restaurant about to serve its last best western in LeslievilleLeslieville diner closing to make way for condos.NewsGTACity HallQueens ParkCanadaWorldInvestigationsCrimeBusinessEconomyPersonal FinanceReal EstateYour TorontoSchoolsThe FixerLifeFashion amp; StyleFood amp; WineHealth amp; WellnessHomesParentTechnologyTravelSportsAmateurBaseballBasketballBlue JaysCurlingFootballGolfHockeyLacrosseLeafsOlympicsRaptorsSoccerTennisOpinionCommentaryCorrectionsEditorialsEditorial CartoonPublic EditorReaders LettersEntertainmentBooksMoviesMusicStageTelevisionVisual ArtsDiversionsHoroscopesCrosswordsSudokuComicsWheels.caSpecial FeaturesObituariesClassifiedsTV ListingsHot TopicsDem. ConventionRio OlympicsPokemon GoBlue JaysGeneration 9/11Panama PapersFresh Air FundWeather BlogFollow usFacebookTwitterGoogle+InstagramRSSManage NewslettersSite MapAboutContact UsFeedbackthestar.comFeedbackSite MapNewslettersInsurance HotlineNew in HomesStar StoreCorrectionsBehavioural TargetingTodays NewsFlyersCanadaStaysContestsToronto Star Newspaper Ltd.AboutAtkinson PrinciplesStatement of PrinciplesGet Home DeliveryMy SubscriptionContact UsContact WebmasterFAQNews ReleasesStar InternshipsCareers  the StarStar AdvisersStar ePaperStar TouchAdvertise with UsAdvertising TermsMedia KitSpecial FeaturesInitiativesSanta Claus FundFresh Air FundSpeakers BureauClassroom ConnectionToronto Star ArchivesReport on Community Giving(c) Copyright Toronto Star Newspapers Ltd. 1996 - 2016Privacy PolicyTerms and Conditions",http://www.thestar.com/entertainment/movies/2013/08/09/planes_a_skyhigh_crowd_pleaser_for_kids_review.html,200,planes8,planes,thestar
"Planes a smooth enjoyable flight | New York Post Thanks for contacting us. Weve received your submission. Back to Reading News Metro Page Six Sports Business Opinion Entertainment Fashion Living Media Tech Real Estate Sub Menu 1 Photos Video Covers Columnists Horoscopes Sub Menu 2 Classifieds Subscribe Sign in In The News hillary clinton iran lamar odom 2016 presidential election new york mets Sections Search Tips Sign in New York Post Most Popular 40752 Ex-NFLer wife fatally shot by teen in their home 21238 14-year-old girl slit teens throat in hopes of getting 1st kill cops 13852 Cop in bikini tackles bad guy 13183 Malia Obama skipped the DNC for Lollapalooza 12631 We have failed to protect Christians from Islamic terror 12321 Why Hollywood babes are trying to bag a tech titan not a rock star Close Breaking News 16 feared dead in Texas hot air balloon crash Share thisFacebookTwitterGoogleWhatsAppEmailCopy Entertainment Share thisFacebookTwitterGoogleWhatsAppEmailCopy Planes a smooth enjoyable flight By Lou Lumenick View author archive email the author follow on twitter Get author RSS feed Name(required) Email(required) Comment(required) August 8 2013 | 734pm Modal Trigger DisneyToons ""Planes"" starring Dane Cook as Dusty (right) with Priyanka Chopra as love interest Ishini escaped a straight to DVD fate.       Photo Everett Collection Often less really is more and thats why I can recommend ""Planes a charmingly modest low-budget spin-off from Pixars ""Cars that provides more thrills and laughs for young children and their parents than many of its more elaborate brethren. With so little money at stake director Klay Hall writer Jeffrey Howard and the rest of the team are free to have some fun -- and even make fun of the sort of ethnic stereotypes largely banished in Disneys more politically correct theatrical product. And they dont feel the obligations to force-feed young audiences heavy-handed life lessons in every other scene. The story -- somewhat similar to DreamWorks recent ""Turbo -- is simplicity itself. Dusty a lowly sentient cropduster (voiced by Dane Cook) wants to live out his dream of entering an around-the-world flying competition never mind that hes afraid of heights. Encouraged in his unlikely ambitions by a perky forklift (Teri Hatcher) and a dimwitted fuel truck (Brad Garrett) Dusty is reluctantly coached by a crusty Navy Corsair from World War II (Stacy Keach). Qualifying through a fluke Dusty arrives for the start of the race at Kennedy Airport. The only competitors who pay much attention to him are Mexicos El Chupacabra (Carlos Alazraqui) and Britains Bulldog (John Cleese). Romantic interest is provided by the French-Canadian plane Rochelle (Julia-Louis Dreyfuss) and the Indian entrant Ishani (Bollywood star Priyanka Chopra). The bad guy is the egotistical defending champion Ripslinger (voiced by Roger Craig Smith) who is constantly trying to sabotage the plucky and resourceful Dusty. RELATED DELVE INTO WHATS NEW IN THIS SEASONS ANIMATED MOVIES The flying footage is extremely well executed for a low-budget animated feature but never sacrifices character in favor of action like Pixars ""Cars 2 did. In fact ""Planes is vastly better than the noisy and crass ""Cars 2 and even a bit superior to the once-great Pixars latest the pricey but ponderous ""Monsters University. Not a Pixar product ""Planes was made for a fraction of the cost by DisneyToon Studios and was headed straight for DVD -- until the Mouse House decided it could be profitably cycled through theaters with a 3-D makeover. (Do yourself a favor and skip the stereoscopic surcharge which is not worth it.) ""Planes is fairly predictable and is far from a masterpiece. But it runs around an hour and a quarter before the closing credits. Thats a definite plus in an era when bloated cartoons frequently exceed the attention span of younger audience members. Follow loulumenick on Twitter for the latest movie news and reviews. Share thisFacebookTwitterGoogleWhatsAppEmailCopy Share this article Share thisFacebookTwitterGoogleWhatsAppEmailCopy Read Next Lovelace not deep enough Read Next Lovelace not deep enough Share Selection Trending Nowon NYPost.com 39913 Ex-NFLer wife fatally shot by teen in their home 20579 14-year-old girl slit teens throat in hopes of getting 1st kill cops 13459 Cop in bikini tackles bad guy Now On Celebrate Arnolds 69th birthday with his beefiest vintage pics Eric Claptons girlfriends ex-beau busted on pot rap Orlando Bloom joins Andy Sambergs HBO mockumentary SEE ALL Page Six TV Lindsay Lohans dad says booze pics arent what they seem Lindsays sober claims Michael Lohan These celebs hang out where? Now On Pure Nude Yoga Actual Workout Or Masturbation Material? (Answer Sorta Both) SEE ALL More Stories pagesix Harry Brant busted for drugs and bailing on taxi fare Now On Decider This Woman Giving Birth In A Stream Has Been Watched Over 54 Million Times (NSFW) nypost Ex-NFLer wife fatally shot by teen in their home New York Post Twitter Facebook Instagram Email Newsletters Mobile Apps Contact Us Tips Twitter Facebook Instagram Sections amp; Features News Real Estate Page Six Tech Sports Media Metro Photos Entertainment Video Business Alexa Opinion Covers Fashion Horoscopes Living Classifieds Newsletters amp; Feeds Email Newsletters RSS Feeds NYPost Store Home Delivery Subscribe Manage Subscription Preferences Help/Support Customer Service App FAQ amp; Help Contact Us Tips Newsroom Letters to the Editor Reprints Careers Apps iPhone App iPad App Android Phone Android Tablet Advertise Media Kit Contact Post Digital Network (c) 2016 NYP Holdings Inc. All Rights Reserved | Terms of Use | Privacy | Your Ad Choices News Corp. is a network of leading companies in the world of diversified media news and information services. News Corp HarperCollins Marketwatch realtor.com Dow Jones The Sun Storyful Wall Street Journal The Times Mansion Global New York Post The Australian Checkout51 News America Marketing News.com.au Unruly Send to Email Address Your Name Your Email Address Cancel Post was not sent - check your email addresses Email check failed please try again Sorry your blog cannot share posts by email. Copy Share URL Copy Link Sign Up / Sign In Sign In // Sign Up With your existing account from... With your existing account { loginWidget } Use an account with your email address Or with a NYPost.com account { userInformationForm } { traditionalSignIn_emailAddress } { traditionalSignIn_password } { traditionalSignIn_signInButton }{ traditionalSignIn_createButton } { /userInformationForm } Sign Up / Sign In Sign In // Sign Up Welcome back { welcomeName } { loginWidget } Or use NYPost.com account Sign Up / Sign In Sign In // Sign Up Welcome back Welcome back { welcomeName } { userInformationForm } { traditionalSignIn_emailAddress } { traditionalSignIn_password } { traditionalSignIn_signInButton } { /userInformationForm } Use an account with your email address Or use another account Almost Done Please confirm the information below before signing in. Please confirm the information below. { socialRegistrationForm } { socialRegistration_emailAddress } { socialRegistration_displayName } { socialRegistration_ageVerification } By clicking ""Sign In"" you confirm that you accept our terms of service and have read and understand privacy policy. { backButton } { socialRegistration_signInButton } { /socialRegistrationForm } Almost Done { registrationForm } { traditionalRegistration_emailAddress } { traditionalRegistration_password } { traditionalRegistration_passwordConfirm } { traditionalRegistration_displayName } { traditionalRegistration_captcha } { traditionalRegistration_ageVerification } By clicking ""Create account"" you confirm that you accept our terms of service and have read and understand our privacy policy. { backButton } { createAccountButton } { /registrationForm } Create a new password ForgotPassword? Dont worry it happens. Well send you a link to create a new password. { forgotPasswordForm } { traditionalSignIn_emailAddress } { backButton } { forgotPassword_sendButton } { /forgotPasswordForm } Create a new password Sent Weve sent an email with instructions to create a new password. Your existing password has not been changed. Weve sent an email with instructions to create a new password. Close Account Already Exists { mergeAccounts } { backButton } Sign in to complete account merge { tradAuthenticateMergeForm } { traditionalSignIn_emailAddress } { mergePassword } { traditionalSignIn_signInButton } { /tradAuthenticateMergeForm }",http://www.nypost.com/p/entertainment/movies/planes_smooth_enjoyable_flight_blTe12uVGHDgDbA7nqYHyM?utm_medium=rss&utm_content=Movies,200,planes9,planes,nypost
