review,link,status_code,id,movie_key,critic
0,http://web.mac.com/moviecritic1/Site/Pride_%26_Glory.html,0,pride&glory0,pride&glory,mac
Were sorry we cant find the page that youre looking for Go to the content Go to the footer Time Out New York New York Popular cities London New York Paris Chicago Los Angeles Browse all cities Time Out New York Close New York Change city New York Popular cities London New York Paris Chicago Los Angeles Browse all cities Tickets Events Things to Do Restaurants Bars Movies Theater Music Shopping Attractions Blog Art Travel Nightlife Events amp; Festivals Museums Kids Hotels Comedy Dance LGBT Sex amp; Dating Books City Guide Neighborhoods Promotions Close My Time Out Things I love My lists My Profile My Account Sign out Sign in Create account Sign in With your social account Or with your email Email Password Remember me Forgotten your password? Sign in You can create a Time Out account in two ways... With a few clicks using your favourite social network Or by entering your details below Email First Name Last Name Create password Repeat new password I accept Time Outs terms of use including opt-in to newsletters. Create account Welcome  You have successfully connected your account to Time Out. You may sign in with this account in future. Please confirm your account details Email First Name Last Name I accept Time Outs terms of use including opt-in to newsletters. Sign up My Account Sign in or Create account Search Tickets Events Things to Do Restaurants Bars Movies Theater Music Shopping Attractions Blog Art Travel Nightlife Events amp; Festivals Museums Kids Hotels Comedy Dance LGBT Sex amp; Dating Books City Guide Neighborhoods Promotions More Search Were sorry we cant find the page that youre looking for We have either moved the page or it no longer exists. To help you find your way here are some search results we think may be of interest. Movies Pride and Glory Bad cop no doughnut; bad cop film no release? From a script shelved after 9/11 by studio execs nervous about criticizing NYCs Finest the long-troubled Pride and Glory is finally out on bail--and hardly the guilty party expected. Its gritty unglamorous... 3 out of 5 stars Read more Movies Paths of Glory Sticklers for the literal will disagree but this is where Stanley Kubricks career truly begins. His previous film 1956s heist gem The Killing sometimes feels trapped in the noir mannerisms of the day. But it was clever enough to engender goodwill... 5 out of 5 stars Read more LGBT See photos from Pride parades across America From the massive parade through the streets of Los Angeles on June 14 to the celebratory marches in San Francisco Chicago and down NYCs Fifth Avenue yesterday millions of Americans hit the pavement this month to show their support at gay pride events... Read more Movies The Fighter What do we talk about when we talk about Oscar bait? We may fixate on accuracy in based-on-a-true-story showcases be wowed over the physical transformations of actors and measure the pandering and positioning of films with these characteristics as contenders.... 3 out of 5 stars Read more Movies Rank The best documentaries can open up even the most arcane of subjects but Rank never quite explains the appeal of PBR--no not Dennis Hoppers favorite beer but Professional Bull Riders Inc. which hosts 31 competitions a year in a sport where career... Read more Movies The Last Victory The recent documentary boom has brought us Big Films on Big Issues tracts polemics and lessons learnt of politics war family and globalisation (with varied interpretations of truth hanging over them all). The Last Victory is a different story.... Read more Movies The Devils Brigade Apparently based on fact this emerges as a pretty slavish reprise of Aldrichs The Dirty Dozen. This time round Holden is the unconventional officer assigned the task of knocking a bunch of thugs and misfits into shape for a special do-or-die mission.... Read more Top About us Work for Time Out Privacy policy Website terms of use Contact us Get listed Advertising Time Out products Mobile apps Time Out Shop Time Out Guides Time Out Travel Time Out Worldwide Time Out magazine Follow us Facebook Twitter Youtube Instagram Pinterest Spotify Foursquare Time Out New York Site map,http://www.timeout.com/film/reviews/86023/pride_and_glory.html,404,pride&glory1,pride&glory,timeout
"Review Pride and Glory - CSMonitor.com .nojs {displayblock;} body {margin-bottom2em;} Log In|Register Manage Profile My Saved Items Log Out World All World Africa Africa Monitor Americas Latin America Monitor Asia Pacific Asia South amp; Central Europe Middle East Global News Blog Passcode Passcode Voices Passcode Influencers Security Culture Progress Watch Security Watch People Making a Difference Change Agent Specials Africas AIDS Orphans Little Bill Clinton Hostage The Jill Carroll Story World Topics Human Trafficking Series USA All USA Politics The Monitor Breakfast Politics Voices Decoder Foreign Policy Military Justice Education Society USA Update Commentary All Commentary The Monitors View Readers Respond Upfront Blog Global Newsstand Monitor Political Cartoons A Christian Science Perspective Business All Business The Bite Tax VOX The New Economy Saving Money In Gear Paper Economy Robert Reich Guide to Giving Americas Top 50 charities in 2015 ranked by total income Energy / Environment All Energy / Environment Energy Energy Voices Technology All Technology Breakthroughs Voices Science All Science Complexity Science Notebook Culture All Culture Arts Full Frame Photoblog Music Movies Monitor Movie Guide TV Verbal Energy The Home Forum Culture Cafe Family Food Stir It Up Recipe Categories Books All Books Book Reviews Chapter amp; Verse Readers Picks Take Action All Take Action Environment Education Conflict Resolution Disaster Relief and Recovery Human Trafficking Subscribe Subscribe Give a Gift Manage Account Daily News Briefing The Culture Movies Review Pride and Glory Save for later Saved Drama about familial strife in the New York City Police Department has a powerhouse cast. By Peter Rainer October 24 2008 Save for later Saved Colin Farrell (l.) is a New York City cop in Pride and Glory which explores conflicting loyalties in a police investigation. Courtesy of New line cinema          View Caption About video ads View Caption of ""Pride and Glory"" is an underpowered movie with a powerhouse cast. Because of studio politics it is just now being released after languishing for two years on the shelf. No wonder. Its yet another movie about familial strife in the New York City Police Department. If you think youve seen it all before you have.Jon Voight plays top cop Francis Tierney Sr. whose two sons Ray (Edward Norton) and Francis Jr. (Noah Emmerich) as well as his son-in-law Jimmy (Colin Farrell) are all on the force. When four New York cops are killed in what at first looks to be a routine drug bust Francis Sr. puts Ray on the case even though the murdered cops served under Francis Jr. and beside Jimmy. This glaring conflict of interest doesnt seem to rankle anybody but Ray who rightly suspects the investigation will end up fingering his brother and brother-in-law.In the real world Ray would likely not have been assigned this case at all or would staunchly have refused it. But this is Hollywood. Rays dilemma - should he serve the cause of justice or family? - becomes the crux of the melodrama. Recommended Could you pass a US citizenship test? It would be easier to buy into this dilemma if director and co-writer Gavin OConnor - whose father was a New York cop - wasnt so keen on engineering a statement. The actors keyed up for greatness look as if theyre flailing about in a roadshow Eugene ONeill production. The overacting by Voight and Farrell is countered by the underacting of Norton and Emmerich. Test your knowledge Could you pass a US citizenship test? Review Pride and Glory At times ""Pride and Glory"" seems to be about a war between actors not cops. Nobody comes off well. Grade C+ (Rated R for strong violence pervasive language and brief drug content.) Recent Movie Reviews Star Trek Beyond is consistently entertaining Norman Lear Just Another Version of You is a testimonial to an icon The Innocents The subject of the film is more arresting than the movie Print/Reprints About these ads Sponsored Content by LockerDome About these ads About these ads We want to hear did we miss an angle we should have covered? Should we come back to this topic? Or just give us a rating for this story. We want to hear from you. Your name Your e-mail address Your comment Loading... Loading... Loading... Stay Current. Go Far.Discover the Monitor Difference About Contact Us Subscribe E-Readers Advertise With Us Careers Find us online Content Map Text Corrections Reprints amp; Permissions Multimedia A Christian Science Perspective (c) The Christian Science Monitor. All Rights Reserved. Terms under which this service is provided to you. Privacy Policy. Save for later Save Cancel Saved ( of items) This item has been saved to read later from any device. Access saved items through your user name at the top of the page. View Saved Items OK Failed to save You reached the limit of 20 saved items. Please visit following link to manage you saved items. View Saved Items OK Failed to save You have already saved this item. View Saved Items OK",http://www.csmonitor.com/2008/1024/p25s27-almo.html,200,pride&glory2,pride&glory,csmonitor
"Fast paised - tribunedigital-chicagotribune Sections HomeNewsBusinessSportsAamp;ELifestylesOpinionReal EstateCarsJobs HomeNewsBusinessSportsAamp;ELifestylesOpinionReal EstateCarsJobs Fast paisedOctober 24 2008|By MATT PAISHigh School Musical 3 Senior Year (G)With graduation looming Troy (Zac Efron) wonders if hell go to college for basketball or theater; Gabriella (Vanessa Hudgens) anticipates heading to Stanford and being away from Troy; and Sharpay (Ashley Tisdale) schemes to score a Juilliard scholarship. Meanwhile Chad (Corbin Bleu) Taylor (Monique Coleman) Ryan (Lucas Grabeel) and the rest of the gang prep for prom and put on a musical about their impending life changes.The buzz Complaining that ""HSM"" is corny is like Santa Claus griping about long hours -- it comes with the territory.The verdict Yes half the lyrics would be at home on a Backstreet Boys record and Hudgens looks embarrassed when Gabriellas Troy-inspired swooning reaches new heights of cheeseballitude. But the series has grown up relatively speaking at last providing melodies that split the difference between stage tunes and pop radio as well as dance sequences that mix old-fashioned grace with modern pizzazz. (Efrons star shines the entire way.)Happy-Go-Lucky (R)London schoolteacher Poppy (Sally Hawkins) is full of life which inspires affection from some and skepticism from others. The film follows her as she hangs with her roommate/best friend (Alexis Zegerman) takes driving lessons from an angry teacher (Eddie Marsan) flirts with a social worker (Samuel Roukin) goes out drinking takes a dance class and chats with her sisters.The buzz This is a much much less gloomy affair than writer-director Mike Leighs last film 2004s ""Vera Drake"" and ""Happy"" is a particularly strange one in that theres barely any plot to summarize. Rather than serving as a film for people who want a clear conflict and resolution its a snapshot of one woman how she interacts with those around her and how they react to her.The verdict Prepare to have your batteries recharged. Absolutely extraordinary in its grounded optimism ""Happy-Go-Lucky"" features an Oscar-worthy performance from Hawkins that cannot be ignored. With the slightest grin or clench of the eyes Hawkins reveals exactly what makes Poppy tick in a way that feels like you know everything about her without actually knowing much at all. matt pais is metromix movies producer.ALSO OUT FRIDAY- ""Changeling"" See Pages 30-31- ""Pride and Glory"" See Page 35- ""Saw V"" did not screen for critics but go to metromix.com Friday afternoon for Matt Pais review of the film.- ""Passengers"" did not screen for critics.QUICK TAKEFilth and Wisdom (R)""The best part of Filth and Wisdom Madonnas (right) directorial debut is that its only 81 minutes long. It could have been 82.""NEELY TUCKER THE WASHINGTON POST MORE`I Believe We Killed Jordans DadPain relievers What are the differences?Gutierrezs Tax Bill Proves That Miracles Still Do Happen Princess Grace`s Fatal Crash Her Daughter`s AccountLife Skill 201 Washing a baseball cap10 reasons why you want the job Related LinksRelated ArticlesTotally In TuneAugust 17 2007High School Musical 3 Senior Year October 24 2008If it wasnt for you meddling kids ...October 30 2008Voicing in againAugust 12 2007Find More Stories AboutZac EfronVanessa HudgensAshley TisdaleTerms of ServicePrivacy PolicyIndex by DateIndex by Keywordwww.chicagotribune.comConnectLike us on FacebookFollow us on Twitter","http://www.chicagotribune.com/entertainment/movies/chi-pride-glory-review-1024oct24,0,5379993.story",200,pride&glory3,pride&glory,chicagotribune
"Little pride little glory in Pride and Glory - USATODAY.com Cars  Auto Financing  Event Tickets  Jobs  Real Estate  Online Degrees Shopping SearchHow do I find it?Subscribe to paper Home News Travel Money Sports Life Tech Weather Life >> Movies Box Office Report Movie Listings Awards Central Shop for Movies/DVDs Little pride little glory in Pride and Glory Updated  | Comment  | Recommend E-mail | Print | Enlarge Warner Bros. Pictures Warner Bros. Pictures Bad cop good cop Noah Emmerich left plays an officer whose principles have lapsed and Edward Norton lets him know about it. ABOUT THE MOVIE Pride and Glory 1/2 (out of four)Stars Edward Norton Colin Farrell Noah Emmerich Jon Voight Jennifer EhleDirector Gavin OConnorDistributor Warner Bros.Rating R for strong violence pervasive language and brief drug contentRunning time 2 hours 5 minutesOpens Friday nationwide  WATCH THE TRAILER By Claudia Puig USA TODAY Its deja vu all over again. There isnt much more to say about We Own the Night 2. Oops make that Pride and Glory. Perhaps more than any other derivative film this year (and there are quite a few) Pride and Glory feels like something weve seen before. This good cop/crooked cop saga has been done right in The Departed. Prides only saving grace is Edward Norton whose mere presence raises the level of a film several notches. But its unclear why he lately has chosen such worn-out material. Norton plays a sharp NYPD detective with special skills in drawing out the right crime witnesses. He also is the scion of a hard-nosed chief of detectives (Jon Voight) and the brother of another cop (Noah Emmerich). Emmerichs character is essentially decent but he has let his principles slide. He is preoccupied understandably with worry over the well-being of his seriously ill wife (Jennifer Ehle). Colin Farrell plays the brother-in-law of Norton and Emmerich. When several police officers are killed Norton is assigned by his father to investigate. Isnt that some sort of conflict of interest? Its hard to believe this movie was made by Gavin OConnor who directed co-wrote and co-starred in the quirky mother-daughter road picture Tumbleweeds (1999). Save for the offputting cinematography it feels as if Pride could have been made by a computer program titled ""Generic cop drama."" Did we mention all this mayhem occurs around Christmas for some obvious symbolic juxtaposition? Apparently Pride and Glory finished shooting more than two years ago and its release date has been postponed a few times. Its no wonder. Blood-soaked and uninvolving this dark story is noteworthy only for its strong cast. Posted Updated E-mail | Print | To report corrections and clarifications contact Reader Editor Brent Jones. For publication consideration in the newspaper send comments to lettersusatoday.com. Include name phone number city and state for verification. Guidelines You share in the USA TODAY community so please keep your comments smart and civil. Dont attack other readers personally and keep your language decent. Use the ""Report Abuse"" button to make a difference. Read more. Newspaper Home Delivery - Subscribe Today Home  News  Travel  Money  Sports  Life  Tech  Weather About USATODAY.com Site Map | FAQ | Contact Us | Jobs with Us | Terms of Service Privacy Policy/Your California Privacy Right | Advertise | Press Room | Developer | Media Lounge | Reprints and Permissions News Your Way Mobile News | Email News | Add USATODAY.com RSS feeds | Twitter | Podcasts | Widgets Partners USA WEEKEND | Sports Weekly | Education | Space.com | Travel Tips Copyright 2011 USA TODAY a division of Gannett Co. Inc.",http://www.usatoday.com/life/movies/reviews/2008-10-23-pride-and-glory_N.htm,200,pride&glory4,pride&glory,usatoday
"Pride and Glory These cops too late on the scene | Toronto Star SectionsSearch the print archivesSectionsNewsPride and Glory These cops too late on the scenePride and Glory is a New York police corruption drama that boasts a strong ensemble cast - Edward Norton Colin Farrell Jon Voight and Noah Emmerich - but a lousy sense of timing.Colin Farrell left and Edward Norton are among the impressive cast in the disappointing and way-too-familar Pride and Glory.  (SUPPLIED PHOTO)  By Peter HowellMovie CriticFri. Oct. 24 2008 Pride and Glory (out of 4)Starring Edward Norton Colin Farrell Jon Voight and Noah Emmerich. Directed by Gavin OConnor. 125 minutes. At major theatres. 14A Pride and Glory is a New York police corruption drama that boasts a strong ensemble cast - Edward Norton Colin Farrell Jon Voight and Noah Emmerich - but a lousy sense of timing.It sat on the shelves for two years while a superior film (The Departed) and a lesser one (We Own the Night) tracked the entanglements of the boys in blue. The films gala debut at the most recent Toronto International Film Festival did nothing to remove the stench of mothballs.Director Gavin OConnor co-wrote it with Joe Carnahan whose Narc followed a similar line. Theres nothing really wrong with Pride and Glory apart from an excessive degree of brutality but theres nothing terribly revelatory about it either.Its the way-too-familiar saga of cops banding together when the going gets tough even if that means acting as if theyre above the law.NYPD Det. Ray Tierney (Norton) is blue through and through. His brother Francis Jr. (Emmerich) and brother-in-law Jimmy (Farrell) are also on the force and his dad Francis (Voight) is the chief of Manhattan detectives and former chief of police. Ray is also blue in the emotional sense. He lives on a leaky houseboat hes on the verge of splitting with his wife and hes weighed down by memories of a case that went terribly wrong. A facial scar only hints at how torn-up he feels inside.Bonded by their Irish blood the Tierneys appear solid - we first meet the family at a celebratory football game - but a drug bust that turns into a bloodbath reveals hidden ruptures. There are four officers amongst the dead and fingers of blame point within the force and the family.Francis Sr. calls upon the reluctant Ray to investigate the case judging him sensitive enough to navigate the treacherous shoals of a case that threatens both family unity and the forces public image.""Anything that makes cops look culpable is no good Raymond"" Francis Sr. cautions his son.Other family members are busy with their own investigations of the crime and their intentions are not at all honorable. Anyone the least bit familiar with police stories needs no further exposition which includes the subplot melodrama of a family member suffering from terminal cancer.But even viewers steeled by repeat exposure to cop tales may find themselves wincing at this one which tries to substitute gratuitous violence for lack of insight. This is a nasty piece of work laced with profanity and including one scene involving a newborn baby and a hot iron that could ruin your entire day if not your week.Not for nothing does one of the films antagonists observe ""We tour the sewers.""The Morning Headlines NewsletterDelivered daily to your inbox.Sign upMore from the Toronto Star amp; PartnersLOADING                                             LOADING                    21degCloseHomeLatest NewsVideoGTABlogsToronto to test mobile ticketing app for island ferryNew way to buy tickets online aimed at cutting down lineups for island ferry.NewsGTACity HallQueens ParkCanadaWorldInvestigationsCrimeBusinessEconomyPersonal FinanceReal EstateYour TorontoSchoolsThe FixerLifeFashion amp; StyleFood amp; WineHealth amp; WellnessHomesParentTechnologyTravelSportsAmateurBaseballBasketballBlue JaysCurlingFootballGolfHockeyLacrosseLeafsOlympicsRaptorsSoccerTennisOpinionCommentaryCorrectionsEditorialsEditorial CartoonPublic EditorReaders LettersEntertainmentBooksMoviesMusicStageTelevisionVisual ArtsDiversionsHoroscopesCrosswordsSudokuComicsWheels.caSpecial FeaturesObituariesClassifiedsTV ListingsHot TopicsDem. ConventionRio OlympicsPokemon GoBlue JaysGeneration 9/11Panama PapersFresh Air FundWeather BlogFollow usFacebookTwitterGoogle+InstagramRSSManage NewslettersSite MapAboutContact UsFeedbackthestar.comFeedbackSite MapNewslettersInsurance HotlineNew in HomesStar StoreCorrectionsBehavioural TargetingTodays NewsFlyersCanadaStaysContestsToronto Star Newspaper Ltd.AboutAtkinson PrinciplesStatement of PrinciplesGet Home DeliveryMy SubscriptionContact UsContact WebmasterFAQNews ReleasesStar InternshipsCareers  the StarStar AdvisersStar ePaperStar TouchAdvertise with UsAdvertising TermsMedia KitSpecial FeaturesInitiativesSanta Claus FundFresh Air FundSpeakers BureauClassroom ConnectionToronto Star ArchivesReport on Community Giving(c) Copyright Toronto Star Newspapers Ltd. 1996 - 2016Privacy PolicyTerms and Conditions",http://www.thestar.com/entertainment/article/523615,200,pride&glory5,pride&glory,thestar
