review,link,status_code,id,movie_key,critic
"Cop drama tries too hard |       NJ.com NJ.com Menu Home News Politics Sports High School Sports Entertainment Photos/Videos Obituaries Autos Jobs Real Estate Rentals Health Classifieds Local Businesses Place An Ad Opinion Follow Us Subscribe Back to Main Menu News News by County All Newspapers Business Crime Education Health Lottery Obituaries Politics Back to Main Menu Atlantic Bergen Burlington Camden Cape May Cumberland Essex Gloucester Hudson Hunterdon Mercer Middlesex Monmouth Morris Ocean Passaic Salem Somerset Sussex Union Warren Back to Main Menu The Star-Ledger The Times of Trenton The Jersey Journal South Jersey Times Hunterdon County Democrat Independent Press Horse News Back to Main Menu Politics Home Chris Christie Opinion The Auditor Back to Main Menu Sports Home Devils Eagles Flyers Giants Jets Knicks Mets Nets Phillies Rangers Red Bulls Rutgers Basketball Rutgers Football Rutgers Sports Seton Hall Sixers Yankees Back to Main Menu Football Baseball Softball Boys Lacrosse Girls Lacrosse Boys Track and Field Girls Track and Field Boys Volleyball Boys Tennis Boys Golf Girls Golf Wrestling Boys Basketball Off Season Sports Back to Main Menu Football Wrestling Boys Basketball Girls Basketball Boys Bowling Girls Bowling Boys Cross Country Girls Cross Country Boys Fencing Girls Fencing Field Hockey Boys Ice Hockey Girls Ice Hockey Gymnastics Boys Skiing Girls Skiing Boys Soccer Girls Soccer Boys Swimming Girls Swimming Girls Tennis Girls Volleyball Boys Winter Track Girls Winter Track Back to Main Menu Entertainment Home Atlantic City Entertainment Celebrities Comics Events Food amp; Dining Indulge Inside Jersey Movies Music Online Gambling Guide Puzzles Shore TV Back to Main Menu Hunterdon County Democrat Photos Jersey Journal Photos NJ.com Photos South Jersey Times Photos Star-Ledger Photos Times of Trenton Photos Videos Back to Main Menu Homes for Sale New Homes For Rent Foreclosures Commercial Real Estate News Resources Place An Ad Back to Main Menu Home Buying Sell My Home Rental Living Home Ideas Mortgages and Loans Im Moving Back to Main Menu Obituaries Rentals Pets For Sale Garage Sales Find n Save Fraud Prevention Manage Your Ad Place An Ad Back to Main Menu Find A Business Food amp; Dining Retail Shopping Health amp; Medicine Personal Care Entertainment Real Estate Automotive Claim Your Business Sponsored Blogs Back to Main Menu Visit our Facebook Page Follow us on Twitter View our Instagram photos See our Tumblr feed See our Pinterest page Visit us on Google Plus Visit OMJ for NJ celebrity amp; style Back to Main Menu Email newsletters The Star-Ledger The Times of Trenton The Jersey Journal South Jersey Times Hunterdon County Democrat Star Gazette Back to Main Menu Close Customize Your Weather Set Your Location (Enter City and State or Zip Code) Congratulations Your weather is set to . You can change the location at any time. AccuWeather.com Quick Look Change your current location >> View Full Weather Report Search Search Search NJ.com Account Sign In Close Sign in toNJ.com You are signed in as Edit Public Profile Sign Out Subscribe Email newsletters The Star-Ledger The Times of Trenton The Jersey Journal South Jersey Times Hunterdon County Democrat Star Gazette comments Cop drama tries too hard Print Email Anthony Venutolo | NJ Advance Media for NJ.com By Anthony Venutolo | NJ Advance Media for NJ.com The Star-Ledger Email the author | Follow on Twitter on October 23 2008 at 1000 PM updated October 23 2008 at 1031 PM comments NEW LINEColin Farrell left stars as Jimmy Egan and Edward Norton stars as ""Ray Tierney"" in Pride and Glory Pride and Glory (R) New Line/Warner Bros. (125 min.) Directed by Gavin OConnor. With Edward Norton Colin Farrell Noah Emmerich Jon Voight. Opens Friday at theaters in New Jersey. TWO AND A HALF STARS The Tierneys have given a lot to New York. A father who slowly rose up the uniformed ranks of the police. Two sons -- and a daughters handsome husband -- all of whom put on the blue and the badge too and still go out every morning to keep the peace. A man couldnt be prouder of a family like that. Too bad only one of them has reason to be proud of himself. ""Pride and Glory"" wants to be one of those big sprawling ethnic crime stories about family and loyalty and duty. And it is mostly -- until a bad third-act detour when it turns into a cops-and-slobbers melodrama full of shouts and crying jags and the corniest fistfight since ""The Quiet Man."" Jon Voight -- in a performance thats a little sad only because it reminds you of how great he can be given the chance -- is the grand and slightly pickled patriarch; Noah Emmerich and Edward Norton are his sons (never mind that they look nothing alike). And Colin Farrell doing another of his frantic violent boyos -- time to give that cliche a rest lad -- is the outsider who married the family beauty. Emotionally Emmerich is the underestimated son and Norton is the tortured but brilliant moralist; Voight is the protect-your-own papa and Farrell is the unpredictable hothead. And once you see thats the mix -- and a murky mystery about dirty cops and a suspicious shootout is introduced -- you know how the whole things going to turn out. The problem is that takes two hours. And not all of that time is spent profitably. There are a few nasty touches (including the most strung-out junkies since ""Fort Apache the Bronx"") and bizarre details (in a pinch it seems a raw potato makes a handy silencer). And the performances are mostly brilliant -- Norton has several good scenes with Voight as they go toe-to-toe and work their way through all sorts of father-and-son conflicts. But the script by director Gavin OConnor (and brutalist Joe Carnahan who also wrote ""Narc"" and ""Smokin Aces"") is far more interested in violence than in the intricacies of police work or politics and OConnor doesnt know where to put the camera except as close to the blood and gore as possible. (In a film filled with shootouts and chases there isnt a single stand-out action sequence.) He also overstuffs the movie with more moods than an Irish wake. One character has a broken marriage; another has a wife dying of cancer; a third is pretty much a stumbling alcoholic. None of this is really developed; it just decorates the film like mourning ribbons an outward sign of the filmmakers seriously morose intentions. Its bearable for two acts but eventually sensation overtakes sense. Perhaps the clearest evidence comes in a climactic scene in which the best cop and the worst cop confront each other. The good cop has the drop on the villain; all he needs to do is make him put his hands out cuff him and march him down to the station. But does he do that? He does not. No instead he makes the criminal put his badge and gun on the table. Then he puts his own badge and gun on the table. And then fists cocked like a couple of John L. Sullivans they engage in a manly bout of fisticuffs while Irish songs blare. Tis the only way men like themselves could settle such a thing dont you see now? No I dont. Although by this point I was getting close to taking a couple of swings myself. Ratings note The film contains brutal violence and strong language. Stephen Whitty may be reached at swhittystarledger.com or (212) 790-4435. Listen to the latest episode of our TV podcast Subscribe on iTunes Subscribe on Stitcher Most Read Find Local Real Estate Jobs Autos Businesses Find a job Buy or sell a car Find a place to live See whats for sale Find a business View obituaries Get Your Weekly Entertainment Guide TV recaps movie and music reviews local dining guides and the latest in Atlantic City entertainment news delivered to your inbox Leave this field blank optional Check here if you do not want to receive additional email offers and information. See our privacy policy Thank you for your subscription To view and subscribe to any of our other newsletters please click here. Entertainment Essentials Search music dining more event listings Inside Jersey N.J.s lifestyle magazine OMJ.com N.J. celebrity and style Entertainment Listings Events Music Food Active Discussions nj.com About Us About NJ.com Advertise with us Contact Us Visit OMJ.com Jobs at NJ Advance Media Newsletters RSS feeds More on NJ.com Interact Weather Site map Claim your free business listing Sponsor Content Search Place an ad Sell your car Sell/rent your home Post a job Post a free classified ad Apartments amp; rentals NJ.com Sections N.J. News Local News N.J. Politics Sports High School Sports Entertainment Food amp; Recipes Living Business Opinion Inside Jersey Shore Obituaries Jobs Autos Real Estate Rentals Classifieds Shopping Good Deals Local Businesses Special Sections Contribute to NJ.com Register for free with NJ.com Submit an event Follow Us Twitter Google+ Facebook foursquare Newspaper stories and photos The Star-Ledger | Subscribe The Times of Trenton | Subscribe The Jersey Journal | Subscribe South Jersey Times | Subscribe Hunterdon County Democrat | Subscribe Star Gazette | Subscribe The Warren Reporter Suburban News Horse News Learn more about our newspapers Mobile iPhone Android apps | Tablet apps Registration on or use of this site constitutes acceptance of our User Agreement and Privacy Policy (c) 2016 New Jersey On-Line LLC. All rights reserved (About Us). The material on this site may not be reproduced distributed transmitted cached or otherwise used except with the prior written permission of New Jersey On-Line LLC. Community Rules apply to all content you upload or otherwise submit to this site. Ad Choices",http://www.nj.com/entertainment/tv/index.ssf/2008/10/copsandslobbers_dama_tries_too.html,200,pride&glory8,pride&glory,nj
"FROM THE COP TO BOTTOM | New York Post Thanks for contacting us. Weve received your submission. Back to Reading News Metro Page Six Sports Business Opinion Entertainment Fashion Living Media Tech Real Estate Sub Menu 1 Photos Video Covers Columnists Horoscopes Sub Menu 2 Classifieds Subscribe Sign in In The News hillary clinton iran lamar odom 2016 presidential election new york mets Sections Search Tips Sign in New York Post Most Popular 39447 Ex-NFLer wife fatally shot by teen in their home 20595 14-year-old girl slit teens throat in hopes of getting 1st kill cops 14565 Why Hollywood babes are trying to bag a tech titan not a rock star 13182 Malia Obama skipped the DNC for Lollapalooza 13157 Cop in bikini tackles bad guy 12201 Why didnt the Democrats even mention the Clinton Foundation? Close Breaking News 16 feared dead in Texas hot air balloon crash Share thisFacebookTwitterGoogleWhatsAppEmailCopy Entertainment Share thisFacebookTwitterGoogleWhatsAppEmailCopy FROM THE COP TO BOTTOM By Kyle Smith View author archive email the author follow on twitter Get author RSS feed Name(required) Email(required) Comment(required) October 24 2008 | 553am THE corrupt-cop drama ""Pride and Glory"" con cludes with a solemn dis claimer informing us that what we have just seen is not to be mistaken for true events. Thats a relief. You mean New York City cops dont walk into delis in daylight beat the innocent guy behind the counter into a stupor and shove a gun in his face - all while the store security camera presumably records the whole thing and anyone could be walking by outside? Edward Norton plays Ray a (possibly) honest cop wearing an unexplained scar positioned just so on his cheek. It looks like it was bought in the markdown aisle of Halloween Mart on Nov. 1. After four officers are gunned down Ray is assigned to investigate the case by his dad (Jon Voight) a department mainstay who advises him ""You keep the rage cut the rest of it."" Isnt that getting it backward? ""Son drop your calm assessment of the facts but be sure to be angry."" ""Keep the rage cut the rest"" sounds more like a manual for talk-radio hosts. Nortons brother-in-law Jimmy (Colin Farrell) yet another cop in the family isnt protecting and serving the people of Gotham quite as well as he should be. He is involved in a drug ring. Early on he and his fellow dirty cops find a car containing a dead suspect and torch it - just below a bridge that certainly makes for a picturesque setting but from which presumably hundreds of drivers will notice the fireball and the police car nearby. When the writers went to the Dialogue Store it must have been closed because they loaded their cart from whatever they found in the Dumpster out back. Can one movie really contain all of these lines? Not just ""Im doing what I have to do"" and ""Its just like ridin a bicycle - you never forget ridin a bicycle"" but also ""Im right in the middle of something I dont know how to get out of."" Most of the rest of the lines are so bad that the script desperately tries to save them with a word that isnt ""freak"" but begins and ends the same way. So we get lines much like ""Laugh you freakin scumbag"" and ""What the freak is going on here?"" and ""Ill slit your throat freak your wife and kill your kid"" and ""You broke my freakin heart Jimmy"" and ""Get your freakin hands off me"" and ""He looked pretty freakin dead"" Nortons brother another cop is played by Noah Emmerich. Emmerich and Norton resemble each other about as closely as Richie Cunningham resembled the Fonz but one of the immutable laws of Hollywood is that Emmerich must appear in all films made by New Line Cinema. Would it be relevant to point out that Emmerichs brother Toby was the New Line executive who keeps hiring him? Nah. That would imply that Hollywood is a corrupt institution one in which secret deals are cut behind closed doors because blood loyalty is everything . . . Hey wait a minute I have an idea for a movie. PRIDE AND GLORY Cop schlock. Running time 125 minutes. Rated R (graphic violence profanity drug references). At the 84th Street 34th Street Kips Bay others. Share thisFacebookTwitterGoogleWhatsAppEmailCopy Share this article Share thisFacebookTwitterGoogleWhatsAppEmailCopy Read Next CALL HER AMBASSADOR OPRAH Read Next CALL HER AMBASSADOR OPRAH Share Selection Trending Nowon NYPost.com 39908 Ex-NFLer wife fatally shot by teen in their home 20576 14-year-old girl slit teens throat in hopes of getting 1st kill cops 13457 Cop in bikini tackles bad guy Now On Celebrate Arnolds 69th birthday with his beefiest vintage pics Eric Claptons girlfriends ex-beau busted on pot rap Orlando Bloom joins Andy Sambergs HBO mockumentary SEE ALL Page Six TV Lindsay Lohans dad says booze pics arent what they seem Lindsays sober claims Michael Lohan These celebs hang out where? Now On Pure Nude Yoga Actual Workout Or Masturbation Material? (Answer Sorta Both) SEE ALL More Stories pagesix Harry Brant busted for drugs and bailing on taxi fare Now On Decider This Woman Giving Birth In A Stream Has Been Watched Over 54 Million Times (NSFW) nypost Ex-NFLer wife fatally shot by teen in their home New York Post Twitter Facebook Instagram Email Newsletters Mobile Apps Contact Us Tips Twitter Facebook Instagram Sections amp; Features News Real Estate Page Six Tech Sports Media Metro Photos Entertainment Video Business Alexa Opinion Covers Fashion Horoscopes Living Classifieds Newsletters amp; Feeds Email Newsletters RSS Feeds NYPost Store Home Delivery Subscribe Manage Subscription Preferences Help/Support Customer Service App FAQ amp; Help Contact Us Tips Newsroom Letters to the Editor Reprints Careers Apps iPhone App iPad App Android Phone Android Tablet Advertise Media Kit Contact Post Digital Network (c) 2016 NYP Holdings Inc. All Rights Reserved | Terms of Use | Privacy | Your Ad Choices News Corp. is a network of leading companies in the world of diversified media news and information services. News Corp HarperCollins Marketwatch realtor.com Dow Jones The Sun Storyful Wall Street Journal The Times Mansion Global New York Post The Australian Checkout51 News America Marketing News.com.au Unruly Send to Email Address Your Name Your Email Address Cancel Post was not sent - check your email addresses Email check failed please try again Sorry your blog cannot share posts by email. Copy Share URL Copy Link Sign Up / Sign In Sign In // Sign Up With your existing account from... With your existing account { loginWidget } Use an account with your email address Or with a NYPost.com account { userInformationForm } { traditionalSignIn_emailAddress } { traditionalSignIn_password } { traditionalSignIn_signInButton }{ traditionalSignIn_createButton } { /userInformationForm } Sign Up / Sign In Sign In // Sign Up Welcome back { welcomeName } { loginWidget } Or use NYPost.com account Sign Up / Sign In Sign In // Sign Up Welcome back Welcome back { welcomeName } { userInformationForm } { traditionalSignIn_emailAddress } { traditionalSignIn_password } { traditionalSignIn_signInButton } { /userInformationForm } Use an account with your email address Or use another account Almost Done Please confirm the information below before signing in. Please confirm the information below. { socialRegistrationForm } { socialRegistration_emailAddress } { socialRegistration_displayName } { socialRegistration_ageVerification } By clicking ""Sign In"" you confirm that you accept our terms of service and have read and understand privacy policy. { backButton } { socialRegistration_signInButton } { /socialRegistrationForm } Almost Done { registrationForm } { traditionalRegistration_emailAddress } { traditionalRegistration_password } { traditionalRegistration_passwordConfirm } { traditionalRegistration_displayName } { traditionalRegistration_captcha } { traditionalRegistration_ageVerification } By clicking ""Create account"" you confirm that you accept our terms of service and have read and understand our privacy policy. { backButton } { createAccountButton } { /registrationForm } Create a new password ForgotPassword? Dont worry it happens. Well send you a link to create a new password. { forgotPasswordForm } { traditionalSignIn_emailAddress } { backButton } { forgotPassword_sendButton } { /forgotPasswordForm } Create a new password Sent Weve sent an email with instructions to create a new password. Your existing password has not been changed. Weve sent an email with instructions to create a new password. Close Account Already Exists { mergeAccounts } { backButton } Sign in to complete account merge { tradAuthenticateMergeForm } { traditionalSignIn_emailAddress } { mergePassword } { traditionalSignIn_signInButton } { /tradAuthenticateMergeForm }",http://www.nypost.com/seven/10242008/entertainment/movies/from_the_cop_to_bottom_134977.htm,200,pride&glory9,pride&glory,nypost
"NYC cop movie Pride amp; Glory is too implausible - NY Daily News Trending DEMOCRATIC NATIONAL CONVENTION HILLARY CLINTON KESHIA KNIGHT PULLIAM MICHAEL JORDAN DONALD TRUMP Sections Sections Home New York NYC Crime Bronx Brooklyn Manhattan Queens Education Weather Obituaries Sports Yankees Mets Giants Jets Knicks Nets Rangers Islanders Football Basketball Baseball Hockey Soccer College High School The Score More Sports News Crime U.S. World Politics Entertainment Gossip Games Entertainment Pics TV Movies Music Theater amp; Arts Horoscopes Daily Weekly Monthly Pet Horoscopes Lifestyle Health Homes Food Opinion Autos Buyers Guide Ratings amp; Reviews News amp; Views Photos amp; Galleries Covers Classifieds Trending DEMOCRATIC NATIONAL CONVENTION HILLARY CLINTON KESHIA KNIGHT PULLIAM MICHAEL JORDAN DONALD TRUMP entertainment Follow Us Facebook Twitter Instagram Pinterest YouTube Subscribe Follow UsNewsletter App Subscriptions Subscribe Get Our Newsletter A daily blend of the most need-to-know Daily News stories delivered right to your inbox. Sign Up Get the latest breaking news entertainment sports and more.Download Our App Subscribe to the newspaper our e-edition or both.Subscribe Select Sport Football Basketball Baseball Hockey Soccer College High School More Sports Gossip Games Entertainment Pics TV Movies Music Theater amp; Arts Share This facebook Tweet email NYC cop movie Pride amp; Glory is too implausible NYC cop movie Pride amp; Glory is too implausible Joe Neumaier Friday October 24 2008 1244 PM facebook Tweet email Colin Farrell and Edward Norton in Pride amp; Glory Joe Neumaier Friday October 24 2008 1244 PM Despite a gritty adherence to police culture that comes from director Gavin OConnors real-life father and especially several lived-in performances the dirty-cop drama ""Pride and Glory"" overshoots the mark by spinning its implausible hyperviolent tale around too tight a family circle. After four NYPD cops are killed in a drug bust in Washington Heights Officer Ray Tierney (Edward Norton) is assigned by his police chief father (Jon Voight) to the internal affairs force investigating the slaughter. But Ray has a progressively messy situation on his hands The slain officers served under his older brother (Noah Emmerich) a precinct head and alongside his flash-tempered brother-in-law Jimmy Egan (Colin Farrell). RELATED FARRELL AND NORTON TALK TO NEWS As he digs deeper Ray finds Jimmy is the center of a crew of bad apples who intimidate rob and bully the neighborhood and who are linked to a powerful drug dealer. Ray whos been out of duty since he himself was caught under fire some years earlier wants to do the right thing but must first face down his dads demands and his familys reputation. OConnor and his co-writer brother Gregory OConnor clearly know the blue wall they write about. However boiling their story down to a Shakespearean clump of clan loyalty doesnt serve the movies grander ambitions. (And giving Emmerichs character a wife nobly suffering from cancer is simply piling on the tragedy.) RELATED ""PRIDE amp; GLORY"" SAVED BY WARNER BROTHERSThough a certain amount of gruffness is expected in a movie like this there are a few too many scenes of guys getting grabbed by the collar and pushed against a wall until they talk and one moment with a newborn baby being threatened is simply hard to watch. Norton again rises above his deep-thinking persona and wiry physical presence as he did in ""American History X"" ""Fight Club"" and ""25th Hour"" to find a noirish heaviness (this movie was shot prior to summers ""The Incredible Hulk"" which unfortunately reduced him to a cartoons shadow). RELATED COLIN FARRELL IS A LITTLE GUN-SHY And while Farrells sneering black sheep and Voights lion in winter are cliches for both this genre and the actors Emmerich (""Little Children"" ""Miracle"") plays his precinct chiefs tortured moral score-keeping close to the vest. ""Pride and Glory"" could have used more of his kind of restraint. jneumaiernydailynews.com Send a Letter to the Editor Join the Conversation facebook Tweet PC Richard and Son Get Daily News stories delivered to your inbox. Sign Up Follow Us Facebook Twitter Instagram Pinterest YouTube Keep in Touch Newsletter Apps Subscribe Feeds Support amp; Contact Contact Us Careers Media Kit Site Map Terms of Use Ad Choices Terms of Service Privacy Policy Daily News Covers (c) Copyright 2016 NYDailyNews.com. All rights reserved.",http://www.nydailynews.com/entertainment/movies/2008/10/23/2008-10-23_nyc_cop_movie_pride__glory_is_too_implau.html,200,pride&glory10,pride&glory,nydailynews
