review,link,status_code,id,movie_key,critic
"In Pride and Glory its all in the precinct - The Boston Globe Local Search Site Search Home Delivery HomeTodays GlobeNewsBusinessSportsLifestyleAamp;EThings to doTravelCarsJobsHomesLocal Search MoviesRestaurantsMusicTheater/ArtsTelevisionBooksCelebrity newsEventsGamesComics THIS STORY HAS BEEN FORMATTED FOR EASY PRINTING Home / Aamp;E / Movies Movie Review In Pride and Glory its all in the precinct Colin Farrell (left) and Edward Norton in Pride and Glory. (Glen wilson/new line cinema) By Ty Burr Globe Staff / October 24 2008 Email| Print| Single Page| | Text size - + The funeral finally arrives 45 minutes into ""Pride and Glory"" but the movies been preparing for it from the opening credits Everything in this good-cop/bad-cop action drama is shrouded in gray and attended by wailing. This isnt a feel-good genre granted but does it have to feel this bad?When ""Pride and Glory"" opens four cops are dead apparently shot in a Bronx drug raid gone wrong. Precinct commander Francis Tierney (Noah Emmerich) assigns his brother Ray (Edward Norton) to the investigative task force urged by their father (Jon Voight) a high NYPD muckety-muck who wants to bring the prodigal son back into the fold. Ray has physical and emotional scars from a mysterious earlier incident; in case you missed that metaphor he lives on a boat thats slowly sinking into New York Harbor.If Ray is a tarnished white knight and Franny is fairly upstanding their brother-in-law Jimmy Egan (Colin Farrell) is the devil in a blue uniform. He leads a dirty crew specializing in mayhem and murder; the only questions are how long Ray will take to discover it and what Francis will do when he finds out.Director Gavin OConnor and co-screenwriter Joe Carnahan take a perfectly fine B-movie premise and slow it down to an A-movie pace; in the process they remove the juice that keeps a story like this honest. Norton does his usual fine reined-in work but you sense Rays calling for back-up in more ways than one. Emmerich is handcuffed by his characters indecisiveness and Voight aims for the back row - someone must have told him this was Shakespeare.Its not; Shakespeare wouldnt have been this afraid to go slumming. The few times ""Pride and Glory"" jumps to life are when it drops the mournful pose and lets rip with the villainy. Frank Grillo and Shea Whigham make a frightening pair of Mutt-and-Jeff bad cops and theres a lulu of a scene involving Farrell terrorizing a drug dealers family during their holiday dinner. In particular what transpires with Jimmy and the dealers infant child is almost up there with Richard Widmark pushing the old lady downstairs in ""Kiss of Death."" (Dont worry I said ""almost."")Elsewhere ""Pride and Glory"" combines cop-movie cliches and self-consciousness - a deadly duo. The heavyhandedness extends to the weight of sin everyone here seems to be living under and the weeping that most of the characters get to indulge in one scene or another. Just in case you thought the mood was too light Frannys wife (Jennifer Ehle) is dying of cancer.Scorsese can pull this stuff off in part because he loves the stink and the snap at the heart of a crime movie (and in part because hes an artist). James Gray (""The Yards"" ""We Own the Night"") walks these mean streets with a similar ponderousness but hes an obsessive who never relaxes his grip. In ""Pride"" OConnor maintains his tone of high solemnity until youre just starting to cave in then trashes the flow with an absurd near-comic climactic fistfight. If a director cant trust his own posturing why should we? (c) Copyright 2008 Globe Newspaper Company. related video Take Two Globe movie critics sound off on ""High School Musical 3"" and more More movies news and reviews blog Movie Nation Globe critics on news reviews and more MOVIE REVIEW PRIDE AND GLORY Directed by Gavin OConnor Written by Gavin OConnor Joe Carnahan Gregory OConnor Robert Hopes Starring Edward Norton Colin Farrell Jon Voight Noah Emmerich At Boston Common Fenway suburbs Running time 125 minutes Rated R (strong violence pervasive language brief drug content) Email Email Print Print Single page Single page Reprints Reprints Share Share Comment Comment Share on Digg Share on Facebook Save this article powered by Del.icio.us Your Name Your e-mail address (for return address purposes) E-mail address of recipients (separate multiple addresses with commas) Name and both e-mail fields are required. Message (optional) Disclaimer Boston.com does not share this information or keep it permanently as it is for the sole purpose of sending this one time e-mail. Advertisement Boston.com Most EmailedSubscribe to SliceBookmark Boston.com Most Emailed120 MOST E-MAILED >> Report Warrant Issued for Roggies Bar OwnerMap of Greater Boston Farmers MarketsBoston Pops Concert Move Keeps the Beach Boys Ditches Joey McIntyreWe Tried Out Those New Solar BenchesNew Englands top outdoor water parksDrink of the Week Mojito ItalianoLawmakers pass compounding pharmacy oversight bill Follow this list on Twitter BostonPopular Home| Todays Globe| News| Business| Sports| Lifestyle| Aamp;E| Things to Do| Travel| Cars| Jobs| Homes| Local Search Contact Boston.com | Help| Advertise| Work here| Privacy Policy| <a href=""http//members.boston.com/reg/login.do?dispatch=loginpageamp;p1=Foot_ContactBostonCom_Newsletters"">Newsletters</a>| Mobile| RSS feeds| Make Boston.com your homepage Contact The Boston Globe| Subscribe| Manage your subscription| Advertise| The Boston Globe Extras| The Boston Globe Store| (c) NY Times Co.",http://www.boston.com/ae/movies/articles/2008/10/24/in_pride_and_glory_its_all_in_the_precinct,200,pride&glory17,pride&glory,boston
"Good cops bad cops - been there - philly-archives | News | Sports | Entertainment | Business | Opinion | Food | Lifestyle | Health | More Classifieds Real Estate Cars Jobs Obituaries Marketplace Shopping Circulars Print Offers Online Events Local Deals Breaking News Video Blogs Philadelphia New Jersey Politics Education Opinion Obituaries Nation/World Weather Traffic Lottery CollectionsGetaway Car <a href=""http//ad.doubleclick.net/jump/ph.search/perfectmarket;pos=btf;sz=300x250;ord=philly_apt_ad_timestamp?""></a> Find More Stories About Getaway Car <a href=""http//ad.doubleclick.net/jump/ph.search/perfectmarket;pos=atf;sz=300x250;ord=philly_apt_ad_timestamp?""></a> Good cops bad cops - been thereBy Steven Rea Inquirer Movie CriticPosted October 24 2008Maybe its time to hang up all that reverence for the movies of the 70s the so-called halcyon days when Hollywood let filmmakers experiment with ""edgy"" story lines and pictures werent vetted by the studios marketing departments. At the very least maybe its time to confiscate director Gavin OConnor and writer Joe Carnahans copies of Serpico and Prince of the City. Gritty jumpy and rife with cliches Pride and Glory emits a distinct retro vibe even as its cameras swoop and jerk around the grimier precincts of modern-day New York telling a tale of good cops and crooked cops fathers sons brothers and in-laws who wear the NYPD badge with honor - or with self-interest vengeance and suspiciously large bank accounts. Beginning on a muddy Coney Island football field and ending on the steps of a Manhattan courthouse Pride and Glory stars Colin Farrell and Edward Norton as two of New Yorks finest. Nortons Ray Tierney is a smart straight-arrow detective heading a task force to catch the killers of four ambushed police in a Washington Heights walkup. His dad Francis Tierney Sr. (Jon Voight) is chief of detectives. Rays brother Francis Jr. (Noah Emmerich) is the captain of the squad that just lost its men. And Farrell nostrils flaring and arms flailing in serious over-acting mode is Jimmy Egan fellow cop and member of the Tierney clan by marriage - his wife is Rays sister Megan (Lake Bell). Hes all tears and rage at the hospital looking on as one of his brethren hangs by a thread. But as Ray sets out to find the perpetrators OConnors camera cuts to Jimmy and his cohorts torching the suspected shooters getaway car. Uh-oh the killings were an inside job and the unthinkable has been thunk rogue cops drug ripoffs extortion and worse. Loyalty betrayal fraternity ya-da-ya-da. With its moody music cues (courtesy of Mark Isham) and dark grubby cityscapes its bar fights and police raids Pride and Glory definitely stirs up some drama. But the script doesnt serve the drama well The patter is tired and even Norton one of the best around acts as if hes hoisting his pants before delivering his lines - hes trying too hard. (And whats with Ray living on a boat in a city marina? Miami Vice this is not.) Things reach a fever pitch outside a corner bodega where another bad cop has flipped out and taken a hostage and the citizens in the neighborhood grab bats and bottles seething with bad feelings for the police that have abused their position - and abused the neighborhood. But what about the abused audience? And wheres Al Pacino when you need him?Contact movie critic Steven Rea at 215-854-5629 or sreaphillynews.com. Read his blog ""On Movies Online"" at http//go.philly.com/onmovies. Please enable JavaScript to view the <a href=""http//disqus.com/?ref_noscript"">comments powered by Disqus.</a> comments powered by Disqus Commenting policy | Comments FAQ FEATURED ARTICLESApothecary gardens fuel farm-to-medicine-cabinet movementTiffany Trump and Naomi Biden graduate Penn dad and granddad looking onPowerball fever Jackpot rises to 900 millionMoreDe Mazia Art Brings 2.38 MillionLeader Of Jbm Sentenced To Life Aaron Jones Was Convicted Of Conspiring To Distribute 100 Million In Cocaine. He Plans To Appeal.Jbm 8 Believed FoundersIn Bulk Trucking Chemical Leaman Is Rolling Toward The TopFrank Nofer 71 famed graphic artistGeorge Mattson 88 Olympian Crew CoachIndex by Keyword|Index by Date|About Philly.com|Contact Us|Terms of Use amp; Privacy Statement|Copyright 2016 <a href=""http//www.omniture.com"" title=""Web Analytics""></a>",http://www.philly.com/philly/entertainment/movies/20081024_Good_cops__bad_cops_-_been_there.html,200,pride&glory18,pride&glory,philly
"Washington Post Breaking News World US DC News amp; Analysis - The Washington Post Sections Politics Opinions Sports Local National World Business Tech Lifestyle Entertainment Video Jobs WP BrandConnect Classifieds Sign In Username Subscribe Home Page Politics PowerPost The Fix White House Courts and Law Polling Monkey Cage Fact Checker Post Politics Blog Opinions The Posts View Toles Cartoons Telnaes Animations Local Opinions Global Opinions Letters to the Editor Act Four All Opinions Are Local Book Party Compost Erik Wemple Five Myths In Theory The Plum Line PostEverything PostPartisan Rampage Right Turn The Watch Volokh Conspiracy Sports Redskins NFL MLB NBA NHL AllMetSports Soccer Boxing/MMA College Football College Basketball D.C. Sports Bog Early Lead Fancy Stats Golf Tennis Fantasy Sports Local D.C. Maryland Virginia Public Safety Education Obituaries Transportation Weather National Acts of Faith Health and Science National Security Investigations Morning Mix Post Nation Obituaries World Africa The Americas Asia and Pacific Europe Middle East National Security WorldViews Checkpoint Business Wonkblog On Leadership Personal Finance Digger Energy and Environment Markets On Small Business World Business Capital Business Tech Innovations On I.T. The Switch Lifestyle Arts and Entertainment Advice Carolyn Hax Food Travel Wellness Magazine Home and Garden Inspired Life Fashion KidsPost On Parenting Reliable Source The Intersect Solo-ish Entertainment Books Comics Comic Riffs Going Out Guide Horoscopes Movies Museums Music Puzzles and Games Theater and Dance TV Restaurants Bars amp; Clubs Crosswords Video Live Top News Popular Video Politics Opinions Sports National World Business Technology Style Entertainment Local Photography In Sight Washington Post Live Events Live Chats Real Estate Rentals Where We Live Recently Sold Homes Cars Jobs WP BrandConnect Classifieds Partners Express El Tiempo Latino Parade Fashion Washington washingtonpost.com 1996-2016 The Washington Post Terms of Service Privacy Policy Submissions and Discussion Policy RSS Terms of Service Ad Choices Saturday July 30 2016 July 30 2016 Edition U.S. amp; World | Regional In the News Hot-air-balloon crash Locker-room recordings Antonio Armstrong Mars FakeTrumpIntelligenceBriefing Great British Baking Show Dale Earnhardt Windows 10 Anthrax Campaign 2016 Clintons detailed economic plan may be a problem General-election polls show that voters trust Donald Trump more than Hillary Clinton on the economy and her campaign has been told by donors and advisers that she must strip down her message. By Jim Tankersley17 hours ago Clinton-Kaine bus tour pulls into Pittsburgh today Clinton campaign denies reports that its computer system was hacked The campaign said that an ""analytics data program"" maintained by the Democratic National Committee had been compromised but that its computer system was intact contradicting reports from earlier Friday that the campaign had become the third Democratic Party organization whose systems had been penetrated. By Ellen Nakashima and Tom Hamburger17 hours ago ""I have to be honest to myself"" Evan Redmond said. (Melina Mara/Post) Can a delegate inspired by Sanders come around to Clinton? Over four days one 18-year-old delegate from rural North Carolina watched as the Democratic Party rolled out celebrities and musicians pastors and presidents to convince skeptical Americans that they could trust Hillary Clinton. It worked. Until the final night. By Robert Samuels17 hours ago Wisconsin ruling hands voting rights activists second legal win Hours after a federal appeals court struck down North Carolinas voting restrictions saying they were intended to blunt the clout of black voters a judge said Wisconsins voter-ID law is ""a cure worse than the disease."" By Robert Barnes and Ann E. Marimow17 hours ago Wonkblog The smoking gun proving N.C. Republicans tried to disenfranchise black voters Chandra Levy murder case rapidly unraveled after secret recordings emerged A Maryland woman told lawyers that a key witness and jailhouse informant said he lied about his testimony according to defense attorneys for the man accused in the 2001 death of the Washington intern. By Keith L. Alexander and Lynh Bui16 hours ago Opinions Opinions How entangled with Russia is Trump? By George F. Will Clinton vs. Trump A choice between the uninspiring and the unfit By Michael Gerson The GOP is becoming the party of exclusion. Who wants to be a part of that? By Kathleen Parker Actually American just had three conventions By Ruth Marcus Bowsers 9000 in Trump change By Colbert I. King Russias DNC hack A prelude to intervention in November? By David Ignatius More Top Stories More Top Stories At least 16 feared dead after hot-air balloon crashes near Austin The balloon caught fire before falling into a pasture authorities said. Federal officials were headed to investigate. By Jim Vertuno | APJust now Campaign 2016 Trump lavishes attention on Colorado whose conservatives backed Cruz Republicans make up only a third of the states electorate so the GOP nominee has to widen his base. By Matea Gold and Jose A. DelReal1 hour ago Trump labels Clinton supporter a failed general Respected veteran John Allen delivered a forceful endorsement of the Democrat on the final night of that partys convention. By Jose A. DelReal3 hours ago Coach accused of drilling holes in locker rooms to record numerous underage victims Investigators found images of girls as young as 13 on the computer of the man who trained high school rowers in Michigan. By Peter Holley2 hours ago Former NFL linebacker and his wife found shot in home. 16-year-old son arrested. Antonio Armstrong and his wife were killed in the bedroom of their home in Houston reports said. The couples two other children were in the house at the time but they were unhurt. By Marissa Payne1 hour ago 2 years before he killed 5 officers in Dallas he was discharged for hiding a grenade pills stolen underwear Army documents said the weapon was found in Micah Xavier Johnsons sleeping bag. He also had a female soldiers undergarments and a prescription belonging to another soldier. By William Wan6 hours ago NASA still believes well find life on Mars The Red Planet might be a frigid atmosphere-less radiation-bombarded desert but it is slightly less of an inhospitable wasteland than the version Viking first captured 40 years ago. By Sarah Kaplan1 hour ago Turkeys president is haunted by the execution of his political icon Like the nations current leader Adnan Menderes was a center-right nationalist with tremendous popular support. But before his downfall he became increasingly autocratic. By Ishaan Tharoor8 hours ago Pentagon scrambles to patch ties with Turkey at key moment in ISIS fight Date Lab One small thing annoyed her A Marylander was forced to confront her feelings about Virginia. Food The end of small plates? The medium-size plate -- a portion between appetizer and entree -- is rapidly becoming the standard. On Parenting Sons halo falls off around family Their 6-year-old is an angel at school but a devil at home. Why is he so sassy with his loved ones? Visual Stories Visual Stories In Sight(Tomasz Lazar) Tokyos surreal and shadowy world of Pokemon Go after dark Graphic(John Muyskens and Kim Soffen/Post) Between Cleveland and Philly a rhetorical divide Graphic(Samuel Granados and Kevin Uhrmacher/Post) Clinton and Trumps very different Americas 29 Photos(Michael Robinson Chavez/Post) In photos The quirk tension and excitement from the Democratic National Convention View Photos(Desmond Boylan/AP) Here are 19 of the weeks best photos 79 Photos(HomeVisit) Inside the Washington areas most expensive homes for sale Video Listen Play Video (/Video Jenny Starrs/The Washington Post / Photo Jabin Botsford/The Washington Post) Fact-checking Hillary Clintons acceptance speech UP NEXT Fact-checking Hillary Clintons acceptance speech Play Video 222 UP NEXT Ron Charles previews the play Harry Potter and the Cursed Child Play Video 232 UP NEXT Would you rather make America great again or is America already great? Play Video 157 UP NEXT Metro train jumps tracks in Northern Virginia bringing morning commute to a halt Play Video 109 Most Read 1 The smoking gun proving North Carolina Republicans tried to disenfranchise black voters 2 Secret recordings emerged and the Chandra Levy case rapidly unraveled 3 Who will play Donald Trump in Hillary Clintons debate prep? Here are 6 ideas. 4 How entangled with Russia is Trump? 5 Meet the big-name Republicans supporting Hillary Clinton Todays Paper Todays print stories View e-Replica edition 360-Degree Video Sponsored by Out of the blue Using 360-degree video The Post explores the Galapagos Islands -- both on land and underwater -- to see the amazing natural scenes and the lives of the locals. Weekly schedule past shows E-books Looking for America A Journey Into the Countrys Divided Heart The 2016 election is unlike any before it. The campaign has seen the rise of Donald Trump the New York provocateur who has seized the Republican Party from its bewildered establishment and seized an angry electorate. Whats happening in America? What does it mean to be American? For nearly 35 days Washington Post journalists crossed the nation looking for answers chronicling them in this book. Diversions Comics Eggz Crosswords Horoscopes Mah Jongg Solitaire Sudoku TV listings Politics Breitbart takes its pro-Trump evangelism to the Bernie Bros. As Trump lavishes Colorado with attention he faces resistance in GOP enclave The Clinton-Kaine ticket hits the campaign trail Heres what was surprising about the protesters at the Democratic convention this week World El Salvador says a brutal gang laundered money through motels brothels taxis Clinton campaign denies reports that its computer system was hacked Israel and U.S. are close to a deal on the biggest military aid package ever Brazils national guard will provide gate security at Olympic venues National Please accept our deepest apologies Calif. college scraps plans for San Bernardino play Why NASA still believes we might find life on Mars Coach accused of drilling holes in locker rooms to record numerous underage girls Think counting on your fingers is dumb? Think again. PostEverything In 2016 Democrats have finally learned to stop worrying about their patriotism How foreclosed homes and used tires can threaten public health in the age of Zika Why Hillary Clinton is both widely disliked and widely admired Ive taught my kids to obey the police. But my son with autism isnt wired for that. Local At last SafeTrack disruptions hit the Red Line Insiders or outsiders who runs public school districts better? Violent night in District leaves two dead five wounded in shootings The continuing myth of free college Sports Nationals execute first triple play in team history to escape jam hold off Giants NASCARs Dale Earnhardt Jr. may be out of commission longer than expected D.C. United enters critical four-game home stretch Redskins to add former GM Bobby Beathard to Ring of Fame Lifestyle The best late-night convention comedy from Stephen Colbert to Samantha Bee Corpse flowers are invading the East Coast Heres how to see (and smell) one The Offline Society A singles scene for those who are tired of online dating The tattoo as Rorschach test Arts An insider lifting the veil on Silicon Valleys self-importance and greed Zelda Fichandler Arena Stage co-founder and matriarch of regional-theater movement dies at 91 Time-travel through a pint-size world at the National Building Museum A thorny question for African American museum Whose story do we tell? Technology Youre running out of time to get Windows 10 for free Facebook could owe 5 billion in back taxes Instagram will soon let you filter comments on your own account Google is letting you inside its moonshot lab to justify its existence Business Whiskey beer and guns How business decisions are made at the West Texas Investors Club U.S. economy grew at a slow pace in spring expanding at just 1.2 percent pace in second quarter Harry Potter is back -- and so is the bookstore hoopla we havent seen since 2007 Read the latest from Capital Business Federal Government Feds feel the burn over huge long-term-care price hike Cost to maintain Afghan military vehicles skyrocketed because of Pentagon mistakes report says Weather Service conducts illegal surveillance on staff union says Democrats platform barely mentions feds but their unions strongly support Clinton Real Estate A D.C. home with an ageless appeal Relaxing by the bay in Marylands Franklin Manor All the reasons its so much harder to buy a home than it was for your parents This weekends open houses in D.C. Maryland Virginia Archives washingtonpost.com (c) 1996-2016 The Washington Post Subscribe Sign In Help and Contact Us Digital Products Terms of Sale Print Products Terms of Sale Terms of Service Privacy Policy Submissions and Discussion Policy RSS Terms of Service Ad Choices Terms of Use Digital Products Terms of Sale Print Products Terms of Sale Terms of Service Privacy Policy Submissions and Discussion Policy RSS Terms of Service Ad Choices Get Us Home Delivery Digital Subscription Gift Subscriptions Mobile amp; Apps Newsletters amp; Alerts Washington Post Live Reprints amp; Permissions Post Store Photo Store e-Replica Contact Us Help amp; Contact Info Reader Representative Digital Ads Newspaper Ads News Service Syndicate About Us In the Community Careers PostPoints Newspaper in Education Digital Publishing Guidelines Todays Paper WP BrandConnect Events",http://www.washingtonpost.com/ac2/wp-dyn?node=cityguide/profile&id=1142503&categories=Movies#editorialReview,200,pride&glory19,pride&glory,washingtonpost
Page not found | The A.V. Club Dead air. Sorry. Search the A.V. Club The page youre looking for does not exist. Please check that the URL is correct. Go back to avclub.com or contact us,http://www.avclub.com/content/cinema/pride_and_glory,404,pride&glory20,pride&glory,avclub
Pride and Glory Movie Review amp; Film Summary (2008) | Roger Ebert,http://www.rogerebert.com/reviews/pride-and-glory-2008,200,pride&glory21,pride&glory,rogerebert
