review,link,status_code,id,movie_key,critic
"Of Cannibals And Kinks Search Newsweek U.S.WorldBusinessTech amp; ScienceCultureSportsOpinion Subscribe To Newsweek This Week EditionSign InAccount Subscribe To Newsweek Subscribe To Newsweek 14.99Print amp; Digital3 Month Trial--Save 85% off cover Try4.99Digital Only3 Month Trial--Save 45% off cover Try See All Subscription Options Subscribe To The Newsletter Please enter a valid email This Week Edition This Weeks Edition July 29The Chilcot Reports War on ErrorWhy Cancer Clusters Are Impossible to ProveCats Star Turn Deep Inside the Weird World of CatCon View All FeaturesChange Your EditionUSEuropeMiddle EastEspanolRi Ben hangugPakistanPolskaSrbijaCeska RepublikaSign InAccountYour SubscriptionYou have days remaining on your subscription Renew Account Settings Sign Out NewsOf Cannibals And Kinks By David Ansen On 2/17/91 at 700 PM NewsTake a deep breath before descending into a darkened theater to see ""The Silence of the Lambs."" This is not a movie for the faint of heart. Spun from the twisted imagination of novelist Thomas Harris who has a clammy genius for creating serial-killer psychopaths Jonathan Demmes terrifying thriller features one psycho nicknamed Buffalo Bill who murders and skins young women and another a former psychiatrist who eats his victims. This is evil of a particularly baroque flourish and readers of the novel might wonder how Demme could bring such nastiness to the screen without crossing the line of stomach-turning exploitation. You might even wonder why the maker of ""Melvin and Howard"" and ""Something Wild"" would be drawn to such nightmarish stuff but only if youve forgotten his B-movie roots (""Caged Heat"") or his 1979 Hitchcockian excursion ""Last Embrace."" Demmes justification is up there on the screen ""The Silence of the Lambs"" is an electrifying exercise in suspense. One need only have a healthy appetite for fear to acknowledge that thrillers dont get much more thrilling.Can Buffalo Bill (Ted Levine) be stopped before he kills his latest captive the daughter (Brooke Smith) of a Tennessee senator? Thats the motor that drives the plot but the heart of the movie lies elsewhere in the relationship between the heroine FBI trainee Clarice Starling (Jodie Foster) and that cannibalistic shrink Dr. Hannibal Lecter (Anthony Hopkins). Lecter who also appears in Harriss ""Red Dragon"" is a great pop creation - a depraved genius with near-omnipotent insight into the minds of other serial killers. Clarice is sent by her FBI mentor Jack Crawford (Scott Glenn) to interrogate Lecter in his high-security prison cell hoping that he can lead her to Buffalo Bill. In return for information what he wants from Clarice whose ambition to escape her white-trash West Virginia roots he instantly divines is a glimpse into her soul. The monstrous Lecter becomes her father confessor and shrink - as well as a kind of intellectual suitor. Their scenes together (shot in enormous close-up) have a horrific weirdly erotic intimacy. He savors her confessions like a connoisseur sniffing vintage wine. Lecter is a role any actor would kill for and Hopkins has vicious fun with it. Still watchful deeply droll and infinitely sinister he becomes the high priest of criminal psychosis.Fosters fiercely committed performance matches him step by step. From our first sight of her running through the woods at the FBI training camp shes a woman in constant motion - a striver grimly driven to escape her own childhood nightmares. Foster has to play her part in a perpetual state of controlled anxiety. Like the movie she wastes no motion giving us quick sharp glimpses into Clarices defensive determined heart. Its the strongest womans action role since Sigourney Weaver in ""Aliens."" Try Newsweek for only 1.25 per week Screenwriter Ted Tally does an excellent job streamlining the novel and Demme tightens the screws with a mastery that would make any horror veteran jealous. Superbly edited (by Craig McKay) and shot (by Tak Fujimoto) ""The Silence of the Lambs"" makes its cliffhangers fake-outs and penny-dreadful devices seem newly minted it breathes fresh contemporary air into the damsel-in-distress genre. Even the broadest most hackneyed character - the vain jealous Dr. Chilton (Anthony Heald) who resents Clarices success with ""his"" patient Dr. Lecter and gums up the investigation to satisfy his bruised ego-pays off supplying some necessary comic relief. This is the grandest guignol Hollywood has produced in years.Request Reprint or Submit Correction Join the Discussion Most Read (c) 2016 Newsweek LLC Please enter a valid emailAbout UsCorrectionsContact UsIBT MediaCareersAdvertiseCopyrightPrivacy PolicyTerms of ServiceTerms of SaleArchiveRecent Issues SubscribeJuly 22 Issue Cop Killers Fatal Shootings of Police Are Rising Jeff Bezos Wants to Rule the World Can Mark Carney Save Britain From Itself? July 15 Issue The Last Nazi Hunter The Weird World of Extreme Racing Solar Power Brightens Prospects in East Africa July 08 Issue Beyond Brexit Europes Populist Backlash Intensifies Mapping Any Location on Earth With Just Three Words Its Time to Stop the Madness Over Starting Pitchers July 01 Issue Jeff Sessions the Trump Whisperer How D.C. Is Preparing for the Next Terrorist Attack Serena Williams and Coach Mouratoglou Perfect Match?Browse Archives",http://www.newsweek.com/id/126597,200,reddragon0,reddragon,newsweek
"Red Dragon | Chicago Reader Switch to the mobile version of this page. Newsletters Follow us Twitter Facebook RSS Mobile Username View Profile Edit Profile Log Out Log in Create Account The Chicago Reader News amp; Politics Music Arts amp; Culture Film Food amp; Drink Classifieds Browse News amp; Politics News amp; Politics home page Steve Bogira | Criminal Justice John Greenfield | Transportation Deanna Isaacs | Culture Ben Joravsky | Politics Michael Miner | Media Browse Music Music home page Gossip Wolf In Rotation Record roundups Leor Galil | Music Criticism Peter Margasak | Music Criticism Soundboard Concerts this week Early Warnings Concerts on horizon Browse Film Film home page J.R. Jones | Movie Reviews Index of Long Reviews Film Archive Short Reviews Now Playing Todays Showtimes Browse Arts amp; Culture Arts amp; Culture home page Tony Adler | Theater Justin Hayford | Theater Aimee Levitt | Features Brianna Wellen | Comedy Arts amp; Culture event search Browse Food amp; Drink Food amp; Drink home page Mike Sula | Restaurant Reviews Key Ingredient A chef-to-chef challenge Cocktail Challenge Bar Guide Restaurant search Browse The Bleader The Bleader blog home page Browse Classifieds Classifieds home page Real Estate Rentals Announcements Services Jobs (Monster) Place ad ad Best of Chicago Summer Guide Savage Love Straight Dope Agenda Events Locations Issues Article Archives Fun amp; Free You searched for [X]Red Dragon Start over Search for... Browse movie times Narrow Search Author Select an author Andrea Gronvall Michael Atkinson Pat Aufderheide Zbigniew Banas Barbara Scharres Angelica Jade Bastien Bill Stamets Bob Mehr Brian Thomas Peter Brunette Dave Canfield Cara Jepsen Carol Burbank Cheryl Ross Pat Chesnut Luca Cimarusti Patrick Dahl Tyler Daswick Dave Kehr Cliff Doerksen Dominick Suzanne-Mayer Don Druker Mick Dumke Marilyn Ferdinand Fred Camper Patrick Friel Chris Fujiwara Leor Galil Hank Sartin Justin Hayford Jack Helbig Henry Sheehan Tanner Howard Drew Hunt J. R. Jones J.R. Jones Jennifer Vanasco Jessica Hopper Jim Healy Jonathan Rosenbaum Joshua Katzman Josh Katzman Anthony Kaufman Kelly Kleiman Asher Klein Shelley Kraicer Shelly Kraicer Nathalie Lagerfeld Adam Langer Lawrence Bommer Lisa Alspector Eric Lutz Peter Margasak Mark Jenkins Martha Bayne Adrian Martin Tom McCormack Meredith Brody Sergio Mims Michael Miner Laura Molzahn Monica Kendrick Adam Morgan Noel Murray Noah Berlatsky Pat Graham Patrick McGavin Patrick Z. McGavin Gerald Peary Richard Pena Mark Peranson Peter Keough Leah Pickett Richard M. Porton Laura Power Quintin Miles Raymer Reece Pendleton Berenice Reynaud Ronnie Scheib Tal Rosenberg Joshua Rothkopf Joshua H. Rothkopf Martin Rubin Ryan Wenzel Ben Sachs Dan Sallitt Dmitry Samarov Ronnie Schieb David Schwartz David P. Schwartz Scott Pfeiffer Ian Simmons Alissa Simon Michael Glover Smith Patrick Somerville Laura Stempel Steve Erickson David Stewart Gwynedd Stuart Mike Sula Ted Shen Julia Thiel Ignatiy Vishnevetsky Kevin Warwick Jessica Weisberg Brianna Wellen Joel Wicklund Albert Williams Michael Wilmington Sam Worley Rating G PG PG-13 R NC-17 X NR Show only Staff Pick Staff Pick Critics Choice Critics Choice Recommended Recommended New New Agenda Agenda Free Free Slideshow Slideshow Video Video Watch on Amazon Watch on Amazon Watch on Netflix Watch on Netflix Watch on Hulu Watch on Hulu Watch on YouTube Watch on YouTube Member Picks Member Picks Other Searches Events Location Guide Member Search Movie Showtimes Movie Reviews Article Archives Issue Archives Slideshows Comments Videos Images Sorting by Name Release Date Film Search Tweet Tools Email Print Share Digg Newsvine del.icio.us Facebook Reddit Twitter Windy Citizen Add to Custom List Loading... Comments Red Dragon Anthony Hopkins returns yet again as Hannibal Lecter though this adaptation of Thomas Harriss first Lecter novel is more reminiscent of The Silence of the Lambs than of 2001s Hannibal. Edward Norton continuing to squander all that press calling him ""the finest actor of his generation"" plays an FBI agent who nabs the diabolical doctor then takes on a case involving two families who have been slaughtered in their beds and must turn to the mad psychiatrist for help. Ralph Fiennes plays the murderer a sort of watered-down Norman Bates and Emily Watson is the blind girl whos got a thing for him; Frank Whaley and Philip Seymour Hoffman play minor characters so annoying they might as well wear T-shirts reading ""Eat My Brain."" Brett Rattner directed. 124 min. By J.R. Jones Now Playing Sorry there are no upcoming showtimes for Red Dragon Reviews/comments Subscribe to this thread By Email Subscribing... With RSS Comment Add a review Rating Roll over stars and click to rate. Subscribe to this thread Terms of UsePrivacy PolicySubmission GuidelinesAbout The ReaderStaffReader CareersContact UsFreelancing InfoAdvertisingBack IssuesReprints Copyright (c) 2016 Sun-Times Media LLC. Powered by Foundation",http://onfilm.chicagoreader.com/movies/capsules/22539_RED_DRAGON,200,reddragon1,reddragon,chicagoreader
Were sorry we cant find the page that youre looking for Go to the content Go to the footer Time Out New York New York Popular cities London New York Paris Chicago Los Angeles Browse all cities Time Out New York Close New York Change city New York Popular cities London New York Paris Chicago Los Angeles Browse all cities Tickets Events Things to Do Restaurants Bars Movies Theater Music Shopping Attractions Blog Art Travel Nightlife Events amp; Festivals Museums Kids Hotels Comedy Dance LGBT Sex amp; Dating Books City Guide Neighborhoods Promotions Close My Time Out Things I love My lists My Profile My Account Sign out Sign in Create account Sign in With your social account Or with your email Email Password Remember me Forgotten your password? Sign in You can create a Time Out account in two ways... With a few clicks using your favourite social network Or by entering your details below Email First Name Last Name Create password Repeat new password I accept Time Outs terms of use including opt-in to newsletters. Create account Welcome  You have successfully connected your account to Time Out. You may sign in with this account in future. Please confirm your account details Email First Name Last Name I accept Time Outs terms of use including opt-in to newsletters. Sign up My Account Sign in or Create account Search Tickets Events Things to Do Restaurants Bars Movies Theater Music Shopping Attractions Blog Art Travel Nightlife Events amp; Festivals Museums Kids Hotels Comedy Dance LGBT Sex amp; Dating Books City Guide Neighborhoods Promotions More Search Were sorry we cant find the page that youre looking for We have either moved the page or it no longer exists. To help you find your way here are some search results we think may be of interest. Movies Red Dragon After secreting his chianti in the cabinet for nearly a decade Anthony Hopkins has uncorked Hannibal Lecters choice tipple twice in three years - first in Hannibal and now in this prequel to Silence of the Lambs. Michael Mann filmed Thomas Harris novel... Read more Movies Dungeons amp; Dragons Now concentrate there are a lot of funny names to take in. The Empire of Izmer ruled by young Empress Savina (Birch) carrier of the magical Royal Sceptre and commander of a fleet of gold dragons is in grave danger. Savinas Archmage Profion (Irons)... Read more Restaurants Nice Restaurant The decor is typical (golden dragon statue red drapes) but the atmosphere is relatively calm and you can be seated almost immediately even at peak brunch time. Choose the light faintly sweet chrysanthemum tea and dont miss the flavorful flat wide... Chinatown Read more Restaurants Tasca Chino (CLOSED) Overlooking Park Avenue South with cool winds washing over diners chatting exuberantly while nibbling tapas Tasca Chino certainly evokes an old Spanish pintxos bar. But a mash-up is in store proven by the funky murals of bullfights David Bowie and... Gramercy Read more Restaurants Mission Chinese Food (CLOSED) Some of the hottest restaurants in the country these days came from the most humble beginnings sprung from trucks carts and fleeting pop-ups. San Franciscos Mission Chinese Food for example can trace its roots to a different concept called Mission... 4 out of 5 stars Lower East Side Read more Restaurants Boundary-pushing Asian restaurants Momofuku Noodle Bar In 2004 David Chang opened this tiny ramen house serving ambitious Asian-inflected fare--a finely tuned mesh of Japanese Korean and other cuisines. The trendsetting joint helped usher in a new era of dining where casual digs accompanied... Read more Restaurants The Feed first look Mission Chinese Food Tomorrow night chef Danny Bowien debuts the much-anticipated offshoot of San Franciscos cultish Mission Chinese Food. The groundbreaking California joint--housed at Lung Shan as a restaurant inside a restaurant--drew long lines on a dingy strip in the... Read more Movies Petes Dragon Pete (Marshall) is orphaned and freckly; the dragon is animated and pale green. As a pair theyre technically unconvincing and emotionally unpalatable particularly when they snuggle together in close-up or when the dragon uses a gentle finger to lift... Read more Movies Anime/manga walk Start 840 Broadway at 13th StEnd 124 First Ave between St. Marks Pl and E 7th StTime 1 hourDistance 1.5 miles 1 Packed with sushi dens and karaoke parlors the East Village may as well be Manhattans Little Tokyo. But the Land of the Rising Sun permeates... Read more Clubs Interview Toca Cielo Drummers and musicians body painters stilt walkers dancers dressed in jaw-dropping costumes and DJs spinning a high-impact mix of tribal-tech rhythms--thats Toca Cielo the themed full-throttle monthly shindig thats been packing Cielo for the past... Read more Top About us Work for Time Out Privacy policy Website terms of use Contact us Get listed Advertising Time Out products Mobile apps Time Out Shop Time Out Guides Time Out Travel Time Out Worldwide Time Out magazine Follow us Facebook Twitter Youtube Instagram Pinterest Spotify Foursquare Time Out New York Site map,http://www.timeout.com/film/reviews/76504/red_dragon.html,404,reddragon2,reddragon,timeout
"StarTribune.com News weather sports from Minneapolis St. Paul and Minnesota All Sections Search Saturday July 30 2016 Manage Account Log out Log In Subscriptions New Manage Existing eEdition 79deg Forecast Traffic Star Tribune Local Sports Business Opinion Variety Obituaries Classifieds Autos Housing Jobs Home All Sections Search StarTribune Manage Account Log out Log In Subscriptions New Manage Existing Recently Visited Home Local Sports Business Opinion Variety Health Highlights Politics Nation World Science Weather Traffic Video Photography Obituaries Classifieds Autos Housing Jobs Minneapolis St. Paul East Metro North Metro South Metro West Metro Projects Local Columnists Jon Tevlin James Lileks Local Blogs Campus Confidential Class Act Dateline Minnesota Full Disclosure Lileks at Lunch MPLS. STP The Drive Yesterdays News State Fair 10000 Takes Data Drop Twins Vikings Wild Wolves Gophers Colleges Golf Lynx Motorsports Outdoors High Schools Soccer Sports Columnists Dennis Anderson Sid Hartman Patrick Reusse Chip Scoggins Jim Souhan Sports Blogs Access Vikings A Fans View Bloggin Scoggins Dennis Anderson Doug Smith Gold in the Barn Gridiron Gold Ice Gold On the Lynx On the Wolves Patrick+ Randball Russos Rants Sids Scoops Souhan on Sports StribSports Upload The Roman Empire Twins Insider Sports Podcasts Access Vikings Twins Insider Top Workplaces Business Columnists Lee Schafer Neal St. Anthony Business Blogs 3D Economics Food Market Just Listed Lee Schafer Point of Sale The Mill Commentary Editorial Steve Sack Letters Podcasts Playing Politics Books Celebs Comics amp; Games Horoscopes Eat amp; Drink Movies Music Stage amp; Arts TV amp; Media Best of MN Health Home amp; Garden Kids Health Style Taste The Good Life Travel Variety Columnists Gail Rosenblum C. J Variety Blogs Artcetera Escape Artists Greengirls Health Check Lileks  Lunch On Books Table Talk Wingnut World Class View all Obituaries Place an Obituary Notice Place an Ad Garage Sales Estate Sales Merchandise Pets Recreational Vehicles amp; Marina Newspaper Ads Auctions Search Used Vehicles Sell your Vehicle Advertise Rentals Commercial Foreclosures Find an Agent Find a Job Your Resume Your Account Employer A-Z Top Workplaces Post a Job Star Tribune All content Business listings Close Toll unclear in crash of Texas balloon carrying at least 16 1 minute ago A hot air balloon carrying at least 16 people caught on fire and crashed in Central Texas on Saturday causing what authorities described as a ""significant loss of life."" The Latest Woman near Texas balloon crash saw fireball A look at the deadliest hot air balloon accidents FAA warned of potential for many hot air balloon deaths Local Twin Cities area braces for sex trafficking tied to Super Bowl Ryder Cup 50 minutes ago Local Pokemon Go poses problem for peace at Eden Prairie park memorial 1020am Pokemon Go trainers were out in full force Nation Russia tied to hack of program used by Clintons campaign 816am Trump Comments about Russia Clinton emails were sarcastic Local St. Croix County girl charged in savage attack on brothers girlfriend 737am More top headlines 2 people shot and wounded in Minneapolis 1117am Man dies in overnight crash near Hastings 1120am Carver County judge narrows list of potential Prince heirs to at least 6 743am Homegazing Spacecrafting The design for the makeover was inspired by Finnish lake homes of the 1960s. Windows were enlarged to capture views of the backyard pond. Homegazing 1958 St. Louis Park rambler gets Finnish lake home makeover An Eisenhower-era rambler in St. Louis Park was crying out for a makeover telling its remodeling designer what it wanted to be -- clean-lined simple and quiet like a midcentury modern Scandinavian home. You can have it for 550000. A Finnish-inspired makeover New landscaping and overhang solve water problems at Minnetonka home How to grow a garden with natural beauty Variety Game of Thrones season 8 will be the last HBO confirms 4 minutes ago Dont miss Cottage Grove couple wrap 250K honeymoon treehouse around old bur oak Michael and Paula Bushillas have spent the last few years making their 8-acre property into a shabby-chic romantic venue for new brides and grooms. Sports Chad Greenway again ready to fend off youngsters in his final(?) NFL season 922am Offense gets a hard look during Vikings first practice Sports Fans give Morneau loud return to Target Field 945am Twins pitchers Abad Kintzler could be on the move Variety Midwest Traveler Exploring the revived Eau Claire Wis. Visiting revitalized Eau Claire Wis. Opinion Rash Report 2016 campaign narrative defies expectations Like the primaries and the impact of media the DNC hack is just the latest story to morph in a different direction than anticipated. Twin Cities transit projects reach a perilous pass Why Democrats abortion stance is a deal-breaker Sports Offense gets a hard look during Vikings first practice Fans give Morneau loud return to Target Field Chad Greenway again ready to fend off youngsters in his final(?) NFL season Local Twin Cities area braces for sex trafficking tied to Super Bowl Ryder Cup New public square to liven up W. Broadway in Minneapolis Cottage Grove couple wrap 250K honeymoon treehouse around old bur oak Business After stumbling big Boston Scientific has regained its stride Mike McNamara is weaving a new web for Target IT operations Growing corn like its 2065 to study climate change effects Variety Is J.K. Rowling selling out? Some Harry Potter fans wonder 168 shows 850 performances 11 days Why Minnesotas Fringe Fest matters Husker Dus Grant Hart on full display in Walker exhibit Blogs Access Vikings Mike Harris calls illness mild setback no set timetable for return Paul Douglas on Weather Good-Looking Weekend; More Hot Encounters Scheduled for August Twins Insider Postgame Nolasco finished his extra-long start with a flourish The Drive Right turns across LRT tracks now legal at 5th and 5th but dont get used to it Todays Video http//www.startribune.com Raw video Patterson injured after spectacular catch 0021Cordarrelle Patterson left Vikings practice after a spectacular catch over cornerback Jabari Price Now Playing Raw video Patterson injured after spectacular ... Now Playing Special prosecutor added to help with Castile ... Now Playing C.J. Outrageous Davis strives to be Dave ... Now Playing Afternoon forecast Partly sunny with a high ... The StreamNews updates from around the Web most read most watched Toll unclear in crash of Texas balloon carrying at least 16  Nation Twin Cities area braces for sex trafficking tied to Super Bowl Ryder Cup  Minneapolis 1958 St. Louis Park rambler gets Finnish lake home makeover  Variety Offense gets a hard look during Vikings first practice  Vikings Fans give Morneau loud return to Target Field  Twins Raw video Patterson injured after spectacular catch  Vikings Nunez Its tough to leave Twins  Sports Clinton With no ceilings the skys the limit  Politics Special prosecutor added to help with Castile shooting case  Video Vikings Greenway hints this could be final year  Vikings Most Shared 1958 St. Louis Park rambler gets Finnish lake home makeover  Variety Right tool for the job? Master gardener shares her favorites  Variety Wisconsin doubles down on dairy distinction with goat farms  Local Choi adds special prosecutor to probe of Castile shooting  East Metro Have a flight at MSP? Exhibit shows history of Minnesota food (and drink)  Variety Follow Us On Facebook Twitter Google+ Pinterest Instagram Tumblr World Philippine president calls off truce after rebel attack Security suddenly boosted at Amsterdams Schipol Airport Nation Reagan shooter Hinckleys return to normalcy has been years in making Powerball 478 million jackpot is nations 8th largest Politics Russia tied to hack of program used by Clintons campaign Gov. Mark Dayton looks back on 40 years of Democratic National Conventions markets get quote symbol lookup 20 minute delay last updated new stadium a look inside Go inside U.S. Bank Stadium the new star of the north Top Workplaces Beer in the office? Top Workplaces offer unusual incentives to attract workers Transparency and straight talk are not just buzzwords at top large companies Celebrities Latest late-night battle Stephen Colbert vs. corporate lawyers Fox 9s Jonathan Choe takes his talent and sartorial style home to Boston Twins Fans give Morneau loud return to Target Field Twins win on Mauers pinch-hit walk-off walk Vikings Offense gets a hard look during Vikings first practice Day 1 injuries to Patterson Peterson dont worry Vikings coach Zimmer poll Poll If Hillary becomes president what title will Bill have? Should Hillary Clinton become the president Bill Clinton would become the first male White House ... 10000 Takes The art of parting We used to spend so much time there How I came to see bipolar disorder as my greatest strength Featured Gallery Photos This mid-century home for sale in Golden Valley is like walk... 13 photos Wallpaper wallpaper wallpaper. Listed for 674900. Featured Video A new generation of black leaders say Jamar Clark made the struggle... 0328 Hear from the new generation of black leaders about challenges they face addressing ... special feature Find the summer fun Whats your flavor? Summer in Minnesota offers something for everyone. StarTribune Follow Us On Facebook Twitter Google+ Pinterest Instagram Tumblr Company About the Star Tribune Contact us Jobs News in Education City Pages High school sports hubs Mobile and tablet apps Advertise with us Talk with a business consultant Media kit Classifieds Buy Star Tribune Store Photo Reprints Archived articles Back Copies Commercial reprints Licensing Customer support Feedback Manage your account Newspaper subscription Digital access eEdition Vacation hold/billing Website Terms of use Privacy policy Site index RSS (c) 2016 StarTribune. All rights reserved.",http://www.startribune.com/stories/1553/3341047.html,200,reddragon3,reddragon,startribune
