review,link,status_code,id,movie_key,critic
"Review ""Repo Men"" is a real grind - StarTribune.com Home All Sections Search StarTribune Manage Account Log out Log In Subscriptions New Manage Existing Recently Visited Home Local Sports Business Opinion Variety Health Highlights Politics Nation World Science Weather Traffic Video Photography Obituaries Classifieds Autos Housing Jobs Minneapolis St. Paul East Metro North Metro South Metro West Metro Projects Local Columnists Jon Tevlin James Lileks Local Blogs Campus Confidential Class Act Dateline Minnesota Full Disclosure Lileks at Lunch MPLS. STP The Drive Yesterdays News State Fair 10000 Takes Data Drop Twins Vikings Wild Wolves Gophers Colleges Golf Lynx Motorsports Outdoors High Schools Soccer Sports Columnists Dennis Anderson Sid Hartman Patrick Reusse Chip Scoggins Jim Souhan Sports Blogs Access Vikings A Fans View Bloggin Scoggins Dennis Anderson Doug Smith Gold in the Barn Gridiron Gold Ice Gold On the Lynx On the Wolves Patrick+ Randball Russos Rants Sids Scoops Souhan on Sports StribSports Upload The Roman Empire Twins Insider Sports Podcasts Access Vikings Twins Insider Top Workplaces Business Columnists Lee Schafer Neal St. Anthony Business Blogs 3D Economics Food Market Just Listed Lee Schafer Point of Sale The Mill Commentary Editorial Steve Sack Letters Podcasts Playing Politics Books Celebs Comics amp; Games Horoscopes Eat amp; Drink Movies Music Stage amp; Arts TV amp; Media Best of MN Health Home amp; Garden Kids Health Style Taste The Good Life Travel Variety Columnists Gail Rosenblum C. J Variety Blogs Artcetera Escape Artists Greengirls Health Check Lileks  Lunch On Books Table Talk Wingnut World Class View all Obituaries Place an Obituary Notice Place an Ad Garage Sales Estate Sales Merchandise Pets Recreational Vehicles amp; Marina Newspaper Ads Auctions Search Used Vehicles Sell your Vehicle Advertise Rentals Commercial Foreclosures Find an Agent Find a Job Your Resume Your Account Employer A-Z Top Workplaces Post a Job Star Tribune All content Business listings Close Home Local Sports Business Opinion Variety Obituaries Classifieds Autos Housing Jobs More from the Homepage prev Toll unclear in crash of Texas balloon carrying at least 16 Twin Cities area braces for sex trafficking tied to Super Bowl Ryder Cup Pokemon Go poses problem for peace at Eden Prairie park memorial Russia tied to hack of program used by Clintons campaign St. Croix County girl charged in savage attack on brothers girlfriend 1958 St. Louis Park rambler gets Finnish lake home makeover Game of Thrones season 8 will be the last HBO confirms Cottage Grove couple wrap 250K honeymoon treehouse around old bur oak Chad Greenway again ready to fend off youngsters in his final(?) NFL season Fans give Morneau loud return to Target Field Midwest Traveler Exploring the revived Eau Claire Wis. next Movies 88428182 Review ""Repo Men"" is a real grind Health care gets unmanageable in the ghastly organ-donor thriller.  | Zero out of 4 stars By COLIN COVERT Star Tribune March 18 2010 -- 226pm Video (0238)  Star Tribune movie critic Colin Covert gives Repo Men a perfectly bad review. Carlos Gonzalez Text size comment share tweet email Print more Share on Share on LinkedIn Share on Google+ Share on Pinterest Copy shortlink Purchase Order Reprint With its radiantly ugly visuals mean-spirited worldview and gut-wrenching levels of gore ""Repo Men"" is about as entertaining as a burst appendix. And yet you can see why the production got a green light from the studio. Projecting the United States health industry to the next level ""Repo Men"" has the framework of a morbid/gonzo science fiction satire like ""Soylent Green"" or ""Idiocracy."" In this misanthropic prophecy artificial organs (artiforgs) can keep you living after your biological parts give out. The catch They cost an arm and a leg. Most patients can only afford them on the installment plan. Fall behind in your payments and the bio- repossession collector retrieves your implants. The tale follows Jude Law as a middle-of-the-food-chain bio-repo man. He likes his work. The moneys good theres a rush to bringing down violators and he meets interesting people. In one episode he lets hip-hop king RZA finish mixing a music track before retrieving his companys property. Irony of ironies when Law is injured on the job he awakens with a mechanical ticker and payments he cant afford. After his change of heart he wants out of the collection racket. And his partner (Forest Whitaker) is now his nemesis. Ah what clockwork ironies Imagine the worst film that could be made from this premise. Now envision something 10 times worse. Thats ""Repo Men."" Its a grade B concept executed with grade Z creative instincts. Former storyboard artist Miguel Sapochnik has never directed a movie before; on the basis of this effort Im not sure hes ever seen a film before. But at least hes got that storyboard day job. The film is further proof of the Oscar Curse for Whitaker whose luck hasnt improved since last weeks fiasco ""Our Family Wedding."" Law is not convincing as a remorseless corporate henchman or as a transformed man of conscience. He is up to the physical challenges of the role however slicing open bodies with a surgical/sadistic relish rarely seen outside snuff films. Moviegoers deserve better. In fact moviegoers deserve a written apology from the producer director and cast. ccovertstartribune.com  612-673-7186 View Comments Read our comment standards StarTribune.com welcomes and encourages readers to comment and engage in substantive mutually respectful exchanges over news topics. Commenters must follow our Terms of Use. Keep it civil and stay on topic. No profanity vulgarity racial slurs or personal attacks. Comments with web links are not permitted. Comments that violate the above will be removed. Repeat violators may lose their commenting privileges on StarTribune.com. Comments will be reviewed before being published. Powered by Livefyre } More from Star Tribune Why Democrats abortion stance is a deal-breaker Federal judge strikes down Wisconsin election laws Twins pitchers Abad Kintzler could be on the move Scoggins Vikings Sullivan says he has nothing to prove in comeback Rash Report 2016 campaign narrative defies expectations Clinton campaign Computer service used by campaign hacked More from Entertainment Polls July 27 Poll If Hillary becomes president what title will Bill have? Should Hillary Clinton become the president Bill Clinton would become the first male White House spouse. This poses a pressing question for Americans what would we call him? Variety July 6 Adele fans show that her music reaches all ages Adele kicked off the first of her two-night Adele Live 2016 North American tour stop at Xcel Energy Center on Tuesday night. Polls June 23 Poll Which new State Fair food do you most want to try? Movies June 19 Finding Dory blows animation record out of the water The forgetful blue fish of ""Finding Dory"" is box office gold. Polls June 14 Poll Which celeb would you most like to chat with over coffee? Top Stories Toll unclear in crash of Texas balloon carrying at least 16 3 minutes ago Twin Cities area braces for sex trafficking tied to Super Bowl Ryder Cup 52 minutes ago Pokemon Go poses problem for peace at Eden Prairie park memorial 1020am Most Read Movie reviews The Names of Love and The Man Who Fell to Earth  Movies Man on Ledge goes off the deep end  Movies Minneapolis St. Paul International Film Festival 2015  Movies A grand finale for Harry Potter  Movies Local Twin Cities area braces for sex trafficking tied to Super Bowl Ryder Cup New public square to liven up W. Broadway in Minneapolis Variety Is J.K. Rowling selling out? Some Harry Potter fans wonder 168 shows 850 performances 11 days Why Minnesotas Fringe Fest matters Sports Offense gets a hard look during Vikings first practice Fans give Morneau loud return to Target Field Featured Gallery Photos This mid-century home for sale in Golden Valley is like walk... 13 photos Wallpaper wallpaper wallpaper. Listed for 674900. Business After stumbling big Boston Scientific has regained its stride Mike McNamara is weaving a new web for Target IT operations Politics Russia tied to hack of program used by Clintons campaign Gov. Mark Dayton looks back on 40 years of Democratic National Conventions 10000 Takes The art of parting We used to spend so much time there How I came to see bipolar disorder as my greatest strength Nation Reagan shooter Hinckleys return to normalcy has been years in making Powerball 478 million jackpot is nations 8th largest World Philippine president calls off truce after rebel attack Security suddenly boosted at Amsterdams Schipol Airport Celebrities Latest late-night battle Stephen Colbert vs. corporate lawyers Fox 9s Jonathan Choe takes his talent and sartorial style home to Boston StarTribune Follow Us On Facebook Twitter Google+ Pinterest Instagram Tumblr Company About the Star Tribune Contact us Jobs News in Education City Pages High school sports hubs Mobile and tablet apps Advertise with us Talk with a business consultant Media kit Classifieds Buy Star Tribune Store Photo Reprints Archived articles Back Copies Commercial reprints Licensing Customer support Feedback Manage your account Newspaper subscription Digital access eEdition Vacation hold/billing Website Terms of use Privacy policy Site index RSS (c) 2016 StarTribune. All rights reserved.",http://www.startribune.com/entertainment/movies/88428182.html?elr=KArksD:aDyaEP:kD:aUnc5PDiUiD3aPc:_Yyc:aULPQL7PQLanchO7DiUr,200,repomen16,repomen,startribune
"A social satire dripping with graphic gore - philly-archives | News | Sports | Entertainment | Business | Opinion | Food | Lifestyle | Health | More Classifieds Real Estate Cars Jobs Obituaries Marketplace Shopping Circulars Print Offers Online Events Local Deals Breaking News Video Blogs Philadelphia New Jersey Politics Education Opinion Obituaries Nation/World Weather Traffic Lottery CollectionsArtificial Heart <a href=""http//ad.doubleclick.net/jump/ph.search/perfectmarket;pos=btf;sz=300x250;ord=philly_apt_ad_timestamp?""></a> We RecommendUltimate recycling Artificial joints after cremationFebruary 24 2012Find More Stories About Artificial HeartRepo Men <a href=""http//ad.doubleclick.net/jump/ph.search/perfectmarket;pos=atf;sz=300x250;ord=philly_apt_ad_timestamp?""></a> A social satire dripping with graphic goreBy Carrie Rickey Inquirer Movie CriticPosted March 19 2010Repo Men a cyber-noir with a blunt satiric edge blunter surgical instruments and stomach-churning surgical procedures imagines a future where consumers buy human organs on the installment plan.What happens if say you are 90 days late on a payment? As our hero Remy (Jude Law) explains it ""Cant pay for your house? The bank takes it. Cant pay for your car? The bank takes it. Cant pay for your liver? Well thats where I come in."" Armed with stun gun and scalpel Remy can jack a human organ quicker than a robber can your car radio.Remy a muscle-bound (and somewhat muscle-headed) ex-soldier is a repo man for The Union a corporation that manufactures ""forgs"" (artificial organs) and sells them at agencies resembling car dealerships. When someone defaults on his late-model Jarvik heart Remy pays a house call surgically extracts the property in question and returns it.(The company reaps huge profits in reselling units as its top salesman - played with greedy glee by Liev Schreiber - notes.)As an allegory of rapacious corporate capitalism the movie based on Eric Garcias novel Repossession Mambo has many provocative ideas. But as an account of how for-profit big business literally rips a consumers heart out Repo Men is too graphic for me.Those with a higher threshold for medical procedures than I possess might be able to look past the scenes of organ evisceration and see Repo Men more as a social satire than slasher horror. I watched a third of the movie through the cracks of my fingers wincing.Director Miguel Sapochnik is a former storyboard artist more attentive to how his atmospherics look than to storytelling or acting. He favors sequences of power violence dynamic in a Matrix-y fashion.Besides Law who is sympathetic but not the first guy you think of for this kind of film (though he was excellent in Gattaca) and Schreiber who provides the comic relief amid the spurts and the splatter the film also stars Forrest Whitaker as Remys partner Jake and wistful Alice Braga as Remys rebound romance Beth.As Remy has an artificial heart and Beth artificial almost everything else they are quite the complementary pair. He is a mostly human fighting machine; she is a mostly bionic well of empathy.Their obligatory sex scene which might reduce even David Cronenberg to watching through his fingers cringing involves relieving each other of all their artificial organs and joints bringing new meaning to the term ""organ grinder."" My dear I damn near fainted.P.S. To answer the queries Im getting about the relationship of Repo Men to other similarly titled films Yes it does share the organ-replacement themes of Repo The Genetic Opera. And no it bears no relation whatsoever to Repo Man Alex Coxs 1984 comedy about the automotive bounty hunter who learns that the more you drive the stupider you get.Contact movie critic Carrie Rickey at 215-854-5402 or crickeyphillynews.com. Please enable JavaScript to view the <a href=""http//disqus.com/?ref_noscript"">comments powered by Disqus.</a> comments powered by Disqus Commenting policy | Comments FAQ FEATURED ARTICLESTiffany Trump and Naomi Biden graduate Penn dad and granddad looking onApothecary gardens fuel farm-to-medicine-cabinet movementCruz pledges to unify GOP AmericansMoreDe Mazia Art Brings 2.38 MillionLeader Of Jbm Sentenced To Life Aaron Jones Was Convicted Of Conspiring To Distribute 100 Million In Cocaine. He Plans To Appeal.Jbm 8 Believed FoundersIn Bulk Trucking Chemical Leaman Is Rolling Toward The TopFrank Nofer 71 famed graphic artistGeorge Mattson 88 Olympian Crew CoachIndex by Keyword|Index by Date|About Philly.com|Contact Us|Terms of Use amp; Privacy Statement|Copyright 2016 <a href=""http//www.omniture.com"" title=""Web Analytics""></a>",http://www.philly.com/inquirer/columnists/carrie_rickey/20100319_A_social_satire_dripping_with_graphic_gore.html,200,repomen17,repomen,philly
"Repo Men movie review - Repo Men showtimes - The Boston Globe Local Search Site Search Home Delivery HomeTodays GlobeNewsYour TownBusinessSportsLifestyleAamp;EThings to doTravelCarsJobsReal Estate Movies Restaurants Music Theater/Art Television Books Celebrity news Events Games Comics THIS STORY HAS BEEN FORMATTED FOR EASY PRINTING Home / Aamp;E / Movies Movie Review Repo Men Body parts collected by hacks By Wesley Morris Globe Staff / March 19 2010 E-mail this article To Invalid E-mail address Add a personal message(80 character limit) Your E-mail Invalid E-mail address Sending your article Your article has been sent. E-mail| Reprints| Text size - + The body organs cost an arm and a leg but life in ""Repo Men is cheap. This is the sort of science fiction that opts for scissors to the groin or a bullet to the head rather than a complete thought. Its much easier for the filmmakers -- Miguel Sapochink directed from a script by Eric Garcia and Garrett Lerner ... (Full article 843 words) This article is available in our archives Globe Subscribers FREE for subscribers Subscribers to the Boston Globe get unlimited access to our archives. Not a subscriber? Non-Subscribers Purchase an electronic copy of the full article. Learn More 9.95 1 month archives pass 24.95 3 months archives pass 74.95 1 year archives pass LOG IN TO COMMENT Sorry we could not find your e-mail or password.Please try again or click here to retrieve your password. Existing users E-mail Password Screen name ( fields are required) Login Forgot your password? New users Please take a minute to register. After you register and pick a screen name you can publish your comments everywhere on the site. Posting Policy. Register Your comment is subject to the rules of our Posting Policy This comment may appear on your public profile. Public Profile FAQ Movie listings search Movie times  Globe review archive Find theaters by town | Search all movie listings Advertisement Boston.com Most EmailedSubscribe to SliceBookmark Boston.com Most Emailed120 MOST E-MAILED >> Report Warrant Issued for Roggies Bar OwnerMap of Greater Boston Farmers MarketsBoston Pops Concert Move Keeps the Beach Boys Ditches Joey McIntyreWe Tried Out Those New Solar BenchesNew Englands top outdoor water parksDrink of the Week Mojito ItalianoLawmakers pass compounding pharmacy oversight bill Follow this list on Twitter BostonPopular Home| Todays Globe| News| Business| Sports| Lifestyle| Aamp;E| Things to Do| Travel| Cars| Jobs| Real Estate| Local Search Contact Boston.com | Help| Advertise| Work here| Privacy Policy| Your Ad Choices| Terms of Service| Newsletters| Mobile| RSS feeds| Sitemap Contact The Boston Globe| Subscribe| Manage your subscription| Advertise| Boston Globe Insiders| The Boston Globe Gallery| (c) Boston Globe Media Partners LLC <a href=""http//www.omniture.com"" title=""Web Analytics""></a>",http://www.boston.com/ae/movies/articles/2010/03/19/in_repo_men_body_parts_are_collected_by_hacks/,200,repomen18,repomen,boston
"Repo Men  Film Review Repo Men  Movie Review  The A.V. Club Film TV Club Music Comedy Books Games Aux More Repo Men Most Read A.V. Club Most Read 1 Artists rendering of HBO executives heads when they found out their biggest show was coming to a close. (Game Of Thrones) Posted Jul 30 HBO confirms that Game Of Thrones will end with season 8 2 Guardians Of The Galaxy Posted Jul 30 Marvel might only be making one Infinity War movie now 3 Photo Warner Bros. Posted Jul 30 Lights Out director David Sandberg defends the ending of his horror hit 4 HBO programming president Casey Bloys at the 2016 Television Critics Association Summer Tour at The Beverly Hilton (Photo by Jeff Kravitz/FilmMagic/Getty Images) Posted Jul 30 HBO exec Casey Bloys on the future of Curb Deadwood and Jon Stewart Film TV Club Music Comedy Books Games Aux Newswire Reviews Video Great Job Internet Film TV Club Music Comedy Books Games Aux Newswire Features Reviews Videos Great Job Internet The Latest From Newswire Artists rendering of HBO executives heads when they found out their biggest show was coming to a close. (Game Of Thrones) HBO confirms that Game Of Thrones will end with season 8 Guardians Of The Galaxy Marvel might only be making one Infinity War movie now The Latest From Features (Graphic Nick Wanserski) The best books of 2016 so far The A.V. Clubs catch-up guide American jazz vocalist Michael Franks at SIR studios in NYC. (Photo Oliver Morris/Getty Images) Jazz-inflected yacht rock word lists and pop-culture nerdery The Latest From Reviews B- Photo Cinema Asia Releasing League Of Gods offers the deadly farts of a six-armed baby in dazzling 3-D B+ Mike Kinsella (Photo Shervin Lainez) On The King Of Whys Owens the best its ever been The Latest From Videos Chasing Jason Bourne and catching up with Woody Allen Comedian Damien Lemon likes his weed to have a heroic backstory The Latest From Great Job Internet (Screenshot YouTube) Watch David Cross wound himself with increasingly brutal hot wings Democratic nominee President Hillary Clinton waves to the crowd following her acceptance speech at the Democratic National Convention in Philadelphia on Thursday July 28 2016. (Photo Bill Clark/CQ Roll Call) Read This Hillary Clinton knows her Hamilton so chill All Recent Browse Our Features Coming Distractions Savage Love Facebook Twitter Tumblr Film Movie Review Repo Men By Keith Phipps Mar 18 2010 205 PM C+ Share Tweet C+ Repo Men Director Miguel Sapochnik Runtime 111 minutes Rating R Cast Jude Law Forest Whitaker Liev Schreiber Community Grade (12 Users) A A- B+ B B- C+ C C- D+ D D- F Your Grade A A- B+ B B- C+ C C- D+ D D- F ? Our Community Grading Tool is in beta. Send Feedback. Share Tweet In a newscast near the beginning of Repo Men an anchor informs her viewers about an ongoing conflict in Nigeria pausing briefly to insert the quick aside ""...thats in Africa."" That fleeting moment says a lot about the world of the movie a place much like ours only slightly dumber. Its a bit more brutal too. The economy remains in the tank dividing the populace into two groups those who have nothing and those just hanging on to what little theyve got. Medicine at least has advanced to the point that most any organ can be replaced by a mechanical equivalent. But health-care reform? Forget it. If you cant pay for the organs youve purchased its back to the warehouse they go. And thats where the repo men come in. Fans of Monty Pythons The Meaning Of Life will see echoes of a famous sequence in the premise and the film--directed by first-timer Miguel Sapochnik and taken from a novel by Matchstick Men writer Eric Garcia--acknowledges the debt by playing a clip from the movie in the background of one scene. Repo Men makes the same dark joke that Python made about the way the value of human life gets lost in the need to balance the books and fill out the paperwork but it doesnt make that point nearly as compactly or as well. Yet for a while Repo Men glides by on style and unrelentingly despairing humor. Jude Law plays a repo man with a nagging wife (an underused Carice van Houten) an overenthusiastic partner (Forest Whitaker) and an unflappably cool professionalism. Law gets an infusion of empathy when an accident on the job leaves him with an artificial heart and all the bills that come with it. Its a too-neat little metaphor--he loses his heart to gain one--and Laws undeveloped portrayal doesnt do much to carry it across. But the films economical plotting an oily performance from Liev Schreiber as Law and Whitakers boss and a brisk pace--up to the endless final act--help patch over some of the flaws. They cant hide the fact that its a film divided against itself however. Sapochnik has made a movie about the delicate dignity of human life that revels in gleeful ultraviolence all of it staged with much less finesse than the rest of the movie (and with one scene that owes way too much to a famous sequence in Oldboy hammer and all). Its a time-waster with brains but ultimately not enough brains and one that wastes too much time. Share Tweet Filed Under Film More Movie Review Previous Movie Review The Runaways Next Movie Review The Bounty Hunter Dont miss a story--follow The A.V. Club on Cant see comments? Please enable JavaScript to view the <a href=""http//disqus.com/?ref_noscript""> comments powered by Disqus. </a> More Movie Review League Of Gods offers the deadly farts of a six-armed baby in dazzling 3-D Jul 30 2016 1022 AM Philip Roths Indignation becomes a character study worth examining Jul 28 2016 900 AM A former football pro documents his struggle with ALS in Gleason Jul 28 2016 1200 AM A woman fights to hold on to her career on Wall Street in Equity Jul 28 2016 1200 AM A.V. Club Most Read 1 Artists rendering of HBO executives heads when they found out their biggest show was coming to a close. (Game Of Thrones) Posted Jul 30 HBO confirms that Game Of Thrones will end with season 8 2 Guardians Of The Galaxy Posted Jul 30 Marvel might only be making one Infinity War movie now 3 Photo Warner Bros. Posted Jul 30 Lights Out director David Sandberg defends the ending of his horror hit 4 HBO programming president Casey Bloys at the 2016 Television Critics Association Summer Tour at The Beverly Hilton (Photo by Jeff Kravitz/FilmMagic/Getty Images) Posted Jul 30 HBO exec Casey Bloys on the future of Curb Deadwood and Jon Stewart Sign up for news Daily Newsletter Highlights from The A.V. Club Whats On Tonight A daily update on the world of TV Submit Links and such All Recent Browse Our Features Coming Distractions Savage Love Contests RSS About Us Contact Advertise Jobs Privacy Policy Our Partners Hitfix Mental Floss Oh My Rockness Uproxx Upworthy Vice (c) Copyright 2016 Onion Inc. All Rights Reserved.","http://www.avclub.com/articles/repo-men,39335/",200,repomen19,repomen,avclub
Repo Men Movie Review amp; Film Summary (2010) | Roger Ebert,http://www.rogerebert.com/reviews/repo-men-2010,200,repomen20,repomen,rogerebert
