review,link,status_code,id,movie_key,critic
Repo Men | Chicago Reader Switch to the mobile version of this page. Newsletters Follow us Twitter Facebook RSS Mobile Username View Profile Edit Profile Log Out Log in Create Account The Chicago Reader News amp; Politics Music Arts amp; Culture Film Food amp; Drink Classifieds Browse News amp; Politics News amp; Politics home page Steve Bogira | Criminal Justice John Greenfield | Transportation Deanna Isaacs | Culture Ben Joravsky | Politics Michael Miner | Media Browse Music Music home page Gossip Wolf In Rotation Record roundups Leor Galil | Music Criticism Peter Margasak | Music Criticism Soundboard Concerts this week Early Warnings Concerts on horizon Browse Film Film home page J.R. Jones | Movie Reviews Index of Long Reviews Film Archive Short Reviews Now Playing Todays Showtimes Browse Arts amp; Culture Arts amp; Culture home page Tony Adler | Theater Justin Hayford | Theater Aimee Levitt | Features Brianna Wellen | Comedy Arts amp; Culture event search Browse Food amp; Drink Food amp; Drink home page Mike Sula | Restaurant Reviews Key Ingredient A chef-to-chef challenge Cocktail Challenge Bar Guide Restaurant search Browse The Bleader The Bleader blog home page Browse Classifieds Classifieds home page Real Estate Rentals Announcements Services Jobs (Monster) Place ad ad Best of Chicago Summer Guide Savage Love Straight Dope Agenda Events Locations Issues Article Archives Fun amp; Free You searched for [X]Repo Men Start over Search for... Browse movie times Narrow Search Author Select an author Andrea Gronvall Michael Atkinson Pat Aufderheide Zbigniew Banas Barbara Scharres Angelica Jade Bastien Bill Stamets Bob Mehr Brian Thomas Peter Brunette Dave Canfield Cara Jepsen Carol Burbank Cheryl Ross Pat Chesnut Luca Cimarusti Patrick Dahl Tyler Daswick Dave Kehr Cliff Doerksen Dominick Suzanne-Mayer Don Druker Mick Dumke Marilyn Ferdinand Fred Camper Patrick Friel Chris Fujiwara Leor Galil Hank Sartin Justin Hayford Jack Helbig Henry Sheehan Tanner Howard Drew Hunt J. R. Jones J.R. Jones Jennifer Vanasco Jessica Hopper Jim Healy Jonathan Rosenbaum Joshua Katzman Josh Katzman Anthony Kaufman Kelly Kleiman Asher Klein Shelley Kraicer Shelly Kraicer Nathalie Lagerfeld Adam Langer Lawrence Bommer Lisa Alspector Eric Lutz Peter Margasak Mark Jenkins Martha Bayne Adrian Martin Tom McCormack Meredith Brody Sergio Mims Michael Miner Laura Molzahn Monica Kendrick Adam Morgan Noel Murray Noah Berlatsky Pat Graham Patrick McGavin Patrick Z. McGavin Gerald Peary Richard Pena Mark Peranson Peter Keough Leah Pickett Richard M. Porton Laura Power Quintin Miles Raymer Reece Pendleton Berenice Reynaud Ronnie Scheib Tal Rosenberg Joshua Rothkopf Joshua H. Rothkopf Martin Rubin Ryan Wenzel Ben Sachs Dan Sallitt Dmitry Samarov Ronnie Schieb David Schwartz David P. Schwartz Scott Pfeiffer Ian Simmons Alissa Simon Michael Glover Smith Patrick Somerville Laura Stempel Steve Erickson David Stewart Gwynedd Stuart Mike Sula Ted Shen Julia Thiel Ignatiy Vishnevetsky Kevin Warwick Jessica Weisberg Brianna Wellen Joel Wicklund Albert Williams Michael Wilmington Sam Worley Rating G PG PG-13 R NC-17 X NR Show only Staff Pick Staff Pick Critics Choice Critics Choice Recommended Recommended New New Agenda Agenda Free Free Slideshow Slideshow Video Video Watch on Amazon Watch on Amazon Watch on Netflix Watch on Netflix Watch on Hulu Watch on Hulu Watch on YouTube Watch on YouTube Member Picks Member Picks Other Searches Events Location Guide Member Search Movie Showtimes Movie Reviews Article Archives Issue Archives Slideshows Comments Videos Images Sorting by Name Release Date Film Search Tweet Tools Email Print Share Digg Newsvine del.icio.us Facebook Reddit Twitter Windy Citizen Add to Custom List Loading... Comments Repo Men Video 2010 Midnight-movie fans may already know Darren Lynn Bousmans Repo The Genetic Opera (2008) an insane futuristic rock opera in which corporate goons barge into peoples homes and bloodily reclaim transplanted organs that havent been paid for on time. This Universal Pictures release has exactly the same premise but was reportedly hatched in 2003 by screenwriters Garrett Lerner and Eric Garcia (whos published the story in novel form as The Repossession Mambo). Jude Law and Forest Whitaker are the callous thugs of the title and Liev Schreiber is their white-collar boss; after a plot twist sticks Law with a transplanted heart he cant pay off he goes on the run with fellow deadbeat Alice Braga. This was too long mean and gory for me though the satirical gloss and well-executed trick ending will probably impress some. Miguel Sapochnik directed. R 111 min. By J.R. Jones Official Site www.repomenarecoming.comDirector Miguel SapochnikProducer Scott Stuber Miguel Sapochnik Jonathan Mone Mike Drake Valerie Dean and Andrew Z. DavisCast Jude Law Forest Whitaker Liev Schreiber Alice Braga Carice van Houten RZA Chandler Canterbury Joe Pingue Liza Lapira Tiffany Espensen Yvette Nicole Brown Wayne Ward Tanya Clarke and Max Turnbull Trailer Repo Men Now Playing Sorry there are no upcoming showtimes for Repo Men Reviews/comments Subscribe to this thread By Email Subscribing... With RSS Comment Add a review Rating Roll over stars and click to rate. Subscribe to this thread Terms of UsePrivacy PolicySubmission GuidelinesAbout The ReaderStaffReader CareersContact UsFreelancing InfoAdvertisingBack IssuesReprints Copyright (c) 2016 Sun-Times Media LLC. Powered by Foundation,http://www.chicagoreader.com/chicago/repo-men/Film?oid=1539235,200,repomen0,repomen,chicagoreader
"Repo Men takes on health care | Newsday 147686468041 Long Island Sports Entertainment Lifestyle News Business Health Opinion Obituaries Cars Homes Jobs Subscribe Manage Manage my account Preferences Newsletters Subscribe to TV Weekly Subscribe to Newsday Manage my account Subscribe to TV Weekly Todays Paper Todays paper / archives >> Newsday Fun Book >> Recent covers gallery >> Special sections >> Traffic 0 Weather 79deg Log in Log out Sections Home Long Island Top Stories Nassau Suffolk Education Crime Politics Towns Investigations Data and maps Commuting LI Life History Obituaries Sports Top Stories Yankees Mets Islanders Rangers Jets Giants Knicks Nets High school College Columns Videos Scores Baseball Basketball Boxing Football Golf Hockey Horse Racing Media MMA Motor Racing Olympics Soccer Opinion Top Stories Matt Davies Columnists Letters to the editor Submit your letter Business Top Stories Real Estate Technology Cars Columns Mutual funds Markets Stocks Nation and World Nation and World NYC State and Region Health Technology Weird news Lottery Entertainment Top Stories Movies TV Celebrities Music Books Theater Reality TV Crosswords Puzzles Comics Lifestyle Top Stories Restaurants Family Pets Travel Food and Drink Top 100 Restaurants Fashion and Shopping Home and Garden LI Getaways Recreation Retirement Advice Beaches Events Things to do Classifieds Classifieds Jobs Cars Real Estate Yellow Pages Legal Notices Obituaries Crosswords More Todays Paper Weather Traffic and Transit Data and maps Photos Videos Act 2 Horoscopes Advice Columns Lottery Long Island Sports Entertainment Lifestyle News Business Health Opinion Obituaries Cars Homes Jobs MoviesEntertainment Repo Men takes on health care Updated March 19 2010 1201 AM By RAFER GUZMAN rafer.guzmannewsday.com + - advertisement | advertise on newsday REVIEW PLOT In the near future an artificial organ company decides not to tolerate late payments. BOTTOM LINE Surprisingly engrossing with an emphasis on the gross. CAST Jude Law Forest Whitaker Alice Braga Liev Schreiber LENGTH 151 Up in the ranks of big-time filmmaking the war in Iraq is the big issue See the Oscar-winning ""The Hurt Locker"" and last weeks Matt Damon vehicle ""Green Zone."" Down in the trenches of populist filmmaking - horror action pulp - there is evident anger over another hot topic health care. ""Repo Men"" like last years ""Saw VI"" has great fun demonizing the health-care industry and contrasting its cold pragmatism with warm gore. The time is the near future and a company called The Union is selling artificial organs to folks who cant afford them (a nod for good measure to the subprime mortgage meltdown). Deadbeats beware Union contractor Remy (Jude Law) will take that organ back on the spot and without anesthesia. The premise isnt new; an oddball horror-musical called ""Repo The Genetic Opera"" came out two years ago. Still ""Repo Men"" is better and smarter than you might expect. advertisement | advertise on newsday Thats partly because of the top-notch cast. Against all odds Law makes Remy an empathetic anti-hero while Forest Whitaker nearly steals the movie as his faithful repo partner. Liev Schreiber sneers it up beautifully as a heartless Union bigwig; Alice Braga breathes a little life into a token role. First-time director Miguel Sapochnik directs with borrowed panache - youll catch glimmers of ""Blade Runner"" ""Total Recall"" David Cronenbergs ""Crash"" and even Terry Gilliams ""Brazil"" in this slightly overlong film. All in all its a darkly bloody good time and a vicarious way to take a hacksaw to your HMO. VideoTrailer Repo Men VIDEO Watch the movie trailer for ""Repo Men"" Sign up for Newsdays Entertainment newsletter Get the latest on celebs TV and more. submit Click here to read or post comments Comments Newsday.com now uses Facebook for our comment boards. Please read our guidelines and connect your Facebook account to comment. You also may be interested in More coverage The Rock is solid in Central Intelligence Like it? Share it Back to Top Services Subscribe Manage my Newsday Todays paper Join us on Facebook Join us on Twitter Sign up for newsletters Get our Apps Our Network News 12 am New York Newsday Cars The Hometown Shopper Newsday Homes CareerBuilder Optimum Newsday Connect MSG Varsity News Long Island Nassau Suffolk Education Crime Politics Towns NYC U.S. / World Business Technology Commuting History Data and Maps Traffic Obituaries Sports Giants Jets Knicks Nets Islanders Rangers Yankees Mets High school Colleges Columns Scores Videos Photo Entertainment Celebrities Movies TV Music Restaurants Theater Lifestyle Family Shopping Pets Events Travel Books Weekend Guide Beaches Classifieds Jobs Cars Real Estate Yellow Pages More Crossword Weather Photos Videos LI Life Act 2 Lottery RSS Archive Site Map Privacy Policy Your ad choices Terms of Service Subscription Terms Contact Newsday Careers Reprints amp; Permissions Media Kit Advertise with Newsday Help Copyright (c) Newsday. All rights reserved.",http://www.newsday.com/entertainment/movies/repo-men-takes-on-health-care-1.1816541,200,repomen1,repomen,newsday
"Movie Review - Repo Men - Organic Living With Just A Few Strings Attached  NPR View Navigation NPR NPR NPR Music NPR Books NPR About NPRPodcast Directory Search Toggle search NPR Home News Arts amp; Life Music Topics Programs amp; Podcasts NPR Music Genres New Music Concerts amp; Videos Articles amp; Lists Tiny Desk NPR Books Author Interviews Find Books Reviews About NPR Overview Connect Support Press Careers Podcast Directory Categories Shop Back News U.S. World Politics Business Technology Science Health Race amp; Culture Education Arts amp; Life Books Movies Pop Culture Food Art amp; Design Performing Arts Photography Music First Listen Songs We Love Music Articles Tiny Desk Videos More Our Blogs Corrections All About NPR Back News amp; Conversations Morning Edition All Things Considered Fresh Air Here amp; Now Code Switch The Diane Rehm Show Embedded Latino USA NPR Politics Podcast On Point Weekend Edition Saturday Weekend Edition Sunday Youth Radio Storytelling amp; Humor Ask Me Another The Best Of Car Talk Bullseye Hidden Brain How To Do Everything Invisibilia Only A Game Planet Money Pop Culture Happy Hour StoryCorps TED Radio Hour Wait Wait...Dont Tell Me Music First Listen All Songs Considered Songs We Love Tiny Desk Alt.Latino From The Top Jazz Night In America Metropolis Microphone Check Mountain Stage Piano Jazz The Thistle amp; Shamrock World Cafe More All Programs Podcast Directory NPR Podcasts Back Rock Pop Jazz Classical Hip-Hop Ramp;B/Soul Folk Latin World Electronic/Dance Back First Listen Songs We Love All Songs Considered Reviews Music Videos Back Tiny Desk Live Concerts Field Recordings Studio Sessions Music Documentaries Music Videos Festival Recordings Back Articles Interviews Quizzes Music Lists Best Music of the Year Back Art amp; Design Arts amp; Entertainment Biography amp; Memoir Business amp; Economy Childrens Books Comedy Comics amp; Graphic Novels Digital Culture Faith amp; Spirituality Food amp; Wine History amp; Society Historical Fiction Horror amp; Supernatural Literary Fiction Mystery amp; Thrillers Parenting amp; Families Poetry Politics amp; Public Affairs Romance Science Fiction amp; Fantasy Science amp; Health Sports Travel Young Adult Nonfiction Fiction Back Book Reviews This Weeks Must Read My Guilty Pleasure Three Books... PG-13 Risky Reads You Must Read This Summer Books Best Books of the Year Back Overview Overview and History Mission and Vision Stations and Public Media NPR Finances People Ethics Awards Back Visit NPR NPR Presents Studio 1 Events Generation Listen Book a Speaker Request Permissions Ways to Listen NPR Extra Blog Email Newsletters Shop NPR Get Help Contact Us Back Support Public Radio Corporate Sponsorship Volunteer Back Releases and Statements Photos and Logos Fact Sheet (PDF) Media Relations Contacts Back Careers at NPR Search Jobs Culture Applying Interns Fellows Digital Back Arts Business Comedy Education Games amp; Hobbies Government amp; Organizations Health Kids amp; Family Music News amp; Politics Religion amp; Spirituality Science amp; Medicine Society amp; Culture Sports amp; Recreation Technology TV amp; Film Repo Men Organic Living With Strings Attached Repo Men Organic Living With Strings Attached Facebook Twitter Google+ Email March 18 2010300 PM ET Ian Buckwalter i When The Tables Turn Jude Law plays Remy an organ repossessor who is heavily in debt after receiving his own heart transplant. Alice Braga plays Beth a fellow debtor who teaches him how to disappear from the system. Kerry Hayes hide caption toggle caption Kerry Hayes When The Tables Turn Jude Law plays Remy an organ repossessor who is heavily in debt after receiving his own heart transplant. Alice Braga plays Beth a fellow debtor who teaches him how to disappear from the system. Kerry Hayes Repo Men Director Miguel Sapochnik Genre Sci-Fi ThrillerRunning Time 111 minutes Rated R for strong bloody violence grisly images language and some sexuality/nudity.With Jude Law Forest Whitaker Liev Schreiber Alice Braga and Carice van Houten Watch Clips You Owe It To Your Family Ask Me About My Lips Predatory lending is taken to macabre new lows in Miguel Sapochniks debut feature Repo Men In a dystopian future that recalls a spruced-up version of Blade Runner an organization called The Union offers a chance at better living through technology. Though technically a health-care organization The Union operates more like a used-car dealer It drives a hard bargain on artificial organs and if you cant make your payments -- at over 19 percent interest on prices in the mid-six figures -- the movies titular enforcers will track you down zap you unconscious and cut their property back out. This may sound familiar Repo Men is actually the second film about organ repossession released in less than two years after the 2008 goth-industrial musical Repo A Genetic Opera. Theres valuable social commentary to be mined here but two movies into this budding subgenre its clear that filmmakers havent yet moved past the shock value of violently yanking bloody organs out of living human beings. Repo Men may not be as awful as its predecessor but thats the faintest of praise. Remy and Jake (Jude Law and Forest Whitaker) are two of The Unions best collectors. Remy however is having a crisis of conscience over his chosen field. Not because of any moral qualms about slicing open semi-conscious people to harvest a mechanical kidney mind you; his wife just doesnt like it when he gets home late. Theres a lot of pesky night work inherent in the job. When a freak accident makes Remy the recipient of a shiny new piece of internal hardware hes forced to reevaluate his chosen field. Unfortunately just when he most needs the cash he finds that his mechanical heart seems to have granted him more empathy toward his victims than his biological one ever did. Hes soon past due and as he becomes a target hes reduced to hiding out in the same refugee shantytowns he once delighted in raiding for a big payday. This reversal of fortune plays out without many surprises. i The Hard Sell Liev Schreiber plays Frank the smooth-talking manager of a company that markets replacement organs to the sick and the injured. hide caption toggle caption The Hard Sell Liev Schreiber plays Frank the smooth-talking manager of a company that markets replacement organs to the sick and the injured. There is a talented pool of actors wasted here; most of them sleepwalk through a script by Eric Garcia and Garrett Lerner that reduces them to one-note caricatures. In fact the films best performance is little more than a cameo -- a surprisingly touching turn from hip-hop impresario RZA as a debt-ridden music producer who is delinquent on his artificial heart payments. But while his one scene opens the door for a larger role the character disappears as quickly as he arrives. Almost any film can benefit from a little more RZA but Repo Men fails to take full advantage of his presence. Sapochnik a veteran of motion-picture art departments seems more interested in finding new and exciting ways for blood to seep splatter and spurt than in telling a compelling story. He attempts to distract from the shortcomings by filling his movie with an endless string of tributes to better films the iconic hallway fight scene in the ultraviolent Korean classic Oldboy and the shot of adrenaline to the heart from Pulp Fiction among them. But the overused homages and a tacked-on twist ending are just failed attempts to save Repo Men from its own shallow blood lust. Facebook Twitter Google+ Email More Stories From NPR Politics 5 Takeaways From The Democratic National Convention News County Sheriff Hot Air Balloon Crashes In Central Texas No Apparent Survivors Politics Pitching A Clintonville Protest During The Democratic Convention Music Come Together (Or Not) Music At The Democratic National Convention More Stories Comments You must be signed in to leave a comment. Sign In / Register Please keep your community civil. All comments must follow the NPR.org Community rules and Terms of Use. NPR reserves the right to use the comments we receive in whole or in part and to use the commenters name and location in any medium. See also the Terms of Use Privacy Policy and Community FAQ. Please enable JavaScript to view the <a href=""http//disqus.com/?ref_noscript"">comments powered by Disqus.</a> NPR thanks our sponsorsBecome an NPR sponsor News U.S. World Politics Business Technology Science Health Race amp; Culture Education Arts amp; Life Books Movies Pop Culture Food Art amp; Design Performing Arts Photography Music First Listen Songs We Love Music Articles Tiny Desk Videos Programs About NPR Overview NPR Finances People at NPR Support NPR Visit NPR Press Room NPR Extra Blog Careers at NPR Corrections NPR Ombudsman Permissions Help Contact Terms of Use Privacy Sponsorship Choices Text-Only",http://www.npr.org/templates/story/story.php?storyId=124781277,200,repomen2,repomen,npr
Repo Men (2010) directed by Miguel Sapochnik | Film review Go to the content Go to the footer Time Out London London Popular cities London New York Paris Chicago Los Angeles Browse all cities Time Out London Close London Change city London Popular cities London New York Paris Chicago Los Angeles Browse all cities Tickets Offers Things to Do Restaurants Bars amp; Pubs Film Theatre Art Music Attractions Blog Theatre Tickets Shopping Offer of the Day Time Out Card Time Out Escapes Time Out Live Hotels Nightlife Music festivals Events amp; Festivals Kids Museums Clubs Comedy Food amp; Drink Classical Music amp; Opera Dance LGBT City Guide Area Guides Property Competitions Dating Close My Time Out Things I love My lists My Profile My Account Sign out Sign in Create account Sign in With your social account Or with your email Email Password Remember me Forgotten your password? Sign in You can create a Time Out account in two ways... With a few clicks using your favourite social network Or by entering your details below Email First Name Last Name Create password Repeat new password I accept Time Outs terms of use including opt-in to newsletters. Create account Welcome  You have successfully connected your account to Time Out. You may sign in with this account in future. Please confirm your account details Email First Name Last Name I accept Time Outs terms of use including opt-in to newsletters. Sign up My Account Sign in or Create account Search Tickets Offers Things to Do Restaurants Bars amp; Pubs Film Theatre Art Music Attractions Blog Theatre Tickets Shopping Offer of the Day Time Out Card Time Out Escapes Time Out Live Hotels Nightlife Music festivals Events amp; Festivals Kids Museums Clubs Comedy Food amp; Drink Classical Music amp; Opera Dance LGBT City Guide Area Guides Property Competitions Dating More Search Repo Men Film  Action and adventure 1 out of 5 stars 2 out of 5 stars (3 user reviews) 0 Love It Save it 3 Add review 0 Love It Save it Time Out says 1 out of 5 stars Details Users say (3) 2 out of 5 stars Time Out says 1 out of 5 stars So whos playing the Emilio Estevez role? Jude Law? Forget it - this nasty non-thriller shares nothing but a similar title with Alex Coxs nutty 1984 head trip through LA and mores the pity. Here were in that gone-to-pot near-future so beloved of filmmakers where Law and Whitaker (pictured) are pals and colleagues working in a debt-recovery department with a difference they recover human organs. The film pitches friend against friend as Law ends up with a new ticker and darts about town with fellow post-op target Alice Braga in tow. Ideas excitement and logic are ditched in favour of blood and gore - and theres no fun to be had watching operations and knife fights. Law and Whitaker are disastrous in the lead roles. Its a dreary and violent film that betrays its three years spent on the shelf. By Dave Calhoun Posted Tuesday April 13 2010 Details Release details Rated 18 Release date Friday April 16 2010 Duration 111 mins Cast and crew Director Miguel Sapochnik Cast Jude LawForest WhitakerAlice Braga Users say (3) 2 out of 5 stars Average User Rating1.9 / 5Rating Breakdown5 star04 star03 star12 star11 star0LiveReviews|31 person listeningSign inWrite reviewMost helpfulMost helpfulHighest ratingLowest ratingNewestOldestLoadingundefinedNew CommentsRefreshApr 17 2011John CooperFeaturedNot many films begin with a foray into the mysteries of quantum physics with Jude Law giving a laymans version ofthe famous ` Schrodingers Cat` paradox. Unfortunately its downhill after that after Jude Laws ruthless repo man persona supposedly develops a conscience and embarks on a mission for the good of mankind which one has to say is not particularly successful as it ends in the gory death of large number of ` mankind` . . . No doubt the producers decided to go for a target audience of 12 year old boys with an18 certificate .( DVD sales should do well) A dis appointing film in which its difficult to summon up any sympathy for the unbelievable characters. Jude Law and Forest Whitakker do their best but theyre up against it with a screenplay which fails to deliver a convincing plot. Time outs rating of one star is about right.FlagShareHelpful?Yes|NoReplySep 2 2010MarleaFeaturedWhile I thought the film wasnt Citizen Kane it was worth it just for the lung outfit joke in the multistorey carpark.FlagShareHelpful?Yes|NoReplyApr 22 2010long catFeaturedNot the surreal cult classic style of Repo Man of84 but overall a decent action movie for the unsqueamish - See if with a low expectation and you may find the blood and brutality mildly entertaining 3 stars.FlagShareHelpful?Yes|NoReplyShow More Share Tweet 0 Shares Top About us Work for Time Out Privacy policy Cookie Policy Website terms of use Contact us Time Out for business Get listed Claim your listing Premium Profiles Advertising Time Out products Time Out Card Mobile apps Time Out Shop Time Out Guides Time Out Travel Time Out Offers Time Out Worldwide Time Out magazine Where to get Time Out magazine Subscribe to Time Out magazine Manage my subscription Follow us Facebook Twitter Youtube Instagram Pinterest Spotify Time Out London Site map },http://www.timeout.com/film/reviews/88479/repo-men.html,200,repomen3,repomen,timeout
