review,link,status_code,id,movie_key,critic
"Repo Men | Reelviews Movie Reviews Out now Cher Harold Rosson Eva Green Benjamin ... Home Video Views ReelThoughts Currently in Cinema ReelViews Library Login Specials My Books Array ( [page] =gt; reelviews [view] =gt; repo-men ) Repo Men (United States/Canada 2010) March 19 2010 A movie review by James Berardinelli Repo Men feels like it was cobbled together using pieces of other often better motion pictures. I could provide a list of titles but it would be more comprehensive simply to state that if a movie is set on a less-than-optimistic future Earth some aspect of it (no matter how minor) probably makes an appearance at some point during Repo Mens nearly two hours. Still despite the familiar nature of the screenplay the direction is crisp enough to engage the attention and there are some enjoyable moments (including an orgy of bloodstained violence) sprinkled throughout. Its tough to recommend Repo Men outright but you could do worse when trolling multiplex halls. Jude Law is Remy and Forest Whitaker is Jake. Paired these two represent the dark side to the futuristic American dream. As the story opens we learn that many elements of human mortality - especially failing organs - are things of the past. But in a world without universal health care theres a price. Transplants are expensive propositions; however like cars they can be paid for on the installment plan. Those who fall behind in their payments can expect to meet the Repo Men - Remy Jake and their fellow workers. They are employed to repossess corporate property using little more than a taser and a very sharp knife. Its bloody business but a jobs a job. Things get dicey however when Remys wife (Carice van Houten) pressures him into seeking a job in sales working alongside the oily Frank (Liev Schreiber) who could sell a refrigerator to an Eskimo. While doing his final repo job Remy suffers a catastrophic accident - one that results in his awakening in a hospital bed with an artificial heart in his ribcage and an expensive debt to be paid off. Having lost his appetite for killing he soon finds himself being chased by his former colleagues with only another fugitive the lovely Beth (Alice Braga) as a companion. As envisioned by first-time feature director Miguel Sapochnik the future is not as bleak a place as one might find in Blade Runner or Brazil but its no Star Trek either. It appears to be a world where corporations rule with an iron fist. Its impossible to miss the satire or the message here. Working from a script co-written by Eric Garcia amp; Garrett Lerner (and based on a novel by Garcia) Sapochnick makes a strong case for what happens when life is just another commodity to be borrowed against and he does so with a macabre sense of humor. There are times when Repo Men feels like a twisted comedy. Even the climax in which blood and gore run freely is presented with a tongue-in-cheek flavor. One problem with Repo Men is that theres not enough material to sustain a 111-minute motion picture. Theres nothing special about most of the action scenes and there are long stretches in which little happens beyond refugees fleeing from corporate enforcers. A little of this goes a long way and theres far too much of it in Repo Men. There were instances when I found myself becoming impatient for something to happen and impatience is rarely a quality I exhibit when a movie has me under its spell. The final 15-20 minutes are sprinkled with small pleasures but it takes an unnecessarily long time to get there. Theres nothing wrong with the acting and although Jude Law isnt a prototypical action hero (any more than Matt Damon was before the Bourne movies) hes a good enough performer to be convincing. Theres some nice chemistry at work here both between Law and Forest Whitaker as his partner and between Law and Alice Braga as his love interest. The connection between Law and Braga is especially effective they make love they support one another and they share knives guns and hacksaws when warranted. Liev Schreiber is delightfully distasteful proving once again that his mere presence in a motion picture can ratchet up its entertainment quotient. Based on the evidence at hand in Repo Men director Sapochnik may have a solid future behind the camera. The movie looks good and the action scenes are presented with clarity and verve. Hopefully for his next project Sapochnik will have something less derivative to work with. Repo Men defeats even his best efforts to elevate it above the level of a passable diversion. Repo Men (United States/Canada 2010) Director Miguel Sapochnik Cast Jude Law Forest Whitaker Alice Braga Liev Schreiber Carice van Houten Screenplay Eric Garcia amp; Garrett Lerner based on Garcias novel The Repossession Mambo Cinematography Enrique Chediak Music Marco Beltrami U.S. Distributor Universal Pictures Run Time 151 U.S. Release Date 2010-03-19 MPAA Rating ""R"" (Violence Profanity Sexual Content Nudity) Genre SCIENCE FICTION Subtitles none Theatrical Aspect Ratio 2.351 Comments Add Comment Three...better movies of this genre Star Wars IV A New Hope (1977) Close Encounters of the Third Kind (1977) Aliens (1986) worse movies of this genre Skyline (2010) Ultraviolet (2006) Mission to Mars (2000) Three...better movies of Jude Law Gattaca (1997) Closer (2004) Hugo (2011) worse movies of Jude Law eXistenZ (0199) Breaking and Entering (2006) Holiday The (2006) Three...better movies of Forest Whitaker Platoon (1986) Crying Game The (1992) Great Debaters The (2007) worse movies of Forest Whitaker Taken 3 (2015) Species (1995) Vantage Point (2008) Three...better movies of Alice Braga Blindness (2008) Elysium (2013) (There are no more better movies of Alice Braga) worse movies of Alice Braga Redbelt (2008) Crossing Over (2009) Predators (2010) ReelViews Library Currently in Cinema Writings Fictional Writings ReelThoughts Specials About Privacy Policy Terms and Conditions Contact Website credits",http://www.reelviews.net/php_review_template.php?identifier=2043,200,repomen12,repomen,reelviews
"Repo Men? Creepo Men is more like it - USATODAY.com Cars  Auto Financing  Event Tickets  Jobs  Real Estate  Online Degrees Shopping SearchHow do I find it?Subscribe to paper Home News Travel Money Sports Life Tech Weather Life >> Movies Box Office Report Movie Listings Awards Central Shop for Movies/DVDs Repo Men? Creepo Men is more like it Updated  | Comment  | Recommend E-mail | Print | Enlarge By Kerry Hayes Universal Studios Give the boys a hand Jude Law and Forest Whitaker repossess artificial limbs. ABOUT THE MOVIERepo Men  1/2 out of four Stars Jude Law Forest Whitaker Alice Braga Liev SchreiberDirector Miguel SapochnikDistributor Universal StudiosRating R for strong bloody violence grisly images language and some sexuality/nudityRunning time 1 hour 51 minutesOpens Friday nationwide By Claudia Puig USA TODAY A job is a job. Or so its said -- at least five times in the nasty hackfest that is Repo Men. Hacking is front and center in this tale of skilled tough guys who viciously ""repossess"" artificial body parts when their owners get behind on payments. TRAILER Sneak a peek at Repo Men Theres a whole lot of slicing and dicing by knife scissor saw ax and sundry other implements. Director Michael Sapochnik and screenwriters Erik Garcia and Garrett Lerner have cobbled together this blood-drenched futuristic thriller from a host of more inventive sources Blade Runner Gattaca Repo; the Genetic Opera and even David Cronenbergs 1996 collision-injury creepfest Crash. Nothing about this movie seems original or fresh -- including the repurposed mechanical body parts. Worse the storys internal logic lacks coherence and structure. The Union the company that manufactures and markets these synthetic body parts takes them back by force -- usually killing the patient in the process -- if payments are past due for 90 days. But of what use to this rapacious corporation are extracted fake body parts presumably fitted to personal specifications? And more important what good are dead people for the bottom line? Corporations are all about profits not vengeance. The whole premise is ridiculous. Why good actors like Forest Whitaker and Liev Schreiber have taken major roles in this wrongheaded effort is perhaps the most compelling question posed by this film. Jude Law plays a cheerily efficient and dedicated repo man named Remy. He has a change of heart when he wakes up from a coma to find he has been fitted with a changed heart. Remy has a wife and child and an evolving conscience but hes so casually vicious for most of the movie that its hard to care a jot about what happens to him. Just why so many young middle-aged and seemingly healthy people need transplants and artificial body parts is never fully explained. And squeamish types be warned Sitting through this movie is worse than being locked in a room with a continuous loop of Nip/Tuck playing on a jumbo screen. Posted Updated E-mail | Print | To report corrections and clarifications contact Standards Editor Brent Jones. For publication consideration in the newspaper send comments to lettersusatoday.com. Include name phone number city and state for verification. To view our corrections go to corrections.usatoday.com. Guidelines You share in the USA TODAY community so please keep your comments smart and civil. Dont attack other readers personally and keep your language decent. Use the ""Report Abuse"" button to make a difference. Read more. Newspaper Home Delivery - Subscribe Today Home  News  Travel  Money  Sports  Life  Tech  Weather About USATODAY.com Site Map | FAQ | Contact Us | Jobs with Us | Terms of Service Privacy Policy/Your California Privacy Right | Advertise | Press Room | Developer | Media Lounge | Reprints and Permissions News Your Way Mobile News | Email News | Add USATODAY.com RSS feeds | Twitter | Podcasts | Widgets Partners USA WEEKEND | Sports Weekly | Education | Space.com | Travel Tips Copyright 2011 USA TODAY a division of Gannett Co. Inc.",http://www.usatoday.com/life/movies/reviews/2010-03-19-repomen19_ST_N.htm,200,repomen13,repomen,usatoday
"Review Rep Men not quite what doctor ordered - SFGate Subscribe Sign In Home Contact SFGate Contact SFGate Customer Support Submissions amp; Tips Classifieds About SFGate About SFGate FAQ Register on SFGate SFGate Newsletters SFGate Staff Careers Site Index Hearst About The Chronicle About The Chronicle The Chronicle Staff Become a Subscriber Manage Your Subscription Customer Service Careers e-edition Back Copies Chronicle in Education Corrections Advertise with Us More on Advertising More on Advertising Place a Classified Ad About Our Ads Public Notices Local Business Directory Place an Obituary Gate List Store Privacy policy Privacy policy Ad Choices Chronicle Archives Terms of Use Newsletters Get news alerts SFGate Customer support Get VIP access with SF Chronicle Membership Get SFGate newsletters for the latest from the Bay Check out the Top 100 Bay Area restaurants News Bay Area amp; State Traffic Nation World Politics Crime Election Results Obituaries Tech Health Education Video News Blogs Coast Guard searching delta region for three missing people Fire in Big Sur area grows 15 percent contained Little shaker 2.7-magnitude earthquake rattles Bay Area 2 men held after 2 San Diego officers shot 1 fatally Sports 49ers Raiders Giants As Olympics Warriors Sports Blogs Sports Calendar MLB NBA College Preps Golf Outdoors Raiders GM McKenzie gets 4-year extension Cal football position preview Linebacker How low can Giants go? Latest loss comes with a triple play Rich Hills blister problem As success muddle trade outlook Business Technology Mortgage Rates Home Guides Public Notices Sponsored Content Office Space The Tech Chronicles Net Worth Plus Fossils amp; Photons Mind Your Business VisionSF Jobs Price Point 649000 in San Bruno ICYMI Can Chipotle be a burger king? Redstones potential Victorian duplex in SOMA open Sunday Three bedroom apartment in San Franciscos Financial District Entertainment The Daily Dish Movies Music amp; Nightlife Performance Art Blogs Videos Events Puzzles TV Horoscope Comics Crosswords amp; Puzzles Things To Do Jason Bourne is a shaky smeary mess The latest from Dear Abby ""Bad Moms"" mixes sentiment with raunch and ends up vulgar Phantom Boy is fast-paced but slight animated fun Food Restaurants Wine Top 100 Restaurants Chronicle Wine Competition Reservations Beer News Inside Scoop SF Healthy Eating Angele Chef shuffle at Napa French restaurant Napa blockbuster Ninebark is closing (temporarily) Check out the food (and menu) at Black Cat now open in the Lights go out at La Rondalla longtime Mission dining spot Living Home amp; Garden Style Parties Lust LGBT Mommy Files amp; Parenting Houzz Outdoors Blogs Sponsored Schools Camps amp; Activities Exploring night photography locations in the Bay Area Couple from different cultures find love is a common ground Heres the most popular video game from the year you were born More Crystal Basin campsites are available with start of Olympics Travel Destination BC Exotic Destinations Monterey-Carmel Weekend Getaways Wine Country Napa Reno-Tahoe Hawaii Caves offer older view of the Continent Traveling to Big Sur? What you need to know Suite Spot Ritz-Carlton Philadelphia Rick Steves Europe Drink in a city through cafe culture Real Estate New Homes Open Homes Luxury Rentals Mortgage Rates Commercial Place an ad Home Guides Home Sales On the Block Blog Hot Property Sebastopol Italianate estate enjoys ocean views How much space do you get for 1500 a month? Hillcrest Estate possibly owned by baseball Hall of Famer Joe Cars Dealers Click and Clack Car Blog My Ride Sell Your Car First Buick ragtop since the 91 Reatta A cherished Nash-Healey Roadster Past Phantom still turning heads Teslas Model S can be used as a boat in a pinch Jobs Job Events Advertise Salary Wizard Get To Work Consider the red flags when staying in a job you dislike Declutter your job search The job gap explanation How to impress an interviewer with non-verbal language Findamp;Save Chronicle Latest columns Michael Bauer Leah Garchik Bruce Jenkins Esther Mobley Ann Killion Thomas Lee Matier amp; Ross C.W Nevius Kathleen Pender Scott Ostler Special Report Forgotten Survivors of AIDS The ultimate NorCal brewery map Top 100 Restaurants Warriors show their style off the court MenuSections http//www.sfgate.com/movies/article/Review-Rep-Men-not-quite-what-doctor-ordered-3195472.php Review Rep Men not quite what doctor ordered By Mick LaSalle Published 400 am Friday March 19 2010 Watch the trailer for the movie ""Repo Men."" Media San Francisco Chronicle Repo Men Science fiction. Starring Jude Law Forest Whitaker and Alice Braga. Directed by Miguel Sapochnik. (R. 111 minutes. At Bay Area theaters.) Theres a good idea behind ""Repo Men"" not a whole lot of thinking but at least one whole idea. The filmmakers take two notions - that health care is a commodity like anything else and that the health industry has a right to make as much money as the market will bear - and they fashion a nightmare scenario in which those notions are extended to their logical conclusion. The result is a new subgenre for our time health care sci-fi horror. The problem is that as directed by Miguel Sapochnik that fairly interesting little idea ends up in a shotgun marriage with a whole host of action-movie conventions that are either ugly or tired. ""Repo Men"" sets up and puts into motion an attention-grabbing premise and then for the most part just goes to typical places with it. Perhaps its a failure of imagination or perhaps the movie promised more than it ever intended to deliver but a lot of ""Repo Men"" feels like filler - not boring but manufactured with emotions and relationships that are never false but concocted. So the glass is either half full or half empty ""Repo Men"" is either a serious sci-fi film not as smart as it should be or a dumb action movie thats a lot smarter than it had to be. Either way theres something to be said for the world it creates. In the near future synthetic organs will be perfected but if you need a new pancreas it will cost you more than 600000 etc. Photo Kerry Hayes AP Image 1of/3 CaptionClose Image 1 of 3 In this publicity image released by Universal Pictures Alice Braga is shown in a scene from ""Repo Men"". In this publicity image released by Universal Pictures Alice Braga is shown in a scene from ""Repo Men"". Photo Kerry Hayes AP Image 2 of 3 (L to R) Frank (LIEV SCHREIBER) and his enforcer Jake (FOREST WHITAKER) in ?Repo Men? a futuristic action-thriller set in a world where artificial organs are available to anyone willing to take the financial risk. less (L to R) Frank (LIEV SCHREIBER) and his enforcer Jake (FOREST WHITAKER) in ?Repo Men? a futuristic action-thriller set in a world where artificial organs are available to anyone willing to take the financial ... more Photo Kerry Hayes Universal Studios Image 3 of 3 (L to R) Jake (FOREST WHITAKER) and Remy (JUDE LAW) in ?Repo Men? a futuristic action-thriller set in a world where artificial organs are available to anyone willing to take the financial risk. (L to R) Jake (FOREST WHITAKER) and Remy (JUDE LAW) in ?Repo Men? a futuristic action-thriller set in a world where artificial organs are available to anyone willing to take the financial risk. Photo Kerry Hayes Universal Studios Review Rep Men not quite what doctor ordered 1 / 3 Back to Gallery Of course no business could survive just doing cash sales in such high amounts. Installment plans are necessary to woo middle-income customers. But what happens if someone has an artificial heart installed for example and then decides not to make the payments? Thats where the Repo Men come in. Before the credits even roll Jude Law shows up shoots a delinquent heart patient with a stun gun cuts open his chest and reclaims the synthetic organ. In almost every case (an exception is when theyre only reclaiming one kidney) the repossession results in death but such is the cleverness of the initial scenes that the viewer feels the impulse to get with the spirit anyway and to root for the Repo Men. In one instance Forest Whitaker as Laws partner makes the case that the Repo Men actually save lives by enforcing payments in a life-extending system that would otherwise crash. Later Liev Schreiber as Laws boss echoes this line. Their arguments wont convince most viewers but they sound like arguments that could at least convince somebody. But as much as the movie is about these ideas ""Repo Men"" is even more about the splatter of blood against the wall and a knife through a guys throat about street fights and repeated graphic and often agonizing scenes of knives slowly cutting into flesh. Give Alice Braga credit. When Jude Law reaches into her stomach cavity looking for artificial organs you will believe by the expression on her face that the anesthetic is definitely not working. But at that point the audience will be in pain too. -- Advisory This film contains graphic fights and excruciating scenes of grotesque medical procedures. Most Popular 1 Dear Abby I want to contact mistress from 45 years ago 2 Cops Son of billionaire former supermodel arrested after... 3 Ann Coulter Hammered by Conservatives for Smearing US War... 4 Dear Abby I dont want anyone to know that Ive retired 5 Iceland man says Donald Trumps son left white powder at... 6 Oakland-bound medical plane crashes -- 4 killed 7 Inmate charged in 2015 quadruple slaying in S.F. 8 Police Girl 14 slits teens throat in hope of first kill 9 33 signs youre living in the San Francisco bubble 10 San Francisco ranks surprisingly low on the list of 20 Most... Find Showtimes Search Theaters amp; Showtimes -- County -- Alameda Contra Costa Lake Marin Napa San Francisco San Mateo Santa Clara Solano Sonoma Show Movies Now Playing | Recent Releases | Critics Favorites Rated G | PG | PG-13 | R Latest News Coast Guard searching delta region for three missing people Officials believe no survivors in Texas hot air balloon crash Outrage caution from Latino stars in critical election year Little shake 2.7-magnitude earthquake rattles Bay Area Philippine president calls off truce after rebel attack Ann Coulter slammed for calling war heros dad angry Muslim Inmate charged in 2015 quadruple slaying in S.F. Man Trumps son left white powder at rental paid women Parilia Amusement Ball in San Francisco early days View Comments (c) 2016 Hearst Communications Inc. Logo Return to Top About Our Company Careers Advertising Ad Choices Terms amp; Conditions Privacy Policy Your California Privacy Rights Contact Customer Service Newsroom Contacts Connect Facebook Twitter Pinterest Google Instagram Subscribe SFChronicle.com App e-edition The Chronicle Archives Subscription Offers Member Services Hearst Newspapers (c) Copyright Hearst Communications Inc.",http://www.sfgate.com/cgi-bin/article.cgi?f=/c/a/2010/03/18/MV9T1CH701.DTL,200,repomen14,repomen,sfgate
"Movie review Repo Men - latimes Advertisement YOU ARE HERE LAT Home-Collections-MovieMOVIE REVIEW Movie review Repo MenThe futuristic thriller starring Jude Law and Forest Whitaker has its own debt to pay as it borrows heavily from similar and better films.March 19 2010|By Robert Abele Plenty of interior body parts are forcibly removed from reluctant humans in the violent futuristic action film ""Repo Men."" Kidneys hearts livers all high-tech and artificial are taken out and in the movies cautionary premise rented to the medically needy at usury-friendly rates by a nasty corporation called the Union. But theres a key organ missing from the movie itself a brain. In its place is a memory bank of other better movies. Thats a shame because creeping around the edges of ""Repo Men"" is the potential for a funky and prescient piece of gory dystopian satire. For starters its got three game male leads Jude Law as Remy one of the titular enforcers a blue-collar Everyhunk whose task -- if youre a customer overdue on payments -- is to slit you up a treat and retrieve that expensive biomedical breakthrough inside that you thought was prolonging your life; Forest Whitaker as his prankish colleague whod love nothing more than to be a repo forever; and Liev Schreiber as their oily always-be-closing boss the Unions top salesman. When Remy estranged from his wife (a scowling Carice Van Houten) and kid gets hurt on the job and wakes up sporting his own pricey Union ticker and a crushing debt he experiences -- wink wink -- a change of heart about his mean bloody job. Knowing what the day of collecting means Remy and a nightclub singer (Alice Braga) with a hot bod of black-market parts decide they must fight to foreclose on the system instead. But where screenwriters Eric Garcia (adapting his own novel) and Garrett Lerner start off with a nifty sci-fi hybrid of headline-conscious concerns about where subprime blues privacy woes biotechnology and unconscionable healthcare are taking us they and director Miguel Sapochnik would ultimately rather sell you a loud and ludicrous tour of genre references. It starts with John Cleeses ""Can we have your liver then?"" from ""Monty Pythons The Meaning of Life"" and barrels through ""Blade Runner"" (production design) ""Logans Run"" (fugitive scenario) ""Coma"" (all-white room reveal) ""Brazil"" (everything) David Cronenbergs ""Crash"" (dont ask) and even a sub-Tarantino attempt to re-create the virtuoso corridor melee from ""Old Boy."" It takes a more skillful hand than Sapochniks to mix cinematic homage thrills and thematic fluidity -- think ""Minority Report"" or ""Children of Men"" -- which leaves ""Repo Men"" feeling like its own desperate case of debt obligation. calendarlatimes.com MORESeizure Led to FloJos DeathHis 104 scores make his caseRestaurant review South Beverly GrillBrutal Murder by Teen-Age Girls Adds to Britons ShockComaneci Confirms Suicide Attempt Magazine SaysAdvertisement FROM THE ARCHIVESForest Whitaker says the message hooked him to Repo MenMarch 18 2010MOVIE REVIEW  Family Business A Mafia Empire With a...November 13 1987MORE STORIES ABOUTMovieEntertainmentDebtRemyCopyright 2016 Los Angeles TimesTerms of Service|Privacy Policy|Index by Date|Index by Keyword","http://www.latimes.com/entertainment/news/la-et-repo19-2010mar19,0,5897214.story",200,repomen15,repomen,latimes
