review,link,status_code,id,movie_key,critic
"Rocket Science Stutterer plots revenge (with words) - SFGate Subscribe Sign In Home Contact SFGate Contact SFGate Customer Support Submissions amp; Tips Classifieds About SFGate About SFGate FAQ Register on SFGate SFGate Newsletters SFGate Staff Careers Site Index Hearst About The Chronicle About The Chronicle The Chronicle Staff Become a Subscriber Manage Your Subscription Customer Service Careers e-edition Back Copies Chronicle in Education Corrections Advertise with Us More on Advertising More on Advertising Place a Classified Ad About Our Ads Public Notices Local Business Directory Place an Obituary Gate List Store Privacy policy Privacy policy Ad Choices Chronicle Archives Terms of Use Newsletters Get news alerts SFGate Customer support Get VIP access with SF Chronicle Membership Get SFGate newsletters for the latest from the Bay Check out the Top 100 Bay Area restaurants News Bay Area amp; State Traffic Nation World Politics Crime Election Results Obituaries Tech Health Education Video News Blogs 3 missing overnight in delta are rescued Fire in Big Sur area grows 15 percent contained Little shaker 2.7-magnitude earthquake rattles Bay Area 2 men held after 2 San Diego officers shot 1 fatally Sports 49ers Raiders Giants As Olympics Warriors Sports Blogs Sports Calendar MLB NBA College Preps Golf Outdoors Giants moves Pence in Pena out Crawford and Span out of lineup Raiders GM McKenzie gets 4-year extension Cal football position preview Linebacker How low can Giants go? Latest loss comes with a triple play Business Technology Mortgage Rates Home Guides Public Notices Sponsored Content Office Space The Tech Chronicles Net Worth Plus Fossils amp; Photons Mind Your Business VisionSF Jobs Price Point 649000 in San Bruno ICYMI Can Chipotle be a burger king? Redstones potential Victorian duplex in SOMA open Sunday Three bedroom apartment in San Franciscos Financial District Entertainment The Daily Dish Movies Music amp; Nightlife Performance Art Blogs Videos Events Puzzles TV Horoscope Comics Crosswords amp; Puzzles Things To Do Jason Bourne is a shaky smeary mess The latest from Dear Abby ""Bad Moms"" mixes sentiment with raunch and ends up vulgar Phantom Boy is fast-paced but slight animated fun Food Restaurants Wine Top 100 Restaurants Chronicle Wine Competition Reservations Beer News Inside Scoop SF Healthy Eating Angele Chef shuffle at Napa French restaurant Napa blockbuster Ninebark is closing (temporarily) Check out the food (and menu) at Black Cat now open in the Lights go out at La Rondalla longtime Mission dining spot Living Home amp; Garden Style Parties Lust LGBT Mommy Files amp; Parenting Houzz Outdoors Blogs Sponsored Schools Camps amp; Activities Exploring night photography locations in the Bay Area Couple from different cultures find love is a common ground Heres the most popular video game from the year you were born More Crystal Basin campsites are available with start of Olympics Travel Destination BC Exotic Destinations Monterey-Carmel Weekend Getaways Wine Country Napa Reno-Tahoe Hawaii Caves offer older view of the Continent Traveling to Big Sur? What you need to know Suite Spot Ritz-Carlton Philadelphia Rick Steves Europe Drink in a city through cafe culture Real Estate New Homes Open Homes Luxury Rentals Mortgage Rates Commercial Place an ad Home Guides Home Sales On the Block Blog Hot Property Sebastopol Italianate estate enjoys ocean views How much space do you get for 1500 a month? Hillcrest Estate possibly owned by baseball Hall of Famer Joe Cars Dealers Click and Clack Car Blog My Ride Sell Your Car First Buick ragtop since the 91 Reatta A cherished Nash-Healey Roadster Past Phantom still turning heads Teslas Model S can be used as a boat in a pinch Jobs Job Events Advertise Salary Wizard Get To Work Consider the red flags when staying in a job you dislike Declutter your job search The job gap explanation How to impress an interviewer with non-verbal language Findamp;Save Chronicle Latest columns Michael Bauer Leah Garchik Bruce Jenkins Esther Mobley Ann Killion Thomas Lee Matier amp; Ross C.W Nevius Kathleen Pender Scott Ostler Special Report Forgotten Survivors of AIDS The ultimate NorCal brewery map Top 100 Restaurants Warriors show their style off the court MenuSections http//www.sfgate.com/movies/article/Rocket-Science-Stutterer-plots-revenge-with-2511502.php Rocket Science Stutterer plots revenge (with words) By Peter Hartlaub Published 400 am Thursday August 9 2007 Photo Picturehouse Entertainment 2007 Image 1of/2 CaptionClose Image 1 of 2 Reece Thompson in ""Rocket Science."" Ran on 02-04-2007 amp;quo;Rocket Scienceamp;quo; Reece Thompson plays a stutterer who joins the debate team and sings his arguments. Ran on 08-05-2007 Reece Thompson plays a high school debate team member who stutters in Jeffrey Blitzs amp;quo;Rocket Science.amp;quo; Ran on 08-10-2007 Reece Daniel Thompson (left) plays a smart but struggling student in amp;quo;Rocket Science.amp;quo; Ran on 08-10-2007 less Reece Thompson in ""Rocket Science."" Ran on 02-04-2007 amp;quo;Rocket Scienceamp;quo; Reece Thompson plays a stutterer who joins the debate team and sings his arguments. Ran on 08-05-2007 Reece Thompson plays a ... more Photo Picturehouse Entertainment 2007 Image 2 of 2 Reece Thompson and Anna Kendrick in ""Rocket Science"" Jeffrey Blitzs teen angst comedy opening Friday. Reece Thompson and Anna Kendrick in ""Rocket Science"" Jeffrey Blitzs teen angst comedy opening Friday. Photo Jim Bridges Rocket Science Stutterer plots revenge (with words) 1 / 2 Back to Gallery Rocket Science Drama. Starring Reece Daniel Thompson Anna Kendrick Nicholas DAgosto and Vincent Piazza. Directed by Jeffrey Blitz. (R. 101 minutes. At Bay Area theaters.) Hal Hefner isnt troubled by physically abusive parents nerd-hating jocks or a town preacher who wants to ban dancing within the city limits. Hes living through an even worse high school hell roaming from home to class in near invisibility - gaining notice only when his stuttering provides amusement for his apathetic classmates. ""Rocket Science"" has the makings of either a tragedy or a crowd-pleasing underdog story but writer-director Jeffrey Blitz instead takes the movie on a different and ultimately more rewarding direction. At various times the movie seems to be a study of high school debating a treatise on love and a ""My Bodyguard""-style triumph by the weak over the strong. But every time Blitz settles on a conventional path his film takes a sharp U-turn back into harsh reality. Above all its a story about the role of vengeance in art and commerce. Has anyone ever doubted that the success of Bill Gates George Lucas Roger Ebert and Stephen King was fueled at least in part by thoughts of revenge against their high school tormenters? Blitz who directed the spelling bee documentary ""Spellbound"" seems to have serious issues concerning his own adolescence and hes working them out with this movie. How else to explain the amusing and often bizarrely accurate details in each main character played convincingly by a roster of excellent young actors? Reece Thompson is Hal a struggling runt of a student who might be hanging out with the smart kids if it werent for the stutter that keeps his quick wit from surfacing. Hal is not too far off from the Robert De Niro character in ""Awakenings."" His life is a walking coma as he struggles - and consistently fails - with tasks as simple as choosing pizza over fish in the school cafeteria. Hal is set free from his seclusion by the schools fast-talking top debater Ginny (Anna Kendrick) who sees something in him that can help her win the New Jersey state debating championships - which she would have taken the previous year if her brilliant partner (Nicholas DAgosto) didnt experience an epic meltdown. The resulting twists and turns are funny and almost always cruel. It might be a good idea to watch a few episodes of ""Curb Your Enthusiasm"" or the British version of ""The Office"" to get in the ""Rocket Science"" mind-set. This is a movie where the protagonist is made to suffer from beginning to end. Its important to know that going in because the story elements that make ""Rocket Science"" unique will also be frustrating for moviegoers who prefer tidy endings. Throughout the movie Blitz constantly nudges his audience in the direction of an inspirational crowd-pleaser story only to yell ""Psyche"" right before a pivotal scene. (Imagine if E.T. got a fatal illness from Reeses Pieces or if ""Rocky"" ended with the Italian Stallion falling in the bathtub and forfeiting the big fight.) As for this movies finish think what would have happened if John Sayles not John Hughes had written the final 20 minutes of ""Sixteen Candles."" But even when Blitz strays from his apparent mission the characters all hit their mark thanks to a script that never fails to present an unexpected scenario - usually accompanied by a moment or two of hilarity. The supporting characters have a ""Napoleon Dynamite"" quality that suggests an alternative reality whether youre watching Hals sociopathic brother or the conservative-looking older couple who practice the Kama Sutra and play Violent Femmes duets on the cello and piano. There are also scenes that might remind you of ""Garden State"" and particularly Alexander Paynes ""Election."" Ultimately though comparisons to other movies are kind of pointless with ""Rocket Science."" This is Blitzs unique creation and it will be exciting to see what he comes up with next. -- Advisory ""Rocket Science"" contains profanity mild sexual content and disturbing images of extremely unappetizing cafeteria food. Most Popular 1 Dear Abby I want to contact mistress from 45 years ago 2 Cops Son of billionaire former supermodel arrested after... 3 Ann Coulter Hammered by Conservatives for Smearing US War... 4 Dear Abby I dont want anyone to know that Ive retired 5 Iceland man says Donald Trumps son left white powder at... 6 Oakland-bound medical plane crashes -- 4 killed 7 Inmate charged in 2015 quadruple slaying in S.F. 8 Police Girl 14 slits teens throat in hope of first kill 9 33 signs youre living in the San Francisco bubble 10 San Francisco ranks surprisingly low on the list of 20 Most... Find Showtimes Search Theaters amp; Showtimes -- County -- Alameda Contra Costa Lake Marin Napa San Francisco San Mateo Santa Clara Solano Sonoma Show Movies Now Playing | Recent Releases | Critics Favorites Rated G | PG | PG-13 | R Latest News 3 missing overnight in delta are rescued Officials believe no survivors in Texas hot air balloon crash Outrage caution from Latino stars in critical election year Little shake 2.7-magnitude earthquake rattles Bay Area Philippine president calls off truce after rebel attack Ann Coulter slammed for calling war heros dad angry Muslim Inmate charged in 2015 quadruple slaying in S.F. Man Trumps son left white powder at rental paid women Parilia Amusement Ball in San Francisco early days View Comments (c) 2016 Hearst Communications Inc. Logo Return to Top About Our Company Careers Advertising Ad Choices Terms amp; Conditions Privacy Policy Your California Privacy Rights Contact Customer Service Newsroom Contacts Connect Facebook Twitter Pinterest Google Instagram Subscribe SFChronicle.com App e-edition The Chronicle Archives Subscription Offers Member Services Hearst Newspapers (c) Copyright Hearst Communications Inc.",http://sfgate.com/cgi-bin/article.cgi?file=/c/a/2007/08/10/DD2QRF371.DTL&type=movies,200,rocketscience17,rocketscience,com/cgi-bin/article
"No debating its a class act - NY Daily News Trending DEMOCRATIC NATIONAL CONVENTION HILLARY CLINTON KESHIA KNIGHT PULLIAM MICHAEL JORDAN DONALD TRUMP Sections Sections Home New York NYC Crime Bronx Brooklyn Manhattan Queens Education Weather Obituaries Sports Yankees Mets Giants Jets Knicks Nets Rangers Islanders Football Basketball Baseball Hockey Soccer College High School The Score More Sports News Crime U.S. World Politics Entertainment Gossip Games Entertainment Pics TV Movies Music Theater amp; Arts Horoscopes Daily Weekly Monthly Pet Horoscopes Lifestyle Health Homes Food Opinion Autos Buyers Guide Ratings amp; Reviews News amp; Views Photos amp; Galleries Covers Classifieds Trending DEMOCRATIC NATIONAL CONVENTION HILLARY CLINTON KESHIA KNIGHT PULLIAM MICHAEL JORDAN DONALD TRUMP entertainment Follow Us Facebook Twitter Instagram Pinterest YouTube Subscribe Follow UsNewsletter App Subscriptions Subscribe Get Our Newsletter A daily blend of the most need-to-know Daily News stories delivered right to your inbox. Sign Up Get the latest breaking news entertainment sports and more.Download Our App Subscribe to the newspaper our e-edition or both.Subscribe Select Sport Football Basketball Baseball Hockey Soccer College High School More Sports Gossip Games Entertainment Pics TV Movies Music Theater amp; Arts Share This facebook Tweet email No debating Rocket Science is a class act No debating its a class act Friday August 10 2007 400 AM facebook Tweet email Reece Thompson is stammeringly word-perfect. Friday August 10 2007 400 AM Rocket Science. Comedy-drama about a stuttering high-school boy trying out for the debate team. With Reece Thompson Anna Kendrick. Writer-director Jeffrey Blitz (148). R Language sexual content. At AMC Empire Landmark Sunshine. Jeffrey Blitzs first film was ""Spellbound"" a superb documentary following contestants in the 1999 National Spelling Bee. With ""Rocket Science"" he switches from nonfiction to fiction and from spelling contests to high-school debate. The result is equally captivating. ""Rocket Science"" follows the verbal and romantic struggles of Hal Hefner a rail-thin New Jersey teen with a stuttering problem so bad that by the time he can say the word ""pizza"" the cafeteria waitress has slapped some Sloppy Joe on his plate. Hal has other problems including a bullying older brother who addresses him by various female names parents who hate each other and a social cluelessness that has him hauling his schoolbooks around in a wheeled carry-on bag. But as played by Reece Thompson Hal is as likable a suburban kid as Beaver Cleaver and when his schools debate queen Ginny Ryerson (Anna Kendrick) improbably picks him as her new debate partner his frustration is offset by infatuation. ""Rocket Science"" is a quirky comedy-drama that gets the bulk of its humor from the well-placed non sequitur. It never seems to be going where you think it is and that includes its oddly endearing dialogue. The story is essentially one school year of preparation for the annual city debate tournament. Ginny had last years championship locked up until her partner froze in the finals. Now shes taking no chances handpicking a student she says she can mold into a debating machine. Hal is happy to accommodate though the only way he can debate without stuttering is to memorize his speech and sing it to the tune of ""The Battle Hymn of the Republic."" The real attraction for him is Ginny and his enthusiasm for this years debate theme - resolved Abstinence from sex is bad. One of the films offbeat treats is the juxtaposition of Hals stammering speech with the rapid-fire debating of Ginny and former partner Ben (Nicholas DAgosto). Hefners stutter is remarkably consistent but for level of difficulty Kendrick and DAgosto get higher marks. Join the Conversation facebook Tweet PC Richard and Son Get Daily News stories delivered to your inbox. Sign Up Follow Us Facebook Twitter Instagram Pinterest YouTube Keep in Touch Newsletter Apps Subscribe Feeds Support amp; Contact Contact Us Careers Media Kit Site Map Terms of Use Ad Choices Terms of Service Privacy Policy Daily News Covers (c) Copyright 2016 NYDailyNews.com. All rights reserved.",http://www.nydailynews.com/entertainment/movies/2007/08/10/2007-08-10_no_debating_rocket_science_is_a_class_ac.html,200,rocketscience18,rocketscience,nydailynews
"New in theaters - CSMonitor.com .nojs {displayblock;} body {margin-bottom2em;} Log In|Register Manage Profile My Saved Items Log Out World All World Africa Africa Monitor Americas Latin America Monitor Asia Pacific Asia South amp; Central Europe Middle East Global News Blog Passcode Passcode Voices Passcode Influencers Security Culture Progress Watch Security Watch People Making a Difference Change Agent Specials Africas AIDS Orphans Little Bill Clinton Hostage The Jill Carroll Story World Topics Human Trafficking Series USA All USA Politics The Monitor Breakfast Politics Voices Decoder Foreign Policy Military Justice Education Society USA Update Commentary All Commentary The Monitors View Readers Respond Upfront Blog Global Newsstand Monitor Political Cartoons A Christian Science Perspective Business All Business The Bite Tax VOX The New Economy Saving Money In Gear Paper Economy Robert Reich Guide to Giving Americas Top 50 charities in 2015 ranked by total income Energy / Environment All Energy / Environment Energy Energy Voices Technology All Technology Breakthroughs Voices Science All Science Complexity Science Notebook Culture All Culture Arts Full Frame Photoblog Music Movies Monitor Movie Guide TV Verbal Energy The Home Forum Culture Cafe Family Food Stir It Up Recipe Categories Books All Books Book Reviews Chapter amp; Verse Readers Picks Take Action All Take Action Environment Education Conflict Resolution Disaster Relief and Recovery Human Trafficking Subscribe Subscribe Give a Gift Manage Account Daily News Briefing Archive      2007 0810 New in theaters Save for later Saved A roundup of fresh releases including Rocket Science a quirky drama revolving around a high-school debate team and actress Julie Delpys derivative directorial debut 2 Days in Paris. August 10 2007 Save for later Saved New in theaters Rocket Science (R)Director Jeffrey Blitz. With Reece Daniel Anna Kendrick. (101 min.)Jeffrey Blitz who made his feature directorial debut with the acclaimed documentary ""Spellbound"" tries out his fiction chops in ""Rocket Science"" with mixed results. High-schooler Hal Hefner (Reece Daniel) is a stutterer who is dragooned into joining the debate team by the teams star member Ginny (Anna Kendrick). Hal is as geeky as Ginny is princessy and to its credit the movie doesnt try to turn them into Romeo and Juliet. Blitz captures high school atmosphere well - not an easy thing to do - but overall the movie coasts on quirkiness. Grade B - Peter Rainer Recommended Could you pass a US citizenship test? 2 Days in Paris (R) Test your knowledge Could you pass a US citizenship test? Photos of the Day Photos of the day 02/08 Director Julie Delpy. With Julie Delpy Adam Goldberg . (96 min.) Actress Julie Delpy both wrote and directed ""2 Days in Paris"" which is like an amiable knock-off of ""Before Sunrise"" and ""Before Sunset"" the two films she made opposite Ethan Hawke for director Richard Linklater. She plays a French photographer who is with her American interior designer boyfriend (Adam Goldberg) as they play out the last gasp of their relationship on a European vacation. Much of their nattery byplay seems improvised and the results are very hit and miss - inspired contretemps alternate with gabfests that seem to go on forever. Grade B - P.R.Bratz (PG)Director Sean McNamara. With Nathalia Ramos Skyler Shaye. (110 min.) Four ""best friends forever"" start high school expecting to be trendsetters but the egomaniacal and seemingly permanent student president quickly assigns them to separate social groups. Eventually they rebel determined to unite the campus in love. A lofty goal certainly but this film plays like an overproduced music video swamping message and talent alike. Grade C-- M.K. TerrellSex/nudity 3 mild instances of innuendo. Violence 2 slapstick scenes. Profanity 9 mild expressions. Cigarettes/drugs/alcohol none.Daddy Day Camp (PG)Director Fred Savage. With Cuba Gooding Jr. Paul Rae. (93 min.) Buoyed by their success at running a child-care center househusbands Charlie Hinton and Phil Ryerson (Cuba Gooding Jr. Paul Rae) decide to start a camp. Of course everything that can go wrong does. The movie on the other hand gets better as it goes along. The ""Olympiad"" contest with a neighboring camp is fun not to say original. This kinder and gentler sequel features the main characters from ""Daddy Day Care"" but with a different cast. Grade C-- M.K.T.Sex/nudity 1 mild instance of innuendo. Violence 7 scenes of comic violence. Profanity 8 mild expressions. Cigarettes/drugs/alcohol none. Next up Lolo is mildly enjoyable but meant to be funnier than it is American Hustle is 2013s best film in New York Los Angeles critics choose Gravity and Her (+video) Wiener-Dog The central dachshund is more of a linking device than a character Print/Reprints About these ads Sponsored Content by LockerDome About these ads About these ads We want to hear did we miss an angle we should have covered? Should we come back to this topic? Or just give us a rating for this story. We want to hear from you. Your name Your e-mail address Your comment Loading... Loading... Loading... Stay Current. Go Far.Discover the Monitor Difference About Contact Us Subscribe E-Readers Advertise With Us Careers Find us online Content Map Text Corrections Reprints amp; Permissions Multimedia A Christian Science Perspective (c) The Christian Science Monitor. All Rights Reserved. Terms under which this service is provided to you. Privacy Policy. Save for later Save Cancel Saved ( of items) This item has been saved to read later from any device. Access saved items through your user name at the top of the page. View Saved Items OK Failed to save You reached the limit of 20 saved items. Please visit following link to manage you saved items. View Saved Items OK Failed to save You have already saved this item. View Saved Items OK",http://www.csmonitor.com/2007/0810/p14s02-almo.html,200,rocketscience19,rocketscience,csmonitor
