review,link,status_code,id,movie_key,critic
Rocket Science | Chicago Reader Switch to the mobile version of this page. Newsletters Follow us Twitter Facebook RSS Mobile Username View Profile Edit Profile Log Out Log in Create Account The Chicago Reader News amp; Politics Music Arts amp; Culture Film Food amp; Drink Classifieds Browse News amp; Politics News amp; Politics home page Steve Bogira | Criminal Justice John Greenfield | Transportation Deanna Isaacs | Culture Ben Joravsky | Politics Michael Miner | Media Browse Music Music home page Gossip Wolf In Rotation Record roundups Leor Galil | Music Criticism Peter Margasak | Music Criticism Soundboard Concerts this week Early Warnings Concerts on horizon Browse Film Film home page J.R. Jones | Movie Reviews Index of Long Reviews Film Archive Short Reviews Now Playing Todays Showtimes Browse Arts amp; Culture Arts amp; Culture home page Tony Adler | Theater Justin Hayford | Theater Aimee Levitt | Features Brianna Wellen | Comedy Arts amp; Culture event search Browse Food amp; Drink Food amp; Drink home page Mike Sula | Restaurant Reviews Key Ingredient A chef-to-chef challenge Cocktail Challenge Bar Guide Restaurant search Browse The Bleader The Bleader blog home page Browse Classifieds Classifieds home page Real Estate Rentals Announcements Services Jobs (Monster) Place ad ad Best of Chicago Summer Guide Savage Love Straight Dope Agenda Events Locations Issues Article Archives Fun amp; Free You searched for [X]Rocket Science Start over Search for... Browse movie times Narrow Search Author Select an author Andrea Gronvall Michael Atkinson Pat Aufderheide Zbigniew Banas Barbara Scharres Angelica Jade Bastien Bill Stamets Bob Mehr Brian Thomas Peter Brunette Dave Canfield Cara Jepsen Carol Burbank Cheryl Ross Pat Chesnut Luca Cimarusti Patrick Dahl Tyler Daswick Dave Kehr Cliff Doerksen Dominick Suzanne-Mayer Don Druker Mick Dumke Marilyn Ferdinand Fred Camper Patrick Friel Chris Fujiwara Leor Galil Hank Sartin Justin Hayford Jack Helbig Henry Sheehan Tanner Howard Drew Hunt J. R. Jones J.R. Jones Jennifer Vanasco Jessica Hopper Jim Healy Jonathan Rosenbaum Joshua Katzman Josh Katzman Anthony Kaufman Kelly Kleiman Asher Klein Shelley Kraicer Shelly Kraicer Nathalie Lagerfeld Adam Langer Lawrence Bommer Lisa Alspector Eric Lutz Peter Margasak Mark Jenkins Martha Bayne Adrian Martin Tom McCormack Meredith Brody Sergio Mims Michael Miner Laura Molzahn Monica Kendrick Adam Morgan Noel Murray Noah Berlatsky Pat Graham Patrick McGavin Patrick Z. McGavin Gerald Peary Richard Pena Mark Peranson Peter Keough Leah Pickett Richard M. Porton Laura Power Quintin Miles Raymer Reece Pendleton Berenice Reynaud Ronnie Scheib Tal Rosenberg Joshua Rothkopf Joshua H. Rothkopf Martin Rubin Ryan Wenzel Ben Sachs Dan Sallitt Dmitry Samarov Ronnie Schieb David Schwartz David P. Schwartz Scott Pfeiffer Ian Simmons Alissa Simon Michael Glover Smith Patrick Somerville Laura Stempel Steve Erickson David Stewart Gwynedd Stuart Mike Sula Ted Shen Julia Thiel Ignatiy Vishnevetsky Kevin Warwick Jessica Weisberg Brianna Wellen Joel Wicklund Albert Williams Michael Wilmington Sam Worley Rating G PG PG-13 R NC-17 X NR Show only Staff Pick Staff Pick Critics Choice Critics Choice Recommended Recommended New New Agenda Agenda Free Free Slideshow Slideshow Video Video Watch on Amazon Watch on Amazon Watch on Netflix Watch on Netflix Watch on Hulu Watch on Hulu Watch on YouTube Watch on YouTube Member Picks Member Picks Other Searches Events Location Guide Member Search Movie Showtimes Movie Reviews Article Archives Issue Archives Slideshows Comments Videos Images Sorting by Name Release Date Film Search Tweet Tools Email Print Share Digg Newsvine del.icio.us Facebook Reddit Twitter Windy Citizen Add to Custom List Loading... Comments Rocket Science Recommended Five years after directing his hit documentary about spelling bees Spellbound (2002) Jeffrey Blitz returns with a high school comedy that builds on that films winning combination of academic stress and offbeat individuals. A put-upon student with a stuttering problem (Reece Thompson) is dragooned by a ferociously competitive schoolmate (Anna Kendrick) to be her partner on the debate squad and their assigned topic--teaching abstinence in public schools--proves ironic given his deep desire to get his hands on her. The heros sexual feelings are complicated by his situation at home his dad has recently moved out and been replaced by his mothers obnoxious new lover (Steve Park) and his teenage son. Quietly written and convincingly played this coming-of-age story mines its rueful laughs from a thick vein of performance anxiety in both senses of the term. R 98 min. By J.R. Jones Now Playing Sorry there are no upcoming showtimes for Rocket Science Reviews/comments Subscribe to this thread By Email Subscribing... With RSS Comment Add a review Rating Roll over stars and click to rate. Subscribe to this thread Terms of UsePrivacy PolicySubmission GuidelinesAbout The ReaderStaffReader CareersContact UsFreelancing InfoAdvertisingBack IssuesReprints Copyright (c) 2016 Sun-Times Media LLC. Powered by Foundation,http://onfilm.chicagoreader.com/movies/briefs/31954_ROCKET_SCIENCE.html,200,rocketscience6,rocketscience,chicagoreader
Rocket Science - Houston Chronicle SUBSCRIBE As low as 1.00/week Sign In Home Contact Chron About Houston Chronicle Advertise with Us Place a Classified Ad Niche Publication Ads Careers Store Privacy Policy Terms of Use Newsletters Subscribe HC Archives Mormon phrase on condom packs? Theres the rub Places every Texas kid should see before growing up 12 ways Joanna Gaines of HGTVs Fixer Upper is your spirit Things Texans secretly do but would never admit Local Neighborhoods Neighborhoods All Neighborhoods Bay Area Bellaire Cy-Fair Fort Bend Heights Katy Kingwood Memorial Pearland Spring The Woodlands Houston amp; Texas News Houston amp; Texas News Houston Texas Traffic Weather Weather Radar amp; Forecasts Houston Weather Severe Weather News Hurricane Guide Education Education K-12 Zone Blog School Report Card 2014 Politics amp; Policy Politics amp; Policy Texas Politics Chronicle Investigates Obituaries Staff amp; Reader Blogs Classifieds Columnists Opinions amp; Editorials Opinions amp; Editorials Opinion Editorials Letters to the Editor Outlook Nick Anderson Cartoons La Voz (Espanol) Texas Energy Guide Car veers off road in Baytown driver taken by Life Flight Son of former Texas Aamp;M football player faces capital murder Woman hospitalized after crash in north Houston Reports Man shoots child then turns gun on himself US amp; World US News World News Crime The Americas Politics Science amp; Environment Strange amp; Weird News Videos Video captures deputys dramatic rescue of gunshot victim kids Texas Senator Brian Birdwell finally got to meet the man who Study confirms what gun rights advocates have said for a long Warren Sapp bitten by shark during Florida Keys lobster trip Sports Texans Rockets Astros Dynamo High School Colleges UH Rice UT Aamp;M Outdoors More Sports More Sports Golf Buy Tickets Super Bowl LI DeAndre Hopkins doesnt report for training camp over contract 10 questions facing Texans at training camp Revisiting the Astros best and worst deadline deals Texans extend Rick Smiths contract Business Energy (Fuel Fix) Technology Real Estate Money Tips Business Insider Press Releases Small Business Mgmt Chron 100 Top Workplaces Sponsored Content Legal Notices Business Directory US GDP grows a weak 1.2 percent in second quarter Amazons already large distribution empire keeps expanding Ford surprises with lower 2Q profit on trouble in US China Chipotle branching out plans to open burger restaurant Aamp;E Preview Preview Alison Cook Restaurant Reviews Whine amp; Dine Top 100 Restaurants Guides to Houston Restaurants amp; Bars Music Movies Arts amp; Theater Rolling Stone Us Weekly Radar Online Horoscopes Comics amp; Games Events amp; Things To Do NEW Puzzles 20 tearjerker movies Hollywood should leave alone Meghan Trainor rocks girls night out in Woodlands Chip and Joanna Gaines are just the latest celebrities to visit Chef Randy Ruckers Bramble restaurant has closed Life Health Health The Doctors Mens Journal Live Healthy Escapes Escapes Home amp; Design Travel Style Mom Houston Luxe Life Houston Belief Food amp; Cooking Food amp; Cooking Food amp; Cooking Alison Cook Restaurant Reviews Whine amp; Dine Top 100 Restaurants Society Travel Travel Flight Tracker Texas Road Trips Travel Pets Houston Gives Weddings amp; Celebrations Sponsored Content Local backyard design inspirations thatll make you want to DIY The 50 smoothest pick-up lines in movie history 18 foods you should never feed your pet Why is everyone freaking out about this photo of two bikini-clad Jobs Advanced search Browse job categories Salary Wizard Career Rescue Careers in Engineering Salute to Nurses Work amp; Career Advice Post a Job Is that dream opportunity really a nightmare? These 25 hot jobs pay at least 100K Set a career goal for every month of 2016 The highest-paying entry-level jobs Cars Cars amp; Auto News Heidis Cars Blog New Car Search Used Car Search Certified Car Search Houston Auto Dealers The new Lincoln Navigator concept is too legit to quit Hennessey pushes a Camaro to over 200 MPH Riding the 2016 Indian Chieftain BMW turns 100 years old A look back Real Estate New Homes Second Homes Rentals Home Price Survey Mortgages Commercial Real Estate Farms amp; Ranches Senior Living Chron Homes App Private Party Ads Summer Showcase My Perfect Hous(e)ton Suburban homebuilder develops new Greater Heights neighborhood Glamorous Texas ranch with Hollywood history hits market Shipping container complex to be developed in Houston 115 Years Findamp;Save Roost MenuSections http//www.chron.com/entertainment/movies/article/Rocket-Science-1618415.php Rocket Science Botched brew of adolescent-angst cliches1halfstars Go to showtimes BRUCE WESTBROOK Copyright 2007 Houston Chronicle Published 530 am Friday August 24 2007 Photo Picturehouse Image 1of/2 CaptionClose Image 1 of 2 Reece Thompson stars as Hal Hefner a teen debate student who suffers from constant stuttering in Rocket Science. Reece Thompson stars as Hal Hefner a teen debate student who suffers from constant stuttering in Rocket Science. Photo Picturehouse Image 2 of 2 Reece Thompson and Anna Kendrick star as Hal and Ginny in Rocket Science. Reece Thompson and Anna Kendrick star as Hal and Ginny in Rocket Science. Photo Picturehouse Rocket Science 1 / 2 Back to Gallery Making a good movie may not be rocket science but it does demand a smart mix of elements. Borrowing from too many movies to count Rocket Science botches that brew in an unwieldy slew of adolescent-angst cliches. Mostly it echoes 2005s Thumbsucker almost to the point of being a remake. In each a troubled teen who has a disability and is a loner in high school is tossed onto the debate team for a shot at stepping-up redemption. For Sciences Hal Hefner (Reece Thompson) the affliction is a stutter that doesnt seem to bother anyone in a movie milieu normally marked by cruelty and ostracism. But it does hold back Hal who wants to open up enough to have cool conversations with girls -- and see where they might lead. Enter Ginny (Anna Kendrick) a fiercely driven debater whos going to be New Jerseys state champ if it kills her -- or her partner. Ginny inexplicably recruits Hal to replace gifted but burned out Ben (Nicholas DAgosto) whose film-opening diatribe is one of the best-acted scenes in recent memory. This turns out to be a problem when the film turns out to have almost nothing to do with debate -- even though the debaters topic is juicy and high-school-centric Should sexual abstinence be taught in public schools? Hal has no interest in debating this and proving anything to anyone. Hes only interested in making out with Ginny. Apart from being hotheaded and borderline violent hes a very simple guy. Yet writer-director Jeffrey Blitz tells his tale as if Hal is a new Holden Caulfield dramatizing Hals lust-denied anguish with grand but futile gestures as when he steals whiskey to get drunk or throws a cello through a window to get attention. None of this is very noteworthy about his character beyond the obvious and the mundane He is sexually anxious self-absorbed and insecure. Meet the class of 2007. Having been a stutterer who still became a champion debater Blitz had a much richer story to tell than his unworthy surrogates. Hes also shown strength shining lights on youthful ambitiousness as with his Oscar-nominated 2002 documentary Spellbound. But debate skills are far less vital here -- not when theres routine angst to be lionized to the sound of Violent Femmes tunes not when each adult must be shown as a clueless twit and not when each misfit-teen tactic from Rushmore to Napoleon Dynamite must be dug up and dusted off. Resolved The next teen-angst film should be fresher and better. If he took a timeout from self-absorption even Hal might be able to get behind that. bruce.westbrookchron.com Todays Deals Tory Burch Sale Up to 60% off + free shipping Wide-Ruled 70-Sheet Spiral-Bound Notebook 17 cents + pickup at... Apple Sale at eBay Up to 60% off + free shipping American Eagle Mens Leather Flip Flops for 12 + 7 samp;h Powered by Contests Enter to win concert tickets airfare and hotel More Entertainment News Rolling Stones Lash Out at Donald Trump (Again) Over Song Use Daveed Diggs Renee Elise Goldsberry to Leave Hamilton Broken Social Scene Working on New Album Steve Young of M/A/R/R/S Pump Up the Volume Fame Dead Calvin Harris Taylor Swift Song Co-Write Questions We Still... Andrew W.K. Celebrates Power of Partying on 50-State... In Police Violence Cases Time Works Against Justice New Marvin Gaye Doc Features Unseen Footage Garth Brooks Previews Unprecedented New Video Series Craig Morgans Son Jerry Greer Dead at 19 in Boating Accident Most Read 1 These are unsettling times that require a steady hand Thats... 2 Two coaches suspended after Texas Aamp;Ms chalk talk for women 3 Teen son accused of killing ex-Aamp;M football star and wife 4 Texas meteorologist removed from staff page after racially... 5 Reports Man shoots child then turns gun on himself 6 Why is everyone freaking out about this photo of two... 7 Number of fatalities in Texas balloon crash; toll unclear 8 Galveston officials Officer says she set out to seduce ex-... 9 Thunderstorms high winds likely to batter Houston region 10 Ex-Katy High teacher charged with improper relationship with... View Comments (c) 2016 Hearst Communications Inc. Logo Return to Top About Our Company Careers Advertise with Us Ad Choices Terms amp; Conditions Privacy Policy Your California Privacy Rights Contact Customer Service Newsroom Contacts Connect Email Newsletter Facebook Twitter Pinterest Google Instagram Subscribe iPad app HoustonChronicle.com Houston Chronicle Archives eEdition Demo Todays eEdition Hearst Newspapers (c) Copyright Hearst Newspapers LLC,http://www.chron.com/disp/story.mpl/ent/movies/reviews/5049136.html,200,rocketscience7,rocketscience,chron
Detroit NewsSUBSCRIBE NOWFOR HOME DELIVERYHomeNewsSportsBusinessAutosLife + HomeEntertainmentOpinionPhoto + VideoMoreHomeNewsSportsBusinessAutosLife + HomeEntertainmentOpinionPhoto + VideoFireflyHi Already a subscriber?Log inSubscribe today for full access on your desktop tablet and mobile device.Subscribe NowAlready a print edition subscriber but dont have a login?Activate your digital access.Manage your account settings.My AccountView the E-NewspaperManage your NewslettersView your Insider deals and moreMember ID CardLog OutFollowSearchGet the newsLog In or Subscribe to skipAlready a subscriber?Log inSubscribe today for full access on your desktop tablet and mobile device.Subscribe NowAlready a subscriber but dont have a login?Activate your digital access.TOP TRENDINGxShareOOPSThis page exists to tell you that this page doesnt exist.RETURN TO HOMENewslettersAlerts amp; RSSContact UsNewsroomSubscribeHelpAppsHomeNewsDetroitWayneOaklandMacombFlint Water CrisisMichiganMore...Nation + WorldElectionsPoliticsSportsLionsTigersRed WingsPistonsBig TenMichiganMore...Michigan StateCollegeHigh SchoolBusinessTechnologyYour MoneyAutosAuto ShowFiat ChryslerFordForeignGeneral MotorsWoodward Dream CruiseLife + HomeHomestyleFood + DrinkHealthTravelAdviceEntertainmentTV + RadioMusicStageDining + BarsArts + FestivalsCelebritiesMore...BooksMoviesOpinionColumnistsBlogsEditorialsPhoto + VideoPhoto Store (c) 2016 The Detroit News a Digital First Media Newspaper. All rights reserved. ServicesAd ChoicesAdvertise With UsAdvertising Terms and ConditionseBookseEditionSign up for Home DeliveryManage AccountMember GuidePlace an Ad in ClassifiedsPlace a Death NoticeReport a Delivery IssuePhotoStorePrivacy Notice/Your California Privacy RightsTerms of ServiceOur PartnersCareerbuilder.comCars.comHomefinder.comFindNSave.comDetroit Newspapers in EducationRenvy.comMichigan.com,http://www.detnews.com/apps/pbcs.dll/article?AID=/20070824/ENT02/708240392/1034,404,rocketscience8,rocketscience,detnews
"Debate love fury fuel ""Rocket Science"" - The Denver Post News News Latest News Colorado News Nation / World Obituaries Marijuana Education Environment Crime amp; Courts Weather Your Hub Sports Sports Olympics Denver Broncos College Sports Colorado Rockies Preps Colorado Avalanche Outdoors Denver Nuggets Boxing / MMA Colorado Rapids Scores and Standings Sports Columnists Sports on TV/Radio Business Business Aerospace Airlines Economy Energy Real Estate Retail Technology Telecom Tourism Entertainment Entertainment Arcade Games Arts Books Calendar Comics Movies Music Reverb Music Theater Television Television Listings Travel Lifestyle Lifestyle Ask Amy Fashion Food amp; Drink Restaurants amp; Dining Fitness Home amp; Garden Horoscopes Opinion Opinion Editorials Columnists Letters Perspective Cartoons Opinion Polls Politics Politics Election Colorado Legislature Denver Politics Local Politics National Politics Cannabist Classifieds Classifieds Cars Homes Jobs Today Subscribe Newsletter News News Latest News Colorado News Nation / World Obituaries Marijuana Education Environment Crime amp; Courts Weather Your Hub Sports Sports Olympics Denver Broncos College Sports Colorado Rockies Preps Colorado Avalanche Outdoors Denver Nuggets Boxing / MMA Colorado Rapids Scores and Standings Sports Columnists Sports on TV/Radio Business Business Aerospace Airlines Economy Energy Real Estate Retail Technology Telecom Tourism Entertainment Entertainment Arcade Games Arts Books Calendar Comics Movies Music Reverb Music Theater Television Television Listings Travel Lifestyle Lifestyle Ask Amy Fashion Food amp; Drink Restaurants amp; Dining Fitness Home amp; Garden Horoscopes Opinion Opinion Editorials Columnists Letters Perspective Cartoons Opinion Polls Politics Politics Election Colorado Legislature Denver Politics Local Politics National Politics Cannabist Classifieds Classifieds Cars Homes Jobs Debate love fury fuel ""Rocket Science"" Share thisClick to share on Facebook (Opens in new window)Click to share on Reddit (Opens in new window)Click to share on Twitter (Opens in new window)Click to print (Opens in new window)Click to email this to a friend (Opens in new window)MoreClick to share on LinkedIn (Opens in new window)Click to share on Pinterest (Opens in new window)Click to share on Tumblr (Opens in new window)Submit to Stumbleupon (Opens in new window) Trending Broncos camp fan guide Texas balloon crash Woody Paige retiring Sports Authority bonuses Rockies down Mets Mile High Roundup Entertainment Debate love fury fuel ""Rocket Science"" Share thisClick to share on Facebook (Opens in new window)Click to share on Reddit (Opens in new window)Click to share on Twitter (Opens in new window)Click to print (Opens in new window)Click to email this to a friend (Opens in new window)MoreClick to share on LinkedIn (Opens in new window)Click to share on Pinterest (Opens in new window)Click to share on Tumblr (Opens in new window)Submit to Stumbleupon (Opens in new window) By  Lisa Kennedy August 22 2007 at 114 pm Sign up for newsletters and alerts Submit your news tips or photos Most Popular Donald Trump stumps in Colorado promises ""No more Mr. Nice Guy"" Chris Harris INT injuries and 8 other observations from Day 2 of Broncos training camp Broncos offensive line can live with the blame game. Theyre built for it. LoDo shooting leaves one dead another injured Peyton Manning stars in 3 new hilarious DIRECTV ads with Lionel Richie Woody Paige retiring from The Denver Post Buoyed by a script rife with poetry a handful of dynamic performances and Eef Barzelays near-perfect score ""Rocket Science"" written and directed by Jeffrey Blitz mildly shames the potty-mouthed ""Superbad."" And I liked ""Superbad."" With a spotlight hanging like a full moon of trouble just beyond his profile Plainsboro High School debater Ben Wekselbaum is expertly racing through points about farm subsidies at the New Jersey state policy debate finals. Nicholas DAgosto who portrays the dark-haired golden boy rips through Bens lines at a pace that leaves you breathless. Then Ben falls silent - really silent - to the chagrin of Ginny Ryerson his debate partner. Right now you might be thinking that ""Rocket Science"" will be Bens story. It wont. Writer-director Blitz deftly shifts the weight of the tale from one style of debate to a more familiar sort from one dark-haired teen to a less formed version of the same. Hal Hefners parents arent merely arguing points theyre splitting up. When Hal and Earls father clomps down the stairs he tells them ""I dont know what to say."" Saying and not saying yearning to speak ones desire or frustration and not quite pulling it off is the rough and exhilarating terrain here. Did we mention that Hal (Reece Daniel Thompson) stutters. Badly. In a quietly hilarious scene a young black woman dressed as Abe Lincoln calls upon Hal to help her debate Stephen A. Douglas. ""What cannot a house divided do?"" Abe asks. Then like a gameshow host asks again. Afterward Ginny recruits Hal (Reece Daniel Thompson) to become her new partner in the years debate season. Ginnys heat and this years resolution on teen abstinence - yay or nay - only adds to Hals staccato stammering. From the knowing little ta-ta wave she gives Hal to an omniscient awareness of when shes being looked at Ginny is less an authentic character than a telling projection of the power and prowess teen boys (and their grown-up writerly selves) credit them with having. Weve seen incarnations of Ginny before. Reese Witherspoon in ""Election"" comes vividly to mind. Rachel Evan Wood gave an even more chilling version of manipulative bravado in ""Pretty Persuasion."" Anna Kendrick plays Ginny with a blazing directness that runs roughshod over doubts about veracity. Her Ginny may be a figment but that makes her no less mesmerizing. ""Rocket Science"" is Blitzs first narrative feature. But the director (who stuttered himself before joining his New Jersey high-school debate team) showed facility and great affection for freaks and geeks with ""Spellbound"" the 2002 documentary about endearing oddsters headed to the National Spelling Bee. Whimsy is fast becoming a staple of American misfit flicks and ""Rocket Science"" has its share of goofball asides. Some miss. Most strike a chord. When dorky Lewis (Josh Kay) shows Hal a bra it feels teen-movie familiar. But when Lewis parents play a duet of the Violent Femmes ""Blister in the Sun"" its a minor rapture. Sounding like the Miller High Life guy the narrator (Dan Cashman) hits notes of butch tenderness as he recounts Hals journey from attraction to hurt to pent-up fury and beyond. When Hals romantic vengeance leads him to Trenton N.J. in search of the legendary Ben Wekselbaum the movie looks headed for a commonplace finale. Fear not. Its not. ""Rocket Science"" R for some sexual content and language | 1 hour 38 minutes | COMING-OF-AGE COMEDY | Written and directed by Jeffrey Blitz; photography by Jo Willems; starring Reece Daniel Thompson Anna Kendrick Nicholas DAgosto Vincent Piazza Margot Martindale Aaron Yoo Josh Kay | Opens today at the Mayan Theater. Lisa Kennedy Digital amp; Driveway Delivery - 50% Off More in Music Polica Synth-pop in the age of racial strife July 29 2016 Indie synth-pop band Polica (pronounced poh-LEE-sah) knew that their newest album ""United Crushers"" wasnt going to get as much attention as their debut album ""Give You the Ghost"" did. Blake Shelton plays free intimate show at Denvers Grizzly Rose July 28 2016 Only 2000 people made it inside Grizzly Rose Thursday for an intimate show by a country superstar. Tickets on sale for Denver shows this week July 29 July 28 2016 How to get tickets for the best upcoming Colorado shows. Dont Miss This Chicano Music Festival this weekend July 28 2016 In the Art District on Santa Fe folks at Su Teatro Cultural and Performing Arts Center have already begun celebrating the 20th annual Chicano Music Festival this week. Member Services News Alerts Facebook Twitter Instagram RSS Subscribe Become a Member / Subscribe Place a Hold Denver Post Store Digital Replica Edition Classifieds Autos Real Estate Jobs Todays Ads Weekly Ads Daily Ads Special Sections Contact Us Submit a News Tip Member Services Advertise With Us Careers Place an Obituary Todays Front Page Back Issues Archives Mobile Apps Copyright (c) 2016 Digital First Media Privacy Policy Site Map Ethics Policy Powered by WordPress VIP Arbitration Send to Email Address Your Name Your Email Address Cancel Post was not sent - check your email addresses Email check failed please try again Sorry your blog cannot share posts by email.",http://www.denverpost.com/movies/ci_6692250,200,rocketscience9,rocketscience,denverpost
