review,link,status_code,id,movie_key,critic
Were sorry we cant find the page that youre looking for Go to the content Go to the footer Time Out New York New York Popular cities London New York Paris Chicago Los Angeles Browse all cities Time Out New York Close New York Change city New York Popular cities London New York Paris Chicago Los Angeles Browse all cities Tickets Events Things to Do Restaurants Bars Movies Theater Music Shopping Attractions Blog Art Travel Nightlife Events amp; Festivals Museums Kids Hotels Comedy Dance LGBT Sex amp; Dating Books City Guide Neighborhoods Promotions Close My Time Out Things I love My lists My Profile My Account Sign out Sign in Create account Sign in With your social account Or with your email Email Password Remember me Forgotten your password? Sign in You can create a Time Out account in two ways... With a few clicks using your favourite social network Or by entering your details below Email First Name Last Name Create password Repeat new password I accept Time Outs terms of use including opt-in to newsletters. Create account Welcome  You have successfully connected your account to Time Out. You may sign in with this account in future. Please confirm your account details Email First Name Last Name I accept Time Outs terms of use including opt-in to newsletters. Sign up My Account Sign in or Create account Search Tickets Events Things to Do Restaurants Bars Movies Theater Music Shopping Attractions Blog Art Travel Nightlife Events amp; Festivals Museums Kids Hotels Comedy Dance LGBT Sex amp; Dating Books City Guide Neighborhoods Promotions More Search Were sorry we cant find the page that youre looking for We have either moved the page or it no longer exists. To help you find your way here are some search results we think may be of interest. Movies Rocket Science This fiction-film debut from Spellbound helmer Jeffrey Blitz is sure to be damned by a rush(more) of comparisons to similar teen-angst spazzathons but accusing him of chewing other ironocentric nerd auteurs food misses the point. Tonal and narrative... 4 out of 5 stars Read more Movies Rocket Science Read more Movies Shorts On Tap Presents Rocket Science Choice 7 Sci-Fi Short Films Read more Art Launch Math amp; Science Centers Campers put their noggins to the test with courses in video-game design robotics and rocket science. Upper West Side Read more Movies The Martian Handling the elements of his signature style with a flair he hasnt shown since Gladiator (2000) Ridley Scott returns to mainstream mastery with The Martian a space misadventure turned survivors tale. Similarities to Apollo 13 and the more recent Gravity... 4 out of 5 stars Read more Movies Moonrise Kingdom Back into the Wes Anderson toy chest we go. The dapper auteur behind such idiosyncratic and polarizing works as The Royal Tenenbaums and The Darjeeling Limited opens his latest feature a continuously surprising and delightful adolescent romance set in... 4 out of 5 stars Read more Things to do Citi Field neighborhood guide All about Citi Field Whether youre at the concession stands or in your seats the three-year-old stadiums wide-open design offers a good view of the field from any angle. You can even scope the pitchers warming up in their respective bullpens and... Read more Music Scottish electropop band Chvrches learns how to navigate the big time Chvrches ascent has been rapid. Though the Scottish band--composed of Lauren Mayberry Iain Cook and Martin Doherty--has yet to release a full-length (one is due later this year) its earned a pretty serious fan base thanks to SXSW and Recover a keyboard-happy... Read more Movies October Sky This adaptation of Homer H Hickams best selling memoir Rocket Boys is set in a working class corner of the Appalachians where life for the young folk follows a depressingly familiar pattern after high school down the mine. Young Homer (Gyllenhaal)... Read more Movies The Hot Seat Anna Kendrick Anna Kendrick has worked with both of our imaginary boyfriends George Clooney and Robert Pattinson. But despite her costars scene-stealing good looks the 25-year-old actor from Portland Maine grabs our attention every time--whether as Jessica Stanley... Read more Top About us Work for Time Out Privacy policy Website terms of use Contact us Get listed Advertising Time Out products Mobile apps Time Out Shop Time Out Guides Time Out Travel Time Out Worldwide Time Out magazine Follow us Facebook Twitter Youtube Instagram Pinterest Spotify Foursquare Time Out New York Site map,http://www.timeout.com/film/chicago/reviews/84476/rocket_science.html,404,rocketscience0,rocketscience,timeout
"Rocket Science  NPR View Navigation NPR NPR NPR Music NPR Books NPR About NPRPodcast Directory Search Toggle search NPR Home News Arts amp; Life Music Topics Programs amp; Podcasts NPR Music Genres New Music Concerts amp; Videos Articles amp; Lists Tiny Desk NPR Books Author Interviews Find Books Reviews About NPR Overview Connect Support Press Careers Podcast Directory Categories Shop Back News U.S. World Politics Business Technology Science Health Race amp; Culture Education Arts amp; Life Books Movies Pop Culture Food Art amp; Design Performing Arts Photography Music First Listen Songs We Love Music Articles Tiny Desk Videos More Our Blogs Corrections All About NPR Back News amp; Conversations Morning Edition All Things Considered Fresh Air Here amp; Now Code Switch The Diane Rehm Show Embedded Latino USA NPR Politics Podcast On Point Weekend Edition Saturday Weekend Edition Sunday Youth Radio Storytelling amp; Humor Ask Me Another The Best Of Car Talk Bullseye Hidden Brain How To Do Everything Invisibilia Only A Game Planet Money Pop Culture Happy Hour StoryCorps TED Radio Hour Wait Wait...Dont Tell Me Music First Listen All Songs Considered Songs We Love Tiny Desk Alt.Latino From The Top Jazz Night In America Metropolis Microphone Check Mountain Stage Piano Jazz The Thistle amp; Shamrock World Cafe More All Programs Podcast Directory NPR Podcasts Back Rock Pop Jazz Classical Hip-Hop Ramp;B/Soul Folk Latin World Electronic/Dance Back First Listen Songs We Love All Songs Considered Reviews Music Videos Back Tiny Desk Live Concerts Field Recordings Studio Sessions Music Documentaries Music Videos Festival Recordings Back Articles Interviews Quizzes Music Lists Best Music of the Year Back Art amp; Design Arts amp; Entertainment Biography amp; Memoir Business amp; Economy Childrens Books Comedy Comics amp; Graphic Novels Digital Culture Faith amp; Spirituality Food amp; Wine History amp; Society Historical Fiction Horror amp; Supernatural Literary Fiction Mystery amp; Thrillers Parenting amp; Families Poetry Politics amp; Public Affairs Romance Science Fiction amp; Fantasy Science amp; Health Sports Travel Young Adult Nonfiction Fiction Back Book Reviews This Weeks Must Read My Guilty Pleasure Three Books... PG-13 Risky Reads You Must Read This Summer Books Best Books of the Year Back Overview Overview and History Mission and Vision Stations and Public Media NPR Finances People Ethics Awards Back Visit NPR NPR Presents Studio 1 Events Generation Listen Book a Speaker Request Permissions Ways to Listen NPR Extra Blog Email Newsletters Shop NPR Get Help Contact Us Back Support Public Radio Corporate Sponsorship Volunteer Back Releases and Statements Photos and Logos Fact Sheet (PDF) Media Relations Contacts Back Careers at NPR Search Jobs Culture Applying Interns Fellows Digital Back Arts Business Comedy Education Games amp; Hobbies Government amp; Organizations Health Kids amp; Family Music News amp; Politics Religion amp; Spirituality Science amp; Medicine Society amp; Culture Sports amp; Recreation Technology TV amp; Film Rocket Science Rocket Science Facebook Twitter Google+ Email August 10 20071220 PM ET Bob Mondello Twitter i Rocket Sciences Hal Hefner (Reece Thompson) left speechless by girls school and the trials of adolescence in general. Jim Bridges/Picturehouse hide caption toggle caption Jim Bridges/Picturehouse Rocket Sciences Hal Hefner (Reece Thompson) left speechless by girls school and the trials of adolescence in general. Jim Bridges/Picturehouse Director Jeffrey BlitzGenre ComedyRunning Time 98 minutes (Requires RealPlayer) Director Jeffrey Blitz won an Oscar nomination for his first movie Spellbound a documentary about a national spelling bee. Hes still dealing with adolescents and school contests in his first fiction film -- a comedy about a stutterer who joins the debate team to impress a pretty girl. Think you know where this is going? Well Blitz is an outsider to Hollywood and hes going someplace else into quirky indie-flick social satire which isnt an altogether unfamiliar place these days. In fact there have been enough offbeat coming-of-age comedies in just the last couple of years -- The Squid and the Whale Napoleon Dynamite Little Miss Sunshine -- that its possible now to say that this film is unconventional in mostly conventional ways. Still between Blitz who proves a clever writer and director and his young leading man (Reece Thompson who puts a lot of character behind that stutter) the smarts and charm of Rocket Science are simply not open to debate. (Recommended) Related NPR Stories Get Bob Mondellos Full Review Rocket Science Prescription Is The Talking Cure Aug. 11 2007 High School? Turns Out It Is Rocket Science Aug. 7 2007 Web Resources Rocket Science Official Site Facebook Twitter Google+ Email More Stories From NPR Politics 5 Takeaways From The Democratic National Convention News County Sheriff Hot Air Balloon Crashes In Central Texas No Apparent Survivors Politics Pitching A Clintonville Protest During The Democratic Convention Music Come Together (Or Not) Music At The Democratic National Convention More Stories Comments You must be signed in to leave a comment. Sign In / Register Please keep your community civil. All comments must follow the NPR.org Community rules and terms of use and will be moderated prior to posting. NPR reserves the right to use the comments we receive in whole or in part and to use the commenters name and location in any medium. See also the Terms of Use Privacy Policy and Community FAQ. Please enable JavaScript to view the <a href=""http//disqus.com/?ref_noscript"">comments powered by Disqus.</a> NPR thanks our sponsorsBecome an NPR sponsor News U.S. World Politics Business Technology Science Health Race amp; Culture Education Arts amp; Life Books Movies Pop Culture Food Art amp; Design Performing Arts Photography Music First Listen Songs We Love Music Articles Tiny Desk Videos Programs About NPR Overview NPR Finances People at NPR Support NPR Visit NPR Press Room NPR Extra Blog Careers at NPR Corrections NPR Ombudsman Permissions Help Contact Terms of Use Privacy Sponsorship Choices Text-Only",http://www.npr.org/templates/story/story.php?storyId=12874310,200,rocketscience1,rocketscience,npr
Movies Bonus Points - Jan. 29 2008 (washingtonpost.com) washingtonpost.com  gt;  Arts amp; Living  gt;  DVD amp; Home Video  gt;  Bonus Points (c) 2008 The Washington Post Company,http://www.washingtonpost.com/wp-srv/artsandliving/movies/features/bonus-points/012908.html,200,rocketscience2,rocketscience,washingtonpost
Rocket Science (2007) directed by Jeffrey Blitz | Film review Go to the content Go to the footer Time Out London London Popular cities London New York Paris Chicago Los Angeles Browse all cities Time Out London Close London Change city London Popular cities London New York Paris Chicago Los Angeles Browse all cities Tickets Offers Things to Do Restaurants Bars amp; Pubs Film Theatre Art Music Attractions Blog Theatre Tickets Shopping Offer of the Day Time Out Card Time Out Escapes Time Out Live Hotels Nightlife Music festivals Events amp; Festivals Kids Museums Clubs Comedy Food amp; Drink Classical Music amp; Opera Dance LGBT City Guide Area Guides Property Competitions Dating Close My Time Out Things I love My lists My Profile My Account Sign out Sign in Create account Sign in With your social account Or with your email Email Password Remember me Forgotten your password? Sign in You can create a Time Out account in two ways... With a few clicks using your favourite social network Or by entering your details below Email First Name Last Name Create password Repeat new password I accept Time Outs terms of use including opt-in to newsletters. Create account Welcome  You have successfully connected your account to Time Out. You may sign in with this account in future. Please confirm your account details Email First Name Last Name I accept Time Outs terms of use including opt-in to newsletters. Sign up My Account Sign in or Create account Search Tickets Offers Things to Do Restaurants Bars amp; Pubs Film Theatre Art Music Attractions Blog Theatre Tickets Shopping Offer of the Day Time Out Card Time Out Escapes Time Out Live Hotels Nightlife Music festivals Events amp; Festivals Kids Museums Clubs Comedy Food amp; Drink Classical Music amp; Opera Dance LGBT City Guide Area Guides Property Competitions Dating More Search Rocket Science Film  Drama 3 out of 5 stars 5 out of 5 stars (2 user reviews) 0 Love It Save it 2 Add review 0 Love It Save it Time Out says 3 out of 5 stars Details Users say (2) 5 out of 5 stars Time Out says 3 out of 5 stars Following his wonderful documentary Spellbound writer-director Jeffrey Blitz moves with less assurance into the fictional arena with this awkwardly framed tale of teen geekdom partly inspired by the filmmakers own youthful misadventures. Gangly high-school student Hal (Reece Daniel Thompson) is willing to try anything to break free from his nervous stutter even taking up the suggestion of alluring over-achiever Ginny (Anna Kendrick) that joining her on the rapid-fire debating team will be just the thing to unlock his confidence and untie his tongue.To Blitzs credit the movie doesnt follow the obvious path to the final-reel showdown suggesting ambivalence and resilience as life lessons in themselves. With its affectionate tone and poised dialogue theres obvious heart and intelligence at work here but the film is far too caught up in its own smarts piling on a clever-clever voiceover and ultra-whimsical score to bury its human core under layers of indie-movie quirkiness. Theres a lovely fragile movie here; if only Blitz had had the faith to let it stand on its own two feet. By Trevor Johnston Posted Monday September 24 2007 Details Release details Rated 15 Release date Friday September 28 2007 Duration 101 mins Cast and crew Director Jeffrey Blitz Screenwriter Jeffrey Blitz Cast Reece Daniel ThompsonVincent PiazzaNicholas DAgostoMargo MartindaleAaron YooAnna Kendrick Users say (2) 5 out of 5 stars Average User Rating5 / 5Rating Breakdown5 star14 star03 star02 star01 star0LiveReviews|21 person listeningSign inWrite reviewMost helpfulMost helpfulHighest ratingLowest ratingNewestOldestLoadingundefinedNew CommentsRefreshAug 10 2007Austin L FlynnFeaturedOne of the best movies of the year. This film is more than just a teenage angst film it goes much deeper than that and you leave knowing that you just saw cinematic art which the studios are so lacking to feed to the public. GO SEE THISFlagShareHelpful?Yes|NoReplyAug 10 2007Austin L FlynnFeaturedOne of the best movies of the year. This film is more than just a teenage angst film it goes much deeper than that and you leave knowing that you just saw cinematic art which the studios are so lacking to feed to the public. GO SEE THISFlagShareHelpful?Yes|NoReplyShow More Share Tweet 0 Shares Top About us Work for Time Out Privacy policy Cookie Policy Website terms of use Contact us Time Out for business Get listed Claim your listing Premium Profiles Advertising Time Out products Time Out Card Mobile apps Time Out Shop Time Out Guides Time Out Travel Time Out Offers Time Out Worldwide Time Out magazine Where to get Time Out magazine Subscribe to Time Out magazine Manage my subscription Follow us Facebook Twitter Youtube Instagram Pinterest Spotify Time Out London Site map },http://www.timeout.com/film/reviews/84476/rocket-science.html,200,rocketscience3,rocketscience,timeout
"Showtimes reviews trailers news and more - MSN Movies Home News Weather Entertainment Sports Money More gt; Lifestyle Health amp; Fitness Food amp; Drink Travel Autos Video entertainment You are using an older browser version. Please use a supported version for the best MSN experience. Kristen Stewart Finally Confirms Alicia Cargile is Her Girlfriend Im Just Really in Love 16 things to know about the Bad Moms star John Tucker Must Die Where Are They Now? Depps legal team sets date to depose Heard in court Matt Damon recalls losing Dead Poets Society role In Theaters Jason Bourne Bad Moms Nerve Star Trek Beyond Ice Age Collision Course AdChoices Movie News Lindsay Lohan not pregnant despite her dads claims friend says Constance Wu slams casting for The Great Wall"" Sony Deletes Ghostbusters Tweet Over Clinton Endorsement Criticism Will Technology Kill the Teen Movie? This Twilight child star is all grown up See her now From the Microsoft Store Sponsored | Microsoft Pre-order The Angry Birds Movie today Sponsored | Microsoft Get Katy Perrys new single Rise Sponsored | Microsoft Watch Season 5 of Homeland Sponsored | Microsoft Save 75 on the Microsoft Band 2 Featured Slideshows 15 ways Bad Moms is basically The Hangover but with moms Crazy Stupid Love Before they were stars 27 Great Revenge Movies 20 modern classic movies everyone needs to watch in their lifetime 17 Mistakes You Never Noticed in Big Thrillers Home News Weather Entertainment Sports Money Lifestyle Health amp; Fitness Food amp; Drink Travel Autos Video (c) 2016 Microsoft Privacy Legal About our Ads Feedback Help MSN Worldwide Newsletter MSN Movies",http://movies.msn.com/movies/movie.aspx?m=1926230&mp=r,200,rocketscience4,rocketscience,msn
