review,link,status_code,id,movie_key,critic
"Shallow Hal | Variety Variety Editions U.S Latino Global Asia Subscribe Today Navigation Menu Film TV Digital Contenders Video Dirt Jobs More Biz Music Legit Scene Conferences Insight Archives Directory Choose Edition U.S Latino Global Asia Russia | My Account Sign In Subscribe HomeFilmReviews Review Shallow Hal Todd McCarthy 0 Share This Article Email LinkedIn Pin It Tumblr November 2 2001 | 0225PM PT For a romantic comedy about seeing beyond fat to a persons inner beauty ""Shallow Hal"" could use a little extra comic poundage. The Farrelly brothers latest sees the team tapping a sweeter milder vein of humor than their outrageous norm one defined by an overriding good-hearted moral. For a romantic comedy about seeing beyond fat to a persons inner beauty ""Shallow Hal"" could use a little extra comic poundage. The Farrelly brothers latest sees the team tapping a sweeter milder vein of humor than their outrageous norm one defined by an overriding good-hearted moral and goosed by the far-flung notion of Gwyneth Paltrow playing an obese young lady whose svelte charms only Jack Black can see. Although its low on hefty laughs and the PG-13 rating wont thrill the Farrellys old core audience of gross-out seeking teens Fox release has enough amusing and endearing moments to put it over as a reasonably commercial date movie before the holiday blockbusters move in. In addition to repping a change of pace for the Farrellys ""Hal"" marks a significant departure for Paltrow away from her status as the tony Miramax house actress and into a thoroughly mainstream low- to middlebrow starring vehicle. With platinum blond hair and an accentuated figure even in her non-tubby incarnation this is a different Paltrow one with a more generic and less distinguished look. Pic also provides Black with his first starring role after his breakthrough supporting turn in ""High Fidelity."" Amazingly after five films the Farrellys have not progressed one iota in the realm of technique; their filmmaking skills remain as rudimentary as they were on ""Dumb and Dumber"" seven years ago. When the comic situations and gags are just flat-out hilarious as they often have been in the brothers work the stylistic roughness doesnt much matter. In this film however with the relatively untested Black coming on awfully strong the lack of directorial finesse lets the enterprise down creating some clunky scenes and dead air where laughs might have been expected. A very ""Shrek""-like tale in its view of physical compatibility script by Sean Moynihan and the Farrellys proposes Blacks Hal and his vulgar buddy Mauricio (Jason Alexander) as two dubious overweight Lotharios who ineptly play the club circuit but still wont consider dating any woman whos not supermodel-beautiful. Mauricio who wears a toupee that looks like black Astroturf is so picky that he breaks up with his latest hottie because of her overlong second toe. Hal after being told by co-workers that he always aims out of his league takes advantage of a stuck-elevator encounter with self-help motivator Tony Robbins to come under a ""spell"" that allows him to see whats inside women rather than judging them on the basis of appearance only. Right away Hals outlook on life picks up and his effect on the ladies with it. A beautiful blonde with whom he shares a taxi gives him her number and three sizzling club dollies all but take him hostage. But when we see these same women from Mauricios p.o.v. the gag is revealed Those Hal sees as gorgeous and without flaws are actually dogs of the first order -- rotund unkempt uncouth and in urgent need of dental work. Then he meets Rosemary (Paltrow). Although shes first glimpsed in an apparel store examining panties that look custom made for a sumo wrestler Hal comes on to her complimenting her as if she were as slim as the Paltrow Hal and we see. Grateful for the attention but suspicious of being admired for qualities she knows she lacks Rosemary whos heavy enough to repeatedly break restaurant chairs shes sitting upon warily allows Hal to court her and both are surprised when they realize that she is Hals boss daughter. Much of the early going feels labored and curiously mirthless considering the ease with which the Farrellys have generated laughs in the past. Part of this could be attributed to overconfidence in the uproariousness of the central conceit and to some degree it stems from overkill by Black and Alexander both of whom push past the red line in playing aggressive over-compensators; at such energy levels a little of each of them goes a long way. Although pic like ""Me Myself amp; Irene"" last year is overlong at nearly two hours action picks up and develops increased cohesiveness in the second half. While Rosemarys father Steve Shanahan (""Analyze This"" tough guy Joe Viterelli sporting a delightfully thick Irish brogue) is highly skeptical of Hals motives hes won over by the young mans sincerity and is so taken with his business ideas that he promotes him at the investment firm. But all goes awry when Mauricio frantic over his best friends myopia tracks down Robbins and convinces him that Hal needs to be dehypnotized for his own good. So when Hal finally realizes what his beloved actually looks like he temporarily heads for the hills much to Rosemarys distress until the predictably public apology and reconciliation send everyone home happy. Almost as an afterthought the Farrellys toss in a couple of moderate gross-outs late in the game notably one involving an unusual appendage of Mauricios. And while there are plenty of references to fat physical attributes and lack of same they are notably not mean-spirited or derisive; hell Rosemary even works in a hospital for children who need special care and one of the main supporting roles is played by an amazing chap named Rene Kirby whose drastic spinal condition called spina bifida forces him to get around on all fours but who is amazingly spirited and is even shown to be an expert skier. With his stocky working class demeanor Black has a regular guy image that reps a good change of pace for a leading man. But the actors brazen glibness is relentless and scarcely modulated which proves too much in the long run and doesnt yield to a display of vulnerability that would match that provided by Paltrows Rosemary. Actress catches the characters shy sense of disbelief at being wooed so enthusiastically and at the end is able to express -- through layers of mountainous makeup -- the heartbreak and residual hope she feels about her first romance. Many student films boast better technical and aesthetic qualities than this one does but the Farrellys make their usual sprightly use of pop songs. Shallow HalProductionA 20th Century Fox release of a Conundrum Entertainment production. Produced by Bradley Thomas Charles B. Wessler Bobby Farrelly Peter Farrelly. Co-producers Marc S. Fischer Mark Charpentier. Directed by Bobby Farrelly Peter Farrelly. Screenplay Sean Moynihan the Farrellys. CrewCamera (Deluxe color) Russell Carpenter; editor Christopher Greenbury; music Ivy; music supervisors Tom Wolfe Manish Raval; production designer Sidney J. Bartholomew Jr.; art director Arlan Jay Vetter; set designers Sharon Davis; set decorator Scott Jacobson; costume designer Pamela Withers; sound (DTS/Dolby) Jonathan ""Earl"" Stein; supervising sound editor John Thomas; makeup effects Tony Gardner amp; Artists Asylum; associate producers Kristofer W. Meyer Sarah S. Lopez; assistant director Hal Olofsson; second unit director Josh Klausner; second unit camera Robert Newcomb; casting Rick Montgomery. Reviewed at the Avco Cinema L.A. Nov. 1 2001. MPAA Rating PG-13. Running time 114 MIN. With Rosemary - Gwyneth Paltrow Hal - Jack Black Mauricio - Jason Alexander Steve Shanahan - Joe Viterelli Walt - Rene Kirby Reverend Larson - Bruce McGill Tony Robbins - Tony Robbins Jill - Susan Ward Ralph - Zen Gesner Katrina - Brooke Burns Other Hostess - Rob Moran LiiBoy - Joshua LiiBoy Shitani Artie - Kyle Gass Jen - Laura Kightlinger Nurse Tanya Peeler - Nan Martin Young Hal - Sasha Joseph Neulinger Waiter - John E. Jordan Mrs. Shanahan - Jill Christine Fitzgerald Spastic Bella - Fawn Irish Bella - Erinn Bartlett Filed Under Nan MartinTanya Lopez Want to read more articles like this one? SUBSCRIBE TO VARIETY TODAY. Post A Comment 0 Variety Jobs Creative Development Coordinator Triptyk Studios New York New York Account/Project Coordinator (Ad Agency) Petrol Advertising Burbank California Media Specialist Bridgewater Associates Westport Connecticut Executive Director Aspen Film Company Confidential Aspen Colorado Associate Director YouTuber amp; Gamer Partnerships Save the Children Fairfield Connecticut See More Jobs Marketplace Leave a Reply No Comments Cancel reply Comments are moderated. They may be edited for clarity and reprinting in whole or in part in Variety publications. Enter your comment here... Fill in your details below or click an icon to log in Email (required) (Address never made public) Name (required) Website You are commenting using your WordPress.com account. ( Log Out / Change ) You are commenting using your Twitter account. ( Log Out / Change ) You are commenting using your Facebook account. ( Log Out / Change ) You are commenting using your Google+ account. ( Log Out / Change ) Cancel Connecting to %s Notify me of new comments via email. Notify me of new posts via email. More Film News from Variety The Power of Content HBO President On Vinyls Demise On-Screen Violence -TCA John Legend Shares Adorable New Snap Of Baby Luna -- See The Cute... Jamie Foxx Wears Puma High-Tops And Unveils New Arsenal Soccer... Westworld Creators Reveal Reason for 2-Month Production Shutdown Pokemon Go update for Android has a very annoying feature... Subscribe to Variety Today All The Ways to Get Variety Online Subscription Print Subscription Mobile Apps Newsletters News Alerts Archives Slanguage Dictionary Help Other Variety Products MediaVariety 411 Research amp; DataVariety Insight Archives Premium Email Alerts Real Estate Jobs Access the best entertainment industry data available View the Variety archives dating back to 1905 Get News Delivered To Your Inbox Privacy Policy Your Privacy Rights Terms of Use About Us Advertise Contact Us Google+ The Power of Content Deadline india.com Hollywoodlife hollywood TV Line BGR WWD Footwearnews (c) Copyright 2016 Variety Media LLC a subsidiary of Penske Business Media LLC. Variety and the Flying V logos are trademarks of Variety Media LLC. Powered by WordPress.com VIP Variety411 Your production services resource",http://www.variety.com/review/VE1117916260.html?categoryid=31&cs=1,200,shallowhal0,shallowhal,variety
Were sorry we cant find the page that youre looking for Go to the content Go to the footer Time Out New York New York Popular cities London New York Paris Chicago Los Angeles Browse all cities Time Out New York Close New York Change city New York Popular cities London New York Paris Chicago Los Angeles Browse all cities Tickets Events Things to Do Restaurants Bars Movies Theater Music Shopping Attractions Blog Art Travel Nightlife Events amp; Festivals Museums Kids Hotels Comedy Dance LGBT Sex amp; Dating Books City Guide Neighborhoods Promotions Close My Time Out Things I love My lists My Profile My Account Sign out Sign in Create account Sign in With your social account Or with your email Email Password Remember me Forgotten your password? Sign in You can create a Time Out account in two ways... With a few clicks using your favourite social network Or by entering your details below Email First Name Last Name Create password Repeat new password I accept Time Outs terms of use including opt-in to newsletters. Create account Welcome  You have successfully connected your account to Time Out. You may sign in with this account in future. Please confirm your account details Email First Name Last Name I accept Time Outs terms of use including opt-in to newsletters. Sign up My Account Sign in or Create account Search Tickets Events Things to Do Restaurants Bars Movies Theater Music Shopping Attractions Blog Art Travel Nightlife Events amp; Festivals Museums Kids Hotels Comedy Dance LGBT Sex amp; Dating Books City Guide Neighborhoods Promotions More Search Were sorry we cant find the page that youre looking for We have either moved the page or it no longer exists. To help you find your way here are some search results we think may be of interest. Movies Shallow Hal The Farrelly brothers put a more sentimental spin on their trademark gross-out/arrested adolescent schtick wresting the issue of fatness from the feminists and kicking it into the comedy arena with mixed results. The film is not as funny as their best... Read more Movies Stuck on You Oh brother Those goofy Farrelly boys have made a comedy about conjoined twins. Joined at the hip Walt (Kinnear) and Bob (Damon) are cooks at Quickee Burger in Marthas Vineyard - but Walt a local am-dram star has a yen to try his luck in Hollywood.... Read more Top About us Work for Time Out Privacy policy Website terms of use Contact us Get listed Advertising Time Out products Mobile apps Time Out Shop Time Out Guides Time Out Travel Time Out Worldwide Time Out magazine Follow us Facebook Twitter Youtube Instagram Pinterest Spotify Foursquare Time Out New York Site map,http://www.timeout.com/film/reviews/74443/shallow_hal.html,404,shallowhal1,shallowhal,timeout
