review,link,status_code,id,movie_key,critic
"That Awkward Moment A comedy with commitment issues - The Globe and Mail Jump to main navigationJump to main content News Search News by eluta.ca Search Jobs at eluta.ca Jobs Login Register 18 Toronto Subscribe Help AdChoices Home News Opinion Business Investing Sports Life Arts Tech Drive Real Estate Film TV amp; Media Books Music Theatre Visual Arts Awards Video Film Reviews Home>> Arts>> Film>> Film Reviews Imogen Poots and Zac Efron in That Awkward Moment. (Focus Features) Imogen Poots and Zac Efron in That Awkward Moment.(Focus Features) That Awkward Moment A comedy with commitment issues Add to ... Liam Lacey The Globe and Mail Published Friday Jan. 31 2014 1201AM EST Last updated Friday Jan. 31 2014 1201AM EST Comments Print /License AA Directed by Tom Gormican Written by Tom Gormican Starring Zac Efron Michael B. Jordan Miles Teller Classification 14A Year 2014 Country USA Language English Three male friends make a pact to stay single and play the field in That Awkward Moment a first-time feature from Tom Gormican that tries to mix Hangover raunch with a heartfelt Jerry Maguire-style romance in what might be more aptly titled Those Awkward 94 Minutes.Zac Efron stars as Jason the swaggering narrator of the story. Along with his sardonic buddy Daniel (Miles Teller) he works in one of those quaint romcom-type artisanal careers designing book covers for a boutique Manhattan publishing house. The gig is improbably lucrative enough to keep him living in a chic brick-walled loft with enough money left over for hair gel and a nightly bar tab. Their other friend Mikey (Michael B. Jordan) has a real job as a workaholic ER doctor. When Mikey gets dumped by his wife Vera (Jessica Lucas) for another guy Jason and Daniel make a vow to help him play the field. In one of those pals-before-gals pacts (which date back to Shakespeares Loves Labours Lost) they agree that none of them can fall in love. In a contemporary update theyll work to expand their ""rosters"" of booty calls. The ""awkward moment"" of the movies title refers to the supposed occasion when a female friend with benefits decides to call in her debts and demands to know where the relationship is headed.Predictably the best-laid plans and best-planned lays go awry. Soon all three men are seeing someone special while trying to keep it from their bros. Jason meets and beds a smart-talking young woman at a bar Ellie (Imogen Poots of A Late Quartet) whom he initially mistakes for a hooker before he falls in love with her when he discovers shes a patrician type who runs a literary lecture series. At the same time Daniel starts noticing his gorgeous gangly wise-cracking girl buddy Chelsea (Vancouver native Mackenzie Davis whos terrific) because hed be crazy not to. Meanwhile Mikey is secretly trying to patch things up with his unfaithful wife. Jessica Lucass Vera in a handful of scenes is never more than a vain cheat while both Poots and Davis in their brief underwritten roles register as considerably more interesting than their emotionally stunted male counterparts.Efron though consistently looking overstyled is decent enough as a redeemable jerk within the limitations of the script. After letting Ellie down at a critical moment he makes up for it with one of those heart-felt public speeches that seems less poetic than trite.The films more irksome offence is the waste of Teller and Jordan who starred in two of the best American independent features last year. Teller who did a superb turn as a teen-aged alcoholic in The Spectacular Now here offers a junior version of that sleepy-eyed sarcastic Bill Murray/Vince Vaughn shtick He coasts at being a coaster. In Fruitvale Station Jordan played a young African-American man killed on New Years Eve by transit police. Jordan who was loose and charismatic in that film is straitjacketed here as a vulnerable nerd with a woeful lack of spontaneity.In one of the movies numbingly dumb series of penis and toilet jokes Mikey pleasures himself using some of Daniels tanning cream leading to selective discolouration. In the hands (and minds) of Judd Apatow or the Farrelly brothers this sort of line-walking gross-out might have pushed some interesting buttons - but here nothing. Like its characters That Awkward Moment has commitment issues It lacks the courage of its bad taste. Report Typo/Error Follow Liam Lacey on Twitter liamlacey More Related to this Story The Spectacular Now Not your average tale of teen romance The time is ripe for Fruitvale Station At Any Price A social-message movie set in the American heartland Comments Print /License AA In the know Report on Business In tough job market highly educated feel the squeeze Obituary Robert-Ralph Carmichael created the art on Canadas loonie CARRICK TALKS MONEY Whats the case for Americans living in Canada to renounce their U.S. citizenship? Report on Pokemon Canadians love it a Pokemaster is crowned Werner Herzog is puzzled Life How do I keep peace in the family when money comes up? The Globe Recommends {{title}} .preloader{displaynone;} Most popular videos >> News Bad boy Justin beaver terrorizes B.C. town News Trump Clinton should have congratulated me for making history Life Make this juicy and delicious tomato salad tonight Report on Business Whats the case for Americans living in Canada to renounce their U.S. citizenship? News No Donald you dont Watch the highlights from Hillary Clintons convention speech News I will gladly lend you my copy Father of fallen Muslim soldier offers Trump his Constitution News I know a con when I see one Bloomberg calls on DNC to unite in opposition to Trump Report on Business What age is a good retirement age? News Warning graphic content Toronto officers trial sees video of Sammy Yatim shooting News He-said-she-said Contrasting Trump and Clintons convention speeches Report on Business Analyst If Air Canada delivers the results the stock will look after itself Sports Video Meet some of the athletes on the Refugee Olympic Team <    > Highlights Report on Business B.C. credit union banks on a fun workplace Report on Business How academic research is subject to racism sexism More from The Globe and Mail Globe Investor This millennial wants to get his MBA but can he afford it? Life How to carb-load the smart way Most popular July 30 Your daily horoscope Forget Brexit This could be Europes biggest crisis yet Provincial free-trade deal clears the way for major changes to liquor laws Judge says RCMP manufactured B.C. terror plot overturns guilty verdict B.C. tax on foreign home buyers almost too good to be true More Top Stories British Columbia Liberal authorizations for Site C dam draw criticism Editorials The mysterious case of Hunter Tootoos ban from the Liberal caucus Football Glenn throws two TD passes Alouettes crush Riders National Montreals Just for Laughs festival fundraising for comedians legal fees Startups How two brothers revived their familys Tennessee whiskey distillery Investor Education Seven things Ive learned about investing Video Trump Clinton should have congratulated me for making history Eye-candy experience at NY ice cream museum See inside Teslas new giant factory Canadian GDP reliant on real estate Photos Pope Francis visits Auschwitz death camp in silence Images from closing day at the Democratic National Convention X connect with us Products The Globe and Mail Newspaper Newspaper delivered to your doorstep. Subscribe to the newspaper Globe Unlimited Digital all access pass across devices. Subscribe to Globe Unlimited Globe2Go The digital replica of our newspaper. Subscribe to Globe2Go Globe Email Newsletters Get top Globe stories sent to your inbox. Subscribe to email newsletters Globe eBooks A collection of articles by the Globe. View the library Advertise with us GlobeLink.ca Your number one partner for reaching Canadas Influential Achievers. Or go directly to Newspaper Magazine Digital Globe Alliance extend your reach Globe Edge custom content Classifieds The Globe at your Workplace Globe Corporate Sales Globe Unlimited digital edition and Globe2Go e-paper group discounts available. Learn more Corporate financial data and content licensing for your organization. Learn more Or go directly to Report On Business Top 1000 DataStore essential business intelligence Our Company About us Work at The Globe Staff Secure Services Secure Drop Staff PGP Directory Customer Service Contact Us Customer Preference Center FAQs Customer Care website Digital subscription services Print subscription services Change your delivery address Vacation Stops Globe Recognition Special Globe events and offers for subscribers Mobile Apps News NEWS APP Available for download on the following devices iPhone iPad Android Blackberry Other Sections Appointments Art Store Births amp; Announcements Corrections Classifieds Classroom Edition Deaths Newspaper Ads Real Estate Special Reports Site Map Terms amp; Conditions Privacy Policy Disclaimer Accessibility Policy Community Guidelines Globe sustainability Editorial Code of Conduct Globe Arts is part of The Globe and Mails Globe Life Network Copyright 2016 The Globe and Mail Inc. All Rights Reserved. 444 Front St. W. Toronto ON Canada M5V 2S9 Phillip Crawley Publisher Add to Watchlist Add to Watchlist Weve run into a glitch. Please try again later. Weve run into a glitch. Please try again later. x Customize your reading font XS S M L XL The quick brown fox jumps over the lazy dog The quick brown fox jumps over the lazy dog The quick brown fox jumps over the lazy dog The quick brown fox jumps over the lazy dog The quick brown fox jumps over the lazy dog",http://www.theglobeandmail.com/arts/film/film-reviews/that-awkward-moment-a-comedy-with-commitment-issues/article16587154/,200,thatawkwardmoment6,thatawkwardmoment,theglobeandmail
That Awkward Moment Movie Review (2014) | Roger Ebert,http://www.rogerebert.com/reviews/that-awkward-moment-2014,200,thatawkwardmoment7,thatawkwardmoment,rogerebert
Detroit NewsSUBSCRIBE NOWFOR HOME DELIVERYHomeNewsSportsBusinessAutosLife + HomeEntertainmentOpinionPhoto + VideoMoreHomeNewsSportsBusinessAutosLife + HomeEntertainmentOpinionPhoto + VideoFireflyHi Already a subscriber?Log inSubscribe today for full access on your desktop tablet and mobile device.Subscribe NowAlready a print edition subscriber but dont have a login?Activate your digital access.Manage your account settings.My AccountView the E-NewspaperManage your NewslettersView your Insider deals and moreMember ID CardLog OutFollowSearchGet the newsLog In or Subscribe to skipAlready a subscriber?Log inSubscribe today for full access on your desktop tablet and mobile device.Subscribe NowAlready a subscriber but dont have a login?Activate your digital access.TOP TRENDINGxShareOOPSThis page exists to tell you that this page doesnt exist.RETURN TO HOMENewslettersAlerts amp; RSSContact UsNewsroomSubscribeHelpAppsHomeNewsDetroitWayneOaklandMacombFlint Water CrisisMichiganMore...Nation + WorldElectionsPoliticsSportsLionsTigersRed WingsPistonsBig TenMichiganMore...Michigan StateCollegeHigh SchoolBusinessTechnologyYour MoneyAutosAuto ShowFiat ChryslerFordForeignGeneral MotorsWoodward Dream CruiseLife + HomeHomestyleFood + DrinkHealthTravelAdviceEntertainmentTV + RadioMusicStageDining + BarsArts + FestivalsCelebritiesMore...BooksMoviesOpinionColumnistsBlogsEditorialsPhoto + VideoPhoto Store (c) 2016 The Detroit News a Digital First Media Newspaper. All rights reserved. ServicesAd ChoicesAdvertise With UsAdvertising Terms and ConditionseBookseEditionSign up for Home DeliveryManage AccountMember GuidePlace an Ad in ClassifiedsPlace a Death NoticeReport a Delivery IssuePhotoStorePrivacy Notice/Your California Privacy RightsTerms of ServiceOur PartnersCareerbuilder.comCars.comHomefinder.comFindNSave.comDetroit Newspapers in EducationRenvy.comMichigan.com,http://www.detroitnews.com/article/20140131/ENT02/301310028,404,thatawkwardmoment8,thatawkwardmoment,detroitnews
"That Awkward Moment suffers from arrested development - The Orange County Register Subscribe Today Customer Service eRegister Todays Paper Knowledge Cafe Magazines Unidos Weather Home News Sports Business Entertainment Life Opinion Obits Register Rewards CARS JOBS DEALS HOMES CLASSIFIEDS Best of OC Celebrities Events Music Disney Knotts Movies Dining TV Arts OCVarsity Arts Columns Brett Simpson goes down other O.C. surfers slip through at U.S. Open U.S. Open of Surfing Bob Hurley among surf icons inducted into Surfing Walk of Fame Disneyland attractions closed to build Star Wars land will reopen in 2017 Early Trump supporter changes her tune Tim Lincecums struggles continue in Angels 6-2 loss to Red Sox Joc Pederson and Chase Utley homer as Dodgers rally to reclaim 9-7 victory over Diamondbacks Rams relocation a breeze compared to Oilers move from Houston to Nashville in 1997 Brett Simpson goes down other O.C. surfers slip through at U.S. Open Erasing buyer turnoffs will help sell your home Anaheim program is packaging new opportunities for workers with disabilities Lynsi Snyder In-N-Out president honored as most trustworthy leader Grocery Outlet debut Free Bruxie lunch for shoppers next week in Orange Comic takes a long road from O.C. to Mad TV 10 free things to do this week (July 29-Aug. 4) Things to do in Orange County (July 29-Aug. 4) Photos Deadheads gather at Irvine Meadows one last time Top news Entertainment That Awkward Moment suffers from arrested development Jan. 30 2014 Updated 523 p.m. 1 of 4 Miles Teller from left Michael B. Jordan and Zac Efron star in ""That Awkward Moment."" FOCUS FEATURES 1 of 4 Imogen Poots plays the love interest of Zac Efron in ""That Awkward Moment."" FOCUS FEATURES 1 of 4 Zac Efron and Imogen Poots star in ""That Awkward Moment."" FOCUS FEATURES 1 of 4 Michael B. Jordan left and Zac Efron star in ""That Awkward Moment."" FOCUS FEATURES View slideshow Miles Teller from left Michael B. Jordan and Zac Efron star in ""That Awkward Moment.""FOCUS FEATURES By MICHAEL SRAGOW / MOVIE CRITIC Facebook Twitter Email Comments PRINT SEND PDF That Awkward MomentStarring Zac Efron Miles Teller Michael B. Jordan Directed by Tom Gormican Rated R for sexual content and language throughout Running time 1 hour 34 minutes Playing Throughout Orange County (See theaters and movie times)The quick hitManhattan Peter Pans fly away from adulthood in this clunky sappy big-screen sitcom. Grade D+ The title of this strained sentimental ensemble dramedy refers to that instant when a bedmate asks ""So ... where is this going?"" Apply that question to the movie and the answer is a cul-de-sac or maybe a blind alley. Part of its problem is infantilism. Neuropsychiatrist Daniel Siegel says that adolescence extends through age 24. He might want to push that to 26 after watching writer-director Tom Gormicans group portrait of frat-boy-like New Yorkers and the women who service or love them. Gormican sets himself the impossible task of asking us to care for semi-grown men who fool themselves into thinking that nirvana consists of emotion-free hookups interspersed with ecstatic nights of video games. The plot kicks in when Michael B. Jordan playing a doctor who married a lawyer (Jessica Lucas) is told that his wife wants a divorce and is sleeping with her lawyer. His two best college pals played by Zac Efron and Miles Teller coerce him into a pact that theyll stay unattached and just hang out and bar-hop until they reach their 30s. Its easy for that duo to make this vow - they lead one of those fantasy Gotham lives best left to sitcoms as a team that designs book covers. (Efron does the concepts and drawing; Teller appears to provide comical moral support.) The doctor cant shake off his feelings for his wife. And immediately Efron connects with a funny gal who works in publishing (Imogen Poots) and Teller with a sharp sardonic musician (MacKenzie Davis); both test the guys commitment to their buddy-buddy-buddy covenant. The movie means to show that its time for them to put aside childish things which includes Jordan accepting that his once-""perfect"" marriage has died. The movies comedy (involving for example the poor choice of an X-rated party suit) and drama (building to a heartfelt public recitation of pickup lines) are wobbly and gimmicky. Gormican may be so caught up in his own fantasies that he doesnt realize how intolerable hes made his characters. One decides not to attend the funeral of his lovers father because that would mean admitting shes his girlfriend. Efron starts snappy then overdoes the dewy-eyed regret. He and Jordan mostly play straight men to Teller who at least communicates what its like to have fun. Poots and Davis pull off the films major performing feat. They convince us that two capable talented women can see real emotion inside a couple of frivolous fratties. Contact the writer msragowocregister.com Most Popular Santa Ana crash ends with 1 dead 1 in custody for possible DUI and 2 others injuredGrocery Outlet debut Free Bruxie lunch for shoppers next week in OrangeConcrete slab is removed so anthropologists can determine if human body is in Santa Ana bSan Diego police officer killed in traffic stopDisneyland could customize your visit by scanning your feet User Agreement Comments are encouraged but you must follow our Privacy Policy Policy amp; Terms of Use Keep it civil and stay on topic. No profanity vulgarity racial slurs or personal attacks. People who harass others or joke about tragedies will be blocked. By posting your comment you agree to allow Orange County Register Communications Inc. the right to republish your name and comment in additional Register publications without any notification or payment. Brett Simpson goes down other O.C. surfers slip through at U.S. Open U.S. Open of Surfing Bob Hurley among surf icons inducted into Surfing Walk of Fame Disneyland attractions closed to build Star Wars land will reopen in 2017 Early Trump supporter changes her tune Tim Lincecums struggles continue in Angels 6-2 loss to Red Sox Joc Pederson and Chase Utley homer as Dodgers rally to reclaim 9-7 victory over Diamondbacks Rams relocation a breeze compared to Oilers move from Houston to Nashville in 1997 Brett Simpson goes down other O.C. surfers slip through at U.S. Open Erasing buyer turnoffs will help sell your home Anaheim program is packaging new opportunities for workers with disabilities Lynsi Snyder In-N-Out president honored as most trustworthy leader Grocery Outlet debut Free Bruxie lunch for shoppers next week in Orange Comic takes a long road from O.C. to Mad TV 10 free things to do this week (July 29-Aug. 4) Things to do in Orange County (July 29-Aug. 4) Photos Deadheads gather at Irvine Meadows one last time Top news Education >> Explaining Californias new vaccine law 9 things you need to know as school begins Santa Ana Unified School District names one of its own as new superintendent Concordia celebrates 40th anniversary with big band concert BUSINESS >> Erasing buyer turnoffs will help sell your home Anaheim program is packaging new opportunities for workers with disabilities Lynsi Snyder In-N-Out president honored as most trustworthy leader O.C. Watchdog >> Obamacare tax credit turns into headache Does O.C. local government need more oversight? Very clear signs of trouble at Trinity Broadcasting Network as revenue shrinks attractions close Health Care >> Obamacare tax credit turns into headache What do Covered Californias big rate hikes mean for you? Obamacare rates in state to rise 13% in 2017 - 14% higher in O.C. ENTERTAINMENT >> Comic takes a long road from O.C. to Mad TV 10 free things to do this week (July 29-Aug. 4) Things to do in Orange County (July 29-Aug. 4) Food >> An OCFair question Who makes the best Spam dish ... and why? Dunkin Donuts opens redesigned store Monday in Yorba Linda Will Johnny Rockets new boss bring back singing waiters or push ahead with modern touch? TELEVISION >> Comic takes a long road from O.C. to Mad TV Richard Wagoner on radio If Sacramento can get its local counter-culture FM station back why not L.A.? This weeks TV highlights Special Sections >> OC Home 2016 OC HOME 2015 100 Top Workplaces 2015 Featured Multimedia CARTOONS >> Cartoons Running with baggage HARRY POTTER >> Why Harry Potter and the Cursed Child continues J.K. Rowlings magical success SLIDESHOW >> U.S. Open of Surfing Check out these tattoos on display SLIDESHOW >> All dressed up for the Barnyard Fashion show at the O.C. Fair SLIDESHOW >> OC Fairs Conjurer is a soothsayer with wit and wisdom SLIDESHOW >> FanFriday Angel fans in the stands Programs amp; Promotions Nominate an Everyday Hero Stay Connected with our E-Mail Newsletters Receive breaking news and newsletters Cars Jobs Homes Deals Classifieds Find a car Dealer Print Specials Find a Dealer News and Research Sell a Car Find a job Employer Tools Interview Online Post a Resume Top Workplaces Find a home Apartments amp; Rentals Find an Agent Mortgage Center New Homes Find a deal Garage Sales Grocery Coupons Search Coupons Search Ads Search Classifieds Announcements Obituaries Place an Ad Pets Business Directory More Orange County Businesses Ads by Google Return to Top home news sports business entertainment life travel opinion Real estate Jobs Cars Deals Classifieds Place an Ad ADVERTISE OPTIONS Self Service Place an Online Ad Place a Print Ad Place a Classified Ad Media Kit Advertising Contact Info CONTACT OCREGISTER About Us Careers Contact Us Corrections Customer Service Subscribe Today Upgrade to 7-days Subscriber Services Site Help Site Feedback OCR SERVICES Archives Buy Our Photos California Lottery Deals Register Rewards Register in Education Obituaries Facebook Comments FAQs NEWS YOUR WAY Blogs E-Mail Newsletters E-Register Mobile RSS Site Map Video ADVERTISING Classifieds Cars Deals Jobs Real Estate Place a Classified Ad View our Media Kit PARTNERS KDOC-TV Unidos Coast Magazine Freedom Printing OC Register Family Southland Golf Copyright (c) 2016 The Orange County Register amp; Digital First Media Privacy Policy amp; Terms of Use | Copyright | Arbitration | Site Help | Site Map | Digital First Media",http://www.ocregister.com/articles/teller-599487-efron-jordan.html,200,thatawkwardmoment9,thatawkwardmoment,ocregister
