review,link,status_code,id,movie_key,critic
That Awkward Moment | Chicago Reader Switch to the mobile version of this page. Newsletters Follow us Twitter Facebook RSS Mobile Username View Profile Edit Profile Log Out Log in Create Account The Chicago Reader News amp; Politics Music Arts amp; Culture Film Food amp; Drink Classifieds Browse News amp; Politics News amp; Politics home page Steve Bogira | Criminal Justice John Greenfield | Transportation Deanna Isaacs | Culture Ben Joravsky | Politics Michael Miner | Media Browse Music Music home page Gossip Wolf In Rotation Record roundups Leor Galil | Music Criticism Peter Margasak | Music Criticism Soundboard Concerts this week Early Warnings Concerts on horizon Browse Film Film home page J.R. Jones | Movie Reviews Index of Long Reviews Film Archive Short Reviews Now Playing Todays Showtimes Browse Arts amp; Culture Arts amp; Culture home page Tony Adler | Theater Justin Hayford | Theater Aimee Levitt | Features Brianna Wellen | Comedy Arts amp; Culture event search Browse Food amp; Drink Food amp; Drink home page Mike Sula | Restaurant Reviews Key Ingredient A chef-to-chef challenge Cocktail Challenge Bar Guide Restaurant search Browse The Bleader The Bleader blog home page Browse Classifieds Classifieds home page Real Estate Rentals Announcements Services Jobs (Monster) Place ad ad Best of Chicago Summer Guide Savage Love Straight Dope Agenda Events Locations Issues Article Archives Fun amp; Free You searched for [X]That Awkward Moment Start over Search for... Browse movie times Narrow Search Author Select an author Andrea Gronvall Michael Atkinson Pat Aufderheide Zbigniew Banas Barbara Scharres Angelica Jade Bastien Bill Stamets Bob Mehr Brian Thomas Peter Brunette Dave Canfield Cara Jepsen Carol Burbank Cheryl Ross Pat Chesnut Luca Cimarusti Patrick Dahl Tyler Daswick Dave Kehr Cliff Doerksen Dominick Suzanne-Mayer Don Druker Mick Dumke Marilyn Ferdinand Fred Camper Patrick Friel Chris Fujiwara Leor Galil Hank Sartin Justin Hayford Jack Helbig Henry Sheehan Tanner Howard Drew Hunt J. R. Jones J.R. Jones Jennifer Vanasco Jessica Hopper Jim Healy Jonathan Rosenbaum Joshua Katzman Josh Katzman Anthony Kaufman Kelly Kleiman Asher Klein Shelley Kraicer Shelly Kraicer Nathalie Lagerfeld Adam Langer Lawrence Bommer Lisa Alspector Eric Lutz Peter Margasak Mark Jenkins Martha Bayne Adrian Martin Tom McCormack Meredith Brody Sergio Mims Michael Miner Laura Molzahn Monica Kendrick Adam Morgan Noel Murray Noah Berlatsky Pat Graham Patrick McGavin Patrick Z. McGavin Gerald Peary Richard Pena Mark Peranson Peter Keough Leah Pickett Richard M. Porton Laura Power Quintin Miles Raymer Reece Pendleton Berenice Reynaud Ronnie Scheib Tal Rosenberg Joshua Rothkopf Joshua H. Rothkopf Martin Rubin Ryan Wenzel Ben Sachs Dan Sallitt Dmitry Samarov Ronnie Schieb David Schwartz David P. Schwartz Scott Pfeiffer Ian Simmons Alissa Simon Michael Glover Smith Patrick Somerville Laura Stempel Steve Erickson David Stewart Gwynedd Stuart Mike Sula Ted Shen Julia Thiel Ignatiy Vishnevetsky Kevin Warwick Jessica Weisberg Brianna Wellen Joel Wicklund Albert Williams Michael Wilmington Sam Worley Rating G PG PG-13 R NC-17 X NR Show only Staff Pick Staff Pick Critics Choice Critics Choice Recommended Recommended New New Agenda Agenda Free Free Slideshow Slideshow Video Video Watch on Amazon Watch on Amazon Watch on Netflix Watch on Netflix Watch on Hulu Watch on Hulu Watch on YouTube Watch on YouTube Member Picks Member Picks Other Searches Events Location Guide Member Search Movie Showtimes Movie Reviews Article Archives Issue Archives Slideshows Comments Videos Images Sorting by Name Release Date Film Search Tweet That Awkward Moment Tools Email Print Share Digg Newsvine del.icio.us Facebook Reddit Twitter Windy Citizen Add to Custom List Loading... Comments click to enlarge That Awkward Moment Video Rated R  94 minutes  2014 Mainstream comedy directors have come to value one-liners as ends in themselves which is why their movies have cobbled-together quips instead of dialogue. The refreshing thing about this otherwise formulaic romantic comedy is that writer-director Tom Gormican gives the verbal humor some rhythm shooting many of the dialogue-driven scenes in long takes so they develop a pleasing ebb and flow. Two single upwardly mobile New Yorkers (Zac Efron Miles Teller) promise to help their recently divorced best friend (Michael B. Jordan) navigate the dating scene but renege on their offer when each meets the girl of his dreams. With Imogen Poots. By Ben Sachs Official Site thatawkwardmomentmovie.tumblr.comDirector Tom GormicanProducer Justin Nappi Andrew OConnor Scott Aversano Kevin Turen Manu Gargi Zac Efron Jason Barrett Michael Simkin John Friedberg Lia Buman and Peter SchlesselCast Zac Efron Miles Teller Michael B. Jordan Imogen Poots Jessica Lucas Mackenzie Davis Addison Timlin Josh Pais John Rothman Tina Benko Barbara Garrick Alysia Reiner and Kate Simses Trailer That Awkward Moment Now Playing Sorry there are no upcoming showtimes for That Awkward Moment Reviews/comments Subscribe to this thread By Email Subscribing... With RSS Comment Add a review Rating Roll over stars and click to rate. Subscribe to this thread Terms of UsePrivacy PolicySubmission GuidelinesAbout The ReaderStaffReader CareersContact UsFreelancing InfoAdvertisingBack IssuesReprints Copyright (c) 2016 Sun-Times Media LLC. Powered by Foundation,http://www.chicagoreader.com/chicago/that-awkward-moment/Film?oid=12134054,200,thatawkwardmoment0,thatawkwardmoment,chicagoreader
"Dumpuary Movie Report The Naked Awfulness of That Awkward Moment Ride Along and Labor Day << Search Search Search Menu Search Features The Triangle The Hollywood Prospectus Contributors Podcasts Video Quarterly ESPN.com Dumpuary Movie Report The Naked Awfulness of That Awkward Moment Ride Along and Labor Day Movies January 31 2014 by Wesley Morris Facebook Twitter Print When bad movies end with a blooper reel youre supposed to think This is how much worse it could have been But really blooper reels add insult to injury. Youre forced to acknowledge that someone actually was in charge of the dull moronic mess you just watched. Remaining seated becomes a forensic opportunity So this is how this was so bad. That Awkward Moment is bad but its scarcely the worst. It wants to be one of those we-had-a-deal comedies in which the characters agree to participate in or abstain from some sexual or romantic rite with Seinfelds ""master of your domain"" masturbation pact being the landmark of the genre. At some point someone says ""I thought we had a deal"" The friendships fracture for a couple of scenes (or one long montage). Then coincidence or a ""one year later"" tag heals all. A moderately smart movie would have pushed back against the formula. That Awkward Moment simply mistakes being obnoxious for being clever. Here three Manhattan friends (played by Michael B. Jordan Zac Efron and Miles Teller) mutually agree to stay single but just wind up closeting their romantic commitments. Even by the loose standards of bromantic comedy these are outrageously low stakes. Jordans doctor comes home one day to a request for divorce. He wants to fight for the marriage but his two buddies -- they design ""chick lit"" book covers -- want him to give up so he can seduce and carouse with them. Whats the price for violating the pact? Whats its point? Its that dudes have to be dudes and being a dude means going home with a girl you meet at a bar -- as Ephron does with Imogen Poots -- and trying to sneak out of her apartment because the thigh-high boots envelopes of cash and copy of Story of O in her bedroom spell prostitute. (Not only does Pootss character show up a scene or two later as a prospective author in need of book-jacket design shes also the sort of character who when Efron explains why he left still continues to date him. Id love to see the movie in which she sits down for brunch and tries explaining that to her girlfriends.) The movie is going for a kind of Taming of the Douche. But none of the three stars is really up to the task. To Jordans credit hes playing the one least interested in being a jerk. Hes got a swaggering sweetness that makes the characters refusal to give up interesting. You just dont believe the movies version of the situation. Its as if writer-director Tom Gormican heard that people get divorced and sleep around but has no idea what making either funny entails. Anyway when he gets to play confident Jordan seems unstoppable. All the sexiness Efron keeps trying for Jordan has coming out of his eyelashes. Efron has become a pleasure to watch. Hes Shia LaBeouf without the hot air and fifth shot of espresso. He just lacks the threat that can turn his hotness into danger. He might never get to Christian Bale in American Psycho or Leonardo DiCaprio in The Wolf of Wall Street. In this movie he gets to be profane and pump his front into a womans rear. But as an immoral star hes still only a Disney Family-level asshole. Teller plays the most maladroit of the three. He softens the misogyny by treating it as something less galling. When a gentleman comes on to the friend (Mackenzie Davis) his character will spend the rest of the movie secretly sleeping with he says ""You can tame her with tequila and compliments."" The insults gush from him as they do from Seth Rogen and Jonah Hill. Teller is also unusual looking yet happens to be a better handsomer actor who can give the offensiveness a psychological changeup. Rogen and Hill project. Teller performs. As actors these three have little to do with each other. I was curious to see a movie attempt to harmonize them. To some extent Gormican manages it but the result just ends up being New Girl but limp. That Awkward Moment plays with the cliche of pricks being princes in need of a princess. But Im not sure the movie even believes that to be true. Its both too cynical and too cute. One scene sees Efron and Teller present a new book design explaining that women will buy any book with shoes on the cover and one of the women in the room blurts out ""I love it."" Only in this fantasy would a woman say that. Only in this fantasy would bromance skip romantic comedy and shoot straight for dick lit.  Ride Along doesnt end with a blooper reel -- just more movie. Its like an overflowing toilet. But for two weeks its been at the top of the American box office. This means there will really be no living with Kevin Hart who was last seen being swatted away by the stars of Grudge Match. Even though this time its Ice Cube doing the swatting the movie is all Harts. He squeaks and screams and talks the way Usain Bolt runs. In a big ensemble comedy -- Think Like a Man for instance or BETs Real Husbands of Hollywood -- his humiliated mock outrage works because youre not stuck with him. Given how big a hit Ride Along appears to be we all are now. Hart plays a do-nothing whos been accepted into Atlantas police academy and needs the approval of his fiancees brother before they can get married. The brother happens to be Ice Cube a detective who cant stand him and drags Hart to work to scare him out of both police work and marriage. Needless to say the plot twists and Hart proves accidentally invaluable. The movies lousiness comes directly from its slap-together laziness (Tim Story directed; four credited writers typed). It could have been the farce of Training Day. Instead the whole thing leans on Ice Cubes scowl and Harts eagerness to please. Meanwhile as Harts girlfriend Tika Sumpter is meant to be a vision of tolerance and well just a vision. She spends the climax as a damsel in workout shorts and a top and seems -- here anyway -- to have arrived from the Kerry Washington-Zoe Saldana-Gabrielle Union bougie-beauty factory. Also here thanklessly are John Leguizamo Bryan Callen and Laurence Fishburne who actually bothers trying to give a performance. Its bad but its something. All the while Hart is jumping up and down not listening causing trouble. You dont know whether to put him in another movie or a timeout. He and Ice Cube bring nothing out of each other. The movie is one of those Coors Light ads in which Ice Cube gets frosted by an inanimate can of sassy beer. Now the beer is Hart who as a comedian has been begging for Hollywoods attention for five years. He has it now but youve got to believe he can do better than this.  I walked by posters for That Awkward Moment and Ride Along and looked around the theater lobby waiting for someone to say ""Just kidding"" Jason Reitmans Labor Day is 111 minutes of a ""just kidding"" that never arrives. I saw the movie first last fall (and wrote about it then) and remain astonished by its earnestness and ludicrousness. Josh Brolin escapes from prison and holds Kate Winslet and her teenage son (Gattlin Griffith) hostage in her stately New England home. Were meant to find this scenario mysterious but it turns laughable fast. At some point Winslet complains about her bowl of spoiled peaches and Brolin suggests making dessert. And so these two and the boy stand together mixing peach filling their hands sloshing in the same bowl. You can believe Reitman was drawn to the colors of Joyce Maynards 2009 novel especially all the purple prose and the opportunity to toy with flashbacks. But the information in the flashbacks is so obvious that they turn the movie into camp. But Labor Day is too dreary for camp. Its dramp. The whole film operates on a level of foolishness thats impossible to sit through with a straight face. Some of the embarrassment arises from terrible performances. Winslet can play confused. But she spends the film in a coma of bewilderment. Its probably easier to pretend youre asleep than to be tied to a chair or doing that pie sequence. This is no part for a good actor. This is no part for anybody. It barely works on the page. The rest of the embarrassment comes from how peculiarly personal this movie feels. Reitman adapted Maynards book himself and whatever he saw in it never materializes on the screen. The result is a gauzy almost unreleasable movie thats detached from its warmth. Its as if Reitman identified with every ounce of florid nonsense in the novel and arrived to the set with no idea of how to film any of it. He goes for art but its not art this material needs. Its a lit match. Filed Under Movies that awkward moment ride along Labor Day Zac Efron MICHAEL B. JORDAN Kevin Hart Ice Cube Kate Winslet josh brolin Archive More From More Movies More Hollywood Prospectus More from Sportstorialist The Hair Up There September 30 2015 Meyerss Lemons Robert De Niro Saves The Intern September 25 2015 Honey Hes Homeless Richard Gere Living on the Streets of New York September 22 2015 Mob Deep Johnny Depps Black Mass and Climbing Everest September 18 2015 Sanaa You in Danger Girl The Perfunctory Stupidity of The Perfect Guy September 15 2015 See all from More Movies Brand Echh Sandra Bullock and Billy Bob Thornton Cant Save the Lame Our Brand Is Crisis October 30 2015 Happy Halloween The Best Horror-Movie Monsters October 29 2015 An Obsessive Ridiculous 6 Trailer Deconstruction October 28 2015 Ash vs. Bruce Campbell The B Movie Legend Returns to The Evil Dead October 28 2015 Weekend Box Office Winners amp; Losers Bill Murray Vin Diesel Steve Jobs and Jem All Go Down in Spectacular Flames October 26 2015 See all Movies More Hollywood Prospectus Brand Echh Sandra Bullock and Billy Bob Thornton Cant Save the Lame Our Brand Is Crisis October 30 2015 50 Scenes That Do Not Appear in the Fox X-Files Revival October 30 2015 In Praise of Beach Slang 2015s Best Most Sincere Rock Band October 29 2015 Who Was Missing From Taylor Swifts Miami Squad? October 29 2015 Happy Halloween The Best Horror-Movie Monsters October 29 2015 See all Hollywood Prospectus Previous Story Right Reasons Podcast Bachelor and Vanderpump Rules  Next Story Anchor Aweigh A Good-bye to (and the Best of) Seth Meyers  The And Greenwald Podcast - Aya Cash October 28 2015 The Andy Greenwald Podcast - Fargo Showrunner Noah Hawley October 27 2015 Grantland Pop Culture - Aaron Sorkin October 23 2015 Twitter Facebook Features The Triangle The Hollywood Prospectus Contributors Podcasts Video Quarterly ESPN.com Terms of Use and Privacy Policy and Safety Information/Your California Privacy Rights/Childrens Online Privacy Policy are applicable to you. (c) 2016 ESPN Internet Ventures. All rights reserved. Interest-Based Ads. Powered by WordPress.com VIP",http://grantland.com/hollywood-prospectus/dumpuary-movie-report-the-naked-awfulness-of-that-awkward-moment-ride-along-and-labor-day/,200,thatawkwardmoment1,thatawkwardmoment,com/hollywood-prospectus/dumpuary-movie-report-the-naked-awfulness-of-that-awkward-moment-ride-along-and-labor-day/
"That Awkward Moment Movie Review | EW.com Skip to main content Sign In Log Out TV TV Recaps Movies Music Books Gaming Video Big Brother Queen of the South Mr. Robot Wayward Pines Suits Tyrant Shop Newsletter Subscribe Get 1 year for 25 Save 86% off the cover price SUBSCRIBE More Great Stuff Comic-Con Hulu Hot List 50Scoops EW Popfest For Your Consideration Jess Cagle Interview Stage Follow EW EW on Facebook EW on Twitter EW on Tumblr EW on Instagram About EW Contact UsCustomer ServiceAbout UsJobs at Time Inc.AdvertisePrivacy PolicyYour California Privacy RightsAd ChoicesNewslettersSubscribeTerms of ServiceSite Map Copyright 2015 Entertainment Weekly Inc. All rights reserved. Login Log out TV TV Recaps Movies Music Books Gaming Video More... TV This Weeks Cover The Walking... TV Exclusive Photos of The Walking... EW POPFEST Get the details 50Scoops50Days Exclusive... Movies Crazy Stupid Love Before Th... Movies The Most 2000s Fashion From Joh... Movies 27 Great Revenge Movies Movies Alice in Wonderland Witticism... Movies John Tucker Must Die Where Ar... Books 15 Captivating International Cri... Movies Planet of the Apes See the Fa... Movies Toronto Film Festival 2016 See... TV One Tree Hill Where Are They... Movies Little Miss Sunshine Where Ar... Books Harry Potter and the Cursed Chi... Movies Comic-Con 2016 See Portraits of... TV Friends See the Casts Evolut... TV Comic-Con 2016 Get Batty With... Movies The Dark Tower Storybook Steph... News Comic-Con 2016 Star Portraits... TV 10 of the Best Moments From The... Movies The Dark Tower Storybook Steph... Movies Thelma and Louise See Rare Behi... Movies 9 of Garry Marshalls Best Movies Movies Every Star Trek Movie Ranked Movies Big Trouble in Little China... Movies The Dark Tower Exclusive Firs... Movies Suicide Squad Before They Wer... Movies The 10 Best Movies of 2016 (So Far) TV Fear the Walking Dead introduc... Movies That Awkward Moment by Adam Markovitz  amrkvtz Share Tweet Share on Google+ Share on Pinterest Share on Tumblr That Awkward MomentEver watched Sex and the City and thought ""Wouldnt this be better if they were guys?"" Probably not. But That Awkward Moment a...That Awkward MomentComedyPT94MREver watched Sex and the City and thought ""Wouldnt this be better if they were guys?"" Probably not. But That Awkward Moment a...2014-02-12Focus Features Share Tweet Share on Google+ Share on Pinterest Share on Tumblr THAT AWKWARD MOMENT Zac Efron Michael B. Jordan and Miles Teller C+ That Awkward Moment Genre Comedy; Starring Zac Efron Michael B. Jordan Miles Teller; Director Tom Gormicon; Release Date Wide 01/31/2014; Runtime (in minutes) 94; MPAA Rating R; Distributor Focus Features Posted February 12 2014 -- 1200 AM EST Ever watched Sex and the City and thought ""Wouldnt this be better if they were guys?"" Probably not. But That Awkward Moment a new bromantic comedy gives us a glimpse at what that would be like -- and the result is a decidedly mixed (though well-dressed) bag. The plot centers on three hot-blooded twentysomethings Studly book cover designer Jason (Zac Efron) his snarky pal Daniel (Miles Teller) and their doctor buddy Mikey (Michael B. Jordan). When Mikeys marriage sours the friends make a pact to steer clear of relationships despite the throngs of lovely-and-willing young ladies threatening to snag their hearts. Romantic entanglements follow but the story is just an excuse for a bit of anthropological espionage a supposed peek at the secret life of the urban American heterosexual male. But on that level That Awkward Moment underperforms. The movies ideas about relationships wouldve felt middle-of-the-road in the 80s and its big epiphany moments (Guys can fall in love too) are shallow enough to make you long for the comparatively profound rom-com oeuvre of Kate Hudson. Luckily the three lead actors are plenty charismatic -- so much so that you wish they werent stuck in such a conventional unambitious movie. But sit tight through the end credits and youll be treated to a few off-the-cuff outtakes of the guys doing things much funnier than anything in the film itself. C+ Share Tweet Share on Google+ Share on Pinterest Share on Tumblr Top Stories Watch Kelly Clarkson adorably forget the lyrics to her songs Katy Perry reveals which line of her DNC speech Orlando Bloom wrote Chandra Levy miniseries in works at TNT Nick Jonas Demi Lovato send fans on scavenger hunt for concert tickets Pokemon Go nests are reportedly spawning different Pokemon Disney changes Avengers Infinity War Part 1 title Constance Wu says Matt Damons Great Wall perpetuates racist myth Photo Galleries 50Scoops50Days The Latest in Fall TV News The Biggest Moments From the 2016 Conventions Crazy Stupid Love Before They Were Stars The Most 2000s Fashion From John Tucker Must Die Exclusive Photos of The Walking Dead Season 7 27 Great Revenge Movies Alice in Wonderland Witticisms and Wisdom From the Disney Classic From Our Partners From Our Partners Contact UsCustomer ServiceAbout UsJobs at Time Inc.AdvertisePrivacy PolicyYour California Privacy RightsAd ChoicesNewslettersSubscribeTerms of ServiceSite Map Copyright (c) 2016 Entertainment Weekly Inc. All rights reserved. img[data-src] { display none important; }","http://www.ew.com/ew/article/0,,20782423,00.html",200,thatawkwardmoment2,thatawkwardmoment,ew
