review,link,status_code,id,movie_key,critic
"That Awkward Moment | Reelviews Movie Reviews Out now Cher Harold Rosson Eva Green Benjamin ... Home Video Views ReelThoughts Currently in Cinema ReelViews Library Login Specials My Books Array ( [page] =gt; reelviews [view] =gt; that-awkward-moment ) That Awkward Moment (United States 2014) January 30 2014 A movie review by James Berardinelli That Awkward Moment exudes an ""old school"" romantic comedy vibe. (Since it borrows from Shakespeares Loves Labours Lost the ""old"" really applies here.) The script has an 80s/90s sensibility wrapped in a layer of lewd crude rude packaging. So although writer/director Tom Gormican wants his movie to hearken back to a series of films he has an affinity for (he calls out Jerry Maguire by name) hes aware that the genre has evolved to where copious amounts of profanity and frank sexual talk are expected. Its the Judd Apatow syndrome and there are times when the blend of romance and raunchiness threatens to curdle. In the end however the ""love conquers all"" mentality wins out. In the fine tradition of most ""classic"" rom-coms of decades gone by the ""romance"" element is considerably stronger than the ""comedy"" one. Thats not to say That Awkward Moment is never funny but the screenplay is stingy with moments that inspire unbridled laughter. This approach serves the storyline well; the more low-key comedic style allows the characters and their interactions to unfold gradually rather than in a flurry of punch-lines. One could argue that the central relationship in That Awkward Moment is platonic not romantic. Its the guy-bonding that occurs between best friends Jason (Zac Efron) Daniel (Miles Teller) and Mikey (Michael B. Jordan). These 20-something buddies make a pact to remain single and unattached. In the romance department its all hook-ups and one-night stands. This suits Jason fine because its how he operates. Ditto for Daniel a bar lizard whose gal pal Chelsea (Mackenzie Davis) rides shotgun and helps him pick up women. Mikey having been dumped by his wife Vera (Jessica Lucas) in a move that blindsides him is reluctant to get back into the dating scene but eventually relents. In due course these three men end up cheating on their pact. Mikey falls back into Veras orbit. Daniel discovers that Chelsea merits romantic consideration. And Jason falls for Ellie (Imogen Poots) a sweet sassy woman he initially mistakes for a hooker. Theres nothing terribly original to be found in That Awkward Moment but the genre isnt known for breaking new ground. The average romantic comedy succeeds based not on narrative innovation but on two simple factors chemistry between the characters and the ability of the filmmakers to convince the audience to root for the happily-ever-after ending. That Awkward Moment does an adequate job in both areas. The most fleshed-out of the characters Jason traverses the familiar road from ""self-centered jerk"" to ""reformed rogue willing to commit"" in a way that gets the viewer on his side. Daniel and Mikey have more perfunctory arcs and as a result their storylines are less satisfying. Zac Efron who has moved far from his Disney roots (in the 2012 film The Paperboy he had the distinction of being urinated on by Nicole Kidman) makes an appealing cad. More importantly he and Imogen Poots exhibit the mix of sugar and sparks necessary to keep That Awkward Moment rolling along. Miles Teller whose John Cusack-like persona leant an offbeat charm to last summers The Spectacular Now has some nice moments with Mackenzie Davis. Admittedly its a little disappointing to see up-and-coming actor Michael B. Jordan slide from Fruitvale Station to this where his character suffers from a chronic case of underdevelopment. Gormican uses Manhattan as more than a setting. The location is woven into the fabric of the film. This was made on location not in a Toronto neighborhood dressed up to look like Gramercy Park. Of course this isnt the real-world New York; its the romanticized movie version that tourists look for but never quite find. Similarities to Woody Allens catalog are probably not coincidental since no filmmaker has so effectively translated his affection for The Big Apple to the screen as Allen. However while That Awkward Moment falls considerably short of the heights achieved by the likes of Annie Hall and Manhattan it also avoids the potholes of some of Allens less successful New York-based productions. The salty language naked (male) buttocks and frank sexual dialogue are meant to give That Awkward Moment a more mature appeal but the movie feels like those elements were incorporated to avoid a PG-13 rating. Those hoping for a male version of Bridesmaids will be disappointed; the dirty gross material in That Awkward Moment is more superficial. Instead this will appeal primarily to those who crave the familiarity of traditional romantic comedies but arent put off by a constant barrage of f-bombs. And although the ending lacks the near perfection of ""You had me at hello"" it gets the job done. That Awkward Moment is a Valentines Day movie that arrives two weeks early. That Awkward Moment (United States 2014) Director Tom Gormican Cast Zac Efron Miles Teller Michael B. Jordan Imogen Poots Mackenzie Davis Jessica Lucas Screenplay Tom Gormican Cinematography Brandon Trost Music David Torn U.S. Distributor Focus Features Run Time 134 U.S. Release Date 2014-01-31 MPAA Rating ""R"" (Sexual Content Profanity) Genre ROMANCE/COMEDY Subtitles none Theatrical Aspect Ratio 2.351 Comments Add Comment Three...better movies of this genre Say Anything (1969) Intolerable Cruelty (2003) (500) Days of Summer (2009) worse movies of this genre Bounty Hunter The (2010) Just Like Heaven (2005) My Best Friends Girl (2008) Three...better movies of Zac Efron Hairspray (2007) Me and Orson Welles (2009) Lorax The (2012) worse movies of Zac Efron Charlie St. Cloud (2010) Neighbors 2 Sorority Rising (2016) 17 Again (2009) Three...better movies of Miles Teller Rabbit Hole (2010) Spectacular Now The (2013) Whiplash (2014) worse movies of Miles Teller Insurgent (2015) Allegiant (2016) Footloose (2011) Three...better movies of Michael B. Jordan Fruitvale Station (2013) Creed (2015) Chronicle (2012) worse movies of Michael B. Jordan Fantastic Four (2015) (There are no more worst movies of Michael B. Jordan) ReelViews Library Currently in Cinema Writings Fictional Writings ReelThoughts Specials About Privacy Policy Terms and Conditions Contact Website credits",http://www.reelviews.net/php_review_template.php?identifier=2720,200,thatawkwardmoment13,thatawkwardmoment,reelviews
"That Awkward Moment review Stars squandered on derivative brom-com - The Washington Post Sections Sign In Username Subscribe Accessibility for screenreader Home Page Politics PowerPost The Fix White House Courts and Law Polling Monkey Cage Fact Checker Post Politics Blog Opinions The Posts View Toles Cartoons Telnaes Animations Local Opinions Global Opinions Letters to the Editor Act Four All Opinions Are Local Book Party Compost Erik Wemple Five Myths In Theory The Plum Line PostEverything PostPartisan Rampage Right Turn The Watch Volokh Conspiracy Sports Redskins NFL MLB NBA NHL AllMetSports Soccer Boxing/MMA College Football College Basketball D.C. Sports Bog Early Lead Fancy Stats Golf Tennis Fantasy Sports Local D.C. Maryland Virginia Public Safety Education Obituaries Transportation Weather National Acts of Faith Health and Science National Security Investigations Morning Mix Post Nation Obituaries World Africa The Americas Asia and Pacific Europe Middle East National Security WorldViews Checkpoint Business Wonkblog On Leadership Personal Finance Digger Energy and Environment Markets On Small Business World Business Capital Business Tech Innovations On I.T. The Switch Lifestyle Arts and Entertainment Advice Carolyn Hax Food Travel Wellness Magazine Home and Garden Inspired Life Fashion KidsPost On Parenting Reliable Source The Intersect Solo-ish Entertainment Books Comics Comic Riffs Going Out Guide Horoscopes Movies Museums Music Puzzles and Games Theater and Dance TV Restaurants Bars amp; Clubs Crosswords Video Live Top News Popular Video Politics Opinions Sports National World Business Technology Style Entertainment Local Photography In Sight Washington Post Live Events Live Chats Real Estate Rentals Where We Live Recently Sold Homes Cars Jobs WP BrandConnect Classifieds Partners Express El Tiempo Latino Parade Fashion Washington washingtonpost.com 1996-2016 The Washington Post Terms of Service Privacy Policy Submissions and Discussion Policy RSS Terms of Service Ad Choices Share on Facebook Share on Twitter Share on Google Plus Share via Email Share on LinkedIn Share on Pinterest Share on Tumblr Resize Text Print Article Comments The inside track on Washington politics. Be the first to know about new stories from PowerPost. Sign up to follow and well e-mail you free updates as theyre published. Youll receive free e-mail news updates each time a new story is published. Youre all set Sign up Invalid email address Got it Got it Movies That Awkward Moment review Stars squandered on derivative brom-com The inside track on Washington politics. Be the first to know about new stories from PowerPost. Sign up to follow and well e-mail you free updates as theyre published. Youll receive free e-mail news updates each time a new story is published. Youre all set Sign up Invalid email address Got it Got it By Ann Hornaday January 30 2014 Follow AnnHornaday ""That Awkward Moment"" turns out to be unfortunately aptly named not for mining a rich vein of social and romantic anthropology as the filmmakers obviously intended to do but for so clunkily stringing together callow predictable scenes from rom-coms past. Actually make that brom-coms In this male-centric version of glossy wish fulfillment Zac Efron Miles Teller and Michael B. Jordan take center stage as three 20-ish Manhattan professionals who early in the film vow to stay single and bro-out together while they still can. The ringleader a serial one-night-stander named Jason (Efron) explains to the far more domesticated Michael (Jordan) that he needs to build a ""roster."" That is a list of women who can be called texted or sexted at any hour for a late-night booty call or other form of adult sleepover. What passes for frank and timely social observation in ""That Awkward Moment"" has less to do with edgy honesty (e.g. Adam on ""Girls"") than a shallow derivative retread (er ""Sexism in the City""?). Trying to fuse the raunch and ribaldry of Judd Apatow with the aspirational feel-goodism of the movies Matthew McConaughey no longer makes first-time writer-director Tom Gormican succeeds only in delivering a long-form sit-com of verbal and behavioral cliches from a running scatological joke featuring Tellers character to a duo of unsavory sight gags involving Efrons anatomy both real and outlandishly artificial. All is supposed to be forgiven in the course of an anticlimactic come-to-Cupid speech in which his caddish protagonist (please dont call him a hero) realizes What Relationships Are All About. With their chirpy pseudo-hip banter and super-designed faux-downscale apartments the men of ""That Awkward Moment"" rarely convince viewers that theyre more than obnoxious entitled brats running amok in the big city with way too much disposable time income and healthy liver enzymes at their disposal. Admittedly Michael proves a sensitive soft-spoken exception in a group that includes a female wingman (Mackenzie Davis) who can drink and swear and sweet-talk ladies with the best -- or worst -- of the laddies. The chief frustration of ""That Awkward Moment"" is that everyone in it is so much better than the material Efron an acting singing and dancing triple threat here squanders his charm evoking fond memories of the ""High School Musical"" movies and ""17 Again."" Teller and Jordan may not be as well known (yet) but to get a sense of the prodigious gifts they possess check out their astonishingly good performances in last years ""The Spectacular Now"" and ""Fruitvale Station"" respectively. For their part Davis and Imogen Poots -- who plays a woman so ideal that shes smart and pretty and likes Scotch and Xbox -- clearly have promising careers ahead of them after this coarse contemptuous digression. The best thing about awkward moments after all is that they usually pass quickly. And blessedly just as swiftly forgotten.  1/2 That Awkward Moment At area theaters. Rated R for sexual content and profanity throughout. 94 minutes. goingoutguide movies true Please provide a valid email address. Sign up Youre all set See all newsletters Comments Share on FacebookShare Share on TwitterTweet Share via Email Ann Hornaday is The Posts chief film critic. Follow AnnHornaday Show Comments Discussion Policy 0 Comments SuperFan Badge SuperFan badge holders consistently post smart timely comments about Washington area sports and teams. More about badges | Request a badge Culture Connoisseur Badge Culture Connoisseurs consistently offer thought-provoking timely comments on the arts lifestyle and entertainment. More about badges | Request a badge Fact Checker Badge Fact Checkers contribute questions information and facts to The Fact Checker. More about badges | Request a badge Washingtologist Badge Washingtologists consistently post thought-provoking timely comments on events communities and trends in the Washington area. More about badges | Request a badge Post Writer Badge This commenter is a Washington Post editor reporter or producer. Post Forum Badge Post Forum members consistently offer thought-provoking timely comments on politics national and international affairs. More about badges | Request a badge Weather Watcher Badge Weather Watchers consistently offer thought-provoking timely comments on climates and forecasts. More about badges | Request a badge World Watcher Badge World Watchers consistently offer thought-provoking timely comments on international affairs. More about badges | Request a badge Post Contributor Badge This commenter is a Washington Post contributor. Post contributors arent staff but may write articles or columns. In some cases contributors are sources or experts quoted in a story. More about badges | Request a badge Post Recommended Washington Post reporters or editors recommend this comment or reader post. You must be logged in to report a comment. Sign in here You must be logged in to recommend a comment. Sign in here Comments our editors find particularly useful or relevant are displayed in Top Comments as are comments by users with these badges . Replies to those posts appear here as well as posts by staff writers.All comments are posted in the All Comments tab. More about badgesGet a badge To pause and restart automatic updates click ""Live"" or ""Paused"". If paused youll be notified of the number of additional comments that have come in. Comments our editors find particularly useful or relevant are displayed in Top Comments as are comments by users with these badges . Replies to those posts appear here as well as posts by staff writers. Spam Offensive Disagree Off-Topic Facebook Twitter Reddit StumbleUpon Digg Delicious Most Read 1 Ask Amy This RV is only big enough for one set of grandkids 2 Democratic convention celebrities ranked from most helpful to most embarrassing 3 The best late-night convention comedy from Stephen Colbert to Samantha Bee 4 I felt angry that it took so long Gretchen Carlson on Roger Ailess ouster from Fox News 5 Carolyn Hax 5 Big-Decision Commandments for city parents who are panicking The Most Advice Lifestyle / Advice No fuss no buss? Fighting and healthy relationships Home amp; Garden Peony passion A garden icon blooms anew in the age of social media Get There She revamped her retirement plan after a divorce. Is she on track? The Most Advice from The Washington Post goingoutguide movies Success Check your inbox for details. Please enter a valid email address You might also like Sign Up No Thanks See all newsletters Our Online Games Play right from this page Mahjongg Dimensions Strategy game Spider Solitaire Card game Daily Crossword Word game washingtonpost.com (c) 1996-2016 The Washington Post   Help and Contact Us Terms of Service Privacy Policy Print Products Terms of Sale Digital Products Terms of Sale Submissions and Discussion Policy RSS Terms of Service Ad Choices Close video player Now Playing",http://www.washingtonpost.com/goingoutguide/movies/that-awkward-moment-review-stars-squandered-on-derivative-brom-com/2014/01/30/0ff8e324-89bd-11e3-a5bd-844629433ba3_story.html,200,thatawkwardmoment14,thatawkwardmoment,washingtonpost
"Movie review That Awkward Moment | Star-Telegram.com Home Blogs Dining Nightlife Music Movies amp; TV The Weekend Chef The Arts Restaurants Movies Music Things 2 Do Party Pics Arts More Visitors guide Ink Eats Beat Places 2 Go Sex amp; Relationships Best of DFW Home gt; Movies amp; TV gt; Movie Reviews Movie amp; TV Reviews RSS Movie review That Awkward Moment Article Tweet Loading ... MCT AP AP Focus Features That Awkward Moment    Director Tom Gormican Cast Zac Efron Michael B. Jordan Miles Teller Rated R (sexual content strong language) Running time 94 min. By Cary Darlingcdarlingdfw.comPosted 434pm on Thursday Jan. 30 2014 Thursday Jan. 30 2014 Thursday Jan. 30 2014 By Cary Darling Fort Worth Star-Telegram No doubt Tom Gormican writer/director of the rom-com That Awkward Moment would be pleased if viewers lumped his feature debut with the likes of say 500 Days of Summer an exuberant sweet 20-something love story with real heart beating beneath its humor.He certainly gets an ""A"" for effort. Gornican has corralled two of the seasons brightest up-and-coming male stars -- Michael B. Jordan ( Fruitvale Station the next Fantastic Four movie) and Miles Teller ( The Spectacular Now and this years much-admired Sundance favorite Whiplash) -- and paired them with Zac Efron a former teen heartthrob who has been trying to broaden his thespian horizons. He has put them in a story that while making a nod toward youthful raunch and bro-code bonhomie is generally a genial look at three guys dealing with issues of commitment fidelity and trust. On top of that he had the good sense to hire the underrated guitarist/composer David Torn (who has played with the likes of David Bowie John Legend Ryuichi Sakamoto and Sting) to write the shimmering electro-pop score.Not bad for a guy whose only previous film credit was as co-producer on the generally despised comedy Movie 43.Still Gormicans reach exceeds his grasp. That Awkward Moment is pleasant enough and it has some inspired moments but they dont add up to anything that pushes the boundaries of the genre.Efron and Teller are Jason and Daniel best pals and jokey co-workers at a graphic design firm specializing in book jackets. The third person in their guy trinity is Mikey (Jordan) a level-headed ER doctor.When Mikeys wife Vera (Jessica Lucas) tells him shes having an affair and wants a divorce these three decide theyve had enough of relationships and arent going to commit to one woman. But theres a catch Jason is getting serious with a girl he meets in a bar Ellie (Imogen Poots) while Daniel is starting to fall for Chelsea (Mackenzie Davis) a good friend and wingwoman whos turning into something more. As for Mikey things may not be over with his wife after all.Yes some hilarity ensues with their amorous adventures whether its dealing with the after-effects of Viagra or showing up at a ""dress-up"" party wearing the wrong thing.The cast is generally strong. Teller and Davis possess a confidence and screen presence that make you want to see what theyll do next while its good to see Jordan a mainstay in dramas get to smile occasionally. Efron is better here as the cocky but cool pretty boy than in the JFK-themed Parkland where he seemed out of his depth.What doesnt work as well is when Gormican tries to go for touching and transcendent and ends up with trite. These may be the most awkward moments of all. Cary Darling cdarlingdfw.com Twitter carydar Tweet We welcome your comments on this story but please be civil. Do not use profanity hate speech threats personal abuse images internet links or any device to draw undue attention. Our policy requires those wishing to post here to use their real identity. Our commenting policy | Facebook commenting FAQ | Why Facebook? Copyright 2016 Fort Worth Star-Telegram. All rights reserved. This material may not be published broadcast rewritten or redistributed. Hey there. Login or join DFW.com. Your account. Log out. username password Login Remember me loading... Recently reviewed Tickled documentary is no laughing matter Foul-mouthed Bad Moms is not bad Hes Bourne to run and keep running Nerve has an app for excitement Star Trek Beyond gets personal in latest expedition More Movies amp; TV Reviews >> loading... What youre reading Brewed pub-cafe on Magnolia is finally starting to perk Hes Bourne to run and keep running Pokemon Go goes wild in DFW Dallas Stars Ice Girls 2016-17 auditions Restaurant review Crazy Cowboy in Bedford Hot adsMore >> View more hot ads Advertise Contact us Terms of Service Privacy Policy Twitter Facebook Star-Telegram.com dfwAutoLink.com DFWVarsity.com",http://www.dfw.com/2014/01/30/863942/movie-review-that-awkward-moment.html,200,thatawkwardmoment15,thatawkwardmoment,dfw
"Movie review That Awkward Moment - Movies - Boston.com Sites V ^ Boston.com BDCwire Love Letters Real Estate Menu Login Search Search Home News Weather Sports Entertainment Lifestyle Travel Cars Real Estate Search Sections Home News Weather Sports Entertainment Business Lifestyle Travel Cars Jobs Real Estate Classified Marketplace Shortcuts Circulars Traffic Video Lottery Markets Horoscopes Forums Comics Movie Listings Crosswords Site help Digital Jobs at Boston Globe Media BDCWire Id click that Radio BDC Streaming todays top alternative music amp; more Loveletters Your daily love advice Boston Globe Home of award-winning Boston Globe reporting Beta Boston Your one-stop source for local innovation news Crux Covering all things Catholic Twitter Facebook Google + ? Privacy Policy Terms of Service Contact (c)2016 Boston Globe Media Partners LLC Their hapless effort is Awkward By Peter Keough Globe Correspondent January 30 2014 700 PM Share Comment This is a summary. To read the whole story subscribe to BostonGlobe.com That Awkward Moment Share Comment To its credit Tom Gormicans ""That Awkward Moment"" does invert one of Hollywoods more tiresome cliches - the one where the distraught woman consoles herself by eating a pint of Ben and Jerrys ice cream. In this movie its the guy who does that. Cinema doesnt get much more groundbreaking. The unfortunate ice cream-eating male is Mikey (Michael B. Jordan) a doctor whose wife a college sweetheart has confessed to cheating on him. His freewheeling buddies Jason (Zac Efron) and Daniel (Miles Teller) see this as an opportunity to reunite the old night-prowling love-them-and-leave wolf pack. They make a pact that none of them will ever get in a relationship again. Full story for BostonGlobe.com subscribers. MPAA Rating R | MPAA rating reasons sexual content and language throughout | Running Time 94 minutes | Cast Zac Efron Imogen Poots Miles Teller Mackenzie Davis Michael B. Jordan | Director Tom Gormican | Writer Tom Gormican | Playing at Boston Common Fenway suburbs | Share Tweet Get the full story with unlimited access to BostonGlobe.com. Just 99 cents for four weeks. Get Access Now Share Comment Twitter Facebook Google + ? (c)2016 Boston Globe Media Partners LLC Privacy Policy | Terms of Service | Ad Choices Search Sections Home News Weather Sports Entertainment Business Lifestyle Travel Cars Jobs Real Estate Classified Marketplace Shortcuts Circulars Traffic Video Lottery Markets Horoscopes Forums Comics Movie Listings Crosswords Site help Digital Jobs at Boston Globe Media BDCWire Id click that Radio BDC Streaming todays top alternative music amp; more Loveletters Your daily love advice Boston Globe Home of award-winning Boston Globe reporting Beta Boston Your one-stop source for local innovation news Crux Covering all things Catholic Twitter Facebook Google + ? Privacy Policy Terms of Service Contact (c)2016 Boston Globe Media Partners LLC Sign in Register <a href=""http//www.omniture.com"" title=""Web Analytics""> </a>",http://www.boston.com/ae/movies/2014/01/30/movie-review-that-awkward-moment/6PvrUBOU946rswUulHT8EP/story.html,200,thatawkwardmoment16,thatawkwardmoment,boston
