review,link,status_code,id,movie_key,critic
"Page Not Found - Boston.com Sites V ^ Boston.com BDCwire Love Letters Real Estate Menu Login Search Search Home News Weather Sports Entertainment Lifestyle Travel Cars Real Estate The page you requested has either moved or been deleted. Sorry the page you have requested does not exist at this address. If you are trying to reach a Boston.com page from a bookmark the address may have changed or the page may have been eliminated. Please use the search below or visit our homepage. If you need immediate assistance please visit our Help Center or contact us by filling out our feedback form. We apologize for the inconvenience. Boston.com Site Tools boston.com home contact boston.com boston.com help center Twitter Facebook Google + ? (c)2016 Boston Globe Media Partners LLC Privacy Policy | Terms of Service | Ad Choices Search Sections Home News Weather Sports Entertainment Business Lifestyle Travel Cars Jobs Real Estate Classified Marketplace Shortcuts Circulars Traffic Video Lottery Markets Horoscopes Forums Comics Movie Listings Crosswords Site help Digital Jobs at Boston Globe Media BDCWire Id click that Radio BDC Streaming todays top alternative music amp; more Loveletters Your daily love advice Boston Globe Home of award-winning Boston Globe reporting Beta Boston Your one-stop source for local innovation news Crux Covering all things Catholic Twitter Facebook Google + ? Privacy Policy Terms of Service Contact (c)2016 Boston Globe Media Partners LLC Sign in Register <a href=""http//www.omniture.com"" title=""Web Analytics""> </a>",http://www.boston.com/ae/movies/2014/01/29/review-that-awkward-moment-average-best/Sf74wPo2tWGJ0JIjhmKNiO/story.html,404,thatawkwardmoment24,thatawkwardmoment,boston
"Review That Awkward Moment - MTV mtv Menu mtv mtv Home Shows Full Episodes Shows A-Z TV Schedule App MTV2 2016 vmas Shows News Music from the Shows Casting Calls Music Music Artists A-Z Music Videos Artist to Watch News Latest News Music Celebrity TV Movies Style Politics Life TV Provider Signout facebook twitter tumblr news Shows Full Episodes Shows A-Z TV Schedule App MTV2 2016 vmas Shows News Music from the Shows Casting Calls Music Music Artists A-Z Music Videos Artist to Watch News Latest News Music Celebrity TV Movies Style Politics Life facebook twitter tumblr VMA Nominations Live From The DNC Music Movies Review That Awkward Moment Kate Erbland 01/30/2014 Most of the awkward moments must have happened in the editing bay. While kitted out with an impressively charming cast Tom Gormicans cliched ""That Awkward Moment"" suffers from the kind of overly snippy editing that doesnt tighten up sequences or streamline character traits but the type that renders whole sequences confusing and entire characters the victim of chopped up narrative aims. Simply put - the most awkward thing about ""That Awkward Moment"" is that the majority of it just doesnt make much sense and as a relatively light-hearted spin on the romantic comedy genre it absolutely should. Gormicans feature debut (the writer and director has one other credit to his name - as a co-producer for ""Movie 43"") centers on three best friends who are all in various states of disarray over their romantic lives. The trio have been friends since college but Michael B. Jordans Mikey apparently tapped out on their running game early marrying his school sweetheart at the tender age of twenty-three. Zac Efrons Jason and Miles Tellers Daniel have run wild ever since and while the news that Mikeys marriage is ostensibly over seems vaguely upsetting to them theyre mainly just jazzed that they can pull Mikey back into their search for fresh meat. The guys come up with a plan - they will all stay single together - thats only brought back up when absolutely necessary which means that its frequently forgotten and then reclassified to meet needs. (Later in the film the pact is referred to as a bet though there are never any stakes or set time limits and theres certainly no one vying to win anything from it.) Despite the slack nature of said plan (pact bet whatever) it coyly triggers opposite responses - Jason begins falling for the wily and carefree Ellie (Imogen Poots) while Daniel and best gal pal/former wingman Chelsea (Mackenzie Davis) start up their own clandestine affair and even Mikey gets cozy with the last person he should feel endeared to. Of course all of the guys lie to each other everyone sneaks around and the outing of secrets is both wholly inevitable and oddly without tension. Choppily put together the film frequently feels as if its missing key bits of exposition and character-building and its often-jumpy transitions keep things confusing instead of allowing it to be amusing or entertaining.  A hefty number of the films characters simply dont react to things with expected or even average emotional responses - one characters wife cheats on him and he never exhibits believable signs of either anger or sadness another character allows the douchebag who skipped out on her fathers Thanksgiving Day funeral to still post cute cat videos on her Facebook page (anyone else would have unfriended the bastard) - robbing the film of even the most tenuous grasp on reality. And tenuous it is as ""That Awkward Moment"" like plenty of films of its kind doesnt adhere too closely to reality in even broad details. Jason and Daniel are book cover designers - a career path that apparently affords them spacious New York City apartments and an entirely drinkable income though their works of art dont seem especially unique or interesting. While nearly everyones apartment is far bigger than it should believably be (though Mikey and Veras place looks about right for a young career couple) it seems as if the set design team at least got a banger of a deal on ikat textiles (everyones sheets and curtains look oddly similar). Rom-coms dont generally seem to exist in ""the real world"" but ""That Awkward Moment"" willfully bucks details both big and small and the result is something oddly fake and emotionally empty. The film is laden (and leaden) with romantic comedy tropes from another eras - hooky coincidences woodenly delivered lines minor misunderstandings played for big laughs and even a final act ""big spectacle"" to show emotion - that dont rile nearly as much as the films other elements simply because theyre comforting amidst all the mish-mash. What the film does have is three highly likable male leads who have all proven their worth in other outings along with a pair of leading ladies (Poots and Davis) who have charm to spare. But the messy final product never allows things to click together even with such a talented and young cast ready to deliver what could have been an at least passable attempt at revitalizing the rom-com. SCORE 4.3 / 10 Movies That Awkward Moment News about FAQ/Help Jobs Terms of Use Privacy Policy/Privacy Rights Copyright Closed Captioning Eventful Partners Ad Choices (c)2016 Viacom International Inc. All Rights Reserved. MTV and all related titles and logos are trademarks of Viacom International Inc.",http://www.film.com/movies/review-that-awkward-moment,200,thatawkwardmoment25,thatawkwardmoment,film
"That Awkward Moment A brom-com for our timeSUBSCRIBE NOWto get home deliveryNewsSportsLifeMoneyTechTravelOpinionWeatherIconHumidityPrecip.WindsOpen settingsSettingsEnter City State or ZipCancelSetClose settingsFull ForecastCrosswordsElections 2016OlympicsVideoStocksAppsBest-Selling BooksClassifiedsCollegeCorrectionsInteractivesNewslettersPhoto GalleriesPortfolio TrackerScoresNewsstandAudioInvestigationsPolicing the USAMoreNewsSportsLifeMoneyTechTravelOpinionWeatherCrosswordsElections 2016OlympicsVideoStocksAppsBest-Selling BooksClassifiedsCollegeCorrectionsInteractivesNewslettersPhoto GalleriesPortfolio TrackerScoresNewsstandAudioInvestigationsPolicing the USASearchFireflyHi Already a subscriber?Sign InSubscribe today to additional USAToday products.Subscribe NowAlready a print edition subscriber but dont have a login?Activate your digital access.Manage your account settings.My AccountLog OutGet the newsLog In or Subscribe to skipSign in with FacebookSign in with GoogleSign in FAQTOP TRENDINGxShare 13 Share This StoryLet friends in your social network know what you are reading aboutFacebookEmailTwitterGoogle+LinkedInPinterestThat Awkward Moment A brom-com for our timeA pact to stay single and a charming trio power this lightweight Valentines Day date movie.Post to FacebookThat Awkward Moment A brom-com for our time A pact to stay single and a charming trio power this lightweight Valentines Day date movie. Check out this story on USATODAY.com http//usat.ly/1eh6lyS { } CancelSendSentA link has been sent to your friends email address.PostedA link has been posted to your Facebook feed. Join the Nations ConversationTo find out more about Facebook commenting please read the Conversation Guidelines and FAQsThat Awkward Moment A brom-com for our timeSkip AdAd Loading...xEmbedxShare USA Today Movie Critics Scott Bowles and Claudia Puig discuss ""That Awkward Moment"" and tell you whether to ""Catch It"" ""Rent It"" or ""Skip It"" in this weeks edition of The Screening Room. Claudia Puig USA TODAY 626 p.m. EST January 31 2014A pact to stay single and a charming trio power this lightweight Valentines Day date movie.Zac Efron stars in the rom-com buddy movie That Awkward Moment.(Photo Nicole Rivelli Film District)Story HighlightsUSA TODAY review 1/2 out of fourStars Zac Efron Michael B. Jordan Miles Teller Imogen Poots Mackenzie DavisRated R; runtime 1 hour 34 minutes; opens Friday nationwide 13 CONNECTTWEETLINKEDINCOMMENTEMAILMOREThe easy camaraderie among the trio of male leads lessens the clumsiness of That Awkward Moment.The title refers to the point at which a casual hook-up may become a more serious romance. The story ( 1/2 out of four; rated R; opens Friday nationwide) is meant to venture beyond the limitations of the predictable rom-com told as it is from a slightly raunchier twentysomething male perspective. However it still adheres to most of the conventions of the genre. While it has the requisite amounts of comedy and romance its actually more of a buddy movie. Think Sex in the City bro-style.From a more cynical perspective its a Valentines Day date movie that guys wont mind seeing and women will find amusing enough and easy on the eyes.Likable lead actors Zac Efron Michael B. Jordan and Miles Teller have an appealing chemistry though the material theyre given lacks cleverness.REVIEWS The latest movie reviews from USA TODAYTRAILERS Coming soon to theatersThe alpha dog in this lovable wolf pack is Jason (Efron) who opens the film wincing as he describes the awkwardness of the moment when a woman opens a line of conversation with ""So..."" as in ""So where is this relationship going?""His buddy Daniel (Teller) agrees in theory if not in practice. He doesnt score nearly as often with the ladies or as successfully. In fact he tends to use the assistance of his female buddy Chelsea (Mackenzie Davis) to pick up girls in bars. Not surprisingly its not the most effective of tactics.Rounding out the trio is Mikey (Jordan) their more grounded pal. Hes a successful doctor whose marriage to successful lawyer Vera (Jessica Lucas) is more than on the rocks. Its hit a boulder.Some of the jokes fall flat such as a recurring gag about Daniels bathroom habit and a costume party mix-up (lifted from Bridget Jones Diary and Legally Blonde). The formulaic concept at the core of the film -- they all agree to lead unencumbered lives and enjoy a friendship like they had back in college -- feels like the sort of rom-com contrivance rife for spoofing (a la How to Lose a Guy in 10 Days or Failure to Launch).One by one they upend their vow. Even though Jason is a guy with a girl in every fashionable New York City neighborhood hes smitten by manic pixie dream girl Ellie (Imogen Poots). Daniel may seem a goofy non-starter but his friendship with Chelsea is veering into romantic territory. Michaels arc with his estranged wife is a jot less predictable.Jordan plays the most admirable character. Teller with his puppy dog affability has a natural gift for humor that rises above the limitations of the script. He deftly conveys his characters lovable vulnerability making him the one we root for most to find happiness. Efron has an easy way of making his jerky charmer more engaging than he should be.The balance between ribald comedy and sweet romance is not perfectly calibrated -- the film leans too heavily on bathroom humor -- but the guys seem to be having fun together.That Awkward Moment is featherweight fare made worth watching because of the charm of the talented leads. 13 CONNECTTWEETLINKEDINCOMMENTEMAILMORERead or Share this story http//usat.ly/1eh6lyS",http://www.usatoday.com/story/life/movies/2014/01/29/awkward-moment-review/5019543/,200,thatawkwardmoment26,thatawkwardmoment,usatoday
"That Awkward Moment review Zac Efrons heart problems |       NJ.com NJ.com Menu Home News Politics Sports High School Sports Entertainment Photos/Videos Obituaries Autos Jobs Real Estate Rentals Health Classifieds Local Businesses Place An Ad Opinion Follow Us Subscribe Back to Main Menu News News by County All Newspapers Business Crime Education Health Lottery Obituaries Politics Back to Main Menu Atlantic Bergen Burlington Camden Cape May Cumberland Essex Gloucester Hudson Hunterdon Mercer Middlesex Monmouth Morris Ocean Passaic Salem Somerset Sussex Union Warren Back to Main Menu The Star-Ledger The Times of Trenton The Jersey Journal South Jersey Times Hunterdon County Democrat Independent Press Horse News Back to Main Menu Politics Home Chris Christie Opinion The Auditor Back to Main Menu Sports Home Devils Eagles Flyers Giants Jets Knicks Mets Nets Phillies Rangers Red Bulls Rutgers Basketball Rutgers Football Rutgers Sports Seton Hall Sixers Yankees Back to Main Menu Football Baseball Softball Boys Lacrosse Girls Lacrosse Boys Track and Field Girls Track and Field Boys Volleyball Boys Tennis Boys Golf Girls Golf Wrestling Boys Basketball Off Season Sports Back to Main Menu Football Wrestling Boys Basketball Girls Basketball Boys Bowling Girls Bowling Boys Cross Country Girls Cross Country Boys Fencing Girls Fencing Field Hockey Boys Ice Hockey Girls Ice Hockey Gymnastics Boys Skiing Girls Skiing Boys Soccer Girls Soccer Boys Swimming Girls Swimming Girls Tennis Girls Volleyball Boys Winter Track Girls Winter Track Back to Main Menu Entertainment Home Atlantic City Entertainment Celebrities Comics Events Food amp; Dining Indulge Inside Jersey Movies Music Online Gambling Guide Puzzles Shore TV Back to Main Menu Hunterdon County Democrat Photos Jersey Journal Photos NJ.com Photos South Jersey Times Photos Star-Ledger Photos Times of Trenton Photos Videos Back to Main Menu Homes for Sale New Homes For Rent Foreclosures Commercial Real Estate News Resources Place An Ad Back to Main Menu Home Buying Sell My Home Rental Living Home Ideas Mortgages and Loans Im Moving Back to Main Menu Obituaries Rentals Pets For Sale Garage Sales Find n Save Fraud Prevention Manage Your Ad Place An Ad Back to Main Menu Find A Business Food amp; Dining Retail Shopping Health amp; Medicine Personal Care Entertainment Real Estate Automotive Claim Your Business Sponsored Blogs Back to Main Menu Visit our Facebook Page Follow us on Twitter View our Instagram photos See our Tumblr feed See our Pinterest page Visit us on Google Plus Visit OMJ for NJ celebrity amp; style Back to Main Menu Email newsletters The Star-Ledger The Times of Trenton The Jersey Journal South Jersey Times Hunterdon County Democrat Star Gazette Back to Main Menu Close Customize Your Weather Set Your Location (Enter City and State or Zip Code) Congratulations Your weather is set to . You can change the location at any time. AccuWeather.com Quick Look Change your current location >> View Full Weather Report Search Search Search NJ.com Account Sign In Close Sign in toNJ.com You are signed in as Edit Public Profile Sign Out Subscribe Email newsletters The Star-Ledger The Times of Trenton The Jersey Journal South Jersey Times Hunterdon County Democrat Star Gazette comments That Awkward Moment review Zac Efrons heart problems zac-efron-awkwardjpg-jpg Zac Efron tries to chart a new course for his relationship in That Awkward Moment (FOCUS) Print Email Stephen Whitty | ArtiSyndicate By Stephen Whitty | ArtiSyndicate The Star-Ledger Email the author | Follow on Twitter on January 30 2014 at 601 PM updated January 30 2014 at 603 PM comments Youre in a relationship that seems to be going fine except its not going anywhere. Or at least nowhere in particular. And finally the other person takes a breath and starts The Conversation. The conversation that almost always begins ""So..."" ""That Awkward Moment"" is what it might be called and its the name of a movie about three not-quite-30 guys who are trying to postpone that chat indefinitely. Keep it light keep it moving keep their options open. Its the movie though thats not ready to commit. It has some good actors and some quick dialogue which also has the feel of real-life. But the plot forces things a bit and the direction is uncertain; just when it seems willing to take some risks it retreats. The first problem is with the films central situation which has Michael B. Jordans wife walk out on him. So to get him back into the dating pool his buddies Zac Efron and Miles Teller swear theyre going to take things strictly casual too -- each guy will develop a ""roster"" of lovers but not one will be allowed to become a regular girlfriend. This is both a little smarmily arrogant and not quite believable -- particularly when Efron and Teller find themselves falling for their beautiful hookups. Compounding the problem is the film doesnt knit the multiple ongoing deceptions into the door-slamming farce they should become; like these guys affairs things just amble along aimlessly. Teller who was so charming in the far better romance ""The Spectacular Now"" is terrific here (although he doesnt seem old enough for the part or these friendships). Newarks Jordan so impressive in ""Fruitvale Station"" is good too as the most serious pal of the three. And while its still a little hard to take Efron too seriously in anything the female roles are particularly well cast with Imogen Poots (who has the name of a Roald Dahl heroine) a truly fresh choice as Efrons lover Ellie a gal with a bad haircut too much eyeshadow and a certain spark. The movies at its best when it just lets her be or sits back and listens as Teller -- who seems to be happily riffing on his lines -- bounces half-muttered insults and oddball jokes off his friends. But what should be the movies big setpieces -- a surprise birthday party a formal Thanksgiving feast -- never develop any layers or interesting sideshows. (Big party scenes are notoriously difficult to direct as first-time filmmaker Tom Gormican may know by now.) And for an R-rated romantic comedy theres not a lot of sex. The three men talk about it a lot (although not quite as much as they talk about masturbation or bowel movements). But nobody seems to spend much time actually doing it and when they do its under carefully draped sheets and without much humor. Thats another missed opportunity because sex is funny (or to repurpose an old Woody Allen punchline it is if youre doing it right). And although some movies (like the Justin Timberlake/Mila Kunis rom-com ""Friends With Benefits"") understood that the actual act seems to make this movie -- like its heroes -- a little uncomfortable. There are some good things here but maybe in development this movie needed an awkward moment of its own -- one where the filmmaker was taken aside by one or more older preferably female studio executives whod read him some of his script out loud. Look at him. And then say ""So..."" Ratings note The film contains sexual situations and strong language. That Awkward Moment (R) Focus (94 min.) Directed by Tom Gormican. With Zac Efron Michael B. Jordan Miles Teller. Now playing in New Jersey.",http://www.nj.com/entertainment/index.ssf/2014/01/that_awkward_moment_review_zac_efrons_heart_problems.html,200,thatawkwardmoment27,thatawkwardmoment,nj
