review,link,status_code,id,movie_key,critic
The Dukes of Hazzard | Chicago Reader Switch to the mobile version of this page. Newsletters Follow us Twitter Facebook RSS Mobile Username View Profile Edit Profile Log Out Log in Create Account The Chicago Reader News amp; Politics Music Arts amp; Culture Film Food amp; Drink Classifieds Browse News amp; Politics News amp; Politics home page Steve Bogira | Criminal Justice John Greenfield | Transportation Deanna Isaacs | Culture Ben Joravsky | Politics Michael Miner | Media Browse Music Music home page Gossip Wolf In Rotation Record roundups Leor Galil | Music Criticism Peter Margasak | Music Criticism Soundboard Concerts this week Early Warnings Concerts on horizon Browse Film Film home page J.R. Jones | Movie Reviews Index of Long Reviews Film Archive Short Reviews Now Playing Todays Showtimes Browse Arts amp; Culture Arts amp; Culture home page Tony Adler | Theater Justin Hayford | Theater Aimee Levitt | Features Brianna Wellen | Comedy Arts amp; Culture event search Browse Food amp; Drink Food amp; Drink home page Mike Sula | Restaurant Reviews Key Ingredient A chef-to-chef challenge Cocktail Challenge Bar Guide Restaurant search Browse The Bleader The Bleader blog home page Browse Classifieds Classifieds home page Real Estate Rentals Announcements Services Jobs (Monster) Place ad ad Best of Chicago Summer Guide Savage Love Straight Dope Agenda Events Locations Issues Article Archives Fun amp; Free You searched for [X]The Dukes of Hazzard Start over Search for... Browse movie times Narrow Search Author Select an author Andrea Gronvall Michael Atkinson Pat Aufderheide Zbigniew Banas Barbara Scharres Angelica Jade Bastien Bill Stamets Bob Mehr Brian Thomas Peter Brunette Dave Canfield Cara Jepsen Carol Burbank Cheryl Ross Pat Chesnut Luca Cimarusti Patrick Dahl Tyler Daswick Dave Kehr Cliff Doerksen Dominick Suzanne-Mayer Don Druker Mick Dumke Marilyn Ferdinand Fred Camper Patrick Friel Chris Fujiwara Leor Galil Hank Sartin Justin Hayford Jack Helbig Henry Sheehan Tanner Howard Drew Hunt J. R. Jones J.R. Jones Jennifer Vanasco Jessica Hopper Jim Healy Jonathan Rosenbaum Joshua Katzman Josh Katzman Anthony Kaufman Kelly Kleiman Asher Klein Shelley Kraicer Shelly Kraicer Nathalie Lagerfeld Adam Langer Lawrence Bommer Lisa Alspector Eric Lutz Peter Margasak Mark Jenkins Martha Bayne Adrian Martin Tom McCormack Meredith Brody Sergio Mims Michael Miner Laura Molzahn Monica Kendrick Adam Morgan Noel Murray Noah Berlatsky Pat Graham Patrick McGavin Patrick Z. McGavin Gerald Peary Richard Pena Mark Peranson Peter Keough Leah Pickett Richard M. Porton Laura Power Quintin Miles Raymer Reece Pendleton Berenice Reynaud Ronnie Scheib Tal Rosenberg Joshua Rothkopf Joshua H. Rothkopf Martin Rubin Ryan Wenzel Ben Sachs Dan Sallitt Dmitry Samarov Ronnie Schieb David Schwartz David P. Schwartz Scott Pfeiffer Ian Simmons Alissa Simon Michael Glover Smith Patrick Somerville Laura Stempel Steve Erickson David Stewart Gwynedd Stuart Mike Sula Ted Shen Julia Thiel Ignatiy Vishnevetsky Kevin Warwick Jessica Weisberg Brianna Wellen Joel Wicklund Albert Williams Michael Wilmington Sam Worley Rating G PG PG-13 R NC-17 X NR Show only Staff Pick Staff Pick Critics Choice Critics Choice Recommended Recommended New New Agenda Agenda Free Free Slideshow Slideshow Video Video Watch on Amazon Watch on Amazon Watch on Netflix Watch on Netflix Watch on Hulu Watch on Hulu Watch on YouTube Watch on YouTube Member Picks Member Picks Other Searches Events Location Guide Member Search Movie Showtimes Movie Reviews Article Archives Issue Archives Slideshows Comments Videos Images Sorting by Name Release Date Film Search Tweet Tools Email Print Share Digg Newsvine del.icio.us Facebook Reddit Twitter Windy Citizen Add to Custom List Loading... Comments The Dukes of Hazzard As soon as it became clear that this remake has nothing to do with real Georgia moonshiners and everything to do with car chases smashups and explosions I could sit back and enjoy it as good stupid fun--a celebration of lawlessness in a crooked county with Burt Reynolds figuring (a little uncomfortably) as the top villain. Cousins Bo (Seann William Scott) Luke (Johnny Knoxville) and Daisy (Jessica Simpson) outwit and outdrive the cops while helping Uncle Jesse (Willie Nelson) keep his farm. With Joe Don Baker and Lynda Carter. Chicago native Jay Chandrasekhar directed the script by John OBrien. PG-13 106 min. By Jonathan Rosenbaum Now Playing Sorry there are no upcoming showtimes for The Dukes of Hazzard Reviews/comments Subscribe to this thread By Email Subscribing... With RSS Comment Add a review Rating Roll over stars and click to rate. Subscribe to this thread Terms of UsePrivacy PolicySubmission GuidelinesAbout The ReaderStaffReader CareersContact UsFreelancing InfoAdvertisingBack IssuesReprints Copyright (c) 2016 Sun-Times Media LLC. Powered by Foundation,http://onfilm.chicagoreader.com/movies/capsules/28324_DUKES_OF_HAZZARD,200,thedukesofhazzard0,thedukesofhazzard,chicagoreader
The Dukes of Hazzard (2005) directed by Jay Chandrasekhar | Film review Go to the content Go to the footer Time Out London London Popular cities London New York Paris Chicago Los Angeles Browse all cities Time Out London Close London Change city London Popular cities London New York Paris Chicago Los Angeles Browse all cities Tickets Offers Things to Do Restaurants Bars amp; Pubs Film Theatre Art Music Attractions Blog Theatre Tickets Shopping Offer of the Day Time Out Card Time Out Escapes Time Out Live Hotels Nightlife Music festivals Events amp; Festivals Kids Museums Clubs Comedy Food amp; Drink Classical Music amp; Opera Dance LGBT City Guide Area Guides Property Competitions Dating Close My Time Out Things I love My lists My Profile My Account Sign out Sign in Create account Sign in With your social account Or with your email Email Password Remember me Forgotten your password? Sign in You can create a Time Out account in two ways... With a few clicks using your favourite social network Or by entering your details below Email First Name Last Name Create password Repeat new password I accept Time Outs terms of use including opt-in to newsletters. Create account Welcome  You have successfully connected your account to Time Out. You may sign in with this account in future. Please confirm your account details Email First Name Last Name I accept Time Outs terms of use including opt-in to newsletters. Sign up My Account Sign in or Create account Search Tickets Offers Things to Do Restaurants Bars amp; Pubs Film Theatre Art Music Attractions Blog Theatre Tickets Shopping Offer of the Day Time Out Card Time Out Escapes Time Out Live Hotels Nightlife Music festivals Events amp; Festivals Kids Museums Clubs Comedy Food amp; Drink Classical Music amp; Opera Dance LGBT City Guide Area Guides Property Competitions Dating More Search The Dukes of Hazzard Film Add review 0 Love It Save it 0 Add review 0 Love It Save it Time Out says Details Users say Time Out says Theres a moment in this latest ramshackle rehash of a vintage TV show when our heroes are baffled. While driving into Atlanta Bo and Luke Duke (Seann William Scott and Johnny Knoxville) - those good old boys raised on moonshine hood-sliding bar brawls and short shorts - receive apparently random cheers and jeers from fellow freeway users; turns out theyve got a giant Confederate flag painted on the roof of their car. Its a moment ripe for the sort of ironic recontextualisation that made an unexpected gem of The Brady Bunch Movie (1995) - an invitation to bounce the inflammatory potential of the Dukes unreconstructed Southern pride off against contemporary sensitivity to the regions thorny legacy. Instead the film gives us bashful dodges (the boys mechanic sidekick painted the flag without their knowledge) and scenes in which the Dukes pose as Japanese scientists and appear in blackface. Whether you find all this inane or offensive will probably depend on whether you buy the Dukes defence of never meaning no harm; either way its pretty hard going. Knoxvilles diffidence and Scotts mildly perverted puppy-dog goofing make an amiable enough match but one that offers lashings of affection-through-pain instead of actual laughs; meanwhile Jessica Simpsons cousin Daisy is one of those strong Hollywood women whose strength derives from exploiting her own sexuality. The plot - revolving around Burt Reynolds Boss Hogg who considerately spells out his plans to strip-mine Hazzard County - is laughably perfunctory too though plenty of attention has gone into some very nifty car chases. The gist seems to be dont sweat the small stuff like tact wit or imagination - lets have fun Which would be okay if it were. By BW Posted Tuesday August 23 2005 Details Release details Rated 12A Release date Wednesday August 24 2005 Duration 106 mins Cast and crew Director Jay Chandrasekhar Screenwriter John OBrien Cast Seann William ScottWillie NelsonBurt ReynoldsJohnny KnoxvilleJessica SimpsonJoe Don BakerLynda Carter Users say LiveReviews|01 person listeningSign inWrite reviewMost helpfulMost helpfulHighest ratingLowest ratingNewestOldestLoadingundefinedNew CommentsRefreshShow More Share Tweet 0 Shares Top About us Work for Time Out Privacy policy Cookie Policy Website terms of use Contact us Time Out for business Get listed Claim your listing Premium Profiles Advertising Time Out products Time Out Card Mobile apps Time Out Shop Time Out Guides Time Out Travel Time Out Offers Time Out Worldwide Time Out magazine Where to get Time Out magazine Subscribe to Time Out magazine Manage my subscription Follow us Facebook Twitter Youtube Instagram Pinterest Spotify Time Out London Site map },http://www.timeout.com/film/82952.html,200,thedukesofhazzard1,thedukesofhazzard,timeout
Error - Houston Chronicle SUBSCRIBE As low as 1.00/week Sign In Home Contact Chron About Houston Chronicle Advertise with Us Place a Classified Ad Niche Publication Ads Careers Store Privacy Policy Terms of Use Newsletters Subscribe HC Archives Mormon phrase on condom packs? Theres the rub Places every Texas kid should see before growing up 12 ways Joanna Gaines of HGTVs Fixer Upper is your spirit Things Texans secretly do but would never admit Local Neighborhoods Neighborhoods All Neighborhoods Bay Area Bellaire Cy-Fair Fort Bend Heights Katy Kingwood Memorial Pearland Spring The Woodlands Houston amp; Texas News Houston amp; Texas News Houston Texas Traffic Weather Weather Radar amp; Forecasts Houston Weather Severe Weather News Hurricane Guide Education Education K-12 Zone Blog School Report Card 2014 Politics amp; Policy Politics amp; Policy Texas Politics Chronicle Investigates Obituaries Staff amp; Reader Blogs Classifieds Columnists Opinions amp; Editorials Opinions amp; Editorials Opinion Editorials Letters to the Editor Outlook Nick Anderson Cartoons La Voz (Espanol) Texas Energy Guide Car veers off road in Baytown driver taken by Life Flight Son of former Texas Aamp;M football player faces capital murder Woman hospitalized after crash in north Houston Reports Man shoots child then turns gun on himself US amp; World US News World News Crime The Americas Politics Science amp; Environment Strange amp; Weird News Videos Video captures deputys dramatic rescue of gunshot victim kids Texas Senator Brian Birdwell finally got to meet the man who Study confirms what gun rights advocates have said for a long Warren Sapp bitten by shark during Florida Keys lobster trip Sports Texans Rockets Astros Dynamo High School Colleges UH Rice UT Aamp;M Outdoors More Sports More Sports Golf Buy Tickets Super Bowl LI DeAndre Hopkins doesnt report for training camp over contract 10 questions facing Texans at training camp Revisiting the Astros best and worst deadline deals Texans extend Rick Smiths contract Business Energy (Fuel Fix) Technology Real Estate Money Tips Business Insider Press Releases Small Business Mgmt Chron 100 Top Workplaces Sponsored Content Legal Notices Business Directory US GDP grows a weak 1.2 percent in second quarter Amazons already large distribution empire keeps expanding Ford surprises with lower 2Q profit on trouble in US China Chipotle branching out plans to open burger restaurant Aamp;E Preview Preview Alison Cook Restaurant Reviews Whine amp; Dine Top 100 Restaurants Guides to Houston Restaurants amp; Bars Music Movies Arts amp; Theater Rolling Stone Us Weekly Radar Online Horoscopes Comics amp; Games Events amp; Things To Do NEW Puzzles 20 tearjerker movies Hollywood should leave alone Meghan Trainor rocks girls night out in Woodlands Chip and Joanna Gaines are just the latest celebrities to visit Chef Randy Ruckers Bramble restaurant has closed Life Health Health The Doctors Mens Journal Live Healthy Escapes Escapes Home amp; Design Travel Style Mom Houston Luxe Life Houston Belief Food amp; Cooking Food amp; Cooking Food amp; Cooking Alison Cook Restaurant Reviews Whine amp; Dine Top 100 Restaurants Society Travel Travel Flight Tracker Texas Road Trips Travel Pets Houston Gives Weddings amp; Celebrations Sponsored Content Local backyard design inspirations thatll make you want to DIY The 50 smoothest pick-up lines in movie history 18 foods you should never feed your pet Why is everyone freaking out about this photo of two bikini-clad Jobs Advanced search Browse job categories Salary Wizard Career Rescue Careers in Engineering Salute to Nurses Work amp; Career Advice Post a Job Is that dream opportunity really a nightmare? These 25 hot jobs pay at least 100K Set a career goal for every month of 2016 The highest-paying entry-level jobs Cars Cars amp; Auto News Heidis Cars Blog New Car Search Used Car Search Certified Car Search Houston Auto Dealers The new Lincoln Navigator concept is too legit to quit Hennessey pushes a Camaro to over 200 MPH Riding the 2016 Indian Chieftain BMW turns 100 years old A look back Real Estate New Homes Second Homes Rentals Home Price Survey Mortgages Commercial Real Estate Farms amp; Ranches Senior Living Chron Homes App Private Party Ads Summer Showcase My Perfect Hous(e)ton Suburban homebuilder develops new Greater Heights neighborhood Glamorous Texas ranch with Hollywood history hits market Shipping container complex to be developed in Houston 115 Years Findamp;Save Roost MenuSections Item Not Found << Return to the Previous Page The item youve requested http//www.chron.com/cs/CDA/moviestory.mpl/ae/movies/reviews/3296708 was not found. Possible causes The address was entered incorrectly The item no longer exists or There has been an error on the site. If you feel the address you entered is correct you can contact us mentioning the error message received and the item you were trying to reach. We apologize for any inconvenience. From here you can Return to the previous page Use the menu bar above Select an item from our site index below Logo Return to Top About Our Company Careers Advertise with Us Ad Choices Terms amp; Conditions Privacy Policy Your California Privacy Rights Contact Customer Service Newsroom Contacts Connect Email Newsletter Facebook Twitter Pinterest Google Instagram Subscribe iPad app HoustonChronicle.com Houston Chronicle Archives eEdition Demo Todays eEdition Hearst Newspapers (c) Copyright Hearst Newspapers LLC,http://www.chron.com/cs/CDA/moviestory.mpl/ae/movies/reviews/3296708,404,thedukesofhazzard2,thedukesofhazzard,chron
"Movies - Salon.com Salon Home News news Obamas DNC letdown The president needed to hit it out of the park but he surprisingly fell short Amanda Marcotte Shock poll Nate Silvers election forecast now has Trump winning Sophia Tesfaye ""Im a New Yorker and I know a con when I see one"" Mike Bloomberg goes to the DNC to knockout Trump Sophia Tesfaye Politics politics 2016 Elections Obamas DNC letdown The president needed to hit it out of the park but he surprisingly fell short Amanda Marcotte 10 reasons why DemExit is serious Getting rid of Debbie Wasserman Schultz is not enough Sophia A. McClennen Shock poll Nate Silvers election forecast now has Trump winning Sophia Tesfaye Entertainment entertainment Books Movies Music TV ""America will finally catch up with 1960 Sri Lanka"" Stephen Colbert puts Hillarys run in perfect perspective Brendan Gauthier Watch the Rolling Stones sing about Rice Krispies in this 1960s ad Michael Garofalo The Bourne Masculinity Matt Damons hyper-aggressive emotionally fragile ""good guy with a gun"" Eileen GSell Life life Life Stories Love amp; Sex Parenting Conservatives mad at Hilton for showing gay couple in ad Mary Elizabeth Williams JoJo returns ""I ate 500 calories a day. It was the most unhealthy thing Ive ever done."" Mary Elizabeth Williams Donald Trump thinks LGBT lives matter--but only if theyre victims of a terrorist attack Nico Lang Business business Wall Street Finance Labor In what is quickly becoming the age of Prime why do investors still hate Amazon? Scott Eric Kaufman With Gigafactory Elon Musk makes ""bid to be the Henry Ford of this era"" Scott Eric Kaufman Verizon purchases Yahoo for 4.83 billion Scott Eric Kaufman Elections 2016 elections 2016 Log out Sign in Movies The Bourne Masculinity Matt Damons hyper-aggressive emotionally fragile ""good guy with a gun"" The saga of Jason Bourne traumatized hero as emblem of unapologetic white-male violence turns 14 with a new film Eileen GSell Friday Jul 29 2016 1100 PM UTC 0 Entertainment Editors Picks Film Allison Janney opens up On being ""fragile but tough on the outside"" and the questionable things shes done for love Salon talks to the ""Talullah"" star about reuniting with Ellen Page using insecurity in her art and ambivalent moms Gary M. Kramer Friday Jul 29 2016 1058 PM UTC 0 Entertainment Allison Janney Editors Picks If you have to ask ""How To Tell Youre a Douchebag"" filmmaker on making his Twitter-era rom-com Salon talks to Tahir Jetter about Internet dating Twitter dissertations and making indie art from ""poor decisions"" Gary M. Kramer Thursday Jul 28 2016 1059 PM UTC 0 Entertainment A new heyday of horror Why the scary movie just might save Hollywood from itself Modestly-budgeted horror films arent just doing well at the box office--theyre charming critics too Nico Lang Monday Jul 25 2016 1105 PM UTC 0 Entertainment horror films It Follows Holy backlash Batgirl ""The Killing Joke"" opens in the shadow of a Comic-Con panel gone wrong The newest Batman animated film based on Alan Moores controversial one-off is being criticized over sexist story Scott Timberg Monday Jul 25 2016 1059 PM UTC 0 Entertainment alan moore Animation Batman The fall of ""Divergent"" The final film will bow on TV -- heres why it matters The YA-movie niche -- the domain of young female stars -- is withering; Hollywood doesnt know whats next Nico Lang Sunday Jul 24 2016 730 PM UTC 0 Entertainment divergent Editors Picks Forever Captain Kirk William Shatner opens up about ""fandom frenzy"" and 50 years of ""Star Trek"" As ""Star Trek"" turns a half-century old Salon talks to icon William Shatner about his career-defining role Ethan Gilsdorf Friday Jul 22 2016 1100 PM UTC 0 Entertainment captain kirk Editors Picks How Mike Birbiglia and Keegan-Michael Key found common comedy ground ""He helped me make less of it"" Salon talks to Birbiglia and Key about their new improv-troupe comedy ""Dont Think Twice"" Gary Kramer Friday Jul 22 2016 1058 PM UTC 0 Entertainment Comedy dont think twice ""Star Trek Beyond"" Humor and adventure abound in this course-correcting sequel The third film in the rebooted series may not go boldly but its a welcome homecoming for the beloved franchise Nico Lang Thursday Jul 21 2016 1100 PM UTC 0 Entertainment Movies review science fiction The sound of Beatlemania Can this new release of ""Hollywood Bowl"" redeem the Fab Fours live record? Heres hoping the Hollywood Bowl concerts released alongside Ron Howards documentary allow us to hear the band Scott TImberg Thursday Jul 21 2016 413 PM UTC 0 Entertainment George Martin Movies Music Drugs despair disintegration 20 years later ""Trainspotting"" still resonates Between its portrayal of drug subculture alienation and Scottish nationalism Danny Boyles film needs a new look Scott Timberg Tuesday Jul 19 2016 734 PM UTC 0 Entertainment Danny Boyle Film Irvine Welsh Buying ""Ghostbusters"" -- or not How buying in or boycotting a summer family movie became a political act Paul Feigs reboot demonstrates how purely consumerist decisions now feel more meaningful than they really are Matthew Rozsa Friday Jul 15 2016 1100 PM UTC 0 Entertainment Editors Picks Feminism Norman Lear sits down with Salon ""Trump is the middle finger of the American right hand"" Archie Bunker wouldnt vote for Trump insists his 93-year-old creator now the subject of an irresistible film Andrew OHehir Thursday Jul 14 2016 1100 PM UTC 0 Entertainment All in the Family Comedy ""Science fiction cyber-war is here"" Alex Gibney on ""Zero Days"" and Stuxnet the secret weapon that got away Salon talks to Oscar-winner Alex Gibney about his new film ""Zero Days"" and a new era of war Andrew OHehir Wednesday Jul 13 2016 1100 PM UTC 0 Entertainment Alex Gibney The growing gender divide over ""Ghostbusters"" Why movies starring women get slimed by male critics Because film criticism is so male-dominated men have a disproportionate say--especially on movies about women Nico Lang Tuesday Jul 12 2016 1059 PM UTC 0 Entertainment Criticism female ghostbusters The new ""Ghostbusters"" delivers Its a cheerful exercise in feminist nostalgia -- except wait is that possible? If you can handle the shock of four female ""Ghostbusters"" Paul Feigs remake is a cheerful summer diversion Andrew OHehir Tuesday Jul 12 2016 320 PM UTC 0 Entertainment Bill Murray Comedy Dan Aykroyd How Matt McGorry falls in love ""When I do Im all in"" Salon talks to the TV star--and Twitters ""woke bae""--about his starring role in new indie film ""How He Fell in Love"" Gary M. Kramer Friday Jul 8 2016 1100 PM UTC 0 Entertainment Editors Picks Meet North Koreas perfect family Totalitarianism Trump and the politics of non-thought An upside-down propaganda film made with North Koreas approval offers a distorted reflection of our own politics Andrew OHehir Tuesday Jul 5 2016 1100 PM UTC 0 Entertainment Documentaries Documentary Pop culture still fails queer people Sanitizing LGBT romance is a tradition Hollywood cant seem to break ""Independence Day Resurgence"" can imagine all kinds of futuristic wonders--but not two men who are in love kissing Nico Lang Tuesday Jul 5 2016 1059 PM UTC 0 Entertainment Film independence day 2 Girl on girl crimes ""The Neon Demon"" makes women look like the real predators in the modeling world Nicolas Winding Refns shocker manages to deftly sideline all the ways that men prey on vulnerable women in the biz Nico Lang Sunday Jul 3 2016 1030 PM UTC 0 Entertainment Editors Picks Film Gender Page 1 of 299 in Movies Previous follow salon brought to you by Most Read Obamas DNC letdown The president needed to hit it out of the park but he surprisingly fell short Amanda Marcotte 10 reasons why DemExit is serious Getting rid of Debbie Wasserman Schultz is not enough Sophia A. McClennen Shock poll Nate Silvers election forecast now has Trump winning Sophia Tesfaye ""Im a New Yorker and I know a con when I see one"" Mike Bloomberg goes to the DNC to knockout Trump Sophia Tesfaye The right-wing spin machine in action Conservatives race to clean up mess from Trumps insane news conference Gary Legum Billionaires brawl Donald Trump throws Twitter temper tantrum after ""Little"" Mike Bloombergs DNC speech Brendan Gauthier Erasing Melanias past Her website gets scrubbed amid reports she lied about college degree Brendan Gauthier ""America will finally catch up with 1960 Sri Lanka"" Stephen Colbert puts Hillarys run in perfect perspective Brendan Gauthier Trump escalates his war with the press Washington Post reporter barred from Mike Pence rally patted down by police Sophia Tesfaye Kentucky fire chief refuses to help black family after traffic accident ""We aint taking no n--gers here"" Jenny Kutner Dont worry about Trumps ""lead"" yet Its too early to stress about the polls Gary Legum WATCH Father of fallen U.S. Muslim solider offers Trump a copy of his pocket Constitution at DNC Sophia Tesfaye Civil rights advocate Rev. Dr. William Barber Faith shouldnt be used ""to serve hate fear racism and greed"" Brendan Gauthier Watch the Rolling Stones sing about Rice Krispies in this 1960s ad Michael Garofalo Hanging with ""The Bernouts"" and Jill Stein The Bernie-or-bust crowd is loud at the DNC -- but theyre powerless Amanda Marcotte From Around the Web Presented by Zergnet About | Advertising | Contact | Corrections | Help | Investor Relations | Privacy | Terms of Service Copyright (c) 2016 Salon Media Group Inc. Reproduction of material from any Salon pages without written permission is strictly prohibited. SALON (r) is registered in the U.S. Patent and Trademark Office as a trademark of Salon Media Group Inc. Associated Press articles Copyright (c) 2016 The Associated Press. All rights reserved. This material may not be published broadcast rewritten or redistributed.",http://www.salon.com/ent/movies/review/2005/08/05/dukes_of_hazzard,200,thedukesofhazzard3,thedukesofhazzard,salon
