review,link,status_code,id,movie_key,critic
"The Final | Variety Variety Editions U.S Latino Global Asia Subscribe Today Navigation Menu Film TV Digital Contenders Video Dirt Jobs More Biz Music Legit Scene Conferences Insight Archives Directory Choose Edition U.S Latino Global Asia Russia | My Account Sign In Subscribe HomeFilmReviews Review The Final Dennis Harvey Film Critic 0 Share This Article Email LinkedIn Pin It Tumblr February 8 2010 | 1032AM PT A group of high school outcasts wreaking elaborate vengeance on tormenting classmates. Probably the most polished U.S. title in this years After Dark Horrorfest veteran assistant/second unit director Joey Stewarts feature directorial bow ""The Final"" has a group of high school outcasts wreaking elaborate vengeance on tormenting classmates. Pic takes itself pretty seriously which works during the buildup less so once it veers into torture-porn terrain. For better or worse resulting queasy mix of horror conventions and Columbine-type exploitation is likely to win some fans via Lionsgate DVD release next month. Five kids endlessly picked on by their suburban schools noxious jocks and jockettes (who are a bit over-caricatured) anonymously invite those foes to a costume party on rural property recently inherited by Dane (Marc Donato). Knocked out by spiked punch the attendees awaken chained together their masked hosts promising they wont be killed -- but by nights end theyll wish they had been. One by one theyre subjected to harsh gruesome punishment for prior cruelties though of course not everything goes as planned. Leads (several former child thesps) and handling are good though theres some stilted dialogue and too much stagy lecturing by Dane in Jason Kabolatis script. The FinalProductionAn After Dark Films release of an Agora Entertainment presentation in association with Final Fate Features. Produced by Jason Kabolati. Executive producers Edward Lewis Von Hohn Bill Randle. Directed by Joey Stewart. Screenplay Jason Kabolati. CrewCamera (color HD) David McFarland; editor Bill Marcellus; music Damon Criswell; production designer Eric Whitney. Reviewed on DVD San Francisco Feb. 4 2009. MPAA Rating R. Running time 92 MIN. With Marc Donato Jascha Washington Whitney Hoy Justin Arnold Travis Tedford Julin Lindsay Seidel Mark Nutter Hunter Garner Eric Isenhower Preston Flagg Matthew Posey Laura Ashley Samuels Vincent Silochan Farah White Daniel Ross Ryan Hayden. Want to read more articles like this one? SUBSCRIBE TO VARIETY TODAY. Post A Comment 0 Variety Jobs Creative Development Coordinator Triptyk Studios New York New York Account/Project Coordinator (Ad Agency) Petrol Advertising Burbank California Media Specialist Bridgewater Associates Westport Connecticut Executive Director Aspen Film Company Confidential Aspen Colorado Associate Director YouTuber amp; Gamer Partnerships Save the Children Fairfield Connecticut See More Jobs Marketplace Leave a Reply No Comments Cancel reply Comments are moderated. They may be edited for clarity and reprinting in whole or in part in Variety publications. Enter your comment here... Fill in your details below or click an icon to log in Email (required) (Address never made public) Name (required) Website You are commenting using your WordPress.com account. ( Log Out / Change ) You are commenting using your Twitter account. ( Log Out / Change ) You are commenting using your Facebook account. ( Log Out / Change ) You are commenting using your Google+ account. ( Log Out / Change ) Cancel Connecting to %s Notify me of new comments via email. Notify me of new posts via email. More Film News from Variety The Power of Content Divorce Marks Sarah Jessica Parkers Return To HBO But... John Legend Shares Adorable New Snap Of Baby Luna -- See The Cute... Cara Delevingne Steps Out In Christian Louboutin Over-The-Knee... Westworld Creators Reveal Reason for 2-Month Production Shutdown Pokemon Go update for Android has a very annoying feature... Subscribe to Variety Today All The Ways to Get Variety Online Subscription Print Subscription Mobile Apps Newsletters News Alerts Archives Slanguage Dictionary Help Other Variety Products MediaVariety 411 Research amp; DataVariety Insight Archives Premium Email Alerts Real Estate Jobs Access the best entertainment industry data available View the Variety archives dating back to 1905 Get News Delivered To Your Inbox Privacy Policy Your Privacy Rights Terms of Use About Us Advertise Contact Us Google+ The Power of Content Deadline india.com Hollywoodlife hollywood TV Line BGR WWD Footwearnews (c) Copyright 2016 Variety Media LLC a subsidiary of Penske Business Media LLC. Variety and the Flying V logos are trademarks of Variety Media LLC. Powered by WordPress.com VIP Variety411 Your production services resource",http://www.variety.com/review/VE1117942103.html?categoryid=31&cs=1,200,thefinaldestination0,thefinaldestination,variety
"Review The Final Destination - latimes Advertisement YOU ARE HERE LAT Home-Collections-ReviewMOVIE REVIEW Review The Final DestinationOnce again attractive young people try to cheat death. Silly them. The filmmakers waste little plot or character development on dispatching them with 3-D gore.August 31 2009|Gary Goldstein It doesnt take 3-D trickery to see everything coming at you from a mile away in ""The Final Destination"" the silly and predictable fourth installment in the lucrative thriller series about pretty young people attempting to cheat death. Director David R. Ellis and writer Eric Bress who previously collaborated on ""Final Destination 2"" unimaginatively rehash the earlier films basic premise Someone foresees a gruesome group death that may or may not play out in reality if the order of the originally envisioned victims can be disrupted.Though this latest entry has an OK sense of humor moves swiftly enough and sports an effective opening sequence of racetrack destruction that puts its Fusion 3-D technology to good use it mostly comes off as a particularly flimsy excuse to string together a bunch of gory killings.Its at the doomed speedway that good guy Nick (Bobby Campo) inexplicably has a premonition in which he and his girlfriend Lori (Shantel VanSanten) their best friends Janet (Haley Webb) and cavalier stud Hunt (Nick Zano) along with various other spectators are killed as the result of a horrific race car crash. Unhinged by his grisly prophecy Nick persuades the crowd to make a hasty exit just seconds before the hell he imagined actually breaks loose saving the lives of most everyone around him."");document.close();})(); frameborder=""0"" scrolling=""no"" width=""649"" height=""160""gt;But later when Nicks fatal visions continue and the folks from the speedway start dying in the order he first predicted the race is on to save all those on Nicks mental list before they prematurely meet their ""final destinations"" via a series of outlandish Rube Goldberg-esque accidents. Can one town really have so many public structures that are literally coming apart at the seams?Aside from an unnerving ride through a self-serve carwash the rest of these death or near-death scenes are unmemorable and squeeze out few thrills from the 3-D process. As for the movies characters theyre strictly one-dimensional.--calendarlatimes.com--The Final DestinationMPAA rating R for strong violent/gruesome accidents language and a scene of sexualityRunning time 1 hour 22 minutesPlaying In general release"");document.close();})(); frameborder=""0"" scrolling=""no"" width=""649"" height=""110""gt; MORESeizure Led to FloJos DeathHis 104 scores make his caseRestaurant review South Beverly GrillBrutal Murder by Teen-Age Girls Adds to Britons ShockComaneci Confirms Suicide Attempt Magazine SaysAdvertisement FROM THE ARCHIVESNew on DVD The First GraderDecember 25 2011Final Destination franchise lives onAugust 11 2011Cheating on School TestsOctober 2 1988"");document.close();})(); frameborder=""0"" scrolling=""no"" width=""300"" height=""250""gt;MORE STORIES ABOUTReviewYoung PeopleFinal DestinationCopyright 2016 Los Angeles TimesTerms of Service|Privacy Policy|Index by Date|Index by Keyword","http://www.latimes.com/entertainment/news/la-et-final-destination31-2009aug31,0,4179548.story",200,thefinaldestination1,thefinaldestination,latimes
"Movie Reviews The Final Destination Halloween II Worlds Greatest Dad | L.A. Weekly NewsVPoliticsCommunityCrimeLongformBest of L.A.Daily NewsletterWeekly NewsletterMusicVConcert CalendarHenry RollinsBars amp; LoungesBest of L.A.Music NewsletterFood amp; DrinkVRestaurant ReviewsL.A. Restaurant GuideBars amp; LoungesBest of L.A.99 Essential RestaurantsFarmers MarketsFood amp; Drink NewsletterArts amp; CultureVFilm and TVTheaterComedyBest of L.A.Arts amp; Culture NewsletterCalendarVSubmit an EventConcertsThings To Do NewsletterFilm amp; TVVNews amp; InterviewsFilm ReviewsShowtimesTrailersFilm amp; TV NewsletterLongformMarijuanaVMarijuana NewsDispensariesStrainsMarijuana NewsletterVideosSlideshowsBest Of L.A.VBest of L.A. 2015Readers Choice PollBest Of NewsletterNewslettersPromotionsVPromotional EventsStreet TeamFree StuffPromotions NewsletterCrafty Bastards Beer ClubClassifiedsVAfter DarkAd Index Apps About Us Contact Us Staff Advertise E-Edition Privacy Terms menu Movie Reviews The Final Destination Halloween II Worlds Greatest Dad Old Irrelevant Comedians Whine About Censorship in Can We Take a Joke? Remember Me SIGN IN > Forgot Password? Or sign in with a social account FACEBOOK GOOGLE + TWITTER YAHOO Dont have an account yet? Sign Up > Connect. Discover. Share. Get the most out of your experience with a personalized all-access pass to everything local on events music restaurants news and more. Enter your email or sign up with a social account to get started FACEBOOK TWITTER GOOGLE+ YAHOO Privacy Policy SIGN UP > Already registered? Login > Email Username Password Name Zipcode DONE MVN Sign In > Dont have an account yet? Sign Up > Facebook Twitter Follow laweekly Other LA Weekly Movie Reviews The Final Destination Halloween II Worlds Greatest Dad Wednesday August 26 2009 at 9 p.m. By LA Weekly CLOUD 9 Seamstress Inge (Ursula Werner) professorial husband Karl (Horst Westphal) and silver fox Werner (Horst Rehberg) form a Berlin love triangle with more than 200 collective years of experience. She strikes up the affair after hand-delivering a pair of pants and within minutes their living room-floor intimacy goes beyond whether Werner dresses left or right. Rather than a tale of geriatric groove-getting German director Andreas Dresens film dwells on Inges ambivalent compartmentalizing Shes in love with her reliable companion of three decades yet newly contented with her escape from routine and demurring when pressed about her intentions. German theater veterans the age-appropriate actors improvised their dialogue but often accomplish more through silence and the eloquence of their old faces. The psychology is rudimentary however and Werner the caring Other Man is little more than a sketch a hale figure out of a prescription-drug ad. Inges vacillations are mechanically interspersed with her participation in a choir and family gatherings. Besides the frank blithe sex scenes a melodramatic ending aims to banish any last hope of gemutlichkeit but the film comes to feel curiously incomplete like one long fretful afternoon. (Royal; Playhouse 7; Town Center 5) (Nicolas Rapold) A A Facebook- Twitter - More shares recommend reddit email - - THE FINAL DESTINATION Fatality lurks around every ceiling fan shampoo bottle and espresso machine in the fourth entry in New Line Cinemas improbably long-running death-by-misadventure franchise focused on yet another group of friends who narrowly escape a catastrophic accident only to learn the hard way that when your numbers up it really is up. The Grim Reaper seems to have taken a hit from the lean economic times judging from The Final Destinations el cheapo Canada-as-Anytown USA production values and sub-One Tree Hill cast; but as usual all that is merely fuel for the series signature domino-effect death scenes here rendered in shlock-o-riffic 3-D by director David R. Ellis (Final Destination 2 Snakes on a Plane) bringing all manner of bodily impalement and dismemberment as close as the butter on your popcorn. Ellis and screenwriter Eric Bress even go all meta on us with an Inglourious Basterds-esque finale set inside a 3D cinema though their set pieces never quite muster the giddy brio of Final Destination 1 and 3 auteur James Wong at his best. They come close however in what Im fairly certain is the silver screens first episode of pool-drain disembowelment. And to think people say there are no fresh ideas in Hollywood anymore. (Citywide) (Scott Foundas)FIVE MINUTES OF HEAVEN Guy Hibberts novel-writing process for Five Minutes of Heaven is an interesting experiment. In 1975 Ulster Alistair Little killed Catholic Joe Griffens brother; decades later Alistair and Griffen unburdened themselves to Hibbert about the event and speculated on what would happen if they ever met. (They never did.) Then Hibbert wrote this movie. He and director Oliver Hirschbiegel use the killing itself as a starting point in an atmospheric prologue. The production design is spot-on but Hirschbiegel tries way too hard to create tension making every occurrence -- a record needle dropping a car door slamming -- an unsubtle potential bomb fraying your nerves like a cheap horror movie. The next two acts are hypotheticals Little (Liam Neeson) and Griffen (James Nesbitt) almost meet 25 years after the shooting while taping a BBC program about reconciliation but Griffen backs out at the last second. This near-brush plays out as a bad one-act play with internal monologues on both sides; Neesons too calmly patrician to convey Littles real inner turmoil though Nesbitts Griffen is hilariously splenetic. Its a hell of a show when he goes off but nothing can be done with lines like ""Thats the trouble with me. I have all the wrong feelings."" Then finally theres the physical confrontation which plays like a bone-crunching and foleyd-out fight scene from the Bourne series. The three parts never coalesce even if they all have potential. (Nuart) (Vadim Rizov) HALLOWEEN II Serial killer Michael Myers it turns out has mother issues. In this disappointing sequel to his intense and much underrated 2007 remake of John Carpenters 1978 classic Halloween rock star turned filmmaker Rob Zombie sends Michael (Tyler Mane) on another killing spree at the urging of his now-dead mom (Sheri Moon Zombie) who appears (all too frequently) as a beckoning ghost standing next to a white horse. Once again Michael hunts baby-sitter extraordinaire Laurie Strode (Scout Taylor-Compton) whos living one year after the first films murders with the town sheriff (Brad Dourif). In his 2007 movie Zombie dug deep into Michaels screwed-up white-trash family history a process which humanized Michael and made his subsequent brutality all the more unsettling. This time Zombie doesnt appear to have many deep thoughts so Michael doesnt just stab his victims he slices and chomps them into gooey pulp -- an overkill motif that actually feels false to the character and quickly becomes a depressing bore. As evidenced by his previous Halloween flick and 2005s astonishing (and irredeemably brutal) The Devils Rejects Zombie has talent to burn but hes slumming here and one suspects that he knows it. (Citywide) (Chuck Wilson) Upcoming Events Paleyfest Previews Fall TV On Abc Tickets Sat. Sep. 10 1200pm Paleyfest Previews Fall TV On the CW Tickets Sat. Sep. 10 600pm Paleyfest Previews Fall TV On CBS Tickets Mon. Sep. 12 600pm Paleyfest Previews Fall TV On NBC Tickets Tue. Sep. 13 600pm THE OPEN ROAD Justin Timberlake cuts such a cocky carefree figure in his videos and on Saturday Night Live that its surprising (not to mention physically uncomfortable) to watch him struggle through The Open Road a weak pulse of a father-and-son road drama. Timberlake plays Carlton a slumping Texas minor-league ballplayer whose ailing mother (Mary Steenburgen) asks him to track down his estranged father Kyle ""Lone Star"" Garrett (Jeff Bridges) a celebrated retired slugger who spends his time charming fans at conventions and uttering Dan Rather-worthy down-home expressions like ""That girls finer than the hair on a frog."" With his supportive ex-girlfriend Lucy (Kate Mara) by his side Carlton flies to Ohio to retrieve dad but complications force the trio to drive back to Texas which provides many opportunities for random conflicts and heartfelt conversations -- and for viewers to check their watches. Unceremoniously dumped into theaters without advance screenings The Open Road isnt an unwatchable howler -- instead writer-director Michael Merediths film is merely dull and obvious. As for Timberlake his success as a pop star is attributable to his graceful nonchalance which registers as awkward shallowness when set against The Open Roads leaden earnest conventionality. Even worse only one of the two male leads sings during the film -- and its not J.T. (Sunset 5) (Tim Grierson)ORGIES AND THE MEANING OF LIFE To maintain erections while bedding a succession of women Baxter (played by writer-director Brad T. Gottfred) fantasizes that hes surrounded by a bevy of sexually compliant partners from his past including his strap-on wearing ex-wife who sodomizes him. These imagined orgies arent just about orgasm however theyre part of Baxters quest to resolve his existential angst. Working with the earnestness and philosophical depth of an undergrad film student Gottfred (a sexy average-Joe type) blends familiar tropes the struggling writer trying to get past a mental block; the son trying to wiggle out of the shadow of an overbearing religious father; the male artist forcing the roles of muse and savior on the women in his life. The sum isnt freshness; its tedium. Dialogue ranges from exposition-heavy to cutesy (""I think Im stalking you. Please stalk me back"") while the performances are little better. Orgies lone strength are its animated sequences in which Baxters stick-figure stand-in embarks on a quest to find a portal into the 3-D world. Though the symbolism is heavy-handed and the writing as cliched as in the live-action scenes these interludes have an energy and poignancy otherwise lacking in the film. (Grande 4-Plex) (Ernest Hardy)PLAY THE GAME In 2007 Waitress established that octogenarian TV legend Andy Griffith still had game as a sly charmer but Marc Fienbergs poky romcom does his legacy no favors by casting Griffith as an accidentally subversive caricature of his Mayberry prime. ""Grandpas horny"" declares Griffiths lonely widow Joe with sitcom believability and in a parallel twist on boob-tube history his estranged son is played by Ron Howards goofy brother Clint. But this Lifetime-ready comedy is hardly provocative -- let alone perceptive funny or fresh -- so the respect Fienberg mightve earned for addressing the love lives of the elderly is squashed by its insipid A plot in which Joes playboy grandson David (Paul Campbell) must learn to grow up and stop single-mindedly chasing pussy. The young pick-up artist teaches the old dog some gimmicky tricks buying his gramps a baby blue tracksuit and backward baseball cap and offering him piggish formulas that begin like ""Step 1 ... reconnaissance."" The reversal is predictable David suddenly schemes for monogamous companionship with characterless cutie Julie (Marla Sokoloff) while Joe pops Viagra and humps half the retirement home. Were thankfully only treated to a chaste closeup of Griffiths doughy puppet face as hes getting head -- think Avenue Q. (Music Hall; Town Center 5) (Aaron Hillis)THIS BEAUTIFUL CITY Beware films in which characters have been saddled with ironic names in Toronto playwright Ed Gass-Donnellys multihyphenate debut feature This Beautiful City Kristin Booth plays a perpetually wasted prostitute named Pretty. Along with her strung-out boyfriend Johnny (Aaron Poole) Pretty occupies the lowest rung of Torontos social ladder but as Gass-Donnellys script (adapted from his own play Descent) labors to illustrate a loftier economic perch is no guarantor of happiness either. The films first act finds Johnny and Pretty bearing witness to the maybe-accidental balcony plunge of condo-frau Carol (Caroline Cave) previously seen bitching at her husband Harry (Noam Jenkins) -- the implication being that this well-manicured young woman opted for suicide over one more day in upscale-young-married hell. But Carol survives and the film continues with the two couples brought into each others orbit through a series of elaborate (and generally predictable) narrative contrivances. After establishing at length that were dealing with spectacularly damaged people (but of course This is a Canadian drama) the plot works itself into a melodramatic lather of anguished breakups cross-caste hookups and looming violence shot in a ragged blur of super 16mm -- that tired ersatz signifier of urban ""reality."" The only real notes of authenticity are struck by the actors and even then only on the distaff side. Booth -- last seen as one of the Young People Fucking -- plays against her looks without descending into grotesquerie while Cave playing a woman in the midst of a troubled convalescence (as she did in David Christensens excellent Six Figures) gives a physically fearless performance. (Grande 4-Plex) (Adam Nayman)  GO  WORLDS GREATEST DAD Playing dark Robin Williams has developed the burly insecurity and gargoyle frown of damned Edward G. Robinson in Fritz Langs Scarlet Street -- with Worlds Greatest Dad he almost has the movie to match. Lance (Williams) is an unpublished serial novelist and an unpopular poetry teacher at the same high school attended by the son Kyle (Daryl Sabara) he is raising alone who incarnates every nightmare of downloaded premature debauchery a physical virgin and Caligula of the mind. Sabara whose few scenes of abject irredeemability leave a lingering stain on the movie is point man for a perfect cast with the standouts including his lone sallow school friend Evan Martin and Henry Simmons as an alpha-male teacher and unflattering contrast to Lance. The particular stew of midlife and pubescent despair that clogs a single-father male-child household has rarely been achieved so well Lances parental tough love is a trailed-off ""ahh ..."" The details of leftover dinosaur-themed wallpaper (unnoticed as it peels) and the dirty sneaker prints on the glove compartment are enough to convince that screenwriter-director Bobcat Goldthwait knows his stuff. His cringer lands improbably on its feet after every reckless plot turn -- involving autoerotic asphyxiation and fraudulent authorship -- all the way until an over-fondness for music montage fells it in the last reel. (The Landmark; Sunset 5; Playhouse 7; Town Center 5) (Nick Pinkerton) Old Irrelevant Comedians Whine About Censorship in Can We Take a Joke? NEXT Contact LA Weekly Follow LA Weekly laweekly L.A. Weekly Film amp; TV L.A. Weekly Film amp; TV Film Film and TV Film Reviews Get the Film amp; TV Newsletter Stay up to date on the best new movies with our critics latest reviews interviews and trailers for the films coming to a theater near you each week. GO Cancel Submit Comments In Case You Missed It The State of the Comedy Game Show Notes on Match Game and... The Low-Key Petes Dragon Dares to Mostly Let Its Beast Chill All-Too-Normal Activity Dominates the Ghostbusters Remake In The Night Before Seth Rogen and Co. Grow Up -- Again Upcoming Events Movie The Seeds Pushin Too Hard Tickets Thu. Aug. 25 900pm Paleyfest Previews Fall TV Fan Pass Tickets Thu. Sep. 8 600pm Paleyfest Previews Fall TV On Fox Tickets Thu. Sep. 8 600pm Paleyfest Previews Fall TV On El Rey Tickets Fri. Sep. 9 600pm Popular Stories All-Too-Normal Activity Dominates the Ghostbusters Remake Ab Fab at Last Patsy and Edina Return Just When We... Ali Wongs Baby Cobra Have We Entered Televisions... Stranger Things Is the Best-Ever Miniseries Adaptation... Sponsor Content (c)2016 LA Weekly LP. All rights reserved. Newsletters All-access pass to the top stories events and offers around town. Top Stories Send Sign Up gt; Remind Me Later gt; No Thanks gt; Privacy Policy Newsletters All-access pass to top stories events and offers around town. Sign Up gt; No Thanks Remind Me Later gt;",http://www.laweekly.com/2009-08-27/film-tv/movie-reviews-the-final-destination-halloween-ii-world-39-s-greatest-dad/,200,thefinaldestination2,thefinaldestination,laweekly
