review,link,status_code,id,movie_key,critic
"The Final Destination Horror sequel serves up simple instantly forgettable fun - NY Daily News Trending DEMOCRATIC NATIONAL CONVENTION HILLARY CLINTON KESHIA KNIGHT PULLIAM MICHAEL JORDAN DONALD TRUMP Sections Sections Home New York NYC Crime Bronx Brooklyn Manhattan Queens Education Weather Obituaries Sports Yankees Mets Giants Jets Knicks Nets Rangers Islanders Football Basketball Baseball Hockey Soccer College High School The Score More Sports News Crime U.S. World Politics Entertainment Gossip Games Entertainment Pics TV Movies Music Theater amp; Arts Horoscopes Daily Weekly Monthly Pet Horoscopes Lifestyle Health Homes Food Opinion Autos Buyers Guide Ratings amp; Reviews News amp; Views Photos amp; Galleries Covers Classifieds Trending DEMOCRATIC NATIONAL CONVENTION HILLARY CLINTON KESHIA KNIGHT PULLIAM MICHAEL JORDAN DONALD TRUMP entertainment Follow Us Facebook Twitter Instagram Pinterest YouTube Subscribe Follow UsNewsletter App Subscriptions Subscribe Get Our Newsletter A daily blend of the most need-to-know Daily News stories delivered right to your inbox. Sign Up Get the latest breaking news entertainment sports and more.Download Our App Subscribe to the newspaper our e-edition or both.Subscribe Select Sport Football Basketball Baseball Hockey Soccer College High School More Sports Gossip Games Entertainment Pics TV Movies Music Theater amp; Arts Share This facebook Tweet email The Final Destination Horror sequel about friends who try cheating death simple forgettable fun The Final Destination Horror sequel serves up simple instantly forgettable fun Elizabeth Weitzman Saturday August 29 2009 622 AM facebook Tweet email If youve seen one--or three--other ""FD"" movies you know where this ends. But its not really the destination that matters. (Courtesy of New Line Cinema) Elizabeth Weitzman Saturday August 29 2009 622 AM Title Despite the racecars that wreak such outrageous havoc in ""The Final Destination"" the fourth installment of this unkillable series is definitely the go-kart entry in the weekends horror face-off. If you like your gore hardcore youll want to head straight for ""Halloween II."" But if youre happy to ease around a slightly smaller track look no further.What the ""FD"" franchise does best is recognize its place as uncomplicated instantly forgettable fun. Director David R. Ellis and writer Eric Bress barely break a sweat but they do keep up their end of the deal by sticking to a formula thats never faltered survivors of an accident are stalked by a reaper with a stubborn streak and a wicked sense of humor.This time around a bunch of twentysomething friends start out at the racetrack where Nick (Bobby Campo) envisions an impending disaster. He convinces the rest to leave just in time but of course that just means hes prolonged their agony. Death doesnt like to be cheated so Nick watches as first one friend and then another dies in absurdly nasty fashion. He and the tracks security guard (Mykelti Williamson) believe theres a way to break the chain but theyre up against a pretty formidable foe.If youve seen one--or three--other ""FD"" movies you know where this ends. But its not really the destination that matters. Its the trip which inevitably goes from suspenseful setup to last-minute twist to demented demise. Fires explosions and crashes all figure prominently but Ellis is equally happy to make the most of a misplaced rock or untied shoelace. (Its definitely worth choosing the 3D option; just watch out for flying eyeballs.)With the exception of Williamson the actors are as disposable as their characters and there is no story to speak of. Instead everyone appears fully focused on the primary goal to deliver tongue-in-cheek suspense until the moment the victims cheek is blown to shreds. Every installment of ""FD"" feels like a next-generation copy of the last--slightly weaker but still recognizable. Fans know just what theyre getting and as long as they dont expect anything more theyll get what they came for. Horror sequel about friends who try to cheat death. With Mykelti Williamson Bobby Campo. Director David R. Ellis (122). R extreme violence language sexuality partial nudity. At area theaters. Send a Letter to the Editor Join the Conversation facebook Tweet PC Richard and Son Get Daily News stories delivered to your inbox. Sign Up Follow Us Facebook Twitter Instagram Pinterest YouTube Keep in Touch Newsletter Apps Subscribe Feeds Support amp; Contact Contact Us Careers Media Kit Site Map Terms of Use Ad Choices Terms of Service Privacy Policy Daily News Covers (c) Copyright 2016 NYDailyNews.com. All rights reserved.",http://www.nydailynews.com/entertainment/movies/2009/08/29/2009-08-29_the_final_destination_.html,200,thefinaldestination3,thefinaldestination,nydailynews
The Final Destination | EW.com Skip to main content Sign In Log Out TV TV Recaps Movies Music Books Gaming Video Big Brother Queen of the South Mr. Robot Wayward Pines Suits Tyrant Shop Newsletter Subscribe Get 1 year for 25 Save 86% off the cover price SUBSCRIBE More Great Stuff Comic-Con Hulu Hot List 50Scoops EW Popfest For Your Consideration Jess Cagle Interview Stage Follow EW EW on Facebook EW on Twitter EW on Tumblr EW on Instagram About EW Contact UsCustomer ServiceAbout UsJobs at Time Inc.AdvertisePrivacy PolicyYour California Privacy RightsAd ChoicesNewslettersSubscribeTerms of ServiceSite Map Copyright 2015 Entertainment Weekly Inc. All rights reserved. Login Log out TV TV Recaps Movies Music Books Gaming Video More... TV This Weeks Cover The Walking... TV Exclusive Photos of The Walking... EW POPFEST Get the details 50Scoops50Days Exclusive... Movies Crazy Stupid Love Before Th... Movies The Most 2000s Fashion From Joh... Movies 27 Great Revenge Movies Movies Alice in Wonderland Witticism... Movies John Tucker Must Die Where Ar... Books 15 Captivating International Cri... Movies Planet of the Apes See the Fa... Movies Toronto Film Festival 2016 See... TV One Tree Hill Where Are They... Movies Little Miss Sunshine Where Ar... Books Harry Potter and the Cursed Chi... Movies Comic-Con 2016 See Portraits of... TV Friends See the Casts Evolut... TV Comic-Con 2016 Get Batty With... Movies The Dark Tower Storybook Steph... News Comic-Con 2016 Star Portraits... TV 10 of the Best Moments From The... Movies The Dark Tower Storybook Steph... Movies Thelma and Louise See Rare Behi... Movies 9 of Garry Marshalls Best Movies Movies Every Star Trek Movie Ranked Movies Big Trouble in Little China... Movies The Dark Tower Exclusive Firs... Movies Suicide Squad Before They Wer... Movies The 10 Best Movies of 2016 (So Far) TV Fear the Walking Dead introduc... Movies by Owen Gleiberman Share Tweet Share on Google+ Share on Pinterest Share on Tumblr The Final Destination The opening slaughter at a speedway sets the freak-accident-as-snuff-sport tone of The Final Destination the fourth entry in the...The Final DestinationHorrorEric Bress The opening slaughter at a speedway sets the freak-accident-as-snuff-sport tone of The Final Destination the fourth entry in the...2009-08-28Shantel VanSantenMykelti WilliamsonShantel VanSanten Mykelti Williamson Share Tweet Share on Google+ Share on Pinterest Share on Tumblr (Jim Sheldon) C+ The Final Destination Genre Horror; Starring Krista Allen Nick Zano Shantel VanSanten Mykelti Williamson; Director David Ellis; Author Eric Bress; Release Date Wide 08/28/2009 Posted August 28 2009 -- 1200 AM EDT The opening slaughter at a speedway sets the freak-accident-as-snuff-sport tone of The Final Destination the fourth entry in the popular youth-death series and the first one made in glorious spike-in-your-face 3-D. As cars come hurtling off the track the mass pandemonium recalls that of early-60s shockers like The Blob but the crucial hook isnt the chaos Its the shot of a man impaled through his mouth by a splintered bench which pokes right into the audience making us feel impaled. Once again a group of pretty young things who have escaped the opening disaster proceed to die one by one as fate catches up with them. The jokey heightened Gen Y-Omen gruesomeness never lets up -- there are burnings and beheadings and one dude gets turned into raw shish kebab when hes mashed through a chain-link fence. But the in-between filler with Nick (Bobby Campo) addled by premonitions scurrying to stop each death before it occurs is about as extraneous as a horror-movie plot can get. (If Nick didnt keep failing there wouldnt be a movie.) Its no exaggeration to say that the actors have less personality than the pipes nail guns grinding gears decaying beams and slowly spreading oil spills that are fused with a kind of empty-dread technical precision into Rube Goldberg torture devices. C+ See all of this week?s reviews Share Tweet Share on Google+ Share on Pinterest Share on Tumblr Top Stories J.K. Rowling meets Harry Potter and the Cursed Child cast in photo Fast and Furious 8 Dwayne Johnson dives for cover in new set video Kanye West on Apples talks with Tidal Let the kids have the music A Chorus Line kicks up the classics at the Hollywood Bowl Sarah Jessica Parker New HBO show isnt Sex and the City The Larry Sanders Show reruns returning to HBO this fall Stranger Things cast and fans scared with even Stranger prank Photo Galleries 50Scoops50Days The Latest in Fall TV News The Biggest Moments From the 2016 Conventions Crazy Stupid Love Before They Were Stars The Most 2000s Fashion From John Tucker Must Die Exclusive Photos of The Walking Dead Season 7 27 Great Revenge Movies Alice in Wonderland Witticisms and Wisdom From the Disney Classic From Our Partners From Our Partners Contact UsCustomer ServiceAbout UsJobs at Time Inc.AdvertisePrivacy PolicyYour California Privacy RightsAd ChoicesNewslettersSubscribeTerms of ServiceSite Map Copyright (c) 2016 Entertainment Weekly Inc. All rights reserved. img[data-src] { display none important; },"http://www.ew.com/ew/article/0,,20301121,00.html",200,thefinaldestination4,thefinaldestination,ew
"The Final Destination | Chicago Reader Switch to the mobile version of this page. Newsletters Follow us Twitter Facebook RSS Mobile Username View Profile Edit Profile Log Out Log in Create Account The Chicago Reader News amp; Politics Music Arts amp; Culture Film Food amp; Drink Classifieds Browse News amp; Politics News amp; Politics home page Steve Bogira | Criminal Justice John Greenfield | Transportation Deanna Isaacs | Culture Ben Joravsky | Politics Michael Miner | Media Browse Music Music home page Gossip Wolf In Rotation Record roundups Leor Galil | Music Criticism Peter Margasak | Music Criticism Soundboard Concerts this week Early Warnings Concerts on horizon Browse Film Film home page J.R. Jones | Movie Reviews Index of Long Reviews Film Archive Short Reviews Now Playing Todays Showtimes Browse Arts amp; Culture Arts amp; Culture home page Tony Adler | Theater Justin Hayford | Theater Aimee Levitt | Features Brianna Wellen | Comedy Arts amp; Culture event search Browse Food amp; Drink Food amp; Drink home page Mike Sula | Restaurant Reviews Key Ingredient A chef-to-chef challenge Cocktail Challenge Bar Guide Restaurant search Browse The Bleader The Bleader blog home page Browse Classifieds Classifieds home page Real Estate Rentals Announcements Services Jobs (Monster) Place ad ad Best of Chicago Summer Guide Savage Love Straight Dope Agenda Events Locations Issues Article Archives Fun amp; Free You searched for [X]The Final Destination Start over Search for... Browse movie times Narrow Search Author Select an author Andrea Gronvall Michael Atkinson Pat Aufderheide Zbigniew Banas Barbara Scharres Angelica Jade Bastien Bill Stamets Bob Mehr Brian Thomas Peter Brunette Dave Canfield Cara Jepsen Carol Burbank Cheryl Ross Pat Chesnut Luca Cimarusti Patrick Dahl Tyler Daswick Dave Kehr Cliff Doerksen Dominick Suzanne-Mayer Don Druker Mick Dumke Marilyn Ferdinand Fred Camper Patrick Friel Chris Fujiwara Leor Galil Hank Sartin Justin Hayford Jack Helbig Henry Sheehan Tanner Howard Drew Hunt J. R. Jones J.R. Jones Jennifer Vanasco Jessica Hopper Jim Healy Jonathan Rosenbaum Joshua Katzman Josh Katzman Anthony Kaufman Kelly Kleiman Asher Klein Shelley Kraicer Shelly Kraicer Nathalie Lagerfeld Adam Langer Lawrence Bommer Lisa Alspector Eric Lutz Peter Margasak Mark Jenkins Martha Bayne Adrian Martin Tom McCormack Meredith Brody Sergio Mims Michael Miner Laura Molzahn Monica Kendrick Adam Morgan Noel Murray Noah Berlatsky Pat Graham Patrick McGavin Patrick Z. McGavin Gerald Peary Richard Pena Mark Peranson Peter Keough Leah Pickett Richard M. Porton Laura Power Quintin Miles Raymer Reece Pendleton Berenice Reynaud Ronnie Scheib Tal Rosenberg Joshua Rothkopf Joshua H. Rothkopf Martin Rubin Ryan Wenzel Ben Sachs Dan Sallitt Dmitry Samarov Ronnie Schieb David Schwartz David P. Schwartz Scott Pfeiffer Ian Simmons Alissa Simon Michael Glover Smith Patrick Somerville Laura Stempel Steve Erickson David Stewart Gwynedd Stuart Mike Sula Ted Shen Julia Thiel Ignatiy Vishnevetsky Kevin Warwick Jessica Weisberg Brianna Wellen Joel Wicklund Albert Williams Michael Wilmington Sam Worley Rating G PG PG-13 R NC-17 X NR Show only Staff Pick Staff Pick Critics Choice Critics Choice Recommended Recommended New New Agenda Agenda Free Free Slideshow Slideshow Video Video Watch on Amazon Watch on Amazon Watch on Netflix Watch on Netflix Watch on Hulu Watch on Hulu Watch on YouTube Watch on YouTube Member Picks Member Picks Other Searches Events Location Guide Member Search Movie Showtimes Movie Reviews Article Archives Issue Archives Slideshows Comments Videos Images Sorting by Name Release Date Film Search Tweet Tools Email Print Share Digg Newsvine del.icio.us Facebook Reddit Twitter Windy Citizen Add to Custom List Loading... Comments click to enlarge The Final Destination 2009 ""Death Be Not Boring"" would have been a better title for this fourth installment in the teen splatter franchise. The formula involves several characters narrowly escaping death only to be hunted down later by an invisible Grim Reaper and killed in freakish accidents. This time the daisy chain of doom begins at a stock car race from which four youngsters and as many adults flee just before a bargain-basement CGI disaster takes out half the crowd. They get theirs but the Rube Goldberg variations are repetitive and devoid of the visual snap that helped distinguish James Wongs Final Destination (2000). Director David R. Ellis (Snakes on a Plane) neglects the basics of his craft in favor of in-your-face 3-D folderol. Lots of people do get killed though. R 86 min. By Cliff Doerksen Official Site www.thefinaldestinationmovie.comDirector David R. EllisWriter Eric Bress and Jeffrey ReddickProducer Craig PerryCast Shantel VanSanten Bobby Campo Haley Webb Nick Zano Krista Allen Andrew Fiscella Mykelti Williamson and Richard T Jones Trailer The Final Destination Now Playing Sorry there are no upcoming showtimes for The Final Destination Reviews/comments Subscribe to this thread By Email Subscribing... With RSS Comment Add a review Rating Roll over stars and click to rate. Subscribe to this thread Terms of UsePrivacy PolicySubmission GuidelinesAbout The ReaderStaffReader CareersContact UsFreelancing InfoAdvertisingBack IssuesReprints Copyright (c) 2016 Sun-Times Media LLC. Powered by Foundation",http://www.chicagoreader.com/chicago/MovieTimes?oid=1022905,200,thefinaldestination5,thefinaldestination,chicagoreader
"The Final Destination movie review -- The Final Destination showtimes - The Boston Globe Local Search Site Search Home Delivery HomeTodays GlobeNewsBusinessSportsLifestyleAamp;EThings to doTravelCarsJobsHomesLocal Search MoviesRestaurantsMusicTheater/ArtsTelevisionBooksCelebrity newsEventsGamesComics THIS STORY HAS BEEN FORMATTED FOR EASY PRINTING Home / Aamp;E / Movies Movie Review The final Destination? One can hope. By Wesley Morris Globe Staff / August 29 2009 E-mail this article To Invalid email address Add a personal message Your e-mail Invalid email address Sending your article Your article has been sent. Email| Print| Reprints| | Text size - + Ten years ago the original ""Final Destination posed a legitimate metaphysical science-fiction headache What if cheating death cursed you with premonitions of other peoples demises? The movie made paranoia just contagious enough for you to leave the theater nervous a bus would run you over.Two sequels later comes ""The Final Destination allegedly the last in the series in which a different young man (Bobby Campo) tries to put the brakes on death. In 3-D. So now when a hurtling tire decapitates one woman and a speeding rock fatally puts out the eye of another its as if each object were first coming for you. Yet nothing about that tire or that rock is exciting enough to make you jump.All this third cheaply rendered dimension contributes is an awareness of how nondimensional everything else is. The writers dont write the director doesnt really direct and the actors dont exactly act. They wait for the movies contraptions to impale them. The guys look like personal trainers the women like salespeople at Forever 21.The gamesmanship is still heartless. The movie presents entire disaster sequences as real then basically say ""Psych It was a premonition and stages it again. If were not meant to be afraid were not laughing either. I searched for the joke in the image of a black character (poor Mykelti Williamson) sitting around while a noose hangs casually around his neck. Strange I never found it.The climax happens at a giant shopping center inside a megaplex - an opportunity at self-deprecation blown. The setting seems off anyway. As franchises go this installment wouldnt make it to a real mall. ""The Final Destination is the movie equivalent of a struggling strip-mall store wedged between Metro PCS and a pawn shop. Someone please foreclose.Wesley Morris can be reached at wmorrisglobe.com. For more on movies go to www.boston.com/movienation. (c) Copyright 2009 Globe Newspaper Company. Find showtimes and theaters fro The Final Destination THE FINAL DESTINATION Directed by David R. Ellis Written by Eric Bress Starring Bobby Campo Shantel VanSanten Nick Zano Haley Webb and Mykelti Williamson At Boston Common Fenway suburbs Running time 82 minutes Rated R (strong violent/gruesome accidents language and a scene of sexuality) LOG IN TO COMMENT Sorry we could not find your e-mail or password.Please try again or click here to retrieve your password. Existing users E-mail Password Screen name ( fields are required) Login Forgot your password? New users Please take a minute to register. After you register and pick a screen name you can publish your comments everywhere on the site. Posting Policy. Register Your comment is subject to the rules of our Posting Policy This comment may appear on your public profile. Public Profile FAQ Movie listings search Movie times  Globe review archive Find theaters by town Advertisement Boston.com Most EmailedSubscribe to SliceBookmark Boston.com Most Emailed120 MOST E-MAILED >> Report Warrant Issued for Roggies Bar OwnerMap of Greater Boston Farmers MarketsBoston Pops Concert Move Keeps the Beach Boys Ditches Joey McIntyreWe Tried Out Those New Solar BenchesNew Englands top outdoor water parksDrink of the Week Mojito ItalianoLawmakers pass compounding pharmacy oversight bill Follow this list on Twitter BostonPopular Home| Todays Globe| News| Business| Sports| Lifestyle| Aamp;E| Things to Do| Travel| Cars| Jobs| Real Estate| Local Search Contact Boston.com | Help| Advertise| Work here| Privacy Policy| Your Ad Choices| Terms of Service| Newsletters| Mobile| RSS feeds| Sitemap Contact The Boston Globe| Subscribe| Manage your subscription| Advertise| Boston Globe Insiders| The Boston Globe Gallery| (c) Boston Globe Media Partners LLC",http://www.boston.com/ae/movies/articles/2009/08/29/the_final_destination_one_can_hope/,200,thefinaldestination6,thefinaldestination,boston
