review,link,status_code,id,movie_key,critic
"The Final Destination  Film Review The Final Destination  Movie Review  The A.V. Club Film TV Club Music Comedy Books Games Aux More The Final Destination Most Read A.V. Club Most Read 1 Artists rendering of HBO executives heads when they found out their biggest show was coming to a close. (Game Of Thrones) Posted Jul 30 HBO confirms that Game Of Thrones will end with season 8 2 Guardians Of The Galaxy Posted Jul 30 Marvel might only be making one Infinity War movie now 3 (Graphic Nick Wanserski) Posted Jul 30 The best books of 2016 so far The A.V. Clubs catch-up guide 4 HBO programming president Casey Bloys at the 2016 Television Critics Association Summer Tour at The Beverly Hilton (Photo by Jeff Kravitz/FilmMagic/Getty Images) Posted Jul 30 HBO exec Casey Bloys on the future of Curb Deadwood and Jon Stewart Film TV Club Music Comedy Books Games Aux Newswire Reviews Video Great Job Internet Film TV Club Music Comedy Books Games Aux Newswire Features Reviews Videos Great Job Internet The Latest From Newswire (Image Getty Images/pokemon.wikia.com) Russian politicians are super wary of the ""devil"" of Pokemon Go Artists rendering of HBO executives heads when they found out their biggest show was coming to a close. (Game Of Thrones) HBO confirms that Game Of Thrones will end with season 8 The Latest From Features (Graphic Nick Wanserski) The best books of 2016 so far The A.V. Clubs catch-up guide American jazz vocalist Michael Franks at SIR studios in NYC. (Photo Oliver Morris/Getty Images) Jazz-inflected yacht rock word lists and pop-culture nerdery The Latest From Reviews B- Photo Cinema Asia Releasing League Of Gods offers the deadly farts of a six-armed baby in dazzling 3-D B+ Mike Kinsella (Photo Shervin Lainez) On The King Of Whys Owens the best its ever been The Latest From Videos Chasing Jason Bourne and catching up with Woody Allen Comedian Damien Lemon likes his weed to have a heroic backstory The Latest From Great Job Internet (Screenshot YouTube) Watch David Cross wound himself with increasingly brutal hot wings Democratic nominee President Hillary Clinton waves to the crowd following her acceptance speech at the Democratic National Convention in Philadelphia on Thursday July 28 2016. (Photo Bill Clark/CQ Roll Call) Read This Hillary Clinton knows her Hamilton so chill All Recent Browse Our Features Coming Distractions Savage Love Facebook Twitter Tumblr Film Movie Review The Final Destination By Tasha Robinson Aug 28 2009 317 PM D Share Tweet D The Final Destination David R. Ellis D The Final Destination Director David R. Ellis Runtime 82 minutes Rating R Cast Bobby Campo Shantel VanSanten Mykelti Williamson Community Grade A A- B+ B B- C+ C C- D+ D D- F ? Your Grade A A- B+ B B- C+ C C- D+ D D- F ? D The Final Destination 3D David R. Ellis D The Final Destination 3D Director David R. Ellis Runtime 82 minutes Rating R Cast Bobby Campo Shantel VanSanten Mykelti Williamson Community Grade A A- B+ B B- C+ C C- D+ D D- F ? Your Grade A A- B+ B B- C+ C C- D+ D D- F ? Our Community Grading Tool is in beta. Send Feedback. Share Tweet Heres a question What seemingly friendly force keeps gifting pretty twentysomethings with prophetic visions in the Final Destination movies enabling them to oh-so-temporarily escape death? Is there some positive influence in the universe working to counteract fate? If so why is it so incompetent at what it does? Alternately is the Grim Reaper just fucking with these poor kids by magically granting them reprieves then even more magically hunting them down one by one? Why does any of this happen? Unfortunately thats a question The Final Destination never bothers to ask as it goes through the rote motions established by the first three films in the franchise. Once again a near-victim (Bobby Campo) receives a precognitive warning about a horrific accident and gets his friends and several bystanders to safety just in time. Death unwilling to be cheated somehow brings unlikely strings of ordinary objects together to reduce the hapless escapees to lovingly rendered chopped wet meat. Thanks to a quick Internet search that brings up evidence of previous Final Destination movies Campo and friends dont even need to engage their brains to figure out whats going on. That leaves a lot more time for ominous music slow concatenations of faulty machinery and spilled solvents and explosions that (particularly for those watching the 3D version) fling shrapnel right in viewers faces. If the Final Destination movies teach us anything its that everything around us is decaying and dangerous and might at any moment become one piece in a monstrous Rube Goldberg execution device. The Final Destination is one such mechanical device churning out each new splattery accident with predictable regularity and a lot of in-your-face gory shocks but few surprises. Its chopping-block fodder is agonizingly bland; each character has one prominent major flaw or no personality at all. Campos generic CGI visions of random objects similarly lack any flavor; only the few rough stabs at R-rated humor like the flying flaming severed head with the goofy expression actually provide a shot of adrenaline. As with his last theatrical outing Snakes On A Plane director David R. Ellis aims for the laziest most easily satisfied thriller fans but he even lets them down by frontloading the action putting all the most creative kills--the one reason to attend a film like this--early on such that the whole movie is just one increasingly dull roll downhill. The same could be said for this once-fresh franchise. Share Tweet Filed Under Film More Movie Review Previous Movie Review Taking Woodstock Next Movie Review Halloween II Dont miss a story--follow The A.V. Club on Cant see comments? Please enable JavaScript to view the <a href=""http//disqus.com/?ref_noscript""> comments powered by Disqus. </a> More Movie Review League Of Gods offers the deadly farts of a six-armed baby in dazzling 3-D Jul 30 2016 1022 AM Philip Roths Indignation becomes a character study worth examining Jul 28 2016 900 AM A former football pro documents his struggle with ALS in Gleason Jul 28 2016 1200 AM A woman fights to hold on to her career on Wall Street in Equity Jul 28 2016 1200 AM A.V. Club Most Read 1 Artists rendering of HBO executives heads when they found out their biggest show was coming to a close. (Game Of Thrones) Posted Jul 30 HBO confirms that Game Of Thrones will end with season 8 2 Guardians Of The Galaxy Posted Jul 30 Marvel might only be making one Infinity War movie now 3 (Graphic Nick Wanserski) Posted Jul 30 The best books of 2016 so far The A.V. Clubs catch-up guide 4 HBO programming president Casey Bloys at the 2016 Television Critics Association Summer Tour at The Beverly Hilton (Photo by Jeff Kravitz/FilmMagic/Getty Images) Posted Jul 30 HBO exec Casey Bloys on the future of Curb Deadwood and Jon Stewart Sign up for news Daily Newsletter Highlights from The A.V. Club Whats On Tonight A daily update on the world of TV Submit Links and such All Recent Browse Our Features Coming Distractions Savage Love Contests RSS About Us Contact Advertise Jobs Privacy Policy Our Partners Hitfix Mental Floss Oh My Rockness Uproxx Upworthy Vice (c) Copyright 2016 Onion Inc. All Rights Reserved.","http://www.avclub.com/articles/the-final-destination,32304/",200,thefinaldestination7,thefinaldestination,avclub
The Final Destination (2009) directed by David R Ellis | Film review Go to the content Go to the footer Time Out London London Popular cities London New York Paris Chicago Los Angeles Browse all cities Time Out London Close London Change city London Popular cities London New York Paris Chicago Los Angeles Browse all cities Tickets Offers Things to Do Restaurants Bars amp; Pubs Film Theatre Art Music Attractions Blog Theatre Tickets Shopping Offer of the Day Time Out Card Time Out Escapes Time Out Live Hotels Nightlife Music festivals Events amp; Festivals Kids Museums Clubs Comedy Food amp; Drink Classical Music amp; Opera Dance LGBT City Guide Area Guides Property Competitions Dating Close My Time Out Things I love My lists My Profile My Account Sign out Sign in Create account Sign in With your social account Or with your email Email Password Remember me Forgotten your password? Sign in You can create a Time Out account in two ways... With a few clicks using your favourite social network Or by entering your details below Email First Name Last Name Create password Repeat new password I accept Time Outs terms of use including opt-in to newsletters. Create account Welcome  You have successfully connected your account to Time Out. You may sign in with this account in future. Please confirm your account details Email First Name Last Name I accept Time Outs terms of use including opt-in to newsletters. Sign up My Account Sign in or Create account Search Tickets Offers Things to Do Restaurants Bars amp; Pubs Film Theatre Art Music Attractions Blog Theatre Tickets Shopping Offer of the Day Time Out Card Time Out Escapes Time Out Live Hotels Nightlife Music festivals Events amp; Festivals Kids Museums Clubs Comedy Food amp; Drink Classical Music amp; Opera Dance LGBT City Guide Area Guides Property Competitions Dating More Search The Final Destination Film  Horror 3 out of 5 stars 4 out of 5 stars (6 user reviews) 0 Love It Save it 6 Add review 0 Love It Save it Time Out says 3 out of 5 stars Details Users say (6) 4 out of 5 stars Time Out says 3 out of 5 stars There will come a time in the not-too-distant future when the appeal of 3D will fade when the time-honoured values of story dialogue and character will once again be prized above giant pointy objects zooming perilously into the delighted faces of a screaming audience. But until that day arrives theres absolutely no reason not to enjoy The Final Destination a film which doesnt just pride itself on the spikiest shiniest collection of audience-intimidating implements yet seen (nails knives scissors screwdrivers) but adds a whole host of hitherto unimagined threats from flaming cars rogue ceiling fans and even a killer car wash.The plot is familiar from previous instalments in the Final Destination series forgettable well-sculpted do-gooder receives visions of impending disaster (in this case a nasty Nascar pileup) and hustles his chums out of danger. This causes the non-corporeal spirit of random death to become mightily peeved and come gunning for each of them in a variety of inventive and increasingly budget-taxing ways.Theres not a great deal to defend in The Final Destination the characters are flimsy and interchangeable the actors portraying them bland and inoffensive. The script serves as merely a framework for a repetitive series of shock deaths each of which is clearly signposted well in advance. But thats half the fun giggling as the shadow of a loaded crane looms menacingly overhead or a bottle of slippery hair oil tips silently across a well-polished floor. Some of the more gratuitously nasty scenes do leave a sour taste - in particular a gruesome reference to Chuck Palahniuks infamous swimming pool horror story Guts - and the films 15 certificate is surprisingly generous. But this is harmless inventive fun a rollercoaster ride on the 3D bandwagon before the wheels fall off. By Tom Huddleston Posted Thursday August 27 2009 Details Release details Rated 15 Release date Friday August 28 2009 Duration 81 mins Cast and crew Director David R Ellis Screenwriter Eric Bress Cast Bobby CampoShantel Van SantenNick ZanoHaley WebbMykelti WilliamsonKrista AllenAndrew Fiscella Users say (6) 4 out of 5 stars Average User Rating3.1 / 5Rating Breakdown5 star04 star43 star12 star11 star0LiveReviews|61 person listeningSign inWrite reviewMost helpfulMost helpfulHighest ratingLowest ratingNewestOldestLoadingundefinedNew CommentsRefreshOct 3 2009domiFeaturedGood movielot of action not bringa little bit illogical but still worth watching...FlagShareHelpful?Yes|NoReplySep 18 2009MattFeatured3d shocks were fun but not incredible. The actors and actressess were bland and script slightly cringing last final destinations much better.FlagShareHelpful?Yes|NoReplySep 3 2009IainFeaturedNot genius but miles better than it should be helped a lot by the 3D. The franchise started well with an interesting idea combined with an immature lust for unconventional deaths but became rather tedious with 2 and 3 being more of the same. This reignites the idea and is easilly better than the middle two films and is actually fun to watch.FlagShareHelpful?Yes|NoReplySep 2 2009JadeFeaturedIt is amazing in 3D. I went too see it andd when the screwdriver comes at you it you feel like its going too hit you in tha facee D x not as good as the others the ending isnt that good either butt still goo and see it xxFlagShareHelpful?Yes|NoReplyAug 30 2009ScottieFeaturedWent and seen this last night in 3D Was a good film and really good in 3D Thought things were going to hit and very real. Didnt like the ending tho and not as good as the other ones. If you have seen the rest then still go see itFlagShareHelpful?Yes|NoReplyAug 29 2009danielleFeaturedwow i saw it in 3D today it is amazing in 3D i recommend you see it i atchully thought a screwdriver was going to hit me in the face not as good as the last ones but it was still amazing )FlagShareHelpful?Yes|NoReplyShow More Share Tweet 0 Shares Top About us Work for Time Out Privacy policy Cookie Policy Website terms of use Contact us Time Out for business Get listed Claim your listing Premium Profiles Advertising Time Out products Time Out Card Mobile apps Time Out Shop Time Out Guides Time Out Travel Time Out Offers Time Out Worldwide Time Out magazine Where to get Time Out magazine Subscribe to Time Out magazine Manage my subscription Follow us Facebook Twitter Youtube Instagram Pinterest Spotify Time Out London Site map },http://www.timeout.com/film/reviews/87472/the-final-destination.html,200,thefinaldestination8,thefinaldestination,timeout
"movie review final destination movie review final destination death trip movie review final destination death trip 3D final destination movie review final destination death trip 3D movie review - Orlando Sentinel Planning a vacation? Check out the best travel deals and destinations Entertainment Entertainment Movie review The Final Destination -- 1 out of 5 stars Roger MooreOrlando Sentinel Movie Critic ""Is it safe to sit here?""The girl always asks that in Final Destination movies. The answer on screen is ""Yes yes yes."" But we in the audience know its ""No no no."" As in ""Get out of there. NOW."" In the movie titled The Final Destination showing in many theaters in 3D ""there"" is a stock car race track where the seats are rotting the cement has cracks and the pit crews are the most accident-prone on the planet. A quartet of college kids go one ""sees"" a crowd-killing accident before it happens and convinces his friends to leave. This is followed by a crowd-killing accident. Followed by more chain reaction disasters that take out the survivors who ""should have been killed"" one by one.They called it ""deaths grand design"" in an earlier Destination. In the latest unoriginal exhausted sequel they give it the pedestrian label ""the death list."" The latter Final Destination movies cant fail to make me nostalgic for the James Wong original a movie wrapped up in high school kids who all think theyre immortal anyway wrestling with mortality trying to decode ""deaths grand design"" foreshadowed by the music of John Denver. I was thinking of that one this morning on the way to the office as three ""Im gonna live FOREVER"" teens darted across six lanes of speeding traffic to beat their bus to the stop. Making that generation question its lack of fear of death was fascinating fodder for a horror film.Nine years later these movies have been reduced to bland killing machines though The Final Destination the latest features aggressive use of 3D with everything from race cars tires and engines to nails from a nail gun entrails and blood blasting off the screen into our laps. Blandly acted by players who seem resigned to the paycheck rather than terrified by the prospect of death or paralyzed by fear or even morbidly fascinated by their impending doom this one is certainly worth a pass.Of the blase cast only Mykelti Williamson as a security guard who accepts his fate with the help of his faith and Nick Zano playing a rude crude and funny frat-boy jerk stand out. A few feeble stabs at social commentary -- race-fan racism (an attempted cross-burning) and the magic of 3D at the movies (in one scene they torch a movie theater showing a film in 3D) dont make up for the cheats -- violent accidents that may or may not be premonitions -- or the exciting-as-a-poached egg leading man (Bobby Campo).Its not frightening in the least with only a few amusing moments a pedal-and-forehead-to-the-metal race track crash opener and then you just keep time by counting off who survives the initial slaughter who awaits death when ""their turn"" comes. Eighty minutes and its all over. Until the NEXT Final Destination. A tip? Dont go to stock car races. Dont leave your sun roof open in the car wash. And dont go in any cinema showing The Final Destination in Theater 13.The Final Destination1 of five starsCast Bobby Campo Shantel VanSanten Mykelti Williamson Nick SavoDirector David R. EllisRunning time 1 hour 24 minutesIndustry rating R for strong violent/gruesome accidents language and a scene of sexuality. Copyright (c) 2016 Orlando Sentinel Death Movies Entertainment Disasters and Accidents The Final Destination Death Trip 3D (movie) Travel Trips and Vacations Movie Reviews Complete coverage of the Florida Film Festival Get the latest headlines sent straight to your phone Pulse ShootingAll SectionsNewsSportsBusinessClassifiedEntertainmentTravel88deg","http://www.orlandosentinel.com/entertainment/orl-movie-review-final-destination-death-trip-3d,0,6114701.story",200,thefinaldestination9,thefinaldestination,orlandosentinel
"The Final Destination | Variety Variety Editions U.S Latino Global Asia Subscribe Today Navigation Menu Film TV Digital Contenders Video Dirt Jobs More Biz Music Legit Scene Conferences Insight Archives Directory Choose Edition U.S Latino Global Asia Russia | My Account Sign In Subscribe HomeFilmReviews Review The Final Destination Jordan Mintzer 0 Share This Article Email LinkedIn Pin It Tumblr August 26 2009 | 0305PM PT Pic may finally sound the death knell for New Lines near-immortal horror franchise. With an array of gory mayhem only marginally enhanced by 3-D and a plot as developed as a text message ""The Final Destination"" may finally sound the death knell for New Lines near-immortal horror franchise. Clocking in at an expedited 75 minutes (minus credits) of fatally gonzo accidents this fourth installment opens with a stock car-race disaster and then proceeds to dispose of its various stock characters by literally tossing their body parts in the audiences faces. Fans could boost late summer biz but this Reapers prospects otherwise look grim indeed. It opens Friday Stateside sans advance press screenings. Whatever hints of originality lay in the series previous editions have been all but sucked out of this one which focuses purely on its numerous decapitations impalements and mutilations and how to render them more lifelike using Fusion 3-D technology. Even the franchises clever take on teenagers wrestling with notions of fate and death has been eviscerated by scribe Eric Bress (""Final Destination 2"" ""The Butterfly Effect"") whose mostly twentysomething protags are neither students nor gainfully employed though they do excel at being tortured by everything from an escalator to a car wash to a swimming pool pump. While the use of 3-D does provide some thrills as well as a few laughs during the pics opening NASCAR-set massacre -- in which visionary hunk Nick (Bobby Campo) envisions friends and strangers being torn to pieces by flying car parts -- the effect quickly grows tiresome as do the deaths themselves. Once we realize the 3-D is used merely to highlight whatever tool or appliance will soon turn into a weapon and then afterward to spew blood and/or various organs in our direction theres not much else to look out for. As Nicks premonitions (rendered in highly unrealistic CGI graphics) involving those spared by the disaster start to come true he and g.f. Lori (Shantel VanSanten) try to save their best buddies bleached-blond womanizer Hunt (Nick Zano) and gabbing shopaholic Janet (Haley Webb). But along with the other survivors such as the ""Racist"" or ""Redneck"" (as hes referred to at different times) Carter (Justin Welborn) or the ""MILF"" Samantha (Krista Allen) theres hardly anyone here worth preserving. Helmer David R. Ellis who directed the more effective ""Final Destination 2"" and the hilarious ""Snakes on a Plane"" seems to be going for the off-the-wall attitude of the latter but never makes the killings funny enough; nor does he adequately unify time and place to generate suspense. He even grows lazy with regards to the rather creative death scenes that marked the other films Here a guy simply gets hit by an ambulance or has a bathtub fall on his head while a woman is blindsided by a flying rock. So much for Deaths grand designs. When their innards arent splattering through the screen the actors rush through their dialogue explaining the series m.o. -- those who escaped the initial accident are doomed to die in a predetermined order (according to Nick and Lori who ""stayed up Googling premonitions"" to understand whats happening). Such scenes play awkwardly in 3-D the actors looking like cardboard cutouts in front of backgrounds that feel more like green screens than actual sets. Mykelti Williamson (""24"" ""CSI NY"") who plays a widowed security guard grappling with alcoholism manages to give the films one redeemable character some depth before becoming just another sausage for the meat grinder. The Final DestinationProductionA Warner Bros. (in U.S.)/Metropolitan Filmexport (in France) release of a New Line Cinema presentation of a Practical Pictures/Parallel Zide production. Produced by Craig Perry Warren Zide. Executive producers Richard Brener Walter Hamada Sheila Hanahan Taylor. Co-producer Art Schaefer. Directed by David R. Ellis. Screenplay Eric Bress based on characters created by Jeffrey Reddick. CrewCamera (Deluxe color 3-D widescreen) Glen MacPherson; editor Mark Stevens; music Brian Tyler; production designer Jaymes Hinkle; art director Scott Plauche; set decorator Raymond Pumlia; costume designer Claire Breaux; sound (Dolby Digital/SDDS/DTS) Jeffrey Haupt; sound designer Jon Title; supervising sound editor Dave McMoyler; visual effects supervisor Erik Henry; associate producer Tawny Ellis-Lehman; assistant director James Giovannetti Jr.; casting David H. Rappaport Lindsey Hayes Kroeger. Reviewed at MK2 Bibliotheque B Paris Aug 26 2009. MPAA Rating R. Running time 82 MIN. With Nick - Bobby Campo Lori - Shantel VanSanten Hunt - Nick Zano Janet - Haley Webb George - Mykelti Williamson MILF/Samantha - Krista Allen Mechanic - Andrew Fiscella Racist/Carter Daniels - Justin Welborn With Stephanie Honore Lara Grice Jackson Walker Phil Austin. Filed Under Eric BressMark Stevens Want to read more articles like this one? SUBSCRIBE TO VARIETY TODAY. Post A Comment 0 Variety Jobs Creative Development Coordinator Triptyk Studios New York New York Account/Project Coordinator (Ad Agency) Petrol Advertising Burbank California Media Specialist Bridgewater Associates Westport Connecticut Executive Director Aspen Film Company Confidential Aspen Colorado Associate Director YouTuber amp; Gamer Partnerships Save the Children Fairfield Connecticut See More Jobs Marketplace Leave a Reply No Comments Cancel reply Comments are moderated. They may be edited for clarity and reprinting in whole or in part in Variety publications. Enter your comment here... Fill in your details below or click an icon to log in Email (required) (Address never made public) Name (required) Website You are commenting using your WordPress.com account. ( Log Out / Change ) You are commenting using your Twitter account. ( Log Out / Change ) You are commenting using your Facebook account. ( Log Out / Change ) You are commenting using your Google+ account. ( Log Out / Change ) Cancel Connecting to %s Notify me of new comments via email. Notify me of new posts via email. More Film News from Variety The Power of Content Divorce Marks Sarah Jessica Parkers Return To HBO But... John Legend Shares Adorable New Snap Of Baby Luna -- See The Cute... Cara Delevingne Steps Out In Christian Louboutin Over-The-Knee... Westworld Creators Reveal Reason for 2-Month Production Shutdown Pokemon Go update for Android has a very annoying feature... Subscribe to Variety Today All The Ways to Get Variety Online Subscription Print Subscription Mobile Apps Newsletters News Alerts Archives Slanguage Dictionary Help Other Variety Products MediaVariety 411 Research amp; DataVariety Insight Archives Premium Email Alerts Real Estate Jobs Access the best entertainment industry data available View the Variety archives dating back to 1905 Get News Delivered To Your Inbox Privacy Policy Your Privacy Rights Terms of Use About Us Advertise Contact Us Google+ The Power of Content Deadline india.com Hollywoodlife hollywood TV Line BGR WWD Footwearnews (c) Copyright 2016 Variety Media LLC a subsidiary of Penske Business Media LLC. Variety and the Flying V logos are trademarks of Variety Media LLC. Powered by WordPress.com VIP Variety411 Your production services resource",http://www.variety.com/review/VE1117940902.html?categoryId=31,200,thefinaldestination10,thefinaldestination,variety
