review,link,status_code,id,movie_key,critic
Were sorry we cant find the page that youre looking for Go to the content Go to the footer Time Out New York New York Popular cities London New York Paris Chicago Los Angeles Browse all cities Time Out New York Close New York Change city New York Popular cities London New York Paris Chicago Los Angeles Browse all cities Tickets Events Things to Do Restaurants Bars Movies Theater Music Shopping Attractions Blog Art Travel Nightlife Events amp; Festivals Museums Kids Hotels Comedy Dance LGBT Sex amp; Dating Books City Guide Neighborhoods Promotions Close My Time Out Things I love My lists My Profile My Account Sign out Sign in Create account Sign in With your social account Or with your email Email Password Remember me Forgotten your password? Sign in You can create a Time Out account in two ways... With a few clicks using your favourite social network Or by entering your details below Email First Name Last Name Create password Repeat new password I accept Time Outs terms of use including opt-in to newsletters. Create account Welcome  You have successfully connected your account to Time Out. You may sign in with this account in future. Please confirm your account details Email First Name Last Name I accept Time Outs terms of use including opt-in to newsletters. Sign up My Account Sign in or Create account Search Tickets Events Things to Do Restaurants Bars Movies Theater Music Shopping Attractions Blog Art Travel Nightlife Events amp; Festivals Museums Kids Hotels Comedy Dance LGBT Sex amp; Dating Books City Guide Neighborhoods Promotions More Search Were sorry we cant find the page that youre looking for We have either moved the page or it no longer exists. To help you find your way here are some search results we think may be of interest. Movies The Grudge Two years after the success of Gore Verbinskis The Ring heres another cash-in on a profitable Japanese horror franchise - one that sticks with the series original Japanese director and Tokyo setting while introducing an American cast (including... Read more Movies The Grudge 2 Adam Sandler films aside could there be a lower form of cinematic life than a remake of a sequel? The Grudge 2 is just that an English-language rehash of J-Horror quickie Ju-on The Grudge 2 which itself borrows liberally from Hideo Nakatas Ring... Read more Movies The Grudge 2 Since Hollywoods first Grudge film proved an unwittingly hilarious imperialist fantasy (Buffy gets pursued by creepy ghosts in Tokyo) this second installment initially seems a lot more ambitious bouncing between three narrative strands a mourning... Read more Movies Ju-on The Grudge In a Japanese house a vengeful spirit goes after one person after another each suffering a horrible death. Read more Movies Ju-on The Grudge 2 Does Japanese director Takashi Shimizu have a grudge against us? His Ju-On/Grudge tally to date includes two straight-to-video titles two features an English-language remake of Ju-On The Grudge featuring Buffy star Sarah Michelle Gellar and... Read more Movies Lousy Bastards Two brothers (Ondrej Vetchy Jiri Langmajer) let a long-ago grudge get in the way of their relationship. Read more Music The 50 top rap lyrics about food Girls cars and jewelry are well-documented tropes of hip-hop but anyone who listens to enough rap knows that eating is one of the genres most pervasive obsessions. From the Sugarhill Gang to Drake MCs have demonstrated a constant urge to document... Read more Movies Most Likely to Die Its the night before a 10-year high school reunion and someones been holding a grudge. One by one former classmates are slain in ways befitting their yearbook superlatives. Read more Movies House They brought us Hello Kitty and The Grudge; surely if the Japanese wanted to make a horror movie for the squealing slumber-party crowd they could. House proves they already have. Cherished at home with the same teen heat as something like Labyrinth here... 4 out of 5 stars Read more Movies Star Trek Beyond Too much ambition can be a dangerous thing. The previous Star Trek movie 2013s sprawling Into Darkness was packed with it new worlds violent consequences and hefty emotional moments. A little unfairly it was voted the worst Trek movie ever by some... 4 out of 5 stars Now Showing Read more Top About us Work for Time Out Privacy policy Website terms of use Contact us Get listed Advertising Time Out products Mobile apps Time Out Shop Time Out Guides Time Out Travel Time Out Worldwide Time Out magazine Follow us Facebook Twitter Youtube Instagram Pinterest Spotify Foursquare Time Out New York Site map,http://www.timeout.com/film/reviews/81510/the_grudge.html,404,thegrudge0,thegrudge,timeout
The Grudge (2004) directed by Takeshi Shimizu | Film review Go to the content Go to the footer Time Out London London Popular cities London New York Paris Chicago Los Angeles Browse all cities Time Out London Close London Change city London Popular cities London New York Paris Chicago Los Angeles Browse all cities Tickets Offers Things to Do Restaurants Bars amp; Pubs Film Theatre Art Music Attractions Blog Theatre Tickets Shopping Offer of the Day Time Out Card Time Out Escapes Time Out Live Hotels Nightlife Music festivals Events amp; Festivals Kids Museums Clubs Comedy Food amp; Drink Classical Music amp; Opera Dance LGBT City Guide Area Guides Property Competitions Dating Close My Time Out Things I love My lists My Profile My Account Sign out Sign in Create account Sign in With your social account Or with your email Email Password Remember me Forgotten your password? Sign in You can create a Time Out account in two ways... With a few clicks using your favourite social network Or by entering your details below Email First Name Last Name Create password Repeat new password I accept Time Outs terms of use including opt-in to newsletters. Create account Welcome  You have successfully connected your account to Time Out. You may sign in with this account in future. Please confirm your account details Email First Name Last Name I accept Time Outs terms of use including opt-in to newsletters. Sign up My Account Sign in or Create account Search Tickets Offers Things to Do Restaurants Bars amp; Pubs Film Theatre Art Music Attractions Blog Theatre Tickets Shopping Offer of the Day Time Out Card Time Out Escapes Time Out Live Hotels Nightlife Music festivals Events amp; Festivals Kids Museums Clubs Comedy Food amp; Drink Classical Music amp; Opera Dance LGBT City Guide Area Guides Property Competitions Dating More Search The Grudge Film  Horror Add review 0 Love It Save it 0 Add review 0 Love It Save it Time Out says Details Users say Time Out says Two years after the success of Gore Verbinskis The Ring heres another cash-in on a profitable Japanese horror franchise - one that sticks with the series original Japanese director and Tokyo setting while introducing an American cast (including Sarah Michelle Gellar and Bill Pullman). The premise of this high-gloss low-resolution remake simply transcribes the standard haunted-house exegesis of Shimizus Ju-on When someone dies in the grip of a powerful rage a curse is born. We presume such a deathly birth has occurred in the abode where a brother-sister pair of American transplants install their mother who suffers from early-stage dementia but appears instantly attuned to the creakings and rattlings that waft from the walls and ceilings... As he did in Ju-on Shimizu builds his film out of chronologically jumbled set pieces that each proceed by an alternating pattern of tense lulls and pay-off jolts. The overdetermined approach preempts the character shadings or social subtext that Japanese horror maestro Hideo Nakata prizes while the soundtracks Dolby thumps and screaming violins head off any genuine scares. By JWin Details Release details Rated 15 Release date Friday November 5 2004 Duration 0 mins Cast and crew Director Takeshi Shimizu Cast Sarah Michelle GellarJason BehrClea DuvallBill PullmanKaDee Strickland Users say LiveReviews|02 people listeningSign inWrite reviewMost helpfulMost helpfulHighest ratingLowest ratingNewestOldestLoadingundefinedNew CommentsRefreshShow More Share Tweet 0 Shares Top About us Work for Time Out Privacy policy Cookie Policy Website terms of use Contact us Time Out for business Get listed Claim your listing Premium Profiles Advertising Time Out products Time Out Card Mobile apps Time Out Shop Time Out Guides Time Out Travel Time Out Offers Time Out Worldwide Time Out magazine Where to get Time Out magazine Subscribe to Time Out magazine Manage my subscription Follow us Facebook Twitter Youtube Instagram Pinterest Spotify Time Out London Site map },http://www.timeout.com/film/81510.html,200,thegrudge1,thegrudge,timeout
lohud.comSUBSCRIBE NOWto get full accessHomeNewsRocklandWestchesterSportsOpinionHomesfoodObituariesPhoto-VideoLifeHealthArchivesUSA TODAYMoreHomeNewsRocklandWestchesterSportsOpinionHomesfoodObituariesPhoto-VideoLifeHealthArchivesUSA TODAYFollowSearchFireflyHi Already a subscriber?Log inSubscribe today for full access on your desktop tablet and mobile device.Subscribe NowAlready a print edition subscriber but dont have a login?Activate your digital access.Manage your account settings.My AccountView the E-NewspaperManage your NewslettersView your Insider deals and moreMember ID CardLog OutGet the newsLog In or Subscribe to skipAlready a subscriber?Log inSubscribe today for full access on your desktop tablet and mobile device.Subscribe NowAlready a subscriber but dont have a login?Activate your digital access.TOP TRENDINGxShareOOPSThis page exists to tell you that this page doesnt exist.RETURN TO HOMESubscribeAbout UsRSSAppsNewslettersInsiderFollow Our StaffContact UsHelpHomeNewsWestchesterRocklandPutnamPoliticsCrimeTappan Zee BridgeMore...HealthEducationInstagramRocklandWestchesterSportsHigh SchoolsYankeesMetsGiantsJetsKnicksMore...RangersBlogsOlympicsScores and SchedulesOpinionEditorialsCommunity ViewsLettersPhil ReismanBoard of ContributorsEditorial BoardExchange BlogHomesFeatured HomesGardeningfoodRestaurantslohudfood blogFarmers MarketsLocal BreweriesWineRecipesObituariesPhoto-VideoLifeEntertainmentThings To DoDay TripsTravelInsiderInstagramHealthArchivesUSA TODAY (c) 2016 Copyright (c) 2014 www.lohud.com. All rights reserved. ServicesAdvertise with UsAdvertising Terms and ConditionsAd ChoicesCommunity RulesFAQMember GuideNewspapers in EducationPrivacy Notice/Your California Privacy RightsReprints PermissionsTerms of ServiceWork for UsOur PartnersCareer BuilderCars.comClassifiedsDealChickenFind amp; SaveHomefinder.comEducationG/O Digital,http://www.thejournalnews.com/theline/movieline/archive/43947.htm,404,thegrudge2,thegrudge,thejournalnews
"Reelviews Movie Reviews Out now Cher Harold Rosson Eva Green Benjamin ... Home Video Views ReelThoughts Currently in Cinema ReelViews Library Login Specials My Books Array ( [page] =gt; home ) Jason Bourne Run Time 203 U.S. Release Date 2016-07-29 MPAA Rating ""PG-13"" (Violence Profanity) Genre Thriller Director Paul Greengrass Cast Matt Damon Tommy Lee Jones Alicia Vikander Vincent Cassel Julia Stiles Riz Ahmed Despite regurgitating elements from the founding trilogy ""Jason Bourne"" represents the best the series has yet offered. Nerve Run Time 136 U.S. Release Date 2016-07-27 MPAA Rating ""PG-13"" (Violence Profanity Sexual Content Drugs Nudity) Genre Thriller Director Henry Joost Ariel Schulman Cast Emma Roberts Dave Franco Emily Meade ... At only 96 minutes ""Nerve"" is short enough not to overstay its welcome and despite a lackluster final 20 minutes it proves to be solidly entertaining. Captain Fantastic Run Time 158 U.S. Release Date 2016-07-22 MPAA Rating ""R"" (Profanity Sexual Content Nudity) Genre Drama Director Matt Ross Cast Viggo Mortensen Shree Crooks Nicholas Hamilton ... Director/writer Matt Ross offers moments of genuine power and pathos that make it easy to forgive the missteps. Latest ReelThoughts Feb 21st 2016 | Fearless Oscar Predictions 2016 Edition Dec 30th 2015 | 2015 in Review The Top 10 Dec 27th 2015 | 2015 in Review The Bottom 10 Aug 30th 2015 | Revisiting the STAR WARS Saga Jul 6th 2015 | The 2015 Halftime Top 10 Apr 29th 2015 | The Future of the Superhero Movie Apr 26th 2015 | Touring the New Site Latest VideoViews Apr 5th 2016 | Star Wars The Force Awakens Mar 29th 2016 | Hateful Eight The Mar 29th 2016 | Concussion Mar 29th 2016 | Point Break Mar 22nd 2016 | Hunger Games The Mockingjay Part 2 Mar 15th 2016 | Brooklyn Mar 15th 2016 | Carol Now available at amazon.com - The complete saga of ""The Last Whisper of the Gods"" Previous Next Star Trek Beyond Run Time 200 U.S. Release Date 2016-07-22 MPAA Rating ""PG-13"" (Violence Profanity) Genre Science Fiction/Action Director Justin Lin Cast Chris Pine Zachary Quinto Karl Urban Zoe Saldana Simon Pegg John Cho Anton Yelchin Idris Elba Sofia Boutella ""Star Trek Beyond"" is a Star Trek movie although not an especially good one. Ice Age Collision Course Run Time 130 U.S. Release Date 2016-07-22 MPAA Rating ""PG"" Genre Animated Director Mike Thurmeier Galen T. Chu Cast Ray Romano John Leguizamo Denis Leary Queen Latifa Keke Palmer Jennifer Lopez Wanda Sykes Simon Pegg Adam Devine Younger kids will have fun with the movie. Adults - well thatas another story. Lights Out Run Time 121 U.S. Release Date 2016-07-22 MPAA Rating ""PG-13"" (Disturbing Images Violence Profanity) Genre Horror Director David F. Sandberg Cast Teresa Palmer Gabriel Bateman Alexander DiPersia Maria Bello Itas a shame to see a clever premise developed in such an underwhelming fashion. Absolutely Fabulous - The Movie Run Time 130 U.S. Release Date 2016-07-22 MPAA Rating ""R"" (Profanity Sexual Content Drugs) Genre Comedy Director Mandie Fletcher Cast Jennifer Saunders Joanna Lumley Julie Sawalha June Whitfield Jane Horrocks As funny as the material sometimes is the flimsy narrative encounters difficulties trying to sustain a 90 minute motion picture. Ghostbusters Run Time 156 U.S. Release Date 2016-07-15 MPAA Rating ""PG-13"" (Horror Action/Violence Profanity) Genre Comedy/Horror Director Paul Feig Cast Melissa McCarthy Kristen Wiig Kate McKinnon Leslie Jones Chris Hemsworth A mediocre horror/comedy that deserves neither high praise nor disparagement. Infiltrator The Run Time 207 U.S. Release Date 2016-07-13 MPAA Rating ""R"" (Violence Profanity Sexual Content Drugs Nudity) Genre Drama/Thriller Director Brad Furman Cast Bryan Cranston Benjamin Bratt John Leguizamo Diane Kruger Juliet Aubrey Elena Anaya Amy Ryan Made for those who prize acting slow-burn suspense and narrative over the usual loud empty summertime fare. Secret Life of Pets The Run Time 130 U.S. Release Date 2016-07-08 MPAA Rating ""PG"" Genre Animated Director Chris Renaud Yarrow Cheney Cast Louis C.K. Eric Stonestreet Kevin Hart Jenny Slate Albert Brooks Lake Bell Dana Carvey Ellie Kemper An entertaining but inconsequential animated movie with a strong ""Toy Story"" influence. ReelViews Library Currently in Cinema Writings Fictional Writings ReelThoughts Specials About Privacy Policy Terms and Conditions Contact Website credits",http://www.reelviews.net/movies/g/grudge.html,200,thegrudge3,thegrudge,reelviews
Movie | stltoday.com Sign Up Log In Dashboard Logout My Account Dashboard Profile Saved items Logout Subscriber services Contact us E-edition Contests Apps Newsletters Obits News Education Election 2016 Databases Columnists Illinois Law and order Metro Nation Obits Political Fix St. Charles Weather Opinion Letters to the editor Columnists Business Top Workplaces Press releases Columnists Sports Cardinals Blues Mizzou Olympics SLU NFL Golf Forums Columnists Chats High schools Schedules Schools Sports Stats Go Entertainment Books Calendar Comics amp; games Dining Music Movies Television Theater amp; arts Columnists Lifestyles Advice Automotive Fashion Food and cooking Health Home and Garden Parenting Religion Travel Columnists Feast Magazine St. Louis Best Bridal Ladue News Multimedia Photos Videos Chats Forums Buy/sell Classifieds Real estate Business Directory Print Ads Newspaper ads Page reprints Autos Jobs Homes Archives Toggle navigation Menu Search Search Log In Using Your Account Log In Dont have an account? Sign Up Today My Account Dashboard Profile Saved items Logout 84deg Saint Louis MO (63101) Today A mix of clouds and sun. High 87F. Winds NW at 5 to 10 mph.. Tonight Mainly clear. Low 69F. Winds N at 5 to 10 mph. Updated July 30 2016  1053 am Full Forecast News Sports Business Go Life Buy/Sell Sorry the page youre looking for cannot be found. 404 The page may have moved you may have mistyped the address or followed a bad link. Visit our homepage or search for whatever you were looking for... Feast Magazine Ladue News St. Louis Best Bridal STL High School Sports Products and features Apps Archives Calendar Chats Comics amp; games Contests E-edition Forums Newsletters Our events Press releases Tools and services Advertise with us Autos Classifieds Contact us Homes Jobs Newspapers in Education Page reprints Post-Dispatch store Site help Subscriber services (c) Copyright 2016 STLtoday.com 900 N. Tucker Blvd. St. Louis MO | Terms of Use | Privacy Policy Powered by BLOX Content Management System from TownNews.com.,http://www.stltoday.com/stltoday/entertainment/reviews.nsf/movie/story/50448A99D95C7C9E86256F3400735FAB?OpenDocument,404,thegrudge4,thegrudge,stltoday
"Grudge Match (washingtonpost.com) <a href=""http//ad.doubleclick.net/jump/wpni.artsandlivingarticle/movies/reviewsdcopt=ist;dir=osullivannode;dir=artsandliving;dir=movies;dir=reviews;dir=osullivan;page=article;kw=;pos=ad19;;tile=10;abr=ie;ord=1098432207047?""></a> washingtonpost.com gt; Arts amp; Living gt; Movies gt; Reviews gt; Michael OSullivan on Movies Print This Article E-Mail This Article <a href=""http//ad.doubleclick.net/jump/wpni.artsandlivingarticle/movies/reviews;dir=osullivannode;dir=artsandliving;dir=movies;dir=reviews;dir=osullivan;page=article;kw=;pos=ad28;;tile=50;abr=ie;ord=1098432207049?""></a> RSS News Feeds Top News Michael OSullivan on Movies What is RSS? | All RSS Feeds Grudge Match By Michael OSullivan Washington Post Staff Writer Friday October 22 2004; Page WE34 IM NOT SURE if this is good news or bad but there isnt all that much difference between last years ""Ju-on The Grudge"" and ""The Grudge"" the new slightly Americanized remake of the cult Japanese horror film about an extremely haunted house. Barring the tweaking of a couple of plot elements and the introduction of some American actors (notably Sarah Michelle Gellar) to make the film more appealing to a Western audience the movies are pretty much identical -- not to mention identically silly. Theyre also pretty darn scary that is if youre susceptible to such ""Carrie""-style creep-outs as a hand suddenly reaching out to grab someone from a stagnant kitchen drain. Sarah Michelle Gellar sees a house full of dead people in ""The Grudge"" the Americanized version of a Japanese horror film. (Kenji Takeuchi -- Columbia Pictures) _____More in Movies_____  The Grudge Details  Current Movie Openings  Arts amp; Living Movies Free E-mail Newsletters Washington Entertainment GuideSee a Sample  |  Sign Up Now MoviesSee a Sample  |  Sign Up Now TravelSee a Sample  |  Sign Up Now At HomeSee a Sample  |  Sign Up Now The similarity is no surprise. Director Takashi Shimizu worked on both films. In a feat of creative bankruptcy -- or remarkable purity of artistic vision depending on your point of view -- he even recycles many of the exact same spooky shots from one film to the next. He even uses the same child actor (Yuya Ozeki who plays the creepy ghost-boy Toshio) in both films. Set in Tokyo both films center on a home care worker (in this case Gellar) who discovers a catatonic elderly woman (Grace Zabriskie) sitting in befouled bed sheets in an otherwise empty house. Okay its not entirely empty. Gellars Karen also discovers a small saucer-eyed boy (Ozeki) and a black cat duct-taped into an upstairs closet. (The thing is hes not really ""there"" at least not in the sense that most of us normally use the word ""there"" if you catch my drift.) Subsequently it becomes apparent that everyone who comes into contact with the house -- Karens boss (Ted Raimi brother of the films producer Sam) her boyfriend (Jason Behr) the police detective (Ryo Ishibashi) who investigates the boys appearance and subsequent disappearance -- all fall victim to the kind of unspeakable evil that aficionados of this type of film will by now be overly familiar with and that here sometimes takes the form of a bloblike cloud of black hair. Where ""The Grudge"" and ""Ju-on The Grudge"" deviate is in their relative levels of obviousness. In what could be read as a response to critics of the first film some of whom complained about the vagueness of whatever or whoever was haunting the house writer-director Shimizu this go-round makes a herculean effort to explain everything to a fare-thee-well. In ""The Grudges"" most ridiculous sequence Karen watches -- courtesy of a cast of obliging ghosts led by Bill Pullman whose character throws himself off a high-rise balcony in the films first minute -- a kind of reenactment of what exactly happened in the house three years ago. Its just too too much and anyone other than the most cretinous viewer or those who stepped out for popcorn at an inopportune moment ought to feel insulted. That being said its effectively frightening. Its just not the kind of frightening that stays with you very long unless of course someone decides to make the same movie . . . yet again. And given the fact that there were three iterations of the Japanese ""Ju-on"" theres already talk of an English-language sequel to ""The Grudge."" THE GRUDGE (PG-13 88 minutes) -- Contains disturbing occasionally violent imagery and mild sensuality. In English and some Japanese with subtitles. Area theaters. Print This Article E-Mail This Article RSS Feed Permission to Republish (c) 2004 The Washington Post Company <a href=""http//ad.doubleclick.net/jump/wpni.artsandlivingarticle/movies/reviews;dir=osullivannode;dir=artsandliving;dir=movies;dir=reviews;dir=osullivan;page=article;kw=;pos=ad30;;tile=20;abr=ie;ord=1098432207147?""></a> <a href=""http//ad.doubleclick.net/jump/wpni.artsandlivingarticle/movies/reviews;dir=osullivannode;dir=artsandliving;dir=movies;dir=reviews;dir=osullivan;page=article;kw=;pos=ad21;;tile=20;abr=ie;ord=1098432207147?""></a> <a href=""http//ad.doubleclick.net/jump/wpni.artsandlivingarticle/movies/reviews;dir=osullivannode;dir=artsandliving;dir=movies;dir=reviews;dir=osullivan;page=article;kw=;pos=ad24;;tile=20;abr=ie;ord=1098432207147?""></a> <a href=""http//ad.doubleclick.net/jump/wpni.artsandlivingarticle/movies/reviews;dir=osullivannode;dir=artsandliving;dir=movies;dir=reviews;dir=osullivan;page=article;kw=;pos=ad25;;tile=40;abr=ie;ord=1098432207208?""></a>",http://www.washingtonpost.com/wp-dyn/articles/A51350-2004Oct21.html,200,thegrudge5,thegrudge,washingtonpost
