review,link,status_code,id,movie_key,critic
"Its heroes too dumb to live too cute to off early Hills II offers a study in splatter films - SFGate Subscribe Sign In Home Contact SFGate Contact SFGate Customer Support Submissions amp; Tips Classifieds About SFGate About SFGate FAQ Register on SFGate SFGate Newsletters SFGate Staff Careers Site Index Hearst About The Chronicle About The Chronicle The Chronicle Staff Become a Subscriber Manage Your Subscription Customer Service Careers e-edition Back Copies Chronicle in Education Corrections Advertise with Us More on Advertising More on Advertising Place a Classified Ad About Our Ads Public Notices Local Business Directory Place an Obituary Gate List Store Privacy policy Privacy policy Ad Choices Chronicle Archives Terms of Use Newsletters Get news alerts SFGate Customer support Get VIP access with SF Chronicle Membership Get SFGate newsletters for the latest from the Bay Check out the Top 100 Bay Area restaurants News Bay Area amp; State Traffic Nation World Politics Crime Election Results Obituaries Tech Health Education Video News Blogs Fire in Big Sur area grows 15 percent contained Little shaker 2.7-magnitude earthquake rattles Bay Area 2 men held after 2 San Diego officers shot 1 fatally 4 Sierra plane crash victims were from Tuolumne County Sports 49ers Raiders Giants As Olympics Warriors Sports Blogs Sports Calendar MLB NBA College Preps Golf Outdoors Cal football position preview Linebacker How low can Giants go? Latest loss comes with a triple play Rich Hills blister problem As success muddle trade outlook One bad inning sinks As at Cleveland Business Technology Mortgage Rates Home Guides Public Notices Sponsored Content Office Space The Tech Chronicles Net Worth Plus Fossils amp; Photons Mind Your Business VisionSF Jobs Price Point 649000 in San Bruno ICYMI Can Chipotle be a burger king? Redstones potential Victorian duplex in SOMA open Sunday Three bedroom apartment in San Franciscos Financial District Entertainment The Daily Dish Movies Music amp; Nightlife Performance Art Blogs Videos Events Puzzles TV Horoscope Comics Crosswords amp; Puzzles Things To Do Jason Bourne is a shaky smeary mess The latest from Dear Abby ""Bad Moms"" mixes sentiment with raunch and ends up vulgar Phantom Boy is fast-paced but slight animated fun Food Restaurants Wine Top 100 Restaurants Chronicle Wine Competition Reservations Beer News Inside Scoop SF Healthy Eating Angele Chef shuffle at Napa French restaurant Napa blockbuster Ninebark is closing (temporarily) Check out the food (and menu) at Black Cat now open in the Lights go out at La Rondalla longtime Mission dining spot Living Home amp; Garden Style Parties Lust LGBT Mommy Files amp; Parenting Houzz Outdoors Blogs Sponsored Schools Camps amp; Activities Exploring night photography locations in the Bay Area Couple from different cultures find love is a common ground Heres the most popular video game from the year you were born More Crystal Basin campsites are available with start of Olympics Travel Destination BC Exotic Destinations Monterey-Carmel Weekend Getaways Wine Country Napa Reno-Tahoe Hawaii Caves offer older view of the Continent Traveling to Big Sur? What you need to know Suite Spot Ritz-Carlton Philadelphia Rick Steves Europe Drink in a city through cafe culture Real Estate New Homes Open Homes Luxury Rentals Mortgage Rates Commercial Place an ad Home Guides Home Sales On the Block Blog Hot Property Sebastopol Italianate estate enjoys ocean views How much space do you get for 1500 a month? Hillcrest Estate possibly owned by baseball Hall of Famer Joe Cars Dealers Click and Clack Car Blog My Ride Sell Your Car First Buick ragtop since the 91 Reatta A cherished Nash-Healey Roadster Past Phantom still turning heads Teslas Model S can be used as a boat in a pinch Jobs Job Events Advertise Salary Wizard Get To Work Consider the red flags when staying in a job you dislike Declutter your job search The job gap explanation How to impress an interviewer with non-verbal language Findamp;Save Chronicle Latest columns Michael Bauer Leah Garchik Bruce Jenkins Esther Mobley Ann Killion Thomas Lee Matier amp; Ross C.W Nevius Kathleen Pender Scott Ostler Special Report Forgotten Survivors of AIDS The ultimate NorCal brewery map Top 100 Restaurants Warriors show their style off the court MenuSections http//www.sfgate.com/movies/article/Its-heroes-too-dumb-to-live-too-cute-to-off-2607347.php Its heroes too dumb to live too cute to off early Hills II offers a study in splatter films By Peter Hartlaub Published 400 am Monday March 26 2007 Photo HO Image 1of/1 CaptionClose Image 1 of 1 A scene from Fox Atomics The Hills Have Eyes 2 - 2007 A scene from Fox Atomics The Hills Have Eyes 2 - 2007 Photo HO Its heroes too dumb to live too cute to off early Hills II offers a study in splatter films 1 / 1 Back to Gallery The Hills Have Eyes II Horror. Starring Michael McMillian Jessica Stroup and Daniella Alonso. Directed by Martin Weisz. (R. 89 minutes. At Bay Area theaters. See complete movie listings and show times and buy tickets for select theaters at SFGate.com/movies.) As unnecessary horror remakes go last years ""The Hills Have Eyes"" did just about everything right. Sure the movie had nothing to say that wasnt covered in Wes Cravens 1977 original but it still came through with stylishly gruesome directing quality actors who could sell the dark humor and buckets and buckets of gore. All thats left in ""The Hills Have Eyes II"" is the bloody carnage and much of that is filmed in caverns so dark that you cant tell a severed foot from a decapitated head. The good guys are incredibly dumb thus theyre almost impossible to root for. And the bad guys in this movie all look exactly the same -- like a cross between a pineapple Jay Leno and Eric Stoltz in ""Mask."" While its not that unusual for a quality movie to be followed by a terrible sequel this is a prime opportunity to examine what makes a good splatter film. The ""Hills"" remake was a harrowing journey focusing on a family whose RV stalled in the middle of the desert -- where a gang of deformed homicidal maniacs picked them off one by one. The wayward travelers mostly seemed like helpless underdogs until the wimpy-looking son-in-law rose to the challenge and turned the tables on his tormenters. The good guys in ""The Hills Have Eyes II"" are a troop of well-armed soldiers who at first look would seem to have every advantage over the cleaver-wielding trolls living in the mountain. Its only through their consistent bad decision-making that the bad guys continue to gain the upper hand. Our heroes are quite literally too stupid to live and its not fun to watch. Craven and his son Jonathan wrote the screenplay for ""Hills II"" but theres almost nothing original or surprising in the dialogue or action. This is exactly the kind of predictable horror detritus that Craven made fun of more than a decade ago when he directed ""Scream."" The good guys die predictably in reverse order of how hot they are. (The movie poster tagline should read ""The Cute Ones Die Last."") Some of the plot points are repetitive from the original such as a sympathetic mutant who helps the good guys. And while the production design in the remake was creepy-cool the cliffs and underground tunnels where 95 percent of ""The Hills Have Eyes II"" takes place are indistinguishable from shot to shot. Worse yet theyre always leaving a gun behind walking off to take a pee by themselves or going back for a doomed friend -- even long after the threat has been established. Most horror films require a couple of stupid decisions just to keep the action moving. In ""Hills II"" the entire plot is built on the poor survival skills of its protagonists. There are one or two flairs of coolness such as the bad guy who slices a soldiers arm off -- and then uses the severed limb to wave goodbye as he pushes the good guy down a cliff. But theres nothing in ""Hills II"" that approaches the best work of Craven who showed in the underrated 2005 thriller ""Red Eye"" that hes capable of much better. Its also worth noting that someone involved in this movie has a strange fetish for people getting attacked while they go to the bathroom. The film may not be as scary as its predecessor but it will make you think twice before you use a Porta Potti again. -- Advisory This film contains adult language heavy amounts of violence and gore and a rape. Theres also a scene where a guy crawls up through the bowels of a toilet which you should already be emotionally prepared for if youve watched the last 20 minutes of ""The Shawshank Redemption."" (Or any episode of ""Jackass."") Most Popular 1 Dear Abby I want to contact mistress from 45 years ago 2 Cops Son of billionaire former supermodel arrested after... 3 Ann Coulter Hammered by Conservatives for Smearing US War... 4 Iceland man says Donald Trumps son left white powder at... 5 Dear Abby I dont want anyone to know that Ive retired 6 Oakland-bound medical plane crashes -- 4 killed 7 Police Girl 14 slits teens throat in hope of first kill 8 Inmate charged in 2015 quadruple slaying in S.F. 9 Bikini-clad Swedish cop makes arrest while sunbathing 10 Woman at scene of minor crash killed when car hits her Find Showtimes Search Theaters amp; Showtimes -- County -- Alameda Contra Costa Lake Marin Napa San Francisco San Mateo Santa Clara Solano Sonoma Show Movies Now Playing | Recent Releases | Critics Favorites Rated G | PG | PG-13 | R Latest News Officials believe no survivors in Texas hot air balloon crash Little shake 2.7-magnitude earthquake rattles Bay Area Philippine president calls off truce after rebel attack Ann Coulter slammed for calling war heros dad angry Muslim 4 Sierra plane crash victims were from Tuolumne County Inmate charged in 2015 quadruple slaying in S.F. Police Vallejo woman run over by man who stole her car Man Trumps son left white powder at rental paid women Parilia Amusement Ball in San Francisco early days View Comments (c) 2016 Hearst Communications Inc. Logo Return to Top About Our Company Careers Advertising Ad Choices Terms amp; Conditions Privacy Policy Your California Privacy Rights Contact Customer Service Newsroom Contacts Connect Facebook Twitter Pinterest Google Instagram Subscribe SFChronicle.com App e-edition The Chronicle Archives Subscription Offers Member Services Hearst Newspapers (c) Copyright Hearst Communications Inc.",http://www.sfgate.com/cgi-bin/article.cgi?file=/c/a/2007/03/26/DDGFHOQO361.DTL&type=movies,200,thehillshaveeyes25,thehillshaveeyes2,sfgate
"The Hills Have Eyes 2 | Variety Variety Editions U.S Latino Global Asia Subscribe Today Navigation Menu Film TV Digital Contenders Video Dirt Jobs More Biz Music Legit Scene Conferences Insight Archives Directory Choose Edition U.S Latino Global Asia Russia | My Account Sign In Subscribe HomeFilmReviews Review The Hills Have Eyes 2 John Anderson 0 Share This Article Email LinkedIn Pin It Tumblr March 25 2007 | 0120PM PT Horror sequels and remakes? What they usually signify is one more trip to the well with a bucket of blood. But while ""The Hills Have Eyes 2"" -- a sequel to a remake -- may inhabit familiar geography screenwriters Wes Craven and son Jonathan have shifted the dramatic landscape. . . Horror sequels and remakes? What they usually signify is one more trip to the well with a bucket of blood. But while ""The Hills Have Eyes 2"" -- a sequel to a remake -- may inhabit familiar geography screenwriters Wes Craven and son Jonathan have shifted the dramatic landscape The scene is still the A-bomb test site of Wes Cravens 1977 original and it includes the mutant cannibals of Alexandre Ajas 2006 remake. This time though the victims are National Guardsmen the issues include training and equipment and the entire scenario adds up to an unmistakable critique of the war in Iraq. The politics of ""Hills 2"" wont enlist any new converts to the horror ranks but existing fans will be drawn to the combination of visceral tension violent payoff and the patented Craven gift for innovative gore. Pic bowed to 10 million in North America and landed in seventh place over the weekend. The scene is a 1300-square-mile patch of New Mexico where the Carter family of the previous ""Hills"" pics met their fate at the hands of mutant psycho Quasimodo look-alikes bio-victims of government nuclear tests. Immediately upon arriving the ""Hills 2s "" National Guard patrol is set upon by the grotesque cave-dwellers who hit and run with such eerie speed that the Guardsmen -- all young and untrained -- are immediately unnerved. It doesnt do much for their confidence that the team of scientists and military they were supposed to meet have all vanished. While nothing is as broadly political as the impalement -- by an American flag -- perpetrated in the 2006 ""Hills Have Eyes"" the sentiments are obvious enough. Napoleon (Michael McMillian) the smartest member of the co-ed Guard group that finds itself in a hostile desert is challenged about his lack of enthusiasm for the war. ""Presidents lie too much"" he says. Hes given little slack ""The last president who told the truth was Truman"" barks his commanding officer Sarge (Flex Alexander) ""and you know what he said? The buck stops here "" Sarge and Napoleon are never going to get along but the way things are working out with the natives it really wont matter. In their first outing as a screenwriting team the Cravens dont offer a lot in terms of plot -- mostly the imperiled attempt to become unimperiled. But with the exception of a ridiculous ""Are you OK?"" when the person has been abducted beaten and raped (and which may have been intended as a ""Scream""-style joke line) the dialogue sparks and the humor relieves without intruding on the mood of terror. A scientist offering a cheery ""Hi"" to a ghoul lunching on intestines? How can you not laugh? Helmer Martin Weisz whose background is largely in musicvideos meets the challenge of creating dread in broad daylight before the entire cast of soldiers and carnivores heads underground into the warren of mines and tunnels where the mutants dwell. Cinematographer Sam McCurdys work is really fine -- the outside world is crisp creepy and khaki-colored while his subterranean shooting is in surroundings so deprived of light youre surprised you can make out whats down there. But oh yes you can. And you probably wont like what you see. The Hills Have Eyes 2ProductionA 20th Century Fox release of a Fox Atomic presentation of a Craven/Maddalena Films and Peter Locke production. Produced by Wes Craven Marianne Maddalena Locke. Executive producer Jonathan Debin. Co-producers Jonathan Craven Christina Anderson Cody Zweig. Directed by Martin Weisz. Screenplay Wes Craven Jonathan Craven. CrewCamera (color Deluxe prints) Sam McCurdy; editors Kirk Morri Sue Blainey; music Trevor Morris; music supervisor David Franco; production designer Keith Wilson; art director Alistair Kay; set decorator Luca Tranchino; costumes Janie Bryant; special makeup and effects Gregory Nicotero Howard Berger; supervising sound editor (Dolby Digital/SDDS/DTS) Jonathan Miller; sound designer Stuart Provine; visual effects supervisor Jamison Goei; special effects supervisor Jason Troughton; stunt coordinator Cedric Proust; assistant director Christopher Landry; casting Mark Bennett. Reviewed at Mann Chinese 6 Los Angeles. MPAA rating R. Running time 89 MIN. With Napoleon - Michael McMillian Amber - Jessica Stroup Missy - Daniella Alonso Crank - Jacob Vargas Sarge - Flex Alexander Delmar - Lee Thompson Young Spitter - Eric Edelstein Papa Hades - Michael Bailey Smith Filed Under The HillsWes Craven Want to read more articles like this one? SUBSCRIBE TO VARIETY TODAY. Post A Comment 0 Variety Jobs Creative Development Coordinator Triptyk Studios New York New York Account/Project Coordinator (Ad Agency) Petrol Advertising Burbank California Media Specialist Bridgewater Associates Westport Connecticut Executive Director Aspen Film Company Confidential Aspen Colorado Associate Director YouTuber amp; Gamer Partnerships Save the Children Fairfield Connecticut See More Jobs Marketplace Leave a Reply No Comments Cancel reply Comments are moderated. They may be edited for clarity and reprinting in whole or in part in Variety publications. Enter your comment here... Fill in your details below or click an icon to log in Email (required) (Address never made public) Name (required) Website You are commenting using your WordPress.com account. ( Log Out / Change ) You are commenting using your Twitter account. ( Log Out / Change ) You are commenting using your Facebook account. ( Log Out / Change ) You are commenting using your Google+ account. ( Log Out / Change ) Cancel Connecting to %s Notify me of new comments via email. Notify me of new posts via email. More Film News from Variety The Power of Content Westworld Divorce amp; Insecure Get Premiere Date On HBO Lindsay Lohan Without Engagement Ring Egor Tarabasov Wedding... High Beam Shoes Launches Synching Sneakers That Help Find... Performer of the Week John Turturro All the best new iOS and Android apps you need to download Subscribe to Variety Today All The Ways to Get Variety Online Subscription Print Subscription Mobile Apps Newsletters News Alerts Archives Slanguage Dictionary Help Other Variety Products MediaVariety 411 Research amp; DataVariety Insight Archives Premium Email Alerts Real Estate Jobs Access the best entertainment industry data available View the Variety archives dating back to 1905 Get News Delivered To Your Inbox Privacy Policy Your Privacy Rights Terms of Use About Us Advertise Contact Us Google+ The Power of Content Deadline india.com Hollywoodlife hollywood TV Line BGR WWD Footwearnews (c) Copyright 2016 Variety Media LLC a subsidiary of Penske Business Media LLC. Variety and the Flying V logos are trademarks of Variety Media LLC. Powered by WordPress.com VIP Variety411 Your production services resource",http://www.variety.com/review/VE1117933180.html?categoryid=31&cs=1,200,thehillshaveeyes26,thehillshaveeyes2,variety
"Hills Have Eyes II The | Reelviews Movie Reviews Out now Cher Harold Rosson Eva Green Benjamin ... Home Video Views ReelThoughts Currently in Cinema ReelViews Library Login Specials My Books Array ( [page] =gt; reelviews [view] =gt; hills-have-eyes-ii-the ) Hills Have Eyes II The (United States 2007) A movie review by James Berardinelli The Hills Have Eyes II is a sequel to a remake but not a remake of a sequel. Curiously Horrormeister Wes Craven has been involved in all four movies featuring the words ""hills"" and ""eyes"" in the title. He wrote and directed the 1977 original and its 1985 sequel. He produced the 2006 remake and now he has added writer/producer credits for this movie to his resume. However whatever optimism I may have had for the movie considering Cravens involvement evaporated quickly once in the theater. Whatever contribution Craven made to the screenplay must have occurred in the middle of the night while he was blindfolded. The hills might have eyes but this is one of those times I wish I didnt; then I could have been spared the headache and boredom inducing experience of sitting through this. If the purpose of a horror film is to deliver violence and gore The Hills Have Eyes II provides those elements aplenty. There is carnage and viscera to go along with a particularly disturbing (and graphic) birth scene and an equally shocking (and unnecessary) rape. However if the purpose of a horror film is to frighten and unsettle The Hills Have Eyes II fails. The movie has no atmosphere to speak of and it is abominably ineffective when it comes to generating tension or suspense. This is yet another movie where audience members can play the ""fun"" game of figuring out in what order the cardboard characters will get picked off and how many of them will survive to see the end credits. The Hills Have Eyes II sends a National Guard unit on a training mission into ""Area 16"" in the New Mexico desert. (They would have been in better shape had they been deployed in Iraq or Afghanistan.) The characters all have names but since theyre mostly played by unknowns its probably most instructive to refer to them by their defining characteristics the tough black sergeant (Flex Alexander) the peacenick (Michael McMillan) the gung-ho lothario (Reshad Strick) the inept big guy (Eric Edelstein) the two women (Jessica Stroup Daniella Alonso) the perfect soldier (Lee Thompson Young) the coward (Ben Crowley) and the shoot-before-thinking hothead (Jacob Vargas a hey Ive heard of him). These guys climb a mountain lose a few of their members to the mutants who live in the area get stuck up there when their ropes are stolen then spend the rest of the movie wandering around in disused mines. The Descent proved that its possible to create a taught horror movie in underground passageways. All it requires is a little ingenuity and a strong sense of atmosphere. The Hills Have Eyes II illustrates that its possible to utilize a similar premise to dismal effect. Once the characters get underground the movie turns into a bore. Theres no gnawing sense of claustrophobia. Theres no growing feeling of menace. Theres just resignation that were going to have to spend an hour with these uninteresting characters as they stumble around looking for daylight. Sure there are occasional appearances by adult mutant ninja cannibals but these guys arent much fun. Then there are the necessary contrivances demanded to even the odds as the soldiers all run out of ammo at the same time. Fix bayonets The creature work in The Hills Have Eyes II is bad enough to be called amateurish. It looks like the makeup department took some big actors and stuck colored marshmallows all over their bodies. Rather than appearing frightening they look silly. They would probably be more effective if their exposure to the camera was limited but unlike the rubber shark in Jaws theyre shown too often in good light. The only horrific sight is that of the pregnant woman during the opening sequence but the overall effect is more repellant than frightening. The Hills Have Eyes II is made for the undiscriminating horror ""fan"" - someone whos looking for a fix of blood and gore without much caring what goes along with it. Sadly this has become the state of the genre in the 90s and its an indication of how bad things have gotten when respected icons like Wes Craven have fallen prey to the pitfalls of fast money and shoddy production values. After this disgrace its time to shut the hills eyes for good. Hills Have Eyes II The (United States 2007) Director Martin Weisz Cast Michael McMillan Jessica Stroup Daniella Alonso Jacob Vargas Lee Thompson Young Ben Crowley Eric Edelstein Flex Alexander Reshad Strik Screenplay Wes Craven amp; Jonathan Craven Cinematography Sam McCurdy Music Trevor Morris U.S. Distributor Fox Atomic Run Time 130 U.S. Release Date 2007-03-23 MPAA Rating ""R"" (Violence Profanity Nudity) Genre HORROR Subtitles none Theatrical Aspect Ratio 2.351 Comments Add Comment Three...better movies of this genre Halloween (1978) Frankenstein (1931) Blair Witch Project The (1999) worse movies of this genre Captivity (2007) Halloween 6 The Curse of Michael Myers (1995) Feast (2006) Three...better movies of Michael McMillan (There are no more better movies of Michael McMillan) worse movies of Michael McMillan (There are no more worst movies of Michael McMillan) Three...better movies of Jessica Stroup (There are no more better movies of Jessica Stroup) worse movies of Jessica Stroup Prom Night (2008) (There are no more worst movies of Jessica Stroup) Three...better movies of Daniella Alonso (There are no more better movies of Daniella Alonso) worse movies of Daniella Alonso (There are no more worst movies of Daniella Alonso) ReelViews Library Currently in Cinema Writings Fictional Writings ReelThoughts Specials About Privacy Policy Terms and Conditions Contact Website credits",http://www.reelviews.net/php_review_template.php?identifier=597,200,thehillshaveeyes27,thehillshaveeyes2,reelviews
