review,link,status_code,id,movie_key,critic
"Dont head for the Hills - NY Daily News Trending DEMOCRATIC NATIONAL CONVENTION HILLARY CLINTON KESHIA KNIGHT PULLIAM MICHAEL JORDAN DONALD TRUMP Sections Sections Home New York NYC Crime Bronx Brooklyn Manhattan Queens Education Weather Obituaries Sports Yankees Mets Giants Jets Knicks Nets Rangers Islanders Football Basketball Baseball Hockey Soccer College High School The Score More Sports News Crime U.S. World Politics Entertainment Gossip Games Entertainment Pics TV Movies Music Theater amp; Arts Horoscopes Daily Weekly Monthly Pet Horoscopes Lifestyle Health Homes Food Opinion Autos Buyers Guide Ratings amp; Reviews News amp; Views Photos amp; Galleries Covers Classifieds Trending DEMOCRATIC NATIONAL CONVENTION HILLARY CLINTON KESHIA KNIGHT PULLIAM MICHAEL JORDAN DONALD TRUMP entertainment Follow Us Facebook Twitter Instagram Pinterest YouTube Subscribe Follow UsNewsletter App Subscriptions Subscribe Get Our Newsletter A daily blend of the most need-to-know Daily News stories delivered right to your inbox. Sign Up Get the latest breaking news entertainment sports and more.Download Our App Subscribe to the newspaper our e-edition or both.Subscribe Select Sport Football Basketball Baseball Hockey Soccer College High School More Sports Gossip Games Entertainment Pics TV Movies Music Theater amp; Arts Share This facebook Tweet email Dont head for the Hills Dont head for the Hills BY Elizabeth Weitzman Wednesday March 28 2007 825 PM facebook Tweet email Women baring arms Daniella Alsonso (l.) and Jessica Stroup flesh out Hills plot. BY Elizabeth Weitzman Wednesday March 28 2007 825 PM Written disappointingly by Wes Craven and his son Jonathan this limp sequel to last years remake of Wes 1977 original feels like the work of a guy whos spent a few too many days lost in the desert. The followup brings us back to dusty New Mexico where mutant hill dwellers have lived since the government conducted nuclear testing decades ago. They dont take well to outsiders so should you wander into their backyard you can plan on being killed raped or eaten. If youre dumb or unlucky enough you could hit the trifecta.Of course the National Guard trainees who arrive one sunny day have no idea of what awaits. So when they hear a fuzzy distress signal their sergeant (Flex Alexander) considers a search-and-rescue mission. Gung-ho soldier Crank (Jacob Vargas) grabs his rifle though peace-loving Napoli (standout Michael McMillian) who has clearly never seen a horror movie warns ""its not about making idiotic and possible fatal decisions."" Naturally hes outvoted and the troops not only climb up into the mountains but make the idiotic and probably fatal decision to enter the caves that dot the landscape. Played primarily by unknown actors each soldier gets exactly one defining trait and the Cravens didnt expend much energy coming up with them. Aside from the pacifist and a Rambo theres the fat one the brave one the pretty one and the one whos a devoted mother. The fact that her gleefully graphic and gratuitous rape is one of the few scenes staged with any effort should tell you most of what you need to know.On the whole this is an awfully long slog through very arid terrain in which generic soldiers track fight and try to escape from generic villains (youd be surprised at how uninteresting mutant flesh-eaters can be). I cant speak for the hills but I spent most of the movie just trying to keep my eyes open.elyzawaol.com Send a Letter to the Editor Join the Conversation facebook Tweet PC Richard and Son Get Daily News stories delivered to your inbox. Sign Up Follow Us Facebook Twitter Instagram Pinterest YouTube Keep in Touch Newsletter Apps Subscribe Feeds Support amp; Contact Contact Us Careers Media Kit Site Map Terms of Use Ad Choices Terms of Service Privacy Policy Daily News Covers (c) Copyright 2016 NYDailyNews.com. All rights reserved.",http://www.nydailynews.com/entertainment/movies/2007/03/24/2007-03-24_dont_head_for_the_hills.html,200,thehillshaveeyes20,thehillshaveeyes2,nydailynews
"Time Out New York | New York Events Activities amp; Things To Do Go to the content Go to the footer Time Out New York New York Popular cities London New York Paris Chicago Los Angeles Browse all cities Time Out New York Close New York Change city New York Popular cities London New York Paris Chicago Los Angeles Browse all cities Tickets Events Things to Do Restaurants Bars Movies Theater Music Shopping Attractions Blog Art Travel Nightlife Events amp; Festivals Museums Kids Hotels Comedy Dance LGBT Sex amp; Dating Books City Guide Neighborhoods Promotions Close My Time Out Things I love My lists My Profile My Account Sign out Sign in Create account Sign in With your social account Or with your email Email Password Remember me Forgotten your password? Sign in You can create a Time Out account in two ways... With a few clicks using your favourite social network Or by entering your details below Email First Name Last Name Create password Repeat new password I accept Time Outs terms of use including opt-in to newsletters. Create account Welcome  You have successfully connected your account to Time Out. You may sign in with this account in future. Please confirm your account details Email First Name Last Name I accept Time Outs terms of use including opt-in to newsletters. Sign up My Account Sign in or Create account Search Tickets Events Things to Do Restaurants Bars Movies Theater Music Shopping Attractions Blog Art Travel Nightlife Events amp; Festivals Museums Kids Hotels Comedy Dance LGBT Sex amp; Dating Books City Guide Neighborhoods Promotions More Search Your ultimate guide to New York Discover the best NYC events things to do restaurants theater and nightlife Movies The best movies out right now Find the latest reviews for movies playing in New York this week Read more Bars The best Williamsburg bars in NYC These are the best Wiliamsburg bars from bustling beer gardens to elegant speakeasies Read more Blog Five emo bands worth taking a look at Theyll make you wish it was the 90s again Read more Things to do The best helicopter tours in NYC Soak up exhilarating views of the citys stunning skyline by choosing the best helicopter tour NYC has to offer Read more Shopping The best cheap clothing stores in NYC The best cheap clothing stores in NYC have everything from vintage duds to one-of-a-kind outfits Read more Things to do in New York Today This week This weekend This month Find more things to do in New York Tickets and offers Hamilton Get your tickets to one of the most critically-acclaimed shows ever--winner of 11 TONY Awards Read more Beautiful The Carole King Musical Take good care of your baby and take them to see this award-winning show Read more The Book of Mormon Nine TONYs. Five Stars. Thank God you can get tickets to this hilarious musical right here. Read more Wicked Touted as the ""Best Musical of the Decade"" Wicked is truly Broadway at its best. Read more Find more tickets Latest news Blog Five emo bands thatll make you wish it was still the 90s What the hell is emo music? The only certainty that question offers is No one will agree. Theres the proto-emo puritans (see 80s acts Rites of Spring and... Read more Blog 15 things youll miss about having a roommate in NYC Roommates. Every New Yorker either has or had one at some point in their lives (unless of course youre a bazillionaire). As tricky as living with your... Read more Blog Awesome free party Glow will illuminate Brooklyns Grove Alley with cosmic light displays tonight Who needs to see the nights stars when trippy light displays are brought to the citys streets or more specifically Brooklyns Grove Alley? Tonight... Read more Blog Whales are blowing up (air from the top of their heads) all over New York Here in New York we like things as a certain infamous city resident is known for saying huge Our skyscrapers are the countrys tallest our Macys is the... Read more More from the blog Upcoming NYC events and festivals Blog Waterfight NYC 2016 2 Read more Things to do New York City Poetry Festival Read more Music Lincoln Center Out of Doors Read more Things to do Jazz Age Lawn Party Read more More New York events and festivals New York events calendar July events August events September events October events See our full events calendar for 2016 The best of New York Things to do The best of 2016 See our essential guide to the best of 2016 including upcoming concerts movies museum exhibits restaurants and more 1 Read more Bars Cocktails in NYC Use our guide to find the best cocktails in the city drink recipes bar reviews and more Read more Attractions The 50 best sights and attractions in NYC From historical landmarks to newer destinations here are the best sights to visit in NYC for tourists and locals alike 5 Read more Theater The best Broadway shows in NYC The most exciting plays musicals and revivals on Broadway. Read more Restaurants The 100 best restaurants in NYC Where are you eating tonight? Read more Art The best art museums in NYC In New York theres a museum for every aesthetic and intellectual taste. 1 Read more Find the best of NYC Most popular stories Blog New dine-in Brooklyn movie theater only charges 3 per ticket Its like a fancier version of Nitehawk Cinema but cheaper? Damn Cancel your plans because tonight January 15 is the grand opening of Syndicated (a new... 7 Read more Blog Watch HD footage of New York in 1993 You wont spot any Citi Bikes smartphones or illegal hoverboards in this footage of New York. The impressively clear HD footage was actually shot around the... 1 Read more Music The 50 best love songs of all time Are you ready to fall head over heels with the best love songs of all time? Cupid has you in his sights people. Read more Things to do NYC events calendar for 2016 Find the best things to do all year with our NYC events calendar of 2016s coolest events including parades concerts films and art exhibits Read more Music 50 sexiest songs ever made Our playlist of sex songs will take you by the hand whisper sweet nothings in your ear and lead you straight to the bedroom Read more See more popular stories New York neighborhoods Things to do Williamsburg neighborhood guide Read more Things to do Chelsea neighborhood guide Read more Things to do Bushwick neighborhood guide Read more Things to do Soho neighborhood guide Read more Things to do Chinatown neighborhood guide Read more Things to do Bronx neighborhood guide Read more More New York neighborhood guides Top About us Work for Time Out Privacy policy Website terms of use Contact us Get listed Advertising Time Out products Mobile apps Time Out Shop Time Out Guides Time Out Travel Time Out Worldwide Time Out magazine Follow us Facebook Twitter Youtube Instagram Pinterest Spotify Foursquare Time Out New York Site map }",http://www.timeoutny.com/newyork/Details.do?page=1&xyurl=xyl://TONYWebArticles1/600/film/the_hills_have_eyes_2.xml,200,thehillshaveeyes21,thehillshaveeyes2,timeoutny
The Hills Have Eyes II (2007) directed by Martin Weisz | Film review Go to the content Go to the footer Time Out London London Popular cities London New York Paris Chicago Los Angeles Browse all cities Time Out London Close London Change city London Popular cities London New York Paris Chicago Los Angeles Browse all cities Tickets Offers Things to Do Restaurants Bars amp; Pubs Film Theatre Art Music Attractions Blog Theatre Tickets Shopping Offer of the Day Time Out Card Time Out Escapes Time Out Live Hotels Nightlife Music festivals Events amp; Festivals Kids Museums Clubs Comedy Food amp; Drink Classical Music amp; Opera Dance LGBT City Guide Area Guides Property Competitions Dating Close My Time Out Things I love My lists My Profile My Account Sign out Sign in Create account Sign in With your social account Or with your email Email Password Remember me Forgotten your password? Sign in You can create a Time Out account in two ways... With a few clicks using your favourite social network Or by entering your details below Email First Name Last Name Create password Repeat new password I accept Time Outs terms of use including opt-in to newsletters. Create account Welcome  You have successfully connected your account to Time Out. You may sign in with this account in future. Please confirm your account details Email First Name Last Name I accept Time Outs terms of use including opt-in to newsletters. Sign up My Account Sign in or Create account Search Tickets Offers Things to Do Restaurants Bars amp; Pubs Film Theatre Art Music Attractions Blog Theatre Tickets Shopping Offer of the Day Time Out Card Time Out Escapes Time Out Live Hotels Nightlife Music festivals Events amp; Festivals Kids Museums Clubs Comedy Food amp; Drink Classical Music amp; Opera Dance LGBT City Guide Area Guides Property Competitions Dating More Search The Hills Have Eyes II Film  Horror Add review 0 Love It Save it 0 Add review 0 Love It Save it Time Out says Details Users say Time Out says A hateful sadistic and boring sequel to Alexandre Ajas 2005 remake this bears little relation to the French directors visually inventive re-working - nor indeed to Wes Cravens lazy 1985 follow-up to his own cult original. Here an inexperienced National Guard Unit delivering supplies to the Section 16 military facility arrives to find the place deserted. Then its mirror signal manoeuvre as flashes from the hillside lure the part-time soldiers into traps set by mutant cannibal caveman Papa Hades (Michael Bailey Smith) and his two bastard off-spring Chameleon and Hansel. Lacking the genre-steeped intelligence of Gregory Levasseurs screenplay for the Aja film the killing-by-numbers script from producer Wes Craven and his son Jonathan presents German director Martin Weisz with few opportunities for suspense or scares. Weisz prefers a single-minded pursuit of ugly set-pieces and repellent sexual violence. Weisz first feature was Butterfly A Grimm Love Story a banal study of a real-life cannibal killer. Like this sorry sequel it amounted to far less than the sum of its body parts. By Nigel Floyd Posted Tuesday March 27 2007 Details Release details Rated 18 Release date Friday March 30 2007 Duration 89 mins Cast and crew Director Martin Weisz Screenwriter Jonathan Craven Wes Craven Cast Jessica StroupReshad StrikLee Thompson YoungDaniella AlonsoMichael McMillianBen Crowley Users say LiveReviews|01 person listeningSign inWrite reviewMost helpfulMost helpfulHighest ratingLowest ratingNewestOldestLoadingundefinedNew CommentsRefreshShow More Share Tweet 0 Shares Top About us Work for Time Out Privacy policy Cookie Policy Website terms of use Contact us Time Out for business Get listed Claim your listing Premium Profiles Advertising Time Out products Time Out Card Mobile apps Time Out Shop Time Out Guides Time Out Travel Time Out Offers Time Out Worldwide Time Out magazine Where to get Time Out magazine Subscribe to Time Out magazine Manage my subscription Follow us Facebook Twitter Youtube Instagram Pinterest Spotify Time Out London Site map },http://www.timeout.com/film/84149.html,200,thehillshaveeyes22,thehillshaveeyes2,timeout
The Hills Have Eyes 2 | EW.com Skip to main content Sign In Log Out TV TV Recaps Movies Music Books Gaming Video Big Brother Queen of the South Mr. Robot Wayward Pines Suits Tyrant Shop Newsletter Subscribe Get 1 year for 25 Save 86% off the cover price SUBSCRIBE More Great Stuff Comic-Con Hulu Hot List 50Scoops EW Popfest For Your Consideration Jess Cagle Interview Stage Follow EW EW on Facebook EW on Twitter EW on Tumblr EW on Instagram About EW Contact UsCustomer ServiceAbout UsJobs at Time Inc.AdvertisePrivacy PolicyYour California Privacy RightsAd ChoicesNewslettersSubscribeTerms of ServiceSite Map Copyright 2015 Entertainment Weekly Inc. All rights reserved. Login Log out TV TV Recaps Movies Music Books Gaming Video More... TV This Weeks Cover The Walking... TV Exclusive Photos of The Walking... EW POPFEST Get the details 50Scoops50Days Exclusive... Movies Crazy Stupid Love Before Th... Movies The Most 2000s Fashion From Joh... Movies 27 Great Revenge Movies Movies Alice in Wonderland Witticism... Movies John Tucker Must Die Where Ar... Books 15 Captivating International Cri... Movies Planet of the Apes See the Fa... Movies Toronto Film Festival 2016 See... TV One Tree Hill Where Are They... Movies Little Miss Sunshine Where Ar... Books Harry Potter and the Cursed Chi... Movies Comic-Con 2016 See Portraits of... TV Friends See the Casts Evolut... TV Comic-Con 2016 Get Batty With... Movies The Dark Tower Storybook Steph... News Comic-Con 2016 Star Portraits... TV 10 of the Best Moments From The... Movies The Dark Tower Storybook Steph... Movies Thelma and Louise See Rare Behi... Movies 9 of Garry Marshalls Best Movies Movies Every Star Trek Movie Ranked Movies Big Trouble in Little China... Movies The Dark Tower Exclusive Firs... Movies Suicide Squad Before They Wer... Movies The 10 Best Movies of 2016 (So Far) TV Fear the Walking Dead introduc... Movies by Gregory Kirschling Share Tweet Share on Google+ Share on Pinterest Share on Tumblr The Hills Have Eyes 2Last years Hills Have Eyes remake was just another modern horror movie with a soulless polish and a jones for torture. The Hills Have...The Hills Have Eyes 2HorrorJonathan Craven Wes CravenPT89MRLast years Hills Have Eyes remake was just another modern horror movie with a soulless polish and a jones for torture. The Hills Have...2007-03-30Flex AlexanderJacob VargasFlex Alexander Jacob VargasFox Atomic Share Tweet Share on Google+ Share on Pinterest Share on Tumblr C+ The Hills Have Eyes 2 Genre Horror; Starring Michael McMillian Jessica Stroup Flex Alexander Jacob Vargas; Director Martin Weisz; Author Jonathan Craven Wes Craven; Release Date Wide 03/23/2007; Runtime (in minutes) 89; MPAA Rating R; Distributor Fox Atomic Posted March 30 2007 -- 1200 AM EDT Last years Hills Have Eyes remake was just another modern horror movie with a soulless polish and a jones for torture. The Hills Have Eyes 2 is a different beast a retro horror-comedy featuring quick deaths and cheapo-looking gore with a few dorky laughs and gross-outs but not so many scares. Plopped down in a U.S. test site that looks like Kandahar nine National Guard soldiers battle A-bomb mutants who are probably meant to remind us of insurgents although that idea like half the cast is horribly malformed. Share Tweet Share on Google+ Share on Pinterest Share on Tumblr Top Stories Nick Cannon says he was hit with Mariah Carey diss on Wild N Out True Detective not dead yet HBO insists Jimmy Fallon Snapchats Martha Stewarts cooking on The Tonight Show Game of Thrones HBO confirms season 8 will be last Margot Robbie says shes given 50 tattoos to her friends HBO sets premiere dates for Westworld and more Suicide Squad Margot Robbie held her breath underwater for five minutes Photo Galleries 50Scoops50Days The Latest in Fall TV News The Biggest Moments From the 2016 Conventions Crazy Stupid Love Before They Were Stars The Most 2000s Fashion From John Tucker Must Die Exclusive Photos of The Walking Dead Season 7 27 Great Revenge Movies Alice in Wonderland Witticisms and Wisdom From the Disney Classic From Our Partners From Our Partners Contact UsCustomer ServiceAbout UsJobs at Time Inc.AdvertisePrivacy PolicyYour California Privacy RightsAd ChoicesNewslettersSubscribeTerms of ServiceSite Map Copyright (c) 2016 Entertainment Weekly Inc. All rights reserved. img[data-src] { display none important; },"http://www.ew.com/ew/article/0,,20016266,00.html",200,thehillshaveeyes23,thehillshaveeyes2,ew
"Who should live and who should die in The Hills - The Boston Globe Movies    Restaurants    Food    Calendar    Music    Theater/Arts    TV    Books    Celebrity news    Games Home gt; Aamp;E gt; Movies MOVIE REVIEW Who should live and who should die in The Hills By Wesley Morris Globe Staff  |  March 24 2007 Given the way popular culture is becoming fully on-demand some day the movies might have to adopt the ""American Idol"" model and let the viewer decide.At the megaplex the most natural beneficiary of such an entertainment upgrade (if customizing your movies is something you prefer) would be horror fans. For years theyve had to sit through hours of gems and dreck watching macho men get an ax to the chest and wily lusty young women become Final Girls (the last women standing). This possible future would allow kids to vote for victims decide survivors and ultimately crown their own Final Girl.Written by Wes Craven and his son Jonathan  ""The Hills Have Eyes 2"" is tailor-made for such a contest. Nine men and women of different races and varying degrees of intelligence from all over the country descend on an abandoned military outpost in the New Mexico desert. Theyre National Guard troops on a training assignment (destination Kandahar ) that suddenly becomes a search-and-rescue mission after desperate voices are heard over the airwaves. Some of these guardspeople are more likable than others and right away we pick up on who the family of lurking post-atomic cavemen should pick off first.I for starters would have kept calling in to expunge Sergeant Millstone (Flex Alexander  the comedian) from this movie. Hes the commanding officer but his stiff orders didnt convince me he should have been in charge. He doesnt listen to anyones advice but he does keep reminding us that this isnt spring break. (All the skull and crotch bashing might leave you eager to see a bikini or some board shorts though.) Lacking a beach were left to wonder if the anonymous rocky desert is meant to make us think were already in Kandahar. The new movie is a pre-combat nightmare whereas the first -- Alexandre Ajas effective 2006 remake of Cravens low-rent 1977 original -- was pure post-nuclear paranoia.Obviously the sequel is predicated on wavering common sense most of which belongs to the most wholesome-looking pair of the bunch -- Napoleon (Michael McMillian ) and Amber (Jessica Stroup ) two privates. I would have kept them around for their brains. Private Crank (Jacob Vargas ) is the hothead who gives everybody a hard time just because he can. His volatility makes him enjoyably unpredictable When will he do something dumb enough to get himself or someone else killed?Things go gory fast. The cutest guy is yanked left leg first through a hole barely big enough for a thigh. Other people are left to splatter on the rocks. The cavemen are horny and need the two women in the crew alive and Private Martinez (Daniella Alonso ) is bold (and foolhardy) enough to relieve herself alone among the crags. Her capture inspires a rescue mission within the rescue mission thats surprisingly suspenseful.The director Martin Weisz  doesnt lean on a lot of noise and editing tricks. He can relax since all the scares are built into the Cravens script which invokes both ""Goonies"" and last years instant-classic chicks-versus-cave-dwelling-vampires flick ""The Descent."" ""The Hills Have Eyes 2"" isnt as entertainingly witty as either of those movies but an assault and a near-assault actually almost make characters of the two women.Any audience with good judgment and the right to vote would keep them around until the finals. We all know their revenge against the mutant hillbillies will be the most satisfying.Wesley Morris can be reached at wmorrisglobe.com. For more on movie go to boston.com/ae/movies/blog. (c) Copyright 2007 Globe Newspaper Company. More Globe Living/Arts stories | Aamp;E section | Latest entertainment news | Globe front page | Boston.com Sign up for Globe Headlines e-mail | Breaking News Alerts Advertisement SEARCH THE ARCHIVES All Globe stories since 2003 are now FREE TodayYesterday Past 30 daysLast 12 months Since 1979 More search options Advertisement Printer friendly E-mail to a friend Movies RSS feed Available RSS feeds Most e-mailed Reprints amp; Licensing Share on Digg Share on Facebook Save this article powered by Del.icio.us feedback form | help | site index | globe archives | rss (c) The New York Times Company",http://www.boston.com/ae/movies/articles/2007/03/24/who_should_live_and_who_should_die_in_the_hills,200,thehillshaveeyes24,thehillshaveeyes2,boston
