review,link,status_code,id,movie_key,critic
"Double Feature Playing with Words and Time  NPR View Navigation NPR NPR NPR Music NPR Books NPR About NPRPodcast Directory Search Toggle search NPR Home News Arts amp; Life Music Topics Programs amp; Podcasts NPR Music Genres New Music Concerts amp; Videos Articles amp; Lists Tiny Desk NPR Books Author Interviews Find Books Reviews About NPR Overview Connect Support Press Careers Podcast Directory Categories Shop Back News U.S. World Politics Business Technology Science Health Race amp; Culture Education Arts amp; Life Books Movies Pop Culture Food Art amp; Design Performing Arts Photography Music First Listen Songs We Love Music Articles Tiny Desk Videos More Our Blogs Corrections All About NPR Back News amp; Conversations Morning Edition All Things Considered Fresh Air Here amp; Now Code Switch The Diane Rehm Show Embedded Latino USA NPR Politics Podcast On Point Weekend Edition Saturday Weekend Edition Sunday Youth Radio Storytelling amp; Humor Ask Me Another The Best Of Car Talk Bullseye Hidden Brain How To Do Everything Invisibilia Only A Game Planet Money Pop Culture Happy Hour StoryCorps TED Radio Hour Wait Wait...Dont Tell Me Music First Listen All Songs Considered Songs We Love Tiny Desk Alt.Latino From The Top Jazz Night In America Metropolis Microphone Check Mountain Stage Piano Jazz The Thistle amp; Shamrock World Cafe More All Programs Podcast Directory NPR Podcasts Back Rock Pop Jazz Classical Hip-Hop Ramp;B/Soul Folk Latin World Electronic/Dance Back First Listen Songs We Love All Songs Considered Reviews Music Videos Back Tiny Desk Live Concerts Field Recordings Studio Sessions Music Documentaries Music Videos Festival Recordings Back Articles Interviews Quizzes Music Lists Best Music of the Year Back Art amp; Design Arts amp; Entertainment Biography amp; Memoir Business amp; Economy Childrens Books Comedy Comics amp; Graphic Novels Digital Culture Faith amp; Spirituality Food amp; Wine History amp; Society Historical Fiction Horror amp; Supernatural Literary Fiction Mystery amp; Thrillers Parenting amp; Families Poetry Politics amp; Public Affairs Romance Science Fiction amp; Fantasy Science amp; Health Sports Travel Young Adult Nonfiction Fiction Back Book Reviews This Weeks Must Read My Guilty Pleasure Three Books... PG-13 Risky Reads You Must Read This Summer Books Best Books of the Year Back Overview Overview and History Mission and Vision Stations and Public Media NPR Finances People Ethics Awards Back Visit NPR NPR Presents Studio 1 Events Generation Listen Book a Speaker Request Permissions Ways to Listen NPR Extra Blog Email Newsletters Shop NPR Get Help Contact Us Back Support Public Radio Corporate Sponsorship Volunteer Back Releases and Statements Photos and Logos Fact Sheet (PDF) Media Relations Contacts Back Careers at NPR Search Jobs Culture Applying Interns Fellows Digital Back Arts Business Comedy Education Games amp; Hobbies Government amp; Organizations Health Kids amp; Family Music News amp; Politics Religion amp; Spirituality Science amp; Medicine Society amp; Culture Sports amp; Recreation Technology TV amp; Film Double Feature Playing with Words and Time Listen Toggle more options Download Embed Embed Transcript Double Feature Playing with Words and Time Movies Double Feature Playing with Words and Time Double Feature Playing with Words and Time Listen Toggle more options Download Embed Embed Transcript Facebook Twitter Google+ Email June 16 2006245 PM ET Heard on All Things Considered Bob Mondello Twitter When Keanu Reeves moves into The Lake House he finds a puzzling letter in the mailbox from a woman claiming to be a previous tenant. So he writes back. But the woman is just as puzzled as he is -- especially by the date on his letter. ""Its 2006. It has been all year. Just ask anybody"" she tells him. Chin-Scratchers Playing with time and words evidently sends hands to the jaw Will Shortz puzzle editor for The New York Times. OMalley Creardon hide caption toggle caption OMalley Creardon A mystical lake house links Sandra Bullock to Keanu Reeves. Warner Bros. hide caption toggle caption Warner Bros. ""2006"" he chokes. See hes living in 2004 and they have -- heaven help us -- a magical mailbox. This being a romance thats both a boon and a problem. Once they stop sparring our two lovebirds cant just get together tomorrow night because ""tomorrow"" for her is two years away for him. But they do have their letters and that mailbox and some pretty convoluted plot twists to keep them company as they bob like corks on a stormy sea of time... or something. The Lake House based on a Korean picture and directed by an Argentinean features supporting players with a variety of intriguing accents and its tempting to say that somethings getting lost in translation except that we are after all in the Twilight Zone here and all those different influences are more interesting than the leads are. Keanu Reeves and Sandra Bullock are attractive enough but theyre almost never on screen together so theres not much of a chance to see any chemistry between them. Still the plot if you dont question it too closely does sort of parse even when it doesnt make sense. So if youre willing to indulge a sappiness factor thats off-the-charts and you dont mind movies that just sort of tread water The Lake House may be your kind of time-waster. Personally I prefer playing with words and who better to do that with than a guy whose name is Shortz with a ""z."" Will Shortz who is NPRs puzzle guy on Weekend Edition Sunday and who has a day-job as crossword puzzle editor at The New York Times is our guide in Wordplay to a pastime that occupies some 50 million Americans every week including some reasonably famous folks -- from former presidents to Comedy Central newscasters. Filmmaker Patrick Creadon spends the first half of Wordplay not just with celebrity puzzleholics but also with the puzzleheads who ""construct"" puzzles... even while driving down the highway. In the films second half the focus shifts to the Annual Crossword Puzzle Tournament in Stamford Conn. where computer graphics snappy editing and the decidedly odd personalities on display lend considerable tension. Admittedly the geek factor in Wordplay is every bit as high as the sap factor is in The Lake House. But if the choice is between a redesign of time or pitting nerds against words Id say make time for the nerds. Shortz on NPR Sunday Puzzle Page July 3 2016 Related NPR Stories College Student Wins Crossword Puzzle Championship March 14 2005 Jill Sobule Singer Actress Crossword Addict Jan. 9 2005 Web Resources Wordplay Site with Puzzles The Lake House Site Facebook Twitter Google+ Email More Stories From NPR Movie Interviews Kristen Bell On Bad Moms It Was The Funniest Script I Had Ever Read Race Easy Writer Walter Mosleys Passion For Bringing Black LA Stories To Life Pop Culture Pop Culture Happy Hour Stranger Things And Onscreen Weddings Movie Reviews In Tallulah An Aimless Young Woman Stumbles Across A Purpose Kidnapping More Stories Comments You must be signed in to leave a comment. Sign In / Register Please keep your community civil. All comments must follow the NPR.org Community rules and Terms of Use. NPR reserves the right to use the comments we receive in whole or in part and to use the commenters name and location in any medium. See also the Terms of Use Privacy Policy and Community FAQ. Please enable JavaScript to view the <a href=""http//disqus.com/?ref_noscript"">comments powered by Disqus.</a> NPR thanks our sponsorsBecome an NPR sponsor News U.S. World Politics Business Technology Science Health Race amp; Culture Education Arts amp; Life Books Movies Pop Culture Food Art amp; Design Performing Arts Photography Music First Listen Songs We Love Music Articles Tiny Desk Videos Programs About NPR Overview NPR Finances People at NPR Support NPR Visit NPR Press Room NPR Extra Blog Careers at NPR Corrections NPR Ombudsman Permissions Help Contact Terms of Use Privacy Sponsorship Choices Text-Only",http://www.npr.org/templates/story/story.php?storyId=5491359,200,thelakehouse0,thelakehouse,npr
"The Disrespected Arts Journalist Blues | | Observer Politics| Arts amp; Entertainment| Style amp; Design| Business amp; Technology| Search for Submit Observer Culture Politics National New York International Editorials Arts amp; Entertainment Art Movies Music Performing Arts TV Style amp; Design Fashion Food amp; Drink Health amp; Wellness Home Design Real Estate Travel Business amp; Technology Deals Innovators Internet Culture Media Startups About Advertise Subscribe Careers Masthead Contact Privacy Terms Follow Us Sign Up for Newsletters Observer Music The Disrespected Arts Journalist Blues By Justin Joffe  07/29/16 324pm Patron saint of schlubby music journalists Lester Bangs. More often than not the music thats sent to me is difficult to write about. Describing music is never easy which is why most journalistic shorthand to describe an artist or sound resorts to cheap genre descriptor pastiches and made-up meaningless new codifications. Once in a while those labels catch on but more often than not those descriptors are but the rare moment where that journalist can flex their creativity to take a chance describing something fresh and new allowing us some insight into what informs the associations that they make. All of which is to say sounds are hard to put into words. But it helps when theres a good story there doesnt it? More often that not the music thats sent to me is difficult to write about because theres just no story there. And sometimes the music is good like really good which makes me feel as if the act of refusing to write about it does a disservice to the readers who trust my judgement. But heres the thing--very few people in journalism give arts journalists a fair shake and even fewer show love for music journalists. I have to at least entertain the idea that people who dont take music journalists seriously are responding to stories that get published for the wrong reasons--either the journalist just really likes the band and their enthusiasm gets the pitch approved despite the fact that they dont have much to say beyond ""its good"" and ""you should listen to it"" or the story has been thrust upon them by the publication for some other reason (either the editor loves it the artist or their crew have some sort of relationship with the publication or theyre just super-fucking popular.) Sounds are hard to put into words. But it helps when theres a good story there doesnt it? A faculty member at my alma mater CUNYs Graduate School of Journalism confirmed my suspicion that admissions was reluctant to accept prospective students who showed an interest in focusing on the Arts amp; Culture concentration over other beats--Health amp; Science Business International and Urban reporting. They just see too many arts journalists floundering after school he said and the commonly held belief by other faculty members was that in a field where finding work is already difficult arts journalists have an even harder time because the jobs just arent there. Whats more the powers that be often feel that the majority of young journalists attracted to arts reporting never evolve into anything more than armchair critics fans with half-baked opinions who favor feelings over facts. Our fearless Observer editor in chief Ken Kurson said something similar to me on my first day in his office. As much as he loved music journalism Ken felt that the majority of journalists who focused on music were just failed musicians themselves less concerned with producing good writing and reporting and instead ultimately looking for a spot on the tour bus. He didnt know at the time that Im a classically trained violinist whos been playing since I was four or that I have several solo records under my belt (Google at your own peril). Nor did I know at the time that he once played bass in the revered Chicago jangle-pop band Green. Either way I suddenly had something to prove and was up for it. My plan with writing if I ever had one was to unpack the ""why"" that informed the work of every artist I wrote about and looking for a raison detre quickly narrowed the pool of who had a good story I could tell. It was really still just a matter of those eternal news values--proximity timeliness prominence impact conflict and nostalgia. A shitty band is pushed upon me as either pure nostalgia or timeliness--theyre either ""progenitors of the new trance-metal"" or they ""long for the days when the sounds of disco..."" The other values are often pushed on me by a publicist. Theres conflict in a record that almost didnt happen after the singers crippling addiction to all-you-can-eat buffets; theres impact in dogmatically-worshiped statistics of chart performance or Soundcloud plays; and theres prominence ascribed to the band that once played Shia Labeoufs Bar Mitzvah or Sofia Vergaras Quinceanera too. But youve got to not only check off several of those news values to have a story--youve got to understand how they inform that artists life to tell their story. In arts journalism with its private parties and branded-content ""exclusive"" premieres maybe that yearning to say something larger gets diluted by the enticing visceral realities of the entertainment industry. Maybe too many publicists focus on writing the story or at least the storys nut graph containing the thesis ahead of time for most arts journalists to just lap up. To that end any stigma that arts features are less serious and more ephemeral than ""hard news"" falls on the shoulders of the editors and their writers who take press releases as scripture and conduct the extent of their reporting as only an amplification of a perspective that has already been shaped and subsequently fed to them. Your disco grind-metal band just released an album of Maroon 5 covers on MiniDisc? Please go on... Thats really a shame because the whole cosmic haw-haw of it all is that the arts for all the seeming short-lived ephemera of listening to a catchy song or watching an entertaining film are eternal. At its most haughty the act of creating something is a grasp at immortality the forging of a work that should last long after the creator is worm food. Hard neighborhood news meanwhile is service journalism--absolutely necessary information timely local and inherently valuable. You want to know when a man is stabbed in your neighborhood or when your favorite gelato chain is coming to your borough. But for all the hallowed seriousness of a local papers breaking-news desk the often palpable shade that reporters on the grind throw at arts journalists is straight-up unfair. Once the mime who kept exposing himself to old ladies on the B52 bus in Brooklyn has been apprehended the story is over. Meanwhile theres a whole world of people creating making shit with their hands and crafting their own legacy for no other reward than maybe a small taste of immortality. Perhaps one day the systematically disrespected and undervalued arts journalist will fade into myth. But its going to come from realizing that in the same way we marginalize our citys creative class by outsourcing creative works and art to freelancers and hired guns we treat our arts journalists with a similar arms-length disdain. Thats a shame because a good song or a good picture is far from ephemera. Like hard news arts journalism tells the story of our shared now. But unlike hard news the creative work that lasts also tells our story to the future. Comment Filed under album review art criticism Arts Journalism CUNY Graduate School of Journalism Ephemera Green Hard News Ken Kurson music critic music criticism music journalism music writing mythology Shia LaBeouf Sofia Vergara Stigma Writing Trending Now Bill Maher Im With Her or Im With Stupid Politics The (Real) Its Always Sunny In Philadelphia Origin Story Culture Marina Abramovic I Had Three Abortions Because Children Hold Female Artists Back Culture Breaking Miamis Wynwood Arts District Is a Hotbed for Zika Politics Observer About Advertise Careers Contact Privacy Terms Powered by WordPress.com VIP",http://www.observer.com/node/39095,200,thelakehouse1,thelakehouse,observer
Movie | stltoday.com Sign Up Log In Dashboard Logout My Account Dashboard Profile Saved items Logout Subscriber services Contact us E-edition Contests Apps Newsletters Obits News Education Election 2016 Databases Columnists Illinois Law and order Metro Nation Obits Political Fix St. Charles Weather Opinion Letters to the editor Columnists Business Top Workplaces Press releases Columnists Sports Cardinals Blues Mizzou Olympics SLU NFL Golf Forums Columnists Chats High schools Schedules Schools Sports Stats Go Entertainment Books Calendar Comics amp; games Dining Music Movies Television Theater amp; arts Columnists Lifestyles Advice Automotive Fashion Food and cooking Health Home and Garden Parenting Religion Travel Columnists Feast Magazine St. Louis Best Bridal Ladue News Multimedia Photos Videos Chats Forums Buy/sell Classifieds Real estate Business Directory Print Ads Newspaper ads Page reprints Autos Jobs Homes Archives Toggle navigation Menu Search Search Log In Using Your Account Log In Dont have an account? Sign Up Today My Account Dashboard Profile Saved items Logout 84deg Saint Louis MO (63101) Today Sunshine and clouds mixed. High 86F. Winds WNW at 5 to 10 mph.. Tonight Partly cloudy skies. Low 69F. Winds NNE at 5 to 10 mph. Updated July 30 2016  1153 am Full Forecast News Sports Business Go Life Buy/Sell Sorry the page youre looking for cannot be found. 404 The page may have moved you may have mistyped the address or followed a bad link. Visit our homepage or search for whatever you were looking for... Feast Magazine Ladue News St. Louis Best Bridal STL High School Sports Products and features Apps Archives Calendar Chats Comics amp; games Contests E-edition Forums Newsletters Our events Press releases Tools and services Advertise with us Autos Classifieds Contact us Homes Jobs Newspapers in Education Page reprints Post-Dispatch store Site help Subscriber services (c) Copyright 2016 STLtoday.com 900 N. Tucker Blvd. St. Louis MO | Terms of Use | Privacy Policy Powered by BLOX Content Management System from TownNews.com.,http://www.stltoday.com/stltoday/entertainment/reviews.nsf/movie/story/8D1E1121F36D463D8625718E006C86D5?OpenDocument,404,thelakehouse2,thelakehouse,stltoday
The Lake House (2006) directed by Alejandro Agresti | Film review Go to the content Go to the footer Time Out London London Popular cities London New York Paris Chicago Los Angeles Browse all cities Time Out London Close London Change city London Popular cities London New York Paris Chicago Los Angeles Browse all cities Tickets Offers Things to Do Restaurants Bars amp; Pubs Film Theatre Art Music Attractions Blog Theatre Tickets Shopping Offer of the Day Time Out Card Time Out Escapes Time Out Live Hotels Nightlife Music festivals Events amp; Festivals Kids Museums Clubs Comedy Food amp; Drink Classical Music amp; Opera Dance LGBT City Guide Area Guides Property Competitions Dating Close My Time Out Things I love My lists My Profile My Account Sign out Sign in Create account Sign in With your social account Or with your email Email Password Remember me Forgotten your password? Sign in You can create a Time Out account in two ways... With a few clicks using your favourite social network Or by entering your details below Email First Name Last Name Create password Repeat new password I accept Time Outs terms of use including opt-in to newsletters. Create account Welcome  You have successfully connected your account to Time Out. You may sign in with this account in future. Please confirm your account details Email First Name Last Name I accept Time Outs terms of use including opt-in to newsletters. Sign up My Account Sign in or Create account Search Tickets Offers Things to Do Restaurants Bars amp; Pubs Film Theatre Art Music Attractions Blog Theatre Tickets Shopping Offer of the Day Time Out Card Time Out Escapes Time Out Live Hotels Nightlife Music festivals Events amp; Festivals Kids Museums Clubs Comedy Food amp; Drink Classical Music amp; Opera Dance LGBT City Guide Area Guides Property Competitions Dating More Search The Lake House Film  Drama Add review 0 Love It Save it 0 Add review 0 Love It Save it Time Out says Details Users say Time Out says Much like 2002s Frequency this remake of the South Korean drama The Sea (2000) uses communication through time as a device to both unite and divide its protagonists. But rather than father and son these time-travellers are potential lovers. Doctor Sarah (Sandra Bullock) starts using the letterbox of her old Lake House to correspond with the new occupant architect Alex (Keanu Reeves). But Alex insists that its 2004 not 2006 and soon an initially sceptical Sarah must accept the fact that they are two years apart in time. Striking up a friendship the penpals become closer and Alex faces the tricky prospect of romancing a woman who is two years into his future (planting trees outside her apartment and writing graffiti on a wall are just two of his little tricks).Like the apparitions in Ghost and Just Like Heaven the time difference provides an entertaining and suspenseful obstacle to romance. Fans of the Back to the Future series may also enjoy the encounters the pair have in Sarahs past and Alexs present in which Alex attempts to alter the future while Sarah has no idea who he is. But the central concept is also this films greatest weakness. Plot holes abound how can a successful architect be so hard to find in the internet age? Why can Sarah attach a book to one of her letters but Alex not? And so on. The Lake House demands a serious suspension of disbelief but if you accept it as a romantic bit of nonsense it has its pleasures. By Anna Smith Posted Tuesday June 20 2006 Details Release details Rated PG Release date Friday June 23 2006 Duration 105 mins Cast and crew Director Alejandro Agresti Screenwriter David Auburn Cast Keanu ReevesSandra BullockChristopher PlummerDylan WalshShohreh Aghdashloo Users say LiveReviews|02 people listeningSign inWrite reviewMost helpfulMost helpfulHighest ratingLowest ratingNewestOldestLoadingundefinedNew CommentsRefreshShow More Share Tweet 0 Shares Top About us Work for Time Out Privacy policy Cookie Policy Website terms of use Contact us Time Out for business Get listed Claim your listing Premium Profiles Advertising Time Out products Time Out Card Mobile apps Time Out Shop Time Out Guides Time Out Travel Time Out Offers Time Out Worldwide Time Out magazine Where to get Time Out magazine Subscribe to Time Out magazine Manage my subscription Follow us Facebook Twitter Youtube Instagram Pinterest Spotify Time Out London Site map },http://www.timeout.com/film/83473.html,200,thelakehouse3,thelakehouse,timeout
