review,link,status_code,id,movie_key,critic
"The Lake House - Houston Chronicle SUBSCRIBE As low as 1.00/week Sign In Home Contact Chron About Houston Chronicle Advertise with Us Place a Classified Ad Niche Publication Ads Careers Store Privacy Policy Terms of Use Newsletters Subscribe HC Archives Mormon phrase on condom packs? Theres the rub Places every Texas kid should see before growing up 12 ways Joanna Gaines of HGTVs Fixer Upper is your spirit Things Texans secretly do but would never admit Local Neighborhoods Neighborhoods All Neighborhoods Bay Area Bellaire Cy-Fair Fort Bend Heights Katy Kingwood Memorial Pearland Spring The Woodlands Houston amp; Texas News Houston amp; Texas News Houston Texas Traffic Weather Weather Radar amp; Forecasts Houston Weather Severe Weather News Hurricane Guide Education Education K-12 Zone Blog School Report Card 2014 Politics amp; Policy Politics amp; Policy Texas Politics Chronicle Investigates Obituaries Staff amp; Reader Blogs Classifieds Columnists Opinions amp; Editorials Opinions amp; Editorials Opinion Editorials Letters to the Editor Outlook Nick Anderson Cartoons La Voz (Espanol) Texas Energy Guide Son of former Texas Aamp;M football player faces capital murder Reports Man shoots child then turns gun on himself Report Man charged after road rage video goes viral Mormon phrase on condom packs? Theres the rub US amp; World US News World News Crime The Americas Politics Science amp; Environment Strange amp; Weird News Videos Video captures deputys dramatic rescue of gunshot victim kids Texas Senator Brian Birdwell finally got to meet the man who Study confirms what gun rights advocates have said for a long Warren Sapp bitten by shark during Florida Keys lobster trip Sports Texans Rockets Astros Dynamo High School Colleges UH Rice UT Aamp;M Outdoors More Sports More Sports Golf Buy Tickets Super Bowl LI DeAndre Hopkins doesnt report for training camp over contract 10 questions facing Texans at training camp Revisiting the Astros best and worst deadline deals Texans extend Rick Smiths contract Business Energy (Fuel Fix) Technology Real Estate Money Tips Business Insider Press Releases Small Business Mgmt Chron 100 Top Workplaces Sponsored Content Legal Notices Business Directory US GDP grows a weak 1.2 percent in second quarter Amazons already large distribution empire keeps expanding Ford surprises with lower 2Q profit on trouble in US China Chipotle branching out plans to open burger restaurant Aamp;E Preview Preview Alison Cook Restaurant Reviews Whine amp; Dine Top 100 Restaurants Guides to Houston Restaurants amp; Bars Music Movies Arts amp; Theater Rolling Stone Us Weekly Radar Online Horoscopes Comics amp; Games Events amp; Things To Do NEW Puzzles 20 tearjerker movies Hollywood should leave alone Meghan Trainor rocks girls night out in Woodlands Chip and Joanna Gaines are just the latest celebrities to visit Chef Randy Ruckers Bramble restaurant has closed Life Health Health The Doctors Mens Journal Live Healthy Escapes Escapes Home amp; Design Travel Style Mom Houston Luxe Life Houston Belief Food amp; Cooking Food amp; Cooking Food amp; Cooking Alison Cook Restaurant Reviews Whine amp; Dine Top 100 Restaurants Society Travel Travel Flight Tracker Texas Road Trips Travel Pets Houston Gives Weddings amp; Celebrations Sponsored Content Local backyard design inspirations thatll make you want to DIY The 50 smoothest pick-up lines in movie history 18 foods you should never feed your pet Why is everyone freaking out about this photo of two bikini-clad Jobs Advanced search Browse job categories Salary Wizard Career Rescue Careers in Engineering Salute to Nurses Work amp; Career Advice Post a Job Is that dream opportunity really a nightmare? These 25 hot jobs pay at least 100K Set a career goal for every month of 2016 The highest-paying entry-level jobs Cars Cars amp; Auto News Heidis Cars Blog New Car Search Used Car Search Certified Car Search Houston Auto Dealers The new Lincoln Navigator concept is too legit to quit Hennessey pushes a Camaro to over 200 MPH Riding the 2016 Indian Chieftain BMW turns 100 years old A look back Real Estate New Homes Second Homes Rentals Home Price Survey Mortgages Commercial Real Estate Farms amp; Ranches Senior Living Chron Homes App Private Party Ads Summer Showcase My Perfect Hous(e)ton Suburban homebuilder develops new Greater Heights neighborhood Glamorous Texas ranch with Hollywood history hits market Shipping container complex to be developed in Houston 115 Years Findamp;Save Roost MenuSections http//www.chron.com/entertainment/movies/article/The-Lake-House-1858548.php The Lake House Its heavy on romance and light on the time travel  2starsGo to showtimes AMY BIANCOLLI Copyright 2006 Houston Chronicle Published 530 am Friday June 16 2006 You think Romeo and Juliet have it bad Alex and Kate cant even enjoy a late-night chat at the balcony. Not in iambs anyway. And not at the same time. Their problem is one of temporal misalignment. He exists in 2004 she in 2006. Theyve taken turns residing in the same glass lake house where they hunger for true love and exchange pensive letters in a mailbox of never-explained magical powers. In 2006 she writes him a note pops it in the box flips up the tin red flag. Pfft it instantly arrives in 2004. He flips the flag down reads the note and inserts a reply flag up. Pfft 2006. In this fashion the pen pals fall in love writing of their dreams their parents their scruffy dog (one and the same). Pfft shes homesick for trees at the lake house. Pfft he plants a sapling outside her soon-to-be Chicago apartment which matures two years later (rather quickly) into a shade-giving oasis. With all this pffting around youd think Alex might ask a few shrewd questions about politics or stocks but The Lake House isnt concerned with such things. Its one concern is amour. Clutch breast. Flush pink. Sigh. As a pair Kate and Alex are oh-so everything oh-so lonely oh-so beautiful. Theyre also oh-so separated by the space-time continuum which means Keanu Reeves and Sandra Bullock dont share too many lusty clutches; witness the discreet PG rating a rare thing for a love story in the age of booty calls. Alex does manage to track her down in ""his"" time when shes tied to a dutiful beau (Dylan Walsh) but mostly their liaison relies on split-screen wizardry and fluent editing (by Alejandro Brodersohn and Lynzee Klingman). Based on the Korean film Il Mare and gauzily realized by Argentine director Alejandro Agresti (Valentin) The Lake House is unreconstituted mystical bunkum. As bunkum goes its not all bad but it lacks cohesion -- and it relies too often and too lazily on cliches. There are better entries in the chronicles of thwarted love Somewhere in Time for era-hopping romance 88 Charing Cross Road for remote epistolary yearning. The Lake House twice excerpts the famous ambulatory-kiss scene from Notorious a classic bit of nibbling eroticism that Agresti might have been wise to avoid. Wedging Cary Grant and Ingrid Bergman into the film wasnt exactly fair to its stars. Still it does have a few things going for it. One is Alar Kivilos airy photography which shows a warm regard for Chicagos broad urban musculature. Another is its reflective cud-chewing on love and the conundrum of timing -- whom we can love when we can love them. (Its a riddle tackled by Jane Austens Persuasion much referenced here.) And I suppose its nice after all this time to see Speed co-stars Reeves and Bullock together again though Im not sure why the mysterious mailbox mojo chose to reunite them here. Both do their pining-lover best to act depressed. The film moves toward a spooky coincidence that canny viewers will predict in the first act. I wish I hadnt; it killed all the films suspense and much of its dewy seduction. ""Can this be happening?"" asks Alex in an early correspondence but he got his tenses wrong. It has happened. It will happen. Even without the gift of foresight the future is in plain view. amy.biancollichron.com Todays Deals Onitsuka Tiger Unisex Ultimate 81 Shoes for 28 + free shipping KeySmart 2.0 Compact Key Organizer for 10 + free shipping Tommy Hilfiger via eBay Clearance Sale Extra 50% off + free... Samsung 60"" 1080p LED Smart TV 250 Dell GC for 700 + free... Powered by Contests Enter to win concert tickets airfare and hotel More Entertainment News Rolling Stones Lash Out at Donald Trump (Again) Over Song Use Daveed Diggs Renee Elise Goldsberry to Leave Hamilton Broken Social Scene Working on New Album Steve Young of M/A/R/R/S Pump Up the Volume Fame Dead Calvin Harris Taylor Swift Song Co-Write Questions We Still... Andrew W.K. Celebrates Power of Partying on 50-State... In Police Violence Cases Time Works Against Justice New Marvin Gaye Doc Features Unseen Footage Garth Brooks Previews Unprecedented New Video Series Craig Morgans Son Jerry Greer Dead at 19 in Boating Accident Most Read 1 These are unsettling times that require a steady hand Thats... 2 Teen son accused of killing ex-Aamp;M football star and wife 3 Two coaches suspended after Texas Aamp;Ms chalk talk for women 4 Texas meteorologist removed from staff page after racially... 5 Why is everyone freaking out about this photo of two... 6 Reports Man shoots child then turns gun on himself 7 Thunderstorms high winds likely to batter Houston region 8 Galveston officials Officer says she set out to seduce ex-... 9 Officials believe at least 16 died in Texas balloon crash 10 Ex-Katy High teacher charged with improper relationship with... View Comments (c) 2016 Hearst Communications Inc. Logo Return to Top About Our Company Careers Advertise with Us Ad Choices Terms amp; Conditions Privacy Policy Your California Privacy Rights Contact Customer Service Newsroom Contacts Connect Email Newsletter Facebook Twitter Pinterest Google Instagram Subscribe iPad app HoustonChronicle.com Houston Chronicle Archives eEdition Demo Todays eEdition Hearst Newspapers (c) Copyright Hearst Newspapers LLC",http://www.chron.com/disp/story.mpl/ent/movies/reviews/3918067.html,200,thelakehouse10,thelakehouse,chron
404 - Page Not Found The Globe and Mail Jump to main navigationJump to main content Home News Commentary Business Investing Sports Life Arts Technology Drive Video AdChoices Oops That page isnt here. We couldnt find the page you were looking for one of the following reasons It has moved it never existed or an agreement with an outside provider has expired. Can we help you findwhat youre looking for? Query Want to help? and let us know about the page error. Please include a link to the page that brought you here as well as any other relevant information. Thanks in advance for the heads-up Or try one of these links editorial cartoons celebrity photos popular videos connect with us Products The Globe and Mail Newspaper Newspaper delivered to your doorstep. Suscribe to the newspaper Globe Unlimited Digital all access pass across devices. Suscribe to Globe Unlimited Globe2Go The digital replica of our newspaper. Suscribe to Globe2Go Globe Email Newsletters Get top Globe stories sent to your inbox. Subscribe to email newsletters Globe eBooks A collection of articles by the Globe. View the library Advertise with us GlobeLink.ca Your number one partner for reaching Canadas Influential Achievers. Or go directly to Newspaper Magazine Digital Globe Alliance extend your reach Globe Edge custom content Classifieds The Globe at your Workplace Globe Corporate Sales Globe Unlimited digital edition and Globe2Go e-paper group discounts available. Learn more Corporate financial data and content licensing for your organization. Learn more Or go directly to Report On Business Top 1000 DataStore essential business intelligence Our Company About us Work at The Globe Staff Secure Service Secure Drop Customer Service Contact Us FAQs Customer Care website Digital subscription services Print subscription services Change your delivery address Vacation Stops Globe Recognition Special Globe events and offers for subscribers Mobile Apps News NEWS APP Available for download on the following devices iPhone iPad Android Blackberry Other Sections Appointments Art Store Births amp; Announcements Corrections Classifieds Classroom Edition Deaths Newspaper Ads Real Estate Special Reports Site Map Terms amp; Conditions Privacy Policy Disclaimer Accessibility Policy Community Guidelines Globe sustainability Editorial Code of Conduct Copyright 2016 The Globe and Mail Inc. All Rights Reserved. 444 Front St. W. Toronto ON Canada M5V 2S9 Phillip Crawley Publisher,http://www.theglobeandmail.com/servlet/story/RTGAM.20060616.wxlake16/BNStory/Entertainment/home,404,thelakehouse11,thelakehouse,theglobeandmail
Detroit NewsSUBSCRIBE NOWFOR HOME DELIVERYHomeNewsSportsBusinessAutosLife + HomeEntertainmentOpinionPhoto + VideoMoreHomeNewsSportsBusinessAutosLife + HomeEntertainmentOpinionPhoto + VideoFireflyHi Already a subscriber?Log inSubscribe today for full access on your desktop tablet and mobile device.Subscribe NowAlready a print edition subscriber but dont have a login?Activate your digital access.Manage your account settings.My AccountView the E-NewspaperManage your NewslettersView your Insider deals and moreMember ID CardLog OutFollowSearchGet the newsLog In or Subscribe to skipAlready a subscriber?Log inSubscribe today for full access on your desktop tablet and mobile device.Subscribe NowAlready a subscriber but dont have a login?Activate your digital access.TOP TRENDINGxShareOOPSThis page exists to tell you that this page doesnt exist.RETURN TO HOMENewslettersAlerts amp; RSSContact UsNewsroomSubscribeHelpAppsHomeNewsDetroitWayneOaklandMacombFlint Water CrisisMichiganMore...Nation + WorldElectionsPoliticsSportsLionsTigersRed WingsPistonsBig TenMichiganMore...Michigan StateCollegeHigh SchoolBusinessTechnologyYour MoneyAutosAuto ShowFiat ChryslerFordForeignGeneral MotorsWoodward Dream CruiseLife + HomeHomestyleFood + DrinkHealthTravelAdviceEntertainmentTV + RadioMusicStageDining + BarsArts + FestivalsCelebritiesMore...BooksMoviesOpinionColumnistsBlogsEditorialsPhoto + VideoPhoto Store (c) 2016 The Detroit News a Digital First Media Newspaper. All rights reserved. ServicesAd ChoicesAdvertise With UsAdvertising Terms and ConditionseBookseEditionSign up for Home DeliveryManage AccountMember GuidePlace an Ad in ClassifiedsPlace a Death NoticeReport a Delivery IssuePhotoStorePrivacy Notice/Your California Privacy RightsTerms of ServiceOur PartnersCareerbuilder.comCars.comHomefinder.comFindNSave.comDetroit Newspapers in EducationRenvy.comMichigan.com,http://www.detnews.com/apps/pbcs.dll/article?AID=/20060616/ENT02/606160417/1034,404,thelakehouse12,thelakehouse,detnews
"Time flies but not for ""Lake House"" viewers - The Denver Post News News Latest News Colorado News Nation / World Obituaries Marijuana Education Environment Crime amp; Courts Weather Your Hub Sports Sports Olympics Denver Broncos College Sports Colorado Rockies Preps Colorado Avalanche Outdoors Denver Nuggets Boxing / MMA Colorado Rapids Scores and Standings Sports Columnists Sports on TV/Radio Business Business Aerospace Airlines Economy Energy Real Estate Retail Technology Telecom Tourism Entertainment Entertainment Arcade Games Arts Books Calendar Comics Movies Music Reverb Music Theater Television Television Listings Travel Lifestyle Lifestyle Ask Amy Fashion Food amp; Drink Restaurants amp; Dining Fitness Home amp; Garden Horoscopes Opinion Opinion Editorials Columnists Letters Perspective Cartoons Opinion Polls Politics Politics Election Colorado Legislature Denver Politics Local Politics National Politics Cannabist Classifieds Classifieds Cars Homes Jobs Today Subscribe Newsletter News News Latest News Colorado News Nation / World Obituaries Marijuana Education Environment Crime amp; Courts Weather Your Hub Sports Sports Olympics Denver Broncos College Sports Colorado Rockies Preps Colorado Avalanche Outdoors Denver Nuggets Boxing / MMA Colorado Rapids Scores and Standings Sports Columnists Sports on TV/Radio Business Business Aerospace Airlines Economy Energy Real Estate Retail Technology Telecom Tourism Entertainment Entertainment Arcade Games Arts Books Calendar Comics Movies Music Reverb Music Theater Television Television Listings Travel Lifestyle Lifestyle Ask Amy Fashion Food amp; Drink Restaurants amp; Dining Fitness Home amp; Garden Horoscopes Opinion Opinion Editorials Columnists Letters Perspective Cartoons Opinion Polls Politics Politics Election Colorado Legislature Denver Politics Local Politics National Politics Cannabist Classifieds Classifieds Cars Homes Jobs Time flies but not for ""Lake House"" viewers Share thisClick to share on Facebook (Opens in new window)Click to share on Reddit (Opens in new window)Click to share on Twitter (Opens in new window)Click to print (Opens in new window)Click to email this to a friend (Opens in new window)MoreClick to share on LinkedIn (Opens in new window)Click to share on Pinterest (Opens in new window)Click to share on Tumblr (Opens in new window)Submit to Stumbleupon (Opens in new window) Trending Broncos camp fan guide Texas balloon crash Woody Paige retiring Sports Authority bonuses GABF tickets Mile High Roundup Entertainment Time flies but not for ""Lake House"" viewers Share thisClick to share on Facebook (Opens in new window)Click to share on Reddit (Opens in new window)Click to share on Twitter (Opens in new window)Click to print (Opens in new window)Click to email this to a friend (Opens in new window)MoreClick to share on LinkedIn (Opens in new window)Click to share on Pinterest (Opens in new window)Click to share on Tumblr (Opens in new window)Submit to Stumbleupon (Opens in new window) Keanu Reeves and Sandra Bullock finally meet after being separated by two years and a time-traveling mailbox in The Lake House.Keanu Reeves reads a time-traveling note in The Lake House.Show Caption of Expand By  Lisa Kennedy PUBLISHED June 14 2006 at 333 pm | UPDATED May 8 2016 at 408 am Sign up for newsletters and alerts Submit your news tips or photos Most Popular Donald Trump stumps in Colorado promises ""No more Mr. Nice Guy"" Chris Harris INT injuries and 8 other observations from Day 2 of Broncos training camp Broncos offensive linemen can live with the blame game. Theyre built for it. LoDo shooting leaves one dead another injured Peyton Manning stars in 3 new hilarious DIRECTV ads with Lionel Richie Woody Paige retiring from The Denver Post If ""The Lake House"" was a real property this sign might hang on its fence ""Beware of dogs that star Keanu Reeves and involve space-time physics."" Because chances are the story line will twist in ways that invite disbelief and not of the suspended variety. Puzzling through the ""Matrix"" labyrinths was part of the fun of that franchise. Even then the quandaries became too much for the saga to bear. Directed by Argentine Alejandro Agresti in his first English-language film ""The Lake House"" swamps its heart-aimed ambitions with too many head- scratching moments. Reteaming Reeves and Sandra Bullock for the first time since ""Speed"" the romantic fable begins when two people living exactly two years apart start communicating by letter. (What a leap year would do to this scenario we dont know.) Over time - but separated by it - they fall for each other. Its a premise you either go with or dont. The rub is even when you do midway through youll begin to notice it isnt quite working. Its 2006 at least in Dr. Kate Foresters world. Shes headed to a job in Chicago and closing her pristine glass-and-steel house perched on a quiet lake outside the city. Before driving away in her vintage Mustang she leaves a note for the next tenant. Please forward my mail. And forgive the paw prints on the walkway. When Alex Wyler (Reeves) arrives in an equally vintage Chevy pickup the place is in sorry shape. An architect by calling and a subdivision developer out of filial rebellion he sets to restoring it. His father played with a gruff chill by Christopher Plummer designed and built the place when Alex was a boy. Alex reads Kates note. What paw prints? he wonders and writes back. He dates the letter 2004. It doesnt take long for Kate and Alex to accept that by writing each other they are rewriting the laws of physics. ""I think we have the same dog"" he observes at one point. Jack a sprite of a terrier mix is a bolt of light for each. What director Agresti doesnt help his personable leads do is achieve much chemistry. And its not because for much of the film theyre kept apart. Youre never quite sure which Keanu Reeves youll get in a movie. This version is flat yet strains. Bullock brings some of the new assurance she continues to hone doing indie films like ""Crash"" and Kevin Bacons ""Loverboy"" in limited release this summer. Kate and Alex have mail. So much in fact that at some point we wonder how many miles the good doctor drives to drop her missives in the mailbox by the rural house. No stranger to dramatizing complicated material Tony winner David Auburn (""Proof"") furnishes this tale based on a 2000 South Korean flick with notions about home control connection and yes timing. Once confided in neither Kates mother nor Alexs younger brother Henry treat the nearly beloveds like lunatics. That might have nudged the movie toward comedy. ""The Lake House"" could use some levity. Thank goodness for Shohreh Aghdashloo who plays the attending doctor at Kates hospital. Kate and Annas scene at a bar floats on Aghdashloos husky laugh and wry wisdom. At a preview screening filmgoers chuckled as the dog watches the mailbox arm rise and fall seemingly of its own accord. Then they hunkered down in their seats with the realization this was going to be a somber affair. The closer Kate and Alex come to meeting in the same time zone the more convoluted the movie becomes. One things for sure Kates provisional boyfriend Morgan (Dylan Walsh) gets it coming and going. Film critic Lisa Kennedy can be reached at 303-820-1567 or lkennedydenverpost.com. ""The Lake House"" PG for some language and a disturbing image|1 hour 33 minutes| ROMANCE|Directed by Alejandro Agresti written by David Auburn; photography by Alar Kivilo; starring Keanu Reeves Sandra Bullock Dylan Walsh Shohreh Aghdashloo Christopher Plummer|Opens today at area theaters Lisa Kennedy Digital amp; Driveway Delivery - 50% Off More in Movies Movie review ""Phantom Boy"" a timely crime with an old-school feel July 29 2016 Aficionados of the lovely old-school style of animation on display in the Academy Award-nominated 2010 feature ""A Cat in Paris"" will be pleased to discover a new hand-drawn tale of adventure from the French filmmakers Jean-Loup Felicioli and Alain Gagnol. Movie review Augmented-reality app at the center of the teen thriller ""Nerve"" July 29 2016 If you think Pokemon Go fanatics are dangerous with their inclination to wander into traffic wait till you get a load of the fictional augmented-reality app at the center of the teen thriller ""Nerve."" Players of the titular game win cash by accepting increasingly reckless dares delivered via smartphone in front of a digital audience. Movie review In ""Bad Moms"" fast food booze spike the stress of motherhood July 29 2016 ""Bad Moms"" doesnt kick into gear until three mothers fed up with the stress of helicopter parenting and the unrealistic expectations of a draconian PTA president walk into a bar. One shot leads to another and pretty soon theyre discussing their most seductive fantasies. Movie review Silly gives way to outlandish in ""Hunt for the Wilderpeople"" July 29 2016 Ricky Baker is an orphaned juvenile delinquent a ""real bad egg"" as an onscreen title announces in ""Hunt for the Wilderpeople"" Taika Waititis endearingly playful adventure tale set in the New Zealand bush. Member Services News Alerts Facebook Twitter Instagram RSS Subscribe Become a Member / Subscribe Place a Hold Denver Post Store Digital Replica Edition Classifieds Autos Real Estate Jobs Todays Ads Weekly Ads Daily Ads Special Sections Contact Us Submit a News Tip Member Services Advertise With Us Careers Place an Obituary Todays Front Page Back Issues Archives Mobile Apps Copyright (c) 2016 Digital First Media Privacy Policy Site Map Ethics Policy Powered by WordPress VIP Arbitration Send to Email Address Your Name Your Email Address Cancel Post was not sent - check your email addresses Email check failed please try again Sorry your blog cannot share posts by email.",http://www.denverpost.com/movies/ci_3937813,200,thelakehouse13,thelakehouse,denverpost
The Lake House Movie Review amp; Film Summary (2006) | Roger Ebert,http://www.rogerebert.com/reviews/the-lake-house-2006,200,thelakehouse14,thelakehouse,rogerebert
