review,link,status_code,id,movie_key,critic
The Last Exorcism Part II (2013) directed by Ed Gass-Donnelly | Film review Go to the content Go to the footer Time Out London London Popular cities London New York Paris Chicago Los Angeles Browse all cities Time Out London Close London Change city London Popular cities London New York Paris Chicago Los Angeles Browse all cities Tickets Offers Things to Do Restaurants Bars amp; Pubs Film Theatre Art Music Attractions Blog Theatre Tickets Shopping Offer of the Day Time Out Card Time Out Escapes Time Out Live Hotels Nightlife Music festivals Events amp; Festivals Kids Museums Clubs Comedy Food amp; Drink Classical Music amp; Opera Dance LGBT City Guide Area Guides Property Competitions Dating Close My Time Out Things I love My lists My Profile My Account Sign out Sign in Create account Sign in With your social account Or with your email Email Password Remember me Forgotten your password? Sign in You can create a Time Out account in two ways... With a few clicks using your favourite social network Or by entering your details below Email First Name Last Name Create password Repeat new password I accept Time Outs terms of use including opt-in to newsletters. Create account Welcome  You have successfully connected your account to Time Out. You may sign in with this account in future. Please confirm your account details Email First Name Last Name I accept Time Outs terms of use including opt-in to newsletters. Sign up My Account Sign in or Create account Search Tickets Offers Things to Do Restaurants Bars amp; Pubs Film Theatre Art Music Attractions Blog Theatre Tickets Shopping Offer of the Day Time Out Card Time Out Escapes Time Out Live Hotels Nightlife Music festivals Events amp; Festivals Kids Museums Clubs Comedy Food amp; Drink Classical Music amp; Opera Dance LGBT City Guide Area Guides Property Competitions Dating More Search The Last Exorcism Part II Film  Horror 2 out of 5 stars Add review 0 Love It Save it 0 Add review 0 Love It Save it Time Out says 2 out of 5 stars Details Users say Time Out says 2 out of 5 stars Abandoning the faux-documentary style of the frightening but frustrating original Ed Gass-Donnellys low-key sequel picks up the supernatural story where it left off. His naturalistic approach showing everything from the psychically distorted point of view of Nell (Ashley Bell) somehow sucks the life out of the still promising material. Pallid Bell exudes fragility and vulnerability as Nell who is the sole survivor of the first film. She now lives in a New Orleans halfway house for troubled teenage girls blissfully unaware that the video recording of her earlier ordeal has gone viral on YouTube. Yet even as innocent Nell edges towards sanity - kissing a boy listening to the Devils music and wearing lipstick for the first time - she is still assailed by nightmares hallucinations and demonic voices. The Southern Gothic atmosphere of backwoods Louisiana has been replaced by lazy tourist shots of New Orleans while the disturbing hints of rural incest have given way to a drippy teen romance and ghostly appearances by Nells dead father - warning that all will be lost if the demon Abalam succeeds in seducing her. Apart from some glancing hints of the symbiotic relationship between the smitten demon and the not-so-naive Nell Part II wholly lacks the originals provocative sexual and religious ambiguities. By the time the kamikaze crows start dive-bombing the church windows and the shape-shifting demon appears in a hoody and a Venetian carnival mask the whole thing has degenerated into a mumbo jumbo gumbo. By Nigel Floyd Posted Thursday June 6 2013 Details Release details Rated 15 Release date Friday June 7 2013 Duration 89 mins Cast and crew Director Ed Gass-Donnelly Cast Ashley BellSpencer Treat ClarkAndrew Sensenig Users say LiveReviews|02 people listeningSign inWrite reviewMost helpfulMost helpfulHighest ratingLowest ratingNewestOldestLoadingundefinedNew CommentsRefreshShow More Share Tweet 0 Shares Top About us Work for Time Out Privacy policy Cookie Policy Website terms of use Contact us Time Out for business Get listed Claim your listing Premium Profiles Advertising Time Out products Time Out Card Mobile apps Time Out Shop Time Out Guides Time Out Travel Time Out Offers Time Out Worldwide Time Out magazine Where to get Time Out magazine Subscribe to Time Out magazine Manage my subscription Follow us Facebook Twitter Youtube Instagram Pinterest Spotify Time Out London Site map },http://www.timeout.com/london/film/the-last-exorcism-part-ii,200,thelastexorcismpartii0,thelastexorcismpartii,timeout
"The Last Exorcism Part II Starring Ashley Bell - The New York Times NYTimes.com no longer supports Internet Explorer 9 or earlier. Please upgrade your browser. LEARN MORE >> Sections Home Search Skip to content Skip to navigation View mobile version The New York Times Movies|The Devil Wants a Sequel Advertisement Search Subscribe Now Log In 0 Settings Close search search sponsored by Site Search Navigation Search NYTimes.com Clear this text input Go http//nyti.ms/14aPUeO Loading... See next articles See previous articles Site Navigation Site Mobile Navigation Advertisement Supported by Movies | Movie Review The Devil Wants a Sequel The Last Exorcism Part II Starring Ashley Bell The Last Exorcism Part II Directed by Ed Gass-Donnelly Drama Horror Thriller PG-13 1h 28m By ANDY WEBSTERMARCH 1 2013 Continue reading the main story Share This Page Continue reading the main story Poor Nell cant catch a break. In ""The Last Exorcism"" (2010) this Louisiana teenager was possessed by the demon Abalam and ultimately bore his progeny only to have their unholy offspring disposed of by solemn hooded attendants. In ""The Last Exorcism Part II"" she has survived that ordeal unlike her father (or so it appears) the documentary crew filming her and the minister of lapsed faith who attempted to coax out her tormentor.Now shes in a house for recovering trauma patients in New Orleans and Abalam has again come a-courting. But only indirectly making overtures through greasepainted human statues (the kind in Times Square) birds hitting windows voices hidden in radio static and the ubiquitous presence of insects. (Clearly ""The Last Exorcism"" was a misnomer.)Nells roommate Gwen (the very interesting though very underused Julia Garner star of the coming ""Electrick Children"" a hit at South by Southwest) isnt much help with Nells suitor. But a hardy group of demon-relocation specialists (including E. Roger Mitchell) gives it a shot.""The Last Exorcism Part II"" belongs to a flourishing genre you could call terror tease. Devoid of nudity gore and obscene dialogue PG-13 films like the ""Paranormal Activity"" series and the first ""Last Exorcism"" eschew graphic violence for mood and minor scares -- perfect for Friday-night mall outings without Mom and Dad. If only they gave you more to think about.At least this movie like its predecessor has Ashley Bell as Nell. An actress who suggests religious piety carnal fire and satanic aggression with equal dexterity Ms. Bell provides a pulse an audience can connect with amid the standard-issue atmospheric accouterments.""The Last Exorcism Part II"" is rated PG-13 (Parents strongly cautioned) for mild violence and brief strong language. The Last Exorcism Part II Director Ed Gass-Donnelly Writers Damien Chazelle Ed Gass-Donnelly Star Ashley Bell Rating PG-13 Running Time 1h 28m Genres Drama Horror Thriller Movie data powered by IMDb.com Last updated Mar 30 2016 Opened on Friday nationwide. Directed by Ed Gass-Donnelly 1 hour 28 minutes A version of this review appears in print on March 2 2013 on page C4 of the New York edition with the headline The Last Exorcism Part II. Order Reprints| Todays Paper|Subscribe Continue reading the main story Were interested in your feedback on this page. Tell us what you think. Whats Next Loading... Go to Home Page >> Site Index The New York Times Site Index Navigation News World U.S. Politics N.Y. Business Tech Science Health Sports Education Obituaries Todays Paper Corrections Opinion Todays Opinion Op-Ed Columnists Editorials Contributing Writers Op-Ed Contributors Opinionator Letters Sunday Review Taking Note Room for Debate Public Editor Video Opinion Arts Todays Arts Art amp; Design Books Dance Movies Music N.Y.C. Events Guide Television Theater Video Arts Living Automobiles Crossword Food Education Fashion amp; Style Health Jobs Magazine N.Y.C. Events Guide Real Estate T Magazine Travel Weddings amp; Celebrations Listings amp; More Classifieds Tools amp; Services Times Topics Public Editor N.Y.C. Events Guide Blogs Multimedia Photography Video NYT Store Times Journeys Subscribe Manage My Account Subscribe Subscribe Times Insider Home Delivery Digital Subscriptions Crossword Email Newsletters Alerts Gift Subscriptions Corporate Subscriptions Education Rate Mobile Applications Replica Edition International New York Times Site Information Navigation (c) 2016 The New York Times Company Home Search Accessibility concerns? Email us at accessibilitynytimes.com. We would love to hear from you. Contact Us Work With Us Advertise Your Ad Choices Privacy Terms of Service Terms of Sale Site Information Navigation Site Map Help Site Feedback Subscriptions",http://movies.nytimes.com/2013/03/02/movies/the-last-exorcism-part-ii-starring-ashley-bell.html,200,thelastexorcismpartii1,thelastexorcismpartii,nytimes
"Film Review The Last Exorcism Part II | Variety Variety Editions U.S Latino Global Asia Subscribe Today Navigation Menu Film TV Digital Contenders Video Dirt Jobs More Biz Music Legit Scene Conferences Insight Archives Directory Choose Edition U.S Latino Global Asia Russia | My Account Sign In Subscribe HomeFilmReviews Film Review The Last Exorcism Part II Dennis Harvey Film Critic 0 Share This Article Email LinkedIn Pin It Tumblr March 2 2013 | 1231AM PT A generally effective sequel that should easily scare up the numbers to justify a third installment. Never mind the inherent titular redundancy ""The Last Exorcism Part II"" is a generally effective sequel to the 2010 sleeper that injected at least a little new life into the heavily taxed found-footage-horror subgenre. That film found a preacher trying to disprove the reality of exorcisms by filming a fake one only to be fatally caught up in an actual demonic visitation; this follow-up from a largely new creative team finds the originals central victim pursued to New Orleans by the same malevolent spirit. Despite considerable competition this weekend the pic should easily scare up the numbers to justify a third installment. After a brief recap of prior events -- all caught on video by the doomed camera crew now dead along with the protags family -- the pic drops the found-footage pretense for a more conventional omnipotent p.o.v. and production polish. The promisingly scary first scene has a couple (Boyana Balta Judd Lormand) unpleasantly roused at home in the wee hours by an intruder who turns out to be none other than failed exorcism and coven-ritual subject Nell (Ashley Bell). Turned over to the authorities near-catatonic with trauma shes hospitalized and for lack of any surviving relatives placed in Devereaux House a ""transitional home for girls looking for a fresh start."" Kindly manager Frank (Muse Watson) advises her to accept that whatever happened to her was the work of evil humans not devils and that she alone decides her fate from now on. After a couple of months shes doing very well getting along with the other girls notably new best friend Gwen (Julia Garner); working as a hotel housekeeper; anticipating a first-ever boyfriend in co-worker Chris (Spencer Treat Clark); and otherwise enjoying life in the big city after a very sheltered rural upbringing. But ominous visions return including visits by the late dad (Louis Herthum) who warns her the demon ""Abalam"" is still in hot pursuit of her soul and more ""If he can seduce you hell be free."" Eventually she turns for help to members of a ""good"" occult group the Order of the Right Hand Path leading to a new rather more paganistic exorcism climax. This is the most head-on but also perhaps the weakest setpiece here as director/co-writer Ed Gass-Donnelly fares best building dread and atmosphere. The more explicit its terrors the less potent the pic becomes and the finale paints the series into a bit of a corner as it will take considerable ingenuity to keep Nells predicament interesting now that shes undergone a fundamental change. Theres also a certain monotony that creeps in once its clear that virtually every sequence is going to lead up to some scare leaving little room for more than rudimentary plot or character detail. The approach leaves Bell so affecting in the first film (but at 27 now clearly a bit long-in-tooth to play a 17-year-old) stuck playing too many scenes on or over the edge of hysteria. Still she retains an appeal distinct from the standard-issue genre damsel in distress. Also in contrast with the first pic none of the supporting characters develop any complexity here. Nonetheless ""Part II"" is above-average PG-13 horror and coaxes quite a bit of tension out of its waking-nighmare scenario via lensing (Brendan Steacy) and editing (Gass-Donnelly) that constantly suggest something awful is about to materialize or spring from behind a corner. Locations and production design are handsome (though thats one awfully posh halfway house for girls) with one nice segment making aptly spooky use of Mardi Gras-type street festivities. The Last Exorcism Part II Reviewed at AMC Van Ness 14 San Francisco March 1 2013. MPAA Rating PG-13. Running time 88 MIN. A CBS Films release of a CBS Films Strike Entertainment and Studiocanal presentation in association with Anton Capital Entertainment of an Arcade Pictures production. Produced by Eric Newman Eli Roth Marc Abraham Thomas Buss. Executive producers Gabrielle Neimand Patty Long Olivier Courson Ron Halpern. Directed edited by Ed Gass-Donnelly. Screenplay Damien Chazelle Gass-Donnelly based on characters created by Huck Botko Andrew Gurland. Camera (color HD) Brendan Steacy; music Michael Wandmacher; music supervisor Dondi Bastone; production designer Meredith Boswell; set decorator Alice Baker; costume designer Abby OSullivan; sound (Dolby Digital) B.J. Lehn; re-recording mixers Keith Elliott Colin McLellan; sound designer Nathan Robitaille; assistant director Joel Nishimine; casting Ellen Parks. With Ashley Bell Julia Garner Spencer Treat Clark David Jensen Tarra Riggs Louis Herthum Muse Watson Erica Michelle Sharice A. Williams Boyana Balta Joe Chrest Raden Greer Judd Lormand E. Roger Mitchell. Filed Under Andrew GurlandAshley BellClark BakerDamien ChazelleDamsels In DistressEric NewmanFilm Law 2Jane CampionJane Got a GunJulia GarnerLast ExorcismMarc AbrahamOlivier CoursonPart 2Porgy And BessRon HalpernStrike EntertainmentSuperboyThe ExorcistThe Last ExorcismThe Last Exorcism Part IITyler Perrys TemptationWeekend Actuals Want to read more articles like this one? SUBSCRIBE TO VARIETY TODAY. Post A Comment 0 Variety Jobs Creative Development Coordinator Triptyk Studios New York New York Account/Project Coordinator (Ad Agency) Petrol Advertising Burbank California Media Specialist Bridgewater Associates Westport Connecticut Executive Director Aspen Film Company Confidential Aspen Colorado Associate Director YouTuber amp; Gamer Partnerships Save the Children Fairfield Connecticut See More Jobs Marketplace Leave a Reply No Comments Cancel reply Comments are moderated. They may be edited for clarity and reprinting in whole or in part in Variety publications. Enter your comment here... Fill in your details below or click an icon to log in Email (required) (Address never made public) Name (required) Website You are commenting using your WordPress.com account. ( Log Out / Change ) You are commenting using your Twitter account. ( Log Out / Change ) You are commenting using your Facebook account. ( Log Out / Change ) You are commenting using your Google+ account. ( Log Out / Change ) Cancel Connecting to %s Notify me of new comments via email. Notify me of new posts via email. More Film News from Variety The Power of Content HBO President On Vinyls Demise On-Screen Violence -TCA Chelsea Vs. Real Madrid Live Stream -- Watch The Champions Cup... High Beam Shoes Launches Synching Sneakers That Help Find... Sarah Jessica Parker Explains Biggest Difference Between Her... Video reveals what Apples iPhone 7 headphones may look like Subscribe to Variety Today All The Ways to Get Variety Online Subscription Print Subscription Mobile Apps Newsletters News Alerts Archives Slanguage Dictionary Help Other Variety Products MediaVariety 411 Research amp; DataVariety Insight Archives Premium Email Alerts Real Estate Jobs Access the best entertainment industry data available View the Variety archives dating back to 1905 Get News Delivered To Your Inbox Privacy Policy Your Privacy Rights Terms of Use About Us Advertise Contact Us Google+ The Power of Content Deadline india.com Hollywoodlife hollywood TV Line BGR WWD Footwearnews (c) Copyright 2016 Variety Media LLC a subsidiary of Penske Business Media LLC. Variety and the Flying V logos are trademarks of Variety Media LLC. Powered by WordPress.com VIP Variety411 Your production services resource",http://variety.com/2013/film/reviews/film-review-the-last-exorcism-part-ii-1200002202/,200,thelastexorcismpartii2,thelastexorcismpartii,com/2013/film/reviews/film-review-the-last-exorcism-part-ii-1200002202/
"Possessive case Last Exorcism returns without the novelty - Movies - Boston.com Sites V ^ Boston.com BDCwire Love Letters Real Estate Menu Login Search Search Home News Weather Sports Entertainment Lifestyle Travel Cars Real Estate Possessive case Last Exorcism returns without the novelty Share Tweet Bcom - Article MobileFriendly - Methode Share Tweet By Ethan Gilsdorf Globe Correspondent | 03.04.13 | 1111 AM With Pope Benedict stepping down just before its opening ""The Last Exorcism Part II"" couldnt be better timed. ""Without the pope there"" said coproducer Eli Roth (""Hostel"") in a recent interview ""a lot of people feel that a gateway to evil will open up."" Plus 42 percent of Americans believe in demonic possession. And its Lent. Related Link Find showtimes and theaters That said this films target audience probably isnt so much unnerved devout Catholics as it is anxious teenage girls of all faiths. According to ""The Last Exorcism Part II"" being possessed by the devil is just another way of talking about the perils of emerging female sexuality. Advertisement - Continue Reading Below Thats one way to read this sequel to 2010s hit ""The Last Exorcism"" a ""Blair Witch""-like faux documentary about possession which ended with young Bayou farm girl Nell Sweetzer (possibly) freed from the demon Abalam and several other people coming to an untimely end. Ashley Bell reprises her truly convincing and remarkable performance again bringing her fragile avian-like demeanor to portray a girl now on the cusp of womanhood. ""Part II"" finds doe-eyed Nell in a New Orleans home for troubled girls run by kindly father-figure Frank (Muse Watson). ""Its your fate"" Frank advises. ""You get to decide who you are."" Or can she? The world overwhelms her. A co-worker at the motel where she works wanting to be her boyfriend is a threat; so is a sexually suggestive voice on the phone. New girlfriends at the home are competitive and suspicious even as they offer a hand of friendship. ""Are you from some cult in the woods or something?"" one resident challenges. In a clever nod to our viral world the homes girls view footage from ""The Last Exorcism"" on YouTube. As Nell wrestles with recurring hauntings -- buzzing flies convulsing bystanders visitations from her dead father -- the question of feminine authority and the historical baggage of female hysteria is the subtext. Are her troubles psychological or supernatural? That provides tension for about half the film. The Mardi Gras backdrop with its masks and costumes offers another metaphorical layer about identity. Fresh-meat director and co-writer Ed Gass-Donnelly (""Small Town Murder Songs"") wisely loses part ones mock-doc look and feel. Hes not afraid to lock down his camera but his story cant quite live up to the creepy novelty of part one directed by Daniel Stamm. Once the ""what is real what is fantasy"" questions are answered and exorcism part deux commences ""The Last Exorcism Part II"" abandons its half-intelligent tender exploration of Nells vulnerability and desirability. We end in flames flies and rock n roll. And Nells fate naturally is left uncertain. Look for that to be answered in ""Part III Return of the Pope."" Ethan Gilsdorf can be reached at ethanethangilsdorf.com. Most Popular Duxbury is New Englands best-kept secret according to Vogue Where to go and what to do in Gloucester How a small Newton backyard became a childrens delight of wildlife and plantings 10 things to do in Boston this weekend The most popular places to order burgers from in Boston according to Grubhub Back to Top Twitter Facebook Google + ? (c)2016 Boston Globe Media Partners LLC Privacy Policy | Terms of Service | Ad Choices Search Sections Home News Weather Sports Entertainment Business Lifestyle Travel Cars Jobs Real Estate Classified Marketplace Shortcuts Circulars Traffic Video Lottery Markets Horoscopes Forums Comics Movie Listings Crosswords Site help Digital Jobs at Boston Globe Media BDCWire Id click that Radio BDC Streaming todays top alternative music amp; more Loveletters Your daily love advice Boston Globe Home of award-winning Boston Globe reporting Beta Boston Your one-stop source for local innovation news Crux Covering all things Catholic Twitter Facebook Google + ? Privacy Policy Terms of Service Contact (c)2016 Boston Globe Media Partners LLC Sign in Register <a href=""http//www.omniture.com"" title=""Web Analytics""> </a>",http://www.boston.com/ae/movies/2013/03/04/possessive-case-last-exorcism-returns-without-the-novelty/ldpaS1GUQENluPubo3FCoM/story.html,200,thelastexorcismpartii3,thelastexorcismpartii,boston
