review,link,status_code,id,movie_key,critic
"Movie Review The Last Exorcism Part II -- Vulture NYMag.com Daily Intelligencer Vulture The Cut Science of Us Select All Grub Street Bedford amp; Bowery FOLLOW Facebook Twitter Instagram UserName LOG IN REGISTER TV Movies Music What to Stream Ghostbusters Vulture Reports from the RNC Mr. Robot Emmys 2016 Search Sections Home TV Movies Music What to Stream Hot Topics Ghostbusters Vulture Reports from the RNC Mr. Robot Emmys 2016 Vultures Network NYMag.com Daily Intelligencer The Cut Grub Street Science of Us Bedford amp; Bowery Like UsFollow UsFollow Us Popular on Vulture When Did the Media Turn Against Taylor Swift? >> movie review March 1 2013 1030 a.m. Movie Review The Last Exorcism Part II Is Possessed by the Jump Scare Demon By Bilge Ebiri Follow BilgeEbiri Fooled you That <em>last </em>exorcism? Totally wasnt the last one. 8 Shares Share 4 Tweet 4 Share 0 Share Email Print Share Photo PATTI PERRET The jump scare can be a problematic tool. It works on a purely physical level Our fight-or-flight response to things suddenly jumping out in our faces is biological imperative not filmmaking artistry. But some movies employ it wisely building up to their big ""boo"" moments in ways that dont seem cheap or opportunistic. (Think of Mama earlier this year.) But most horror films nowadays rely on jump scares because they dont have much else to go with. The Last Exorcism Part II fits in a third category For much of its running time its a surprisingly effective almost classically restrained thriller that builds its tension slowly methodically. But then it pees in its own soup by larding itself up with jump scares galore almost destroying the uneasy chilling mood its created. Those who saw the first film might be surprised to hear this one described as ""classical"" since the original was another of those disposable found-footage horror flicks albeit with some genuinely scary moments. Part II picks up soon after the events of the first film and features the same central possessed character Nell (Ashley Bell) a young woman who when we first see her is terrorizing a married couple in their home like some kind of demon. Taken to a kind of recovery home for troubled female souls Nell starts a new life under the kindly but disbelieving eye of social worker Frank Merle (Muse Watson). Sure enough the demon that possessed her Abalam isnt far away and things start to go off-kilter fairly quickly. Unlike many of the other directors working in the genre today director Ed Gass-Donnelly uses out-of-focus background elements long takes and deliberate pacing to create a world where everything seems slightly unhinged where anything seems possible -- more David Lynch than Eli Roth (though Roth is one of the executive producers of this film). Bell who was also in the first film has a similarly uncomfortable quality that serves her nicely. She seems uneasy in her own skin an innocent to whom everything seems new and either wondrous or threatening. Its a smart elemental performance We can see doubt and relief and anger and fear work their way across her face almost like a childs. At times you feel like this could be a silent film. (And with harebrained dialogue like ""I dont believe in ghosts but I do believe in people"" you often wish it were.) Anyway thats the good news. The bad news is that this matter-of-fact brick-by-brick approach to building scares and tension probably wont work for audiences who just want to scream a lot so Gass-Donnelly undercuts it all by haphazardly tossing in jump scares of the cheapest most predictable kind which force their own crippling rhythm to the movie. Instead of experiencing the slow build of tension watching this girls reality unravel around her we wind up being carried along from cheap thrill to cheap thrill. And theyre not even particularly good thrills. If you watch closely enough youll see that somewhere inside The Last Exorcism Part II is a very good thriller -- a genuinely unnerving movie about possession -- struggling to get out. But then the sound drops out the music shrieks a figure jumps out and were back to the same old same old. Tagsmoviesmovie reviewthe last exorcism part ii Share on Facebook Tweet this Story Top Stories The 17 Best Jokes About Donald Trump From His 2011 Comedy Central Roast When Did the Media Turn Against Taylor Swift? How Stranger Things Subverts the aDouchebag Boyfrienda a80s-Movie Trope Most Viewed Stories Constance Wu Slams Matt Damonas Great Wall Film for Perpetuating a aRacist Mytha 39.2k Shares Share Tweet LeBron James Reportedly Stopped Justin Bieber From Performing at the RNC 92 Shares Share Tweet John C. Reilly Is Giving One of the Best Performances in TV Comedy Today 8.2k Shares Share Tweet How a80s Are the Names on Stranger Things? 224 Shares Share Tweet Whatas New on Netflix August 2016 2 Shares Share Tweet What to Stream Now See whatas new and notable on Netflix Amazon Hulu and HBO Drakeas Current Nemesis Joe Budden Is More of a Match for Him Than He Looks 9 Shares Share Tweet Malia Obama Americaas Coolest Teen Spent Her DNC at Lollapalooza 1.3k Shares Share Tweet In Praise of the Stand-alone Episode of TV 163 Shares Share Tweet A Quick Refresher on the Jason Bourne Universe Backstory 24 Shares Share Tweet American Sniper Fans Are Upset Bradley Cooper Attended the DNC 931 Shares Share Tweet Latest News from Vulture 16 mins agoHBOas Divorce Is Actually a Wish Fulfillment ComedyItll hit HBO on October 9. 216 p.m.HBOas Limited Series The Night Of Might Get a Second SeasonNot so limited after all eh? 151 p.m.Game of Thrones Will Officially End With Season 8Winter is here. 123 p.m.Women on TV Were a Heated Topic at HBOas TCA Exec Session""I would hope the violence is not intentionally against women."" 118 p.m.True Detective Season 3 May Happen After AllPossibly with someone other than Nic Pizzolatto in charge of writing it. 107 p.m.Jon Stewartas New HBO Project Will Be Animated and Onion-LikeBill Maher is also staying until 2018. 1254 p.m.Divorce Insecure and Westworld Get Fall Premiere Dates on HBOTheyll be here soon enough... 1231 p.m.The Larry Sanders Show Is Coming to HBO Streaming Outlets in SeptemberSeptember 23 to be precise. 1228 p.m.Avengers Infinity War Doesnt Want Infinite Films Is Now Just a Standalone Film2 Infinity 2 Handle. 1158 a.m.Somebody Alert the Television Academy A New Alan Ball Family Drama Is Coming to HBOItll focus on a ""contemporary multi-racial family."" 1104 a.m.The Handmaiden Trailer Its the Korean Gothic Lesbian Revenge Thriller We DeserveIn theaters October 19 1031 a.m.A Chandra Levy Miniseries Is Coming to TNTNetworks cant get enough of true crime. 936 a.m.You Can Now Watch Mr. Robots Disturbing Short Film The Careful Massacre of the BourgeoisieNSFW 837 a.m.Jimmy Fallon Found a Super Effortless Way to Hold Margot Robbies Hand For Four MinutesIf the glove doesnt fit... Yesterday at 1100 p.m. Outcast Recap Sympathy for the Devil""What Lurks Within"" is a deceptively slow episode. Yesterday at 1100 p.m. The Great British Baking Show Recap Rough PuffWho on earth is washing all of these dishes? Yesterday at 1000 p.m.The Great British Baking Show Recap Lady FingersThe greatest mystery of our time Why does the Male Judge hate pomegranate? Yesterday at 550 p.m.A Quick Refresher on the Jason Bourne Universe BackstoryUniversal was really planning on more Jeremy Renner movies. Yesterday at 547 p.m.Whatas New on Hulu August 2016Youre the Worst The Wine Show Yesterday at 510 p.m.How a80s Are the Names on Stranger Things?Barb. Nance. Joyce. Load More Home TV Movies Music Books New On Netflix Newsletters Facebook Twitter RSS Feedly Privacy Terms Sitemap Media Kit Ad Choices About Us Contacts Feedback Were Hiring A(c) 2016 New York Media LLC. View all trademarks Close But we noticed youre visiting us with an ad blocker We understand the reasons for blocking but Vulture depends on ads to pay our writers and editors. Were working hard to improve the ad experience on our site but in the mean time wed really appreciate it if you added us to the approved list in your ad blocker. Thanks for the support Stream David Bowieas New Album Right Now Dermot Mulroney Returning to New Girl Ad will collapse in seconds... CLOSE",http://www.vulture.com/2013/03/movie-review-the-last-exorcism-part-ii.html,200,thelastexorcismpartii11,thelastexorcismpartii,vulture
"The Last Exorcism Part II Starring Ashley Bell - The New York Times NYTimes.com no longer supports Internet Explorer 9 or earlier. Please upgrade your browser. LEARN MORE >> Sections Home Search Skip to content Skip to navigation View mobile version The New York Times Movies|The Devil Wants a Sequel Advertisement Search Subscribe Now Log In 0 Settings Close search search sponsored by Site Search Navigation Search NYTimes.com Clear this text input Go http//nyti.ms/14aPUeO Loading... See next articles See previous articles Site Navigation Site Mobile Navigation Advertisement Supported by Movies | Movie Review The Devil Wants a Sequel The Last Exorcism Part II Starring Ashley Bell The Last Exorcism Part II Directed by Ed Gass-Donnelly Drama Horror Thriller PG-13 1h 28m By ANDY WEBSTERMARCH 1 2013 Continue reading the main story Share This Page Continue reading the main story Poor Nell cant catch a break. In ""The Last Exorcism"" (2010) this Louisiana teenager was possessed by the demon Abalam and ultimately bore his progeny only to have their unholy offspring disposed of by solemn hooded attendants. In ""The Last Exorcism Part II"" she has survived that ordeal unlike her father (or so it appears) the documentary crew filming her and the minister of lapsed faith who attempted to coax out her tormentor.Now shes in a house for recovering trauma patients in New Orleans and Abalam has again come a-courting. But only indirectly making overtures through greasepainted human statues (the kind in Times Square) birds hitting windows voices hidden in radio static and the ubiquitous presence of insects. (Clearly ""The Last Exorcism"" was a misnomer.)Nells roommate Gwen (the very interesting though very underused Julia Garner star of the coming ""Electrick Children"" a hit at South by Southwest) isnt much help with Nells suitor. But a hardy group of demon-relocation specialists (including E. Roger Mitchell) gives it a shot.""The Last Exorcism Part II"" belongs to a flourishing genre you could call terror tease. Devoid of nudity gore and obscene dialogue PG-13 films like the ""Paranormal Activity"" series and the first ""Last Exorcism"" eschew graphic violence for mood and minor scares -- perfect for Friday-night mall outings without Mom and Dad. If only they gave you more to think about.At least this movie like its predecessor has Ashley Bell as Nell. An actress who suggests religious piety carnal fire and satanic aggression with equal dexterity Ms. Bell provides a pulse an audience can connect with amid the standard-issue atmospheric accouterments.""The Last Exorcism Part II"" is rated PG-13 (Parents strongly cautioned) for mild violence and brief strong language. The Last Exorcism Part II Director Ed Gass-Donnelly Writers Damien Chazelle Ed Gass-Donnelly Star Ashley Bell Rating PG-13 Running Time 1h 28m Genres Drama Horror Thriller Movie data powered by IMDb.com Last updated Mar 30 2016 Opened on Friday nationwide. Directed by Ed Gass-Donnelly 1 hour 28 minutes A version of this review appears in print on March 2 2013 on page C4 of the New York edition with the headline The Last Exorcism Part II. Order Reprints| Todays Paper|Subscribe Continue reading the main story Were interested in your feedback on this page. Tell us what you think. Whats Next Loading... Go to Home Page >> Site Index The New York Times Site Index Navigation News World U.S. Politics N.Y. Business Tech Science Health Sports Education Obituaries Todays Paper Corrections Opinion Todays Opinion Op-Ed Columnists Editorials Contributing Writers Op-Ed Contributors Opinionator Letters Sunday Review Taking Note Room for Debate Public Editor Video Opinion Arts Todays Arts Art amp; Design Books Dance Movies Music N.Y.C. Events Guide Television Theater Video Arts Living Automobiles Crossword Food Education Fashion amp; Style Health Jobs Magazine N.Y.C. Events Guide Real Estate T Magazine Travel Weddings amp; Celebrations Listings amp; More Classifieds Tools amp; Services Times Topics Public Editor N.Y.C. Events Guide Blogs Multimedia Photography Video NYT Store Times Journeys Subscribe Manage My Account Subscribe Subscribe Times Insider Home Delivery Digital Subscriptions Crossword Email Newsletters Alerts Gift Subscriptions Corporate Subscriptions Education Rate Mobile Applications Replica Edition International New York Times Site Information Navigation (c) 2016 The New York Times Company Home Search Accessibility concerns? Email us at accessibilitynytimes.com. We would love to hear from you. Contact Us Work With Us Advertise Your Ad Choices Privacy Terms of Service Terms of Sale Site Information Navigation Site Map Help Site Feedback Subscriptions",http://movies.nytimes.com/2013/03/02/movies/the-last-exorcism-part-ii-starring-ashley-bell.html?_r=0,200,thelastexorcismpartii12,thelastexorcismpartii,nytimes
"The Last Exorcism Part II Film Review - Hollywood Reporter The Hollywood Reporter movies Subscribe reviews box office heat vision coming soon trailers movies tv music tech the business style culture awards video Subscribe Blogs heat vision bastard machine live feed behind the screen esq earshot the race Newsletter THR Social Confessions of Colbert Subscribe Now Never Miss A Story. Sign up for our Newsletters. Daily Edition Login to download The Last Exorcism Part II Film Review 1048 AM PST 3/1/2013 by Frank Scheck FACEBOOK TWITTER EMAIL ME PRINT COMMENTS Creepy atmospherics dont compensate for the lack of genuine scares in this unimpressive follow-up. TWITTER This sequel to the breakout horror-film hit finds its young heroine once again undergoing the titular ritual. Instantly rendering the title of its first installment moot The Last Exorcism Part II proves yet again that you cant keep a good demon down. Yes Abalam is back to torture Nell Sweetzer (Ashley Bell) the innocent deeply religious young woman who went through both spiritual and physical contortions in the 2010 breakout hit. After a brief recap featuring scenes from the original film Nell -- who somehow survived its fiery climax -- is seen terrorizing a young couple in their home after which she is promptly whisked off to a New Orleans halfway house for troubled girls. There shes introduced to such joys as hard-rock music on an iPod the exotic spectacle of Mardi Gras and a burgeoning attraction to a nice young man who returns her interest. PHOTOS Iconic Horror Movies But it isnt long before creepy things begin happening including ominous visits from her fathers ghost warning her that shes in danger; her newfound friends suddenly being possessed by a vengeful spirit; and an unsettling encounter with a stranger in a church thats followed by an attack by suicidal birds. (That last scene incidentally represents the second such episode in a horror film in a week following quickly on the heels of Dark Skies.) Forgoing the faux found-footage technique that the original employed this sequel takes a more classical narrative approach. Unfortunately while director/co-writer Ed Gass-Donnelly displays an admirable restraint in his general eschewing of gratuitous gore quick editing and flashy visuals the results have a generally soporific feel. Although there are several moments that are undeniably creepy such as Nells encounter with a motionless mime or her experiencing an episode of airborne solo sexual ecstasy the general tedium is only alleviated by the obligatory shock scares for which the sound mixer has dutifully cranked up the volume to 11. PHOTOS Halloween Gone Wrong The 10 Least Scary Movies of All Time It all culminates in -- what else? -- another exorcism this time of the voodoo variety. But the scene barely registers and the explosive finale featuring unimpressive CGI fire effects is a further letdown. Reprising her role Bell again is the films chief asset delivering a memorable unsettling performance that easily can be compared to Sissy Spaceks Carrie. Vividly conveying her characters complex emotions with a minimum of histrionics she actually comes across as a real person unlike so many glam horror film heroines who look like theyve just stepped out of a photo shoot. Although the actress doesnt perform nearly as many of the memorable physical contortions as she did in the first film she remains a vital presence throughout and clearly is headed for bigger and better things. Of course before that she might be headed to a third installment of this series the seeds of which are planted in an open-ended climax demonstrating that this edition should have probably been titled The Penultimate Exorcism. FACEBOOK TWITTER EMAIL ME PRINT COMMENTS Frank Scheck THRnewsthr.com thr Comments Please enable JavaScript to view the <a href=""http//disqus.com/?ref_noscript"">comments powered by Disqus.</a> comments powered by Disqus The Hollywood Reporter (c) 2016 The Hollywood Reporter All rights reserved. Terms of Use | Privacy | Sitemap | About Our Ads About Us Login Daily Edition Subscribe Subscriber Services Back Issues Advertising Contact Us Careers Industry Jobs Follow Us On Twitter Find Us On Facebook Watch Us On Youtube Our affiliate publications Billboard Ad Week Backstage Casting",http://www.hollywoodreporter.com/movie/last-exorcism-part-ii/review/425570,200,thelastexorcismpartii13,thelastexorcismpartii,hollywoodreporter
"Review The Last Exorcism Part 2 - MTV mtv Menu mtv mtv Home Shows Full Episodes Shows A-Z TV Schedule App MTV2 2016 vmas Shows News Music from the Shows Casting Calls Music Music Artists A-Z Music Videos Artist to Watch News Latest News Music Celebrity TV Movies Style Politics Life TV Provider Signout facebook twitter tumblr news Shows Full Episodes Shows A-Z TV Schedule App MTV2 2016 vmas Shows News Music from the Shows Casting Calls Music Music Artists A-Z Music Videos Artist to Watch News Latest News Music Celebrity TV Movies Style Politics Life facebook twitter tumblr VMA Nominations Live From The DNC Music Movies Review The Last Exorcism Part 2 Williams Goss 03/01/2013 ""So you from a cult in the woods or something?"" asks the curly-haired girl from ""Martha Marcy May Marlene"" (Julia Garner). Nell (Ashley Bell) isnt quick to respond. She doesnt quite remember what happened out at the Sweetzer farm -- how she birthed a demon baby before a mass of worshippers how said worshippers then killed a camera crew that had been documenting her prolonged possession by the frisky likes of the evil spirit Abalam -- so to watch the ill-titled ""The Last Exorcism Part 2"" is to already know what Nell doesnt It aint over. The film picks up from the moment that the cameras (and bodies) fell with director Ed Gass-Donnelly opting for a crisp static widescreen approach to the supernatural shenanigans this time around as if to apologize for the jittery found-footage tactics of the first outing. Nell is found in a feral state by some unnerved neighbors and it isnt long before shes shipped off to a girls home overseen by kindly counselor Frank (Muse Watson spewing unprompted maxims at such a fast clip that it seems as if hes auditioning for Scott Glenns role in ""Sucker Punch""). Nell settles in loosens up finds a job and meets a boy (Spencer Treat Clark) in due time but of course it isnt long until Nells past comes back to haunt her in the form of hallucinations nightmares flashbacks masked followers shadowy figures and improbable fame as a viral video sensation (what her legion of cult admirers would stand to gain by uploading that footage to YouTube and inviting inquiries into what really happened before I havent the foggiest). Its girl-who-cried-wolf routine for her and a non-mystery for us the potentially apocalyptic stakes of which are more often said than shown and if you told me that Gass-Donnelly and co-writer Damien Chazelle had worked together to retrofit an already generic possession screenplay for the sake of this franchise Id believe it. Fortunately Gass-Donnellys prowess as a helmer is frequently on display eager as he is to isolate the characters within the frame and prone to lingering on quiet asides -- like flies on a bathroom mirror or bicycles abandoned in the street -- effectively transforming the mundane details of Nells new life into more ominous indicators of decay and foreboding. Alas we also get the suddenly loud dog the cymbal crash any time someone startles our lead and just about every other jolt tactic that deflates the films carefully creepy approach. Late-night seizures becomes exceedingly bone-crunching affairs while a neutered throat-slitting begs to be restored on the inevitable unrated DVD. To her credit all the hokum does little to change the fact that Bell maintains her fragile performance from the first film. The actress is fueled equally by naivete and trauma able to elicit compassion for her character beyond her tendency for bodily contortions (exploited far less here than expected). ""Part 2"" rushes into its climactic re-exorcism with characters hardly established earlier than the third act paying off few sinister intimations of those characters who had come before and the ending falls in line with the now-belabored ""Paranormal Activity"" formula of wheel-spinning and sequel-teasing. At the end of the day its a sure-handed sequel but not a terribly thrilling one. Grade C Movies The Last Exorcism Part II News about FAQ/Help Jobs Terms of Use Privacy Policy/Privacy Rights Copyright Closed Captioning Eventful Partners Ad Choices (c)2016 Viacom International Inc. All Rights Reserved. MTV and all related titles and logos are trademarks of Viacom International Inc.",http://www.film.com/movies/review-the-last-exorcism-part-2,200,thelastexorcismpartii14,thelastexorcismpartii,film
