review,link,status_code,id,movie_key,critic
"The Last Exorcism Part II movie review - The Washington Post Sections Sign In Username Subscribe Accessibility for screenreader Home Page Politics PowerPost The Fix White House Courts and Law Polling Monkey Cage Fact Checker Post Politics Blog Opinions The Posts View Toles Cartoons Telnaes Animations Local Opinions Global Opinions Letters to the Editor Act Four All Opinions Are Local Book Party Compost Erik Wemple Five Myths In Theory The Plum Line PostEverything PostPartisan Rampage Right Turn The Watch Volokh Conspiracy Sports Redskins NFL MLB NBA NHL AllMetSports Soccer Boxing/MMA College Football College Basketball D.C. Sports Bog Early Lead Fancy Stats Golf Tennis Fantasy Sports Local D.C. Maryland Virginia Public Safety Education Obituaries Transportation Weather National Acts of Faith Health and Science National Security Investigations Morning Mix Post Nation Obituaries World Africa The Americas Asia and Pacific Europe Middle East National Security WorldViews Checkpoint Business Wonkblog On Leadership Personal Finance Digger Energy and Environment Markets On Small Business World Business Capital Business Tech Innovations On I.T. The Switch Lifestyle Arts and Entertainment Advice Carolyn Hax Food Travel Wellness Magazine Home and Garden Inspired Life Fashion KidsPost On Parenting Reliable Source The Intersect Solo-ish Entertainment Books Comics Comic Riffs Going Out Guide Horoscopes Movies Museums Music Puzzles and Games Theater and Dance TV Restaurants Bars amp; Clubs Crosswords Video Live Top News Popular Video Politics Opinions Sports National World Business Technology Style Entertainment Local Photography In Sight Washington Post Live Events Live Chats Real Estate Rentals Where We Live Recently Sold Homes Cars Jobs WP BrandConnect Classifieds Partners Express El Tiempo Latino Parade Fashion Washington washingtonpost.com 1996-2016 The Washington Post Terms of Service Privacy Policy Submissions and Discussion Policy RSS Terms of Service Ad Choices Share on Facebook Share on Twitter Share on Google Plus Share via Email Share on LinkedIn Share on Pinterest Share on Tumblr Resize Text Print Article Comments The inside track on Washington politics. Be the first to know about new stories from PowerPost. Sign up to follow and well e-mail you free updates as theyre published. Youll receive free e-mail news updates each time a new story is published. Youre all set Sign up Invalid email address Got it Got it Movies The Last Exorcism Part II movie review The inside track on Washington politics. Be the first to know about new stories from PowerPost. Sign up to follow and well e-mail you free updates as theyre published. Youll receive free e-mail news updates each time a new story is published. Youre all set Sign up Invalid email address Got it Got it Still of Ashley Bell in The Last Exorcism Part II. (CBS Films/CBS FILMS) By Sean OConnell March 1 2013 At what point do you think the producers of 2010s surprise hit ""The Last Exorcism"" regretted putting the word ""Last"" in their title? Was it after the first wave of positive reviews rolled in? Could it have been right around the time the low-budget indie horror film turned a sizable profit earning 67 million in global ticket sales and all but guaranteeing a sequel? Not to worry. True horror fans know that ""Last"" -- and similar adjectives -- hold no weight in this sequel-happy genre. Thats why there were six additional Jason movies after 1984s ""Friday the 13th The Final Chapter"" and Freddy Krueger didnt actually die in the 1991 thriller ""Freddys Dead The Final Nightmare."" So long as audiences support horror franchises at the box office studios happily will crank out substandard follow-up films that have no real interest beyond squeezing dollars from a marketable brand. The promise of a quick cash grab is the only excuse that justifies ""The Last Exorcism Part II"" an ineffective excursion that maintains a few direct ties back to the original film but never moves the story forward. Dark components that genuinely disturbed us in the first film -- a skeptical Southern preacher (played by Patrick Fabian) getting his faith shaken to the core; the hand-held camera techniques of a true-crime docu-drama; a legitimate fear of the occult -- are sacrificed for generic scares and flavorless plot twists. By jogging in place for an hour and a half this monotonous and unimaginative sequel only tests a viewers patience and should ensure that this actually is the last chapter in the rapidly declining series. For continuitys sake ""Part II"" picks up in the Louisiana swamp where Nell (Ashley Bell) has given birth to the demonic love child of a seedy pastor. Fabians character has been killed (the actor is sorely missed in this humorless sequel) and the shell-shocked Nell hardly remembers anything we witnessed in the first movie. Since she essentially has been orphaned by the events of the first film Nell is turned over to a New Orleans foster home for wayward women where her possession continues and strange occurrences start plaguing the homes emotionally damaged residents. And by ""strange"" I mean ""boring."" Nell admits to a sympathetic counselor (Muse Watson) that she still feels the evil presence of the demon Abalam but all the unseen threat does is make dirty phone calls in the dead of night and occasionally send black flies to buzz around Nells bedroom. Abalams more annoying than terrifying in this sequel following Nell around the French Quarter while wearing a Mardi Gras mask and prompting dogs to bark in a cheap effort to get audience members to jump in their chairs. Bell was a welcome find in the original ""Last Exorcism"" and she continues to try interesting things with her unusual character. The actress projects a farm-girl innocence when playing Nell turning the naive heroine into a blank slate thats ripe for satanic corruption. And ""Part II"" like so many horror sequels concerns itself with Nells sexual awakening which encourages the flexible Bell to writhe and squirm like a serpent on a Twister board. But the PG-13 rating pushes all racy gory material far off screen instantly deflating any potential heat or tension the sequel threatened to generate. Without spoiling anything I will say that ""The Last Exorcism Part II"" ends on an open note that teases a legitimately engaging setup for a potential third movie. But really the producers of this series should quit while theyre behind. One sequel was unnecessary. A second sequel would be criminal. Besides what could they possibly call it? ""The Last Exorcism Seriously. We Mean It This Time. Trust Us?"" The Last Exorcism Part II r PG-13. At area theaters. Contains horror violence terror and brief language. 88 minutes. entertainment movies Get 2016 Olympics updates by email Our best news and analysis from Rio delivered to your inbox. post_newsletter333 magnet-olympics2016 false after3th false Please provide a valid email address. Sign up Youre all set See all newsletters entertainment movies true Please provide a valid email address. Sign up Youre all set See all newsletters Comments Share on FacebookShare Share on TwitterTweet Share via Email Show Comments Discussion Policy 0 Comments SuperFan Badge SuperFan badge holders consistently post smart timely comments about Washington area sports and teams. More about badges | Request a badge Culture Connoisseur Badge Culture Connoisseurs consistently offer thought-provoking timely comments on the arts lifestyle and entertainment. More about badges | Request a badge Fact Checker Badge Fact Checkers contribute questions information and facts to The Fact Checker. More about badges | Request a badge Washingtologist Badge Washingtologists consistently post thought-provoking timely comments on events communities and trends in the Washington area. More about badges | Request a badge Post Writer Badge This commenter is a Washington Post editor reporter or producer. Post Forum Badge Post Forum members consistently offer thought-provoking timely comments on politics national and international affairs. More about badges | Request a badge Weather Watcher Badge Weather Watchers consistently offer thought-provoking timely comments on climates and forecasts. More about badges | Request a badge World Watcher Badge World Watchers consistently offer thought-provoking timely comments on international affairs. More about badges | Request a badge Post Contributor Badge This commenter is a Washington Post contributor. Post contributors arent staff but may write articles or columns. In some cases contributors are sources or experts quoted in a story. More about badges | Request a badge Post Recommended Washington Post reporters or editors recommend this comment or reader post. You must be logged in to report a comment. Sign in here You must be logged in to recommend a comment. Sign in here Comments our editors find particularly useful or relevant are displayed in Top Comments as are comments by users with these badges . Replies to those posts appear here as well as posts by staff writers.All comments are posted in the All Comments tab. More about badgesGet a badge To pause and restart automatic updates click ""Live"" or ""Paused"". If paused youll be notified of the number of additional comments that have come in. Comments our editors find particularly useful or relevant are displayed in Top Comments as are comments by users with these badges . Replies to those posts appear here as well as posts by staff writers. Spam Offensive Disagree Off-Topic Facebook Twitter Reddit StumbleUpon Digg Delicious Most Read 1 The best cartoons making fun of Hillary Clintons Democratic Convention 2 The best cartoons ridiculing the GOP convention -- and Melania Trumps plagiarism 3 Wizard magic JK Rowling hopes Harry Potter play goes global 4 These are the Richard Thompson masterpieces well most remember him by 5 Donald Trump will win in a landslide. The mind behind Dilbert explains why. Our Online Games Play right from this page Mahjongg Dimensions Strategy game Spider Solitaire Card game Daily Crossword Word game washingtonpost.com (c) 1996-2016 The Washington Post   Help and Contact Us Terms of Service Privacy Policy Print Products Terms of Sale Digital Products Terms of Sale Submissions and Discussion Policy RSS Terms of Service Ad Choices Close video player Now Playing More from The Post",http://www.washingtonpost.com/entertainment/movies/the-last-exorcism-part-ii-movie-review/2013/03/01/bd711d28-828e-11e2-b99e-6baf4ebe42df_story.html,200,thelastexorcismpartii8,thelastexorcismpartii,washingtonpost
The Last Exorcism Part II | EW.com Skip to main content Sign In Log Out TV TV Recaps Movies Music Books Gaming Video Big Brother Queen of the South Mr. Robot Wayward Pines Suits Tyrant Shop Newsletter Subscribe Get 1 year for 25 Save 86% off the cover price SUBSCRIBE More Great Stuff Comic-Con Hulu Hot List 50Scoops EW Popfest For Your Consideration Jess Cagle Interview Stage Follow EW EW on Facebook EW on Twitter EW on Tumblr EW on Instagram About EW Contact UsCustomer ServiceAbout UsJobs at Time Inc.AdvertisePrivacy PolicyYour California Privacy RightsAd ChoicesNewslettersSubscribeTerms of ServiceSite Map Copyright 2015 Entertainment Weekly Inc. All rights reserved. Login Log out TV TV Recaps Movies Music Books Gaming Video More... TV This Weeks Cover The Walking... TV Exclusive Photos of The Walking... EW POPFEST Get the details 50Scoops50Days Exclusive... Movies Crazy Stupid Love Before Th... Movies The Most 2000s Fashion From Joh... Movies 27 Great Revenge Movies Movies Alice in Wonderland Witticism... Movies John Tucker Must Die Where Ar... Books 15 Captivating International Cri... Movies Planet of the Apes See the Fa... Movies Toronto Film Festival 2016 See... TV One Tree Hill Where Are They... Movies Little Miss Sunshine Where Ar... Books Harry Potter and the Cursed Chi... Movies Comic-Con 2016 See Portraits of... TV Friends See the Casts Evolut... TV Comic-Con 2016 Get Batty With... Movies The Dark Tower Storybook Steph... News Comic-Con 2016 Star Portraits... TV 10 of the Best Moments From The... Movies The Dark Tower Storybook Steph... Movies Thelma and Louise See Rare Behi... Movies 9 of Garry Marshalls Best Movies Movies Every Star Trek Movie Ranked Movies Big Trouble in Little China... Movies The Dark Tower Exclusive Firs... Movies Suicide Squad Before They Wer... Movies The 10 Best Movies of 2016 (So Far) TV Fear the Walking Dead introduc... Movies The Last Exorcism Part II by Clark Collis  clarkcollis Share Tweet Share on Google+ Share on Pinterest Share on Tumblr The Last Exorcism Part IIThe Last Exorcism Part II may have an extremely dumb title but thats not a good reason to avoid it -- particularly when there are so...The Last Exorcism Part IIHorrorPT89MPG-13The Last Exorcism Part II may have an extremely dumb title but thats not a good reason to avoid it -- particularly when there are so...2013-03-06CBS Films Share Tweet Share on Google+ Share on Pinterest Share on Tumblr THE LAST EXORCISM PART II C+ The Last Exorcism Part II Genre Horror; Starring Ashley Bell Spencer Treat Clark; Director Ed Gass-Donnelly; Release Date Wide 03/01/2013; Runtime (in minutes) 89; MPAA Rating PG-13; Distributor CBS Films Posted March 6 2013 -- 1200 AM EST The Last Exorcism Part II may have an extremely dumb title but thats not a good reason to avoid it -- particularly when there are so many more legitimate excuses not to see this tepid predictable sequel to the 2010 horror film were now renaming The First Last Exorcism. Having eschewed the found-footage format of the original director Ed Gass-Donnelly makes good-ish use of the movies New Orleans location. Ashley Bell is convincingly fretful as the returning exorcisee Nell who spends much of the film enduring flies visions of her dead father and nocturnal backbending (a limber vertebrae has now officially replaced projectile vomiting as the definitive proof of demonic possession). Unfortunately no one involved seems to have bent over backwards to make the movie either original or even all that scary. C+ Share Tweet Share on Google+ Share on Pinterest Share on Tumblr Top Stories A Chorus Line kicks up the classics at the Hollywood Bowl Sarah Jessica Parker New HBO show isnt Sex and the City The Larry Sanders Show reruns returning to HBO this fall Stranger Things cast and fans scared with even Stranger prank HBO chief spars with critics over rape scenes Nick Cannon says he was hit with Mariah Carey diss on Wild N Out True Detective not dead yet HBO insists Photo Galleries 50Scoops50Days The Latest in Fall TV News The Biggest Moments From the 2016 Conventions Crazy Stupid Love Before They Were Stars The Most 2000s Fashion From John Tucker Must Die Exclusive Photos of The Walking Dead Season 7 27 Great Revenge Movies Alice in Wonderland Witticisms and Wisdom From the Disney Classic From Our Partners From Our Partners Contact UsCustomer ServiceAbout UsJobs at Time Inc.AdvertisePrivacy PolicyYour California Privacy RightsAd ChoicesNewslettersSubscribeTerms of ServiceSite Map Copyright (c) 2016 Entertainment Weekly Inc. All rights reserved. img[data-src] { display none important; },"http://www.ew.com/ew/article/0,,20678831,00.html",200,thelastexorcismpartii9,thelastexorcismpartii,ew
"The Last Exorcism Part II  Film Review The Last Exorcism Part II  Movie Review  The A.V. Club Film TV Club Music Comedy Books Games Aux More The Last Exorcism Part II Most Read A.V. Club Most Read 1 Guardians Of The Galaxy Posted Jul 30 Marvel might only be making one Infinity War movie now 2 HBO programming president Casey Bloys at the 2016 Television Critics Association Summer Tour at The Beverly Hilton (Photo by Jeff Kravitz/FilmMagic/Getty Images) Posted Jul 30 HBO exec Casey Bloys on the future of Curb Deadwood and Jon Stewart 3 (Graphic Nick Wanserski) Posted Jul 30 The best books of 2016 so far The A.V. Clubs catch-up guide 4 Westworld (1973) Posted Jul 30 HBO sets a date for the robot cowboy uprising to begin Film TV Club Music Comedy Books Games Aux Newswire Reviews Video Great Job Internet Film TV Club Music Comedy Books Games Aux Newswire Features Reviews Videos Great Job Internet The Latest From Newswire Artists rendering of HBO executives heads when they found out their biggest show was coming to a close. (Game Of Thrones) HBO confirms that Game Of Thrones will end with season 8 Guardians Of The Galaxy Marvel might only be making one Infinity War movie now The Latest From Features (Graphic Nick Wanserski) The best books of 2016 so far The A.V. Clubs catch-up guide American jazz vocalist Michael Franks at SIR studios in NYC. (Photo Oliver Morris/Getty Images) Jazz-inflected yacht rock word lists and pop-culture nerdery The Latest From Reviews B- Photo Cinema Asia Releasing League Of Gods offers the deadly farts of a six-armed baby in dazzling 3-D B+ Mike Kinsella (Photo Shervin Lainez) On The King Of Whys Owens the best its ever been The Latest From Videos Chasing Jason Bourne and catching up with Woody Allen Comedian Damien Lemon likes his weed to have a heroic backstory The Latest From Great Job Internet (Screenshot YouTube) Watch David Cross wound himself with increasingly brutal hot wings Democratic nominee President Hillary Clinton waves to the crowd following her acceptance speech at the Democratic National Convention in Philadelphia on Thursday July 28 2016. (Photo Bill Clark/CQ Roll Call) Read This Hillary Clinton knows her Hamilton so chill All Recent Browse Our Features Coming Distractions Savage Love Facebook Twitter Tumblr Film Movie Review The Last Exorcism Part II By Scott Tobias Mar 1 2013 250 PM D Share Tweet D The Last Exorcism Part II Director Ed Gass-Donnelly Runtime 88 minutes Rating PG-13 Cast Ashley Bell Julia Garner Spencer Treat Clark Community Grade (7 Users) A A- B+ B B- C+ C C- D+ D D- F Your Grade A A- B+ B B- C+ C C- D+ D D- F ? Our Community Grading Tool is in beta. Send Feedback. Share Tweet Lost in all the jokes about the very existence of a sequel to 2010s The Last Exorcism--""The Lastest Exorcism?"" etc.--is a much more simple reason it isnt necessary Everything that was good about the first movie is dead. The problem with most found-footage horror movies is the mundane lulls before and between the punctuating spasms of supernatural activity but The Last Exorcism reversed the formula surrounding a run-of-the-mill demon-possession tale with a funny ironic character study about a sham exorcist who unwittingly stumbles into the real thing. Once the back-arching and mythological hoo-hah began in earnest the film slid into an ending that made audiences groan and that low point is where the story picks up with The Last Exorcism Part II an abysmal sequel that abandons the found-footage concept along with the pockets of wit and originality that made its predecessor salvageable. The only real carry-over here for reasons of mortality is Ashley Bell the Louisiana country girl whose corporeal form was invaded by a beastie named Abalam. In the dumbest of the films three dozen fake scares she turns up disheveled and confused in a private residence and the authorities place her in a foster home in New Orleans among other abused and abandoned teenage girls. With the support of her new friends and a job on a motel cleaning crew Bell inches her way back to normalcy in spite of escalating signs that Abalam is looking for a host again. She even strikes up a relationship with a shy co-worker (Spencer Treat Clark) that awakens her slumbering libido which only makes her more receptive to the forces of evil. The Last Exorcism Part II summons all the cliched New Orleans atmosphere it can muster voodoo cults Mardi Gras floats old-timey radios that only play crackling blues music from the 20s and 30s. But these are spices in the familiar gumbo of levitations guttural voices and ineffectual incantations thats been ladled out in the 40 years since William Friedkins The Exorcist. Theres a Carrie-like element to this sheltered religious girl from the sticks trying to be a normal teenager but Bells uncertainty in the lead reflects more on her limitations than her characters. She had the right look for the Plain Jane victim in the first movie; here shes the victim of its success. Share Tweet Filed Under Film More Movie Review Previous Movie Review 21 amp; Over Next Movie Review Beyond The Hills Dont miss a story--follow The A.V. Club on Cant see comments? Please enable JavaScript to view the <a href=""http//disqus.com/?ref_noscript""> comments powered by Disqus. </a> More Movie Review League Of Gods offers the deadly farts of a six-armed baby in dazzling 3-D Jul 30 2016 1022 AM Philip Roths Indignation becomes a character study worth examining Jul 28 2016 900 AM A former football pro documents his struggle with ALS in Gleason Jul 28 2016 1200 AM A woman fights to hold on to her career on Wall Street in Equity Jul 28 2016 1200 AM A.V. Club Most Read 1 Guardians Of The Galaxy Posted Jul 30 Marvel might only be making one Infinity War movie now 2 HBO programming president Casey Bloys at the 2016 Television Critics Association Summer Tour at The Beverly Hilton (Photo by Jeff Kravitz/FilmMagic/Getty Images) Posted Jul 30 HBO exec Casey Bloys on the future of Curb Deadwood and Jon Stewart 3 (Graphic Nick Wanserski) Posted Jul 30 The best books of 2016 so far The A.V. Clubs catch-up guide 4 Westworld (1973) Posted Jul 30 HBO sets a date for the robot cowboy uprising to begin Sign up for news Daily Newsletter Highlights from The A.V. Club Whats On Tonight A daily update on the world of TV Submit Links and such All Recent Browse Our Features Coming Distractions Savage Love Contests RSS About Us Contact Advertise Jobs Privacy Policy Our Partners Hitfix Mental Floss Oh My Rockness Uproxx Upworthy Vice (c) Copyright 2016 Onion Inc. All Rights Reserved.","http://www.avclub.com/articles/the-last-exorcism-part-ii,93183/",200,thelastexorcismpartii10,thelastexorcismpartii,avclub
