review,link,status_code,id,movie_key,critic
"PERFECT-LY INSIPID | New York Post Thanks for contacting us. Weve received your submission. Back to Reading News Metro Page Six Sports Business Opinion Entertainment Fashion Living Media Tech Real Estate Sub Menu 1 Photos Video Covers Columnists Horoscopes Sub Menu 2 Classifieds Subscribe Sign in In The News hillary clinton iran lamar odom 2016 presidential election new york mets Sections Search Tips Sign in New York Post Most Popular 46220 Why Hollywood babes are trying to bag a tech titan not a rock star 25222 College student kills 3 in house party shooting cops 15304 Braves Brian McCann interest may pave way for Gary Sanchez 14788 16 dead in Texas hot air balloon crash 12128 For the love of God stop dressing like crap 11960 Ex-NFLer wife fatally shot by teen in their home Share thisFacebookTwitterGoogleWhatsAppEmailCopy Entertainment Share thisFacebookTwitterGoogleWhatsAppEmailCopy PERFECT-LY INSIPID By Lou Lumenick View author archive email the author follow on twitter Get author RSS feed Name(required) Email(required) Comment(required) June 17 2005 | 400am EVEN tweens may think twice about plunking down 10 to see ""The Perfect Man"" a sticky straight-to-video-caliber Hilary Duff vehicle thats Hollywoods official sacrifice in a week that belongs to ""Batman Begins."" Sure there are a couple of giggles provided by the filmmakers inept attempts to pass off parts of Toronto as Brooklyn Heights. And the erstwhile Lizzie McGuire eventually hooks up in a PG-way with a cute classmate (Ben Feldman) who passes his time drawing comic books about her. But most of this movie is beyond lame. It almost makes ""A Cinderella Story"" - the ever-mugging Duffs surprise hit of last summer - look like a real movie by comparison. In this one Holly (Duff) a seldom-seen younger sister (Aria Wallace) and their single mother Jean (the improbably cast and preternaturally ageless TV vet Heather Locklear) arrive in the ersatz Brooklyn Heights after moms latest romantic breakup. Though Jean works as a baker at a deli shes somehow able to afford a spacious three-bedroom apartment in a brownstone in one of the citys hottest neighborhoods. She is insecure and romantically desperate - hello this is Heather Locklear - and begins dating a fellow baker and heavy-metal enthusiast (Mike OMalley). Holly considers him a loser so the enterprising teen invents a fictional ""perfect man"" who begins wooing her mother by e-mail. The model for this paragon is Ben a pals smug uncle who runs a pricey Brooklyn cafe and whos played by Mr. Big himself Chris Noth. Holly converts Bens romantic platitudes into a series of mushy e-mails guaranteed to lull even the most hyperactive tweens to sleep. Somehow Mom falls for this even when Hollys nascent teen boyfriend pretends to be the perfect man on the phone calling from ""China."" Or maybe shes too busy practicing for the New York City-wide baking competition The script attributed to Gina Wendkos (""The Princess Diaries"") has scarcely enough wit or momentum for an episode of ""Lizzie Maguire"" yet director Mark Rossman (who also helmed ""A Cinderella Story"") stretches it out well past the 90-minute mark not to mention the limits of endurance and credibility. The good news in ""The Perfect Man"" is that Noth and Locklear have terrific chemistry together. The bad news is that they have only one short scene together near the end of this throwaway movie. -- THE PERFECT MAN [] (One star) Not even adequate. Running time 100 minutes. Rated PG (mild suggestiveness). At the Empire the Kips Bay the First Avenue and 62nd St. others. Share thisFacebookTwitterGoogleWhatsAppEmailCopy Share this article Share thisFacebookTwitterGoogleWhatsAppEmailCopy Read Next PIXIE LUST Read Next PIXIE LUST Share Selection Trending Nowon NYPost.com 45878 Why Hollywood babes are trying to bag a tech titan not a rock star 24537 College student kills 3 in house party shooting cops 14723 Braves Brian McCann interest may pave way for Gary Sanchez Now On Celebrate Arnolds 69th birthday with his beefiest vintage pics Eric Claptons girlfriends ex-beau busted on pot rap Orlando Bloom joins Andy Sambergs HBO mockumentary SEE ALL Page Six TV Lindsay Lohans dad says booze pics arent what they seem Lindsays sober claims Michael Lohan These celebs hang out where? Now On Pure Nude Yoga Actual Workout Or Masturbation Material? (Answer Sorta Both) SEE ALL More Stories pagesix Harry Brant busted for drugs and bailing on taxi fare Now On Decider This Woman Giving Birth In A Stream Has Been Watched Over 54 Million Times (NSFW) nypost Why Hollywood babes are trying to bag a tech titan not a rock star New York Post Twitter Facebook Instagram Email Newsletters Mobile Apps Contact Us Tips Twitter Facebook Instagram Sections amp; Features News Real Estate Page Six Tech Sports Media Metro Photos Entertainment Video Business Alexa Opinion Covers Fashion Horoscopes Living Classifieds Newsletters amp; Feeds Email Newsletters RSS Feeds NYPost Store Home Delivery Subscribe Manage Subscription Preferences Help/Support Customer Service App FAQ amp; Help Contact Us Tips Newsroom Letters to the Editor Reprints Careers Apps iPhone App iPad App Android Phone Android Tablet Advertise Media Kit Contact Post Digital Network (c) 2016 NYP Holdings Inc. All Rights Reserved | Terms of Use | Privacy | Your Ad Choices News Corp. is a network of leading companies in the world of diversified media news and information services. News Corp HarperCollins Marketwatch realtor.com Dow Jones The Sun Storyful Wall Street Journal The Times Mansion Global New York Post The Australian Checkout51 News America Marketing News.com.au Unruly Send to Email Address Your Name Your Email Address Cancel Post was not sent - check your email addresses Email check failed please try again Sorry your blog cannot share posts by email. Copy Share URL Copy Link Sign Up / Sign In Sign In // Sign Up With your existing account from... With your existing account { loginWidget } Use an account with your email address Or with a NYPost.com account { userInformationForm } { traditionalSignIn_emailAddress } { traditionalSignIn_password } { traditionalSignIn_signInButton }{ traditionalSignIn_createButton } { /userInformationForm } Sign Up / Sign In Sign In // Sign Up Welcome back { welcomeName } { loginWidget } Or use NYPost.com account Sign Up / Sign In Sign In // Sign Up Welcome back Welcome back { welcomeName } { userInformationForm } { traditionalSignIn_emailAddress } { traditionalSignIn_password } { traditionalSignIn_signInButton } { /userInformationForm } Use an account with your email address Or use another account Almost Done Please confirm the information below before signing in. Please confirm the information below. { socialRegistrationForm } { socialRegistration_emailAddress } { socialRegistration_displayName } { socialRegistration_ageVerification } By clicking ""Sign In"" you confirm that you accept our terms of service and have read and understand privacy policy. { backButton } { socialRegistration_signInButton } { /socialRegistrationForm } Almost Done { registrationForm } { traditionalRegistration_emailAddress } { traditionalRegistration_password } { traditionalRegistration_passwordConfirm } { traditionalRegistration_displayName } { traditionalRegistration_captcha } { traditionalRegistration_ageVerification } By clicking ""Create account"" you confirm that you accept our terms of service and have read and understand our privacy policy. { backButton } { createAccountButton } { /registrationForm } Create a new password ForgotPassword? Dont worry it happens. Well send you a link to create a new password. { forgotPasswordForm } { traditionalSignIn_emailAddress } { backButton } { forgotPassword_sendButton } { /forgotPasswordForm } Create a new password Sent Weve sent an email with instructions to create a new password. Your existing password has not been changed. Weve sent an email with instructions to create a new password. Close Account Already Exists { mergeAccounts } { backButton } Sign in to complete account merge { tradAuthenticateMergeForm } { traditionalSignIn_emailAddress } { mergePassword } { traditionalSignIn_signInButton } { /tradAuthenticateMergeForm }",http://nypost.com/2005/06/17/perfect-ly-insipid/,200,theperfectman17,theperfectman,com/2005/06/17/perfect-ly-insipid/
The Perfect Man Movie Review amp; Film Summary (2005) | Roger Ebert,http://www.rogerebert.com/reviews/the-perfect-man-2005,200,theperfectman18,theperfectman,rogerebert
"USATODAY.com - The Perfect Man doesnt measure up Classifieds | | | Home News Travel Money Sports Life Tech Weather Movies Movies home Box office report DVD releases Music Music home Top albums Top singles Listen Up Music reviews TV TV home TV listings Nielsen ratings Reality Check Critics Corner Idol Chatter Books Books home Top 150 books Columnists Columnists home Robert Bianco Peter Johnson Whitney Matheson Alison Maxwell Craig Wilson Gaming Gaming home Arcade Crosswords Sudoku More Life People Media Mix Pop Candy Photo archive Talk Today Marketplace Real estate Arcade Music Tickets Shopping International Business Index Newspaper Classifieds Posted 6/16/2005 915 PM     Updated 6/16/2005 1055 PM Todays Top Life StoriesComedy fest names Colbert person of year - NaNNaN PMRedstone wants to mend ties with Cruise - NaNNaN PMElizabeth Hurley weds at British castle - NaNNaN PMComedy fest names Colbert person of year - NaNNaN PMEverett leads gay Mardi Gras in Sydney - NaNNaN PMAdd USATODAY.com RSS feeds Whats this? Click here to shop What are you shopping for?  Browse over 8 million products  Clothing amp; Jewelry  Computers amp; Electronics  Home amp; Garden  Kids amp; Family The Perfect Man doesnt measure upThe Perfect Man is so imperfect that it may qualify as one of the summers worst movies. The tagline to The Perfect Man is ""Dont settle."" It should have been ""Dont bother (watching this movie)."" Universal Its hard to say who is more insipid the overrated Hilary Duff or the lackluster Heather Locklear. Chris Noth plays a variation of his Mr. Big character from Sex and the City and seems to be going through the motions. But hes still the best thing about the movie. About the movie The Perfect Man  (out of four) Stars Heather Locklear Hilary Duff Chris Noth Director Mark Rosman Distributor Universal Pictures Running time 1 hour 36 minutes Rated PG for some mildly suggestive content Opens Friday nationwide To start the films premise is annoying Locklear plays Jean a single mom were supposed to believe is a good and caring parent. But shes so self-absorbed and obsessed with finding a man that she routinely hooks up with losers. When they inevitably break up she falls apart and drags her kids 16-year-old Holly (Duff) and 6-year-old Zoe (Aria Wallace) somewhere usually several states away. Locklears character scarcely realizes how painful this pattern is to her daughters. She even goes to a PTA meeting and instead of focusing on school issues brings up her need to find a good man under the guise of setting up ""mixers"" for single parents. We cringe right along with Holly as her mom makes her needs known. Holly -- possibly the most selfless teenager who ever lived -- wants desperately to persuade her mother to believe that she has a host of stellar qualities. Were not convinced. She pops out of her selfish bubble long enough to engage in the obligatory screen cliche the crazy dance montage with her daughters. Duffs Holly is more likable than her self-centered mom but shes hardly believable. After moving from a small town in Kansas to New York Holly decides to invent the coolest guy to woo her mom. Awww. Make that Ewwww. Wouldnt it be better if her mom did some soul-searching and stopped acting 16? Particularly when her own daughter has reached the same age? Hollys fictional perfect guy sends flowers and poetic e-mails. Surprise Her mother is smitten. Of course mayhem ensues as Holly struggles to keep up the charade. Noth plays Ben uncle of Hollys pal and a restaurateur who gives romantic guidance which Holly uses in her faux courtship. And -- what a shock -- its clear from the start that Ben and Jean are made for each other. The movies tagline is ""Dont settle."" Lets take that a step further Dont settle for such trite fare. Hold out for a movie worth your time and money. Newspaper Home Delivery - Subscribe Today USATODAY.com partners USA WEEKEND Sports Weekly Education Space.com Home Travel News Money Sports Life Tech Weather Resources Mobile news Site map FAQ Contact us E-mail news Jobs with us Internships Terms of service Privacy policy/Your California Privacy Right Advertise Press Room Media Lounge Electronic print edition Reprints and Permissions Add USATODAY.com RSS feeds The Nations Homepage Copyright 2008 USA TODAY a division of Gannett Co. Inc.",http://www.usatoday.com/life/movies/reviews/2005-06-16-the-perfect-man_x.htm,200,theperfectman19,theperfectman,usatoday
"Perfect Man not found here - latimes Advertisement YOU ARE HERE LAT Home-CollectionsMovies | CAPSULE REVIEWS Perfect Man not found hereJune 17 2005|Carina Chocano;Kevin Thomas In ""The Perfect Man"" the moon exists ""to remind us that each day has the potential for beauty."" This according to Jean (Heather Locklear) a fancy-cake baker and single mother of two who would be better off remembering that each day has the potential for medication. Jean is a serial monogamist with a penchant for losers. Every time one dumps her she picks up the family and moves. Spastic parenting calls for drastic measures so when newly installed in Brooklyn (where everyone sounds exactly like Fran Drescher) Jeans daughter Holly (Hilary Duff) smells another bad egg in the person of Lenny the Styx-loving baker (Mike OMalley) and decides to play e-Cyrano. Inventing a perfect man for Jean to fall for sight unseen she models him on her friends uncle Ben (Chris Noth) the kind of sexy warm restaurant owner who always has time for inquisitive 10th graders during the lunch rush. Holly gets so caught up writing Jean love e-mails in an effort to prevent her from marrying Lenny that she overlooks her own perfect boy Adam (Ben Feldman) a cute artist who lets Holly commandeer his computer for her e-charade. Then she spends each wistful night confiding it all to her online diary. Sure it all sounds like a stretch but Jean is just crazy enough for it to work -- the plan that is not the movie. The movie is a tortured marshmallow. Its too disingenuous for teens (at least the teens sitting behind me at the screening who kept howling ""Wheres the moooon?"") and too mommys-going-on-Match.com-again disturbing for younger viewers. Seriously the perfect man would call social services.-- Carina Chocano""The Perfect Man"" PG for some mildly suggestive content. It suggests that mom gets around. 1 hour 40 minutes. In general release.Unrefined mystery afflicts an oil crisisSet in the near future during an oil crisis ""The Deal"" is timely and concludes on a bitter note of irony but it could have used a rigorous rewrite. The film might have worked as a taut topical corporate intrigue thriller; instead for all its ambition its just a routine mystery despite a solid performance by Christian Slater.Slaters Tom Hanson is a dynamic but principled rising star at Wall Street investment bank Delaney amp; Strong. For three years the U.S. has been at war with the Confederation of Arab States which has driven the price of gasoline up to 6 a gallon and wreaked havoc on the U.S. economy. Jared Tolson (Robert Loggia) chief executive officer at Condor Oil amp; Gas approaches Tom to handle a deal for a 20-billion merger with a Russian oil company.When Tom starts doing his homework he places himself in great danger but it actually doesnt start affecting him personally until a long-winded 45 minutes into the film.In a distractingly elaborate setup for a love interest for Tom the films heroine Abbey (Selma Blair) is a dedicated environmentalist and Tom has come up with a scheme to persuade corporations in need of tax credits to invest in companies sensitive to the environment. There is way too much going on in Ruth Epsteins script which leaves director Harvey Kahn plowing through it as best he can. With Colm Feore John Heard.-- Kevin Thomas""The Deal"" R for language and some violence. Complex adult themes. Running time 1 hour 47 minutes. Exclusively at the Beverly Center Cineplex 8522 Beverly Blvd. (310) 652-7760; and the University 6 Campus Drive and Stanford opposite UCI Irvine (800) FANDANGO 143.Kid holds English drama captiveWritten by Alison Hume and directed by Gillies MacKinnon ""Pure"" is an alternately sentimental and brutal tale of a 10-year-old boy (Harry Eden) struggling to rescue his widowed mother (Molly Parker) from heroin addiction. This is a conventional well-acted English working-class drama in the familiar realist style but it does not attain anywhere near the level of artistry and imagination of a Ken Loach film. Although deeply felt on the part of its makers ""Pure"" is manipulative on the one hand and at times defies credibility on the other. Nonetheless Eden who holds the film together by his winning presence and doughty performance effectively conveys the effect of severe challenges that no child should ever have to face. With David Wenham Geraldine McEwan Karl Johnson Vinni Hunter and Keira Knightley.-- K.T.""Pure"" Unrated. Heavy drug use occasional strong violence. Entirely unsuitable for children. Running time 1 hour 36 minutes. Exclusively at Laemmles Fairfax Cinemas 7907 Beverly Blvd. L.A. (323) 655-4010. MORESeizure Led to FloJos DeathHis 104 scores make his caseRestaurant review South Beverly GrillBrutal Murder by Teen-Age Girls Adds to Britons ShockComaneci Confirms Suicide Attempt Magazine SaysAdvertisement FROM THE ARCHIVESGuilty Plea in Movie Piracy CaseSeptember 28 2005Man Is Charged Under New U.S. Film Piracy LawAugust 5 2005Howard Dean the Right Man for the DemocratsFebruary 7 2005Copyright 2016 Los Angeles TimesTerms of Service|Privacy Policy|Index by Date|Index by Keyword",http://articles.latimes.com/2005/jun/17/entertainment/et-capsules17,200,theperfectman20,theperfectman,latimes
Movies | GuideLive Connect with Us Twitter Facebook Instagram RSS Get in Touch Submit a Listing Tip Line About Us DallasNews.com Search Search Submit Your Search Whatas Hot Fun Places and Events Holidays Movies Food and Drink TV Geek Find Something to Do Things To Do Eats Beats Drinks I Feel Like... I Feel Like... Doing Something Eating Listening to Music Drinking Like What? Anything for a Laugh Festive/Holiday with the Family with Food and Drink with Film and Movies Active Artsy Music Free Editors Picks at places Where? Anywhere Near Me in Addison in Allen/Fairview in the Arts District in Bishop Arts in Deep Ellum in Downtown Dallas in the Design District in East Dallas/Lakewood in Frisco in Knox/Henderson in Lower Greenville in McKinney in Oak Cliff/South Dallas in Oak Lawn in Plano in Richardson/Lake Highlands in Uptown in Victory Park in West Dallas/Trinity Groves in the West End sometime When? Anytime Today This Weekend Next 7 Days Next 30 Days What Kind of Food? Anything American Upscale Asian Barbecue Burgers European Mediterranean Mexican amp; Tex-Mex Pizza Seafood Steakhouse Vegetarian/Organic at places Where? Anywhere Near Me in Addison in Allen/Fairview in the Arts District in Bishop Arts in Deep Ellum in Downtown Dallas in the Design District in East Dallas/Lakewood in Frisco in Knox/Henderson in Lower Greenville in McKinney in Oak Cliff/South Dallas in Oak Lawn in Plano in Richardson/Lake Highlands in Uptown in Victory Park in West Dallas/Trinity Groves in the West End with a wallet thats How Full? I Dont Care YOLO () Full () Lacking Funds () Empty () with other perks including What Options? Im Good Thanks Brunch Delivery Outdoor Seating Pet Friendly to the beat of What Kind of Music? Anything Alt-Country/Americana Alternative/Indie Bluegrass Blues Country Cover/Tribute Bands Electronic/EDM Folk Jazz Latin Metal Pop Punk Rap/Hip-Hop Ramp;B/Soul Rock Singer/Songwriter at places Where? Anywhere Near Me in Addison in Allen/Fairview in the Arts District in Bishop Arts in Deep Ellum in Downtown Dallas in the Design District in East Dallas/Lakewood in Frisco in Knox/Henderson in Lower Greenville in McKinney in Oak Cliff/South Dallas in Oak Lawn in Plano in Richardson/Lake Highlands in Uptown in Victory Park in West Dallas/Trinity Groves in the West End sometime When? Anytime Today This Weekend Next 7 Days Next 30 Days at places Where? Anywhere Near Me in Addison in Allen/Fairview in the Arts District in Bishop Arts in Deep Ellum in Downtown Dallas in the Design District in East Dallas/Lakewood in Frisco in Knox/Henderson in Lower Greenville in McKinney in Oak Cliff/South Dallas in Oak Lawn in Plano in Richardson/Lake Highlands in Uptown in Victory Park in West Dallas/Trinity Groves in the West End on When? Any Day Today Sunday Monday Tuesday Wednesday Thursday Friday Saturday around Anytime Brunch Lunch Happy Hour Dinner Late Night with a glass of What Kind Of Drink? Anything Beer Wine Mixed Letas Do This What Do You Feel Like? Doing Something Eating Listening To Music Drinking Like What? Anything for a Laugh Festive/Holiday with the Family with Food and Drink with Film and Movies Active Artsy Music Free Where? Quick Choices Anywhere Near Me or Enter Your Location Use This Location Districts in the Arts District in Bishop Arts in the Design District in Victory Park in West Dallas/Trinity Groves in the West End Neighborhoods in Addison in Allen/Fairview in Deep Ellum in Downtown Dallas in East Dallas/Lakewood in Frisco in Knox/Henderson in Lower Greenville in McKinney in Oak Cliff/South Dallas in Oak Lawn in Plano in Richardson/Lake Highlands in Uptown When? Quick Choices Anytime Today This Weekend Next 7 Days Next 30 Days From To Select Date Movies Now Playing Jason Bourne PG-13 2 hrs 3 mins View Showtimes Bad Moms R 1 hr 41 mins View Showtimes Nerve PG-13 1 hr 36 mins View Showtimes Star Trek Beyond PG-13 2 hrs 2 mins View Showtimes Ice Age Collision Course PG 1 hr 34 mins View Showtimes Ghostbusters PG-13 1 hr 57 mins View Showtimes See All Movies Find A Theater Whats Happening in Movies Were Obsessed with Movies Chris Vognar chrisvognar cvognardallasnews.com A blast of Medium Cool brings usA back to a more eventful Democratic Convention Jul. 28 2016 1045am Close Sharing really is caring... Close Join the conversation... With Chris Vognar Share This Story Share Discuss Were Obsessed with Movies Britton Peele BrittonPeele bpeeledallasnews.com The original Star Wars trilogy is coming back to a Dallas theater Jul. 27 2016 131pm Close Sharing really is caring... Close Join the conversation... On Facebook On Twitter With Britton Peele Comment on one of our official threads. Share This Story Share Discuss Were Obsessed with Movies Chris Vognar chrisvognar cvognardallasnews.com Why the Jason Bourne movies are still perfect for our scary unstable world Jul. 27 2016 1253pm Close Sharing really is caring... Close Join the conversation... With Chris Vognar Share This Story Share Discuss Were Obsessed with Festivals GuideLive Staff guidelivegroupdallasnews.com Dentons Thin Line festival will be free in 2017 Jul. 27 2016 1057am Close Sharing really is caring... Close Join the conversation... With GuideLive Staff Share This Story Share Discuss Were Obsessed with Star Wars Chase Karacostas chasekaracostas ckaracostasdallasnews.com The Force Awakens showing at Texas Motor Speedway to benefit childrens charities Jul. 27 2016 1030am Close Sharing really is caring... Close Join the conversation... With Chase Karacostas Share This Story Share Discuss Were Obsessed with Movies Nicholas Friedman NMFreed nicholas.friedman1gmail.com Marvel teases Black Panther Spider-Man and more casts Captain Marvel at Comic Con Jul. 24 2016 1101am Close Sharing really is caring... Close Join the conversation... With Nicholas Friedman Share This Story Share Discuss Hey lets be BFFs Get Our Newsletters Yes Sign me up for the GuideLive Newsletter Our Greatest Movies Hits Were Obsessed with Geek Heres a detailed list of upcoming superhero comic book movies between now and 2020 Were Obsessed with Movies 10 movies you might not know were filmed in Dallas Were Obsessed with Movies The Oscars boycott is a symptom of Hollywood inequities Were Obsessed with Movies On Tarantino The Hateful Eight and the misogyny accusations Thats all Folks See what else is hot Fun Places and Events Holidays Movies Food and Drink TV Geek Drop us a hint or tip Give us feedback Submit a listing About Us Privacy Policy Terms of Service Brought to you by DallasNews.com (c)2016 The Dallas Morning News Inc. All Rights Reserved. Powered by the Parse.ly Publisher Platform (P3).,http://www.guidelive.com/pls/portal/url/page/LSDallasPageGroup/MovieDetail?item_id=33198,200,theperfectman21,theperfectman,guidelive
