review,link,status_code,id,movie_key,critic
"Goody-two-shoe fluff | Entertainment | nwitimes.com x We hope you have enjoyed your complimentary access for the month. Already a subscriber? Click on the button below to set up your account or log in if you already have one. Want to become a subscriber? Purchase a digital-only subscription now for unlimited online access to local news and information. Digital-only Access Unlimited Access to nwitimes.com mobile web and mobile apps e-replica edition of printed newspaper Digital-only access only 10.00/mo Current Subscriber? Set up your account Log In Current Subscriber? Set up Account You are the owner of this article. Edit Article Add New Article Sign Up Log In Dashboard Logout My Account Dashboard Profile Saved items Logout Subscribe Customer Service Calendar Home News Latest Updates Lake County News Porter County News LaPorte County News State and Regional News South Suburban News National News World News Government and Politics Crime News History E-Edition Sports NWI Preps Columnists Business Northwest Indiana Business Headlines Jobs and Employment Transportation News Healthcare News Business Columnists Opinion Letters to the Editor NWI.com Blogs Editorials Forum Columnists Entertainment Comics Games Horoscopes Northwest Indiana Calendar Lifestyles Inspired Living Health amp; Fitness Food and Cooking Home and Garden Celebrations Photos Buy Photos Obituaries Area Deaths/Tributes Cars Jobs Homes For Sale Ads Rental Ads Rental Showcase Buy amp; Sell Classifieds Buy Local Deals Business Directory Coupons Newspaper Ads Buy Photos Weekly Ads Contact Us Customer Service Toggle navigation Menu Search Search Log In Using Your Account Log In Dont have an account? Sign Up Today My Account Dashboard Profile Saved items Logout 76deg Munster IN (46321) Today Cloudy. Tonight Some clouds. Low 63F. Winds N at 5 to 10 mph. Updated July 30 2016  355 pm Full Forecast News Sports Business Photos Obits Buy amp; Sell Goody-two-shoe fluff The Perfect Man proves only slightly better than A Cinderella Story DAVID GERMAINAP Movie Writer Jun 17 2005 Finding the perfect man for Heather Locklear has always been a problem. Her husband and the boys from ""Waynes World"" aside what man in his right mind would give her a second glance? Come on show of hands. Lets see every American male between 12 and 112 whos not on a respirator? OK we stand corrected. Locklears stunning looks and winsome personality remain in full bloom in ""The Perfect Man"" though the filmmakers try to dull her down a bit by making her a single mom working in a bakery who has some desperate emotional bent for hooking up with losers. Even so the woman you see on screen should have men lined up around the block. Thats the first fatal flaw to ""The Perfect Man"" starring Hilary Duff as Locklears teenage daughter who tries to salve her moms romantic pangs by creating an ideal -- but fictional -- beau. The second fatal flaw The movie is a toxic buzz of sweetness that Duffs teen gal fans might lap up while all others suffer through a prolonged sugar fit. Director Mark Rosman delivers a marginally better movie than last years ""A Cinderella Story"" the lousy teen fairy tale in which he also directed Duff. Her young fans made that movie a modest success and ""The Perfect Man"" presents more of the same goody-goody Duff shenanigans for them to savor. Duffs Holly Hamilton her typical angelically mischievous high schooler is tired of the endless uprooting each time her mom Jean (Locklear) moves the family after bad breakups with men. When the latest jerk dumps her Jean relocates with Holly and her younger daughter Zoe (Aria Wallace) to New York City where they find an oddly spacious and charming apartment on a lowly bakers salary. But then no one expects a Hilary Duff flick to take on the financial dilemmas of single parenthood. In New York Holly begins a little romantic dance with hunky classmate Adam (Ben Feldman) and makes instant friends with another student Amy (Vanessa Lengies) who becomes Ethel to Duffs Lucy as Holly schemes to make her mom stay put for once. Hollys worried because Jean has begun another dicey relationship with co-worker Lenny (Mike OMalley) a devotee of the rock band Styx whos a nice guy but in Hollys view the latest in a string of men bound to break her mothers heart. To push Lenny aside and keep Jeans lovesick blues at bay Holly creates the perfect suitor based on Amys uncle classy restaurateur Ben (Chris Noth). Fictional Ben sweeps Jean off her feet with flowers e-mails and online chatroom heart-to-hearts. The proverbial rocket-science degree is not necessary to figure out who the real perfect man for Jean might be. Screenwriter Gina Wendkos (""The Princess Diaries"") piles on the Duff fluff the movie essentially a series of gags and scenarios that range from implausible to outlandish. The saccharine is thickly and sickly applied reaching a gag-reflex zenith with a nauseating mother-daughter dance montage in the Hamiltons living room. Teen crowds will find Duff and her new playpals as cute as ever but the grown-ups are the strong suit in ""The Perfect Man."" Locklear and Noth are fetching and funny separately and while they share only a few moments on screen they show a hint of chemistry that makes you wish for more. Now that the teens have their sugar fix someone should do the adults a favor and come up with a smart romantic comedy starring Locklear and Noth. Lets say a love story between a couple of divorcees. Neither with kids. onscreen ""The Perfect Man"" Grade C Starring Heather Locklear Hilary Duff Aria Wallace Ben Feldman Vanessa Lengies Mike OMalley Chris Noth Director Mark Rosman Rated PG for some mildly suggestive content Latest in section Game of Thrones to end after season 8 but 7th still ahead Game of Thrones to end after season 8 but 7th still ahead Kelly Ripa not saying who shed like as new Live co-host Outrage caution from Latino stars in critical election year Congo musician accused of assault is provisionally released Movie Showtimes | PrettyFamous Most Popular on nwi.com Fired prosecutor said she did not intend any wrongdoing UPDATE Gary infant didnt have body fat when he died Retired Hammond firefighter dies in boating accident Dozens of alleged Latin Kings members indicted West Calumet residents advised to relocate because of lead Currents Northwest Indiana Real Estate Listings Project Lab Quick and easy tool board pencil holder +26 National Sports Photo Galleries Gallery White Sox blank Cubs for 4th straight win National News DNC viewers guide Tuesdays roll call says it all Todays top pics DEM Convention comes to close and more Dog missing nearly 7 years reunited with family in Texas Your daily 6 Somber stop at Auschwitz cop killed in San Diego and Hillarys history Today In History July 29 Adolf Hitler Hues Turn coach Jackson determined to rebuild bad Browns Australias Penny Taylor set to retire at end of WNBA season Saints Payton wary of wearing players out at training camp Athletes in Rio Olympics refugee team luckier than many 146 Ndn AP video Despite wins in Wisconsin road to nomination still steep for Ted Cruz Bernie Sanders 205 Ndn AP video Young refugees in US inspired by Olympics 201 Ndn AP video Homeless New York City sisters head to Junior Olympics 046 News Raw video People flee Germany mall shooting Find local businesses View local offers Local Businesses Alberts Diamond Jewelers 711 Main St Schererville IN 46375 45th Street Tattoo 1817 West Glen Park Avenue Griffith IN 46319 Bamp;E Recreation 1006 US Highway 30 Valparaiso IN 46383 Christenson Chevrolet Inc 9700 Indianapolis Blvd Highland IN 46322 Business Directory Latest Local Offers One Guy With Tools Call One Guy With Tools to learn all about our Home Protection Inspection Plan Updated Jul 27 2016 Stevenson and Fairchild OMS Stevenson amp; Fairchild OMS uses the most advanced technology to ensure excellence of diagnostics and treatment. Contact us at our one of our two locations; Valparaiso or Merrillville. Updated Jul 27 2016 Home Sweet Home Cleaning Let us take care of you weekly and bi-weekly needs at Home Sweet Home Cleaning Service Updated Jul 27 2016 Lawn Doctor of West Lake County You Can Have the Best Lawn On the Block. Call Lawn Doctor of West Lake County Today for a FREE On Site Evaluation Today 219-364-6300 Updated Jul 27 2016 E-edition Inspired Living Get Healthy Your Family Featured Sections Best of the Region Buy Local Deals Regional Crime Report CrimeTimes Northwest Indiana Calendar Contact The Times About Us Subscribe Manage Your Subscription Send a News Tip Newspapers In Education Donation Request Work At The Times RSS Feeds E-newsletter Sign-Up",http://www.nwitimes.com/entertainment/goody-two-shoe-fluff/article_620a782f-7d68-5b4b-a6cb-25abb1f30dcf.html,200,theperfectman0,theperfectman,nwitimes
The Perfect Man | Chicago Reader Switch to the mobile version of this page. Newsletters Follow us Twitter Facebook RSS Mobile Username View Profile Edit Profile Log Out Log in Create Account The Chicago Reader News amp; Politics Music Arts amp; Culture Film Food amp; Drink Classifieds Browse News amp; Politics News amp; Politics home page Steve Bogira | Criminal Justice John Greenfield | Transportation Deanna Isaacs | Culture Ben Joravsky | Politics Michael Miner | Media Browse Music Music home page Gossip Wolf In Rotation Record roundups Leor Galil | Music Criticism Peter Margasak | Music Criticism Soundboard Concerts this week Early Warnings Concerts on horizon Browse Film Film home page J.R. Jones | Movie Reviews Index of Long Reviews Film Archive Short Reviews Now Playing Todays Showtimes Browse Arts amp; Culture Arts amp; Culture home page Tony Adler | Theater Justin Hayford | Theater Aimee Levitt | Features Brianna Wellen | Comedy Arts amp; Culture event search Browse Food amp; Drink Food amp; Drink home page Mike Sula | Restaurant Reviews Key Ingredient A chef-to-chef challenge Cocktail Challenge Bar Guide Restaurant search Browse The Bleader The Bleader blog home page Browse Classifieds Classifieds home page Real Estate Rentals Announcements Services Jobs (Monster) Place ad ad Best of Chicago Summer Guide Savage Love Straight Dope Agenda Events Locations Issues Article Archives Fun amp; Free You searched for [X]The Perfect Man Start over Search for... Browse movie times Narrow Search Author Select an author Andrea Gronvall Michael Atkinson Pat Aufderheide Zbigniew Banas Barbara Scharres Angelica Jade Bastien Bill Stamets Bob Mehr Brian Thomas Peter Brunette Dave Canfield Cara Jepsen Carol Burbank Cheryl Ross Pat Chesnut Luca Cimarusti Patrick Dahl Tyler Daswick Dave Kehr Cliff Doerksen Dominick Suzanne-Mayer Don Druker Mick Dumke Marilyn Ferdinand Fred Camper Patrick Friel Chris Fujiwara Leor Galil Hank Sartin Justin Hayford Jack Helbig Henry Sheehan Tanner Howard Drew Hunt J. R. Jones J.R. Jones Jennifer Vanasco Jessica Hopper Jim Healy Jonathan Rosenbaum Joshua Katzman Josh Katzman Anthony Kaufman Kelly Kleiman Asher Klein Shelley Kraicer Shelly Kraicer Nathalie Lagerfeld Adam Langer Lawrence Bommer Lisa Alspector Eric Lutz Peter Margasak Mark Jenkins Martha Bayne Adrian Martin Tom McCormack Meredith Brody Sergio Mims Michael Miner Laura Molzahn Monica Kendrick Adam Morgan Noel Murray Noah Berlatsky Pat Graham Patrick McGavin Patrick Z. McGavin Gerald Peary Richard Pena Mark Peranson Peter Keough Leah Pickett Richard M. Porton Laura Power Quintin Miles Raymer Reece Pendleton Berenice Reynaud Ronnie Scheib Tal Rosenberg Joshua Rothkopf Joshua H. Rothkopf Martin Rubin Ryan Wenzel Ben Sachs Dan Sallitt Dmitry Samarov Ronnie Schieb David Schwartz David P. Schwartz Scott Pfeiffer Ian Simmons Alissa Simon Michael Glover Smith Patrick Somerville Laura Stempel Steve Erickson David Stewart Gwynedd Stuart Mike Sula Ted Shen Julia Thiel Ignatiy Vishnevetsky Kevin Warwick Jessica Weisberg Brianna Wellen Joel Wicklund Albert Williams Michael Wilmington Sam Worley Rating G PG PG-13 R NC-17 X NR Show only Staff Pick Staff Pick Critics Choice Critics Choice Recommended Recommended New New Agenda Agenda Free Free Slideshow Slideshow Video Video Watch on Amazon Watch on Amazon Watch on Netflix Watch on Netflix Watch on Hulu Watch on Hulu Watch on YouTube Watch on YouTube Member Picks Member Picks Other Searches Events Location Guide Member Search Movie Showtimes Movie Reviews Article Archives Issue Archives Slideshows Comments Videos Images Sorting by Name Release Date Film Search Tweet Tools Email Print Share Digg Newsvine del.icio.us Facebook Reddit Twitter Windy Citizen Add to Custom List Loading... Comments The Perfect Man Wholesome Hilary Duff has a problem her knockout single mother (Heather Locklear) keeps getting dumped and dragging her kids to a new town in search of romance. So to forestall another such move Duff plays matchmaker between mom and handsome Chris Noth. The premise is patently ridiculous but the target audience of 12-year-old girls will be too charmed by the genre requisites to care. These include a soft-rock sound track a cute boy who draws and comic relief from a limp-wristed gay waiter named Lance (Carson Kressley of Queer Eye for the Straight Guy). Mark Rosman directed a script by Gina Wendkos (The Princess Diaries). PG 100 min. By J.R. Jones Now Playing Sorry there are no upcoming showtimes for The Perfect Man Reviews/comments Subscribe to this thread By Email Subscribing... With RSS Comment Add a review Rating Roll over stars and click to rate. Subscribe to this thread Terms of UsePrivacy PolicySubmission GuidelinesAbout The ReaderStaffReader CareersContact UsFreelancing InfoAdvertisingBack IssuesReprints Copyright (c) 2016 Sun-Times Media LLC. Powered by Foundation,http://onfilm.chicagoreader.com/movies/capsules/28150_PERFECT_MAN,200,theperfectman1,theperfectman,chicagoreader
The Perfect Man (2005) directed by Mark Rosman | Film review Go to the content Go to the footer Time Out London London Popular cities London New York Paris Chicago Los Angeles Browse all cities Time Out London Close London Change city London Popular cities London New York Paris Chicago Los Angeles Browse all cities Tickets Offers Things to Do Restaurants Bars amp; Pubs Film Theatre Art Music Attractions Blog Theatre Tickets Shopping Offer of the Day Time Out Card Time Out Escapes Time Out Live Hotels Nightlife Music festivals Events amp; Festivals Kids Museums Clubs Comedy Food amp; Drink Classical Music amp; Opera Dance LGBT City Guide Area Guides Property Competitions Dating Close My Time Out Things I love My lists My Profile My Account Sign out Sign in Create account Sign in With your social account Or with your email Email Password Remember me Forgotten your password? Sign in You can create a Time Out account in two ways... With a few clicks using your favourite social network Or by entering your details below Email First Name Last Name Create password Repeat new password I accept Time Outs terms of use including opt-in to newsletters. Create account Welcome  You have successfully connected your account to Time Out. You may sign in with this account in future. Please confirm your account details Email First Name Last Name I accept Time Outs terms of use including opt-in to newsletters. Sign up My Account Sign in or Create account Search Tickets Offers Things to Do Restaurants Bars amp; Pubs Film Theatre Art Music Attractions Blog Theatre Tickets Shopping Offer of the Day Time Out Card Time Out Escapes Time Out Live Hotels Nightlife Music festivals Events amp; Festivals Kids Museums Clubs Comedy Food amp; Drink Classical Music amp; Opera Dance LGBT City Guide Area Guides Property Competitions Dating More Search The Perfect Man Film Add review 0 Love It Save it 0 Add review 0 Love It Save it Time Out says Details Users say Time Out says Fed up with moving home every time her mother Jean (Heather Locklear) splits up with another boyfriend teenager Holly (Hilary Duff) takes matters into her own hands by posing via email as a handsome admirer. She hopes that a captivated Jean will stay away from unsuitable men - but no-hopers still come a-knocking and Holly has to step up her game. She draws inspiration from her friends uncle Ben (Chris Noth) by grilling him on romance and composes saccharine emails designed to make poor insecure Jean feel loved - never mind that a bright pleasant woman who looks like Heather Locklear could have bagged a millionaire with a heart of gold by now. One supposes that the prospect of Jean and Bens eventual meeting is designed to create tension but Hollys attempts to prevent this from happening (as it would expose her deception) merely irritate. Unfunny set-pieces are punctuated by quasi-romantic interludes as Ben spouts cliches and Holly ignores the perfect man right under her nose. None of the leads convince or engage and supporting characters are either gay stereotypes routine little sisters or functional best friends. Rather than a romantic comedy this prim PG is a saccharine family drama which overpowers any prospect of genuine sweetness with its dull deceitful characters. And lets face it there was never anything particularly appealing about a girl trying to seduce her own mother in the first place. By AS Posted Tuesday August 16 2005 Details Release details Rated PG Release date Friday August 19 2005 Duration 0 mins Cast and crew Director Mark Rosman Screenwriter Gina Wendkos Cast Hilary DuffHeather LocklearChris NothMichael OMalleyBen FeldmanAria Wallace Users say LiveReviews|01 person listeningSign inWrite reviewMost helpfulMost helpfulHighest ratingLowest ratingNewestOldestLoadingundefinedNew CommentsRefreshShow More Share Tweet 0 Shares Top About us Work for Time Out Privacy policy Cookie Policy Website terms of use Contact us Time Out for business Get listed Claim your listing Premium Profiles Advertising Time Out products Time Out Card Mobile apps Time Out Shop Time Out Guides Time Out Travel Time Out Offers Time Out Worldwide Time Out magazine Where to get Time Out magazine Subscribe to Time Out magazine Manage my subscription Follow us Facebook Twitter Youtube Instagram Pinterest Spotify Time Out London Site map },http://www.timeout.com/film/82948.html,200,theperfectman2,theperfectman,timeout
