review,link,status_code,id,movie_key,critic
"Chainsaw prequel is a cut below - The Boston Globe Movies    Restaurants    Food    Calendar    Music    Theater/Arts    TV    Books    Celebrity news    Games Home gt; Aamp;E gt; Movies MOVIE REVIEW Chainsaw prequel is a cut below By Rocco Colella Globe Correspondent  |  October 7 2006 Poor Leatherface.He never quite made it into the top tier of slasher-movie killers ( Jason Freddy and Michael ) so it doesnt come as a surprise when we see him angrily hack up beef in the local slaughterhouse. And especially not when we see him driving a chainsaw clean through the pretty boy hes always wanted to be.The new prequel ``The Texas Chainsaw Massacre The Beginning"" isnt really a slasher movie at all. Its a mess with too much to say and an odd genre in which to preach . Strange pro-war sentiments are prevalent throughout. Its 1969 and the world is divided by the conflict in Vietnam. So are two brothers Dean and Eric. Dean (Taylor Handley) wants to dodge the draft and head to Mexico with his girlfriend while Eric (Matthew Bomer) is proud to go back to fight overseas as his girlfriend shrugs .Erics girlfriend is played by Jordana Brewster the films biggest name. Shes so static that when she runs through a glass window during a climactic scene it seems way out of character.While intended to be a prequel to the remake this is basically a remake of the remake. Director Jonathan Liebesman relies too much on cringe-inducing gore. Those who stomached Eli Roths ``Hostel"" have already watched unnecessary surgery performed without anesthesia. Even ``Nip/Tuck"" has shown ickier facial removals. (c) Copyright 2006 Globe Newspaper Company. More Globe Living/Arts stories | Aamp;E section | Latest entertainment news | Globe front page | Boston.com Sign up for Globe Headlines e-mail | Breaking News Alerts Advertisement SEARCH THE ARCHIVES Today (free) Yesterday (free) Past 30 days Last 12 months Advanced search / Historic Archives Advertisement Printer friendly E-mail to a friend Movies RSS feed Available RSS feeds Most e-mailed Reprints amp; Licensing Share on Facebook Save this article powered by Del.icio.us feedback form | help | site index | globe archives | rss (c) 20 The New York Times Company",http://www.boston.com/ae/movies/articles/2006/10/07/chainsaw_prequel_is_a_cut_below,200,thetexaschainsawmassacrethebeginning0,thetexaschainsawmassacrethebeginning,boston
"Page not found | www.accessatlanta.com Our ProductsAJC JobsContact UsNewsSportsNeighborhoodLifeThings to DoMoreBlogsAJC ClassifiedsGa LotteryHoroscopesTrafficDoctors amp; Sex Abuse All News 2016 Election Atlanta News Nation amp; World Business Technology Politics Crime Education Offbeat News News Video Atlanta Weather News BlogsAJC InvestigationsPolitical InsiderGet SchooledAll News BlogsIn the NewsAtlanta Watering RestrictionsTraffic Construction AlertGa. Public School RatingsAtlanta Gas Prices All Sports Atlanta Braves Atlanta Falcons Hawks High Schools Georgia Tech Georgia State Kennesaw State UGA / DawgNation SEC / SECCountry Sports Video Sports BlogsRecruiting BlogAtlanta FalconsAtlanta HawksAll Sports BlogsIn the NewsSports ScoresGolfNASCARAJC Peachtree Road Race All Neighborhood Newcomer Guide Buckhead Buford Decatur Gwinnett County Intown Atlanta Marietta Roswell Sandy Springs Smyrna Peachtree City County NewsClayton CountyCobb CountyDeKalb CountyGwinnett CountyIn the NewsAtlanta Summer CampsLiving NorthsideLiving IntownEvents Near Me All Life Celebrities Home amp; Garden Weddings amp;... Health Travel Parenting Music Home Design Ideas Food amp; Drink Movies amp; TV Arts amp; Culture Life BlogsBest of AtlantaAtlanta RestaurantsAtlanta ShoppingAll Entertainment BlogsIn the NewsBest of AtlantaGamesAJC Peachtree Road Race All Things to Do Events in Atlanta Best of Atlanta Summer Camps Movie Showtimes Radio amp; TV Arts amp; Culture Music Food amp; Drink Shopping Latest Video Games BlogsAtlanta RestaurantsMusic SceneArts amp; CultureAll Entertainment BlogsIn the NewsUpcoming MoviesLiving Intown BeltLineHoroscopes All More Newsletters AJC Customer Care Contact the AJC Games AJC Cars AJC Jobs Shop Obituaries Homefinder Kudzu Todays BuzzBuzz BlogRadio amp; TV TalkNews to MeInside AJCMovie TheatersAtlantas Top WorkplacesFind a Garage Sale All Blogs The Biz Beat Georgia Tech High School Jeff Schultz Mark Bradley Political Insider Radio amp; TV Talk The Buzz Get Schooled Take a BreakPlay a GameHoroscopesWeekend CalendarEvents near youIn the newsHow Atlanta Loses WeightKudzuGa Lottery All AJC Classifieds AJC Pets AJC Cars Homes for Sale AJC Jobs All Ga Lottery All Horoscopes All Traffic All Doctors amp; Sex Abuse State-by-State For Patients Explore the Project About the Project Doctors Investigation ArticlesBroken SystemWhich Doctors AbuseHow Many Cases?One Repeat OffenderVulnerable PatientsDoctors ExcusesUndercover Agent Nabs DocPediatrician AccusedSubscribe nowAs low as 99C/SubscribeLog InYour AccountNewslettersLog Out COMMENTS0 SHORTCUTS Homefinder Atlanta Jobs Find Your Car Classifieds Obituaries Family-placed Notices Contact Us/Subscribe Customer Care Advertise With Us Digital Products Shortcuts Homefinder Atlanta Jobs Find Your Car Full Site IndexVisitor AgreementPrivacy PolicyContact UsFollow usTopCLOSESECTIONSnewssportslifeneighborhoodsshopthings to doSHORTCUTSajc obituariesfamily-placed noticesclassifiedshomefinderatlanta jobsfind your carmanage your profilecontact uscustomer careadvertise with usdigital productsPARTNERSfind amp; save couponskudzusavings.comvalpakmyajcFUNgame centerMEMBER CENTERsign inmanage your profileUTILITIESarchivesweathertrafficsitemapLEARN ABOUT AJC.COMtake a tourFOLLOW USfacebooktwitterinstagramyoutubepinterestPRODUCTS SUBSCRIBEFOLLOW US (c) 2016 Cox Media Group. By using this website you accept the terms of our Visitor Agreement and Privacy Policy and understand your options regarding Ad Choices. Learn about careers at Cox Media Group. <a href=""http//www.omniture.com"" title=""Web Analytics""></a><a href=""http//www.qualtrics.com/enterprise-feedback-management"">Enterprise Feedback Management</a><a href=""http//www.qualtrics.com/survey-software"">Survey Software</a>x Report Cheddars employee with loud weed in restroom bumps into cop Deadly hot air balloon crash in Texas What we know now Mystery mower carves Trumps name into Texas lawn Walmart store in Oklahoma keeping cops busy Small Loans Make Up Greatest Share Of Student Debt Staycations 101 The page could not be foundWere sorry the page you requested could not be found. It is possible that the address is incorrect or that the page no longer exists.To look further you can enter a search term in the box belowSearch More from ajc.com Topics AllNewsSportsNeighborhoodLifeThings to DoMoreBlogsAJC ClassifiedsGa LotteryHoroscopesTrafficDoctors amp; Sex AbuseNation Report Cheddars employee with loud weed in restroom bumps into cop Nation Deadly hot air balloon crash in Texas What we know now Politics Mystery mower carves Trumps name into Texas lawn Crime Walmart store in Oklahoma keeping cops busy Business Small Loans Make Up Greatest Share Of Student Debt Business Staycations 101 Sign InORSign in using your accessAtlanta profileNeed a Profile? Register Now. { userInformationForm } EMAIL { traditionalSignIn_emailAddress } PASSWORDForgot your password? { traditionalSignIn_password } { traditionalSignIn_signInButton } { /userInformationForm } Sign in using your existing account { loginWidget } Sign InORSign in using your accessAtlanta profileNeed a Profile? Register Now. { userInformationForm } EMAIL { traditionalSignIn_emailAddress } PASSWORDForgot your password? { traditionalSignIn_password } { traditionalSignIn_signInButton } { /userInformationForm } Sign in using your existing account { loginWidget } Sign InORSign in using your accessAtlanta profileNeed a Profile? Register Now. { userInformationForm } EMAIL { traditionalSignIn_emailAddress } PASSWORDForgot your password? { traditionalSignIn_password } { traditionalSignIn_signInButton } { /userInformationForm } Sign in using your existing account { loginWidget } Youre Almost DonePlease confirm the information below before signing in.Required { socialRegistrationForm } { socialRegistration_displayName } { socialRegistration_emailAddress } By submitting your registration information you agree to our Visitor Agreement and Privacy Policy. { socialRegistration_signInButton } { /socialRegistrationForm } RegisterRequired { registrationForm } { traditionalRegistration_emailAddress } { traditionalRegistration_password } { traditionalRegistration_passwordConfirm } { traditionalRegistration_displayName } By submitting your registration information you agree to our Visitor Agreement and Privacy Policy. { createAccountButton } { /registrationForm } Create a New AccountRequired { registrationFormBlank } { traditionalRegistration_emailAddressBlank } { traditionalRegistration_passwordBlank } { traditionalRegistration_passwordConfirmBlank } { traditionalRegistration_displayName } By submitting your registration information you agree to our Visitor Agreement and Privacy Policy. { createAccountButton } { /registrationForm } Just One More Thing...We have sent you a verification email. Please check your email and click on the link to activate your profile.If you do not receive the verification message within a few minutes of signing up please check your Spam or Junk folder.CloseThank you for registeringWe look forward to seeing you on [website] frequently. Visit us and sign in to update your profile receive the latest news and keep up to date with mobile alerts. Click here to return to the page you were visiting. Create a new passwordDont worry it happens. Well send you a link to create a new password. { forgotPasswordForm } { forgotPassword_emailAddress } { forgotPassword_sendButton } { /forgotPasswordForm } Email sentWe have sent you an email with a link to change your password.Close { mergeAccounts } Sign in to complete account merge { tradAuthenticateMergeForm } { traditionalSignIn_emailAddress } { mergePassword } { backButton } { traditionalSignIn_signInButton } { /tradAuthenticateMergeForm } Resend Email VerificationClick submit to receive another verification email { resendVerificationForm } { traditionalSignIn_emailAddress } { /resendVerificationForm } Your Verification Email Has Been SentCheck your email for a verification linkClose",http://www.accessatlanta.com/movies/movies/etc/viewMovie.jspd?movieId=333,404,thetexaschainsawmassacrethebeginning1,thetexaschainsawmassacrethebeginning,accessatlanta
"Murder amp; Mayhem Are in the Blood washingtonpost.com gt; Arts amp; Living gt; Movies >> Follow Movies On Movies Murder amp; Mayhem Are in the Blood Jordana Brewster portrays a waylaid road tripper terrorized by Leatherface and his cannibalistic clan in ""The Texas Chainsaw Massacre The Beginning."" (Photos By Van Redin -- New Line Productions) Network News X Profile View More Activity TOOLBOX Resize Print E-mail Reprints By Desson Thomson Washington Post Staff Writer Saturday October 7 2006 Perhaps its misleading to praise ""The Texas Chainsaw Massacre The Beginning"" for its positive family values. But we do note that the Hewitts -- the Texas relations at the center of this horrorfest -- say grace before dinner and show deep love and support for one another. Were almost reluctant to mention their tendency to apprehend slaughter and eat anyone who passes through their rural hamlet. But the Hewitts are doing the best with what they have which in this economically impoverished corner of Texas is nothing. The one who prepares their cannibal spread of course is Thomas a.k.a. Leatherface the marauding butcher of the original 1974 ""Texas Chainsaw Massacre"" who never met a visitor he couldnt dismember dice and debone in time for supper. Sadly this movie is a far cry from the atmospheric even thoughtfully crafted original which made you truly scared for the unkempt everyman victims. But this latest version though just as grisly is literally hackwork and stars a forgettable airbrushed cast of slaughterees. A brief recap of the chainsaw chronicles There was 1986s ""Texas Chainsaw Massacre 2"" which featured Dennis Hopper as a vengeful Texas cop. Viggo Mortensen popped up in 1990s ""Leatherface Texas Chainsaw Massacre III"" and 1994s ""The Return of the Texas Chainsaw Massacre"" starred Renee Zellweger and Matthew McConaughey. But all you need to know this weekend is that ""The Beginning"" is the prequel to 2003s ""The Texas Chainsaw Massacre"" which in turn is the remake of Tobe Hoopers 1974 original the big bang that started it all. As the latest movie shows us Thomas (played here and in 2003 by Andrew Bryniarski) is just a misunderstood psychotic who was teased as a child for his disfigured face and in later years denied gainful employment when the local slaughterhouse was closed down in 1969. Have no fear horror fans ""The Beginning"" may get mushy about Leatherface and his family but it spares no detail -- not a one -- when it comes to showing the Hewitts first round of victims. When he hears about the factory shutdown Thomas sledgehammers his supervisor to death. And his adoptive uncle Charlie (R. Lee Ermey) feels obligated to blow out the brains of the sheriff who comes to arrest his nephew. Charlie takes over the sheriffs badge uniform even his identity. And waste not want not That old Sheriff Hoyt makes one heckuva dinner. And of course there are the four kids (a bell-bottomed Jordana Brewster is the best known) who make the unfortunate mistake of getting into an accident on Route 17 one July day on their way to a Lynyrd Skynyrd concert (its 1969 remember). Little do they know theyll be playing involuntary air guitar on meat hooks before the day is through. Is there much more to tell you? We will say we have never seen a 300-pound woman (shes called the Tea Lady and we remember her from the 2003 ""Massacre"") used as a doorstop. And we couldnt help but laugh when Sheriff Hoyt/Charlie compliments his nephew on his new face mask which Leatherface obtained the hard way from one of his victims. But we also noted the tenderness in the compliment and the twinkle in his uncles eyes. The Texas Chainsaw Massacre The Beginning (84 minutes at area theaters) is rated R for hard-core violence and gore profanity and some sexual content. (c) 2006 The Washington Post Company Network News X My Profile Friends Activity View More Activity",http://www.washingtonpost.com/wp-dyn/content/article/2006/10/06/AR2006100601588.html,200,thetexaschainsawmassacrethebeginning2,thetexaschainsawmassacrethebeginning,washingtonpost
The Texas Chainsaw Massacre The Beginning (2006) directed by Jonathan Liebesman | Film review Go to the content Go to the footer Time Out London London Popular cities London New York Paris Chicago Los Angeles Browse all cities Time Out London Close London Change city London Popular cities London New York Paris Chicago Los Angeles Browse all cities Tickets Offers Things to Do Restaurants Bars amp; Pubs Film Theatre Art Music Attractions Blog Theatre Tickets Shopping Offer of the Day Time Out Card Time Out Escapes Time Out Live Hotels Nightlife Music festivals Events amp; Festivals Kids Museums Clubs Comedy Food amp; Drink Classical Music amp; Opera Dance LGBT City Guide Area Guides Property Competitions Dating Close My Time Out Things I love My lists My Profile My Account Sign out Sign in Create account Sign in With your social account Or with your email Email Password Remember me Forgotten your password? Sign in You can create a Time Out account in two ways... With a few clicks using your favourite social network Or by entering your details below Email First Name Last Name Create password Repeat new password I accept Time Outs terms of use including opt-in to newsletters. Create account Welcome  You have successfully connected your account to Time Out. You may sign in with this account in future. Please confirm your account details Email First Name Last Name I accept Time Outs terms of use including opt-in to newsletters. Sign up My Account Sign in or Create account Search Tickets Offers Things to Do Restaurants Bars amp; Pubs Film Theatre Art Music Attractions Blog Theatre Tickets Shopping Offer of the Day Time Out Card Time Out Escapes Time Out Live Hotels Nightlife Music festivals Events amp; Festivals Kids Museums Clubs Comedy Food amp; Drink Classical Music amp; Opera Dance LGBT City Guide Area Guides Property Competitions Dating More Search The Texas Chainsaw Massacre The Beginning Film  Horror Add review 0 Love It Save it 0 Add review 0 Love It Save it Time Out says Details Users say Time Out says Thats the ugliest thing I ever saw So says a character in reference to baby Leatherface at the start of Texas Chainsaw Massacre The Beginning but they could just as easily be talking about this deeply unpleasant film by Darkness Falls helmer Liebesman. A prequel to the 2003 remake of the Tobe Hooper classic it purports to explore the background and mythology behind one of cinemas greatest horror icons. Yet this plotless pointless piece has nothing to say about the nature of the beast choosing instead to wallow in the brutal violence and nihilism of the dysfunctional family from hell. Oppressive mean-spirited and sadistic The Beginning is an unsavoury exercise in cruelty and pain that one hopes will also be the end. By Chris Tilly Posted Friday October 13 2006 Details Release details Rated 18 Release date Friday October 13 2006 Duration 92 mins Cast and crew Director Jonathan Liebesman Screenwriter Sheldon Turner Cast Jordana BrewsterMatthew BomerTaylor HandleyDiora BairdR Lee ErmeyAndrew BryniarskiLee TergesenMarietta MarichLew TempleHeather Kafka Users say LiveReviews|02 people listeningSign inWrite reviewMost helpfulMost helpfulHighest ratingLowest ratingNewestOldestLoadingundefinedNew CommentsRefreshShow More Share Tweet 0 Shares Top About us Work for Time Out Privacy policy Cookie Policy Website terms of use Contact us Time Out for business Get listed Claim your listing Premium Profiles Advertising Time Out products Time Out Card Mobile apps Time Out Shop Time Out Guides Time Out Travel Time Out Offers Time Out Worldwide Time Out magazine Where to get Time Out magazine Subscribe to Time Out magazine Manage my subscription Follow us Facebook Twitter Youtube Instagram Pinterest Spotify Time Out London Site map },http://www.timeout.com/film/83718.html,200,thetexaschainsawmassacrethebeginning3,thetexaschainsawmassacrethebeginning,timeout
