review,link,status_code,id,movie_key,critic
"The World Is Not Enough  Film Review The World Is Not Enough  DVD Review  The A.V. Club Film TV Club Music Comedy Books Games Aux More The World Is Not Enough Most Read A.V. Club Most Read 1 Guardians Of The Galaxy Posted Jul 30 Marvel might only be making one Infinity War movie now 2 Artists rendering of HBO executives heads when they found out their biggest show was coming to a close. (Game Of Thrones) Posted Jul 30 HBO confirms that Game Of Thrones will end with season 8 3 (Graphic Nick Wanserski) Posted Jul 30 The best books of 2016 so far The A.V. Clubs catch-up guide 4 Photo Warner Bros. Posted Jul 30 Lights Out director David Sandberg defends the ending of his horror hit Film TV Club Music Comedy Books Games Aux Newswire Reviews Video Great Job Internet Film TV Club Music Comedy Books Games Aux Newswire Features Reviews Videos Great Job Internet The Latest From Newswire The Larry Sanders Show The Larry Sanders Show is finally coming to HBO Go--in September (Image Getty Images/pokemon.wikia.com) Russian politicians are super wary of the ""devil"" of Pokemon Go The Latest From Features (Graphic Nick Wanserski) The best books of 2016 so far The A.V. Clubs catch-up guide American jazz vocalist Michael Franks at SIR studios in NYC. (Photo Oliver Morris/Getty Images) Jazz-inflected yacht rock word lists and pop-culture nerdery The Latest From Reviews B- Photo Cinema Asia Releasing League Of Gods offers the deadly farts of a six-armed baby in dazzling 3-D B+ Mike Kinsella (Photo Shervin Lainez) On The King Of Whys Owens the best its ever been The Latest From Videos Chasing Jason Bourne and catching up with Woody Allen Comedian Damien Lemon likes his weed to have a heroic backstory The Latest From Great Job Internet (Screenshot YouTube) Watch David Cross wound himself with increasingly brutal hot wings Democratic nominee President Hillary Clinton waves to the crowd following her acceptance speech at the Democratic National Convention in Philadelphia on Thursday July 28 2016. (Photo Bill Clark/CQ Roll Call) Read This Hillary Clinton knows her Hamilton so chill All Recent Browse Our Features Coming Distractions Savage Love Facebook Twitter Tumblr Film DVD Review The World Is Not Enough By Nathan Rabinnathanrabin Nov 19 1999 1200 AM Share Tweet - The World Is Not Enough Community Grade (4 Users) A A- B+ B B- C+ C C- D+ D D- F Your Grade A A- B+ B B- C+ C C- D+ D D- F ? Our Community Grading Tool is in beta. Send Feedback. Share Tweet What do the James Bond series the Chicago Cubs and Master Ps No Limit empire have in common? All owe their considerable commercial success more to loyalty marketing and tradition than to quality. The last Bond movie 1997s Tomorrow Never Dies represented a steep drop in quality from the first Pierce Brosnan-as-Bond film GoldenEye and while The World Is Not Enough is a notable improvement the series continues to run on auto-pilot. As its conventional title would indicate Brosnans third outing as Bond isnt about to mess with a profitable formula. This time out his 007 has been dispatched to Russia to look after an oil heiress (Sophie Marceau) who may be the target of an anarchist terrorist (Robert Carlyle) immune to pain and not above sticking his hand on pieces of red-hot rock to prove it. As always minimal concessions to the passage of time are sprinkled throughout--the odd scratching on David Arnolds score nods to current events and the casting of drum-and-bass superstar Goldie as a minor baddie--but other than that not a whole lot has changed. Bond still manages to find a casino in the least likely of locations he still beds every woman worthy of a Maxim photo shoot and the villains still never kill him when given a chance. As in Tomorrow the filmmakers pair Brosnan with one respectable foreign actress (Marceau) and one chesty American so laughably awful that the film comes to a dead stop whenever shes on screen (Denise Richards). Richards plays a nuclear physicist this time out but you dont need to be one yourself to realize that her skimpily attired character seems a lot more like a San Diego aerobics instructor than a scientist. Enough fun moments are scattered throughout (many courtesy of Robbie Coltranes scummy Russian hustler returning from GoldenEye) to make The World Is Not Enough a decent Bond entry. But the series still needs a massive shot of fresh ideas if it wishes to become anything more than a nostalgia-fueled commercial sure thing. Share Tweet Filed Under Film More DVD Review Previous DVD Review Sleepy Hollow Next DVD Review Sleepy Hollow Dont miss a story--follow The A.V. Club on Cant see comments? Please enable JavaScript to view the <a href=""http//disqus.com/?ref_noscript""> comments powered by Disqus. </a> More DVD Review With Dr. Strangelove Kubrick shot a brilliant satire like a straight thriller Jun 25 2016 1200 AM Fantastic Planet looks as strange today as it must have 40 years ago Jun 18 2016 1200 AM Neither Warren Beatty nor Chris Rock could improve upon Here Comes Mr. Jordan Jun 11 2016 1200 AM Jean Renoirs path to greatness began with La Chienne Jun 11 2016 1200 AM A.V. Club Most Read 1 Guardians Of The Galaxy Posted Jul 30 Marvel might only be making one Infinity War movie now 2 Artists rendering of HBO executives heads when they found out their biggest show was coming to a close. (Game Of Thrones) Posted Jul 30 HBO confirms that Game Of Thrones will end with season 8 3 (Graphic Nick Wanserski) Posted Jul 30 The best books of 2016 so far The A.V. Clubs catch-up guide 4 Photo Warner Bros. Posted Jul 30 Lights Out director David Sandberg defends the ending of his horror hit Sign up for news Daily Newsletter Highlights from The A.V. Club Whats On Tonight A daily update on the world of TV Submit Links and such All Recent Browse Our Features Coming Distractions Savage Love Contests RSS About Us Contact Advertise Jobs Privacy Policy Our Partners Hitfix Mental Floss Oh My Rockness Uproxx Upworthy Vice (c) Copyright 2016 Onion Inc. All Rights Reserved.",http://www.avclub.com/review/the-world-is-not-enough-17686,200,theworldisnotenough0,theworldisnotenough,avclub
"Ban Bond Hes Been Spoofed By Higher Powers Pierce Brosnan Is As Pinched And Humorless As Ever In His Third Go-round. - philly-archives | News | Sports | Entertainment | Business | Opinion | Food | Lifestyle | Health | More Classifieds Real Estate Cars Jobs Obituaries Marketplace Shopping Circulars Print Offers Online Events Local Deals Breaking News Video Blogs Philadelphia New Jersey Politics Education Opinion Obituaries Nation/World Weather Traffic Lottery CollectionsDenise Richards <a href=""http//ad.doubleclick.net/jump/ph.search/perfectmarket;pos=btf;sz=300x250;ord=philly_apt_ad_timestamp?""></a> We RecommendBond. Evolving Bond.November 5 2012Find More Stories About Denise Richards <a href=""http//ad.doubleclick.net/jump/ph.search/perfectmarket;pos=atf;sz=300x250;ord=philly_apt_ad_timestamp?""></a> Ban Bond Hes Been Spoofed By Higher Powers Pierce Brosnan Is As Pinched And Humorless As Ever In His Third Go-round.By Carrie Rickey INQUIRER MOVIE CRITICPosted November 19 1999So long as the Brits are sweeping obsolete institutions like the House of Lords into the dustpan of history may we recommend the broom for James Bond?He was naughty fun in the 60s and a campy lark in the 70s. But after two Austin Powers films spoofing the studly superspy and his nefarious nemeses we can probably agree that 007 served straight is tempting as a tepid martini.The World Is Not Enough the 19th installment in the film franchise inaugurated with Dr. No in 1962 is a case of Enough Already At least the Austin Powers comedies wring laughs out of the fact that the James Bond character is out of time and out of touch. This 007 movie isnt in on the joke.Because by the late 70s Bond had already devolved from surefooted sadist to smartly tailored mannequin it is old news to complain that Pierce Brosnan making his third appearance as Bond is an empty Brioni suit. Yet so pinched and clenched and positively humorless is Brosnan that he made me nostalgic for the labored grace and easy humor of Roger Moore.At least when Moore made a double-entendre you could see his tongue tickle the inside of his cheek. When Brosnan makes one of those puns more likely to make a 12-year-old girl cringe than blush he teases a pretty thing with a panatela saying ""Close but no cigar"" as though he means it literally.OK you argue we dont treasure Bond movies for the hero. We like them because they are catalogs of whats happening on the travel gadget and glamourpuss fronts.So I argue back While it is cool very cool that Bonds gleaming BMW looks like the mini-me version of the Guggenheim Museum in Bilbao (both are titanium and both are tilted) what does it say when a movies inanimate props have more magnetism than the actors?While it is fun very fun to see Desmond Llewelyn for the billionth time as gizmo guru Q who here introduces a bullet-spewing bagpipe what does it say in this computer age that the best Bond gadgets are low-tech? While I particularly liked the helicopter outfitted with a vertical bank of circular saws (its ambidextrous it can decapitate horizontally with its rotor or vertically with its blades) its rare to encounter such a device outside a chainsaw-massacre film.And while it is saucy very saucy to see Sophie Marceau and Denise Richards - women whose pillow lips and frontal elevations have to be more effective hormonal boosts than Viagra - what does it say that Richards (as a physicist named Christmas Jones) delivers her dialogue phonetically?Enough is enough. Spoofing James Bond in the 90s may lack an original comic bite but making James Bond in the 90s is positively toothless.THE WORLD IS NOT ENOUGH  1/2 Produced by Michael G. Wilson and Barbara Broccoli directed by Michael Apted written by Neal Purvis Robert Wade and Bruce Feirstein photography by Adrian Biddle music by David Arnold distributed by Metro Goldwyn Mayer.Running time 2 hours 8 mins.James Bond.........Pierce BrosnanElektra............Sophie MarceauRenard.............Robert CarlyleChristmas Jones....Denise RichardsM..................Judi DenchParents guide PG-13 (double-entendres sexual innuendo discreet nudity violence)Showing at area theaters Please enable JavaScript to view the <a href=""http//disqus.com/?ref_noscript"">comments powered by Disqus.</a> comments powered by Disqus Commenting policy | Comments FAQ FEATURED ARTICLESTiffany Trump and Naomi Biden graduate Penn dad and granddad looking onApothecary gardens fuel farm-to-medicine-cabinet movementCruz pledges to unify GOP AmericansMoreDe Mazia Art Brings 2.38 MillionLeader Of Jbm Sentenced To Life Aaron Jones Was Convicted Of Conspiring To Distribute 100 Million In Cocaine. He Plans To Appeal.Jbm 8 Believed FoundersIn Bulk Trucking Chemical Leaman Is Rolling Toward The TopFrank Nofer 71 famed graphic artistGeorge Mattson 88 Olympian Crew CoachIndex by Keyword|Index by Date|About Philly.com|Contact Us|Terms of Use amp; Privacy Statement|Copyright 2016 <a href=""http//www.omniture.com"" title=""Web Analytics""></a>",http://articles.philly.com/1999-11-19/entertainment/25494760_1_christmas-jones-bruce-feirstein-barbara-broccoli,200,theworldisnotenough1,theworldisnotenough,philly
"washingtonpost.com Entertainment Guide Home | Register               Web Search Movies Music Restaurants Nightlife Museums/Galleries Theater/Dance Love Life In Store  Style  Books  Travel  Horoscopes  Weather  Traffic  TV Listings  citysearch.com The World Is Not Enough One Olive Short of a Martini By Stephen Hunter Washington Post Staff Writer Friday November 19 1999 Pierce Brosnan and Denise Richards as James Bond and Christmas Jones go all out to suspend our disbelief in ""The World Is Not Enough."" (MGM) Once all the world went gaga over James Bond. Now James Bond is going dada all over ""The World Is Not Enough."" Its true. The new Bond movie is pure nonsense art of the dadaist school; it follows the rules of the ridiculous as it turns narrative convention thriller formula and special-effects set pieces into a manifesto of the purest gibberish. To see it is to walk out of the theater scrambled wondering where in the hell you are if you are anyplace at all and even that is in doubt. It must be a giant joke played on us by those merry pranksters at MGM. Or perhaps Pierce Brosnan is angry that his excellent remake of ""The Thomas Crown Affair"" made so small a dent at the box office that he has decided to give the public what he thinks is appropriate to its IQ two hours of splosions and speedboats and machine guns arranged randomly lacking beginning middle or even end or any connective tissue while spotlighting some of the most vapid dialogue and some of the most vacant performances in history. Its pure dada as revolutionary in its way as Marcel Duchamps stunt of painting a mustache on the ""Mona Lisa"" to stun the bourgeoisie. It seems to be about--stop me if youve heard this one before--the ace stud of the British Secret Service being sent as a bodyguard for the recently orphaned daughter--unaccountably French--of a British oil billionaire who is trying to fulfill her fathers dream of building an oil pipeline along the southern route out of Azerbaijan Yes. Youre supposed to root for the pipeline builders who are seen rounding up peasants at gunpoint Now as no one would or could believe this its clearly a joke. Then halfway through when that story has lost what little steam it had--largely on account of Sophie Marceaus impenetrable accent and Robert Carlyles limp impersonation of an anarchist who believes only in disorder (he would have changed his mind if hed read the script)--the movie starts all over again. This time its a parody of the George Clooney non-hit ""The Peacemaker"" about terrorists who steal a nuclear warhead from a Russian missile silo for deployment against the West. The two stories are only marginally connected and how Cmdr. Bond walks from one into the other is a mystery that only Scully and Mulder could solve. But the second story at least has the spectacle of Denise Richards in her astonishing performance. (""Astonishing""--Hunter The Post.) I am sure this young American woman is a terrific human being a good citizen and can really dance well but as an actress she gives a tree slug a run for its money in the expression category. Admittedly shes made to say stupid things but she says them so dim-bulbishly with such lightless eyes and in such a childish monotone that you wonder if her parents knew where she was. Putting her in this movie seems almost like child abuse. Meanwhile Brosnan is walking about as if he hasnt noticed hes in the picture show. He can barely be bothered to read his lines. The performance is mainly a matter of displaying the fit of his suits. We all understand that the only remaining part of Bonds retro charm is his coolness his refusal to ruffle but has anyone put a mirror under Pierces nostrils recently? Whats his pulse rate -32? Has it been ascertained beyond a doubt that he is actually alive? Is this some stunt of cryogenics the first movie star to get through an entire performance while biologically frozen solid as a cod? Even the gags seem lackluster this umpteenth time through. The opening speedboat chase through London--by the way when did London become Venice and did it make the front page?--is pretty tame unless you get excited by splashing and a bit where guys in snowmobiles with parachutes chase downhill a 22-year-old stunt skier dressed sort of but not very much like Bond. Worst of all is a ride through the pipeline in some kind of vague contrivance that looks like the pneumatic tubes from old-time newsrooms when they sent remakes down to composing in the last few minutes before deadline. I kept waiting for a big hand to reach in pull him out and yell ""New Page One for the Five-Star"" It does get a little better at the end with Bond and Richardss Dr. Christmas Jones (yes) fleeing up the shaft of a vertically implanted nuclear sub being chased by a wall of propane flame. But really. ""The World Is Not Enough"" shows that Bond has gotten shaky not stirring. The World Is Not Enough (128 minutes at area theaters) is rated PG-13 for phony movie violence and phony sexual innuendo. (c) Copyright 1999 The Washington Post Company Related Item ""The World Is Not Enough"" showtimes and details Home | Register               Web Search",http://www.washingtonpost.com/wp-srv/entertainment/movies/reviews/worldisnotenoughhunter.htm,200,theworldisnotenough2,theworldisnotenough,washingtonpost
"Less Elation Than Decapitation In Lifeless Sleepy Hollow - WSJ DOW JONES A NEWS CORP COMPANY News Corp is a network of leading companies in the worlds of diversified media news education and information services. DOW JONES Barrons BigCharts DJX Dow Jones Newswires Factiva Financial News Mansion Global MarketWatch Newsmart NewsPlus Private Markets Risk amp; Compliance WSJ.com WSJ Pro WSJ Conference WSJ Video NEWS CORP Big Decisions Business Spectator Checkout51 Harper Collins New York Post PropTiger REA realtor.com Storyful The Australian The Sun The Times DJIA ^ 18432.24 -0.13% Samp;P 500 ^ 2173.60 0.16% Nasdaq ^ 5162.13 0.14% U.S. 10 Yr ^ 0/32 yield 1.452% Crude Oil ^ 41.38 0.58% Euro ^ 1.1176 0.88% Subscribe Now Sign In The Wall Street Journal Sections My Journal Home World U.S. Politics Economy Business Tech Markets Opinion Arts Life Real Estate Todays Paper SHOW ALL SECTIONS HIDE ALL SECTIONS World Home Africa Asia Canada China Europe Latin America Middle East Brussels Real Time China Real Time India Real Time Economy World Video U.S. Home Economy Law New York Politics Real Time Economics The Numbers Washington Wire Journal Report U.S. Video Whats News Podcast Politics Home Think Tank Washington Wire Politics Video WSJ/NBC News Poll Economy Home Real Time Economics Economic Forecasting Survey Economy Video Business Home Management Tech/WSJ.D Aerospace amp; Defense Autos amp; Transportation Commercial Real Estate Consumer Products Energy Entrepreneurship Financial Services Food amp; Services Health Care Hospitality Law Manufacturing Media amp; Marketing Natural Resources Retail CFO Journal CIO Journal CMO Today Logistics Report Risk amp; Compliance Bankruptcy Beat Heard on the Street Business Video Journal Report Business Podcast Tech Home CIO Journal E-Commerce Mobile Personal Tech Privacy amp; Security Startups Christopher Mims Geoffrey Fowler Joanna Stern Personal Tech News Venture Capital Dispatch Billion Dollar Startup Club Tech Trader Daily Tech Video The Accelerators Tech Podcast Markets Home Bonds Commercial Real Estate Commodities amp; Futures Currencies Deals Financial Services Funds Stocks Your Money Heard on the Street MoneyBeat Wealth Adviser Ahead of the Tape CFO Journal Journal Report Market Data Markets Video Markets Podcast MoneyBeat Podcast Heard on the Street Podcast Watching Your Wealth Podcast Opinion Home Arts in Review Book Reviews Commentary Editorials Letters to the Editor Best of the Web Columnists Morning Editorial Report Peggy Noonan Political Diary Opinion Video Potomac Watch Podcast Foreign Edition Podcast Arts Home Arts in Review Books Speakeasy Arts Video WSJ. Magazine Speakeasy Podcast Life Home Careers Cars Food amp; Drink Health Ideas Real Estate Science Sports Style amp; Fashion Travel Expat Off Duty Daily The Daily Fix Life Video WSJ. Magazine WSJ Puzzles Off Duty Podcast The Future of Everything Real Estate Home Commercial Real Estate House of the Day Mansion Real Estate Video HIDE ALL SECTIONS Aim higher reach further. Get the Wall Street Journal 12 for 12 weeks. Subscribe Now Sign In Reveal Navigation Options Home World Regions Africa Asia Canada China Europe Latin America Middle East Blogs Brussels Real Time China Real Time India Real Time Sections Economy More World Video U.S. Sections Economy Law New York Politics Columns amp; Blogs Real Time Economics The Numbers Washington Wire More Journal Report U.S. Video Whats News Podcast Politics Blogs Think Tank Washington Wire More Politics Video WSJ/NBC News Poll Economy Blogs Real Time Economics More Economic Forecasting Survey Economy Video Business Sections Management Tech/WSJ.D Industries Aerospace amp; Defense Autos amp; Transportation Commercial Real Estate Consumer Products Energy Entrepreneurship Financial Services Food amp; Services Health Care Hospitality Law Manufacturing Media amp; Marketing Natural Resources Retail C-Suite CFO Journal CIO Journal CMO Today Logistics Report Risk amp; Compliance Columns amp; Blogs Bankruptcy Beat Heard on the Street More Business Video Journal Report Business Podcast Tech Sections CIO Journal E-Commerce Mobile Personal Tech Privacy amp; Security Startups Columns amp; Blogs Christopher Mims Geoffrey Fowler Joanna Stern Personal Tech News Venture Capital Dispatch More Billion Dollar Startup Club Tech Trader Daily Tech Video The Accelerators Tech Podcast Markets Sections Bonds Commercial Real Estate Commodities amp; Futures Currencies Deals Financial Services Funds Stocks Your Money Columns amp; Blogs Heard on the Street MoneyBeat Wealth Adviser Ahead of the Tape More CFO Journal Journal Report Market Data Markets Video Markets Podcast MoneyBeat Podcast Heard on the Street Podcast Watching Your Wealth Podcast Opinion Sections Arts in Review Book Reviews Commentary Editorials Letters to the Editor Columns amp; Blogs Best of the Web Columnists Morning Editorial Report Peggy Noonan Political Diary More Opinion Video Potomac Watch Podcast Foreign Edition Podcast Arts Sections Arts in Review Books Blogs Speakeasy More Arts Video WSJ. Magazine Speakeasy Podcast Life Sections Careers Cars Food amp; Drink Health Ideas Real Estate Science Sports Style amp; Fashion Travel Blogs Expat Off Duty Daily The Daily Fix More Life Video WSJ. Magazine WSJ Puzzles Off Duty Podcast The Future of Everything Real Estate Sections Commercial Real Estate House of the Day Mansion More Real Estate Video Search SEARCH - Subscribe Sign In Hot-Air Balloon Crashes in Texas Killing 16 People Turkeys Powerful Spy Network Failed to See Coup Coming Pennsylvania Voters Barely Swayed After National Conventions Goldman Sachs Subpoenaed in U.S. for Documents Related to 1MDB Abreast of the Market Tech Stocks New Attraction Dividends Spread of Zika Virus in Puerto Rico Accelerates The Saturday Essay The Strange Rites of the Ancient Olympics Essay How the Patty Hearst Case Began the Era of Televised Terror Wildfires Why Archaeologists Dig Them HBO Game of Thrones Will End at Season 8 How Jason Day Sees His Shot He Closes His Eyes The A-Hed Score Piano Salesman Loans Out Free Steinways Some Strings Attached Save Article Sign In to Save Subscribe to WSJ Text Size Regular Medium Large Google+ Print Film Less Elation Than Decapitation In Lifeless Sleepy Hollow By Joe Morgenstern Updated Nov. 19 1999 1239 a.m. ET H eres a heads-up on ""Sleepy Hollow"" Tim Burtons reprocessing of Washington Irvings venerable tale -- expect less elation than decapitation. The horseman and his several victims may be missing crucial parts of their anatomy but this elegantly mounted movie is missing a soul. The omission isnt noticeable when Johnny Depps Ichabod Crane first journeys upstate from New York City at the end of the 18th century. Ichabod wants to investigate a series of murders in the village of Sleepy Hollow where bleak... To Read the Full Story Subscribe or Sign In Popular on WSJ Most Popular Videos Wildfires Uncover Historic Treasures for Archaeologists Corpse Flower Causes Big Stink in New York City Rio 2016 Giving Horses Wings to Compete Game of Thrones Exclusive Behind-the-Scenes Glimpse Muslim Soldiers Father Delivers Message to Trump Most Popular Articles Opinion Hillary Clinton Underdog Campaigns Eye Pennsylvania Prize Hedge-Fund Money 48.5 Million for Clinton 19000 for Trump Turkeys Powerful Spy Network Failed to See Coup Coming Hillary Clintons Convention Speech Falls Short of Donald Trump Ratings Wall Street Journal U.S. Edition U.S. Asia Europe India America Latina Brasil Zhong Guo  (China) Ri Ben  (Japan) Edition U.S. Asia Europe India America Latina Brasil Zhong Guo  (China) Ri Ben  (Japan) Text Size Small Medium Large Subscribe NowSign In WSJ Membership Benefits Download WSJ Apps Customer Center Legal Policies Subscribe Sign In TOP<< WSJ Membership WSJ+ Membership Benefits Digital Subscription Print Subscription Print and Digital Subscription Why Subscribe? Download WSJ Apps for iOS and Android Corporate Subscriptions Professor Journal Student Journal Customer Service Customer Center Live Help Redesign Guided Tour Notice to Subscribers Tools amp; Features Emails amp; Alerts Guides My News RSS Feeds Topics Video Center Watchlist Podcasts Ads Advertise Advertise Locally Commercial Real Estate Ads Place a Classified Ad Sell Your Business Sell Your Home Recruitment amp; Career Ads More Content Partnerships Corrections Jobs at WSJ News Archive Register for Free Reprints Facebook Twitter Google+ YouTube Podcasts Snapchat GooglePlay AppStore Windows10 Dow Jones Products Barrons BigCharts DJX Dow Jones Newswires Factiva Financial News Mansion Global MarketWatch Private Markets realtor.com Risk amp; Compliance WSJ Conference WSJ Pro Central Banking WSJ Video WSJ Wine Privacy Policy Cookie Policy Copyright Policy Data Policy Subscriber Agreement amp; Terms of Use Your Ad Choices Copyright (c)2016 Dow Jones amp; Company Inc. All Rights Reserved.",http://www.wsj.com/articles/SB942981540802628725,200,theworldisnotenough3,theworldisnotenough,wsj
