review,link,status_code,id,movie_key,critic
"washingtonpost.com Entertainment Guide Home | Register               Web Search Movies Music Restaurants Nightlife Museums/Galleries Theater/Dance Love Life In Store  Style  Books  Travel  Horoscopes  Weather  Traffic  TV Listings  citysearch.com World Bond Without End By Desson Howe Washington Post Staff Writer Friday November 19 1999 Pierce Brosnan and Denise Richards as James Bond and Christmas Jones go all out to suspend our disbelief in ""The World Is Not Enough."" (MGM) In ""The World Is Not Enough"" Pierce Brosnans James Bond is starting to look a tad long in the tooth. And it looks as though Desmond Llewelyns ""Q"" is taking his final bow. But dont worry. Pierce probably has another Bond in him. And Qs replacement looks to be none other than - well lets just say ""Now its time for someone completely different."" But personnel changes no matter how significant will never stop the eternal Bond factory. If therell always be an England therell always be a Bond. Hence this bold declarative sentence at the end of the movie ""James Bond will return."" In fact Bond flicks have returned steadily since 1962 when a young Sean Connery (the first Bond for those of you unaware of the series original Agent 007) beheld the salty-wet bikini-clad Ursula Andress - name of Honey Ryder - emerging from the sea in ""Dr. No."" In ""The World Is Not Enough"" little has changed in more than 36 years. Denise Richards who has built her career as a nubile sex symbol without too much gray matter is now Bonds latest pinup ally as Christmas Jones. Shes hardly the worlds greatest actor either. But were meant to believe shes a nuclear weapons expert. ""The World Is Not Enough"" which has something to do with the possible destruction of the Western worlds biggest oil pipeline oozes over with plot. In addition to Christmas Jones Bond (Brosnan in his third appearance) crosses paths with oil heiress Elektra King (Sophie Marceau) sinister terrorist Renard (Robert Carlyle) and double agent Valentin (Robbie Coltrane). And of course Her Majestys best agent attends the usual round of office meetings with Q (Llewelyn) and M (Judi Dench). Making sense of Bond scenarios was never the point. The movie like its 18 predecessors is all about the sideshow. (Okay Bondistas Im not counting those unofficial Bond films like ""Never Say Never Again."") Were talking about girls gadgetry villains international hot spots and last but not least saucy dialogue. ""Would you like to check my figures?"" an attractive woman asks Bond as he attends a significant meeting with a shady Swiss banker. Naturally shes referring to the financial records in her hands. And naturally so is Bond when he replies ""Oh Im sure theyre perfectly rounded."" Ill spare you the exchange between Bond and Miss Moneypenny (Samantha Bond) on the subject of cigars. The fact is this is an enjoyable formula. ""The World Is Not Enough"" is simply a visit to familiar territory with that martini - shaken not stirred - waiting at some out-of-the-way international bar. Theres a thrilling and wonderfully implausible boat race on the Thames. Theres a joyride on the nose of an atomic bomb racing through a pipeline in Turkey. Theres a great bungee stunt in Bilbao. And theres skiing in Azerbaijan. There is always skiing it seems. And as we watch footage of two stuntmen pretending to be Bond and Elektra streaking down the slopes we have to pretend its really actors Brosnan and Marceau. And when the stars pause to catch their breath after a strenuous downhill run - their hair still perfectly coiffed - we smirk to ourselves. This is the world of James Bond; and if we dont believe the whole fantasy will plunge into a crevasse. THE WORLD IS NOT ENOUGH (PG-13 128 minutes) - Contains obscured nudity extensive machine-gun deaths and risque dialogue. Area theaters. (c) Copyright 1999 The Washington Post Company Related Item ""The World Is Not Enough"" showtimes and details Home | Register               Web Search",http://www.washingtonpost.com/wp-srv/entertainment/movies/reviews/worldisnotenoughhowe.htm,200,theworldisnotenough12,theworldisnotenough,washingtonpost
A Traditional Bond - tribunedigital-orlandosentinel Home-Collections-Bond A Traditional BondMOVIES - MOVIE REVIEWThe Latest Spy Adventure Emphasizes 007 Mythology But Doesnt Scrimp On ActionNovember 19 1999|By Jay Boyar Sentinel Movie CriticThe World Is Not Enough is almost too much.Unlike Tomorrow Never Dies - its sleek immediate predecessor - the latest 007 extravaganza has enough plot developments double-entendres emotional underpinnings and of course Bond girls action scenes and explosions to furnish at least a couple of Bondfests with plenty left over for an episode of Nash Bridges.I dont have room to offer more than the briefest summary of the labyrinthine plot of this two-hour-plus presentation which takes Bond (Pierce Brosnan) from Spain to London to Azerbaijan to Istanbul to various photo ops near the Caspian Sea.This time Ian Flemings dapper uber-agent finds himself attempting to protect a young oil heiress whose father had been a close friend of Bonds boss the ironical M (Judi Dench).It seems that that heiress a beauty named Elektra (Sophie Marceau) had once been abducted by the fiendish Renard (Robert Carlyle) who may be after her again. Theres also something in there about a crucial oil pipeline which explains why the gyrating nude models of the opening-credits sequence are slathered in a viscous black liquid.The World Is Not Enough is a departure from Tomorrow Never Dies among the most popular and least Bondlike film of the series. Of course the 1997 movie contained all the Bond trademarks but they were downplayed. In most ways the film was indistinguishable from the sort of action flick that might star Bruce Willis or Harrison Ford.But if Tomorrow Never Dies was generic it was also fast exciting and very much of its moment.In The World Is Not Enough the 19th official installment of the series director Michael Apted (Extreme Measures) and his screenwriting team re-emphasize Bond myth- othogy. Not only is M a big part of the plot but the film also contains two government gadget gurus the retiring Q (Desmond Llewelyn) and his replacement R (Monty Pythons John Cleese).And 007s signature phrase ``Bond. James Bond is spoken not once but three times - twice by the spy himself and once by a casino owner (Robbie Coltrane).As a result the new film (which opens today) is apt to be most appreciated by true-blue Bondites. To others it might seem solid but a bit familiar and overstuffed like a favorite old chair that has begun to show its age.Even so Apted has a flair for action scenes. He keeps these swift and clear whether the sequence has Bond pursuing evildoers on land at sea in the air or all three.Brosnan continues to fill out the starring role with such flinty panache that his only real rival is the original Bond Sean Connery. Tops among the new Bond girls are Marceau (Braveheart) who does troubled and delicate well and Denise Richards (Starship Troopers) who plays a feisty midriff-baring nuclear expert named Dr. Christmas Jones.``I thought Christmas only comes once a year quips 007 after an extended intimate encounter with the scientist. As I say there is a great deal of this interplay although the screenwriters somehow missed out on the chance to come up with a double-entendre about that pipeline.But they dont miss much else in The World Is Not Enough a double scoop of double-0 seven and then some. MORELottery results for Powerball Florida LottoLottery results for Powerball Florida LottoDo your homework before painting or sealing cool deckPuerto Rico birth certificates How to get a new oneLottery results for Powerball Florida LottoLottery results for Powerball Florida Lotto Related ArticlesAction-packed `Tomorrow Is Solid-gold BondMay 15 1998Straightforward Action Makes Tomorrow Best Bond In AgesDecember 19 1997Bond Pal Q Faced Real-life DangerDecember 25 1997Bond Is Forever The Spy Who Survives ProspersJanuary 6 1998Find More Stories AboutBondPierce BrosnanDenise RichardsIndex by Keyword|Index by Date|Privacy Policy|Terms of ServicePlease note the green-lined linked article text has been applied commercially without any involvement from our newsroom editors reporters or any other editorial staff.,http://articles.orlandosentinel.com/1999-11-19/entertainment/9911180276_1_bond-pierce-brosnan-tomorrow-never-dies,200,theworldisnotenough13,theworldisnotenough,orlandosentinel
"Bonds Complexity More Than Enough - latimes Advertisement YOU ARE HERE LAT Home-CollectionsMovie Review Bonds Complexity More Than EnoughNovember 19 1999|KEVIN THOMAS | TIMES STAFF WRITER ""The World Is Not Enough"" the 19th James Bond movie is in the ""Mission Impossible"" tradition It presents action adventure and romance with maximum sophistication and spectacle and minimal clarity.Director Michael Apted and his writers admirably maintain a balance between complexity of character and special effects only to undercut their impact with a murky narrative. This sleek fast-paced entertainment is further evidence of a steady erosion of confidence in the power of storytelling for its own sake on the part of contemporary blockbuster filmmakers and truth to tell that audiences may have trouble following the plot probably wont make a dent at the box office.A pre-credit jaw-dropping sequence is de rigueur for the Bonds and ""World"" delivers big time with Pierce Brosnans Agent 007 in a terrific speedboat chase down the River Thames that culminates with the suspect attempting to escape via balloon and Bond landing on top of Londons Millennium Dome. Through a series of sequences each one a triumph of production design and technical bravura we gather that Bond has been sent by M (Judi Dench) to Bilbao Spain to retrieve a ransom payment paid by an oil tycoon Sir Robert King (David Calder) to rescue his kidnapped daughter Elektra (Sophie Marceau) from the arch anarchist Renard (Robert Carlyle) whose only goal it seems is to create chaos.But when Sir Robert comes to MI6 headquarters in London to collect his money a fiendish device blows him to bits. Bond is off to Baku Azerbaijan to keep a protective eye on Elektra who is carrying on her fathers ambitious and perilous task of building an oil pipeline across Western Asia to Istanbul so that in the words of M ""the West can count on oil reserves for the next century.""As a survivor of a kidnapping Elektra is seemingly as fearless as she is gorgeous not welcoming Bonds presence as a protector but eager to have him as a bedmate. He tries to resist but is beguiled by this beauty who soon proves to be complicated indeed. Bond begins suspecting that she may be a victim of the ""Stockholm syndrome"" secretly remaining in the thrall of Renard. But what if Renard in turn has fallen in love with her? Apted is adroit in suggesting the contradictions that riddle Elektra and others that render their behavior ambiguous at best.Similarly hes good at evoking an aura of complicity that governs interplay between the pursuer and the pursued revealing vulnerability in all of the films key players a quality that has become a must in screen heroes and villains alike. All this is to the good; Brosnan Marceau (whose 15 movies include ""Braveheart"" and some prestigious French pictures) and Britains ever-versatile Carlyle and Dench all have the talent and experience necessary in creating three-dimensional characters. But too often the filmmakers allow a concern for complexity of motivation to lapse into needless confusion.All the elements that audiences have come to expect of Bond pictures are securely in place fabulous gadgetry superbly photographed exotic locales stupendous production values inspired action sequences gorgeous women considerable zingy double-entendres a driving score that incorporates the familiar Bond theme and an overall feeling of tremendous-scale no-expenses-spared filmmaking.Robbie Coltrane reprises vividly bad-guy-turned-good-guy Valentin Zukovsky and John Cleese is on hand for some comic relief as R aide to series veteran Desmond Llewelyns Q MI6s inventor extraordinaire. But beautiful Denise Richards draws unintended laughs for her singularly callow portrayal of a nuclear weapons whiz. ""The World Is Not Enough"" in fact offers not enough to add up to a fully satisfying movie. MPAA rating PG-13 for intense sequences of action violence some sexuality and innuendo. Times guidelines violence thats intense rather than brutal some sexual double-entendre.The World Is Not EnoughPierce Brosnan James BondSophie Marceau Elektra KingDenise Richards Dr. Christmas JonesRobert Carlyle RenardJudi Dench MAn MGM release of an Albert R. Broccolis Eon Productions Ltd. presentation. Director Michael Apted. Producers Michael G. Wilson and Barbara Broccoli. Screenplay by Neal Purvis amp; Robert Wade and Bruce Feirstein; story by Purvis amp; Wade. Cinematographer Adrian Biddle. Editor Jim Clark. Second unit director Vic Armstrong. Special effects supervisor Chris Corbould. Visual effects supervisor Mara Bryan. Stunt coordinator Simon Crane. Music David Arnold. Production designer Peter Lamont. Supervising art director Neil Lamont. Running time 2 hours 8 minutes.In general release. MORESeizure Led to FloJos DeathHis 104 scores make his caseRestaurant review South Beverly GrillBrutal Murder by Teen-Age Girls Adds to Britons ShockComaneci Confirms Suicide Attempt Magazine SaysAdvertisement FROM THE ARCHIVESOscars 2013 James Bonds not-so-secret life on the chartsFebruary 23 2013Skyfall Are James Bond and Jason Bourne melding together?October 23 2012Adeles Skyfall is in tune with James Bond historyOctober 5 2012Adele confirmed for Bond theme; her Skyfall will debut...October 1 2012John Barry dies at 77; composer scored 11 James Bond filmsFebruary 1 2011Copyright 2016 Los Angeles TimesTerms of Service|Privacy Policy|Index by Date|Index by Keyword",http://articles.latimes.com/1999/nov/19/entertainment/ca-35115,200,theworldisnotenough14,theworldisnotenough,latimes
"The World Is Not Enough | EW.com Skip to main content Sign In Log Out TV TV Recaps Movies Music Books Gaming Video Big Brother Queen of the South Mr. Robot Wayward Pines Suits Tyrant Shop Newsletter Subscribe Get 1 year for 25 Save 86% off the cover price SUBSCRIBE More Great Stuff Comic-Con Hulu Hot List 50Scoops EW Popfest For Your Consideration Jess Cagle Interview Stage Follow EW EW on Facebook EW on Twitter EW on Tumblr EW on Instagram About EW Contact UsCustomer ServiceAbout UsJobs at Time Inc.AdvertisePrivacy PolicyYour California Privacy RightsAd ChoicesNewslettersSubscribeTerms of ServiceSite Map Copyright 2015 Entertainment Weekly Inc. All rights reserved. Login Log out TV TV Recaps Movies Music Books Gaming Video More... TV This Weeks Cover The Walking... TV Exclusive Photos of The Walking... EW POPFEST Get the details 50Scoops50Days Exclusive... Movies Crazy Stupid Love Before Th... Movies The Most 2000s Fashion From Joh... Movies 27 Great Revenge Movies Movies Alice in Wonderland Witticism... Movies John Tucker Must Die Where Ar... Books 15 Captivating International Cri... Movies Planet of the Apes See the Fa... Movies Toronto Film Festival 2016 See... TV One Tree Hill Where Are They... Movies Little Miss Sunshine Where Ar... Books Harry Potter and the Cursed Chi... Movies Comic-Con 2016 See Portraits of... TV Friends See the Casts Evolut... TV Comic-Con 2016 Get Batty With... Movies The Dark Tower Storybook Steph... News Comic-Con 2016 Star Portraits... TV 10 of the Best Moments From The... Movies The Dark Tower Storybook Steph... Movies Thelma and Louise See Rare Behi... Movies 9 of Garry Marshalls Best Movies Movies Every Star Trek Movie Ranked Movies Big Trouble in Little China... Movies The Dark Tower Exclusive Firs... Movies Suicide Squad Before They Wer... Movies The 10 Best Movies of 2016 (So Far) TV Fear the Walking Dead introduc... Movies by Lisa Schwarzbaum Share Tweet Share on Google+ Share on Pinterest Share on Tumblr The World Is Not EnoughThick slick black oil is a key prop in The World Is Not Enough the third James Bond outing to star Pierce Brosnan and the first in which viscous...The World Is Not EnoughAction/AdventureNeal Purvis Robert WadePT128MPG-13Thick slick black oil is a key prop in The World Is Not Enough the third James Bond outing to star Pierce Brosnan and the first in which viscous...1999-11-26Robert CarlyleJohn CleeseJudi DenchDesmond LlewelynSophie MarceauDenise RichardsRobert Carlyle John Cleese Judi Dench Desmond Llewelyn Sophie Marceau Denise RichardsDanjaq Share Tweet Share on Google+ Share on Pinterest Share on Tumblr GET MY MIDRIFF? Brosnan bellies up to Richards C The World Is Not Enough Genre Action/Adventure; Starring Pierce Brosnan Robert Carlyle John Cleese Judi Dench Desmond Llewelyn Sophie Marceau Denise Richards; Director Michael Apted; Author Neal Purvis Robert Wade; Runtime (in minutes) 128; MPAA Rating PG-13; Distributor Danjaq Posted November 26 1999 -- 1200 AM EST Thick slick black oil is a key prop in The World Is Not Enough the third James Bond outing to star Pierce Brosnan and the first in which viscous fluid exhibits more personality than the people who are killing each other over it. Not that it matters but Bonds ostensible assignment this time on special orders from M (long-lived English lioness Judi Dench) is to protect oil heiress Elektra King (long-lived French kitten Sophie Marceau) from Renard--just Renard (Robert Carlyle)--an international terrorist with a bullet in his brain that renders him impervious to pain. Of course no one is who he or she appears to be as Bond learns the hard way stunt-doubling through the usual flashy feats involving speedboats skis submarines and at one point an underground oil pipeline itself. At some outpost in his travels avec dinner jacket though Bond crosses paths once again with Valentin Zukovsky the charismatically corpulent casino operator and arms merchant who first raised the stakes in 007s world in Goldeneye. Once again Robbie Coltrane plays with unstinting Sydney Greenstreet dash. And every moment of Coltrane on screen is a moment more alive with pleasure than any involving Bond and his gizmos or Bond and his girls; Brosnans repertoire of eyebrow arching while ogling and jaw clenching while escaping is by now entirely without flavor. Which confirms a 007 theory of mine that the hero himself has been denatured for a young late 1990s audience with little appreciation for real suavity or sex play (the visual charms of Denise Richards as a nuclear-weapons expert who works best in tank tops dim every time she speaks in petulant Party of Five cadences). And that as a result the future of the Bond market--arrested as it is in The World Is Not Enough somewhere between the blockish durability of Baywatchs David Hasselhoff and the satiric commotion of Austin Powers Mike Myers--lies in giving more screen time to everyone but the spy and his gal pals. Director Michael Apted in his first swing at the franchise plays his strong backbench of British character actors for all theyre worth; theyre the pungent streak of blue cutting through the films cheese. Apted gets more explosive power for instance out of illustrious John Cleese in a brief hilarious scene as Qs successor-in-training than he does out of a hundred shots of stuff blowing up. ""And you might be...?"" ""R"" asks tartly when meeting the poker-faced stiff with the fancy shirt cuffs. The question is an important existential one but its sloshed over in a cascade of crude. C Share Tweet Share on Google+ Share on Pinterest Share on Tumblr Top Stories Fast and Furious cast congratulates Vin Diesel on Facebook milestone Teen Wolf star Tyler Posey apologizes for Gay Street Snapchat Harry Potter and the Cursed Child Go inside the opening gala J.K. Rowling meets Harry Potter and the Cursed Child cast in photo Fast and Furious 8 Dwayne Johnson dives for cover in new set video Kanye West on Apples talks with Tidal Let the kids have the music A Chorus Line kicks up the classics at the Hollywood Bowl Photo Galleries 50Scoops50Days The Latest in Fall TV News The Biggest Moments From the 2016 Conventions Crazy Stupid Love Before They Were Stars The Most 2000s Fashion From John Tucker Must Die Exclusive Photos of The Walking Dead Season 7 27 Great Revenge Movies Alice in Wonderland Witticisms and Wisdom From the Disney Classic From Our Partners From Our Partners Contact UsCustomer ServiceAbout UsJobs at Time Inc.AdvertisePrivacy PolicyYour California Privacy RightsAd ChoicesNewslettersSubscribeTerms of ServiceSite Map Copyright (c) 2016 Entertainment Weekly Inc. All rights reserved. img[data-src] { display none important; }","http://www.ew.com/ew/article/0,,64373,00.html",200,theworldisnotenough15,theworldisnotenough,ew
