review,link,status_code,id,movie_key,critic
Valiant (2005) directed by Gary Chapman | Film review Go to the content Go to the footer Time Out London London Popular cities London New York Paris Chicago Los Angeles Browse all cities Time Out London Close London Change city London Popular cities London New York Paris Chicago Los Angeles Browse all cities Tickets Offers Things to Do Restaurants Bars amp; Pubs Film Theatre Art Music Attractions Blog Theatre Tickets Shopping Offer of the Day Time Out Card Time Out Escapes Time Out Live Hotels Nightlife Music festivals Events amp; Festivals Kids Museums Clubs Comedy Food amp; Drink Classical Music amp; Opera Dance LGBT City Guide Area Guides Property Competitions Dating Close My Time Out Things I love My lists My Profile My Account Sign out Sign in Create account Sign in With your social account Or with your email Email Password Remember me Forgotten your password? Sign in You can create a Time Out account in two ways... With a few clicks using your favourite social network Or by entering your details below Email First Name Last Name Create password Repeat new password I accept Time Outs terms of use including opt-in to newsletters. Create account Welcome  You have successfully connected your account to Time Out. You may sign in with this account in future. Please confirm your account details Email First Name Last Name I accept Time Outs terms of use including opt-in to newsletters. Sign up My Account Sign in or Create account Search Tickets Offers Things to Do Restaurants Bars amp; Pubs Film Theatre Art Music Attractions Blog Theatre Tickets Shopping Offer of the Day Time Out Card Time Out Escapes Time Out Live Hotels Nightlife Music festivals Events amp; Festivals Kids Museums Clubs Comedy Food amp; Drink Classical Music amp; Opera Dance LGBT City Guide Area Guides Property Competitions Dating More Search Valiant Film Add review 0 Love It Save it 0 Add review 0 Love It Save it Time Out says Details Users say Time Out says Thousands of documentaries and films have been made about WWII but how many have mentioned the plight of the plucky homing pigeon? British computer-animation house Vanguard redresses the balance by giving our feathered heroes their due with this entertaining CGI family flick about a wood pigeon who despite his diminutive size manages to con his way into the elite Royal Homing Pigeon Service (RHPS) a wing of the military responsible for delivering important messages from the French Resistance to the Allies. Valiant and his new flock of friends have hardly finished pre-flight training when news comes in of another failed RHPS attempt to get past the Nazis Channel-based falcon squad. Can the audacious Valiant his heroic leader Gutsy and the rest arrive safely in France meet the Resistance (a gang of field mice) and return without losing their feathers? Not if General Von Talon head of the pigeon-fancying falcons has anything to do with it. This may be the first that the latest generation will have seen or heard of the war so you could say theres a modicum of educational value in it albeit of the cute anthropomorphic sort. (Sounds like pigeon-fanciers anti-peregrine-falcon propaganda to me - Senior Film Ed.) Its funny too and well voiced by a cast that includes Ewan McGregor (in a second CGI role alongside Robots) Ricky Gervais John Cleese (obviously) and John Hurt. What surprises most though is the quality of the visuals which if not in the Robots league are commendably lush and lively. By DA Details Release details Rated U Release date Friday March 25 2005 Duration 78 mins Cast and crew Director Gary Chapman Users say LiveReviews|01 person listeningSign inWrite reviewMost helpfulMost helpfulHighest ratingLowest ratingNewestOldestLoadingundefinedNew CommentsRefreshShow More Share Tweet 0 Shares Top About us Work for Time Out Privacy policy Cookie Policy Website terms of use Contact us Time Out for business Get listed Claim your listing Premium Profiles Advertising Time Out products Time Out Card Mobile apps Time Out Shop Time Out Guides Time Out Travel Time Out Offers Time Out Worldwide Time Out magazine Where to get Time Out magazine Subscribe to Time Out magazine Manage my subscription Follow us Facebook Twitter Youtube Instagram Pinterest Spotify Time Out London Site map },http://www.timeout.com/film/81584.html,200,valiant0,valiant,timeout
Page not found | The A.V. Club Dead air. Sorry. Search the A.V. Club The page youre looking for does not exist. Please check that the URL is correct. Go back to avclub.com or contact us,http://www.avclub.com/content/node/25614,404,valiant1,valiant,avclub
"Valiant | Reelviews Movie Reviews Out now Cher Harold Rosson Eva Green Benjamin ... Home Video Views ReelThoughts Currently in Cinema ReelViews Library Login Specials My Books Array ( [page] =gt; reelviews [view] =gt; valiant ) Valiant (United Kingdom 2005) A movie review by James Berardinelli Valiant is for the birds. Arguably the blandest of the burgeoning crop of big budget digitally animated films Valiant aims to prove that the death of traditional animation has simply pushed lackluster screenplays into the digital realm. Until recently digital animation had been heads-and-shoulders about its longer-lived counterpart because each film was lovingly crafted with an attention to detail. Over the past year however digitally animated films have begun to show an assembly line quality and Valiant represents a new low. Its not as clever as it thinks it is not as funny or exciting as it should be and not as engaging as it needs to be to prevent kids from losing interest and parents from falling asleep. Its 1944 and the Allies are preparing for D-Day. Valiant (voice of Ewan McGregor) is an undersized pigeon who wants to join the Royal Carrier Pigeon Force and ferry messages back and forth between England and the French Resistance. With Germanys dangerous falcon Von Talon (Tim Curry) frequently downing pigeons the corps cant afford to be picky about its recruits so unlikely candidates such as Valiant and his scruffy friend Bugsy (Ricky Gervais) are allowed to sign up. After going through ""boot camp"" under the tutelage of a hard-nosed sergeant (Jim Broadbent) Valiant is sent on a mission to France to rescue a captured courier (John Cleese) and retrieve a crucial message. The missions commander is the revered Gutsy (Hugh Laurie) perhaps the most decorated pigeon. But things go wrong and Valiant and his comrades find themselves trapped behind enemy lines. Its necessary to ask a fundamental question about Valiant. Who is the target audience? The WWII backstory will have no meaning to viewers under 10 and the storyline doesnt offer much for viewers who are older. The film is plodding predictable and uninteresting. Theres nothing fresh or inspired about any aspect of the storytelling. Young kids might be amused by some of the slapstick antics but the humor isnt going to tickle the funny bones of older children or adults. (At the public screening I attended there was virtually no laughter and the auditorium was packed with families.) The action scenes generate little tension or suspense. The voices are provided by an impressive array of names - its a cast worthy of better material. John Cleese Jim Broadbent Ricky Gervais and Hugh Laurie are the only ones whose vocal performances exhibit any gusto. Tim Curry sounds like hes doing an impersonation of Tim the Enchanter from The Holy Grail (odd considering that hes currently appearing in ""Spamalot"" on Broadway). Everyone else including Ewan McGregor and John Hurt sound bored. With this film and Robots on his animated resume its time for McGregor to give up the voice work and return to live-action. The most disappointing thing about Valiant is the pedestrian quality of the animation. Strictly speaking its not bad but after the advances of films like Finding Nemo and The Incredibles this film takes a giant step backwards. At times it has a rough unfinished look. Facial expressions are less flexible than in many other digitally animated films. Backgrounds frequently lack detail. I dont know how long it took to make Valiant; however judging purely by the evidence on the screen it seems to have been put together quickly and cheaply. This is not a strong argument for first-time director Gary Chapman being granted another shot. In a way Valiant is a stopgap for both British animation and Disney (the distributor). Fans of the former are eagerly awaiting the next Wallace and Gromit film which is due out in the fall. And Disney is already stoking up the publicity engine to generate excitement for their first in-house digitally animated project Chicken Little (opens November 4 2005). As for Valiant its limited appeal will likely result in a short box office life. Its sad to realize that the most entertaining portion of the Valiant theater-going experience is watching the 5-minute ""short"" that represents the Ice Age 2 trailer. Valiant (United Kingdom 2005) Director Gary Chapman Cast (voices) Ewan McGregor Rik Mayall Pip Torrens John Hurt John Clesse Hugh Laurie Jim Broadbent Tim Curry Ricky Gervais Olivia Williams Screenplay Jordan Katz and George Webster and George Melrod Cinematography John Fenner Music George Fenton U.S. Distributor Walt Disney Pictures Run Time 116 U.S. Release Date 2005-08-19 MPAA Rating ""G"" (Nothing Objectionable) Genre ANIMATED Subtitles none Theatrical Aspect Ratio 1.851 Comments Add Comment Three...better movies of this genre Beauty and the Beast (1991) Shrek (2001) Lion King The (1994) worse movies of this genre Quest for Camelot The (1998) Happily NEver After (2007) Ant Bully The (2006) Three...better movies of (voices) Ewan McGregor Robots (2005) (There are no more better movies of (voices) Ewan McGregor) worse movies of (voices) Ewan McGregor (There are no more worst movies of (voices) Ewan McGregor) Three...better movies of Rik Mayall (There are no more better movies of Rik Mayall) worse movies of Rik Mayall (There are no more worst movies of Rik Mayall) Three...better movies of Pip Torrens (There are no more better movies of Pip Torrens) worse movies of Pip Torrens (There are no more worst movies of Pip Torrens) ReelViews Library Currently in Cinema Writings Fictional Writings ReelThoughts Specials About Privacy Policy Terms and Conditions Contact Website credits",http://www.reelviews.net/php_review_template.php?identifier=1247,200,valiant2,valiant,reelviews
Movie | stltoday.com Sign Up Log In Dashboard Logout My Account Dashboard Profile Saved items Logout Subscriber services Contact us E-edition Contests Apps Newsletters Obits News Education Election 2016 Databases Columnists Illinois Law and order Metro Nation Obits Political Fix St. Charles Weather Opinion Letters to the editor Columnists Business Top Workplaces Press releases Columnists Sports Cardinals Blues Mizzou Olympics SLU NFL Golf Forums Columnists Chats High schools Schedules Schools Sports Stats Go Entertainment Books Calendar Comics amp; games Dining Music Movies Television Theater amp; arts Columnists Lifestyles Advice Automotive Fashion Food and cooking Health Home and Garden Parenting Religion Travel Columnists Feast Magazine St. Louis Best Bridal Ladue News Multimedia Photos Videos Chats Forums Buy/sell Classifieds Real estate Business Directory Print Ads Newspaper ads Page reprints Autos Jobs Homes Archives Toggle navigation Menu Search Search Log In Using Your Account Log In Dont have an account? Sign Up Today My Account Dashboard Profile Saved items Logout 87deg Saint Louis MO (63101) Today Partly cloudy. Tonight Some passing clouds. Low around 70F. Winds N at 5 to 10 mph. Updated July 30 2016  353 pm Full Forecast News Sports Business Go Life Buy/Sell Sorry the page youre looking for cannot be found. 404 The page may have moved you may have mistyped the address or followed a bad link. Visit our homepage or search for whatever you were looking for... Feast Magazine Ladue News St. Louis Best Bridal STL High School Sports Products and features Apps Archives Calendar Chats Comics amp; games Contests E-edition Forums Newsletters Our events Press releases Tools and services Advertise with us Autos Classifieds Contact us Homes Jobs Newspapers in Education Page reprints Post-Dispatch store Site help Subscriber services (c) Copyright 2016 STLtoday.com 900 N. Tucker Blvd. St. Louis MO | Terms of Use | Privacy Policy Powered by BLOX Content Management System from TownNews.com.,http://www.stltoday.com/stltoday/entertainment/reviews.nsf/movie/story/9C606E8C13C1F7268625706200505312?OpenDocument,404,valiant3,valiant,stltoday
"A Military Coo washingtonpost.com gt; Arts amp; Living gt; Movies >> Follow Movies On Movies A Military Coo Fly boys On the wing members of Britains Royal Homing Pigeon Service team up with Rollo a mouse whos part of the French Resistance. (Copyright 2005 Disney/vanguard Animation Uk Limited/uk Film Council.) Network News X Profile View More Activity TOOLBOX Resize Print E-mail Reprints By Ann Hornaday Washington Post Staff Writer Friday August 19 2005 ""What did you think of the movie?"" ""Scawy."" Thats pretty much a verbatim account of a lunchtime conversation with the 3 1/2 -year-old who accompanied this critic to a Saturday-morning preview of ""Valiant"" Disneys last attempt of the summer to entertain the kids before theyre safely warehoused -- er enrolled -- back in school and day care for the fall. Whether kids will thank Disney or feel like theyve been given some early homework however is open to question. ""Valiant"" is a smart marvelously drawn account of the bravery of homing pigeons during World War II when 31 real British birds won the equivalent of the Victoria Cross for outstanding service. Indeed the movie is so faithful to its historical subject that it resembles an animated version of a walk through Londons somber Imperial War Museum; edifying enlightening rather humbling but not what most kids would describe as a lot of wacky end-of-summer fun . At a recent screening young viewers were rapt but the only laughs heard in the audience were the quiet chuckles of parents appreciating the films subtle interstitial humor. Still as long as expectations are properly managed ""Valiant"" will be a tonic compared with some of the fluffier animated films usually offered to kids. The story -- about a tiny wood pigeon named Valiant (voiced by Ewan McGregor) who enlists in the Royal Homing Pigeon Service and finds himself saving the day by going behind enemy lines -- is engrossing even though the finer points of espionage wartime sacrifice and the strategic role of the French Resistance may elude very young viewers. Then there are those ""scawy"" parts which usually involve surprisingly intense battle action and some grim bird-on-bird violence especially when a group of German falcons swoops down on the stout British pigeons with bloodthirsty ferocity. At one point a British bird voiced by John Cleese is taken prisoner in one of the falcons pillboxes which the animators have endowed with deco monumentalism worthy of Albert Speer. ""Ve hef vays of making you squawk"" says Von Talon (Tim Curry) the preening chief falcon. In a typical example of ""Valiants"" knowing humor Von Talons secret weapon is to force his victims to listen to yodeling (a form of torture conveniently left out of the Geneva Conventions). Meanwhile Valiant along with a new friend named Bugsy (Ricky Gervais the brilliant star of BBCs ""The Office"") joins up with the RHPS and the two endure the kind of classic war-movie training that always begins with a commander yelling ""Gentlemen welcome to the . . . ."" Valiant and his -- what else -- ragtag gang of misfits may be the only soldiers who train by flying in and out of the structures at Stonehenge but train they do until theyre unexpectedly called to France. Thats when things become really dodgy They are shot down they barely receive a message from French spies they suffer a falcon attack and they infiltrate Von Talons lair finally returning to Britain with the message -- something about the location of a landing being changed to Normandy. Fans of classic World War II movies will appreciate ""Valiants"" old-school aesthetic and storytelling sense a return to core cinematic values that is made even more classy by a first-rate all-British cast. Whats more first-time director Gary Chapman and his crack team of animators have done a terrific job with the graphics rendering Valiant and his fellow birds with painterly detail right down to the blue green and violet iridescence of their feathers. The artistic team takes similar care with the pigeons world bringing to life such beloved landmarks as Big Ben Trafalgar Square and the white cliffs of Dover. A soundtrack gleaned from 1940s classics and some authentic-looking newsreels (in which cartoon pigeons train and mug just like human soldiers did back in the day) complete a production that for many parents will be a relief from the incessant pop-culture references and Top 40 hits that drive so many of todays animated features. And even though its historical references and battle scenes may fly over their heads like so many homing pigeons kids will enjoy ""Valiant"" too if only for its nonstop action and lively visual design. To pick up that lunchtime conversation where we left off the toddler was asked whether she would want to see ""Valiant"" again. ""Um-hmm"" she said nodding emphatically just before taking a swig of chocolate milk and turning her attention to the hot dog before her. Valiant (76 minutes at area theaters) is rated G. (c) 2005 The Washington Post Company Network News X My Profile Friends Activity View More Activity",http://www.washingtonpost.com/wp-dyn/content/article/2005/08/18/AR2005081801911.html,200,valiant4,valiant,washingtonpost
