review,link,status_code,id,movie_key,critic
White Chicks (2004) directed by Keenen Ivory Wayans | Film review Go to the content Go to the footer Time Out London London Popular cities London New York Paris Chicago Los Angeles Browse all cities Time Out London Close London Change city London Popular cities London New York Paris Chicago Los Angeles Browse all cities Tickets Offers Things to Do Restaurants Bars amp; Pubs Film Theatre Art Music Attractions Blog Theatre Tickets Shopping Offer of the Day Time Out Card Time Out Escapes Time Out Live Hotels Nightlife Music festivals Events amp; Festivals Kids Museums Clubs Comedy Food amp; Drink Classical Music amp; Opera Dance LGBT City Guide Area Guides Property Competitions Dating Close My Time Out Things I love My lists My Profile My Account Sign out Sign in Create account Sign in With your social account Or with your email Email Password Remember me Forgotten your password? Sign in You can create a Time Out account in two ways... With a few clicks using your favourite social network Or by entering your details below Email First Name Last Name Create password Repeat new password I accept Time Outs terms of use including opt-in to newsletters. Create account Welcome  You have successfully connected your account to Time Out. You may sign in with this account in future. Please confirm your account details Email First Name Last Name I accept Time Outs terms of use including opt-in to newsletters. Sign up My Account Sign in or Create account Search Tickets Offers Things to Do Restaurants Bars amp; Pubs Film Theatre Art Music Attractions Blog Theatre Tickets Shopping Offer of the Day Time Out Card Time Out Escapes Time Out Live Hotels Nightlife Music festivals Events amp; Festivals Kids Museums Clubs Comedy Food amp; Drink Classical Music amp; Opera Dance LGBT City Guide Area Guides Property Competitions Dating More Search White Chicks Film  Comedy Add review 0 Love It Save it 0 Add review 0 Love It Save it Time Out says Details Users say Time Out says Two black male FBI officers go undercover as white society girls hardly the sell of the century is it? Nevertheless this comedy caper got the green light - perhaps we have its stars sitcom brothers Shawn and Marlon Wayans to thank. Or not. Its hardly a credible affair for starters. Not only do two men clearly wearing hideous rubber masks pass for women but they pass for two specific women notorious party girls under threat of kidnap who must be replaced in the Hamptons (there is at least a spurious plot point to explain why white female FBI agents werent called upon). While the black men teach the Hamptons girls a thing or two about enjoying themselves they learn about womens ways and try to dodge lecherous rich men Some Like It Hot style. Most gags are as weak as they are derivative offering little incentive to suspend ones disbelief and as for the gender politics well... you can only imagine. By AS Details Release details Rated 12A Release date Friday October 15 2004 Duration 97 mins Cast and crew Director Keenen Ivory Wayans Cast Shawn WayansMarlon WayansJaime KingFrankie FaisonLochlyn Munro Users say LiveReviews|01 person listeningSign inWrite reviewMost helpfulMost helpfulHighest ratingLowest ratingNewestOldestLoadingundefinedNew CommentsRefreshShow More Share Tweet 0 Shares Top About us Work for Time Out Privacy policy Cookie Policy Website terms of use Contact us Time Out for business Get listed Claim your listing Premium Profiles Advertising Time Out products Time Out Card Mobile apps Time Out Shop Time Out Guides Time Out Travel Time Out Offers Time Out Worldwide Time Out magazine Where to get Time Out magazine Subscribe to Time Out magazine Manage my subscription Follow us Facebook Twitter Youtube Instagram Pinterest Spotify Time Out London Site map },http://www.timeout.com/film/81395.html,200,whitechicks0,whitechicks,timeout
File not found404 File not foundFile not found /stltoday/entertainment/reviews.nsf/movie/story/5e1db61bd8fba46186256ebb00394e99,http://www.stltoday.com/stltoday/entertainment/reviews.nsf/movie/story/5E1DB61BD8FBA46186256EBB00394E99?OpenDocument,404,whitechicks1,whitechicks,stltoday
"New York | Not Found | Village Voice NewsVLongformThe MTAMediaNYPDPoliticsMake It StopCultureLGBTTop Stories NewsletterMusicVAsk Andrew W.K.New YorkersMusic ListsBars amp; LoungesConcert CalendarMusic NewsletterFood amp; DrinkVNYC Restaurant GuideRestaurant Reviews100 Favorite Dishes99 Essential Restaurants in BKPizzaFood amp; Drink ListsFood amp; Drink NewsletterArts amp; CultureVVisual ArtsTheaterBooksComedyObiesThe Seen A NYC Style GuideTheater NewsletterCalendarVSubmit an EventConcert CalendarThings To Do NewsletterFilm amp; TVVNews amp; InterviewsFilm ReviewsShowtimesTrailersVillage Voice Film PollFilm PodcastFilm amp; TV NewsletterLongformVideosSlideshowsBest Of NYC(r)VArts amp; EntertainmentFood amp; DrinkShopping amp; ServicesSports amp; RecreationReaders ChoiceBest Of NewsletterPromotionsVPromotional EventsStreet TeamFree StuffPromotions NewsletterClassifiedsVMedical Studies Apps About Us Contact Us Staff Careers Advertise E-Edition Privacy Terms menu Remember Me SIGN IN > Forgot Password? Or sign in with a social account FACEBOOK GOOGLE + TWITTER YAHOO Dont have an account yet? Sign Up > Connect. Discover. Share. Get the most out of your experience with a personalized all-access pass to everything local on events music restaurants news and more. Enter your email or sign up with a social account to get started FACEBOOK TWITTER GOOGLE+ YAHOO Privacy Policy SIGN UP > Already registered? Login > Email Username Password Name Zipcode DONE MVN Sign In > Dont have an account yet? Sign Up > Facebook Twitter Follow villagevoice Other MORE That page could not be found. Whoops we cant seem to find what youre looking for. Based upon what we do know here are some search results that you might find useful.  Article Kiddie-Contest Doc Dances Around Class Gender Issues 11 years ago by Laura Sinagra Like Spellbounds glimpse of the darker side of childhood competition Mad Hot Ballroom--a look at New York City schools fifth-grade ballroom dance program--is best when exploring issues of class and gender and definitions of success. Director Marilyn Agrelo picks three fascinating schools--in Tribeca Bensonhurst and Washington Heights--and documents the 10...  Article Three of Hearts A Postmodern Family 11 years ago by Laura Sinagra This well-told doc follows nine years in the lives of a gay couple and the woman they invited to share their relationship. When we meet this happy threesome--Sam Steven and Samantha--theyre trying to get pregnant. In winning interviews spliced between suspenseful EPT tests the assertively bourgeois strivers chat about their...  Article Film 12 years ago by Laura Sinagra With just the right balance of epic grandeur and break-into-song goofiness this Bollywood love legend does double duty as a womens-rights manifesto and a plea for amity between India and Pakistan. Hindu rescue pilot Veer Singh (Shah Rukh Khan whose welling emotions and quaking stoicism recall Benicio Del Toro) and...  Article Saturday saturday 04/26 [CONCERT] PLAYING THE GAME A digital and musical sensory overload Ever wonder what Donkey Kongs music would sound like if played by a full orchestra? Yeah us neither. But what the hell Video Games Live sounds like a cool concept the tunes you remember from classic games played...  Article Letters from Chad Filmmaking without a film industry 13 years ago by Laura Sinagra Bordeaux-based Mahamat-Saleh Haroun is happy to be part of a ""filmmaking gang."" It is he says ""the only way you change things build things."" He explains that his current film Abouna about two young boys abandoned by their father in Chad is in direct conversation with the meditative work of... All 167 results or Back to home (c)2016 Village Voice LLC. All rights reserved. Newsletters All-access pass to the top stories events and offers around town. Top Stories Send Sign Up gt; Remind Me Later gt; No Thanks gt; Privacy Policy Newsletters All-access pass to top stories events and offers around town. Sign Up gt; No Thanks Remind Me Later gt;",http://www.villagevoice.com/issues/0426/sinagra.php,404,whitechicks2,whitechicks,villagevoice
"White Chicks No Wayans (washingtonpost.com) <a href=""http//ad.doubleclick.net/jump/wpni.artsandlivingarticle/movies/reviewsdcopt=ist;dir=howenode;dir=artsandliving;dir=movies;dir=reviews;dir=howe;page=article;kw=;ad=bn;pos=ad1;sz=468x60;tile=10;ord=1088151925459?""></a> <a href=""http//ad.doubleclick.net/jump/wpni.artsandlivingarticle/movies/reviews;dir=howenode;dir=artsandliving;dir=movies;dir=reviews;dir=howe;page=article;kw=;ad=lb;ad=bn;pos=ad19;sz=728x90;tile=10;abr=ie;ord=1088151925460?""></a> washingtonpost.com gt; Arts amp; Living gt; Desson Thomson on Movies White Chicks No Wayans By Desson Thomson Washington Post Staff Writer Thursday June 24 2004; Page WE36 There is no end to the Wayans family it seems as well as their perpetual presence on the screen in bad comedies. <a href=""http//ad.doubleclick.net/jump/wpni.artsandlivingarticle/movies/reviews;dir=howenode;dir=artsandliving;dir=movies;dir=reviews;dir=howe;page=article;kw=;ad=ss;ad=bb;ad=hp;pos=ad26;sz=300x250;tile=20;abr=ie;ord=1088151925466?""></a> <a href=""http//ad.doubleclick.net/jump/wpni.artsandlivingarticle/movies/reviews;dir=howenode;dir=artsandliving;dir=movies;dir=reviews;dir=howe;page=article;kw=;ad=ss;ad=bb;ad=hp;pos=ad27;sz=160x600;tile=20;abr=ie;ord=1088151925467?""></a> <a href=""http//ad.doubleclick.net/jump/wpni.artsandlivingarticle/movies/reviews;dir=howenode;dir=artsandliving;dir=movies;dir=reviews;dir=howe;page=article;kw=;ad=ss;ad=bb;ad=hp;pos=ad24;sz=336x850;tile=20;abr=ie;ord=1088151925468?""></a> In this banshee-howlingly awful caper tiresomely drawn from a few dozen other bad cross-dressing films of the forgettable past Marlon and Shawn Wayans (the untalented end of the family) are two disgraced FBI agents. Determined to show they have the right stuff they volunteer to pose as doubles for two white pampered heiresses Brittany and Tiffany (Maitland Ward and Anne Dudek) who are in danger of being kidnapped. Cue the latex breasts the blond wigs and both Wayans speaking in ""knee-slapping"" mall-princess falsetto. Laugh? I thought Id never start. WHITE CHICKS (PG-13 105 minutes) --Contains crude and sexual humor obscenity and drug use. Area theaters. (c) 2004 The Washington Post Company E-Mail This Article Print This Article Permission to Republish _____Online Extras_____  White Chicks Showtimes  Summer Movie Guide  Arts amp; Living Movies _____Desson Thomson_____  More Reviews  Live Online Behind the Screen  Arts amp; Living Movies _____Free E-mail Newsletters_____  News Headlines  News Alert <a href=""http//ad.doubleclick.net/jump/wpni.artsandlivingarticle/movies/reviews;dir=howenode;dir=artsandliving;dir=movies;dir=reviews;dir=howe;page=article;kw=;ad=bn;pos=ad2;sz=468x60;tile=40;ord=1088151925532?""></a> <a href=""http//ad.doubleclick.net/jump/wpni.artsandlivingarticle/movies/reviews;dir=howenode;dir=artsandliving;dir=movies;dir=reviews;dir=howe;page=article;kw=;ad=lb;ad=bn;pos=ad25;sz=728x90;tile=40;abr=ie;ord=1088151925533?""></a> <a href=""http//ad.doubleclick.net/jump/wpni.artsandlivingarticle/movies/reviews;dir=howenode;dir=artsandliving;dir=movies;dir=reviews;dir=howe;page=article;kw=;ad=ss;pos=ad28;sz=160x600;tile=50;abr=ie;ord=1088151925558?""></a>",http://www.washingtonpost.com/wp-dyn/articles/A3026-2004Jun24.html,200,whitechicks3,whitechicks,washingtonpost
"White Chicks | EW.com Skip to main content Sign In Log Out TV TV Recaps Movies Music Books Gaming Video Big Brother Queen of the South Mr. Robot Wayward Pines Suits Tyrant Shop Newsletter Subscribe Get 1 year for 25 Save 86% off the cover price SUBSCRIBE More Great Stuff Comic-Con Hulu Hot List 50Scoops EW Popfest For Your Consideration Jess Cagle Interview Stage Follow EW EW on Facebook EW on Twitter EW on Tumblr EW on Instagram About EW Contact UsCustomer ServiceAbout UsJobs at Time Inc.AdvertisePrivacy PolicyYour California Privacy RightsAd ChoicesNewslettersSubscribeTerms of ServiceSite Map Copyright 2015 Entertainment Weekly Inc. All rights reserved. Login Log out TV TV Recaps Movies Music Books Gaming Video More... TV This Weeks Cover The Walking... TV Exclusive Photos of The Walking... EW POPFEST Get the details 50Scoops50Days Exclusive... Movies Crazy Stupid Love Before Th... Movies The Most 2000s Fashion From Joh... Movies 27 Great Revenge Movies Movies Alice in Wonderland Witticism... Movies John Tucker Must Die Where Ar... Books 15 Captivating International Cri... Movies Planet of the Apes See the Fa... Movies Toronto Film Festival 2016 See... TV One Tree Hill Where Are They... Movies Little Miss Sunshine Where Ar... Books Harry Potter and the Cursed Chi... Movies Comic-Con 2016 See Portraits of... TV Friends See the Casts Evolut... TV Comic-Con 2016 Get Batty With... Movies The Dark Tower Storybook Steph... News Comic-Con 2016 Star Portraits... TV 10 of the Best Moments From The... Movies The Dark Tower Storybook Steph... Movies Thelma and Louise See Rare Behi... Movies 9 of Garry Marshalls Best Movies Movies Every Star Trek Movie Ranked Movies Big Trouble in Little China... Movies The Dark Tower Exclusive Firs... Movies Suicide Squad Before They Wer... Movies The 10 Best Movies of 2016 (So Far) TV Fear the Walking Dead introduc... Movies by Owen Gleiberman Share Tweet Share on Google+ Share on Pinterest Share on Tumblr White ChicksBy now Some Like It Hot has become a genre unto itself and the role-reversal comedies that descend from it regardless of how chintzy have a way of...White ChicksComedy Action/AdventureKeenen Ivory Wayans Marlon Wayans Shawn WayansPT105MPG-13By now Some Like It Hot has become a genre unto itself and the role-reversal comedies that descend from it regardless of how chintzy have a way of...2004-06-25Rochelle AytesBrittany DanielJames KingBusy PhilippsRochelle Aytes Brittany Daniel James King Busy PhilippsColumbia Pictures Share Tweet Share on Google+ Share on Pinterest Share on Tumblr (White Chicks Joe Lederer) C+ White Chicks Genre Comedy Action/Adventure; Starring Marlon Wayans Shawn Wayans Rochelle Aytes Brittany Daniel James King Busy Philipps; Director Keenen Ivory Wayans; Author Keenen Ivory Wayans Marlon Wayans Shawn Wayans; Release Date Wide 06/23/2004; Runtime (in minutes) 105; MPAA Rating PG-13; Distributor Columbia Pictures Posted June 25 2004 -- 1200 AM EDT By now ""Some Like It Hot"" has become a genre unto itself and the role-reversal comedies that descend from it regardless of how chintzy have a way of stumbling into zeitgeist collisions of sex and style. In White Chicks the latest slipshod taboo-nudging burlesque from the Wayans brothers a pair of disgruntled FBI agents (Marlon and Shawn Wayans) put on alabaster body paint latex facial padding and blue contact lenses in order to go undercover as the Wilson sisters who coo and roll their eyes and speak in spoiled-rotten Valley patois (""Im so frickin pissed""). The joke it would appear is that the agents could hardly be more different from the vapid Hilton-sister knockoffs theyre impersonating. Yet theres a tickle of surprise - I wouldnt quite call it wit - nestled within the dress-up-doll broadness. Incognito the Wayans brothers may look like twin plastic Halloween masks of Tori Spelling but the real joke is that the aggressive swagger of two cliche African-American law enforcers overlaps in bizarre ways with the bitch-slap hauteur of todays tiara brats. ""White Chicks"" is a tawdry excuse for a movie but it has a handful of shameless giggles. Share Tweet Share on Google+ Share on Pinterest Share on Tumblr Top Stories J.K. Rowling meets Harry Potter and the Cursed Child cast in photo Fast and Furious 8 Dwayne Johnson dives for cover in new set video Kanye West on Apples talks with Tidal Let the kids have the music A Chorus Line kicks up the classics at the Hollywood Bowl Sarah Jessica Parker New HBO show isnt Sex and the City The Larry Sanders Show reruns returning to HBO this fall Stranger Things cast and fans scared with even Stranger prank Photo Galleries 50Scoops50Days The Latest in Fall TV News The Biggest Moments From the 2016 Conventions Crazy Stupid Love Before They Were Stars The Most 2000s Fashion From John Tucker Must Die Exclusive Photos of The Walking Dead Season 7 27 Great Revenge Movies Alice in Wonderland Witticisms and Wisdom From the Disney Classic From Our Partners From Our Partners Contact UsCustomer ServiceAbout UsJobs at Time Inc.AdvertisePrivacy PolicyYour California Privacy RightsAd ChoicesNewslettersSubscribeTerms of ServiceSite Map Copyright (c) 2016 Entertainment Weekly Inc. All rights reserved. img[data-src] { display none important; }","http://www.ew.com/ew/article/0,,658013,00.html",200,whitechicks4,whitechicks,ew
"Satire in White Chicks hardly goes skin-deep - The Boston Globe Movies    Restaurants    Food    Calendar    Music    Theater/Arts    TV    Books    Celebrity news    Games Home gt; Aamp;E gt; Movies MOVIE REVIEW Satire in White Chicks hardly goes skin-deep By Wesley Morris Globe Staff  |  June 23 2004 The bratty blond socialites Shawn and Marlon Wayans impersonate in ""White Chicks"" are vain shallow ignorant addicted to designer labels rude to people of color and possibly soulless. But white? Not so much.The Wayanses brown skin and long athletic frames are hidden beneath elaborate prosthetic suits and flaxen wigs that make them look alternately like life-size Barbie dolls and the ceramic Michael Jackson of that famous Jeff Koons sculpture subhumanly artificial. Their lack of physical resemblance to actual spoiled dingbats goes unnoticed by everybody in this patchy inept satire.But the movie doesnt care about biological whiteness so much as its cultural twin and on that front the movies timing really couldnt be any better. White girls flaunty entitlement might be displacing hip-hop materialism as popular cultures number one attitude. Lindsay Lohan was thoroughly obnoxious in ""Confessions of a Teenage Drama Queen"" only to reform and square off against mean girls; the global popularity of Britney Spears cannot be stopped; people love Jessica Simpsons brilliant dimness and cant stop reading best-selling junk food such as ""The Devil Wears Prada"" and ""Bergdorf Blondes."" Meanwhile West Coast princesses Paris Hilton and Nicole Richie run amok again through middle America.Into this explosion of girls behaving badly step the Wayanses comedians capable of spotting the trend (or is it an epidemic?) and brutalizing it. Shawn and Marlon play Kevin and Marcus Copeland two neer-do-well FBI agents given a probationary assignment to escort hotel heiresses the Wilson sisters Brittany and Tiffany (Maitland Ward and Anne Dudek) from their private jet to the Hamptons for Labor Day. Theres a car accident. The girls get scratches on their faces and refuse to be seen with boo-boos. But the Wilsons need to arrive safe and sound or Kevin and Marcus will be fired. So rather than explain the truth to their irritable chief (Frankie Faison) they call in the bureaus masters of disguise to turn them into impostor Wilson sisters who arrive at the Hamptons just in time to fool everybody -- nemeses and fake friends alike -- into thinking that these taller kinder more albino-looking girls are the real things. The actual Wilsons sit and pout somewhere in Manhattan. (Oh I forgot to mention that the sisters are also the objects of a kidnapping plot.)Those waiting to see entitled girls savaged for 100 minutes will probably find ""White Chicks"" the years most disappointing movie. Marlon Shawn and Keenen Ivory Wayans who directs ""White Chicks"" -- and barely -- also made the first two installments of ""Scary Movie"" which showed us white popular culture through black eyes. The view was unprecedented and for the most part outrageous and entertainingly stupid. Only occasionally does the movie which Shawn and Marlon wrote with three other people play fast and loose with racial difference in a way that produces any legitimate laughs. The fake sisters in one very funny example hop in a car with three of the Wilsons pals who flip out when Vanessa Carltons three-year-old preppy ditty ""A Thousand Miles"" comes on the radio (its their ""jam"") and the fake Wilsons encourage them to listen to an R-rated rap song instead. The friends object because it contains the ""N"" word. One sister says ""Nobodys around"" so the whole car breaks into bumptious obscenities.More often the movie makes a beeline for bathroom jokes assorted antics and side plots. Marcus is chasing a pretty journalist while Kevin is running from his suspicious wife and a muscle-bound self-hating playboy whos addicted to white women. The playboy is played by the very funny Terry Crews of ""Baadasssss"" and ""Soul Plane"" who seems to be spending his year stealing scenes in neo-blaxploitation movies. When hes around the movie has the antic spirit of low-low-rent Marx Brothers.Otherwise Keenen Ivory Wayans treats ""White Chicks"" not as burlesque or farce but as an action comedy that wouldnt seem fresh if it came out in 1984. The film feels long when it should be brisk and its bloated with stretches of hot dead air. The racial kitsch goes nowhere. Thats unfortunate White chicks from the Olsens to the Hiltons are here for the skewering but the shabby jabs by the Wayanses mean these sisters will have to do it for themselves.Wesley Morris can be reached at wmorrisglobe.com.White ChicksDirected by Keenen Ivory WayansWritten by Shawn Wayans Marlon Wayans Andy McElfresh Michael Anthony Snowden and Xavier CookStarring MarlonWayans Shawn Wayans Brittany Daniel Terry Crews Frankie Faison Lochlyn Munro Jaime King and John HeardAt Boston Common Fenway suburbsRunning time 111 minutesRated PG-13 (crude and sexual humor language drug content) (c) Copyright 2006 Globe Newspaper Company. More Globe Living/Arts stories | Aamp;E section | Latest entertainment news | Globe front page | Boston.com Sign up for Globe Headlines e-mail | Breaking News Alerts Advertisement SEARCH THE ARCHIVES Today (free) Yesterday (free) Past 30 days Last 12 months Advanced search / Historic Archives Advertisement Printer friendly E-mail to a friend Movies RSS feed Available RSS feeds Most e-mailed Reprints amp; Licensing Share on Facebook Save this article powered by Del.icio.us feedback form | help | site index | globe archives | rss (c) 20 The New York Times Company",http://www.boston.com/ae/movies/articles/2004/06/23/satire_in_white_chicks_hardly_goes_skin_deep,200,whitechicks5,whitechicks,boston
410 Gone Gone The requested resource/film/film_results.php is no longer available on this server and there is no forwarding address. Please remove all references to this resource.,http://www.laweekly.com/film/film_results.php?showid=2996,410,whitechicks6,whitechicks,laweekly
