review,link,status_code,id,movie_key,critic
"Great White Hopeless (washingtonpost.com) <a href=""http//ad.doubleclick.net/jump/wpni.artsandlivingarticle/movies/reviewsdcopt=ist;dir=hunternode;dir=artsandliving;dir=movies;dir=reviews;dir=hunter;page=article;kw=;ad=bn;pos=ad1;sz=468x60;tile=10;ord=1087997786295?""></a> <a href=""http//ad.doubleclick.net/jump/wpni.artsandlivingarticle/movies/reviews;dir=hunternode;dir=artsandliving;dir=movies;dir=reviews;dir=hunter;page=article;kw=;ad=lb;ad=bn;pos=ad19;sz=728x90;tile=10;abr=ie;ord=1087997786296?""></a> washingtonpost.com gt; Arts amp; Living gt; Stephen Hunter on Movies Movies Great White Hopeless White Chicks Unbelievable but Funny By Stephen Hunter Washington Post Staff Writer Wednesday June 23 2004; Page C04 Think of ""White Chicks"" as a crude parody of Billy Wilders ""Some Like It Hot""; it could be called ""Some Like It White."" Its about a couple of disgraced FBI agents who transform not only their gender but also their ethnicity until they have become the creatures of the title in order to crack an extremely lame kidnapping conspiracy. <a href=""http//ad.doubleclick.net/jump/wpni.artsandlivingarticle/movies/reviews;dir=hunternode;dir=artsandliving;dir=movies;dir=reviews;dir=hunter;page=article;kw=;ad=ss;ad=bb;ad=hp;pos=ad26;sz=300x250;tile=20;abr=ie;ord=1087997786309?""></a> <a href=""http//ad.doubleclick.net/jump/wpni.artsandlivingarticle/movies/reviews;dir=hunternode;dir=artsandliving;dir=movies;dir=reviews;dir=hunter;page=article;kw=;ad=ss;ad=bb;ad=hp;pos=ad27;sz=160x600;tile=20;abr=ie;ord=1087997786309?""></a> <a href=""http//ad.doubleclick.net/jump/wpni.artsandlivingarticle/movies/reviews;dir=hunternode;dir=artsandliving;dir=movies;dir=reviews;dir=hunter;page=article;kw=;ad=ss;ad=bb;ad=hp;pos=ad24;sz=336x850;tile=20;abr=ie;ord=1087997786310?""></a> But its not what the Wayans brothers do its how they do it. They do it funny. Older sibling Keenen Ivory directs younger siblings Shawn and Marlon co-write with him and Shawn and Marlon star. Do yourself a favor and take an extended 27.95 popcorn-and-Coke break in the lobby during the flatulence-in-the-fancy-restaurant bit and you might find yourself happier going out than when you went in. Almost nothing formal in the film works. By formal I mean little stuff like oh you know plot setting character believability of milieu dialogue conviction of central device. So whats left? Well the Wayans brothers going downtown way uptown. They play feeble Feebs named Marcus and Kevin Copeland whose job performance has them on the edge of getting fired. Finally given the low-strain task of driving two rich blond sisters to the Hamptons where they will be put under protective observation as a way of capturing a kidnapper they have a minor accident and each of the high-strung girls receives a minor facial laceration. Since the girls are spoiled trivial silly vain ignorant and sullen they refuse to appear in public with bandages and instead decide to spend the weekend in a New York hotel. So the brothers use the FBIs disguise technology to masquerade as the two sisters. They will go up to the prissy glades of far Long Island and sport with the preppies the millionaires the celebs and the wannabes whove turned that neck of the woods into the worlds most exclusive creep zone. Now as a movie illusion this just never begins to work. The two dont look a thing like white chicks. They dont look like black men either. They sort of look like they come from the future rubberized robotoids from the planet of the really cheesy special effects. Their faces arent turned white cosmetically but planted under rubber cheek forms; the result is dead dead dull inexpressive rendered yet more ""I Robot""-like by blond wigs that look like skinned poodles that have been soaking in the Tallahatchie River for years. But as a premise for some good tough sketch comedy the device is brilliant. It affords us a look into a world through strange eyes. When one of them encounters a girl in a dressing room you think Oh here we go cheap boob jokes. But thats not it. What he discovers is a young woman crippled by body anxiety tormented by three extra ounces that she sees as ruining her body and her life since her life is her body. Thats a continuous surprise in the film the Wayanses so immature in so many ways dont use their entree into girl world for tawdry purposes. Quite the contrary and sometimes even movingly they become anchors of faith and self-belief almost psychological medics who apply instant first aid to the many many wounds of bitter girl combat. A continual joke is that as black men strong and body-confident and well-versed in dynamic improvisatory verbal traditions they make superb white chicks. Theyre smarter faster tougher than the rest of the gals and affiliated with a lesser clique they lead their crew to social triumph. And when the white boys condescend to them or cop attitude on them the boys get a lesson fast. Thats whats so good about ""White Chicks"" and often so funny. What else is good about it? Er nothing. White Chicks (105 minutes at area theaters) is rated PG-13 for drug-related humor plus a revolting bathroom-joke sequence. (c) 2004 The Washington Post Company E-Mail This Article Print This Article Permission to Republish Shawn Wayans left and his brother Marlon go undercover but hardly look like the rich white sisters they are supposed to be in ""White Chicks."" (Joe Lederer -- Revolution Studios) _____Online Extras_____  White Chicks Showtimes  Summer Movie Guide  Arts amp; Living Movies _____Free E-mail Newsletters_____  News Headlines  News Alert <a href=""http//ad.doubleclick.net/jump/wpni.artsandlivingarticle/movies/reviews;dir=hunternode;dir=artsandliving;dir=movies;dir=reviews;dir=hunter;page=article;kw=;ad=bn;pos=ad2;sz=468x60;tile=40;ord=1087997786498?""></a> <a href=""http//ad.doubleclick.net/jump/wpni.artsandlivingarticle/movies/reviews;dir=hunternode;dir=artsandliving;dir=movies;dir=reviews;dir=hunter;page=article;kw=;ad=lb;ad=bn;pos=ad25;sz=728x90;tile=40;abr=ie;ord=1087997786499?""></a> <a href=""http//ad.doubleclick.net/jump/wpni.artsandlivingarticle/movies/reviews;dir=hunternode;dir=artsandliving;dir=movies;dir=reviews;dir=hunter;page=article;kw=;ad=ss;pos=ad28;sz=160x600;tile=50;abr=ie;ord=1087997786526?""></a>",http://www.washingtonpost.com/wp-dyn/articles/A62496-2004Jun22.html,200,whitechicks7,whitechicks,washingtonpost
"White Chicks | Variety Variety Editions U.S Latino Global Asia Subscribe Today Navigation Menu Film TV Digital Contenders Video Dirt Jobs More Biz Music Legit Scene Conferences Insight Archives Directory Choose Edition U.S Latino Global Asia Russia | My Account Sign In Subscribe HomeFilmReviews Review White Chicks David Rooney 0 Share This Article Email LinkedIn Pin It Tumblr June 22 2004 | 0628PM PT Following ""Connie and Carla"" as this years second brazen ""Some Like It Hot"" rip-off ""White Chicks"" poses zero threat to Billy Wilders supremacy. But as lowbrow comedies go it pretty much delivers. The Wayans brothers vehicle should post fierce early summer numbers with more booty down the road on DVD. Following ""Connie and Carla"" as this years second brazen ""Some Like It Hot"" rip-off ""White Chicks"" poses zero threat to Billy Wilders supremacy. But as lowbrow comedies go it pretty much delivers. While the same concept in blackface would have the PC police reaching for their weapons this caper about two black Feds going undercover as skanky white heiresses scores more hits than misses before stumbling in the final act. More likely to pull urban audiences and women than gagfest rival ""DodgeBall"" the Wayans brothers vehicle should post fierce early summer numbers with more booty down the road on DVD. Scripted by a team that includes director Keenen Ivory Wayans brothers Shawn and Marlon and writing alumni from their various television outings including ""In Living Color"" the comedy skewers easy but irresistible targets in two sets of spotlight-seeking Hilton sister clones and their Hamptons debutante sorority. Most of the best jokes are at the expense of unhip white folks or vacuous rich ho-bags driven by reverse racial stereotyping but the comedy saves a few digs for black dudes and their treatment of pale-skinned trophies. Brothers Kevin and Marcus Copeland (Shawn and Marlon respectively) are low-level FBI agents with a dismal arrest record. Amusing opening has them posing as Latino clerks at a convenience store to make a drug bust. After they arrest the wrong guys and losethe real culprits the brothers are warned by section chief Gordon (Frankie Faison) that one more screw-up will cost them their jobs. When a plot emerges to kidnap socialite sisters Brittany (Maitland Ward) and Tiffany Wilson (Anne Dudek) the Copelands are assigned the thankless task of escorting them safely from the airport to their Hamptons summer hangout while the brothers FBI rivals Gomez (Eddie Velez) and Harper (Lochlyn Munro) get to track the kidnappers. The fragile setup that gets the Copeland boys into the Wilson sisters shoes hardly stands up to scrutiny. En route from the airport Tiffanys pampered dog causes an accident leaving the girls with a scratched nose and a busted lip. Following a major B.F. (bitch fit) they refuse to leave their Gotham hotel suite and jeopardize their chances of making the cover of Hamptons Magazine. Not wanting to bungle their assignment Kevin and Marcus call in their buddies on the latex disguise crew and sashay into socialite central as taller more stacked versions of Brittany and Tiffany. Rather than advancing the narrative in any concrete way the comedys main body serves merely to accommodate a series of silly but often hilarious gags with the faux Wilsons facing off against their ultracompetitive arch rivals Heather (Jaime King) and Megan Vandergeld (Brittany Daniel) whose father Warren (John Heard) is a social kingpin. Backed -- in ""Legally Blonde"" style -- by gal pals Karen (Busy Philipps) Lisa (Jennifer Carpenter) and Tori (Jessica Cauffiel) the Wilsons gain the edge notably in a dance floor showdown where Britt and Tiff shake up the whitebread crowd with some freestyle breakdancing. In a ho-hum romantic detour that steals shamelessly from Tony Curtis exploits in ""Some Like It Hot"" Kevin slips out of drag and into the identity of kazillionaire pro basketballer Latrell Spencer to seduce Denise (Rochelle Aytes) a reporter with a score to settle against pere Vandergeld. More successful is the fixation of the real Latrell (Terry Crews) on Tiffany which becomes increasingly zealous despite Marcus use of gross-out behavior as a deterrent. Final stretch lapses into overplotted chaos as Gomez and Harper figure out the brothers undercover guise just as a clue steers them toward the real kidnapper. Swooping in during the seasons climactic fashion show are Marcus controlling wife (Faune Chambers) the real Wilson sisters the kidnappers stooges and the brothers fellow Feds while the resentful Vandergeld sisters bite back from being shut out with a revenge plan involving Bjork-esque swan dresses and a ""Carrie"" blood-bucket homage. Messy wrap-up comes together serviceably enough however with the boys gaining female-friendly knowledge about how men regard women. Squeezed into microskirts and pastel T-shirts emblazoned with tags like ""Fierce Bitch"" or ""Dude Wheres My Couture?"" the Wayans brothers look like statuesque blond aliens their blue contact lenses giving them a freakishly dead-eyed look. But while theres nothing subtle going on they milk every comic opportunity for surprisingly consistent dividends whether its physical (like chasing down and tackling a bag-snatcher) or verbal (demanding Midol and a Snickers for PMS relief). Some of the best laughs come from the brothers difficulties adapting to the white world. And while theres plenty of fart humor to keep the frat boys happy appealing backup of a slightly more sophisticated model comes from Philipps (playing the polar opposite of her ""Freaks and Geeks"" character) Cauffiel and Carpenter. Crews also has moments while King and Daniel make Paris Hilton and Nicole Ritchie seem demure. Keenen Ivory Wayans direction is functional enough and craft contributions are clean down the line with Jori Woodmans fun costumes and the transformative makeup by Greg Cannom and Keith Vanderlaan deserving a mention. Soundtrack juggles the expected mix of white and black tunes to keep things moving. White ChicksProductionA Sony Pictures Entertainment release from Columbia Pictures of a Revolution Studios presentation of a Wayans Bros. production. Produced by Keenen Ivory Wayans Shawn Wayans Marlon Wayans Rick Alvarez Lee R. Mayes. Directed by Keenen Ivory Wayans. Screenplay Keenen Ivory Wayans Shawn Wayans Marlon Wayans Andy McElfresh Michael Anthony Snowden Xavier Cook; story Keenen Ivory Wayans Shawn Wayans Marlon Wayans. CrewCamera (Deluxe color) Steven Bernstein; editors Jeffrey Stephen Gourson Stuart Pappe; music Teddy Castellucci; music supervisor Lisa Brown; production designer Paul J. Peters; art director Eric Norlin; set decorator Dominique Fauquet-Lemaitre; costume designer Jori Woodman; sound (Dolby Digital/SDDS/DTS) Eric Batut; supervising sound editor Scott A. Hecker; supervising sound mixers Andy Koyama Chris Carpenter; makeup effects Greg Cannom Keith Vanderlaan; assistant director Jim Brebner; casting Lisa Beach Sarah Katzman. Reviewed at Regal 64th amp; Second Theater New York June 21 2004. MPAA Rating PG-13. Running time 108 MIN. With Kevin Copeland - Shawn Wayans Marcus Copeland - Marlon Wayans Heather Vandergeld - Jaime King Section Chief Elliot Gordon - Frankie Faison Agent Jake Harper - Lochlyn Munro Warren Vandergeld - John Heard Karen - Busy Philipps Latrell Spencer - Terry Crews Megan Vandergeld - Brittany Daniel Agent Vincent Gomez - Eddie Velez Tori - Jessica Cauffiel Brittany Wilson - Maitland Ward Tiffany Wilson - Anne Dudek Denise Porter - Rochelle Aytes Lisa - Jennifer Carpenter Gina Copeland - Faune Chambers Filed Under BitchJessica WilsonKeenen Ivory WayansLisa PorterMarlon WayansTiff Wrap-up Want to read more articles like this one? SUBSCRIBE TO VARIETY TODAY. Post A Comment 0 Variety Jobs Creative Development Coordinator Triptyk Studios New York New York Account/Project Coordinator (Ad Agency) Petrol Advertising Burbank California Media Specialist Bridgewater Associates Westport Connecticut Executive Director Aspen Film Company Confidential Aspen Colorado Associate Director YouTuber amp; Gamer Partnerships Save the Children Fairfield Connecticut See More Jobs Marketplace Leave a Reply No Comments Cancel reply Comments are moderated. They may be edited for clarity and reprinting in whole or in part in Variety publications. Enter your comment here... Fill in your details below or click an icon to log in Email (required) (Address never made public) Name (required) Website You are commenting using your WordPress.com account. ( Log Out / Change ) You are commenting using your Twitter account. ( Log Out / Change ) You are commenting using your Facebook account. ( Log Out / Change ) You are commenting using your Google+ account. ( Log Out / Change ) Cancel Connecting to %s Notify me of new comments via email. Notify me of new posts via email. More Film News from Variety The Power of Content Divorce Marks Sarah Jessica Parkers Return To HBO But... John Legend Shares Adorable New Snap Of Baby Luna -- See The Cute... Jamie Foxx Wears Puma High-Tops And Unveils New Arsenal Soccer... Westworld Creators Reveal Reason for 2-Month Production Shutdown Pokemon Go update for Android has a very annoying feature... Subscribe to Variety Today All The Ways to Get Variety Online Subscription Print Subscription Mobile Apps Newsletters News Alerts Archives Slanguage Dictionary Help Other Variety Products MediaVariety 411 Research amp; DataVariety Insight Archives Premium Email Alerts Real Estate Jobs Access the best entertainment industry data available View the Variety archives dating back to 1905 Get News Delivered To Your Inbox Privacy Policy Your Privacy Rights Terms of Use About Us Advertise Contact Us Google+ The Power of Content Deadline india.com Hollywoodlife hollywood TV Line BGR WWD Footwearnews (c) Copyright 2016 Variety Media LLC a subsidiary of Penske Business Media LLC. Variety and the Flying V logos are trademarks of Variety Media LLC. Powered by WordPress.com VIP Variety411 Your production services resource",http://www.variety.com/review/VE1117924182.html?categoryid=31&cs=1,200,whitechicks8,whitechicks,variety
"USATODAY.com - Humor helps White Chicks put a better face forward Classifieds | | | Home News Travel Money Sports Life Tech Weather Movies Movies home Box office report DVD releases Music Music home Top albums Top singles Listen Up Music reviews TV TV home TV listings Nielsen ratings Reality Check Critics Corner Idol Chatter Books Books home Top 150 books Columnists Columnists home Robert Bianco Peter Johnson Whitney Matheson Alison Maxwell Craig Wilson Gaming Gaming home Arcade Crosswords Sudoku More Life People Media Mix Pop Candy Photo archive Talk Today Marketplace Real estate Arcade Music Tickets Shopping International Business Index Newspaper Classifieds Posted 6/23/2004 116 AM     Updated 6/23/2004 1031 AM BEYOND WORDS Summer entertainment guides Movies that shade from summer heat Get your sweat on at music festivals Great reads for lazy days Todays Top Life StoriesComedy fest names Colbert person of year - NaNNaN PMRedstone wants to mend ties with Cruise - NaNNaN PMElizabeth Hurley weds at British castle - NaNNaN PMComedy fest names Colbert person of year - NaNNaN PMEverett leads gay Mardi Gras in Sydney - NaNNaN PMAdd USATODAY.com RSS feeds Whats this? Click here to shop What are you shopping for?  Browse over 8 million products  Clothing amp; Jewelry  Computers amp; Electronics  Home amp; Garden  Kids amp; Family Humor helps White Chicks put a better face forward By Mike Clark USA TODAY With a title like White Chicks (   out of four) you might think ""How sweet that Brady Bunchs Florence Henderson is making a comeback."" But the stars here are two male Wayans -- Marlon and Shawn with brother Keenan Ivory directing -- so its easy to surmise that somethings up. Marlon and Shawn Wayans protect two hotel heiresses in White Chicks. Wonder whom those characters were modeled after? Revolution Studios What we get is a tweaked variation on the litany of men-disguised-as-women comedies Some Like It Hot and Tootsie just for starters. Obviously this sassy farce sounds recycled and certainly appears to be in the coming attraction. Yet its also funnier than expected in ways you wouldnt expect. Two FBI agents played by the Wayans go undercover to foil a kidnapping plot against a pair of ditz sisters/hotel heiresses. Using a storehouse of white latex they disguise themselves as the young women. The hammered-home Paris Hilton connection is inspired and in fact more than half of Chicks non-African-American female characters are blonde spoiled and on their way to terminal rot in the Hamptons. Its this latter satire not the sex switcheroo that makes the movie somewhat of a crudely engaging surprise. There is a funny subplot however involving Terry Crews (who also has a prominent role in the current Baadasssss) as a black basketball player with a white-woman fixation who gets hung up on the blonde version of Marlon. Its hard to imagine anyone but a real stick being offended because the entire movie is so sassy and over the top that just about anything goes. (Sample Wayans dialogue ""Can you guys go get me some Midol and a Snickers?"" and ""Your mothers so dumb that she went to Dr. Dre for a Pap smear."") Six credited writers for a script and three for the story is usually a bad sign but the comedy actually picks up sex-on-the-brain momentum; you begin half-expecting that even villain John Heard will put out a booty call. As with every other genre theres a right way and a wrong way to handle dude-lawman comedies. Chicks does it right a lot of the time. (PG-13 crude and sexual humor language drug content) Newspaper Home Delivery - Subscribe Today USATODAY.com partners USA WEEKEND Sports Weekly Education Space.com Home Travel News Money Sports Life Tech Weather Resources Mobile news Site map FAQ Contact us E-mail news Jobs with us Internships Terms of service Privacy policy/Your California Privacy Right Advertise Press Room Media Lounge Electronic print edition Reprints and Permissions Add USATODAY.com RSS feeds The Nations Homepage Copyright 2008 USA TODAY a division of Gannett Co. Inc.",http://www.usatoday.com/life/movies/reviews/2004-06-23-white-chicks_x.htm,200,whitechicks9,whitechicks,usatoday
