review,link,status_code,id,movie_key,critic
Wimbledon (2004) directed by Richard Loncraine | Film review Go to the content Go to the footer Time Out London London Popular cities London New York Paris Chicago Los Angeles Browse all cities Time Out London Close London Change city London Popular cities London New York Paris Chicago Los Angeles Browse all cities Tickets Offers Things to Do Restaurants Bars amp; Pubs Film Theatre Art Music Attractions Blog Theatre Tickets Shopping Offer of the Day Time Out Card Time Out Escapes Time Out Live Hotels Nightlife Music festivals Events amp; Festivals Kids Museums Clubs Comedy Food amp; Drink Classical Music amp; Opera Dance LGBT City Guide Area Guides Property Competitions Dating Close My Time Out Things I love My lists My Profile My Account Sign out Sign in Create account Sign in With your social account Or with your email Email Password Remember me Forgotten your password? Sign in You can create a Time Out account in two ways... With a few clicks using your favourite social network Or by entering your details below Email First Name Last Name Create password Repeat new password I accept Time Outs terms of use including opt-in to newsletters. Create account Welcome  You have successfully connected your account to Time Out. You may sign in with this account in future. Please confirm your account details Email First Name Last Name I accept Time Outs terms of use including opt-in to newsletters. Sign up My Account Sign in or Create account Search Tickets Offers Things to Do Restaurants Bars amp; Pubs Film Theatre Art Music Attractions Blog Theatre Tickets Shopping Offer of the Day Time Out Card Time Out Escapes Time Out Live Hotels Nightlife Music festivals Events amp; Festivals Kids Museums Clubs Comedy Food amp; Drink Classical Music amp; Opera Dance LGBT City Guide Area Guides Property Competitions Dating More Search Wimbledon Film  Drama Add review 0 Love It Save it 0 Add review 0 Love It Save it Time Out says Details Users say Time Out says The poster for Wimbledon has Kirsten Dunst brandishing a tennis racket sideways so that at first glance it looks more like a sword a tacit admission surely that tennis is hardly a subject to set the pulse racing? This however is Working Title-land and tennis of course is one of those things that Americans like us to do - as well as driving open-top sports cars past the Houses of Parliament which star tennis player Peter Colt (Paul Bettany) does with surprising regularity in this tale of love across the tennis net.The game is simple. Two tennis players -Dunst and Bettany - meet over the hallowed lawns of SW19 one summer. Very soon its love all; but Dunsts father/manager (Sam Neill) is quick to pour water on their dalliance even though Bettany serves up lashings of British charm to woo both Dunst and audiences. In the meantime both have trophies to fight for cue tennis scenes that have at least some spark. Its hardly nail-biting but the sport works.Much has been made of the films making but its hardly notable verite. Yes this was actually really filmed at the gen-u-wine Wimbledon. Yes the crowds are kosher. Yes theres a cameo from John McEnroe. And no they didnt use real balls. They added them later. All in all its rather pleasant but nothing else. Dunst and especially Bettany make for good romantic leads (although Bettany flips between Hugh Grant and Michael Caine ). But where are the gags? And it could do without the thinly sketched sub-plots involving Peter Colts cheeky younger brother (James McAvoy) and warring Home Counties parents. A fairly charming romantic comedy - minus the comedy. By DC Details Release details Rated 12A Release date Friday September 24 2004 Duration 98 mins Cast and crew Director Richard Loncraine Screenwriter Adam Brooks Jennifer Flackett Mark Levin Cast Paul BettanyKirsten DunstSam NeillBernard HillJames McAvoyNikolai Coster WaldauAustin NicholsJon Favreau Users say LiveReviews|01 person listeningSign inWrite reviewMost helpfulMost helpfulHighest ratingLowest ratingNewestOldestLoadingundefinedNew CommentsRefreshShow More Share Tweet 0 Shares Top About us Work for Time Out Privacy policy Cookie Policy Website terms of use Contact us Time Out for business Get listed Claim your listing Premium Profiles Advertising Time Out products Time Out Card Mobile apps Time Out Shop Time Out Guides Time Out Travel Time Out Offers Time Out Worldwide Time Out magazine Where to get Time Out magazine Subscribe to Time Out magazine Manage my subscription Follow us Facebook Twitter Youtube Instagram Pinterest Spotify Time Out London Site map },http://www.timeout.com/film/81337.html,200,wimbledon0,wimbledon,timeout
"Story of My Life Hair Today Gone Tomorrow | Observer Politics| Arts amp; Entertainment| Style amp; Design| Business amp; Technology| Search for Submit Observer Politics National New York International Editorials Arts amp; Entertainment Art Movies Music Performing Arts TV Style amp; Design Fashion Food amp; Drink Health amp; Wellness Home Design Real Estate Travel Business amp; Technology Deals Innovators Internet Culture Media Startups About Advertise Subscribe Careers Masthead Contact Privacy Terms Follow Us Sign Up for Newsletters Story of My Life Hair Today Gone Tomorrow By Ralph Gardner Jr.  05/26/03 1200am I was sorry when I learned that Michaels the well-known childrens hair-cutting salon at Madison Avenue and 90th Street went out of business recently. But not that sorry. Michaels was famous for cutting the hair of generations of preppies allegedly including John F. Kennedy Jr. I say allegedly because I never saw him there. And God knows I spent enough of my childhood in the barbers chair at Michaels that Id have run into him if hed been a regular. I got my first haircut at Michaels and every haircut after that until at the ripe old age of 16 I finally rebelled. Haircuts in my family were traumatic psychologically scarring events. The fault lay not with Mr. Michael as the salons owner was called or with his No. 2 man Mr. Gay both of whom gave a competent haircut. The problem was my mother. First there was the hair style shed invented for us. It was like nothing that existed in nature or even in science fiction. Well maybe science fiction It sprung from her fertile imagination like that creature in Alien . The easiest way to describe it is as a crewcut a Marine buzz cut-except that my mother God forbid would never let anything as proletarian as a razor near her four sons tender heads. Instead she insisted that we be trimmed to a state of virtual baldness-except in the front where we all sported Tom Sawyer-like cowlicks-with a scissors. To keep our hair just so required that we visit Michaels religiously every two weeks. And since my parents were apparently under the impression that the only way to cope with four boys was to treat them like military cadets or rather prisoners of war we all had our hair cut on the same afternoon every other week. And by the same barber. At first it was Mr. Gay a pleasant man with a business-like mustache-until he crossed my mom. From the age of 3 until I was 8 or 9 no one but Mr. Gay was allowed near my hair. Until suddenly one day without explanation my mother dropped him for Mr. Michael. It was disorienting for a child to say the least. So much importance did my mother attach to our appearance (and to our hair in particular) and so completely were we Mr. Gays customers that it was hardly less significant than if shed just filed for divorce from my father. I recently asked her why we abruptly switched from Mr. Gay to Mr. Michael a sweet-natured opera buff with the worlds bushiest eyebrows who ran the salon from Chair No. 1. At first my mother denied wed ever patronized Mr. Gay so utterly had she banished him from her memory. Eventually she admitted there must have been some falling out over hair. Its coming back to me now almost as if retrieved by hypnosis. Mr. Gay who seemed like a decent enough guy eventually balked at clipping our heads with a scissors. Since the final result was hairlessness he didnt see why he couldnt save lots of time-not to mention his mental health-by simply plugging in a razor. I was on his side. I cant exaggerate the exhaustion for all involved in going to Michaels. It was like getting your own hair cut four times on the same day. After I was through Id have to wait while my brothers got their hair cut my mother standing over the barber the whole time. The comic books and lollipops helped. But by the time my youngest brother Jamie slipped out of the barbers chair with his crewcut I was crawling the walls. We spent so much time at Michaels that historic events transpired while we were there. The great blackout of 1965 occurred during one of our biweekly visits. Unfortunately the lights didnt go out until our haircuts were finished and we were leaving. Not that that wouldve made any difference My mother wouldve simply insisted that Mr. Michael complete the job to her specifications by flashlight. This form of child abuse went on until June 1969 when Id just turned 16 and my mother sent me off on one of those eight-week cross-country ""teen tours."" She didnt realize the far-reaching consequences it would have for both my hair and our relationship. If shed known Im certain shed have forbidden me to go. Suffice it to say that I wasnt popular with the young ladies on the trip at least not at first. When its the Age of Aquarius and youre a 6-foot-2 125-pound hairless geek you arent going to attract women whose idea of handsome is Paul McCartney. I was stuck sharing hotel rooms with all the other losers on the bus because nobody not even my cousin would room with me. But something miraculous happened during the journey. My hair started to grow. And since I was on a bus crossing the country there was nothing my mother could do about it. The longer my hair got the more socially acceptable I became. Halfway through the trip the coolest guy on the bus-a rock musician who attended an alternative high school in Newton Mass.-decided I was hip or at least unconventional and became my roommate bless his heart. He remains a friend to this day. By the end of the vacation my hair was almost normal length and under his tutelage I was considered cool too. I even started having girlfriends. But I knew full well that this fantasy would soon end and I would be delivered back into the clutches of my mother and her evil scissors. So I had everybody on the bus sign a petition pleading with her to leave my hair alone. I delivered the document to her in Italy where I joined my family after the teen tour ended. Predictably she almost dropped dead when she saw my hair and insisted that I get it cut immediately. I agreed-on the condition that it remain a reasonable length. She concurred. But I should have known that when it came to hair my mother had no scruples. She was ruthless As soon as I was seated in the barbers chair she kept instructing the barber "" Piu corto  piu corto ""-shorter shorter. I didnt catch on until it was too late. When my haircut was finished it looked exactly as it had before Id departed on the trip. No longer a cool teen I was a heartbroken pinhead once more. To punish her I wore a hat everywhere even to dinner at fancy restaurants in the sweltering heat of the Italian summer and I never again let her near my hair. I also never went back to Michaels. The tragic thing is that by the time I finally got to wear my hair the way I wanted in college it was already starting to fall out. Now Michaels is a Face Stockholm makeup boutique. I suppose theres some poetic justice there. Its one of my daughters favorite stores a place where they love to try on lip balms and blushes and where theyre free to experiment with their appearance. If Id had that chance at 14-I dont mean being allowed to wear makeup but sporting the same bowl cut as J.F.K. Jr. and all the other guys-who knows how nicely I might have turned out? I guess its never too late to consider a hairpiece. Comment Filed under John F. Kennedy John F. Kennedy Jr. Newton (Massachusetts) The New Yorkers Diary Tom Sawyerlike Trending Now Wikileaks Proves Primary Was Rigged DNC Undermined Democracy Politics Space Radiation Devastated the Lives of Apollo Astronauts Business amp; Tech Wikileaks Dismantling of DNC Is Clear Attack by Putin on Clinton Politics Why ISIS Sees an Elderly Priest as a Threat to the Caliphate Politics Observer About Advertise Careers Contact Privacy Terms Powered by WordPress.com VIP",http://www.nyobserver.com/pages/story.asp?ID=9616,200,wimbledon1,wimbledon,nyobserver
lohud.comSUBSCRIBE NOWto get full accessHomeNewsRocklandWestchesterSportsOpinionHomesfoodObituariesPhoto-VideoLifeHealthArchivesUSA TODAYMoreHomeNewsRocklandWestchesterSportsOpinionHomesfoodObituariesPhoto-VideoLifeHealthArchivesUSA TODAYFollowSearchFireflyHi Already a subscriber?Log inSubscribe today for full access on your desktop tablet and mobile device.Subscribe NowAlready a print edition subscriber but dont have a login?Activate your digital access.Manage your account settings.My AccountView the E-NewspaperManage your NewslettersView your Insider deals and moreMember ID CardLog OutGet the newsLog In or Subscribe to skipAlready a subscriber?Log inSubscribe today for full access on your desktop tablet and mobile device.Subscribe NowAlready a subscriber but dont have a login?Activate your digital access.TOP TRENDINGxShareOOPSThis page exists to tell you that this page doesnt exist.RETURN TO HOMESubscribeAbout UsRSSAppsNewslettersInsiderFollow Our StaffContact UsHelpHomeNewsWestchesterRocklandPutnamPoliticsCrimeTappan Zee BridgeMore...HealthEducationInstagramRocklandWestchesterSportsHigh SchoolsYankeesMetsGiantsJetsKnicksMore...RangersBlogsOlympicsScores and SchedulesOpinionEditorialsCommunity ViewsLettersPhil ReismanBoard of ContributorsEditorial BoardExchange BlogHomesFeatured HomesGardeningfoodRestaurantslohudfood blogFarmers MarketsLocal BreweriesWineRecipesObituariesPhoto-VideoLifeEntertainmentThings To DoDay TripsTravelInsiderInstagramHealthArchivesUSA TODAY (c) 2016 Copyright (c) 2014 www.lohud.com. All rights reserved. ServicesAdvertise with UsAdvertising Terms and ConditionsAd ChoicesCommunity RulesFAQMember GuideNewspapers in EducationPrivacy Notice/Your California Privacy RightsReprints PermissionsTerms of ServiceWork for UsOur PartnersCareer BuilderCars.comClassifiedsDealChickenFind amp; SaveHomefinder.comEducationG/O Digital,http://www.thejournalnews.com/theline/movieline/archive/41555.htm,404,wimbledon2,wimbledon,thejournalnews
"Wimbledon | Reelviews Movie Reviews Out now Cher Harold Rosson Eva Green Benjamin ... Home Video Views ReelThoughts Currently in Cinema ReelViews Library Login Specials My Books Array ( [page] =gt; reelviews [view] =gt; wimbledon ) Wimbledon (United States/United Kingdom/France 2004) A movie review by James Berardinelli Love in tennis doesnt have to be bad as Richard Loncraines Wimbledon shows. A formulaic motion picture that delights in spite of (or perhaps because of?) its reliance upon conventions Wimbledon is the kind of movie that allows the non-cynical movie-goer to sit back and relax in the presence of actors who work well with each other and a script whose familiarity is an asset. Its rare for any motion picture to successfully combine the clichA(c)s of the sports and romance genres while keeping a balance between them. In recent years I can name only two For Love of the Game and The Cutting Edge. To that select group Wimbledon can be added. The sports portion of the movie employs the usual underdog-makes-good scenario. Tennis is relatively new to this kind of treatment but we have seen it tried with everything from baseball to basketball to boxing to golf and theres not a lot of variation. The romance is more serious than comedic; Loncraine (whom art-house viewers may remember as the director of Ian McKellans Richard III) has a greater interest in developing a real-world kind of relationship than punctuating the love affair with goof-ups and pratfalls. There are laughs to be had but if you want to call Wimbledon a ""romantic comedy"" be assured that the emphasis is on romantic. Peter Colt (Paul Bettany) is a 31-year old tennis has-been. Actually make that a never-was. His current world ranking of 119 is considerably below his position at 11 in 1996 but even in his heyday he was never a household name. Now he has decided to announce his retirement after one more try at Wimbledon where he has garnered a wild-card bid. He first encounters up-and-coming American star Lizzie Bradbury (Kirsten Dunst) when he accidentally enters her hotel room to find her in the shower. This mistake turns out to be the beginning of a whirlwind romance. For Peter its the best thing that could have happened to him - hes winning matches he was expected to lose and advancing further into the tournament than anyone believed he could. The opposite is true for Lizzie who is favored to reach the finals. Shes losing her focus and her play is becoming sloppy. The film echoes some real-life tennis stories such as the 70s storybook romance between Jimmy Connors and Chris Evert (it was short-lived but made big headlines in the tennis world when it was hot) and the incredible ride to the U.S. Open semifinals for a 39-year old Connors in 1991 (before the tournament he was ranked 174). Anyone wanting to call Wimbledon a fairy tale is within their rights (and it does have a fairy tale quality) but the storyline doesnt venture too far from reality. As I have said dozens of times romantic movies are made or broken by how well the leads interact with each other. If an audience believes they are in love and wants them to be together its irrelevant how plain or convoluted the plot is. And in this case theres plenty of chemistry between Bettany and Dunst. Also while both are convincing when playing the romantic aspects of their roles they look good on the court as well. Although its possible that the editing has something to do with it Bettany and Dunst look like they know what to do with a racket. Bettany is a familiar face having been seen in films like A Beautiful Mind and Master and Commander The Far Side of the World. His manner is a lot like that of Colin Firth reserved and humble. Its part of his charm. Dunst on the other hand is known world-wide as Spider-Mans Mary Jane. Its to her credit that she sheds the superheros girlfriend image immediately. She becomes Lizzie and her natural high level of energy shines through. Shes as bouncy and lively as anyone this side of Reese Witherspoon. As much as Wimbledon gains from its two leads the film also offers other small pleasures. The supporting cast is stacked with competent actors including Sam Neill and Bernard Hill (best-known as King Theoden in The Lord of the Rings) as the fathers of Lizzie and Peter respectively. The script is smart and includes some incisive internal monologues by Peter. The handling of agents (one is played by Jon Favreau) is spot-on. And at least to a casual fan of the sport the script seems to have been penned by someone who knows what theyre talking about. Die-hards may be able to find gaffes but the screenplay stands up to a casual inspection. I have never apologized for my taste in movies and Im not going to start now. Yes Wimbledon is a crowd-pleaser but it doesnt energize audiences by pandering to the least common denominator. The film has heart and spirit and it does a lot of things well. There are plenty of other choices out there if youre looking for something surprising. Wimbledon has the feel of a comfortable bathrobe - you can sink into it and relax. Wimbledon (United States/United Kingdom/France 2004) Director Richard Loncraine Cast Kirsten Dunst Paul Bettany Sam Neill Jon Favreau Bernard Hill Eleanor Bron Austin Nichols Screenplay Adam Brooks and Jennifer Flackett amp; Mark Levin Cinematography Darius Khondji Music Edward Shearmur U.S. Distributor Universal Pictures Run Time 138 U.S. Release Date 2004-09-17 MPAA Rating ""PG-13"" (Profanity Sexual Situations Nudity) Genre ROMANTIC COMEDY Subtitles none Theatrical Aspect Ratio 2.351 Comments Add Comment Three...better movies of this genre Forgetting Sarah Marshall (2008) When Harry Met Sally (1989) Kissing Jessica Stein (2002) worse movies of this genre Hottie and the Nottie The (2008) Just Friends (2005) Runaway Bride (1999) Three...better movies of Kirsten Dunst Anastasia (1997) Eternal Sunshine of the Spotless Mind (2004) Wag the Dog (1997) worse movies of Kirsten Dunst Bachelorette (2012) Marie Antoinette (2006) Spider-Man 3 (2007) Three...better movies of Paul Bettany Beautiful Mind A (2001) Secret Life of Bees The (2008) Margin Call (2011) worse movies of Paul Bettany Transcendence (2014) Da Vinci Code The (2006) Inkheart (2009) Three...better movies of Sam Neill Horse Whisperer The (1998) Forgotten Silver (1969) Jurassic Park (1993) worse movies of Sam Neill Vow The (2012) Jurassic Park III (2001) Sirens (1993) ReelViews Library Currently in Cinema Writings Fictional Writings ReelThoughts Specials About Privacy Policy Terms and Conditions Contact Website credits",http://www.reelviews.net/php_review_template.php?identifier=729,200,wimbledon3,wimbledon,reelviews
