review,link,status_code,id,movie_key,critic
World Trade Center (2006) directed by Oliver Stone | Film review Go to the content Go to the footer Time Out London London Popular cities London New York Paris Chicago Los Angeles Browse all cities Time Out London Close London Change city London Popular cities London New York Paris Chicago Los Angeles Browse all cities Tickets Offers Things to Do Restaurants Bars amp; Pubs Film Theatre Art Music Attractions Blog Theatre Tickets Shopping Offer of the Day Time Out Card Time Out Escapes Time Out Live Hotels Nightlife Music festivals Events amp; Festivals Kids Museums Clubs Comedy Food amp; Drink Classical Music amp; Opera Dance LGBT City Guide Area Guides Property Competitions Dating Close My Time Out Things I love My lists My Profile My Account Sign out Sign in Create account Sign in With your social account Or with your email Email Password Remember me Forgotten your password? Sign in You can create a Time Out account in two ways... With a few clicks using your favourite social network Or by entering your details below Email First Name Last Name Create password Repeat new password I accept Time Outs terms of use including opt-in to newsletters. Create account Welcome  You have successfully connected your account to Time Out. You may sign in with this account in future. Please confirm your account details Email First Name Last Name I accept Time Outs terms of use including opt-in to newsletters. Sign up My Account Sign in or Create account Search Tickets Offers Things to Do Restaurants Bars amp; Pubs Film Theatre Art Music Attractions Blog Theatre Tickets Shopping Offer of the Day Time Out Card Time Out Escapes Time Out Live Hotels Nightlife Music festivals Events amp; Festivals Kids Museums Clubs Comedy Food amp; Drink Classical Music amp; Opera Dance LGBT City Guide Area Guides Property Competitions Dating More Search World Trade Center Film  Drama 4 out of 5 stars (1 user review) 0 Love It Save it 1 Add review 0 Love It Save it Time Out says Details Users say (1) 4 out of 5 stars Time Out says If ever there was an antidote to the chilly science of Paul Greengrasss United 93 its Oliver Stones cloying 9/11 film terrifying soppy mournful gung-ho and plodding all in one go. One minute its pure horror; the next its so daft and sappy that its laughable not least when the hallucinations of a semi-conscious policeman buried in the rubble of the collapsed World Trade Center threaten to evoke the LSD scenes in Stones The Doors. The events of 9/11 were told highlighted the goodness that we forgot could exist which alludes to the heroism of John McLoughlin (Nicolas Cage) and Will Jimeno (Michael Pena) two policemen who entered the towers were pulled alive from the rubble and whose testimonies inform the film. Ten minutes in the first plane hits and the attack is depicted as an oversize shadow on the side of a skyscraper. But its sound not image that has the most impact creaks and groans crashes and thumps. Much time is spent within the tangled mess of the collapsed towers where the camera stays close to the faces of Cage and Pena. Their dialogue is of the tell-my-wife-I-love-her dont-you-dare-die variety which is credible if barely interesting. Beckett its not. The real banal soppy stuff takes place outside and with the policemens waiting worried families.World Trade Center is horrific and rousing and exactly as expected from a film that never threatened to be anything other than the first unchallenging reaction to 9/11 from Hollywood. It exists as the catalyst to a mass purge. If Stone werent in charge someone else would have made an identikit film. Destiny pervades the project and anyone who expected Stone to toe anything other than the company line was gravely mistaken. By Dave Calhoun Posted Tuesday September 26 2006 Details Release details Rated 12A Release date Friday September 29 2006 Duration 130 mins Cast and crew Director Oliver Stone Screenwriter Andrea Berloff Cast Nicolas CageMichael PenaMaggie GyllenhaalMaria BelloStephen DorffJay HernandezMichael Shannon Users say (1) 4 out of 5 stars Average User Rating3.8 / 5Rating Breakdown5 star04 star13 star02 star01 star0LiveReviews|11 person listeningSign inWrite reviewMost helpfulMost helpfulHighest ratingLowest ratingNewestOldestLoadingundefinedNew CommentsRefreshMar 24 2009Johnny KnoxvilleFeaturedIts a very good movie but its a bit rushed and they make it too long under the rubble. They should show the towers falling or at least ppl runningFlagShareHelpful?Yes|NoReplyShow More Share Tweet 0 Shares Top About us Work for Time Out Privacy policy Cookie Policy Website terms of use Contact us Time Out for business Get listed Claim your listing Premium Profiles Advertising Time Out products Time Out Card Mobile apps Time Out Shop Time Out Guides Time Out Travel Time Out Offers Time Out Worldwide Time Out magazine Where to get Time Out magazine Subscribe to Time Out magazine Manage my subscription Follow us Facebook Twitter Youtube Instagram Pinterest Spotify Time Out London Site map },http://www.timeout.com/film/83693.html,200,worldtradecenter0,worldtradecenter,timeout
"The Disrespected Arts Journalist Blues | | Observer Politics| Arts amp; Entertainment| Style amp; Design| Business amp; Technology| Search for Submit Observer Culture Politics National New York International Editorials Arts amp; Entertainment Art Movies Music Performing Arts TV Style amp; Design Fashion Food amp; Drink Health amp; Wellness Home Design Real Estate Travel Business amp; Technology Deals Innovators Internet Culture Media Startups About Advertise Subscribe Careers Masthead Contact Privacy Terms Follow Us Sign Up for Newsletters Observer Music The Disrespected Arts Journalist Blues By Justin Joffe  07/29/16 324pm Patron saint of schlubby music journalists Lester Bangs. More often than not the music thats sent to me is difficult to write about. Describing music is never easy which is why most journalistic shorthand to describe an artist or sound resorts to cheap genre descriptor pastiches and made-up meaningless new codifications. Once in a while those labels catch on but more often than not those descriptors are but the rare moment where that journalist can flex their creativity to take a chance describing something fresh and new allowing us some insight into what informs the associations that they make. All of which is to say sounds are hard to put into words. But it helps when theres a good story there doesnt it? More often that not the music thats sent to me is difficult to write about because theres just no story there. And sometimes the music is good like really good which makes me feel as if the act of refusing to write about it does a disservice to the readers who trust my judgement. But heres the thing--very few people in journalism give arts journalists a fair shake and even fewer show love for music journalists. I have to at least entertain the idea that people who dont take music journalists seriously are responding to stories that get published for the wrong reasons--either the journalist just really likes the band and their enthusiasm gets the pitch approved despite the fact that they dont have much to say beyond ""its good"" and ""you should listen to it"" or the story has been thrust upon them by the publication for some other reason (either the editor loves it the artist or their crew have some sort of relationship with the publication or theyre just super-fucking popular.) Sounds are hard to put into words. But it helps when theres a good story there doesnt it? A faculty member at my alma mater CUNYs Graduate School of Journalism confirmed my suspicion that admissions was reluctant to accept prospective students who showed an interest in focusing on the Arts amp; Culture concentration over other beats--Health amp; Science Business International and Urban reporting. They just see too many arts journalists floundering after school he said and the commonly held belief by other faculty members was that in a field where finding work is already difficult arts journalists have an even harder time because the jobs just arent there. Whats more the powers that be often feel that the majority of young journalists attracted to arts reporting never evolve into anything more than armchair critics fans with half-baked opinions who favor feelings over facts. Our fearless Observer editor in chief Ken Kurson said something similar to me on my first day in his office. As much as he loved music journalism Ken felt that the majority of journalists who focused on music were just failed musicians themselves less concerned with producing good writing and reporting and instead ultimately looking for a spot on the tour bus. He didnt know at the time that Im a classically trained violinist whos been playing since I was four or that I have several solo records under my belt (Google at your own peril). Nor did I know at the time that he once played bass in the revered Chicago jangle-pop band Green. Either way I suddenly had something to prove and was up for it. My plan with writing if I ever had one was to unpack the ""why"" that informed the work of every artist I wrote about and looking for a raison detre quickly narrowed the pool of who had a good story I could tell. It was really still just a matter of those eternal news values--proximity timeliness prominence impact conflict and nostalgia. A shitty band is pushed upon me as either pure nostalgia or timeliness--theyre either ""progenitors of the new trance-metal"" or they ""long for the days when the sounds of disco..."" The other values are often pushed on me by a publicist. Theres conflict in a record that almost didnt happen after the singers crippling addiction to all-you-can-eat buffets; theres impact in dogmatically-worshiped statistics of chart performance or Soundcloud plays; and theres prominence ascribed to the band that once played Shia Labeoufs Bar Mitzvah or Sofia Vergaras Quinceanera too. But youve got to not only check off several of those news values to have a story--youve got to understand how they inform that artists life to tell their story. In arts journalism with its private parties and branded-content ""exclusive"" premieres maybe that yearning to say something larger gets diluted by the enticing visceral realities of the entertainment industry. Maybe too many publicists focus on writing the story or at least the storys nut graph containing the thesis ahead of time for most arts journalists to just lap up. To that end any stigma that arts features are less serious and more ephemeral than ""hard news"" falls on the shoulders of the editors and their writers who take press releases as scripture and conduct the extent of their reporting as only an amplification of a perspective that has already been shaped and subsequently fed to them. Your disco grind-metal band just released an album of Maroon 5 covers on MiniDisc? Please go on... Thats really a shame because the whole cosmic haw-haw of it all is that the arts for all the seeming short-lived ephemera of listening to a catchy song or watching an entertaining film are eternal. At its most haughty the act of creating something is a grasp at immortality the forging of a work that should last long after the creator is worm food. Hard neighborhood news meanwhile is service journalism--absolutely necessary information timely local and inherently valuable. You want to know when a man is stabbed in your neighborhood or when your favorite gelato chain is coming to your borough. But for all the hallowed seriousness of a local papers breaking-news desk the often palpable shade that reporters on the grind throw at arts journalists is straight-up unfair. Once the mime who kept exposing himself to old ladies on the B52 bus in Brooklyn has been apprehended the story is over. Meanwhile theres a whole world of people creating making shit with their hands and crafting their own legacy for no other reward than maybe a small taste of immortality. Perhaps one day the systematically disrespected and undervalued arts journalist will fade into myth. But its going to come from realizing that in the same way we marginalize our citys creative class by outsourcing creative works and art to freelancers and hired guns we treat our arts journalists with a similar arms-length disdain. Thats a shame because a good song or a good picture is far from ephemera. Like hard news arts journalism tells the story of our shared now. But unlike hard news the creative work that lasts also tells our story to the future. Comment Filed under album review art criticism Arts Journalism CUNY Graduate School of Journalism Ephemera Green Hard News Ken Kurson music critic music criticism music journalism music writing mythology Shia LaBeouf Sofia Vergara Stigma Writing Trending Now Bill Maher Im With Her or Im With Stupid Politics Pussy Riot On Their Provocative Donald Trump-Inspired Art Installation Culture Marina Abramovic I Had Three Abortions Because Children Hold Female Artists Back Culture The (Real) Its Always Sunny In Philadelphia Origin Story Culture Observer About Advertise Careers Contact Privacy Terms Powered by WordPress.com VIP",http://www.observer.com/node/39289,200,worldtradecenter1,worldtradecenter,observer
File not found404 File not foundFile not found /stltoday/entertainment/reviews.nsf/movie/story/aedb8f327ef286e9862571c4006e873d,http://www.stltoday.com/stltoday/entertainment/reviews.nsf/movie/story/AEDB8F327EF286E9862571C4006E873D?OpenDocument,404,worldtradecenter2,worldtradecenter,stltoday
