review,link,status_code,id,movie_key,critic
"Movies - Salon.com Salon Home News news Obamas DNC letdown The president needed to hit it out of the park but he surprisingly fell short Amanda Marcotte Shock poll Nate Silvers election forecast now has Trump winning Sophia Tesfaye ""Im a New Yorker and I know a con when I see one"" Mike Bloomberg goes to the DNC to knockout Trump Sophia Tesfaye Politics politics 2016 Elections Obamas DNC letdown The president needed to hit it out of the park but he surprisingly fell short Amanda Marcotte 10 reasons why DemExit is serious Getting rid of Debbie Wasserman Schultz is not enough Sophia A. McClennen Shock poll Nate Silvers election forecast now has Trump winning Sophia Tesfaye Entertainment entertainment Books Movies Music TV ""America will finally catch up with 1960 Sri Lanka"" Stephen Colbert puts Hillarys run in perfect perspective Brendan Gauthier Watch the Rolling Stones sing about Rice Krispies in this 1960s ad Michael Garofalo The Bourne Masculinity Matt Damons hyper-aggressive emotionally fragile ""good guy with a gun"" Eileen GSell Life life Life Stories Love amp; Sex Parenting Conservatives mad at Hilton for showing gay couple in ad Mary Elizabeth Williams JoJo returns ""I ate 500 calories a day. It was the most unhealthy thing Ive ever done."" Mary Elizabeth Williams Donald Trump thinks LGBT lives matter--but only if theyre victims of a terrorist attack Nico Lang Business business Wall Street Finance Labor In what is quickly becoming the age of Prime why do investors still hate Amazon? Scott Eric Kaufman With Gigafactory Elon Musk makes ""bid to be the Henry Ford of this era"" Scott Eric Kaufman Verizon purchases Yahoo for 4.83 billion Scott Eric Kaufman Elections 2016 elections 2016 Log out Sign in Movies The Bourne Masculinity Matt Damons hyper-aggressive emotionally fragile ""good guy with a gun"" The saga of Jason Bourne traumatized hero as emblem of unapologetic white-male violence turns 14 with a new film Eileen GSell Friday Jul 29 2016 1100 PM UTC 0 Entertainment Editors Picks Film Allison Janney opens up On being ""fragile but tough on the outside"" and the questionable things shes done for love Salon talks to the ""Talullah"" star about reuniting with Ellen Page using insecurity in her art and ambivalent moms Gary M. Kramer Friday Jul 29 2016 1058 PM UTC 0 Entertainment Allison Janney Editors Picks If you have to ask ""How To Tell Youre a Douchebag"" filmmaker on making his Twitter-era rom-com Salon talks to Tahir Jetter about Internet dating Twitter dissertations and making indie art from ""poor decisions"" Gary M. Kramer Thursday Jul 28 2016 1059 PM UTC 0 Entertainment A new heyday of horror Why the scary movie just might save Hollywood from itself Modestly-budgeted horror films arent just doing well at the box office--theyre charming critics too Nico Lang Monday Jul 25 2016 1105 PM UTC 0 Entertainment horror films It Follows Holy backlash Batgirl ""The Killing Joke"" opens in the shadow of a Comic-Con panel gone wrong The newest Batman animated film based on Alan Moores controversial one-off is being criticized over sexist story Scott Timberg Monday Jul 25 2016 1059 PM UTC 0 Entertainment alan moore Animation Batman The fall of ""Divergent"" The final film will bow on TV -- heres why it matters The YA-movie niche -- the domain of young female stars -- is withering; Hollywood doesnt know whats next Nico Lang Sunday Jul 24 2016 730 PM UTC 0 Entertainment divergent Editors Picks Forever Captain Kirk William Shatner opens up about ""fandom frenzy"" and 50 years of ""Star Trek"" As ""Star Trek"" turns a half-century old Salon talks to icon William Shatner about his career-defining role Ethan Gilsdorf Friday Jul 22 2016 1100 PM UTC 0 Entertainment captain kirk Editors Picks How Mike Birbiglia and Keegan-Michael Key found common comedy ground ""He helped me make less of it"" Salon talks to Birbiglia and Key about their new improv-troupe comedy ""Dont Think Twice"" Gary Kramer Friday Jul 22 2016 1058 PM UTC 0 Entertainment Comedy dont think twice ""Star Trek Beyond"" Humor and adventure abound in this course-correcting sequel The third film in the rebooted series may not go boldly but its a welcome homecoming for the beloved franchise Nico Lang Thursday Jul 21 2016 1100 PM UTC 0 Entertainment Movies review science fiction The sound of Beatlemania Can this new release of ""Hollywood Bowl"" redeem the Fab Fours live record? Heres hoping the Hollywood Bowl concerts released alongside Ron Howards documentary allow us to hear the band Scott TImberg Thursday Jul 21 2016 413 PM UTC 0 Entertainment George Martin Movies Music Drugs despair disintegration 20 years later ""Trainspotting"" still resonates Between its portrayal of drug subculture alienation and Scottish nationalism Danny Boyles film needs a new look Scott Timberg Tuesday Jul 19 2016 734 PM UTC 0 Entertainment Danny Boyle Film Irvine Welsh Buying ""Ghostbusters"" -- or not How buying in or boycotting a summer family movie became a political act Paul Feigs reboot demonstrates how purely consumerist decisions now feel more meaningful than they really are Matthew Rozsa Friday Jul 15 2016 1100 PM UTC 0 Entertainment Editors Picks Feminism Norman Lear sits down with Salon ""Trump is the middle finger of the American right hand"" Archie Bunker wouldnt vote for Trump insists his 93-year-old creator now the subject of an irresistible film Andrew OHehir Thursday Jul 14 2016 1100 PM UTC 0 Entertainment All in the Family Comedy ""Science fiction cyber-war is here"" Alex Gibney on ""Zero Days"" and Stuxnet the secret weapon that got away Salon talks to Oscar-winner Alex Gibney about his new film ""Zero Days"" and a new era of war Andrew OHehir Wednesday Jul 13 2016 1100 PM UTC 0 Entertainment Alex Gibney The growing gender divide over ""Ghostbusters"" Why movies starring women get slimed by male critics Because film criticism is so male-dominated men have a disproportionate say--especially on movies about women Nico Lang Tuesday Jul 12 2016 1059 PM UTC 0 Entertainment Criticism female ghostbusters The new ""Ghostbusters"" delivers Its a cheerful exercise in feminist nostalgia -- except wait is that possible? If you can handle the shock of four female ""Ghostbusters"" Paul Feigs remake is a cheerful summer diversion Andrew OHehir Tuesday Jul 12 2016 320 PM UTC 0 Entertainment Bill Murray Comedy Dan Aykroyd How Matt McGorry falls in love ""When I do Im all in"" Salon talks to the TV star--and Twitters ""woke bae""--about his starring role in new indie film ""How He Fell in Love"" Gary M. Kramer Friday Jul 8 2016 1100 PM UTC 0 Entertainment Editors Picks Meet North Koreas perfect family Totalitarianism Trump and the politics of non-thought An upside-down propaganda film made with North Koreas approval offers a distorted reflection of our own politics Andrew OHehir Tuesday Jul 5 2016 1100 PM UTC 0 Entertainment Documentaries Documentary Pop culture still fails queer people Sanitizing LGBT romance is a tradition Hollywood cant seem to break ""Independence Day Resurgence"" can imagine all kinds of futuristic wonders--but not two men who are in love kissing Nico Lang Tuesday Jul 5 2016 1059 PM UTC 0 Entertainment Film independence day 2 Girl on girl crimes ""The Neon Demon"" makes women look like the real predators in the modeling world Nicolas Winding Refns shocker manages to deftly sideline all the ways that men prey on vulnerable women in the biz Nico Lang Sunday Jul 3 2016 1030 PM UTC 0 Entertainment Editors Picks Film Gender Page 1 of 299 in Movies Previous follow salon brought to you by Most Read Obamas DNC letdown The president needed to hit it out of the park but he surprisingly fell short Amanda Marcotte 10 reasons why DemExit is serious Getting rid of Debbie Wasserman Schultz is not enough Sophia A. McClennen Shock poll Nate Silvers election forecast now has Trump winning Sophia Tesfaye ""Im a New Yorker and I know a con when I see one"" Mike Bloomberg goes to the DNC to knockout Trump Sophia Tesfaye The right-wing spin machine in action Conservatives race to clean up mess from Trumps insane news conference Gary Legum Billionaires brawl Donald Trump throws Twitter temper tantrum after ""Little"" Mike Bloombergs DNC speech Brendan Gauthier Erasing Melanias past Her website gets scrubbed amid reports she lied about college degree Brendan Gauthier ""America will finally catch up with 1960 Sri Lanka"" Stephen Colbert puts Hillarys run in perfect perspective Brendan Gauthier Trump escalates his war with the press Washington Post reporter barred from Mike Pence rally patted down by police Sophia Tesfaye Kentucky fire chief refuses to help black family after traffic accident ""We aint taking no n--gers here"" Jenny Kutner Dont worry about Trumps ""lead"" yet Its too early to stress about the polls Gary Legum WATCH Father of fallen U.S. Muslim solider offers Trump a copy of his pocket Constitution at DNC Sophia Tesfaye Civil rights advocate Rev. Dr. William Barber Faith shouldnt be used ""to serve hate fear racism and greed"" Brendan Gauthier Watch the Rolling Stones sing about Rice Krispies in this 1960s ad Michael Garofalo Hanging with ""The Bernouts"" and Jill Stein The Bernie-or-bust crowd is loud at the DNC -- but theyre powerless Amanda Marcotte From Around the Web Presented by Zergnet About | Advertising | Contact | Corrections | Help | Investor Relations | Privacy | Terms of Service Copyright (c) 2016 Salon Media Group Inc. Reproduction of material from any Salon pages without written permission is strictly prohibited. SALON (r) is registered in the U.S. Patent and Trademark Office as a trademark of Salon Media Group Inc. Associated Press articles Copyright (c) 2016 The Associated Press. All rights reserved. This material may not be published broadcast rewritten or redistributed.",http://www.salon.com/ent/movies/review/2006/08/09/wtc,200,worldtradecenter19,worldtradecenter,salon
"StarTribune.com News weather sports from Minneapolis St. Paul and Minnesota All Sections Search Saturday July 30 2016 Manage Account Log out Log In Subscriptions New Manage Existing eEdition 79deg Forecast Traffic Star Tribune Local Sports Business Opinion Variety Obituaries Classifieds Autos Housing Jobs Home All Sections Search StarTribune Manage Account Log out Log In Subscriptions New Manage Existing Recently Visited Home Local Sports Business Opinion Variety Health Highlights Politics Nation World Science Weather Traffic Video Photography Obituaries Classifieds Autos Housing Jobs Minneapolis St. Paul East Metro North Metro South Metro West Metro Projects Local Columnists Jon Tevlin James Lileks Local Blogs Campus Confidential Class Act Dateline Minnesota Full Disclosure Lileks at Lunch MPLS. STP The Drive Yesterdays News State Fair 10000 Takes Data Drop Twins Vikings Wild Wolves Gophers Colleges Golf Lynx Motorsports Outdoors High Schools Soccer Sports Columnists Dennis Anderson Sid Hartman Patrick Reusse Chip Scoggins Jim Souhan Sports Blogs Access Vikings A Fans View Bloggin Scoggins Dennis Anderson Doug Smith Gold in the Barn Gridiron Gold Ice Gold On the Lynx On the Wolves Patrick+ Randball Russos Rants Sids Scoops Souhan on Sports StribSports Upload The Roman Empire Twins Insider Sports Podcasts Access Vikings Twins Insider Top Workplaces Business Columnists Lee Schafer Neal St. Anthony Business Blogs 3D Economics Food Market Just Listed Lee Schafer Point of Sale The Mill Commentary Editorial Steve Sack Letters Podcasts Playing Politics Books Celebs Comics amp; Games Horoscopes Eat amp; Drink Movies Music Stage amp; Arts TV amp; Media Best of MN Health Home amp; Garden Kids Health Style Taste The Good Life Travel Variety Columnists Gail Rosenblum C. J Variety Blogs Artcetera Escape Artists Greengirls Health Check Lileks  Lunch On Books Table Talk Wingnut World Class View all Obituaries Place an Obituary Notice Place an Ad Garage Sales Estate Sales Merchandise Pets Recreational Vehicles amp; Marina Newspaper Ads Auctions Search Used Vehicles Sell your Vehicle Advertise Rentals Commercial Foreclosures Find an Agent Find a Job Your Resume Your Account Employer A-Z Top Workplaces Post a Job Star Tribune All content Business listings Close Toll unclear in crash of Texas balloon carrying at least 16 34 minutes ago A hot air balloon carrying at least 16 people caught on fire and crashed in Central Texas on Saturday causing what authorities described as a ""significant loss of life."" The Latest Woman near Texas balloon crash saw fireball A look at the deadliest hot air balloon accidents FAA warned of potential for many hot air balloon deaths Local Twin Cities area braces for sex trafficking tied to Super Bowl Ryder Cup 157pm Local Pokemon Go poses problem for peace at Eden Prairie park memorial 1020am Pokemon Go trainers were out in full force Nation Russia tied to hack of program used by Clintons campaign 816am Trump Comments about Russia Clinton emails were sarcastic Local St. Croix County girl charged in savage attack on brothers girlfriend 737am More top headlines 2 people shot and wounded in Minneapolis 1117am Man dies in overnight crash near Hastings 1120am Carver County judge narrows list of potential Prince heirs to at least 6 743am Homegazing Spacecrafting The design for the makeover was inspired by Finnish lake homes of the 1960s. Windows were enlarged to capture views of the backyard pond. Homegazing 1958 St. Louis Park rambler gets Finnish lake home makeover An Eisenhower-era rambler in St. Louis Park was crying out for a makeover telling its remodeling designer what it wanted to be -- clean-lined simple and quiet like a midcentury modern Scandinavian home. You can have it for 550000. A Finnish-inspired makeover New landscaping and overhang solve water problems at Minnetonka home How to grow a garden with natural beauty Variety Game of Thrones season 8 will be the last HBO confirms 43 minutes ago Dont miss Cottage Grove couple wrap 250K honeymoon treehouse around old bur oak Michael and Paula Bushillas have spent the last few years making their 8-acre property into a shabby-chic romantic venue for new brides and grooms. Sports Chad Greenway again ready to fend off youngsters in his final(?) NFL season 922am Offense gets a hard look during Vikings first practice Sports Fans give Morneau loud return to Target Field 945am Twins pitchers Abad Kintzler could be on the move Variety Midwest Traveler Exploring the revived Eau Claire Wis. Visiting revitalized Eau Claire Wis. Opinion Rash Report 2016 campaign narrative defies expectations Like the primaries and the impact of media the DNC hack is just the latest story to morph in a different direction than anticipated. Twin Cities transit projects reach a perilous pass Why Democrats abortion stance is a deal-breaker Sports Offense gets a hard look during Vikings first practice Fans give Morneau loud return to Target Field Chad Greenway again ready to fend off youngsters in his final(?) NFL season Local Twin Cities area braces for sex trafficking tied to Super Bowl Ryder Cup New public square to liven up W. Broadway in Minneapolis Cottage Grove couple wrap 250K honeymoon treehouse around old bur oak Business After stumbling big Boston Scientific has regained its stride Mike McNamara is weaving a new web for Target IT operations Growing corn like its 2065 to study climate change effects Variety Is J.K. Rowling selling out? Some Harry Potter fans wonder 168 shows 850 performances 11 days Why Minnesotas Fringe Fest matters Husker Dus Grant Hart on full display in Walker exhibit Blogs Access Vikings Mike Harris calls illness mild setback no set timetable for return Paul Douglas on Weather Good-Looking Weekend; More Hot Encounters Scheduled for August Twins Insider Postgame Nolasco finished his extra-long start with a flourish The Drive Right turns across LRT tracks now legal at 5th and 5th but dont get used to it Todays Video http//www.startribune.com Raw video Patterson injured after spectacular catch 0021Cordarrelle Patterson left Vikings practice after a spectacular catch over cornerback Jabari Price Now Playing Raw video Patterson injured after spectacular ... Now Playing Special prosecutor added to help with Castile ... Now Playing C.J. Outrageous Davis strives to be Dave ... Now Playing Afternoon forecast Partly sunny with a high ... The StreamNews updates from around the Web most read most watched Toll unclear in crash of Texas balloon carrying at least 16  Nation Twin Cities area braces for sex trafficking tied to Super Bowl Ryder Cup  Minneapolis 1958 St. Louis Park rambler gets Finnish lake home makeover  Variety Cottage Grove couple wrap 250K honeymoon treehouse around old bur oak  East Metro Offense gets a hard look during Vikings first practice  Vikings Raw video Patterson injured after spectacular catch  Vikings Nunez Its tough to leave Twins  Sports Clinton With no ceilings the skys the limit  Politics Special prosecutor added to help with Castile shooting case  Video Vikings Greenway hints this could be final year  Vikings Most Shared Healthy Family Slow cooker carnitas serve up comfort food  Taste The key to peeling hard-cooked eggs? Cook them right  Taste How Denmark is trying to subvert call to terror A model for here?  Local After stumbling big Boston Scientific has regained its stride  Business Prince tribute concert set for October at U.S. Bank Stadium  Music Follow Us On Facebook Twitter Google+ Pinterest Instagram Tumblr World Philippine president calls off truce after rebel attack Security suddenly boosted at Amsterdams Schipol Airport Nation Reagan shooter Hinckleys return to normalcy has been years in making Powerball 478 million jackpot is nations 8th largest Politics Russia tied to hack of program used by Clintons campaign Gov. Mark Dayton looks back on 40 years of Democratic National Conventions markets get quote symbol lookup 20 minute delay last updated new stadium a look inside Go inside U.S. Bank Stadium the new star of the north Top Workplaces Beer in the office? Top Workplaces offer unusual incentives to attract workers Transparency and straight talk are not just buzzwords at top large companies Celebrities Latest late-night battle Stephen Colbert vs. corporate lawyers Fox 9s Jonathan Choe takes his talent and sartorial style home to Boston Twins Fans give Morneau loud return to Target Field Twins win on Mauers pinch-hit walk-off walk Vikings Offense gets a hard look during Vikings first practice Day 1 injuries to Patterson Peterson dont worry Vikings coach Zimmer poll Poll If Hillary becomes president what title will Bill have? Should Hillary Clinton become the president Bill Clinton would become the first male White House ... 10000 Takes The art of parting We used to spend so much time there How I came to see bipolar disorder as my greatest strength Featured Gallery Photos This mid-century home for sale in Golden Valley is like walk... 13 photos Wallpaper wallpaper wallpaper. Listed for 674900. Featured Video A new generation of black leaders say Jamar Clark made the struggle... 0328 Hear from the new generation of black leaders about challenges they face addressing ... special feature Find the summer fun Whats your flavor? Summer in Minnesota offers something for everyone. StarTribune Follow Us On Facebook Twitter Google+ Pinterest Instagram Tumblr Company About the Star Tribune Contact us Jobs News in Education City Pages High school sports hubs Mobile and tablet apps Advertise with us Talk with a business consultant Media kit Classifieds Buy Star Tribune Store Photo Reprints Archived articles Back Copies Commercial reprints Licensing Customer support Feedback Manage your account Newspaper subscription Digital access eEdition Vacation hold/billing Website Terms of use Privacy policy Site index RSS (c) 2016 StarTribune. All rights reserved.",http://www.startribune.com/412/story/602287.html,200,worldtradecenter20,worldtradecenter,startribune
Detroit NewsSUBSCRIBE NOWFOR HOME DELIVERYHomeNewsSportsBusinessAutosLife + HomeEntertainmentOpinionPhoto + VideoMoreHomeNewsSportsBusinessAutosLife + HomeEntertainmentOpinionPhoto + VideoFireflyHi Already a subscriber?Log inSubscribe today for full access on your desktop tablet and mobile device.Subscribe NowAlready a print edition subscriber but dont have a login?Activate your digital access.Manage your account settings.My AccountView the E-NewspaperManage your NewslettersView your Insider deals and moreMember ID CardLog OutFollowSearchGet the newsLog In or Subscribe to skipAlready a subscriber?Log inSubscribe today for full access on your desktop tablet and mobile device.Subscribe NowAlready a subscriber but dont have a login?Activate your digital access.TOP TRENDINGxShareOOPSThis page exists to tell you that this page doesnt exist.RETURN TO HOMENewslettersAlerts amp; RSSContact UsNewsroomSubscribeHelpAppsHomeNewsDetroitWayneOaklandMacombFlint Water CrisisMichiganMore...Nation + WorldElectionsPoliticsSportsLionsTigersRed WingsPistonsBig TenMichiganMore...Michigan StateCollegeHigh SchoolBusinessTechnologyYour MoneyAutosAuto ShowFiat ChryslerFordForeignGeneral MotorsWoodward Dream CruiseLife + HomeHomestyleFood + DrinkHealthTravelAdviceEntertainmentTV + RadioMusicStageDining + BarsArts + FestivalsCelebritiesMore...BooksMoviesOpinionColumnistsBlogsEditorialsPhoto + VideoPhoto Store (c) 2016 The Detroit News a Digital First Media Newspaper. All rights reserved. ServicesAd ChoicesAdvertise With UsAdvertising Terms and ConditionseBookseEditionSign up for Home DeliveryManage AccountMember GuidePlace an Ad in ClassifiedsPlace a Death NoticeReport a Delivery IssuePhotoStorePrivacy Notice/Your California Privacy RightsTerms of ServiceOur PartnersCareerbuilder.comCars.comHomefinder.comFindNSave.comDetroit Newspapers in EducationRenvy.comMichigan.com,http://www.detnews.com/apps/pbcs.dll/article?AID=/20060808/UPDATE/608080426,404,worldtradecenter21,worldtradecenter,detnews
