review,link,status_code,id,movie_key,critic
Yes Man | Chicago Reader Switch to the mobile version of this page. Newsletters Follow us Twitter Facebook RSS Mobile Username View Profile Edit Profile Log Out Log in Create Account The Chicago Reader News amp; Politics Music Arts amp; Culture Film Food amp; Drink Classifieds Browse News amp; Politics News amp; Politics home page Steve Bogira | Criminal Justice John Greenfield | Transportation Deanna Isaacs | Culture Ben Joravsky | Politics Michael Miner | Media Browse Music Music home page Gossip Wolf In Rotation Record roundups Leor Galil | Music Criticism Peter Margasak | Music Criticism Soundboard Concerts this week Early Warnings Concerts on horizon Browse Film Film home page J.R. Jones | Movie Reviews Index of Long Reviews Film Archive Short Reviews Now Playing Todays Showtimes Browse Arts amp; Culture Arts amp; Culture home page Tony Adler | Theater Justin Hayford | Theater Aimee Levitt | Features Brianna Wellen | Comedy Arts amp; Culture event search Browse Food amp; Drink Food amp; Drink home page Mike Sula | Restaurant Reviews Key Ingredient A chef-to-chef challenge Cocktail Challenge Bar Guide Restaurant search Browse The Bleader The Bleader blog home page Browse Classifieds Classifieds home page Real Estate Rentals Announcements Services Jobs (Monster) Place ad ad Best of Chicago Summer Guide Savage Love Straight Dope Agenda Events Locations Issues Article Archives Fun amp; Free You searched for [X]Yes Man Start over Search for... Browse movie times Narrow Search Author Select an author Andrea Gronvall Michael Atkinson Pat Aufderheide Zbigniew Banas Barbara Scharres Angelica Jade Bastien Bill Stamets Bob Mehr Brian Thomas Peter Brunette Dave Canfield Cara Jepsen Carol Burbank Cheryl Ross Pat Chesnut Luca Cimarusti Patrick Dahl Tyler Daswick Dave Kehr Cliff Doerksen Dominick Suzanne-Mayer Don Druker Mick Dumke Marilyn Ferdinand Fred Camper Patrick Friel Chris Fujiwara Leor Galil Hank Sartin Justin Hayford Jack Helbig Henry Sheehan Tanner Howard Drew Hunt J. R. Jones J.R. Jones Jennifer Vanasco Jessica Hopper Jim Healy Jonathan Rosenbaum Joshua Katzman Josh Katzman Anthony Kaufman Kelly Kleiman Asher Klein Shelley Kraicer Shelly Kraicer Nathalie Lagerfeld Adam Langer Lawrence Bommer Lisa Alspector Eric Lutz Peter Margasak Mark Jenkins Martha Bayne Adrian Martin Tom McCormack Meredith Brody Sergio Mims Michael Miner Laura Molzahn Monica Kendrick Adam Morgan Noel Murray Noah Berlatsky Pat Graham Patrick McGavin Patrick Z. McGavin Gerald Peary Richard Pena Mark Peranson Peter Keough Leah Pickett Richard M. Porton Laura Power Quintin Miles Raymer Reece Pendleton Berenice Reynaud Ronnie Scheib Tal Rosenberg Joshua Rothkopf Joshua H. Rothkopf Martin Rubin Ryan Wenzel Ben Sachs Dan Sallitt Dmitry Samarov Ronnie Schieb David Schwartz David P. Schwartz Scott Pfeiffer Ian Simmons Alissa Simon Michael Glover Smith Patrick Somerville Laura Stempel Steve Erickson David Stewart Gwynedd Stuart Mike Sula Ted Shen Julia Thiel Ignatiy Vishnevetsky Kevin Warwick Jessica Weisberg Brianna Wellen Joel Wicklund Albert Williams Michael Wilmington Sam Worley Rating G PG PG-13 R NC-17 X NR Show only Staff Pick Staff Pick Critics Choice Critics Choice Recommended Recommended New New Agenda Agenda Free Free Slideshow Slideshow Video Video Watch on Amazon Watch on Amazon Watch on Netflix Watch on Netflix Watch on Hulu Watch on Hulu Watch on YouTube Watch on YouTube Member Picks Member Picks Other Searches Events Location Guide Member Search Movie Showtimes Movie Reviews Article Archives Issue Archives Slideshows Comments Videos Images Sorting by Name Release Date Film Search Tweet Tools Email Print Share Digg Newsvine del.icio.us Facebook Reddit Twitter Windy Citizen Add to Custom List Loading... Comments Yes Man Jim Carrey is a negative-minded loser who gets roped into a seminar with motivational guru Terence Stamp and emerges from it as a boy who cant say no. This leads to numerous complications at home (his friends all take advantage) and at work (hes a loan officer naturally). But it also opens him up to life--in particular scooter-riding wild child Zooey Deschanel. An interesting Atlantic column by James Parker posits the idea of Carrey as an existential hero which might be more persuasive if his funniest moment here didnt involve him pulling his face into a grotesque mask with adhesive tape. On the other hand its nice to see a high-concept comedy with such a generous concept. Peyton Reed (Down With Love The Break-Up) directed. PG-13 104 min. By J.R. Jones Now Playing Sorry there are no upcoming showtimes for Yes Man Reviews/comments Subscribe to this thread By Email Subscribing... With RSS Comment Add a review Rating Roll over stars and click to rate. Subscribe to this thread Terms of UsePrivacy PolicySubmission GuidelinesAbout The ReaderStaffReader CareersContact UsFreelancing InfoAdvertisingBack IssuesReprints Copyright (c) 2016 Sun-Times Media LLC. Powered by Foundation,http://onfilm.chicagoreader.com/movies/briefs/33972_YES_MAN.html,200,yesman15,yesman,chicagoreader
"He wont give no for an answer - The Boston Globe Local Search Site Search Home Delivery HomeTodays GlobeNewsBusinessSportsLifestyleAamp;EThings to doTravelCarsJobsHomesLocal Search MoviesRestaurantsMusicTheater/ArtsTelevisionBooksCelebrity newsEventsGamesComics THIS STORY HAS BEEN FORMATTED FOR EASY PRINTING Home / Aamp;E / Movies MOVIE REVIEW Yes Man He wont give no for an answer Jim Carrey plays an antisocial bank-loan officer who changes after attending an affirmation seminar. (melissa moseley) By Wesley Morris Globe Staff / December 19 2008 Email| Print| Single Page| | Text size - + In ""Yes Man"" Jim Carrey plays Carl an antisocial Los Angeles bank-loan officer who agrees to stop saying ""no"" - to friends strangers co-workers the homeless; to fun life Mormons even the horny old lady (Fionnula Flanagan) in his apartment complex. He twists shouts does a round of Dance Dance Revolution plans a bridal shower attends what must be the last rave in California learns Korean goes to a Harry Potter costume party and courts Zooey Deschanel.Yet the joys of affirmation appear lost on Carrey who never looks truly happy. Its entirely possible that Im projecting my forced smiles onto Carreys face. But he seems to hold this entire exercise (it is alas a workout) in contempt. Perhaps he thought he was through with these high-concept one-note comedies having failed to top the physical genius of ""Liar Liar"" in 1997 and having made a mild breakthrough of sincerity in 2003s ""Bruce Almighty.""While Carrey was off exploring his dramatic range in movies as radically different as ""Man on the Moon"" ""Eternal Sunshine of the Spotless Mind"" and the execrable ""The Number 23"" the landscape for movie clowns changed. He does not belong to the fraternity that has come to dominate Hollywood comedy in this decade. Vince Vaughn Ben Stiller Will Ferrell Owen Wilson on one hand and the writer-director-producer Judd Apatow on the other share a franchise on the genre. Its strange to say but Carrey is an outsider in a rambunctious style he helped create. For ""Yes Man"" he turns in what feels like a Jim Carrey impersonation - 104 minutes of high-energy heartlessness.The gist of it all is that Carl must carpe his diem. He attends a seminar led by a yes guru (Terence Stamp comically smug) where everyone around Carl is happy (or something like it) so why shouldnt he be too? In our pharmaceutical age theres probably a great farce to be made about emotional conformity. This movie directed by Peyton Reed and adapted from Danny Wallaces novel by three writers feels made from quirky-comedy instant mix just add heart. Its a cynical attempt ultimately to make obnoxious people palatable by throwing them into a tub of romantic comedy.Casting Deschanel as The Girl is not the wonderful stroke it once was. Between this film and ""The Happening"" she seems more warmed over than Carrey. Deschanel glides through ""Yes Man"" with a cute haircut and cuter clothes fronts a band called - quirk alert 1 - Munchausen By Proxy (they have a semi-funny song about booty calls) and - quirk alert 2 - teaches a jogging photography class. Weve seen her scoot through this part before in ""Elf"" and ""Failure to Launch."" There are probably a dozen better ways for her to spend her time (although few as lucrative) so it seems too soon for her to be on autopilot. For one thing wheres her ""Yes Woman""?That of course is the biggest problem with this movie - not that its mediocre dull or barely written (though its guilty on all counts). Its that Carrey himself is miscast. This is a star-making part as opposed to a part for a star committing a repeat offense. I watched Carrey ride a Ducati motorcycle in a hospital gown during the climax of this movie and thought about how much more fun it would have been to see a fresher face (Michael Ceras Robert Pattinsons or Paul Danos) do that and all of Carls exclamatory slapstick to see someone care enough to make a character out of this.If Carrey looks resentful or bored it may be because hes made things too easy for himself. He doesnt have to worry about breaking character in ""Yes Man."" Hes not playing one.Wesley Morris can be reached at wmorrisglobe.com. For more on movies go to www. boston.com/movienation. (c) Copyright 2009 Globe Newspaper Company. Related Find showtimes theaters and ticket information for Yes Man Video Watch the trailer YES MAN Directed by Peyton Reed Written by Nicholas Stoller Jarrad Paul and Andrew Mogul adapted from the book by Danny Wallace Starring Jim Carrey Zooey Deschanel Bradley Cooper Danny Masterson and Fionnula Flanagan At Boston Common Fenway suburbs Running time 104 minutes Rated PG-13 (crude sexual humor language and brief nudity) Email Email Print Print Single page Single page Reprints Reprints Share Share Comment Comment Share on Digg Share on Facebook Save this article powered by Del.icio.us Your Name Your e-mail address (for return address purposes) E-mail address of recipients (separate multiple addresses with commas) Name and both e-mail fields are required. Message (optional) Disclaimer Boston.com does not share this information or keep it permanently as it is for the sole purpose of sending this one time e-mail. Advertisement Boston.com Most EmailedSubscribe to SliceBookmark Boston.com Most Emailed120 MOST E-MAILED >> Report Warrant Issued for Roggies Bar OwnerMap of Greater Boston Farmers MarketsBoston Pops Concert Move Keeps the Beach Boys Ditches Joey McIntyreWe Tried Out Those New Solar BenchesNew Englands top outdoor water parksDrink of the Week Mojito ItalianoLawmakers pass compounding pharmacy oversight bill Follow this list on Twitter BostonPopular Home| Todays Globe| News| Business| Sports| Lifestyle| Aamp;E| Things to Do| Travel| Cars| Jobs| Homes| Local Search Contact Boston.com | Help| Advertise| Work here| Privacy Policy| <a href=""http//members.boston.com/reg/login.do?dispatch=loginpageamp;p1=Foot_ContactBostonCom_Newsletters"">Newsletters</a>| Mobile| RSS feeds| Sitemap| Make Boston.com your homepage Contact The Boston Globe| Subscribe| Manage your subscription| Advertise| The Boston Globe Extras| The Boston Globe Store| (c) NY Times Co.",http://www.boston.com/ae/movies/articles/2008/12/19/he_wont_give_no_for_an_answer,200,yesman16,yesman,boston
" Yes Man stars Jim Carrey Zooey Deschanel Terence Stamp - Chicago Tribune Movies Arts amp; Entertainment Movies  Yes Man stars Jim Carrey Zooey Deschanel Terence Stamp Michael PhillipsTribune critic The director Peyton Reed is used to working in italics. His ""Down With Love"" (2003) was an entirely italicized movie reworking the plot mechanics and arch visual strategies of the Doris Day/Rock Hudson sex comedies of the late 1950s and early 60s along with Broadway-to-Hollywood adaptations such as ""Sunday in New York"" (1963). It turned out more like a cinematic term paper than a movie but Reeds willingness to go all the way--further than Doris Day ever did at least before the ring and the fade-out--marked him as a director to watch.In ""Yes Man"" hes working with the human italic button known as Jim Carrey who shot to movie fame as Ace Ventura and The Mask characters straight from the cartoon world or the world according to Frank Tashlins live-action comedies. These days (Carrey turns 47 next month) the star isnt going for insanely broad comedy. When he lands the right script as he did with ""Eternal Sunshine of the Spotless Mind"" Carrey finds real and touching ways to channel all that energy into a performance as opposed to a performance. ""Yes Man"" starts out wobbly but ends up quite nicely primarily because Carrey has a wonderful acting partner in Zooey Deschanel the singer-actress with the saucer eyes and unpredictable behind-the-beat comic timing. Carrey by nature is a coiled spring; Deschanels a spring thats already sproiiiinged. If she ever co-stars in a movie with Kat Dennings of ""Nick amp; Noras Infinite Playlist"" the world will immediately enter a permanent Zen-like state of calm.Carrey plays Carl Allen an L.A. loan officer at a drab bank stuck with a goon of a superior (Rhys Darby very funny). Carl cant get out of his surly self-pitying rut three long years after his breakup. For the first 20 minutes of ""Yes Man"" which was loosely based on Scottish comedian Danny Wallaces book you think youre in for it. Carrey forces the laughs and the characters an uninteresting sour fellow. Then comes Terence Stamp in his first genuinely funny screen appearance as a self-help guru who challenges his followers to say ""yes"" to every single thing that comes their way. Carl tries it and before long he meets Allison (Deschanel) a bohemian L.A. polyglot whos in a band called Munchausen By Proxy and who teaches classes in ""jogging photography"" i.e. taking photos while jogging. In its tale of an emotional shut-in who learns to embrace life get a pilots license and speak Korean ""Yes Man"" recalls some previous Carrey vehicles notably ""Liar Liar."" (Chris Knight of the National Post newspaper put it this way ""Jim Carrey + oddly constraining superpower = box-office gold"") The tone of ""Yes Man"" isnt predominantly manic however and may throw some die-hard Carrey fans expecting the old shtick in high gear.We dont like our movie stars to change on us and yet they must if theyre to grow as actors. What I enjoyed most here was the interplay between two utterly different leads. Director Reed cant resolve the tensions in a spotty script by Nicholas Stoller Jarrad Paul and Andrew Mogel which feels like a compromise between two (or more) separate drafts one leaning in the direction of farce the other romance. But Carrey and Deschanel are pretty amazing to watch together onscreen. And that makes ""Yes Man"" movie enough for me.mjphillipstribune.comMPAA rating PG-13 (for crude sexual humor language and brief nudity). Running time 144.Opening Dec. 19.Starring Jim Carrey (Carl Allen); Zooey Deschanel (Allison); Bradley Cooper (Peter); John Michael Higgins (Nick); Terence Stamp (Terrence); Rhys Darby (Norm).Directed by Peyton Reed; written by Nicholas Stoller Jarrad Paul and Andrew Mogel based on the book by Danny Wallace; photographed by Robert Yeoman; edited by Craig Alpert; music by Lyle Workman and Mark Oliver Everett; production designed by Andrew Laws; produced by Richard D. Zanuck and David Heyman. A Warner Bros. Pictures release. Copyright (c) 2016 Chicago Tribune Entertainment Movies Jim Carrey Zooey Deschanel Celebrities Doris Day Death Lolla 2016SportsBreakingTrendingOpinionBusinessSuburbsAdvertising76deg","http://www.chicagotribune.com/entertainment/movies/chi-yesman-review-1219dec19,0,3464479.story",200,yesman17,yesman,chicagotribune
Page not found | Inland Empire Weekly | Page 1910 About Advertise Paper Locator Promotions Subscribe Contact Feature Story News News Stories The Watch Dog Ask A Mexican Final Word The Rundown Letters Music Music Feature Band of the Week CD Reviews Arts amp; Culture Arts Feature Books Theater Eats Eats Reviews Bite Me Film Film Reviews The 7 Day Stretch Pick of the Week Web Only Bite Me PhotoBomb The Watch Dog Video of the Week Locals Only How Well Do You Know The IE Arts amp; Culture Web Only News Stories Film Music Feature Ask A Mexican Final Word The 7 Day Stretch Eats Fractured Selves Embezzling Girl Scout Leader Arrested Secretive Security Romantic Delivery Taking Flight !ASK A MEXICAN The Final Word The 7 Day Stretch Living La Vida Loca 404 - Page Not Found That just happened. We could not find the page that you requested. It is possible that it was deleted since the last time you viewed it or that you typed in the wrong URL. In any case we want you to find what you are looking for so we offer you the following options 1. Go back to the home page and start your journey over. 2. Use the menu above to locate the section you wish to view. 3. Search our site Enter keyword(s) and press enter Search Follow UsWeather Forecast | Weather Maps | Weather Radar In the NewsHermosillo leads Inland Empire over Lake Elsinore 10-3 - The Daily ProgressFletcher Houchins and Moyer lead Inland Empire in win - The Daily ProgressDaryl Dirty D James to return to the air in Inland Empire - San Bernardino County SunRed-blooded donors in the Inland Empire needed to fill shortage - San Bernardino County SunInland Empire must carefully weigh Californias climate change policies Guest commentary - San Bernardino County SunLike us on Facebook Video of the Week Get old school with Pink Martini   CLICK HERE FOR MORE VIDEOS Subscribe Via Email Enter your email address Latest Tweets Categories Archives Arts amp; Culture Best of Eats Events Feature Story Film Man on the Streets Mind Body Spirit Music News Pop Goes the Culture Sports The 7 Day Stretch The Small Screen Travel Uncategorized Videos Web Only January 27 2014-February 2 2014 January 20 2014-January 26 2014 January 13 2014-January 19 2014 January 6 2014-January 12 2014 December 30 2013-January 5 2014 December 23 2013-December 29 2013 December 16 2013-December 22 2013 December 9 2013-December 15 2013 December 2 2013-December 8 2013 November 25 2013-December 1 2013 November 18 2013-November 24 2013 November 11 2013-November 17 2013 November 4 2013-November 10 2013 October 28 2013-November 3 2013 Recent Embezzling Girl Scout Leader Arrested Groups that Give Back The Final Word The 7 Day Stretch The Rundown !ASK A MEXICAN Copyright (c) 2016 Inland Empire Weekly All Rights Reserved. Pasadena Weekly | Ventura County Reporter | San Diego CityBEAT | CULTURE Magazine | Privacy Policy top,http://www.ieweekly.com/cms/story/detail/yes_man/1910/,404,yesman18,yesman,ieweekly
404 Not Found 404 Not Found nginx,http://feeds.washingtonpost.com/~r/wp-dyn/rss/print/style/index_xml/~3/0mavB9mtxKc/AR2008121803604.html,404,yesman19,yesman,washingtonpost
"No no no to Liar-like Yes Man - USATODAY.com Cars  Auto Financing  Event Tickets  Jobs  Real Estate  Online Degrees Shopping SearchHow do I find it?Subscribe to paper Home News Travel Money Sports Life Tech Weather Life >> Movies Box Office Report Movie Listings Awards Central Shop for Movies/DVDs No no no to Liar-like Yes Man Updated  | Review  | Recommend E-mail | Print | Enlarge Warner Bros. Pictures Free spirit (Zooey Deschanel) meets elastic-faced guy (Jim Carrey) who just cant say no in Yes Man. ABOUT THE MOVIEYes Man  1/2 out of fourStars Jim Carrey Zooey Deschanel Terence Stamp John Michael Higgins Bradley Cooper Rhys DarbyDirector Peyton ReedDistributor Warner Bros.Rating PG-13 for crude sexual humor language and brief nudityRunning time 1 hour 44 minutesOpens Friday nationwide WATCH THE TRAILER By Claudia Puig USA TODAY Yes yes its Liar Liar 2. Yes Man is more than just familiar. It feels downright repetitive. The plot relies on a high concept so similar to that 1997 movie that the audience will get a decided feeling of deja viewed. In the earlier film Jim Carrey played a selfish guy with a chronic habit of lying. He is forced via his sons birthday wish to tell the truth for 24 hours. This time Carrey plays Carl the quintessential naysayer. An increasingly withdrawn loan officer he routinely turns down prospective clients and roundly refuses invitations from friends. Still shattered from the break-up of a relationship more than two years before hes in a rut. A chance encounter with an exuberant and slightly unhinged friend (a funny John Michael Higgins) inspires Carl to attend a self-help seminar. Though he resists he is swept up by the movements charismatic guru (Terence Stamp) and makes a covenant to seize opportunities and respond affirmatively to all requests. The first involves giving a ride to a homeless man that leads to a humorous chain of events and a chance meeting with a free-spirited girl (Zooey Deschanel). Carl is convinced that terrible repercussions will ensue if he says no. Illustrating that point is a funny scene involving an encounter with a randy elderly neighbor (Fionnula Flannagan). Fortunately Yes Man though uneven is an improvement over Liar Liar. But as the movie progresses incidents grow more forced and are only sporadically funny. A protracted scene in which he talks a suicidal man (Luis Guzman) off a ledge by playing the guitar becomes a cloying group singalong. Carrey is back to elastic-faced form and zany physical humor. But his efforts feel more manic than comical. His co-stars pick up the slack. Rhys Darby (Murray on HBOs Flight of the Conchords) is weirdly funny as Carls boss. The idea is inspired enough a series of unusual ""yescapades"" a term coined by author Danny Wallace on whose memoir the movie is based. But with Carrey in the lead its freshness seems compromised. Its just too hard to avoid Liar Liar comparisons. It might have been more enjoyable if the lead had gone to someone who could have played it less clownish. This is not to diminish Carrey. But the combination of the familiar scenario and his broadly comic style seems stale. Posted Updated E-mail | Print | To report corrections and clarifications contact Reader Editor Brent Jones. For publication consideration in the newspaper send comments to lettersusatoday.com. Include name phone number city and state for verification. Guidelines You share in the USA TODAY community so please keep your comments smart and civil. Dont attack other readers personally and keep your language decent. Use the ""Report Abuse"" button to make a difference. Read more. Newspaper Home Delivery - Subscribe Today Home  News  Travel  Money  Sports  Life  Tech  Weather About USATODAY.com Site Map | FAQ | Contact Us | Jobs with Us | Terms of Service Privacy Policy/Your California Privacy Right | Advertise | Press Room | Developer | Media Lounge | Reprints and Permissions News Your Way Mobile News | Email News | Add USATODAY.com RSS feeds | Twitter | Podcasts | Widgets Partners USA WEEKEND | Sports Weekly | Education | Space.com | Travel Tips Copyright 2011 USA TODAY a division of Gannett Co. Inc.",http://www.usatoday.com/life/movies/reviews/2008-12-18-yes-man_N.htm,200,yesman20,yesman,usatoday
