review,link,status_code,id,movie_key,critic
"Were sorry we cant find the page that youre looking for Go to the content Go to the footer Time Out New York New York Popular cities London New York Paris Chicago Los Angeles Browse all cities Time Out New York Close New York Change city New York Popular cities London New York Paris Chicago Los Angeles Browse all cities Tickets Events Things to Do Restaurants Bars Movies Theater Music Shopping Attractions Blog Art Travel Nightlife Events amp; Festivals Museums Kids Hotels Comedy Dance LGBT Sex amp; Dating Books City Guide Neighborhoods Promotions Close My Time Out Things I love My lists My Profile My Account Sign out Sign in Create account Sign in With your social account Or with your email Email Password Remember me Forgotten your password? Sign in You can create a Time Out account in two ways... With a few clicks using your favourite social network Or by entering your details below Email First Name Last Name Create password Repeat new password I accept Time Outs terms of use including opt-in to newsletters. Create account Welcome  You have successfully connected your account to Time Out. You may sign in with this account in future. Please confirm your account details Email First Name Last Name I accept Time Outs terms of use including opt-in to newsletters. Sign up My Account Sign in or Create account Search Tickets Events Things to Do Restaurants Bars Movies Theater Music Shopping Attractions Blog Art Travel Nightlife Events amp; Festivals Museums Kids Hotels Comedy Dance LGBT Sex amp; Dating Books City Guide Neighborhoods Promotions More Search Were sorry we cant find the page that youre looking for We have either moved the page or it no longer exists. To help you find your way here are some search results we think may be of interest. Movies Yes Man Is Peyton Reed an underrated director? Down with Love dissected the Day-Hudson rom-coms with more lifeblood than its highbrow equivalent Far from Heaven. The Break-Up shirked conventions and built to a devastating final scene in which the characters...talked... 3 out of 5 stars Read more Movies The 50 best songs from 80s movies If theres one word that captures the feel of the 1980s in pop culture its joy. Sure there have been classier deeper artier weirder eras--in fact probably any other decade you care to name in the past century is cooler than the 80s--but thats precisely... Read more Theater Then She Fell [Note Since this review was written Then She Fell has moved and reopened; it now plays on three floors of a church building in Williamsburg.] At first blush Then She Fell seems to be a small-scale cribbing of Punchdrunks Sleep No More. Yes you wander... 4 out of 5 stars Until Sunday September 25 2016 Read more LGBT Boomer Banks interview ""I always knew I wanted to be in New York City"" Boomer Banks has made quite an impression in the last year. In the short time hes been making porn hes become one of the most popular stars at Raging Stallion the studio where hes currently an exclusive. He was also just named the citys top hustler... Read more Movies The Great Beauty movie review The cheesy Eurodisco is pumping old men are lecherously pawing young models and strippers listlessly dance on tabletops and in Deco glass booths. Then the crowd parts and like Moses in a bespoke suit he appears Geppino ""Jep"" Gambardella (Toni Servillo)... 4 out of 5 stars Read more Movies Paths of Glory Sticklers for the literal will disagree but this is where Stanley Kubricks career truly begins. His previous film 1956s heist gem The Killing sometimes feels trapped in the noir mannerisms of the day. But it was clever enough to engender goodwill... 5 out of 5 stars Read more Blog That guy who dresses as Bane in Times Square needs to GTFO So theres a guy in Times Square who thinks its appropriate to dress as Bane. Yes that Bane the DC supervillain with the muscles and the mask and the silly everythings-a-question voice who spends the last three hours of The Dark Knight Rises (or... Read more Movies The Invisible Life When his boss and mentor falls seriously ill Lisbon government functionary Hugo (Filipe Duarte) goes into a tailspin. He looks back on his life descends into a vortex of regret and spends increasing amounts of time in his darkened office after everyone... 4 out of 5 stars Read more Theater 20 Broadway and Off Broadway shows to catch this fall Postmodern church services British monarchical struggles New David Mamet David Bowie...playwright?? This fall certainly doesnt lack for variety on Broadway or Off-Broadway shows. New musicals are a bit scarce (typical in the fall) but were looking... Read more If you see one movie this week go to... Dead Man (1995) This provocative and mesmerizing black-and-white Western from Jim Jarmusch (Only Lovers Left Alive) is arguably his masterpiece. A pre-Pirates of the Caribbean Johnny Depp stars as meek accountant William Blake (yes he shares his name... Read more Top About us Work for Time Out Privacy policy Website terms of use Contact us Get listed Advertising Time Out products Mobile apps Time Out Shop Time Out Guides Time Out Travel Time Out Worldwide Time Out magazine Follow us Facebook Twitter Youtube Instagram Pinterest Spotify Foursquare Time Out New York Site map",http://www.timeout.com/film/reviews/86475/yes_man.html,404,yesman0,yesman,timeout
0,http://bventertainment.go.com/tv/buenavista/atm/,0,yesman1,yesman,go
"Yes Man is a definite maybe |       NJ.com NJ.com Menu Home News Politics Sports High School Sports Entertainment Photos/Videos Obituaries Autos Jobs Real Estate Rentals Health Classifieds Local Businesses Place An Ad Opinion Follow Us Subscribe Back to Main Menu News News by County All Newspapers Business Crime Education Health Lottery Obituaries Politics Back to Main Menu Atlantic Bergen Burlington Camden Cape May Cumberland Essex Gloucester Hudson Hunterdon Mercer Middlesex Monmouth Morris Ocean Passaic Salem Somerset Sussex Union Warren Back to Main Menu The Star-Ledger The Times of Trenton The Jersey Journal South Jersey Times Hunterdon County Democrat Independent Press Horse News Back to Main Menu Politics Home Chris Christie Opinion The Auditor Back to Main Menu Sports Home Devils Eagles Flyers Giants Jets Knicks Mets Nets Phillies Rangers Red Bulls Rutgers Basketball Rutgers Football Rutgers Sports Seton Hall Sixers Yankees Back to Main Menu Football Baseball Softball Boys Lacrosse Girls Lacrosse Boys Track and Field Girls Track and Field Boys Volleyball Boys Tennis Boys Golf Girls Golf Wrestling Boys Basketball Off Season Sports Back to Main Menu Football Wrestling Boys Basketball Girls Basketball Boys Bowling Girls Bowling Boys Cross Country Girls Cross Country Boys Fencing Girls Fencing Field Hockey Boys Ice Hockey Girls Ice Hockey Gymnastics Boys Skiing Girls Skiing Boys Soccer Girls Soccer Boys Swimming Girls Swimming Girls Tennis Girls Volleyball Boys Winter Track Girls Winter Track Back to Main Menu Entertainment Home Atlantic City Entertainment Celebrities Comics Events Food amp; Dining Indulge Inside Jersey Movies Music Online Gambling Guide Puzzles Shore TV Back to Main Menu Hunterdon County Democrat Photos Jersey Journal Photos NJ.com Photos South Jersey Times Photos Star-Ledger Photos Times of Trenton Photos Videos Back to Main Menu Homes for Sale New Homes For Rent Foreclosures Commercial Real Estate News Resources Place An Ad Back to Main Menu Home Buying Sell My Home Rental Living Home Ideas Mortgages and Loans Im Moving Back to Main Menu Obituaries Rentals Pets For Sale Garage Sales Find n Save Fraud Prevention Manage Your Ad Place An Ad Back to Main Menu Find A Business Food amp; Dining Retail Shopping Health amp; Medicine Personal Care Entertainment Real Estate Automotive Claim Your Business Sponsored Blogs Back to Main Menu Visit our Facebook Page Follow us on Twitter View our Instagram photos See our Tumblr feed See our Pinterest page Visit us on Google Plus Visit OMJ for NJ celebrity amp; style Back to Main Menu Email newsletters The Star-Ledger The Times of Trenton The Jersey Journal South Jersey Times Hunterdon County Democrat Star Gazette Back to Main Menu Close Customize Your Weather Set Your Location (Enter City and State or Zip Code) Congratulations Your weather is set to . You can change the location at any time. AccuWeather.com Quick Look Change your current location >> View Full Weather Report Search Search Search NJ.com Account Sign In Close Sign in toNJ.com You are signed in as Edit Public Profile Sign Out Subscribe Email newsletters The Star-Ledger The Times of Trenton The Jersey Journal South Jersey Times Hunterdon County Democrat Star Gazette comments Yes Man is a definite maybe Print Email Anthony Venutolo | NJ Advance Media for NJ.com By Anthony Venutolo | NJ Advance Media for NJ.com The Star-Ledger Email the author | Follow on Twitter on December 18 2008 at 1000 PM updated December 18 2008 at 1003 PM comments WARNER BROS.Jim Carrey makes a return to goofball comedy in ""Yes Man."" Yes Man. (PG-13) Warner Bros. (105 min.) Directed by Peyton Reed. With Jim Carrey Zooey Deschanel. Opens Friday at theaters in New Jersey. TWO AND A HALF STARS Carl Allen lives in the negative. His friends think he should start dating again? No. His next-door-neighbor wants him to stop by for a cake a muffin a cup of tea? No. A long line of supplicants at his loan-officers desk want to start a business go on vacation splurge on a gift? No no no. And then Carl decides to say yes. Its all thanks to a slightly flaky old friend and the ""transformational"" seminar he drags him to -- you know one of those all-day Ramada Inn affairs where caffeinated pitchmen push their books. Only this pitch is simple. Say yes to every opportunity. Say yes to everyone. Just say yes. Thats the idea behind ""Yes Man."" And its a small nice return to form by Jim Carrey whose most recent onscreen appearances include the paranoid ""The Number 23"" and unfunny ""Fun With Dick and Jane."" Its not a great movie but its a lot better than what hes been turning out. Perhaps its because (as in ""Eternal Sunshine of the Spotless Mind"" ""The Truman Show"" and ""Man in the Moon"") Carreys finally working with a good director again. Its a sad pattern with comics but generally they look for malleable hacks; theyre convinced they know whats funny and the last thing they want is an auteur with ideas. Which goes a long way toward explaining the last decade or so of Steve Martin and Eddie Murphy movies. Peyton Reed who directs here is no Milos Forman or Peter Weir but hes better than the filmmakers Carrey usually pushes around. Reeds ""Down With Love"" a careful homage to Rock-and-Doris comedies showed a careful eye if not an abundance of wit; his follow-up ""The Break-Up"" was amazingly both funny and adult. ""Yes Man"" isnt that adult -- theres a senior-sex scene weve already seen in ""Soul Men"" and plenty of pratfalls -- but its well-edited and has some nicely offbeat moments. Some of those come from Reeds sense of pace and payoff; many of them come from the supporting cast. Kiwi actor Rhys Darby from ""Flight of the Conchords"" is winning as Carls socially maladroit boss; as a new love in Carls life Zooey Deschanel has the inside track on taking the Adorable Kook crown from Maggie Gyllenhaal. If theres a weak link in this Jim Carrey movie it is ironically Jim Carrey. He has always worked too hard for laughs class-clowning his way through even throwaway bits of exposition; its as if hes terrified that for one brief moment you might doubt that hes the funniest person in the room. The problem is that here that works against his character. The point of ""Yes Man"" is that Carl is transformed; he needs to start off as a sad-sack loser like Jack Lemmon in ""The Apartment"" so he can be reborn. But thats anathema to Carrey; he needs too desperately for us to like him. And so he yuks it up from the start and dilutes the change to come. Still the incidental pleasures of ""Yes Man"" connect. Like Luis Guzman as a would-be suicide Carrey tries to counsel. Or Deschanels cult band Munchausen by Proxy (which performs for some reason wearing lobster masks). Or Darbys elaborate pathetic costume parties or Terence Stamps rap as the self-help guru. Is ""Yes Man"" hysterical? No. Is it terribly romantic? No. Is it going to give you every dimes worth of your 11 ticket price? Well I dont know maybe. But does it mark the beginning of a comeback for a comic who will not only do anything for a laugh but frequently does too much? Yes. Rating note The film contains strong language comic nudity alcohol abuse and sexual situations. Stephen Whitty may be reached at swhittystarledger.com or (212) 790-4435. Listen to the latest episode of our TV podcast Subscribe on iTunes Subscribe on Stitcher Most Read Find Local Real Estate Jobs Autos Businesses Find a job Buy or sell a car Find a place to live See whats for sale Find a business View obituaries Get Your Weekly Entertainment Guide TV recaps movie and music reviews local dining guides and the latest in Atlantic City entertainment news delivered to your inbox Leave this field blank optional Check here if you do not want to receive additional email offers and information. See our privacy policy Thank you for your subscription To view and subscribe to any of our other newsletters please click here. Entertainment Essentials Search music dining more event listings Inside Jersey N.J.s lifestyle magazine OMJ.com N.J. celebrity and style Entertainment Listings Events Music Food Active Discussions nj.com About Us About NJ.com Advertise with us Contact Us Visit OMJ.com Jobs at NJ Advance Media Newsletters RSS feeds More on NJ.com Interact Weather Site map Claim your free business listing Sponsor Content Search Place an ad Sell your car Sell/rent your home Post a job Post a free classified ad Apartments amp; rentals NJ.com Sections N.J. News Local News N.J. Politics Sports High School Sports Entertainment Food amp; Recipes Living Business Opinion Inside Jersey Shore Obituaries Jobs Autos Real Estate Rentals Classifieds Shopping Good Deals Local Businesses Special Sections Contribute to NJ.com Register for free with NJ.com Submit an event Follow Us Twitter Google+ Facebook foursquare Newspaper stories and photos The Star-Ledger | Subscribe The Times of Trenton | Subscribe The Jersey Journal | Subscribe South Jersey Times | Subscribe Hunterdon County Democrat | Subscribe Star Gazette | Subscribe The Warren Reporter Suburban News Horse News Learn more about our newspapers Mobile iPhone Android apps | Tablet apps Registration on or use of this site constitutes acceptance of our User Agreement and Privacy Policy (c) 2016 New Jersey On-Line LLC. All rights reserved (About Us). The material on this site may not be reproduced distributed transmitted cached or otherwise used except with the prior written permission of New Jersey On-Line LLC. Community Rules apply to all content you upload or otherwise submit to this site. Ad Choices",http://www.nj.com/entertainment/tv/index.ssf/2008/12/yes_man_is_a_definite_maybe.html,200,yesman2,yesman,nj
"OH NO YES IS A MESS | New York Post Thanks for contacting us. Weve received your submission. Back to Reading News Metro Page Six Sports Business Opinion Entertainment Fashion Living Media Tech Real Estate Sub Menu 1 Photos Video Covers Columnists Horoscopes Sub Menu 2 Classifieds Subscribe Sign in In The News hillary clinton iran lamar odom 2016 presidential election new york mets Sections Search Tips Sign in New York Post Most Popular 47261 Why Hollywood babes are trying to bag a tech titan not a rock star 21696 College student kills 3 in house party shooting cops 17581 16 dead in Texas hot air balloon crash 13806 Ex-NFLer wife fatally shot by teen in their home 13314 Braves Brian McCann interest may pave way for Gary Sanchez 11794 For the love of God stop dressing like crap Share thisFacebookTwitterGoogleWhatsAppEmailCopy Entertainment Share thisFacebookTwitterGoogleWhatsAppEmailCopy OH NO YES IS A MESS By Kyle Smith View author archive email the author follow on twitter Get author RSS feed Name(required) Email(required) Comment(required) December 19 2008 | 507am THE first time I saw ""Yes Man"" I thought the concept was getting kind of stale toward the end. As it turns out that was only the trailer. The movie offered an additional 102 minutes of a depressed loan officer saying yes every time hes asked to do something. Does Jim Carrey annoy his friends by saying no every time they ask him to come out to play? Would actual friends forget about such a drippy loser within a week after he started blowing them off? Does he turn his life around after a friend drags him to a positive-think seminar run by a freaky guru (Terence Stamp)? Wouldnt you go along with the program if told to say yes to everything by General Zod? When the guru says we should ""gobble up lifes energies and excrete the waste"" was I regretting my career path? Does Carrey encounter a few blandly disagreeable situations like agreeing to drive a homeless guy to a scary park and letting him run down the battery on his cellphone? Wouldnt a guy in this situation instantly be bankrupted by Nigerian Internet scammers? Wouldnt he run out of hours for all the language and music courses and charity work hes offered? Was I wishing hed agree to follow some Crips down a dark alley and never return? Does this movie say a sure way to get promoted at a bank is to approve all loans no matter how unlikely to be repaid? Is it possible that the chuckleheads at Citibank and WaMu got a sneak peek of this movie a couple of years ago? Does the blue-eyed alterna-cutie Zooey Deschanel demean herself by playing a scooter-driving girl who randomly strikes up a conversation with Carrey at a gas station? Do the two of them make out only to part again forever? Does forever turn out to be about two days at which point he runs into her again by agreeing to go see a ridiculous rock act she fronts? Do you find it hard to believe she wouldnt notice that he says yes to everything as their relationship deepens? Do you think she would think hes kind of deranged? Does the movie kill lots of time by throwing in situations where saying yes doesnt even apply like a scene in which Carrey saves a guy from jumping off a ledge by playing him a song on a guitar? Does he bungee-jump off a bridge because the movie needs one more wacky shot for the trailer? Does the power of repetition gradually make him a better person? Would you be better off watching ""Groundhog Day"" for the 10th time instead? Is there a gross-out scene in which an old lady offers him oral sex? Will there be a close-up of the glass of water she puts her dentures in? Are there enough idiots to make this movie a hit? Is Carreys elastic-man act a lot less funny than it used to be? Is he 10 years too old for gags like vrooming around on a Ducati while wearing a hospital gown? Was everyone around him in grade school when ""Ace Ventura"" came out? Except General Zod who was probably still banished to the Phantom Zone? Did I laugh less than once? Can you do better than an entire movie as predictable and annoying as this review? kyle.smithnypost.com YES MAN ""The Secret"" plus pratfalls. Running time 104 minutes. Rated PG-13 (crude sexual humor profanity brief nudity). At the Lincoln Square the 34th Street the Kips Bay others. Share thisFacebookTwitterGoogleWhatsAppEmailCopy Share this article Share thisFacebookTwitterGoogleWhatsAppEmailCopy Read Next DVR TOP TEN LIST Read Next DVR TOP TEN LIST Share Selection Trending Nowon NYPost.com 46764 Why Hollywood babes are trying to bag a tech titan not a rock star 20339 College student kills 3 in house party shooting cops 17970 16 dead in Texas hot air balloon crash Now On Celebrate Arnolds 69th birthday with his beefiest vintage pics Eric Claptons girlfriends ex-beau busted on pot rap Orlando Bloom joins Andy Sambergs HBO mockumentary SEE ALL Page Six TV Lindsay Lohans dad says booze pics arent what they seem Lindsays sober claims Michael Lohan These celebs hang out where? Now On Pure Nude Yoga Actual Workout Or Masturbation Material? (Answer Sorta Both) SEE ALL More Stories pagesix Harry Brant busted for drugs and bailing on taxi fare Now On Decider This Woman Giving Birth In A Stream Has Been Watched Over 54 Million Times (NSFW) nypost Why Hollywood babes are trying to bag a tech titan not a rock star New York Post Twitter Facebook Instagram Email Newsletters Mobile Apps Contact Us Tips Twitter Facebook Instagram Sections amp; Features News Real Estate Page Six Tech Sports Media Metro Photos Entertainment Video Business Alexa Opinion Covers Fashion Horoscopes Living Classifieds Newsletters amp; Feeds Email Newsletters RSS Feeds NYPost Store Home Delivery Subscribe Manage Subscription Preferences Help/Support Customer Service App FAQ amp; Help Contact Us Tips Newsroom Letters to the Editor Reprints Careers Apps iPhone App iPad App Android Phone Android Tablet Advertise Media Kit Contact Post Digital Network (c) 2016 NYP Holdings Inc. All Rights Reserved | Terms of Use | Privacy | Your Ad Choices News Corp. is a network of leading companies in the world of diversified media news and information services. News Corp HarperCollins Marketwatch realtor.com Dow Jones The Sun Storyful Wall Street Journal The Times Mansion Global New York Post The Australian Checkout51 News America Marketing News.com.au Unruly Send to Email Address Your Name Your Email Address Cancel Post was not sent - check your email addresses Email check failed please try again Sorry your blog cannot share posts by email. Copy Share URL Copy Link Sign Up / Sign In Sign In // Sign Up With your existing account from... With your existing account { loginWidget } Use an account with your email address Or with a NYPost.com account { userInformationForm } { traditionalSignIn_emailAddress } { traditionalSignIn_password } { traditionalSignIn_signInButton }{ traditionalSignIn_createButton } { /userInformationForm } Sign Up / Sign In Sign In // Sign Up Welcome back { welcomeName } { loginWidget } Or use NYPost.com account Sign Up / Sign In Sign In // Sign Up Welcome back Welcome back { welcomeName } { userInformationForm } { traditionalSignIn_emailAddress } { traditionalSignIn_password } { traditionalSignIn_signInButton } { /userInformationForm } Use an account with your email address Or use another account Almost Done Please confirm the information below before signing in. Please confirm the information below. { socialRegistrationForm } { socialRegistration_emailAddress } { socialRegistration_displayName } { socialRegistration_ageVerification } By clicking ""Sign In"" you confirm that you accept our terms of service and have read and understand privacy policy. { backButton } { socialRegistration_signInButton } { /socialRegistrationForm } Almost Done { registrationForm } { traditionalRegistration_emailAddress } { traditionalRegistration_password } { traditionalRegistration_passwordConfirm } { traditionalRegistration_displayName } { traditionalRegistration_captcha } { traditionalRegistration_ageVerification } By clicking ""Create account"" you confirm that you accept our terms of service and have read and understand our privacy policy. { backButton } { createAccountButton } { /registrationForm } Create a new password ForgotPassword? Dont worry it happens. Well send you a link to create a new password. { forgotPasswordForm } { traditionalSignIn_emailAddress } { backButton } { forgotPassword_sendButton } { /forgotPasswordForm } Create a new password Sent Weve sent an email with instructions to create a new password. Your existing password has not been changed. Weve sent an email with instructions to create a new password. Close Account Already Exists { mergeAccounts } { backButton } Sign in to complete account merge { tradAuthenticateMergeForm } { traditionalSignIn_emailAddress } { mergePassword } { traditionalSignIn_signInButton } { /tradAuthenticateMergeForm }",http://www.nypost.com/seven/12192008/entertainment/movies/oh__no__yes_is_a_mess_144826.htm,200,yesman3,yesman,nypost
