review,link,status_code,id,movie_key,critic
"You Got Served | Variety Variety Editions U.S Latino Global Asia Subscribe Today Navigation Menu Film TV Digital Contenders Video Dirt Jobs More Biz Music Legit Scene Conferences Insight Archives Directory Choose Edition U.S Latino Global Asia Russia | My Account Sign In Subscribe HomeFilmReviews Review You Got Served Dennis Harvey Film Critic 0 Share This Article Email LinkedIn Pin It Tumblr January 29 2004 | 0302PM PT If each decade must have its own ""Breakin 2 Electric Boogaloo"" things could be worse than ""You Got Served."" Latest formula reheating of snotty (white) outsiders vs. plucky (black) homies is a serviceable youth pic thats marginally less dumb than Novembers urban quasi-musical ""Honey."" ""Served"" should score a couple of heady weeks. If each decade must have its own ""Breakin 2 Electric Boogaloo"" things could be worse than ""You Got Served."" Latest formula reheating of snotty (white) outsiders vs. plucky (black) homies is a serviceable youth pic thats marginally less dumb than Novembers urban quasi-musical ""Honey."" Pic wont be more than a blip on the radar for most grownups but if nonstop screams and squeals from a largely under-15 preview aud are any sign ""Served"" should score a couple of heady weeks among those who spend their afterschool hours with MTV and BET. Making his feature directorial bow musicvid veteran and producer/manager (notably of Ramp;B group B2K whose members fill several roles here) Christopher B. Stokes also wrote the script which has a storyline so simple even little kids wont find it a challenge to follow it. Elgin (Marques Houston of IMX) and David (Omari Grandberry aka Omarion of B2K whos Houstons real-life brother) are best friends who lead an L.A. street-dancing troupe that performs regularly at the neighborhood venue run by Mr. Rad (Steve Harvey). Strapped for cash the two young men also run occasional questionably legal errands for local crime boss Emerald (Jabba the Hut-like Michael ""Bear"" Taliferro). David has a reputation as a Casanova but Elgin draws the line when David gets serious about Elgins comely little sister Liyah (Jennifer Freeman). This rift develops into a chasm when Elgin is jumped and robbed on a solo delivery mission for Emerald -- while David who should have been watching his back was out making time with Liyah. Resulting bad blood splinters their dance crew just as they are invited to compete in a big MTV dance-off. However when a tyke is killed in a drive-by shooting the protags reunite for the dance-off beating back a straight-outta-Orange-County crew led by sneering spiky-haired wigger Wade (Christopher Jones). Prize is 50000 and a spot in a new video starring Lil Kim (one of many personalities playing themselves in cameos here). As Mr. Rad puts it ""Money isnt the important thing friendship is."" But hey friendship plus money is even better. Ultra-baggy hip-hop fashion trends of the last few years dont ideally complement dance moves nor does the usual overactive musicvid-bred editorial approach. Nonetheless main attraction here is the large number of body-rocking segs. They showcase dynamic old-school breakdancing plus mind-boggling acrobatics and even a little modern-dance/musical theater-influenced choreography. Its easy to forget the eminently forgettable plot when so many feet are flying. Perfs are as good as they need to be which (off the competition floor at least) is just competent. Only notable weak link is dewy ingenue Freeman (from ABC sitcom ""My Wife and Kids"") who seems to have wandered in from ""Valley Girl 2."" She makes a line like ""Your boy is really trippin "" sound uncomfortably close to ""Omigawd Gag me with a spoon"" Harveys comic chops are barely tapped. Design and tech aspects are nondescript You have to think the music supervisor was running out of ideas when de rigueur wall-to-wall soundtrack of hip-hop and neo-soul cuts -- featuring Timbaland Ludacris Method Man DMX Redman several from B2K etc. -- finds room for a dance-floor version of ""Fur Elise."" You Got ServedProductionA Sony Pictures Entertainment release of a Screen Gems presentation of an Ultimate Group Films production in association with Melee Entertainment. Produced by Marcus Morton Cassius Vernon Westhersby Billy Pollina. Executive producers Ketrina ""Taz"" Askew Max Gousse. Directed written by Christopher B. Stokes. CrewCamera (color) David Hennings; editor Earl Watson; music Tyler Bates; music supervisor Barry Cole; production designer Maxine Shepard; art directors Jason Weil Kitty Doris Bates; set decorator Dan May; costume designer Ca-Trece Massey; sound (Dolby Digital) Stephen Hunter Flick; choreographers Dave Scott Shane Sparks; additional choreography Robert James Hoffman III; line producer Kevin Halloran; assistant director Todd Amateau; casting Monica Swann. Reviewed at AMC Van Ness 1000 San Francisco Jan. 28 2004. MPAA Rating PG-13. Running time 94 MIN. With Elgin - Marques Houston David - Omari Grandberry Rico - Jarell Houston Vick - DeMario Thornton Rashaan - Dreux Frederic Liyah - Jennifer Freeman Herself - Lil Kim Emerald - Michael ""Bear"" Taliferro Herself - Alani ""La La"" Vasquez Wade - Christopher Jones Beautifull - Meagan Good Mr. Rad - Steve Harvey Filed Under Christopher SeyKim Swann Want to read more articles like this one? SUBSCRIBE TO VARIETY TODAY. Post A Comment 0 Variety Jobs Creative Development Coordinator Triptyk Studios New York New York Account/Project Coordinator (Ad Agency) Petrol Advertising Burbank California Media Specialist Bridgewater Associates Westport Connecticut Executive Director Aspen Film Company Confidential Aspen Colorado Associate Director YouTuber amp; Gamer Partnerships Save the Children Fairfield Connecticut See More Jobs Marketplace Leave a Reply No Comments Cancel reply Comments are moderated. They may be edited for clarity and reprinting in whole or in part in Variety publications. Enter your comment here... Fill in your details below or click an icon to log in Email (required) (Address never made public) Name (required) Website You are commenting using your WordPress.com account. ( Log Out / Change ) You are commenting using your Twitter account. ( Log Out / Change ) You are commenting using your Facebook account. ( Log Out / Change ) You are commenting using your Google+ account. ( Log Out / Change ) Cancel Connecting to %s Notify me of new comments via email. Notify me of new posts via email. More Film News from Variety The Power of Content Divorce Marks Sarah Jessica Parkers Return To HBO But... John Legend Shares Adorable New Snap Of Baby Luna -- See The Cute... Cara Delevingne Steps Out In Christian Louboutin Over-The-Knee... Westworld Creators Reveal Reason for 2-Month Production Shutdown Pokemon Go update for Android has a very annoying feature... Subscribe to Variety Today All The Ways to Get Variety Online Subscription Print Subscription Mobile Apps Newsletters News Alerts Archives Slanguage Dictionary Help Other Variety Products MediaVariety 411 Research amp; DataVariety Insight Archives Premium Email Alerts Real Estate Jobs Access the best entertainment industry data available View the Variety archives dating back to 1905 Get News Delivered To Your Inbox Privacy Policy Your Privacy Rights Terms of Use About Us Advertise Contact Us Google+ The Power of Content Deadline india.com Hollywoodlife hollywood TV Line BGR WWD Footwearnews (c) Copyright 2016 Variety Media LLC a subsidiary of Penske Business Media LLC. Variety and the Flying V logos are trademarks of Variety Media LLC. Powered by WordPress.com VIP Variety411 Your production services resource",http://www.variety.com/review/VE1117922966.html?categoryid=31&cs=1,200,yougotserved0,yougotserved,variety
You Got Served directed by Chris Stokes | Film review Go to the content Go to the footer Time Out London London Popular cities London New York Paris Chicago Los Angeles Browse all cities Time Out London Close London Change city London Popular cities London New York Paris Chicago Los Angeles Browse all cities Tickets Offers Things to Do Restaurants Bars amp; Pubs Film Theatre Art Music Attractions Blog Theatre Tickets Shopping Offer of the Day Time Out Card Time Out Escapes Time Out Live Hotels Nightlife Music festivals Events amp; Festivals Kids Museums Clubs Comedy Food amp; Drink Classical Music amp; Opera Dance LGBT City Guide Area Guides Property Competitions Dating Close My Time Out Things I love My lists My Profile My Account Sign out Sign in Create account Sign in With your social account Or with your email Email Password Remember me Forgotten your password? Sign in You can create a Time Out account in two ways... With a few clicks using your favourite social network Or by entering your details below Email First Name Last Name Create password Repeat new password I accept Time Outs terms of use including opt-in to newsletters. Create account Welcome  You have successfully connected your account to Time Out. You may sign in with this account in future. Please confirm your account details Email First Name Last Name I accept Time Outs terms of use including opt-in to newsletters. Sign up My Account Sign in or Create account Search Tickets Offers Things to Do Restaurants Bars amp; Pubs Film Theatre Art Music Attractions Blog Theatre Tickets Shopping Offer of the Day Time Out Card Time Out Escapes Time Out Live Hotels Nightlife Music festivals Events amp; Festivals Kids Museums Clubs Comedy Food amp; Drink Classical Music amp; Opera Dance LGBT City Guide Area Guides Property Competitions Dating More Search You Got Served Film 5 out of 5 stars (2 user reviews) 0 Love It Save it 2 Add review 0 Love It Save it Time Out says Details Users say (2) 5 out of 5 stars Time Out says For a film that currently occupies the top spot on IMDb.coms worst-films list this isnt good enough. Sure the directions shambolic the acting laughable the script amateurish the editing clumsy the plot no more than a laboured device for getting from set-piece A to set-piece B in as quick and corny a fashion as possible. But is it the worst ever? At heart an extended promo for now-defunct commercial teeny hip hop band B2K this is a handful of breathtaking dance sequences stitched together by very bad acting. It follows the members of a South Californian breakdancing crew hoping to win a dance competition and get out of the ghetto. Everything else is incidental and fills time between terrific scenes of hardcore rug-burning in which gangs of dancers meet in crowded warehouses and throw down choice insults before aggressively trying to formation- dance their opponents off the stage. Its like a hip hop haka. Only the most curmudgeonly would consider it wholly unwatchable. By CS Details Release details Rated PG Duration 95 mins Cast and crew Director Chris Stokes Cast OmarionMarques HoustoJennifer Freeman Users say (2) 5 out of 5 stars Average User Rating5 / 5Rating Breakdown5 star14 star03 star02 star01 star0LiveReviews|21 person listeningSign inWrite reviewMost helpfulMost helpfulHighest ratingLowest ratingNewestOldestLoadingundefinedNew CommentsRefreshNov 5 2012DamnFeaturedIt was coolFlagShareHelpful?Yes|NoReplyNov 5 2012DamnFeaturedIt was coolFlagShareHelpful?Yes|NoReplyShow More Share Tweet 0 Shares Top About us Work for Time Out Privacy policy Cookie Policy Website terms of use Contact us Time Out for business Get listed Claim your listing Premium Profiles Advertising Time Out products Time Out Card Mobile apps Time Out Shop Time Out Guides Time Out Travel Time Out Offers Time Out Worldwide Time Out magazine Where to get Time Out magazine Subscribe to Time Out magazine Manage my subscription Follow us Facebook Twitter Youtube Instagram Pinterest Spotify Time Out London Site map },http://www.timeout.com/film/81295.html,200,yougotserved1,yougotserved,timeout
Error - Houston Chronicle SUBSCRIBE As low as 1.00/week Sign In Home Contact Chron About Houston Chronicle Advertise with Us Place a Classified Ad Niche Publication Ads Careers Store Privacy Policy Terms of Use Newsletters Subscribe HC Archives Mormon phrase on condom packs? Theres the rub Places every Texas kid should see before growing up 12 ways Joanna Gaines of HGTVs Fixer Upper is your spirit Things Texans secretly do but would never admit Local Neighborhoods Neighborhoods All Neighborhoods Bay Area Bellaire Cy-Fair Fort Bend Heights Katy Kingwood Memorial Pearland Spring The Woodlands Houston amp; Texas News Houston amp; Texas News Houston Texas Traffic Weather Weather Radar amp; Forecasts Houston Weather Severe Weather News Hurricane Guide Education Education K-12 Zone Blog School Report Card 2014 Politics amp; Policy Politics amp; Policy Texas Politics Chronicle Investigates Obituaries Staff amp; Reader Blogs Classifieds Columnists Opinions amp; Editorials Opinions amp; Editorials Opinion Editorials Letters to the Editor Outlook Nick Anderson Cartoons La Voz (Espanol) Texas Energy Guide Car veers off road in Baytown driver taken by Life Flight Son of former Texas Aamp;M football player faces capital murder Woman hospitalized after crash in north Houston Reports Man shoots child then turns gun on himself US amp; World US News World News Crime The Americas Politics Science amp; Environment Strange amp; Weird News Videos Video captures deputys dramatic rescue of gunshot victim kids Texas Senator Brian Birdwell finally got to meet the man who Study confirms what gun rights advocates have said for a long Warren Sapp bitten by shark during Florida Keys lobster trip Sports Texans Rockets Astros Dynamo High School Colleges UH Rice UT Aamp;M Outdoors More Sports More Sports Golf Buy Tickets Super Bowl LI DeAndre Hopkins doesnt report for training camp over contract 10 questions facing Texans at training camp Revisiting the Astros best and worst deadline deals Texans extend Rick Smiths contract Business Energy (Fuel Fix) Technology Real Estate Money Tips Business Insider Press Releases Small Business Mgmt Chron 100 Top Workplaces Sponsored Content Legal Notices Business Directory US GDP grows a weak 1.2 percent in second quarter Amazons already large distribution empire keeps expanding Ford surprises with lower 2Q profit on trouble in US China Chipotle branching out plans to open burger restaurant Aamp;E Preview Preview Alison Cook Restaurant Reviews Whine amp; Dine Top 100 Restaurants Guides to Houston Restaurants amp; Bars Music Movies Arts amp; Theater Rolling Stone Us Weekly Radar Online Horoscopes Comics amp; Games Events amp; Things To Do NEW Puzzles 20 tearjerker movies Hollywood should leave alone Meghan Trainor rocks girls night out in Woodlands Chip and Joanna Gaines are just the latest celebrities to visit Chef Randy Ruckers Bramble restaurant has closed Life Health Health The Doctors Mens Journal Live Healthy Escapes Escapes Home amp; Design Travel Style Mom Houston Luxe Life Houston Belief Food amp; Cooking Food amp; Cooking Food amp; Cooking Alison Cook Restaurant Reviews Whine amp; Dine Top 100 Restaurants Society Travel Travel Flight Tracker Texas Road Trips Travel Pets Houston Gives Weddings amp; Celebrations Sponsored Content Local backyard design inspirations thatll make you want to DIY The 50 smoothest pick-up lines in movie history 18 foods you should never feed your pet Why is everyone freaking out about this photo of two bikini-clad Jobs Advanced search Browse job categories Salary Wizard Career Rescue Careers in Engineering Salute to Nurses Work amp; Career Advice Post a Job Is that dream opportunity really a nightmare? These 25 hot jobs pay at least 100K Set a career goal for every month of 2016 The highest-paying entry-level jobs Cars Cars amp; Auto News Heidis Cars Blog New Car Search Used Car Search Certified Car Search Houston Auto Dealers The new Lincoln Navigator concept is too legit to quit Hennessey pushes a Camaro to over 200 MPH Riding the 2016 Indian Chieftain BMW turns 100 years old A look back Real Estate New Homes Second Homes Rentals Home Price Survey Mortgages Commercial Real Estate Farms amp; Ranches Senior Living Chron Homes App Private Party Ads Summer Showcase My Perfect Hous(e)ton Suburban homebuilder develops new Greater Heights neighborhood Glamorous Texas ranch with Hollywood history hits market Shipping container complex to be developed in Houston 115 Years Findamp;Save Roost MenuSections Item Not Found << Return to the Previous Page The item youve requested http//www.chron.com/cs/CDA/moviestory.mpl/ae/movies/reviews/2377829 was not found. Possible causes The address was entered incorrectly The item no longer exists or There has been an error on the site. If you feel the address you entered is correct you can contact us mentioning the error message received and the item you were trying to reach. We apologize for any inconvenience. From here you can Return to the previous page Use the menu bar above Select an item from our site index below Logo Return to Top About Our Company Careers Advertise with Us Ad Choices Terms amp; Conditions Privacy Policy Your California Privacy Rights Contact Customer Service Newsroom Contacts Connect Email Newsletter Facebook Twitter Pinterest Google Instagram Subscribe iPad app HoustonChronicle.com Houston Chronicle Archives eEdition Demo Todays eEdition Hearst Newspapers (c) Copyright Hearst Newspapers LLC,http://www.chron.com/cs/CDA/moviestory.mpl/ae/movies/reviews/2377829,404,yougotserved2,yougotserved,chron
"Page not found | www.accessatlanta.com Our ProductsAJC JobsContact UsNewsSportsNeighborhoodLifeThings to DoMoreBlogsAJC ClassifiedsGa LotteryHoroscopesTrafficDoctors amp; Sex Abuse All News 2016 Election Atlanta News Nation amp; World Business Technology Politics Crime Education Offbeat News News Video Atlanta Weather News BlogsAJC InvestigationsPolitical InsiderGet SchooledAll News BlogsIn the NewsAtlanta Watering RestrictionsTraffic Construction AlertGa. Public School RatingsAtlanta Gas Prices All Sports Atlanta Braves Atlanta Falcons Hawks High Schools Georgia Tech Georgia State Kennesaw State UGA / DawgNation SEC / SECCountry Sports Video Sports BlogsRecruiting BlogAtlanta FalconsAtlanta HawksAll Sports BlogsIn the NewsSports ScoresGolfNASCARAJC Peachtree Road Race All Neighborhood Newcomer Guide Buckhead Buford Decatur Gwinnett County Intown Atlanta Marietta Roswell Sandy Springs Smyrna Peachtree City County NewsClayton CountyCobb CountyDeKalb CountyGwinnett CountyIn the NewsAtlanta Summer CampsLiving NorthsideLiving IntownEvents Near Me All Life Celebrities Home amp; Garden Weddings amp;... Health Travel Parenting Music Home Design Ideas Food amp; Drink Movies amp; TV Arts amp; Culture Life BlogsBest of AtlantaAtlanta RestaurantsAtlanta ShoppingAll Entertainment BlogsIn the NewsBest of AtlantaGamesAJC Peachtree Road Race All Things to Do Events in Atlanta Best of Atlanta Summer Camps Movie Showtimes Radio amp; TV Arts amp; Culture Music Food amp; Drink Shopping Latest Video Games BlogsAtlanta RestaurantsMusic SceneArts amp; CultureAll Entertainment BlogsIn the NewsUpcoming MoviesLiving Intown BeltLineHoroscopes All More Newsletters AJC Customer Care Contact the AJC Games AJC Cars AJC Jobs Shop Obituaries Homefinder Kudzu Todays BuzzBuzz BlogRadio amp; TV TalkNews to MeInside AJCMovie TheatersAtlantas Top WorkplacesFind a Garage Sale All Blogs The Biz Beat Georgia Tech High School Jeff Schultz Mark Bradley Political Insider Radio amp; TV Talk The Buzz Get Schooled Take a BreakPlay a GameHoroscopesWeekend CalendarEvents near youIn the newsHow Atlanta Loses WeightKudzuGa Lottery All AJC Classifieds AJC Pets AJC Cars Homes for Sale AJC Jobs All Ga Lottery All Horoscopes All Traffic All Doctors amp; Sex Abuse State-by-State For Patients Explore the Project About the Project Doctors Investigation ArticlesBroken SystemWhich Doctors AbuseHow Many Cases?One Repeat OffenderVulnerable PatientsDoctors ExcusesUndercover Agent Nabs DocPediatrician AccusedSubscribe nowAs low as 99C/SubscribeLog InYour AccountNewslettersLog Out COMMENTS0 SHORTCUTS Homefinder Atlanta Jobs Find Your Car Classifieds Obituaries Family-placed Notices Contact Us/Subscribe Customer Care Advertise With Us Digital Products Shortcuts Homefinder Atlanta Jobs Find Your Car Full Site IndexVisitor AgreementPrivacy PolicyContact UsFollow usTopCLOSESECTIONSnewssportslifeneighborhoodsshopthings to doSHORTCUTSajc obituariesfamily-placed noticesclassifiedshomefinderatlanta jobsfind your carmanage your profilecontact uscustomer careadvertise with usdigital productsPARTNERSfind amp; save couponskudzusavings.comvalpakmyajcFUNgame centerMEMBER CENTERsign inmanage your profileUTILITIESarchivesweathertrafficsitemapLEARN ABOUT AJC.COMtake a tourFOLLOW USfacebooktwitterinstagramyoutubepinterestPRODUCTS SUBSCRIBEFOLLOW US (c) 2016 Cox Media Group. By using this website you accept the terms of our Visitor Agreement and Privacy Policy and understand your options regarding Ad Choices. Learn about careers at Cox Media Group. <a href=""http//www.omniture.com"" title=""Web Analytics""></a><a href=""http//www.qualtrics.com/enterprise-feedback-management"">Enterprise Feedback Management</a><a href=""http//www.qualtrics.com/survey-software"">Survey Software</a>x 3 killed 1 injured when gunman opens fire at party near Seattle Report Cheddars employee with loud weed in restroom bumps into cop Deadly hot air balloon crash in Texas What we know now Mystery mower carves Trumps name into Texas lawn Small Loans Make Up Greatest Share Of Student Debt Staycations 101 The page could not be foundWere sorry the page you requested could not be found. It is possible that the address is incorrect or that the page no longer exists.To look further you can enter a search term in the box belowSearch More from ajc.com Topics AllNewsSportsNeighborhoodLifeThings to DoMoreBlogsAJC ClassifiedsGa LotteryHoroscopesTrafficDoctors amp; Sex AbuseCrime 3 killed 1 injured when gunman opens fire at party near Seattle Nation Report Cheddars employee with loud weed in restroom bumps into cop Nation Deadly hot air balloon crash in Texas What we know now Politics Mystery mower carves Trumps name into Texas lawn Business Small Loans Make Up Greatest Share Of Student Debt Business Staycations 101 Sign InORSign in using your accessAtlanta profileNeed a Profile? Register Now. { userInformationForm } EMAIL { traditionalSignIn_emailAddress } PASSWORDForgot your password? { traditionalSignIn_password } { traditionalSignIn_signInButton } { /userInformationForm } Sign in using your existing account { loginWidget } Sign InORSign in using your accessAtlanta profileNeed a Profile? Register Now. { userInformationForm } EMAIL { traditionalSignIn_emailAddress } PASSWORDForgot your password? { traditionalSignIn_password } { traditionalSignIn_signInButton } { /userInformationForm } Sign in using your existing account { loginWidget } Sign InORSign in using your accessAtlanta profileNeed a Profile? Register Now. { userInformationForm } EMAIL { traditionalSignIn_emailAddress } PASSWORDForgot your password? { traditionalSignIn_password } { traditionalSignIn_signInButton } { /userInformationForm } Sign in using your existing account { loginWidget } Youre Almost DonePlease confirm the information below before signing in.Required { socialRegistrationForm } { socialRegistration_displayName } { socialRegistration_emailAddress } By submitting your registration information you agree to our Visitor Agreement and Privacy Policy. { socialRegistration_signInButton } { /socialRegistrationForm } RegisterRequired { registrationForm } { traditionalRegistration_emailAddress } { traditionalRegistration_password } { traditionalRegistration_passwordConfirm } { traditionalRegistration_displayName } By submitting your registration information you agree to our Visitor Agreement and Privacy Policy. { createAccountButton } { /registrationForm } Create a New AccountRequired { registrationFormBlank } { traditionalRegistration_emailAddressBlank } { traditionalRegistration_passwordBlank } { traditionalRegistration_passwordConfirmBlank } { traditionalRegistration_displayName } By submitting your registration information you agree to our Visitor Agreement and Privacy Policy. { createAccountButton } { /registrationForm } Just One More Thing...We have sent you a verification email. Please check your email and click on the link to activate your profile.If you do not receive the verification message within a few minutes of signing up please check your Spam or Junk folder.CloseThank you for registeringWe look forward to seeing you on [website] frequently. Visit us and sign in to update your profile receive the latest news and keep up to date with mobile alerts. Click here to return to the page you were visiting. Create a new passwordDont worry it happens. Well send you a link to create a new password. { forgotPasswordForm } { forgotPassword_emailAddress } { forgotPassword_sendButton } { /forgotPasswordForm } Email sentWe have sent you an email with a link to change your password.Close { mergeAccounts } Sign in to complete account merge { tradAuthenticateMergeForm } { traditionalSignIn_emailAddress } { mergePassword } { backButton } { traditionalSignIn_signInButton } { /tradAuthenticateMergeForm } Resend Email VerificationClick submit to receive another verification email { resendVerificationForm } { traditionalSignIn_emailAddress } { /resendVerificationForm } Your Verification Email Has Been SentCheck your email for a verification linkClose",http://www.accessatlanta.com/movies/content/shared/movies/reviews/XYZ/yougotserved.html,404,yougotserved3,yougotserved,accessatlanta
