review,link,status_code,id,movie_key,critic
"Big sis falls asleep and two brothers are left to fend for themselves in old-fashioned space adventure - SFGate Subscribe Sign In Home Contact SFGate Contact SFGate Customer Support Submissions amp; Tips Classifieds About SFGate About SFGate FAQ Register on SFGate SFGate Newsletters SFGate Staff Careers Site Index Hearst About The Chronicle About The Chronicle The Chronicle Staff Become a Subscriber Manage Your Subscription Customer Service Careers e-edition Back Copies Chronicle in Education Corrections Advertise with Us More on Advertising More on Advertising Place a Classified Ad About Our Ads Public Notices Local Business Directory Place an Obituary Gate List Store Privacy policy Privacy policy Ad Choices Chronicle Archives Terms of Use Newsletters Get news alerts SFGate Customer support Get VIP access with SF Chronicle Membership Get SFGate newsletters for the latest from the Bay Check out the Top 100 Bay Area restaurants News Bay Area amp; State Traffic Nation World Politics Crime Election Results Obituaries Tech Health Education Video News Blogs Tykes on bikes compete in SF Strider competition Europe scrambles to heighten security Fire in Big Sur area grows 15 percent contained Little shaker 2.7-magnitude earthquake rattles Bay Area Sports 49ers Raiders Giants As Olympics Warriors Sports Blogs Sports Calendar MLB NBA College Preps Golf Outdoors Giants moves Pence in Pena out Crawford and Span out of lineup Raiders GM McKenzie gets 4-year extension Cal football position preview Linebacker How low can Giants go? Latest loss comes with a triple play Business Technology Mortgage Rates Home Guides Public Notices Sponsored Content Office Space The Tech Chronicles Net Worth Plus Fossils amp; Photons Mind Your Business VisionSF Jobs Price Point 649000 in San Bruno ICYMI Can Chipotle be a burger king? Redstones potential Victorian duplex in SOMA open Sunday Three bedroom apartment in San Franciscos Financial District Entertainment The Daily Dish Movies Music amp; Nightlife Performance Art Blogs Videos Events Puzzles TV Horoscope Comics Crosswords amp; Puzzles Things To Do Jason Bourne is a shaky smeary mess The latest from Dear Abby ""Bad Moms"" mixes sentiment with raunch and ends up vulgar Phantom Boy is fast-paced but slight animated fun Food Restaurants Wine Top 100 Restaurants Chronicle Wine Competition Reservations Beer News Inside Scoop SF Healthy Eating Angele Chef shuffle at Napa French restaurant Napa blockbuster Ninebark is closing (temporarily) Check out the food (and menu) at Black Cat now open in the Lights go out at La Rondalla longtime Mission dining spot Living Home amp; Garden Style Parties Lust LGBT Mommy Files amp; Parenting Houzz Outdoors Blogs Sponsored Schools Camps amp; Activities Exploring night photography locations in the Bay Area Couple from different cultures find love is a common ground Heres the most popular video game from the year you were born More Crystal Basin campsites are available with start of Olympics Travel Destination BC Exotic Destinations Monterey-Carmel Weekend Getaways Wine Country Napa Reno-Tahoe Hawaii Caves offer older view of the Continent Traveling to Big Sur? What you need to know Suite Spot Ritz-Carlton Philadelphia Rick Steves Europe Drink in a city through cafe culture Real Estate New Homes Open Homes Luxury Rentals Mortgage Rates Commercial Place an ad Home Guides Home Sales On the Block Blog Hot Property Sebastopol Italianate estate enjoys ocean views How much space do you get for 1500 a month? Hillcrest Estate possibly owned by baseball Hall of Famer Joe Cars Dealers Click and Clack Car Blog My Ride Sell Your Car First Buick ragtop since the 91 Reatta A cherished Nash-Healey Roadster Past Phantom still turning heads Teslas Model S can be used as a boat in a pinch Jobs Job Events Advertise Salary Wizard Get To Work Consider the red flags when staying in a job you dislike Declutter your job search The job gap explanation How to impress an interviewer with non-verbal language Findamp;Save Chronicle Latest columns Michael Bauer Leah Garchik Bruce Jenkins Esther Mobley Ann Killion Thomas Lee Matier amp; Ross C.W Nevius Kathleen Pender Scott Ostler Special Report Forgotten Survivors of AIDS The ultimate NorCal brewery map Top 100 Restaurants Warriors show their style off the court MenuSections http//www.sfgate.com/movies/article/Big-sis-falls-asleep-and-two-brothers-are-left-to-2596119.php Big sis falls asleep and two brothers are left to fend for themselves in old-fashioned space adventure By Ruthe Stein Published 400 am Friday November 11 2005 Photo LILO/SIPA Image 1of/2 CaptionClose Image 1 of 2 Josh Hutcherson and Dax Shepard in a scene of the film ""Zathura A Space Adventure"" directed by Jon Favreau. USA - 2005 [Photo via NewsCom] Josh Hutcherson and Dax Shepard in a scene of the film ""Zathura A Space Adventure"" directed by Jon Favreau. USA - 2005 [Photo via NewsCom] Photo LILO/SIPA Image 2 of 2 In this photo provided by Columbia Pictures two brothers (Josh Hutcherson left and Jonah Bobo) discover a game board with an outer-space theme and a colored path leading to a purple planet in ""Zathura A Space Adventure."" (AP Photo/ Columbia Pictures/Merrick Morton) less In this photo provided by Columbia Pictures two brothers (Josh Hutcherson left and Jonah Bobo) discover a game board with an outer-space theme and a colored path leading to a purple planet in ""Zathura A ... more Photo MERRICK MORTON Big sis falls asleep and two brothers are left to fend for themselves in old-fashioned space adventure 1 / 2 Back to Gallery Zathura Family entertainment. Starring Josh Hutcherson Jonah Bobo and Tim Robbins. Directed by Jon Favreau. (PG. 100 minutes. At Bay Area theaters.) Tales of kids left home alone have a built-in appeal to young audiences plugging into a common fantasy of wild fun to be had when there are no killjoy adults around to interfere. In the spirited ""Zathura"" brothers wind up with the run of their dads creaky house after their older sister who was instructed to supervise them falls asleep on the job. Although ""Zathura"" doesnt stint on special effects in creating the havoc that results what makes the movie truly special is its old-fashioned style like tuning into ""The Twilight Zone."" The movie harks back to a time before state-of-the-art technology when writers and directors had to rely mostly on imagination. There are some first-rate imaginations at work here beginning with Chris Van Allsburg whose childrens books ""Jumanji"" ""The Polar Express"" and now ""Zathura"" have turned out to be naturals for the big screen. Fresh from directing his first breakaway hit ""Elf"" Jon Favreau delivers a movie that will delight both kids -- the ones I took to a screening could barely contain their excitement -- and adults. He signals that this will be a cool experience for all by displaying a poster of Steve McQueen in ""Bullitt"" on a wall in the house. The action is set off by something in the basement. Rummaging through piles of junk 6-year-old Danny (Jonah Bobo) and Walter (Josh Hutcherson) -- the older sibling by four years an eon at their age -- uncover a simple-looking metal board game the worse for wear. What could be more 20th century than that? Except as the brothers discover this game offers a portal into the future. The object is to reach the planet Zathura advancing through cards ejected after each move. The alternative is to be stuck in a neverland somewhere in outer space. Unlike chess no time is allowed to strategize. A card appears warning ""Meteor shower take evasive action"" and the boys look up to see volcanic meteors coming their way. Armageddon arrives in the form of Zorgons lizard-like aliens bent on destroying everything in sight. Amazingly Sis continues to sleep through all of this until in one of the films great comic images she becomes frozen as the result of a wrong move. ""Zathura"" can be enjoyed solely as a sci-fi adventure. But it also sneaks in a couple of messages for those receptive to them. Sibling rivalry makes it almost impossible for the brothers to cooperate even when their lives depend upon it. Avoiding the staginess of many child actors Bobo and Hutcherson are very good at showing this natural antagonism. All Danny wants is for Walter to pay attention to him and acknowledge his accomplishments. But Walter thinks that to do so would somehow diminish his status as the older one. The game teaches him otherwise. A divorce has forced the boys to shuttle between their mother and father which they are none too happy about. Tim Robbins makes a brief but memorable appearance as their father who tries to make amends for the breakup of the family. By the movies end Danny and Walter come to realize -- as Dorothy and E.T. did before them -- that theres no place like home even if its a broken one. Most Popular 1 Dear Abby I want to contact mistress from 45 years ago 2 Cops Son of billionaire former supermodel arrested after... 3 Ann Coulter Hammered by Conservatives for Smearing US War... 4 Dear Abby I dont want anyone to know that Ive retired 5 Iceland man says Donald Trumps son left white powder at... 6 Inmate charged in 2015 quadruple slaying in S.F. 7 33 signs youre living in the San Francisco bubble 8 Oakland-bound medical plane crashes -- 4 killed 9 Police Girl 14 slits teens throat in hope of first kill 10 San Francisco ranks surprisingly low on the list of 20 Most... Find Showtimes Search Theaters amp; Showtimes -- County -- Alameda Contra Costa Lake Marin Napa San Francisco San Mateo Santa Clara Solano Sonoma Show Movies Now Playing | Recent Releases | Critics Favorites Rated G | PG | PG-13 | R Latest News Tykes on bikes compete in SF Strider competition 3 missing overnight in delta are rescued Officials believe no survivors in Texas hot air balloon crash Outrage caution from Latino stars in critical election year Little shake 2.7-magnitude earthquake rattles Bay Area Ann Coulter slammed for calling war heros dad angry Muslim Inmate charged in 2015 quadruple slaying in S.F. Man Trumps son left white powder at rental paid women Parilia Amusement Ball in San Francisco early days View Comments (c) 2016 Hearst Communications Inc. Logo Return to Top About Our Company Careers Advertising Ad Choices Terms amp; Conditions Privacy Policy Your California Privacy Rights Contact Customer Service Newsroom Contacts Connect Facebook Twitter Pinterest Google Instagram Subscribe SFChronicle.com App e-edition The Chronicle Archives Subscription Offers Member Services Hearst Newspapers (c) Copyright Hearst Communications Inc.",http://sfgate.com/cgi-bin/article.cgi?f=/c/a/2005/11/11/DDGJBFLS9M1.DTL&type=movies,200,zathura4,zathura,com/cgi-bin/article
0,http://ae.miami.com/entertainment/ui/miami/movie.html?id=455569&reviewId=19514,0,zathura5,zathura,miami
Error - Houston Chronicle SUBSCRIBE As low as 1.00/week Sign In Home Contact Chron About Houston Chronicle Advertise with Us Place a Classified Ad Niche Publication Ads Careers Store Privacy Policy Terms of Use Newsletters Subscribe HC Archives Mormon phrase on condom packs? Theres the rub Places every Texas kid should see before growing up 12 ways Joanna Gaines of HGTVs Fixer Upper is your spirit Things Texans secretly do but would never admit Local Neighborhoods Neighborhoods All Neighborhoods Bay Area Bellaire Cy-Fair Fort Bend Heights Katy Kingwood Memorial Pearland Spring The Woodlands Houston amp; Texas News Houston amp; Texas News Houston Texas Traffic Weather Weather Radar amp; Forecasts Houston Weather Severe Weather News Hurricane Guide Education Education K-12 Zone Blog School Report Card 2014 Politics amp; Policy Politics amp; Policy Texas Politics Chronicle Investigates Obituaries Staff amp; Reader Blogs Classifieds Columnists Opinions amp; Editorials Opinions amp; Editorials Opinion Editorials Letters to the Editor Outlook Nick Anderson Cartoons La Voz (Espanol) Texas Energy Guide Car veers off road in Baytown driver taken by Life Flight Son of former Texas Aamp;M football player faces capital murder Woman hospitalized after crash in north Houston Reports Man shoots child then turns gun on himself US amp; World US News World News Crime The Americas Politics Science amp; Environment Strange amp; Weird News Videos Video captures deputys dramatic rescue of gunshot victim kids Texas Senator Brian Birdwell finally got to meet the man who Study confirms what gun rights advocates have said for a long Warren Sapp bitten by shark during Florida Keys lobster trip Sports Texans Rockets Astros Dynamo High School Colleges UH Rice UT Aamp;M Outdoors More Sports More Sports Golf Buy Tickets Super Bowl LI DeAndre Hopkins doesnt report for training camp over contract 10 questions facing Texans at training camp Revisiting the Astros best and worst deadline deals Texans extend Rick Smiths contract Business Energy (Fuel Fix) Technology Real Estate Money Tips Business Insider Press Releases Small Business Mgmt Chron 100 Top Workplaces Sponsored Content Legal Notices Business Directory US GDP grows a weak 1.2 percent in second quarter Amazons already large distribution empire keeps expanding Ford surprises with lower 2Q profit on trouble in US China Chipotle branching out plans to open burger restaurant Aamp;E Preview Preview Alison Cook Restaurant Reviews Whine amp; Dine Top 100 Restaurants Guides to Houston Restaurants amp; Bars Music Movies Arts amp; Theater Rolling Stone Us Weekly Radar Online Horoscopes Comics amp; Games Events amp; Things To Do NEW Puzzles 20 tearjerker movies Hollywood should leave alone Meghan Trainor rocks girls night out in Woodlands Chip and Joanna Gaines are just the latest celebrities to visit Chef Randy Ruckers Bramble restaurant has closed Life Health Health The Doctors Mens Journal Live Healthy Escapes Escapes Home amp; Design Travel Style Mom Houston Luxe Life Houston Belief Food amp; Cooking Food amp; Cooking Food amp; Cooking Alison Cook Restaurant Reviews Whine amp; Dine Top 100 Restaurants Society Travel Travel Flight Tracker Texas Road Trips Travel Pets Houston Gives Weddings amp; Celebrations Sponsored Content Local backyard design inspirations thatll make you want to DIY The 50 smoothest pick-up lines in movie history 18 foods you should never feed your pet Why is everyone freaking out about this photo of two bikini-clad Jobs Advanced search Browse job categories Salary Wizard Career Rescue Careers in Engineering Salute to Nurses Work amp; Career Advice Post a Job Is that dream opportunity really a nightmare? These 25 hot jobs pay at least 100K Set a career goal for every month of 2016 The highest-paying entry-level jobs Cars Cars amp; Auto News Heidis Cars Blog New Car Search Used Car Search Certified Car Search Houston Auto Dealers The new Lincoln Navigator concept is too legit to quit Hennessey pushes a Camaro to over 200 MPH Riding the 2016 Indian Chieftain BMW turns 100 years old A look back Real Estate New Homes Second Homes Rentals Home Price Survey Mortgages Commercial Real Estate Farms amp; Ranches Senior Living Chron Homes App Private Party Ads Summer Showcase My Perfect Hous(e)ton Suburban homebuilder develops new Greater Heights neighborhood Glamorous Texas ranch with Hollywood history hits market Shipping container complex to be developed in Houston 115 Years Findamp;Save Roost MenuSections Item Not Found << Return to the Previous Page The item youve requested http//www.chron.com/cs/CDA/moviestory.mpl/ae/movies/reviews/3437135 was not found. Possible causes The address was entered incorrectly The item no longer exists or There has been an error on the site. If you feel the address you entered is correct you can contact us mentioning the error message received and the item you were trying to reach. We apologize for any inconvenience. From here you can Return to the previous page Use the menu bar above Select an item from our site index below Logo Return to Top About Our Company Careers Advertise with Us Ad Choices Terms amp; Conditions Privacy Policy Your California Privacy Rights Contact Customer Service Newsroom Contacts Connect Email Newsletter Facebook Twitter Pinterest Google Instagram Subscribe iPad app HoustonChronicle.com Houston Chronicle Archives eEdition Demo Todays eEdition Hearst Newspapers (c) Copyright Hearst Newspapers LLC,http://www.chron.com/cs/CDA/moviestory.mpl/ae/movies/reviews/3437135,404,zathura6,zathura,chron
"Brace for ""Zathura"" assault"" - The Denver Post News News Latest News Colorado News Nation / World Obituaries Marijuana Education Environment Crime amp; Courts Weather Your Hub Sports Sports Olympics Denver Broncos College Sports Colorado Rockies Preps Colorado Avalanche Outdoors Denver Nuggets Boxing / MMA Colorado Rapids Scores and Standings Sports Columnists Sports on TV/Radio Business Business Aerospace Airlines Economy Energy Real Estate Retail Technology Telecom Tourism Entertainment Entertainment Arcade Games Arts Books Calendar Comics Movies Music Reverb Music Theater Television Television Listings Travel Lifestyle Lifestyle Ask Amy Fashion Food amp; Drink Restaurants amp; Dining Fitness Home amp; Garden Horoscopes Opinion Opinion Editorials Columnists Letters Perspective Cartoons Opinion Polls Politics Politics Election Colorado Legislature Denver Politics Local Politics National Politics Cannabist Classifieds Classifieds Cars Homes Jobs Today Subscribe Newsletter News News Latest News Colorado News Nation / World Obituaries Marijuana Education Environment Crime amp; Courts Weather Your Hub Sports Sports Olympics Denver Broncos College Sports Colorado Rockies Preps Colorado Avalanche Outdoors Denver Nuggets Boxing / MMA Colorado Rapids Scores and Standings Sports Columnists Sports on TV/Radio Business Business Aerospace Airlines Economy Energy Real Estate Retail Technology Telecom Tourism Entertainment Entertainment Arcade Games Arts Books Calendar Comics Movies Music Reverb Music Theater Television Television Listings Travel Lifestyle Lifestyle Ask Amy Fashion Food amp; Drink Restaurants amp; Dining Fitness Home amp; Garden Horoscopes Opinion Opinion Editorials Columnists Letters Perspective Cartoons Opinion Polls Politics Politics Election Colorado Legislature Denver Politics Local Politics National Politics Cannabist Classifieds Classifieds Cars Homes Jobs Brace for ""Zathura"" assault"" Share thisClick to share on Facebook (Opens in new window)Click to share on Reddit (Opens in new window)Click to share on Twitter (Opens in new window)Click to print (Opens in new window)Click to email this to a friend (Opens in new window)MoreClick to share on LinkedIn (Opens in new window)Click to share on Pinterest (Opens in new window)Click to share on Tumblr (Opens in new window)Submit to Stumbleupon (Opens in new window) Trending Broncos camp fan guide Texas balloon crash Woody Paige retiring Sports Authority bonuses Rockies down Mets Mile High Roundup Entertainment Brace for ""Zathura"" assault"" Share thisClick to share on Facebook (Opens in new window)Click to share on Reddit (Opens in new window)Click to share on Twitter (Opens in new window)Click to print (Opens in new window)Click to email this to a friend (Opens in new window)MoreClick to share on LinkedIn (Opens in new window)Click to share on Pinterest (Opens in new window)Click to share on Tumblr (Opens in new window)Submit to Stumbleupon (Opens in new window) From left Josh Hutcherson Jonah Bobo and Tim Robbins star in""Zathura A Space Adventure"" based on Chris Van Allsburgs book. By  Michael Booth PUBLISHED November 9 2005 at 135 pm | UPDATED May 8 2016 at 446 am Sign up for newsletters and alerts Submit your news tips or photos Most Popular Donald Trump stumps in Colorado promises ""No more Mr. Nice Guy"" Chris Harris INT injuries and 8 other observations from Day 2 of Broncos training camp Broncos offensive line can live with the blame game. Theyre built for it. LoDo shooting leaves one dead another injured Peyton Manning stars in 3 new hilarious DIRECTV ads with Lionel Richie Woody Paige retiring from The Denver Post Did board-game sales plummet after the terrors of ""Jumanji""? Its hard to imagine any kid rolling the dice for ""Monopoly"" after the unrelenting brutality of marauding elephants and screeching monkeys in Chris Van Allsburgs chilling tale. But one of the rules of Hollywood is that movie kids never learn from watching other movies. So 10 years after ""Jumanji"" a new duo of bickering siblings discovers a dusty old board game called ""Zathura"" and the resulting destruction makes ""Doom"" look like ""Candyland."" Children seem to love the concept at least the half-dozen I took with me to help calibrate my cynic-meter. Ranging from 10 to 13 the junior previewers each found something to love in ""Zathura A Space Adventure"" and demanded a glowing review. Glowing may be a bit much from a parent feeling assaulted by meteor showers and mindless Zorgons. But Id have to agree that ""Zathura"" is a rousing tale with an agreeable balance of fear and teachable moments the kind of adventure story that seems old-fashioned these days. Van Allsburg is an expert at spooking kids to the verge of downright meanness. The robo-elves of ""The Polar Express"" turned the North Pole into a Stepford factory town. ""Jumanji"" made you wonder how often the beloved author was left alone in childhood to unhappy ends. ""Zathura"" pulls back a bit from that precipice. Two brothers bicker relentlessly as their dad (Tim Robbins) tries to work at home on a quiet Saturday afternoon. The boys hate their creaky old house - though parents will salivate over the triple-wide Craftsman- style bungalow that co-stars. Danny and Walter hate their parents divorce and they seem to hate each other. In a nice touch no one even acknowledges the presence of a self-absorbed 15-year-old sister until shes awakened at 2 p.m. for emergency service. Younger brother Danny (Jonah Bobo) finds a forgotten board game called Zathura and starts to play the space adventure. Disdainful older brother Walter (Josh Hutcherson) grows interested when the house is suddenly pelted by burning meteors and floats into outer space. Like ""Jumanji"" the problem with ""Zathura"" is that danger piles upon danger without progression logic or point. The kids have no control over their destiny merely waiting in horror for the next assault. ""Zathura"" softens the approach with a slacker astronaut portrayed nicely by Dax Shepard. He has been stuck in the game for a while and knows to finish his salami sandwich before getting overheated about the latest Zorgon attack. Some of the set pieces stretch on far too long with each conclusion telegraphed well in advance. ""Zathura"" is painfully stretched and should have come in at a speedier 80 minutes. But screenwriter David Koepp hits realistic notes and positions the family for comeuppance. ""All I know"" Danny trembles ""is when we play this game bad things happen."" True except for a movie that your kids will probably appreciate. Staff writer Michael Booth can be reached at 303-820-1686 or mboothdenverpost.com.  | ""Zathura A Space Adventure"" PG for mild language scary situations|1 hour 40 minutes|FANTASY/FAMILY|Directed by Jon Favreau; written by David Koepp based on the childrens book by Chris Van Allsburg; starring Josh Hutcherson Kristen Stewart Tim Robbins Jonah Bobo and Dax Shepard |Opens today at area theaters. Michael Booth Digital amp; Driveway Delivery - 50% Off More in Movies Movie review ""Phantom Boy"" a timely crime with an old-school feel July 29 2016 Aficionados of the lovely old-school style of animation on display in the Academy Award-nominated 2010 feature ""A Cat in Paris"" will be pleased to discover a new hand-drawn tale of adventure from the French filmmakers Jean-Loup Felicioli and Alain Gagnol. Movie review Augmented-reality app at the center of the teen thriller ""Nerve"" July 29 2016 If you think Pokemon Go fanatics are dangerous with their inclination to wander into traffic wait till you get a load of the fictional augmented-reality app at the center of the teen thriller ""Nerve."" Players of the titular game win cash by accepting increasingly reckless dares delivered via smartphone in front of a digital audience. Movie review In ""Bad Moms"" fast food booze spike the stress of motherhood July 29 2016 ""Bad Moms"" doesnt kick into gear until three mothers fed up with the stress of helicopter parenting and the unrealistic expectations of a draconian PTA president walk into a bar. One shot leads to another and pretty soon theyre discussing their most seductive fantasies. Movie review Silly gives way to outlandish in ""Hunt for the Wilderpeople"" July 29 2016 Ricky Baker is an orphaned juvenile delinquent a ""real bad egg"" as an onscreen title announces in ""Hunt for the Wilderpeople"" Taika Waititis endearingly playful adventure tale set in the New Zealand bush. Member Services News Alerts Facebook Twitter Instagram RSS Subscribe Become a Member / Subscribe Place a Hold Denver Post Store Digital Replica Edition Classifieds Autos Real Estate Jobs Todays Ads Weekly Ads Daily Ads Special Sections Contact Us Submit a News Tip Member Services Advertise With Us Careers Place an Obituary Todays Front Page Back Issues Archives Mobile Apps Copyright (c) 2016 Digital First Media Privacy Policy Site Map Ethics Policy Powered by WordPress VIP Arbitration Send to Email Address Your Name Your Email Address Cancel Post was not sent - check your email addresses Email check failed please try again Sorry your blog cannot share posts by email.",http://www.denverpost.com/movies/ci_3199535,200,zathura7,zathura,denverpost
