review,link,status_code,id,movie_key,critic
"Zathura | Reelviews Movie Reviews Out now Cher Harold Rosson Eva Green Benjamin ... Home Video Views ReelThoughts Currently in Cinema ReelViews Library Login Specials My Books Array ( [page] =gt; reelviews [view] =gt; zathura ) Zathura (United States 2005) A movie review by James Berardinelli Calling Zathura the ""space version of Jumanji"" wouldnt be far off. Like the 1995 film this movie is based on a childrens book by celebrated author Chris Van Allsburg in which a group of people plays an amazing board game. (Van Allsburg doesnt always write about games - he also penned The Polar Express.) In Jumanji each turn brought a new herd of stampeding wild animals into a quiet suburban neighborhood. In Zathura the participants are blasted into outer space and can only return to terra firma once a winner has been declared. Admittedly as was the case with Jumanji the material is a little thin for a full-length feature. Yet director Jon Favreau and screenwriters David Koepp and John Kamps do a better job making the conversion than the creative team behind Jumanji. Theres a lot more energy and excitement here and although the premise is essentially the same developments seem less forced. A lot of that has to do with character development. In Jumanji the players were two-dimensional pawns. In Zathura theyre real people. The dialogue in the film is perfect - this is exactly how brothers interact at a certain age. Walter Budwing (Josh Hutcherson) and his younger brother Danny (Jonah Bobo) are typical siblings - rivals in almost everything including capturing the attention of their father (Tim Robbins) who splits his time between playing catch with the boys and working overtime. One Saturday Dad goes to the office leaving Walter and Danny behind under the less-than-watchful-eye of their older sister Lisa (Kristen Stewart). Her cardinal rule dont wake me unless the house is burning down. While poking around in the basement Danny finds an old board game called ""Zarutha."" He wants to play; Walter wants to watch ESPN. But when Danny starts tinkering with the game strange things happen. A meteor shower devastates the living room. Lisa ends up in cryogenic sleep. An astronaut appears out of nowhere. And the house is in orbit around Saturn. Its a killer view but it puts the Budwings in danger from the lizard-like Zorgons. The only way back to normalcy is to win the gamea| provided the board isnt destroyed in one of numerous freak occurrences. Zathura will work better for younger viewers than older ones. Theres not much plot to absorb and theres plenty of action so this is the kind of spectacle that will appeal to those without long attention spans. For adults there are moments of genuine suspense and a nice twist or two (nothing too fancy). The action is standard-order science fiction stuff but its handled well by Favreau so it never feels too derivative. The visuals are eye-popping - lots of pretty scenery and theres never an instance when the CGI comes across as cheap or silly. Theres also a nostalgia element to Zathura. This is a movie for everyone who remembers playing this sort of old clunky board game. Its vintage 50s when ""high tech"" represented a wind-up gadget. Watching the kids play I was reminded of some of the ""treasures"" I found in the recesses of a closet in my grandparents house. The only difference is that when I started tinkering with one of those games I did not end up in the middle of an intergalactic war. At the heart of Zathura is the relationship that deepens between the brothers as the movie develops. For Walter Danny starts out as a pest always following him around and cramping his style. On more than one occasion he wishes Danny hadnt been born. Then sometime during their intergalactic journey he discovers things he never suspected about his brother. Lisas presence (curtailed for a while by her cryogenic nap) adds another element to the sibling interaction. Unlike Jumanji Zathura is a complete movie-going experience. And its suitable for the entire family (although young children may be frightened by the Zorgons who are scary-looking). The simplicity of the plot is a strength and weakness but Favreaus sure-handed direction does a good job of obscuring how little meat exists on the bones of the story. Zathura is welcome late-year fun for all ages - a pleasant contrast to the nauseating dreck that normally masquerades as family-friendly science fiction. (Clockstoppers Thunderbirdsa| need I go on?) Zathura (United States 2005) Director Jon Favreau Cast Josh Hutcherson Jonah Bobo Dax Shepard Kristen Stewart Tim Robbins Screenplay David Koepp amp; John Kamps based on the book by Chris Van Allsburg Cinematography Guillermo Navarro Music John Debney U.S. Distributor Columbia Pictures Run Time 142 U.S. Release Date 2005-11-11 MPAA Rating ""PG"" (Profanity) Genre ADVENTURE/SCIENCE FICTION Subtitles none Theatrical Aspect Ratio 2.351 Comments Add Comment Three...better movies of this genre (There are no more better movies of this genre) worse movies of this genre Race to Witch Mountain (2009) Maze Runner The (2014) Three...better movies of Josh Hutcherson Bridge to Terabithia A (2007) Kids Are All Right The (2010) Hunger Games The Catching Fire (2013) worse movies of Josh Hutcherson RV (2006) Journey to the Center of the Earth (2008) Cirque du Freak The Vampires Assistant (2009) Three...better movies of Jonah Bobo Crazy Stupid Love. (2011) Disconnect (2013) (There are no more better movies of Jonah Bobo) worse movies of Jonah Bobo (There are no more worst movies of Jonah Bobo) Three...better movies of Dax Shepard This Is Where I Leave You (2014) (There are no more better movies of Dax Shepard) worse movies of Dax Shepard Without a Paddle (2004) Hit amp; Run (2012) Baby Mama (2008) ReelViews Library Currently in Cinema Writings Fictional Writings ReelThoughts Specials About Privacy Policy Terms and Conditions Contact Website credits",http://www.reelviews.net/php_review_template.php?identifier=1174,200,zathura13,zathura,reelviews
"StarTribune.com News weather sports from Minneapolis St. Paul and Minnesota All Sections Search Saturday July 30 2016 Manage Account Log out Log In Subscriptions New Manage Existing eEdition 79deg Forecast Traffic Star Tribune Local Sports Business Opinion Variety Obituaries Classifieds Autos Housing Jobs Home All Sections Search StarTribune Manage Account Log out Log In Subscriptions New Manage Existing Recently Visited Home Local Sports Business Opinion Variety Health Highlights Politics Nation World Science Weather Traffic Video Photography Obituaries Classifieds Autos Housing Jobs Minneapolis St. Paul East Metro North Metro South Metro West Metro Projects Local Columnists Jon Tevlin James Lileks Local Blogs Campus Confidential Class Act Dateline Minnesota Full Disclosure Lileks at Lunch MPLS. STP The Drive Yesterdays News State Fair 10000 Takes Data Drop Twins Vikings Wild Wolves Gophers Colleges Golf Lynx Motorsports Outdoors High Schools Soccer Sports Columnists Dennis Anderson Sid Hartman Patrick Reusse Chip Scoggins Jim Souhan Sports Blogs Access Vikings A Fans View Bloggin Scoggins Dennis Anderson Doug Smith Gold in the Barn Gridiron Gold Ice Gold On the Lynx On the Wolves Patrick+ Randball Russos Rants Sids Scoops Souhan on Sports StribSports Upload The Roman Empire Twins Insider Sports Podcasts Access Vikings Twins Insider Top Workplaces Business Columnists Lee Schafer Neal St. Anthony Business Blogs 3D Economics Food Market Just Listed Lee Schafer Point of Sale The Mill Commentary Editorial Steve Sack Letters Podcasts Playing Politics Books Celebs Comics amp; Games Horoscopes Eat amp; Drink Movies Music Stage amp; Arts TV amp; Media Best of MN Health Home amp; Garden Kids Health Style Taste The Good Life Travel Variety Columnists Gail Rosenblum C. J Variety Blogs Artcetera Escape Artists Greengirls Health Check Lileks  Lunch On Books Table Talk Wingnut World Class View all Obituaries Place an Obituary Notice Place an Ad Garage Sales Estate Sales Merchandise Pets Recreational Vehicles amp; Marina Newspaper Ads Auctions Search Used Vehicles Sell your Vehicle Advertise Rentals Commercial Foreclosures Find an Agent Find a Job Your Resume Your Account Employer A-Z Top Workplaces Post a Job Star Tribune All content Business listings Close Toll unclear in crash of Texas balloon carrying at least 16 52 minutes ago A hot air balloon carrying at least 16 people caught on fire and crashed in Central Texas on Saturday causing what authorities described as a ""significant loss of life."" The Latest Woman near Texas balloon crash saw fireball A look at the deadliest hot air balloon accidents FAA warned of potential for many hot air balloon deaths Local Twin Cities area braces for sex trafficking tied to Super Bowl Ryder Cup 157pm Local Pokemon Go poses problem for peace at Eden Prairie park memorial 1020am Pokemon Go trainers were out in full force Nation Russia tied to hack of program used by Clintons campaign 816am Trump Comments about Russia Clinton emails were sarcastic Local St. Croix County girl charged in savage attack on brothers girlfriend 737am More top headlines 2 people shot and wounded in Minneapolis 1117am Man dies in overnight crash near Hastings 1120am Carver County judge narrows list of potential Prince heirs to at least 6 743am Homegazing Spacecrafting The design for the makeover was inspired by Finnish lake homes of the 1960s. Windows were enlarged to capture views of the backyard pond. Homegazing 1958 St. Louis Park rambler gets Finnish lake home makeover An Eisenhower-era rambler in St. Louis Park was crying out for a makeover telling its remodeling designer what it wanted to be -- clean-lined simple and quiet like a midcentury modern Scandinavian home. You can have it for 550000. A Finnish-inspired makeover New landscaping and overhang solve water problems at Minnetonka home How to grow a garden with natural beauty Variety Game of Thrones season 8 will be the last HBO confirms 242pm Dont miss Cottage Grove couple wrap 250K honeymoon treehouse around old bur oak Michael and Paula Bushillas have spent the last few years making their 8-acre property into a shabby-chic romantic venue for new brides and grooms. Sports Greenway ready to fend off youngsters in his final (?) NFL season 922am Offense gets a hard look during Vikings first practice Sports Fans give Morneau loud return to Target Field 945am Twins pitchers Abad Kintzler could be on the move Variety Midwest Traveler Exploring the revived Eau Claire Wis. Visiting revitalized Eau Claire Wis. Opinion Rash Report 2016 campaign narrative defies expectations Like the primaries and the impact of media the DNC hack is just the latest story to morph in a different direction than anticipated. Twin Cities transit projects reach a perilous pass Why Democrats abortion stance is a deal-breaker Sports Offense gets a hard look during Vikings first practice Fans give Morneau loud return to Target Field Greenway ready to fend off youngsters in his final (?) NFL season Local Twin Cities area braces for sex trafficking tied to Super Bowl Ryder Cup New public square to liven up W. Broadway in Minneapolis Cottage Grove couple wrap 250K honeymoon treehouse around old bur oak Business After stumbling big Boston Scientific has regained its stride Mike McNamara is weaving a new web for Target IT operations Growing corn like its 2065 to study climate change effects Variety Is J.K. Rowling selling out? Some Harry Potter fans wonder 168 shows 850 performances 11 days Why Minnesotas Fringe Fest matters Husker Dus Grant Hart on full display in Walker exhibit Blogs Access Vikings Vikings lineman Harris calls illness mild setback Paul Douglas on Weather Good-Looking Weekend; More Hot Encounters Scheduled for August Twins Insider Postgame Nolasco finished his extra-long start with a flourish The Drive Right turns across LRT tracks now legal at 5th and 5th but dont get used to it Todays Video http//www.startribune.com Raw video Patterson injured after spectacular catch 0021Cordarrelle Patterson left Vikings practice after a spectacular catch over cornerback Jabari Price Now Playing Raw video Patterson injured after spectacular ... Now Playing Special prosecutor added to help with Castile ... Now Playing C.J. Outrageous Davis strives to be Dave ... Now Playing Afternoon forecast Partly sunny with a high ... The StreamNews updates from around the Web most read most watched Toll unclear in crash of Texas balloon carrying at least 16  Nation Twin Cities area braces for sex trafficking tied to Super Bowl Ryder Cup  Minneapolis 1958 St. Louis Park rambler gets Finnish lake home makeover  Variety Cottage Grove couple wrap 250K honeymoon treehouse around old bur oak  East Metro Offense gets a hard look during Vikings first practice  Vikings Raw video Patterson injured after spectacular catch  Vikings Nunez Its tough to leave Twins  Sports Clinton With no ceilings the skys the limit  Politics Special prosecutor added to help with Castile shooting case  Video Vikings Greenway hints this could be final year  Vikings Most Shared Healthy Family Slow cooker carnitas serve up comfort food  Taste The key to peeling hard-cooked eggs? Cook them right  Taste How Denmark is trying to subvert call to terror A model for here?  Local After stumbling big Boston Scientific has regained its stride  Business Prince tribute concert set for October at U.S. Bank Stadium  Music Follow Us On Facebook Twitter Google+ Pinterest Instagram Tumblr World Philippine president calls off truce after rebel attack Security suddenly boosted at Amsterdams Schipol Airport Nation Reagan shooter Hinckleys return to normalcy has been years in making Powerball 478 million jackpot is nations 8th largest Politics Russia tied to hack of program used by Clintons campaign Gov. Mark Dayton looks back on 40 years of Democratic National Conventions markets get quote symbol lookup 20 minute delay last updated new stadium a look inside Go inside U.S. Bank Stadium the new star of the north Top Workplaces Beer in the office? Top Workplaces offer unusual incentives to attract workers Transparency and straight talk are not just buzzwords at top large companies Celebrities Latest late-night battle Stephen Colbert vs. corporate lawyers Fox 9s Jonathan Choe takes his talent and sartorial style home to Boston Twins Fans give Morneau loud return to Target Field Twins win on Mauers pinch-hit walk-off walk Vikings Offense gets a hard look during Vikings first practice Day 1 injuries to Patterson Peterson dont worry Vikings coach Zimmer poll Poll If Hillary becomes president what title will Bill have? Should Hillary Clinton become the president Bill Clinton would become the first male White House ... 10000 Takes The art of parting We used to spend so much time there How I came to see bipolar disorder as my greatest strength Featured Gallery Photos This mid-century home for sale in Golden Valley is like walk... 13 photos Wallpaper wallpaper wallpaper. Listed for 674900. Featured Video A new generation of black leaders say Jamar Clark made the struggle... 0328 Hear from the new generation of black leaders about challenges they face addressing ... special feature Find the summer fun Whats your flavor? Summer in Minnesota offers something for everyone. StarTribune Follow Us On Facebook Twitter Google+ Pinterest Instagram Tumblr Company About the Star Tribune Contact us Jobs News in Education City Pages High school sports hubs Mobile and tablet apps Advertise with us Talk with a business consultant Media kit Classifieds Buy Star Tribune Store Photo Reprints Archived articles Back Copies Commercial reprints Licensing Customer support Feedback Manage your account Newspaper subscription Digital access eEdition Vacation hold/billing Website Terms of use Privacy policy Site index RSS (c) 2016 StarTribune. All rights reserved.",http://www.startribune.com/stories/1553/5719653.html,200,zathura14,zathura,startribune
"Page not found | www.accessatlanta.com Our ProductsAJC JobsContact UsNewsSportsNeighborhoodLifeThings to DoMoreBlogsAJC ClassifiedsGa LotteryHoroscopesTrafficDoctors amp; Sex Abuse All News 2016 Election Atlanta News Nation amp; World Business Technology Politics Crime Education Offbeat News News Video Atlanta Weather News BlogsAJC InvestigationsPolitical InsiderGet SchooledAll News BlogsIn the NewsAtlanta Watering RestrictionsTraffic Construction AlertGa. Public School RatingsAtlanta Gas Prices All Sports Atlanta Braves Atlanta Falcons Hawks High Schools Georgia Tech Georgia State Kennesaw State UGA / DawgNation SEC / SECCountry Sports Video Sports BlogsRecruiting BlogAtlanta FalconsAtlanta HawksAll Sports BlogsIn the NewsSports ScoresGolfNASCARAJC Peachtree Road Race All Neighborhood Newcomer Guide Buckhead Buford Decatur Gwinnett County Intown Atlanta Marietta Roswell Sandy Springs Smyrna Peachtree City County NewsClayton CountyCobb CountyDeKalb CountyGwinnett CountyIn the NewsAtlanta Summer CampsLiving NorthsideLiving IntownEvents Near Me All Life Celebrities Home amp; Garden Weddings amp;... Health Travel Parenting Music Home Design Ideas Food amp; Drink Movies amp; TV Arts amp; Culture Life BlogsBest of AtlantaAtlanta RestaurantsAtlanta ShoppingAll Entertainment BlogsIn the NewsBest of AtlantaGamesAJC Peachtree Road Race All Things to Do Events in Atlanta Best of Atlanta Summer Camps Movie Showtimes Radio amp; TV Arts amp; Culture Music Food amp; Drink Shopping Latest Video Games BlogsAtlanta RestaurantsMusic SceneArts amp; CultureAll Entertainment BlogsIn the NewsUpcoming MoviesLiving Intown BeltLineHoroscopes All More Newsletters AJC Customer Care Contact the AJC Games AJC Cars AJC Jobs Shop Obituaries Homefinder Kudzu Todays BuzzBuzz BlogRadio amp; TV TalkNews to MeInside AJCMovie TheatersAtlantas Top WorkplacesFind a Garage Sale All Blogs The Biz Beat Georgia Tech High School Jeff Schultz Mark Bradley Political Insider Radio amp; TV Talk The Buzz Get Schooled Take a BreakPlay a GameHoroscopesWeekend CalendarEvents near youIn the newsHow Atlanta Loses WeightKudzuGa Lottery All AJC Classifieds AJC Pets AJC Cars Homes for Sale AJC Jobs All Ga Lottery All Horoscopes All Traffic All Doctors amp; Sex Abuse State-by-State For Patients Explore the Project About the Project Doctors Investigation ArticlesBroken SystemWhich Doctors AbuseHow Many Cases?One Repeat OffenderVulnerable PatientsDoctors ExcusesUndercover Agent Nabs DocPediatrician AccusedSubscribe nowAs low as 99C/SubscribeLog InYour AccountNewslettersLog Out COMMENTS0 SHORTCUTS Homefinder Atlanta Jobs Find Your Car Classifieds Obituaries Family-placed Notices Contact Us/Subscribe Customer Care Advertise With Us Digital Products Shortcuts Homefinder Atlanta Jobs Find Your Car Full Site IndexVisitor AgreementPrivacy PolicyContact UsFollow usTopCLOSESECTIONSnewssportslifeneighborhoodsshopthings to doSHORTCUTSajc obituariesfamily-placed noticesclassifiedshomefinderatlanta jobsfind your carmanage your profilecontact uscustomer careadvertise with usdigital productsPARTNERSfind amp; save couponskudzusavings.comvalpakmyajcFUNgame centerMEMBER CENTERsign inmanage your profileUTILITIESarchivesweathertrafficsitemapLEARN ABOUT AJC.COMtake a tourFOLLOW USfacebooktwitterinstagramyoutubepinterestPRODUCTS SUBSCRIBEFOLLOW US (c) 2016 Cox Media Group. By using this website you accept the terms of our Visitor Agreement and Privacy Policy and understand your options regarding Ad Choices. Learn about careers at Cox Media Group. <a href=""http//www.omniture.com"" title=""Web Analytics""></a><a href=""http//www.qualtrics.com/enterprise-feedback-management"">Enterprise Feedback Management</a><a href=""http//www.qualtrics.com/survey-software"">Survey Software</a>x 3 killed 1 injured when gunman opens fire at party near Seattle Report Cheddars employee with loud weed in restroom bumps into cop Deadly hot air balloon crash in Texas What we know now Mystery mower carves Trumps name into Texas lawn Small Loans Make Up Greatest Share Of Student Debt Staycations 101 The page could not be foundWere sorry the page you requested could not be found. It is possible that the address is incorrect or that the page no longer exists.To look further you can enter a search term in the box belowSearch More from ajc.com Topics AllNewsSportsNeighborhoodLifeThings to DoMoreBlogsAJC ClassifiedsGa LotteryHoroscopesTrafficDoctors amp; Sex AbuseCrime 3 killed 1 injured when gunman opens fire at party near Seattle Nation Report Cheddars employee with loud weed in restroom bumps into cop Nation Deadly hot air balloon crash in Texas What we know now Politics Mystery mower carves Trumps name into Texas lawn Business Small Loans Make Up Greatest Share Of Student Debt Business Staycations 101 Sign InORSign in using your accessAtlanta profileNeed a Profile? Register Now. { userInformationForm } EMAIL { traditionalSignIn_emailAddress } PASSWORDForgot your password? { traditionalSignIn_password } { traditionalSignIn_signInButton } { /userInformationForm } Sign in using your existing account { loginWidget } Sign InORSign in using your accessAtlanta profileNeed a Profile? Register Now. { userInformationForm } EMAIL { traditionalSignIn_emailAddress } PASSWORDForgot your password? { traditionalSignIn_password } { traditionalSignIn_signInButton } { /userInformationForm } Sign in using your existing account { loginWidget } Sign InORSign in using your accessAtlanta profileNeed a Profile? Register Now. { userInformationForm } EMAIL { traditionalSignIn_emailAddress } PASSWORDForgot your password? { traditionalSignIn_password } { traditionalSignIn_signInButton } { /userInformationForm } Sign in using your existing account { loginWidget } Youre Almost DonePlease confirm the information below before signing in.Required { socialRegistrationForm } { socialRegistration_displayName } { socialRegistration_emailAddress } By submitting your registration information you agree to our Visitor Agreement and Privacy Policy. { socialRegistration_signInButton } { /socialRegistrationForm } RegisterRequired { registrationForm } { traditionalRegistration_emailAddress } { traditionalRegistration_password } { traditionalRegistration_passwordConfirm } { traditionalRegistration_displayName } By submitting your registration information you agree to our Visitor Agreement and Privacy Policy. { createAccountButton } { /registrationForm } Create a New AccountRequired { registrationFormBlank } { traditionalRegistration_emailAddressBlank } { traditionalRegistration_passwordBlank } { traditionalRegistration_passwordConfirmBlank } { traditionalRegistration_displayName } By submitting your registration information you agree to our Visitor Agreement and Privacy Policy. { createAccountButton } { /registrationForm } Just One More Thing...We have sent you a verification email. Please check your email and click on the link to activate your profile.If you do not receive the verification message within a few minutes of signing up please check your Spam or Junk folder.CloseThank you for registeringWe look forward to seeing you on [website] frequently. Visit us and sign in to update your profile receive the latest news and keep up to date with mobile alerts. Click here to return to the page you were visiting. Create a new passwordDont worry it happens. Well send you a link to create a new password. { forgotPasswordForm } { forgotPassword_emailAddress } { forgotPassword_sendButton } { /forgotPasswordForm } Email sentWe have sent you an email with a link to change your password.Close { mergeAccounts } Sign in to complete account merge { tradAuthenticateMergeForm } { traditionalSignIn_emailAddress } { mergePassword } { backButton } { traditionalSignIn_signInButton } { /tradAuthenticateMergeForm } Resend Email VerificationClick submit to receive another verification email { resendVerificationForm } { traditionalSignIn_emailAddress } { /resendVerificationForm } Your Verification Email Has Been SentCheck your email for a verification linkClose",http://www.accessatlanta.com/movies/content/shared/movies/reviews/XYZ/zathura/index.html,404,zathura15,zathura,accessatlanta
410 Gone Gone The requested resource/film/film_results.php is no longer available on this server and there is no forwarding address. Please remove all references to this resource.,http://www.laweekly.com/film/film_results.php?showid=3656&Sumbit.x=40&Sumbit.y=19,410,zathura16,zathura,laweekly
