review,link,status_code,id,movie_key,critic
Zathura A Space Adventure (2006) directed by Jon Favreau | Film review Go to the content Go to the footer Time Out London London Popular cities London New York Paris Chicago Los Angeles Browse all cities Time Out London Close London Change city London Popular cities London New York Paris Chicago Los Angeles Browse all cities Tickets Offers Things to Do Restaurants Bars amp; Pubs Film Theatre Art Music Attractions Blog Theatre Tickets Shopping Offer of the Day Time Out Card Time Out Escapes Time Out Live Hotels Nightlife Music festivals Events amp; Festivals Kids Museums Clubs Comedy Food amp; Drink Classical Music amp; Opera Dance LGBT City Guide Area Guides Property Competitions Dating Close My Time Out Things I love My lists My Profile My Account Sign out Sign in Create account Sign in With your social account Or with your email Email Password Remember me Forgotten your password? Sign in You can create a Time Out account in two ways... With a few clicks using your favourite social network Or by entering your details below Email First Name Last Name Create password Repeat new password I accept Time Outs terms of use including opt-in to newsletters. Create account Welcome  You have successfully connected your account to Time Out. You may sign in with this account in future. Please confirm your account details Email First Name Last Name I accept Time Outs terms of use including opt-in to newsletters. Sign up My Account Sign in or Create account Search Tickets Offers Things to Do Restaurants Bars amp; Pubs Film Theatre Art Music Attractions Blog Theatre Tickets Shopping Offer of the Day Time Out Card Time Out Escapes Time Out Live Hotels Nightlife Music festivals Events amp; Festivals Kids Museums Clubs Comedy Food amp; Drink Classical Music amp; Opera Dance LGBT City Guide Area Guides Property Competitions Dating More Search Zathura A Space Adventure Film  Action and adventure Add review 0 Love It Save it 0 Add review 0 Love It Save it Time Out says Details Users say Time Out says Jumanji in space anyone? Bewildering though it may seem Zathura is just that. Two young brothers chance across a board game with untapped mystical powers which once play begins transports their house into outer space and barrages them with sci-fi cliches. Ten-year-old Walter (Josh Hutcherson) and his cute-as-pie younger brother Danny (the aptly named Jonah Bobo) are the protagonists the latter coming across like a male counterpoint to devil-child Dakota Fanning. While Zathura is certainly aimed at a younger audience older viewers may enjoy the lovingly wrought 50s iconography of rocket ships aliens robots and ray guns which hark back to the likes of Forbidden Planet. And notwithstanding the plots basic unoriginality director Jon Favreau (Made Elf) gratifyingly prevents the film from becoming a mere maelstrom of CG effects by pushing the brothers amusing bickering to the fore the impulsive my-turn/ your-turn narrative supplies the same giddy charm that a couple of banana daiquiris might lend to a game of snakes and ladders. By DJ Posted Monday January 30 2006 Details Release details Rated PG Release date Friday February 3 2006 Duration 113 mins Cast and crew Director Jon Favreau Screenwriter David Koepp John Kamps Cast Josh HutchersonJonah BoboDax ShepardKristen StewartTim Robbins Users say LiveReviews|01 person listeningSign inWrite reviewMost helpfulMost helpfulHighest ratingLowest ratingNewestOldestLoadingundefinedNew CommentsRefreshShow More Share Tweet 0 Shares Top About us Work for Time Out Privacy policy Cookie Policy Website terms of use Contact us Time Out for business Get listed Claim your listing Premium Profiles Advertising Time Out products Time Out Card Mobile apps Time Out Shop Time Out Guides Time Out Travel Time Out Offers Time Out Worldwide Time Out magazine Where to get Time Out magazine Subscribe to Time Out magazine Manage my subscription Follow us Facebook Twitter Youtube Instagram Pinterest Spotify Time Out London Site map },http://www.timeout.com/film/83388.html,200,zathura0,zathura,timeout
Page Not Found,http://www.nydailynews.com/entertainment/movies/moviereviews/story/364446p-310267c.html,404,zathura1,zathura,nydailynews
"Zathura Plays Well on the Big Screen washingtonpost.com gt; Arts amp; Living gt; Movies >> Follow Movies On Movies Zathura Plays Well on the Big Screen One wrong move and . . .  Josh Hutcherson and Jonah Bobo discover a games broader implications in ""Zathura."" (By Merrick Morton -- Associated Press) Network News X Profile View More Activity TOOLBOX Resize Print E-mail Reprints By Desson Thomson Washington Post Staff Writer Friday November 11 2005 Remember that summer vacation when it just poured? Dad had paid a small ransom -- as he kept muttering over his pre-noon beer -- for that perfect beach house. And now it was bucketing. Thats when someone pulled out the dusty board game Tokens cards and dice spilled out before a circle of grumpy faces. Then everyone in spite of themselves got caught up in the game -- hooting and high-fiving slowly slipping into the warm waters of familial goodwill. ""Zathura"" salutes the low-tech magic that lurks inside a board game -- that hidden ability to bring people together. Although director Jon Favreau employs an arsenal of modern weapons -- digital effects miniature models robots and computer-generated imagery -- he makes sure the technology never overruns the story or its characters. The movie based on the book by Chris Van Allsburg (also author of ""Polar Express"" and ""Jumanji"") introduces us to 6-year-old Danny (Jonah Bobo) and 10-year-old Walter (Josh Hutcherson) who live in a constant state of war with their sullen older sister Lisa (Kristen Stewart). When their divorced father (Tim Robbins) is unexpectedly called to work one day he asks Lisa to run the house. She locks herself upstairs. The boys battle downstairs. Its another day in sibling hell. Walter gets so exasperated with Danny that at one point he loads him into a dumbwaiter and lowers him to the basement. Thats when Danny discovers Zathura an old-fashioned board game mostly made of tin with a windup key a lever a ""Go"" button and a miniature spaceship that whirs along the game board. Failing to get his brother interested Danny starts it up himself. That little spaceship springs to life and -- ding -- up pops a card with a message ""Meteor Shower -- Take Evasive Action."" Moments later the house is being bombarded with real meteors. Looking through the burning Swiss cheese that is now their roof the brothers realize they are intergalactic passengers in their own home -- which has been propelled into outer space. They have no choice but to continue playing the game. As in ""Jumanji"" each turn yields a very real surprise -- often unpleasant. Lisa is plunged into a cryonic sleep for five turns. A robot invades the house programmed erroneously to destroy them -- or so the cue card tells them. Flesh-eating Zorgons (reptilian bipedal aliens) pursue the floating house in their own spaceships and these guys are hungry . And an astronaut (Dax Shepard) who has been trapped in the nethersphere of this game for years literally drops in. (To the brothers disgust Lisa finally awakened from her involuntary slumber develops a crush on this stranger. ) It wont surprise you to hear its going to take a lot of sibling camaraderie for Danny Walter and Lisa to get their house back home. Or that Favreau who first appeared on the scene as writer-star of 1996s ""Swingers"" and most recently directed ""Elf"" engenders an amusing improvisatory atmosphere among the performers. They persuasively convey the familys domestic feistiness with screaming battles that reach such a pitch at times they forget the hostile forces around them. ""Zathura"" has an almost antique charm recalling the 1950s sci-fi movies in which actors in silver suits pretended to be aliens or those old Ray Harryhausen films such as 1963s ""Jason and the Argonauts"" in which ancient warriors fought herky-jerky monsters on studio back lots. The Zathura game looks like something hauled out of a Cold War-era basement. This hand-made feel gives ""Zathura"" an appealing childlike sense of wonder an element too often forgotten in movies with many times the budget and technological resources. By comparison the 1995 movie ""Jumanji"" whose plot is remarkably similar (preteen boy plays and gets swallowed into a board game for 26 years) has such stunning spectacles as rhinos zebras and elephants thundering through a household hallway but its characters and story seem like afterthoughts. Favreau clearly understands that the importance of a board game isnt in its fancy bells and whistles. Its measured by the people who play it and the fun it gives them. Zathura (102 minutes at area theaters) is rated PG for mild profanity. And those Zorgons might be too scary for young children. (c) 2005 The Washington Post Company Network News X My Profile Friends Activity View More Activity",http://www.washingtonpost.com/wp-dyn/content/article/2005/11/10/AR2005111001975.html?sub=AR,200,zathura2,zathura,washingtonpost
"thestar.com | Toronto Star | Canadas largest daily SectionsSearch the print archivesSectionsTop Stories420 PMBlue Jays jump into first place in AL East with win over OriolesPowerhouse seven-run fifth inning help Jays drive home a 9-1 victory over the Baltimore Orioles.1152 AMTwo seriously injured in shooting during fitness bootcamp at Christie Pits ParkJust before 9 a.m. Toronto police responded to reports of a shooting with multiple people injured in Koreatown.1250 PMTeen son allegedly kills ex-Blue Bomber Antonio Armstrong and wifeArmstrong and his wife Dawn were shot and killed in their Houston home on Friday allegedly by their teenage son. Police have charged the 16-year-old boy with murder. 438 PMLIVE Over 16000 participate in Caribbean Carnival parade Over 16000 estimated participants part of what makes the Caribbean Carnival so monumental in Toronto.403 PMSignificant loss of life in Texas hot air balloon crash officials say Authorities would not provide an exact number of how many people died after a hot air balloon caught on fire and crashed into a pasture. 215 PMFive aerospace companies battle to replace Canadas CF-18sFive aerospace companies respond to Ottawas call for info offering their fighter jets as potential replacement for aging CF-18s.600 AMSammy Yatims father He gets to go home. My son sleeps in an urnNabil Yatim talks to the Star about Toronto police Const. James Forcillos conviction his sons death and the indescribable pain of the last three years.600 AMMore Canadian peacekeepers accused of sex abuseThree more Canadian peacekeepers were accused of sexual exploitation or assault in Haiti documents show.600 AMThis program is adding years to my lifeToronto residents whove lived with hepatitis C share their experiences of living with the disease through their art.1002 AMTwo 3-year-old sisters found wandering Scarborough streets alone reunited with parentsThe girls appeared to have left their home on their own while their mother was sleeping according to police.500 AMCanada needs to prepare for the unthinkable -- President Trump Paul Wells The conventions are over and the U.S. election is set. It would be folly for Canada not to plan for the worst.July 29 2016McCain heiress asks for removal of estranged husbands lawyerAs Eleanor McCain and Jeff Melanson continue their divorce battle McCain seeks to remove Melansons lawyer.1200 PMHeart of gold hero saves eight lives in the Junction KeenanJunction man woke sleeping residents to tell them house was burning. Talking PointsDating Diaries I demanded a photo...he sent me two pictures of his feetVicki met Brendan on a dating site. He started to chat with her but he didnt have a picture of himself on his profile.I spent 2000 to build a wall between me and my pot-smoking neighbourMarijuana exposure is increasing as we move toward legalization. But what if you dont want to smell it? Matt Damons The Great Wall slammed for whitewashing Chinese history ""Fresh Off the Boat"" actress Constance Wu speaks out against Hollywoods white saviour problem pointing to the casting of Matt Damon as its dragon-slaying lead in 2017s action movie ""The Great Wall."" Bikini-clad Swedish cop arrests suspected thiefSunbathing police officer Mikaela Kellner was off duty and wearing a bikini but that didnt stop her from catching a man suspected of stealing a phoneWhy a Newfoundland village is afraid for this friendly beluga whale The 2.4-metre-long whale showed up at the wharf in Admirals Beach about four months ago and experts are now worried it could be hit by boat traffic.Who is stealing the mannequins from Bellevilles clothing stores?Frustrated shop owners are worried by a string of ""creepy"" break-ins.Road closures this Civic Holiday weekendLake Shore Blvd. will be closed all day Saturday for the annual Caribbean Carnival parade.Cirque du Soleil Luzia an outrageous veritable festival of cultural appropriationShow is full of wow feats and gorgeous stage pictures but indulges in cultural appropriation.Melania Trumps website taken down after university degree debunked In a Twitter post Melania Trump said her website had been removed because ""it does not accurately reflect my current business and professional interests."" Jason Bourne is on the run again older but still explosive ReviewMatt Damon returning to the screen as the amnesiac ex-CIA assassin is a kinetic and sympathetic presence.Watch White Lungs scorching mini-set at Mill Street Brew PubWatch the Vancouver punks scorching mini-set at Mill Street Brew Pub.NewsThe Morning Headlines NewsletterDelivered daily to your inbox.Sign upGTAJims Restaurant about to serve its last best western in LeslievilleLeslieville diner closing to make way for condos.VANCOUVERPair found guilty in B.C. terror trial to go free after judge rules RCMP entrapment John Nuttall and Amanda Korody were arrested for plotting to attack the B.C. legislature on Canada Day in 2013.GTAOntario has a serious problem with bad bossesStudy commissioned by the Ministry of Labour says poor enforcement leaving vulnerable workers exposed.OTTAWACanadian military seeks to improve its transgender policy The Canadian Armed Forces reviewing the current transgender policy want to prevent discrimination and inappropriate behaviour in the newest policy draft. MANILA PHILIPPINESPhilippine president calls off ceasefire after rebel attackAfter withdrawing his weeklong ceasefire Duterte ordered all government forces to go on high alert and ""continue to discharge their normal functions."" Todays VideosNewsAt least 16 feared dead in Texas air balloon crashEmergency crews are sifting through the remains of a hot-air balloon that caught fire and crashed near the central Texas city of Lockhart.NewsWhat the milk crystals of a Pacific beetle cockroach look likeIn the brood sac the cockroach embryos gulp down the liquid milk. There the proteins turn to hard crystals in their guts.NewsArmenian police protesters clash amid hostage crisisArmenian police use tear gas stun grenades and batons to disperse protesters near a police station in the capital Yerevan that is being occupied by supporters of an imprisoned politician.NewsNew Sandy Hook school unveiledOfficials say the newly built Sandy Hook Elementary School will offer a warm and comfortable environment for students with increased security in light of the 2012 massacre which killed 20 first graders.NewsTrump Clinton should have congratulated me for making historyRepublican presidential nominee Donald Trump said Hillary Clinton should have congratulated me for having done something that nobody has ever done in history.NewsFuneral for Ottawa man who died after police altercationOttawas main mosque was packed to overflowing Friday for the funeral service of Abdirahman Abdi who died after a confrontation with police last Sunday.NewsClinton Kaine kick off post-convention bus tourHillary Clinton and running mate Tim Kaine are starting their bus tour of a pair of battleground states. The Democratic presidential nominee said the tour through critical Pennsylvania and Ohio will stop at places that make things.NewsB.C. couple walk free after entrapment ruling in terror caseA couple that had been found guilty of plotting a terrorist attack in B.C. walked free on Friday after a judge ruled that the RCMP had entrapped them.NewsDozens we killed in Taiwan bus crash on July 19A tour bus carrying Chinese tourists in Taiwan burst into flames on July 19 killing all 26 passengers aboard. The accident is the deadliest involving Chinese tourism to the island.Opinion and AnalysisReaders LettersWhy Americans have trouble loving HillaryCanadaCanada needs to prepare for the unthinkable -- President Trump Paul Wells The conventions are over and the U.S. election is set. It would be folly for Canada not to plan for the worst.InsightDid Donald just get Trumped? BurmanThe Democratic convention shone a light on the dark deficiencies of Donald Trumps dystopian vision -- and boosted Hillary Clinton. Readers LettersWhy TTC ridership is downOlympicsBar hasnt been set high for Rio Olympics ArthurAt this point if the Games dont skid all the way into the ditch they will be deemed a success. Life is about setting reasonable expectations. So here are your best-and-worst-case scenarios for how the Games will unfold.CommentaryCanadas main environmental law isnt workingEmissions of some of the most harmful chemicals are on the rise in Canada. We need to update the federal law thats supposed to curb them.GTABusinessIn a park behind a Toronto rehab centre joy for kidsIn Spiral Park the outdoors is for everyone.City HallMayor Tory wants at least 1M fine for removal of trees on BayviewThe mayor says hes pushing for a ""seven-figure"" penalty for the removal of trees without a permit.GTADrug testing kits urged for Veld other music festsReport recommends testing drugs for impure substances at music festivals Once Upon a City The local eateries serving Torontonians for generations A menu of olde tyme favourites in photos.City HallToronto to test mobile ticketing app for island ferryNew way to buy tickets online aimed at cutting down lineups for island ferry.GTARefugee offers to pay hydro bills for pensioner left in the darkPeggy Mills 74 lost her hydro and her hope until Star readers came to the rescue with offers of financial help.GTAPedestrian dies in collision involving TTC bus in ScarboroughToronto Police said the collision involved a TTC bus and an SUV which then struck the two pedestrians.SportsWOBURN ENGLANDAriya Jutanugarn leads Womens British OpenCanadians far off the pace in major test.TORONTOBlue Jays jump into first place in AL East with win over OriolesPowerhouse seven-run fifth inning help Jays drive home a 9-1 victory over the Baltimore Orioles.OlympicsCanadian Olympic sailor shares Laser visionOakvilles Lee Parkhill uses London letdown as fuel for Rio Olympics.FootballEx-Blue Bomber Antonio Armstrong wife allegedly killed by son Armstrong and his wife Dawn were shot and killed in their Houston home on Friday allegedly by their teenage son. Police have charged the 16-year-old boy with murder. MOSCOWRussia to appeal against ban on its weightlifters from Rio Olympics Russian Sports Minister Vitaly Mutkov will appeal the decision to ban all eight of its weightlifters from the Rio de Janeiro Olympics for doping. Blue JaysBlue Jays blasts bury Orioles in series openerJose Bautista Edwin Encarnacion and Troy Tulowitzki launch solo homers in the first inning to send early message in win over AL East leaders.BusinessSTRATFORD Ont.Is Stratford the next Waterloo? Town known for Shakespeare wants to be self-driving hubRBC has opened a 300 million data centre here. Starwood Hotels is experimenting with its first ""distributive call centre"" and The University of Waterloo agreed to open a satellite campus that will be home to 500 students this fall.BusinessAre healthier relations with Russia in the works? OliveForeign Affairs minister Stephane Dion and his Russian counterpart met for 30 minutes Monday at a Pacific nations summit in Laos.BusinessIn a park behind a Toronto rehab centre joy for kidsIn Spiral Park the outdoors is for everyone.BusinessTSX and loonie creep higher oil shows slight recoveryThe Canadian dollar closed at 76.59 cents US up 0.61 of a cent from Thursdays close.BusinessAir Canada profits decline with Brexit and attacksThe second-quarter drop comes in spite of slight lift in revenue.WASHINGTONU.S. economy posts sluggish growth in springThe Commerce Department said Friday that the gross domestic product -- the broadest measure of the economy -- grew at a 1.2 per cent annual rate in the April-June quarter.Life and EntertainmentDownload the Toronto Star ePaper Edition.HomesWhat 505000 will get you in Liberty VillageA roundup of condos that sold in the GTA in recent weeks.EntertainmentDrake curator has hotel down to a fine artArt is not an afterthought at the Drake Hotel and its properties thanks to curator Mia Nielsen.EntertainmentTabloids Ben gets his third or fourth second chance with Jen Jen Garner imposes a bunch of boring rules on Batman Kelly Ripa is having a bit of trouble at the office and Julia Roberts may lose her fortune to the nobody she married. EntertainmentWhere the cast of Suicide Squad were spotted while filming in TorontoHeres where Will Smith Jared Leto Margot Robbie and the rest of the cast of the supervillain action pic Suicide Squad were spotted while filming in Toronto -- sorry make that ""Midway City""LifeEarly loyalty problems not a good long-term sign EllieStraying boyfriend is putting his indulgences before his partners well-being.24degCloseHomeLatest NewsVideoGTABlogsToronto to test mobile ticketing app for island ferryNew way to buy tickets online aimed at cutting down lineups for island ferry.NewsGTACity HallQueens ParkCanadaWorldInvestigationsCrimeBusinessEconomyPersonal FinanceReal EstateYour TorontoSchoolsThe FixerLifeFashion amp; StyleFood amp; WineHealth amp; WellnessHomesParentTechnologyTravelSportsAmateurBaseballBasketballBlue JaysCurlingFootballGolfHockeyLacrosseLeafsOlympicsRaptorsSoccerTennisOpinionCommentaryCorrectionsEditorialsEditorial CartoonPublic EditorReaders LettersEntertainmentBooksMoviesMusicStageTelevisionVisual ArtsDiversionsHoroscopesCrosswordsSudokuComicsWheels.caSpecial FeaturesObituariesClassifiedsTV ListingsHot TopicsDem. ConventionRio OlympicsPokemon GoBlue JaysGeneration 9/11Panama PapersFresh Air FundWeather BlogFollow usFacebookTwitterGoogle+InstagramRSSManage NewslettersSite MapAboutContact UsFeedbackthestar.comFeedbackSite MapNewslettersInsurance HotlineNew in HomesStar StoreCorrectionsBehavioural TargetingTodays NewsFlyersCanadaStaysContestsToronto Star Newspaper Ltd.AboutAtkinson PrinciplesStatement of PrinciplesGet Home DeliveryMy SubscriptionContact UsContact WebmasterFAQNews ReleasesStar InternshipsCareers  the StarStar AdvisersStar ePaperStar TouchAdvertise with UsAdvertising TermsMedia KitSpecial FeaturesInitiativesSanta Claus FundFresh Air FundSpeakers BureauClassroom ConnectionToronto Star ArchivesReport on Community Giving(c) Copyright Toronto Star Newspapers Ltd. 1996 - 2016Privacy PolicyTerms and Conditions",http://www.thestar.com/NASApp/cs/ContentServer?pagename=thestar/Layout/Article_Type1&c=Article&cid=1131707100886&call_pageid=1022183557980&col=1022183560753,200,zathura3,zathura,thestar
